[
  {
    "captions": "BEFORE/AFTER - The transformation begins here.\n\nâš™ï¸ Processing: from bulky scrap to a compact bale or log, ready for recycling.\nğŸ”¥ Zero waste, maximum gain.\n\nWith GPS Recycling machines:\n-Efficient and fast recovery.\n-Space optimization with compact bales.\n-A new life for every material, improving margins.\n\nWhat more do you want?BEFORE/AFTER - The transformation begins here.\n\nâš™ï¸ Processing: from bulky scrap to a compact bale or log, ready for recycling.\nğŸ”¥ Zero waste, maximum gain.\n\nWith GPS Recycling machines:\n-Efficient and fast recovery.\n-Space optimization with compact bales.\n-A new life for every material, improving margins.\n\nWhat more do you want?",
    "likes": "2",
    "time": {
      "raw": "1ay",
      "parsed": "21.03.2025",
      "isoString": "2025-03-21T05:51:29.778Z"
    },
    "mediaType": "image",
    "mediaContent": [
      "https://media.licdn.com/dms/image/v2/D5610AQE392NKQfUwUQ/image-shrink_800/B56ZVGa79zHEAc-/0/1740643222475?e=1745820000&v=beta&t=x2vRp81Efne2gxPWpTCa7FtPGwRGz2q3EW_HcGbe-YA"
    ],
    "date": "2025-03-21T05:51:29.778Z"
  },
  {
    "captions": "ğŸ’¥UNRIVALED EFFICIENCY RECOVERYğŸ’¥\n\nDefective cans and production waste are not a problem. The problem is managing them poorly.\nWith the the automatic balers:\n-#100% recycling directly in the production line.\n-Clean material ready for the foundry without additional steps.\n-Reduce time, increase #gains.\nIf you want speed, quality and zero #waste, this is not just a machine: it's your competitive advantage.\nDon't settle: dominate the production cycle with GPS Recycling.\n\nğŸ”— Find out how to revolutionize your line: https://lnkd.in/djNSDEetğŸ’¥UNRIVALED EFFICIENCY RECOVERYğŸ’¥\n\nDefective cans and production waste are not a problem. The problem is managing them poorly.\nWith the the automatic balers:\n-#100% recycling directly in the production line.\n-Clean material ready for the foundry without additional steps.\n-Reduce time, increase #gains.\nIf you want speed, quality and zero #waste, this is not just a machine: it's your competitive advantage.\nDon't settle: dominate the production cycle with GPS Recycling.\n\nğŸ”— Find out how to revolutionize your line: https://lnkd.in/djNSDEet",
    "likes": "2",
    "time": {
      "raw": "1ay",
      "parsed": "21.03.2025",
      "isoString": "2025-03-21T05:51:29.781Z"
    },
    "mediaType": "image",
    "mediaContent": [
      "https://media.licdn.com/dms/image/v2/D4D10AQG0v0Yz9ypQbA/image-shrink_800/B4DZUiX429HIAc-/0/1740038443676?e=1745820000&v=beta&t=91XzwlfPdcahI7TxaSGCr35ECLnrZySTKPpYXiZju6M"
    ],
    "date": "2025-03-21T05:51:29.781Z"
  },
  {
    "captions": "ğŸ’– GPS IN LOVE: POWER THAT MAKES YOU FALL IN LOVE ğŸ’–\nFor Valentine's Day, we present our new #passion: PREDATOR 9.0 HS.\n\nA machine born to make your heart beat faster:\n-High speed to handle any challenge.\n-Deadly precision, no waste.\n-Unbeatable #efficiency, like a perfect partner.\n\nIf you're looking for a machine that combines strength and #performance, look no further. This is not just #technology, it's love at first use. https://lnkd.in/g6unxs5gğŸ’– GPS IN LOVE: POWER THAT MAKES YOU FALL IN LOVE ğŸ’–\nFor Valentine's Day, we present our new #passion: PREDATOR 9.0 HS.\n\nA machine born to make your heart beat faster:\n-High speed to handle any challenge.\n-Deadly precision, no waste.\n-Unbeatable #efficiency, like a perfect partner.\n\nIf you're looking for a machine that combines strength and #performance, look no further. This is not just #technology, it's love at first use. https://lnkd.in/g6unxs5g",
    "likes": "1",
    "time": {
      "raw": "2ay",
      "parsed": "21.02.2025",
      "isoString": "2025-02-21T05:51:29.784Z"
    },
    "mediaType": "image",
    "mediaContent": [
      "https://media.licdn.com/dms/image/v2/D4D10AQGLfVDlUqHtVw/image-shrink_800/B4DZUDeQJxHIAg-/0/1739520017958?e=1745820000&v=beta&t=wqoftmW4zPua7qVzmnycXNXWWN5yfmbHRqe4bpkP5sQ"
    ],
    "date": "2025-02-21T05:51:29.784Z"
  },
  {
    "captions": "ğŸ’¡YOUR BUSINESS DESERVES MOREğŸ’¡\n\nIn a competitive market, reducing cost per ton is the only way to improve margins and beat the competition.\n\nWith our #balers and #shearbalers:\n-Maximum efficiency, every ton is worth more.\n-Cutting-edge technology, always one step ahead.\n-Optimized costs, higher margins.\nWhy lag behind when you can dominate the market? ğŸš€\n\nğŸ”— Learn how to transform your production cycle: https://lnkd.in/dvMb29C8 \n\n#efficiencymatters #costreduction #industrialinnovation #costpertonğŸ’¡YOUR BUSINESS DESERVES MOREğŸ’¡\n\nIn a competitive market, reducing cost per ton is the only way to improve margins and beat the competition.\n\nWith our #balers and #shearbalers:\n-Maximum efficiency, every ton is worth more.\n-Cutting-edge technology, always one step ahead.\n-Optimized costs, higher margins.\nWhy lag behind when you can dominate the market? ğŸš€\n\nğŸ”— Learn how to transform your production cycle: https://lnkd.in/dvMb29C8 \n\n#efficiencymatters #costreduction #industrialinnovation #costperton",
    "likes": "1",
    "time": {
      "raw": "2ay",
      "parsed": "21.02.2025",
      "isoString": "2025-02-21T05:51:29.786Z"
    },
    "mediaType": "image",
    "mediaContent": [
      "https://media.licdn.com/dms/image/v2/D4D10AQGHYG-S2KZFBQ/image-shrink_800/B4DZTaRlIdG4Ag-/0/1738828830752?e=1745820000&v=beta&t=BxMyGQSDWK14iM9l6fSYz_RMjMvKDV30ZJ_OteopCas"
    ],
    "date": "2025-02-21T05:51:29.786Z"
  },
  {
    "captions": "With #Predator 9.0 HS, GPS Recycling has redefined #industry standards. No one has ever built a #baler of this size, and its #power is incomparable.\n\nDesigned to handle the #bulkiest #loads, the Predator 9.0 HS delivers outstanding performance at every stage of the process.\n\n-Large loading chamber to handle large volumes quickly.\n-Unmatched compaction power, ideal for those who need high performance.\nWith this machine you can maximize your company's #productivity, contact us!\nhttps://lnkd.in/d9wYEUX5",
    "likes": "2",
    "comments": "1",
    "time": {
      "raw": "2ay",
      "parsed": "21.02.2025",
      "isoString": "2025-02-21T05:51:29.788Z"
    },
    "mediaType": "video",
    "mediaContent": {
      "src": [
        {
          "src": "https://dms.licdn.com/playlist/vid/v2/D4D10AQF7z7Hj62fFRA/mp4-640p-30fp-crf28/mp4-640p-30fp-crf28/0/1737619229761?e=1745820000&v=beta&t=mLknnK_xu7W4AmL4bSUMpLEjYwNSwzMXoYeBoDPp9PQ",
          "type": "video/mp4",
          "data-bitrate": 589854
        },
        {
          "src": "https://dms.licdn.com/playlist/vid/v2/D4D10AQF7z7Hj62fFRA/mp4-360p-30fp-crf28/mp4-360p-30fp-crf28/0/1737619229330?e=1745820000&v=beta&t=ew_wucd46OLvHVBkPCIeqQ7VDbvT2ohXsybsnVNtvkI",
          "type": "video/mp4",
          "data-bitrate": 250941
        },
        {
          "src": "https://dms.licdn.com/playlist/vid/v2/D4D10AQF7z7Hj62fFRA/mp4-720p-30fp-crf28/mp4-720p-30fp-crf28/0/1737619230133?e=1745820000&v=beta&t=Ss2cMjOAB_2go_Lgo0_dzTgHuVuzM_UKTTLuGbu6jDE",
          "type": "video/mp4",
          "data-bitrate": 784332
        }
      ],
      "posterUrl": "https://media.licdn.com/dms/image/v2/D4D10AQF7z7Hj62fFRA/videocover-high/videocover-high/0/1737619228810?e=1745820000&v=beta&t=OMi-aS3lQKqza34EHyZHiiB-aH7jKJB0srvjmkCTS1o"
    },
    "date": "2025-02-21T05:51:29.788Z"
  },
  {
    "captions": "ğŸš€ The #Destroyer represents the ultimate solution for large-scale scrap processing. Designed with an extraordinary loading capacity and a #closingforce on lids greater than that of any conventional shear, this machine offers unparalleled performance.\n\n-Box over 9 meters long and an open loading area of 2.8 meters, ideal for bulky materials.\n-State-of-the-art hydraulic power plant for maximum production efficiency.\n-Increased productivity and reduced operating costs all in one.\nIf your business needs #superior performance, Destroyer is the answer.\nFind out more on our website\nğŸ”—https://lnkd.in/gAfnKPG7ğŸš€ The #Destroyer represents the ultimate solution for large-scale scrap processing. Designed with an extraordinary loading capacity and a #closingforce on lids greater than that of any conventional shear, this machine offers unparalleled performance.\n\n-Box over 9 meters long and an open loading area of 2.8 meters, ideal for bulky materials.\n-State-of-the-art hydraulic power plant for maximum production efficiency.\n-Increased productivity and reduced operating costs all in one.\nIf your business needs #superior performance, Destroyer is the answer.\nFind out more on our website\nğŸ”—https://lnkd.in/gAfnKPG7",
    "likes": "5",
    "time": {
      "raw": "3ay",
      "parsed": "21.01.2025",
      "isoString": "2025-01-21T05:51:29.790Z"
    },
    "mediaType": "image",
    "mediaContent": [
      "https://media.licdn.com/dms/image/v2/D4D10AQEgQ8HdBL96AA/image-shrink_800/image-shrink_800/0/1737014415045?e=1745820000&v=beta&t=ICdfZmxNWyrUdVHsamX0HZk_N-FnONyF1eA4tykqi_U"
    ],
    "date": "2025-01-21T05:51:29.790Z"
  },
  {
    "captions": "ğŸ”§ #GPSRecycling is proud to continue the path of #innovation traced by Lollini International, a pioneer in the design of the first mobile scrap processing machines in Italy.\n\nIf you own a Lollini machine, you can count on us for service and genuine #spare parts to ensure that your operations remain efficient and uninterrupted.\n\nIn addition, we offer the option of picking up your Lollini model in #tradein, so you can upgrade to a more modern, efficient and technologically advanced solution. ğŸ’ª\n\nDon't miss this opportunity! Contact us now: https://lnkd.in/d9wYEUX5ğŸ”§ #GPSRecycling is proud to continue the path of #innovation traced by Lollini International, a pioneer in the design of the first mobile scrap processing machines in Italy.\n\nIf you own a Lollini machine, you can count on us for service and genuine #spare parts to ensure that your operations remain efficient and uninterrupted.\n\nIn addition, we offer the option of picking up your Lollini model in #tradein, so you can upgrade to a more modern, efficient and technologically advanced solution. ğŸ’ª\n\nDon't miss this opportunity! Contact us now: https://lnkd.in/d9wYEUX5",
    "likes": "1",
    "time": {
      "raw": "3ay",
      "parsed": "21.01.2025",
      "isoString": "2025-01-21T05:51:29.793Z"
    },
    "mediaType": "image",
    "mediaContent": [
      "https://media.licdn.com/dms/image/v2/D4D10AQE_jhjXvp-fUQ/image-shrink_800/image-shrink_800/0/1736409647401?e=1745820000&v=beta&t=Bsgv5Uu38Fy0FZAIFUDikmLMta2MGIlZE7ZZxJn4w4s"
    ],
    "date": "2025-01-21T05:51:29.793Z"
  },
  {
    "captions": "Happy new year from #GPSRecycling! ğŸ†\nWe are ready to welcome 2025 with #newchallenges, #innovations and many #projects.\n\nWe wish everyone a year full of satisfaction and great #results! ğŸ’¥\n#Happy2025! ğŸ‰ğŸ¥‚Happy new year from #GPSRecycling! ğŸ†\nWe are ready to welcome 2025 with #newchallenges, #innovations and many #projects.\n\nWe wish everyone a year full of satisfaction and great #results! ğŸ’¥\n#Happy2025! ğŸ‰ğŸ¥‚",
    "likes": "6",
    "time": {
      "raw": "3ay",
      "parsed": "21.01.2025",
      "isoString": "2025-01-21T05:51:29.795Z"
    },
    "mediaType": "image",
    "mediaContent": [
      "https://media.licdn.com/dms/image/v2/D4D10AQHGH5bc5XxcYA/image-shrink_800/image-shrink_800/0/1735718413176?e=1745820000&v=beta&t=9XPbNFzfaob1TlS2VhqLOXuWc2XfnI-NZzLlHbjzsq8"
    ],
    "date": "2025-01-21T05:51:29.795Z"
  },
  {
    "captions": "ğŸ‰ 2024: Despite the difficulties, we continued to innovate and make important strides in the #industry. \n\nğŸ”© Birth of the #Destroyer - Our new, powerful, state-of-the-art winged #shearbaler that redefined the way we process scrap.\n\nğŸ¤ Collaboration with Harris - This year we consolidated our partnership with Harris, becoming the only dealer with exclusivity for the US, Canada and Mexico.\n\nğŸª Participation in the #ISRI in Las Vegas - We brought our #leading-edge #technology to the ultimate international #recycling event.\n\nğŸŒ #ExpansionGlobal - We strengthened our presence around the world.\n\nğŸ”§ Launch of the Predator 9.0 HS - The #biggest automobile logger ever created, designed to tackle the most complex challenges in the #recycling world.\n\nThank you all for supporting and accompanying us through this year.\n#GPSRECYRLINGğŸ‰ 2024: Despite the difficulties, we continued to innovate and make important strides in the #industry. \n\nğŸ”© Birth of the #Destroyer - Our new, powerful, state-of-the-art winged #shearbaler that redefined the way we process scrap.\n\nğŸ¤ Collaboration with Harris - This year we consolidated our partnership with Harris, becoming the only dealer with exclusivity for the US, Canada and Mexico.\n\nğŸª Participation in the #ISRI in Las Vegas - We brought our #leading-edge #technology to the ultimate international #recycling event.\n\nğŸŒ #ExpansionGlobal - We strengthened our presence around the world.\n\nğŸ”§ Launch of the Predator 9.0 HS - The #biggest automobile logger ever created, designed to tackle the most complex challenges in the #recycling world.\n\nThank you all for supporting and accompanying us through this year.\n#GPSRECYRLING",
    "likes": "8",
    "time": {
      "raw": "3ay",
      "parsed": "21.01.2025",
      "isoString": "2025-01-21T05:51:29.797Z"
    },
    "mediaType": "image",
    "mediaContent": [
      "https://media.licdn.com/dms/image/v2/D4D10AQG372fxQshNfA/image-shrink_800/image-shrink_800/0/1735545637059?e=1745820000&v=beta&t=vusHibRnoJV_oYYlxlMEJT7kO-edaCvAOzJSRvKjSgs"
    ],
    "date": "2025-01-21T05:51:29.797Z"
  },
  {
    "captions": "ğŸ„ #Seasonâ€™s Greetings from GPS Recycling! ğŸ„\n\nWe would like to wish all our customers, #partners and #collaborators peaceful #Holidays. \nThank you for choosing us and supporting us in our #growth and #innovation journey. \n\nHappy holidays to everyone! ğŸâ„ï¸ğŸ„ #Seasonâ€™s Greetings from GPS Recycling! ğŸ„\n\nWe would like to wish all our customers, #partners and #collaborators peaceful #Holidays. \nThank you for choosing us and supporting us in our #growth and #innovation journey. \n\nHappy holidays to everyone! ğŸâ„ï¸",
    "likes": "3",
    "time": {
      "raw": "3ay",
      "parsed": "21.01.2025",
      "isoString": "2025-01-21T05:51:29.799Z"
    },
    "mediaType": "image",
    "mediaContent": [
      "https://media.licdn.com/dms/image/v2/D4D10AQHB6bs4vFfTTw/image-shrink_800/image-shrink_800/0/1735113635976?e=1745820000&v=beta&t=ULuBAW2eAlaIfnlrh7wALtjiy31bdX69X9iMmCez-iE"
    ],
    "date": "2025-01-21T05:51:29.799Z"
  },
  {
    "captions": "We proudly present #Predator9.0, the #biggest #elvrecycling #logger #carbaler ever made. Designed to tackle the recycling industry's toughest challenges, this machine combines #power, exceptional size and unprecedented \n#operating efficiency.\n\nIf your business needs #maximum #capacity and the best #performance, Predator 9.0 HS is the solution you've been waiting for.\n\n#gpsrecycling #innovation",
    "likes": "6",
    "time": {
      "raw": "4ay",
      "parsed": "21.12.2024",
      "isoString": "2024-12-21T05:51:29.801Z"
    },
    "mediaType": "video",
    "mediaContent": {
      "src": [
        {
          "src": "https://dms.licdn.com/playlist/vid/v2/D4D10AQFseu2Ryl2qwQ/mp4-640p-30fp-crf28/mp4-640p-30fp-crf28/0/1733990499185?e=1745820000&v=beta&t=H0W-9Z8a-52fA4IKpREaXwG1rEdl0sT8Ee-fDUgsuf8",
          "type": "video/mp4",
          "data-bitrate": 881889
        },
        {
          "src": "https://dms.licdn.com/playlist/vid/v2/D4D10AQFseu2Ryl2qwQ/mp4-360p-30fp-crf28/mp4-360p-30fp-crf28/0/1733990499297?e=1745820000&v=beta&t=ScP6LPTtAvuGWeFlKxd9mcaiN26YVrS2p4bzjbR0Ua8",
          "type": "video/mp4",
          "data-bitrate": 368812
        },
        {
          "src": "https://dms.licdn.com/playlist/vid/v2/D4D10AQFseu2Ryl2qwQ/mp4-720p-30fp-crf28/mp4-720p-30fp-crf28/0/1733990499091?e=1745820000&v=beta&t=jSCQEp6RXeQrBvZ7NlZDRK3nIO4Q-yW56nOu8kTOnbQ",
          "type": "video/mp4",
          "data-bitrate": 1165984
        }
      ],
      "posterUrl": "https://media.licdn.com/dms/image/v2/D4D10AQFseu2Ryl2qwQ/videocover-high/videocover-high/0/1733990495577?e=1745820000&v=beta&t=W2E5muNBhi8AC5K6S49mZO8gMiDdpf2wu2IkG1g1cR4"
    },
    "date": "2024-12-21T05:51:29.801Z"
  },
  {
    "captions": "Our great #production #flexibility, combined with our knowledge of the industry and the daily challenges of scrap dealers, allows us to offer fully #customized solutions that greatly improve workflow.\n\nOur machines are designed to be fast, powerful and ensure an increase in your #profit margins, but they are not all the same!\n\nContact us today for a customized #pre-sales consultation and find out how we can help you optimize your operation! ğŸŒ\n\n#gpsrecyclingOur great #production #flexibility, combined with our knowledge of the industry and the daily challenges of scrap dealers, allows us to offer fully #customized solutions that greatly improve workflow.\n\nOur machines are designed to be fast, powerful and ensure an increase in your #profit margins, but they are not all the same!\n\nContact us today for a customized #pre-sales consultation and find out how we can help you optimize your operation! ğŸŒ\n\n#gpsrecycling",
    "likes": "2",
    "time": {
      "raw": "4ay",
      "parsed": "21.12.2024",
      "isoString": "2024-12-21T05:51:29.802Z"
    },
    "mediaType": "image",
    "mediaContent": [
      "https://media.licdn.com/dms/image/v2/D4D10AQFvGDLNx4I1tw/image-shrink_800/image-shrink_800/0/1733385619574?e=1745820000&v=beta&t=QxZyVbDBjreFiE7U8tcmI3S1TU1nCDmPUnFBy1ZGT1E"
    ],
    "date": "2024-12-21T05:51:29.802Z"
  },
  {
    "captions": "ğŸ“¢ Our Predator baler/loggers are ready to hit the road!\n\nWe have Predator machines ready for delivery to the US and Canada through our exclusive partners, Harris and Ely Enterprises, Inc Want to speed up your recycling process? The Predator is designed for maximum performance and unbeatable speed in processing scrap. ğŸ’ª\n\nâŒ› Quantities are limited! Don't wait - contact us today to lock in your machine!\n\n#Predator #GPSRecycling #ImmediateDelivery #Recycling #ProductivityğŸ“¢ Our Predator baler/loggers are ready to hit the road!\n\nWe have Predator machines ready for delivery to the US and Canada through our exclusive partners, Harris and Ely Enterprises, Inc Want to speed up your recycling process? The Predator is designed for maximum performance and unbeatable speed in processing scrap. ğŸ’ª\n\nâŒ› Quantities are limited! Don't wait - contact us today to lock in your machine!\n\n#Predator #GPSRecycling #ImmediateDelivery #Recycling #Productivity",
    "likes": "3",
    "shares": "1",
    "time": {
      "raw": "4ay",
      "parsed": "21.12.2024",
      "isoString": "2024-12-21T05:51:29.803Z"
    },
    "mediaType": "image",
    "mediaContent": [
      "https://media.licdn.com/dms/image/v2/D4D10AQHb1hLePDT7BQ/image-shrink_800/image-shrink_800/0/1732780809697?e=1745820000&v=beta&t=hMwflV6XpGjZZyHnzYtOG-vu_h6V1FJg8s9dOe_UHUM"
    ],
    "date": "2024-12-21T05:51:29.803Z"
  },
  {
    "captions": "Guess the shear:\n- Equipped with a fast and extremely powerful cutting system\n- Continuous feeding\n- Not only powerful, but also compact\nDo you know which shear we are talking about? Share your answer in the comments! â£\n#gpsrecycling #guesstheshearGuess the shear:\n- Equipped with a fast and extremely powerful cutting system\n- Continuous feeding\n- Not only powerful, but also compact\nDo you know which shear we are talking about? Share your answer in the comments! â£\n#gpsrecycling #guesstheshear",
    "likes": "2",
    "time": {
      "raw": "4ay",
      "parsed": "14.12.2024",
      "isoString": "2024-12-14T04:46:57.841Z"
    },
    "mediaType": "image",
    "mediaContent": [
      "https://media.licdn.com/dms/image/v2/D4D10AQGI-fcP7PhJaQ/image-shrink_800/image-shrink_800/0/1732608068944?e=1745211600&v=beta&t=q5rAZj5X6LUQ-m5-uVKtTf_MOfdw3yGwXPfQPEiB2Jk"
    ],
    "date": "2024-12-14T04:46:57.841Z"
  },
  {
    "captions": "ğŸ”§ Maximum power, minimum wait!\n\nThe Predator balers are ready for delivery thanks to our partnership with Harris and Ely Enterprises, Inc There are no waiting times: these machines are ready to go into action and improve your business. ğŸ’¥\n\nIf you are looking for power and reliability, the Predator is the right choice for you. Write to us now for more information and to book your machine!\n\n#Predator #GPSRecycling #Power #ImmediateDeliveryğŸ”§ Maximum power, minimum wait!\n\nThe Predator balers are ready for delivery thanks to our partnership with Harris and Ely Enterprises, Inc There are no waiting times: these machines are ready to go into action and improve your business. ğŸ’¥\n\nIf you are looking for power and reliability, the Predator is the right choice for you. Write to us now for more information and to book your machine!\n\n#Predator #GPSRecycling #Power #ImmediateDelivery",
    "likes": "5",
    "shares": "1",
    "time": {
      "raw": "4ay",
      "parsed": "07.12.2024",
      "isoString": "2024-12-07T05:40:50.760Z"
    },
    "mediaType": "image",
    "mediaContent": [
      "https://media.licdn.com/dms/image/v2/D4D10AQHTK66N_TReEw/image-shrink_800/image-shrink_800/0/1732176012463?e=1744610400&v=beta&t=R0c0pGQd4Qi8KEjLCOVmMAXwIVxfPJl9S8L42YKcczk"
    ],
    "date": "2024-12-07T05:40:50.760Z"
  },
  {
    "captions": "ğŸ”§Our commitment goes beyond sales: we listen carefully to our #customers' needs to offer customized solutions. Thanks to our global presence, we are ready to step in and provide #support in every corner of the world, ensuring that our customers' #machines operate at peak #performance. ğŸŒ\n\nFor this reason, we are always looking for new #resellers to expand our network and bring our technology and support to anyone in need around the world.\n\nIf you are interested in a partnership please contact us:https://lnkd.in/d9wYEUX5\n\n#gpsrecyclingğŸ”§Our commitment goes beyond sales: we listen carefully to our #customers' needs to offer customized solutions. Thanks to our global presence, we are ready to step in and provide #support in every corner of the world, ensuring that our customers' #machines operate at peak #performance. ğŸŒ\n\nFor this reason, we are always looking for new #resellers to expand our network and bring our technology and support to anyone in need around the world.\n\nIf you are interested in a partnership please contact us:https://lnkd.in/d9wYEUX5\n\n#gpsrecycling",
    "likes": "3",
    "time": {
      "raw": "4ay",
      "parsed": "26.11.2024",
      "isoString": "2024-11-26T05:22:46.172Z"
    },
    "mediaType": "image",
    "mediaContent": [
      "https://media.licdn.com/dms/image/v2/D5610AQGSn6vY60X2gA/image-shrink_800/image-shrink_800/0/1732003218289?e=1743573600&v=beta&t=QcJvHUW5ct0m6xdoT6nY4-1lZ-Vj4CY5XLNHp_knD6w"
    ],
    "date": "2024-11-26T05:22:46.172Z"
  },
  {
    "captions": "ğŸ¤” What are G.P.S. Great Scrap Processing Solutions, Harris  and Ely Enterprises, Inc doing together? It sounds like the beginning of a joke, but it's pure reality!\n\nğŸ˜„ There is an Italian (GPS), an American (Harris), and another American (Ely)... together they bring the Predator ready for delivery to the United States and Canada, ready to revolutionize the world of recycling! ğŸ’¥\nThis is no joke, this is your next chance to get the Predator baler/logger in your yard right away. \n\nContact us now!\nğŸ“¦ Stock is running low!\n\n#Predator #GPSRecycling #ReadyToShip #EfficiencyğŸ¤” What are G.P.S. Great Scrap Processing Solutions, Harris  and Ely Enterprises, Inc doing together? It sounds like the beginning of a joke, but it's pure reality!\n\nğŸ˜„ There is an Italian (GPS), an American (Harris), and another American (Ely)... together they bring the Predator ready for delivery to the United States and Canada, ready to revolutionize the world of recycling! ğŸ’¥\nThis is no joke, this is your next chance to get the Predator baler/logger in your yard right away. \n\nContact us now!\nğŸ“¦ Stock is running low!\n\n#Predator #GPSRecycling #ReadyToShip #Efficiency",
    "likes": "5",
    "shares": "1",
    "time": {
      "raw": "4ay",
      "parsed": "26.11.2024",
      "isoString": "2024-11-26T05:22:46.173Z"
    },
    "mediaType": "image",
    "mediaContent": [
      "https://media.licdn.com/dms/image/v2/D5610AQGDsj8Y4Zs_7w/image-shrink_800/image-shrink_800/0/1731571222124?e=1743573600&v=beta&t=61ABfeca9FKOAnlSd8gVkZC1-qhCtSwhPUaYkm4A38w"
    ],
    "date": "2024-11-26T05:22:46.173Z"
  },
  {
    "captions": "In the world of #automobileloggers, there is only one leading machine. GPS's #Predator is the most imitated machine on the market, but no copy can come close to its performance in terms of #power, #reliability and #innovation.\nThe Predator was born to make a difference, and it proves it to you every day.\nWhy choose an imitation when you can have the top technology for #scrap treatment? \n\nFind out what makes it unique: https://lnkd.in/g6unxs5gIn the world of #automobileloggers, there is only one leading machine. GPS's #Predator is the most imitated machine on the market, but no copy can come close to its performance in terms of #power, #reliability and #innovation.\nThe Predator was born to make a difference, and it proves it to you every day.\nWhy choose an imitation when you can have the top technology for #scrap treatment? \n\nFind out what makes it unique: https://lnkd.in/g6unxs5g",
    "likes": "6",
    "shares": "3",
    "time": {
      "raw": "4ay",
      "parsed": "17.11.2024",
      "isoString": "2024-11-17T05:06:14.157Z"
    },
    "mediaType": "image",
    "mediaContent": [
      "https://media.licdn.com/dms/image/v2/D4D10AQEGSq4mOnb_tA/image-shrink_800/image-shrink_800/0/1731398406811?e=1742796000&v=beta&t=zNLET67FZdWEzKl7KwtEHy9qqWZpC9pfbyZECv5quLY"
    ],
    "date": "2024-11-17T05:06:14.157Z"
  },
  {
    "captions": "ğŸ§® Harris + Ely Enterprises, Inc + G.P.S. Great Scrap Processing Solutions = your new Predator ready for delivery to the US and Canada!\n\nWhen the power of the Predator meets the right partners, the equation is simple: maximum efficiency and minimum delivery times.\n\nThis is the winning formula for your scrap yard.ğŸš€\nğŸ’ª The Predator, the most powerful scrap baler on the market, is ready to go into action without waiting times!\n\nDon't wait, contact us now! ğŸš€\n\n#Predator #GPSRecycling #ReadyToShip #Efficiency #RecyclingğŸ§® Harris + Ely Enterprises, Inc + G.P.S. Great Scrap Processing Solutions = your new Predator ready for delivery to the US and Canada!\n\nWhen the power of the Predator meets the right partners, the equation is simple: maximum efficiency and minimum delivery times.\n\nThis is the winning formula for your scrap yard.ğŸš€\nğŸ’ª The Predator, the most powerful scrap baler on the market, is ready to go into action without waiting times!\n\nDon't wait, contact us now! ğŸš€\n\n#Predator #GPSRecycling #ReadyToShip #Efficiency #Recycling",
    "likes": "6",
    "time": {
      "raw": "3ay",
      "parsed": "05.12.2024",
      "isoString": "2024-12-05T10:28:07.798Z"
    },
    "mediaType": "image",
    "mediaContent": [
      "https://media.licdn.com/dms/image/v2/D5622AQGPOmlH7jOhqg/feedshare-shrink_800/feedshare-shrink_800/0/1730974771950?e=1744243200&v=beta&t=ssmaTDThCAdJnjV1hNUEFSch4HRQWHwTgQ1nTHU-GCc",
      "https://static.licdn.com/aero-v1/sc/h/dur0ryw0e9uscxa9b6zqvgvfs"
    ],
    "date": "2024-12-05T10:28:07.798Z"
  },
  {
    "captions": "ğŸ“¢ We are looking for new GPS agents and dealers in the world! ğŸŒ\n#GPSRecycling is looking for qualified resellers to expand its global network and provide more #service to its #customers.\nWhy become a #GPS reseller?\n\nâœ… Represent state-of-the-art, top-quality machines.\nâœ… Dedicated sales and technical support\nâœ… Be part of a successful global network\n\nIf you have a business in the #recycling industry and are interested, contact us now for more information! ğŸŒŸ\n#business #partnershipğŸ“¢ We are looking for new GPS agents and dealers in the world! ğŸŒ\n#GPSRecycling is looking for qualified resellers to expand its global network and provide more #service to its #customers.\nWhy become a #GPS reseller?\n\nâœ… Represent state-of-the-art, top-quality machines.\nâœ… Dedicated sales and technical support\nâœ… Be part of a successful global network\n\nIf you have a business in the #recycling industry and are interested, contact us now for more information! ğŸŒŸ\n#business #partnership",
    "likes": "3",
    "time": {
      "raw": "3ay",
      "parsed": "05.12.2024",
      "isoString": "2024-12-05T10:28:07.799Z"
    },
    "mediaType": "image",
    "mediaContent": [
      "https://media.licdn.com/dms/image/v2/D4D10AQHg34dvRdyjdg/image-shrink_800/image-shrink_800/0/1730880011591?e=1741777200&v=beta&t=1nFIS4DJialSuDHk_v0YA-GqxTbsx23cz1yl7hVDH4A"
    ],
    "date": "2024-12-05T10:28:07.799Z"
  },
  {
    "captions": "ğŸ’¥ DEFECTIVE CANS? NEVER A PROBLEM AGAIN! ğŸ’¥\nOut-of-standard cans of tomatoes, legumes, preserved foods or beverage cans don't have to slow you down. \n\nWith the automatic balers:\n\n-You press the defective cans with the contents.\n-You separate the product from the can in one process.\n-You recover 100 percent of the material for #recycling.\n\nResult? More speed, zero #waste and optimized costs.\nğŸ”— Find out how to revolutionize your waste management: https://lnkd.in/dRFdd7rWğŸ’¥ DEFECTIVE CANS? NEVER A PROBLEM AGAIN! ğŸ’¥\nOut-of-standard cans of tomatoes, legumes, preserved foods or beverage cans don't have to slow you down. \n\nWith the automatic balers:\n\n-You press the defective cans with the contents.\n-You separate the product from the can in one process.\n-You recover 100 percent of the material for #recycling.\n\nResult? More speed, zero #waste and optimized costs.\nğŸ”— Find out how to revolutionize your waste management: https://lnkd.in/dRFdd7rW",
    "likes": "1",
    "time": {
      "raw": "1ay",
      "parsed": "21.03.2025",
      "isoString": "2025-03-21T05:51:29.775Z"
    },
    "mediaType": "image",
    "mediaContent": [
      "https://media.licdn.com/dms/image/v2/D4D10AQEH3wNhQGtQUw/image-shrink_800/B4DZVqeEU5GkAg-/0/1741248022840?e=1745820000&v=beta&t=etVRL3PBPKEOkZfPpjDXblv7-KQPsoke3MNyUshCj7Y"
    ],
    "date": "2025-03-21T05:51:29.775Z"
  },
  {
    "captions": "GPS QUIZ: Destroyer\n\nHow many tons of material do you think our Destroyer can handle in an hour? ğŸš€\nTest your intuition! Write your answer in the comments. The solution will come in a week... Prepare to be amazed!GPS QUIZ: Destroyer\n\nHow many tons of material do you think our Destroyer can handle in an hour? ğŸš€\nTest your intuition! Write your answer in the comments. The solution will come in a week... Prepare to be amazed!",
    "likes": "1",
    "time": {
      "raw": "1ay",
      "parsed": "21.03.2025",
      "isoString": "2025-03-21T05:51:29.772Z"
    },
    "mediaType": "image",
    "mediaContent": [
      "https://media.licdn.com/dms/image/v2/D4D10AQFgaKhLEyTSvQ/image-shrink_800/B4DZWOhLpBG8Ac-/0/1741852818945?e=1745820000&v=beta&t=9M74IFvl44JKyDGzcEudLtj8WoiFrN62AZJ3AJjidW0"
    ],
    "date": "2025-03-21T05:51:29.772Z"
  },
  {
    "captions": "Here is the answer to the GPS QUIZ\n\nThe Destroyer is truly unbeatable: it is the most powerful wing shear ever designed! With its 6- to 9-meter-long feeding box and an opening of more than 2.8 meters, it can handle even the bulkiest material with extraordinary speed.\n\nğŸ”§ In one hour it can handle 18 to 45 tons of sheared material, depending on the model and material handled.\n\nA true efficiency behemoth for a world that can't stop. ğŸ’¥Here is the answer to the GPS QUIZ\n\nThe Destroyer is truly unbeatable: it is the most powerful wing shear ever designed! With its 6- to 9-meter-long feeding box and an opening of more than 2.8 meters, it can handle even the bulkiest material with extraordinary speed.\n\nğŸ”§ In one hour it can handle 18 to 45 tons of sheared material, depending on the model and material handled.\n\nA true efficiency behemoth for a world that can't stop. ğŸ’¥",
    "likes": "2",
    "time": {
      "raw": "1ay",
      "parsed": "21.03.2025",
      "isoString": "2025-03-21T05:51:29.770Z"
    },
    "mediaType": "image",
    "mediaContent": [
      "https://media.licdn.com/dms/image/v2/D5610AQFTzEQEk8Hdnw/image-shrink_800/B56ZWykU7ZHEAg-/0/1742457624852?e=1745820000&v=beta&t=uIwt0MKj6mNNHGObCJs5Mu63gVcPNQGA-Bk-qRtu5Co"
    ],
    "date": "2025-03-21T05:51:29.770Z"
  },
  {
    "captions": "ğŸ”§ Optimize your process with an #automatic #baler.\n\nIndustrial automation is the key to reducing operational costs, eliminating #scrap, and increasing productivity. With an automatic baler, you can:\n\nâœ” Speed up processing times, eliminating inefficiencies.\nâœ” Integrate it seamlessly into your #production line, without interruptions.\nâœ” Ensure immediate #recycling with zero industrial waste.\n\nğŸ“© Want to find the right solution for your #business? \n\nContact us now!\n ğŸ”— https://lnkd.in/d9wYEUX5ğŸ”§ Optimize your process with an #automatic #baler.\n\nIndustrial automation is the key to reducing operational costs, eliminating #scrap, and increasing productivity. With an automatic baler, you can:\n\nâœ” Speed up processing times, eliminating inefficiencies.\nâœ” Integrate it seamlessly into your #production line, without interruptions.\nâœ” Ensure immediate #recycling with zero industrial waste.\n\nğŸ“© Want to find the right solution for your #business? \n\nContact us now!\n ğŸ”— https://lnkd.in/d9wYEUX5",
    "likes": "1",
    "time": {
      "raw": "2h",
      "parsed": "07.04.2025",
      "isoString": "2025-04-07T05:51:29.764Z"
    },
    "mediaType": "image",
    "mediaContent": [
      "https://media.licdn.com/dms/image/v2/D4D10AQHsemkgzgvCMg/image-shrink_800/B4DZX6czwsH4Ag-/0/1743663611897?e=1745820000&v=beta&t=Is9P60ZQ1t0qdj7Nyuehjd3Be7lf0gs0sf8IkPfpi9M"
    ],
    "date": "2025-04-07T05:51:29.764Z"
  },
  {
    "captions": "BEFORE/AFTER - The transformation begins here.\nâš™ï¸Cans: from bulky scrap to a compact bale, ready for recycling.\nğŸ”¥ Zero waste, maximum gain.\n\nWith GPS Recycling machines:\n-Efficient and fast recovery.\n-Space optimization with compact bales.\n-A new life for every material, improving margins.\n\nWhat more do you want?BEFORE/AFTER - The transformation begins here.\nâš™ï¸Cans: from bulky scrap to a compact bale, ready for recycling.\nğŸ”¥ Zero waste, maximum gain.\n\nWith GPS Recycling machines:\n-Efficient and fast recovery.\n-Space optimization with compact bales.\n-A new life for every material, improving margins.\n\nWhat more do you want?",
    "likes": "2",
    "time": {
      "raw": "3h",
      "parsed": "31.03.2025",
      "isoString": "2025-03-31T05:51:29.767Z"
    },
    "mediaType": "image",
    "mediaContent": [
      "https://media.licdn.com/dms/image/v2/D4D10AQGCLvtY2WgS4Q/image-shrink_800/B4DZXWnhD1HIAc-/0/1743062439487?e=1745820000&v=beta&t=qRNJOIpz0IxtfLpkD4JDX-pwvLjnTGbgomb9qfPzSCY"
    ],
    "date": "2025-03-31T05:51:29.767Z"
  },
  {
    "captions": "BEFORE/AFTER - With Predator, even household appliances donâ€™t stand a chance! ğŸ’¥\nğŸ”¹ BEFORE: bulky, hard to manage.\nğŸ”¹ AFTER: compacted in seconds, ready for recycling.\nâš™ï¸ More efficiency, less scrap. Predator turns every scrap into value!BEFORE/AFTER - With Predator, even household appliances donâ€™t stand a chance! ğŸ’¥\nğŸ”¹ BEFORE: bulky, hard to manage.\nğŸ”¹ AFTER: compacted in seconds, ready for recycling.\nâš™ï¸ More efficiency, less scrap. Predator turns every scrap into value!",
    "time": {
      "raw": "1h",
      "parsed": "14.04.2025",
      "isoString": "2025-04-14T05:51:29.761Z"
    },
    "mediaType": "image",
    "mediaContent": [
      "https://media.licdn.com/dms/image/v2/D4D10AQFcmOkcJ3Oo8w/image-shrink_800/B4DZYef.JrGwAc-/0/1744268420348?e=1745820000&v=beta&t=-jnrx4ZpDhjMwDeGjBFEK3G3hxDH58-VJQlxTCpjlLs"
    ],
    "date": "2025-04-14T05:51:29.761Z"
  },
  {
    "captions": "ğŸ£ Tired of the same Easter egg surprises? ğŸ¥š\n\nThis year, straight from the eggâ€¦ comes the DESTROYER! ğŸ’¥ \nThe most powerful shear baler in the industry is here to revolutionize your scrapyard.\n\nâœ… Unmatched power\nâœ… Extreme efficiency\nâœ… Cuts and compacts with no compromises\n\nğŸ”¥ Are you ready to unleash the Destroyer? ğŸš€\nhttps://lnkd.in/gAfnKPG7ğŸ£ Tired of the same Easter egg surprises? ğŸ¥š\n\nThis year, straight from the eggâ€¦ comes the DESTROYER! ğŸ’¥ \nThe most powerful shear baler in the industry is here to revolutionize your scrapyard.\n\nâœ… Unmatched power\nâœ… Extreme efficiency\nâœ… Cuts and compacts with no compromises\n\nğŸ”¥ Are you ready to unleash the Destroyer? ğŸš€\nhttps://lnkd.in/gAfnKPG7",
    "time": {
      "raw": "22s",
      "parsed": "20.04.2025",
      "isoString": "2025-04-20T07:51:29.756Z"
    },
    "mediaType": "image",
    "mediaContent": [
      "https://media.licdn.com/dms/image/v2/D4D10AQEaCGGz2gJBag/image-shrink_800/B4DZZSADSHHIAc-/0/1745132468625?e=1745820000&v=beta&t=X2CcQLkFE4KfvLbRkyv-pbKzTjrvDxbwOhsJeXNry7Q"
    ],
    "date": "2025-04-20T07:51:29.756Z"
  }
]