[
  {
    "captions": "Wishing you a blessed and peaceful Ramadan! May this holy month bring you joy, prosperity, and spiritual growth. ğŸŒ™âœ¨\n\nHappy Ramadan Mubarak! May this holy month bring you peace, abundance and spiritual strength. ğŸŒ™âœ¨Wishing you a blessed and peaceful Ramadan! May this holy month bring you joy, prosperity, and spiritual growth. ğŸŒ™âœ¨\n\nHappy Ramadan Mubarak! May this holy month bring you peace, abundance and spiritual strength. ğŸŒ™âœ¨",
    "likes": "22",
    "shares": "5",
    "time": {
      "raw": "2h",
      "parsed": "03.03.2025",
      "isoString": "2025-03-03T05:04:29.222Z"
    },
    "mediaType": "image",
    "mediaContent": [
      "https://media.licdn.com/dms/image/v2/D4D22AQGm1_af2BS_ZA/feedshare-shrink_800/B4DZVNNZR7GkAk-/0/1740757113228?e=1744848000&v=beta&t=K9wYfJ6WAAtBIfjPZZNXYGetEgNkViH3plMQdhxRebQ"
    ],
    "date": "2025-03-03T05:04:29.222Z"
  },
  {
    "captions": "AYMAS\n\n#materialhandler #metalrecycling #hurda #scrap #scraplife #scrapyard #scrapmetal #heavyload \n#scrapshear #metalscrap\n#recyclingequipment #scrapshear \n#engineering #hurdamakasÄ± \n#geridÃ¶nÃ¼ÅŸÃ¼m #recyclingmachinery #scrapmetalrecycling #briquetting #singleshaftshredder #cablestripper #inclinedshear  #copper #scrapbaler #scrapshear  #shredder #metalbaler #scraprecycling #baler #twinshaftshredder \n#aymasrecyclingmachinery",
    "likes": "37",
    "shares": "4",
    "time": {
      "raw": "2h",
      "parsed": "03.03.2025",
      "isoString": "2025-03-03T05:04:29.224Z"
    },
    "mediaType": "video",
    "mediaContent": {
      "src": [
        {
          "src": "https://dms.licdn.com/playlist/vid/v2/D5605AQGludL6PxPtIQ/mp4-640p-30fp-crf28/B56ZVGSV8HGQBk-/0/1740640978535?e=1742796000&v=beta&t=B8BTop1aG2Wqi7AV8G_x--Qw5sWJtV-XaQcyQj2nFRc",
          "type": "video/mp4",
          "data-bitrate": 537310
        }
      ],
      "posterUrl": "https://media.licdn.com/dms/image/v2/D5605AQGludL6PxPtIQ/videocover-low/B56ZVGSV8HGQCU-/0/1740640974158?e=1742796000&v=beta&t=l03oZgoAx6osslNCmiD0uij-KaqfKg6Wbr6-xgFWxTs"
    },
    "date": "2025-03-03T05:04:29.224Z"
  },
  {
    "captions": "#materialhandler #metalrecycling #hurda #scrap #scraplife #scrapyard #scrapmetal #heavyload \n#scrapshear #metalscrap\n#recyclingequipment #scrapshear \n#engineering #hurdamakasÄ± \n#geridÃ¶nÃ¼ÅŸÃ¼m #recyclingmachinery #scrapmetalrecycling #briquetting #singleshaftshredder #cablestripper #inclinedshear  #copper #scrapbaler #scrapshear  #shredder #metalbaler #scraprecycling #baler #twinshaftshredder \n#aymasrecyclingmachinery#materialhandler #metalrecycling #hurda #scrap #scraplife #scrapyard #scrapmetal #heavyload \n#scrapshear #metalscrap\n#recyclingequipment #scrapshear \n#engineering #hurdamakasÄ± \n#geridÃ¶nÃ¼ÅŸÃ¼m #recyclingmachinery #scrapmetalrecycling #briquetting #singleshaftshredder #cablestripper #inclinedshear  #copper #scrapbaler #scrapshear  #shredder #metalbaler #scraprecycling #baler #twinshaftshredder \n#aymasrecyclingmachinery",
    "likes": "60",
    "comments": "1",
    "shares": "5",
    "time": {
      "raw": "2h",
      "parsed": "03.03.2025",
      "isoString": "2025-03-03T05:04:29.226Z"
    },
    "mediaType": "image",
    "mediaContent": [
      "https://media.licdn.com/dms/image/v2/D4D22AQEPSlYw6VQhqg/feedshare-shrink_800/B4DZU8rwHUGkAo-/0/1740479869773?e=1744848000&v=beta&t=W3DUeysTUZmiuUw8wua2xw6hs6WmFIghy7zkPEvqKcA"
    ],
    "date": "2025-03-03T05:04:29.226Z"
  },
  {
    "captions": "Well, it only took 11 days and 33 separate #Exhibitors of #ReMA2025 https://lnkd.in/e548nxm3\nhttps://aymasmakina.com/en\n#TheShow to get through's the \"A's\" alphabetically, but that makes sense when you throw the biggest #recyclingevent in the #recycledmaterials industry. AYMAS Recycling Machinery, it's your turn in the #exhibitorspotlight. Aymas manufactures reliable #scrapprocessing equipments. #ScrapShears #Shears #ScrapBalers #Shredders #ChipBriquetting  #BaleBusters #Dewiring #DewiringEquipment\n#Briquetters #Compactors #Nonferrous #NonferrousBalers\n#AlligatorShears #GuillotineShears #MobileAttachments\n#AutoShredders #Trommels #Screens\n#CanDensifiers #CanFlatteners #ExhibitorReMA2025Well, it only took 11 days and 33 separate #Exhibitors of #ReMA2025 https://lnkd.in/e548nxm3\nhttps://aymasmakina.com/en\n#TheShow to get through's the \"A's\" alphabetically, but that makes sense when you throw the biggest #recyclingevent in the #recycledmaterials industry. AYMAS Recycling Machinery, it's your turn in the #exhibitorspotlight. Aymas manufactures reliable #scrapprocessing equipments. #ScrapShears #Shears #ScrapBalers #Shredders #ChipBriquetting  #BaleBusters #Dewiring #DewiringEquipment\n#Briquetters #Compactors #Nonferrous #NonferrousBalers\n#AlligatorShears #GuillotineShears #MobileAttachments\n#AutoShredders #Trommels #Screens\n#CanDensifiers #CanFlatteners #ExhibitorReMA2025",
    "likes": "13",
    "shares": "6",
    "time": {
      "raw": "2h",
      "parsed": "27.02.2025",
      "isoString": "2025-02-27T06:51:33.689Z"
    },
    "mediaType": "image",
    "mediaContent": [
      "https://media.licdn.com/dms/image/v2/D4E22AQFBrHa1HUhOxw/feedshare-shrink_800/B4EZUUtfvlHcAg-/0/1739809226077?e=1744848000&v=beta&t=2tFRDyWWB4KF-Wti4jqsKVc52VzBndYwZxVXTVAQZKE"
    ],
    "date": "2025-02-27T06:51:33.689Z"
  },
  {
    "captions": "Shredded aluminum baling. High compression forces for shredded scrap densifying.\n\n#materialhandler #metalrecycling #hurda #scrap #scraplife #scrapyard #scrapmetal #heavyload \n#scrapshear #metalscrap\n#recyclingequipment #scrapshear \n#engineering #hurdamakasÄ± \n#demirÃ§elik #recyclingmachinery #scrapmetalrecycling #briquetting #singleshaftshredder #cablestripper #inclinedshear  #copper #scrapbaler #scrapshear  #shredder #metalbaler #scraprecycling #baler #twinshaftshredder \n#aymasrecyclingmachinery",
    "likes": "54",
    "comments": "1",
    "shares": "8",
    "time": {
      "raw": "2h",
      "parsed": "27.02.2025",
      "isoString": "2025-02-27T06:51:33.690Z"
    },
    "mediaType": "video",
    "mediaContent": {
      "src": [
        {
          "src": "https://dms.licdn.com/playlist/vid/v2/D4D05AQGuQtgoeGGZ-w/mp4-640p-30fp-crf28/B4DZUitvB4GcBc-/0/1740044205393?e=1742454000&v=beta&t=tgn33y5lc_SuZTiPZn7ILwRNR5AXwpgMXYPCwRZ3Z4Q",
          "type": "video/mp4",
          "data-bitrate": 646331
        }
      ],
      "posterUrl": "https://media.licdn.com/dms/image/v2/D4D05AQGuQtgoeGGZ-w/videocover-high/B4DZUitvB4GcBs-/0/1740044201461?e=1742454000&v=beta&t=VZeNNbfdKelh7yT43YCRG7uNewm8jUD1wQ3i0UVJGlI"
    },
    "date": "2025-02-27T06:51:33.690Z"
  },
  {
    "captions": "Recycling made simple with Immix! We help conserve resources and reduce environmental impact every day. \nLooking for a tailored metal recycling solution? Get in touch today!\n\nğŸ“ 1300 046 649\nğŸŒ www.immix.com.au\nğŸ“§ trading@immix.com.au\n\n#Immix #SustainableRecycling #MetalRecycling #EcoFriendly #ReduceReuseRecycleRecycling made simple with Immix! We help conserve resources and reduce environmental impact every day. \nLooking for a tailored metal recycling solution? Get in touch today!\n\nğŸ“ 1300 046 649\nğŸŒ www.immix.com.au\nğŸ“§ trading@immix.com.au\n\n#Immix #SustainableRecycling #MetalRecycling #EcoFriendly #ReduceReuseRecycle",
    "likes": "13",
    "shares": "7",
    "time": {
      "raw": "2h",
      "parsed": "27.02.2025",
      "isoString": "2025-02-27T06:51:33.691Z"
    },
    "mediaType": "image",
    "mediaContent": [
      "https://media.licdn.com/dms/image/v2/D4E22AQFojYtsUhlrfw/feedshare-shrink_800/B4EZUiSyfzGgAk-/0/1740037112701?e=1744848000&v=beta&t=6I3otxWZQLkFyIdr0-1EaFzuyxX8ZtrJBGBvcN6pssA"
    ],
    "date": "2025-02-27T06:51:33.691Z"
  },
  {
    "captions": "Up to 2000 ton cutting force\nUp to 100 tph\nUp to 300 ton densifying compression\n\n#materialhandler #metalrecycling #hurda #scrap #scraplife #scrapyard #scrapmetal #heavyload \n#scrapshear #metalscrap\n#recyclingequipment #scrapshear \n#engineering #hurdamakasÄ± \n#hurda #recyclingmachinery #scrapmetalrecycling #briquetting #singleshaftshredder #cablestripper #inclinedshear  #copper #scrapbaler #scrapshear  #shredder #metalbaler #scraprecycling #baler #twinshaftshredder \n#aymasrecyclingmachineryUp to 2000 ton cutting force\nUp to 100 tph\nUp to 300 ton densifying compression\n\n#materialhandler #metalrecycling #hurda #scrap #scraplife #scrapyard #scrapmetal #heavyload \n#scrapshear #metalscrap\n#recyclingequipment #scrapshear \n#engineering #hurdamakasÄ± \n#hurda #recyclingmachinery #scrapmetalrecycling #briquetting #singleshaftshredder #cablestripper #inclinedshear  #copper #scrapbaler #scrapshear  #shredder #metalbaler #scraprecycling #baler #twinshaftshredder \n#aymasrecyclingmachinery",
    "likes": "81",
    "shares": "14",
    "time": {
      "raw": "3h",
      "parsed": "20.02.2025",
      "isoString": "2025-02-20T06:51:33.692Z"
    },
    "mediaType": "image",
    "mediaContent": [
      "https://media.licdn.com/dms/image/v2/D4D22AQE-fmsx0usaHA/feedshare-shrink_800/B4DZUYYk0EGkAk-/0/1739870857584?e=1744848000&v=beta&t=RRZahi-Jmrddw48djmGkc0in9QFt7lKFifHsZOth1EE"
    ],
    "date": "2025-02-20T06:51:33.692Z"
  },
  {
    "captions": "#materialhandler #metalrecycling #hurda #scrap #scraplife #scrapyard #scrapmetal #heavyload \n#scrapshear #metalscrap\n#recyclingequipment #scrapshear \n#engineering #heavymetal \n#hurda #recyclingmachinery #scrapmetalrecycling #briquetting #singleshaftshredder #cablestripper #inclinedshear  #copper #scrapbaler #scrapshear  #shredder #metalbaler #scraprecycling #baler #twinshaftshredder \n#aymasrecyclingmachinery#materialhandler #metalrecycling #hurda #scrap #scraplife #scrapyard #scrapmetal #heavyload \n#scrapshear #metalscrap\n#recyclingequipment #scrapshear \n#engineering #heavymetal \n#hurda #recyclingmachinery #scrapmetalrecycling #briquetting #singleshaftshredder #cablestripper #inclinedshear  #copper #scrapbaler #scrapshear  #shredder #metalbaler #scraprecycling #baler #twinshaftshredder \n#aymasrecyclingmachinery",
    "likes": "38",
    "comments": "1",
    "shares": "5",
    "time": {
      "raw": "3h",
      "parsed": "20.02.2025",
      "isoString": "2025-02-20T06:51:33.694Z"
    },
    "mediaType": "image",
    "mediaContent": [
      "https://media.licdn.com/dms/image/v2/D4D22AQHilifLUjWAyQ/feedshare-shrink_800/B4DZT_KkUoHAAk-/0/1739447749796?e=1744848000&v=beta&t=ghOgTMdEM-iHa1hbyeoUpHam58G3O3Xt-xHPsjxmR24"
    ],
    "date": "2025-02-20T06:51:33.694Z"
  },
  {
    "captions": "more scrap to chew !\n\n#materialhandler #metalrecycling #hurdacÄ± #scrap #scraplife #scrapyard #scrapmetal #heavyload \n#scrapshear #metalscrap\n#recyclingequipment #scrapshear \n#engineering #heavymetal \n#hurda #recyclingmachinery #scrapmetalrecycling #briquetting #singleshaftshredder #cablestripper #inclinedshear  #copper #scrapbaler #scrapshear  #shredder #metalbaler #scraprecycling #baler #twinshaftshredder \n#aymasrecyclingmachinerymore scrap to chew !\n\n#materialhandler #metalrecycling #hurdacÄ± #scrap #scraplife #scrapyard #scrapmetal #heavyload \n#scrapshear #metalscrap\n#recyclingequipment #scrapshear \n#engineering #heavymetal \n#hurda #recyclingmachinery #scrapmetalrecycling #briquetting #singleshaftshredder #cablestripper #inclinedshear  #copper #scrapbaler #scrapshear  #shredder #metalbaler #scraprecycling #baler #twinshaftshredder \n#aymasrecyclingmachinery",
    "likes": "39",
    "shares": "8",
    "time": {
      "raw": "4h",
      "parsed": "13.02.2025",
      "isoString": "2025-02-13T06:51:33.695Z"
    },
    "mediaType": "image",
    "mediaContent": [
      "https://media.licdn.com/dms/image/v2/D4D22AQHYQ-1wnYkWhA/feedshare-shrink_800/B4DZT0nQj7HYAk-/0/1739270720927?e=1744848000&v=beta&t=pFSSx1I-2kUmeZiD7JREq-iV90B19azNUi9HdQMiGTM"
    ],
    "date": "2025-02-13T06:51:33.695Z"
  },
  {
    "captions": "BugÃ¼n, 6 Åubat depreminin yÄ±l dÃ¶nÃ¼mÃ¼nde, hayatÄ±nÄ± kaybeden vatandaÅŸlarÄ±mÄ±zÄ± saygÄ± ve rahmetle anÄ±yor, ailelerine sabÄ±r ve dayanma gÃ¼cÃ¼ diliyoruz. Bu bÃ¼yÃ¼k felaketin acÄ±sÄ±nÄ± yÃ¼reÄŸimizde hissederken, dayanÄ±ÅŸma ve birlik iÃ§inde olmanÄ±n Ã¶nemini bir kez daha hatÄ±rlÄ±yoruz.\n\nDeprem gerÃ§eÄŸiyle yÃ¼zleÅŸmek ve gerekli Ã¶nlemleri almak, gelecekte benzer acÄ±larÄ±n yaÅŸanmamasÄ± iÃ§in hayati bir sorumluluktur. Daha gÃ¼venli yarÄ±nlar iÃ§in bilinÃ§lenmeye, afetlere karÅŸÄ± hazÄ±rlÄ±klÄ± olmaya ve gerekli tedbirleri almaya devam etmeliyiz.\n\nBugÃ¼n, sadece kaybettiklerimizi anma gÃ¼nÃ¼ deÄŸil, aynÄ± zamanda ders Ã§Ä±karÄ±p daha gÃ¼venli bir gelecek inÅŸa etme sorumluluÄŸunu hatÄ±rlama gÃ¼nÃ¼dÃ¼r.\n\nâ€”â€”â€”â€”â€”â€”â€”â€”â€”â€”â€”â€”â€”â€”â€”â€”â€”â€”â€”â€”â€”â€”â€” \n\nToday marks the anniversary of the February 6 earthquake, and we remember with respect and compassion those who lost their lives. We extend our deepest condolences to their families and wish them strength and resilience. The pain of this great disaster remains in our hearts, reminding us once again of the importance of unity and solidarity.\n\nFacing the reality of earthquakes and taking necessary precautions is crucial to preventing similar tragedies in the future. We must continue to raise awareness, be prepared for disasters, and take the necessary measures to ensure a safer tomorrow.\n\nToday is not only a day of remembrance for those we lost but also a day to reflect, learn, and commit to building a safer future.\n\n#6ÅŸubatdepremi #AymasRecyclingMachineryBugÃ¼n, 6 Åubat depreminin yÄ±l dÃ¶nÃ¼mÃ¼nde, hayatÄ±nÄ± kaybeden vatandaÅŸlarÄ±mÄ±zÄ± saygÄ± ve rahmetle anÄ±yor, ailelerine sabÄ±r ve dayanma gÃ¼cÃ¼ diliyoruz. Bu bÃ¼yÃ¼k felaketin acÄ±sÄ±nÄ± yÃ¼reÄŸimizde hissederken, dayanÄ±ÅŸma ve birlik iÃ§inde olmanÄ±n Ã¶nemini bir kez daha hatÄ±rlÄ±yoruz.\n\nDeprem gerÃ§eÄŸiyle yÃ¼zleÅŸmek ve gerekli Ã¶nlemleri almak, gelecekte benzer acÄ±larÄ±n yaÅŸanmamasÄ± iÃ§in hayati bir sorumluluktur. Daha gÃ¼venli yarÄ±nlar iÃ§in bilinÃ§lenmeye, afetlere karÅŸÄ± hazÄ±rlÄ±klÄ± olmaya ve gerekli tedbirleri almaya devam etmeliyiz.\n\nBugÃ¼n, sadece kaybettiklerimizi anma gÃ¼nÃ¼ deÄŸil, aynÄ± zamanda ders Ã§Ä±karÄ±p daha gÃ¼venli bir gelecek inÅŸa etme sorumluluÄŸunu hatÄ±rlama gÃ¼nÃ¼dÃ¼r.\n\nâ€”â€”â€”â€”â€”â€”â€”â€”â€”â€”â€”â€”â€”â€”â€”â€”â€”â€”â€”â€”â€”â€”â€” \n\nToday marks the anniversary of the February 6 earthquake, and we remember with respect and compassion those who lost their lives. We extend our deepest condolences to their families and wish them strength and resilience. The pain of this great disaster remains in our hearts, reminding us once again of the importance of unity and solidarity.\n\nFacing the reality of earthquakes and taking necessary precautions is crucial to preventing similar tragedies in the future. We must continue to raise awareness, be prepared for disasters, and take the necessary measures to ensure a safer tomorrow.\n\nToday is not only a day of remembrance for those we lost but also a day to reflect, learn, and commit to building a safer future.\n\n#6ÅŸubatdepremi #AymasRecyclingMachinery",
    "likes": "14",
    "shares": "8",
    "time": {
      "raw": "1ay",
      "parsed": "13.02.2025",
      "isoString": "2025-02-13T06:51:33.697Z"
    },
    "mediaType": "image",
    "mediaContent": [
      "https://media.licdn.com/dms/image/v2/D4D22AQGP_Cal7l5ZRA/feedshare-shrink_800/B4DZTbGIDHHAAg-/0/1738842605018?e=1744848000&v=beta&t=DXlw0J6nTIxCujYwAUumpEBIBcM8JhdkF9KKijCCni0"
    ],
    "date": "2025-02-13T06:51:33.697Z"
  },
  {
    "captions": "A mobile inclined shear on duty.\n\n#materialhandler #metalrecycling #hurda #scrap #scraplife #scrapyard #scrapmetal #heavyload \n#scrapshear #metalscrap\n#recyclingequipment #scrapshear \n#engineering #heavymetal \n#hurda #recyclingmachinery #scrapmetalrecycling #briquetting #singleshaftshredder #cablestripper #inclinedshear  #copper #scrapbaler #scrapshear  #shredder #metalbaler #scraprecycling #baler #twinshaftshredder \n#aymasrecyclingmachineryA mobile inclined shear on duty.\n\n#materialhandler #metalrecycling #hurda #scrap #scraplife #scrapyard #scrapmetal #heavyload \n#scrapshear #metalscrap\n#recyclingequipment #scrapshear \n#engineering #heavymetal \n#hurda #recyclingmachinery #scrapmetalrecycling #briquetting #singleshaftshredder #cablestripper #inclinedshear  #copper #scrapbaler #scrapshear  #shredder #metalbaler #scraprecycling #baler #twinshaftshredder \n#aymasrecyclingmachinery",
    "likes": "35",
    "shares": "7",
    "time": {
      "raw": "1ay",
      "parsed": "13.02.2025",
      "isoString": "2025-02-13T06:51:33.699Z"
    },
    "mediaType": "image",
    "mediaContent": [
      "https://media.licdn.com/dms/image/v2/D4D22AQGYrP9vP6OqdA/feedshare-shrink_800/B4DZTakKRNGcAk-/0/1738833700987?e=1744848000&v=beta&t=Si5xBqyySQnPBYWXsNmnwPuawk-CdRylG100J5G62qA"
    ],
    "date": "2025-02-13T06:51:33.699Z"
  },
  {
    "captions": "A new installation of one of our triple compression baler for ferrous.\n\n#materialhandler #metalrecycling #hurda #scrap #scraplife #scrapyard #scrapmetal #heavyload \n#baler #metalscrap\n#recyclingequipment #scrapshear \n#engineering #heavymetal \n#hurda #recyclingmachinery #scrapmetalrecycling #briquetting #singleshaftshredder #cablestripper #inclinedshear  #copper #scrapbaler #scrapshear  #shredder #metalbaler #scraprecycling #baler #twinshaftshredder \n#aymasrecyclingmachineryA new installation of one of our triple compression baler for ferrous.\n\n#materialhandler #metalrecycling #hurda #scrap #scraplife #scrapyard #scrapmetal #heavyload \n#baler #metalscrap\n#recyclingequipment #scrapshear \n#engineering #heavymetal \n#hurda #recyclingmachinery #scrapmetalrecycling #briquetting #singleshaftshredder #cablestripper #inclinedshear  #copper #scrapbaler #scrapshear  #shredder #metalbaler #scraprecycling #baler #twinshaftshredder \n#aymasrecyclingmachinery",
    "likes": "37",
    "shares": "7",
    "time": {
      "raw": "1ay",
      "parsed": "13.02.2025",
      "isoString": "2025-02-13T06:51:33.700Z"
    },
    "mediaType": "image",
    "mediaContent": [
      "https://media.licdn.com/dms/image/v2/D4D22AQGFz4Bk6P7pyQ/feedshare-shrink_800/B4DZTQwZNlGcAg-/0/1738669138298?e=1744848000&v=beta&t=HctRaSyUgbaIXZ-T1CUEKNLJouexZqzzJidvfyF3HTg"
    ],
    "date": "2025-02-13T06:51:33.700Z"
  },
  {
    "captions": "From scrap to sustainability! ğŸŒ At IMMIX, we're turning scrap metal into valuable resources through efficient recycling processes. Together, let's shape a greener future! \n#MetalRecycling #Sustainability #IMMIXFrom scrap to sustainability! ğŸŒ At IMMIX, we're turning scrap metal into valuable resources through efficient recycling processes. Together, let's shape a greener future! \n#MetalRecycling #Sustainability #IMMIX",
    "likes": "28",
    "comments": "2",
    "shares": "3",
    "time": {
      "raw": "2ay",
      "parsed": "13.01.2025",
      "isoString": "2025-01-13T06:51:33.702Z"
    },
    "mediaType": "image",
    "mediaContent": [
      "https://media.licdn.com/dms/image/v2/D4E22AQFJ-soKtiP1bA/feedshare-shrink_800/B4EZQ6MVtpHEAg-/0/1736143112593?e=1744848000&v=beta&t=r-uomhw_qjs5hsdYBrzbShpp87tmq3PRLOMh7C1uNLE"
    ],
    "date": "2025-01-13T06:51:33.702Z"
  },
  {
    "captions": "ğŸ‘‡ ğ—–ğ—Ÿğ—œğ—–ğ— ğ—§ğ—¢ ğ——ğ—œğ—¦ğ—–ğ—¢ğ—©ğ—˜ğ—¥ ğ— ğ—¢ğ—¥ğ—˜",
    "likes": "25",
    "shares": "7",
    "time": {
      "raw": "1ay",
      "parsed": "13.02.2025",
      "isoString": "2025-02-13T06:51:33.703Z"
    },
    "mediaType": "other",
    "date": "2025-02-13T06:51:33.703Z"
  },
  {
    "captions": "DostÄ™pne i przystÄ™pne? \nTak! Takie sÄ… maszyny Aymas, ktÃ³re czekajÄ… na Was i swÃ³j nowy dom, a raczej hale, albo zakÅ‚ad, plac... \nTy wybierasz gdzie bÄ™dzie dla Ciebie pracowaÄ‡. \nCzas produkcji paczkarki i brykieciarki to standardowo 3-4 miesiÄ…ce,   po co czekaÄ‡, skoro moÅ¼esz zaczÄ…Ä‡ juÅ¼ teraz?\n\nhttps://lnkd.in/eSn8rdhB",
    "likes": "14",
    "shares": "7",
    "time": {
      "raw": "1ay",
      "parsed": "05.02.2025",
      "isoString": "2025-02-05T10:26:20.859Z"
    },
    "mediaType": "other",
    "date": "2025-02-05T10:26:20.859Z"
  },
  {
    "captions": "#materialhandler #metalrecycling #Jaipur #scrap #scraplife #scrapyard #scrapmetal #heavyload \n#MRAI #metalscrap\n#recyclingequipment #scrapshear \n#engineering #heavymetal \n#hurda #recyclingmachinery #scrapmetalrecycling #briquetting #singleshaftshredder #cablestripper #inclinedshear  #copper #scrapbaler #scrapshear  #shredder #metalbaler #scraprecycling #baler #twinshaftshredder \n#aymasrecyclingmachinery#materialhandler #metalrecycling #Jaipur #scrap #scraplife #scrapyard #scrapmetal #heavyload \n#MRAI #metalscrap\n#recyclingequipment #scrapshear \n#engineering #heavymetal \n#hurda #recyclingmachinery #scrapmetalrecycling #briquetting #singleshaftshredder #cablestripper #inclinedshear  #copper #scrapbaler #scrapshear  #shredder #metalbaler #scraprecycling #baler #twinshaftshredder \n#aymasrecyclingmachinery",
    "likes": "35",
    "comments": "1",
    "shares": "6",
    "time": {
      "raw": "1ay",
      "parsed": "05.02.2025",
      "isoString": "2025-02-05T10:26:20.860Z"
    },
    "mediaType": "image",
    "mediaContent": [
      "https://media.licdn.com/dms/image/v2/D4D22AQFzNnPNch-PGA/feedshare-shrink_800/B4DZS2B51GHAAg-/0/1738220741215?e=1744243200&v=beta&t=tP4CZwbAOmMx7GPYz8c_I4g6jrdmOsb2fC6yrVikiw0"
    ],
    "date": "2025-02-05T10:26:20.860Z"
  },
  {
    "captions": "MRAI Exhibition in Jaipur. Come and visit us.\n\n#materialhandler #metalrecycling #Jaipur #scrap #scraplife #scrapyard #scrapmetal #heavyload \n#MRAI #metalscrap\n#recyclingequipment #scrapshear \n#engineering #heavymetal \n#hurda #recyclingmachinery #scrapmetalrecycling #briquetting #singleshaftshredder #cablestripper #inclinedshear  #copper #scrapbaler #scrapshear  #shredder #metalbaler #scraprecycling #baler #twinshaftshredder \n#aymasrecyclingmachineryMRAI Exhibition in Jaipur. Come and visit us.\n\n#materialhandler #metalrecycling #Jaipur #scrap #scraplife #scrapyard #scrapmetal #heavyload \n#MRAI #metalscrap\n#recyclingequipment #scrapshear \n#engineering #heavymetal \n#hurda #recyclingmachinery #scrapmetalrecycling #briquetting #singleshaftshredder #cablestripper #inclinedshear  #copper #scrapbaler #scrapshear  #shredder #metalbaler #scraprecycling #baler #twinshaftshredder \n#aymasrecyclingmachinery",
    "likes": "33",
    "shares": "5",
    "time": {
      "raw": "1ay",
      "parsed": "05.02.2025",
      "isoString": "2025-02-05T10:26:20.862Z"
    },
    "mediaType": "image",
    "mediaContent": [
      "https://media.licdn.com/dms/image/v2/D4D22AQFOBLvPkbGCZw/feedshare-shrink_800/B4DZSxfTnzHAAg-/0/1738144564771?e=1744243200&v=beta&t=3XvgKYVrEvGIq5NxCTrbjl2XBu38ilLqWigqVMIB5Cs"
    ],
    "date": "2025-02-05T10:26:20.862Z"
  },
  {
    "likes": "40",
    "comments": "1",
    "shares": "7",
    "time": {
      "raw": "1ay",
      "parsed": "05.02.2025",
      "isoString": "2025-02-05T10:26:20.863Z"
    },
    "mediaType": "image",
    "mediaContent": [
      "https://media.licdn.com/dms/image/v2/D4D22AQF_Uqk9IXFowQ/feedshare-shrink_2048_1536/B4DZSr1HSlHIAo-/0/1738049616263?e=1744243200&v=beta&t=OxN6oFzdfr7TpRaeStmGiQwPKQMG8bRe7h--2xJ9pes"
    ],
    "date": "2025-02-05T10:26:20.863Z"
  },
  {
    "captions": "Heavy beast is on the way.\n\n#materialhandler #metalrecycling #steel #scrap #scraplife #scrapyard #scrapmetal #heavyload \n#heavyduty #metalscrap\n#recyclingequipment #scrapshear \n#engineering #heavymetal \n#alligatorshear #recyclingmachinery #scrapmetalrecycling #briquetting #singleshaftshredder #cablestripper #inclinedshear  #copper #scrapbaler #scrapshear  #shredder #metalbaler #scraprecycling #baler #twinshaftshredder \n#aymasrecyclingmachineryHeavy beast is on the way.\n\n#materialhandler #metalrecycling #steel #scrap #scraplife #scrapyard #scrapmetal #heavyload \n#heavyduty #metalscrap\n#recyclingequipment #scrapshear \n#engineering #heavymetal \n#alligatorshear #recyclingmachinery #scrapmetalrecycling #briquetting #singleshaftshredder #cablestripper #inclinedshear  #copper #scrapbaler #scrapshear  #shredder #metalbaler #scraprecycling #baler #twinshaftshredder \n#aymasrecyclingmachinery",
    "likes": "69",
    "comments": "3",
    "shares": "9",
    "time": {
      "raw": "1ay",
      "parsed": "05.02.2025",
      "isoString": "2025-02-05T10:26:20.864Z"
    },
    "mediaType": "image",
    "mediaContent": [
      "https://media.licdn.com/dms/image/v2/D4D22AQHp86fYmCEyDw/feedshare-shrink_800/B4DZSXo4pEHYAg-/0/1737710866723?e=1744243200&v=beta&t=ieXD7ofPHvvYvoesZ7RUrEXD0ACae5w_X1T2-OWKK-8"
    ],
    "date": "2025-02-05T10:26:20.864Z"
  },
  {
    "captions": "Another container arrives to Machinery Specialist HQ with loads of wire strippers and alligator shears\nhalf of them already sold and ready for shipping next week, but contact our team to secure yours before they all gone.Another container arrives to Machinery Specialist HQ with loads of wire strippers and alligator shears\nhalf of them already sold and ready for shipping next week, but contact our team to secure yours before they all gone.",
    "likes": "46",
    "shares": "5",
    "time": {
      "raw": "1ay",
      "parsed": "03.02.2025",
      "isoString": "2025-02-03T14:17:58.826Z"
    },
    "mediaType": "image",
    "mediaContent": [
      "https://media.licdn.com/dms/image/v2/D5622AQEuSN1ZJJ0XUQ/feedshare-shrink_800/B56ZSWSnJ1HQAg-/0/1737688250635?e=1743638400&v=beta&t=HOvsZzTuf-4S4nyacNyfy0h74vOaiwoFOmk3v2NYlPQ"
    ],
    "date": "2025-02-03T14:17:58.826Z"
  },
  {
    "captions": "#dubai #materialhandler #metalrecycling #hurda #scrap #scraplife #scrapyard #scrapmetal #heavyload \n#scrapshear #metalscrap\n#recyclingequipment #scrapshear \n#engineering #hurdamakasÄ± \n#geridÃ¶nÃ¼ÅŸÃ¼m #recyclingmachinery #scrapmetalrecycling #inclinedshear #scrapshear #eÄŸikmakas\n#aymasrecyclingmachinery",
    "likes": "30",
    "comments": "3",
    "shares": "5",
    "time": {
      "raw": "1h",
      "parsed": "10.03.2025",
      "isoString": "2025-03-10T05:04:29.221Z"
    },
    "mediaType": "video",
    "mediaContent": {
      "src": [
        {
          "src": "https://dms.licdn.com/playlist/vid/v2/D4D05AQE73xhqRNVvSQ/mp4-640p-30fp-crf28/B4DZVf8aSOGkBc-/0/1741071446926?e=1742796000&v=beta&t=zl8DAi_VfCQ2DazPHYTq_xRdK-nX8AGUpLccyFXMPiA",
          "type": "video/mp4",
          "data-bitrate": 773349
        }
      ],
      "posterUrl": "https://media.licdn.com/dms/image/v2/D4D05AQE73xhqRNVvSQ/videocover-high/B4DZVf8aSOGkBs-/0/1741071446422?e=1742796000&v=beta&t=toK0hbLTOy34x53Y4B4IEmPUMP9HFKdqQxoZ8ysuGZ4"
    },
    "date": "2025-03-10T05:04:29.221Z"
  },
  {
    "captions": "A new installation in KSA.\n\n#materialhandler #metalrecycling #hurda #scrap #scraplife #scrapyard #scrapmetal #heavyload \n#scrapshear #metalscrap\n#recyclingequipment #scrapshear \n#engineering #hurdamakasÄ± #recyclingmachinery #scrapmetalrecycling #briquetting #singleshaftshredder #cablestripper #inclinedshear  #copper #scrapbaler #scrapshear  #shredder #metalbaler #scraprecycling #geridÃ¶nÃ¼ÅŸÃ¼m #twinshaftshredder \n#aymasrecyclingmachinery",
    "likes": "52",
    "comments": "1",
    "shares": "6",
    "time": {
      "raw": "2h",
      "parsed": "12.03.2025",
      "isoString": "2025-03-12T05:21:14.659Z"
    },
    "mediaType": "video",
    "mediaContent": {
      "src": [
        {
          "src": "https://dms.licdn.com/playlist/vid/v2/D4D05AQFlwbOUkiK6Aw/mp4-640p-30fp-crf28/B4DZWD_I39G4Bs-/0/1741676152838?e=1743573600&v=beta&t=GiHBkl7Mt4YAFfkyDo09s6WAAEw7bR-nQ4Dq_stITqA",
          "type": "video/mp4",
          "data-bitrate": 221289
        }
      ],
      "posterUrl": "https://media.licdn.com/dms/image/v2/D4D05AQFlwbOUkiK6Aw/videocover-low/B4DZWD_I39G4Cc-/0/1741676150459?e=1743573600&v=beta&t=_dxkTmw6w71L5rTevMn-e0yF1ZMnI91-yf9kPy-Pano"
    },
    "date": "2025-03-12T05:21:14.659Z"
  },
  {
    "captions": "MEET THE BEAST\n\nThe Aymas Inclined Shear can process a whopping 70 tonnes of mixed and heavy-duty scrap per hour with continuous feeding.\n\nâœ‚ï¸ No scrap length limit!\nâœ‚ï¸ No operator needed!\nâœ‚ï¸ Electric or diesel - your choice\nâœ‚ï¸ Automatic lubrication & remote diagnostic for easy maintenance\nâœ‚ï¸ Chrome-plated shafts and anti-wear plates for long lifespan\nâœ‚ï¸ Stationary or semi-mobile\nâœ‚ï¸ Reliable cooling system for hot climates (we're looking at you, QLD & NT)\n\nDM us for more info!\n\n#scrap #scrapmetal #scrapprocessingMEET THE BEAST\n\nThe Aymas Inclined Shear can process a whopping 70 tonnes of mixed and heavy-duty scrap per hour with continuous feeding.\n\nâœ‚ï¸ No scrap length limit!\nâœ‚ï¸ No operator needed!\nâœ‚ï¸ Electric or diesel - your choice\nâœ‚ï¸ Automatic lubrication & remote diagnostic for easy maintenance\nâœ‚ï¸ Chrome-plated shafts and anti-wear plates for long lifespan\nâœ‚ï¸ Stationary or semi-mobile\nâœ‚ï¸ Reliable cooling system for hot climates (we're looking at you, QLD & NT)\n\nDM us for more info!\n\n#scrap #scrapmetal #scrapprocessing",
    "likes": "31",
    "shares": "5",
    "time": {
      "raw": "2h",
      "parsed": "12.03.2025",
      "isoString": "2025-03-12T05:21:14.662Z"
    },
    "mediaType": "image",
    "mediaContent": [
      "https://media.licdn.com/dms/image/v2/D4D22AQHD42G4ZC2bgA/feedshare-shrink_800/B4DZS7GrVlG4Ag-/0/1738305955150?e=1746057600&v=beta&t=5SAdp38zDf276a0Nbdt9QtIKvYJcA-QT4mhAzkRmgrU"
    ],
    "date": "2025-03-12T05:21:14.662Z"
  },
  {
    "captions": "Aymas is in Mexico for Latin American clients. Visit us for the recent technologies in metal scrap recycling machinery.\n\n#materialhandler #metalrecycling #hurda #scrap #scraplife #scrapyard #scrapmetal #heavyload \n#scrapshear #metalscrap\n#recyclingequipment #scrapshear \n#engineering #hurdamakasÄ± \n#Residuosexpo  #recyclingmachinery #scrapmetalrecycling #briquetting #singleshaftshredder #cablestripper #inclinedshear  #copper #scrapbaler #scrapshear  #shredder #metalbaler #scraprecycling #baler #twinshaftshredder \n#aymasrecyclingmachineryAymas is in Mexico for Latin American clients. Visit us for the recent technologies in metal scrap recycling machinery.\n\n#materialhandler #metalrecycling #hurda #scrap #scraplife #scrapyard #scrapmetal #heavyload \n#scrapshear #metalscrap\n#recyclingequipment #scrapshear \n#engineering #hurdamakasÄ± \n#Residuosexpo  #recyclingmachinery #scrapmetalrecycling #briquetting #singleshaftshredder #cablestripper #inclinedshear  #copper #scrapbaler #scrapshear  #shredder #metalbaler #scraprecycling #baler #twinshaftshredder \n#aymasrecyclingmachinery",
    "likes": "20",
    "shares": "4",
    "time": {
      "raw": "2h",
      "parsed": "12.03.2025",
      "isoString": "2025-03-12T05:21:14.673Z"
    },
    "mediaType": "image",
    "mediaContent": [
      "https://media.licdn.com/dms/image/v2/D4D22AQEqlG-3qsTS4A/feedshare-shrink_800/B4DZV2oRmaG8Ag-/0/1741452025116?e=1746057600&v=beta&t=g0d_8E0g038324BilPH_6AWFSdEpuiDmQKHGc0rd0EU"
    ],
    "date": "2025-03-12T05:21:14.673Z"
  },
  {
    "captions": "ğŸŒ¸ Happy International Women's Day! ğŸŒ¸ Today, we celebrate the strength, resilience, and extraordinary achievements of women around the world. Let's continue to uplift, support, and empower each other every day. Together, we can create a brighter and more equal future. ğŸ’ªâœ¨ \n\n#materialhandler #metalrecycling #Womendays #scrap #scraplife #scrapyard #scrapmetal #heavyload \n#scrapshear #metalscrap\n#recyclingequipment #scrapshear \n#engineering #hurdamakasÄ± \n#InternationalWomensDay #recyclingmachinery #scrapmetalrecycling #briquetting #singleshaftshredder #cablestripper #inclinedshear  #copper #scrapbaler #scrapshear  #shredder #metalbaler #scraprecycling #baler #twinshaftshredder \n#aymasrecyclingmachineryğŸŒ¸ Happy International Women's Day! ğŸŒ¸ Today, we celebrate the strength, resilience, and extraordinary achievements of women around the world. Let's continue to uplift, support, and empower each other every day. Together, we can create a brighter and more equal future. ğŸ’ªâœ¨ \n\n#materialhandler #metalrecycling #Womendays #scrap #scraplife #scrapyard #scrapmetal #heavyload \n#scrapshear #metalscrap\n#recyclingequipment #scrapshear \n#engineering #hurdamakasÄ± \n#InternationalWomensDay #recyclingmachinery #scrapmetalrecycling #briquetting #singleshaftshredder #cablestripper #inclinedshear  #copper #scrapbaler #scrapshear  #shredder #metalbaler #scraprecycling #baler #twinshaftshredder \n#aymasrecyclingmachinery",
    "likes": "13",
    "comments": "1",
    "shares": "4",
    "time": {
      "raw": "2h",
      "parsed": "12.03.2025",
      "isoString": "2025-03-12T05:21:14.691Z"
    },
    "mediaType": "image",
    "mediaContent": [
      "https://media.licdn.com/dms/image/v2/D4D22AQGqrtO4lVg_ng/feedshare-shrink_800/B4DZV12uRTHIAg-/0/1741439037133?e=1746057600&v=beta&t=p_--_qF-KeCMy-1Ap22-HR37GyToQClvKMPubiK_2dw"
    ],
    "date": "2025-03-12T05:21:14.691Z"
  },
  {
    "captions": "#materialhandler #metalrecycling #hurda #scrap #scraplife #scrapyard #scrapmetal #heavyload \n#scrapshear #metalscrap\n#recyclingequipment #scrapshear \n#steel #hurdamakasÄ± \n#geridÃ¶nÃ¼ÅŸÃ¼m #demirÃ§elik #scrapmetalrecycling #briquetting #singleshaftshredder #cablestripper #inclinedshear  #copper #scrapbaler #scrapshear  #shredder #metalbaler #scraprecycling #demir #twinshaftshredder \n#aymasrecyclingmachinery",
    "likes": "20",
    "comments": "1",
    "shares": "5",
    "time": {
      "raw": "1h",
      "parsed": "10.03.2025",
      "isoString": "2025-03-10T05:04:29.220Z"
    },
    "mediaType": "video",
    "mediaContent": {
      "src": [
        {
          "src": "https://dms.licdn.com/playlist/vid/v2/D4D05AQEaEvl3HdOiFQ/mp4-640p-30fp-crf28/B4DZVqCktQHIBE-/0/1741240821798?e=1742796000&v=beta&t=A93wLJPEcxhtlOx7FgIzSzuna_qK3LfY5Csjfmg0dTY",
          "type": "video/mp4",
          "data-bitrate": 417174
        }
      ],
      "posterUrl": "https://media.licdn.com/dms/image/v2/D4D05AQEaEvl3HdOiFQ/videocover-high/B4DZVqCktQHIBU-/0/1741240820255?e=1742796000&v=beta&t=VxoZhcD1_W23SzjsvzOkzxiLTxzDhnISnY8XKUsFdjs"
    },
    "date": "2025-03-10T05:04:29.220Z"
  },
  {
    "captions": "Inclined Shear Semi - Mobile 900 ton\n\n#materialhandler #metalrecycling #hurda #scrap #scraplife #scrapyard #scrapmetal #heavyload \n#scrapshear #metalscrap\n#recyclingequipment #scrapshear \n#engineering #hurdamakasÄ± #recyclingmachinery #scrapmetalrecycling #briquetting #singleshaftshredder #cablestripper #inclinedshear  #copper #scrapbaler #scrapshear  #shredder #metalbaler #scraprecycling #geridÃ¶nÃ¼ÅŸÃ¼m #twinshaftshredder \n#aymasrecyclingmachineryInclined Shear Semi - Mobile 900 ton\n\n#materialhandler #metalrecycling #hurda #scrap #scraplife #scrapyard #scrapmetal #heavyload \n#scrapshear #metalscrap\n#recyclingequipment #scrapshear \n#engineering #hurdamakasÄ± #recyclingmachinery #scrapmetalrecycling #briquetting #singleshaftshredder #cablestripper #inclinedshear  #copper #scrapbaler #scrapshear  #shredder #metalbaler #scraprecycling #geridÃ¶nÃ¼ÅŸÃ¼m #twinshaftshredder \n#aymasrecyclingmachinery",
    "likes": "55",
    "shares": "6",
    "time": {
      "raw": "1h",
      "parsed": "19.03.2025",
      "isoString": "2025-03-19T05:21:14.627Z"
    },
    "mediaType": "image",
    "mediaContent": [
      "https://media.licdn.com/dms/image/v2/D4D22AQHela2x1amjJA/feedshare-shrink_800/B4DZWOZGGuHYAg-/0/1741850705645?e=1746057600&v=beta&t=s7GaNXGi9DYhxESA62xlCDoC7ZqCrzpbN6pz47PqbHE"
    ],
    "date": "2025-03-19T05:21:14.627Z"
  },
  {
    "captions": "Residuos Expo is just starting. We are waiting for all of you to our booth at 1338.\n\n#materialhandler #metalrecycling #Residuos #scrap #scraplife #scrapyard #scrapmetal #heavyload \n#scrapshear #metalscrap\n#recyclingequipment #scrapshear \n#engineering #hurdamakasÄ± #recyclingmachinery #scrapmetalrecycling #briquetting #singleshaftshredder #cablestripper #inclinedshear  #copper #scrapbaler #scrapshear  #shredder #metalbaler #scraprecycling #geridÃ¶nÃ¼ÅŸÃ¼m #twinshaftshredder \n#aymasrecyclingmachineryResiduos Expo is just starting. We are waiting for all of you to our booth at 1338.\n\n#materialhandler #metalrecycling #Residuos #scrap #scraplife #scrapyard #scrapmetal #heavyload \n#scrapshear #metalscrap\n#recyclingequipment #scrapshear \n#engineering #hurdamakasÄ± #recyclingmachinery #scrapmetalrecycling #briquetting #singleshaftshredder #cablestripper #inclinedshear  #copper #scrapbaler #scrapshear  #shredder #metalbaler #scraprecycling #geridÃ¶nÃ¼ÅŸÃ¼m #twinshaftshredder \n#aymasrecyclingmachinery",
    "likes": "15",
    "shares": "4",
    "time": {
      "raw": "12s",
      "parsed": "25.03.2025",
      "isoString": "2025-03-25T17:21:14.599Z"
    },
    "mediaType": "image",
    "mediaContent": [
      "https://media.licdn.com/dms/image/v2/D4D22AQFuGhuez5hA3w/feedshare-shrink_800/B4DZXOQeulG4Ag-/0/1742922183723?e=1746057600&v=beta&t=LjrdnFhuCjrw8A7rEHTKwQOeiGeC0By1TZn9M-EtIsg"
    ],
    "date": "2025-03-25T17:21:14.599Z"
  },
  {
    "captions": "#materialhandler #metalrecycling #hurda #scrap #scraplife #scrapyard #scrapmetal #heavyload \n#scrapshear #metalscrap\n#recyclingequipment #scrapshear \n#engineering #hurdamakasÄ± #recyclingmachinery #scrapmetalrecycling #briquetting #singleshaftshredder #cablestripper #inclinedshear  #copper #scrapbaler #scrapshear  #shredder #metalbaler #scraprecycling #geridÃ¶nÃ¼ÅŸÃ¼m #twinshaftshredder \n#aymasrecyclingmachinery",
    "likes": "40",
    "comments": "2",
    "shares": "4",
    "time": {
      "raw": "23s",
      "parsed": "25.03.2025",
      "isoString": "2025-03-25T06:21:14.602Z"
    },
    "mediaType": "video",
    "mediaContent": {
      "src": [
        {
          "src": "https://dms.licdn.com/playlist/vid/v2/D4D05AQFZsRSj-TOvUg/mp4-640p-30fp-crf28/B4DZXL1L1XG8Bc-/0/1742881483731?e=1743573600&v=beta&t=uY_AkzvaCiJVcfq3cY0cEUIC_tF4mJHzH6PeEQDj3cQ",
          "type": "video/mp4",
          "data-bitrate": 580414
        }
      ],
      "posterUrl": "https://media.licdn.com/dms/image/v2/D4D05AQFZsRSj-TOvUg/videocover-low/B4DZXL1L1XG8CQ-/0/1742881480316?e=1743573600&v=beta&t=n_q8hZJnBL9pQIJs95rvhO6Sj8-WgqJqwvX8nkqFlms"
    },
    "date": "2025-03-25T06:21:14.602Z"
  },
  {
    "captions": "Solid briquettes drop test.\n\n#materialhandler #metalrecycling #hurda #scrap #scraplife #scrapyard #scrapmetal #heavyload \n#scrapshear #metalscrap\n#recyclingequipment #scrapshear \n#engineering #hurdamakasÄ± #recyclingmachinery #scrapmetalrecycling #briquetting #singleshaftshredder #cablestripper #inclinedshear  #copper #scrapbaler #scrapshear  #shredder #metalbaler #scraprecycling #geridÃ¶nÃ¼ÅŸÃ¼m #twinshaftshredder \n#aymasrecyclingmachinery",
    "likes": "31",
    "comments": "1",
    "shares": "4",
    "time": {
      "raw": "5g",
      "parsed": "21.03.2025",
      "isoString": "2025-03-21T05:21:14.617Z"
    },
    "mediaType": "video",
    "mediaContent": {
      "src": [
        {
          "src": "https://dms.licdn.com/playlist/vid/v2/D5605AQHxhDqQ9K5UBg/mp4-640p-30fp-crf28/B56ZWybBHwHsBg-/0/1742455186908?e=1743573600&v=beta&t=Snu4MHXLMPXvBaTDLgpiyKqN5u5bKu4eIpKKTE8jLUg",
          "type": "video/mp4",
          "data-bitrate": 507624
        }
      ],
      "posterUrl": "https://media.licdn.com/dms/image/v2/D5605AQHxhDqQ9K5UBg/videocover-high/B56ZWybBHwHsBw-/0/1742455186088?e=1743573600&v=beta&t=QYes22C6Fnj1JQClsSqfbI1kWBYIbOur5ExT3zvf3BE"
    },
    "date": "2025-03-21T05:21:14.617Z"
  },
  {
    "captions": "Aymas Multi Crusher for multi purpose shredding.\n\n#materialhandler #metalrecycling #hurda #scrap #scraplife #scrapyard #scrapmetal #heavyload \n#scrapshear #metalscrap\n#recyclingequipment #scrapshear \n#engineering #hurdamakasÄ± #recyclingmachinery #scrapmetalrecycling #briquetting #singleshaftshredder #cablestripper #inclinedshear  #copper #scrapbaler #scrapshear  #shredder #metalbaler #scraprecycling #geridÃ¶nÃ¼ÅŸÃ¼m #twinshaftshredder \n#aymasrecyclingmachinery",
    "likes": "39",
    "comments": "1",
    "shares": "6",
    "time": {
      "raw": "1h",
      "parsed": "19.03.2025",
      "isoString": "2025-03-19T05:21:14.620Z"
    },
    "mediaType": "video",
    "mediaContent": {
      "src": [
        {
          "src": "https://dms.licdn.com/playlist/vid/v2/D4D05AQEIq-fPlkmAqw/mp4-640p-30fp-crf28/B4DZWox5hpHIBg-/0/1742293434768?e=1743573600&v=beta&t=mXnWLvrf1ED8InT83za1NwxA6or9Kdfv3dewhZNiYd8",
          "type": "video/mp4",
          "data-bitrate": 929755
        }
      ],
      "posterUrl": "https://media.licdn.com/dms/image/v2/D4D05AQEIq-fPlkmAqw/videocover-low/B4DZWox5hpHICU-/0/1742293427555?e=1743573600&v=beta&t=hltwL9GKtXFPr8s_MAT1Gzm0HShXpJKZqsn5cSuqKpE"
    },
    "date": "2025-03-19T05:21:14.620Z"
  },
  {
    "captions": "DID YOU KNOW? \nImmix helps industries, mining, councils, and agri-businesses achieve their sustainability goals through innovative metal recycling solutions! \n\nVisit: www.immix.com.au\n ğŸ“§ trading@immix.com.au | ğŸ“ 1300 046 649DID YOU KNOW? \nImmix helps industries, mining, councils, and agri-businesses achieve their sustainability goals through innovative metal recycling solutions! \n\nVisit: www.immix.com.au\n ğŸ“§ trading@immix.com.au | ğŸ“ 1300 046 649",
    "likes": "10",
    "shares": "3",
    "time": {
      "raw": "1h",
      "parsed": "19.03.2025",
      "isoString": "2025-03-19T05:21:14.624Z"
    },
    "mediaType": "image",
    "mediaContent": [
      "https://media.licdn.com/dms/image/v2/D4D22AQH1iWWMNxXHsQ/feedshare-shrink_800/B4DZWjDcYqHYAg-/0/1742197350148?e=1746057600&v=beta&t=N96g53NZ-TzjJ3zXvhYgPZBms6jFU_sGDUrH5-xDHr0"
    ],
    "date": "2025-03-19T05:21:14.624Z"
  }
]