{
  "followerData": [
    [
      20250213,
      5830
    ],
    [
      20250225,
      5862
    ],
    [
      20250225,
      5862
    ],
    [
      20250225,
      5862
    ],
    [
      20250228,
      5865
    ],
    [
      20250228,
      5865
    ],
    [
      20250228,
      5865
    ],
    [
      20250228,
      5865
    ],
    [
      20250303,
      5874
    ],
    [
      1741011455536,
      "5.874"
    ],
    [
      1741076472538,
      "5.877"
    ],
    [
      1741077615332,
      "5.877"
    ],
    [
      1741083590935,
      "5.877"
    ],
    [
      1741084601735,
      "5.877"
    ],
    [
      1741170361423,
      5880
    ],
    [
      1741755775755,
      5897
    ],
    [
      1741848677108,
      5900
    ],
    [
      1742187857382,
      5910
    ],
    [
      1742966460517,
      5914
    ],
    [
      1744004331455,
      5929
    ],
    [
      1744605900480,
      5943
    ],
    [
      1745214577277,
      5953
    ]
  ],
  "data": [
    {
      "captions": "New challengers in the kitchen! 🔥\n\nTeam Alter Trading —bringing bold flavors, fresh energy, and a competitive edge to Table Scraps: The Chef’s Challenge. These industry pros know their way around the job, but can they handle the heat of the kitchen?\n\nFind out when Table Scraps: The Chef’s Challenge drops March 14th! \n\n🔔 Subscribe on YouTube today! \n🔗 https://lnkd.in/gNG2dRXW\n\n#TableScraps #TheChefsChallenge #RecyclingMeetsCulinary #RecyclingCommunity Michael Goldstein🟧, Patrick Young, Mark Hadacek, Abby Goldstein, John Sacco",
      "likes": "24",
      "comments": "4",
      "shares": "3",
      "time": {
        "raw": "1h",
        "parsed": "05.03.2025",
        "isoString": "2025-03-05T05:02:55.515Z"
      },
      "mediaType": "video",
      "mediaContent": {
        "src": [
          {
            "src": "https://dms.licdn.com/playlist/vid/v2/D5605AQFE7bULTPQ4Fg/mp4-640p-30fp-crf28/B56ZVNuLu8GQBk-/0/1740765711583?e=1742364000&v=beta&t=P1rZ5qkxhK9PrNFIcb2ZYXxPX2YWxWTm8siZEu88vPs",
            "type": "video/mp4",
            "data-bitrate": 858157
          },
          {
            "src": "https://dms.licdn.com/playlist/vid/v2/D5605AQFE7bULTPQ4Fg/mp4-720p-30fp-crf28/B56ZVNuLu8GQBo-/0/1740765711535?e=1742364000&v=beta&t=4NBE6FlJJkbKUXCv75VfHyHTbL41CnE_wNNDNh4h2Xo",
            "type": "video/mp4",
            "data-bitrate": 1142498
          }
        ],
        "posterUrl": "https://media.licdn.com/dms/image/v2/D5605AQFE7bULTPQ4Fg/videocover-high/B56ZVNuLu8GQB0-/0/1740765710943?e=1742364000&v=beta&t=RHrS-KU6GoaSceUu64Q3OiXaY514Qqd-Gtw82VWRuVc"
      },
      "date": "2025-03-05T05:02:55.515Z"
    },
    {
      "captions": "Sierra® T1100 3-in-1? This powerhouse combines three machines in one, delivering unmatched versatility and efficiency. \n\nWith a 36-inch throat, it effortlessly handles bulkier materials and even logs automobiles with ease—outperforming anything else on the market. Plus, the double automatic lubrication system keeps you cutting longer!\n\n📲 Reach out to one of our sales reps today for more information!\n\n#SierraT1100 #RecyclingInnovation #BuiltToPerform Alter Trading",
      "likes": "13",
      "time": {
        "raw": "1h",
        "parsed": "05.03.2025",
        "isoString": "2025-03-05T05:02:55.516Z"
      },
      "mediaType": "video",
      "mediaContent": {
        "src": [
          {
            "src": "https://dms.licdn.com/playlist/vid/v2/D5605AQEMy8sAKSEIRQ/mp4-720p-30fp-crf28/B56ZVOLW6FHEBg-/0/1740773372512?e=1742364000&v=beta&t=pw8_ad8PZ_ibjEUvaBaYAqPO6Ha3s6lX5NdHKikC9ik",
            "type": "video/mp4",
            "data-bitrate": 1273632
          },
          {
            "src": "https://dms.licdn.com/playlist/vid/v2/D5605AQEMy8sAKSEIRQ/mp4-640p-30fp-crf28/B56ZVOLW6FHEBc-/0/1740773367640?e=1742364000&v=beta&t=a5pnZnFV3ikImFXg1PJWKjZOGHY-ha1wZqOfSlDNOjQ",
            "type": "video/mp4",
            "data-bitrate": 993407
          }
        ],
        "posterUrl": "https://media.licdn.com/dms/image/v2/D5605AQEMy8sAKSEIRQ/videocover-high/B56ZVOLW6FHEBs-/0/1740773364340?e=1742364000&v=beta&t=KYsp2vWcOR-f79DaFUNnojW4wilyddiahImi-cx7p34"
      },
      "date": "2025-03-05T05:02:55.516Z"
    },
    {
      "captions": "When we say “The Chef’s Challenge,” we mean it! ⏲️\n\nThis season of Table Scraps raises the stakes, so it’s only fitting that we brought in expert judges to take on the challenge! 🏆\n\nMeet Gino, Lanette, and Antonia—Bakersfield’s very own food and wine legends. With deep roots in the restaurant industry, they know a great dish when they taste one. And what better place to bring them in than Luigi’s (@Luigisbakersfield)—a Bakersfield institution for 115 years and a true cornerstone of the community. 🍝\n\nOh, and fun fact? They also happen to be John Sacco’s in-laws! We love our Luigi’s family!\n\nWill anyone WOW the judges? Find out March 14th! ♻️\n\n#TableScraps #TheChefsChallenge #RecyclingMeetsCulinary #RecyclingCommunity #FoodAndWine #Sustainability #BakersfieldEatsWhen we say “The Chef’s Challenge,” we mean it! ⏲️\n\nThis season of Table Scraps raises the stakes, so it’s only fitting that we brought in expert judges to take on the challenge! 🏆\n\nMeet Gino, Lanette, and Antonia—Bakersfield’s very own food and wine legends. With deep roots in the restaurant industry, they know a great dish when they taste one. And what better place to bring them in than Luigi’s (@Luigisbakersfield)—a Bakersfield institution for 115 years and a true cornerstone of the community. 🍝\n\nOh, and fun fact? They also happen to be John Sacco’s in-laws! We love our Luigi’s family!\n\nWill anyone WOW the judges? Find out March 14th! ♻️\n\n#TableScraps #TheChefsChallenge #RecyclingMeetsCulinary #RecyclingCommunity #FoodAndWine #Sustainability #BakersfieldEats",
      "likes": "23",
      "comments": "2",
      "shares": "3",
      "time": {
        "raw": "1h",
        "parsed": "05.03.2025",
        "isoString": "2025-03-05T05:02:55.517Z"
      },
      "mediaType": "image",
      "mediaContent": [
        "https://media.licdn.com/dms/image/v2/D5622AQHci18dt-Qeuw/feedshare-shrink_800/B56ZVOwRn8GUAg-/0/1740783035453?e=1744848000&v=beta&t=nSlXW9hYCTi_-lp1VpYA2IbS-qaXH6VA5CvChKQ3LYY",
        "https://media.licdn.com/dms/image/v2/D5622AQGCyjl7npFORw/feedshare-shrink_800/B56ZVOwRoOGUAg-/0/1740783034508?e=1744848000&v=beta&t=dTvedA690ZaTdR-S-1t95pi5Lc1Y32MsWQcBNlF4I2M",
        "https://media.licdn.com/dms/image/v2/D5622AQElwuU_v8kE-A/feedshare-shrink_800/B56ZVOwRoAGsAs-/0/1740783034459?e=1744848000&v=beta&t=Or7GvyMCmRZPEtmkflAmUV-OZ1Fyb8KCsMg9cvtSJvo",
        "https://media.licdn.com/dms/image/v2/D5622AQFeJCzrA8siGA/feedshare-shrink_800/B56ZVOwRoIHQAk-/0/1740783034273?e=1744848000&v=beta&t=exvXXtWcUxdvy61JW86bhh3R2Zhp3YGO0LWRI7vqze8",
        "https://media.licdn.com/dms/image/v2/D5622AQHXVkyoJsSfNw/feedshare-shrink_800/B56ZVOwRn8HQAk-/0/1740783034224?e=1744848000&v=beta&t=4M2OlIUBeZ3-G2evqUCI9A1PlfclAnqB2IGNrKP_kzA"
      ],
      "date": "2025-03-05T05:02:55.517Z"
    },
    {
      "captions": "Sierra® E9.6 Ecological Material Handler—built for efficiency and performance⚡️♻️\n\n✅Zero emissions & reduced noise\n\n✅ Energy Plus™ heavy-duty battery for lower operating costs\n\n✅ Unmatched mobility for safe, flexible operation \n\nDesigned for materials like nonferrous metals, cardboard, plastics, and more, the E9.6 is revolutionizing recycling operations! \n\n#SierraE96 #recyclinginnovation #sustainablesolutionsSierra® E9.6 Ecological Material Handler—built for efficiency and performance⚡️♻️\n\n✅Zero emissions & reduced noise\n\n✅ Energy Plus™ heavy-duty battery for lower operating costs\n\n✅ Unmatched mobility for safe, flexible operation \n\nDesigned for materials like nonferrous metals, cardboard, plastics, and more, the E9.6 is revolutionizing recycling operations! \n\n#SierraE96 #recyclinginnovation #sustainablesolutions",
      "likes": "6",
      "time": {
        "raw": "1h",
        "parsed": "05.03.2025",
        "isoString": "2025-03-05T05:02:55.518Z"
      },
      "mediaType": "image",
      "mediaContent": [
        "https://media.licdn.com/dms/image/v2/D5622AQEQt9YMiI8zBA/feedshare-shrink_800/B56ZVNpp3.HQAo-/0/1740764523455?e=1744848000&v=beta&t=NPDbMUtd7Vs1m0oCFexn-jBfzr-kQrsLIBv7IwyjFNQ",
        "https://media.licdn.com/dms/image/v2/D5622AQHRTBkQS4AWEQ/feedshare-shrink_800/B56ZVNpp3wHQAg-/0/1740764523383?e=1744848000&v=beta&t=1MZwndlBnTud8U5In2NT9jG2Uz1uMlTdbqB_sLaQDmE",
        "https://media.licdn.com/dms/image/v2/D5622AQEa09hKtNBilA/feedshare-shrink_800/B56ZVNpp3EGsAg-/0/1740764523601?e=1744848000&v=beta&t=8HD_LMwfnlT1_nEy9Pd0tNwLWSGIpISX_n2Y9Qk_98I",
        "https://media.licdn.com/dms/image/v2/D5622AQHSs9-YwZHSEA/feedshare-shrink_800/B56ZVNpp4CGsAk-/0/1740764522956?e=1744848000&v=beta&t=Tq7qaUDPIM6EOssgs1Jz3rBbfJ2f3jhGfuboyY07o8Y",
        "https://media.licdn.com/dms/image/v2/D5622AQFbM3f_EKo8TA/feedshare-shrink_800/B56ZVNpp38HEAg-/0/1740764523201?e=1744848000&v=beta&t=z2m25DNQvWFd0HyeuSA373DiQQIE2Mo4Hhw5s7trQs8"
      ],
      "date": "2025-03-05T05:02:55.518Z"
    },
    {
      "captions": "Meet Alton Schaubhut ♻️CMC 📌Dallas TX / New Orleans, LA 🎤Team O.G.s\n\n2/2 of the O.G.s! Alton was also a chef on Table Scraps Season 1! He’s bringing his New Oreleans flare to the Chef’s Challenge! Meeting Andrew through REMA & Season 1, they think they have what it takes to win the chef’s challenge…\n\nSee who takes home the Chef’s trophy→ March 14th! 📺Subscribe on Youtube – https://lnkd.in/gBt__iug",
      "likes": "34",
      "comments": "6",
      "shares": "1",
      "time": {
        "raw": "4g",
        "parsed": "01.03.2025",
        "isoString": "2025-03-01T10:26:01.188Z"
      },
      "mediaType": "video",
      "mediaContent": {
        "src": [
          {
            "src": "https://dms.licdn.com/playlist/vid/v2/D5605AQFjtzKx8eV8bw/mp4-720p-30fp-crf28/B56ZVNZ7erGsBg-/0/1740760419333?e=1741777200&v=beta&t=-shjIlMtNUzzvhAJ9YuhRBZhC30ZBZ-GUjzmCbHgxg8",
            "type": "video/mp4",
            "data-bitrate": 1183202
          },
          {
            "src": "https://dms.licdn.com/playlist/vid/v2/D5605AQFjtzKx8eV8bw/mp4-640p-30fp-crf28/B56ZVNZ7erGsBc-/0/1740760417437?e=1741777200&v=beta&t=sI88_NG7xAVVWUzDfM_fzvDg2aQIrUwVg4RiAL9s1o8",
            "type": "video/mp4",
            "data-bitrate": 898784
          }
        ],
        "posterUrl": "https://media.licdn.com/dms/image/v2/D5605AQFjtzKx8eV8bw/videocover-high/B56ZVNZ7erGsBs-/0/1740760413058?e=1741777200&v=beta&t=Ts4aZstH-apIHQN5kG9XYpGDELiS0tx4s8v3tUtBR48"
      },
      "date": "2025-03-01T10:26:01.188Z"
    },
    {
      "captions": "Season 2 of Table Scraps: The Chef's Challenge is almost here, bringing the recycling community together in a whole new way!\n\nBefore we fire up the kitchen again, have you watched Season 1? 🍴🥩\n\n📺 Catch up now: https://lnkd.in/gxcqsxJS",
      "likes": "13",
      "shares": "2",
      "time": {
        "raw": "5g",
        "parsed": "28.02.2025",
        "isoString": "2025-02-28T10:26:01.188Z"
      },
      "mediaType": "video",
      "mediaContent": {
        "src": [
          {
            "src": "https://dms.licdn.com/playlist/vid/v2/D5605AQEhwbt1g8Vu8w/mp4-720p-30fp-crf28/B56ZVIZVeoGsBg-/0/1740676366300?e=1741777200&v=beta&t=7n5WEc9-R3LCFmJSOoWkYVE4BsT2AcHmtiKfrFUMpCw",
            "type": "video/mp4",
            "data-bitrate": 1337622
          },
          {
            "src": "https://dms.licdn.com/playlist/vid/v2/D5605AQEhwbt1g8Vu8w/mp4-640p-30fp-crf28/B56ZVIZVeoGsBc-/0/1740676366368?e=1741777200&v=beta&t=BIVAGMJ6XD7lJYztiYUdVdOXsmgNuDquh-iAShUwpOo",
            "type": "video/mp4",
            "data-bitrate": 1014901
          }
        ],
        "posterUrl": "https://media.licdn.com/dms/image/v2/D5605AQEhwbt1g8Vu8w/feedshare-thumbnail_720_1280/B56ZVIZVeoGsA8-/0/1740676360868?e=1741777200&v=beta&t=kp7Yj_JtIY-v7wChxZOV2fVHfvhlshhxVjEgmXFTBr8"
      },
      "date": "2025-02-28T10:26:01.188Z"
    },
    {
      "captions": "Out in the yard! 🦾 Efficiency you can hear. 🔊♻️ Aluminum radiators baled and ready for recycling—another step in keeping valuable materials in the loop. #SustainableSolutions #RecyclingInAction",
      "likes": "2",
      "time": {
        "raw": "4g5g",
        "parsed": "04.03.2025",
        "isoString": "2025-03-04T10:36:41.483Z"
      },
      "mediaType": "video",
      "mediaContent": {
        "src": [
          {
            "src": "https://dms.licdn.com/playlist/vid/v2/D5605AQGrpZ2FI-kw9g/mp4-720p-30fp-crf28/B56ZVD.qEVGQBg-/0/1740602263147?e=1741690800&v=beta&t=Yt1GJ6XNo2OhiwII3NcBAieUCafSbVQ7AQxfh_xldSc",
            "type": "video/mp4",
            "data-bitrate": 1229157
          },
          {
            "src": "https://dms.licdn.com/playlist/vid/v2/D5605AQGrpZ2FI-kw9g/mp4-640p-30fp-crf28/B56ZVD.qEVGQBc-/0/1740602262071?e=1741690800&v=beta&t=yH0AoUrkqV6wxbD8xB7lBKumbZYMtnnm9lkQA0rSwvE",
            "type": "video/mp4",
            "data-bitrate": 925153
          }
        ],
        "posterUrl": "https://media.licdn.com/dms/image/v2/D5605AQGrpZ2FI-kw9g/videocover-high/B56ZVD.qEVGQBs-/0/1740602259719?e=1741690800&v=beta&t=YnLnQ2maRds0xzNd60t15mk6MStavZ_fLd9lQUPuWaY"
      },
      "date": "2025-03-04T10:36:41.483Z"
    },
    {
      "captions": "Efficiency you can hear. 🔊♻️ Aluminum radiators baled and ready for recycling—another step in keeping valuable materials in the loop. #SustainableSolutions #RecyclingInAction",
      "time": {
        "raw": "5g",
        "parsed": "27.02.2025",
        "isoString": "2025-02-27T10:36:41.484Z"
      },
      "mediaType": "video",
      "mediaContent": {
        "src": [
          {
            "src": "https://dms.licdn.com/playlist/vid/v2/D5605AQGrpZ2FI-kw9g/mp4-720p-30fp-crf28/B56ZVD.qEVGQBg-/0/1740602263147?e=1741690800&v=beta&t=Yt1GJ6XNo2OhiwII3NcBAieUCafSbVQ7AQxfh_xldSc",
            "type": "video/mp4",
            "data-bitrate": 1229157
          },
          {
            "src": "https://dms.licdn.com/playlist/vid/v2/D5605AQGrpZ2FI-kw9g/mp4-640p-30fp-crf28/B56ZVD.qEVGQBc-/0/1740602262071?e=1741690800&v=beta&t=yH0AoUrkqV6wxbD8xB7lBKumbZYMtnnm9lkQA0rSwvE",
            "type": "video/mp4",
            "data-bitrate": 925153
          }
        ],
        "posterUrl": "https://media.licdn.com/dms/image/v2/D5605AQGrpZ2FI-kw9g/videocover-high/B56ZVD.qEVGQBs-/0/1740602259719?e=1741690800&v=beta&t=YnLnQ2maRds0xzNd60t15mk6MStavZ_fLd9lQUPuWaY"
      },
      "date": "2025-02-27T10:36:41.484Z"
    },
    {
      "captions": "Meet Andrew Lincoln! ♻️Lincoln Recycling 📌Erie, PA 🎤Team O.G.s\n\nAndrew was a chef on Table Scraps Season 1! He’s back & bringing his experience to the Chef’s Challenge! John Sacco & Andrew bonded over their shared love of cooking & food. He’s teamed up with another familiar face: Alton Schaubhut to bring the heat to Bakersfield. (Missing their other teammate Michael Sciaba who couldn’t make it😔)\n\nWatch Andrew cook → March 14th! 📺 Subscribe on Youtube – link in bio!",
      "likes": "48",
      "comments": "8",
      "shares": "2",
      "time": {
        "raw": "5g",
        "parsed": "27.02.2025",
        "isoString": "2025-02-27T10:36:41.484Z"
      },
      "mediaType": "video",
      "mediaContent": {
        "src": [
          {
            "src": "https://dms.licdn.com/playlist/vid/v2/D5605AQFyH_PT1-4aYQ/mp4-720p-30fp-crf28/B56ZVDKeMsHEBk-/0/1740588604050?e=1741690800&v=beta&t=6W0hS-_ACr0Qz8ZDdudWLicFXsFcY8R5Hu_us1m2XQI",
            "type": "video/mp4",
            "data-bitrate": 892620
          },
          {
            "src": "https://dms.licdn.com/playlist/vid/v2/D5605AQFyH_PT1-4aYQ/mp4-640p-30fp-crf28/B56ZVDKeMsHEBg-/0/1740588609762?e=1741690800&v=beta&t=GDhM18yR4T5ymzMXSGwUEwWamT329MZ0hac1h_-mp4M",
            "type": "video/mp4",
            "data-bitrate": 678836
          }
        ],
        "posterUrl": "https://media.licdn.com/dms/image/v2/D5605AQFyH_PT1-4aYQ/feedshare-thumbnail_720_1280/B56ZVDKeMsHEBA-/0/1740588574536?e=1741690800&v=beta&t=cUTtjyCP-S7XDkrpm0yP7mFK6BidYjFnRcCfqcdayRQ"
      },
      "date": "2025-02-27T10:36:41.484Z"
    },
    {
      "captions": "Team OG’s- back for another year, bringing skills, experience, and a whole lot of flavor to the challenge. Are they the ones to beat? 👀\n\nPremiering March 14th—who’s hungry?🍴 \n\n🔔 Don’t miss out, subscribe on YouTube today!\n\n#TableScraps #TheChefsChallenge #RecyclingMeetsCulinary #RecyclingCommunity \nAndrew Lincoln, Alton Schaubhut",
      "likes": "14",
      "comments": "4",
      "shares": "1",
      "time": {
        "raw": "6g",
        "parsed": "26.02.2025",
        "isoString": "2025-02-26T10:36:41.485Z"
      },
      "mediaType": "video",
      "mediaContent": {
        "src": [
          {
            "src": "https://dms.licdn.com/playlist/vid/v2/D5605AQF62KDsDfihbA/mp4-720p-30fp-crf28/B56ZU.vISGGsBg-/0/1740514301701?e=1741690800&v=beta&t=5BF2i6F_RY54d0RA-oYW2_dsv5Br5v8KbVHga9hh14g",
            "type": "video/mp4",
            "data-bitrate": 936933
          },
          {
            "src": "https://dms.licdn.com/playlist/vid/v2/D5605AQF62KDsDfihbA/mp4-640p-30fp-crf28/B56ZU.vISGGsBc-/0/1740514301482?e=1741690800&v=beta&t=hT-7ZmfRbFRDOcpDe-t1cdjunnGsy7OsC8uJizVNbvk",
            "type": "video/mp4",
            "data-bitrate": 721512
          }
        ],
        "posterUrl": "https://media.licdn.com/dms/image/v2/D5605AQF62KDsDfihbA/videocover-high/B56ZU.vISGGsBs-/0/1740514300877?e=1741690800&v=beta&t=axniKWjFgLA_6fxz0IRVvUuR_rtdJJjfXgn6pGH4yHw"
      },
      "date": "2025-02-26T10:36:41.485Z"
    },
    {
      "captions": "The Sierra S5000 baler makes a compact stainless steel bale, there is nothing that competes with this unit !!! \n\n#sierrainternationalmachinery\n#scrapmetal #recycledmaterials\n#portablebaler #amplirollsystemThe Sierra S5000 baler makes a compact stainless steel bale, there is nothing that competes with this unit !!! \n\n#sierrainternationalmachinery\n#scrapmetal #recycledmaterials\n#portablebaler #amplirollsystem",
      "likes": "17",
      "shares": "1",
      "time": {
        "raw": "6g",
        "parsed": "26.02.2025",
        "isoString": "2025-02-26T10:36:41.486Z"
      },
      "mediaType": "image",
      "mediaContent": [
        "https://media.licdn.com/dms/image/v2/D4D22AQH-gASDuzg16g/feedshare-shrink_800/B4DZU.jA4nGcAk-/0/1740511126491?e=1744243200&v=beta&t=l-TSV53CSabZvgGyhMqC1hEpfK5BGu50zXl-p4___-4",
        "https://media.licdn.com/dms/image/v2/D4D22AQFuCtGh1Xccgg/feedshare-shrink_800/B4DZU.jA3bHkAk-/0/1740511126081?e=1744243200&v=beta&t=_TsUN5n6JI4oKWM8aZBtuuZRAfooNRyPlsqnjdjJLNo",
        "https://media.licdn.com/dms/image/v2/D4D22AQESkJrlDvSL4Q/feedshare-shrink_800/B4DZU.jA4SGcAg-/0/1740511125803?e=1744243200&v=beta&t=aHRlsviJCMrynWDD8g2ZoRnq_I6ld1z75L9_N81RekU"
      ],
      "date": "2025-02-26T10:36:41.486Z"
    },
    {
      "captions": "Reb-1 baler heading to recycling facility in the NE where it will be processing plastic and aluminum cans to then be repurposed into new products ♻️✅Sierra International MachineryReb-1 baler heading to recycling facility in the NE where it will be processing plastic and aluminum cans to then be repurposed into new products ♻️✅Sierra International Machinery",
      "likes": "18",
      "comments": "1",
      "shares": "1",
      "time": {
        "raw": "6g",
        "parsed": "26.02.2025",
        "isoString": "2025-02-26T10:36:41.488Z"
      },
      "mediaType": "image",
      "mediaContent": [
        "https://media.licdn.com/dms/image/v2/D4E22AQHMPZpIDfVW1Q/feedshare-shrink_800/B4EZU.TQa3H0Ak-/0/1740506992724?e=1744243200&v=beta&t=g10lkipEJhWaU2xuu88heM950_8Tv5WErJNMpYxhD2o",
        "https://media.licdn.com/dms/image/v2/D4E22AQGeeq9Dmbg4cw/feedshare-shrink_800/B4EZU.TQb9HMAg-/0/1740506993651?e=1744243200&v=beta&t=uQDeSvbQU0hdE81e8ypsE5KP_EUemcyn5inPHH5vCDw"
      ],
      "date": "2025-02-26T10:36:41.488Z"
    },
    {
      "captions": "The Sierra® RB6000: Unmatched Power & Performance. ♻️\n\nWhen it comes to baling and logging, the RB6000 sets the standard:\n\n✅ Most powerful in its class\n\n✅ Handles up to 32 tons per hour\n\n✅ Mill-spec bales & high-density logging\n\n✅ Built to last with Hardox® 450 liners\n\nWith a 170 HP Cummins Turbo Diesel Engine and an industry-leading crane, this machine is designed for maximum efficiency and reliability.\n\n📩 Ready to upgrade your operation? Reach out today!\n\n🔗 https://lnkd.in/gZ5HMB9P\n\n#RB6000 #RecyclingIndustry #HeavyMachinery #Efficiency #BuiltToWork",
      "likes": "3",
      "time": {
        "raw": "6g",
        "parsed": "26.02.2025",
        "isoString": "2025-02-26T10:36:41.489Z"
      },
      "mediaType": "video",
      "mediaContent": {
        "src": [
          {
            "src": "https://dms.licdn.com/playlist/vid/v2/D5605AQEQy8nN9Xm6ow/mp4-640p-30fp-crf28/B56ZU98dOkHEBc-/0/1740501020955?e=1741690800&v=beta&t=tGuzgwW_2mwN_4Euz-vS3dlmrnAurLodg2kRgzkLn-0",
            "type": "video/mp4",
            "data-bitrate": 1084675
          },
          {
            "src": "https://dms.licdn.com/playlist/vid/v2/D5605AQEQy8nN9Xm6ow/mp4-720p-30fp-crf28/B56ZU98dOkHEBg-/0/1740501022032?e=1741690800&v=beta&t=WpQ7HSIsKyHTVaamhWybh9Jm38X7_vT-LAK4Sz5W-48",
            "type": "video/mp4",
            "data-bitrate": 1411652
          }
        ],
        "posterUrl": "https://media.licdn.com/dms/image/v2/D5605AQEQy8nN9Xm6ow/videocover-high/B56ZU98dOkHEBs-/0/1740501019142?e=1741690800&v=beta&t=X31dmmfRVgGAz9mKHIMLEbMfPX1I9Cb4BTcs7QM6tIw"
      },
      "date": "2025-02-26T10:36:41.489Z"
    },
    {
      "captions": "Every great dish starts with a story—just like Table Scraps: The Chef’s Challenge did. 🍽️♻️\n\nJohn Sacco breaks down the ‘why’ behind this one-of-a-kind competition: bringing people from all over the world together through the shared bond of recycled materials & food. \n\nYear 2 kicked it up a notch! These foodies will be throwing down their best dishes – find out who has what it takes to win → March 14th 📆\n\n📺 Subscribe on Youtube – link in bio! \n\n#TableScraps #ChefsChallenge #Sustainability #Recycling #foodies",
      "likes": "30",
      "comments": "2",
      "shares": "3",
      "time": {
        "raw": "1h",
        "parsed": "25.02.2025",
        "isoString": "2025-02-25T10:36:41.490Z"
      },
      "mediaType": "video",
      "mediaContent": {
        "src": [
          {
            "src": "https://dms.licdn.com/playlist/vid/v2/D4D05AQGEdiQ_a81dzA/mp4-720p-30fp-crf28/B4DZU5E.7yG8Bg-/0/1740419382172?e=1741690800&v=beta&t=fhbdV0nHyXnmOO3CqNnF9izC8IA-YPfg7PBtM-CU_Ok",
            "type": "video/mp4",
            "data-bitrate": 1340348
          },
          {
            "src": "https://dms.licdn.com/playlist/vid/v2/D4D05AQGEdiQ_a81dzA/mp4-640p-30fp-crf28/B4DZU5E.7yG8Bc-/0/1740419381833?e=1741690800&v=beta&t=IprMs-yANltn799-h4PZRXvQwHW-vj8t4kRn-F8-j7c",
            "type": "video/mp4",
            "data-bitrate": 1012092
          }
        ],
        "posterUrl": "https://media.licdn.com/dms/image/v2/D4D05AQGEdiQ_a81dzA/videocover-high/B4DZU5E.7yG8Bs-/0/1740419377782?e=1741690800&v=beta&t=U550jxCclGenpeUA670zlRD0ALiW7IRn1TlJgjq92cQ"
      },
      "date": "2025-02-25T10:36:41.490Z"
    },
    {
      "captions": "🚨 Meet the competitors! 🚨\n\nThree teams. One kitchen. Who’s claiming the Table Scraps: The Chef’s Challenge title? 🍽️\n\n🏆 Team Alter Q\n🏆 Team International\n🏆 Team OG’s – the original Table Scraps chef’s are BACK!\n\nGet ready for the ultimate recycler showdown—March 14th on YouTube! Don’t miss it. Subscribe now: https://lnkd.in/gtP7jhBm\n\n#TableScraps #ChefsChallenge #RecyclingIndustry #Sustainability #Foodies",
      "likes": "39",
      "comments": "4",
      "shares": "2",
      "time": {
        "raw": "1h",
        "parsed": "25.02.2025",
        "isoString": "2025-02-25T10:36:41.491Z"
      },
      "mediaType": "video",
      "mediaContent": {
        "src": [
          {
            "src": "https://dms.licdn.com/playlist/vid/v2/D5605AQHXLPnMCZf3qQ/mp4-720p-30fp-crf28/B56ZUrBUUUGUBk-/0/1740183530582?e=1741690800&v=beta&t=gJiaIHpxFMi14MDTeCEoM1SCk7xpIGpQB8R4H6Sts1o",
            "type": "video/mp4",
            "data-bitrate": 1051350
          },
          {
            "src": "https://dms.licdn.com/playlist/vid/v2/D5605AQHXLPnMCZf3qQ/mp4-640p-30fp-crf28/B56ZUrBUUUGUBg-/0/1740183530645?e=1741690800&v=beta&t=VDH9_6hSgLBgF7YtnTqxocyM25jDtakFVnBIcEu5o7c",
            "type": "video/mp4",
            "data-bitrate": 666856
          }
        ],
        "posterUrl": "https://media.licdn.com/dms/image/v2/D5605AQHXLPnMCZf3qQ/feedshare-thumbnail_720_1280/B56ZUrBUUUGUBA-/0/1740183527026?e=1741690800&v=beta&t=tETwXng21ac-IfkdnM3smAEg627HrmV2eKs9eAVFzjg"
      },
      "date": "2025-02-25T10:36:41.491Z"
    },
    {
      "captions": "Good morning ☀️ \n\nSierra® T409 Matrial Handler | 📦 #wedotoo Sierra Recycling & DemolitionGood morning ☀️ \n\nSierra® T409 Matrial Handler | 📦 #wedotoo Sierra Recycling & Demolition",
      "likes": "4",
      "time": {
        "raw": "1h",
        "parsed": "25.02.2025",
        "isoString": "2025-02-25T10:36:41.492Z"
      },
      "mediaType": "image",
      "mediaContent": [
        "https://media.licdn.com/dms/image/v2/D5622AQFCcspWuOpP_w/feedshare-shrink_800/B56ZUqq0wbHoAg-/0/1740177625077?e=1744243200&v=beta&t=MhHSF6JvoqaFeRvMmOqIHncT_IE02y0YcwcmzVRSN1Q"
      ],
      "date": "2025-02-25T10:36:41.492Z"
    },
    {
      "captions": "Are you ready? 👀 Here’s a sneak peek at this year’s Table Scraps: The Chef’s Challenge! 🍽️\n\nWhich team of recyclers will come out on top? 🏆 \n\n🎥 Premieres March 14, 2025\n🔔 Don’t miss out—subscribe on YouTube today! https://lnkd.in/gtP7jhBm\n\n#TableScraps #ChefsChallenge #Foodies #RecyclingCommunity \n\nJohn Sacco Michael Goldstein🟦Alton Schaubhut Andrew Lincoln Michael Sciaba Abby Goldstein Patrick Young Mark Hadacek Stuart Kagan 🧿 Atilla W. Antonio Tammaro",
      "likes": "27",
      "comments": "7",
      "shares": "4",
      "time": {
        "raw": "1h",
        "parsed": "25.02.2025",
        "isoString": "2025-02-25T10:36:41.493Z"
      },
      "mediaType": "video",
      "mediaContent": {
        "src": [
          {
            "src": "https://dms.licdn.com/playlist/vid/v2/D5605AQFpG5WU9HJ5lQ/mp4-640p-30fp-crf28/B56ZUpxzssHsBc-/0/1740162694269?e=1741690800&v=beta&t=TsFI5y8-j1QkJ3P1zDCWwpfYwZ6rFleKob-AgoTeJ94",
            "type": "video/mp4",
            "data-bitrate": 928183
          },
          {
            "src": "https://dms.licdn.com/playlist/vid/v2/D5605AQFpG5WU9HJ5lQ/mp4-720p-30fp-crf28/B56ZUpxzssHsBg-/0/1740162691617?e=1741690800&v=beta&t=HG4Wa8AzIAJsectxKQhpn2hNPkFoLyEsiqB3cJPCyJM",
            "type": "video/mp4",
            "data-bitrate": 1230355
          }
        ],
        "posterUrl": "https://media.licdn.com/dms/image/v2/D5605AQFpG5WU9HJ5lQ/feedshare-thumbnail_720_1280/B56ZUpxzssHsA8-/0/1740162679332?e=1741690800&v=beta&t=O8sk2KiQaAWBSTBlOLDi8qeCS7pdLA65SzuxRqsdt8k"
      },
      "date": "2025-02-25T10:36:41.493Z"
    },
    {
      "captions": "Table Scraps is BACK—with an exciting twist! 🍽️\n\nTable Scraps: The Chef’s Challenge premieres March 14th, bringing together fellow recyclers for a fun kitchen showdown! Which team is coming out on top? 🍳🔥\n\nDon’t miss out—subscribe on YouTube today! 🎥 Link in the comments! ⬇️\n#TableScraps #ChefsChallenge #RecyclingIndustry #Sustainability #Foodie\n\n---\n\nAndrew Lincoln, Michael Sciaba, Michael Goldstein🟦, Abby Goldstein, Patrick Young, Mark Hadacek, Stuart Kagan, 🧿 Atilla W., Antonio Tammaro, Alton Schaubhut, John Sacco",
      "likes": "23",
      "comments": "5",
      "shares": "2",
      "time": {
        "raw": "1h",
        "parsed": "25.02.2025",
        "isoString": "2025-02-25T10:36:41.494Z"
      },
      "mediaType": "video",
      "mediaContent": {
        "src": [
          {
            "src": "https://dms.licdn.com/playlist/vid/v2/D5605AQE-ZM1HQUcLvw/mp4-720p-30fp-crf28/B56ZUlrkWPGoBg-/0/1740093943965?e=1741690800&v=beta&t=azXpxmtIvMsd6iOvNX6Rakw-J2emG3XUYP4hyi-RV1Y",
            "type": "video/mp4",
            "data-bitrate": 361000
          },
          {
            "src": "https://dms.licdn.com/playlist/vid/v2/D5605AQE-ZM1HQUcLvw/mp4-640p-30fp-crf28/B56ZUlrkWPGoBc-/0/1740093943736?e=1741690800&v=beta&t=-dl7EnQPsExIC0P1y7_1DrnB2WBoUjOVje3IwOVWa3c",
            "type": "video/mp4",
            "data-bitrate": 273412
          }
        ],
        "posterUrl": "https://media.licdn.com/dms/image/v2/D5605AQE-ZM1HQUcLvw/feedshare-thumbnail_720_1280/B56ZUlrkWPGoA8-/0/1740093934511?e=1741690800&v=beta&t=3tj04-9LLoDFK-U3GMc7BFJ0zMzAZeI9jSKCmsC5dZI"
      },
      "date": "2025-02-25T10:36:41.494Z"
    },
    {
      "captions": "Recycled copper retains its quality indefinitely—making it a critical material in today’s economy.\nThese bales—processed with our Sierra® REB-2—are on their way to becoming:\n\n⚡ Electrical wiring\n💻 Circuit boards\n🔧 Motors & transformers\n🚰 Plumbing systems\n🏠 Roofing & gutters\n🚗 Automotive components\n🔋 EV & battery tech\n✈️ Aerospace materials\n☀️ Renewable energy infrastructure\n\nWhen efficiency, durability, and throughput matter, the REB-2 delivers. More tons. More profit. Let’s talk.",
      "likes": "5",
      "time": {
        "raw": "1h",
        "parsed": "25.02.2025",
        "isoString": "2025-02-25T10:36:41.495Z"
      },
      "mediaType": "video",
      "mediaContent": {
        "src": [
          {
            "src": "https://dms.licdn.com/playlist/vid/v2/D5605AQEI_b6tUuM-8Q/mp4-720p-30fp-crf28/B56ZUkQ6iKGUBo-/0/1740070209849?e=1741690800&v=beta&t=Mpw0jYuScky7KZ1pka5YnTR_2h9vmBjanwW7JjwNawY",
            "type": "video/mp4",
            "data-bitrate": 1304986
          },
          {
            "src": "https://dms.licdn.com/playlist/vid/v2/D5605AQEI_b6tUuM-8Q/mp4-640p-30fp-crf28/B56ZUkQ6iKGUBk-/0/1740070209326?e=1741690800&v=beta&t=iUFaMfvGersNg7iH5jQDV4JsenjgQEC4ESkCelxRa-w",
            "type": "video/mp4",
            "data-bitrate": 992737
          }
        ],
        "posterUrl": "https://media.licdn.com/dms/image/v2/D5605AQEI_b6tUuM-8Q/feedshare-thumbnail_720_1280/B56ZUkQ6iKGUBE-/0/1740070178321?e=1741690800&v=beta&t=pwxLpMHGgTZd1U-BBcpa8L4aTpjle0F06mVc--w2bjk"
      },
      "date": "2025-02-25T10:36:41.495Z"
    },
    {
      "captions": "Sierra Recycling & Demolition is upgrading their operation, and this 2012 T1100CD shear/baler/logger is ready for a new home! \n\nKey features:\n✔️ New Floor for extended durability\n\n✔️ Rebuilt Pusher Cylinder (New Rod & Packing)\n\n✔️ (3) 125 HP Engines for maximum power\n\n✔️ New Brass Wear Plates to reduce friction and extend lifespan\n\n✔️ Shear & Pre-Compression for efficient processing\n\n🎥 Filmed: February 2025\n📍 Location: Bakersfield, CA\n📆 Delivery: March 2025\n\nWith a 29'6\" box and 14,577 hours (as of 10/14/2025) this machine is ready to go to work in your yard. Don’t miss out on this opportunity!\n\n📞 Interested? \nContact our sales team today ➡️ https://lnkd.in/gZ5HMB9P",
      "likes": "7",
      "shares": "2",
      "time": {
        "raw": "1h",
        "parsed": "24.02.2025",
        "isoString": "2025-02-24T14:17:35.295Z"
      },
      "mediaType": "video",
      "mediaContent": {
        "src": [
          {
            "src": "https://dms.licdn.com/playlist/vid/v2/D5605AQGHkczrOqncdQ/mp4-640p-30fp-crf28/B56ZUfF5BhGsBc-/0/1739983415024?e=1741618800&v=beta&t=RqdAKh_7rJvHzPcS6nnpAMSVTWGuaqU7wDo1ddW1pug",
            "type": "video/mp4",
            "data-bitrate": 883019
          },
          {
            "src": "https://dms.licdn.com/playlist/vid/v2/D5605AQGHkczrOqncdQ/mp4-720p-30fp-crf28/B56ZUfF5BhGsBg-/0/1739983416124?e=1741618800&v=beta&t=TOsKsF89Ss8MdfQ7HpRm6awtWVlfTt_x19U4JY_Iszo",
            "type": "video/mp4",
            "data-bitrate": 1159375
          }
        ],
        "posterUrl": "https://media.licdn.com/dms/image/v2/D5605AQGHkczrOqncdQ/videocover-low/B56ZUfF5BhGsCM-/0/1739983410653?e=1741618800&v=beta&t=SVnWGfjdUthmaF4X9ywDW7ZBX1EENtZ8ZFsIx0v3oL8"
      },
      "date": "2025-02-24T14:17:35.295Z"
    },
    {
      "captions": "Cutting I-beam like it’s nothing ✂️\n\nStrength. Speed. Efficiency. That's all the Sierra® T715SKL Shear/Baler/Logger knows! \n\nShear Force - 715 tons\nMain Compression - 170 tons\n\nProcesses: \n\nALL METAL\nSTAINLESS STEEL\nHMS #1 + #2 STEEL\nP&S\n\nFor more info reach out to one of our sales reps today! ➡️ https://lnkd.in/gZ5HMB9P",
      "likes": "5",
      "time": {
        "raw": "1h",
        "parsed": "24.02.2025",
        "isoString": "2025-02-24T14:17:35.296Z"
      },
      "mediaType": "video",
      "mediaContent": {
        "src": [
          {
            "src": "https://dms.licdn.com/playlist/vid/v2/D5605AQFoSPIYO-UoFQ/mp4-720p-30fp-crf28/B56ZUbc2DqHEBk-/0/1739922304647?e=1741618800&v=beta&t=jT-F8EpqjxhKTpkHqWAOOsh-GU5jeggZP2SYJGXwRCc",
            "type": "video/mp4",
            "data-bitrate": 1154348
          },
          {
            "src": "https://dms.licdn.com/playlist/vid/v2/D5605AQFoSPIYO-UoFQ/mp4-640p-30fp-crf28/B56ZUbc2DqHEBg-/0/1739922305437?e=1741618800&v=beta&t=w3mC0XKoYgdsT5d2Bo_kiXycruZULXigriQ_SdxHO1Q",
            "type": "video/mp4",
            "data-bitrate": 840865
          }
        ],
        "posterUrl": "https://media.licdn.com/dms/image/v2/D5605AQFoSPIYO-UoFQ/videocover-high/B56ZUbc2DqHEBw-/0/1739922303756?e=1741618800&v=beta&t=ZMwnP285ccy0fF3Bn809M5m4Ho2_43BYKsd5OfZuLaE"
      },
      "date": "2025-02-24T14:17:35.296Z"
    },
    {
      "captions": "Alter-Adjacent & Team Alter-Q’s secret weapon: Abby Goldstein (Michael Goldstein🟧's other half!) 📍St. Louis, MO\n\nAbby made the trip to Bakersfield for Table Scraps with Michael because of their shared love for food & their friends in the recycled materials industry! 🍽️Abby was keeping the kitchen going with mimosas & key tasks to get the dishes done in time! Tune in on March 14th to see how Team Alter-Q’s dishes turned out! 👀\n\n📺Don’t miss out! Subscribe to our YouTube channel link below!\nhttps://lnkd.in/gtP7jhBm\n\nAlter Trading",
      "likes": "27",
      "comments": "5",
      "shares": "1",
      "time": {
        "raw": "1h",
        "parsed": "05.03.2025",
        "isoString": "2025-03-05T05:02:55.513Z"
      },
      "mediaType": "video",
      "mediaContent": {
        "src": [
          {
            "src": "https://dms.licdn.com/playlist/vid/v2/D5605AQFEvBRK1Z3Fgg/mp4-720p-30fp-crf28/B56ZVdATLVHQB0-/0/1741022141910?e=1742364000&v=beta&t=HrYAa1j0YB63pp6NMAf_pOQSpAQ2frRkjd2C3_oLvxI",
            "type": "video/mp4",
            "data-bitrate": 1180291
          },
          {
            "src": "https://dms.licdn.com/playlist/vid/v2/D5605AQFEvBRK1Z3Fgg/mp4-640p-30fp-crf28/B56ZVdATLVHQBw-/0/1741022140606?e=1742364000&v=beta&t=YmDxTplS4ParnWNSLGpjQAEjua1RT-MLcr-wWQH86N0",
            "type": "video/mp4",
            "data-bitrate": 899038
          }
        ],
        "posterUrl": "https://media.licdn.com/dms/image/v2/D5605AQFEvBRK1Z3Fgg/feedshare-thumbnail_720_1280/B56ZVdATLVHQA8-/0/1741022115962?e=1742364000&v=beta&t=wrWnTmg3Zwh0CD92lIPArgFPObC1d1BLvKSZnijveVA"
      },
      "date": "2025-03-05T05:02:55.513Z"
    },
    {
      "captions": "Say hello to Michael Goldstein🟧! ♻️Alter Trading 🏆St. Louis, MO\n\nMichael & his other half Abby (who you’ll meet later today) came to the Table Scraps The Chef’s Challenge to rep Alter Trading & have some fun! Michael wasn’t so much focused on the food, but rather hyping his team up & making sure no one was caught cooking without a drink! Alter & Sierra go back many years, and we love continuing relationships in the recycled materials industry! 🤝 Cheers, Michael! 🍻\n\nTable Scraps drops March 14th → Subscribe to our Youtube Channel ⭐️ \nhttps://lnkd.in/gtP7jhBm",
      "likes": "38",
      "comments": "9",
      "shares": "1",
      "time": {
        "raw": "1h",
        "parsed": "05.03.2025",
        "isoString": "2025-03-05T05:02:55.514Z"
      },
      "mediaType": "video",
      "mediaContent": {
        "src": [
          {
            "src": "https://dms.licdn.com/playlist/vid/v2/D5605AQGzgBV3kH1iBg/mp4-640p-30fp-crf28/B56ZVc.mRxHsB0-/0/1741021701793?e=1742364000&v=beta&t=Hm2ZMEm9AJTiD00jXnVeHVEn8mpu4DSXxIdUzE2I40g",
            "type": "video/mp4",
            "data-bitrate": 776091
          },
          {
            "src": "https://dms.licdn.com/playlist/vid/v2/D5605AQGzgBV3kH1iBg/mp4-720p-30fp-crf28/B56ZVc.mRxHsB4-/0/1741021701234?e=1742364000&v=beta&t=AnVoPRP30F3XWfhpoIUtqTdlJ6i84NW_Uvqkczhnsr8",
            "type": "video/mp4",
            "data-bitrate": 1021574
          }
        ],
        "posterUrl": "https://media.licdn.com/dms/image/v2/D5605AQGzgBV3kH1iBg/feedshare-thumbnail_720_1280/B56ZVc.mRxHsBA-/0/1741021669679?e=1742364000&v=beta&t=Gmf-0BXDWRRTLRzG4OOYhsGnaNyN1Z346JklqFZjLT4"
      },
      "date": "2025-03-05T05:02:55.514Z"
    },
    {
      "captions": "The Sierra® T900 has been at the top of its class for 20+ years—and for good reason. \n\nWith a powerful yet efficient hydraulic system and a 36” throat for handling bulkier materials, this shear/baler/logger delivers unmatched productivity. 💪⚙️ \n\nAfter 16,000 hours in operation at Sierra Recycling & Demolition’s own yard, we can confidently say it’s built to perform.\n\n#MetalRecycling #SierraT900",
      "likes": "15",
      "time": {
        "raw": "1h",
        "parsed": "05.03.2025",
        "isoString": "2025-03-05T05:02:55.511Z"
      },
      "mediaType": "video",
      "mediaContent": {
        "src": [
          {
            "src": "https://dms.licdn.com/playlist/vid/v2/D5605AQHbF4ZE0gbpwA/mp4-640p-30fp-crf28/B56ZVi3bVtGUBc-/0/1741120456767?e=1742364000&v=beta&t=jEzGaLXLo7EDd_tItfEKm4RdNT-_cJ46Sylrl_pYWEk",
            "type": "video/mp4",
            "data-bitrate": 734765
          },
          {
            "src": "https://dms.licdn.com/playlist/vid/v2/D5605AQHbF4ZE0gbpwA/mp4-720p-30fp-crf28/B56ZVi3bVtGUBg-/0/1741120457286?e=1742364000&v=beta&t=arvrZG6MH-KL8qTN6TdSZ1VxIzqXqNG8XNrR_HmSRr8",
            "type": "video/mp4",
            "data-bitrate": 1001282
          }
        ],
        "posterUrl": "https://media.licdn.com/dms/image/v2/D5605AQHbF4ZE0gbpwA/videocover-high/B56ZVi3bVtGUBs-/0/1741120455061?e=1742364000&v=beta&t=cLZ3oNuuUWRzZZeOMJmbyu7PNWf1K0wiJYhdaavTj9A"
      },
      "date": "2025-03-05T05:02:55.511Z"
    },
    {
      "captions": "Table Scraps🍽️: The Chef’s Challenge is a celebration of the relationships that fuel the recycling community—the shared experiences, the friendly rivalries, and the moments that bring us together.\n\nAnd at the end of the day? It’s just great food and even better company. \n\nSwipe through for a glimpse behind the scenes, and don’t miss Season 2—premiering March 14th!\n\n——\n\nJohn Sacco 🧿 Atilla W. Antonio Tammaro Stuart Kagan Andrew Lincoln Alton Schaubhut Patrick Young Mark Hadacek Michael Goldstein🟧 Abby Goldstein Giovanna SaccoTable Scraps🍽️: The Chef’s Challenge is a celebration of the relationships that fuel the recycling community—the shared experiences, the friendly rivalries, and the moments that bring us together.\n\nAnd at the end of the day? It’s just great food and even better company. \n\nSwipe through for a glimpse behind the scenes, and don’t miss Season 2—premiering March 14th!\n\n——\n\nJohn Sacco 🧿 Atilla W. Antonio Tammaro Stuart Kagan Andrew Lincoln Alton Schaubhut Patrick Young Mark Hadacek Michael Goldstein🟧 Abby Goldstein Giovanna Sacco",
      "likes": "39",
      "comments": "5",
      "shares": "2",
      "time": {
        "raw": "1h",
        "parsed": "05.03.2025",
        "isoString": "2025-03-05T05:02:55.512Z"
      },
      "mediaType": "image",
      "mediaContent": [
        "https://media.licdn.com/dms/image/v2/D5622AQHOTgZHPpl_Rw/feedshare-shrink_800/B56ZVdg2FnGoAg-/0/1741030662433?e=1744848000&v=beta&t=F-rqA03gQI2nRHoxuv7IYcS43cCWQ1DrZpODth70RIY",
        "https://media.licdn.com/dms/image/v2/D5622AQEUY9wRhZc4fg/feedshare-shrink_800/B56ZVdg2FEHQAg-/0/1741030656895?e=1744848000&v=beta&t=sHbtbcu1ljrMvidmtrl3WKoO1OJKZ7z7_FGJmjN2Fts",
        "https://media.licdn.com/dms/image/v2/D5622AQFgh5qmSj9CUw/feedshare-shrink_800/B56ZVdg2FCGsAo-/0/1741030662916?e=1744848000&v=beta&t=1rFBn-oyFc6UWqjtNHSP_ilQD9vgNs_5hp0NmJWHBCw",
        "https://media.licdn.com/dms/image/v2/D5622AQFNzxMwoPT1sQ/feedshare-shrink_800/B56ZVdg2F7GQAg-/0/1741030658375?e=1744848000&v=beta&t=9P1a6pQY179mqw2iBxXtUWaVsPziCwr-jDIGcMPKekU",
        "https://media.licdn.com/dms/image/v2/D5622AQErNAxB4ZeliA/feedshare-shrink_800/B56ZVdg2GPHEAk-/0/1741030656798?e=1744848000&v=beta&t=SdX69gK0pWR59nF31rhWaW3DOJEh4gJWTjIp_BFcIfE"
      ],
      "date": "2025-03-05T05:02:55.512Z"
    },
    {
      "captions": "In the aftermath of the devastating Palisades Fire, our hearts go out to all those affected. As recovery efforts continue, one of Sierra®'s RB6000 portable baler/loggers is on the ground in the Palisades, assisting in the cleanup and recycling efforts. \n\nWhat was lost can find new life through the recycling and repurposing of materials!\n\n#lafires #palisades #rebuildpalisadesIn the aftermath of the devastating Palisades Fire, our hearts go out to all those affected. As recovery efforts continue, one of Sierra®'s RB6000 portable baler/loggers is on the ground in the Palisades, assisting in the cleanup and recycling efforts. \n\nWhat was lost can find new life through the recycling and repurposing of materials!\n\n#lafires #palisades #rebuildpalisades",
      "likes": "14",
      "shares": "4",
      "time": {
        "raw": "5g",
        "parsed": "12.03.2025",
        "isoString": "2025-03-12T05:04:17.144Z"
      },
      "mediaType": "image",
      "mediaContent": [
        "https://media.licdn.com/dms/image/v2/D5610AQHq2TRKohKQTw/image-shrink_800/B56ZWHeczYHQAg-/0/1741734662424?e=1742796000&v=beta&t=Ctt71I0OMo8Q9X-6rAtvItQQIPDnRPuMPps6nyWvYyU",
        "https://media.licdn.com/dms/image/v2/D5610AQGiw-y-zOO6Mg/image-shrink_800/B56ZWHec.2HEAc-/0/1741734662523?e=1742796000&v=beta&t=-j14hByi3QzO3tZz4_m4J-ECsdcOR00Jliy_SP96B2I",
        "https://media.licdn.com/dms/image/v2/D5610AQE2MSJGMctn7Q/image-shrink_800/B56ZWHedHiHEAc-/0/1741734663732?e=1742796000&v=beta&t=RPytQKgtT7JKx0C3hwsHO9fMs_qfj-PJhL4pkVdm3ss",
        "https://media.licdn.com/dms/image/v2/D5610AQEG9Y50isWlAg/image-shrink_800/B56ZWHedV.HEAc-/0/1741734666077?e=1742796000&v=beta&t=7VauGEgpU0wqML8-cg5h8kgH0sEuzcotUWorDasJItU",
        "https://media.licdn.com/dms/image/v2/D5610AQGjbbT2uszeJA/image-shrink_800/B56ZWHedl0GoAc-/0/1741734665524?e=1742796000&v=beta&t=gpJSK5Tk__8_UfY2CDn5XHw1aD_IFUHc_fsrPB8_GLQ"
      ],
      "date": "2025-03-12T05:04:17.144Z"
    },
    {
      "captions": "Next up on Team International:  🧿 Atilla W. 📍Singapore 🤝 Navigate Commodities \n\nAtilla met John Sacco in Copenhagen at the B.I.R. after his impactful presentation! He knows the importance of changing the narrative around the Recycled Materials Industry! AND he also loves to cook 🍽️ Team International is excited about this meal full of Italian influence. We can’t wait to watch this unfold → 3 DAYS! Table Scraps: The Chef’s Challenge coming Friday March 14 on our YouTube Channel! \n\n📺 Subscribe on YouTube: https://lnkd.in/gtP7jhBm",
      "likes": "34",
      "comments": "7",
      "shares": "1",
      "time": {
        "raw": "5g",
        "parsed": "12.03.2025",
        "isoString": "2025-03-12T05:04:17.145Z"
      },
      "mediaType": "video",
      "mediaContent": {
        "src": [
          {
            "src": "https://dms.licdn.com/playlist/vid/v2/D5610AQH0lBXBqxVkRg/mp4-640p-30fp-crf28/B56ZWGkFgcGUBs-/0/1741719370654?e=1742796000&v=beta&t=m403AowMgvJPNWYUi8nR94foAIfqF_q_9UcdMpTIxjA",
            "type": "video/mp4",
            "data-bitrate": 914841
          },
          {
            "src": "https://dms.licdn.com/playlist/vid/v2/D5610AQH0lBXBqxVkRg/mp4-360p-30fp-crf28/B56ZWGkFgcGUBo-/0/1741719368494?e=1742796000&v=beta&t=2jk5Y-3AogwiaPsZzAfil5ojhl99iRk0sm0pR9Q26as",
            "type": "video/mp4",
            "data-bitrate": 402170
          },
          {
            "src": "https://dms.licdn.com/playlist/vid/v2/D5610AQH0lBXBqxVkRg/mp4-720p-30fp-crf28/B56ZWGkFgcGUBw-/0/1741719370997?e=1742796000&v=beta&t=J4wq8uO2AYslFWErqvh5KN1A7rIHTKCvABVJuV4aITM",
            "type": "video/mp4",
            "data-bitrate": 1229916
          }
        ],
        "posterUrl": "https://media.licdn.com/dms/image/v2/D5610AQH0lBXBqxVkRg/ads-video-thumbnail_720_1280/B56ZWGkFgcGUAc-/0/1741719365126?e=1742796000&v=beta&t=qHoGYf-dqDwr_yj2KYmPWSLHOLsh1H-AyZ8pEVHB5z4"
      },
      "date": "2025-03-12T05:04:17.145Z"
    },
    {
      "captions": "Make sure you say hi 👋 to Cameron Keefe and Tom Jansen at C&D World Conference + Expo - Booth #7!\nSierra International Machinery is proudly exhibiting at the Construction & Demolition Recycling Association (CDRA)’s event C&D World Conference in Dallas, TX. \n\nStop by booth 7 to learn how our two-ram balers and material handlers can help your operations today! \n\n#machinery #networking #TheSierraWaySierra International Machinery is proudly exhibiting at the Construction & Demolition Recycling Association (CDRA)’s event C&D World Conference in Dallas, TX. \n\nStop by booth 7 to learn how our two-ram balers and material handlers can help your operations today! \n\n#machinery #networking #TheSierraWay",
      "time": {
        "raw": "5g5g",
        "parsed": "17.03.2025",
        "isoString": "2025-03-17T05:04:17.146Z"
      },
      "mediaType": "image",
      "mediaContent": [
        "https://media.licdn.com/dms/image/v2/D4E22AQFr4CnA9GSMRw/feedshare-shrink_800/B4EZWGgy2cGwAg-/0/1741718507530?e=1744848000&v=beta&t=f0ZqEZIihUTIJF3pWkwrMvqQcBiEYAfMiu6C6RN7J4c"
      ],
      "date": "2025-03-17T05:04:17.146Z"
    },
    {
      "captions": "Sierra International Machinery is proudly exhibiting at the Construction & Demolition Recycling Association (CDRA)’s event C&D World Conference in Dallas, TX. \n\nStop by booth 7 to learn how our two-ram balers and material handlers can help your operations today! \n\n#machinery #networking #TheSierraWaySierra International Machinery is proudly exhibiting at the Construction & Demolition Recycling Association (CDRA)’s event C&D World Conference in Dallas, TX. \n\nStop by booth 7 to learn how our two-ram balers and material handlers can help your operations today! \n\n#machinery #networking #TheSierraWay",
      "time": {
        "raw": "5g",
        "parsed": "12.03.2025",
        "isoString": "2025-03-12T05:04:17.147Z"
      },
      "mediaType": "image",
      "mediaContent": [
        "https://media.licdn.com/dms/image/v2/D4E22AQFr4CnA9GSMRw/feedshare-shrink_800/B4EZWGgy2cGwAg-/0/1741718507530?e=1744848000&v=beta&t=f0ZqEZIihUTIJF3pWkwrMvqQcBiEYAfMiu6C6RN7J4c"
      ],
      "date": "2025-03-12T05:04:17.147Z"
    },
    {
      "captions": "Sierra, Nuestra 409, perfecto complemento para tus operaciones, movimientos de materiales, carga de maquinaria, rapidez de carga y descarga de góndolas,Sierra, Nuestra 409, perfecto complemento para tus operaciones, movimientos de materiales, carga de maquinaria, rapidez de carga y descarga de góndolas,",
      "likes": "9",
      "shares": "1",
      "time": {
        "raw": "5g",
        "parsed": "12.03.2025",
        "isoString": "2025-03-12T05:04:17.148Z"
      },
      "mediaType": "image",
      "mediaContent": [
        "https://media.licdn.com/dms/image/v2/D4E22AQHBiz7d_tYzQw/feedshare-shrink_800/B4EZWFt7DPHMAo-/0/1741705166334?e=1744848000&v=beta&t=oRIO44iQJkni-B0woXaTQeOoNTXZ603iA3ynun1brIs"
      ],
      "date": "2025-03-12T05:04:17.148Z"
    },
    {
      "captions": "Our Buddy: Stuart Kagan! 📍ATX ♻️BUDDY - Born Scrappy \n\nStuart is a long time ‘buddy’ of Sierra! We have appreciated his love & support since day 1! 🌎\n\nStuart called his friends from all around the world to compete in Table Scraps! Team International is bringing their fresh & light flavors to try & win the Italian judges tastebuds over. THIS FRIDAY! MARCH 14! Don’t miss the dishes that Team INT puts together (😱) \n\n📺 Subscribe on YouTube: https://lnkd.in/dSqJ4r8m",
      "likes": "27",
      "comments": "2",
      "shares": "1",
      "time": {
        "raw": "6g",
        "parsed": "11.03.2025",
        "isoString": "2025-03-11T05:04:17.149Z"
      },
      "mediaType": "video",
      "mediaContent": {
        "src": [
          {
            "src": "https://dms.licdn.com/playlist/vid/v2/D4D05AQEXILkeqVAEuw/mp4-720p-30fp-crf28/B4DZWCAwyKHIBo-/0/1741643023900?e=1742796000&v=beta&t=hNLQ9NlM5oh3zRajwnnECWj7vi1_hNuPAYN5d2GBfdk",
            "type": "video/mp4",
            "data-bitrate": 1091350
          },
          {
            "src": "https://dms.licdn.com/playlist/vid/v2/D4D05AQEXILkeqVAEuw/mp4-640p-30fp-crf28/B4DZWCAwyKHIBk-/0/1741643023675?e=1742796000&v=beta&t=gyeqnH98OhRQ2FQ1OrHTcPJSpzwzyeMil2uJ57-eouk",
            "type": "video/mp4",
            "data-bitrate": 820813
          }
        ],
        "posterUrl": "https://media.licdn.com/dms/image/v2/D4D05AQEXILkeqVAEuw/videocover-high/B4DZWCAwyKHIB0-/0/1741643017706?e=1742796000&v=beta&t=JpXLxdcsdJAfBn4zC6Qp028uc3czrgOU4Vk78uznRSc"
      },
      "date": "2025-03-11T05:04:17.149Z"
    },
    {
      "captions": "Got milk?🥛\n\nThe Sierra® REB-4 makes quick work of plastic, turning loose material into dense, high-quality bales. With its patented dual-compression doors, rollback is eliminated—meaning more efficient baling! ♻️ \n\nAvailable with either a 150 or 250 HP power unit, it's built for high production and versatility. From plastics to non-ferrous metals, tires, and fiber, the REB-4 delivers the performance recyclers need.",
      "likes": "7",
      "time": {
        "raw": "1h",
        "parsed": "10.03.2025",
        "isoString": "2025-03-10T05:04:17.150Z"
      },
      "mediaType": "video",
      "mediaContent": {
        "src": [
          {
            "src": "https://dms.licdn.com/playlist/vid/v2/D5610AQEfvSwIe0yPZg/mp4-360p-30fp-crf28/B56ZV7.0poHoBo-/0/1741541830059?e=1742796000&v=beta&t=07KeC5M9a1wQB2m1Mf5YGZ18cRtnA-6Vz0zWzMNlAI0",
            "type": "video/mp4",
            "data-bitrate": 311246
          },
          {
            "src": "https://dms.licdn.com/playlist/vid/v2/D5610AQEfvSwIe0yPZg/mp4-720p-30fp-crf28/B56ZV7.0poHoBw-/0/1741541829536?e=1742796000&v=beta&t=HBi873QIT10LSPs9-J68vjY88QV7oliidJaexm0S82o",
            "type": "video/mp4",
            "data-bitrate": 905533
          },
          {
            "src": "https://dms.licdn.com/playlist/vid/v2/D5610AQEfvSwIe0yPZg/mp4-640p-30fp-crf28/B56ZV7.0poHoBs-/0/1741541831126?e=1742796000&v=beta&t=YKHBwyb5-vDXvPi-qWMjoev8EpJ3jH0oR9pPKihmc-I",
            "type": "video/mp4",
            "data-bitrate": 693096
          }
        ],
        "posterUrl": "https://media.licdn.com/dms/image/v2/D5610AQEfvSwIe0yPZg/ads-video-thumbnail_720_1280/B56ZV7.0poHoAc-/0/1741541824859?e=1742796000&v=beta&t=zI9dYOmJsTuR92_G2BD17UaZ3V3j0q99RpS6mR3I58I"
      },
      "date": "2025-03-10T05:04:17.150Z"
    },
    {
      "captions": "Will Team International’s 🇿🇦 🇮🇹 🇸🇬  global experience give them the upper hand, or will they get lost in translation? 👀\n\nFind out when Table Scraps returns for The Chef’s Challenge on March 14th!\n\nDrop a 🌍 if you’re backing Team International! \n\nAntonio Tammaro Stuart Kagan 🧿 Atilla W. John Sacco",
      "likes": "7",
      "comments": "1",
      "time": {
        "raw": "1h",
        "parsed": "10.03.2025",
        "isoString": "2025-03-10T05:04:17.151Z"
      },
      "mediaType": "video",
      "mediaContent": {
        "src": [
          {
            "src": "https://dms.licdn.com/playlist/vid/v2/D5610AQEf8lsH30KVzg/mp4-640p-30fp-crf28/B56ZV7.0qUHoBo-/0/1741541825734?e=1742796000&v=beta&t=3-7jmaJEOYQ73-TABhaqYd1sL4aZkrjETwO7mYKkiPE",
            "type": "video/mp4",
            "data-bitrate": 1059096
          },
          {
            "src": "https://dms.licdn.com/playlist/vid/v2/D5610AQEf8lsH30KVzg/mp4-360p-30fp-crf28/B56ZV7.0qUHoBk-/0/1741541825478?e=1742796000&v=beta&t=O2CgMnvQm6CEUrzeXa2wZUsHQOTczwmtwMKWOLyY2zw",
            "type": "video/mp4",
            "data-bitrate": 453594
          },
          {
            "src": "https://dms.licdn.com/playlist/vid/v2/D5610AQEf8lsH30KVzg/mp4-720p-30fp-crf28/B56ZV7.0qUHoBs-/0/1741541825863?e=1742796000&v=beta&t=BHD54-JSh_74L3KLc25PPCI-SEhAE1h34wCoqTshvTw",
            "type": "video/mp4",
            "data-bitrate": 1387393
          }
        ],
        "posterUrl": "https://media.licdn.com/dms/image/v2/D5610AQEf8lsH30KVzg/ads-video-thumbnail_720_1280/B56ZV7.0qUHoAY-/0/1741541823936?e=1742796000&v=beta&t=vPLOBm0skX9ABylmrd19Bzf7eM3Fozs4v8mrEiwWRzw"
      },
      "date": "2025-03-10T05:04:17.151Z"
    },
    {
      "captions": "Something about that Sierra® red & yellow!🔥 | REB-8 Two-Ram BalerSomething about that Sierra® red & yellow!🔥 | REB-8 Two-Ram Baler",
      "likes": "16",
      "shares": "1",
      "time": {
        "raw": "1h",
        "parsed": "10.03.2025",
        "isoString": "2025-03-10T05:04:17.152Z"
      },
      "mediaType": "image",
      "mediaContent": [
        "https://media.licdn.com/dms/image/v2/D5610AQHzAri0Bt2X_w/image-shrink_800/B56ZVyKU1eHQAg-/0/1741377064948?e=1742796000&v=beta&t=dBGafveIqN_cqD7OC0-DeBLnT-B8fiTcWonPjExQMvo",
        "https://media.licdn.com/dms/image/v2/D5610AQFNm4YGbXjm0g/image-shrink_800/B56ZVyKVADGQAc-/0/1741377065670?e=1742796000&v=beta&t=8rJjJ6Gu5pa-3Bg4HqvDGRg9hs8y5pvoAJ_T5k7AfzI",
        "https://media.licdn.com/dms/image/v2/D5610AQGOJ9Ld2K2W9Q/image-shrink_800/B56ZVyKVMGHQAg-/0/1741377066156?e=1742796000&v=beta&t=wjhKUOOHAt_5oM-R5p2KXuYjAf1aRTbd7CLMpqGTs8g",
        "https://media.licdn.com/dms/image/v2/D5610AQGQlsn5t_WKoA/image-shrink_800/B56ZVyKVUIHsAc-/0/1741377066602?e=1742796000&v=beta&t=UNwu5X7FjRQsBIkQAP5XhAvlo0Wkj_YpHZYjxnQxhck",
        "https://media.licdn.com/dms/image/v2/D5610AQF8Kl9tFLJ0tA/image-shrink_800/B56ZVyKVckGsAc-/0/1741377067942?e=1742796000&v=beta&t=HAsTF3doDOPT18dTOK7xJj42ni06nIfGaMsV-kiZkwU"
      ],
      "date": "2025-03-10T05:04:17.152Z"
    },
    {
      "captions": "Almost 20 years old and still plays a vital role. This T500 has been through hurricanes, blazing summers and even snow/ice storms. This durability is what customers have come to expect from Sierra International Machinery !Almost 20 years old and still plays a vital role. This T500 has been through hurricanes, blazing summers and even snow/ice storms. This durability is what customers have come to expect from Sierra International Machinery !",
      "likes": "25",
      "comments": "1",
      "shares": "1",
      "time": {
        "raw": "1h",
        "parsed": "10.03.2025",
        "isoString": "2025-03-10T05:04:17.153Z"
      },
      "mediaType": "image",
      "mediaContent": [
        "https://media.licdn.com/dms/image/v2/D4E22AQG78WdwLkmEbg/feedshare-shrink_800/B4EZVxn9uMH0Ak-/0/1741368062355?e=1744848000&v=beta&t=HmEa7XtLv0-6__Nc05X_EQsZwHVhzMj8Qf28e7AZcMM"
      ],
      "date": "2025-03-10T05:04:17.153Z"
    },
    {
      "captions": "The Sierra® REB-8 two-ram baler is built for maximum performance—offering greater input density in the charging chamber and minimizing material shearing by 90% when the doors are fully closed.\n\nWhat does this mean for your operation?\n\n✔ Reduced shear and hydraulic shock for smoother operation\n\n✔ Less stress on blades and structure, extending machine life\n\n✔ Lower energy costs, increasing efficiency and profitability\n\nWhen it comes to performance, the REB-8 is built to last and engineered to perform. \n\n#SierraInternationalMachinery #REB8 #RecyclingMachinery #BalingEfficiency #SustainableSolutions #IndustrialEquipment",
      "likes": "2",
      "time": {
        "raw": "1h",
        "parsed": "10.03.2025",
        "isoString": "2025-03-10T05:04:17.154Z"
      },
      "mediaType": "video",
      "mediaContent": {
        "src": [
          {
            "src": "https://dms.licdn.com/playlist/vid/v2/D5605AQEqLMytWl6G6A/mp4-640p-30fp-crf28/B56ZVtIg1kHQBc-/0/1741292707872?e=1742796000&v=beta&t=uRfSHMLetVP9VnKlEOF4S5qA3rMZzhASXkuAotzv1l4",
            "type": "video/mp4",
            "data-bitrate": 809318
          }
        ],
        "posterUrl": "https://media.licdn.com/dms/image/v2/D5605AQEqLMytWl6G6A/videocover-high/B56ZVtIg1kHQBs-/0/1741292706072?e=1742796000&v=beta&t=fd9wGZTeYaAbDlzSntleVuYskXSPpz5JugugIrsbL6Q"
      },
      "date": "2025-03-10T05:04:17.154Z"
    },
    {
      "captions": "Last but not least on Team Alter-Q: Patrick Young  📍Milwakee, WI 🤝Alter Trading \n\nPatrick is another certified foodie that brought his cooking game to CA! The dishes that Patrick makes on this season of Table Scraps will make your mouth water! From his speciality cut of meat to his incredible appetizer, you’re not going to want to miss Team Alter-Q’s meal.\n\nThanks for the sneak peak, Patrick! 🍽️\n\nSubscribe now on YouTube → almost 1 week away! 📺March 14th\n\nhttps://lnkd.in/gvnu-_id",
      "likes": "29",
      "comments": "7",
      "time": {
        "raw": "5g",
        "parsed": "07.03.2025",
        "isoString": "2025-03-07T05:02:55.509Z"
      },
      "mediaType": "video",
      "mediaContent": {
        "src": [
          {
            "src": "https://dms.licdn.com/playlist/vid/v2/D5605AQHPYW0ZGrkbDQ/mp4-720p-30fp-crf28/B56ZVsLysZGoBo-/0/1741276802910?e=1742364000&v=beta&t=vncWD1fZclzinB0tBb4cILyJiQgd61lUKduIpCSlwpk",
            "type": "video/mp4",
            "data-bitrate": 876646
          },
          {
            "src": "https://dms.licdn.com/playlist/vid/v2/D5605AQHPYW0ZGrkbDQ/mp4-640p-30fp-crf28/B56ZVsLysZGoBk-/0/1741276802208?e=1742364000&v=beta&t=g-OfXGveHsG4pnsmjEOtAOq8EQftJwmTH2F_D8VJrL0",
            "type": "video/mp4",
            "data-bitrate": 672227
          }
        ],
        "posterUrl": "https://media.licdn.com/dms/image/v2/D5605AQHPYW0ZGrkbDQ/videocover-high/B56ZVsLysZGoB0-/0/1741276797082?e=1742364000&v=beta&t=2Iw139IVhNmHMucgS1WT_4QN2nJgrnQ0k_VkzF3RViw"
      },
      "date": "2025-03-07T05:02:55.509Z"
    },
    {
      "captions": "Next Up on Team Alter-Q: Mark Hadacek  📍Milwaukee, WI\n\nMark lives to eat, not eating to live: certified foodie 🫡 Mark brought his prized black truffles for his porcini risotto… Let’s see if it gives team Alter-Q the edge with the judges!\n\nMark’s in the business of making good food – subscribe to Table Scraps on our YouTube channel → coming March 14th ♻️\nhttps://lnkd.in/g-VSPrHf \n\nAlter Trading John Sacco",
      "likes": "24",
      "comments": "3",
      "shares": "2",
      "time": {
        "raw": "6g",
        "parsed": "06.03.2025",
        "isoString": "2025-03-06T05:02:55.510Z"
      },
      "mediaType": "video",
      "mediaContent": {
        "src": [
          {
            "src": "https://dms.licdn.com/playlist/vid/v2/D5605AQENE_OSvk5dHQ/mp4-640p-30fp-crf28/B56ZVnMK6fHQBs-/0/1741193015652?e=1742364000&v=beta&t=CGoBqF0aMKCfZ4GWzTwVxxrMC-esc95SPg3RdpXMUo4",
            "type": "video/mp4",
            "data-bitrate": 812346
          },
          {
            "src": "https://dms.licdn.com/playlist/vid/v2/D5605AQENE_OSvk5dHQ/mp4-720p-30fp-crf28/B56ZVnMK6fHQBw-/0/1741193016446?e=1742364000&v=beta&t=H6-eTilX9AOUtNyE30vzjMNKWbpJSWAp8dBz9hMaAnQ",
            "type": "video/mp4",
            "data-bitrate": 1061646
          }
        ],
        "posterUrl": "https://media.licdn.com/dms/image/v2/D5605AQENE_OSvk5dHQ/videocover-high/B56ZVnMK6fHQB8-/0/1741193012033?e=1742364000&v=beta&t=PGYclnPP2Jucf7NUYki2ICibBs0fLJCPsJbkl9-zmyI"
      },
      "date": "2025-03-06T05:02:55.510Z"
    },
    {
      "captions": "Built for recycled metal processors currently handling 25 to 50 tons per day—and ready to boost their production even further—the Sierra® S5000 portable baler/logger is for you!\n\nWith its eject door, remote control capabilities (excluding crane), and optimized chamber design, the S5000 is small but mighty! ⚡️\n\nReach out today for more info! 📲 https://lnkd.in/gZ5HMB9P",
      "likes": "5",
      "time": {
        "raw": "4g",
        "parsed": "13.03.2025",
        "isoString": "2025-03-13T05:04:17.139Z"
      },
      "mediaType": "video",
      "mediaContent": {
        "src": [
          {
            "src": "https://dms.licdn.com/playlist/vid/v2/D5610AQGRjDw90b3vnA/mp4-360p-30fp-crf28/B56ZWMDMxRHEBo-/0/1741811409883?e=1742796000&v=beta&t=VclGH4sSmChy5B94K3Ph0_YKFzIg_EAV-eTzU4mimic",
            "type": "video/mp4",
            "data-bitrate": 382557
          },
          {
            "src": "https://dms.licdn.com/playlist/vid/v2/D5610AQGRjDw90b3vnA/mp4-720p-30fp-crf28/B56ZWMDMxRHEBw-/0/1741811410274?e=1742796000&v=beta&t=Ro51M8dcplv1ydVq8TumCRBMtGYazIulDcZMkiRuKHo",
            "type": "video/mp4",
            "data-bitrate": 1198643
          },
          {
            "src": "https://dms.licdn.com/playlist/vid/v2/D5610AQGRjDw90b3vnA/mp4-640p-30fp-crf28/B56ZWMDMxRHEBs-/0/1741811410192?e=1742796000&v=beta&t=Y9C8ecYteQDwZs5hx8ZSiVR6usoOQbNoapYTWtOvICE",
            "type": "video/mp4",
            "data-bitrate": 880897
          }
        ],
        "posterUrl": "https://media.licdn.com/dms/image/v2/D5610AQGRjDw90b3vnA/ads-video-thumbnail_720_1280/B56ZWMDMxRHEAc-/0/1741811405508?e=1742796000&v=beta&t=g_jr91DFSpzlvZIIwDD0MnZtaIiKeXAsZ6FsVUaiRxo"
      },
      "date": "2025-03-13T05:04:17.139Z"
    },
    {
      "captions": "Last but certainly not least, meet Antonio who came from Italy (with his tomatoes) to cook for Table Scraps! 🇮🇹🍝📍Napoli ♻️ Tammaro Metalli | Recycled Materials Industry\n\nAntonio felt the love immediately with the cast & crew; everyone together on this Table Scraps: Chef’s Challenge team has a true bond! 🍽️\n\nTHIS FRIDAY watch Antonio bring his Italian flare to Table Scraps 🔥You’re not going to want to miss this → Subscribe to our YouTube channel 📺 Link in Bio 📺",
      "likes": "15",
      "comments": "2",
      "time": {
        "raw": "13s",
        "parsed": "12.03.2025",
        "isoString": "2025-03-12T17:51:16.841Z"
      },
      "mediaType": "video",
      "mediaContent": {
        "src": [
          {
            "src": "https://dms.licdn.com/playlist/vid/v2/D5610AQGgWCLcTfr0eQ/mp4-720p-30fp-crf28/B56ZWLcSOrHsBs-/0/1741801212191?e=1742454000&v=beta&t=7_RxstqelXtpPiwYu6kSJnUkQsE6C6y2C0Hu-r4NIq4",
            "type": "video/mp4",
            "data-bitrate": 981367
          },
          {
            "src": "https://dms.licdn.com/playlist/vid/v2/D5610AQGgWCLcTfr0eQ/mp4-640p-30fp-crf28/B56ZWLcSOrHsBo-/0/1741801212043?e=1742454000&v=beta&t=C-6uJdoELcWR6f8-vtOWyD1Qh4cgzKBa1OA6WXDDp9U",
            "type": "video/mp4",
            "data-bitrate": 704143
          },
          {
            "src": "https://dms.licdn.com/playlist/vid/v2/D5610AQGgWCLcTfr0eQ/mp4-360p-30fp-crf28/B56ZWLcSOrHsBk-/0/1741801210197?e=1742454000&v=beta&t=5isrbiiWw-L1wMf26oB6qxsMdu3_UeLJbFGieH2Jmek",
            "type": "video/mp4",
            "data-bitrate": 303775
          }
        ],
        "posterUrl": "https://media.licdn.com/dms/image/v2/D5610AQGgWCLcTfr0eQ/ads-video-thumbnail_720_1280/B56ZWLcSOrHsAY-/0/1741801206096?e=1742454000&v=beta&t=LjrvLN0nXr5Fnvs4NcvDacUOZIc3BDcnLjkQFNSzfoc"
      },
      "date": "2025-03-12T17:51:16.841Z"
    },
    {
      "captions": "In case you missed it - Table Scraps🍽️: The Chef's Challenge is out NOW watch on YouTube!\n\n📲 https://lnkd.in/gbJtFDycIn case you missed it - Table Scraps🍽️: The Chef's Challenge is out NOW watch on YouTube!\n\n📲 https://lnkd.in/gbJtFDyc",
      "likes": "15",
      "shares": "1",
      "time": {
        "raw": "3h",
        "parsed": "17.03.2025",
        "isoString": "2025-03-17T05:38:51.154Z"
      },
      "mediaType": "image",
      "mediaContent": [
        "https://media.licdn.com/dms/image/v2/D5610AQE_KYtmO1zHpA/image-shrink_800/B56ZWgAznQHsAk-/0/1742146321512?e=1744610400&v=beta&t=H4fvAMtzT_errSrTJD2pD334JksYj8m5T9oqOp1gVlk"
      ],
      "date": "2025-03-17T05:38:51.154Z"
    },
    {
      "captions": "Watch NOW on YouTube‼️ \nFind out which team has what it takes to impress the judges! 🍽️🤤\n\nTable Scraps: The Chef’s Challenge 🏆 streaming now! 🎥 https://bit.ly/4irfUPC\n\nJohn Sacco 🧿 Atilla W. Antonio Tammaro Stuart Kagan Andrew Lincoln Alton Schaubhut Patrick Young Mark Hadacek Michael Goldstein🟧 Andrew Sacchini",
      "likes": "23",
      "shares": "2",
      "time": {
        "raw": "3h",
        "parsed": "17.03.2025",
        "isoString": "2025-03-17T05:38:51.156Z"
      },
      "mediaType": "video",
      "mediaContent": {
        "src": [
          {
            "src": "https://dms.licdn.com/playlist/vid/v2/D5610AQGEwb908but4Q/mp4-360p-30fp-crf28/B56ZWa7y_KHsBk-/0/1742061136813?e=1744610400&v=beta&t=_w7ubWJf5pcqUO_XRbv2PddsyR4srC3ZXpcTGM57Hd0",
            "type": "video/mp4",
            "data-bitrate": 534037
          },
          {
            "src": "https://dms.licdn.com/playlist/vid/v2/D5610AQGEwb908but4Q/mp4-720p-30fp-crf28/B56ZWa7y_KHsBs-/0/1742061137463?e=1744610400&v=beta&t=luI7dAvd_TtYRv_D6dQWt_mA86Wm3v3bXpT8BcNkLNY",
            "type": "video/mp4",
            "data-bitrate": 1486669
          },
          {
            "src": "https://dms.licdn.com/playlist/vid/v2/D5610AQGEwb908but4Q/mp4-640p-30fp-crf28/B56ZWa7y_KHsBo-/0/1742061136600?e=1744610400&v=beta&t=2SlXhF9LccO1wKZlJ532T6h_pS_CL4O_btcPDzxw6wY",
            "type": "video/mp4",
            "data-bitrate": 1160444
          }
        ],
        "posterUrl": "https://media.licdn.com/dms/image/v2/D5610AQGEwb908but4Q/ads-video-thumbnail_720_1280/B56ZWa7y_KHsAY-/0/1742061127718?e=1744610400&v=beta&t=tKoFarRX7aduDnjDP4e8KJRnAawNP7LS0AC4QTcJePI"
      },
      "date": "2025-03-17T05:38:51.156Z"
    },
    {
      "captions": "The community, the food, the fun - it was electric! \n\nTable Scraps: The Chef’s Challenge 🏆 is streaming now— grab your🥤🍿 + tell us what you think!",
      "likes": "1",
      "time": {
        "raw": "2g",
        "parsed": "15.03.2025",
        "isoString": "2025-03-15T05:04:17.133Z"
      },
      "mediaType": "other",
      "date": "2025-03-15T05:04:17.133Z"
    },
    {
      "captions": "Metal recycling meets Master chef!\n\nWho knew scrappies could cook?\n\nBe sure to watch #TableScraps tonight.\n\nGoing live at 3pm US Eastern Time.\n\n3 teams going head to head.\n\nYou'll laugh, \nYou'll cry,\nYou'll get hungryou'll laugh again!\n\nSo open a bottle of wine.\n\nEnjoy the show.\n\nLink to the show in the comments.\n\nJohn Sacco Michael Goldstein🟧Abby Goldstein Mark Hadacek Patrick Young Alton Schaubhut Andrew Lincoln 🧿 Atilla W. Antonio Tammaro Darren Doane Sierra International Machinery",
      "likes": "30",
      "comments": "10",
      "shares": "2",
      "time": {
        "raw": "2g",
        "parsed": "15.03.2025",
        "isoString": "2025-03-15T05:04:17.134Z"
      },
      "mediaType": "video",
      "mediaContent": {
        "src": [
          {
            "src": "https://dms.licdn.com/playlist/vid/v2/D5605AQEGiXExXQM8ew/mp4-640p-30fp-crf28/B56ZWVKXftHQBg-/0/1741964413380?e=1742796000&v=beta&t=XJgZ4jHFv8tpGa1nNLkjOzE3p1-XZSMw1Hdukw7l5kM",
            "type": "video/mp4",
            "data-bitrate": 817927
          },
          {
            "src": "https://dms.licdn.com/playlist/vid/v2/D5605AQEGiXExXQM8ew/mp4-720p-30fp-crf28/B56ZWVKXftHQBk-/0/1741964414402?e=1742796000&v=beta&t=QqEqPbQntdiu7NqqOTnjBrbj2IEqWGI04N4yXuRkWqE",
            "type": "video/mp4",
            "data-bitrate": 1093200
          }
        ],
        "posterUrl": "https://media.licdn.com/dms/image/v2/D5605AQEGiXExXQM8ew/videocover-high/B56ZWVKXftHQBw-/0/1741964405188?e=1742796000&v=beta&t=CWvifvyfAsLfVIGkkSmSalMG8dK7S4DCAAj1VjcOIic"
      },
      "date": "2025-03-15T05:04:17.134Z"
    },
    {
      "captions": "LIVE NOW ‼️ The wait is over—Table Scraps: The Chef’s Challenge is officially out! 🍿🔥\n\nPour your favorite drinks, grab some snacks, and settle in—one hour of raw, intense, and unfiltered competition awaits. This is Table Scraps at its finest! \n\nWho are you watching with? Tune in now on YouTube! 🎥 👀 \n\n#TableScraps #TheChefsChallenge #recyclingcommunity",
      "likes": "7",
      "comments": "2",
      "shares": "2",
      "time": {
        "raw": "2g",
        "parsed": "15.03.2025",
        "isoString": "2025-03-15T05:04:17.136Z"
      },
      "mediaType": "video",
      "mediaContent": {
        "src": [
          {
            "src": "https://dms.licdn.com/playlist/vid/v2/D5610AQEthe0MXqmCdw/mp4-720p-30fp-crf28/B56ZWWDnPlHoBs-/0/1741979294743?e=1742796000&v=beta&t=sFtqd07N2rDuKydPdIES4bwxttBSq5VrsfSy0cBafY0",
            "type": "video/mp4",
            "data-bitrate": 1166899
          },
          {
            "src": "https://dms.licdn.com/playlist/vid/v2/D5610AQEthe0MXqmCdw/mp4-640p-30fp-crf28/B56ZWWDnPlHoBo-/0/1741979294390?e=1742796000&v=beta&t=wZHba90q6jXCfuQKwWeGWhGsy9TkgTaJZWzHo8hvUCg",
            "type": "video/mp4",
            "data-bitrate": 908636
          },
          {
            "src": "https://dms.licdn.com/playlist/vid/v2/D5610AQEthe0MXqmCdw/mp4-360p-30fp-crf28/B56ZWWDnPlHoBk-/0/1741979292287?e=1742796000&v=beta&t=SdOlshzpbLFuik8X-6f_fqDXGTsTHsVSiQuaTJx1z_o",
            "type": "video/mp4",
            "data-bitrate": 409807
          }
        ],
        "posterUrl": "https://media.licdn.com/dms/image/v2/D5610AQEthe0MXqmCdw/ads-video-thumbnail_720_1280/B56ZWWDnPlHoAY-/0/1741979288118?e=1742796000&v=beta&t=eAxCSimo97LImg9QPGB3l9AjxeYXVXkaUrcsIDonbNE"
      },
      "date": "2025-03-15T05:04:17.136Z"
    },
    {
      "captions": "Mood because Table Scraps: The Chef's Challenge drops TOMORROW! 🍾🍾🍾 \n\nThe wait is almost over! Have you subscribed?? 📺 https://lnkd.in/gtP7jhBm \n--\nJohn Sacco 🧿 Atilla W. Antonio Tammaro Stuart Kagan Andrew Lincoln Alton Schaubhut Patrick Young Mark Hadacek Michael Goldstein🟧 Monica Sacco Giovanna Sacco Vanessa Ramirez Andrew Sacchini Xan Doane",
      "likes": "18",
      "shares": "3",
      "time": {
        "raw": "3g",
        "parsed": "14.03.2025",
        "isoString": "2025-03-14T05:04:17.137Z"
      },
      "mediaType": "video",
      "mediaContent": {
        "src": [
          {
            "src": "https://dms.licdn.com/playlist/vid/v2/D5610AQFOtosCijXeKQ/mp4-720p-30fp-crf28/B56ZWQfBNKHEBs-/0/1741885812936?e=1742796000&v=beta&t=bWut8Pp0Hz6_KYzxu5Tq7144nfApVfgJbVXPHns8-aA",
            "type": "video/mp4",
            "data-bitrate": 1024189
          },
          {
            "src": "https://dms.licdn.com/playlist/vid/v2/D5610AQFOtosCijXeKQ/mp4-640p-30fp-crf28/B56ZWQfBNKHEBo-/0/1741885812754?e=1742796000&v=beta&t=X48mdbmpNfOAk3KC5AkUUKbPlZwoBJJn_y9HWxpue10",
            "type": "video/mp4",
            "data-bitrate": 779168
          },
          {
            "src": "https://dms.licdn.com/playlist/vid/v2/D5610AQFOtosCijXeKQ/mp4-360p-30fp-crf28/B56ZWQfBNKHEBk-/0/1741885812036?e=1742796000&v=beta&t=9gasNXQ5Mo__PexYrv5slhx1JbdGB3pdh1YDCFyOEpA",
            "type": "video/mp4",
            "data-bitrate": 377042
          }
        ],
        "posterUrl": "https://media.licdn.com/dms/image/v2/D5610AQFOtosCijXeKQ/ads-video-thumbnail_720_1280/B56ZWQfBNKHEAY-/0/1741885808810?e=1742796000&v=beta&t=t2wszM8r_PPUDQnYwL3BQKLQbokZGTHJiRdgWllbayc"
      },
      "date": "2025-03-14T05:04:17.137Z"
    },
    {
      "captions": "This is what it’s all about! Our industry may be vital to everyday life, but it’s the people, friendships, and shared experiences that give it heart. Grateful to be part of a community that lifts each other up. Cheers, 🧿 Atilla W.! All my insecurities laid bare...\n\nBelieve it or not \n\nI'm not a big fan of my appearance or how I sound\n\nI cringe when I see and hear myself in TV interviews or recordings\n\nUnfortunately, the career & life I choose means I drive myself to be ultra visible\n\nThat means jumping head first into any speaking events, presentations, or TV interviews without a seconds thought\n\nI don't give my brain time to think or allow my insecurities to manifest to the point they hold me back from incredible opportunities\n\nAnd guess what!?\n\nJohn Sacco's Table Scraps: The Chef’s Challenge was EXACTLY that\n\nWhat an incredibly awesome couple of days that has been burnt & etched into my memory, and will stay with me for the rest of my life\n\nWords cannot describe how immeasurably grateful I am to John and his wonderful wife Monica for inviting us into their beautiful home\n\nJohn & Monica took hospitality to a whole other level, it was truly mind-blowing how humble and generous you guys are\n\nThey invited complete strangers like myself & Antonio in their home and made us feel like part of the family\n\nNot only that, but...\n\nI got the chance to build amazing new friendships & bromances with people a million times smarter and more experienced than me\n\nIn just a couple of days, I learnt more about the US Mississippi barge network than I have in 15 years of commodity analytics & research\n\nEternally grateful to my bro Stuart, my new bud Michael, and the Godfather John Sacco for inviting and welcoming us into their circle\n\nThe Lesson:\n\nDon't let your insecurities hold you back\n\nYou never know what amazing opportunities you'll miss\n\n“You miss 100% of the shots you don't take”\n- Michael Jordan\n\nTable Scraps: The Chef’s Challenge coming Friday March 14 on Sierra International Machinery's YouTube Channel! \n\n📺 Subscribe on YouTube - Link below 👇",
      "likes": "4",
      "time": {
        "raw": "3g3g",
        "parsed": "17.03.2025",
        "isoString": "2025-03-17T05:04:17.138Z"
      },
      "mediaType": "video",
      "mediaContent": {
        "src": [
          {
            "src": "https://dms.licdn.com/playlist/vid/v2/D5605AQFzRZqKaViNLA/mp4-640p-30fp-crf28/B56ZWOFqh_GoBc-/0/1741845616817?e=1742796000&v=beta&t=1NOzjkKaDCdr37yHdhvJZmSFOR9w2pqCl553Sm660qc",
            "type": "video/mp4",
            "data-bitrate": 876260
          }
        ],
        "posterUrl": "https://media.licdn.com/dms/image/v2/D5605AQFzRZqKaViNLA/videocover-high/B56ZWOFqh_GoBs-/0/1741845614520?e=1742796000&v=beta&t=nxFomZFEFnBZmYtz0u4ITicahLa-QSfRUA6jDUBTz0U"
      },
      "date": "2025-03-17T05:04:17.138Z"
    },
    {
      "captions": "All my insecurities laid bare...\n\nBelieve it or not \n\nI'm not a big fan of my appearance or how I sound\n\nI cringe when I see and hear myself in TV interviews or recordings\n\nUnfortunately, the career & life I choose means I drive myself to be ultra visible\n\nThat means jumping head first into any speaking events, presentations, or TV interviews without a seconds thought\n\nI don't give my brain time to think or allow my insecurities to manifest to the point they hold me back from incredible opportunities\n\nAnd guess what!?\n\nJohn Sacco's Table Scraps: The Chef’s Challenge was EXACTLY that\n\nWhat an incredibly awesome couple of days that has been burnt & etched into my memory, and will stay with me for the rest of my life\n\nWords cannot describe how immeasurably grateful I am to John and his wonderful wife Monica for inviting us into their beautiful home\n\nJohn & Monica took hospitality to a whole other level, it was truly mind-blowing how humble and generous you guys are\n\nThey invited complete strangers like myself & Antonio in their home and made us feel like part of the family\n\nNot only that, but...\n\nI got the chance to build amazing new friendships & bromances with people a million times smarter and more experienced than me\n\nIn just a couple of days, I learnt more about the US Mississippi barge network than I have in 15 years of commodity analytics & research\n\nEternally grateful to my bro Stuart, my new bud Michael, and the Godfather John Sacco for inviting and welcoming us into their circle\n\nThe Lesson:\n\nDon't let your insecurities hold you back\n\nYou never know what amazing opportunities you'll miss\n\n“You miss 100% of the shots you don't take”\n- Michael Jordan\n\nTable Scraps: The Chef’s Challenge coming Friday March 14 on Sierra International Machinery's YouTube Channel! \n\n📺 Subscribe on YouTube - Link below 👇",
      "time": {
        "raw": "3g",
        "parsed": "14.03.2025",
        "isoString": "2025-03-14T05:04:17.139Z"
      },
      "mediaType": "video",
      "mediaContent": {
        "src": [
          {
            "src": "https://dms.licdn.com/playlist/vid/v2/D5605AQFzRZqKaViNLA/mp4-640p-30fp-crf28/B56ZWOFqh_GoBc-/0/1741845616817?e=1742796000&v=beta&t=1NOzjkKaDCdr37yHdhvJZmSFOR9w2pqCl553Sm660qc",
            "type": "video/mp4",
            "data-bitrate": 876260
          }
        ],
        "posterUrl": "https://media.licdn.com/dms/image/v2/D5605AQFzRZqKaViNLA/videocover-high/B56ZWOFqh_GoBs-/0/1741845614520?e=1742796000&v=beta&t=nxFomZFEFnBZmYtz0u4ITicahLa-QSfRUA6jDUBTz0U"
      },
      "date": "2025-03-14T05:04:17.139Z"
    },
    {
      "captions": "Last but certainly not least, meet Antonio Tammaro  who came from Italy (with his tomatoes) to cook for Table Scraps! 🇮🇹🍝📍Napoli ♻️ Tammaro Metalli | Recycled Materials Industry\n\nAntonio felt the love immediately with the cast & crew; everyone together on this Table Scraps: Chef’s Challenge team has a true bond! 🍽️\n\nTHIS FRIDAY watch Antonio bring his Italian flare to Table Scraps 🔥You’re not going to want to miss this → Subscribe to our YouTube channel 📺 https://lnkd.in/gBCv86ha \nJohn Sacco",
      "likes": "19",
      "comments": "5",
      "shares": "1",
      "time": {
        "raw": "4g",
        "parsed": "13.03.2025",
        "isoString": "2025-03-13T05:04:17.140Z"
      },
      "mediaType": "video",
      "mediaContent": {
        "src": [
          {
            "src": "https://dms.licdn.com/playlist/vid/v2/D5610AQGgWCLcTfr0eQ/mp4-720p-30fp-crf28/B56ZWLcSOrHsBs-/0/1741801212191?e=1742796000&v=beta&t=VRUw_-9vXwDiRBExZO4ZtDe0xiSNbq0-1CZMIwsooc4",
            "type": "video/mp4",
            "data-bitrate": 981367
          },
          {
            "src": "https://dms.licdn.com/playlist/vid/v2/D5610AQGgWCLcTfr0eQ/mp4-640p-30fp-crf28/B56ZWLcSOrHsBo-/0/1741801212043?e=1742796000&v=beta&t=P8w5vLJ2s-ksCMV9cYVpLfGP4zsznrIAvlKdPbQIqjE",
            "type": "video/mp4",
            "data-bitrate": 704143
          },
          {
            "src": "https://dms.licdn.com/playlist/vid/v2/D5610AQGgWCLcTfr0eQ/mp4-360p-30fp-crf28/B56ZWLcSOrHsBk-/0/1741801210197?e=1742796000&v=beta&t=ezi9Hq36BJp8TFhJaXTFyF6abOAHUSXtoeJblfS7J1A",
            "type": "video/mp4",
            "data-bitrate": 303775
          }
        ],
        "posterUrl": "https://media.licdn.com/dms/image/v2/D5610AQGgWCLcTfr0eQ/ads-video-thumbnail_720_1280/B56ZWLcSOrHsAY-/0/1741801206096?e=1742796000&v=beta&t=5y2eeMfwhfKUZMNhtM3H04e2DStM8K0dTuP41dx3WJk"
      },
      "date": "2025-03-13T05:04:17.140Z"
    },
    {
      "captions": "From boxes to new beginnings. ♻️\n Recycling cardboard isn’t just about cleanup—it’s about creating opportunity. Every bale packed here represents raw potential ready to re-enter the circular economy.\n📦 Processed. Baled. Ready for what’s next.\n#RecyclingMatters #CircularEconomy #SustainableFuture #CardboardRecycling #BalingForChange #RecycledMaterials #SustainabilityInActionFrom boxes to new beginnings. ♻️\n Recycling cardboard isn’t just about cleanup—it’s about creating opportunity. Every bale packed here represents raw potential ready to re-enter the circular economy.\n📦 Processed. Baled. Ready for what’s next.\n#RecyclingMatters #CircularEconomy #SustainableFuture #CardboardRecycling #BalingForChange #RecycledMaterials #SustainabilityInAction",
      "likes": "7",
      "shares": "1",
      "time": {
        "raw": "3h",
        "parsed": "24.03.2025",
        "isoString": "2025-03-24T04:45:00.225Z"
      },
      "mediaType": "image",
      "mediaContent": [
        "https://media.licdn.com/dms/image/v2/D5622AQGrIg52-CmPmw/feedshare-shrink_800/B56ZW0ciGeGoAo-/0/1742489136698?e=1747267200&v=beta&t=6wg6LOC2t0uW8rjh-UYrsycJGBehZ41sKpY5MQOa0kU"
      ],
      "date": "2025-03-24T04:45:00.225Z"
    },
    {
      "captions": "Baling clean, consistent results. ♻️\n Our team is putting in the work to keep recyclable materials moving efficiently through the cycle—reducing waste and delivering value back into the supply chain.\n#RecyclingIndustry #Sustainability #CardboardRecycling #RecyclingSolutions #SierraBuiltBaling clean, consistent results. ♻️\n Our team is putting in the work to keep recyclable materials moving efficiently through the cycle—reducing waste and delivering value back into the supply chain.\n#RecyclingIndustry #Sustainability #CardboardRecycling #RecyclingSolutions #SierraBuilt",
      "likes": "6",
      "shares": "1",
      "time": {
        "raw": "2h",
        "parsed": "31.03.2025",
        "isoString": "2025-03-31T04:45:00.226Z"
      },
      "mediaType": "image",
      "mediaContent": [
        "https://media.licdn.com/dms/image/v2/D5622AQHb4mO3N-rAGw/feedshare-shrink_800/B56ZXOQNZhGsAg-/0/1742922114144?e=1747267200&v=beta&t=bUwM9ZHX99nRSTpQ1dRy977aVpcrWyVpnr0AClr_rP0"
      ],
      "date": "2025-03-31T04:45:00.226Z"
    },
    {
      "captions": "Things got a little tense on Team AlterQ… 👀\n\nTable Scraps: The Chef’s Challenge 🍽️ streaming on YouTube now, GO WATCH‼️\n\n#TableScraps #TheChefsChallenge #recyclingcomunity Patrick Young Michael Goldstein🟦🟧, Mark Hadacek",
      "likes": "35",
      "comments": "7",
      "time": {
        "raw": "2h",
        "parsed": "31.03.2025",
        "isoString": "2025-03-31T04:45:00.227Z"
      },
      "mediaType": "video",
      "mediaContent": {
        "src": [
          {
            "src": "https://dms.licdn.com/playlist/vid/v2/D5610AQHWbhGI0g-RXQ/mp4-720p-30fp-crf28/B56ZXJakrsHEBw-/0/1742840948070?e=1745211600&v=beta&t=FVIhiAmNcAi75DEBjslVadr-2dTbNTNvFA3-NP9k4NM",
            "type": "video/mp4",
            "data-bitrate": 1314054
          },
          {
            "src": "https://dms.licdn.com/playlist/vid/v2/D5610AQHWbhGI0g-RXQ/mp4-640p-30fp-crf28/B56ZXJakrsHEBs-/0/1742840947374?e=1745211600&v=beta&t=xpDjRk_nad6vCnvEkE_-EJR1u7ddS3NPBQnVl2dGZMk",
            "type": "video/mp4",
            "data-bitrate": 990041
          },
          {
            "src": "https://dms.licdn.com/playlist/vid/v2/D5610AQHWbhGI0g-RXQ/mp4-360p-30fp-crf28/B56ZXJakrsHEBo-/0/1742840946780?e=1745211600&v=beta&t=bZQL5xSssyslr6r-lhPXp1Z5JQLLEyN_YOqkGKyraxM",
            "type": "video/mp4",
            "data-bitrate": 415961
          }
        ],
        "posterUrl": "https://media.licdn.com/dms/image/v2/D5610AQHWbhGI0g-RXQ/ads-video-thumbnail_720_1280/B56ZXJakrsHEAc-/0/1742840944930?e=1745211600&v=beta&t=WJm6PRpH5nkrVZ7jgcXM6NtGl4oDUSgPOx3dzIlHKOE"
      },
      "date": "2025-03-31T04:45:00.227Z"
    },
    {
      "captions": "Cacoa anyone? \n\nWatch Table Scraps: The Chef’s Challenge 🍽️ now! \n\n👀 📺 https://lnkd.in/gtP7jhBm\n\n#TableScraps #TheChefsChallnege #recyclingcommunity Stuart Kagan, Patrick Young",
      "likes": "15",
      "comments": "1",
      "time": {
        "raw": "3h",
        "parsed": "24.03.2025",
        "isoString": "2025-03-24T04:45:00.228Z"
      },
      "mediaType": "video",
      "mediaContent": {
        "src": [
          {
            "src": "https://dms.licdn.com/playlist/vid/v2/D5610AQE3Ad_6fZHyhQ/mp4-640p-30fp-crf28/B56ZXEDBP8GUBo-/0/1742750887647?e=1745211600&v=beta&t=U0WTp5yrzDJLefXAUUJSqZ_Tx22MiiEqqQTJTddZNgA",
            "type": "video/mp4",
            "data-bitrate": 887508
          },
          {
            "src": "https://dms.licdn.com/playlist/vid/v2/D5610AQE3Ad_6fZHyhQ/mp4-360p-30fp-crf28/B56ZXEDBP8GUBk-/0/1742750886965?e=1745211600&v=beta&t=DMhJD2HsUlMvf27KGVYoEI6uWXQ-QI_iNRTp0Ir8i4I",
            "type": "video/mp4",
            "data-bitrate": 388860
          },
          {
            "src": "https://dms.licdn.com/playlist/vid/v2/D5610AQE3Ad_6fZHyhQ/mp4-720p-30fp-crf28/B56ZXEDBP8GUBs-/0/1742750889227?e=1745211600&v=beta&t=TUBc6wark6r4QCei_FfspnIN7LFd8m5iuslDHaWV57c",
            "type": "video/mp4",
            "data-bitrate": 1165311
          }
        ],
        "posterUrl": "https://media.licdn.com/dms/image/v2/D5610AQE3Ad_6fZHyhQ/ads-video-thumbnail_720_1280/B56ZXEDBP8GUAY-/0/1742750884519?e=1745211600&v=beta&t=wSovn4zldkpOPn-f8sEyghLPGMX-LWzHKLIs1BeQbs0"
      },
      "date": "2025-03-24T04:45:00.228Z"
    },
    {
      "captions": "Team Alter Q took a bold approach—but was it the right move to secure the win? 🏆\n\nGo watch Table Scraps: The Chef’s Challenge 🍽️ now on YouTube!\n\n#tablescraps #thechefschallenge #recyclingcommunity",
      "likes": "11",
      "time": {
        "raw": "2h",
        "parsed": "24.03.2025",
        "isoString": "2025-03-24T05:38:51.143Z"
      },
      "mediaType": "video",
      "mediaContent": {
        "src": [
          {
            "src": "https://dms.licdn.com/playlist/vid/v2/D5610AQETWZ1VvCdpAw/mp4-720p-30fp-crf28/B56ZW_k6yvGQBs-/0/1742675889286?e=1744610400&v=beta&t=U9f5gLippbEwdOX5pstG4TSbafYH7q4OiNEI558qc3Q",
            "type": "video/mp4",
            "data-bitrate": 1097006
          },
          {
            "src": "https://dms.licdn.com/playlist/vid/v2/D5610AQETWZ1VvCdpAw/mp4-640p-30fp-crf28/B56ZW_k6yvGQBo-/0/1742675889207?e=1744610400&v=beta&t=P9FJbT5pzx6OenXRWoM15676CcmohooobuODynLekpw",
            "type": "video/mp4",
            "data-bitrate": 824421
          },
          {
            "src": "https://dms.licdn.com/playlist/vid/v2/D5610AQETWZ1VvCdpAw/mp4-360p-30fp-crf28/B56ZW_k6yvGQBk-/0/1742675888484?e=1744610400&v=beta&t=gz7NSU0jbw17fzDncOTwrxaEUASKKc6Eiz8eSBzHm1Q",
            "type": "video/mp4",
            "data-bitrate": 350378
          }
        ],
        "posterUrl": "https://media.licdn.com/dms/image/v2/D5610AQETWZ1VvCdpAw/ads-video-thumbnail_720_1280/B56ZW_k6yvGQAY-/0/1742675885500?e=1744610400&v=beta&t=lfKJFJByJ928OQQ9PL-OpwrLYhhImFcr1Xnl9hS92Nw"
      },
      "date": "2025-03-24T05:38:51.143Z"
    },
    {
      "captions": "PART ✌️ of the Table Scraps BTS from Giovanna Sacco‘s POV\n\nWatching the food makes us hungry all over again, this day was pure entertainment + memories! Enjoy the story of how the day unfolded & be sure to watch the full episode out NOW on our YouTube channel 💻 \n\n👀 👉 https://lnkd.in/gtP7jhBm",
      "likes": "18",
      "time": {
        "raw": "2h",
        "parsed": "24.03.2025",
        "isoString": "2025-03-24T05:38:51.145Z"
      },
      "mediaType": "video",
      "mediaContent": {
        "src": [
          {
            "src": "https://dms.licdn.com/playlist/vid/v2/D5610AQERXa8uDRSlLg/mp4-720p-30fp-crf28/B56ZW6Bs7tHsBs-/0/1742582785721?e=1744610400&v=beta&t=ITy7qnrZEjRdRUYG2Z0r6SIHoNclRvZvZ3m83KHFTcI",
            "type": "video/mp4",
            "data-bitrate": 1423551
          },
          {
            "src": "https://dms.licdn.com/playlist/vid/v2/D5610AQERXa8uDRSlLg/mp4-640p-30fp-crf28/B56ZW6Bs7tHsBo-/0/1742582785975?e=1744610400&v=beta&t=iY1G_PCHbPR_Ut1yfcfnMJKNS8KVhDq2PLgqCtAfvJ4",
            "type": "video/mp4",
            "data-bitrate": 1118308
          },
          {
            "src": "https://dms.licdn.com/playlist/vid/v2/D5610AQERXa8uDRSlLg/mp4-360p-30fp-crf28/B56ZW6Bs7tHsBk-/0/1742582781765?e=1744610400&v=beta&t=PlDQYtVGO1YH7Fk5St6ru4xyZ1a03SC1bMipjWQMDgI",
            "type": "video/mp4",
            "data-bitrate": 510211
          }
        ],
        "posterUrl": "https://media.licdn.com/dms/image/v2/D5610AQERXa8uDRSlLg/ads-video-thumbnail_720_1280/B56ZW6Bs7tHsAY-/0/1742582771240?e=1744610400&v=beta&t=owgDepmShIGiWETOBVzzXQ7bLIypr3-G4bpjraPygC8"
      },
      "date": "2025-03-24T05:38:51.145Z"
    },
    {
      "captions": "BEHIND THE SCENES OF TABLE SCRAPS: PART 1 🎬\n\nFrom Giovanna Sacco's POV → the crazy day that produced Table Scraps\n\nThe energy, friendship and excitement in the kitchen is obvious from 7 AM! ⭐️ Check out how the day started & stay tuned for part 2! 👀\n\nThanks to all who have watched & supported! Watch Table Scraps now on our YouTube → 📺 https://lnkd.in/gtP7jhBm\n\nJohn Sacco",
      "likes": "18",
      "comments": "3",
      "shares": "1",
      "time": {
        "raw": "2h",
        "parsed": "24.03.2025",
        "isoString": "2025-03-24T05:38:51.146Z"
      },
      "mediaType": "video",
      "mediaContent": {
        "src": [
          {
            "src": "https://dms.licdn.com/playlist/vid/v2/D5610AQFsIcGHkzOLZQ/mp4-720p-30fp-crf28/B56ZW0noMXGsBs-/0/1742492061763?e=1744610400&v=beta&t=c0lDlnIP-xVB6uqZbqOtonxkuMRIko6gEG49XQnENTk",
            "type": "video/mp4",
            "data-bitrate": 1428111
          },
          {
            "src": "https://dms.licdn.com/playlist/vid/v2/D5610AQFsIcGHkzOLZQ/mp4-640p-30fp-crf28/B56ZW0noMXGsBo-/0/1742492060834?e=1744610400&v=beta&t=JdMxf12YwGgfdql8X0fpJdXM3P-1b4U2plj5_XKIv1o",
            "type": "video/mp4",
            "data-bitrate": 1122813
          },
          {
            "src": "https://dms.licdn.com/playlist/vid/v2/D5610AQFsIcGHkzOLZQ/mp4-360p-30fp-crf28/B56ZW0noMXGsBk-/0/1742492065353?e=1744610400&v=beta&t=saIZMyTjtj6IDVSbxLVQlsCGGR_qiC1xGWKcepFw8Hc",
            "type": "video/mp4",
            "data-bitrate": 508252
          }
        ],
        "posterUrl": "https://media.licdn.com/dms/image/v2/D5610AQFsIcGHkzOLZQ/ads-video-thumbnail_720_1280/B56ZW0noMXGsAY-/0/1742492047498?e=1744610400&v=beta&t=NwDVlpRli1GGwMVM9aTB4zVcTrCzWLpySBeu9THspmg"
      },
      "date": "2025-03-24T05:38:51.146Z"
    },
    {
      "captions": "We don’t just build machines—we use them too. Every day, Sierra® Material Handlers are at work in our very own yard, Sierra Recycling & Demolition, proving their power, durability, and reliability in real-life conditions.\n\nWhen we say we understand your needs, we mean it. Our machines are built for recyclers, tested by recyclers. \n\n📍 Sierra Recycling & Demolition | Bakersfield, CA\n\n#RecyclingIndustry #MaterialHandling #BuiltToLast #SierraMachinery #WeDoToo",
      "likes": "21",
      "shares": "1",
      "time": {
        "raw": "2h",
        "parsed": "24.03.2025",
        "isoString": "2025-03-24T05:38:51.147Z"
      },
      "mediaType": "video",
      "mediaContent": {
        "src": [
          {
            "src": "https://dms.licdn.com/playlist/vid/v2/D5610AQEM--E6NPKxXg/mp4-720p-30fp-crf28/B56ZWwCMzzHECA-/0/1742415126263?e=1744610400&v=beta&t=7X-DClRhwz_WNNDLCzoZ-7ZJ5gjluElSV6-6ygVOcVw",
            "type": "video/mp4",
            "data-bitrate": 1106195
          },
          {
            "src": "https://dms.licdn.com/playlist/vid/v2/D5610AQEM--E6NPKxXg/mp4-640p-30fp-crf28/B56ZWwCMzzHEB8-/0/1742415125954?e=1744610400&v=beta&t=VjVtsyBp1aUoxHHcmxCtF9C6QM4hADuVo0QpofMJAXU",
            "type": "video/mp4",
            "data-bitrate": 801637
          },
          {
            "src": "https://dms.licdn.com/playlist/vid/v2/D5610AQEM--E6NPKxXg/mp4-360p-30fp-crf28/B56ZWwCMzzHEB4-/0/1742415125842?e=1744610400&v=beta&t=-NPlL__q9Ug8VXB29emZ0pJtJvSuUXOBKzVMn38XHEI",
            "type": "video/mp4",
            "data-bitrate": 356601
          }
        ],
        "posterUrl": "https://media.licdn.com/dms/image/v2/D5610AQEM--E6NPKxXg/ads-video-thumbnail_720_1280/B56ZWwCMzzHEAY-/0/1742415123285?e=1744610400&v=beta&t=2EG9Bcs_K3YK-TmeMiiIWkN5zDSSS3C4uqa3yY9kJ6M"
      },
      "date": "2025-03-24T05:38:51.147Z"
    },
    {
      "captions": "Happy #GlobalRecyclingDay! ♻️ The choice is yours… but only one leads to a better future. \n\nRecycling transforms old materials into new possibilities, while the alternative? Well, let’s just say it’s not a world you want to be part of. \n\nChoose wisely. \n\n#GlobalRecyclingDay #recyclingmatters #thematrix #redpillbluepill #Morpheus",
      "likes": "21",
      "shares": "3",
      "time": {
        "raw": "2h",
        "parsed": "24.03.2025",
        "isoString": "2025-03-24T05:38:51.150Z"
      },
      "mediaType": "video",
      "mediaContent": {
        "src": [
          {
            "src": "https://dms.licdn.com/playlist/vid/v2/D5610AQHkG4HnbJ_QKw/mp4-720p-30fp-crf28/B56ZWqRAybHEBs-/0/1742318355406?e=1744610400&v=beta&t=enKZ2pYRouUNFAeJSWGoT9IYKPcHu7Z1_eRMxBt1oiA",
            "type": "video/mp4",
            "data-bitrate": 822283
          },
          {
            "src": "https://dms.licdn.com/playlist/vid/v2/D5610AQHkG4HnbJ_QKw/mp4-640p-30fp-crf28/B56ZWqRAybHEBo-/0/1742318355135?e=1744610400&v=beta&t=aYepTVf_VzPK7FKATxU2mzyMnQ6y59fbwNCTt0EbRQ0",
            "type": "video/mp4",
            "data-bitrate": 630804
          },
          {
            "src": "https://dms.licdn.com/playlist/vid/v2/D5610AQHkG4HnbJ_QKw/mp4-360p-30fp-crf28/B56ZWqRAybHEBk-/0/1742318352338?e=1744610400&v=beta&t=J9_btrZe3r42qdwbR50dMTdEDe0kfxazVo5kbMAF6pE",
            "type": "video/mp4",
            "data-bitrate": 283413
          }
        ],
        "posterUrl": "https://media.licdn.com/dms/image/v2/D5610AQHkG4HnbJ_QKw/ads-video-thumbnail_720_1280/B56ZWqRAybHEAY-/0/1742318347071?e=1744610400&v=beta&t=YZVTZwrIOhS2hltvLHMDF0jqt8fsh12wMAFh--lRTVc"
      },
      "date": "2025-03-24T05:38:51.150Z"
    },
    {
      "captions": "Someone’s cutting onions… and it’s not just the chefs. 🥲\nHave you seen Table Scraps: The Chef’s Challenge yet? Catch the full episode now on YouTube and see how passion, purpose, and a little friendly competition come together.\n\n🎥 Watch here: https://lnkd.in/g7DGWH9f\n\n#TableScraps #TheChefsChallenge #RecyclingCommunity #SustainabilityInAction",
      "likes": "19",
      "comments": "3",
      "time": {
        "raw": "2h",
        "parsed": "24.03.2025",
        "isoString": "2025-03-24T05:38:51.152Z"
      },
      "mediaType": "video",
      "mediaContent": {
        "src": [
          {
            "src": "https://dms.licdn.com/playlist/vid/v2/D5605AQG8khPL24FolQ/mp4-720p-30fp-crf28/B56ZWlV6LlHEBk-/0/1742235888653?e=1744610400&v=beta&t=enuobX15Jk9WjhhEEdZRx4EOr6guUQHZyGuqgUs2NpU",
            "type": "video/mp4",
            "data-bitrate": 1202463
          },
          {
            "src": "https://dms.licdn.com/playlist/vid/v2/D5605AQG8khPL24FolQ/mp4-640p-30fp-crf28/B56ZWlV6LlHEBg-/0/1742235889896?e=1744610400&v=beta&t=qSgUsHjDmptldwv0HqBLnLqJeAOE-dg3X6VfZy98Le0",
            "type": "video/mp4",
            "data-bitrate": 915369
          }
        ],
        "posterUrl": "https://media.licdn.com/dms/image/v2/D5605AQG8khPL24FolQ/videocover-high/B56ZWlV6LlHEBw-/0/1742235886648?e=1744610400&v=beta&t=QsvbARmoFyTgj8oThshTndT56TvG0hvOz5dC2Y3pxBk"
      },
      "date": "2025-03-24T05:38:51.152Z"
    },
    {
      "captions": "Another successful REB-1 installation, making quick work of aluminum siding! 🏠 \n\nDesigned for versatility, the REB-1 features a unique shear blade that efficiently processes waste, fiber, and non-ferrous metals—eliminating the need to choose between materials. ♻️Another successful REB-1 installation, making quick work of aluminum siding! 🏠 \n\nDesigned for versatility, the REB-1 features a unique shear blade that efficiently processes waste, fiber, and non-ferrous metals—eliminating the need to choose between materials. ♻️",
      "likes": "24",
      "comments": "1",
      "time": {
        "raw": "2h",
        "parsed": "07.04.2025",
        "isoString": "2025-04-07T05:49:37.013Z"
      },
      "mediaType": "image",
      "mediaContent": [
        "https://media.licdn.com/dms/image/v2/D5610AQG0bIpJAgGmfA/image-shrink_800/B56ZX8pUi1GQAc-/0/1743700446119?e=1745820000&v=beta&t=6BXK7sNHrFsWHQvAQZ557nHLQRpTFfEQCupNpCiOmO0",
        "https://media.licdn.com/dms/image/v2/D5610AQGqecAaLhFXNQ/image-shrink_800/B56ZX8pUxxGUAc-/0/1743700447310?e=1745820000&v=beta&t=-XodnfPAf3O2sP1KV6ctkhvUqGmytzbbdTvGirQlBgc",
        "https://media.licdn.com/dms/image/v2/D5610AQGZnlOiiMgYuw/image-shrink_800/B56ZX8pVBSGcAo-/0/1743700448032?e=1745820000&v=beta&t=bpHlAYcV99MV6ASD0pDwKkbB-FqRn8D2n_FoZo6mh40",
        "https://media.licdn.com/dms/image/v2/D5610AQEa_V5boeZjJw/image-shrink_800/B56ZX8pVRMGoAc-/0/1743700451635?e=1745820000&v=beta&t=Kl6Kbd7-APRR3Kc7KaRM78JVBlhQFCKzRHLLsdIqaOE",
        "https://media.licdn.com/dms/image/v2/D5610AQFNv-MMgX2x3A/image-shrink_800/B56ZX8pV8IHoAs-/0/1743700451974?e=1745820000&v=beta&t=H0YJJpEl9_va4w6zFRqPHroa7ptr0eMTmUDeSccm8I0"
      ],
      "date": "2025-04-07T05:49:37.013Z"
    },
    {
      "captions": "S1 E1 • Cup of Joe ☕🔧\n\nMeet our Parts & Service team—the backbone of Sierra’s commitment to customer success. With hands-on expertise, a deep understanding of our machines, and the largest parts inventory in the industry, they work tirelessly to keep operations running smoothly.\n\n✔ Extensive parts availability (even for older machines)\n✔ On-call expert technicians to diagnose & resolve issues\n✔ Built by recyclers, for recyclers—we know what it takes to minimize downtime\n\nHere’s to the team that keeps Sierra moving forward! 👏 \n\n#meettheteam  #teamSierra #builttolast #recyclingmachinery #TheOffice",
      "likes": "11",
      "time": {
        "raw": "2h",
        "parsed": "07.04.2025",
        "isoString": "2025-04-07T05:49:37.015Z"
      },
      "mediaType": "video",
      "mediaContent": {
        "src": [
          {
            "src": "https://dms.licdn.com/playlist/vid/v2/D5610AQFJ7Ouj4HG98Q/mp4-640p-30fp-crf28/B56ZX3bmHPHoB0-/0/1743612978432?e=1745820000&v=beta&t=TRMKjIvpXDcLLUCtjd6vKAbjFyDpYtmIUU0Unhzxj0E",
            "type": "video/mp4",
            "data-bitrate": 697948
          },
          {
            "src": "https://dms.licdn.com/playlist/vid/v2/D5610AQFJ7Ouj4HG98Q/mp4-720p-30fp-crf28/B56ZX3bmHPHoB4-/0/1743612975251?e=1745820000&v=beta&t=ltUNWHh_zsYTxm8Lttvh-Wp2lujblYxVbRuaSNGbL8k",
            "type": "video/mp4",
            "data-bitrate": 944154
          },
          {
            "src": "https://dms.licdn.com/playlist/vid/v2/D5610AQFJ7Ouj4HG98Q/mp4-360p-30fp-crf28/B56ZX3bmHPHoBw-/0/1743612973615?e=1745820000&v=beta&t=k_VpfD-m8vtsGXC03MZPt7-qkRPUqdfrkQfpZwsM_1k",
            "type": "video/mp4",
            "data-bitrate": 305179
          }
        ],
        "posterUrl": "https://media.licdn.com/dms/image/v2/D5610AQFJ7Ouj4HG98Q/ads-video-thumbnail_720_1280/B56ZX3bmHPHoAk-/0/1743612969405?e=1745820000&v=beta&t=VZinvyhDv6YVM8n3b9M8uOS7giW3d7hTVt8YpPEZaW4"
      },
      "date": "2025-04-07T05:49:37.015Z"
    },
    {
      "captions": "♻️ Cardboard doesn’t belong in a landfill. When you recycle it, you’re keeping valuable material in the loop—and out of the environment.\nAt Sierra Recycling and Demolition, we process cardboard daily, turning yesterday’s packaging into tomorrow’s possibilities. Bring your cardboard to us and be part of a smarter, cleaner future.\n#CardboardRecycling #SustainabilityInAction #RecyclingIndustry #SierraRecycling #CircularEconomy♻️ Cardboard doesn’t belong in a landfill. When you recycle it, you’re keeping valuable material in the loop—and out of the environment.\nAt Sierra Recycling and Demolition, we process cardboard daily, turning yesterday’s packaging into tomorrow’s possibilities. Bring your cardboard to us and be part of a smarter, cleaner future.\n#CardboardRecycling #SustainabilityInAction #RecyclingIndustry #SierraRecycling #CircularEconomy",
      "likes": "7",
      "shares": "1",
      "time": {
        "raw": "2h",
        "parsed": "07.04.2025",
        "isoString": "2025-04-07T05:49:37.017Z"
      },
      "mediaType": "image",
      "mediaContent": [
        "https://media.licdn.com/dms/image/v2/D5622AQFGbBu9SCUYYQ/feedshare-shrink_800/B56ZXyZbpkHoAg-/0/1743528510733?e=1747872000&v=beta&t=dztHaUHRe3GPXHdPwOhjwoEp4cKoVgn1t2tgoOGroqU"
      ],
      "date": "2025-04-07T05:49:37.017Z"
    },
    {
