[
  {
    "captions": "New challengers in the kitchen! 🔥\n\nTeam Alter Trading —bringing bold flavors, fresh energy, and a competitive edge to Table Scraps: The Chef’s Challenge. These industry pros know their way around the job, but can they handle the heat of the kitchen?\n\nFind out when Table Scraps: The Chef’s Challenge drops March 14th! \n\n🔔 Subscribe on YouTube today! \n🔗 https://lnkd.in/gNG2dRXW\n\n#TableScraps #TheChefsChallenge #RecyclingMeetsCulinary #RecyclingCommunity Michael Goldstein🟧, Patrick Young, Mark Hadacek, Abby Goldstein, John Sacco",
    "likes": "24",
    "comments": "4",
    "shares": "3",
    "time": {
      "raw": "1h",
      "parsed": "05.03.2025",
      "isoString": "2025-03-05T05:02:55.515Z"
    },
    "mediaType": "video",
    "mediaContent": {
      "src": [
        {
          "src": "https://dms.licdn.com/playlist/vid/v2/D5605AQFE7bULTPQ4Fg/mp4-640p-30fp-crf28/B56ZVNuLu8GQBk-/0/1740765711583?e=1742364000&v=beta&t=P1rZ5qkxhK9PrNFIcb2ZYXxPX2YWxWTm8siZEu88vPs",
          "type": "video/mp4",
          "data-bitrate": 858157
        },
        {
          "src": "https://dms.licdn.com/playlist/vid/v2/D5605AQFE7bULTPQ4Fg/mp4-720p-30fp-crf28/B56ZVNuLu8GQBo-/0/1740765711535?e=1742364000&v=beta&t=4NBE6FlJJkbKUXCv75VfHyHTbL41CnE_wNNDNh4h2Xo",
          "type": "video/mp4",
          "data-bitrate": 1142498
        }
      ],
      "posterUrl": "https://media.licdn.com/dms/image/v2/D5605AQFE7bULTPQ4Fg/videocover-high/B56ZVNuLu8GQB0-/0/1740765710943?e=1742364000&v=beta&t=RHrS-KU6GoaSceUu64Q3OiXaY514Qqd-Gtw82VWRuVc"
    },
    "date": "2025-03-05T05:02:55.515Z"
  },
  {
    "captions": "Sierra® T1100 3-in-1? This powerhouse combines three machines in one, delivering unmatched versatility and efficiency. \n\nWith a 36-inch throat, it effortlessly handles bulkier materials and even logs automobiles with ease—outperforming anything else on the market. Plus, the double automatic lubrication system keeps you cutting longer!\n\n📲 Reach out to one of our sales reps today for more information!\n\n#SierraT1100 #RecyclingInnovation #BuiltToPerform Alter Trading",
    "likes": "13",
    "time": {
      "raw": "1h",
      "parsed": "05.03.2025",
      "isoString": "2025-03-05T05:02:55.516Z"
    },
    "mediaType": "video",
    "mediaContent": {
      "src": [
        {
          "src": "https://dms.licdn.com/playlist/vid/v2/D5605AQEMy8sAKSEIRQ/mp4-720p-30fp-crf28/B56ZVOLW6FHEBg-/0/1740773372512?e=1742364000&v=beta&t=pw8_ad8PZ_ibjEUvaBaYAqPO6Ha3s6lX5NdHKikC9ik",
          "type": "video/mp4",
          "data-bitrate": 1273632
        },
        {
          "src": "https://dms.licdn.com/playlist/vid/v2/D5605AQEMy8sAKSEIRQ/mp4-640p-30fp-crf28/B56ZVOLW6FHEBc-/0/1740773367640?e=1742364000&v=beta&t=a5pnZnFV3ikImFXg1PJWKjZOGHY-ha1wZqOfSlDNOjQ",
          "type": "video/mp4",
          "data-bitrate": 993407
        }
      ],
      "posterUrl": "https://media.licdn.com/dms/image/v2/D5605AQEMy8sAKSEIRQ/videocover-high/B56ZVOLW6FHEBs-/0/1740773364340?e=1742364000&v=beta&t=KYsp2vWcOR-f79DaFUNnojW4wilyddiahImi-cx7p34"
    },
    "date": "2025-03-05T05:02:55.516Z"
  },
  {
    "captions": "When we say “The Chef’s Challenge,” we mean it! ⏲️\n\nThis season of Table Scraps raises the stakes, so it’s only fitting that we brought in expert judges to take on the challenge! 🏆\n\nMeet Gino, Lanette, and Antonia—Bakersfield’s very own food and wine legends. With deep roots in the restaurant industry, they know a great dish when they taste one. And what better place to bring them in than Luigi’s (@Luigisbakersfield)—a Bakersfield institution for 115 years and a true cornerstone of the community. 🍝\n\nOh, and fun fact? They also happen to be John Sacco’s in-laws! We love our Luigi’s family!\n\nWill anyone WOW the judges? Find out March 14th! ♻️\n\n#TableScraps #TheChefsChallenge #RecyclingMeetsCulinary #RecyclingCommunity #FoodAndWine #Sustainability #BakersfieldEatsWhen we say “The Chef’s Challenge,” we mean it! ⏲️\n\nThis season of Table Scraps raises the stakes, so it’s only fitting that we brought in expert judges to take on the challenge! 🏆\n\nMeet Gino, Lanette, and Antonia—Bakersfield’s very own food and wine legends. With deep roots in the restaurant industry, they know a great dish when they taste one. And what better place to bring them in than Luigi’s (@Luigisbakersfield)—a Bakersfield institution for 115 years and a true cornerstone of the community. 🍝\n\nOh, and fun fact? They also happen to be John Sacco’s in-laws! We love our Luigi’s family!\n\nWill anyone WOW the judges? Find out March 14th! ♻️\n\n#TableScraps #TheChefsChallenge #RecyclingMeetsCulinary #RecyclingCommunity #FoodAndWine #Sustainability #BakersfieldEats",
    "likes": "23",
    "comments": "2",
    "shares": "3",
    "time": {
      "raw": "1h",
      "parsed": "05.03.2025",
      "isoString": "2025-03-05T05:02:55.517Z"
    },
    "mediaType": "image",
    "mediaContent": [
      "https://media.licdn.com/dms/image/v2/D5622AQHci18dt-Qeuw/feedshare-shrink_800/B56ZVOwRn8GUAg-/0/1740783035453?e=1744848000&v=beta&t=nSlXW9hYCTi_-lp1VpYA2IbS-qaXH6VA5CvChKQ3LYY",
      "https://media.licdn.com/dms/image/v2/D5622AQGCyjl7npFORw/feedshare-shrink_800/B56ZVOwRoOGUAg-/0/1740783034508?e=1744848000&v=beta&t=dTvedA690ZaTdR-S-1t95pi5Lc1Y32MsWQcBNlF4I2M",
      "https://media.licdn.com/dms/image/v2/D5622AQElwuU_v8kE-A/feedshare-shrink_800/B56ZVOwRoAGsAs-/0/1740783034459?e=1744848000&v=beta&t=Or7GvyMCmRZPEtmkflAmUV-OZ1Fyb8KCsMg9cvtSJvo",
      "https://media.licdn.com/dms/image/v2/D5622AQFeJCzrA8siGA/feedshare-shrink_800/B56ZVOwRoIHQAk-/0/1740783034273?e=1744848000&v=beta&t=exvXXtWcUxdvy61JW86bhh3R2Zhp3YGO0LWRI7vqze8",
      "https://media.licdn.com/dms/image/v2/D5622AQHXVkyoJsSfNw/feedshare-shrink_800/B56ZVOwRn8HQAk-/0/1740783034224?e=1744848000&v=beta&t=4M2OlIUBeZ3-G2evqUCI9A1PlfclAnqB2IGNrKP_kzA"
    ],
    "date": "2025-03-05T05:02:55.517Z"
  },
  {
    "captions": "Sierra® E9.6 Ecological Material Handler—built for efficiency and performance⚡️♻️\n\n✅Zero emissions & reduced noise\n\n✅ Energy Plus™ heavy-duty battery for lower operating costs\n\n✅ Unmatched mobility for safe, flexible operation \n\nDesigned for materials like nonferrous metals, cardboard, plastics, and more, the E9.6 is revolutionizing recycling operations! \n\n#SierraE96 #recyclinginnovation #sustainablesolutionsSierra® E9.6 Ecological Material Handler—built for efficiency and performance⚡️♻️\n\n✅Zero emissions & reduced noise\n\n✅ Energy Plus™ heavy-duty battery for lower operating costs\n\n✅ Unmatched mobility for safe, flexible operation \n\nDesigned for materials like nonferrous metals, cardboard, plastics, and more, the E9.6 is revolutionizing recycling operations! \n\n#SierraE96 #recyclinginnovation #sustainablesolutions",
    "likes": "6",
    "time": {
      "raw": "1h",
      "parsed": "05.03.2025",
      "isoString": "2025-03-05T05:02:55.518Z"
    },
    "mediaType": "image",
    "mediaContent": [
      "https://media.licdn.com/dms/image/v2/D5622AQEQt9YMiI8zBA/feedshare-shrink_800/B56ZVNpp3.HQAo-/0/1740764523455?e=1744848000&v=beta&t=NPDbMUtd7Vs1m0oCFexn-jBfzr-kQrsLIBv7IwyjFNQ",
      "https://media.licdn.com/dms/image/v2/D5622AQHRTBkQS4AWEQ/feedshare-shrink_800/B56ZVNpp3wHQAg-/0/1740764523383?e=1744848000&v=beta&t=1MZwndlBnTud8U5In2NT9jG2Uz1uMlTdbqB_sLaQDmE",
      "https://media.licdn.com/dms/image/v2/D5622AQEa09hKtNBilA/feedshare-shrink_800/B56ZVNpp3EGsAg-/0/1740764523601?e=1744848000&v=beta&t=8HD_LMwfnlT1_nEy9Pd0tNwLWSGIpISX_n2Y9Qk_98I",
      "https://media.licdn.com/dms/image/v2/D5622AQHSs9-YwZHSEA/feedshare-shrink_800/B56ZVNpp4CGsAk-/0/1740764522956?e=1744848000&v=beta&t=Tq7qaUDPIM6EOssgs1Jz3rBbfJ2f3jhGfuboyY07o8Y",
      "https://media.licdn.com/dms/image/v2/D5622AQFbM3f_EKo8TA/feedshare-shrink_800/B56ZVNpp38HEAg-/0/1740764523201?e=1744848000&v=beta&t=z2m25DNQvWFd0HyeuSA373DiQQIE2Mo4Hhw5s7trQs8"
    ],
    "date": "2025-03-05T05:02:55.518Z"
  },
  {
    "captions": "Meet Alton Schaubhut ♻️CMC 📌Dallas TX / New Orleans, LA 🎤Team O.G.s\n\n2/2 of the O.G.s! Alton was also a chef on Table Scraps Season 1! He’s bringing his New Oreleans flare to the Chef’s Challenge! Meeting Andrew through REMA & Season 1, they think they have what it takes to win the chef’s challenge…\n\nSee who takes home the Chef’s trophy→ March 14th! 📺Subscribe on Youtube – https://lnkd.in/gBt__iug",
    "likes": "34",
    "comments": "6",
    "shares": "1",
    "time": {
      "raw": "4g",
      "parsed": "01.03.2025",
      "isoString": "2025-03-01T10:26:01.188Z"
    },
    "mediaType": "video",
    "mediaContent": {
      "src": [
        {
          "src": "https://dms.licdn.com/playlist/vid/v2/D5605AQFjtzKx8eV8bw/mp4-720p-30fp-crf28/B56ZVNZ7erGsBg-/0/1740760419333?e=1741777200&v=beta&t=-shjIlMtNUzzvhAJ9YuhRBZhC30ZBZ-GUjzmCbHgxg8",
          "type": "video/mp4",
          "data-bitrate": 1183202
        },
        {
          "src": "https://dms.licdn.com/playlist/vid/v2/D5605AQFjtzKx8eV8bw/mp4-640p-30fp-crf28/B56ZVNZ7erGsBc-/0/1740760417437?e=1741777200&v=beta&t=sI88_NG7xAVVWUzDfM_fzvDg2aQIrUwVg4RiAL9s1o8",
          "type": "video/mp4",
          "data-bitrate": 898784
        }
      ],
      "posterUrl": "https://media.licdn.com/dms/image/v2/D5605AQFjtzKx8eV8bw/videocover-high/B56ZVNZ7erGsBs-/0/1740760413058?e=1741777200&v=beta&t=Ts4aZstH-apIHQN5kG9XYpGDELiS0tx4s8v3tUtBR48"
    },
    "date": "2025-03-01T10:26:01.188Z"
  },
  {
    "captions": "Season 2 of Table Scraps: The Chef's Challenge is almost here, bringing the recycling community together in a whole new way!\n\nBefore we fire up the kitchen again, have you watched Season 1? 🍴🥩\n\n📺 Catch up now: https://lnkd.in/gxcqsxJS",
    "likes": "13",
    "shares": "2",
    "time": {
      "raw": "5g",
      "parsed": "28.02.2025",
      "isoString": "2025-02-28T10:26:01.188Z"
    },
    "mediaType": "video",
    "mediaContent": {
      "src": [
        {
          "src": "https://dms.licdn.com/playlist/vid/v2/D5605AQEhwbt1g8Vu8w/mp4-720p-30fp-crf28/B56ZVIZVeoGsBg-/0/1740676366300?e=1741777200&v=beta&t=7n5WEc9-R3LCFmJSOoWkYVE4BsT2AcHmtiKfrFUMpCw",
          "type": "video/mp4",
          "data-bitrate": 1337622
        },
        {
          "src": "https://dms.licdn.com/playlist/vid/v2/D5605AQEhwbt1g8Vu8w/mp4-640p-30fp-crf28/B56ZVIZVeoGsBc-/0/1740676366368?e=1741777200&v=beta&t=BIVAGMJ6XD7lJYztiYUdVdOXsmgNuDquh-iAShUwpOo",
          "type": "video/mp4",
          "data-bitrate": 1014901
        }
      ],
      "posterUrl": "https://media.licdn.com/dms/image/v2/D5605AQEhwbt1g8Vu8w/feedshare-thumbnail_720_1280/B56ZVIZVeoGsA8-/0/1740676360868?e=1741777200&v=beta&t=kp7Yj_JtIY-v7wChxZOV2fVHfvhlshhxVjEgmXFTBr8"
    },
    "date": "2025-02-28T10:26:01.188Z"
  },
  {
    "captions": "Out in the yard! 🦾 Efficiency you can hear. 🔊♻️ Aluminum radiators baled and ready for recycling—another step in keeping valuable materials in the loop. #SustainableSolutions #RecyclingInAction",
    "likes": "2",
    "time": {
      "raw": "4g5g",
      "parsed": "04.03.2025",
      "isoString": "2025-03-04T10:36:41.483Z"
    },
    "mediaType": "video",
    "mediaContent": {
      "src": [
        {
          "src": "https://dms.licdn.com/playlist/vid/v2/D5605AQGrpZ2FI-kw9g/mp4-720p-30fp-crf28/B56ZVD.qEVGQBg-/0/1740602263147?e=1741690800&v=beta&t=Yt1GJ6XNo2OhiwII3NcBAieUCafSbVQ7AQxfh_xldSc",
          "type": "video/mp4",
          "data-bitrate": 1229157
        },
        {
          "src": "https://dms.licdn.com/playlist/vid/v2/D5605AQGrpZ2FI-kw9g/mp4-640p-30fp-crf28/B56ZVD.qEVGQBc-/0/1740602262071?e=1741690800&v=beta&t=yH0AoUrkqV6wxbD8xB7lBKumbZYMtnnm9lkQA0rSwvE",
          "type": "video/mp4",
          "data-bitrate": 925153
        }
      ],
      "posterUrl": "https://media.licdn.com/dms/image/v2/D5605AQGrpZ2FI-kw9g/videocover-high/B56ZVD.qEVGQBs-/0/1740602259719?e=1741690800&v=beta&t=YnLnQ2maRds0xzNd60t15mk6MStavZ_fLd9lQUPuWaY"
    },
    "date": "2025-03-04T10:36:41.483Z"
  },
  {
    "captions": "Efficiency you can hear. 🔊♻️ Aluminum radiators baled and ready for recycling—another step in keeping valuable materials in the loop. #SustainableSolutions #RecyclingInAction",
    "time": {
      "raw": "5g",
      "parsed": "27.02.2025",
      "isoString": "2025-02-27T10:36:41.484Z"
    },
    "mediaType": "video",
    "mediaContent": {
      "src": [
        {
          "src": "https://dms.licdn.com/playlist/vid/v2/D5605AQGrpZ2FI-kw9g/mp4-720p-30fp-crf28/B56ZVD.qEVGQBg-/0/1740602263147?e=1741690800&v=beta&t=Yt1GJ6XNo2OhiwII3NcBAieUCafSbVQ7AQxfh_xldSc",
          "type": "video/mp4",
          "data-bitrate": 1229157
        },
        {
          "src": "https://dms.licdn.com/playlist/vid/v2/D5605AQGrpZ2FI-kw9g/mp4-640p-30fp-crf28/B56ZVD.qEVGQBc-/0/1740602262071?e=1741690800&v=beta&t=yH0AoUrkqV6wxbD8xB7lBKumbZYMtnnm9lkQA0rSwvE",
          "type": "video/mp4",
          "data-bitrate": 925153
        }
      ],
      "posterUrl": "https://media.licdn.com/dms/image/v2/D5605AQGrpZ2FI-kw9g/videocover-high/B56ZVD.qEVGQBs-/0/1740602259719?e=1741690800&v=beta&t=YnLnQ2maRds0xzNd60t15mk6MStavZ_fLd9lQUPuWaY"
    },
    "date": "2025-02-27T10:36:41.484Z"
  },
  {
    "captions": "Meet Andrew Lincoln! ♻️Lincoln Recycling 📌Erie, PA 🎤Team O.G.s\n\nAndrew was a chef on Table Scraps Season 1! He’s back & bringing his experience to the Chef’s Challenge! John Sacco & Andrew bonded over their shared love of cooking & food. He’s teamed up with another familiar face: Alton Schaubhut to bring the heat to Bakersfield. (Missing their other teammate Michael Sciaba who couldn’t make it😔)\n\nWatch Andrew cook → March 14th! 📺 Subscribe on Youtube – link in bio!",
    "likes": "48",
    "comments": "8",
    "shares": "2",
    "time": {
      "raw": "5g",
      "parsed": "27.02.2025",
      "isoString": "2025-02-27T10:36:41.484Z"
    },
    "mediaType": "video",
    "mediaContent": {
      "src": [
        {
          "src": "https://dms.licdn.com/playlist/vid/v2/D5605AQFyH_PT1-4aYQ/mp4-720p-30fp-crf28/B56ZVDKeMsHEBk-/0/1740588604050?e=1741690800&v=beta&t=6W0hS-_ACr0Qz8ZDdudWLicFXsFcY8R5Hu_us1m2XQI",
          "type": "video/mp4",
          "data-bitrate": 892620
        },
        {
          "src": "https://dms.licdn.com/playlist/vid/v2/D5605AQFyH_PT1-4aYQ/mp4-640p-30fp-crf28/B56ZVDKeMsHEBg-/0/1740588609762?e=1741690800&v=beta&t=GDhM18yR4T5ymzMXSGwUEwWamT329MZ0hac1h_-mp4M",
          "type": "video/mp4",
          "data-bitrate": 678836
        }
      ],
      "posterUrl": "https://media.licdn.com/dms/image/v2/D5605AQFyH_PT1-4aYQ/feedshare-thumbnail_720_1280/B56ZVDKeMsHEBA-/0/1740588574536?e=1741690800&v=beta&t=cUTtjyCP-S7XDkrpm0yP7mFK6BidYjFnRcCfqcdayRQ"
    },
    "date": "2025-02-27T10:36:41.484Z"
  },
  {
    "captions": "Team OG’s- back for another year, bringing skills, experience, and a whole lot of flavor to the challenge. Are they the ones to beat? 👀\n\nPremiering March 14th—who’s hungry?🍴 \n\n🔔 Don’t miss out, subscribe on YouTube today!\n\n#TableScraps #TheChefsChallenge #RecyclingMeetsCulinary #RecyclingCommunity \nAndrew Lincoln, Alton Schaubhut",
    "likes": "14",
    "comments": "4",
    "shares": "1",
    "time": {
      "raw": "6g",
      "parsed": "26.02.2025",
      "isoString": "2025-02-26T10:36:41.485Z"
    },
    "mediaType": "video",
    "mediaContent": {
      "src": [
        {
          "src": "https://dms.licdn.com/playlist/vid/v2/D5605AQF62KDsDfihbA/mp4-720p-30fp-crf28/B56ZU.vISGGsBg-/0/1740514301701?e=1741690800&v=beta&t=5BF2i6F_RY54d0RA-oYW2_dsv5Br5v8KbVHga9hh14g",
          "type": "video/mp4",
          "data-bitrate": 936933
        },
        {
          "src": "https://dms.licdn.com/playlist/vid/v2/D5605AQF62KDsDfihbA/mp4-640p-30fp-crf28/B56ZU.vISGGsBc-/0/1740514301482?e=1741690800&v=beta&t=hT-7ZmfRbFRDOcpDe-t1cdjunnGsy7OsC8uJizVNbvk",
          "type": "video/mp4",
          "data-bitrate": 721512
        }
      ],
      "posterUrl": "https://media.licdn.com/dms/image/v2/D5605AQF62KDsDfihbA/videocover-high/B56ZU.vISGGsBs-/0/1740514300877?e=1741690800&v=beta&t=axniKWjFgLA_6fxz0IRVvUuR_rtdJJjfXgn6pGH4yHw"
    },
    "date": "2025-02-26T10:36:41.485Z"
  },
  {
    "captions": "The Sierra S5000 baler makes a compact stainless steel bale, there is nothing that competes with this unit !!! \n\n#sierrainternationalmachinery\n#scrapmetal #recycledmaterials\n#portablebaler #amplirollsystemThe Sierra S5000 baler makes a compact stainless steel bale, there is nothing that competes with this unit !!! \n\n#sierrainternationalmachinery\n#scrapmetal #recycledmaterials\n#portablebaler #amplirollsystem",
    "likes": "17",
    "shares": "1",
    "time": {
      "raw": "6g",
      "parsed": "26.02.2025",
      "isoString": "2025-02-26T10:36:41.486Z"
    },
    "mediaType": "image",
    "mediaContent": [
      "https://media.licdn.com/dms/image/v2/D4D22AQH-gASDuzg16g/feedshare-shrink_800/B4DZU.jA4nGcAk-/0/1740511126491?e=1744243200&v=beta&t=l-TSV53CSabZvgGyhMqC1hEpfK5BGu50zXl-p4___-4",
      "https://media.licdn.com/dms/image/v2/D4D22AQFuCtGh1Xccgg/feedshare-shrink_800/B4DZU.jA3bHkAk-/0/1740511126081?e=1744243200&v=beta&t=_TsUN5n6JI4oKWM8aZBtuuZRAfooNRyPlsqnjdjJLNo",
      "https://media.licdn.com/dms/image/v2/D4D22AQESkJrlDvSL4Q/feedshare-shrink_800/B4DZU.jA4SGcAg-/0/1740511125803?e=1744243200&v=beta&t=aHRlsviJCMrynWDD8g2ZoRnq_I6ld1z75L9_N81RekU"
    ],
    "date": "2025-02-26T10:36:41.486Z"
  },
  {
    "captions": "Reb-1 baler heading to recycling facility in the NE where it will be processing plastic and aluminum cans to then be repurposed into new products ♻️✅Sierra International MachineryReb-1 baler heading to recycling facility in the NE where it will be processing plastic and aluminum cans to then be repurposed into new products ♻️✅Sierra International Machinery",
    "likes": "18",
    "comments": "1",
    "shares": "1",
    "time": {
      "raw": "6g",
      "parsed": "26.02.2025",
      "isoString": "2025-02-26T10:36:41.488Z"
    },
    "mediaType": "image",
    "mediaContent": [
      "https://media.licdn.com/dms/image/v2/D4E22AQHMPZpIDfVW1Q/feedshare-shrink_800/B4EZU.TQa3H0Ak-/0/1740506992724?e=1744243200&v=beta&t=g10lkipEJhWaU2xuu88heM950_8Tv5WErJNMpYxhD2o",
      "https://media.licdn.com/dms/image/v2/D4E22AQGeeq9Dmbg4cw/feedshare-shrink_800/B4EZU.TQb9HMAg-/0/1740506993651?e=1744243200&v=beta&t=uQDeSvbQU0hdE81e8ypsE5KP_EUemcyn5inPHH5vCDw"
    ],
    "date": "2025-02-26T10:36:41.488Z"
  },
  {
    "captions": "The Sierra® RB6000: Unmatched Power & Performance. ♻️\n\nWhen it comes to baling and logging, the RB6000 sets the standard:\n\n✅ Most powerful in its class\n\n✅ Handles up to 32 tons per hour\n\n✅ Mill-spec bales & high-density logging\n\n✅ Built to last with Hardox® 450 liners\n\nWith a 170 HP Cummins Turbo Diesel Engine and an industry-leading crane, this machine is designed for maximum efficiency and reliability.\n\n📩 Ready to upgrade your operation? Reach out today!\n\n🔗 https://lnkd.in/gZ5HMB9P\n\n#RB6000 #RecyclingIndustry #HeavyMachinery #Efficiency #BuiltToWork",
    "likes": "3",
    "time": {
      "raw": "6g",
      "parsed": "26.02.2025",
      "isoString": "2025-02-26T10:36:41.489Z"
    },
    "mediaType": "video",
    "mediaContent": {
      "src": [
        {
          "src": "https://dms.licdn.com/playlist/vid/v2/D5605AQEQy8nN9Xm6ow/mp4-640p-30fp-crf28/B56ZU98dOkHEBc-/0/1740501020955?e=1741690800&v=beta&t=tGuzgwW_2mwN_4Euz-vS3dlmrnAurLodg2kRgzkLn-0",
          "type": "video/mp4",
          "data-bitrate": 1084675
        },
        {
          "src": "https://dms.licdn.com/playlist/vid/v2/D5605AQEQy8nN9Xm6ow/mp4-720p-30fp-crf28/B56ZU98dOkHEBg-/0/1740501022032?e=1741690800&v=beta&t=WpQ7HSIsKyHTVaamhWybh9Jm38X7_vT-LAK4Sz5W-48",
          "type": "video/mp4",
          "data-bitrate": 1411652
        }
      ],
      "posterUrl": "https://media.licdn.com/dms/image/v2/D5605AQEQy8nN9Xm6ow/videocover-high/B56ZU98dOkHEBs-/0/1740501019142?e=1741690800&v=beta&t=X31dmmfRVgGAz9mKHIMLEbMfPX1I9Cb4BTcs7QM6tIw"
    },
    "date": "2025-02-26T10:36:41.489Z"
  },
  {
    "captions": "Every great dish starts with a story—just like Table Scraps: The Chef’s Challenge did. 🍽️♻️\n\nJohn Sacco breaks down the ‘why’ behind this one-of-a-kind competition: bringing people from all over the world together through the shared bond of recycled materials & food. \n\nYear 2 kicked it up a notch! These foodies will be throwing down their best dishes – find out who has what it takes to win → March 14th 📆\n\n📺 Subscribe on Youtube – link in bio! \n\n#TableScraps #ChefsChallenge #Sustainability #Recycling #foodies",
    "likes": "30",
    "comments": "2",
    "shares": "3",
    "time": {
      "raw": "1h",
      "parsed": "25.02.2025",
      "isoString": "2025-02-25T10:36:41.490Z"
    },
    "mediaType": "video",
    "mediaContent": {
      "src": [
        {
          "src": "https://dms.licdn.com/playlist/vid/v2/D4D05AQGEdiQ_a81dzA/mp4-720p-30fp-crf28/B4DZU5E.7yG8Bg-/0/1740419382172?e=1741690800&v=beta&t=fhbdV0nHyXnmOO3CqNnF9izC8IA-YPfg7PBtM-CU_Ok",
          "type": "video/mp4",
          "data-bitrate": 1340348
        },
        {
          "src": "https://dms.licdn.com/playlist/vid/v2/D4D05AQGEdiQ_a81dzA/mp4-640p-30fp-crf28/B4DZU5E.7yG8Bc-/0/1740419381833?e=1741690800&v=beta&t=IprMs-yANltn799-h4PZRXvQwHW-vj8t4kRn-F8-j7c",
          "type": "video/mp4",
          "data-bitrate": 1012092
        }
      ],
      "posterUrl": "https://media.licdn.com/dms/image/v2/D4D05AQGEdiQ_a81dzA/videocover-high/B4DZU5E.7yG8Bs-/0/1740419377782?e=1741690800&v=beta&t=U550jxCclGenpeUA670zlRD0ALiW7IRn1TlJgjq92cQ"
    },
    "date": "2025-02-25T10:36:41.490Z"
  },
  {
    "captions": "🚨 Meet the competitors! 🚨\n\nThree teams. One kitchen. Who’s claiming the Table Scraps: The Chef’s Challenge title? 🍽️\n\n🏆 Team Alter Q\n🏆 Team International\n🏆 Team OG’s – the original Table Scraps chef’s are BACK!\n\nGet ready for the ultimate recycler showdown—March 14th on YouTube! Don’t miss it. Subscribe now: https://lnkd.in/gtP7jhBm\n\n#TableScraps #ChefsChallenge #RecyclingIndustry #Sustainability #Foodies",
    "likes": "39",
    "comments": "4",
    "shares": "2",
    "time": {
      "raw": "1h",
      "parsed": "25.02.2025",
      "isoString": "2025-02-25T10:36:41.491Z"
    },
    "mediaType": "video",
    "mediaContent": {
      "src": [
        {
          "src": "https://dms.licdn.com/playlist/vid/v2/D5605AQHXLPnMCZf3qQ/mp4-720p-30fp-crf28/B56ZUrBUUUGUBk-/0/1740183530582?e=1741690800&v=beta&t=gJiaIHpxFMi14MDTeCEoM1SCk7xpIGpQB8R4H6Sts1o",
          "type": "video/mp4",
          "data-bitrate": 1051350
        },
        {
          "src": "https://dms.licdn.com/playlist/vid/v2/D5605AQHXLPnMCZf3qQ/mp4-640p-30fp-crf28/B56ZUrBUUUGUBg-/0/1740183530645?e=1741690800&v=beta&t=VDH9_6hSgLBgF7YtnTqxocyM25jDtakFVnBIcEu5o7c",
          "type": "video/mp4",
          "data-bitrate": 666856
        }
      ],
      "posterUrl": "https://media.licdn.com/dms/image/v2/D5605AQHXLPnMCZf3qQ/feedshare-thumbnail_720_1280/B56ZUrBUUUGUBA-/0/1740183527026?e=1741690800&v=beta&t=tETwXng21ac-IfkdnM3smAEg627HrmV2eKs9eAVFzjg"
    },
    "date": "2025-02-25T10:36:41.491Z"
  },
  {
    "captions": "Good morning ☀️ \n\nSierra® T409 Matrial Handler | 📦 #wedotoo Sierra Recycling & DemolitionGood morning ☀️ \n\nSierra® T409 Matrial Handler | 📦 #wedotoo Sierra Recycling & Demolition",
    "likes": "4",
    "time": {
      "raw": "1h",
      "parsed": "25.02.2025",
      "isoString": "2025-02-25T10:36:41.492Z"
    },
    "mediaType": "image",
    "mediaContent": [
      "https://media.licdn.com/dms/image/v2/D5622AQFCcspWuOpP_w/feedshare-shrink_800/B56ZUqq0wbHoAg-/0/1740177625077?e=1744243200&v=beta&t=MhHSF6JvoqaFeRvMmOqIHncT_IE02y0YcwcmzVRSN1Q"
    ],
    "date": "2025-02-25T10:36:41.492Z"
  },
  {
    "captions": "Are you ready? 👀 Here’s a sneak peek at this year’s Table Scraps: The Chef’s Challenge! 🍽️\n\nWhich team of recyclers will come out on top? 🏆 \n\n🎥 Premieres March 14, 2025\n🔔 Don’t miss out—subscribe on YouTube today! https://lnkd.in/gtP7jhBm\n\n#TableScraps #ChefsChallenge #Foodies #RecyclingCommunity \n\nJohn Sacco Michael Goldstein🟦Alton Schaubhut Andrew Lincoln Michael Sciaba Abby Goldstein Patrick Young Mark Hadacek Stuart Kagan 🧿 Atilla W. Antonio Tammaro",
    "likes": "27",
    "comments": "7",
    "shares": "4",
    "time": {
      "raw": "1h",
      "parsed": "25.02.2025",
      "isoString": "2025-02-25T10:36:41.493Z"
    },
    "mediaType": "video",
    "mediaContent": {
      "src": [
        {
          "src": "https://dms.licdn.com/playlist/vid/v2/D5605AQFpG5WU9HJ5lQ/mp4-640p-30fp-crf28/B56ZUpxzssHsBc-/0/1740162694269?e=1741690800&v=beta&t=TsFI5y8-j1QkJ3P1zDCWwpfYwZ6rFleKob-AgoTeJ94",
          "type": "video/mp4",
          "data-bitrate": 928183
        },
        {
          "src": "https://dms.licdn.com/playlist/vid/v2/D5605AQFpG5WU9HJ5lQ/mp4-720p-30fp-crf28/B56ZUpxzssHsBg-/0/1740162691617?e=1741690800&v=beta&t=HG4Wa8AzIAJsectxKQhpn2hNPkFoLyEsiqB3cJPCyJM",
          "type": "video/mp4",
          "data-bitrate": 1230355
        }
      ],
      "posterUrl": "https://media.licdn.com/dms/image/v2/D5605AQFpG5WU9HJ5lQ/feedshare-thumbnail_720_1280/B56ZUpxzssHsA8-/0/1740162679332?e=1741690800&v=beta&t=O8sk2KiQaAWBSTBlOLDi8qeCS7pdLA65SzuxRqsdt8k"
    },
    "date": "2025-02-25T10:36:41.493Z"
  },
  {
    "captions": "Table Scraps is BACK—with an exciting twist! 🍽️\n\nTable Scraps: The Chef’s Challenge premieres March 14th, bringing together fellow recyclers for a fun kitchen showdown! Which team is coming out on top? 🍳🔥\n\nDon’t miss out—subscribe on YouTube today! 🎥 Link in the comments! ⬇️\n#TableScraps #ChefsChallenge #RecyclingIndustry #Sustainability #Foodie\n\n---\n\nAndrew Lincoln, Michael Sciaba, Michael Goldstein🟦, Abby Goldstein, Patrick Young, Mark Hadacek, Stuart Kagan, 🧿 Atilla W., Antonio Tammaro, Alton Schaubhut, John Sacco",
    "likes": "23",
    "comments": "5",
    "shares": "2",
    "time": {
      "raw": "1h",
      "parsed": "25.02.2025",
      "isoString": "2025-02-25T10:36:41.494Z"
    },
    "mediaType": "video",
    "mediaContent": {
      "src": [
        {
          "src": "https://dms.licdn.com/playlist/vid/v2/D5605AQE-ZM1HQUcLvw/mp4-720p-30fp-crf28/B56ZUlrkWPGoBg-/0/1740093943965?e=1741690800&v=beta&t=azXpxmtIvMsd6iOvNX6Rakw-J2emG3XUYP4hyi-RV1Y",
          "type": "video/mp4",
          "data-bitrate": 361000
        },
        {
          "src": "https://dms.licdn.com/playlist/vid/v2/D5605AQE-ZM1HQUcLvw/mp4-640p-30fp-crf28/B56ZUlrkWPGoBc-/0/1740093943736?e=1741690800&v=beta&t=-dl7EnQPsExIC0P1y7_1DrnB2WBoUjOVje3IwOVWa3c",
          "type": "video/mp4",
          "data-bitrate": 273412
        }
      ],
      "posterUrl": "https://media.licdn.com/dms/image/v2/D5605AQE-ZM1HQUcLvw/feedshare-thumbnail_720_1280/B56ZUlrkWPGoA8-/0/1740093934511?e=1741690800&v=beta&t=3tj04-9LLoDFK-U3GMc7BFJ0zMzAZeI9jSKCmsC5dZI"
    },
    "date": "2025-02-25T10:36:41.494Z"
  },
  {
    "captions": "Recycled copper retains its quality indefinitely—making it a critical material in today’s economy.\nThese bales—processed with our Sierra® REB-2—are on their way to becoming:\n\n⚡ Electrical wiring\n💻 Circuit boards\n🔧 Motors & transformers\n🚰 Plumbing systems\n🏠 Roofing & gutters\n🚗 Automotive components\n🔋 EV & battery tech\n✈️ Aerospace materials\n☀️ Renewable energy infrastructure\n\nWhen efficiency, durability, and throughput matter, the REB-2 delivers. More tons. More profit. Let’s talk.",
    "likes": "5",
    "time": {
      "raw": "1h",
      "parsed": "25.02.2025",
      "isoString": "2025-02-25T10:36:41.495Z"
    },
    "mediaType": "video",
    "mediaContent": {
      "src": [
        {
          "src": "https://dms.licdn.com/playlist/vid/v2/D5605AQEI_b6tUuM-8Q/mp4-720p-30fp-crf28/B56ZUkQ6iKGUBo-/0/1740070209849?e=1741690800&v=beta&t=Mpw0jYuScky7KZ1pka5YnTR_2h9vmBjanwW7JjwNawY",
          "type": "video/mp4",
          "data-bitrate": 1304986
        },
        {
          "src": "https://dms.licdn.com/playlist/vid/v2/D5605AQEI_b6tUuM-8Q/mp4-640p-30fp-crf28/B56ZUkQ6iKGUBk-/0/1740070209326?e=1741690800&v=beta&t=iUFaMfvGersNg7iH5jQDV4JsenjgQEC4ESkCelxRa-w",
          "type": "video/mp4",
          "data-bitrate": 992737
        }
      ],
      "posterUrl": "https://media.licdn.com/dms/image/v2/D5605AQEI_b6tUuM-8Q/feedshare-thumbnail_720_1280/B56ZUkQ6iKGUBE-/0/1740070178321?e=1741690800&v=beta&t=pwxLpMHGgTZd1U-BBcpa8L4aTpjle0F06mVc--w2bjk"
    },
    "date": "2025-02-25T10:36:41.495Z"
  },
  {
    "captions": "Sierra Recycling & Demolition is upgrading their operation, and this 2012 T1100CD shear/baler/logger is ready for a new home! \n\nKey features:\n✔️ New Floor for extended durability\n\n✔️ Rebuilt Pusher Cylinder (New Rod & Packing)\n\n✔️ (3) 125 HP Engines for maximum power\n\n✔️ New Brass Wear Plates to reduce friction and extend lifespan\n\n✔️ Shear & Pre-Compression for efficient processing\n\n🎥 Filmed: February 2025\n📍 Location: Bakersfield, CA\n📆 Delivery: March 2025\n\nWith a 29'6\" box and 14,577 hours (as of 10/14/2025) this machine is ready to go to work in your yard. Don’t miss out on this opportunity!\n\n📞 Interested? \nContact our sales team today ➡️ https://lnkd.in/gZ5HMB9P",
    "likes": "7",
    "shares": "2",
    "time": {
      "raw": "1h",
      "parsed": "24.02.2025",
      "isoString": "2025-02-24T14:17:35.295Z"
    },
    "mediaType": "video",
    "mediaContent": {
      "src": [
        {
          "src": "https://dms.licdn.com/playlist/vid/v2/D5605AQGHkczrOqncdQ/mp4-640p-30fp-crf28/B56ZUfF5BhGsBc-/0/1739983415024?e=1741618800&v=beta&t=RqdAKh_7rJvHzPcS6nnpAMSVTWGuaqU7wDo1ddW1pug",
          "type": "video/mp4",
          "data-bitrate": 883019
        },
        {
          "src": "https://dms.licdn.com/playlist/vid/v2/D5605AQGHkczrOqncdQ/mp4-720p-30fp-crf28/B56ZUfF5BhGsBg-/0/1739983416124?e=1741618800&v=beta&t=TOsKsF89Ss8MdfQ7HpRm6awtWVlfTt_x19U4JY_Iszo",
          "type": "video/mp4",
          "data-bitrate": 1159375
        }
      ],
      "posterUrl": "https://media.licdn.com/dms/image/v2/D5605AQGHkczrOqncdQ/videocover-low/B56ZUfF5BhGsCM-/0/1739983410653?e=1741618800&v=beta&t=SVnWGfjdUthmaF4X9ywDW7ZBX1EENtZ8ZFsIx0v3oL8"
    },
    "date": "2025-02-24T14:17:35.295Z"
  },
  {
    "captions": "Cutting I-beam like it’s nothing ✂️\n\nStrength. Speed. Efficiency. That's all the Sierra® T715SKL Shear/Baler/Logger knows! \n\nShear Force - 715 tons\nMain Compression - 170 tons\n\nProcesses: \n\nALL METAL\nSTAINLESS STEEL\nHMS #1 + #2 STEEL\nP&S\n\nFor more info reach out to one of our sales reps today! ➡️ https://lnkd.in/gZ5HMB9P",
    "likes": "5",
    "time": {
      "raw": "1h",
      "parsed": "24.02.2025",
      "isoString": "2025-02-24T14:17:35.296Z"
    },
    "mediaType": "video",
    "mediaContent": {
      "src": [
        {
          "src": "https://dms.licdn.com/playlist/vid/v2/D5605AQFoSPIYO-UoFQ/mp4-720p-30fp-crf28/B56ZUbc2DqHEBk-/0/1739922304647?e=1741618800&v=beta&t=jT-F8EpqjxhKTpkHqWAOOsh-GU5jeggZP2SYJGXwRCc",
          "type": "video/mp4",
          "data-bitrate": 1154348
        },
        {
          "src": "https://dms.licdn.com/playlist/vid/v2/D5605AQFoSPIYO-UoFQ/mp4-640p-30fp-crf28/B56ZUbc2DqHEBg-/0/1739922305437?e=1741618800&v=beta&t=w3mC0XKoYgdsT5d2Bo_kiXycruZULXigriQ_SdxHO1Q",
          "type": "video/mp4",
          "data-bitrate": 840865
        }
      ],
      "posterUrl": "https://media.licdn.com/dms/image/v2/D5605AQFoSPIYO-UoFQ/videocover-high/B56ZUbc2DqHEBw-/0/1739922303756?e=1741618800&v=beta&t=ZMwnP285ccy0fF3Bn809M5m4Ho2_43BYKsd5OfZuLaE"
    },
    "date": "2025-02-24T14:17:35.296Z"
  },
  {
    "captions": "Alter-Adjacent & Team Alter-Q’s secret weapon: Abby Goldstein (Michael Goldstein🟧's other half!) 📍St. Louis, MO\n\nAbby made the trip to Bakersfield for Table Scraps with Michael because of their shared love for food & their friends in the recycled materials industry! 🍽️Abby was keeping the kitchen going with mimosas & key tasks to get the dishes done in time! Tune in on March 14th to see how Team Alter-Q’s dishes turned out! 👀\n\n📺Don’t miss out! Subscribe to our YouTube channel link below!\nhttps://lnkd.in/gtP7jhBm\n\nAlter Trading",
    "likes": "27",
    "comments": "5",
    "shares": "1",
    "time": {
      "raw": "1h",
      "parsed": "05.03.2025",
      "isoString": "2025-03-05T05:02:55.513Z"
    },
    "mediaType": "video",
    "mediaContent": {
      "src": [
        {
          "src": "https://dms.licdn.com/playlist/vid/v2/D5605AQFEvBRK1Z3Fgg/mp4-720p-30fp-crf28/B56ZVdATLVHQB0-/0/1741022141910?e=1742364000&v=beta&t=HrYAa1j0YB63pp6NMAf_pOQSpAQ2frRkjd2C3_oLvxI",
          "type": "video/mp4",
          "data-bitrate": 1180291
        },
        {
          "src": "https://dms.licdn.com/playlist/vid/v2/D5605AQFEvBRK1Z3Fgg/mp4-640p-30fp-crf28/B56ZVdATLVHQBw-/0/1741022140606?e=1742364000&v=beta&t=YmDxTplS4ParnWNSLGpjQAEjua1RT-MLcr-wWQH86N0",
          "type": "video/mp4",
          "data-bitrate": 899038
        }
      ],
      "posterUrl": "https://media.licdn.com/dms/image/v2/D5605AQFEvBRK1Z3Fgg/feedshare-thumbnail_720_1280/B56ZVdATLVHQA8-/0/1741022115962?e=1742364000&v=beta&t=wrWnTmg3Zwh0CD92lIPArgFPObC1d1BLvKSZnijveVA"
    },
    "date": "2025-03-05T05:02:55.513Z"
  },
  {
    "captions": "Say hello to Michael Goldstein🟧! ♻️Alter Trading 🏆St. Louis, MO\n\nMichael & his other half Abby (who you’ll meet later today) came to the Table Scraps The Chef’s Challenge to rep Alter Trading & have some fun! Michael wasn’t so much focused on the food, but rather hyping his team up & making sure no one was caught cooking without a drink! Alter & Sierra go back many years, and we love continuing relationships in the recycled materials industry! 🤝 Cheers, Michael! 🍻\n\nTable Scraps drops March 14th → Subscribe to our Youtube Channel ⭐️ \nhttps://lnkd.in/gtP7jhBm",
    "likes": "38",
    "comments": "9",
    "shares": "1",
    "time": {
      "raw": "1h",
      "parsed": "05.03.2025",
      "isoString": "2025-03-05T05:02:55.514Z"
    },
    "mediaType": "video",
    "mediaContent": {
      "src": [
        {
          "src": "https://dms.licdn.com/playlist/vid/v2/D5605AQGzgBV3kH1iBg/mp4-640p-30fp-crf28/B56ZVc.mRxHsB0-/0/1741021701793?e=1742364000&v=beta&t=Hm2ZMEm9AJTiD00jXnVeHVEn8mpu4DSXxIdUzE2I40g",
          "type": "video/mp4",
          "data-bitrate": 776091
        },
        {
          "src": "https://dms.licdn.com/playlist/vid/v2/D5605AQGzgBV3kH1iBg/mp4-720p-30fp-crf28/B56ZVc.mRxHsB4-/0/1741021701234?e=1742364000&v=beta&t=AnVoPRP30F3XWfhpoIUtqTdlJ6i84NW_Uvqkczhnsr8",
          "type": "video/mp4",
          "data-bitrate": 1021574
        }
      ],
      "posterUrl": "https://media.licdn.com/dms/image/v2/D5605AQGzgBV3kH1iBg/feedshare-thumbnail_720_1280/B56ZVc.mRxHsBA-/0/1741021669679?e=1742364000&v=beta&t=Gmf-0BXDWRRTLRzG4OOYhsGnaNyN1Z346JklqFZjLT4"
    },
    "date": "2025-03-05T05:02:55.514Z"
  },
  {
    "captions": "The Sierra® T900 has been at the top of its class for 20+ years—and for good reason. \n\nWith a powerful yet efficient hydraulic system and a 36” throat for handling bulkier materials, this shear/baler/logger delivers unmatched productivity. 💪⚙️ \n\nAfter 16,000 hours in operation at Sierra Recycling & Demolition’s own yard, we can confidently say it’s built to perform.\n\n#MetalRecycling #SierraT900",
    "likes": "15",
    "time": {
      "raw": "1h",
      "parsed": "05.03.2025",
      "isoString": "2025-03-05T05:02:55.511Z"
    },
    "mediaType": "video",
    "mediaContent": {
      "src": [
        {
          "src": "https://dms.licdn.com/playlist/vid/v2/D5605AQHbF4ZE0gbpwA/mp4-640p-30fp-crf28/B56ZVi3bVtGUBc-/0/1741120456767?e=1742364000&v=beta&t=jEzGaLXLo7EDd_tItfEKm4RdNT-_cJ46Sylrl_pYWEk",
          "type": "video/mp4",
          "data-bitrate": 734765
        },
        {
          "src": "https://dms.licdn.com/playlist/vid/v2/D5605AQHbF4ZE0gbpwA/mp4-720p-30fp-crf28/B56ZVi3bVtGUBg-/0/1741120457286?e=1742364000&v=beta&t=arvrZG6MH-KL8qTN6TdSZ1VxIzqXqNG8XNrR_HmSRr8",
          "type": "video/mp4",
          "data-bitrate": 1001282
        }
      ],
      "posterUrl": "https://media.licdn.com/dms/image/v2/D5605AQHbF4ZE0gbpwA/videocover-high/B56ZVi3bVtGUBs-/0/1741120455061?e=1742364000&v=beta&t=cLZ3oNuuUWRzZZeOMJmbyu7PNWf1K0wiJYhdaavTj9A"
    },
    "date": "2025-03-05T05:02:55.511Z"
  },
  {
    "captions": "Table Scraps🍽️: The Chef’s Challenge is a celebration of the relationships that fuel the recycling community—the shared experiences, the friendly rivalries, and the moments that bring us together.\n\nAnd at the end of the day? It’s just great food and even better company. \n\nSwipe through for a glimpse behind the scenes, and don’t miss Season 2—premiering March 14th!\n\n——\n\nJohn Sacco 🧿 Atilla W. Antonio Tammaro Stuart Kagan Andrew Lincoln Alton Schaubhut Patrick Young Mark Hadacek Michael Goldstein🟧 Abby Goldstein Giovanna SaccoTable Scraps🍽️: The Chef’s Challenge is a celebration of the relationships that fuel the recycling community—the shared experiences, the friendly rivalries, and the moments that bring us together.\n\nAnd at the end of the day? It’s just great food and even better company. \n\nSwipe through for a glimpse behind the scenes, and don’t miss Season 2—premiering March 14th!\n\n——\n\nJohn Sacco 🧿 Atilla W. Antonio Tammaro Stuart Kagan Andrew Lincoln Alton Schaubhut Patrick Young Mark Hadacek Michael Goldstein🟧 Abby Goldstein Giovanna Sacco",
    "likes": "39",
    "comments": "5",
    "shares": "2",
    "time": {
      "raw": "1h",
      "parsed": "05.03.2025",
      "isoString": "2025-03-05T05:02:55.512Z"
    },
    "mediaType": "image",
    "mediaContent": [
      "https://media.licdn.com/dms/image/v2/D5622AQHOTgZHPpl_Rw/feedshare-shrink_800/B56ZVdg2FnGoAg-/0/1741030662433?e=1744848000&v=beta&t=F-rqA03gQI2nRHoxuv7IYcS43cCWQ1DrZpODth70RIY",
      "https://media.licdn.com/dms/image/v2/D5622AQEUY9wRhZc4fg/feedshare-shrink_800/B56ZVdg2FEHQAg-/0/1741030656895?e=1744848000&v=beta&t=sHbtbcu1ljrMvidmtrl3WKoO1OJKZ7z7_FGJmjN2Fts",
      "https://media.licdn.com/dms/image/v2/D5622AQFgh5qmSj9CUw/feedshare-shrink_800/B56ZVdg2FCGsAo-/0/1741030662916?e=1744848000&v=beta&t=1rFBn-oyFc6UWqjtNHSP_ilQD9vgNs_5hp0NmJWHBCw",
      "https://media.licdn.com/dms/image/v2/D5622AQFNzxMwoPT1sQ/feedshare-shrink_800/B56ZVdg2F7GQAg-/0/1741030658375?e=1744848000&v=beta&t=9P1a6pQY179mqw2iBxXtUWaVsPziCwr-jDIGcMPKekU",
      "https://media.licdn.com/dms/image/v2/D5622AQErNAxB4ZeliA/feedshare-shrink_800/B56ZVdg2GPHEAk-/0/1741030656798?e=1744848000&v=beta&t=SdX69gK0pWR59nF31rhWaW3DOJEh4gJWTjIp_BFcIfE"
    ],
    "date": "2025-03-05T05:02:55.512Z"
  },
  {
    "captions": "In the aftermath of the devastating Palisades Fire, our hearts go out to all those affected. As recovery efforts continue, one of Sierra®'s RB6000 portable baler/loggers is on the ground in the Palisades, assisting in the cleanup and recycling efforts. \n\nWhat was lost can find new life through the recycling and repurposing of materials!\n\n#lafires #palisades #rebuildpalisadesIn the aftermath of the devastating Palisades Fire, our hearts go out to all those affected. As recovery efforts continue, one of Sierra®'s RB6000 portable baler/loggers is on the ground in the Palisades, assisting in the cleanup and recycling efforts. \n\nWhat was lost can find new life through the recycling and repurposing of materials!\n\n#lafires #palisades #rebuildpalisades",
    "likes": "6",
    "shares": "1",
    "time": {
      "raw": "5s",
      "parsed": "12.03.2025",
      "isoString": "2025-03-12T00:02:55.491Z"
    },
    "mediaType": "image",
    "mediaContent": [
      "https://media.licdn.com/dms/image/v2/D5610AQHq2TRKohKQTw/image-shrink_800/B56ZWHeczYHQAg-/0/1741734662424?e=1742364000&v=beta&t=3_B1YkQ9HgCWp5V9vynS0d3M9Ahklgbii58tTBIQXSk",
      "https://media.licdn.com/dms/image/v2/D5610AQGiw-y-zOO6Mg/image-shrink_800/B56ZWHec.2HEAc-/0/1741734662523?e=1742364000&v=beta&t=09MC9DUzIgEeXfxHAKyv4pDS4TQRsC0hu8xHH1iwDPM",
      "https://media.licdn.com/dms/image/v2/D5610AQE2MSJGMctn7Q/image-shrink_800/B56ZWHedHiHEAc-/0/1741734663732?e=1742364000&v=beta&t=Or1Uh7FQywko9O1rfQ7tTxIsNWV12Flf60QErW52No0",
      "https://media.licdn.com/dms/image/v2/D5610AQEG9Y50isWlAg/image-shrink_800/B56ZWHedV.HEAc-/0/1741734666077?e=1742364000&v=beta&t=5rH4S9kAJwwXeXBoLRVCcDWT543uq8d2mUSo6zXa6QY",
      "https://media.licdn.com/dms/image/v2/D5610AQGjbbT2uszeJA/image-shrink_800/B56ZWHedl0GoAc-/0/1741734665524?e=1742364000&v=beta&t=W0r6Imjk35ERM7OJ-pzKuZgANcwchxE_k6-Yi9f1-O4"
    ],
    "date": "2025-03-12T00:02:55.491Z"
  },
  {
    "captions": "Next up on Team International:  🧿 Atilla W. 📍Singapore 🤝 Navigate Commodities \n\nAtilla met John Sacco in Copenhagen at the B.I.R. after his impactful presentation! He knows the importance of changing the narrative around the Recycled Materials Industry! AND he also loves to cook 🍽️ Team International is excited about this meal full of Italian influence. We can’t wait to watch this unfold → 3 DAYS! Table Scraps: The Chef’s Challenge coming Friday March 14 on our YouTube Channel! \n\n📺 Subscribe on YouTube: https://lnkd.in/gtP7jhBm",
    "likes": "13",
    "comments": "2",
    "time": {
      "raw": "10s",
      "parsed": "11.03.2025",
      "isoString": "2025-03-11T19:02:55.493Z"
    },
    "mediaType": "video",
    "mediaContent": {
      "src": [
        {
          "src": "https://dms.licdn.com/playlist/vid/v2/D5610AQH0lBXBqxVkRg/mp4-640p-30fp-crf28/B56ZWGkFgcGUBs-/0/1741719370654?e=1742364000&v=beta&t=xpsccUe2M_wh90cmHOOx6egM4ceBSyRQ3PFHcICuwKU",
          "type": "video/mp4",
          "data-bitrate": 914841
        },
        {
          "src": "https://dms.licdn.com/playlist/vid/v2/D5610AQH0lBXBqxVkRg/mp4-360p-30fp-crf28/B56ZWGkFgcGUBo-/0/1741719368494?e=1742364000&v=beta&t=-BxC5uEdVJJfUJ3rYij6WrsKBogc9GhQ6pZbKQ83haU",
          "type": "video/mp4",
          "data-bitrate": 402170
        },
        {
          "src": "https://dms.licdn.com/playlist/vid/v2/D5610AQH0lBXBqxVkRg/mp4-720p-30fp-crf28/B56ZWGkFgcGUBw-/0/1741719370997?e=1742364000&v=beta&t=2k3Q0CPymG8Wd-yN2v0rtSjtGginFPm7F-aULQ8zhk4",
          "type": "video/mp4",
          "data-bitrate": 1229916
        }
      ],
      "posterUrl": "https://media.licdn.com/dms/image/v2/D5610AQH0lBXBqxVkRg/ads-video-thumbnail_720_1280/B56ZWGkFgcGUAc-/0/1741719365126?e=1742364000&v=beta&t=lgkqnV8r-4oRMuZ6Iay3I5XZuMy7SZmQbR_0wiEq3u8"
    },
    "date": "2025-03-11T19:02:55.493Z"
  },
  {
    "captions": "Make sure you say hi 👋 to Cameron Keefe and Tom Jansen at C&D World Conference + Expo - Booth #7!\nSierra International Machinery is proudly exhibiting at the Construction & Demolition Recycling Association (CDRA)’s event C&D World Conference in Dallas, TX. \n\nStop by booth 7 to learn how our two-ram balers and material handlers can help your operations today! \n\n#machinery #networking #TheSierraWaySierra International Machinery is proudly exhibiting at the Construction & Demolition Recycling Association (CDRA)’s event C&D World Conference in Dallas, TX. \n\nStop by booth 7 to learn how our two-ram balers and material handlers can help your operations today! \n\n#machinery #networking #TheSierraWay",
    "time": {
      "raw": "10s10s",
      "parsed": "12.03.2025",
      "isoString": "2025-03-12T05:02:55.498Z"
    },
    "mediaType": "image",
    "mediaContent": [
      "https://media.licdn.com/dms/image/v2/D4E22AQFr4CnA9GSMRw/feedshare-shrink_800/B4EZWGgy2cGwAg-/0/1741718507530?e=1744848000&v=beta&t=f0ZqEZIihUTIJF3pWkwrMvqQcBiEYAfMiu6C6RN7J4c"
    ],
    "date": "2025-03-12T05:02:55.498Z"
  },
  {
    "captions": "Sierra International Machinery is proudly exhibiting at the Construction & Demolition Recycling Association (CDRA)’s event C&D World Conference in Dallas, TX. \n\nStop by booth 7 to learn how our two-ram balers and material handlers can help your operations today! \n\n#machinery #networking #TheSierraWaySierra International Machinery is proudly exhibiting at the Construction & Demolition Recycling Association (CDRA)’s event C&D World Conference in Dallas, TX. \n\nStop by booth 7 to learn how our two-ram balers and material handlers can help your operations today! \n\n#machinery #networking #TheSierraWay",
    "time": {
      "raw": "10s",
      "parsed": "11.03.2025",
      "isoString": "2025-03-11T19:02:55.500Z"
    },
    "mediaType": "image",
    "mediaContent": [
      "https://media.licdn.com/dms/image/v2/D4E22AQFr4CnA9GSMRw/feedshare-shrink_800/B4EZWGgy2cGwAg-/0/1741718507530?e=1744848000&v=beta&t=f0ZqEZIihUTIJF3pWkwrMvqQcBiEYAfMiu6C6RN7J4c"
    ],
    "date": "2025-03-11T19:02:55.500Z"
  },
  {
    "captions": "Sierra, Nuestra 409, perfecto complemento para tus operaciones, movimientos de materiales, carga de maquinaria, rapidez de carga y descarga de góndolas,Sierra, Nuestra 409, perfecto complemento para tus operaciones, movimientos de materiales, carga de maquinaria, rapidez de carga y descarga de góndolas,",
    "likes": "5",
    "shares": "1",
    "time": {
      "raw": "14s",
      "parsed": "11.03.2025",
      "isoString": "2025-03-11T15:02:55.502Z"
    },
    "mediaType": "image",
    "mediaContent": [
      "https://media.licdn.com/dms/image/v2/D4E22AQHBiz7d_tYzQw/feedshare-shrink_800/B4EZWFt7DPHMAo-/0/1741705166334?e=1744848000&v=beta&t=oRIO44iQJkni-B0woXaTQeOoNTXZ603iA3ynun1brIs"
    ],
    "date": "2025-03-11T15:02:55.502Z"
  },
  {
    "captions": "Our Buddy: Stuart Kagan! 📍ATX ♻️BUDDY - Born Scrappy \n\nStuart is a long time ‘buddy’ of Sierra! We have appreciated his love & support since day 1! 🌎\n\nStuart called his friends from all around the world to compete in Table Scraps! Team International is bringing their fresh & light flavors to try & win the Italian judges tastebuds over. THIS FRIDAY! MARCH 14! Don’t miss the dishes that Team INT puts together (😱) \n\n📺 Subscribe on YouTube: https://lnkd.in/dSqJ4r8m",
    "likes": "25",
    "comments": "2",
    "shares": "1",
    "time": {
      "raw": "1g",
      "parsed": "11.03.2025",
      "isoString": "2025-03-11T05:02:55.503Z"
    },
    "mediaType": "video",
    "mediaContent": {
      "src": [
        {
          "src": "https://dms.licdn.com/playlist/vid/v2/D4D05AQEXILkeqVAEuw/mp4-720p-30fp-crf28/B4DZWCAwyKHIBo-/0/1741643023900?e=1742364000&v=beta&t=ve7oMNEwB7_uwCSk2UNVTZAiiv-qaOeUyDN5HPWyLTQ",
          "type": "video/mp4",
          "data-bitrate": 1091350
        },
        {
          "src": "https://dms.licdn.com/playlist/vid/v2/D4D05AQEXILkeqVAEuw/mp4-640p-30fp-crf28/B4DZWCAwyKHIBk-/0/1741643023675?e=1742364000&v=beta&t=5TzLI9SEBSFBHJt26LeJnKng9RKUv5lx-oujs-GEK64",
          "type": "video/mp4",
          "data-bitrate": 820813
        }
      ],
      "posterUrl": "https://media.licdn.com/dms/image/v2/D4D05AQEXILkeqVAEuw/videocover-high/B4DZWCAwyKHIB0-/0/1741643017706?e=1742364000&v=beta&t=GjO8Yzkj-ApS_ZEJN8RTNElcwFvlatT0ZK8q0l4CiZY"
    },
    "date": "2025-03-11T05:02:55.503Z"
  },
  {
    "captions": "Got milk?🥛\n\nThe Sierra® REB-4 makes quick work of plastic, turning loose material into dense, high-quality bales. With its patented dual-compression doors, rollback is eliminated—meaning more efficient baling! ♻️ \n\nAvailable with either a 150 or 250 HP power unit, it's built for high production and versatility. From plastics to non-ferrous metals, tires, and fiber, the REB-4 delivers the performance recyclers need.",
    "likes": "7",
    "time": {
      "raw": "2g",
      "parsed": "10.03.2025",
      "isoString": "2025-03-10T05:02:55.504Z"
    },
    "mediaType": "video",
    "mediaContent": {
      "src": [
        {
          "src": "https://dms.licdn.com/playlist/vid/v2/D5610AQEfvSwIe0yPZg/mp4-360p-30fp-crf28/B56ZV7.0poHoBo-/0/1741541830059?e=1742364000&v=beta&t=NtTgnZan_d97ff2tqEZ-jBy3SCIRoDHWa0QKG4ZckJc",
          "type": "video/mp4",
          "data-bitrate": 311246
        },
        {
          "src": "https://dms.licdn.com/playlist/vid/v2/D5610AQEfvSwIe0yPZg/mp4-720p-30fp-crf28/B56ZV7.0poHoBw-/0/1741541829536?e=1742364000&v=beta&t=N--_mMg3d2h-BxCAhHzWUREe0_hnvBSv11c451YT5ww",
          "type": "video/mp4",
          "data-bitrate": 905533
        },
        {
          "src": "https://dms.licdn.com/playlist/vid/v2/D5610AQEfvSwIe0yPZg/mp4-640p-30fp-crf28/B56ZV7.0poHoBs-/0/1741541831126?e=1742364000&v=beta&t=K7DYHmooeq34LSMBht0gm9I80LKk_vKYSE33g0iuWVE",
          "type": "video/mp4",
          "data-bitrate": 693096
        }
      ],
      "posterUrl": "https://media.licdn.com/dms/image/v2/D5610AQEfvSwIe0yPZg/ads-video-thumbnail_720_1280/B56ZV7.0poHoAc-/0/1741541824859?e=1742364000&v=beta&t=TP0JxvmL8icqeYBPtqFZ5Wv8HNd7HG4Inyepu2zZwu8"
    },
    "date": "2025-03-10T05:02:55.504Z"
  },
  {
    "captions": "Will Team International’s 🇿🇦 🇮🇹 🇸🇬  global experience give them the upper hand, or will they get lost in translation? 👀\n\nFind out when Table Scraps returns for The Chef’s Challenge on March 14th!\n\nDrop a 🌍 if you’re backing Team International! \n\nAntonio Tammaro Stuart Kagan 🧿 Atilla W. John Sacco",
    "likes": "7",
    "comments": "1",
    "time": {
      "raw": "2g",
      "parsed": "10.03.2025",
      "isoString": "2025-03-10T05:02:55.505Z"
    },
    "mediaType": "video",
    "mediaContent": {
      "src": [
        {
          "src": "https://dms.licdn.com/playlist/vid/v2/D5610AQEf8lsH30KVzg/mp4-640p-30fp-crf28/B56ZV7.0qUHoBo-/0/1741541825734?e=1742364000&v=beta&t=UW1DHsMFOzUI75yvK7oOXzoByWvULyZ0RqwlIw5fjbI",
          "type": "video/mp4",
          "data-bitrate": 1059096
        },
        {
          "src": "https://dms.licdn.com/playlist/vid/v2/D5610AQEf8lsH30KVzg/mp4-360p-30fp-crf28/B56ZV7.0qUHoBk-/0/1741541825478?e=1742364000&v=beta&t=c68CgFqSZvKDrrgj-yq3ks7V2kPZb5Mc9BCNc3sT2pI",
          "type": "video/mp4",
          "data-bitrate": 453594
        },
        {
          "src": "https://dms.licdn.com/playlist/vid/v2/D5610AQEf8lsH30KVzg/mp4-720p-30fp-crf28/B56ZV7.0qUHoBs-/0/1741541825863?e=1742364000&v=beta&t=qqlfaul43x8YvGlmhvRS-MazQsP1EGaNbuuXEetNEnc",
          "type": "video/mp4",
          "data-bitrate": 1387393
        }
      ],
      "posterUrl": "https://media.licdn.com/dms/image/v2/D5610AQEf8lsH30KVzg/ads-video-thumbnail_720_1280/B56ZV7.0qUHoAY-/0/1741541823936?e=1742364000&v=beta&t=FMGW_-9KXOYnXE1DI3J9WyszhZfnunUD_nIWP8Nmu1w"
    },
    "date": "2025-03-10T05:02:55.505Z"
  },
  {
    "captions": "Something about that Sierra® red & yellow!🔥 | REB-8 Two-Ram BalerSomething about that Sierra® red & yellow!🔥 | REB-8 Two-Ram Baler",
    "likes": "15",
    "shares": "1",
    "time": {
      "raw": "4g",
      "parsed": "08.03.2025",
      "isoString": "2025-03-08T05:02:55.506Z"
    },
    "mediaType": "image",
    "mediaContent": [
      "https://media.licdn.com/dms/image/v2/D5610AQHzAri0Bt2X_w/image-shrink_800/B56ZVyKU1eHQAg-/0/1741377064948?e=1742364000&v=beta&t=-TmJ64vuCPkGprAcPY-Gd0xJHRE0iJE-VL4aHwwrqck",
      "https://media.licdn.com/dms/image/v2/D5610AQFNm4YGbXjm0g/image-shrink_800/B56ZVyKVADGQAc-/0/1741377065670?e=1742364000&v=beta&t=Px9jmPpmm1wwyWsaD8dpYx8xynzYxXvsbq2lxlQbJQc",
      "https://media.licdn.com/dms/image/v2/D5610AQGOJ9Ld2K2W9Q/image-shrink_800/B56ZVyKVMGHQAg-/0/1741377066156?e=1742364000&v=beta&t=w97zh9rZN81U-KmoKwThSAGvorXTSv-ulHYyXtFJacA",
      "https://media.licdn.com/dms/image/v2/D5610AQGQlsn5t_WKoA/image-shrink_800/B56ZVyKVUIHsAc-/0/1741377066602?e=1742364000&v=beta&t=xdSzud57TOHjD54Go6OPt1Lzzwa0_ZdO-NMYEFHox0g",
      "https://media.licdn.com/dms/image/v2/D5610AQF8Kl9tFLJ0tA/image-shrink_800/B56ZVyKVckGsAc-/0/1741377067942?e=1742364000&v=beta&t=jk1lvuZfB3l5rEgq9bMZVAyqp4dvJr32875I89HxV8A"
    ],
    "date": "2025-03-08T05:02:55.506Z"
  },
  {
    "captions": "Almost 20 years old and still plays a vital role. This T500 has been through hurricanes, blazing summers and even snow/ice storms. This durability is what customers have come to expect from Sierra International Machinery !Almost 20 years old and still plays a vital role. This T500 has been through hurricanes, blazing summers and even snow/ice storms. This durability is what customers have come to expect from Sierra International Machinery !",
    "likes": "23",
    "comments": "1",
    "shares": "1",
    "time": {
      "raw": "4g",
      "parsed": "08.03.2025",
      "isoString": "2025-03-08T05:02:55.507Z"
    },
    "mediaType": "image",
    "mediaContent": [
      "https://media.licdn.com/dms/image/v2/D4E22AQG78WdwLkmEbg/feedshare-shrink_800/B4EZVxn9uMH0Ak-/0/1741368062355?e=1744848000&v=beta&t=HmEa7XtLv0-6__Nc05X_EQsZwHVhzMj8Qf28e7AZcMM"
    ],
    "date": "2025-03-08T05:02:55.507Z"
  },
  {
    "captions": "The Sierra® REB-8 two-ram baler is built for maximum performance—offering greater input density in the charging chamber and minimizing material shearing by 90% when the doors are fully closed.\n\nWhat does this mean for your operation?\n\n✔ Reduced shear and hydraulic shock for smoother operation\n\n✔ Less stress on blades and structure, extending machine life\n\n✔ Lower energy costs, increasing efficiency and profitability\n\nWhen it comes to performance, the REB-8 is built to last and engineered to perform. \n\n#SierraInternationalMachinery #REB8 #RecyclingMachinery #BalingEfficiency #SustainableSolutions #IndustrialEquipment",
    "likes": "2",
    "time": {
      "raw": "5g",
      "parsed": "07.03.2025",
      "isoString": "2025-03-07T05:02:55.508Z"
    },
    "mediaType": "video",
    "mediaContent": {
      "src": [
        {
          "src": "https://dms.licdn.com/playlist/vid/v2/D5605AQEqLMytWl6G6A/mp4-640p-30fp-crf28/B56ZVtIg1kHQBc-/0/1741292707872?e=1742364000&v=beta&t=mejt0TUrPIxvg5zEHA4ifzro9u-xkDPeWlXtGQhg2eQ",
          "type": "video/mp4",
          "data-bitrate": 809318
        }
      ],
      "posterUrl": "https://media.licdn.com/dms/image/v2/D5605AQEqLMytWl6G6A/videocover-high/B56ZVtIg1kHQBs-/0/1741292706072?e=1742364000&v=beta&t=uJS_pEMruCYDCG1ScaRaBOlRRt-t0QcFQyBUx42NBqg"
    },
    "date": "2025-03-07T05:02:55.508Z"
  },
  {
    "captions": "Last but not least on Team Alter-Q: Patrick Young  📍Milwakee, WI 🤝Alter Trading \n\nPatrick is another certified foodie that brought his cooking game to CA! The dishes that Patrick makes on this season of Table Scraps will make your mouth water! From his speciality cut of meat to his incredible appetizer, you’re not going to want to miss Team Alter-Q’s meal.\n\nThanks for the sneak peak, Patrick! 🍽️\n\nSubscribe now on YouTube → almost 1 week away! 📺March 14th\n\nhttps://lnkd.in/gvnu-_id",
    "likes": "29",
    "comments": "7",
    "time": {
      "raw": "5g",
      "parsed": "07.03.2025",
      "isoString": "2025-03-07T05:02:55.509Z"
    },
    "mediaType": "video",
    "mediaContent": {
      "src": [
        {
          "src": "https://dms.licdn.com/playlist/vid/v2/D5605AQHPYW0ZGrkbDQ/mp4-720p-30fp-crf28/B56ZVsLysZGoBo-/0/1741276802910?e=1742364000&v=beta&t=vncWD1fZclzinB0tBb4cILyJiQgd61lUKduIpCSlwpk",
          "type": "video/mp4",
          "data-bitrate": 876646
        },
        {
          "src": "https://dms.licdn.com/playlist/vid/v2/D5605AQHPYW0ZGrkbDQ/mp4-640p-30fp-crf28/B56ZVsLysZGoBk-/0/1741276802208?e=1742364000&v=beta&t=g-OfXGveHsG4pnsmjEOtAOq8EQftJwmTH2F_D8VJrL0",
          "type": "video/mp4",
          "data-bitrate": 672227
        }
      ],
      "posterUrl": "https://media.licdn.com/dms/image/v2/D5605AQHPYW0ZGrkbDQ/videocover-high/B56ZVsLysZGoB0-/0/1741276797082?e=1742364000&v=beta&t=2Iw139IVhNmHMucgS1WT_4QN2nJgrnQ0k_VkzF3RViw"
    },
    "date": "2025-03-07T05:02:55.509Z"
  },
  {
    "captions": "Next Up on Team Alter-Q: Mark Hadacek  📍Milwaukee, WI\n\nMark lives to eat, not eating to live: certified foodie 🫡 Mark brought his prized black truffles for his porcini risotto… Let’s see if it gives team Alter-Q the edge with the judges!\n\nMark’s in the business of making good food – subscribe to Table Scraps on our YouTube channel → coming March 14th ♻️\nhttps://lnkd.in/g-VSPrHf \n\nAlter Trading John Sacco",
    "likes": "24",
    "comments": "3",
    "shares": "2",
    "time": {
      "raw": "6g",
      "parsed": "06.03.2025",
      "isoString": "2025-03-06T05:02:55.510Z"
    },
    "mediaType": "video",
    "mediaContent": {
      "src": [
        {
          "src": "https://dms.licdn.com/playlist/vid/v2/D5605AQENE_OSvk5dHQ/mp4-640p-30fp-crf28/B56ZVnMK6fHQBs-/0/1741193015652?e=1742364000&v=beta&t=CGoBqF0aMKCfZ4GWzTwVxxrMC-esc95SPg3RdpXMUo4",
          "type": "video/mp4",
          "data-bitrate": 812346
        },
        {
          "src": "https://dms.licdn.com/playlist/vid/v2/D5605AQENE_OSvk5dHQ/mp4-720p-30fp-crf28/B56ZVnMK6fHQBw-/0/1741193016446?e=1742364000&v=beta&t=H6-eTilX9AOUtNyE30vzjMNKWbpJSWAp8dBz9hMaAnQ",
          "type": "video/mp4",
          "data-bitrate": 1061646
        }
      ],
      "posterUrl": "https://media.licdn.com/dms/image/v2/D5605AQENE_OSvk5dHQ/videocover-high/B56ZVnMK6fHQB8-/0/1741193012033?e=1742364000&v=beta&t=PGYclnPP2Jucf7NUYki2ICibBs0fLJCPsJbkl9-zmyI"
    },
    "date": "2025-03-06T05:02:55.510Z"
  }
]