{
  "followerData": [
    [
      20250225,
      926
    ],
    [
      20250225,
      926
    ],
    [
      20250225,
      926
    ],
    [
      20250228,
      927
    ],
    [
      20250228,
      927
    ],
    [
      20250228,
      927
    ],
    [
      20250228,
      927
    ],
    [
      20250303,
      928
    ],
    [
      1741011738663,
      "928"
    ],
    [
      1741076701818,
      "929"
    ],
    [
      1741077847252,
      "929"
    ],
    [
      1741083823305,
      "929"
    ],
    [
      1741084837241,
      "929"
    ],
    [
      1741170597875,
      930
    ],
    [
      1741755988509,
      935
    ],
    [
      1741848901895,
      935
    ],
    [
      1742188093307,
      937
    ],
    [
      1742966681292,
      937
    ],
    [
      1744004562195,
      940
    ],
    [
      1744606127655,
      941
    ],
    [
      1745214794902,
      942
    ],
    [
      1745472322987,
      943
    ],
    [
      1745816511282,
      944
    ],
    [
      1746164463108,
      950
    ]
  ],
  "data": [
    {
      "captions": "Saremo presenti ad ECOMONDO - ITALIAN EXHIBITION GROUP  2024, dal 5 all’8 Novembre. Ci troverete al Rimini Expo Centre, Hall C3, Stand 301. Venite a scoprire il nuovo T815 e la nuova cabina!Non mancate!\n\nWe will be at Ecomondo 2024, from 5th to 8th November. You will find us at Rimini Expo Centre, Hall C3, Stand 301. Come and discover the new T815 and the new cab there!\n\n#ecomondo #tabarelli #materialhandler #recycling",
      "likes": "27",
      "shares": "3",
      "time": {
        "raw": "5ay",
        "parsed": "02.12.2024",
        "isoString": "2024-12-02T05:41:02.853Z"
      },
      "mediaType": "video",
      "mediaContent": {
        "src": [
          {
            "src": "https://dms.licdn.com/playlist/vid/v2/D4D05AQF3IwOSh1uWhQ/mp4-640p-30fp-crf28/mp4-640p-30fp-crf28/0/1730814532848?e=1746770400&v=beta&t=RnjVgNuLTk-hRS72_CFzrKYgjqZtb2QLuUK5kH-R9rA",
            "type": "video/mp4",
            "data-bitrate": 699053
          },
          {
            "src": "https://dms.licdn.com/playlist/vid/v2/D4D05AQF3IwOSh1uWhQ/mp4-720p-30fp-crf28/mp4-720p-30fp-crf28/0/1730814532477?e=1746770400&v=beta&t=2vBaWUL-H0D3fa7sfXbOCMt2fPWjKi4NT_j66jVShVk",
            "type": "video/mp4",
            "data-bitrate": 994330
          }
        ],
        "posterUrl": "https://media.licdn.com/dms/image/v2/D4D05AQF3IwOSh1uWhQ/videocover-high/videocover-high/0/1730814528608?e=1746770400&v=beta&t=B2cc_9N4SrPs2F5I0-xkfEa4QZMy07z92s8V1bvRVmU"
      },
      "date": "2024-12-02T05:41:02.853Z"
    },
    {
      "captions": "Saremo presenti ad Ecomondo 2024, dal 5 all’8 Novembre. Ci troverete al Rimini Expo Centre, Hall C3, Stand 301. Non mancate!\n\nWe will be at Ecomondo 2024, from 5th to 8th November. You will find us at Rimini Expo Centre, Hall C3, Stand 301. Be there!\n\n#ecomondo #tabarelli #materialhandler #recyclingSaremo presenti ad Ecomondo 2024, dal 5 all’8 Novembre. Ci troverete al Rimini Expo Centre, Hall C3, Stand 301. Non mancate!\n\nWe will be at Ecomondo 2024, from 5th to 8th November. You will find us at Rimini Expo Centre, Hall C3, Stand 301. Be there!\n\n#ecomondo #tabarelli #materialhandler #recycling",
      "likes": "15",
      "shares": "2",
      "time": {
        "raw": "5ay",
        "parsed": "02.12.2024",
        "isoString": "2024-12-02T05:41:02.855Z"
      },
      "mediaType": "image",
      "mediaContent": [
        "https://media.licdn.com/dms/image/v2/D4D22AQHeMPL6gYAoEA/feedshare-shrink_800/feedshare-shrink_800/0/1730667100300?e=1749081600&v=beta&t=GJEuqAq-AroyEweA3yOSHLdsM7SWoYmpDbTIIH_CFD0"
      ],
      "date": "2024-12-02T05:41:02.855Z"
    },
    {
      "captions": "Nuova cabina 2024:\n-   Design moderno\n- Maggior sicurezza (questa cabina è molto più solida e le griglie protettive superiori e frontali sono più robuste rispetto alla precedente)\n- Comfort (cabina più grande come abitacolo, visibilità lato destro aumentata, climatizzatore con potenza doppia rispetto alla precedente)\n- Sistema di filtraggio aria ottimizzato (doppio filtro)\n- Display touch screen 7”\n- Estintore in cabina\n- Nuovo cruscotto con porta telefono, porta bottiglie e vasca porta oggetti dietro al sedile che permette di mettere un piccolo frigo\n- Cambio filtro aria esterna e rabbocco liquido tergi cristalli molto agevole aprendo la portellina in ABS\n- Griglia anteriore e superiore sono apribili per consentire la pulizia dei vetri\n- Assistenza remota\n \nNew Cab 2024: \n- Modern design:\n- Better security: the front and upper protective grilles have been reinforced, providing additional protection for the operator\n- Enhanced comfort: the cockpit is more spacious; side visibility, particularly on the right side, has been improved; air conditioning system has doubled its power.\n- Optimised air filter system: improved by adding a double filter.\n- 7-inch touch screen display:\n- Cab fire extinguisher\n- New multifunctional dashboard with a telephone holder, a bottle holder and a storage tub located behind the seat, that can also be used to store a refrigerator\n- Ease of maintenance:** easily allows access to components without having to remove parts of the cab.\n- Accessibility for window cleaning:** Both the front and top grille are designed to be openable.\n- Remote assistance\n #tabarelli #materialhandler #recycling #newcab",
      "likes": "38",
      "comments": "1",
      "shares": "9",
      "time": {
        "raw": "6ay",
        "parsed": "02.11.2024",
        "isoString": "2024-11-02T05:41:02.856Z"
      },
      "mediaType": "video",
      "mediaContent": {
        "src": [
          {
            "src": "https://dms.licdn.com/playlist/vid/v2/D4D05AQFX9R2-yJIHyw/mp4-640p-30fp-crf28/mp4-640p-30fp-crf28/0/1729772915824?e=1746770400&v=beta&t=orHJBtKJvNJ4OXDesOMCkMbpCDey5npEqARGNFYwRXk",
            "type": "video/mp4",
            "data-bitrate": 917714
          },
          {
            "src": "https://dms.licdn.com/playlist/vid/v2/D4D05AQFX9R2-yJIHyw/mp4-720p-30fp-crf28/mp4-720p-30fp-crf28/0/1729772915250?e=1746770400&v=beta&t=6jeW-nWrrcyuNfA7sr85oQD8xC56V5Qgl9IIeVGY0qk",
            "type": "video/mp4",
            "data-bitrate": 1210063
          }
        ],
        "posterUrl": "https://media.licdn.com/dms/image/v2/D4D05AQFX9R2-yJIHyw/videocover-high/videocover-high/0/1729772911754?e=1746770400&v=beta&t=B0kYgGba4ksLFE996O7TCX5p9xj4jdDabNC_X44qTcg"
      },
      "date": "2024-11-02T05:41:02.856Z"
    },
    {
      "likes": "8",
      "comments": "1",
      "time": {
        "raw": "8ay",
        "parsed": "02.09.2024",
        "isoString": "2024-09-02T05:41:02.859Z"
      },
      "mediaType": "image",
      "mediaContent": [
        "https://media.licdn.com/dms/image/v2/D4D22AQGw9jFEIJWWdw/feedshare-shrink_800/feedshare-shrink_800/0/1722880496475?e=1749081600&v=beta&t=zaKoNVP2fI2h5KoVKQzlefBWeG1gtrwY8iTwcZdHf2U"
      ],
      "date": "2024-09-02T05:41:02.859Z"
    },
    {
      "captions": "T510 material handler for Sierra International Machinery  :\n- Stage V Cummins engine (129 kw/175 hp)\n- 13 m boom\n- 4 outriggers\n#recycling #tabarelli #materialhandler",
      "likes": "26",
      "shares": "4",
      "time": {
        "raw": "9ay",
        "parsed": "02.08.2024",
        "isoString": "2024-08-02T05:41:02.860Z"
      },
      "mediaType": "video",
      "mediaContent": {
        "src": [
          {
            "src": "https://dms.licdn.com/playlist/vid/v2/D4E05AQGo4UPJaIchuA/feedshare-ambry-analyzed_servable_progressive_video/feedshare-ambry-analyzed_servable_progressive_video/0/1722504270783?e=1746770400&v=beta&t=t03YDEfVOuM_R_PZ4fM-oz7NaLmATIVWDgS37i4QAd4",
            "type": "video/mp4",
            "data-bitrate": 3138128
          },
          {
            "src": "https://dms.licdn.com/playlist/vid/v2/D4E05AQGo4UPJaIchuA/mp4-640p-30fp-crf28/mp4-640p-30fp-crf28/0/1722504275976?e=1746770400&v=beta&t=QuEakwYXGE4PH2uALjBw17czijwNxakEj6M2W1W_Yeo",
            "type": "video/mp4",
            "data-bitrate": 1013523
          },
          {
            "src": "https://dms.licdn.com/playlist/vid/v2/D4E05AQGo4UPJaIchuA/mp4-720p-30fp-crf28/mp4-720p-30fp-crf28/0/1722504274618?e=1746770400&v=beta&t=fOMawYASmgixXZw-UIfgBqeXwvnHNqCa3SJtqZMO0rg",
            "type": "video/mp4",
            "data-bitrate": 1306626
          }
        ],
        "posterUrl": "https://media.licdn.com/dms/image/v2/D4E05AQGo4UPJaIchuA/videocover-high/videocover-high/0/1722504271387?e=1746770400&v=beta&t=wbPxolCQwKzmIeOEYo6G-RbNPwodJXKrdYo_1JMDOgk"
      },
      "date": "2024-08-02T05:41:02.860Z"
    },
    {
      "captions": "On  Recycling Magazine this month…\n#tabarelli #materialhandler #recycling",
      "likes": "8",
      "shares": "1",
      "time": {
        "raw": "9ay",
        "parsed": "02.08.2024",
        "isoString": "2024-08-02T05:41:02.861Z"
      },
      "mediaType": "video",
      "mediaContent": {
        "src": [
          {
            "src": "https://dms.licdn.com/playlist/vid/v2/D4D05AQGELldvToELdQ/feedshare-ambry-analyzed_servable_progressive_video/feedshare-ambry-analyzed_servable_progressive_video/0/1721067218079?e=1746770400&v=beta&t=CENl9jBCrMDi4kEl9E4CSs4f7e12rlah9t8T_nrGaqY",
            "type": "video/quicktime",
            "data-bitrate": 15076204
          },
          {
            "src": "https://dms.licdn.com/playlist/vid/v2/D4D05AQGELldvToELdQ/mp4-640p-30fp-crf28/mp4-640p-30fp-crf28/0/1721067233850?e=1746770400&v=beta&t=X-V9qWl_klKKGTUNGJ1AC0hGYPKepicoHUcjkipeJNw",
            "type": "video/mp4",
            "data-bitrate": 1071767
          },
          {
            "src": "https://dms.licdn.com/playlist/vid/v2/D4D05AQGELldvToELdQ/mp4-720p-30fp-crf28/mp4-720p-30fp-crf28/0/1721067233365?e=1746770400&v=beta&t=bwihcV_WAvHXB8Q33pJHDH-wiOkd-E17rHvBKvfv5Do",
            "type": "video/mp4",
            "data-bitrate": 1417740
          }
        ],
        "posterUrl": "https://media.licdn.com/dms/image/v2/D4D05AQGELldvToELdQ/videocover-high/videocover-high/0/1721067219607?e=1746770400&v=beta&t=7HPAgpleYYwofjijrZJeYvxoPhKvff1zGLwEGZpANDc"
      },
      "date": "2024-08-02T05:41:02.861Z"
    },
    {
      "captions": "4th day at IFAT 2024! Visit us at Hall C5, stand 328!\n#ifat #materialhandler #tabarelli #recycling4th day at IFAT 2024! Visit us at Hall C5, stand 328!\n#ifat #materialhandler #tabarelli #recycling",
      "likes": "17",
      "shares": "2",
      "time": {
        "raw": "11ay",
        "parsed": "02.06.2024",
        "isoString": "2024-06-02T05:41:02.862Z"
      },
      "mediaType": "image",
      "mediaContent": [
        "https://media.licdn.com/dms/image/v2/D4D22AQGIasDUzNltqg/feedshare-shrink_800/feedshare-shrink_800/0/1715872379360?e=1749081600&v=beta&t=QEfQgI36EFwH-tfHOamkVjbNSX8sialDET_l_zv46fw",
        "https://media.licdn.com/dms/image/v2/D4D22AQFvW5WPGWwfUQ/feedshare-shrink_800/feedshare-shrink_800/0/1715872379801?e=1749081600&v=beta&t=5USzqE1H2pWMhCC8Lsxj8tPyE-gfURxtUGdehLLmw0s",
        "https://media.licdn.com/dms/image/v2/D4D22AQFa9Y3OzH_F6Q/feedshare-shrink_800/feedshare-shrink_800/0/1715872379322?e=1749081600&v=beta&t=fN_N7-gpN8wweVWrXTPgqeJKlRR7FlOZ1bLEOdCIFqU"
      ],
      "date": "2024-06-02T05:41:02.862Z"
    },
    {
      "captions": "Huge support for our Material Handler\nBusiness from our US Colleague Thomas Hickson  from Sierra International Machinery  and DE colleague Ingo Niksic  from BMA Maschinenvertrieb  \n#ifat #materialhandler #tabarelli #recyclingHuge support for our Material Handler\nBusiness from our US Colleague Thomas Hickson  from Sierra International Machinery  and DE colleague Ingo Niksic  from BMA Maschinenvertrieb  \n#ifat #materialhandler #tabarelli #recycling",
      "likes": "36",
      "comments": "1",
      "shares": "4",
      "time": {
        "raw": "11ay",
        "parsed": "02.06.2024",
        "isoString": "2024-06-02T05:41:02.863Z"
      },
      "mediaType": "image",
      "mediaContent": [
        "https://media.licdn.com/dms/image/v2/D4D22AQFUUljVhTnczQ/feedshare-shrink_800/feedshare-shrink_800/0/1715768063809?e=1749081600&v=beta&t=Jg1MJB1Gmqq7Hf-E_AsY7N26yK--wdI2qu5T8jjdRG0",
        "https://media.licdn.com/dms/image/v2/D4D22AQFlouhnVhbzAA/feedshare-shrink_800/feedshare-shrink_800/0/1715768063849?e=1749081600&v=beta&t=oSJlzcXBkBR_hHfSN9vQ37Rq6PxD27LE1FRNq6wX1YI",
        "https://media.licdn.com/dms/image/v2/D4D22AQFYZZ_QA-vI6Q/feedshare-shrink_800/feedshare-shrink_800/0/1715768063644?e=1749081600&v=beta&t=N8iAsuhMMVXeb6SIT8-Va4Chro-h_axuB0Pb1SMO5HU"
      ],
      "date": "2024-06-02T05:41:02.863Z"
    },
    {
      "captions": "IFAT day 2: visit us at Hall C5 stand 328! We will show you our electric and diesel material handlers!\n#ifat #materialhandler #tabarelli #recyclingIFAT day 2: visit us at Hall C5 stand 328! We will show you our electric and diesel material handlers!\n#ifat #materialhandler #tabarelli #recycling",
      "likes": "8",
      "time": {
        "raw": "11ay",
        "parsed": "02.06.2024",
        "isoString": "2024-06-02T05:41:02.865Z"
      },
      "mediaType": "image",
      "mediaContent": [
        "https://media.licdn.com/dms/image/v2/D4D22AQGqUOtPmORFDA/feedshare-shrink_800/feedshare-shrink_800/0/1715691490262?e=1749081600&v=beta&t=dm2v9gC1-PCb3VwH0k-h7cyNr_mL0vNgXlUKly5ionI",
        "https://media.licdn.com/dms/image/v2/D4D22AQGYx5AkXt9FUA/feedshare-shrink_800/feedshare-shrink_800/0/1715691490265?e=1749081600&v=beta&t=OJIc-iSL3hqrz_bE9WSIFxnB_0nKcrBeVIBEqWoHcoQ",
        "https://media.licdn.com/dms/image/v2/D4D22AQHMfs7bhpFWCA/feedshare-shrink_800/feedshare-shrink_800/0/1715691490284?e=1749081600&v=beta&t=63rGZC_ZCB1SK2ZOmCVe9sM87GeLaE0VgLtxaMz3WHc",
        "https://media.licdn.com/dms/image/v2/D4D22AQHUZwYN0jd6ow/feedshare-shrink_800/feedshare-shrink_800/0/1715691489092?e=1749081600&v=beta&t=80P448gYgNlXOkL6rTnDZs1TOi0h4l5KYW7uK1h2Sxk"
      ],
      "date": "2024-06-02T05:41:02.865Z"
    },
    {
      "captions": "Are you ready? You can find us at Hall C5 stand 328!\n\n#tabarelli #materialhandler #ifat #recyclingAre you ready? You can find us at Hall C5 stand 328!\n\n#tabarelli #materialhandler #ifat #recycling",
      "likes": "16",
      "shares": "1",
      "time": {
        "raw": "11ay",
        "parsed": "02.06.2024",
        "isoString": "2024-06-02T05:41:02.866Z"
      },
      "mediaType": "image",
      "mediaContent": [
        "https://media.licdn.com/dms/image/v2/D4D22AQET0VfNDho3qQ/feedshare-shrink_800/feedshare-shrink_800/0/1715588552932?e=1749081600&v=beta&t=n1MTSWEUKirDZAn0wJBeL5m43e9tiBcGXM9burf32eM",
        "https://media.licdn.com/dms/image/v2/D4D22AQH3e-_BNajS1A/feedshare-shrink_800/feedshare-shrink_800/0/1715588553350?e=1749081600&v=beta&t=PsgAY6LU9bDDJ1GMG2V1tR6KL-98hKMkQUgslNSRUIM"
      ],
      "date": "2024-06-02T05:41:02.866Z"
    },
    {
      "captions": "IFAT 2024 | 13-17 Maggio\nEccoci anche quest’anno alla fiera internazionale leader per la gestione dei rifiuti e delle materie prime. Venite a trovarci al Centro Fieristico di Monaco di Baviera, Hall C5 – Stand 328!\n \nIFAT 2024 | May 13-17\nHere we are once again at the world’s leading trade fair for waste and raw materials management.\nCome and visit us at the Munich Trade Fair Center, Hall C5 – Booth 328!\n\n#ifat #tabarelli #materialhandler #recyclingIFAT 2024 | 13-17 Maggio\nEccoci anche quest’anno alla fiera internazionale leader per la gestione dei rifiuti e delle materie prime. Venite a trovarci al Centro Fieristico di Monaco di Baviera, Hall C5 – Stand 328!\n \nIFAT 2024 | May 13-17\nHere we are once again at the world’s leading trade fair for waste and raw materials management.\nCome and visit us at the Munich Trade Fair Center, Hall C5 – Booth 328!\n\n#ifat #tabarelli #materialhandler #recycling",
      "likes": "14",
      "comments": "1",
      "shares": "2",
      "time": {
        "raw": "11ay",
        "parsed": "02.06.2024",
        "isoString": "2024-06-02T05:41:02.868Z"
      },
      "mediaType": "image",
      "mediaContent": [
        "https://media.licdn.com/dms/image/v2/D4E22AQGoBtUYlH5ljQ/feedshare-shrink_800/feedshare-shrink_800/0/1715092147985?e=1749081600&v=beta&t=HgOZlsLDUD5CFcVyPI8MScjEUoxmLoSzLkYtSIkmYAs"
      ],
      "date": "2024-06-02T05:41:02.868Z"
    },
    {
      "captions": "Visit us at Booth B6!\n#isri #tabarelli #materialhandler #recyclingVisit us at Booth B6!\n#isri #tabarelli #materialhandler #recycling",
      "likes": "15",
      "shares": "1",
      "time": {
        "raw": "12ay",
        "parsed": "14.04.2024",
        "isoString": "2024-04-14T04:48:46.995Z"
      },
      "mediaType": "image",
      "mediaContent": [
        "https://media.licdn.com/dms/image/v2/D4D22AQFA2Qw3hCv5Ww/feedshare-shrink_800/feedshare-shrink_800/0/1713381857573?e=1747267200&v=beta&t=NDHL46jGHNsSJggBW6eb_HsonDY2uQcl7bCE5ev-Y_Q",
        "https://media.licdn.com/dms/image/v2/D4D22AQHs27QyZSqwlA/feedshare-shrink_800/feedshare-shrink_800/0/1713381857399?e=1747267200&v=beta&t=kJbBuCYd24F9Noftxz6h5VGSomweN4MgsSucrr_U0U8"
      ],
      "date": "2024-04-14T04:48:46.995Z"
    },
    {
      "captions": "Ready to startViva ISRI! We are ready for you!",
      "likes": "2",
      "time": {
        "raw": "12ay12ay",
        "parsed": "14.04.2025",
        "isoString": "2025-04-14T04:48:46.997Z"
      },
      "mediaType": "video",
      "mediaContent": {
        "src": [
          {
            "src": "https://dms.licdn.com/playlist/vid/v2/D5605AQHjtUsPOmWqKg/feedshare-ambry-analyzed_servable_progressive_video/feedshare-ambry-analyzed_servable_progressive_video/0/1713225575593?e=1745211600&v=beta&t=DtOb7dwW4dFCii-YYVzISAB1HsdYhBbArvuPOd9AcYI",
            "type": "video/quicktime",
            "data-bitrate": 12784870
          },
          {
            "src": "https://dms.licdn.com/playlist/vid/v2/D5605AQHjtUsPOmWqKg/mp4-640p-30fp-crf28/mp4-640p-30fp-crf28/0/1713225578724?e=1745211600&v=beta&t=dm67gFyBrWq_6P-IQgi2UldeQCaaOStXvNAMKAayNQw",
            "type": "video/mp4",
            "data-bitrate": 1176888
          },
          {
            "src": "https://dms.licdn.com/playlist/vid/v2/D5605AQHjtUsPOmWqKg/mp4-720p-30fp-crf28/mp4-720p-30fp-crf28/0/1713225579450?e=1745211600&v=beta&t=aQtTFVC_7FVl5OZdj1qcm4hU4u73kK5dluYEmmaNLyQ",
            "type": "video/mp4",
            "data-bitrate": 1547287
          }
        ],
        "posterUrl": "https://media.licdn.com/dms/image/v2/D5605AQHjtUsPOmWqKg/videocover-high/videocover-high/0/1713225574224?e=1745211600&v=beta&t=5DXE1b-QcwCyaPfyjJhfQFcyE_0X0mmyuplsCM9gSYg"
      },
      "date": "2025-04-14T04:48:46.997Z"
    },
    {
      "captions": "Viva ISRI! We are ready for you!",
      "time": {
        "raw": "12ay",
        "parsed": "14.04.2024",
        "isoString": "2024-04-14T04:48:46.998Z"
      },
      "mediaType": "video",
      "mediaContent": {
        "src": [
          {
            "src": "https://dms.licdn.com/playlist/vid/v2/D5605AQHjtUsPOmWqKg/feedshare-ambry-analyzed_servable_progressive_video/feedshare-ambry-analyzed_servable_progressive_video/0/1713225575593?e=1745211600&v=beta&t=DtOb7dwW4dFCii-YYVzISAB1HsdYhBbArvuPOd9AcYI",
            "type": "video/quicktime",
            "data-bitrate": 12784870
          },
          {
            "src": "https://dms.licdn.com/playlist/vid/v2/D5605AQHjtUsPOmWqKg/mp4-640p-30fp-crf28/mp4-640p-30fp-crf28/0/1713225578724?e=1745211600&v=beta&t=dm67gFyBrWq_6P-IQgi2UldeQCaaOStXvNAMKAayNQw",
            "type": "video/mp4",
            "data-bitrate": 1176888
          },
          {
            "src": "https://dms.licdn.com/playlist/vid/v2/D5605AQHjtUsPOmWqKg/mp4-720p-30fp-crf28/mp4-720p-30fp-crf28/0/1713225579450?e=1745211600&v=beta&t=aQtTFVC_7FVl5OZdj1qcm4hU4u73kK5dluYEmmaNLyQ",
            "type": "video/mp4",
            "data-bitrate": 1547287
          }
        ],
        "posterUrl": "https://media.licdn.com/dms/image/v2/D5605AQHjtUsPOmWqKg/videocover-high/videocover-high/0/1713225574224?e=1745211600&v=beta&t=5DXE1b-QcwCyaPfyjJhfQFcyE_0X0mmyuplsCM9gSYg"
      },
      "date": "2024-04-14T04:48:46.998Z"
    },
    {
      "captions": "Almost ready to start at the Mandalay Bay Convention Center !!Almost ready to start at the Mandalay Bay Convention Center !!",
      "likes": "27",
      "shares": "4",
      "time": {
        "raw": "12ay",
        "parsed": "14.04.2024",
        "isoString": "2024-04-14T04:48:46.999Z"
      },
      "mediaType": "image",
      "mediaContent": [
        "https://media.licdn.com/dms/image/v2/D4D22AQGAIuSZCRAquw/feedshare-shrink_800/feedshare-shrink_800/0/1713180144563?e=1747267200&v=beta&t=RrM5jdHPI8Ml4nNSti_bBaCSoJCaLl1t5KgkaD0-oew",
        "https://media.licdn.com/dms/image/v2/D4D22AQEKy9GQxGUiXA/feedshare-shrink_800/feedshare-shrink_800/0/1713180144374?e=1747267200&v=beta&t=A-KYit6zteiBunXt9eT2YI7S2nSF1BCbY6mlC_tU3Rc",
        "https://media.licdn.com/dms/image/v2/D4D22AQG4OWNine0dfA/feedshare-shrink_800/feedshare-shrink_800/0/1713180143605?e=1747267200&v=beta&t=85u7XE6_J0xnQm0JoxVGZjzAJFZO0TTk4_bXYR1zWPA"
      ],
      "date": "2024-04-14T04:48:46.999Z"
    },
    {
      "captions": "Happy Easter!\n#tabarelli #materialhandler #recycling #peaceHappy Easter!\n#tabarelli #materialhandler #recycling #peace",
      "likes": "5",
      "time": {
        "raw": "11ay",
        "parsed": "26.04.2024",
        "isoString": "2024-04-26T05:24:41.049Z"
      },
      "mediaType": "image",
      "mediaContent": [
        "https://media.licdn.com/dms/image/v2/D4D22AQHXMafl8TgEnQ/feedshare-shrink_800/feedshare-shrink_800/0/1711874212678?e=1746057600&v=beta&t=asMMNf46D-4X3JNLZWxtf1MJ0_Cek8DRR3yhdCE8BCU"
      ],
      "date": "2024-04-26T05:24:41.049Z"
    },
    {
      "captions": "Der BMA Maschinenvertrieb Tabarelli Material Handler bewirbt sich mit einem Beitrag zum Erreichen der Klimaziele für den Innovationspreis der Region Göttingen Northeim. Mit rein für den Batteriebetrieb entwickelten Materialumschlagmaschinen helfen die Hannoveraner der kommunalen und privaten Recyclingbranche bei der Transformation hin zur Elektrifizierung des Maschinenparks.\n\n#innovationspreis #gemeinsamzukunftgestalten #wirtschaftsförderung #göttingen #landkreisgöttingen #northeim #regiongöttingennortheim #wrg #klimainnovationspreis #niedersachsenDer BMA Maschinenvertrieb Tabarelli Material Handler bewirbt sich mit einem Beitrag zum Erreichen der Klimaziele für den Innovationspreis der Region Göttingen Northeim. Mit rein für den Batteriebetrieb entwickelten Materialumschlagmaschinen helfen die Hannoveraner der kommunalen und privaten Recyclingbranche bei der Transformation hin zur Elektrifizierung des Maschinenparks.\n\n#innovationspreis #gemeinsamzukunftgestalten #wirtschaftsförderung #göttingen #landkreisgöttingen #northeim #regiongöttingennortheim #wrg #klimainnovationspreis #niedersachsen",
      "likes": "11",
      "shares": "4",
      "time": {
        "raw": "11ay",
        "parsed": "17.04.2024",
        "isoString": "2024-04-17T05:08:13.061Z"
      },
      "mediaType": "image",
      "mediaContent": [
        "https://media.licdn.com/dms/image/v2/D4E10AQEWKq3RNrmMNg/image-shrink_800/image-shrink_800/0/1711354042915?e=1742796000&v=beta&t=6XW_bIAi1MAxWEmWrTUNiAuTp_oUb2EKXiLbL9YusBI"
      ],
      "date": "2024-04-17T05:08:13.061Z"
    },
    {
      "captions": "Only available from us. Two door variants on one cab. Whether classic or as a sliding door. We want you to feel comfortable in your new Tabarelli material handler. \n\nBecause we build it just for you.Only available from us. Two door variants on one cab. Whether classic or as a sliding door. We want you to feel comfortable in your new Tabarelli material handler. \n\nBecause we build it just for you.",
      "likes": "7",
      "shares": "1",
      "time": {
        "raw": "2ay",
        "parsed": "02.03.2025",
        "isoString": "2025-03-02T05:41:02.852Z"
      },
      "mediaType": "image",
      "mediaContent": [
        "https://media.licdn.com/dms/image/v2/D4E22AQHEW8Dr5HRjDQ/feedshare-shrink_800/B4EZUj6scXHUAg-/0/1740064344923?e=1749081600&v=beta&t=qU7GaAPQaPMbKoQxDIzI6zPZzGT753XIrCEiYq2inhI"
      ],
      "date": "2025-03-02T05:41:02.852Z"
    },
    {
      "captions": "Tra i ritmi della produzione e la forza dei materiali, la Pasqua ci ricorda il valore delle pause vere.\nTabarelli Spa augura a tutti giorni di equilibrio, rinnovamento e serenità.\n\nAmid the pace of production and the strength of materials, Easter reminds us of the value of true pauses.\nTabarelli Spa wishes you days of balance, renewal, and peace.\n\n#Easter2025 #tabarelli #recyclingTra i ritmi della produzione e la forza dei materiali, la Pasqua ci ricorda il valore delle pause vere.\nTabarelli Spa augura a tutti giorni di equilibrio, rinnovamento e serenità.\n\nAmid the pace of production and the strength of materials, Easter reminds us of the value of true pauses.\nTabarelli Spa wishes you days of balance, renewal, and peace.\n\n#Easter2025 #tabarelli #recycling",
      "likes": "5",
      "time": {
        "raw": "1h",
        "parsed": "25.04.2025",
        "isoString": "2025-04-25T05:41:02.851Z"
      },
      "mediaType": "image",
      "mediaContent": [
        "https://media.licdn.com/dms/image/v2/D4E22AQEbvFXNz068bg/feedshare-shrink_800/B4EZZJRhIuHMAk-/0/1744986053337?e=1749081600&v=beta&t=GEwqV15E-sTCJ25jvv6ClMrN1E7YrSzl-xiNM-XD8Og"
      ],
      "date": "2025-04-25T05:41:02.851Z"
    },
    {
      "captions": "Introducing the newest addition to the Sierra lineup: the T815 Material Handler.\n\nEngineered for heavy-duty performance, the T815 features our patented Fly-Cab — offering ground-level entry and an impressive 19-foot elevation for unbeatable visibility.\n\nDesigned with the operator in mind, the T815 offers:\n✔️ 53-foot boom reach\n✔️ Automatic and centralized manual greasing systems\n✔️ Rear and side infrared cameras with dedicated display\n✔️ Load-sensing hydraulic system with electronic power control\n✔️ AC/heat climate controls\n✔️ Bluetooth radio with cell phone connectivity\n✔️ Fuse relay drawer conveniently located under the seat\n✔️ No DIN hydraulic fittings or flat O-rings\n✔️ Pilot hydraulic joysticks (not electronic)\n\nBuilt for those who demand more from their equipment — the Sierra T815 is in a class of its own. \n\nWant to know more? Reach out today 📲 https://lnkd.in/gZ5HMB9P",
      "likes": "17",
      "shares": "3",
      "time": {
        "raw": "2h",
        "parsed": "18.04.2025",
        "isoString": "2025-04-18T05:41:02.847Z"
      },
      "mediaType": "video",
      "mediaContent": {
        "src": [
          {
            "src": "https://dms.licdn.com/playlist/vid/v2/D5605AQEP34e0pfaFdQ/mp4-720p-30fp-crf28/B56ZY6jWoTH0BY-/0/1744739074268?e=1746770400&v=beta&t=ov42uejIR86fnbX-5_ku6A214uyEPQEC_z3ViJkvQbU",
            "type": "video/mp4",
            "data-bitrate": 1417472
          },
          {
            "src": "https://dms.licdn.com/playlist/vid/v2/D5605AQEP34e0pfaFdQ/mp4-640p-30fp-crf28/B56ZY6jWoTH0BU-/0/1744739073923?e=1746770400&v=beta&t=ZNnXy7WgTf8-cK6tGS9lRHmOUA2kyXe9AEN9mYYO8pQ",
            "type": "video/mp4",
            "data-bitrate": 1112506
          }
        ],
        "posterUrl": "https://media.licdn.com/dms/image/v2/D5605AQEP34e0pfaFdQ/videocover-high/B56ZY6jWoTH0Bk-/0/1744739073167?e=1746770400&v=beta&t=QGCIcVruW-DrGq9fQ8gWi9nHo8waB6fiwk_dHq3ygXM"
      },
      "date": "2025-04-18T05:41:02.847Z"
    },
    {
      "captions": "This week we’re proud to be at Sierra International Machinery  in the USA, presenting the latest evolution of the Tabarelli T815.\n\nOne of the standout features? Our patented Flycab® system — a cab that lowers almost to the ground, allowing operators to get in and out easily, safely, and without climbing.\n\nBecause true innovation isn’t just about power or performance. It’s about people.\nWhen comfort and safety come first, productivity follows.\n\nGrateful for the trust and collaboration with Sierra — and excited to keep pushing boundaries together.\n\n⸻\n\n#Tabarelli #Flycab #SierraMachinery #InnovationDrivenByPeople #MaterialHandler #OperatorFirst #SmartEngineering #MadeInItaly",
      "likes": "28",
      "comments": "2",
      "shares": "1",
      "time": {
        "raw": "6g",
        "parsed": "26.04.2025",
        "isoString": "2025-04-26T05:41:02.848Z"
      },
      "mediaType": "video",
      "mediaContent": {
        "src": [
          {
            "src": "https://dms.licdn.com/playlist/vid/v2/D4D05AQEOqPX2a6D0Gw/mp4-640p-30fp-crf28/B4DZZtTt91G4BM-/0/1745590617023?e=1746770400&v=beta&t=YO7ymTHI_mX1VpdtmmFlm_lM-VDvF8L-LG7WjLcgYcA",
            "type": "video/mp4",
            "data-bitrate": 543630
          }
        ],
        "posterUrl": "https://media.licdn.com/dms/image/v2/D4D05AQEOqPX2a6D0Gw/videocover-high/B4DZZtTt91G4Bc-/0/1745590614780?e=1746770400&v=beta&t=9xI7OEhhH_hLLw7erLYu4OHePm5RTxPwoaiO_4L3KGU"
      },
      "date": "2025-04-26T05:41:02.848Z"
    },
    {
      "captions": "On the move with the new Tabarelli T815.\nWe’re in the U.S.A, hosted by Sierra International Machinery  for a dedicated training session— focusing on the electric and hydraulic systems, as well as the latest innovations introduced in the new cab.\nA great opportunity to share knowledge, exchange insights in the field, and showcase the full potential of our next-generation scrap handling machine.\n#Tabarelli #T815 #Training #ScrapHandling #Innovation #MadeInItaly #SierraInternationalMachinery #materialhandlers  #recyclingOn the move with the new Tabarelli T815.\nWe’re in the U.S.A, hosted by Sierra International Machinery  for a dedicated training session— focusing on the electric and hydraulic systems, as well as the latest innovations introduced in the new cab.\nA great opportunity to share knowledge, exchange insights in the field, and showcase the full potential of our next-generation scrap handling machine.\n#Tabarelli #T815 #Training #ScrapHandling #Innovation #MadeInItaly #SierraInternationalMachinery #materialhandlers  #recycling",
      "likes": "26",
      "comments": "1",
      "shares": "4",
      "time": {
        "raw": "1h",
        "parsed": "25.04.2025",
        "isoString": "2025-04-25T05:41:02.849Z"
      },
      "mediaType": "image",
      "mediaContent": [
        "https://media.licdn.com/dms/image/v2/D4D22AQFq4HJ7RtN9dw/feedshare-shrink_800/B4DZZoQlLcG4Ao-/0/1745505902256?e=1749081600&v=beta&t=9ErqyMSvwoELyJ6v5AsORDZiJokmhvKiMrLXTYU2Clo",
        "https://media.licdn.com/dms/image/v2/D4D22AQFKfccFKBaZ-A/feedshare-shrink_800/B4DZZoQlL2G0Ao-/0/1745505901848?e=1749081600&v=beta&t=dj3M7hEISHOXOwpZfRL10V7vXm1pKn3vsNqGkMBsxk4"
      ],
      "date": "2025-04-25T05:41:02.849Z"
    },
    {
      "captions": "Engine removal made efficient and precise — the Rozzi R580GRA12 at work. A custom bracket on the material handler at ensures vehicle stability while the grapple does its job with power and accuracy. An excellent example of teamwork between strength and control in industrial dismantling.",
      "likes": "3",
      "time": {
        "raw": "1g",
        "parsed": "01.05.2025",
        "isoString": "2025-05-01T05:41:02.844Z"
      },
      "mediaType": "video",
      "mediaContent": {
        "src": [
          {
            "src": "https://dms.licdn.com/playlist/vid/v2/D4D05AQF6rMJzxy3ADA/mp4-720p-30fp-crf28/B4DZaGx633G8BY-/0/1746018005832?e=1746770400&v=beta&t=s7eozZrOIhhFVifNbw99B4_kNf2idkMRZNyA0Ua7atw",
            "type": "video/mp4",
            "data-bitrate": 1411151
          },
          {
            "src": "https://dms.licdn.com/playlist/vid/v2/D4D05AQF6rMJzxy3ADA/mp4-640p-30fp-crf28/B4DZaGx633G8BU-/0/1746018004188?e=1746770400&v=beta&t=qCEa2hGXiCz5L91HtGr6-cakk9TnuVOQkCp77q4fJBM",
            "type": "video/mp4",
            "data-bitrate": 1102723
          }
        ],
        "posterUrl": "https://media.licdn.com/dms/image/v2/D4D05AQF6rMJzxy3ADA/videocover-high/B4DZaGx633G8Bk-/0/1746017997140?e=1746770400&v=beta&t=1DzzbiytvcenCbcKSxa40RAm86zX1mLFW9kAjULl8gk"
      },
      "date": "2025-05-01T05:41:02.844Z"
    },
    {
      "captions": "Engineering strength, delivering precision.\nIntroducing the Tabarelli T510, designed for high-demand demolition and recycling operations.\n\nFeaturing a 10-meter boom, 4 outriggers, and a 4.5L Stage V engine delivering 129 kW, this material handler offers both power and reliability.\nThe machine is equipped with full automatic lubrication, an intuitive OPUS-B4 7” display, and camera coverage — ensuring safety, efficiency, and control in every condition.\n\nIn the photos: mounted with a VTN CI1200 shear. The machine will also be delivered with a Rozzi R580GRA12 grapple, combining versatility with brute strength.\n\nBuilt for industry. Backed by tradition. Engineered to lead.\n\n#Tabarelli #MaterialHandling #DemolitionEquipment #RecyclingMachinery #HeavyEquipment #VTN #Rozzi #InnovationInMotion #IndustrialSolutions #MadeInItalyEngineering strength, delivering precision.\nIntroducing the Tabarelli T510, designed for high-demand demolition and recycling operations.\n\nFeaturing a 10-meter boom, 4 outriggers, and a 4.5L Stage V engine delivering 129 kW, this material handler offers both power and reliability.\nThe machine is equipped with full automatic lubrication, an intuitive OPUS-B4 7” display, and camera coverage — ensuring safety, efficiency, and control in every condition.\n\nIn the photos: mounted with a VTN CI1200 shear. The machine will also be delivered with a Rozzi R580GRA12 grapple, combining versatility with brute strength.\n\nBuilt for industry. Backed by tradition. Engineered to lead.\n\n#Tabarelli #MaterialHandling #DemolitionEquipment #RecyclingMachinery #HeavyEquipment #VTN #Rozzi #InnovationInMotion #IndustrialSolutions #MadeInItaly",
      "likes": "15",
      "shares": "1",
      "time": {
        "raw": "2g",
        "parsed": "30.04.2025",
        "isoString": "2025-04-30T05:41:02.845Z"
      },
      "mediaType": "image",
      "mediaContent": [
        "https://media.licdn.com/dms/image/v2/D4D22AQFrAbC6Fi-E8g/feedshare-shrink_800/B4DZaCZATaGgAg-/0/1745944317241?e=1749081600&v=beta&t=HxpTCsVlNOY5G1LmqJofl9mPaljVkv4DpERH1iNjMuo",
        "https://media.licdn.com/dms/image/v2/D4D22AQG5tTtQa8MdUA/feedshare-shrink_800/B4DZaCZAQvH4Ag-/0/1745944316593?e=1749081600&v=beta&t=GEKazhkP9X-EVI4t_0CfQxs3sQIuLq_cnfTRBQ44z0Q",
        "https://media.licdn.com/dms/image/v2/D4D22AQERYpR5VzAEmg/feedshare-shrink_800/B4DZaCZAQbG0Ag-/0/1745944316868?e=1749081600&v=beta&t=pUIxk8ZvuYMx09QfKMp5B3kXZJjVsZMZp6t8gy1ABw8",
        "https://media.licdn.com/dms/image/v2/D4D22AQFeGcHtDTXNLw/feedshare-shrink_800/B4DZaCZAQVGwAk-/0/1745944317530?e=1749081600&v=beta&t=ed7GjM0efWaAo0xWuFM-xopCB9MQMRqiqUFKJGHhy2s"
      ],
      "date": "2025-04-30T05:41:02.845Z"
    }
  ]
}