[
  {
    "name": "Birim-Makina"
    ,
    "data": [
      {
        "captions": "BugÃ¼n nasÄ±lsÄ±nÄ±z? Bizden neler beklediÄŸinizi bizimle paylaÅŸÄ±n.\n\nGÃ¼ncellemelerimizi kaÃ§Ä±rmak istemiyorsanÄ±z SayfamÄ±zÄ± takip edin.",
        "likes": "3",
        "time": {
          "raw": "3g",
          "parsed": "14.03.2025",
          "isoString": "2025-03-14T05:03:21.816Z"
        },
        "mediaType": "other",
        "date": "2025-03-14T05:03:21.816Z"
      },
      {
        "captions": "Happy Woman's Day",
        "likes": "8",
        "time": {
          "raw": "1h",
          "parsed": "10.03.2025",
          "isoString": "2025-03-10T05:03:21.818Z"
        },
        "mediaType": "video",
        "mediaContent": {
          "src": [
            {
              "src": "https://dms.licdn.com/playlist/vid/v2/D4D05AQEe8tqdORQlPQ/mp4-720p-30fp-crf28/B4DZV13M79GkBo-/0/1741439197273?e=1742796000&v=beta&t=HbMVay_0EltAYQvQgWN_aO4uBo4h7ggmXXb3Nq4PiZQ",
              "type": "video/mp4",
              "data-bitrate": 698190
            },
            {
              "src": "https://dms.licdn.com/playlist/vid/v2/D4D05AQEe8tqdORQlPQ/mp4-640p-30fp-crf28/B4DZV13M79GkBk-/0/1741439197322?e=1742796000&v=beta&t=f8z0yatAFp8TUnc1qlNkd9MgJFr92KOgEqBYc_kM4RI",
              "type": "video/mp4",
              "data-bitrate": 530053
            }
          ],
          "posterUrl": "https://media.licdn.com/dms/image/v2/D4D05AQEe8tqdORQlPQ/videocover-low/B4DZV13M79GkCU-/0/1741439195646?e=1742796000&v=beta&t=7EwmFK3uFjpXcy48WWcFivEwimFEwEn3aPKB0JYnGlw"
        },
        "date": "2025-03-10T05:03:21.818Z"
      },
      {
        "captions": "âš™ğŸ”§ We have commissioned two new Fanuc robot welding arms that can perform high precision welding operations on a 24 metre slider.\n\nğŸš€âš¡ We are raising the bar even higher in production capacity and quality with uninterrupted automation.\n\n---\n\nâš™ğŸ”§ 24 metrelik slider Ã¼zerinde yÃ¼ksek hassasiyetli kaynak iÅŸlemlerini yapabilen iki adet yeni Fanuc robot kaynak kolunu devreye almÄ±ÅŸ bulunmaktayÄ±z.\n\nğŸš€âš¡ Kesintisiz otomasyon ile Ã¼retim kapasitesinde ve kalitede Ã§Ä±tayÄ± daha da yukarÄ± taÅŸÄ±yoruz.",
        "likes": "130",
        "comments": "1",
        "shares": "5",
        "time": {
          "raw": "1h",
          "parsed": "10.03.2025",
          "isoString": "2025-03-10T05:03:21.820Z"
        },
        "mediaType": "video",
        "mediaContent": {
          "src": [
            {
              "src": "https://dms.licdn.com/playlist/vid/v2/D4D05AQHduLnupccDCA/mp4-640p-30fp-crf28/B4DZVxzjdZG4AA-/0/1741371218357?e=1742796000&v=beta&t=D0W2k9ImJCfoYDXqDNUguMMTv_77L9WKywVIbqQnh6o",
              "type": "video/mp4",
              "data-bitrate": 638052
            },
            {
              "src": "https://dms.licdn.com/playlist/vid/v2/D4D05AQHduLnupccDCA/mp4-720p-30fp-crf28/B4DZVxzjdZG4AE-/0/1741371218846?e=1742796000&v=beta&t=TR2k-elfXftKRY7rSusqSBOpZegVmirwPqW1oOFPmRQ",
              "type": "video/mp4",
              "data-bitrate": 878818
            }
          ],
          "posterUrl": "https://media.licdn.com/dms/image/v2/D4D05AQHduLnupccDCA/feedshare-thumbnail_720_1280/B4DZVxzjdYG4BE-/0/1741371099309?e=1742796000&v=beta&t=fGvIfJe5i6JwOCr4EntG-persVF6M6KrJGphwTHXSx8"
        },
        "date": "2025-03-10T05:03:21.820Z"
      },
      {
        "captions": "Orca High-Capacity Cutting And Baling\n\nIt can compress and cut big size scrap with its big feeding box.\nIt 60th makes dense bales and shears the scrap.\nNo-contact sensors to avoid re-calibration\nCapacity is between 20 to 60 ton/hourÂ  \n\nâ¤ Detailed information about Orca: birimrecycling.com/orca-2\nâ¤ All Metal Scrap Shears: https://lnkd.in/dq423CXY\nâ¤ Web Site: birimrecycling.com/\n\n---\n\nOrca YÃ¼ksek Kapasiteli Kesme ve Balyalama\n\nBÃ¼yÃ¼k sÄ±kÄ±ÅŸtÄ±rma haznesiyle Ã§ok bÃ¼yÃ¼k ebatlÄ± hurdalarÄ± sÄ±kÄ±ÅŸtÄ±rÄ±p kesebilir.\nHem yoÄŸun balya , hem de kesim yapar\nAyarÄ± kaÃ§mayan temassÄ±z sensÃ¶rler\nKapasite 20-60 ton /saat aralÄ±ÄŸÄ±ndadÄ±r.\n\nâ¤ Orca HakkÄ±nda AyrÄ±ntÄ±lÄ± Bilgi: birimrecycling.com/orca\nâ¤ TÃ¼m Metal Hurda MakaslarÄ±: birimrecycling.com/shears\nâ¤ Web Site: birimrecycling.com/Orca High-Capacity Cutting And Baling\n\nIt can compress and cut big size scrap with its big feeding box.\nIt 60th makes dense bales and shears the scrap.\nNo-contact sensors to avoid re-calibration\nCapacity is between 20 to 60 ton/hourÂ  \n\nâ¤ Detailed information about Orca: birimrecycling.com/orca-2\nâ¤ All Metal Scrap Shears: https://lnkd.in/dq423CXY\nâ¤ Web Site: birimrecycling.com/\n\n---\n\nOrca YÃ¼ksek Kapasiteli Kesme ve Balyalama\n\nBÃ¼yÃ¼k sÄ±kÄ±ÅŸtÄ±rma haznesiyle Ã§ok bÃ¼yÃ¼k ebatlÄ± hurdalarÄ± sÄ±kÄ±ÅŸtÄ±rÄ±p kesebilir.\nHem yoÄŸun balya , hem de kesim yapar\nAyarÄ± kaÃ§mayan temassÄ±z sensÃ¶rler\nKapasite 20-60 ton /saat aralÄ±ÄŸÄ±ndadÄ±r.\n\nâ¤ Orca HakkÄ±nda AyrÄ±ntÄ±lÄ± Bilgi: birimrecycling.com/orca\nâ¤ TÃ¼m Metal Hurda MakaslarÄ±: birimrecycling.com/shears\nâ¤ Web Site: birimrecycling.com/",
        "likes": "62",
        "comments": "2",
        "time": {
          "raw": "1h",
          "parsed": "10.03.2025",
          "isoString": "2025-03-10T05:03:21.822Z"
        },
        "mediaType": "image",
        "mediaContent": [
          "https://media.licdn.com/dms/image/v2/D4D22AQFkKz-Oe65trQ/feedshare-shrink_800/B4DZVdaYgrGcAg-/0/1741028961232?e=1744848000&v=beta&t=hVTVQq6baFB9DESUC4aiwt8uq6T8oozpz-bjCmSJG9k"
        ],
        "date": "2025-03-10T05:03:21.822Z"
      },
      {
        "captions": "ğŸ¦¾ Tiger 3 Ram Baler\nÂ \nâš™ï¸ Operation & Structure\n\nâœ”ï¸ Strong body for Heavy Duty operation\nâœ”ï¸ Capacity is between 1,5 - 40 ton/hour (Fe)\nâœ”ï¸ No-contact sensors to avoid re-calibration\n\nTiger: https://lnkd.in/e9Gx3SZM\nAll Balers: https://lnkd.in/dq-MMRYC\nWeb Site: https://lnkd.in/dSwqCgZ8\n\n----\n\nğŸ¦¾ Tiger 3 SÄ±kÄ±ÅŸtÄ±rmalÄ± Pres\n\nâš™ï¸ Operasyon ve YapÄ±\n\nâœ”ï¸ AÄŸÄ±r hizmete uygun gÃ¶vde\nâœ”ï¸ Kapasite 1.5 - 40 ton/saat (Fe)\nâœ”ï¸ AyarÄ± kaÃ§mayan temassÄ±z sensÃ¶rler\n\nTiger: https://lnkd.in/emTMFnKj\nTÃ¼m Presler: https://lnkd.in/d3w4W9Wa\nWeb Site:https://lnkd.in/dSwqCgZ8\nğŸ¦¾ Tiger 3 Ram Baler\nÂ \nâš™ï¸ Operation & Structure\n\nâœ”ï¸ Strong body for Heavy Duty operation\nâœ”ï¸ Capacity is between 1,5 - 40 ton/hour (Fe)\nâœ”ï¸ No-contact sensors to avoid re-calibration\n\nTiger: https://lnkd.in/e9Gx3SZM\nAll Balers: https://lnkd.in/dq-MMRYC\nWeb Site: https://lnkd.in/dSwqCgZ8\n\n----\n\nğŸ¦¾ Tiger 3 SÄ±kÄ±ÅŸtÄ±rmalÄ± Pres\n\nâš™ï¸ Operasyon ve YapÄ±\n\nâœ”ï¸ AÄŸÄ±r hizmete uygun gÃ¶vde\nâœ”ï¸ Kapasite 1.5 - 40 ton/saat (Fe)\nâœ”ï¸ AyarÄ± kaÃ§mayan temassÄ±z sensÃ¶rler\n\nTiger: https://lnkd.in/emTMFnKj\nTÃ¼m Presler: https://lnkd.in/d3w4W9Wa\nWeb Site:https://lnkd.in/dSwqCgZ8",
        "likes": "17",
        "time": {
          "raw": "2h",
          "parsed": "03.03.2025",
          "isoString": "2025-03-03T05:03:21.824Z"
        },
        "mediaType": "image",
        "mediaContent": [
          "https://media.licdn.com/dms/image/v2/D4E22AQEs6m28MPBKbQ/feedshare-shrink_800/B4EZVMqPK7H0Ao-/0/1740747897744?e=1744848000&v=beta&t=BY3usxEPHlHvNWCJpbe1rwEb-Po-DmD1yPOJoWLyI1k"
        ],
        "date": "2025-03-03T05:03:21.824Z"
      },
      {
        "captions": "See you in Valencia ğŸ‘‹ ğŸš€ https://lnkd.in/eDEXUwCk\n\nWe are thrilled to welcome back BIRIM MAKINA as exhibitors at #BIRValencia2025! They have been a valued presence at our World Recycling Conventions for many years, showcasing their innovative metal scrap processing machinery.\n\nğŸ“ Meet BIRIM MAKINA in #Valencia to discover their latest solutions and see how they can help optimise your operations. #Register here ğŸ‘‰https://lnkd.in/dGYPuHVa\n\nğŸŒ Want to showcase your company at #BIRValencia2025? Secure your stand today and connect with key industry players! ğŸ‘‰https://lnkd.in/euyzy_fc\n\n#BIRValencia2025 #recyclinginnovation #BirimMakina #metalrecyclingğŸš€ https://lnkd.in/eDEXUwCk\n\nWe are thrilled to welcome back BIRIM MAKINA as exhibitors at #BIRValencia2025! They have been a valued presence at our World Recycling Conventions for many years, showcasing their innovative metal scrap processing machinery.\n\nğŸ“ Meet BIRIM MAKINA in #Valencia to discover their latest solutions and see how they can help optimise your operations. #Register here ğŸ‘‰https://lnkd.in/dGYPuHVa\n\nğŸŒ Want to showcase your company at #BIRValencia2025? Secure your stand today and connect with key industry players! ğŸ‘‰https://lnkd.in/euyzy_fc\n\n#BIRValencia2025 #recyclinginnovation #BirimMakina #metalrecycling",
        "likes": "6",
        "time": {
          "raw": "2h2h",
          "parsed": "17.03.2025",
          "isoString": "2025-03-17T05:03:21.825Z"
        },
        "mediaType": "image",
        "mediaContent": [
          "https://media.licdn.com/dms/image/v2/D4E22AQF4PvuF3Y7OiQ/feedshare-shrink_800/B4EZVCJIK5H0Ag-/0/1740571444783?e=1744848000&v=beta&t=90ZS8cDpRAAatciCuMv6J2v2u8efv8zYU6eI6kskFs0"
        ],
        "date": "2025-03-17T05:03:21.825Z"
      },
      {
        "captions": "ğŸš€ https://lnkd.in/eDEXUwCk\n\nWe are thrilled to welcome back BIRIM MAKINA as exhibitors at #BIRValencia2025! They have been a valued presence at our World Recycling Conventions for many years, showcasing their innovative metal scrap processing machinery.\n\nğŸ“ Meet BIRIM MAKINA in #Valencia to discover their latest solutions and see how they can help optimise your operations. #Register here ğŸ‘‰https://lnkd.in/dGYPuHVa\n\nğŸŒ Want to showcase your company at #BIRValencia2025? Secure your stand today and connect with key industry players! ğŸ‘‰https://lnkd.in/euyzy_fc\n\n#BIRValencia2025 #recyclinginnovation #BirimMakina #metalrecyclingğŸš€ https://lnkd.in/eDEXUwCk\n\nWe are thrilled to welcome back BIRIM MAKINA as exhibitors at #BIRValencia2025! They have been a valued presence at our World Recycling Conventions for many years, showcasing their innovative metal scrap processing machinery.\n\nğŸ“ Meet BIRIM MAKINA in #Valencia to discover their latest solutions and see how they can help optimise your operations. #Register here ğŸ‘‰https://lnkd.in/dGYPuHVa\n\nğŸŒ Want to showcase your company at #BIRValencia2025? Secure your stand today and connect with key industry players! ğŸ‘‰https://lnkd.in/euyzy_fc\n\n#BIRValencia2025 #recyclinginnovation #BirimMakina #metalrecycling",
        "likes": "6",
        "time": {
          "raw": "2h",
          "parsed": "03.03.2025",
          "isoString": "2025-03-03T05:03:21.826Z"
        },
        "mediaType": "image",
        "mediaContent": [
          "https://media.licdn.com/dms/image/v2/D4E22AQF4PvuF3Y7OiQ/feedshare-shrink_800/B4EZVCJIK5H0Ag-/0/1740571444783?e=1744848000&v=beta&t=90ZS8cDpRAAatciCuMv6J2v2u8efv8zYU6eI6kskFs0"
        ],
        "date": "2025-03-03T05:03:21.826Z"
      },
      {
        "captions": "â™»ï¸ We help you to reduce your CarbonÂ footprint.\n\nğŸ”¥ Diesel + Electric Hybrid Material Handler: \n\nâ€¢\tBooms are made of SSAB Strenx 700 material for extra durability\nâ€¢\tSolid Rubber Tire\nâ€¢\tQuick change from Diesel to Electric Power\nâ€¢\t14 m Boom Reach 3,5 tons lifting force at max reach\nâ€¢\tBosch Rexroth hydraulics\nâ€¢\t175 HP Volvo Diesel Engine\nâ€¢\t90 kW Electric Motor\nâ€¢\tEasy change from Electric Power to Diesel\nâ€¢\tWe help you to reduce your Carbon footprint.\n\nThe Diesel + Electric Hybrid Material Handler is an impressive product that boasts a number of exceptional features. Its booms are constructed of SSAB Strenx 700 material, ensuring extra durability. Equipped with solid rubber tires, this material handler allows for a quick and easy transition from diesel to electric power. With a 14-meter boom reach and a 3.5-ton lifting force at maximum reach, it offers powerful performance for a variety of applications. It comes with Bosch Rexroth hydraulics, 175 horsepower Volvo diesel engine, and 90 kW electric motor. Users can easily switch between electric power and diesel power, making it a flexible solution for different job sites. Additionally, by using this product, you can reduce your carbon footprint, as we help you to make environmentally conscious choices.\n\nâ¤ About Hybrid Material Handler: https://lnkd.in/dC4ztXBz\nâ¤ All Material Handler: https://lnkd.in/dWf-qx2D\nâ¤ Web Site: https://lnkd.in/dmZmCsMi\n\n---\n\nâ™»ï¸ Karbon Ayak izinizi dÃ¼ÅŸÃ¼rmenize yardÄ±mcÄ± oluyoruz. \n\nğŸ”¥ Dizel + Elektrikli Hibrit ElleÃ§leme Vinci Ã–zellikleri: \n\nâ€¢\tBomlar ekstra dayanÄ±klÄ±lÄ±k iÃ§in SSAB Strenx 700 malzemeden yapÄ±lmÄ±ÅŸtÄ±rÂ \nâ€¢\tDizelden Elektrik gÃ¼cÃ¼ne hÄ±zlÄ± ve kolay geÃ§iÅŸÂ Â \nâ€¢\t14 m Boom boyu, maksimum uzanmada 3,5 ton kaldÄ±rma kuvvetiÂ Â \nâ€¢\tBosch Rexroth pompa ve valfi\nâ€¢\t175 HP Volvo Dizel Motor\nâ€¢\t90 kW elektrik motorÂ \nâ€¢\tElektrik gÃ¼cÃ¼nden dizele kolay geÃ§iÅŸ\nâ€¢\tKarbon ayak izinizi dÃ¼ÅŸÃ¼rmenize yardÄ±mcÄ± oluyoruz. \n\nDizel + Elektrikli Hibrit ElleÃ§leme Vinci, Ã¼stÃ¼n dayanÄ±klÄ±lÄ±k iÃ§in SSAB Strenx 700 malzeme ile tasarlanmÄ±ÅŸ bomlara sahip bir Ã¼rÃ¼ndÃ¼r. Bu elleÃ§leme vinci, dolgu lastiklerle donatÄ±lmÄ±ÅŸtÄ±r ve hÄ±zlÄ± bir ÅŸekilde dizel gÃ¼Ã§ten elektrik gÃ¼cÃ¼ne geÃ§iÅŸ yapabilme Ã¶zelliÄŸine sahiptir. 14 metrelik bom boyu ve maksimum uzanmada 3,5 ton kaldÄ±rma kapasitesi ile gÃ¼Ã§lÃ¼ bir performans sunar. Bosch Rexroth pompa ve valf sistemleri ile donatÄ±lmÄ±ÅŸtÄ±r. 175 beygir gÃ¼cÃ¼ndeki Volvo dizel motoruyla Ã§alÄ±ÅŸÄ±rken, deÄŸiÅŸtirir 90 kilovatlÄ±k elektrik motoru da kullanÄ±labilir. Elektrik gÃ¼cÃ¼nden dizel gÃ¼ce kolayca geÃ§iÅŸ yapabilme Ã¶zelliÄŸi sayesinde kullanÄ±cÄ±larÄ±n karbon ayak izini azaltmalarÄ±na yardÄ±mcÄ± olur. Dizel + Elektrikli Hibrit ElleÃ§leme Vinci, dayanÄ±klÄ±lÄ±ÄŸÄ±, performansÄ± ve Ã§evre dostu Ã¶zellikleriyle dikkat Ã§ekmektedir.\n\nâ¤ Hibrid Hurda Vinci HakkÄ±nda AyrÄ±ntÄ±lÄ± Bilgi: https://lnkd.in/dfHAnGb4\nâ¤ TÃ¼m Metal Hurda VinÃ§leri: https://lnkd.in/dR_YjNhn\nâ¤ Web Site: https://lnkd.in/dmZmCsMi",
        "likes": "42",
        "time": {
          "raw": "2h",
          "parsed": "03.03.2025",
          "isoString": "2025-03-03T05:03:21.827Z"
        },
        "mediaType": "video",
        "mediaContent": {
          "src": [
            {
              "src": "https://dms.licdn.com/playlist/vid/v2/D4D05AQF0rC5v8Q9Lug/mp4-720p-30fp-crf28/B4DZVCfShjHABg-/0/1740577404503?e=1742796000&v=beta&t=JP3puOOEt7sVJluLfF_E58FiQH8IYZiSZTOlH8LhjzM",
              "type": "video/mp4",
              "data-bitrate": 1045512
            },
            {
              "src": "https://dms.licdn.com/playlist/vid/v2/D4D05AQF0rC5v8Q9Lug/mp4-640p-30fp-crf28/B4DZVCfShjHABc-/0/1740577402363?e=1742796000&v=beta&t=Yb39yzdhCTVOlIu5S-yvsKLKpMvebXnXtKrEHGED4qI",
              "type": "video/mp4",
              "data-bitrate": 742380
            }
          ],
          "posterUrl": "https://media.licdn.com/dms/image/v2/D4D05AQF0rC5v8Q9Lug/feedshare-thumbnail_720_1280/B4DZVCfShjHAA8-/0/1740577255061?e=1742796000&v=beta&t=JFj3bjwSVFHoMYhDgDOWILun17F8h2TWtXDFe1zEaOY"
        },
        "date": "2025-03-03T05:03:21.827Z"
      },
      {
        "captions": "Piranha | The Ultimate Scrap Processing Solution\n- Superior performance for heavy and light scrap\n- With a cutting capacity of 1100 tons\n- Ideal for iron & steel plants\n\nâ¤ Detailed information about PÄ±ranha: birimrecycling.com/piranha\nâ¤ All Metal Scrap Shears: https://lnkd.in/dn-eeG2n\nâ¤ Web Site: birimrecycling.com/\n\n-----\n\nPiranha | Metal Hurda Geri DÃ¶nÃ¼ÅŸÃ¼mÃ¼nde En Ä°yi Ã‡Ã¶zÃ¼m\n- AÄŸÄ±r ve hafif hurdalar iÃ§in Ã¼stÃ¼n performans\n- Kesme kapasitesi 1100 ton olan\n- Demir Ã§elik tesisleri iÃ§in ideal\n\nâ¤ Piranha HakkÄ±nda AyrÄ±ntÄ±lÄ± Bilgi: birimrecycling.com/piranha\nâ¤ TÃ¼m Metal Hurda MakaslarÄ±: https://lnkd.in/dy9K9ues\nâ¤ Web Site: birimrecycling.com/",
        "likes": "30",
        "time": {
          "raw": "2h",
          "parsed": "03.03.2025",
          "isoString": "2025-03-03T05:03:21.829Z"
        },
        "mediaType": "video",
        "mediaContent": {
          "src": [
            {
              "src": "https://dms.licdn.com/playlist/vid/v2/D4D05AQGVOIdf6GvRfA/mp4-720p-30fp-crf28/B4DZU4KBdkHkBg-/0/1740403930933?e=1742796000&v=beta&t=iHH5634wr89PZGhZxUUVLWtWcE-Prp8M6tqHgEYB5As",
              "type": "video/mp4",
              "data-bitrate": 600482
            },
            {
              "src": "https://dms.licdn.com/playlist/vid/v2/D4D05AQGVOIdf6GvRfA/mp4-640p-30fp-crf28/B4DZU4KBdkHkBc-/0/1740403930097?e=1742796000&v=beta&t=mDq1VAP8QReJBCjCy4B1PhNGLKcFJaZmdPTq6oyJL2Y",
              "type": "video/mp4",
              "data-bitrate": 455081
            }
          ],
          "posterUrl": "https://media.licdn.com/dms/image/v2/D4D05AQGVOIdf6GvRfA/feedshare-thumbnail_720_1280/B4DZU4KBdkHkA8-/0/1740403911627?e=1742796000&v=beta&t=eMx29IrV1hMqskierEjADYGVUFFcA-5MkcTcL1TZjwg"
        },
        "date": "2025-03-03T05:03:21.829Z"
      },
      {
        "captions": "Piranha shears are designed to efficiently process metal scrap with high cutting capacity and durability.\n\nâš™ï¸ Working Principle: \n\nPiranha increases the density of all types of scrap by compressing it and then automatically cuts it into the desired lengths. Diesel and electric power options are available. It has a production capacity range from 6 to 60 tons per hour depending on the model. Thanks to the short stroke programme, the blades only rise up to the height of the scrap, reducing cutting time and increasing capacity.\n\nâ¤ Detailed information about PÄ±ranha: https://lnkd.in/dn-eeG2n\nâ¤ All Metal Scrap Shears: https://lnkd.in/dq423CXY\nâ¤ Web Site: birimrecycling.com/\n\n---\n\nMetal geri dÃ¶nÃ¼ÅŸÃ¼mÃ¼ndeki en bÃ¼yÃ¼k yardÄ±mcÄ±nÄ±z olan Piranha makasÄ±, yÃ¼ksek kesme kapasitesi ve dayanÄ±klÄ±lÄ±ÄŸÄ± ile metal hurdalarÄ± verimli bir ÅŸekilde iÅŸlemek iÃ§in tasarlanmÄ±ÅŸtÄ±r.\n\nâš™ï¸ Ã‡alÄ±ÅŸma Prensibi: \n\nPiranha,her cins hurdayÄ± sÄ±kÄ±ÅŸtÄ±rarak yoÄŸunluÄŸunu artÄ±rÄ±r ve ardÄ±ndan istenilen uzunluklarda otomatik olarak keser. Dizel ve elektrikli gÃ¼Ã§ seÃ§enekleri mevcuttur. Modele baÄŸlÄ± olarak saatte 6 ila 60 ton arasÄ±nda deÄŸiÅŸen Ã¼retim kapasitesine sahiptir. KÄ±sa strok programÄ± sayesinde bÄ±Ã§aklar yalnÄ±zca hurda yÃ¼ksekliÄŸi kadar kalkarak kesim sÃ¼resini azaltÄ±r ve kapasiteyi artÄ±rÄ±r. \n\nâ¤ Piranha HakkÄ±nda AyrÄ±ntÄ±lÄ± Bilgi: birimrecycling.com/piranha\nâ¤ TÃ¼m Metal Hurda MakaslarÄ±: https://lnkd.in/dy9K9ues\nâ¤ Web Site: birimrecycling.com/Piranha shears are designed to efficiently process metal scrap with high cutting capacity and durability.\n\nâš™ï¸ Working Principle: \n\nPiranha increases the density of all types of scrap by compressing it and then automatically cuts it into the desired lengths. Diesel and electric power options are available. It has a production capacity range from 6 to 60 tons per hour depending on the model. Thanks to the short stroke programme, the blades only rise up to the height of the scrap, reducing cutting time and increasing capacity.\n\nâ¤ Detailed information about PÄ±ranha: https://lnkd.in/dn-eeG2n\nâ¤ All Metal Scrap Shears: https://lnkd.in/dq423CXY\nâ¤ Web Site: birimrecycling.com/\n\n---\n\nMetal geri dÃ¶nÃ¼ÅŸÃ¼mÃ¼ndeki en bÃ¼yÃ¼k yardÄ±mcÄ±nÄ±z olan Piranha makasÄ±, yÃ¼ksek kesme kapasitesi ve dayanÄ±klÄ±lÄ±ÄŸÄ± ile metal hurdalarÄ± verimli bir ÅŸekilde iÅŸlemek iÃ§in tasarlanmÄ±ÅŸtÄ±r.\n\nâš™ï¸ Ã‡alÄ±ÅŸma Prensibi: \n\nPiranha,her cins hurdayÄ± sÄ±kÄ±ÅŸtÄ±rarak yoÄŸunluÄŸunu artÄ±rÄ±r ve ardÄ±ndan istenilen uzunluklarda otomatik olarak keser. Dizel ve elektrikli gÃ¼Ã§ seÃ§enekleri mevcuttur. Modele baÄŸlÄ± olarak saatte 6 ila 60 ton arasÄ±nda deÄŸiÅŸen Ã¼retim kapasitesine sahiptir. KÄ±sa strok programÄ± sayesinde bÄ±Ã§aklar yalnÄ±zca hurda yÃ¼ksekliÄŸi kadar kalkarak kesim sÃ¼resini azaltÄ±r ve kapasiteyi artÄ±rÄ±r. \n\nâ¤ Piranha HakkÄ±nda AyrÄ±ntÄ±lÄ± Bilgi: birimrecycling.com/piranha\nâ¤ TÃ¼m Metal Hurda MakaslarÄ±: https://lnkd.in/dy9K9ues\nâ¤ Web Site: birimrecycling.com/",
        "likes": "25",
        "time": {
          "raw": "3h",
          "parsed": "24.02.2025",
          "isoString": "2025-02-24T05:03:21.830Z"
        },
        "mediaType": "image",
        "mediaContent": [
          "https://media.licdn.com/dms/image/v2/D4D22AQEh3Q2nR6RWpA/feedshare-shrink_800/B4DZUo0jHYHwAg-/0/1740146619907?e=1744848000&v=beta&t=Sq41JpErPXCNv0FEJCwLkwZrUJJBmEMU3kFaWGcq_lM",
          "https://static.licdn.com/aero-v1/sc/h/dur0ryw0e9uscxa9b6zqvgvfs"
        ],
        "date": "2025-02-24T05:03:21.830Z"
      },
      {
        "captions": "Our new 30 kW laser cutting machine has started operations. Now we can cut more precise, faster and increase our production.\n\nYeni 30 kW lazer kesim tezgahÄ±mÄ±z devreye girdi. ArtÄ±k daha hassas, daha hÄ±zlÄ± keserek Ã¼retim kapasitemizi arttÄ±rÄ±yoruz.\n\n#birimmakina #metalgeridÃ¶nÃ¼ÅŸÃ¼m #metalprocessing #metalrecycling #scrapmetal",
        "likes": "29",
        "comments": "1",
        "time": {
          "raw": "3h",
          "parsed": "24.02.2025",
          "isoString": "2025-02-24T05:03:21.831Z"
        },
        "mediaType": "video",
        "mediaContent": {
          "src": [
            {
              "src": "https://dms.licdn.com/playlist/vid/v2/D4D05AQHpjeIkLNS2rw/mp4-640p-30fp-crf28/B4DZUkU9eCHABc-/0/1740071261184?e=1742796000&v=beta&t=8oblOlmCZB37xwOOQmgYShugjUuLAujE5JpVCZ3zdxc",
              "type": "video/mp4",
              "data-bitrate": 856639
            },
            {
              "src": "https://dms.licdn.com/playlist/vid/v2/D4D05AQHpjeIkLNS2rw/mp4-720p-30fp-crf28/B4DZUkU9eCHABg-/0/1740071262034?e=1742796000&v=beta&t=zSf8QPJqqTNXhN6YmIbN5FBgEoSL0rRnGkgLelYPK8Q",
              "type": "video/mp4",
              "data-bitrate": 1131400
            }
          ],
          "posterUrl": "https://media.licdn.com/dms/image/v2/D4D05AQHpjeIkLNS2rw/videocover-high/B4DZUkU9eCHABs-/0/1740071257761?e=1742796000&v=beta&t=V4SCAY_XczJ1S_X2Iq2nEl_6Bub4SUhsK9eZCvFS0kQ"
        },
        "date": "2025-02-24T05:03:21.831Z"
      },
      {
        "captions": "Piranha 1100S Metal Scrap Shear | Incline Shear | Birim Makina\n\nPiranha shears are designed to efficiently process metal scrap with high cutting capacity and durability.\n\nâš™ï¸ Working Principle: \n\nPiranha increases the density of all types of scrap by compressing it and then automatically cuts it into the desired lengths. Diesel and electric power options are available. It has a production capacity range from 6 to 60 tons per hour depending on the model. Thanks to the short stroke programme, the blades only rise up to the height of the scrap, reducing cutting time and increasing capacity.\n\nâ¤ Detailed information about PÄ±ranha: https://lnkd.in/d7xrtSDT\nâ¤ All Metal Scrap Shears: https://lnkd.in/dR9r2jNR\nâ¤ Web Site: https://lnkd.in/dmZmCsMi\n\n-----\n\nPiranha 1100S Metal Hurda MakasÄ± | SÃ¼rekli Kesim MakasÄ± | Incline Shears | Birim Makina\n\nMetal geri dÃ¶nÃ¼ÅŸÃ¼mÃ¼ndeki en bÃ¼yÃ¼k yardÄ±mcÄ±nÄ±z olan Piranha makasÄ±, yÃ¼ksek kesme kapasitesi ve dayanÄ±klÄ±lÄ±ÄŸÄ± ile metal hurdalarÄ± verimli bir ÅŸekilde iÅŸlemek iÃ§in tasarlanmÄ±ÅŸtÄ±r.\n\nâš™ï¸ Ã‡alÄ±ÅŸma Prensibi: \n\nPiranha,her cins hurdayÄ± sÄ±kÄ±ÅŸtÄ±rarak yoÄŸunluÄŸunu artÄ±rÄ±r ve ardÄ±ndan istenilen uzunluklarda otomatik olarak keser. Dizel ve elektrikli gÃ¼Ã§ seÃ§enekleri mevcuttur. Modele baÄŸlÄ± olarak saatte 6 ila 60 ton arasÄ±nda deÄŸiÅŸen Ã¼retim kapasitesine sahiptir. KÄ±sa strok programÄ± sayesinde bÄ±Ã§aklar yalnÄ±zca hurda yÃ¼ksekliÄŸi kadar kalkarak kesim sÃ¼resini azaltÄ±r ve kapasiteyi artÄ±rÄ±r. \n\nâ¤ Piranha HakkÄ±nda AyrÄ±ntÄ±lÄ± Bilgi: https://lnkd.in/dgpkxxh7\nâ¤ TÃ¼m Metal Hurda MakaslarÄ±: https://lnkd.in/dzQUGq_y\nâ¤ Web Site: https://lnkd.in/dmZmCsMi",
        "likes": "43",
        "comments": "1",
        "shares": "2",
        "time": {
          "raw": "3h",
          "parsed": "24.02.2025",
          "isoString": "2025-02-24T05:03:21.832Z"
        },
        "mediaType": "video",
        "mediaContent": {
          "src": [
            {
              "src": "https://dms.licdn.com/playlist/vid/v2/D4D05AQEKkZwUGtzqSg/mp4-640p-30fp-crf28/B4DZUemjIVHIBc-/0/1739975448162?e=1742796000&v=beta&t=xr8UqEaXv0InM4qb26HfKPPnO4CMgc8aSXAfv4qumbM",
              "type": "video/mp4",
              "data-bitrate": 862726
            },
            {
              "src": "https://dms.licdn.com/playlist/vid/v2/D4D05AQEKkZwUGtzqSg/mp4-720p-30fp-crf28/B4DZUemjIVHIBg-/0/1739975441970?e=1742796000&v=beta&t=lsnwRDGOG9iJinE57wy6qCKeR9IGUVHArLclhgKmx4M",
              "type": "video/mp4",
              "data-bitrate": 1144112
            }
          ],
          "posterUrl": "https://media.licdn.com/dms/image/v2/D4D05AQEKkZwUGtzqSg/videocover-high/B4DZUemjIVHIBs-/0/1739975393080?e=1742796000&v=beta&t=2dqqYG2G_AfSy5V_6XSdPEORCgG5pCyfPPBRqUzy41Q"
        },
        "date": "2025-02-24T05:03:21.832Z"
      },
      {
        "captions": "Did You Meet Our Cats Our Cats ? \n\nStreamline your recycling processes with the Leopard, Tiger, Lion and Puma. \n\nğŸ’ª Power and Technology Together:\n\nFully Automatic and Long-term Use\nVarious Models and Power Options\nDurable Design for High Performance Under Heavy Duty Operation\n\nâ¤ Leopard: https://lnkd.in/dh27E9eS\nâ¤ Tiger: birimrecycling.com/tiger-2\nâ¤ Lion: birimrecycling.com/lion-2\nâ¤ Puma: birimrecycling.com/puma-2\n---Â  \n\nKedilerimiz Ä°le TanÄ±ÅŸtÄ±nÄ±z mÄ± ? \n\nLeopard, Tiger, Lion and Puma ileÂ metal iÅŸleme ve geri dÃ¶nÃ¼ÅŸÃ¼m sÃ¼reÃ§lerinizi kolaylaÅŸtÄ±rÄ±n.\n\nğŸ’ª GÃ¼Ã§ ve Teknoloji Bir Arada:\n\nTam otomatik ve kesintisiz Ã§alÄ±ÅŸma\nÃ‡eÅŸitli modeller ve gÃ¼Ã§ seÃ§enekleri\nDayanÄ±klÄ± tasarÄ±m ve uzun Ã¶mÃ¼r\n\nâ¤ Leopard: birimrecycling.com/leopard\nâ¤ Tiger: birimrecycling.com/tiger\nâ¤ Lion: birimrecycling.com/lion\nâ¤ Puma: birimrecycling.com/puma\n\n#DÃ¼nyaKedilerGÃ¼nÃ¼Â #WorldCatsDayÂ #BirimMakinaÂ #MetalGeriDÃ¶nÃ¼ÅŸÃ¼mÂ #MetalÄ°ÅŸlemeÂ #MetalHurdaPresiÂ #MetalScrapBalers",
        "likes": "14",
        "comments": "1",
        "shares": "1",
        "time": {
          "raw": "3h",
          "parsed": "24.02.2025",
          "isoString": "2025-02-24T05:03:21.833Z"
        },
        "mediaType": "video",
        "mediaContent": {
          "src": [
            {
              "src": "https://dms.licdn.com/playlist/vid/v2/D4D05AQE6-oEXLsZ5sw/mp4-640p-30fp-crf28/B4DZUUFfnaG8Bg-/0/1739798789500?e=1742796000&v=beta&t=Lnf4-wJaxmDvbHrc-NgmT75Rx68sP-JkVq94TiT7Dsk",
              "type": "video/mp4",
              "data-bitrate": 472133
            },
            {
              "src": "https://dms.licdn.com/playlist/vid/v2/D4D05AQE6-oEXLsZ5sw/mp4-720p-30fp-crf28/B4DZUUFfnaG8Bk-/0/1739798789618?e=1742796000&v=beta&t=t6q_dJgZxQ_HSGs1vpsNW02Sgzc4h7-aDcpDsAMXB4w",
              "type": "video/mp4",
              "data-bitrate": 622630
            }
          ],
          "posterUrl": "https://media.licdn.com/dms/image/v2/D4D05AQE6-oEXLsZ5sw/feedshare-thumbnail_720_1280/B4DZUUFfnaG8BA-/0/1739798742820?e=1742796000&v=beta&t=RjPvQ3n5eILzNK9-OXF8kyYKQB_6S7ZTrvBtkT2LBLk"
        },
        "date": "2025-02-24T05:03:21.833Z"
      },
      {
        "captions": "Features of Murenha:\n\nâœ”ï¸ Automatic Lubrication\nâœ”ï¸ Lubricant filtering system for continuous operation\nâœ”ï¸ Non-contact sensors to avoid re-calibration\nâœ”ï¸ Optional Mobile and Semi Mobile versions\n\n-----\n\nMurenha'nÄ±n OÌˆzellikeri:\n\nâœ”ï¸ Otomatik yagÌ†lama\nâœ”ï¸ Sorunsuz operasyon icÌ§in oÌˆzel yagÌ† filtreleme sistemi\nâœ”ï¸ AyarÄ± kacÌ§mayan temassÄ±z sensoÌˆrler\nâœ”ï¸ Opsiyonel mobil veya yarÄ± mobil uygulamalarÄ±\n\n#MetalHurdaPresi #MetalScrapShears #ScrapRecyclingProcess #HurdaGeriDoÌˆnuÌˆsÌ§uÌˆm #BirimMakinaFeatures of Murenha:\n\nâœ”ï¸ Automatic Lubrication\nâœ”ï¸ Lubricant filtering system for continuous operation\nâœ”ï¸ Non-contact sensors to avoid re-calibration\nâœ”ï¸ Optional Mobile and Semi Mobile versions\n\n-----\n\nMurenha'nÄ±n OÌˆzellikeri:\n\nâœ”ï¸ Otomatik yagÌ†lama\nâœ”ï¸ Sorunsuz operasyon icÌ§in oÌˆzel yagÌ† filtreleme sistemi\nâœ”ï¸ AyarÄ± kacÌ§mayan temassÄ±z sensoÌˆrler\nâœ”ï¸ Opsiyonel mobil veya yarÄ± mobil uygulamalarÄ±\n\n#MetalHurdaPresi #MetalScrapShears #ScrapRecyclingProcess #HurdaGeriDoÌˆnuÌˆsÌ§uÌˆm #BirimMakina",
        "likes": "48",
        "comments": "3",
        "shares": "2",
        "time": {
          "raw": "1ay",
          "parsed": "17.02.2025",
          "isoString": "2025-02-17T05:03:21.834Z"
        },
        "mediaType": "image",
        "mediaContent": [
          "https://media.licdn.com/dms/image/v2/D4D22AQGOmjiUwslmtw/feedshare-shrink_800/B4DZUFb_jDHIAk-/0/1739552980713?e=1744848000&v=beta&t=jSpyYdvVw8xjxU4gp-ID_507E8FjBVqMi_ief_unDsI"
        ],
        "date": "2025-02-17T05:03:21.834Z"
      },
      {
        "captions": "Berat Kandilimiz MÃ¼barek Olsun!Berat Kandilimiz MÃ¼barek Olsun!",
        "likes": "10",
        "time": {
          "raw": "1ay",
          "parsed": "17.02.2025",
          "isoString": "2025-02-17T05:03:21.836Z"
        },
        "mediaType": "image",
        "mediaContent": [
          "https://media.licdn.com/dms/image/v2/D4D22AQG2lxthqcevzw/feedshare-shrink_800/B4DZT_tcuhHAAk-/0/1739456894174?e=1744848000&v=beta&t=Edxw4qrmvRkbpJWNtT5NFvwPljAJ03-B3FAAJRbwngE"
        ],
        "date": "2025-02-17T05:03:21.836Z"
      },
      {
        "captions": "ğŸ“¢ğŸ“¢ New video available ! \n\nâ¤ Briquetting Press: https://lnkd.in/d3VakZkP\nâ¤ All Balers: https://lnkd.in/dC6zMMyk\n\nhttps://lnkd.in/daeYZP2q",
        "likes": "20",
        "shares": "1",
        "time": {
          "raw": "1ay",
          "parsed": "17.02.2025",
          "isoString": "2025-02-17T05:03:21.837Z"
        },
        "mediaType": "other",
        "date": "2025-02-17T05:03:21.837Z"
      },
      {
        "captions": "NO GUTS , NO GLORY\n\nAnother BIRIM continuous baler just started operation in Sydney -Australia.  \nHigh Density Bales, \nFast Cycle Time, \nHigh Productivity,\nRobust Design, \nHigh Quality Hydraulic & Electrical Components,\n\n& HAPPY CUSTOMERS WORLDWIDE\n..NO GUTS , NO GLORY\n\nAnother BIRIM continuous baler just started operation in Sydney -Australia.  \nHigh Density Bales, \nFast Cycle Time, \nHigh Productivity,\nRobust Design, \nHigh Quality Hydraulic & Electrical Components,\n\n& HAPPY CUSTOMERS WORLDWIDE\n..",
        "likes": "49",
        "shares": "2",
        "time": {
          "raw": "1ay",
          "parsed": "17.02.2025",
          "isoString": "2025-02-17T05:03:21.838Z"
        },
        "mediaType": "image",
        "mediaContent": [
          "https://media.licdn.com/dms/image/v2/D4D22AQGySvfNKyMxuQ/feedshare-shrink_800/B4DZTwIsuLHwAo-/0/1739195601465?e=1744848000&v=beta&t=-CE63bD6p2Kia5VokmX3kD9RB3_kWdBPzxbeMYKQ2O8",
          "https://media.licdn.com/dms/image/v2/D4D22AQE0sPhqtMVoGg/feedshare-shrink_800/B4DZTwIsvDHkAo-/0/1739195601570?e=1744848000&v=beta&t=uNkSZtnybJwRSRBb4fjXgZlchFc0dbdxLmLeT5Zr_ms"
        ],
        "date": "2025-02-17T05:03:21.838Z"
      },
      {
        "captions": "Features of Leopard Baler:Â \nâœ”ï¸ Capacity up to 24 tons/hour (Fe)Â \nâœ”ï¸ Fully automated operation for ease of useÂ \nâœ”ï¸ Durable design for high performance under heavy duty operation\n\nâ¤ Detailed information about Leopard: https://lnkd.in/ddpHtraE\nâ¤ All Metal Scrap Balers: https://lnkd.in/dq-MMRYC\nâ¤ Web Site: https://lnkd.in/dmZmCsMi\n\n----\n\nLeopard SÃ¼rekli Pres Ã–zellikleri:Â \nâœ”ï¸ Maksimum 24 ton/saat (Fe) kapasiteli modelleri mevcutturÂ \nâœ”ï¸ KullanÄ±m kolaylÄ±ÄŸÄ± iÃ§in tam otomatik Ã§alÄ±ÅŸmaÂ \nâœ”ï¸ AÄŸÄ±r gÃ¶rev koÅŸullarÄ±nda yÃ¼ksek performans iÃ§in dayanÄ±klÄ± tasarÄ±m \n\nâ¤ Leopard HakkÄ±nda AyrÄ±ntÄ± bilgi: https://lnkd.in/d5pNy44X\nâ¤ TÃ¼m Metal Hurda Preslerimiz: https://lnkd.in/d3w4W9Wa\nâ¤ Web Sitemiz: https://lnkd.in/dSwqCgZ8\n\n#BirimMakina #MetalGeriDÃ¶nÃ¼ÅŸÃ¼mÂ #MetalÄ°ÅŸlemeÂ #3BamBalers #ContuniusBaler #MetalHurdaPresi #MetalScrapBalersFeatures of Leopard Baler:Â \nâœ”ï¸ Capacity up to 24 tons/hour (Fe)Â \nâœ”ï¸ Fully automated operation for ease of useÂ \nâœ”ï¸ Durable design for high performance under heavy duty operation\n\nâ¤ Detailed information about Leopard: https://lnkd.in/ddpHtraE\nâ¤ All Metal Scrap Balers: https://lnkd.in/dq-MMRYC\nâ¤ Web Site: https://lnkd.in/dmZmCsMi\n\n----\n\nLeopard SÃ¼rekli Pres Ã–zellikleri:Â \nâœ”ï¸ Maksimum 24 ton/saat (Fe) kapasiteli modelleri mevcutturÂ \nâœ”ï¸ KullanÄ±m kolaylÄ±ÄŸÄ± iÃ§in tam otomatik Ã§alÄ±ÅŸmaÂ \nâœ”ï¸ AÄŸÄ±r gÃ¶rev koÅŸullarÄ±nda yÃ¼ksek performans iÃ§in dayanÄ±klÄ± tasarÄ±m \n\nâ¤ Leopard HakkÄ±nda AyrÄ±ntÄ± bilgi: https://lnkd.in/d5pNy44X\nâ¤ TÃ¼m Metal Hurda Preslerimiz: https://lnkd.in/d3w4W9Wa\nâ¤ Web Sitemiz: https://lnkd.in/dSwqCgZ8\n\n#BirimMakina #MetalGeriDÃ¶nÃ¼ÅŸÃ¼mÂ #MetalÄ°ÅŸlemeÂ #3BamBalers #ContuniusBaler #MetalHurdaPresi #MetalScrapBalers",
        "likes": "52",
        "comments": "1",
        "shares": "1",
        "time": {
          "raw": "1ay",
          "parsed": "17.02.2025",
          "isoString": "2025-02-17T05:03:21.840Z"
        },
        "mediaType": "image",
        "mediaContent": [
          "https://media.licdn.com/dms/image/v2/D4D22AQGC0wfKDQs4KQ/feedshare-shrink_800/B4DZSyaOZKHkAk-/0/1738160008746?e=1744848000&v=beta&t=A05BUrttVhDaPk6Q7guP5rpgU3YnOlp0HaA9TTtXvi8"
        ],
        "date": "2025-02-17T05:03:21.840Z"
      },
      {
        "captions": "KahramanmaraÅŸ merkezli, 11 ilimizi etkileyen deprem felaketinde hayatÄ±nÄ± kaybeden vatandaÅŸlarÄ±mÄ±zÄ± rahmet ve Ã¶zlemle anÄ±yor, yakÄ±nlarÄ±na ve tÃ¼m Ã¼lkemize baÅŸsaÄŸlÄ±ÄŸÄ± ve sabÄ±r diliyoruz.\n\n#UnutmadÄ±k #6ÅubatKahramanmaraÅŸ merkezli, 11 ilimizi etkileyen deprem felaketinde hayatÄ±nÄ± kaybeden vatandaÅŸlarÄ±mÄ±zÄ± rahmet ve Ã¶zlemle anÄ±yor, yakÄ±nlarÄ±na ve tÃ¼m Ã¼lkemize baÅŸsaÄŸlÄ±ÄŸÄ± ve sabÄ±r diliyoruz.\n\n#UnutmadÄ±k #6Åubat",
        "likes": "4",
        "time": {
          "raw": "1ay",
          "parsed": "17.02.2025",
          "isoString": "2025-02-17T05:03:21.841Z"
        },
        "mediaType": "image",
        "mediaContent": [
          "https://media.licdn.com/dms/image/v2/D4D22AQEw6g7ZxPNwWQ/feedshare-shrink_800/B4DZTar6rkGcAk-/0/1738835734993?e=1744848000&v=beta&t=tm174GlL5l7IlHLpwe-jKYj4EnEIXUKP157DOBTTs2s"
        ],
        "date": "2025-02-17T05:03:21.841Z"
      },
      {
        "captions": "ğŸ“¢ğŸ“¢ New Video Available Now\n\nLeopard Continuous Baler | 3 Ram Baler\n\nLeopard Balers are designed to efficiently process metal scrap with high cutting capacity and durability. Leopard increases the density of all types of scrap by compressing it and makes it ready for other processes.\n\nhttps://lnkd.in/dfe_mNv8",
        "likes": "9",
        "time": {
          "raw": "1ay",
          "parsed": "17.02.2025",
          "isoString": "2025-02-17T05:03:21.842Z"
        },
        "mediaType": "other",
        "date": "2025-02-17T05:03:21.842Z"
      },
      {
        "captions": "Streamline your recycling processes with the Shark, Piranha, Orca, Mobile Shark and Murenha. Each is designed to provide high capacity, durability and maximum efficiency. â™»ï¸\n\nğŸ’ª Power and Technology Together:\n\nFully Automatic and Long-term Use\nVarious Models and Power Options\nDurable Design for High Performance Under Heavy Duty Operation\n\nMeet our scrap processing solutions and boost your productivity ğŸš€\n\nAll Shears: https://lnkd.in/dq423CXY\n\n---\n\nShark, Piranha, Orca, Mobile Shark ve Murenha ile metal iÅŸleme ve geri dÃ¶nÃ¼ÅŸÃ¼m sÃ¼reÃ§lerinizi kolaylaÅŸtÄ±rÄ±n. Her biri, yÃ¼ksek kapasite, dayanÄ±klÄ±lÄ±k ve maksimum verimlilik saÄŸlamak iÃ§in tasarlandÄ±. â™»ï¸\n\nğŸ’ª GÃ¼Ã§ ve Teknoloji Bir Arada:\n\nTam otomatik ve kesintisiz Ã§alÄ±ÅŸma\nÃ‡eÅŸitli modeller ve gÃ¼Ã§ seÃ§enekleri\nDayanÄ±klÄ± tasarÄ±m ve uzun Ã¶mÃ¼r\n\nHurda iÅŸleme Ã§Ã¶zÃ¼mlerimizle tanÄ±ÅŸÄ±n ve Ã¼retiminizi bir Ã¼st seviyeye taÅŸÄ±yÄ±n! ğŸš€\n\nTÃ¼m Hurda MakaslarÄ±: https://lnkd.in/dy9K9ues",
        "likes": "31",
        "comments": "1",
        "time": {
          "raw": "1ay",
          "parsed": "17.02.2025",
          "isoString": "2025-02-17T05:03:21.843Z"
        },
        "mediaType": "video",
        "mediaContent": {
          "src": [
            {
              "src": "https://dms.licdn.com/playlist/vid/v2/D4D05AQHwTLNBqFTk0Q/mp4-640p-30fp-crf28/B4DZStGohaG8Bc-/0/1738071000427?e=1742796000&v=beta&t=InTCCXZ2wXV72q9n3ewHkBc3KfptBLi6aOgaiOssuaE",
              "type": "video/mp4",
              "data-bitrate": 424917
            },
            {
              "src": "https://dms.licdn.com/playlist/vid/v2/D4D05AQHwTLNBqFTk0Q/mp4-720p-30fp-crf28/B4DZStGohaG8Bg-/0/1738070999863?e=1742796000&v=beta&t=pRBlfkXfdDo96vkXzh4WJcZ-PeIn2l-zUo_ZVV9cbJY",
              "type": "video/mp4",
              "data-bitrate": 560053
            }
          ],
          "posterUrl": "https://media.licdn.com/dms/image/v2/D4D05AQHwTLNBqFTk0Q/feedshare-thumbnail_720_1280/B4DZStGohaG8A8-/0/1738070987508?e=1742796000&v=beta&t=Hm4QeuXsajg9bMr_p2X_VEWIsQesVVVR2BbKmtwYzKc"
        },
        "date": "2025-02-17T05:03:21.843Z"
      }
    ]
  },
  {
    "name": "DanieliGroup",
    "data": [
      {
        "captions": "MRAI Expo in Jaipur, marks our first event of 2025, and we couldnâ€™t be more excited!â˜€\n\nğŸƒ Visit our stand to explore the best #Danieli solutions to take your business to the next level in the green and circular economy sectors.\n\n \nğŸ” Find us at Booth 1309 \nğŸ“… From January 28th to 30th\nğŸ“ Novotel Jaipur Convention Center, Jaipur, India \nÂ \nğŸŒ Want to know where to find Danieli next? \nCheck out our website for updates on all future events ğŸ‘‰ https://lnkd.in/dh8zMFDM\n\nMaterial Recycling Association of India MRAI Expo in Jaipur, marks our first event of 2025, and we couldnâ€™t be more excited!â˜€\n\nğŸƒ Visit our stand to explore the best #Danieli solutions to take your business to the next level in the green and circular economy sectors.\n\n \nğŸ” Find us at Booth 1309 \nğŸ“… From January 28th to 30th\nğŸ“ Novotel Jaipur Convention Center, Jaipur, India \nÂ \nğŸŒ Want to know where to find Danieli next? \nCheck out our website for updates on all future events ğŸ‘‰ https://lnkd.in/dh8zMFDM\n\nMaterial Recycling Association of India",
        "likes": "14",
        "shares": "6",
        "time": {
          "raw": "2ay",
          "parsed": "17.01.2025",
          "isoString": "2025-01-17T05:03:42.546Z"
        },
        "mediaType": "image",
        "mediaContent": [
          "https://media.licdn.com/dms/image/v2/D4D22AQGuftsVUXhQ2A/feedshare-shrink_800/B4DZRkpAZgHEAg-/0/1736855259103?e=1744848000&v=beta&t=Np4NI8tGZpqHuHPnRUiVwGt0ojRZ3g5VRT0aEcRCXpY"
        ],
        "date": "2025-01-17T05:03:42.546Z"
      },
      {
        "captions": "Dun dun duuun! The DaNews #DIM Special Issue is here and looking dapper â­Â Â \nDive into the Fifth Danieli Innovaction Meeting with an in-depth focus on:Â \nğŸ¯ Industry-expert panelsÂ \nâš™ Dedicated #green technology sessionsÂ \nâœˆ Global plant toursÂ \nğŸ§­ A journey through #Danieliâ€™s history and our beautiful region \n\nAnd more!\nÂ Â \nGrab your definitive digital #DaNews copy here â¡Â https://lnkd.in/g4D6dyc",
        "likes": "279",
        "shares": "17",
        "time": {
          "raw": "4ay",
          "parsed": "17.11.2024",
          "isoString": "2024-11-17T05:03:42.548Z"
        },
        "mediaType": "video",
        "mediaContent": {
          "src": [
            {
              "src": "https://dms.licdn.com/playlist/vid/v2/D4E05AQECihFi870umQ/mp4-640p-30fp-crf28/mp4-640p-30fp-crf28/0/1731428429183?e=1742796000&v=beta&t=eu9mRMUAaYRUejbVD603QcugrqmLQ-F5o4e0bx5Sqmg",
              "type": "video/mp4",
              "data-bitrate": 455926
            },
            {
              "src": "https://dms.licdn.com/playlist/vid/v2/D4E05AQECihFi870umQ/mp4-720p-30fp-crf28/mp4-720p-30fp-crf28/0/1731428430976?e=1742796000&v=beta&t=2sLt-4-xl_3fKZC5hKv7DA3YBmyD8BvMQof65FQwYCk",
              "type": "video/mp4",
              "data-bitrate": 619108
            }
          ],
          "posterUrl": "https://media.licdn.com/dms/image/v2/D4E05AQECihFi870umQ/feedshare-thumbnail_720_1280/feedshare-thumbnail_720_1280/0/1731428409767?e=1742796000&v=beta&t=fKmXOTDtA-M9DSSAsWghJLxP3vjuBIMhuf840RoiowE"
        },
        "date": "2024-11-17T05:03:42.548Z"
      },
      {
        "captions": "Everything is ready for Ecomondo, and we will be there too! â˜€\nğŸƒ Visit our stand to explore the best #Danieli solutions to take your business to the next level in the green and circular economy sectors.\nECOMONDO - ITALIAN EXHIBITION GROUP\n \nğŸ” Find us at Booth A3/109-111 \nğŸ“… From November 5th to 8th\nğŸ“ At Rimini Expo Centre, Rimini, Italy \nÂ \nğŸŒ Want to know where to find Danieli next? \nCheck out our website for updates on all future events ğŸ‘‰ https://lnkd.in/dh8zMFDMEverything is ready for Ecomondo, and we will be there too! â˜€\nğŸƒ Visit our stand to explore the best #Danieli solutions to take your business to the next level in the green and circular economy sectors.\nECOMONDO - ITALIAN EXHIBITION GROUP\n \nğŸ” Find us at Booth A3/109-111 \nğŸ“… From November 5th to 8th\nğŸ“ At Rimini Expo Centre, Rimini, Italy \nÂ \nğŸŒ Want to know where to find Danieli next? \nCheck out our website for updates on all future events ğŸ‘‰ https://lnkd.in/dh8zMFDM",
        "likes": "17",
        "comments": "1",
        "shares": "4",
        "time": {
          "raw": "4ay",
          "parsed": "17.11.2024",
          "isoString": "2024-11-17T05:03:42.549Z"
        },
        "mediaType": "image",
        "mediaContent": [
          "https://media.licdn.com/dms/image/v2/D4D22AQH2O1Y23a-X1g/feedshare-shrink_800/feedshare-shrink_800/0/1730360484228?e=1744848000&v=beta&t=YEc7itqHlzvJOGHPpO3B3dL4OzkAY49ijl0W_Jqp2K0"
        ],
        "date": "2024-11-17T05:03:42.549Z"
      },
      {
        "captions": "BIR World Recycling Convention is coming, and we'll not miss the event! â˜€\nâ™» #Danieli is ready to make its mark with innovative solutions for the sustainable economic development: visit our stand to take your business to the next level.\n \nğŸ” Find us at Booth B02 \nğŸ“… From October 28th to 29th \nğŸ“ At Raffles City Convention Centre, Singapore \nÂ \nğŸŒ Want to know where to find Danieli next? \nCheck out our website for updates on all future events ğŸ‘‰ https://lnkd.in/dh8zMFDM\nBureau of International RecyclingBIR World Recycling Convention is coming, and we'll not miss the event! â˜€\nâ™» #Danieli is ready to make its mark with innovative solutions for the sustainable economic development: visit our stand to take your business to the next level.\n \nğŸ” Find us at Booth B02 \nğŸ“… From October 28th to 29th \nğŸ“ At Raffles City Convention Centre, Singapore \nÂ \nğŸŒ Want to know where to find Danieli next? \nCheck out our website for updates on all future events ğŸ‘‰ https://lnkd.in/dh8zMFDM\nBureau of International Recycling",
        "likes": "25",
        "shares": "2",
        "time": {
          "raw": "4ay",
          "parsed": "17.11.2024",
          "isoString": "2024-11-17T05:03:42.551Z"
        },
        "mediaType": "image",
        "mediaContent": [
          "https://media.licdn.com/dms/image/v2/D4D22AQHstak22oLumQ/feedshare-shrink_800/feedshare-shrink_800/0/1729860335368?e=1744848000&v=beta&t=Q4apnOdoXEG0lXDOk_GP4fmNZQSKG5zqkMcRF90HRHA"
        ],
        "date": "2024-11-17T05:03:42.551Z"
      },
      {
        "captions": "It's our honor to announce Danieli Group as an exhibitor at FABEX Saudi Arabia 2024 \n\nRegister Now to visit and get your free ticket at: https://lnkd.in/ds5N22zB \n\nğŸ“…Dates: 13-16 OCTOBER 2024\nğŸ“Venue: Riyadh International Convention & Exhibition Centre (Halls 1,2,3,4,5)\nğŸŒWebsite: https://www.fabxsaudi.com/\nğŸ“§Email: riyadh@arabiangerman.com\n\n#FABEX #FABEXKSA #MACH #Metal_and_Steel #FABEX_SaudiArabia #SaudiArabia #riyadh #MetalIndustry #SteelFabrication #Machinery #Steel #Machinery #Metal #CNC #Welding #Cutting #automationIt's our honor to announce Danieli Group as an exhibitor at FABEX Saudi Arabia 2024 \n\nRegister Now to visit and get your free ticket at: https://lnkd.in/ds5N22zB \n\nğŸ“…Dates: 13-16 OCTOBER 2024\nğŸ“Venue: Riyadh International Convention & Exhibition Centre (Halls 1,2,3,4,5)\nğŸŒWebsite: https://www.fabxsaudi.com/\nğŸ“§Email: riyadh@arabiangerman.com\n\n#FABEX #FABEXKSA #MACH #Metal_and_Steel #FABEX_SaudiArabia #SaudiArabia #riyadh #MetalIndustry #SteelFabrication #Machinery #Steel #Machinery #Metal #CNC #Welding #Cutting #automation",
        "likes": "12",
        "shares": "4",
        "time": {
          "raw": "7ay",
          "parsed": "17.08.2024",
          "isoString": "2024-08-17T05:03:42.552Z"
        },
        "mediaType": "image",
        "mediaContent": [
          "https://media.licdn.com/dms/image/v2/D4D22AQFwcCRJNjjIBw/feedshare-shrink_800/feedshare-shrink_800/0/1723727332470?e=1744848000&v=beta&t=2onvBBBv36bRcRNxtLY31NKHjgQ2d3500-lYjWzlSaE"
        ],
        "date": "2024-08-17T05:03:42.552Z"
      },
      {
        "captions": "It's time for Scrap Expo, and we'll be there! â˜€\n\nâ­ Discover the latest trends, network with industry leaders, and explore the best #Danieli solutions to take your business to the next level. \nğŸ” Find us at Booth 420 \nğŸ“… From September 17 to 18 \nğŸ“ At Kentucky Exposition Center, Louisville, USA \nğŸŒ Want to know where to find Danieli next? \nCheck out our website for updates on all future events ğŸ‘‰ https://lnkd.in/dh8zMFDMIt's time for Scrap Expo, and we'll be there! â˜€\n\nâ­ Discover the latest trends, network with industry leaders, and explore the best #Danieli solutions to take your business to the next level. \nğŸ” Find us at Booth 420 \nğŸ“… From September 17 to 18 \nğŸ“ At Kentucky Exposition Center, Louisville, USA \nğŸŒ Want to know where to find Danieli next? \nCheck out our website for updates on all future events ğŸ‘‰ https://lnkd.in/dh8zMFDM",
        "likes": "16",
        "shares": "9",
        "time": {
          "raw": "6ay",
          "parsed": "17.09.2024",
          "isoString": "2024-09-17T05:03:42.554Z"
        },
        "mediaType": "image",
        "mediaContent": [
          "https://media.licdn.com/dms/image/v2/D4D22AQGnBxCWO-UPlw/feedshare-shrink_800/feedshare-shrink_800/0/1726568048923?e=1744848000&v=beta&t=LfUBJassOM9mKw359RG2ZSdxiP34n0kNSnC-SmUPDM0"
        ],
        "date": "2024-09-17T05:03:42.554Z"
      },
      {
        "captions": "ğŸ”” Danieli Centro Recycling will be present at IFAT Munich 2024!\nÂ \nJoin us\nğŸ“… From May 13 to 17\nğŸ“ Hall B4, Booth 415 \nÂ \nğŸ’¼ Looking for global opportunities? Check out our website: https://lnkd.in/ez2Fvdt8The leading trade fair for environmental technologies is back! â™»Â Â \nğŸ’¡ IFAT worldwide starts next week and Danieli is ready to be a part of it. Are you? Â Â \nğŸ” Find us at Hall B4, Booth 415 Â \nğŸ“… From May 13 to 17Â \nğŸ“ At Messe MÃ¼nchen, GermanyÂ Â \nğŸŒ Want to know where to find Danieli next? Â \nCheck out our website for updates on all future events ğŸ‘‰ https://lnkd.in/dh8zMFDM",
        "likes": "21",
        "shares": "3",
        "time": {
          "raw": "10ay10ay",
          "parsed": "17.03.2025",
          "isoString": "2025-03-17T05:03:42.556Z"
        },
        "mediaType": "video",
        "mediaContent": {
          "src": [
            {
              "src": "https://dms.licdn.com/playlist/vid/v2/D4E05AQEmFCbkTAT7VQ/mp4-640p-30fp-crf28/mp4-640p-30fp-crf28/0/1715172375594?e=1742796000&v=beta&t=4Xwx8nurPP19GELbLVIz1Z-96lHNH1mOSOaQ0Yygg1Q",
              "type": "video/mp4",
              "data-bitrate": 55193
            },
            {
              "src": "https://dms.licdn.com/playlist/vid/v2/D4E05AQEmFCbkTAT7VQ/mp4-720p-30fp-crf28/mp4-720p-30fp-crf28/0/1715172375508?e=1742796000&v=beta&t=hYj805Il9JSNRSPDKXuMReN2pCkPpX93207CSZLQREw",
              "type": "video/mp4",
              "data-bitrate": 66819
            }
          ],
          "posterUrl": "https://media.licdn.com/dms/image/v2/D4E05AQEmFCbkTAT7VQ/feedshare-thumbnail_720_1280/feedshare-thumbnail_720_1280/0/1715172365655?e=1742796000&v=beta&t=mM9yjBWF4kauQlWDQSVZ24ipiL1hUoaJHnAygeFOSLk"
        },
        "date": "2025-03-17T05:03:42.556Z"
      },
      {
        "captions": "The leading trade fair for environmental technologies is back! â™»Â Â \nğŸ’¡ IFAT worldwide starts next week and Danieli is ready to be a part of it. Are you? Â Â \nğŸ” Find us at Hall B4, Booth 415 Â \nğŸ“… From May 13 to 17Â \nğŸ“ At Messe MÃ¼nchen, GermanyÂ Â \nğŸŒ Want to know where to find Danieli next? Â \nCheck out our website for updates on all future events ğŸ‘‰ https://lnkd.in/dh8zMFDM",
        "time": {
          "raw": "10ay",
          "parsed": "17.05.2024",
          "isoString": "2024-05-17T05:03:42.557Z"
        },
        "mediaType": "video",
        "mediaContent": {
          "src": [
            {
              "src": "https://dms.licdn.com/playlist/vid/v2/D4E05AQEmFCbkTAT7VQ/mp4-640p-30fp-crf28/mp4-640p-30fp-crf28/0/1715172375594?e=1742796000&v=beta&t=4Xwx8nurPP19GELbLVIz1Z-96lHNH1mOSOaQ0Yygg1Q",
              "type": "video/mp4",
              "data-bitrate": 55193
            },
            {
              "src": "https://dms.licdn.com/playlist/vid/v2/D4E05AQEmFCbkTAT7VQ/mp4-720p-30fp-crf28/mp4-720p-30fp-crf28/0/1715172375508?e=1742796000&v=beta&t=hYj805Il9JSNRSPDKXuMReN2pCkPpX93207CSZLQREw",
              "type": "video/mp4",
              "data-bitrate": 66819
            }
          ],
          "posterUrl": "https://media.licdn.com/dms/image/v2/D4E05AQEmFCbkTAT7VQ/feedshare-thumbnail_720_1280/feedshare-thumbnail_720_1280/0/1715172365655?e=1742796000&v=beta&t=mM9yjBWF4kauQlWDQSVZ24ipiL1hUoaJHnAygeFOSLk"
        },
        "date": "2024-05-17T05:03:42.557Z"
      }
    ]
  },
  {
    "name": "LINDEMANNMetalRecycling",
    "data": [
      {
        "captions": "Customer Advisory Board \nDay 2 recap\n\nThe second and final day of LINDEMANNâ€™s Customer Advisory Board built on the momentum of an incredible first day, with deeper discussions, industry-leading insights, and an exclusive look at cutting-edge recycling technology in action. Steel industry expert Dr. Christian FrÃ¶hling from SMS took centre stage with a keynote exploring the role of electric arc furnaces, regulatory pressures, and the role recycled steel/scrap will play in the developing global demand for green steel.ğŸŒ±\n\nHis insights reinforced the industryâ€™s need for improved density and purity â€“ as well as innovation, collaboration and a strong commitment to decarbonization.\nAttendees then had the unique opportunity to tour S. Norton Groupâ€™s advanced recycling facility, featuring the worldâ€™s first LINDEMANN shredder with the revolutionary Variable Frequency Drive (VDA) technology, as well as Shredder Drive Assist (SDA). Seeing innovation in action capped off an event that was not just about discussion â€” but about real solutions and a better way forward for the industry.â™»ï¸\n\nFrom thought-provoking keynotes to hands-on experiences, LINDEMANNâ€™s Customer Advisory Board was a milestone moment for the industry. This event underscored the power of partnership in shaping a stronger, more sustainable future for metal recycling.\n\nğŸ¥ Watch the video to see the highlights from Day 2!\n\n#MetalRecycling #MetalRecyclingSolutions #RecycleForChange #RecycleResponsibly #GreenFuture #RecycleForABetterFuture #CleanerPlanet #CircularEconomy #CarbonReduction #TheCAB #Manchester #England #event #SNorton",
        "likes": "47",
        "shares": "5",
        "time": {
          "raw": "2h",
          "parsed": "03.03.2025",
          "isoString": "2025-03-03T05:03:57.319Z"
        },
        "mediaType": "video",
        "mediaContent": {
          "src": [
            {
              "src": "https://dms.licdn.com/playlist/vid/v2/D4E05AQEd68lXDek8vQ/mp4-720p-30fp-crf28/B4EZVC2mnXHUBg-/0/1740583422686?e=1742796000&v=beta&t=IgiIoJ4FBGNmVwpvel31wD0q2wAuAyu9KMBtSZ79edw",
              "type": "video/mp4",
              "data-bitrate": 1015285
            },
            {
              "src": "https://dms.licdn.com/playlist/vid/v2/D4E05AQEd68lXDek8vQ/mp4-640p-30fp-crf28/B4EZVC2mnXHUBc-/0/1740583425014?e=1742796000&v=beta&t=KFLCGdbIej0wqtzSeqUh6PvnaHKCTufzSPEqtFtu1-Y",
              "type": "video/mp4",
              "data-bitrate": 783529
            }
          ],
          "posterUrl": "https://media.licdn.com/dms/image/v2/D4E05AQEd68lXDek8vQ/videocover-low/B4EZVC2mnXHUCM-/0/1740583417229?e=1742796000&v=beta&t=y6Sa730zCDMkRCs3SP-tJUkWaCgMskuJ-4DtXKzXoIE"
        },
        "date": "2025-03-03T05:03:57.319Z"
      },
      {
        "captions": "ğŸ”§ SPARE AND WEAR PARTS: THE LINDEMANN DIFFERENCE\n\nWhen it comes to keeping your recycling operation running smoothly, every component matters. As an OEM supplier, LINDEMANN provides spare and wear parts designed to fit your machines perfectly.\n\nFor decades, weâ€™ve paired the development of our innovative recycling plants with the creation of specifically adapted parts, ensuring durability, efficiency, and reliability from the ground up.\n\nOur original LINDEMANN parts are: \n\nâœ… Developed and tested in-house\n\nâœ… Designed with performance and cost-efficiency in mind\n\nâœ… Built to maximize machine availability and minimize maintenance\n\nWith extensive experience in design and field testing, we ensure every part contributes to seamless operations, helping you achieve optimal performance while reducing downtime.\n\nğŸ”— Ready to learn more? Explore the LINDEMANN advantage today:Â https://lnkd.in/e-t6EWwv\n\n#MetalRecycling #MetalRecyclingSolutions #RecycleForChange #RecycleResponsibly #GreenFuture #RecycleForABetterFuture #CleanerPlanet #CircularEconomy #CarbonReduction #GreenFutureÂ #OEMParts #Efficiency #Innovation",
        "likes": "32",
        "shares": "10",
        "time": {
          "raw": "2h",
          "parsed": "03.03.2025",
          "isoString": "2025-03-03T05:03:57.319Z"
        },
        "mediaType": "document",
        "mediaContent": {
          "title": "Baler",
          "subtitle": "4 sayfa",
          "totalPages": 4,
          "coverPages": [
            {
              "type": "image",
              "config": {
                "src": "https://media.licdn.com/dms/image/v2/D561FAQFEKeBhP5VddA/feedshare-document-cover-images_480/B56ZTwhwkCGoBU-/0/1739202178952?e=1742796000&v=beta&t=z7WAwrgaKmVYQEpKA35D2VdB2tf7qUC9Ijb_MoHzGdw"
              }
            },
            {
              "type": "image",
              "config": {
                "src": "https://media.licdn.com/dms/image/v2/D561FAQFEKeBhP5VddA/feedshare-document-cover-images_480/B56ZTwhwkCGoBU-/1/1739202178952?e=1742796000&v=beta&t=Ny0nisolJc3QhHh88jvdWVBL3X8ZYPgBEugOXfgeDa0"
              }
            },
            {
              "type": "image",
              "config": {
                "src": "https://media.licdn.com/dms/image/v2/D561FAQFEKeBhP5VddA/feedshare-document-cover-images_480/B56ZTwhwkCGoBU-/2/1739202178952?e=1742796000&v=beta&t=8luh26LesIsVT2KV2AjOuurpBiOxgxLIHpUeazzWd-4"
              }
            }
          ]
        },
        "date": "2025-03-03T05:03:57.319Z"
      },
      {
        "captions": "It was a pleasure to have you on board ğŸ˜I was honoured to be asked by Lindemann to be keynote speaker at their Customer Advisory Board meeting in Manchester. The meeting was attended by the CEOs and owners of leading metal recycling companies from across the globe. Attendees travelled from North America, France, Belgium, Holland, Germany, Spain, Sweden, Norway, Czech Republic and Denmark. We discussed the challenges facing the metal recycling industry and the solutions to overcome those challenges. To engage and interact with the decision makers at the top of their respective companies was extremely productive. The conclusion for our industry is that the outlook is extremely positive.\nOn a personal note the icing on the cake was winning the table tennis competition where I managed to take a point off professional German table tennis player Timo Boll former World Number 1, Olympic Silver Medalist, European and World Champion. Those years away at boarding school playing endless games of table tennis eventually paid off! \nA special thankyou to Matt Norton from #SNorton for hosting the event and organising a visit to S Nortonâ€™s outstanding metal recycling operation in Trafford Park Manchester. \n#enicor\n#metalrecycling\n#Lindemann\n#positiveoutlookI was honoured to be asked by Lindemann to be keynote speaker at their Customer Advisory Board meeting in Manchester. The meeting was attended by the CEOs and owners of leading metal recycling companies from across the globe. Attendees travelled from North America, France, Belgium, Holland, Germany, Spain, Sweden, Norway, Czech Republic and Denmark. We discussed the challenges facing the metal recycling industry and the solutions to overcome those challenges. To engage and interact with the decision makers at the top of their respective companies was extremely productive. The conclusion for our industry is that the outlook is extremely positive.\nOn a personal note the icing on the cake was winning the table tennis competition where I managed to take a point off professional German table tennis player Timo Boll former World Number 1, Olympic Silver Medalist, European and World Champion. Those years away at boarding school playing endless games of table tennis eventually paid off! \nA special thankyou to Matt Norton from #SNorton for hosting the event and organising a visit to S Nortonâ€™s outstanding metal recycling operation in Trafford Park Manchester. \n#enicor\n#metalrecycling\n#Lindemann\n#positiveoutlook",
        "likes": "15",
        "time": {
          "raw": "2h1ay",
          "parsed": "13.03.2025",
          "isoString": "2025-03-13T06:51:02.571Z"
        },
        "mediaType": "image",
        "mediaContent": [
          "https://media.licdn.com/dms/image/v2/D4E22AQFxL8Ver3vBiQ/feedshare-shrink_800/B4EZTbIFgaGgAg-/0/1738843119945?e=1744848000&v=beta&t=RmKn5SB1wp3m5pF8At5H5NCvfjaHI40Ic9gWiLPsi18",
          "https://media.licdn.com/dms/image/v2/D4E22AQGM1obtaYEbaQ/feedshare-shrink_800/B4EZTbIFe6HcAg-/0/1738843120532?e=1744848000&v=beta&t=1XrCdC6LVO7_nB3GbkeGoWsFnEVTv97xWgp_NvY_lUo",
          "https://media.licdn.com/dms/image/v2/D4E22AQFqmakEvyW5_w/feedshare-shrink_800/B4EZTbIFgIGYAk-/0/1738843120198?e=1744848000&v=beta&t=tLEdEX3LZ2rvY_PCNxhON1cfa2SkEqc46aYXLliAegg",
          "https://media.licdn.com/dms/image/v2/D4E22AQFaQG_953T4cw/feedshare-shrink_800/B4EZTbIFgHGYAg-/0/1738843120775?e=1744848000&v=beta&t=WDi-8aknT7cWDJIe3ny8Cb5e26sFES2ZnQWGKBsecak",
          "https://media.licdn.com/dms/image/v2/D4E22AQEn9eZ2Gbb0rg/feedshare-shrink_800/B4EZTbIFfTHgAo-/0/1738843128584?e=1744848000&v=beta&t=ItnS3aFxlCqUGhdxHVuWeATLot17Qhrxy7irW1JBK8M"
        ],
        "date": "2025-03-13T06:51:02.571Z"
      },
      {
        "captions": "I was honoured to be asked by Lindemann to be keynote speaker at their Customer Advisory Board meeting in Manchester. The meeting was attended by the CEOs and owners of leading metal recycling companies from across the globe. Attendees travelled from North America, France, Belgium, Holland, Germany, Spain, Sweden, Norway, Czech Republic and Denmark. We discussed the challenges facing the metal recycling industry and the solutions to overcome those challenges. To engage and interact with the decision makers at the top of their respective companies was extremely productive. The conclusion for our industry is that the outlook is extremely positive.\nOn a personal note the icing on the cake was winning the table tennis competition where I managed to take a point off professional German table tennis player Timo Boll former World Number 1, Olympic Silver Medalist, European and World Champion. Those years away at boarding school playing endless games of table tennis eventually paid off! \nA special thankyou to Matt Norton from #SNorton for hosting the event and organising a visit to S Nortonâ€™s outstanding metal recycling operation in Trafford Park Manchester. \n#enicor\n#metalrecycling\n#Lindemann\n#positiveoutlookI was honoured to be asked by Lindemann to be keynote speaker at their Customer Advisory Board meeting in Manchester. The meeting was attended by the CEOs and owners of leading metal recycling companies from across the globe. Attendees travelled from North America, France, Belgium, Holland, Germany, Spain, Sweden, Norway, Czech Republic and Denmark. We discussed the challenges facing the metal recycling industry and the solutions to overcome those challenges. To engage and interact with the decision makers at the top of their respective companies was extremely productive. The conclusion for our industry is that the outlook is extremely positive.\nOn a personal note the icing on the cake was winning the table tennis competition where I managed to take a point off professional German table tennis player Timo Boll former World Number 1, Olympic Silver Medalist, European and World Champion. Those years away at boarding school playing endless games of table tennis eventually paid off! \nA special thankyou to Matt Norton from #SNorton for hosting the event and organising a visit to S Nortonâ€™s outstanding metal recycling operation in Trafford Park Manchester. \n#enicor\n#metalrecycling\n#Lindemann\n#positiveoutlook",
        "likes": "15",
        "time": {
          "raw": "1ay",
          "parsed": "13.02.2025",
          "isoString": "2025-02-13T06:51:02.575Z"
        },
        "mediaType": "image",
        "mediaContent": [
          "https://media.licdn.com/dms/image/v2/D4E22AQFxL8Ver3vBiQ/feedshare-shrink_800/B4EZTbIFgaGgAg-/0/1738843119945?e=1744848000&v=beta&t=RmKn5SB1wp3m5pF8At5H5NCvfjaHI40Ic9gWiLPsi18",
          "https://media.licdn.com/dms/image/v2/D4E22AQGM1obtaYEbaQ/feedshare-shrink_800/B4EZTbIFe6HcAg-/0/1738843120532?e=1744848000&v=beta&t=1XrCdC6LVO7_nB3GbkeGoWsFnEVTv97xWgp_NvY_lUo",
          "https://media.licdn.com/dms/image/v2/D4E22AQFqmakEvyW5_w/feedshare-shrink_800/B4EZTbIFgIGYAk-/0/1738843120198?e=1744848000&v=beta&t=tLEdEX3LZ2rvY_PCNxhON1cfa2SkEqc46aYXLliAegg",
          "https://media.licdn.com/dms/image/v2/D4E22AQFaQG_953T4cw/feedshare-shrink_800/B4EZTbIFgHGYAg-/0/1738843120775?e=1744848000&v=beta&t=WDi-8aknT7cWDJIe3ny8Cb5e26sFES2ZnQWGKBsecak",
          "https://media.licdn.com/dms/image/v2/D4E22AQEn9eZ2Gbb0rg/feedshare-shrink_800/B4EZTbIFfTHgAo-/0/1738843128584?e=1744848000&v=beta&t=ItnS3aFxlCqUGhdxHVuWeATLot17Qhrxy7irW1JBK8M"
        ],
        "date": "2025-02-13T06:51:02.575Z"
      },
      {
        "captions": "First Customer Advisory Board of Metal Recycling Industry successfully \nheld in Manchester\n\nDay 1 recap\n\nIndustry leaders, innovators, and decision-makers from across the global metal recycling sector gathered at the historic Midland Hotel in Manchester, England for LINDEMANNâ€™s inaugural Customer Advisory Board (CAB). Over two days, delegates from all over Europe â€“ and as far afield as Canada â€“ discussed the future of metal recycling, emerging trends, challenges, and how the industry can drive meaningful change.\n\nFollowing an opening address by LINDEMANN CEO Carl Gustaf GÃ¶ransson, Past President of the Bureau of International Recycling,Â Tom Bird, delivered a powerful keynote, emphasizing that while the industry is already green, it must do more to communicate its sustainability credentials. This set the stage for insightful presentations from LINDEMANNâ€™s leadership team, outlining the companyâ€™s strategic vision, advancements in technology and a commitment to supporting customers with new business models and closer after-sales partnerships. ğŸ“£ğŸ¤\n\nBut CAB wasnâ€™t just about presentations â€” it was a collaborative platform where industry voices were heard. Lively discussions and interactive sessions captured key challenges and opportunities, ensuring that customer perspectives are at the heart of future innovations. Participants even got to go toe-to-toe with the professional table tennis athletes from the LINDEMANN-sponsored Borussia DÃ¼sseldorf e.V. team in Germany!\n\nğŸ“½ï¸ Watch the video to relive the energy, insights, and collaboration from Day 1!\n\n#MetalRecycling #MetalRecyclingSolutions #RecycleForChange #RecycleResponsibly #GreenFuture #RecycleForABetterFuture #CleanerPlanet #CircularEconomy #CarbonReduction #TheCAB #Manchester #England #event",
        "likes": "52",
        "comments": "1",
        "shares": "12",
        "time": {
          "raw": "2h",
          "parsed": "26.02.2025",
          "isoString": "2025-02-26T05:02:36.283Z"
        },
        "mediaType": "video",
        "mediaContent": {
          "src": [
            {
              "src": "https://dms.licdn.com/playlist/vid/v2/D4E05AQHMVmoX6Sx0oA/mp4-640p-30fp-crf28/B4EZU3ucvsGYBc-/0/1740396768709?e=1742364000&v=beta&t=TMSMzSH-5F-8u2Fg7blGe46KwHCIXwwbkB7JUVsaOsk",
              "type": "video/mp4",
              "data-bitrate": 633721
            },
            {
              "src": "https://dms.licdn.com/playlist/vid/v2/D4E05AQHMVmoX6Sx0oA/mp4-720p-30fp-crf28/B4EZU3ucvsGYBg-/0/1740396770257?e=1742364000&v=beta&t=cCQO8lp7mYh2xZAV8bPz6nQJaGiuyULL5f2VAobkRMo",
              "type": "video/mp4",
              "data-bitrate": 829428
            }
          ],
          "posterUrl": "https://media.licdn.com/dms/image/v2/D4E05AQHMVmoX6Sx0oA/videocover-low/B4EZU3ucvsGYCM-/0/1740396759935?e=1742364000&v=beta&t=ax2xFhlXU3nTVvq0ogMJWSwfSB2ial_3PLkoFq0tjXU"
        },
        "date": "2025-02-26T05:02:36.283Z"
      },
      {
        "captions": "InDEx: Revolutionizing Metal Recycling Technology â™»ï¸\n\nThe circular economy demands high performance and rapid, predictive recycling technologies to meet its ambitious goals. Thatâ€™s where InDEx, LINDEMANNâ€™s digital operating and production data acquisition system, comes in.\n\nDeveloped to provide real-time insights into your machineâ€™s performance, InDEx empowers operators to:\n\nğŸ“ˆMonitor utilization and performance instantly\n\nğŸ” Track materials being processed\n\nğŸ“² Access critical data anytime, anywhereâ€”via mobile app or web portal\n\nIn a presentation at RWTH Aachen University, experts Wei Song, Fabian Diaz, and Bernd Friedrich recognized InDEx as a â€œstate-in-industryâ€ solution, highlighting its role in supporting the circular economy through digital transformation.\n\nInDEx gives our customers the tools they need to stay agile and efficient, making it easier than ever to optimize processes and maximize machine value. Together, weâ€™re setting new standards in metal recycling technology.\n\n#MetalRecycling #MetalRecyclingSolutions #RecycleForChange #RecycleResponsibly #GreenFuture #RecycleForABetterFuture #CleanerPlanet #CircularEconomy #CarbonReduction #InDEx #technologyÂ InDEx: Revolutionizing Metal Recycling Technology â™»ï¸\n\nThe circular economy demands high performance and rapid, predictive recycling technologies to meet its ambitious goals. Thatâ€™s where InDEx, LINDEMANNâ€™s digital operating and production data acquisition system, comes in.\n\nDeveloped to provide real-time insights into your machineâ€™s performance, InDEx empowers operators to:\n\nğŸ“ˆMonitor utilization and performance instantly\n\nğŸ” Track materials being processed\n\nğŸ“² Access critical data anytime, anywhereâ€”via mobile app or web portal\n\nIn a presentation at RWTH Aachen University, experts Wei Song, Fabian Diaz, and Bernd Friedrich recognized InDEx as a â€œstate-in-industryâ€ solution, highlighting its role in supporting the circular economy through digital transformation.\n\nInDEx gives our customers the tools they need to stay agile and efficient, making it easier than ever to optimize processes and maximize machine value. Together, weâ€™re setting new standards in metal recycling technology.\n\n#MetalRecycling #MetalRecyclingSolutions #RecycleForChange #RecycleResponsibly #GreenFuture #RecycleForABetterFuture #CleanerPlanet #CircularEconomy #CarbonReduction #InDEx #technology",
        "likes": "19",
        "shares": "4",
        "time": {
          "raw": "2h",
          "parsed": "26.02.2025",
          "isoString": "2025-02-26T05:02:36.285Z"
        },
        "mediaType": "image",
        "mediaContent": [
          "https://media.licdn.com/dms/image/v2/D5622AQHZr419aAdgDw/feedshare-shrink_800/B56ZTwhIAjGoAk-/0/1739202005888?e=1744848000&v=beta&t=iuG_GDqWeOmCn6WyuUHtyy5LUL85aKSJL2OlyiqiDh4"
        ],
        "date": "2025-02-26T05:02:36.285Z"
      },
      {
        "captions": "As 2025 begins to take shape, LINDEMANN is ready to seize the opportunities this year brings. The global focus on sustainability continues to grow, and we are proud to be part of the movement driving positive change through innovation in metal recycling.â™»ï¸\nCompanies everywhere must align with increasingly stringent regulations aimed at reducing emissions, conserving resources, and fostering sustainable practices. At LINDEMANN, we are committed to supporting our customers in meeting these standards through innovative metal recycling solutions that help reduce environmental impact while driving efficiency. ğŸ“ˆ\nThis year, we will focus on strengthening partnerships and delivering solutions that enable companies to meet their environmental obligations while making meaningful progress toward sustainability goals. ğŸ¥…\n#MetalRecycling #MetalRecyclingSolutions #RecycleForChange #RecycleResponsibly #GreenFuture #RecycleForABetterFuture #CleanerPlanet #CircularEconomy #CarbonReduction #CustainabilityGoals #customersÂ As 2025 begins to take shape, LINDEMANN is ready to seize the opportunities this year brings. The global focus on sustainability continues to grow, and we are proud to be part of the movement driving positive change through innovation in metal recycling.â™»ï¸\nCompanies everywhere must align with increasingly stringent regulations aimed at reducing emissions, conserving resources, and fostering sustainable practices. At LINDEMANN, we are committed to supporting our customers in meeting these standards through innovative metal recycling solutions that help reduce environmental impact while driving efficiency. ğŸ“ˆ\nThis year, we will focus on strengthening partnerships and delivering solutions that enable companies to meet their environmental obligations while making meaningful progress toward sustainability goals. ğŸ¥…\n#MetalRecycling #MetalRecyclingSolutions #RecycleForChange #RecycleResponsibly #GreenFuture #RecycleForABetterFuture #CleanerPlanet #CircularEconomy #CarbonReduction #CustainabilityGoals #customers",
        "likes": "28",
        "shares": "5",
        "time": {
          "raw": "2h",
          "parsed": "26.02.2025",
          "isoString": "2025-02-26T05:02:36.286Z"
        },
        "mediaType": "image",
        "mediaContent": [
          "https://media.licdn.com/dms/image/v2/D5622AQFbS_EeCVZhxA/feedshare-shrink_800/B56ZTwgvWKGUAs-/0/1739201904099?e=1744848000&v=beta&t=9rAbFEHHnBDRfKTUfZYhG8NvRu0WS3fg2xfmbj-f-J4"
        ],
        "date": "2025-02-26T05:02:36.286Z"
      },
      {
        "captions": "Did you know: Steel production currently accounts for approximately 8% of global COâ‚‚ emissions?! Let's make a change and drive the green steel cycle. In our vision of transforming the metal circular economy for a better tomorrow,  I am sharing my thoughts and reflections in this article why scrap metal is key to cutting COâ‚‚.\nAt Lindemann, our goal is to play an active role in  transformation journey",
        "likes": "23",
        "shares": "6",
        "time": {
          "raw": "2h2h",
          "parsed": "12.03.2025",
          "isoString": "2025-03-12T05:02:36.287Z"
        },
        "mediaType": "other",
        "date": "2025-03-12T05:02:36.287Z"
      },
      {
        "captions": "In our vision of transforming the metal circular economy for a better tomorrow,  I am sharing my thoughts and reflections in this article why scrap metal is key to cutting COâ‚‚.\nAt Lindemann, our goal is to play an active role in  transformation journey",
        "time": {
          "raw": "2h",
          "parsed": "26.02.2025",
          "isoString": "2025-02-26T05:02:36.288Z"
        },
        "mediaType": "other",
        "date": "2025-02-26T05:02:36.288Z"
      },
      {
        "captions": "Excellent Service for Customers SuccessğŸ˜ğŸ’ªCASE STUDY - EXCELLENT CUSTOMER-RELATIONSHIP AND CUSTOMER-SERVICE ACROSS CONTINENTS\n\nSometimes it's not the big strategies or long-term plans that make the difference - but quick, pragmatic solutions at critical moments.\n\nOne of our customers had a machine failure: A control block had unexpectedly failed after very long time of operation. Replacement? It had already been ordered before the failure, but was still in production for some time. Long story short: machine downtime and loss of production.\n\nIn this situation our service team deeply impressed me:\nInstead of waiting, they checked with another long-standing customer, who they knew had a machine of the same type and a control block in stock.\n\nThe result? We picked this one up and sent it to another customer - a temporary loan of the control block across continents!\n\nI have been working in various industries for over 15 years. But I've never experienced this kind of interaction between service and customers!\n\nWhat can we learn from this?\nâœ… Excellent service - does not just mean reacting to problems, but finding solutions where others only see obstacles.\nâœ… Good customer relations - a genuine partnership-based exchange is what makes such solutions conceivable. Trust and long-term cooperation pay off - for all sides.\n\nHave you ever experienced similarly situations? Even in other fields?CASE STUDY - EXCELLENT CUSTOMER-RELATIONSHIP AND CUSTOMER-SERVICE ACROSS CONTINENTS\n\nSometimes it's not the big strategies or long-term plans that make the difference - but quick, pragmatic solutions at critical moments.\n\nOne of our customers had a machine failure: A control block had unexpectedly failed after very long time of operation. Replacement? It had already been ordered before the failure, but was still in production for some time. Long story short: machine downtime and loss of production.\n\nIn this situation our service team deeply impressed me:\nInstead of waiting, they checked with another long-standing customer, who they knew had a machine of the same type and a control block in stock.\n\nThe result? We picked this one up and sent it to another customer - a temporary loan of the control block across continents!\n\nI have been working in various industries for over 15 years. But I've never experienced this kind of interaction between service and customers!\n\nWhat can we learn from this?\nâœ… Excellent service - does not just mean reacting to problems, but finding solutions where others only see obstacles.\nâœ… Good customer relations - a genuine partnership-based exchange is what makes such solutions conceivable. Trust and long-term cooperation pay off - for all sides.\n\nHave you ever experienced similarly situations? Even in other fields?",
        "likes": "7",
        "time": {
          "raw": "2h2h",
          "parsed": "12.03.2025",
          "isoString": "2025-03-12T05:02:36.289Z"
        },
        "mediaType": "image",
        "mediaContent": [
          "https://media.licdn.com/dms/image/v2/D4E22AQEx451gH50UvQ/feedshare-shrink_800/B4EZUahpF.G0Ag-/0/1739906781998?e=1744848000&v=beta&t=TWbzptst7R00X9WNSBqVkuM_sxdxlQEVdkz2Ft0VXic"
        ],
        "date": "2025-03-12T05:02:36.289Z"
      },
      {
        "captions": "CASE STUDY - EXCELLENT CUSTOMER-RELATIONSHIP AND CUSTOMER-SERVICE ACROSS CONTINENTS\n\nSometimes it's not the big strategies or long-term plans that make the difference - but quick, pragmatic solutions at critical moments.\n\nOne of our customers had a machine failure: A control block had unexpectedly failed after very long time of operation. Replacement? It had already been ordered before the failure, but was still in production for some time. Long story short: machine downtime and loss of production.\n\nIn this situation our service team deeply impressed me:\nInstead of waiting, they checked with another long-standing customer, who they knew had a machine of the same type and a control block in stock.\n\nThe result? We picked this one up and sent it to another customer - a temporary loan of the control block across continents!\n\nI have been working in various industries for over 15 years. But I've never experienced this kind of interaction between service and customers!\n\nWhat can we learn from this?\nâœ… Excellent service - does not just mean reacting to problems, but finding solutions where others only see obstacles.\nâœ… Good customer relations - a genuine partnership-based exchange is what makes such solutions conceivable. Trust and long-term cooperation pay off - for all sides.\n\nHave you ever experienced similarly situations? Even in other fields?CASE STUDY - EXCELLENT CUSTOMER-RELATIONSHIP AND CUSTOMER-SERVICE ACROSS CONTINENTS\n\nSometimes it's not the big strategies or long-term plans that make the difference - but quick, pragmatic solutions at critical moments.\n\nOne of our customers had a machine failure: A control block had unexpectedly failed after very long time of operation. Replacement? It had already been ordered before the failure, but was still in production for some time. Long story short: machine downtime and loss of production.\n\nIn this situation our service team deeply impressed me:\nInstead of waiting, they checked with another long-standing customer, who they knew had a machine of the same type and a control block in stock.\n\nThe result? We picked this one up and sent it to another customer - a temporary loan of the control block across continents!\n\nI have been working in various industries for over 15 years. But I've never experienced this kind of interaction between service and customers!\n\nWhat can we learn from this?\nâœ… Excellent service - does not just mean reacting to problems, but finding solutions where others only see obstacles.\nâœ… Good customer relations - a genuine partnership-based exchange is what makes such solutions conceivable. Trust and long-term cooperation pay off - for all sides.\n\nHave you ever experienced similarly situations? Even in other fields?",
        "likes": "7",
        "time": {
          "raw": "2h",
          "parsed": "26.02.2025",
          "isoString": "2025-02-26T05:02:36.290Z"
        },
        "mediaType": "image",
        "mediaContent": [
          "https://media.licdn.com/dms/image/v2/D4E22AQEx451gH50UvQ/feedshare-shrink_800/B4EZUahpF.G0Ag-/0/1739906781998?e=1744848000&v=beta&t=TWbzptst7R00X9WNSBqVkuM_sxdxlQEVdkz2Ft0VXic"
        ],
        "date": "2025-02-26T05:02:36.290Z"
      },
      {
        "captions": "â˜€ï¸ğŸ’ªğŸ˜Transforming the metal circular economy for a better tomorrow. Together, we can build a greener and more efficient world! ğŸŒâ™»ï¸ \n\nRuslan Pereira Jean L.  \n\n#CircularEconomy #Sustainability #Innovation #Chatarra #Sucata #WeAreLindemann #MetalRecycling #LindemannMetalRecycling #EconomiaCircular #ReciclagemTransforming the metal circular economy for a better tomorrow. Together, we can build a greener and more efficient world! ğŸŒâ™»ï¸ \n\nRuslan Pereira Jean L.  \n\n#CircularEconomy #Sustainability #Innovation #Chatarra #Sucata #WeAreLindemann #MetalRecycling #LindemannMetalRecycling #EconomiaCircular #Reciclagem",
        "likes": "13",
        "time": {
          "raw": "2h2h",
          "parsed": "12.03.2025",
          "isoString": "2025-03-12T05:02:36.291Z"
        },
        "mediaType": "image",
        "mediaContent": [
          "https://media.licdn.com/dms/image/v2/D4D22AQGotAzvnQBaDQ/feedshare-shrink_800/B4DZUfYSCHHkAk-/0/1739988241755?e=1744848000&v=beta&t=9qJGPQd_TFD38ulNT2eAPSWnZ2t6oOvsz4XH9YJop9Q"
        ],
        "date": "2025-03-12T05:02:36.291Z"
      },
      {
        "captions": "Transforming the metal circular economy for a better tomorrow. Together, we can build a greener and more efficient world! ğŸŒâ™»ï¸ \n\nRuslan Pereira Jean L.  \n\n#CircularEconomy #Sustainability #Innovation #Chatarra #Sucata #WeAreLindemann #MetalRecycling #LindemannMetalRecycling #EconomiaCircular #ReciclagemTransforming the metal circular economy for a better tomorrow. Together, we can build a greener and more efficient world! ğŸŒâ™»ï¸ \n\nRuslan Pereira Jean L.  \n\n#CircularEconomy #Sustainability #Innovation #Chatarra #Sucata #WeAreLindemann #MetalRecycling #LindemannMetalRecycling #EconomiaCircular #Reciclagem",
        "likes": "13",
        "time": {
          "raw": "2h",
          "parsed": "26.02.2025",
          "isoString": "2025-02-26T05:02:36.292Z"
        },
        "mediaType": "image",
        "mediaContent": [
          "https://media.licdn.com/dms/image/v2/D4D22AQGotAzvnQBaDQ/feedshare-shrink_800/B4DZUfYSCHHkAk-/0/1739988241755?e=1744848000&v=beta&t=9qJGPQd_TFD38ulNT2eAPSWnZ2t6oOvsz4XH9YJop9Q"
        ],
        "date": "2025-02-26T05:02:36.292Z"
      },
      {
        "captions": "At the 12th International Material Recycling Convention & Exposition,\nheld by MRAI, LINDEMANN  made a significant impact, joining 2,500 delegates from around the world.Â ğŸŒâœ¨Â Keegan Vas represented the company in a high-profile panel discussion on the role of technology in scrap processing. He showcased innovative solutions, including the Index and the groundbreaking thermal camera for shredders.Â ğŸ”¥ğŸ¤–\n\nThe panel, featuring experts from different branches, sparked lively debates on AI-driven sorting, sensor-based separation, and advanced processing techniques. These discussions set new standards for productivity, sustainability, and the future of the recycling industry.Â â™»ï¸ğŸš€\n\nLINDEMANN's booth at the exhibition was buzzing with activity, further reinforcing the company's commitment to pushing the boundaries of metal recycling. The future of the industry looks bright!Â ğŸ’¡\n\n#MetalRecycling #MetalRecyclingSolutions #RecycleForChange #RecycleResponsibly #GreenFuture #RecycleForABetterFuture #CircularEconomyÂ #Ecomondo #EcotecSolutions #Sustainability #Innovation#IMRC2025 #RecyclingTechnology",
        "likes": "31",
        "shares": "2",
        "time": {
          "raw": "2h",
          "parsed": "26.02.2025",
          "isoString": "2025-02-26T05:02:36.293Z"
        },
        "mediaType": "document",
        "mediaContent": {
          "title": "MRAI",
          "subtitle": "4 sayfa",
          "totalPages": 4,
          "coverPages": [
            {
              "type": "image",
              "config": {
                "src": "https://media.licdn.com/dms/image/v2/D4E1FAQHLeX5PLr-OQg/feedshare-document-cover-images_480/B4EZUdtBuwGgBM-/0/1739960105265?e=1742364000&v=beta&t=a313Xjo-cUt1z2VBuPL7X22-ZAP7nN0znJUcngkja6E"
              }
            },
            {
              "type": "image",
              "config": {
                "src": "https://media.licdn.com/dms/image/v2/D4E1FAQHLeX5PLr-OQg/feedshare-document-cover-images_480/B4EZUdtBuwGgBM-/1/1739960105265?e=1742364000&v=beta&t=68D7GCmDZLpMqhyCNX63QDAHo753xKNHhf9lwv8Dwlo"
              }
            },
            {
              "type": "image",
              "config": {
                "src": "https://media.licdn.com/dms/image/v2/D4E1FAQHLeX5PLr-OQg/feedshare-document-cover-images_480/B4EZUdtBuwGgBM-/2/1739960105265?e=1742364000&v=beta&t=xfbGtqmatBL7llzBudlhvPy4CDbRjWHE8kji-fcmvnQ"
              }
            }
          ]
        },
        "date": "2025-02-26T05:02:36.293Z"
      },
      {
        "captions": "Designed for ultimate operator comfort and precision, the LINDEMANN shredder cabin sets the standard for modern recycling equipment.\n\nâœ… Climate Control: Equipped with heating and air-conditioning, the cabin provides optimal comfort in all weather conditions.\n\nâœ… Enhanced Monitoring: An advanced graphic visualization system with Siemens TP series ensures seamless machine monitoring, so operators can stay in control.\n\nâœ… Ergonomic Excellence: The rotating control chair, with adjustable length and height, features dampers for smoother operation. Separate replacement options for seat cushions, armrests, and headrests mean longer-lasting comfort.\n\nâœ… Optimal Visibility: Angled and reinforced safety glass minimizes reflections, providing an unobstructed view of the worksite.\n\nâœ… Intuitive Controls: Joysticks and push buttons are integrated into the armrests for effortless operation, while the adjustable side-wall-mounted control panel puts everything within reach.\n\nBuilt with comfort, safety, and efficiency in mind. Stay tuned for more insights into our machine features!\n\n#MetalRecycling #MetalRecyclingSolutions #RecycleForChange #RecycleResponsibly #GreenFuture #RecycleForABetterFuture #CleanerPlanet #CircularEconomy #CarbonReduction #ShredderParts #cabinÂ Designed for ultimate operator comfort and precision, the LINDEMANN shredder cabin sets the standard for modern recycling equipment.\n\nâœ… Climate Control: Equipped with heating and air-conditioning, the cabin provides optimal comfort in all weather conditions.\n\nâœ… Enhanced Monitoring: An advanced graphic visualization system with Siemens TP series ensures seamless machine monitoring, so operators can stay in control.\n\nâœ… Ergonomic Excellence: The rotating control chair, with adjustable length and height, features dampers for smoother operation. Separate replacement options for seat cushions, armrests, and headrests mean longer-lasting comfort.\n\nâœ… Optimal Visibility: Angled and reinforced safety glass minimizes reflections, providing an unobstructed view of the worksite.\n\nâœ… Intuitive Controls: Joysticks and push buttons are integrated into the armrests for effortless operation, while the adjustable side-wall-mounted control panel puts everything within reach.\n\nBuilt with comfort, safety, and efficiency in mind. Stay tuned for more insights into our machine features!\n\n#MetalRecycling #MetalRecyclingSolutions #RecycleForChange #RecycleResponsibly #GreenFuture #RecycleForABetterFuture #CleanerPlanet #CircularEconomy #CarbonReduction #ShredderParts #cabin",
        "likes": "51",
        "comments": "1",
        "shares": "6",
        "time": {
          "raw": "2h",
          "parsed": "26.02.2025",
          "isoString": "2025-02-26T05:02:36.294Z"
        },
        "mediaType": "image",
        "mediaContent": [
          "https://media.licdn.com/dms/image/v2/D5622AQGj_lZn8_Negw/feedshare-shrink_800/B56ZTwf_p5HsAk-/0/1739201709007?e=1744848000&v=beta&t=SsU_lJBjlPcks5OjTqvbIuLPKXI7Wti4CDipRquQfz8"
        ],
        "date": "2025-02-26T05:02:36.294Z"
      },
      {
        "captions": "Location Spotlight: San Antonio, Texas! ğŸ‡ºğŸ‡¸\n\nAt LINDEMANN Metal Recycling, we take pride in being close to our customers, no matter where they are. Today, we're highlighting our North American headquarters in the vibrant city of San Antonio, Texas! ğŸ¤ \n\nThis dynamic hub is whereÂ XÂ incredible team members come together to drive innovation and provide exceptional service. Itâ€™s also home to our U.S. service center, which ensures top-notch support for our North American customers. \n\nBut what makes San Antonio so special?\n\nğŸŒµ Known as the \"Alamo City\", San Antonio boasts a rich history, with landmarks like the iconic Alamo and the San Antonio Missions, a UNESCO World Heritage Site.\n\nğŸŒ‰ The city is famous for the beautiful River Walk, a network of scenic walkways along the San Antonio River filled with restaurants, shops, and cultural experiences.\n\nğŸ‰ San Antonio is also a hub for innovation and business, making it the perfect home for LINDEMANNâ€™s commitment to advancing metal recycling technology in North America.\n\nFrom this dynamic location, we work to deliver cutting-edge recycling solutions and industry-leading support to our customers across the continent.\n\nHave you visited our San Antonio location or experienced its unique charm? Share your thoughts in the comments!\n\n#MetalRecycling #MetalRecyclingSolutions #RecycleForChange #RecycleResponsibly #GreenFuture #RecycleForABetterFuture #CleanerPlanet #CircularEconomy #CarbonReduction #SanAntonio #Spotlight #location #serviceÂ Location Spotlight: San Antonio, Texas! ğŸ‡ºğŸ‡¸\n\nAt LINDEMANN Metal Recycling, we take pride in being close to our customers, no matter where they are. Today, we're highlighting our North American headquarters in the vibrant city of San Antonio, Texas! ğŸ¤ \n\nThis dynamic hub is whereÂ XÂ incredible team members come together to drive innovation and provide exceptional service. Itâ€™s also home to our U.S. service center, which ensures top-notch support for our North American customers. \n\nBut what makes San Antonio so special?\n\nğŸŒµ Known as the \"Alamo City\", San Antonio boasts a rich history, with landmarks like the iconic Alamo and the San Antonio Missions, a UNESCO World Heritage Site.\n\nğŸŒ‰ The city is famous for the beautiful River Walk, a network of scenic walkways along the San Antonio River filled with restaurants, shops, and cultural experiences.\n\nğŸ‰ San Antonio is also a hub for innovation and business, making it the perfect home for LINDEMANNâ€™s commitment to advancing metal recycling technology in North America.\n\nFrom this dynamic location, we work to deliver cutting-edge recycling solutions and industry-leading support to our customers across the continent.\n\nHave you visited our San Antonio location or experienced its unique charm? Share your thoughts in the comments!\n\n#MetalRecycling #MetalRecyclingSolutions #RecycleForChange #RecycleResponsibly #GreenFuture #RecycleForABetterFuture #CleanerPlanet #CircularEconomy #CarbonReduction #SanAntonio #Spotlight #location #service",
        "likes": "41",
        "shares": "7",
        "time": {
          "raw": "3h",
          "parsed": "19.02.2025",
          "isoString": "2025-02-19T05:02:36.296Z"
        },
        "mediaType": "image",
        "mediaContent": [
          "https://media.licdn.com/dms/image/v2/D5622AQGyKeezGynPZg/feedshare-shrink_800/B56ZTwewfVGQAs-/0/1739201384896?e=1744848000&v=beta&t=bwLbOXZZfIEZtObk3_yMUzdAkEZbctNdGapFnU9nWNU"
        ],
        "date": "2025-02-19T05:02:36.296Z"
      },
      {
        "captions": "Keep Your Machines Running smoothly with LINDEMANN Inspections and Maintenance\n\nTime takes its toll on even the best machines. Over the years, wear and aging can lead to internal leakages and the risk of unexpected failures. Thatâ€™s where LINDEMANN's inspections and maintenance planning services come in.\n\nOur expert team helps you identify potential issues before they become costly problems, ensuring your machines stay in top shape and delivering peak performance.\n\nDonâ€™t let aging components catch you off guard. Partner with LINDEMANN for proactive care and long-term reliability.\n\nğŸ‘‰ Ready to avoid unpleasant surprises? Discover how we can support your operations:Â https://lnkd.in/eHZSfXGj\n\n#MetalRecycling #MetalRecyclingSolutions #RecycleForChange #RecycleResponsibly #GreenFuture #RecycleForABetterFuture #CleanerPlanet #CircularEconomy #CarbonReduction #GreenFuture #maintenance #reliabilityÂ Keep Your Machines Running smoothly with LINDEMANN Inspections and Maintenance\n\nTime takes its toll on even the best machines. Over the years, wear and aging can lead to internal leakages and the risk of unexpected failures. Thatâ€™s where LINDEMANN's inspections and maintenance planning services come in.\n\nOur expert team helps you identify potential issues before they become costly problems, ensuring your machines stay in top shape and delivering peak performance.\n\nDonâ€™t let aging components catch you off guard. Partner with LINDEMANN for proactive care and long-term reliability.\n\nğŸ‘‰ Ready to avoid unpleasant surprises? Discover how we can support your operations:Â https://lnkd.in/eHZSfXGj\n\n#MetalRecycling #MetalRecyclingSolutions #RecycleForChange #RecycleResponsibly #GreenFuture #RecycleForABetterFuture #CleanerPlanet #CircularEconomy #CarbonReduction #GreenFuture #maintenance #reliability",
        "likes": "39",
        "shares": "8",
        "time": {
          "raw": "3h",
          "parsed": "19.02.2025",
          "isoString": "2025-02-19T05:02:36.297Z"
        },
        "mediaType": "image",
        "mediaContent": [
          "https://media.licdn.com/dms/image/v2/D4E22AQHZQImFxJfOqg/feedshare-shrink_800/B4EZTwbNTzG0Ag-/0/1739200457091?e=1744848000&v=beta&t=6maN--msrJPaLvqZM9gPsPLFOcNVtWWGsdjg5BBQ2Ps"
        ],
        "date": "2025-02-19T05:02:36.297Z"
      },
      {
        "captions": "ğŸ”© Discover our NxtCut Midsize Scrap Shear in 360Â°! ğŸŒ\n\nEver wondered what cutting-edge innovation looks like? With our interactive 360Â° 3D view, you can explore every detail of the NxtCut Midsize Scrap Shear from the comfort of your screen.\n\nğŸ“² Take a closer look at the machine redefining efficiency in metal recycling by following this link:Â https://lnkd.in/gFxUBhbw\n\nGet a new perspective on performance. Check it out today!\n\n#MetalRecycling #MetalRecyclingSolutions #RecycleForChange #RecycleResponsibly #GreenFuture #RecycleForABetterFuture #CleanerPlanet #CircularEconomy #CarbonReduction #GreenFuture #ScrapShear #InnovationInAction #360ViewğŸ”© Discover our NxtCut Midsize Scrap Shear in 360Â°! ğŸŒ\n\nEver wondered what cutting-edge innovation looks like? With our interactive 360Â° 3D view, you can explore every detail of the NxtCut Midsize Scrap Shear from the comfort of your screen.\n\nğŸ“² Take a closer look at the machine redefining efficiency in metal recycling by following this link:Â https://lnkd.in/gFxUBhbw\n\nGet a new perspective on performance. Check it out today!\n\n#MetalRecycling #MetalRecyclingSolutions #RecycleForChange #RecycleResponsibly #GreenFuture #RecycleForABetterFuture #CleanerPlanet #CircularEconomy #CarbonReduction #GreenFuture #ScrapShear #InnovationInAction #360View",
        "likes": "52",
        "comments": "2",
        "shares": "10",
        "time": {
          "raw": "4h",
          "parsed": "12.02.2025",
          "isoString": "2025-02-12T05:02:36.298Z"
        },
        "mediaType": "image",
        "mediaContent": [
          "https://media.licdn.com/dms/image/v2/D5622AQECgkdVfaS25w/feedshare-shrink_800/B56ZTwdk64GoBo-/0/1739201076939?e=1744848000&v=beta&t=SqwXz7M5xzrTb3geSB85ETUaIuWcNUasoIVlR0hOprA"
        ],
        "date": "2025-02-12T05:02:36.298Z"
      },
      {
        "captions": "Thanks for that great opportunity: it was a pleasure to see our ZZ shredder ğŸ˜ and how your business is running. Today we were pleased to welcome a group of senior leaders from the metals recycling industry, representing companies from across Europe.Â The group have been attending a Lindemann industry event being held in Manchester and took the opportunity to visit S. Nortonâ€™s Â£20m world-class shredder installation at our Manchester site. This ambitious investment in recycling technology has increased scrap metal shredding capacity by 50% and produces higher quality ferrous and non-ferrous metals - all while delivering sustainability gains including reduced emissions to atmosphere and lower energy consumption.\n#LindemannMetalRecycling #Metals #Recycling #Sustainability #ManchesterToday we were pleased to welcome a group of senior leaders from the metals recycling industry, representing companies from across Europe.Â The group have been attending a Lindemann industry event being held in Manchester and took the opportunity to visit S. Nortonâ€™s Â£20m world-class shredder installation at our Manchester site. This ambitious investment in recycling technology has increased scrap metal shredding capacity by 50% and produces higher quality ferrous and non-ferrous metals - all while delivering sustainability gains including reduced emissions to atmosphere and lower energy consumption.\n#LindemannMetalRecycling #Metals #Recycling #Sustainability #Manchester",
        "likes": "31",
        "shares": "2",
        "time": {
          "raw": "3h3h",
          "parsed": "05.03.2025",
          "isoString": "2025-03-05T10:25:48.588Z"
        },
        "mediaType": "image",
        "mediaContent": [
          "https://media.licdn.com/dms/image/v2/D4E22AQGhQmdzvMsfkQ/feedshare-shrink_800/B4EZTWQxADHgAk-/0/1738761509024?e=1744243200&v=beta&t=xbb4hqqIX8Mp9m5XNbH6HTNJg2rchqekOGNcnVRYdTw",
          "https://media.licdn.com/dms/image/v2/D4E22AQHg8C40oPAqkw/feedshare-shrink_800/B4EZTWQxA3GYAo-/0/1738761510858?e=1744243200&v=beta&t=Jb3b-EUQ_eMSKozME7e845CaEBlWKgLXZmC6HyvV9qg",
          "https://media.licdn.com/dms/image/v2/D4E22AQEjDtUCcrQrNw/feedshare-shrink_800/B4EZTWQw_8G0Ag-/0/1738761510602?e=1744243200&v=beta&t=cWKRWimv_xQwbCj8TQg0saH4JyB1WutTL9inAvwX5Ec",
          "https://media.licdn.com/dms/image/v2/D4E22AQF8mbgoL9250w/feedshare-shrink_800/B4EZTWQxBGHUAg-/0/1738761510529?e=1744243200&v=beta&t=HvbJ2jnk0-YrCNrWlvjwMAn-2cXj4q5h527dD2v4AtM"
        ],
        "date": "2025-03-05T10:25:48.588Z"
      },
      {
        "captions": "Today we were pleased to welcome a group of senior leaders from the metals recycling industry, representing companies from across Europe.Â The group have been attending a Lindemann industry event being held in Manchester and took the opportunity to visit S. Nortonâ€™s Â£20m world-class shredder installation at our Manchester site. This ambitious investment in recycling technology has increased scrap metal shredding capacity by 50% and produces higher quality ferrous and non-ferrous metals - all while delivering sustainability gains including reduced emissions to atmosphere and lower energy consumption.\n#LindemannMetalRecycling #Metals #Recycling #Sustainability #ManchesterToday we were pleased to welcome a group of senior leaders from the metals recycling industry, representing companies from across Europe.Â The group have been attending a Lindemann industry event being held in Manchester and took the opportunity to visit S. Nortonâ€™s Â£20m world-class shredder installation at our Manchester site. This ambitious investment in recycling technology has increased scrap metal shredding capacity by 50% and produces higher quality ferrous and non-ferrous metals - all while delivering sustainability gains including reduced emissions to atmosphere and lower energy consumption.\n#LindemannMetalRecycling #Metals #Recycling #Sustainability #Manchester",
        "likes": "31",
        "shares": "2",
        "time": {
          "raw": "3h",
          "parsed": "12.02.2025",
          "isoString": "2025-02-12T10:25:48.589Z"
        },
        "mediaType": "image",
        "mediaContent": [
          "https://media.licdn.com/dms/image/v2/D4E22AQGhQmdzvMsfkQ/feedshare-shrink_800/B4EZTWQxADHgAk-/0/1738761509024?e=1744243200&v=beta&t=xbb4hqqIX8Mp9m5XNbH6HTNJg2rchqekOGNcnVRYdTw",
          "https://media.licdn.com/dms/image/v2/D4E22AQHg8C40oPAqkw/feedshare-shrink_800/B4EZTWQxA3GYAo-/0/1738761510858?e=1744243200&v=beta&t=Jb3b-EUQ_eMSKozME7e845CaEBlWKgLXZmC6HyvV9qg",
          "https://media.licdn.com/dms/image/v2/D4E22AQEjDtUCcrQrNw/feedshare-shrink_800/B4EZTWQw_8G0Ag-/0/1738761510602?e=1744243200&v=beta&t=cWKRWimv_xQwbCj8TQg0saH4JyB1WutTL9inAvwX5Ec",
          "https://media.licdn.com/dms/image/v2/D4E22AQF8mbgoL9250w/feedshare-shrink_800/B4EZTWQxBGHUAg-/0/1738761510529?e=1744243200&v=beta&t=HvbJ2jnk0-YrCNrWlvjwMAn-2cXj4q5h527dD2v4AtM"
        ],
        "date": "2025-02-12T10:25:48.589Z"
      },
      {
