[
  {
    "name": "JainHydraulics",
    "data": {
      "followerCount": "9",
      "employeeCount": "51 - 200 çalışan",
      "data": []
    }
  },
  {
    "name": "DanieliGroup",
    "data": {
      "followerCount": "2.821",
      "employeeCount": "5.001-10.000 çalışan",
      "data": [
        {
          "captions": "MRAI Expo in Jaipur, marks our first event of 2025, and we couldn’t be more excited!☀\n\n🍃 Visit our stand to explore the best #Danieli solutions to take your business to the next level in the green and circular economy sectors.\n\n \n🔍 Find us at Booth 1309 \n📅 From January 28th to 30th\n📍 Novotel Jaipur Convention Center, Jaipur, India \n \n🌐 Want to know where to find Danieli next? \nCheck out our website for updates on all future events 👉 https://lnkd.in/dh8zMFDM\n\nMaterial Recycling Association of India MRAI Expo in Jaipur, marks our first event of 2025, and we couldn’t be more excited!☀\n\n🍃 Visit our stand to explore the best #Danieli solutions to take your business to the next level in the green and circular economy sectors.\n\n \n🔍 Find us at Booth 1309 \n📅 From January 28th to 30th\n📍 Novotel Jaipur Convention Center, Jaipur, India \n \n🌐 Want to know where to find Danieli next? \nCheck out our website for updates on all future events 👉 https://lnkd.in/dh8zMFDM\n\nMaterial Recycling Association of India",
          "likes": "14",
          "shares": "6",
          "time": {
            "raw": "1ay",
            "parsed": "03.02.2025",
            "isoString": "2025-02-03T14:16:42.531Z"
          },
          "mediaType": "image",
          "mediaContent": [
            "https://media.licdn.com/dms/image/v2/D4D22AQGuftsVUXhQ2A/feedshare-shrink_800/B4DZRkpAZgHEAg-/0/1736855259103?e=1743638400&v=beta&t=TOJ6NA98Jv237ck0wf-FZoucNLNp4qtqHjYDNBPcJ68"
          ],
          "date": "2025-02-03T14:16:42.531Z"
        },
        {
          "captions": "Dun dun duuun! The DaNews #DIM Special Issue is here and looking dapper ⭐  \nDive into the Fifth Danieli Innovaction Meeting with an in-depth focus on: \n🎯 Industry-expert panels \n⚙ Dedicated #green technology sessions \n✈ Global plant tours \n🧭 A journey through #Danieli’s history and our beautiful region \n\nAnd more!\n  \nGrab your definitive digital #DaNews copy here ➡ https://lnkd.in/g4D6dyc",
          "likes": "279",
          "shares": "17",
          "time": {
            "raw": "3ay",
            "parsed": "03.12.2024",
            "isoString": "2024-12-03T14:16:42.534Z"
          },
          "mediaType": "video",
          "mediaContent": {
            "src": [
              {
                "src": "https://dms.licdn.com/playlist/vid/v2/D4E05AQECihFi870umQ/mp4-640p-30fp-crf28/mp4-640p-30fp-crf28/0/1731428429183?e=1741618800&v=beta&t=i9SPkHdtLwQCTbWxZl1Qk-AJc5EpddhNzXM0SzoNkKI",
                "type": "video/mp4",
                "data-bitrate": 455926
              },
              {
                "src": "https://dms.licdn.com/playlist/vid/v2/D4E05AQECihFi870umQ/mp4-720p-30fp-crf28/mp4-720p-30fp-crf28/0/1731428430976?e=1741618800&v=beta&t=n-vt1bGetr8qOKWo-RMkq90oy3DlrzQkH-vGotT87Lo",
                "type": "video/mp4",
                "data-bitrate": 619108
              }
            ],
            "posterUrl": "https://media.licdn.com/dms/image/v2/D4E05AQECihFi870umQ/feedshare-thumbnail_720_1280/feedshare-thumbnail_720_1280/0/1731428409767?e=1741618800&v=beta&t=0jsc1szYuaZj7czFYZWWS7qX2oiznozUMDniIHwui1Y"
          },
          "date": "2024-12-03T14:16:42.534Z"
        },
        {
          "captions": "Everything is ready for Ecomondo, and we will be there too! ☀\n🍃 Visit our stand to explore the best #Danieli solutions to take your business to the next level in the green and circular economy sectors.\nECOMONDO - ITALIAN EXHIBITION GROUP\n \n🔍 Find us at Booth A3/109-111 \n📅 From November 5th to 8th\n📍 At Rimini Expo Centre, Rimini, Italy \n \n🌐 Want to know where to find Danieli next? \nCheck out our website for updates on all future events 👉 https://lnkd.in/dh8zMFDMEverything is ready for Ecomondo, and we will be there too! ☀\n🍃 Visit our stand to explore the best #Danieli solutions to take your business to the next level in the green and circular economy sectors.\nECOMONDO - ITALIAN EXHIBITION GROUP\n \n🔍 Find us at Booth A3/109-111 \n📅 From November 5th to 8th\n📍 At Rimini Expo Centre, Rimini, Italy \n \n🌐 Want to know where to find Danieli next? \nCheck out our website for updates on all future events 👉 https://lnkd.in/dh8zMFDM",
          "likes": "17",
          "comments": "1",
          "shares": "4",
          "time": {
            "raw": "4ay",
            "parsed": "03.11.2024",
            "isoString": "2024-11-03T14:16:42.536Z"
          },
          "mediaType": "image",
          "mediaContent": [
            "https://media.licdn.com/dms/image/v2/D4D22AQH2O1Y23a-X1g/feedshare-shrink_800/feedshare-shrink_800/0/1730360484228?e=1743638400&v=beta&t=aJQHGHAzkP3GB0TKT91_kzwKXCUYljhscGRXG-WcxKA"
          ],
          "date": "2024-11-03T14:16:42.536Z"
        },
        {
          "captions": "BIR World Recycling Convention is coming, and we'll not miss the event! ☀\n♻ #Danieli is ready to make its mark with innovative solutions for the sustainable economic development: visit our stand to take your business to the next level.\n \n🔍 Find us at Booth B02 \n📅 From October 28th to 29th \n📍 At Raffles City Convention Centre, Singapore \n \n🌐 Want to know where to find Danieli next? \nCheck out our website for updates on all future events 👉 https://lnkd.in/dh8zMFDM\nBureau of International RecyclingBIR World Recycling Convention is coming, and we'll not miss the event! ☀\n♻ #Danieli is ready to make its mark with innovative solutions for the sustainable economic development: visit our stand to take your business to the next level.\n \n🔍 Find us at Booth B02 \n📅 From October 28th to 29th \n📍 At Raffles City Convention Centre, Singapore \n \n🌐 Want to know where to find Danieli next? \nCheck out our website for updates on all future events 👉 https://lnkd.in/dh8zMFDM\nBureau of International Recycling",
          "likes": "25",
          "shares": "2",
          "time": {
            "raw": "4ay",
            "parsed": "03.11.2024",
            "isoString": "2024-11-03T14:16:42.537Z"
          },
          "mediaType": "image",
          "mediaContent": [
            "https://media.licdn.com/dms/image/v2/D4D22AQHstak22oLumQ/feedshare-shrink_800/feedshare-shrink_800/0/1729860335368?e=1743638400&v=beta&t=FHQnxT4YK4I4yctyTpZCsaIwdldRz731VJPIhPGK7Gk"
          ],
          "date": "2024-11-03T14:16:42.537Z"
        },
        {
          "captions": "It's our honor to announce Danieli Group as an exhibitor at FABEX Saudi Arabia 2024 \n\nRegister Now to visit and get your free ticket at: https://lnkd.in/ds5N22zB \n\n📅Dates: 13-16 OCTOBER 2024\n📍Venue: Riyadh International Convention & Exhibition Centre (Halls 1,2,3,4,5)\n🌐Website: https://www.fabxsaudi.com/\n📧Email: riyadh@arabiangerman.com\n\n#FABEX #FABEXKSA #MACH #Metal_and_Steel #FABEX_SaudiArabia #SaudiArabia #riyadh #MetalIndustry #SteelFabrication #Machinery #Steel #Machinery #Metal #CNC #Welding #Cutting #automationIt's our honor to announce Danieli Group as an exhibitor at FABEX Saudi Arabia 2024 \n\nRegister Now to visit and get your free ticket at: https://lnkd.in/ds5N22zB \n\n📅Dates: 13-16 OCTOBER 2024\n📍Venue: Riyadh International Convention & Exhibition Centre (Halls 1,2,3,4,5)\n🌐Website: https://www.fabxsaudi.com/\n📧Email: riyadh@arabiangerman.com\n\n#FABEX #FABEXKSA #MACH #Metal_and_Steel #FABEX_SaudiArabia #SaudiArabia #riyadh #MetalIndustry #SteelFabrication #Machinery #Steel #Machinery #Metal #CNC #Welding #Cutting #automation",
          "likes": "12",
          "shares": "4",
          "time": {
            "raw": "6ay",
            "parsed": "03.09.2024",
            "isoString": "2024-09-03T14:16:42.539Z"
          },
          "mediaType": "image",
          "mediaContent": [
            "https://media.licdn.com/dms/image/v2/D4D22AQFwcCRJNjjIBw/feedshare-shrink_800/feedshare-shrink_800/0/1723727332470?e=1743638400&v=beta&t=jzXg5_J3Z8eogZr2REWEwJG4mJ3xEk9iXiHQlVJ-MNk"
          ],
          "date": "2024-09-03T14:16:42.539Z"
        },
        {
          "captions": "It's time for Scrap Expo, and we'll be there! ☀\n\n⭐ Discover the latest trends, network with industry leaders, and explore the best #Danieli solutions to take your business to the next level. \n🔍 Find us at Booth 420 \n📅 From September 17 to 18 \n📍 At Kentucky Exposition Center, Louisville, USA \n🌐 Want to know where to find Danieli next? \nCheck out our website for updates on all future events 👉 https://lnkd.in/dh8zMFDMIt's time for Scrap Expo, and we'll be there! ☀\n\n⭐ Discover the latest trends, network with industry leaders, and explore the best #Danieli solutions to take your business to the next level. \n🔍 Find us at Booth 420 \n📅 From September 17 to 18 \n📍 At Kentucky Exposition Center, Louisville, USA \n🌐 Want to know where to find Danieli next? \nCheck out our website for updates on all future events 👉 https://lnkd.in/dh8zMFDM",
          "likes": "16",
          "shares": "9",
          "time": {
            "raw": "5ay",
            "parsed": "03.10.2024",
            "isoString": "2024-10-03T14:16:42.541Z"
          },
          "mediaType": "image",
          "mediaContent": [
            "https://media.licdn.com/dms/image/v2/D4D22AQGnBxCWO-UPlw/feedshare-shrink_800/feedshare-shrink_800/0/1726568048923?e=1743638400&v=beta&t=DgmdnxYdsgUPDiB-jyY7cEOrkET7V5qeLiJeDMsPhtA"
          ],
          "date": "2024-10-03T14:16:42.541Z"
        },
        {
          "captions": "🔔 Danieli Centro Recycling will be present at IFAT Munich 2024!\n \nJoin us\n📅 From May 13 to 17\n📍 Hall B4, Booth 415 \n \n💼 Looking for global opportunities? Check out our website: https://lnkd.in/ez2Fvdt8The leading trade fair for environmental technologies is back! ♻  \n💡 IFAT worldwide starts next week and Danieli is ready to be a part of it. Are you?   \n🔍 Find us at Hall B4, Booth 415  \n📅 From May 13 to 17 \n📍 At Messe München, Germany  \n🌐 Want to know where to find Danieli next?  \nCheck out our website for updates on all future events 👉 https://lnkd.in/dh8zMFDM",
          "likes": "21",
          "shares": "3",
          "time": {
            "raw": "9ay9ay",
            "parsed": "03.03.2025",
            "isoString": "2025-03-03T14:16:42.542Z"
          },
          "mediaType": "video",
          "mediaContent": {
            "src": [
              {
                "src": "https://dms.licdn.com/playlist/vid/v2/D4E05AQEmFCbkTAT7VQ/mp4-640p-30fp-crf28/mp4-640p-30fp-crf28/0/1715172375594?e=1741618800&v=beta&t=-xo6xoOVdfnzIZDxMUv9BDm1bFC18U_VsNZWrvVE1Gc",
                "type": "video/mp4",
                "data-bitrate": 55193
              },
              {
                "src": "https://dms.licdn.com/playlist/vid/v2/D4E05AQEmFCbkTAT7VQ/mp4-720p-30fp-crf28/mp4-720p-30fp-crf28/0/1715172375508?e=1741618800&v=beta&t=N43SN2712XduOhY_JtzUN7MdbmHHHaln1DSW_KuK3m8",
                "type": "video/mp4",
                "data-bitrate": 66819
              }
            ],
            "posterUrl": "https://media.licdn.com/dms/image/v2/D4E05AQEmFCbkTAT7VQ/feedshare-thumbnail_720_1280/feedshare-thumbnail_720_1280/0/1715172365655?e=1741618800&v=beta&t=sk5ibI0njZQoKXF2t4s4McIDSpruAb3Z206hBeUTf-Q"
          },
          "date": "2025-03-03T14:16:42.542Z"
        },
        {
          "captions": "The leading trade fair for environmental technologies is back! ♻  \n💡 IFAT worldwide starts next week and Danieli is ready to be a part of it. Are you?   \n🔍 Find us at Hall B4, Booth 415  \n📅 From May 13 to 17 \n📍 At Messe München, Germany  \n🌐 Want to know where to find Danieli next?  \nCheck out our website for updates on all future events 👉 https://lnkd.in/dh8zMFDM",
          "time": {
            "raw": "9ay",
            "parsed": "03.06.2024",
            "isoString": "2024-06-03T14:16:42.542Z"
          },
          "mediaType": "video",
          "mediaContent": {
            "src": [
              {
                "src": "https://dms.licdn.com/playlist/vid/v2/D4E05AQEmFCbkTAT7VQ/mp4-640p-30fp-crf28/mp4-640p-30fp-crf28/0/1715172375594?e=1741618800&v=beta&t=-xo6xoOVdfnzIZDxMUv9BDm1bFC18U_VsNZWrvVE1Gc",
                "type": "video/mp4",
                "data-bitrate": 55193
              },
              {
                "src": "https://dms.licdn.com/playlist/vid/v2/D4E05AQEmFCbkTAT7VQ/mp4-720p-30fp-crf28/mp4-720p-30fp-crf28/0/1715172375508?e=1741618800&v=beta&t=N43SN2712XduOhY_JtzUN7MdbmHHHaln1DSW_KuK3m8",
                "type": "video/mp4",
                "data-bitrate": 66819
              }
            ],
            "posterUrl": "https://media.licdn.com/dms/image/v2/D4E05AQEmFCbkTAT7VQ/feedshare-thumbnail_720_1280/feedshare-thumbnail_720_1280/0/1715172365655?e=1741618800&v=beta&t=sk5ibI0njZQoKXF2t4s4McIDSpruAb3Z206hBeUTf-Q"
          },
          "date": "2024-06-03T14:16:42.542Z"
        }
      ]
    }
  },
  {
    "name": "LINDEMANNMetalRecycling",
    "data": {
      "followerCount": "3.219",
      "employeeCount": "201 - 500 çalışan",
      "data": [
        {
          "captions": "Customer Advisory Board \nDay 2 recap\n\nThe second and final day of LINDEMANN’s Customer Advisory Board built on the momentum of an incredible first day, with deeper discussions, industry-leading insights, and an exclusive look at cutting-edge recycling technology in action. Steel industry expert Dr. Christian Fröhling from SMS took centre stage with a keynote exploring the role of electric arc furnaces, regulatory pressures, and the role recycled steel/scrap will play in the developing global demand for green steel.🌱\n\nHis insights reinforced the industry’s need for improved density and purity – as well as innovation, collaboration and a strong commitment to decarbonization.\nAttendees then had the unique opportunity to tour S. Norton Group’s advanced recycling facility, featuring the world’s first LINDEMANN shredder with the revolutionary Variable Frequency Drive (VDA) technology, as well as Shredder Drive Assist (SDA). Seeing innovation in action capped off an event that was not just about discussion — but about real solutions and a better way forward for the industry.♻️\n\nFrom thought-provoking keynotes to hands-on experiences, LINDEMANN’s Customer Advisory Board was a milestone moment for the industry. This event underscored the power of partnership in shaping a stronger, more sustainable future for metal recycling.\n\n🎥 Watch the video to see the highlights from Day 2!\n\n#MetalRecycling #MetalRecyclingSolutions #RecycleForChange #RecycleResponsibly #GreenFuture #RecycleForABetterFuture #CleanerPlanet #CircularEconomy #CarbonReduction #TheCAB #Manchester #England #event #SNorton",
          "likes": "41",
          "shares": "4",
          "time": {
            "raw": "3g",
            "parsed": "28.02.2025",
            "isoString": "2025-02-28T14:17:11.176Z"
          },
          "mediaType": "video",
          "mediaContent": {
            "src": [
              {
                "src": "https://dms.licdn.com/playlist/vid/v2/D4E05AQEd68lXDek8vQ/mp4-720p-30fp-crf28/B4EZVC2mnXHUBg-/0/1740583422686?e=1741618800&v=beta&t=zViKeMw-Dg_TPMcHkvt50kPiIiNMuIqSsNFUtLMvA_I",
                "type": "video/mp4",
                "data-bitrate": 1015285
              },
              {
                "src": "https://dms.licdn.com/playlist/vid/v2/D4E05AQEd68lXDek8vQ/mp4-640p-30fp-crf28/B4EZVC2mnXHUBc-/0/1740583425014?e=1741618800&v=beta&t=XkL2YBg9QrDM8kCwnP4mHvx2dx8zTLQNcyTEfPGqg1Y",
                "type": "video/mp4",
                "data-bitrate": 783529
              }
            ],
            "posterUrl": "https://media.licdn.com/dms/image/v2/D4E05AQEd68lXDek8vQ/videocover-low/B4EZVC2mnXHUCM-/0/1740583417229?e=1741618800&v=beta&t=ZzqLkEFQarBEkjKDx2Ik1AGC4knXENd81sLeQuHc-aU"
          },
          "date": "2025-02-28T14:17:11.176Z"
        },
        {
          "captions": "🔧 SPARE AND WEAR PARTS: THE LINDEMANN DIFFERENCE\n\nWhen it comes to keeping your recycling operation running smoothly, every component matters. As an OEM supplier, LINDEMANN provides spare and wear parts designed to fit your machines perfectly.\n\nFor decades, we’ve paired the development of our innovative recycling plants with the creation of specifically adapted parts, ensuring durability, efficiency, and reliability from the ground up.\n\nOur original LINDEMANN parts are: \n\n✅ Developed and tested in-house\n\n✅ Designed with performance and cost-efficiency in mind\n\n✅ Built to maximize machine availability and minimize maintenance\n\nWith extensive experience in design and field testing, we ensure every part contributes to seamless operations, helping you achieve optimal performance while reducing downtime.\n\n🔗 Ready to learn more? Explore the LINDEMANN advantage today: https://lnkd.in/e-t6EWwv\n\n#MetalRecycling #MetalRecyclingSolutions #RecycleForChange #RecycleResponsibly #GreenFuture #RecycleForABetterFuture #CleanerPlanet #CircularEconomy #CarbonReduction #GreenFuture #OEMParts #Efficiency #Innovation",
          "likes": "21",
          "shares": "8",
          "time": {
            "raw": "5g",
            "parsed": "26.02.2025",
            "isoString": "2025-02-26T14:17:11.184Z"
          },
          "mediaType": "document",
          "mediaContent": {
            "title": "Baler",
            "subtitle": "4 sayfa",
            "totalPages": 4,
            "coverPages": [
              {
                "type": "image",
                "config": {
                  "src": "https://media.licdn.com/dms/image/v2/D561FAQFEKeBhP5VddA/feedshare-document-cover-images_480/B56ZTwhwkCGoBU-/0/1739202178952?e=1741618800&v=beta&t=xhmJNjsB4LgEP9QLZnkWkwRIp3mPkcRf6b7GTG7ekRM"
                }
              },
              {
                "type": "image",
                "config": {
                  "src": "https://media.licdn.com/dms/image/v2/D561FAQFEKeBhP5VddA/feedshare-document-cover-images_480/B56ZTwhwkCGoBU-/1/1739202178952?e=1741618800&v=beta&t=FwvvFwaRtoi4vDaM1E-fJewMllMY__6I7T5Vh5rSyOI"
                }
              },
              {
                "type": "image",
                "config": {
                  "src": "https://media.licdn.com/dms/image/v2/D561FAQFEKeBhP5VddA/feedshare-document-cover-images_480/B56ZTwhwkCGoBU-/2/1739202178952?e=1741618800&v=beta&t=DaZRFSBAveXsWDmdtzxZR2U03YHYbV-orKsbmqRJ3qI"
                }
              }
            ]
          },
          "date": "2025-02-26T14:17:11.184Z"
        },
        {
          "captions": "It was a pleasure to have you on board 😎I was honoured to be asked by Lindemann to be keynote speaker at their Customer Advisory Board meeting in Manchester. The meeting was attended by the CEOs and owners of leading metal recycling companies from across the globe. Attendees travelled from North America, France, Belgium, Holland, Germany, Spain, Sweden, Norway, Czech Republic and Denmark. We discussed the challenges facing the metal recycling industry and the solutions to overcome those challenges. To engage and interact with the decision makers at the top of their respective companies was extremely productive. The conclusion for our industry is that the outlook is extremely positive.\nOn a personal note the icing on the cake was winning the table tennis competition where I managed to take a point off professional German table tennis player Timo Boll former World Number 1, Olympic Silver Medalist, European and World Champion. Those years away at boarding school playing endless games of table tennis eventually paid off! \nA special thankyou to Matt Norton from #SNorton for hosting the event and organising a visit to S Norton’s outstanding metal recycling operation in Trafford Park Manchester. \n#enicor\n#metalrecycling\n#Lindemann\n#positiveoutlookI was honoured to be asked by Lindemann to be keynote speaker at their Customer Advisory Board meeting in Manchester. The meeting was attended by the CEOs and owners of leading metal recycling companies from across the globe. Attendees travelled from North America, France, Belgium, Holland, Germany, Spain, Sweden, Norway, Czech Republic and Denmark. We discussed the challenges facing the metal recycling industry and the solutions to overcome those challenges. To engage and interact with the decision makers at the top of their respective companies was extremely productive. The conclusion for our industry is that the outlook is extremely positive.\nOn a personal note the icing on the cake was winning the table tennis competition where I managed to take a point off professional German table tennis player Timo Boll former World Number 1, Olympic Silver Medalist, European and World Champion. Those years away at boarding school playing endless games of table tennis eventually paid off! \nA special thankyou to Matt Norton from #SNorton for hosting the event and organising a visit to S Norton’s outstanding metal recycling operation in Trafford Park Manchester. \n#enicor\n#metalrecycling\n#Lindemann\n#positiveoutlook",
          "likes": "13",
          "time": {
            "raw": "6g3h",
            "parsed": "03.03.2025",
            "isoString": "2025-03-03T14:17:11.186Z"
          },
          "mediaType": "image",
          "mediaContent": [
            "https://media.licdn.com/dms/image/v2/D4E22AQFxL8Ver3vBiQ/feedshare-shrink_800/B4EZTbIFgaGgAg-/0/1738843119945?e=1743638400&v=beta&t=nwhgqRlX-gCQCwIiEHA7BN4MIf-St-6BjZ1c2JeqkwA",
            "https://media.licdn.com/dms/image/v2/D4E22AQGM1obtaYEbaQ/feedshare-shrink_800/B4EZTbIFe6HcAg-/0/1738843120532?e=1743638400&v=beta&t=mph5DPe8E5jhGCR_wVRbxkKtP0qn2msM5OFoIjYqiV4",
            "https://media.licdn.com/dms/image/v2/D4E22AQFqmakEvyW5_w/feedshare-shrink_800/B4EZTbIFgIGYAk-/0/1738843120198?e=1743638400&v=beta&t=eZU2oTN6vm2aGSjoiDZNncseZ0y277iewaA3oBAXeLE",
            "https://media.licdn.com/dms/image/v2/D4E22AQFaQG_953T4cw/feedshare-shrink_800/B4EZTbIFgHGYAg-/0/1738843120775?e=1743638400&v=beta&t=_eiQbtHnaPTkQ4Psb-vnVS0dLrBRRrir6VuwTIBsKh0",
            "https://media.licdn.com/dms/image/v2/D4E22AQEn9eZ2Gbb0rg/feedshare-shrink_800/B4EZTbIFfTHgAo-/0/1738843128584?e=1743638400&v=beta&t=4gPkNNq_TSALXbUrUkstVAJiNAMCmbk-Pbq6ap9qP8E"
          ],
          "date": "2025-03-03T14:17:11.186Z"
        },
        {
          "captions": "I was honoured to be asked by Lindemann to be keynote speaker at their Customer Advisory Board meeting in Manchester. The meeting was attended by the CEOs and owners of leading metal recycling companies from across the globe. Attendees travelled from North America, France, Belgium, Holland, Germany, Spain, Sweden, Norway, Czech Republic and Denmark. We discussed the challenges facing the metal recycling industry and the solutions to overcome those challenges. To engage and interact with the decision makers at the top of their respective companies was extremely productive. The conclusion for our industry is that the outlook is extremely positive.\nOn a personal note the icing on the cake was winning the table tennis competition where I managed to take a point off professional German table tennis player Timo Boll former World Number 1, Olympic Silver Medalist, European and World Champion. Those years away at boarding school playing endless games of table tennis eventually paid off! \nA special thankyou to Matt Norton from #SNorton for hosting the event and organising a visit to S Norton’s outstanding metal recycling operation in Trafford Park Manchester. \n#enicor\n#metalrecycling\n#Lindemann\n#positiveoutlookI was honoured to be asked by Lindemann to be keynote speaker at their Customer Advisory Board meeting in Manchester. The meeting was attended by the CEOs and owners of leading metal recycling companies from across the globe. Attendees travelled from North America, France, Belgium, Holland, Germany, Spain, Sweden, Norway, Czech Republic and Denmark. We discussed the challenges facing the metal recycling industry and the solutions to overcome those challenges. To engage and interact with the decision makers at the top of their respective companies was extremely productive. The conclusion for our industry is that the outlook is extremely positive.\nOn a personal note the icing on the cake was winning the table tennis competition where I managed to take a point off professional German table tennis player Timo Boll former World Number 1, Olympic Silver Medalist, European and World Champion. Those years away at boarding school playing endless games of table tennis eventually paid off! \nA special thankyou to Matt Norton from #SNorton for hosting the event and organising a visit to S Norton’s outstanding metal recycling operation in Trafford Park Manchester. \n#enicor\n#metalrecycling\n#Lindemann\n#positiveoutlook",
          "likes": "13",
          "time": {
            "raw": "3h",
            "parsed": "10.02.2025",
            "isoString": "2025-02-10T14:17:11.188Z"
          },
          "mediaType": "image",
          "mediaContent": [
            "https://media.licdn.com/dms/image/v2/D4E22AQFxL8Ver3vBiQ/feedshare-shrink_800/B4EZTbIFgaGgAg-/0/1738843119945?e=1743638400&v=beta&t=nwhgqRlX-gCQCwIiEHA7BN4MIf-St-6BjZ1c2JeqkwA",
            "https://media.licdn.com/dms/image/v2/D4E22AQGM1obtaYEbaQ/feedshare-shrink_800/B4EZTbIFe6HcAg-/0/1738843120532?e=1743638400&v=beta&t=mph5DPe8E5jhGCR_wVRbxkKtP0qn2msM5OFoIjYqiV4",
            "https://media.licdn.com/dms/image/v2/D4E22AQFqmakEvyW5_w/feedshare-shrink_800/B4EZTbIFgIGYAk-/0/1738843120198?e=1743638400&v=beta&t=eZU2oTN6vm2aGSjoiDZNncseZ0y277iewaA3oBAXeLE",
            "https://media.licdn.com/dms/image/v2/D4E22AQFaQG_953T4cw/feedshare-shrink_800/B4EZTbIFgHGYAg-/0/1738843120775?e=1743638400&v=beta&t=_eiQbtHnaPTkQ4Psb-vnVS0dLrBRRrir6VuwTIBsKh0",
            "https://media.licdn.com/dms/image/v2/D4E22AQEn9eZ2Gbb0rg/feedshare-shrink_800/B4EZTbIFfTHgAo-/0/1738843128584?e=1743638400&v=beta&t=4gPkNNq_TSALXbUrUkstVAJiNAMCmbk-Pbq6ap9qP8E"
          ],
          "date": "2025-02-10T14:17:11.188Z"
        },
        {
          "captions": "First Customer Advisory Board of Metal Recycling Industry successfully \nheld in Manchester\n\nDay 1 recap\n\nIndustry leaders, innovators, and decision-makers from across the global metal recycling sector gathered at the historic Midland Hotel in Manchester, England for LINDEMANN’s inaugural Customer Advisory Board (CAB). Over two days, delegates from all over Europe – and as far afield as Canada – discussed the future of metal recycling, emerging trends, challenges, and how the industry can drive meaningful change.\n\nFollowing an opening address by LINDEMANN CEO Carl Gustaf Göransson, Past President of the Bureau of International Recycling, Tom Bird, delivered a powerful keynote, emphasizing that while the industry is already green, it must do more to communicate its sustainability credentials. This set the stage for insightful presentations from LINDEMANN’s leadership team, outlining the company’s strategic vision, advancements in technology and a commitment to supporting customers with new business models and closer after-sales partnerships. 📣🤝\n\nBut CAB wasn’t just about presentations — it was a collaborative platform where industry voices were heard. Lively discussions and interactive sessions captured key challenges and opportunities, ensuring that customer perspectives are at the heart of future innovations. Participants even got to go toe-to-toe with the professional table tennis athletes from the LINDEMANN-sponsored Borussia Düsseldorf e.V. team in Germany!\n\n📽️ Watch the video to relive the energy, insights, and collaboration from Day 1!\n\n#MetalRecycling #MetalRecyclingSolutions #RecycleForChange #RecycleResponsibly #GreenFuture #RecycleForABetterFuture #CleanerPlanet #CircularEconomy #CarbonReduction #TheCAB #Manchester #England #event",
          "likes": "50",
          "comments": "1",
          "shares": "12",
          "time": {
            "raw": "1h",
            "parsed": "24.02.2025",
            "isoString": "2025-02-24T14:17:11.189Z"
          },
          "mediaType": "video",
          "mediaContent": {
            "src": [
              {
                "src": "https://dms.licdn.com/playlist/vid/v2/D4E05AQHMVmoX6Sx0oA/mp4-640p-30fp-crf28/B4EZU3ucvsGYBc-/0/1740396768709?e=1741618800&v=beta&t=2GJYqLUvZRtZx0ym_z9aR0EwwNl-MuoBNJgT18yOjnA",
                "type": "video/mp4",
                "data-bitrate": 633721
              },
              {
                "src": "https://dms.licdn.com/playlist/vid/v2/D4E05AQHMVmoX6Sx0oA/mp4-720p-30fp-crf28/B4EZU3ucvsGYBg-/0/1740396770257?e=1741618800&v=beta&t=V1skI80tuPL9UEfwxUJKmwXA55g2lakOoNSbxGFO3Ck",
                "type": "video/mp4",
                "data-bitrate": 829428
              }
            ],
            "posterUrl": "https://media.licdn.com/dms/image/v2/D4E05AQHMVmoX6Sx0oA/videocover-low/B4EZU3ucvsGYCM-/0/1740396759935?e=1741618800&v=beta&t=nN3DuSotlDatmhACVV6nIRTbwXGxlLAXDttwpq5PgSE"
          },
          "date": "2025-02-24T14:17:11.189Z"
        },
        {
          "captions": "InDEx: Revolutionizing Metal Recycling Technology ♻️\n\nThe circular economy demands high performance and rapid, predictive recycling technologies to meet its ambitious goals. That’s where InDEx, LINDEMANN’s digital operating and production data acquisition system, comes in.\n\nDeveloped to provide real-time insights into your machine’s performance, InDEx empowers operators to:\n\n📈Monitor utilization and performance instantly\n\n🔍 Track materials being processed\n\n📲 Access critical data anytime, anywhere—via mobile app or web portal\n\nIn a presentation at RWTH Aachen University, experts Wei Song, Fabian Diaz, and Bernd Friedrich recognized InDEx as a “state-in-industry” solution, highlighting its role in supporting the circular economy through digital transformation.\n\nInDEx gives our customers the tools they need to stay agile and efficient, making it easier than ever to optimize processes and maximize machine value. Together, we’re setting new standards in metal recycling technology.\n\n#MetalRecycling #MetalRecyclingSolutions #RecycleForChange #RecycleResponsibly #GreenFuture #RecycleForABetterFuture #CleanerPlanet #CircularEconomy #CarbonReduction #InDEx #technology InDEx: Revolutionizing Metal Recycling Technology ♻️\n\nThe circular economy demands high performance and rapid, predictive recycling technologies to meet its ambitious goals. That’s where InDEx, LINDEMANN’s digital operating and production data acquisition system, comes in.\n\nDeveloped to provide real-time insights into your machine’s performance, InDEx empowers operators to:\n\n📈Monitor utilization and performance instantly\n\n🔍 Track materials being processed\n\n📲 Access critical data anytime, anywhere—via mobile app or web portal\n\nIn a presentation at RWTH Aachen University, experts Wei Song, Fabian Diaz, and Bernd Friedrich recognized InDEx as a “state-in-industry” solution, highlighting its role in supporting the circular economy through digital transformation.\n\nInDEx gives our customers the tools they need to stay agile and efficient, making it easier than ever to optimize processes and maximize machine value. Together, we’re setting new standards in metal recycling technology.\n\n#MetalRecycling #MetalRecyclingSolutions #RecycleForChange #RecycleResponsibly #GreenFuture #RecycleForABetterFuture #CleanerPlanet #CircularEconomy #CarbonReduction #InDEx #technology",
          "likes": "17",
          "shares": "3",
          "time": {
            "raw": "1h",
            "parsed": "24.02.2025",
            "isoString": "2025-02-24T14:17:11.190Z"
          },
          "mediaType": "image",
          "mediaContent": [
            "https://media.licdn.com/dms/image/v2/D5622AQHZr419aAdgDw/feedshare-shrink_800/B56ZTwhIAjGoAk-/0/1739202005888?e=1743638400&v=beta&t=e1D2BSLzDTeuTkAvhWc0kewpGLnvSttnqDxFqVHbCBU"
          ],
          "date": "2025-02-24T14:17:11.190Z"
        },
        {
          "captions": "As 2025 begins to take shape, LINDEMANN is ready to seize the opportunities this year brings. The global focus on sustainability continues to grow, and we are proud to be part of the movement driving positive change through innovation in metal recycling.♻️\nCompanies everywhere must align with increasingly stringent regulations aimed at reducing emissions, conserving resources, and fostering sustainable practices. At LINDEMANN, we are committed to supporting our customers in meeting these standards through innovative metal recycling solutions that help reduce environmental impact while driving efficiency. 📈\nThis year, we will focus on strengthening partnerships and delivering solutions that enable companies to meet their environmental obligations while making meaningful progress toward sustainability goals. 🥅\n#MetalRecycling #MetalRecyclingSolutions #RecycleForChange #RecycleResponsibly #GreenFuture #RecycleForABetterFuture #CleanerPlanet #CircularEconomy #CarbonReduction #CustainabilityGoals #customers As 2025 begins to take shape, LINDEMANN is ready to seize the opportunities this year brings. The global focus on sustainability continues to grow, and we are proud to be part of the movement driving positive change through innovation in metal recycling.♻️\nCompanies everywhere must align with increasingly stringent regulations aimed at reducing emissions, conserving resources, and fostering sustainable practices. At LINDEMANN, we are committed to supporting our customers in meeting these standards through innovative metal recycling solutions that help reduce environmental impact while driving efficiency. 📈\nThis year, we will focus on strengthening partnerships and delivering solutions that enable companies to meet their environmental obligations while making meaningful progress toward sustainability goals. 🥅\n#MetalRecycling #MetalRecyclingSolutions #RecycleForChange #RecycleResponsibly #GreenFuture #RecycleForABetterFuture #CleanerPlanet #CircularEconomy #CarbonReduction #CustainabilityGoals #customers",
          "likes": "28",
          "shares": "4",
          "time": {
            "raw": "1h",
            "parsed": "24.02.2025",
            "isoString": "2025-02-24T14:17:11.192Z"
          },
          "mediaType": "image",
          "mediaContent": [
            "https://media.licdn.com/dms/image/v2/D5622AQFbS_EeCVZhxA/feedshare-shrink_800/B56ZTwgvWKGUAs-/0/1739201904099?e=1743638400&v=beta&t=UXuH3FvNoyF0UwitXozSfRpd3M5H0YwFXZK6dTE0T-o"
          ],
          "date": "2025-02-24T14:17:11.192Z"
        },
        {
          "captions": "Did you know: Steel production currently accounts for approximately 8% of global CO₂ emissions?! Let's make a change and drive the green steel cycle. In our vision of transforming the metal circular economy for a better tomorrow,  I am sharing my thoughts and reflections in this article why scrap metal is key to cutting CO₂.\nAt Lindemann, our goal is to play an active role in  transformation journey",
          "likes": "21",
          "shares": "5",
          "time": {
            "raw": "1h1h",
            "parsed": "03.03.2025",
            "isoString": "2025-03-03T14:17:11.193Z"
          },
          "mediaType": "other",
          "date": "2025-03-03T14:17:11.193Z"
        },
        {
          "captions": "In our vision of transforming the metal circular economy for a better tomorrow,  I am sharing my thoughts and reflections in this article why scrap metal is key to cutting CO₂.\nAt Lindemann, our goal is to play an active role in  transformation journey",
          "time": {
            "raw": "1h",
            "parsed": "24.02.2025",
            "isoString": "2025-02-24T14:17:11.194Z"
          },
          "mediaType": "other",
          "date": "2025-02-24T14:17:11.194Z"
        },
        {
          "captions": "Excellent Service for Customers Success😎💪CASE STUDY - EXCELLENT CUSTOMER-RELATIONSHIP AND CUSTOMER-SERVICE ACROSS CONTINENTS\n\nSometimes it's not the big strategies or long-term plans that make the difference - but quick, pragmatic solutions at critical moments.\n\nOne of our customers had a machine failure: A control block had unexpectedly failed after very long time of operation. Replacement? It had already been ordered before the failure, but was still in production for some time. Long story short: machine downtime and loss of production.\n\nIn this situation our service team deeply impressed me:\nInstead of waiting, they checked with another long-standing customer, who they knew had a machine of the same type and a control block in stock.\n\nThe result? We picked this one up and sent it to another customer - a temporary loan of the control block across continents!\n\nI have been working in various industries for over 15 years. But I've never experienced this kind of interaction between service and customers!\n\nWhat can we learn from this?\n✅ Excellent service - does not just mean reacting to problems, but finding solutions where others only see obstacles.\n✅ Good customer relations - a genuine partnership-based exchange is what makes such solutions conceivable. Trust and long-term cooperation pay off - for all sides.\n\nHave you ever experienced similarly situations? Even in other fields?CASE STUDY - EXCELLENT CUSTOMER-RELATIONSHIP AND CUSTOMER-SERVICE ACROSS CONTINENTS\n\nSometimes it's not the big strategies or long-term plans that make the difference - but quick, pragmatic solutions at critical moments.\n\nOne of our customers had a machine failure: A control block had unexpectedly failed after very long time of operation. Replacement? It had already been ordered before the failure, but was still in production for some time. Long story short: machine downtime and loss of production.\n\nIn this situation our service team deeply impressed me:\nInstead of waiting, they checked with another long-standing customer, who they knew had a machine of the same type and a control block in stock.\n\nThe result? We picked this one up and sent it to another customer - a temporary loan of the control block across continents!\n\nI have been working in various industries for over 15 years. But I've never experienced this kind of interaction between service and customers!\n\nWhat can we learn from this?\n✅ Excellent service - does not just mean reacting to problems, but finding solutions where others only see obstacles.\n✅ Good customer relations - a genuine partnership-based exchange is what makes such solutions conceivable. Trust and long-term cooperation pay off - for all sides.\n\nHave you ever experienced similarly situations? Even in other fields?",
          "likes": "5",
          "time": {
            "raw": "1h1h",
            "parsed": "03.03.2025",
            "isoString": "2025-03-03T14:17:11.195Z"
          },
          "mediaType": "image",
          "mediaContent": [
            "https://media.licdn.com/dms/image/v2/D4E22AQEx451gH50UvQ/feedshare-shrink_800/B4EZUahpF.G0Ag-/0/1739906781998?e=1743638400&v=beta&t=f5DJanvQClaCKR1YfALsgFwmp6crXxrhz3n3w_jtkEk"
          ],
          "date": "2025-03-03T14:17:11.195Z"
        },
        {
          "captions": "CASE STUDY - EXCELLENT CUSTOMER-RELATIONSHIP AND CUSTOMER-SERVICE ACROSS CONTINENTS\n\nSometimes it's not the big strategies or long-term plans that make the difference - but quick, pragmatic solutions at critical moments.\n\nOne of our customers had a machine failure: A control block had unexpectedly failed after very long time of operation. Replacement? It had already been ordered before the failure, but was still in production for some time. Long story short: machine downtime and loss of production.\n\nIn this situation our service team deeply impressed me:\nInstead of waiting, they checked with another long-standing customer, who they knew had a machine of the same type and a control block in stock.\n\nThe result? We picked this one up and sent it to another customer - a temporary loan of the control block across continents!\n\nI have been working in various industries for over 15 years. But I've never experienced this kind of interaction between service and customers!\n\nWhat can we learn from this?\n✅ Excellent service - does not just mean reacting to problems, but finding solutions where others only see obstacles.\n✅ Good customer relations - a genuine partnership-based exchange is what makes such solutions conceivable. Trust and long-term cooperation pay off - for all sides.\n\nHave you ever experienced similarly situations? Even in other fields?CASE STUDY - EXCELLENT CUSTOMER-RELATIONSHIP AND CUSTOMER-SERVICE ACROSS CONTINENTS\n\nSometimes it's not the big strategies or long-term plans that make the difference - but quick, pragmatic solutions at critical moments.\n\nOne of our customers had a machine failure: A control block had unexpectedly failed after very long time of operation. Replacement? It had already been ordered before the failure, but was still in production for some time. Long story short: machine downtime and loss of production.\n\nIn this situation our service team deeply impressed me:\nInstead of waiting, they checked with another long-standing customer, who they knew had a machine of the same type and a control block in stock.\n\nThe result? We picked this one up and sent it to another customer - a temporary loan of the control block across continents!\n\nI have been working in various industries for over 15 years. But I've never experienced this kind of interaction between service and customers!\n\nWhat can we learn from this?\n✅ Excellent service - does not just mean reacting to problems, but finding solutions where others only see obstacles.\n✅ Good customer relations - a genuine partnership-based exchange is what makes such solutions conceivable. Trust and long-term cooperation pay off - for all sides.\n\nHave you ever experienced similarly situations? Even in other fields?",
          "likes": "5",
          "time": {
            "raw": "1h",
            "parsed": "24.02.2025",
            "isoString": "2025-02-24T14:17:11.197Z"
          },
          "mediaType": "image",
          "mediaContent": [
            "https://media.licdn.com/dms/image/v2/D4E22AQEx451gH50UvQ/feedshare-shrink_800/B4EZUahpF.G0Ag-/0/1739906781998?e=1743638400&v=beta&t=f5DJanvQClaCKR1YfALsgFwmp6crXxrhz3n3w_jtkEk"
          ],
          "date": "2025-02-24T14:17:11.197Z"
        },
        {
          "captions": "☀️💪😎Transforming the metal circular economy for a better tomorrow. Together, we can build a greener and more efficient world! 🌍♻️ \n\nRuslan Pereira Jean L.  \n\n#CircularEconomy #Sustainability #Innovation #Chatarra #Sucata #WeAreLindemann #MetalRecycling #LindemannMetalRecycling #EconomiaCircular #ReciclagemTransforming the metal circular economy for a better tomorrow. Together, we can build a greener and more efficient world! 🌍♻️ \n\nRuslan Pereira Jean L.  \n\n#CircularEconomy #Sustainability #Innovation #Chatarra #Sucata #WeAreLindemann #MetalRecycling #LindemannMetalRecycling #EconomiaCircular #Reciclagem",
          "likes": "10",
          "time": {
            "raw": "1h1h",
            "parsed": "03.03.2025",
            "isoString": "2025-03-03T14:17:11.198Z"
          },
          "mediaType": "image",
          "mediaContent": [
            "https://media.licdn.com/dms/image/v2/D4D22AQGotAzvnQBaDQ/feedshare-shrink_800/B4DZUfYSCHHkAk-/0/1739988241755?e=1743638400&v=beta&t=_U77VynZEGYzDMafUgLQ3qdV6lg19jEcvzjimx7NuOo"
          ],
          "date": "2025-03-03T14:17:11.198Z"
        },
        {
          "captions": "Transforming the metal circular economy for a better tomorrow. Together, we can build a greener and more efficient world! 🌍♻️ \n\nRuslan Pereira Jean L.  \n\n#CircularEconomy #Sustainability #Innovation #Chatarra #Sucata #WeAreLindemann #MetalRecycling #LindemannMetalRecycling #EconomiaCircular #ReciclagemTransforming the metal circular economy for a better tomorrow. Together, we can build a greener and more efficient world! 🌍♻️ \n\nRuslan Pereira Jean L.  \n\n#CircularEconomy #Sustainability #Innovation #Chatarra #Sucata #WeAreLindemann #MetalRecycling #LindemannMetalRecycling #EconomiaCircular #Reciclagem",
          "likes": "10",
          "time": {
            "raw": "1h",
            "parsed": "24.02.2025",
            "isoString": "2025-02-24T14:17:11.199Z"
          },
          "mediaType": "image",
          "mediaContent": [
            "https://media.licdn.com/dms/image/v2/D4D22AQGotAzvnQBaDQ/feedshare-shrink_800/B4DZUfYSCHHkAk-/0/1739988241755?e=1743638400&v=beta&t=_U77VynZEGYzDMafUgLQ3qdV6lg19jEcvzjimx7NuOo"
          ],
          "date": "2025-02-24T14:17:11.199Z"
        },
        {
          "captions": "At the 12th International Material Recycling Convention & Exposition,\nheld by MRAI, LINDEMANN  made a significant impact, joining 2,500 delegates from around the world. 🌍✨ Keegan Vas represented the company in a high-profile panel discussion on the role of technology in scrap processing. He showcased innovative solutions, including the Index and the groundbreaking thermal camera for shredders. 🔥🤖\n\nThe panel, featuring experts from different branches, sparked lively debates on AI-driven sorting, sensor-based separation, and advanced processing techniques. These discussions set new standards for productivity, sustainability, and the future of the recycling industry. ♻️🚀\n\nLINDEMANN's booth at the exhibition was buzzing with activity, further reinforcing the company's commitment to pushing the boundaries of metal recycling. The future of the industry looks bright! 💡\n\n#MetalRecycling #MetalRecyclingSolutions #RecycleForChange #RecycleResponsibly #GreenFuture #RecycleForABetterFuture #CircularEconomy #Ecomondo #EcotecSolutions #Sustainability #Innovation#IMRC2025 #RecyclingTechnology",
          "likes": "29",
          "shares": "2",
          "time": {
            "raw": "1h",
            "parsed": "24.02.2025",
            "isoString": "2025-02-24T14:17:11.200Z"
          },
          "mediaType": "document",
          "mediaContent": {
            "title": "MRAI",
            "subtitle": "4 sayfa",
            "totalPages": 4,
            "coverPages": [
              {
                "type": "image",
                "config": {
                  "src": "https://media.licdn.com/dms/image/v2/D4E1FAQHLeX5PLr-OQg/feedshare-document-cover-images_480/B4EZUdtBuwGgBM-/0/1739960105265?e=1741618800&v=beta&t=a6HLWFymaYb5_TLC0Yk6hXAhjEFFKeB2otuvwlQ8aao"
                }
              },
              {
                "type": "image",
                "config": {
                  "src": "https://media.licdn.com/dms/image/v2/D4E1FAQHLeX5PLr-OQg/feedshare-document-cover-images_480/B4EZUdtBuwGgBM-/1/1739960105265?e=1741618800&v=beta&t=lqGmXpN0qMynlaom0B_CQpNMi9yoUmeaEA8IEARNcKg"
                }
              },
              {
                "type": "image",
                "config": {
                  "src": "https://media.licdn.com/dms/image/v2/D4E1FAQHLeX5PLr-OQg/feedshare-document-cover-images_480/B4EZUdtBuwGgBM-/2/1739960105265?e=1741618800&v=beta&t=91dSfY5MXrcl-bioq0IF1st3LG1eu3yKU2JO3NIdgpQ"
                }
              }
            ]
          },
          "date": "2025-02-24T14:17:11.200Z"
        },
        {
          "captions": "Designed for ultimate operator comfort and precision, the LINDEMANN shredder cabin sets the standard for modern recycling equipment.\n\n✅ Climate Control: Equipped with heating and air-conditioning, the cabin provides optimal comfort in all weather conditions.\n\n✅ Enhanced Monitoring: An advanced graphic visualization system with Siemens TP series ensures seamless machine monitoring, so operators can stay in control.\n\n✅ Ergonomic Excellence: The rotating control chair, with adjustable length and height, features dampers for smoother operation. Separate replacement options for seat cushions, armrests, and headrests mean longer-lasting comfort.\n\n✅ Optimal Visibility: Angled and reinforced safety glass minimizes reflections, providing an unobstructed view of the worksite.\n\n✅ Intuitive Controls: Joysticks and push buttons are integrated into the armrests for effortless operation, while the adjustable side-wall-mounted control panel puts everything within reach.\n\nBuilt with comfort, safety, and efficiency in mind. Stay tuned for more insights into our machine features!\n\n#MetalRecycling #MetalRecyclingSolutions #RecycleForChange #RecycleResponsibly #GreenFuture #RecycleForABetterFuture #CleanerPlanet #CircularEconomy #CarbonReduction #ShredderParts #cabin Designed for ultimate operator comfort and precision, the LINDEMANN shredder cabin sets the standard for modern recycling equipment.\n\n✅ Climate Control: Equipped with heating and air-conditioning, the cabin provides optimal comfort in all weather conditions.\n\n✅ Enhanced Monitoring: An advanced graphic visualization system with Siemens TP series ensures seamless machine monitoring, so operators can stay in control.\n\n✅ Ergonomic Excellence: The rotating control chair, with adjustable length and height, features dampers for smoother operation. Separate replacement options for seat cushions, armrests, and headrests mean longer-lasting comfort.\n\n✅ Optimal Visibility: Angled and reinforced safety glass minimizes reflections, providing an unobstructed view of the worksite.\n\n✅ Intuitive Controls: Joysticks and push buttons are integrated into the armrests for effortless operation, while the adjustable side-wall-mounted control panel puts everything within reach.\n\nBuilt with comfort, safety, and efficiency in mind. Stay tuned for more insights into our machine features!\n\n#MetalRecycling #MetalRecyclingSolutions #RecycleForChange #RecycleResponsibly #GreenFuture #RecycleForABetterFuture #CleanerPlanet #CircularEconomy #CarbonReduction #ShredderParts #cabin",
          "likes": "47",
          "comments": "1",
          "shares": "5",
          "time": {
            "raw": "1h",
            "parsed": "24.02.2025",
            "isoString": "2025-02-24T14:17:11.201Z"
          },
          "mediaType": "image",
          "mediaContent": [
            "https://media.licdn.com/dms/image/v2/D5622AQGj_lZn8_Negw/feedshare-shrink_800/B56ZTwf_p5HsAk-/0/1739201709007?e=1743638400&v=beta&t=TWXIPb0PNuAv5VGyUDvRQojV9kziTZl7M_5roeLRRnQ"
          ],
          "date": "2025-02-24T14:17:11.201Z"
        },
        {
          "captions": "Location Spotlight: San Antonio, Texas! 🇺🇸\n\nAt LINDEMANN Metal Recycling, we take pride in being close to our customers, no matter where they are. Today, we're highlighting our North American headquarters in the vibrant city of San Antonio, Texas! 🤠\n\nThis dynamic hub is where X incredible team members come together to drive innovation and provide exceptional service. It’s also home to our U.S. service center, which ensures top-notch support for our North American customers. \n\nBut what makes San Antonio so special?\n\n🌵 Known as the \"Alamo City\", San Antonio boasts a rich history, with landmarks like the iconic Alamo and the San Antonio Missions, a UNESCO World Heritage Site.\n\n🌉 The city is famous for the beautiful River Walk, a network of scenic walkways along the San Antonio River filled with restaurants, shops, and cultural experiences.\n\n🎉 San Antonio is also a hub for innovation and business, making it the perfect home for LINDEMANN’s commitment to advancing metal recycling technology in North America.\n\nFrom this dynamic location, we work to deliver cutting-edge recycling solutions and industry-leading support to our customers across the continent.\n\nHave you visited our San Antonio location or experienced its unique charm? Share your thoughts in the comments!\n\n#MetalRecycling #MetalRecyclingSolutions #RecycleForChange #RecycleResponsibly #GreenFuture #RecycleForABetterFuture #CleanerPlanet #CircularEconomy #CarbonReduction #SanAntonio #Spotlight #location #service Location Spotlight: San Antonio, Texas! 🇺🇸\n\nAt LINDEMANN Metal Recycling, we take pride in being close to our customers, no matter where they are. Today, we're highlighting our North American headquarters in the vibrant city of San Antonio, Texas! 🤠\n\nThis dynamic hub is where X incredible team members come together to drive innovation and provide exceptional service. It’s also home to our U.S. service center, which ensures top-notch support for our North American customers. \n\nBut what makes San Antonio so special?\n\n🌵 Known as the \"Alamo City\", San Antonio boasts a rich history, with landmarks like the iconic Alamo and the San Antonio Missions, a UNESCO World Heritage Site.\n\n🌉 The city is famous for the beautiful River Walk, a network of scenic walkways along the San Antonio River filled with restaurants, shops, and cultural experiences.\n\n🎉 San Antonio is also a hub for innovation and business, making it the perfect home for LINDEMANN’s commitment to advancing metal recycling technology in North America.\n\nFrom this dynamic location, we work to deliver cutting-edge recycling solutions and industry-leading support to our customers across the continent.\n\nHave you visited our San Antonio location or experienced its unique charm? Share your thoughts in the comments!\n\n#MetalRecycling #MetalRecyclingSolutions #RecycleForChange #RecycleResponsibly #GreenFuture #RecycleForABetterFuture #CleanerPlanet #CircularEconomy #CarbonReduction #SanAntonio #Spotlight #location #service",
          "likes": "33",
          "shares": "5",
          "time": {
            "raw": "2h",
            "parsed": "17.02.2025",
            "isoString": "2025-02-17T14:17:11.203Z"
          },
          "mediaType": "image",
          "mediaContent": [
            "https://media.licdn.com/dms/image/v2/D5622AQGyKeezGynPZg/feedshare-shrink_800/B56ZTwewfVGQAs-/0/1739201384896?e=1743638400&v=beta&t=esRyu5gtI8SR3kUxEmq_GiwhAb7OfH6ILczChE_u3pY"
          ],
          "date": "2025-02-17T14:17:11.203Z"
        },
        {
          "captions": "Keep Your Machines Running smoothly with LINDEMANN Inspections and Maintenance\n\nTime takes its toll on even the best machines. Over the years, wear and aging can lead to internal leakages and the risk of unexpected failures. That’s where LINDEMANN's inspections and maintenance planning services come in.\n\nOur expert team helps you identify potential issues before they become costly problems, ensuring your machines stay in top shape and delivering peak performance.\n\nDon’t let aging components catch you off guard. Partner with LINDEMANN for proactive care and long-term reliability.\n\n👉 Ready to avoid unpleasant surprises? Discover how we can support your operations: https://lnkd.in/eHZSfXGj\n\n#MetalRecycling #MetalRecyclingSolutions #RecycleForChange #RecycleResponsibly #GreenFuture #RecycleForABetterFuture #CleanerPlanet #CircularEconomy #CarbonReduction #GreenFuture #maintenance #reliability Keep Your Machines Running smoothly with LINDEMANN Inspections and Maintenance\n\nTime takes its toll on even the best machines. Over the years, wear and aging can lead to internal leakages and the risk of unexpected failures. That’s where LINDEMANN's inspections and maintenance planning services come in.\n\nOur expert team helps you identify potential issues before they become costly problems, ensuring your machines stay in top shape and delivering peak performance.\n\nDon’t let aging components catch you off guard. Partner with LINDEMANN for proactive care and long-term reliability.\n\n👉 Ready to avoid unpleasant surprises? Discover how we can support your operations: https://lnkd.in/eHZSfXGj\n\n#MetalRecycling #MetalRecyclingSolutions #RecycleForChange #RecycleResponsibly #GreenFuture #RecycleForABetterFuture #CleanerPlanet #CircularEconomy #CarbonReduction #GreenFuture #maintenance #reliability",
          "likes": "37",
          "shares": "8",
          "time": {
            "raw": "2h",
            "parsed": "17.02.2025",
            "isoString": "2025-02-17T14:17:11.204Z"
          },
          "mediaType": "image",
          "mediaContent": [
            "https://media.licdn.com/dms/image/v2/D4E22AQHZQImFxJfOqg/feedshare-shrink_800/B4EZTwbNTzG0Ag-/0/1739200457091?e=1743638400&v=beta&t=QX6kYqZwB-GXAf7d2wnnUQkWckFnvq8_p5XRUjDGPOc"
          ],
          "date": "2025-02-17T14:17:11.204Z"
        },
        {
          "captions": "🔩 Discover our NxtCut Midsize Scrap Shear in 360°! 🌍\n\nEver wondered what cutting-edge innovation looks like? With our interactive 360° 3D view, you can explore every detail of the NxtCut Midsize Scrap Shear from the comfort of your screen.\n\n📲 Take a closer look at the machine redefining efficiency in metal recycling by following this link: https://lnkd.in/gFxUBhbw\n\nGet a new perspective on performance. Check it out today!\n\n#MetalRecycling #MetalRecyclingSolutions #RecycleForChange #RecycleResponsibly #GreenFuture #RecycleForABetterFuture #CleanerPlanet #CircularEconomy #CarbonReduction #GreenFuture #ScrapShear #InnovationInAction #360View🔩 Discover our NxtCut Midsize Scrap Shear in 360°! 🌍\n\nEver wondered what cutting-edge innovation looks like? With our interactive 360° 3D view, you can explore every detail of the NxtCut Midsize Scrap Shear from the comfort of your screen.\n\n📲 Take a closer look at the machine redefining efficiency in metal recycling by following this link: https://lnkd.in/gFxUBhbw\n\nGet a new perspective on performance. Check it out today!\n\n#MetalRecycling #MetalRecyclingSolutions #RecycleForChange #RecycleResponsibly #GreenFuture #RecycleForABetterFuture #CleanerPlanet #CircularEconomy #CarbonReduction #GreenFuture #ScrapShear #InnovationInAction #360View",
          "likes": "51",
          "comments": "2",
          "shares": "10",
          "time": {
            "raw": "2h",
            "parsed": "17.02.2025",
            "isoString": "2025-02-17T14:17:11.205Z"
          },
          "mediaType": "image",
          "mediaContent": [
            "https://media.licdn.com/dms/image/v2/D5622AQECgkdVfaS25w/feedshare-shrink_800/B56ZTwdk64GoBo-/0/1739201076939?e=1743638400&v=beta&t=sl2Xma5G9rwM__26QLghnZQie4XEuS9b222bf0EyHmY"
          ],
          "date": "2025-02-17T14:17:11.205Z"
        },
        {
          "captions": "Thanks for that great opportunity: it was a pleasure to see our ZZ shredder 😎 and how your business is running. Today we were pleased to welcome a group of senior leaders from the metals recycling industry, representing companies from across Europe. The group have been attending a Lindemann industry event being held in Manchester and took the opportunity to visit S. Norton’s £20m world-class shredder installation at our Manchester site. This ambitious investment in recycling technology has increased scrap metal shredding capacity by 50% and produces higher quality ferrous and non-ferrous metals - all while delivering sustainability gains including reduced emissions to atmosphere and lower energy consumption.\n#LindemannMetalRecycling #Metals #Recycling #Sustainability #ManchesterToday we were pleased to welcome a group of senior leaders from the metals recycling industry, representing companies from across Europe. The group have been attending a Lindemann industry event being held in Manchester and took the opportunity to visit S. Norton’s £20m world-class shredder installation at our Manchester site. This ambitious investment in recycling technology has increased scrap metal shredding capacity by 50% and produces higher quality ferrous and non-ferrous metals - all while delivering sustainability gains including reduced emissions to atmosphere and lower energy consumption.\n#LindemannMetalRecycling #Metals #Recycling #Sustainability #Manchester",
          "likes": "31",
          "shares": "2",
          "time": {
            "raw": "3h3h",
            "parsed": "03.03.2025",
            "isoString": "2025-03-03T14:17:11.207Z"
          },
          "mediaType": "image",
          "mediaContent": [
            "https://media.licdn.com/dms/image/v2/D4E22AQGhQmdzvMsfkQ/feedshare-shrink_800/B4EZTWQxADHgAk-/0/1738761509024?e=1743638400&v=beta&t=vR0tlOIpLdc4Pe2cCDacfYL36qwwWy3BBy1n38ASW1U",
            "https://media.licdn.com/dms/image/v2/D4E22AQHg8C40oPAqkw/feedshare-shrink_800/B4EZTWQxA3GYAo-/0/1738761510858?e=1743638400&v=beta&t=8JA7LzEE8H77lk4ynpslnAXQY8G2nFrVI1G3S2O5iOI",
            "https://media.licdn.com/dms/image/v2/D4E22AQEjDtUCcrQrNw/feedshare-shrink_800/B4EZTWQw_8G0Ag-/0/1738761510602?e=1743638400&v=beta&t=v6P1cK0KRxOIHDStRdLXAvIBOuLmi0v3XneZ-O89sZ0",
            "https://media.licdn.com/dms/image/v2/D4E22AQF8mbgoL9250w/feedshare-shrink_800/B4EZTWQxBGHUAg-/0/1738761510529?e=1743638400&v=beta&t=KbwuDs0swcm9zw1kZD_sHpJKOVirWYuSxvbrpFD0nrw"
          ],
          "date": "2025-03-03T14:17:11.207Z"
        },
        {
          "captions": "Today we were pleased to welcome a group of senior leaders from the metals recycling industry, representing companies from across Europe. The group have been attending a Lindemann industry event being held in Manchester and took the opportunity to visit S. Norton’s £20m world-class shredder installation at our Manchester site. This ambitious investment in recycling technology has increased scrap metal shredding capacity by 50% and produces higher quality ferrous and non-ferrous metals - all while delivering sustainability gains including reduced emissions to atmosphere and lower energy consumption.\n#LindemannMetalRecycling #Metals #Recycling #Sustainability #ManchesterToday we were pleased to welcome a group of senior leaders from the metals recycling industry, representing companies from across Europe. The group have been attending a Lindemann industry event being held in Manchester and took the opportunity to visit S. Norton’s £20m world-class shredder installation at our Manchester site. This ambitious investment in recycling technology has increased scrap metal shredding capacity by 50% and produces higher quality ferrous and non-ferrous metals - all while delivering sustainability gains including reduced emissions to atmosphere and lower energy consumption.\n#LindemannMetalRecycling #Metals #Recycling #Sustainability #Manchester",
          "likes": "31",
          "shares": "2",
          "time": {
            "raw": "3h",
            "parsed": "10.02.2025",
            "isoString": "2025-02-10T14:17:11.209Z"
          },
          "mediaType": "image",
          "mediaContent": [
            "https://media.licdn.com/dms/image/v2/D4E22AQGhQmdzvMsfkQ/feedshare-shrink_800/B4EZTWQxADHgAk-/0/1738761509024?e=1743638400&v=beta&t=vR0tlOIpLdc4Pe2cCDacfYL36qwwWy3BBy1n38ASW1U",
            "https://media.licdn.com/dms/image/v2/D4E22AQHg8C40oPAqkw/feedshare-shrink_800/B4EZTWQxA3GYAo-/0/1738761510858?e=1743638400&v=beta&t=8JA7LzEE8H77lk4ynpslnAXQY8G2nFrVI1G3S2O5iOI",
            "https://media.licdn.com/dms/image/v2/D4E22AQEjDtUCcrQrNw/feedshare-shrink_800/B4EZTWQw_8G0Ag-/0/1738761510602?e=1743638400&v=beta&t=v6P1cK0KRxOIHDStRdLXAvIBOuLmi0v3XneZ-O89sZ0",
            "https://media.licdn.com/dms/image/v2/D4E22AQF8mbgoL9250w/feedshare-shrink_800/B4EZTWQxBGHUAg-/0/1738761510529?e=1743638400&v=beta&t=KbwuDs0swcm9zw1kZD_sHpJKOVirWYuSxvbrpFD0nrw"
          ],
          "date": "2025-02-10T14:17:11.209Z"
        },
        {
          "captions": "Did you know? Around 30% of steel is currently produced by recycling scrap, and this is expected to rise to 50% by 2050. ♻️\nRecycling steel not only saves resources but also reduces CO₂ emissions – a win for the planet! 🌱✨\n\nEvery step we take today helps build a greener tomorrow – let's recycle for a sustainable future! 💪🌎♻️\n\n#MetalRecycling #MetalRecyclingSolutions #RecycleForChange #RecycleResponsibly #GreenFuture #RecycleForABetterFuture #Steel",
          "likes": "29",
          "shares": "5",
          "time": {
            "raw": "4h",
            "parsed": "03.02.2025",
            "isoString": "2025-02-03T14:17:11.209Z"
          },
          "mediaType": "document",
          "mediaContent": {
            "title": "facts",
            "subtitle": "2 sayfa",
            "totalPages": 2,
            "coverPages": [
              {
                "type": "image",
                "config": {
                  "src": "https://media.licdn.com/dms/image/v2/D4E1FAQGfdBm4O_B0OQ/feedshare-document-cover-images_480/B4EZSXq8sbHMBI-/0/1737711406819?e=1741618800&v=beta&t=MhlhjYItDlYvJNtNQpFqU1n9tPe7YK8dF7u1zipw5OI"
                }
              },
              {
                "type": "image",
                "config": {
                  "src": "https://media.licdn.com/dms/image/v2/D4E1FAQGfdBm4O_B0OQ/feedshare-document-cover-images_480/B4EZSXq8sbHMBI-/1/1737711406819?e=1741618800&v=beta&t=AvCSTfLUl2TY2Ma6QWa3aMEexZdy9WeM3rUfA4hjRvU"
                }
              }
            ]
          },
          "date": "2025-02-03T14:17:11.209Z"
        },
        {
          "captions": "🇮🇳 India’s Steel Ambitions: A Call for Action in Metal Recycling♻️\n\nBy 2030, India aims to achieve an impressive 250 million tones of steel output, a critical milestone for its industrial and economic growth. But this ambitious target comes with a significant challenge: 700 shredder plants will be required to process the necessary scrap materials, supported by 2,800-3,000 collection and dismantling centers.(Source: Euromonitor, SIAM, Business Sweden Analysis)\n\nThis is a tremendous opportunity for the recycling industry to step up and play a pivotal role in building a more efficient and sustainable supply chain.\n\nAt LINDEMANN, we are committed to driving innovation and delivering advanced solutions that empower businesses to meet these demands. With our cutting-edge shredders and expertise in metal recycling, we’re ready to support India—and the world—on its journey to a more circular economy.\n\nLet’s shape the future of recycling together. 🌟\n\n#MetalRecycling #MetalRecyclingSolutions #RecycleForChange #RecycleResponsibly #GreenFuture #RecycleForABetterFuture #CleanerPlanet #CircularEconomy #CarbonReduction #GreenFuture #India 🇮🇳 India’s Steel Ambitions: A Call for Action in Metal Recycling♻️\n\nBy 2030, India aims to achieve an impressive 250 million tones of steel output, a critical milestone for its industrial and economic growth. But this ambitious target comes with a significant challenge: 700 shredder plants will be required to process the necessary scrap materials, supported by 2,800-3,000 collection and dismantling centers.(Source: Euromonitor, SIAM, Business Sweden Analysis)\n\nThis is a tremendous opportunity for the recycling industry to step up and play a pivotal role in building a more efficient and sustainable supply chain.\n\nAt LINDEMANN, we are committed to driving innovation and delivering advanced solutions that empower businesses to meet these demands. With our cutting-edge shredders and expertise in metal recycling, we’re ready to support India—and the world—on its journey to a more circular economy.\n\nLet’s shape the future of recycling together. 🌟\n\n#MetalRecycling #MetalRecyclingSolutions #RecycleForChange #RecycleResponsibly #GreenFuture #RecycleForABetterFuture #CleanerPlanet #CircularEconomy #CarbonReduction #GreenFuture #India",
          "likes": "37",
          "comments": "2",
          "shares": "6",
          "time": {
            "raw": "1ay",
            "parsed": "03.02.2025",
            "isoString": "2025-02-03T14:17:11.212Z"
          },
          "mediaType": "image",
          "mediaContent": [
            "https://media.licdn.com/dms/image/v2/D4E22AQGoQBsivsiAIQ/feedshare-shrink_800/B4EZSdI9yIGYAg-/0/1737803163338?e=1743638400&v=beta&t=AJcokz4Oboty-IPfATy4VmbodSOTdNAnDKg71fTOMgs"
          ],
          "date": "2025-02-03T14:17:11.212Z"
        },
        {
          "captions": "At LINDEMANN Metal Recycling, our commitment to excellence knows no borders. Across the globe, we deliver industry-leading service and support tailored to meet the unique needs of our customers, wherever they are. 🌍\n\nFrom installation and training to maintenance and spare parts, our expert teams work closely with you at every stage to maximize the efficiency and longevity of your metal recycling equipment. With service technicians strategically located worldwide, we ensure quick response times and minimized downtime for your operations. 📈\n\nAt LINDEMANN, we pride ourselves on delivering not just premium technology but also a partnership built on trust, reliability, and expertise. Whether you’re looking to upgrade your machinery, resolve a technical issue, or plan preventive maintenance, our global team is ready to help you succeed.\n\nWe’re here for you. To get in contact with a team near you, visit: https://lnkd.in/eCbX9HMg\n\n#MetalRecycling #MetalRecyclingSolutions #RecycleForChange #RecycleResponsibly #GreenFuture #RecycleForABetterFuture #CleanerPlanet #CircularEconomy #CarbonReduction #GlobalSupport #CustomerServiceAt LINDEMANN Metal Recycling, our commitment to excellence knows no borders. Across the globe, we deliver industry-leading service and support tailored to meet the unique needs of our customers, wherever they are. 🌍\n\nFrom installation and training to maintenance and spare parts, our expert teams work closely with you at every stage to maximize the efficiency and longevity of your metal recycling equipment. With service technicians strategically located worldwide, we ensure quick response times and minimized downtime for your operations. 📈\n\nAt LINDEMANN, we pride ourselves on delivering not just premium technology but also a partnership built on trust, reliability, and expertise. Whether you’re looking to upgrade your machinery, resolve a technical issue, or plan preventive maintenance, our global team is ready to help you succeed.\n\nWe’re here for you. To get in contact with a team near you, visit: https://lnkd.in/eCbX9HMg\n\n#MetalRecycling #MetalRecyclingSolutions #RecycleForChange #RecycleResponsibly #GreenFuture #RecycleForABetterFuture #CleanerPlanet #CircularEconomy #CarbonReduction #GlobalSupport #CustomerService",
          "likes": "63",
          "comments": "2",
          "shares": "7",
          "time": {
            "raw": "1ay",
            "parsed": "03.02.2025",
            "isoString": "2025-02-03T14:17:11.213Z"
          },
          "mediaType": "image",
          "mediaContent": [
            "https://media.licdn.com/dms/image/v2/D4E22AQGC0uKNfQIclg/feedshare-shrink_800/B4EZS76XtFG0Ag-/0/1738319430927?e=1743638400&v=beta&t=ZAX02fB5ZMJPFg6BSAGLt6HZVcTzkpx8P8P-7iCxXjo"
          ],
          "date": "2025-02-03T14:17:11.213Z"
        },
        {
          "captions": "We’re thrilled to announce that LINDEMANN will be participating in the 12th International Material Recycling Convention (IMRC), organized by MRAI, taking place January 28-30, 2025, at the Novotel Jaipur & Convention Centre in Jaipur, India. 🇮🇳 ♻️\n\n Why Attend?✅\n\nThe IMRC is a premier event that unites 3,000+ delegates and 200+ exhibitors from across the global recycling fraternity. It’s a unique platform for networking, showcasing the latest in recycling technologies, exploring business opportunities, and discovering innovative solutions shaping the industry’s future.\n\nAt LINDEMANN, we’re excited to share how our advanced recycling technologies are driving the future of sustainable metal recycling. We will be at booth ...... Don’t forget to stop by to meet our team and discuss how we can help you achieve your goals.\n\n🎟️ Don’t miss out—register now: https://imrc.mrai.org.in\n\n#MetalRecycling #MetalRecyclingSolutions #RecycleForChange #RecycleResponsibly #GreenFuture #RecycleForABetterFuture #CleanerPlanet #CircularEconomy #MRAI #IMRC2025 #RecyclingInnovation #NetworkingOpportunityWe’re thrilled to announce that LINDEMANN will be participating in the 12th International Material Recycling Convention (IMRC), organized by MRAI, taking place January 28-30, 2025, at the Novotel Jaipur & Convention Centre in Jaipur, India. 🇮🇳 ♻️\n\n Why Attend?✅\n\nThe IMRC is a premier event that unites 3,000+ delegates and 200+ exhibitors from across the global recycling fraternity. It’s a unique platform for networking, showcasing the latest in recycling technologies, exploring business opportunities, and discovering innovative solutions shaping the industry’s future.\n\nAt LINDEMANN, we’re excited to share how our advanced recycling technologies are driving the future of sustainable metal recycling. We will be at booth ...... Don’t forget to stop by to meet our team and discuss how we can help you achieve your goals.\n\n🎟️ Don’t miss out—register now: https://imrc.mrai.org.in\n\n#MetalRecycling #MetalRecyclingSolutions #RecycleForChange #RecycleResponsibly #GreenFuture #RecycleForABetterFuture #CleanerPlanet #CircularEconomy #MRAI #IMRC2025 #RecyclingInnovation #NetworkingOpportunity",
          "likes": "35",
          "shares": "5",
          "time": {
            "raw": "1ay",
            "parsed": "03.02.2025",
            "isoString": "2025-02-03T14:17:11.215Z"
          },
          "mediaType": "image",
          "mediaContent": [
            "https://media.licdn.com/dms/image/v2/D4E22AQFScq8XfsCqQQ/feedshare-shrink_800/B4EZSXoDtMGYAg-/0/1737710649488?e=1743638400&v=beta&t=LEu6oS0KFUzGTu2vQtU9zZJKUUbzg5Hme4mT2TAv2EQ"
          ],
          "date": "2025-02-03T14:17:11.215Z"
        },
        {
          "captions": "🔧 SPARE AND WEAR PARTS: THE LINDEMANN DIFFERENCE\n\nWhen it comes to keeping your recycling operation running smoothly, every component matters. As an OEM supplier, LINDEMANN provides spare and wear parts designed to fit your machines perfectly.\n\nFor decades, we’ve paired the development of our innovative recycling plants with the creation of specifically adapted parts, ensuring durability, efficiency, and reliability from the ground up.\n\nOur original LINDEMANN parts are: \n\n✅ Developed and tested in-house\n\n✅ Designed with performance and cost-efficiency in mind\n\n✅ Built to maximize machine availability and minimize maintenance\n\nWith extensive experience in design and field testing, we ensure every part contributes to seamless operations, helping you achieve optimal performance while reducing downtime.\n\n🔗 Ready to learn more? Explore the LINDEMANN advantage today: https://lnkd.in/e-t6EWwv\n\n#MetalRecycling #MetalRecyclingSolutions #RecycleForChange #RecycleResponsibly #GreenFuture #RecycleForABetterFuture #CleanerPlanet #CircularEconomy #CarbonReduction #GreenFuture #OEMParts #Efficiency #Innovation",
          "likes": "47",
          "shares": "7",
          "time": {
            "raw": "1ay",
            "parsed": "03.02.2025",
            "isoString": "2025-02-03T14:17:11.216Z"
          },
          "mediaType": "document",
          "mediaContent": {
            "title": "shear parts",
            "subtitle": "5 sayfa",
            "totalPages": 5,
            "coverPages": [
              {
                "type": "image",
                "config": {
                  "src": "https://media.licdn.com/dms/image/v2/D4E1FAQEIOVAJe2Q7Tg/feedshare-document-cover-images_480/B4EZSc6WMrGgBM-/0/1737799336683?e=1741618800&v=beta&t=mVxNuOoZE6IJKlB_aZhVSZLN5hstAquZP7owFu77uX4"
                }
              },
              {
                "type": "image",
                "config": {
                  "src": "https://media.licdn.com/dms/image/v2/D4E1FAQEIOVAJe2Q7Tg/feedshare-document-cover-images_480/B4EZSc6WMrGgBM-/1/1737799336683?e=1741618800&v=beta&t=Te1JgKXa7RLTDIhUilTslK8Ju77dEBeiIxF2EFzNLBI"
                }
              },
              {
                "type": "image",
                "config": {
                  "src": "https://media.licdn.com/dms/image/v2/D4E1FAQEIOVAJe2Q7Tg/feedshare-document-cover-images_480/B4EZSc6WMrGgBM-/2/1737799336683?e=1741618800&v=beta&t=g_Xw-ytwov8IOraElWrb3_HVKZSrIDXcA6mIJphHYq4"
                }
              }
            ]
          },
          "date": "2025-02-03T14:17:11.216Z"
        }
      ]
    }
  },
  {
    "name": "Sierra",
    "data": {
      "followerCount": "5.874",
      "employeeCount": "51 - 200 çalışan",
      "data": [
        {
          "captions": "New challengers in the kitchen! 🔥\n\nTeam Alter Trading —bringing bold flavors, fresh energy, and a competitive edge to Table Scraps: The Chef’s Challenge. These industry pros know their way around the job, but can they handle the heat of the kitchen?\n\nFind out when Table Scraps: The Chef’s Challenge drops March 14th! \n\n🔔 Subscribe on YouTube today! \n🔗 https://lnkd.in/gNG2dRXW\n\n#TableScraps #TheChefsChallenge #RecyclingMeetsCulinary #RecyclingCommunity Michael Goldstein🟧, Patrick Young, Mark Hadacek, Abby Goldstein, John Sacco",
          "likes": "18",
          "comments": "3",
          "shares": "3",
          "time": {
            "raw": "18s",
            "parsed": "02.03.2025",
            "isoString": "2025-03-02T20:17:35.273Z"
          },
          "mediaType": "video",
          "mediaContent": {
            "src": [
              {
                "src": "https://dms.licdn.com/playlist/vid/v2/D5605AQFE7bULTPQ4Fg/mp4-640p-30fp-crf28/B56ZVNuLu8GQBk-/0/1740765711583?e=1741618800&v=beta&t=qn1pgFIIZuXYyufFLc0ZPgpyioAHH8qA8nRA75KYAdY",
                "type": "video/mp4",
                "data-bitrate": 858157
              },
              {
                "src": "https://dms.licdn.com/playlist/vid/v2/D5605AQFE7bULTPQ4Fg/mp4-720p-30fp-crf28/B56ZVNuLu8GQBo-/0/1740765711535?e=1741618800&v=beta&t=5KG553hxaOQ-tgC3DJFAie3HdGUuK9K8ATOduiExg6w",
                "type": "video/mp4",
                "data-bitrate": 1142498
              }
            ],
            "posterUrl": "https://media.licdn.com/dms/image/v2/D5605AQFE7bULTPQ4Fg/videocover-high/B56ZVNuLu8GQB0-/0/1740765710943?e=1741618800&v=beta&t=8TcVSzzglp7uN61RUSX-5ojBx4vg4PVo_1GIlCuQdOw"
          },
          "date": "2025-03-02T20:17:35.273Z"
        },
        {
          "captions": "Sierra® T1100 3-in-1? This powerhouse combines three machines in one, delivering unmatched versatility and efficiency. \n\nWith a 36-inch throat, it effortlessly handles bulkier materials and even logs automobiles with ease—outperforming anything else on the market. Plus, the double automatic lubrication system keeps you cutting longer!\n\n📲 Reach out to one of our sales reps today for more information!\n\n#SierraT1100 #RecyclingInnovation #BuiltToPerform Alter Trading",
          "likes": "7",
          "time": {
            "raw": "21s",
            "parsed": "02.03.2025",
            "isoString": "2025-03-02T17:17:35.275Z"
          },
          "mediaType": "video",
          "mediaContent": {
            "src": [
              {
                "src": "https://dms.licdn.com/playlist/vid/v2/D5605AQEMy8sAKSEIRQ/mp4-720p-30fp-crf28/B56ZVOLW6FHEBg-/0/1740773372512?e=1741618800&v=beta&t=yKV7cEL2Cx2guRCPSmCGSkUhGciAJdZ6g8qJw5tsHjs",
                "type": "video/mp4",
                "data-bitrate": 1273632
              },
              {
                "src": "https://dms.licdn.com/playlist/vid/v2/D5605AQEMy8sAKSEIRQ/mp4-640p-30fp-crf28/B56ZVOLW6FHEBc-/0/1740773367640?e=1741618800&v=beta&t=NaT-AcdqrdybqgVpFIcdmX3YJ41S6-W06Qweb_CpJ_Y",
                "type": "video/mp4",
                "data-bitrate": 993407
              }
            ],
            "posterUrl": "https://media.licdn.com/dms/image/v2/D5605AQEMy8sAKSEIRQ/videocover-high/B56ZVOLW6FHEBs-/0/1740773364340?e=1741618800&v=beta&t=qzRD8g_mefTfiWP2RujGMA04amWCsZh_ZF1K6FM80Zk"
          },
          "date": "2025-03-02T17:17:35.275Z"
        },
        {
          "captions": "When we say “The Chef’s Challenge,” we mean it! ⏲️\n\nThis season of Table Scraps raises the stakes, so it’s only fitting that we brought in expert judges to take on the challenge! 🏆\n\nMeet Gino, Lanette, and Antonia—Bakersfield’s very own food and wine legends. With deep roots in the restaurant industry, they know a great dish when they taste one. And what better place to bring them in than Luigi’s (@Luigisbakersfield)—a Bakersfield institution for 115 years and a true cornerstone of the community. 🍝\n\nOh, and fun fact? They also happen to be John Sacco’s in-laws! We love our Luigi’s family!\n\nWill anyone WOW the judges? Find out March 14th! ♻️\n\n#TableScraps #TheChefsChallenge #RecyclingMeetsCulinary #RecyclingCommunity #FoodAndWine #Sustainability #BakersfieldEatsWhen we say “The Chef’s Challenge,” we mean it! ⏲️\n\nThis season of Table Scraps raises the stakes, so it’s only fitting that we brought in expert judges to take on the challenge! 🏆\n\nMeet Gino, Lanette, and Antonia—Bakersfield’s very own food and wine legends. With deep roots in the restaurant industry, they know a great dish when they taste one. And what better place to bring them in than Luigi’s (@Luigisbakersfield)—a Bakersfield institution for 115 years and a true cornerstone of the community. 🍝\n\nOh, and fun fact? They also happen to be John Sacco’s in-laws! We love our Luigi’s family!\n\nWill anyone WOW the judges? Find out March 14th! ♻️\n\n#TableScraps #TheChefsChallenge #RecyclingMeetsCulinary #RecyclingCommunity #FoodAndWine #Sustainability #BakersfieldEats",
          "likes": "20",
          "comments": "2",
          "shares": "3",
          "time": {
            "raw": "1g",
            "parsed": "02.03.2025",
            "isoString": "2025-03-02T14:17:35.277Z"
          },
          "mediaType": "image",
          "mediaContent": [
            "https://media.licdn.com/dms/image/v2/D5622AQHci18dt-Qeuw/feedshare-shrink_800/B56ZVOwRn8GUAg-/0/1740783035453?e=1743638400&v=beta&t=S4hA4VxuEAJC_zTAG5KfR1XBGpt797bulbK2fzBM8xg",
            "https://media.licdn.com/dms/image/v2/D5622AQGCyjl7npFORw/feedshare-shrink_800/B56ZVOwRoOGUAg-/0/1740783034508?e=1743638400&v=beta&t=5R_pj5i-J2VYhhUqzGwMVuCabPJcaYJ_eO9CUqaY6yY",
            "https://media.licdn.com/dms/image/v2/D5622AQElwuU_v8kE-A/feedshare-shrink_800/B56ZVOwRoAGsAs-/0/1740783034459?e=1743638400&v=beta&t=tNDln-9EKy2jgd6OyYWCeiuqJHF4xRwZgGvNRVsAJvk",
            "https://media.licdn.com/dms/image/v2/D5622AQFeJCzrA8siGA/feedshare-shrink_800/B56ZVOwRoIHQAk-/0/1740783034273?e=1743638400&v=beta&t=ggvtWx7gpY0eh_pML5G9djq5M9e6lAnkNR6DtD0c2DE",
            "https://media.licdn.com/dms/image/v2/D5622AQHXVkyoJsSfNw/feedshare-shrink_800/B56ZVOwRn8HQAk-/0/1740783034224?e=1743638400&v=beta&t=x7D_K_c5z2wa4xQLXGr2dkhSuf6tqv5uiem0UR_5UXc"
          ],
          "date": "2025-03-02T14:17:35.277Z"
        },
        {
          "captions": "Sierra® E9.6 Ecological Material Handler—built for efficiency and performance⚡️♻️\n\n✅Zero emissions & reduced noise\n\n✅ Energy Plus™ heavy-duty battery for lower operating costs\n\n✅ Unmatched mobility for safe, flexible operation \n\nDesigned for materials like nonferrous metals, cardboard, plastics, and more, the E9.6 is revolutionizing recycling operations! \n\n#SierraE96 #recyclinginnovation #sustainablesolutionsSierra® E9.6 Ecological Material Handler—built for efficiency and performance⚡️♻️\n\n✅Zero emissions & reduced noise\n\n✅ Energy Plus™ heavy-duty battery for lower operating costs\n\n✅ Unmatched mobility for safe, flexible operation \n\nDesigned for materials like nonferrous metals, cardboard, plastics, and more, the E9.6 is revolutionizing recycling operations! \n\n#SierraE96 #recyclinginnovation #sustainablesolutions",
          "likes": "1",
          "time": {
            "raw": "2g",
            "parsed": "01.03.2025",
            "isoString": "2025-03-01T14:17:35.278Z"
          },
          "mediaType": "image",
          "mediaContent": [
            "https://media.licdn.com/dms/image/v2/D5622AQEQt9YMiI8zBA/feedshare-shrink_800/B56ZVNpp3.HQAo-/0/1740764523455?e=1743638400&v=beta&t=TSUDBDTzeG4wPBZtDd5mPcE-UKX4ioDh2Haih_wQu-k",
            "https://media.licdn.com/dms/image/v2/D5622AQHRTBkQS4AWEQ/feedshare-shrink_800/B56ZVNpp3wHQAg-/0/1740764523383?e=1743638400&v=beta&t=U4G6Zph8Yqseu3KiDpYY1ibVOKY49Yeb67NPLnBYmbg",
            "https://media.licdn.com/dms/image/v2/D5622AQEa09hKtNBilA/feedshare-shrink_800/B56ZVNpp3EGsAg-/0/1740764523601?e=1743638400&v=beta&t=fZEgM5hMPICsR_Ui7uBX8vNpnd_5HK_zSUF8g6tHbNs",
            "https://media.licdn.com/dms/image/v2/D5622AQHSs9-YwZHSEA/feedshare-shrink_800/B56ZVNpp4CGsAk-/0/1740764522956?e=1743638400&v=beta&t=iEPYJRC0lgS4mBZZfJh8KBqHC5sdoobR42vzgS6MPx0",
            "https://media.licdn.com/dms/image/v2/D5622AQFbM3f_EKo8TA/feedshare-shrink_800/B56ZVNpp38HEAg-/0/1740764523201?e=1743638400&v=beta&t=KCfLZK3cwVAuDMncS7KleFBaxBEIEByJWb4_5P8JRVk"
          ],
          "date": "2025-03-01T14:17:35.278Z"
        },
        {
          "captions": "Meet Alton Schaubhut ♻️CMC 📌Dallas TX / New Orleans, LA 🎤Team O.G.s\n\n2/2 of the O.G.s! Alton was also a chef on Table Scraps Season 1! He’s bringing his New Oreleans flare to the Chef’s Challenge! Meeting Andrew through REMA & Season 1, they think they have what it takes to win the chef’s challenge…\n\nSee who takes home the Chef’s trophy→ March 14th! 📺Subscribe on Youtube – https://lnkd.in/gBt__iug",
          "likes": "31",
          "comments": "6",
          "shares": "1",
          "time": {
            "raw": "2g",
            "parsed": "01.03.2025",
            "isoString": "2025-03-01T14:17:35.279Z"
          },
          "mediaType": "video",
          "mediaContent": {
            "src": [
              {
                "src": "https://dms.licdn.com/playlist/vid/v2/D5605AQFjtzKx8eV8bw/mp4-720p-30fp-crf28/B56ZVNZ7erGsBg-/0/1740760419333?e=1741618800&v=beta&t=QkSywn5pGnd7pWmGZt-uvfCJ4AYGG1N20pLlyQceJZM",
                "type": "video/mp4",
                "data-bitrate": 1183202
              },
              {
                "src": "https://dms.licdn.com/playlist/vid/v2/D5605AQFjtzKx8eV8bw/mp4-640p-30fp-crf28/B56ZVNZ7erGsBc-/0/1740760417437?e=1741618800&v=beta&t=TF4R-oVltiaCNPCBkV5g9X1somww__B4rIMQ8mZCmcE",
                "type": "video/mp4",
                "data-bitrate": 898784
              }
            ],
            "posterUrl": "https://media.licdn.com/dms/image/v2/D5605AQFjtzKx8eV8bw/videocover-high/B56ZVNZ7erGsBs-/0/1740760413058?e=1741618800&v=beta&t=GNPVHeMLRGku1ItqbtlVLQB3c2afidggonSjlNtbd8w"
          },
          "date": "2025-03-01T14:17:35.279Z"
        },
        {
          "captions": "Season 2 of Table Scraps: The Chef's Challenge is almost here, bringing the recycling community together in a whole new way!\n\nBefore we fire up the kitchen again, have you watched Season 1? 🍴🥩\n\n📺 Catch up now: https://lnkd.in/gxcqsxJS",
          "likes": "12",
          "shares": "2",
          "time": {
            "raw": "3g",
            "parsed": "28.02.2025",
            "isoString": "2025-02-28T14:17:35.280Z"
          },
          "mediaType": "video",
          "mediaContent": {
            "src": [
              {
                "src": "https://dms.licdn.com/playlist/vid/v2/D5605AQEhwbt1g8Vu8w/mp4-720p-30fp-crf28/B56ZVIZVeoGsBg-/0/1740676366300?e=1741618800&v=beta&t=_F6cKPop0fLCxvZiMTI8TwwU425tbkaml6cvvpXqU_g",
                "type": "video/mp4",
                "data-bitrate": 1337622
              },
              {
                "src": "https://dms.licdn.com/playlist/vid/v2/D5605AQEhwbt1g8Vu8w/mp4-640p-30fp-crf28/B56ZVIZVeoGsBc-/0/1740676366368?e=1741618800&v=beta&t=5eYY-QLJn7xQSy7oVtFQsBLGCJsNMsekpGxYWpdE-zo",
                "type": "video/mp4",
                "data-bitrate": 1014901
              }
            ],
            "posterUrl": "https://media.licdn.com/dms/image/v2/D5605AQEhwbt1g8Vu8w/feedshare-thumbnail_720_1280/B56ZVIZVeoGsA8-/0/1740676360868?e=1741618800&v=beta&t=FVlnvhdip_ibNRMD_A2V1yYsyiUIoIv84D3WxsRq92Y"
          },
          "date": "2025-02-28T14:17:35.280Z"
        },
        {
          "captions": "Out in the yard! 🦾 Efficiency you can hear. 🔊♻️ Aluminum radiators baled and ready for recycling—another step in keeping valuable materials in the loop. #SustainableSolutions #RecyclingInAction",
          "likes": "2",
          "time": {
            "raw": "3g4g",
            "parsed": "03.03.2025",
            "isoString": "2025-03-03T14:17:35.281Z"
          },
          "mediaType": "video",
          "mediaContent": {
            "src": [
              {
                "src": "https://dms.licdn.com/playlist/vid/v2/D5605AQGrpZ2FI-kw9g/mp4-720p-30fp-crf28/B56ZVD.qEVGQBg-/0/1740602263147?e=1741618800&v=beta&t=JwK7Jw7JVfnCzWBPmVWRfkG35F354cBYl6iUJeXpuGk",
                "type": "video/mp4",
                "data-bitrate": 1229157
              },
              {
                "src": "https://dms.licdn.com/playlist/vid/v2/D5605AQGrpZ2FI-kw9g/mp4-640p-30fp-crf28/B56ZVD.qEVGQBc-/0/1740602262071?e=1741618800&v=beta&t=JYRTYKEg47xrqaw1VSl1HQ6g2HZF1d_v1h93KBL3uDk",
                "type": "video/mp4",
                "data-bitrate": 925153
              }
            ],
            "posterUrl": "https://media.licdn.com/dms/image/v2/D5605AQGrpZ2FI-kw9g/videocover-high/B56ZVD.qEVGQBs-/0/1740602259719?e=1741618800&v=beta&t=U4sBol9qdoBKIbGADPXCdcZNswcTv1E1ENHbGilxjWo"
          },
          "date": "2025-03-03T14:17:35.281Z"
        },
        {
          "captions": "Efficiency you can hear. 🔊♻️ Aluminum radiators baled and ready for recycling—another step in keeping valuable materials in the loop. #SustainableSolutions #RecyclingInAction",
          "time": {
            "raw": "4g",
            "parsed": "27.02.2025",
            "isoString": "2025-02-27T14:17:35.282Z"
          },
          "mediaType": "video",
          "mediaContent": {
            "src": [
              {
                "src": "https://dms.licdn.com/playlist/vid/v2/D5605AQGrpZ2FI-kw9g/mp4-720p-30fp-crf28/B56ZVD.qEVGQBg-/0/1740602263147?e=1741618800&v=beta&t=JwK7Jw7JVfnCzWBPmVWRfkG35F354cBYl6iUJeXpuGk",
                "type": "video/mp4",
                "data-bitrate": 1229157
              },
              {
                "src": "https://dms.licdn.com/playlist/vid/v2/D5605AQGrpZ2FI-kw9g/mp4-640p-30fp-crf28/B56ZVD.qEVGQBc-/0/1740602262071?e=1741618800&v=beta&t=JYRTYKEg47xrqaw1VSl1HQ6g2HZF1d_v1h93KBL3uDk",
                "type": "video/mp4",
                "data-bitrate": 925153
              }
            ],
            "posterUrl": "https://media.licdn.com/dms/image/v2/D5605AQGrpZ2FI-kw9g/videocover-high/B56ZVD.qEVGQBs-/0/1740602259719?e=1741618800&v=beta&t=U4sBol9qdoBKIbGADPXCdcZNswcTv1E1ENHbGilxjWo"
          },
          "date": "2025-02-27T14:17:35.282Z"
        },
        {
          "captions": "Meet Andrew Lincoln! ♻️Lincoln Recycling 📌Erie, PA 🎤Team O.G.s\n\nAndrew was a chef on Table Scraps Season 1! He’s back & bringing his experience to the Chef’s Challenge! John Sacco & Andrew bonded over their shared love of cooking & food. He’s teamed up with another familiar face: Alton Schaubhut to bring the heat to Bakersfield. (Missing their other teammate Michael Sciaba who couldn’t make it😔)\n\nWatch Andrew cook → March 14th! 📺 Subscribe on Youtube – link in bio!",
          "likes": "47",
          "comments": "8",
          "shares": "2",
          "time": {
            "raw": "4g",
            "parsed": "27.02.2025",
            "isoString": "2025-02-27T14:17:35.282Z"
          },
          "mediaType": "video",
          "mediaContent": {
            "src": [
              {
                "src": "https://dms.licdn.com/playlist/vid/v2/D5605AQFyH_PT1-4aYQ/mp4-720p-30fp-crf28/B56ZVDKeMsHEBk-/0/1740588604050?e=1741618800&v=beta&t=STAkQow_Btxb_4h5RPLyo1w1R-RCNFAFTcfqpE8B0J8",
                "type": "video/mp4",
                "data-bitrate": 892620
              },
              {
                "src": "https://dms.licdn.com/playlist/vid/v2/D5605AQFyH_PT1-4aYQ/mp4-640p-30fp-crf28/B56ZVDKeMsHEBg-/0/1740588609762?e=1741618800&v=beta&t=WuwTv-339q8trz-h7HnQclu2Mz_qbSNI3WI1FDmyCg8",
                "type": "video/mp4",
                "data-bitrate": 678836
              }
            ],
            "posterUrl": "https://media.licdn.com/dms/image/v2/D5605AQFyH_PT1-4aYQ/feedshare-thumbnail_720_1280/B56ZVDKeMsHEBA-/0/1740588574536?e=1741618800&v=beta&t=gZ0izxkEh5jFhPq5KPJsTUPRdMRCZb4Qc0tudMFPpkI"
          },
          "date": "2025-02-27T14:17:35.282Z"
        },
        {
          "captions": "Team OG’s- back for another year, bringing skills, experience, and a whole lot of flavor to the challenge. Are they the ones to beat? 👀\n\nPremiering March 14th—who’s hungry?🍴 \n\n🔔 Don’t miss out, subscribe on YouTube today!\n\n#TableScraps #TheChefsChallenge #RecyclingMeetsCulinary #RecyclingCommunity \nAndrew Lincoln, Alton Schaubhut",
          "likes": "13",
          "comments": "4",
          "shares": "1",
          "time": {
            "raw": "5g",
            "parsed": "26.02.2025",
            "isoString": "2025-02-26T14:17:35.283Z"
          },
          "mediaType": "video",
          "mediaContent": {
            "src": [
              {
                "src": "https://dms.licdn.com/playlist/vid/v2/D5605AQF62KDsDfihbA/mp4-720p-30fp-crf28/B56ZU.vISGGsBg-/0/1740514301701?e=1741618800&v=beta&t=V0O9Twy-VEHA4HZX5ky-VuWQ2JgkPEV97L91Ih8utP0",
                "type": "video/mp4",
                "data-bitrate": 936933
              },
              {
                "src": "https://dms.licdn.com/playlist/vid/v2/D5605AQF62KDsDfihbA/mp4-640p-30fp-crf28/B56ZU.vISGGsBc-/0/1740514301482?e=1741618800&v=beta&t=2dIZPcXPqHVsXc-9f666mxJVVmiUM0UwGEClBYD_C_Q",
                "type": "video/mp4",
                "data-bitrate": 721512
              }
            ],
            "posterUrl": "https://media.licdn.com/dms/image/v2/D5605AQF62KDsDfihbA/videocover-high/B56ZU.vISGGsBs-/0/1740514300877?e=1741618800&v=beta&t=bTpAkq5Z2zYocZvxfln-lf8gIOi_4IzW_wX4ZzZ3uys"
          },
          "date": "2025-02-26T14:17:35.283Z"
        },
        {
          "captions": "The Sierra S5000 baler makes a compact stainless steel bale, there is nothing that competes with this unit !!! \n\n#sierrainternationalmachinery\n#scrapmetal #recycledmaterials\n#portablebaler #amplirollsystemThe Sierra S5000 baler makes a compact stainless steel bale, there is nothing that competes with this unit !!! \n\n#sierrainternationalmachinery\n#scrapmetal #recycledmaterials\n#portablebaler #amplirollsystem",
          "likes": "16",
          "shares": "1",
          "time": {
            "raw": "5g",
            "parsed": "26.02.2025",
            "isoString": "2025-02-26T14:17:35.285Z"
          },
          "mediaType": "image",
          "mediaContent": [
            "https://media.licdn.com/dms/image/v2/D4D22AQH-gASDuzg16g/feedshare-shrink_800/B4DZU.jA4nGcAk-/0/1740511126491?e=1743638400&v=beta&t=qToqjWEviS0VG38PvmrI0o7Bic-jUeZZTKNNbfCA9ww",
            "https://media.licdn.com/dms/image/v2/D4D22AQFuCtGh1Xccgg/feedshare-shrink_800/B4DZU.jA3bHkAk-/0/1740511126081?e=1743638400&v=beta&t=i58kRgtFcqafQyuyKNAvwuxNA5e--gfR9IpBfAN8qmA",
            "https://media.licdn.com/dms/image/v2/D4D22AQESkJrlDvSL4Q/feedshare-shrink_800/B4DZU.jA4SGcAg-/0/1740511125803?e=1743638400&v=beta&t=D-PyVuV73JnNNauafltVaxCKP-2_m1vO7fIiRZJCuqM"
          ],
          "date": "2025-02-26T14:17:35.285Z"
        },
        {
          "captions": "Reb-1 baler heading to recycling facility in the NE where it will be processing plastic and aluminum cans to then be repurposed into new products ♻️✅Sierra International MachineryReb-1 baler heading to recycling facility in the NE where it will be processing plastic and aluminum cans to then be repurposed into new products ♻️✅Sierra International Machinery",
          "likes": "18",
          "comments": "1",
          "shares": "1",
          "time": {
            "raw": "5g",
            "parsed": "26.02.2025",
            "isoString": "2025-02-26T14:17:35.286Z"
          },
          "mediaType": "image",
          "mediaContent": [
            "https://media.licdn.com/dms/image/v2/D4E22AQHMPZpIDfVW1Q/feedshare-shrink_800/B4EZU.TQa3H0Ak-/0/1740506992724?e=1743638400&v=beta&t=RpxAvfzaTru1siWrzG_eOY1GprOavwzzu7TUopIeIrU",
            "https://media.licdn.com/dms/image/v2/D4E22AQGeeq9Dmbg4cw/feedshare-shrink_800/B4EZU.TQb9HMAg-/0/1740506993651?e=1743638400&v=beta&t=pDkQCxDo-FAsYiIodMx2HR2M6tGOe_E6uSiOLtxoOk4"
          ],
          "date": "2025-02-26T14:17:35.286Z"
        },
        {
          "captions": "The Sierra® RB6000: Unmatched Power & Performance. ♻️\n\nWhen it comes to baling and logging, the RB6000 sets the standard:\n\n✅ Most powerful in its class\n\n✅ Handles up to 32 tons per hour\n\n✅ Mill-spec bales & high-density logging\n\n✅ Built to last with Hardox® 450 liners\n\nWith a 170 HP Cummins Turbo Diesel Engine and an industry-leading crane, this machine is designed for maximum efficiency and reliability.\n\n📩 Ready to upgrade your operation? Reach out today!\n\n🔗 https://lnkd.in/gZ5HMB9P\n\n#RB6000 #RecyclingIndustry #HeavyMachinery #Efficiency #BuiltToWork",
          "likes": "3",
          "time": {
            "raw": "5g",
            "parsed": "26.02.2025",
            "isoString": "2025-02-26T14:17:35.288Z"
          },
          "mediaType": "video",
          "mediaContent": {
            "src": [
              {
                "src": "https://dms.licdn.com/playlist/vid/v2/D5605AQEQy8nN9Xm6ow/mp4-640p-30fp-crf28/B56ZU98dOkHEBc-/0/1740501020955?e=1741618800&v=beta&t=CFx1PFucpyePQzu_zROqPXO4j46B2cGLzmp9M1ozQGs",
                "type": "video/mp4",
                "data-bitrate": 1084675
              },
              {
                "src": "https://dms.licdn.com/playlist/vid/v2/D5605AQEQy8nN9Xm6ow/mp4-720p-30fp-crf28/B56ZU98dOkHEBg-/0/1740501022032?e=1741618800&v=beta&t=gguUQF3vNXE0LgFWl41Fryy1do6IAvCOAAJVXZ48DuI",
                "type": "video/mp4",
                "data-bitrate": 1411652
              }
            ],
            "posterUrl": "https://media.licdn.com/dms/image/v2/D5605AQEQy8nN9Xm6ow/videocover-high/B56ZU98dOkHEBs-/0/1740501019142?e=1741618800&v=beta&t=giPXwNs-9fqyD_JMrHizaHkm6I0Tloh-N8ZOFIm-ih0"
          },
          "date": "2025-02-26T14:17:35.288Z"
        },
        {
          "captions": "Every great dish starts with a story—just like Table Scraps: The Chef’s Challenge did. 🍽️♻️\n\nJohn Sacco breaks down the ‘why’ behind this one-of-a-kind competition: bringing people from all over the world together through the shared bond of recycled materials & food. \n\nYear 2 kicked it up a notch! These foodies will be throwing down their best dishes – find out who has what it takes to win → March 14th 📆\n\n📺 Subscribe on Youtube – link in bio! \n\n#TableScraps #ChefsChallenge #Sustainability #Recycling #foodies",
          "likes": "30",
          "comments": "2",
          "shares": "3",
          "time": {
            "raw": "6g",
            "parsed": "25.02.2025",
            "isoString": "2025-02-25T14:17:35.289Z"
          },
          "mediaType": "video",
          "mediaContent": {
            "src": [
              {
                "src": "https://dms.licdn.com/playlist/vid/v2/D4D05AQGEdiQ_a81dzA/mp4-720p-30fp-crf28/B4DZU5E.7yG8Bg-/0/1740419382172?e=1741618800&v=beta&t=kgmZOugHAiwZWPZfucqOuUm3Kom56U-YlE_gypgQKhk",
                "type": "video/mp4",
                "data-bitrate": 1340348
              },
              {
                "src": "https://dms.licdn.com/playlist/vid/v2/D4D05AQGEdiQ_a81dzA/mp4-640p-30fp-crf28/B4DZU5E.7yG8Bc-/0/1740419381833?e=1741618800&v=beta&t=wt5Y3T7Y_Xm0MHGCOl_d6hKhSOXg8k1MZaq4B_iPC2A",
                "type": "video/mp4",
                "data-bitrate": 1012092
              }
            ],
