[
  {
    "captions": "Exciting new 1400 ton Shear for our recycling facility in Bakersfield !On Location in Mozzecane Italy!!\n\nIt was exciting to see our new 1400ton Shear being loaded out for our own facility Sierra Recycling & Demolition!!!!\n\nCan’t wait for its arrival!!!",
    "likes": "45",
    "comments": "4",
    "shares": "5",
    "time": {
      "raw": "1ay1ay",
      "parsed": "07.04.2025",
      "isoString": "2025-04-07T05:41:48.181Z"
    },
    "mediaType": "video",
    "mediaContent": {
      "src": [
        {
          "src": "https://dms.licdn.com/playlist/vid/v2/D5605AQFJgP7A2Of8lQ/mp4-640p-30fp-crf28/B56ZTvpPVqHEBc-/0/1739187379825?e=1744610400&v=beta&t=Cpou11C0crgHs7-5I4YDe2l2wIs994aCJKta5WEK8fI",
          "type": "video/mp4",
          "data-bitrate": 610370
        },
        {
          "src": "https://dms.licdn.com/playlist/vid/v2/D5605AQFJgP7A2Of8lQ/mp4-720p-30fp-crf28/B56ZTvpPVqHEBg-/0/1739187380483?e=1744610400&v=beta&t=OFK5ZhYnTlLdf8VmtTUeWL__ODJsfoC857pw-ro-erU",
          "type": "video/mp4",
          "data-bitrate": 833042
        }
      ],
      "posterUrl": "https://media.licdn.com/dms/image/v2/D5605AQFJgP7A2Of8lQ/videocover-low/B56ZTvpPVqHECM-/0/1739187374832?e=1744610400&v=beta&t=-SMDdGJLKVN4qPhPmbXDdivp2hhW9F_smDMboQtY0oQ"
    },
    "date": "2025-04-07T05:41:48.181Z"
  },
  {
    "captions": "On Location in Mozzecane Italy!!\n\nIt was exciting to see our new 1400ton Shear being loaded out for our own facility Sierra Recycling & Demolition!!!!\n\nCan’t wait for its arrival!!!",
    "time": {
      "raw": "1ay",
      "parsed": "07.03.2025",
      "isoString": "2025-03-07T05:41:48.182Z"
    },
    "mediaType": "video",
    "mediaContent": {
      "src": [
        {
          "src": "https://dms.licdn.com/playlist/vid/v2/D5605AQFJgP7A2Of8lQ/mp4-640p-30fp-crf28/B56ZTvpPVqHEBc-/0/1739187379825?e=1744610400&v=beta&t=Cpou11C0crgHs7-5I4YDe2l2wIs994aCJKta5WEK8fI",
          "type": "video/mp4",
          "data-bitrate": 610370
        },
        {
          "src": "https://dms.licdn.com/playlist/vid/v2/D5605AQFJgP7A2Of8lQ/mp4-720p-30fp-crf28/B56ZTvpPVqHEBg-/0/1739187380483?e=1744610400&v=beta&t=OFK5ZhYnTlLdf8VmtTUeWL__ODJsfoC857pw-ro-erU",
          "type": "video/mp4",
          "data-bitrate": 833042
        }
      ],
      "posterUrl": "https://media.licdn.com/dms/image/v2/D5605AQFJgP7A2Of8lQ/videocover-low/B56ZTvpPVqHECM-/0/1739187374832?e=1744610400&v=beta&t=-SMDdGJLKVN4qPhPmbXDdivp2hhW9F_smDMboQtY0oQ"
    },
    "date": "2025-03-07T05:41:48.182Z"
  },
  {
    "captions": "Venerdì abbiamo avuto  l’ultimo di 3 incontri con i ragazzi delle scuole secondarie di primo grado di Mozzecane e Nogarole Rocca. I ragazzi, divisi a gruppi, hanno visitato l’officina e gli uffici della ditta dove sono state spiegate loro le varie figure professionali. Il tutto nell’ottica della scelta della corretta scuola secondaria di secondo grado. I ragazzi, accompagnati dai professori, hanno mostrato interesse e fatto domande. Speriamo di essere stati d’aiuto nella scelta del loro percorso di studi che li preparerà alla vita lavorativa. In bocca al lupo ragazzi!Venerdì abbiamo avuto  l’ultimo di 3 incontri con i ragazzi delle scuole secondarie di primo grado di Mozzecane e Nogarole Rocca. I ragazzi, divisi a gruppi, hanno visitato l’officina e gli uffici della ditta dove sono state spiegate loro le varie figure professionali. Il tutto nell’ottica della scelta della corretta scuola secondaria di secondo grado. I ragazzi, accompagnati dai professori, hanno mostrato interesse e fatto domande. Speriamo di essere stati d’aiuto nella scelta del loro percorso di studi che li preparerà alla vita lavorativa. In bocca al lupo ragazzi!",
    "likes": "27",
    "time": {
      "raw": "4ay",
      "parsed": "07.12.2024",
      "isoString": "2024-12-07T05:41:48.187Z"
    },
    "mediaType": "image",
    "mediaContent": [
      "https://media.licdn.com/dms/image/v2/D5622AQFR1Y-7lGi3Pg/feedshare-shrink_800/feedshare-shrink_800/0/1731942602714?e=1746662400&v=beta&t=ouE9wV8S_4TwKrXimpO37IeZgSKy5xxZOPc7HeiRBv4",
      "https://media.licdn.com/dms/image/v2/D5622AQGDbGjPJ8SJjA/feedshare-shrink_800/feedshare-shrink_800/0/1731942602790?e=1746662400&v=beta&t=XPkTyr2AkiIcEfnhBmbmGUteM6FEAyOhpOHd4RVXXY4",
      "https://media.licdn.com/dms/image/v2/D5622AQF4q8J_cEVbzQ/feedshare-shrink_800/feedshare-shrink_800/0/1731942602558?e=1746662400&v=beta&t=KMAKJGn2acI_nKhABh01xsQVUvX-xoY8xNS_SYEuw0c"
    ],
    "date": "2024-12-07T05:41:48.187Z"
  },
  {
    "captions": "Saremo presenti ad Ecomondo 2024, dal 5 all’8 Novembre. Ci troverete al Rimini Expo Centre, Hall C3, Stand 301. Non mancate!\n\nWe will be at Ecomondo 2024, from 5th to 8th November. You will find us at Rimini Expo Centre, Hall C3, Stand 301. Be there!\n\n#ecomondo #idromec #shearbaler #recyclingSaremo presenti ad Ecomondo 2024, dal 5 all’8 Novembre. Ci troverete al Rimini Expo Centre, Hall C3, Stand 301. Non mancate!\n\nWe will be at Ecomondo 2024, from 5th to 8th November. You will find us at Rimini Expo Centre, Hall C3, Stand 301. Be there!\n\n#ecomondo #idromec #shearbaler #recycling",
    "likes": "10",
    "shares": "1",
    "time": {
      "raw": "5ay",
      "parsed": "07.11.2024",
      "isoString": "2024-11-07T05:41:48.189Z"
    },
    "mediaType": "image",
    "mediaContent": [
      "https://media.licdn.com/dms/image/v2/D4D22AQGn9yC8IazGhA/feedshare-shrink_800/feedshare-shrink_800/0/1730667175460?e=1746662400&v=beta&t=VXTzsPSQyVTwgMnSoD28LLPCdYDgcm8n3kNoi7yryTU"
    ],
    "date": "2024-11-07T05:41:48.189Z"
  },
  {
    "likes": "14",
    "comments": "2",
    "time": {
      "raw": "8ay",
      "parsed": "07.08.2024",
      "isoString": "2024-08-07T05:41:48.191Z"
    },
    "mediaType": "image",
    "mediaContent": [
      "https://media.licdn.com/dms/image/v2/D4D22AQFSEU_gXbc6Ag/feedshare-shrink_800/feedshare-shrink_800/0/1722880521861?e=1746662400&v=beta&t=ghVT9jurwX2rEdv8IiD38IRLbcaN1fKlh67xctF0gx8"
    ],
    "date": "2024-08-07T05:41:48.191Z"
  },
  {
    "captions": "11st July 1969: exactly 55 years ago Idromec was born.\nHere’s a pic from the early 80s\n#idromec #shearbaler #recycling11st July 1969: exactly 55 years ago Idromec was born.\nHere’s a pic from the early 80s\n#idromec #shearbaler #recycling",
    "likes": "28",
    "shares": "2",
    "time": {
      "raw": "8ay",
      "parsed": "07.08.2024",
      "isoString": "2024-08-07T05:41:48.193Z"
    },
    "mediaType": "image",
    "mediaContent": [
      "https://media.licdn.com/dms/image/v2/D4D22AQEOPJl_NH_Nuw/feedshare-shrink_800/feedshare-shrink_800/0/1720711243102?e=1746662400&v=beta&t=lQQhluFcMa7yUDvVDj7ZMjfsiY48LOM0SZodkMkfosU"
    ],
    "date": "2024-08-07T05:41:48.193Z"
  },
  {
    "captions": "Last day in IFAT!!! You can find us at Hall C5 stand 328!\n#ifat #shearbaler #idromec #recycling",
    "likes": "16",
    "comments": "2",
    "shares": "1",
    "time": {
      "raw": "10ay",
      "parsed": "07.06.2024",
      "isoString": "2024-06-07T05:41:48.194Z"
    },
    "mediaType": "video",
    "mediaContent": {
      "src": [
        {
          "src": "https://dms.licdn.com/playlist/vid/v2/D4D05AQHd08j_AhLPcg/feedshare-ambry-analyzed_servable_progressive_video/feedshare-ambry-analyzed_servable_progressive_video/0/1715939640900?e=1744610400&v=beta&t=jaeYYQ1QyAbhNKBVCXBj7zPxcVP2ArpWDbQ3SezUwtk",
          "type": "video/quicktime",
          "data-bitrate": 14993888
        },
        {
          "src": "https://dms.licdn.com/playlist/vid/v2/D4D05AQHd08j_AhLPcg/mp4-640p-30fp-crf28/mp4-640p-30fp-crf28/0/1715939657955?e=1744610400&v=beta&t=D24_-PMVkBoX5BNz_6EIHhSw2AQlKK3n89wdMPInatg",
          "type": "video/mp4",
          "data-bitrate": 812715
        },
        {
          "src": "https://dms.licdn.com/playlist/vid/v2/D4D05AQHd08j_AhLPcg/mp4-720p-30fp-crf28/mp4-720p-30fp-crf28/0/1715939657894?e=1744610400&v=beta&t=EBJf73-2mCnlGBlqpYszU8zh9M2tSfbATZ-qNDPm6ME",
          "type": "video/mp4",
          "data-bitrate": 1136998
        }
      ],
      "posterUrl": "https://media.licdn.com/dms/image/v2/D4D05AQHd08j_AhLPcg/videocover-high/videocover-high/0/1715939642735?e=1744610400&v=beta&t=Mxk4XD_0Hl0EjgfnQWBj9F6Cu8vbZJ96s8dOY2vvTC8"
    },
    "date": "2024-06-07T05:41:48.194Z"
  },
  {
    "captions": "4th day at IFAT 2024! Visit us at Hall C5, stand 328!\n#ifat #shearbaler #idromec #recycling4th day at IFAT 2024! Visit us at Hall C5, stand 328!\n#ifat #shearbaler #idromec #recycling",
    "likes": "16",
    "shares": "2",
    "time": {
      "raw": "10ay",
      "parsed": "07.06.2024",
      "isoString": "2024-06-07T05:41:48.195Z"
    },
    "mediaType": "image",
    "mediaContent": [
      "https://media.licdn.com/dms/image/v2/D4D22AQFBVLE0qQ1u6g/feedshare-shrink_800/feedshare-shrink_800/0/1715872649696?e=1746662400&v=beta&t=cetcsjQOx0C7w5VNAO9eXAP34QisMKxS9CskKObI0Zw",
      "https://media.licdn.com/dms/image/v2/D4D22AQGDN7ntpRg0aw/feedshare-shrink_800/feedshare-shrink_800/0/1715872650289?e=1746662400&v=beta&t=fzW-1ZibMuO4DlauNjwpflho_kYj15naBSn-VQStN28",
      "https://media.licdn.com/dms/image/v2/D4D22AQE4zGmaAcUpCQ/feedshare-shrink_800/feedshare-shrink_800/0/1715872650065?e=1746662400&v=beta&t=xFrWSStBBFrdKZrAEgaT1iqiUiScFXjIdguKrQNCJhs",
      "https://media.licdn.com/dms/image/v2/D4D22AQETq5NINzJ7xg/feedshare-shrink_800/feedshare-shrink_800/0/1715872650292?e=1746662400&v=beta&t=zSNefUko_I-QdaaK5tzqJqVJV1nCjD-TvyKpKXsNkIs"
    ],
    "date": "2024-06-07T05:41:48.195Z"
  },
  {
    "captions": "IFAT day 2: visit us at Hall C5 stand 328! We will show you our balers and shearbalers!\n#ifat #shearbaler #idromec #recyclingIFAT day 2: visit us at Hall C5 stand 328! We will show you our balers and shearbalers!\n#ifat #shearbaler #idromec #recycling",
    "likes": "9",
    "comments": "1",
    "time": {
      "raw": "10ay",
      "parsed": "07.06.2024",
      "isoString": "2024-06-07T05:41:48.196Z"
    },
    "mediaType": "image",
    "mediaContent": [
      "https://media.licdn.com/dms/image/v2/D4D22AQG_SjHZQAWEzQ/feedshare-shrink_800/feedshare-shrink_800/0/1715691824133?e=1746662400&v=beta&t=vC2u6aNEyyofBzVNm3Vn4U0ZJ5VxJBwbAW-Vr8PbEYI",
      "https://media.licdn.com/dms/image/v2/D4D22AQGHzJSNEgOKyQ/feedshare-shrink_800/feedshare-shrink_800/0/1715691826502?e=1746662400&v=beta&t=0PCW4M0LzhtRUPSGsqBS5jjU30q4t0lg0l19QZ3gHco",
      "https://media.licdn.com/dms/image/v2/D4D22AQGyaYemQvGn4g/feedshare-shrink_800/feedshare-shrink_800/0/1715691826522?e=1746662400&v=beta&t=lIFpzcKerwgMIcS-VfEeK5WUdBM-dhNKPomC7N9l_MY",
      "https://media.licdn.com/dms/image/v2/D4D22AQHn0Mln-Hy26Q/feedshare-shrink_800/feedshare-shrink_800/0/1715691825438?e=1746662400&v=beta&t=1RmqFp4y-FZuD1wi3Q0whLfw3QBYlat9gTJX6_621-Y"
    ],
    "date": "2024-06-07T05:41:48.196Z"
  },
  {
    "captions": "Are you ready? You can find us at Hall C5 stand 328!\n\n#idromec #shearbaler #ifat #recyclingAre you ready? You can find us at Hall C5 stand 328!\n\n#idromec #shearbaler #ifat #recycling",
    "likes": "16",
    "time": {
      "raw": "10ay",
      "parsed": "07.06.2024",
      "isoString": "2024-06-07T05:41:48.197Z"
    },
    "mediaType": "image",
    "mediaContent": [
      "https://media.licdn.com/dms/image/v2/D4D22AQF12pQKjwYrGg/feedshare-shrink_800/feedshare-shrink_800/0/1715588784121?e=1746662400&v=beta&t=_JK1_OwDL-u-LTWREvPkxjR-ggun4Fc7C5FyiPhnvIk",
      "https://media.licdn.com/dms/image/v2/D4D22AQGikCnZ2jHaLw/feedshare-shrink_800/feedshare-shrink_800/0/1715588781704?e=1746662400&v=beta&t=2ykhHd9ycRsZP5TUR6K4BhpQly2IjegWOseRnitZTOc",
      "https://media.licdn.com/dms/image/v2/D4D22AQGS4YrZf187rg/feedshare-shrink_800/feedshare-shrink_800/0/1715588780834?e=1746662400&v=beta&t=eJuF2GZVwtnkSUNZI-X72KokOFGcLsUhVIZk74oaDiU"
    ],
    "date": "2024-06-07T05:41:48.197Z"
  },
  {
    "captions": "IFAT 2024 | 13-17 Maggio\nEccoci anche quest’anno alla fiera internazionale leader per la gestione dei rifiuti e delle materie prime. Venite a trovarci al Centro Fieristico di Monaco di Baviera, Hall C5 – Stand 328!\n \nIFAT 2024 | May 13-17\nHere we are once again at the world’s leading trade fair for waste and raw materials management.\nCome and visit us at the Munich Trade Fair Center, Hall C5 – Booth 328!\n\n#ifat #idromec #shearbaler #recyclingIFAT 2024 | 13-17 Maggio\nEccoci anche quest’anno alla fiera internazionale leader per la gestione dei rifiuti e delle materie prime. Venite a trovarci al Centro Fieristico di Monaco di Baviera, Hall C5 – Stand 328!\n \nIFAT 2024 | May 13-17\nHere we are once again at the world’s leading trade fair for waste and raw materials management.\nCome and visit us at the Munich Trade Fair Center, Hall C5 – Booth 328!\n\n#ifat #idromec #shearbaler #recycling",
    "likes": "18",
    "shares": "1",
    "time": {
      "raw": "11ay",
      "parsed": "07.05.2024",
      "isoString": "2024-05-07T05:41:48.198Z"
    },
    "mediaType": "image",
    "mediaContent": [
      "https://media.licdn.com/dms/image/v2/D4E22AQEm8XTOITdtyw/feedshare-shrink_800/feedshare-shrink_800/0/1715092209459?e=1746662400&v=beta&t=wyjkO8GG1jIiUCTukNQ_DCPrUoBlAnr70iSTA9fzbYw"
    ],
    "date": "2024-05-07T05:41:48.198Z"
  },
  {
    "captions": "Visit us at Booth B6!\n#isri #idromec #shearbaler #recyclingVisit us at Booth B6!\n#isri #idromec #shearbaler #recycling",
    "likes": "12",
    "time": {
      "raw": "11ay",
      "parsed": "07.05.2024",
      "isoString": "2024-05-07T05:41:48.200Z"
    },
    "mediaType": "image",
    "mediaContent": [
      "https://media.licdn.com/dms/image/v2/D4D22AQEB2HHkHoFISQ/feedshare-shrink_800/feedshare-shrink_800/0/1713381796898?e=1746662400&v=beta&t=XjEBpsS1eIm2spOsLzP1sP-BZw1l29EwANjrRLUsVu0",
      "https://media.licdn.com/dms/image/v2/D4D22AQF4QvED2J-fHQ/feedshare-shrink_800/feedshare-shrink_800/0/1713381796347?e=1746662400&v=beta&t=1C0WZ5peVIHeqkLQh_Oi5_I92xActDs2q62fSjHXOfA"
    ],
    "date": "2024-05-07T05:41:48.200Z"
  },
  {
    "captions": "Ready to startViva ISRI! We are ready for you!",
    "time": {
      "raw": "11ay11ay",
      "parsed": "07.04.2025",
      "isoString": "2025-04-07T05:41:48.201Z"
    },
    "mediaType": "video",
    "mediaContent": {
      "src": [
        {
          "src": "https://dms.licdn.com/playlist/vid/v2/D5605AQHjtUsPOmWqKg/feedshare-ambry-analyzed_servable_progressive_video/feedshare-ambry-analyzed_servable_progressive_video/0/1713225575593?e=1744610400&v=beta&t=2AdLjjcZRzBojt2y2Z42Eprcxg5ePXU4k8pWDeKjdbU",
          "type": "video/quicktime",
          "data-bitrate": 12784870
        },
        {
          "src": "https://dms.licdn.com/playlist/vid/v2/D5605AQHjtUsPOmWqKg/mp4-640p-30fp-crf28/mp4-640p-30fp-crf28/0/1713225578724?e=1744610400&v=beta&t=FK0pe8OK10owMG54AtC6v7FmzJaViBxUJy9eOXqdumA",
          "type": "video/mp4",
          "data-bitrate": 1176888
        },
        {
          "src": "https://dms.licdn.com/playlist/vid/v2/D5605AQHjtUsPOmWqKg/mp4-720p-30fp-crf28/mp4-720p-30fp-crf28/0/1713225579450?e=1744610400&v=beta&t=OSWwTXpfAUqS4H8jpqm-Y7J63MXPOpjMiu-ymozyHUY",
          "type": "video/mp4",
          "data-bitrate": 1547287
        }
      ],
      "posterUrl": "https://media.licdn.com/dms/image/v2/D5605AQHjtUsPOmWqKg/videocover-high/videocover-high/0/1713225574224?e=1744610400&v=beta&t=8NMEHan-TYO6a1tP7YgfPaLO1H49jEuymL0S7NEZstc"
    },
    "date": "2025-04-07T05:41:48.201Z"
  },
  {
    "captions": "Viva ISRI! We are ready for you!",
    "time": {
      "raw": "11ay",
      "parsed": "07.05.2024",
      "isoString": "2024-05-07T05:41:48.201Z"
    },
    "mediaType": "video",
    "mediaContent": {
      "src": [
        {
          "src": "https://dms.licdn.com/playlist/vid/v2/D5605AQHjtUsPOmWqKg/feedshare-ambry-analyzed_servable_progressive_video/feedshare-ambry-analyzed_servable_progressive_video/0/1713225575593?e=1744610400&v=beta&t=2AdLjjcZRzBojt2y2Z42Eprcxg5ePXU4k8pWDeKjdbU",
          "type": "video/quicktime",
          "data-bitrate": 12784870
        },
        {
          "src": "https://dms.licdn.com/playlist/vid/v2/D5605AQHjtUsPOmWqKg/mp4-640p-30fp-crf28/mp4-640p-30fp-crf28/0/1713225578724?e=1744610400&v=beta&t=FK0pe8OK10owMG54AtC6v7FmzJaViBxUJy9eOXqdumA",
          "type": "video/mp4",
          "data-bitrate": 1176888
        },
        {
          "src": "https://dms.licdn.com/playlist/vid/v2/D5605AQHjtUsPOmWqKg/mp4-720p-30fp-crf28/mp4-720p-30fp-crf28/0/1713225579450?e=1744610400&v=beta&t=OSWwTXpfAUqS4H8jpqm-Y7J63MXPOpjMiu-ymozyHUY",
          "type": "video/mp4",
          "data-bitrate": 1547287
        }
      ],
      "posterUrl": "https://media.licdn.com/dms/image/v2/D5605AQHjtUsPOmWqKg/videocover-high/videocover-high/0/1713225574224?e=1744610400&v=beta&t=8NMEHan-TYO6a1tP7YgfPaLO1H49jEuymL0S7NEZstc"
    },
    "date": "2024-05-07T05:41:48.201Z"
  },
  {
    "captions": "Almost ready to start at the Mandalay Bay Convention Center !!Almost ready to start at the Mandalay Bay Convention Center !!",
    "likes": "16",
    "shares": "1",
    "time": {
      "raw": "11ay",
      "parsed": "07.05.2024",
      "isoString": "2024-05-07T05:41:48.202Z"
    },
    "mediaType": "image",
    "mediaContent": [
      "https://media.licdn.com/dms/image/v2/D4D22AQE9QcfvqFL5IQ/feedshare-shrink_800/feedshare-shrink_800/0/1713180189376?e=1746662400&v=beta&t=ZCQjzOP_wzLqaRjhCj3hbUw4UCn7T25xqmzWjaSHkbE",
      "https://media.licdn.com/dms/image/v2/D4D22AQHqYaV6zSdVzg/feedshare-shrink_800/feedshare-shrink_800/0/1713180185607?e=1746662400&v=beta&t=FDgODfAz1nK4fwpT-quQDmLrobAtYUpS2jk7r2v5-K0",
      "https://media.licdn.com/dms/image/v2/D4D22AQEB-8nFf_Udng/feedshare-shrink_800/feedshare-shrink_800/0/1713180188767?e=1746662400&v=beta&t=5WyYxB_SwD4c98HTiWfn9bU-Rxw2LCxZjF5tmKke_AI"
    ],
    "date": "2024-05-07T05:41:48.202Z"
  },
  {
    "captions": "Happy Easter!\n#idromec #shearbaler #recycling #peaceHappy Easter!\n#idromec #shearbaler #recycling #peace",
    "likes": "4",
    "time": {
      "raw": "11ay",
      "parsed": "26.04.2024",
      "isoString": "2024-04-26T05:23:45.617Z"
    },
    "mediaType": "image",
    "mediaContent": [
      "https://media.licdn.com/dms/image/v2/D4D22AQGBln2c_CLLEw/feedshare-shrink_800/feedshare-shrink_800/0/1711874287092?e=1746057600&v=beta&t=vYZTCPw3w9HVsE63tP3-bV66ea6EFTQoHErhJmuE6VY"
    ],
    "date": "2024-04-26T05:23:45.617Z"
  },
  {
    "captions": "It’always a pleasure to meet you and Jose Pereyra!Spent a wonderful day with Olivo Tabarelli, the founder of IDROMEC SPA , a man who’s been my mentor and friend for 40 years!!\n\nThey just don’t make them like him anymore! \n\n#mentor #friendSpent a wonderful day with Olivo Tabarelli, the founder of IDROMEC SPA , a man who’s been my mentor and friend for 40 years!!\n\nThey just don’t make them like him anymore! \n\n#mentor #friend",
    "likes": "11",
    "time": {
      "raw": "12ay12ay",
      "parsed": "17.03.2025",
      "isoString": "2025-03-17T05:07:24.299Z"
    },
    "mediaType": "image",
    "mediaContent": [
      "https://media.licdn.com/dms/image/v2/D4D22AQHUmSrlzva4Jg/feedshare-shrink_800/feedshare-shrink_800/0/1710918869870?e=1744848000&v=beta&t=M76TQyq-S_NZ0FttVfhlnIlP3NMdRnEmJMV8lC_TrVo",
      "https://media.licdn.com/dms/image/v2/D4D22AQFoFERV18sIVw/feedshare-shrink_800/feedshare-shrink_800/0/1710918873460?e=1744848000&v=beta&t=jrKAKYM2j-WljnEnsQ3Kge5_0zA0Tnx1_LU0uhJEaHA",
      "https://media.licdn.com/dms/image/v2/D4D22AQFv-YvOSDfSeA/feedshare-shrink_800/feedshare-shrink_800/0/1710918872422?e=1744848000&v=beta&t=ChVlnz2LOvATrzu2js-g3hKNXcRVbW6XED2_RMH1l2U",
      "https://media.licdn.com/dms/image/v2/D4D22AQGlH5J_bjoE_Q/feedshare-shrink_800/feedshare-shrink_800/0/1710918873250?e=1744848000&v=beta&t=wbEKlRoVYM-bvm1_vGCFTdEXjskmcZAouY5X01HX_ls",
      "https://media.licdn.com/dms/image/v2/D4D22AQFAy6gxE3VWuA/feedshare-shrink_800/feedshare-shrink_800/0/1710918869086?e=1744848000&v=beta&t=a6NTlvVDla41XPNgb0JufeAsYiDV1yTtGXUv63gkjVc"
    ],
    "date": "2025-03-17T05:07:24.299Z"
  },
  {
    "captions": "Spent a wonderful day with Olivo Tabarelli, the founder of IDROMEC SPA , a man who’s been my mentor and friend for 40 years!!\n\nThey just don’t make them like him anymore! \n\n#mentor #friendSpent a wonderful day with Olivo Tabarelli, the founder of IDROMEC SPA , a man who’s been my mentor and friend for 40 years!!\n\nThey just don’t make them like him anymore! \n\n#mentor #friend",
    "likes": "11",
    "time": {
      "raw": "12ay",
      "parsed": "17.03.2024",
      "isoString": "2024-03-17T05:07:24.300Z"
    },
    "mediaType": "image",
    "mediaContent": [
      "https://media.licdn.com/dms/image/v2/D4D22AQHUmSrlzva4Jg/feedshare-shrink_800/feedshare-shrink_800/0/1710918869870?e=1744848000&v=beta&t=M76TQyq-S_NZ0FttVfhlnIlP3NMdRnEmJMV8lC_TrVo",
      "https://media.licdn.com/dms/image/v2/D4D22AQFoFERV18sIVw/feedshare-shrink_800/feedshare-shrink_800/0/1710918873460?e=1744848000&v=beta&t=jrKAKYM2j-WljnEnsQ3Kge5_0zA0Tnx1_LU0uhJEaHA",
      "https://media.licdn.com/dms/image/v2/D4D22AQFv-YvOSDfSeA/feedshare-shrink_800/feedshare-shrink_800/0/1710918872422?e=1744848000&v=beta&t=ChVlnz2LOvATrzu2js-g3hKNXcRVbW6XED2_RMH1l2U",
      "https://media.licdn.com/dms/image/v2/D4D22AQGlH5J_bjoE_Q/feedshare-shrink_800/feedshare-shrink_800/0/1710918873250?e=1744848000&v=beta&t=wbEKlRoVYM-bvm1_vGCFTdEXjskmcZAouY5X01HX_ls",
      "https://media.licdn.com/dms/image/v2/D4D22AQFAy6gxE3VWuA/feedshare-shrink_800/feedshare-shrink_800/0/1710918869086?e=1744848000&v=beta&t=a6NTlvVDla41XPNgb0JufeAsYiDV1yTtGXUv63gkjVc"
    ],
    "date": "2024-03-17T05:07:24.300Z"
  },
  {
    "captions": "Olivo Tabarelli, 93 years old, with over 70 years dedicated to the companies he built alongside his brother Luigi (Tabarelli spa in 1949 and Idromec spa in 1969). Every day. A lifetime where work was not just a duty, but a testament to responsibility and passion.Olivo Tabarelli, 93 years old, with over 70 years dedicated to the companies he built alongside his brother Luigi (Tabarelli spa in 1949 and Idromec spa in 1969). Every day. A lifetime where work was not just a duty, but a testament to responsibility and passion.",
    "likes": "112",
    "comments": "2",
    "shares": "1",
    "time": {
      "raw": "3h",
      "parsed": "17.03.2025",
      "isoString": "2025-03-17T05:41:48.179Z"
    },
    "mediaType": "image",
    "mediaContent": [
      "https://media.licdn.com/dms/image/v2/D4D22AQHEPRCWdFqgAw/feedshare-shrink_800/B4DZWAeHLjHkAs-/0/1741617140215?e=1746662400&v=beta&t=1CkfM9RH3D1dYOiBsS85IrEEQVK2lmAN9H8wAedbfpA"
    ],
    "date": "2025-03-17T05:41:48.179Z"
  },
  {
    "captions": "We bought this shear in 1997… it was a game changer for our business United Metals Recycling  We took it out of commission a year ago and started the rebuild… stay tuned, it’s about to be back and the centerpiece for partners over at B & K Auto Salvage & Recycling… thank you Sierra International Machinery for the support and for building quality equipment that lasts! \n\n#imback #scraplife #fafo #recycledOregon",
    "likes": "35",
    "shares": "1",
    "time": {
      "raw": "4h",
      "parsed": "10.03.2025",
      "isoString": "2025-03-10T05:41:48.177Z"
    },
    "mediaType": "video",
    "mediaContent": {
      "src": [
        {
          "src": "https://dms.licdn.com/playlist/vid/v2/D5605AQEpJulNaxCWog/mp4-640p-30fp-crf28/B56ZV35_jlHoBk-/0/1741478156051?e=1744610400&v=beta&t=VE80o7N7TMtNGmCA7xjYYMvOS7O768KCyWr5vzwcc7g",
          "type": "video/mp4",
          "data-bitrate": 1158588
        },
        {
          "src": "https://dms.licdn.com/playlist/vid/v2/D5605AQEpJulNaxCWog/mp4-720p-30fp-crf28/B56ZV35_jlHoBo-/0/1741478153994?e=1744610400&v=beta&t=YvjnL49tu4AoOFJVkBXWIPnzfLmig8Oxp4XqBH5-Fek",
          "type": "video/mp4",
          "data-bitrate": 1471524
        }
      ],
      "posterUrl": "https://media.licdn.com/dms/image/v2/D5605AQEpJulNaxCWog/videocover-high/B56ZV35_jlHoB0-/0/1741478149381?e=1744610400&v=beta&t=ut8E6sKdkVyls1xn76zTsl6GiOl3i25sGSwgHENYM9U"
    },
    "date": "2025-03-10T05:41:48.177Z"
  },
  {
    "captions": "Car Baler Idromec Tabarelli S6000 3M – Electric Version for Maximum Efficiency and Sustainability.\n\nThe third compression system takes power to the next level, making body dismantling effortless. Boost productivity by 20% compared to the standard version.\n\nMounted on four telescopic brackets, it lifts a full meter, ensuring easier access for cleaning and maintenance. Stronger, smarter, and greener than ever!",
    "likes": "11",
    "shares": "1",
    "time": {
      "raw": "2h",
      "parsed": "24.03.2025",
      "isoString": "2025-03-24T05:41:48.172Z"
    },
    "mediaType": "video",
    "mediaContent": {
      "src": [
        {
          "src": "https://dms.licdn.com/playlist/vid/v2/D4D05AQHU_CONlrYJOA/mp4-640p-30fp-crf28/B4DZW95MMnG4Bk-/0/1742647649057?e=1744610400&v=beta&t=ddb7hM_zYqaqzS6bMwyUnT3CrLEFsroIac3vdOYgN6g",
          "type": "video/mp4",
          "data-bitrate": 530932
        }
      ],
      "posterUrl": "https://media.licdn.com/dms/image/v2/D4D05AQHU_CONlrYJOA/videocover-high/B4DZW95MMnG4B0-/0/1742647646275?e=1744610400&v=beta&t=-mhoIHdjGAWD3uRzFxMcN62xFwI-VDnwDvmLsTORVeQ"
    },
    "date": "2025-03-24T05:41:48.172Z"
  },
  {
    "captions": "🎉Spread the news🎉, the new Idromec Tabarelli S6000 baler redefines the new standard. Fast, powerful and versatile. Ever greener in its electric version, economical to manage, silent and easy to use. Quick to transport and install. Call us for any information and to discover all the available options.",
    "likes": "39",
    "comments": "1",
    "shares": "5",
    "time": {
      "raw": "2h",
      "parsed": "24.03.2025",
      "isoString": "2025-03-24T05:41:48.175Z"
    },
    "mediaType": "video",
    "mediaContent": {
      "src": [
        {
          "src": "https://dms.licdn.com/playlist/vid/v2/D4E05AQE6wEJpp6fKCQ/mp4-720p-30fp-crf28/B4EZWvPjmJHgBk-/0/1742401914484?e=1744610400&v=beta&t=oL97Ocf-bRUZNi3Hn0xcAB8t73ZjlPekpcKcRCv0IiI",
          "type": "video/mp4",
          "data-bitrate": 1042628
        },
        {
          "src": "https://dms.licdn.com/playlist/vid/v2/D4E05AQE6wEJpp6fKCQ/mp4-640p-30fp-crf28/B4EZWvPjmJHgBg-/0/1742401905354?e=1744610400&v=beta&t=V6ZO_2mqRvHyvd2yeFCdhzigzDDT8JOH4VIeT8EGVGE",
          "type": "video/mp4",
          "data-bitrate": 789682
        }
      ],
      "posterUrl": "https://media.licdn.com/dms/image/v2/D4E05AQE6wEJpp6fKCQ/videocover-low/B4EZWvPjmJHgCU-/0/1742401870762?e=1744610400&v=beta&t=bbyCieJHCkHdHRBnxIpqfNpPQEEHlVsap9XKimPGsOM"
    },
    "date": "2025-03-24T05:41:48.175Z"
  }
]