[
  {
    "captions": "Looking for fast, mobile, accurate, and reliable metal analysis? At Bronneberg, we offer state-of-the-art SciAps Inc. Metall Analyzers that bring precision and portability together for superior performance in metal identification and sorting.\nExplore our two leading models:\n\nğŸ”¹ XRF Analyzer X-200: The perfect solution for scrap metal sorting and positive material identification (PMI). With advanced X-ray fluorescence technology, it delivers rapid and precise results even on the most challenging materials.\nğŸ”¹ Laser Analyzer Z-70: Experience the power of laser-induced breakdown spectroscopy (LIBS) for fast alloy analysis. Ideal for high-speed sorting and accurate analysis of magnesium, aluminum, and other light elements.\n\nWith SciAps Analyzers, youâ€™ll save time, improve productivity, and boost profitability in your metal recycling operations.\nğŸ“© Contact us today for a demonstration or to find the right solution for your needs!\n\nğŸ‘‰ Discover more: https://lnkd.in/eUJtWMmq\n\n#Bronneberg #SciAps #MetallAnalyzers #MetalRecycling #XRF #LIBS #InnovationLooking for fast, mobile, accurate, and reliable metal analysis? At Bronneberg, we offer state-of-the-art SciAps Inc. Metall Analyzers that bring precision and portability together for superior performance in metal identification and sorting.\nExplore our two leading models:\n\nğŸ”¹ XRF Analyzer X-200: The perfect solution for scrap metal sorting and positive material identification (PMI). With advanced X-ray fluorescence technology, it delivers rapid and precise results even on the most challenging materials.\nğŸ”¹ Laser Analyzer Z-70: Experience the power of laser-induced breakdown spectroscopy (LIBS) for fast alloy analysis. Ideal for high-speed sorting and accurate analysis of magnesium, aluminum, and other light elements.\n\nWith SciAps Analyzers, youâ€™ll save time, improve productivity, and boost profitability in your metal recycling operations.\nğŸ“© Contact us today for a demonstration or to find the right solution for your needs!\n\nğŸ‘‰ Discover more: https://lnkd.in/eUJtWMmq\n\n#Bronneberg #SciAps #MetallAnalyzers #MetalRecycling #XRF #LIBS #Innovation",
    "likes": "23",
    "comments": "1",
    "shares": "7",
    "time": {
      "raw": "3ay",
      "parsed": "13.02.2025",
      "isoString": "2025-02-13T06:13:28.495Z"
    },
    "mediaType": "image",
    "mediaContent": [
      "https://media.licdn.com/dms/image/v2/D4E22AQEw-Q2PWTy3NA/feedshare-shrink_800/B4EZR0p2ZlGcAk-/0/1737123916000?e=1750291200&v=beta&t=ogL_illGTQ8F1lmdz1o3i1pMRafNge5uvKhUHPqOLb4",
      "https://media.licdn.com/dms/image/v2/D4E22AQH4Lv8AiDWIJw/feedshare-shrink_800/B4EZR0p2ZdHAAg-/0/1737123916285?e=1750291200&v=beta&t=Y8rSx5ousPEfSKtz0LSgiLfb2J7mI1sf4wEBvn0fTkw",
      "https://media.licdn.com/dms/image/v2/D4E22AQG7i7v9bpXkvg/feedshare-shrink_800/B4EZR0p2ZbHAAo-/0/1737123915886?e=1750291200&v=beta&t=iL8oIsvDOvEBaYH4UlTsoX_9o_WMbCQJug-GSNnbsMg"
    ],
    "date": "2025-02-13T06:13:28.495Z"
  },
  {
    "captions": "Bronneberg B.V. is een begrip in de markt. Schrootverwerkers spreken vaak met liefde over hun eerste Bronneberg schaar dan wel pers. ZeÂ veroorzaakten decennia geleden al een kleine revolutie in de branche, en doen dat nog steeds. Achter iedere Bronneberg machine zit namelijk een gedachte, want die is altijd nÃ©t wat efficiÃ«nter, sneller of slimmer dan een machine van een â€˜vreemdâ€™ merk. \n\nâ€œWe investeren in de persoonlijke ontwikkeling van onze medewerkers en zorgen ervoor dat iedereen zich onderdeel voelt van de Bronneberg familieâ€, vertelt Michiel J..\n\nOntdek het volledige gesprek via https://lnkd.in/e-rDM6wq\n \nğŸ“· Henri Jegerings , Robbert-Jan Jegerings, Alexander Jegerings, Michiel J.\n\nğŸ“– Wenst u het âœ¨ Jubileumboek âœ¨ gratis als hardcopy ontvangen inclusief dit artikel? Aarzel dan zeker niet om dit even te laten weten in de opmerkingen hieronder en dan brengen wij dit in orde.\n\n#recycling #afval #schroot #metalsBronneberg B.V. is een begrip in de markt. Schrootverwerkers spreken vaak met liefde over hun eerste Bronneberg schaar dan wel pers. ZeÂ veroorzaakten decennia geleden al een kleine revolutie in de branche, en doen dat nog steeds. Achter iedere Bronneberg machine zit namelijk een gedachte, want die is altijd nÃ©t wat efficiÃ«nter, sneller of slimmer dan een machine van een â€˜vreemdâ€™ merk. \n\nâ€œWe investeren in de persoonlijke ontwikkeling van onze medewerkers en zorgen ervoor dat iedereen zich onderdeel voelt van de Bronneberg familieâ€, vertelt Michiel J..\n\nOntdek het volledige gesprek via https://lnkd.in/e-rDM6wq\n \nğŸ“· Henri Jegerings , Robbert-Jan Jegerings, Alexander Jegerings, Michiel J.\n\nğŸ“– Wenst u het âœ¨ Jubileumboek âœ¨ gratis als hardcopy ontvangen inclusief dit artikel? Aarzel dan zeker niet om dit even te laten weten in de opmerkingen hieronder en dan brengen wij dit in orde.\n\n#recycling #afval #schroot #metals",
    "likes": "261",
    "comments": "17",
    "shares": "5",
    "time": {
      "raw": "4ay",
      "parsed": "13.01.2025",
      "isoString": "2025-01-13T06:13:28.498Z"
    },
    "mediaType": "image",
    "mediaContent": [
      "https://media.licdn.com/dms/image/v2/D4E22AQEfzVMCiWyKcQ/feedshare-shrink_1280/B4EZQ7PeNHGcAk-/0/1736160699690?e=1750291200&v=beta&t=iKfLqGPRszBCjCSJQawUsUUMOMgsP406fUXf79Vvz1s"
    ],
    "date": "2025-01-13T06:13:28.498Z"
  },
  {
    "captions": "ğŸ“¢ Last week, the #REEPRODUCE consortium met at Bronneberg B.V. ğŸ‘ \n\nThe consortium engaged in productive discussions around key objectives, strategies and next steps to ensure the success of our collaborative effortsğŸ¤\n\nDuring the first half of the project, significant progress has been made in advancing recycling technologies for devices containing Neodymium (Nd) magnets. The #REEPRODUCE consortium initiated demonstration phases, focusing on validating innovative recycling processes across multiple facilities in Europe.Â At this stage the consortium has successfully constructed five pilots (TRL7) and carried out demonstration trials in two of them,Â marking a significant step forward in achieving the projectâ€™s objective.\n\nThe partners had the opportunity to visit Bronneberg B.V.'s facilities to explore the innovative pilots that FAU Erlangen-NÃ¼rnberg (Institute FAPS) and Bronneberg have developed to extract Nd-based magnets blocks from different components of selected end-of-life products, with validation planned for early 2025.\n\nExciting times ahead as we work together to drive innovation and deliver impactful resultsâ— â™»ï¸ğŸŒ\n\nDonâ€™t miss outâ€”give us a follow and help spread the word ğŸ“¢ \n\nğŸ’»Visit our website: https://www.reeproduce.eu/\nğŸ“°Subscribe to our newsletter: https://lnkd.in/eUn93-xd\n\nMeet the consortium ğŸ¤ https://lnkd.in/exXnDuvy\n\n#rareearths #rareearthelements #recycling #circulareconomy #permanentmagnets #EuropeğŸ“¢ Last week, the #REEPRODUCE consortium met at Bronneberg B.V. ğŸ‘ \n\nThe consortium engaged in productive discussions around key objectives, strategies and next steps to ensure the success of our collaborative effortsğŸ¤\n\nDuring the first half of the project, significant progress has been made in advancing recycling technologies for devices containing Neodymium (Nd) magnets. The #REEPRODUCE consortium initiated demonstration phases, focusing on validating innovative recycling processes across multiple facilities in Europe.Â At this stage the consortium has successfully constructed five pilots (TRL7) and carried out demonstration trials in two of them,Â marking a significant step forward in achieving the projectâ€™s objective.\n\nThe partners had the opportunity to visit Bronneberg B.V.'s facilities to explore the innovative pilots that FAU Erlangen-NÃ¼rnberg (Institute FAPS) and Bronneberg have developed to extract Nd-based magnets blocks from different components of selected end-of-life products, with validation planned for early 2025.\n\nExciting times ahead as we work together to drive innovation and deliver impactful resultsâ— â™»ï¸ğŸŒ\n\nDonâ€™t miss outâ€”give us a follow and help spread the word ğŸ“¢ \n\nğŸ’»Visit our website: https://www.reeproduce.eu/\nğŸ“°Subscribe to our newsletter: https://lnkd.in/eUn93-xd\n\nMeet the consortium ğŸ¤ https://lnkd.in/exXnDuvy\n\n#rareearths #rareearthelements #recycling #circulareconomy #permanentmagnets #Europe",
    "likes": "69",
    "comments": "1",
    "shares": "14",
    "time": {
      "raw": "5ay",
      "parsed": "13.12.2024",
      "isoString": "2024-12-13T06:13:28.502Z"
    },
    "mediaType": "image",
    "mediaContent": [
      "https://media.licdn.com/dms/image/v2/D4E22AQGWZMTBx6vUEg/feedshare-shrink_800/feedshare-shrink_800/0/1733754869525?e=1750291200&v=beta&t=PIGQLmJN3GgkTa1Xaj1R-5e4dJ8u1qe_uJbAweihUWY",
      "https://media.licdn.com/dms/image/v2/D4E22AQFUChe0WRTwww/feedshare-shrink_800/feedshare-shrink_800/0/1733754866956?e=1750291200&v=beta&t=TC0JE4GM5Xf9tL56WwRTCpU4xvFC-82bGSmv6tAj3rE",
      "https://media.licdn.com/dms/image/v2/D4E22AQEF5L2PLbtGpA/feedshare-shrink_800/feedshare-shrink_800/0/1733754869069?e=1750291200&v=beta&t=Ts_BSebUPp9tNParQfuovhnW7gYMayP1q2HHZsbwZ84"
    ],
    "date": "2024-12-13T06:13:28.502Z"
  },
  {
    "captions": "ğŸ”§âœ¨ ğ—¦ğ˜ğ—¿ğ—²ğ—»ğ—´ğ˜ğ—µğ—²ğ—»ğ—¶ğ—»ğ—´ ğ˜ğ—µğ—² ğ—³ğ˜‚ğ˜ğ˜‚ğ—¿ğ—² ğ—¼ğ—³ ğ—¿ğ—²ğ—°ğ˜†ğ—°ğ—¹ğ—¶ğ—»ğ—´ ğ˜ğ—¼ğ—´ğ—²ğ˜ğ—µğ—²ğ—¿!\n\nAt Bronneberg, weâ€™re thrilled to announce our partnership with Dutch Magnetics B.V., bringing magnetic solutions to the recycling industry. Together, weâ€™re making it easier for businesses to achieve cleaner, more efficient recycling processes.\n\nHereâ€™s how Dutch Magnetics' state-of-the-art technology is elevating recycling:\nğŸ”¹ ğ—˜ğ—±ğ—±ğ˜† ğ—–ğ˜‚ğ—¿ğ—¿ğ—²ğ—»ğ˜ğ˜€ for separating non-ferrous metals with precision.\nğŸ”¹ ğ— ğ—®ğ—´ğ—»ğ—²ğ˜ğ—¶ğ—° ğ——ğ—¿ğ˜‚ğ—º ğ—¥ğ—¼ğ—¹ğ—¹ğ˜€ to simplify material handling and sorting.\nğŸ”¹ ğ—¢ğ˜ƒğ—²ğ—¿ğ—¯ğ—²ğ—¹ğ˜ ğ— ğ—®ğ—´ğ—»ğ—²ğ˜ğ˜€ to separate ferrous from non-ferrous metals.\nğŸ”¹ And more\n\nHave a look at their website for more information: https://lnkd.in/endzY-D7\n\n#RecyclingInnovation #MagneticSolutions #CircularEconomy #Bronneberg #DutchMagnetics #RecyclingTechnology #Sustainability #GreenSolutions #WasteManagement #RecyclingEfficiency",
    "likes": "26",
    "comments": "1",
    "shares": "4",
    "time": {
      "raw": "5ay",
      "parsed": "13.12.2024",
      "isoString": "2024-12-13T06:13:28.505Z"
    },
    "mediaType": "other",
    "date": "2024-12-13T06:13:28.505Z"
  },
  {
    "captions": "Visit us at the BMR Conference the 25th and 26th of November. Together with Holmatro Industrial Equipment B.V. you can find us at our stand!\n\n#bmr #recycling #machineryVisit us at the BMR Conference the 25th and 26th of November. Together with Holmatro Industrial Equipment B.V. you can find us at our stand!\n\n#bmr #recycling #machinery",
    "likes": "34",
    "shares": "2",
    "time": {
      "raw": "5ay",
      "parsed": "13.12.2024",
      "isoString": "2024-12-13T06:13:28.507Z"
    },
    "mediaType": "image",
    "mediaContent": [
      "https://media.licdn.com/dms/image/v2/D4E22AQELoQCEhK8C8g/feedshare-shrink_800/feedshare-shrink_800/0/1732515659123?e=1750291200&v=beta&t=kC9VsoVejKMAzn1nwwfZyI5vn8wsRujT83JGK-R6ixg"
    ],
    "date": "2024-12-13T06:13:28.507Z"
  },
  {
    "captions": "It was fantastic to see our Industrial Cutting Tools in action at Van der Ven Auto's , largest car recycler in the Netherlands, handling over 40,000 cars per year with a recycling rate of 98%.\n\nOur Dutch partner for Industrial Cutting tools, Bronneberg B.V. ensures Van der Ven is equipped with the right tools, expert service, and reliable repairs. Partnership is a key factor in being successful in our markets. Our cooperation with Bronneberg is a perfect example of how to be successful by joining forces and knowledge. \n\nAre you curious to learn more about both our solutions for industrial recycling and cutting? Visit Alexander Jegerings, Ivo Willems and me next week at our joined booth during the Bureau of Middle East Recycling conference - 25 and 26 November - Le MÃ©ridien Dubai Hotel & Conference!\n\n#holmatro #industrialcutting #wehelpmaketheworldmoveforward #recycling #demolition #production #decommissioning \n#hydraulics #hydrauliccutting #highpressurehydraulics #safe \n#durable #ergonomicIt was fantastic to see our Industrial Cutting Tools in action at Van der Ven Auto's , largest car recycler in the Netherlands, handling over 40,000 cars per year with a recycling rate of 98%.\n\nOur Dutch partner for Industrial Cutting tools, Bronneberg B.V. ensures Van der Ven is equipped with the right tools, expert service, and reliable repairs. Partnership is a key factor in being successful in our markets. Our cooperation with Bronneberg is a perfect example of how to be successful by joining forces and knowledge. \n\nAre you curious to learn more about both our solutions for industrial recycling and cutting? Visit Alexander Jegerings, Ivo Willems and me next week at our joined booth during the Bureau of Middle East Recycling conference - 25 and 26 November - Le MÃ©ridien Dubai Hotel & Conference!\n\n#holmatro #industrialcutting #wehelpmaketheworldmoveforward #recycling #demolition #production #decommissioning \n#hydraulics #hydrauliccutting #highpressurehydraulics #safe \n#durable #ergonomic",
    "likes": "41",
    "shares": "9",
    "time": {
      "raw": "5ay",
      "parsed": "13.12.2024",
      "isoString": "2024-12-13T06:13:28.509Z"
    },
    "mediaType": "image",
    "mediaContent": [
      "https://media.licdn.com/dms/image/v2/D4E22AQHgFQAPR_ewRg/feedshare-shrink_2048_1536/feedshare-shrink_2048_1536/0/1732020041205?e=1750291200&v=beta&t=cN1utN9_G1uMhciiJbBugI_tA-Z5mYuX5x2SmzG5cO0"
    ],
    "date": "2024-12-13T06:13:28.509Z"
  },
  {
    "captions": "You can find us this year at the BMR International Conference together with our partner Holmatro Industrial Equipment B.V..\n\nVisit us 25 and 26 November at Le MÃ©ridien Dubai Hotel & Conference! We're thrilled to announce BRONNEBERG Recycling Machines & Services as an Exhibitor for the Standard Booth at the prestigious 12th BMR International Conference!\n\nJoin us for the 12th BMR International Conference, the premier event for the recycling industry in the Middle East! This year's theme is \"One Language, One Vision, One Goal,\" bringing together voices from across the sector to share insights, innovations, and strategies.\n\n*Date:* 25-26 November 2024\n*Venue:* Le MÃ©ridien Dubai Hotel & Conference Centre, Airport Road, Dubai, UAE\n\nLimited sponsorship opportunities availableâ€”secure yours today!\n\nConnect with us on:\n\nLinkedIn: https://rb.gy/kkfvp8\nInstagram: https://rb.gy/5dj450\nFacebook: https://rb.gy/lhml4g\nX (Twitter): https://rb.gy/tkztoxWe're thrilled to announce BRONNEBERG Recycling Machines & Services as an Exhibitor for the Standard Booth at the prestigious 12th BMR International Conference!\n\nJoin us for the 12th BMR International Conference, the premier event for the recycling industry in the Middle East! This year's theme is \"One Language, One Vision, One Goal,\" bringing together voices from across the sector to share insights, innovations, and strategies.\n\n*Date:* 25-26 November 2024\n*Venue:* Le MÃ©ridien Dubai Hotel & Conference Centre, Airport Road, Dubai, UAE\n\nLimited sponsorship opportunities availableâ€”secure yours today!\n\nConnect with us on:\n\nLinkedIn: https://rb.gy/kkfvp8\nInstagram: https://rb.gy/5dj450\nFacebook: https://rb.gy/lhml4g\nX (Twitter): https://rb.gy/tkztox",
    "likes": "13",
    "shares": "3",
    "time": {
      "raw": "5ay6ay",
      "parsed": "13.05.2025",
      "isoString": "2025-05-13T06:13:28.510Z"
    },
    "mediaType": "image",
    "mediaContent": [
      "https://media.licdn.com/dms/image/v2/D4D22AQGqD4HO2hKqoA/feedshare-shrink_800/feedshare-shrink_800/0/1729188313607?e=1750291200&v=beta&t=ULv2bzeOn5C_ZjCkRwzmYZ6HzdxoCl40cTrgdoidGhE"
    ],
    "date": "2025-05-13T06:13:28.510Z"
  },
  {
    "captions": "We're thrilled to announce BRONNEBERG Recycling Machines & Services as an Exhibitor for the Standard Booth at the prestigious 12th BMR International Conference!\n\nJoin us for the 12th BMR International Conference, the premier event for the recycling industry in the Middle East! This year's theme is \"One Language, One Vision, One Goal,\" bringing together voices from across the sector to share insights, innovations, and strategies.\n\n*Date:* 25-26 November 2024\n*Venue:* Le MÃ©ridien Dubai Hotel & Conference Centre, Airport Road, Dubai, UAE\n\nLimited sponsorship opportunities availableâ€”secure yours today!\n\nConnect with us on:\n\nLinkedIn: https://rb.gy/kkfvp8\nInstagram: https://rb.gy/5dj450\nFacebook: https://rb.gy/lhml4g\nX (Twitter): https://rb.gy/tkztoxWe're thrilled to announce BRONNEBERG Recycling Machines & Services as an Exhibitor for the Standard Booth at the prestigious 12th BMR International Conference!\n\nJoin us for the 12th BMR International Conference, the premier event for the recycling industry in the Middle East! This year's theme is \"One Language, One Vision, One Goal,\" bringing together voices from across the sector to share insights, innovations, and strategies.\n\n*Date:* 25-26 November 2024\n*Venue:* Le MÃ©ridien Dubai Hotel & Conference Centre, Airport Road, Dubai, UAE\n\nLimited sponsorship opportunities availableâ€”secure yours today!\n\nConnect with us on:\n\nLinkedIn: https://rb.gy/kkfvp8\nInstagram: https://rb.gy/5dj450\nFacebook: https://rb.gy/lhml4g\nX (Twitter): https://rb.gy/tkztox",
    "likes": "13",
    "shares": "3",
    "time": {
      "raw": "6ay",
      "parsed": "13.11.2024",
      "isoString": "2024-11-13T06:13:28.511Z"
    },
    "mediaType": "image",
    "mediaContent": [
      "https://media.licdn.com/dms/image/v2/D4D22AQGqD4HO2hKqoA/feedshare-shrink_800/feedshare-shrink_800/0/1729188313607?e=1750291200&v=beta&t=ULv2bzeOn5C_ZjCkRwzmYZ6HzdxoCl40cTrgdoidGhE"
    ],
    "date": "2024-11-13T06:13:28.511Z"
  },
  {
    "captions": "Visit us at Vakbeurs Recycling in Gorinchem! You can find us at booth F106!\n#recycling #convention #metals #recovery #circulareconomyVisit us at Vakbeurs Recycling in Gorinchem! You can find us at booth F106!\n#recycling #convention #metals #recovery #circulareconomy",
    "likes": "38",
    "shares": "4",
    "time": {
      "raw": "6ay",
      "parsed": "13.11.2024",
      "isoString": "2024-11-13T06:13:28.512Z"
    },
    "mediaType": "image",
    "mediaContent": [
      "https://media.licdn.com/dms/image/v2/D4E22AQETItDE600Ghg/feedshare-shrink_800/feedshare-shrink_800/0/1731521054722?e=1750291200&v=beta&t=vm9Toy_I0xU51SmCEAcZ9WCePqyPjIzpWwbFKyKDOPw"
    ],
    "date": "2024-11-13T06:13:28.512Z"
  },
  {
    "captions": "Come visit us today and tomorrow at Aluminium DÃ¼sseldorf and Recycling Technik Dortmund!\n\nYou can find us at the FOR REC S.P.A. booth:\n- DÃ¼sseldorf: 6A11\n- Dortmund: 7-N09\n\n#recycling #technology #recovery #bronnebergCome visit us today and tomorrow at Aluminium DÃ¼sseldorf and Recycling Technik Dortmund!\n\nYou can find us at the FOR REC S.P.A. booth:\n- DÃ¼sseldorf: 6A11\n- Dortmund: 7-N09\n\n#recycling #technology #recovery #bronneberg",
    "likes": "42",
    "shares": "3",
    "time": {
      "raw": "7ay",
      "parsed": "13.10.2024",
      "isoString": "2024-10-13T06:13:28.513Z"
    },
    "mediaType": "image",
    "mediaContent": [
      "https://media.licdn.com/dms/image/v2/D4E22AQFerSD8ndnCcQ/feedshare-shrink_800/feedshare-shrink_800/0/1728463160493?e=1750291200&v=beta&t=E6fxaurk9_TYN_sF4688821sqZYV2lTrnMsXbEFre_U",
      "https://media.licdn.com/dms/image/v2/D4E22AQEJRm8Kv2jgzA/feedshare-shrink_800/feedshare-shrink_800/0/1728463156785?e=1750291200&v=beta&t=WRX7tI_AF30rUpbDuo4UYuNu5-H4XwWtzCJ0_sNEjo8"
    ],
    "date": "2024-10-13T06:13:28.513Z"
  },
  {
    "captions": "We are your partner for Recycling Solutions!\n\nOur innovative recycling machines combined with reliable service are the key the your successful recycling activities. We are committed to providing solutions for our customers specific needs, all over the world! ğŸŒ\n\nFeel free to contact us or have a look at our website for more information about our Recycling Solutions.\n\n#Recycling #Machinery #Bronneberg\n\nhttps://lnkd.in/eJ6nyRPQ",
    "likes": "18",
    "shares": "2",
    "time": {
      "raw": "7ay",
      "parsed": "13.10.2024",
      "isoString": "2024-10-13T06:13:28.515Z"
    },
    "mediaType": "other",
    "date": "2024-10-13T06:13:28.515Z"
  },
  {
    "captions": "We are proud to announce we launched our new website today!ğŸŒ\n\nSpecial thanks to Keistoer - Digitale innovatie for developing our website!ğŸ’ª\n\nClick on the link below to check it outğŸ‘‡:\nhttps://lnkd.in/eT4jvk6z",
    "likes": "8",
    "shares": "2",
    "time": {
      "raw": "10ay",
      "parsed": "13.07.2024",
      "isoString": "2024-07-13T06:13:28.517Z"
    },
    "mediaType": "other",
    "date": "2024-07-13T06:13:28.517Z"
  },
  {
    "captions": "ğŸ¥ Check out our newest video of the TECNOECOLOGY SRL T3000 Cable Granulation Plant!\nğŸ”¹ Capacity up to 3.000 KG per hour\nğŸ”¹ Modulair System\nğŸ”¹ High Quality Materials\n\nğŸ¥ https://lnkd.in/gPKaQaTE\n\nCheck out our website for more information:\nğŸ‡¬ğŸ‡§: https://lnkd.in/g55436zv\nğŸ‡³ğŸ‡±: https://lnkd.in/gvjtTwn6\nğŸ‡©ğŸ‡ª: https://lnkd.in/gSysYwcf",
    "likes": "14",
    "shares": "3",
    "time": {
      "raw": "10ay",
      "parsed": "13.07.2024",
      "isoString": "2024-07-13T06:13:28.519Z"
    },
    "mediaType": "other",
    "date": "2024-07-13T06:13:28.519Z"
  },
  {
    "captions": "For over 35 years, we are manufactures of cable strippers. Our range of cable strippers is designed to meet the diverse needs of professionals all over the world! ğŸŒ\n\nWhy choose for a Bronneberg Cable Stripper?\nğŸ”¹ Quality: With 35+ years of manufacturing experience, made in Holland ğŸ‡³ğŸ‡±\nğŸ”¹ Innovative: Engineered and developed by our own engineering department, to ensure efficiency and durability\nğŸ”¹ Wide Range: From small cables to heavy armoured sea cables, we have the cable stripper that gets the job done âœ…\n\nDiscover our full range of cable strippers and other recycling equipment on our website, or speak with one of our professionals for personal advice!\nW: https://lnkd.in/eUjyc6tM\nT: +31 492 591900For over 35 years, we are manufactures of cable strippers. Our range of cable strippers is designed to meet the diverse needs of professionals all over the world! ğŸŒ\n\nWhy choose for a Bronneberg Cable Stripper?\nğŸ”¹ Quality: With 35+ years of manufacturing experience, made in Holland ğŸ‡³ğŸ‡±\nğŸ”¹ Innovative: Engineered and developed by our own engineering department, to ensure efficiency and durability\nğŸ”¹ Wide Range: From small cables to heavy armoured sea cables, we have the cable stripper that gets the job done âœ…\n\nDiscover our full range of cable strippers and other recycling equipment on our website, or speak with one of our professionals for personal advice!\nW: https://lnkd.in/eUjyc6tM\nT: +31 492 591900",
    "likes": "16",
    "shares": "4",
    "time": {
      "raw": "10ay",
      "parsed": "13.07.2024",
      "isoString": "2024-07-13T06:13:28.520Z"
    },
    "mediaType": "image",
    "mediaContent": [
      "https://media.licdn.com/dms/image/v2/D5622AQF1X27MW0p9eQ/feedshare-shrink_800/feedshare-shrink_800/0/1719231359636?e=1750291200&v=beta&t=wN8Vdp_NiZWfcLne4mtxBgTm6OOuhJE8B0l3r1F6XRM",
      "https://media.licdn.com/dms/image/v2/D5622AQGj-fQ9Wylmqg/feedshare-shrink_800/feedshare-shrink_800/0/1719231359712?e=1750291200&v=beta&t=5_wknLnVaN48XbX3rkeWQMgHkYOr-MKhX6jCeaQzRCc",
      "https://media.licdn.com/dms/image/v2/D5622AQHoWnsNwW3tWw/feedshare-shrink_800/feedshare-shrink_800/0/1719231359653?e=1750291200&v=beta&t=8Vw3dZ_kZxcSgXGCX2S4PrmlEYgZsZ6GBTyBbetD8f0"
    ],
    "date": "2024-07-13T06:13:28.520Z"
  },
  {
    "captions": "ğŸš€ Exciting News! ğŸš€\n\nWe just uploaded a new video showcasing the TECNOECOLOGY SRL T1500 Cable Granulation Plant and the Bronneberg Optical Sorting System! ğŸ“¹ğŸ”— Check it out here: https://lnkd.in/ewnTQdUr\n\nBronneberg continues to lead the way in the global recycling market with our reliable, high-quality, and innovative recycling machines. From small cable strippers to large scrap balers and cable granulation plants, we provide innovative solutions for recycling scrap, metal, cars, cables, and more.\nIn this video, you'll see: \n\nğŸ”§ The Tecnoecology T1500 Cable Granulation Plant in action \nğŸ” The precision of the Bronneberg Optical Sorting System\n\nJoin us in our mission to revolutionize recycling technology. Your feedback and comments are always welcome!\n#Bronneberg #Recycling #Sustainability #Innovation #TechInRecycling #Tecnoecology #CableGranulation #OpticalSorting #WasteManagement #CircularEconomy",
    "likes": "24",
    "shares": "4",
    "time": {
      "raw": "10ay",
      "parsed": "13.07.2024",
      "isoString": "2024-07-13T06:13:28.523Z"
    },
    "mediaType": "other",
    "date": "2024-07-13T06:13:28.523Z"
  },
  {
    "captions": "For over 75 years, Bronneberg has been synonymous with excellence in recycling technology. As a Dutch specialist in the field, they've continually pushed the boundaries of innovation and sustainability. But what truly sets them apart is the unwavering commitment to the circular economy.\n#RecyclingTechnology #CircularEconomy #Sustainability #BronnebergLegacy Alexander Jegerings Robbert-Jan Jegerings #business #recyclingtechnology",
    "likes": "90",
    "comments": "5",
    "shares": "5",
    "time": {
      "raw": "1y",
      "parsed": "13.05.2025",
      "isoString": "2025-05-13T06:13:28.525Z"
    },
    "mediaType": "other",
    "date": "2025-05-13T06:13:28.525Z"
  },
  {
    "captions": "ğŸŒŸ Thank You for Visiting Bronneberg at IFAT! ğŸŒŸ\n\nWe're so grateful to everyone who stopped by our booth! Your support and interest mean the world to us. Together, we can continue to innovate and create reliable, high-quality recycling solutions.\n\nIf you're looking for Total Recycling Solutions, please contact us and speak with one of our specialists!\n\n#Recycling #IFAT #Bronneberg #Innovation #Machinery #Sustainability #EnvironmentğŸŒŸ Thank You for Visiting Bronneberg at IFAT! ğŸŒŸ\n\nWe're so grateful to everyone who stopped by our booth! Your support and interest mean the world to us. Together, we can continue to innovate and create reliable, high-quality recycling solutions.\n\nIf you're looking for Total Recycling Solutions, please contact us and speak with one of our specialists!\n\n#Recycling #IFAT #Bronneberg #Innovation #Machinery #Sustainability #Environment",
    "likes": "64",
    "comments": "1",
    "shares": "2",
    "time": {
      "raw": "11ay",
      "parsed": "13.06.2024",
      "isoString": "2024-06-13T06:13:28.527Z"
    },
    "mediaType": "image",
    "mediaContent": [
      "https://media.licdn.com/dms/image/v2/D4E22AQEHKz82mQ40ow/feedshare-shrink_800/feedshare-shrink_800/0/1716388551536?e=1750291200&v=beta&t=D6g-1udrzywSolgs_6nvlJV0ZX8rzFQoi8MmYyph6hM"
    ],
    "date": "2024-06-13T06:13:28.527Z"
  },
  {
    "captions": "Visit our booth B4.417 this week at IFAT in Munich!\n\n#ifat #messe #bronneberg #munichVisit our booth B4.417 this week at IFAT in Munich!\n\n#ifat #messe #bronneberg #munich",
    "likes": "38",
    "comments": "3",
    "shares": "3",
    "time": {
      "raw": "12ay",
      "parsed": "13.05.2024",
      "isoString": "2024-05-13T06:13:28.531Z"
    },
    "mediaType": "image",
    "mediaContent": [
      "https://media.licdn.com/dms/image/v2/D5622AQFIfV5MXk5ObQ/feedshare-shrink_800/feedshare-shrink_800/0/1715595664304?e=1750291200&v=beta&t=K0w84-ZNjO7px-lEr00WihOVJl_D7qj3RN1YA-xAJ20"
    ],
    "date": "2024-05-13T06:13:28.531Z"
  },
  {
    "captions": "Visit us next week at IFAT 2024 in Munich!\n\nYou can find us in Hall B4 stand 417.Visit us next week at IFAT 2024 in Munich!\n\nYou can find us in Hall B4 stand 417.",
    "likes": "10",
    "shares": "1",
    "time": {
      "raw": "12ay",
      "parsed": "07.05.2024",
      "isoString": "2024-05-07T11:57:00.230Z"
    },
    "mediaType": "image",
    "mediaContent": [
      "https://media.licdn.com/dms/image/v2/D4E22AQElz2AN5TV_Xg/feedshare-shrink_800/feedshare-shrink_800/0/1715159692327?e=1749686400&v=beta&t=f1GiQrQQPWeoG-YVVOXGxDmuGya8SE3ebGQgXaCy_Ls"
    ],
    "date": "2024-05-07T11:57:00.230Z"
  },
  {
    "captions": "From its very creation in 1946, Bronneberg B.V. has been active in the #RecyclingIndustry. \n\nIn general, the recycling industry is not aware of the importance of the #Neodymium #magnet recovery and its important #valuechain. But, Bronneberg acknowledges that there is still ample room for progress in this area, and they are committed to further supporting the project objectives,\n\nâ™»ï¸ğŸŒ\n\nğŸ“° Do not miss our exclusive interview with our partner Bronneberg B.V. â¡ https://lnkd.in/ePJWKev6 \n\n#rareearths #rareearthelements #recycling #circuclareconomy \n#permanentmagnets #Europe\n\nSINTEF, SINTEF Industry, Ana Maria Martinez, INDUMETAL RECYCLING SA, Revac, Sense2Sort Toratecnica, S.L.U., Euregio Recycling Belgium BV, JGI-HYDROMETAL, HYDROMETAL , Magneti Ljubljana, d.d., Elkem ASA, Bronneberg B.V., DISKUS Polska, PNO Innovation Belgium, INOVERTIS, FAU Erlangen-NÃ¼rnberg, TECNALIA Research & Innovation, Ceit Research Center, Felipe Guerrero, Nader Akil, Abuzar Abrar, Diego Borro, Maider Arieta-araunabeÃ±a, Tomasz FilipÃ³w, Eric van Looy, Matej Zaplotnik, REIA - The Global Rare Earth Industry Association, SUPREEMO Horizon Europe, REEsilience, Jokin Hidalgo, Henri Jegerings, Ivo Willems",
    "likes": "38",
    "shares": "6",
    "time": {
      "raw": "11ay",
      "parsed": "07.05.2024",
      "isoString": "2024-05-07T05:43:00.673Z"
    },
    "mediaType": "other",
    "date": "2024-05-07T05:43:00.673Z"
  },
  {
    "captions": "Met trots delen wij dat Bronneberg partner is van Hartstichting: Hart voor de Zaak! (English Below) \n\nWij vinden het belangrijk betrokken te zijn bij maatschappelijke doelen en willen dit ook vertalen binnen onze organisatie. De gezondheid en welzijn van onze mensen staat hierbij centraal.\n\nSamen gaan wij voor een gezonder hart, voor nu Ã©n later! â¤ï¸\n\n----------------------------------(English)----------------------------------\nWith pride we can announce that Bronneberg is partner of Hartstichting: Hart voor de Zaak!\n\nWe believe it is important to be involved in social goals and want to express this in our organization. The health and well being of our employees is one of our core values.\n\nTogether we go for a healthier heart, for now and later! â¤ï¸\n\n#MVO #Hartstichting #HartvoordeZaak #BronnebergMet trots delen wij dat Bronneberg partner is van Hartstichting: Hart voor de Zaak! (English Below) \n\nWij vinden het belangrijk betrokken te zijn bij maatschappelijke doelen en willen dit ook vertalen binnen onze organisatie. De gezondheid en welzijn van onze mensen staat hierbij centraal.\n\nSamen gaan wij voor een gezonder hart, voor nu Ã©n later! â¤ï¸\n\n----------------------------------(English)----------------------------------\nWith pride we can announce that Bronneberg is partner of Hartstichting: Hart voor de Zaak!\n\nWe believe it is important to be involved in social goals and want to express this in our organization. The health and well being of our employees is one of our core values.\n\nTogether we go for a healthier heart, for now and later! â¤ï¸\n\n#MVO #Hartstichting #HartvoordeZaak #Bronneberg",
    "likes": "19",
    "comments": "2",
    "shares": "2",
    "time": {
      "raw": "11ay",
      "parsed": "12.04.2024",
      "isoString": "2024-04-12T05:06:47.371Z"
    },
    "mediaType": "image",
    "mediaContent": [
      "https://media.licdn.com/dms/image/v2/D4E22AQGkaZuU2Kv_0g/feedshare-shrink_800/feedshare-shrink_800/0/1711118693608?e=1744848000&v=beta&t=6PA0zpfXLS2A_-OYLv-pYzOes1Da7gzsSS4NoZQY3Es"
    ],
    "date": "2024-04-12T05:06:47.371Z"
  },
  {
    "captions": "**Curea Elektro AG â€“ Leidenschaft fÃ¼r nachhaltige Entsorgung**\nÂ \nCurea testet derzeit im Herstellerwerk der Firma Bronneberg B.V. (NL) eine Abisoliermaschine, die Kupfer und Kunststoff effektiv voneinander trennt. Diese Technologie kÃ¶nnte einen bedeutenden Mehrwert fÃ¼r die Zukunft bringen, indem sie ressourcenschonende Recyclingprozesse fÃ¶rdert und die Nachhaltigkeit verbessert.**Curea Elektro AG â€“ Leidenschaft fÃ¼r nachhaltige Entsorgung**\nÂ \nCurea testet derzeit im Herstellerwerk der Firma Bronneberg B.V. (NL) eine Abisoliermaschine, die Kupfer und Kunststoff effektiv voneinander trennt. Diese Technologie kÃ¶nnte einen bedeutenden Mehrwert fÃ¼r die Zukunft bringen, indem sie ressourcenschonende Recyclingprozesse fÃ¶rdert und die Nachhaltigkeit verbessert.",
    "likes": "44",
    "comments": "1",
    "shares": "5",
    "time": {
      "raw": "1ay",
      "parsed": "13.04.2025",
      "isoString": "2025-04-13T06:13:28.486Z"
    },
    "mediaType": "image",
    "mediaContent": [
      "https://media.licdn.com/dms/image/v2/D4D22AQE_Fjbrie1_Tw/feedshare-shrink_800/B4DZX3QIyyHIAk-/0/1743609966029?e=1750291200&v=beta&t=59M_v9xFh2n48QddevF9GtprhB6H75SL8Cd4BZ8h1UU",
      "https://media.licdn.com/dms/image/v2/D4D22AQFbwbHC_CTJSw/feedshare-shrink_800/B4DZX3QI1wGkAo-/0/1743609963624?e=1750291200&v=beta&t=4ugbyhAqwdUvTxIY3lq5dwyauj4zURO7YuYqR-smVAE",
      "https://media.licdn.com/dms/image/v2/D4D22AQEzZESQvC2VEQ/feedshare-shrink_800/B4DZX3QI4yHwAk-/0/1743609967860?e=1750291200&v=beta&t=u1u972VvriM4CBrT49Wo2R34bAX2003UjFfgUz4l3FQ",
      "https://media.licdn.com/dms/image/v2/D4D22AQFzNmRAcESyaQ/feedshare-shrink_800/B4DZX3QI63G4Ag-/0/1743609967277?e=1750291200&v=beta&t=gMKFCmErXXX44UONLoQUMmoeGS8z0xcwiHG6atcfGnc",
      "https://media.licdn.com/dms/image/v2/D4D22AQH0ukHWiEoITw/feedshare-shrink_800/B4DZX3QI6gG8Ag-/0/1743609967327?e=1750291200&v=beta&t=D4S-GuMvYqS82j3Npfekimp2krfaG_TP_R9iGPHyez0"
    ],
    "date": "2025-04-13T06:13:28.486Z"
  },
  {
    "captions": "ğ—˜ğ—«ğ—›ğ—œğ—•ğ—œğ—§ğ—¢ğ—¥ ğ—”ğ—¡ğ—¡ğ—¢ğ—¨ğ—¡ğ—–ğ—˜ğ— ğ—˜ğ—¡ğ—§ ğŸ‡¸ğŸ‡¦  \n\nğ˜ğ˜¦ ğ˜©ğ˜¢ğ˜·ğ˜¦ ğ˜¢ ğ˜­ğ˜°ğ˜¯ğ˜¨ ğ˜­ğ˜ªğ˜´ğ˜µ ğ˜°ğ˜§ ğ˜¦ğ˜¹ğ˜©ğ˜ªğ˜£ğ˜ªğ˜µğ˜°ğ˜³ ğ˜¢ğ˜¯ğ˜¯ğ˜°ğ˜¶ğ˜¯ğ˜¤ğ˜¦ğ˜®ğ˜¦ğ˜¯ğ˜µğ˜´. \nğ˜ˆğ˜­ğ˜­ ğ˜¤ğ˜°ğ˜¯ğ˜§ğ˜ªğ˜³ğ˜®ğ˜¦ğ˜¥ ğ˜¢ğ˜¯ğ˜¥ ğ˜³ğ˜¦ğ˜¢ğ˜¥ğ˜º ğ˜§ğ˜°ğ˜³ ğ˜µğ˜©ğ˜¦ ğ˜³ğ˜¦ğ˜¤ğ˜ºğ˜¤ğ˜­ğ˜ªğ˜¯ğ˜¨ ğ˜®ğ˜¢ğ˜³ğ˜¬ğ˜¦ğ˜µ ğ˜ªğ˜¯ ğ˜µğ˜©ğ˜¦ ğ˜”ğ˜ªğ˜¥ğ˜¥ğ˜­ğ˜¦ ğ˜Œğ˜¢ğ˜´ğ˜µ,ğ˜°ğ˜¯ğ˜¦ ğ˜°ğ˜§ ğ˜µğ˜©ğ˜¦ğ˜® ğ˜ªğ˜´ ğ˜‰ğ˜³ğ˜°ğ˜¯ğ˜¯ğ˜¦ğ˜£ğ˜¦ğ˜³ğ˜¨ ğ˜‰.ğ˜..ğŸ‡³ğŸ‡± \n\nğ—”ğ—¯ğ—¼ğ˜‚ğ˜ ğ—•ğ—¿ğ—¼ğ—»ğ—»ğ—²ğ—¯ğ—²ğ—¿ğ—´ ğ—•.ğ—©. â€“ ğ— ğ—®ğ—»ğ˜‚ğ—³ğ—®ğ—°ğ˜ğ˜‚ğ—¿ğ—²ğ—¿ ğ—¼ğ—³ ğ—¦ğ—°ğ—¿ğ—®ğ—½ ğ—¥ğ—²ğ—°ğ˜†ğ—°ğ—¹ğ—¶ğ—»ğ—´ ğ—˜ğ—¾ğ˜‚ğ—¶ğ—½ğ—ºğ—²ğ—»ğ˜\n\nBronneberg B.V. specializes in engineering and manufacturing advanced hydraulic systems for the recycling industry, including:\n\nâ€¢ Scrap guillotine shears\nâ€¢ Scrap balers\nâ€¢ Cable recycling plants & cable strippers\nâ€¢ Cable Stripping Machines\nâ€¢ Alligator Shears\n\n...and more!\n\nBronneberg B.V. offers worldwide delivery of complete, turnkey recycling plants and provides servicing for all brands of equipment. See them in November on the 10th & 11th at the Recycling Expo in Riyadh!\n\n#Bronneberg #RecyclingIndustry #RiyadhExpo #Sustainability #MiddleEastRecycling #CircularEconomyğ—˜ğ—«ğ—›ğ—œğ—•ğ—œğ—§ğ—¢ğ—¥ ğ—”ğ—¡ğ—¡ğ—¢ğ—¨ğ—¡ğ—–ğ—˜ğ— ğ—˜ğ—¡ğ—§ ğŸ‡¸ğŸ‡¦  \n\nğ˜ğ˜¦ ğ˜©ğ˜¢ğ˜·ğ˜¦ ğ˜¢ ğ˜­ğ˜°ğ˜¯ğ˜¨ ğ˜­ğ˜ªğ˜´ğ˜µ ğ˜°ğ˜§ ğ˜¦ğ˜¹ğ˜©ğ˜ªğ˜£ğ˜ªğ˜µğ˜°ğ˜³ ğ˜¢ğ˜¯ğ˜¯ğ˜°ğ˜¶ğ˜¯ğ˜¤ğ˜¦ğ˜®ğ˜¦ğ˜¯ğ˜µğ˜´. \nğ˜ˆğ˜­ğ˜­ ğ˜¤ğ˜°ğ˜¯ğ˜§ğ˜ªğ˜³ğ˜®ğ˜¦ğ˜¥ ğ˜¢ğ˜¯ğ˜¥ ğ˜³ğ˜¦ğ˜¢ğ˜¥ğ˜º ğ˜§ğ˜°ğ˜³ ğ˜µğ˜©ğ˜¦ ğ˜³ğ˜¦ğ˜¤ğ˜ºğ˜¤ğ˜­ğ˜ªğ˜¯ğ˜¨ ğ˜®ğ˜¢ğ˜³ğ˜¬ğ˜¦ğ˜µ ğ˜ªğ˜¯ ğ˜µğ˜©ğ˜¦ ğ˜”ğ˜ªğ˜¥ğ˜¥ğ˜­ğ˜¦ ğ˜Œğ˜¢ğ˜´ğ˜µ,ğ˜°ğ˜¯ğ˜¦ ğ˜°ğ˜§ ğ˜µğ˜©ğ˜¦ğ˜® ğ˜ªğ˜´ ğ˜‰ğ˜³ğ˜°ğ˜¯ğ˜¯ğ˜¦ğ˜£ğ˜¦ğ˜³ğ˜¨ ğ˜‰.ğ˜..ğŸ‡³ğŸ‡± \n\nğ—”ğ—¯ğ—¼ğ˜‚ğ˜ ğ—•ğ—¿ğ—¼ğ—»ğ—»ğ—²ğ—¯ğ—²ğ—¿ğ—´ ğ—•.ğ—©. â€“ ğ— ğ—®ğ—»ğ˜‚ğ—³ğ—®ğ—°ğ˜ğ˜‚ğ—¿ğ—²ğ—¿ ğ—¼ğ—³ ğ—¦ğ—°ğ—¿ğ—®ğ—½ ğ—¥ğ—²ğ—°ğ˜†ğ—°ğ—¹ğ—¶ğ—»ğ—´ ğ—˜ğ—¾ğ˜‚ğ—¶ğ—½ğ—ºğ—²ğ—»ğ˜\n\nBronneberg B.V. specializes in engineering and manufacturing advanced hydraulic systems for the recycling industry, including:\n\nâ€¢ Scrap guillotine shears\nâ€¢ Scrap balers\nâ€¢ Cable recycling plants & cable strippers\nâ€¢ Cable Stripping Machines\nâ€¢ Alligator Shears\n\n...and more!\n\nBronneberg B.V. offers worldwide delivery of complete, turnkey recycling plants and provides servicing for all brands of equipment. See them in November on the 10th & 11th at the Recycling Expo in Riyadh!\n\n#Bronneberg #RecyclingIndustry #RiyadhExpo #Sustainability #MiddleEastRecycling #CircularEconomy",
    "likes": "23",
    "comments": "2",
    "shares": "4",
    "time": {
      "raw": "4g",
      "parsed": "09.05.2025",
      "isoString": "2025-05-09T06:13:28.483Z"
    },
    "mediaType": "image",
    "mediaContent": [
      "https://media.licdn.com/dms/image/v2/D4E22AQG-Gzc0xbUeRQ/feedshare-shrink_800/B4EZavd9cqHkAg-/0/1746700589980?e=1750291200&v=beta&t=wtMb3aBeXKIvnwhQhH4FVf-mZ-NBhLuxqUgcV0TCU5U"
    ],
    "date": "2025-05-09T06:13:28.483Z"
  }
]