[
  {
    "captions": "TAURUS BLULINE SHEAR BALER\nT 1300\nAlways a step ahead!\n.\nFor more info:\ninfo@taurusweb.it\nwww.taurusweb.it\n\n#Taurus #shearbaler #pressa #pressacesoia #presse #pressecisaille #cisaille #prensa #compactadora #chatarras #chatarreria #sucata #scrap #scrapyard #Scrapmachine #scrapequipment #recycling #recyclingequipment #HeavyDuty #heavyequipment #heavymachine #rottame #madeinitaly TAURUS BLULINE SHEAR BALER\nT 1300\nAlways a step ahead!\n.\nFor more info:\ninfo@taurusweb.it\nwww.taurusweb.it\n\n#Taurus #shearbaler #pressa #pressacesoia #presse #pressecisaille #cisaille #prensa #compactadora #chatarras #chatarreria #sucata #scrap #scrapyard #Scrapmachine #scrapequipment #recycling #recyclingequipment #HeavyDuty #heavyequipment #heavymachine #rottame #madeinitaly",
    "likes": "32",
    "comments": "1",
    "shares": "3",
    "time": {
      "raw": "3ay",
      "parsed": "27.02.2025",
      "isoString": "2025-02-27T04:59:42.302Z"
    },
    "mediaType": "image",
    "mediaContent": [
      "https://media.licdn.com/dms/image/v2/D4E22AQHrnGEJrjxgFA/feedshare-shrink_800/B4EZU.EsYaHMAg-/0/1740503173435?e=1751500800&v=beta&t=YRf_YfTCuK7tMJV4OmplfuNOg1FaFZ6gM-PYe9b0v3s"
    ],
    "date": "2025-02-27T04:59:42.302Z"
  },
  {
    "captions": "TAURUS INCLINED SHEAR TR\nThe NeverEnding Shear...\nFor more info:\ninfo@taurusweb.it\nwww.taurusweb.it\n\n#inclinedshear #Taurus #neverending #continousfeeding #shear #shearbaler #cisalleincliné #cisaille #reffaille #scrap #recycling #cesoia #rottame #cesoiainclinata #alimentazionecontinua #cizalla #cizallainclinada #cisalhamentoinclinado #sucata #chatarra #scrapyard #MadeInItaly",
    "likes": "29",
    "shares": "5",
    "time": {
      "raw": "2ay",
      "parsed": "07.03.2025",
      "isoString": "2025-03-07T11:55:24.467Z"
    },
    "mediaType": "video",
    "mediaContent": {
      "src": [
        {
          "src": "https://dms.licdn.com/playlist/vid/v2/D4D05AQF4TRuSqgzU6A/mp4-640p-30fp-crf28/B4DZUitGFQHIBc-/0/1740044015092?e=1747224000&v=beta&t=yrrd5ibrwfWXsjanDU0JCt9pyB4BpsdePaDhPEpnI88",
          "type": "video/mp4",
          "data-bitrate": 586050
        }
      ],
      "posterUrl": "https://media.licdn.com/dms/image/v2/D4D05AQF4TRuSqgzU6A/videocover-high/B4DZUitGFQHIBs-/0/1740044008670?e=1747224000&v=beta&t=dRK_Kr9V0lsa5bl8jJmad6OPnT-ie5UGvN3Md5BE89k"
    },
    "date": "2025-03-07T11:55:24.467Z"
  },
  {
    "captions": "TAURUS SHEAR BALER ELLE (loading - unloading)\nShearing force t 1000\nDiscover more:\nhttps://lnkd.in/dDe3xUQA\n.\nFor more info:\ninfo@taurusweb.it\nwww.taurusweb.it\n\n#Taurus #shearbaler #Loading #unloading #liftingjacks #recycling #scrapyard #recyclingequipment #scrapunit #madeinitaly #recyclingtechnology #CircularEconomy #transportableshear #cisailletransportable #cisaille #presse #Recyclage #Ferrailleur #ferraille #compactadora #prensa #cizalla #sucata #sucateiro  TAURUS SHEAR BALER ELLE (loading - unloading)\nShearing force t 1000\nDiscover more:\nhttps://lnkd.in/dDe3xUQA\n.\nFor more info:\ninfo@taurusweb.it\nwww.taurusweb.it\n\n#Taurus #shearbaler #Loading #unloading #liftingjacks #recycling #scrapyard #recyclingequipment #scrapunit #madeinitaly #recyclingtechnology #CircularEconomy #transportableshear #cisailletransportable #cisaille #presse #Recyclage #Ferrailleur #ferraille #compactadora #prensa #cizalla #sucata #sucateiro",
    "likes": "22",
    "shares": "3",
    "time": {
      "raw": "2ay",
      "parsed": "07.03.2025",
      "isoString": "2025-03-07T11:55:24.470Z"
    },
    "mediaType": "image",
    "mediaContent": [
      "https://media.licdn.com/dms/image/v2/D4D22AQGsVcevffXIIg/feedshare-shrink_800/B4DZUZyA0gGcAk-/0/1739894296515?e=1749686400&v=beta&t=zT4jGYsSAu0VKT4Y1C7ps6EufrBjZx99hQtyW6oOc9M"
    ],
    "date": "2025-03-07T11:55:24.470Z"
  },
  {
    "captions": "The new TAURUS brochure is online,\nVisit our website:\nhttps://lnkd.in/dcqvQwwE\n.\nTAURUS, Always a step ahead!\n\n#Taurus #brochure2025 #production #redline #BluLine #BlackLine #shears #shearbaler #inclinedshear #hammermill #pressecisaille #preshredder #pré-broyeur #broyeur #premacinatore #mulinomartelli #pressacesoia #pressa #cesoiainclinata #cisailleincliné #scrapequipment #scrapunit #scrap #Ferrailleur #ferraille #scrapyard #chatarras #compactadora #sucata #sucateiroThe new TAURUS brochure is online,\nVisit our website:\nhttps://lnkd.in/dcqvQwwE\n.\nTAURUS, Always a step ahead!\n\n#Taurus #brochure2025 #production #redline #BluLine #BlackLine #shears #shearbaler #inclinedshear #hammermill #pressecisaille #preshredder #pré-broyeur #broyeur #premacinatore #mulinomartelli #pressacesoia #pressa #cesoiainclinata #cisailleincliné #scrapequipment #scrapunit #scrap #Ferrailleur #ferraille #scrapyard #chatarras #compactadora #sucata #sucateiro",
    "likes": "12",
    "shares": "4",
    "time": {
      "raw": "2ay",
      "parsed": "07.03.2025",
      "isoString": "2025-03-07T11:55:24.473Z"
    },
    "mediaType": "image",
    "mediaContent": [
      "https://media.licdn.com/dms/image/v2/D4D22AQGCwF2hJEQtrg/feedshare-shrink_800/B4DZT_yAjPHAAk-/0/1739458088733?e=1749686400&v=beta&t=DbQOOq6QQbSCsOEwRUaWn01dRd3mxndt-lgkz52IwMc"
    ],
    "date": "2025-03-07T11:55:24.473Z"
  },
  {
    "captions": "TR: THE TAURUS INCLINE SHEAR\nshearing force up to 1800 t\ninstalled power up to 950 kw\nhttps://lnkd.in/dXtfMU-m\n.\nFor more info:\ninfo@taurusweb.it\nwww.taurusweb.it\n#tr #Taurus #inclinedshear #shears #scrap #cesoiainclinata #cesoia #rottame #recycling #Ferrailleur #compactadora #cizalla #pressecisaille #presse #guillotines #Recyclage #Ferrailleur #sucata #sucateros #chatarra #prensa #scrapyard #madeinitaly #scrapunit #Scrapmachine #scrapequipment TR: THE TAURUS INCLINE SHEAR\nshearing force up to 1800 t\ninstalled power up to 950 kw\nhttps://lnkd.in/dXtfMU-m\n.\nFor more info:\ninfo@taurusweb.it\nwww.taurusweb.it\n#tr #Taurus #inclinedshear #shears #scrap #cesoiainclinata #cesoia #rottame #recycling #Ferrailleur #compactadora #cizalla #pressecisaille #presse #guillotines #Recyclage #Ferrailleur #sucata #sucateros #chatarra #prensa #scrapyard #madeinitaly #scrapunit #Scrapmachine #scrapequipment",
    "likes": "29",
    "comments": "1",
    "shares": "1",
    "time": {
      "raw": "2ay",
      "parsed": "07.03.2025",
      "isoString": "2025-03-07T11:55:24.476Z"
    },
    "mediaType": "image",
    "mediaContent": [
      "https://media.licdn.com/dms/image/v2/D4D22AQEgkSnzcSYa6w/feedshare-shrink_800/B4DZT1YQSDHwAo-/0/1739283564181?e=1749686400&v=beta&t=nX9Ws1H_RXRwZkf5qtnyEnZZuDg_jnNG3LWNz9ws0tM"
    ],
    "date": "2025-03-07T11:55:24.476Z"
  },
  {
    "captions": "TAURUS shear baler QUATTRO\nT 1400\n.\nFor more info:\nInfo@taurusweb.it\nwww.taurusweb.it\n\n #taurus #shearbaler #4x4 #pressacesoia #prensa #compactadora #cisaille #presse\n #ferraille #sucata #chatarra #rottame #scrap #scrapmachine #recycling #scrapequipment #recyclingtechnic #madeinitalyTAURUS shear baler QUATTRO\nT 1400\n.\nFor more info:\nInfo@taurusweb.it\nwww.taurusweb.it\n\n #taurus #shearbaler #4x4 #pressacesoia #prensa #compactadora #cisaille #presse\n #ferraille #sucata #chatarra #rottame #scrap #scrapmachine #recycling #scrapequipment #recyclingtechnic #madeinitaly",
    "likes": "25",
    "shares": "2",
    "time": {
      "raw": "3ay",
      "parsed": "07.02.2025",
      "isoString": "2025-02-07T11:55:24.479Z"
    },
    "mediaType": "image",
    "mediaContent": [
      "https://media.licdn.com/dms/image/v2/D4D22AQH-62tOYBwdsw/feedshare-shrink_800/B4DZTWuhzcH0Ag-/0/1738769310326?e=1749686400&v=beta&t=qwYw03Ij6JW3mPvwxS6VjJ1mrwFfUj_5PnzpBTnBZ2A"
    ],
    "date": "2025-02-07T11:55:24.479Z"
  },
  {
    "captions": "A TAURUS SECOND HAND MACHINE\nCutting force T 700\nBox length mm 6000\nCylinder per wing n.2\nElectric motor\n.\nFor more info:\ninfo@taurusweb.it\nwww.taurusweb.it\n#Taurus #shearbaler #secondhand #used #usedmachines #diesel #RecyclingTech #recyclingequipment #recyclingmachine #Scrapmachine #scrap #scrapunit #scrapyard #pressacesoia #cesoia #pressa #rottamepesante #rottame #raccolta #chatarra #sucata #compactadora #fierrosargentinos #fierros #prensa #Ferrailleur #ferraille #Presse  #cisailleA TAURUS SECOND HAND MACHINE\nCutting force T 700\nBox length mm 6000\nCylinder per wing n.2\nElectric motor\n.\nFor more info:\ninfo@taurusweb.it\nwww.taurusweb.it\n#Taurus #shearbaler #secondhand #used #usedmachines #diesel #RecyclingTech #recyclingequipment #recyclingmachine #Scrapmachine #scrap #scrapunit #scrapyard #pressacesoia #cesoia #pressa #rottamepesante #rottame #raccolta #chatarra #sucata #compactadora #fierrosargentinos #fierros #prensa #Ferrailleur #ferraille #Presse  #cisaille",
    "likes": "30",
    "comments": "1",
    "shares": "5",
    "time": {
      "raw": "3ay",
      "parsed": "07.02.2025",
      "isoString": "2025-02-07T11:55:24.482Z"
    },
    "mediaType": "image",
    "mediaContent": [
      "https://media.licdn.com/dms/image/v2/D4D22AQGK34sS9bzb_w/feedshare-shrink_800/B4DZS9GYMpGkAg-/0/1738339354429?e=1749686400&v=beta&t=d5zVPHTY67T1iFcETCDU3L-BqByM5OTHISUYfGwahsg"
    ],
    "date": "2025-02-07T11:55:24.482Z"
  },
  {
    "captions": "Il nuovo Consiglio d'Amministrazione TAURUS 2025. \nGiovanni Colombo, Chiara Di Montegnacco Colombo e Marta Colombo. \nPresidente Onorario Peter Beyeler perché anche grazie a lui le presse cesoie TAURUS sono le migliori!\nTAURUS, Always a step ahead!\n\nThe new Board of Directors of TAURUS 2025. \nGiovanni Colombo, Chiara Di Montegnacco Colombo and Marta Colombo. \nHonorary President Peter Beyeler because also thanks to him TAURUS shear balers are the best!\nTAURUS, always a step ahead!Il nuovo Consiglio d'Amministrazione TAURUS 2025. \nGiovanni Colombo, Chiara Di Montegnacco Colombo e Marta Colombo. \nPresidente Onorario Peter Beyeler perché anche grazie a lui le presse cesoie TAURUS sono le migliori!\nTAURUS, Always a step ahead!\n\nThe new Board of Directors of TAURUS 2025. \nGiovanni Colombo, Chiara Di Montegnacco Colombo and Marta Colombo. \nHonorary President Peter Beyeler because also thanks to him TAURUS shear balers are the best!\nTAURUS, always a step ahead!",
    "likes": "36",
    "comments": "5",
    "shares": "1",
    "time": {
      "raw": "2ay",
      "parsed": "14.02.2025",
      "isoString": "2025-02-14T04:47:29.421Z"
    },
    "mediaType": "image",
    "mediaContent": [
      "https://media.licdn.com/dms/image/v2/D4D22AQEWcyqb0_FzGg/feedshare-shrink_2048_1536/B4DZSJz67yG4Aw-/0/1737478877363?e=1747267200&v=beta&t=eyFrQ9zajNLCiMCGPvebtETES_gvMG24fKTjfw7DuXk"
    ],
    "date": "2025-02-14T04:47:29.421Z"
  },
  {
    "captions": "“CAT”, the transportable shear baler on tracked vehicle that adapts to your working needs.\nThe transportable shear baler has 2 independent remote controls, one for the shear and the other one for the traked vehicle: \"2\" is for safety, \"2\" is for ease of use; \"2\" is for not making mistakes, \"2\" is because 2 are the machines that make up the unit.\nDiscover more:\nhttps://lnkd.in/dHqMhpZJ\n.\nFor more info:\ninfo@taurusweb.it\nwww.taurusweb.it\n\n#Taurus #cat #tracks #transportable #shearbaler #pressacesoia #cingoli #mezzocingolato #trasportabile #scrapunit #scrapyard #cantiere #rottame #rottamepesante #recyclingmachines #RecyclingTech #recyclingequipment #recycling #Scrapmachine #madeinitaly “CAT”, the transportable shear baler on tracked vehicle that adapts to your working needs.\nThe transportable shear baler has 2 independent remote controls, one for the shear and the other one for the traked vehicle: \"2\" is for safety, \"2\" is for ease of use; \"2\" is for not making mistakes, \"2\" is because 2 are the machines that make up the unit.\nDiscover more:\nhttps://lnkd.in/dHqMhpZJ\n.\nFor more info:\ninfo@taurusweb.it\nwww.taurusweb.it\n\n#Taurus #cat #tracks #transportable #shearbaler #pressacesoia #cingoli #mezzocingolato #trasportabile #scrapunit #scrapyard #cantiere #rottame #rottamepesante #recyclingmachines #RecyclingTech #recyclingequipment #recycling #Scrapmachine #madeinitaly",
    "likes": "51",
    "comments": "1",
    "shares": "4",
    "time": {
      "raw": "2ay",
      "parsed": "14.02.2025",
      "isoString": "2025-02-14T04:47:29.423Z"
    },
    "mediaType": "image",
    "mediaContent": [
      "https://media.licdn.com/dms/image/v2/D4D22AQHKzKHOyak7TQ/feedshare-shrink_800/B4DZR1AofsHkAg-/0/1737129889463?e=1747267200&v=beta&t=XS04IuRMOA8XU-IfWaRl0Q8EjqQU9F79qLxvBR4b1kU"
    ],
    "date": "2025-02-14T04:47:29.423Z"
  },
  {
    "captions": "TAURUS shear baler QUATTRO\nAlways a step ahead!\n.\nFor more info:\ninfo@taurusweb.it\nwww.taurusweb.it\n#Taurus #shearbaler #Scrapmachine #scrapyard #scrap #rottame #pressacesoia #recyclingtechnology #RecyclingTech #Ferrailleur #ferraille #pressecisaille #Ferrailleur #presse #cylinder #4x4 #chatarras #chatarreros #sucata #circulareconomy #madeinitaly #recyclingequipment #heavyscrap #demolition #rottamepesante #heavyequipment #heavy #lightTAURUS shear baler QUATTRO\nAlways a step ahead!\n.\nFor more info:\ninfo@taurusweb.it\nwww.taurusweb.it\n#Taurus #shearbaler #Scrapmachine #scrapyard #scrap #rottame #pressacesoia #recyclingtechnology #RecyclingTech #Ferrailleur #ferraille #pressecisaille #Ferrailleur #presse #cylinder #4x4 #chatarras #chatarreros #sucata #circulareconomy #madeinitaly #recyclingequipment #heavyscrap #demolition #rottamepesante #heavyequipment #heavy #light",
    "likes": "20",
    "shares": "4",
    "time": {
      "raw": "2ay",
      "parsed": "14.02.2025",
      "isoString": "2025-02-14T04:47:29.424Z"
    },
    "mediaType": "image",
    "mediaContent": [
      "https://media.licdn.com/dms/image/v2/D4D22AQGKJZaKu4NcIg/feedshare-shrink_800/B4DZRq18ubHYAg-/0/1736959315696?e=1747267200&v=beta&t=vdgvqgJFJRnmr291QR6rMoJuevO7iFLR8-o1pfm7oqE"
    ],
    "date": "2025-02-14T04:47:29.424Z"
  },
  {
    "captions": "HAPPY NEW 2025 \nby CHAOS\n.\nFor more info:\ninfo@taurusweb.it\nwww.taurusweb.it\n\n#TAURUS #shearbale #pressacesoia #rottame #scrap #recycling #riciclo #circulareconomy #recyclingequipment #scrapmachine #scrapyard #rottamaio #ferraille #pressecisaille #compactadora #chatarra #sucata #cisalla #recyclingtechnology HAPPY NEW 2025 \nby CHAOS\n.\nFor more info:\ninfo@taurusweb.it\nwww.taurusweb.it\n\n#TAURUS #shearbale #pressacesoia #rottame #scrap #recycling #riciclo #circulareconomy #recyclingequipment #scrapmachine #scrapyard #rottamaio #ferraille #pressecisaille #compactadora #chatarra #sucata #cisalla #recyclingtechnology",
    "likes": "16",
    "shares": "2",
    "time": {
      "raw": "3ay",
      "parsed": "14.01.2025",
      "isoString": "2025-01-14T04:47:29.426Z"
    },
    "mediaType": "image",
    "mediaContent": [
      "https://media.licdn.com/dms/image/v2/D4D22AQEtJfFJHszh6A/feedshare-shrink_800/B4DZRgVVAAHIAs-/0/1736782992024?e=1747267200&v=beta&t=qROB5emzE9ud5Ny5T7S8KRSWNk6O08XQZovy85c_WWk"
    ],
    "date": "2025-01-14T04:47:29.426Z"
  },
  {
    "captions": "E762 - shearing force T 700\nA versatile machine that produces light scrap, E.L.V and collected scrap to be sent to mill. It is capable of shearing heavy scrap and demolition scrap ready for fournace  with low operating costs.\nAN INVESTMENT THAT PAYS ITSELF QUICKLY!\nhttps://lnkd.in/dqVxv-XU\n.\nFor more info:\ninfo@taurusweb.it\nwww.taurusweb.it\n\n#Taurus #shearbaler #cisalle  #prensacizalla #pressacesoia #rottame #scrap #ferraille #chatarra #sucata #sucatas #circulareconomy #Scrapmachine #Technology #scrapequipment #scraplife #scrapmetalrecycling #scrapmetal #recyclingequipment #hydraulics #HydraulicMachine #madeinitaly #metalrecycling E762 - shearing force T 700\nA versatile machine that produces light scrap, E.L.V and collected scrap to be sent to mill. It is capable of shearing heavy scrap and demolition scrap ready for fournace  with low operating costs.\nAN INVESTMENT THAT PAYS ITSELF QUICKLY!\nhttps://lnkd.in/dqVxv-XU\n.\nFor more info:\ninfo@taurusweb.it\nwww.taurusweb.it\n\n#Taurus #shearbaler #cisalle  #prensacizalla #pressacesoia #rottame #scrap #ferraille #chatarra #sucata #sucatas #circulareconomy #Scrapmachine #Technology #scrapequipment #scraplife #scrapmetalrecycling #scrapmetal #recyclingequipment #hydraulics #HydraulicMachine #madeinitaly #metalrecycling",
    "likes": "17",
    "shares": "1",
    "time": {
      "raw": "3ay",
      "parsed": "14.01.2025",
      "isoString": "2025-01-14T04:47:29.427Z"
    },
    "mediaType": "image",
    "mediaContent": [
      "https://media.licdn.com/dms/image/v2/D4D22AQEPjiL8H_i7ZA/feedshare-shrink_800/B4DZRQj6AHHkAg-/0/1736518378924?e=1747267200&v=beta&t=x4DAfsk12pCFUxQ-PnXJ8pV_fcu9WGqRS9LNeR-an2c"
    ],
    "date": "2025-01-14T04:47:29.427Z"
  },
  {
    "captions": "TAURUS wishes you a Happy New Year!TAURUS wishes you a Happy New Year!",
    "likes": "13",
    "comments": "1",
    "time": {
      "raw": "3ay",
      "parsed": "14.01.2025",
      "isoString": "2025-01-14T04:47:29.429Z"
    },
    "mediaType": "image",
    "mediaContent": [
      "https://media.licdn.com/dms/image/v2/D4D22AQE1R30P6qcreQ/feedshare-shrink_800/B4DZQXLyLdGkAg-/0/1735555753123?e=1747267200&v=beta&t=yfI_BjtBaKL2JPJWwI6zTnVy1iuqEXtdTiMPK2XWWio"
    ],
    "date": "2025-01-14T04:47:29.429Z"
  },
  {
    "captions": "Merry Christmas and Happy New Year!\nby TAURUS\n\n#Taurus #shearbaler #scrap #scrapbale #Gift #christmasgifts #makeawish #christmas2024 #NewYear2025 #italy #madeinitaly #recyclingequipment #recycling #CircularEconomy #Scrapmachine #scrapprocessing #scrapsolution Merry Christmas and Happy New Year!\nby TAURUS\n\n#Taurus #shearbaler #scrap #scrapbale #Gift #christmasgifts #makeawish #christmas2024 #NewYear2025 #italy #madeinitaly #recyclingequipment #recycling #CircularEconomy #Scrapmachine #scrapprocessing #scrapsolution",
    "likes": "8",
    "shares": "1",
    "time": {
      "raw": "3ay",
      "parsed": "14.01.2025",
      "isoString": "2025-01-14T04:47:29.430Z"
    },
    "mediaType": "image",
    "mediaContent": [
      "https://media.licdn.com/dms/image/v2/D4D22AQFqlp-E-vjqVQ/feedshare-shrink_800/B4DZPjhg6MGUAg-/0/1734689035118?e=1747267200&v=beta&t=G0isDxT_berUK6JQ1AzpeCWsPvO0fT0Rf0Xp79Q8rEM"
    ],
    "date": "2025-01-14T04:47:29.430Z"
  },
  {
    "captions": "TAURUS SHEAR BALER EVO\nT 650\nIvo Nyffenegger\n.\nFor more info:\ninfo@taurusweb.it\nwww.taurusweb.it\n\n#Taurus #shearbaler #recyclingequipment #recyclingmachine\n#scrapprocessing #Scrapmachine #scrap #MadeInItaly #circulareconomy #recyclingtechniqueTAURUS SHEAR BALER EVO\nT 650\nIvo Nyffenegger\n.\nFor more info:\ninfo@taurusweb.it\nwww.taurusweb.it\n\n#Taurus #shearbaler #recyclingequipment #recyclingmachine\n#scrapprocessing #Scrapmachine #scrap #MadeInItaly #circulareconomy #recyclingtechnique",
    "likes": "20",
    "shares": "2",
    "time": {
      "raw": "2ay",
      "parsed": "05.01.2025",
      "isoString": "2025-01-05T10:28:38.321Z"
    },
    "mediaType": "image",
    "mediaContent": [
      "https://media.licdn.com/dms/image/v2/D4D22AQGE28J70eOs_Q/feedshare-shrink_800/B4DZPVZ2cKHgAg-/0/1734452144538?e=1744243200&v=beta&t=gS447kq8M2JhGoRQtyB4dvKhUyRSpyuXrPJjFfpl6-c"
    ],
    "date": "2025-01-05T10:28:38.321Z"
  },
  {
    "captions": "CHAOS SHEAR BALER\nby TAURUS\n.\nFor more info:\ninfo@taurusweb.it\nwww.taurusweb.it\n\n#Taurus #pressacesoia #shearbaler #chaos #technology #future #futuremachine #equipment #discover #madeinitaly #Recyclingtechnik #recycling #Scrapmachine #scrapprocessing #Ferrailleur #chatarra #sucataCHAOS SHEAR BALER\nby TAURUS\n.\nFor more info:\ninfo@taurusweb.it\nwww.taurusweb.it\n\n#Taurus #pressacesoia #shearbaler #chaos #technology #future #futuremachine #equipment #discover #madeinitaly #Recyclingtechnik #recycling #Scrapmachine #scrapprocessing #Ferrailleur #chatarra #sucata",
    "likes": "15",
    "shares": "2",
    "time": {
      "raw": "2ay",
      "parsed": "05.01.2025",
      "isoString": "2025-01-05T10:28:38.322Z"
    },
    "mediaType": "image",
    "mediaContent": [
      "https://media.licdn.com/dms/image/v2/D4D22AQHXOdplL3HiGw/feedshare-shrink_800/feedshare-shrink_800/0/1733849598407?e=1744243200&v=beta&t=Ilb86hrAN2_HL93Ul3K9iwgj6eBN1SpptyJHAO0A1vY"
    ],
    "date": "2025-01-05T10:28:38.322Z"
  },
  {
    "captions": "TAURUS SHEAR BALER \nT 1400\nTESTING TIME\n.\nFor more info:\ninfo@taurusweb.it\nwww.taurusweb.it\n\n#Taurus #shearbaler #HeavyDutyEquipment #heavydutymachines #heavydutyshear #shearing #TestingMachine #scrapprocessing #Scrapmachine #Recyclingtechnik #recyclingequipment #RecyclingTechnology #rottame #cesoia #pressacesoia #reciclagem #recyclage #Recycle #circulareconomy #demolizione #collaudo #cisaille #pressecisaille #ferraille #Ferrailleur #compactadora #sucata #prensa #cisalla #chatarra",
    "likes": "50",
    "comments": "3",
    "shares": "4",
    "time": {
      "raw": "3ay",
      "parsed": "05.12.2024",
      "isoString": "2024-12-05T10:28:38.323Z"
    },
    "mediaType": "video",
    "mediaContent": {
      "src": [
        {
          "src": "https://dms.licdn.com/playlist/vid/v2/D4D05AQFqyBTT3brUCA/mp4-640p-30fp-crf28/mp4-640p-30fp-crf28/0/1733324113930?e=1741777200&v=beta&t=bg3udrgKdDTzUFDKHo-lbydaVFZQZzF9P8GNFpyBaSU",
          "type": "video/mp4",
          "data-bitrate": 297858
        },
        {
          "src": "https://dms.licdn.com/playlist/vid/v2/D4D05AQFqyBTT3brUCA/mp4-720p-30fp-crf28/mp4-720p-30fp-crf28/0/1733324116342?e=1741777200&v=beta&t=TrgPUIbrlKctSQ2G05L9T7YvGwY-xCW3RPWNHGP3qNk",
          "type": "video/mp4",
          "data-bitrate": 403074
        }
      ],
      "posterUrl": "https://media.licdn.com/dms/image/v2/D4D05AQFqyBTT3brUCA/videocover-high/videocover-high/0/1733324103614?e=1741777200&v=beta&t=HsmLX9qeu71Mu4yYzvuME11KQvSjAhb6gxbGHVbofkc"
    },
    "date": "2024-12-05T10:28:38.323Z"
  },
  {
    "captions": "Dopo 40.000 ore di onorato lavoro\nil nuovo che avanza!\n.\nPer maggiori informazioni:\ninfo@taurusweb.it\nwww.taurusweb.it\n\n#taurus #4x4 #shearbaler #scrapprocessing #Scrapmachine #Recyclingtechnik #recyclingequipment #scraprecycling #recycling #madeinitaly #heavydutyequipment #heavydutymachines #rottami #rottame #pressacesoia #cisaille #pressecisaille #prensa #cisalla #compactadora #chatarreros #sucata #chatarra  Dopo 40.000 ore di onorato lavoro\nil nuovo che avanza!\n.\nPer maggiori informazioni:\ninfo@taurusweb.it\nwww.taurusweb.it\n\n#taurus #4x4 #shearbaler #scrapprocessing #Scrapmachine #Recyclingtechnik #recyclingequipment #scraprecycling #recycling #madeinitaly #heavydutyequipment #heavydutymachines #rottami #rottame #pressacesoia #cisaille #pressecisaille #prensa #cisalla #compactadora #chatarreros #sucata #chatarra",
    "likes": "23",
    "shares": "2",
    "time": {
      "raw": "3ay",
      "parsed": "05.12.2024",
      "isoString": "2024-12-05T10:28:38.325Z"
    },
    "mediaType": "image",
    "mediaContent": [
      "https://media.licdn.com/dms/image/v2/D4D22AQFh9CU52YAvSA/feedshare-shrink_800/feedshare-shrink_800/0/1732811826392?e=1744243200&v=beta&t=Pw4N8Q0aw-xlA_3RLLzgQN58fszADGmVSeXbtu5eRpY"
    ],
    "date": "2024-12-05T10:28:38.325Z"
  },
  {
    "captions": "TAURUS BLULINE shear baler \n750 T\n.\nFor more info:\ninfo@taurusweb.it\nwww.taurusweb.it\n\n#Taurus #shearbaler #shear #cuttingforce #scrapprocessing #scrap #Scrapmachine #rottame #chatarra #chatarreros #Ferrailleur #ferraille #madeinitaly #pressacesoia #pressa #Recyclingtechnik #recyclingequipment #recyclage #recycling #recyclingsolutions",
    "likes": "17",
    "shares": "4",
    "time": {
      "raw": "3ay",
      "parsed": "05.12.2024",
      "isoString": "2024-12-05T10:28:38.326Z"
    },
    "mediaType": "video",
    "mediaContent": {
      "src": [
        {
          "src": "https://dms.licdn.com/playlist/vid/v2/D4D05AQHpOtQpUtE-TQ/mp4-640p-30fp-crf28/mp4-640p-30fp-crf28/0/1732552750210?e=1741777200&v=beta&t=CbsRddg7d_iEK_CuA9hYtWVECFymZEevADHlg3Ikf9Q",
          "type": "video/mp4",
          "data-bitrate": 547984
        },
        {
          "src": "https://dms.licdn.com/playlist/vid/v2/D4D05AQHpOtQpUtE-TQ/mp4-720p-30fp-crf28/mp4-720p-30fp-crf28/0/1732552750704?e=1741777200&v=beta&t=djgvr6oYp1kompqjEIQdFvtD1MhaQRxxhGj4uQp4Mr0",
          "type": "video/mp4",
          "data-bitrate": 653600
        }
      ],
      "posterUrl": "https://media.licdn.com/dms/image/v2/D4D05AQHpOtQpUtE-TQ/videocover-high/videocover-high/0/1732552742996?e=1741777200&v=beta&t=ouVHNh9QPkLD6bXJzm5CWn-Lpu9LfzEh09x52g4I8Vc"
    },
    "date": "2024-12-05T10:28:38.326Z"
  },
  {
    "captions": "TAURUS BLULINE SHEAR BALER\nT 800\nIvo Nyffenegger\n.\nFor more info:\ninfo@taurusweb.it\nwww.taurusweb.it\n\n#Taurus #pressacesoia #pressa #cesoia #shearingforce #shears #Balers #shearbalers #scrapequiment #scrap #Scrapmachine #Recyclingtechnik #recyclingequipment #recycling #heavymachine #circulareconomy #cisalla #prensa #cisalle #compactadora #chatarra #Ferrailleur #ferraille #chatarreros #sucata #maquinasindustriales #prensadecorte TAURUS BLULINE SHEAR BALER\nT 800\nIvo Nyffenegger\n.\nFor more info:\ninfo@taurusweb.it\nwww.taurusweb.it\n\n#Taurus #pressacesoia #pressa #cesoia #shearingforce #shears #Balers #shearbalers #scrapequiment #scrap #Scrapmachine #Recyclingtechnik #recyclingequipment #recycling #heavymachine #circulareconomy #cisalla #prensa #cisalle #compactadora #chatarra #Ferrailleur #ferraille #chatarreros #sucata #maquinasindustriales #prensadecorte",
    "likes": "28",
    "shares": "2",
    "time": {
      "raw": "3ay",
      "parsed": "04.12.2024",
      "isoString": "2024-12-04T10:39:11.838Z"
    },
    "mediaType": "image",
    "mediaContent": [
      "https://media.licdn.com/dms/image/v2/D4D22AQHjHO7DIjhTig/feedshare-shrink_800/feedshare-shrink_800/0/1732285313726?e=1744243200&v=beta&t=bcH4hoZM9y2TDjCRmsUI-qfs0fPKa52xnERDgm_PgZw"
    ],
    "date": "2024-12-04T10:39:11.838Z"
  },
  {
    "captions": "TAURUS SHEAR BALER RAPID\nT 1100\n.\nFor more info:\ninfo@taurusweb.it\nwww.taurusweb.it\n#Taurus #shearbaler #shear #pressacesoia #cesoia  #rottame #scrapequipment #Scrapmachine #scrap #scrapyard #Ferrailleur #ferraille #pressecisaille #ghigliottina #recyclage #recycling #recyclingequipment #recyclingtechnology #Rapide #sucata #chatarras #prensa #compactadora #prensadecorte #cisalhamentoTAURUS SHEAR BALER RAPID\nT 1100\n.\nFor more info:\ninfo@taurusweb.it\nwww.taurusweb.it\n#Taurus #shearbaler #shear #pressacesoia #cesoia  #rottame #scrapequipment #Scrapmachine #scrap #scrapyard #Ferrailleur #ferraille #pressecisaille #ghigliottina #recyclage #recycling #recyclingequipment #recyclingtechnology #Rapide #sucata #chatarras #prensa #compactadora #prensadecorte #cisalhamento",
    "likes": "23",
    "shares": "5",
    "time": {
      "raw": "2ay",
      "parsed": "02.04.2025",
      "isoString": "2025-04-02T11:57:23.904Z"
    },
    "mediaType": "image",
    "mediaContent": [
      "https://media.licdn.com/dms/image/v2/D4D22AQEooxLiroy0Lw/feedshare-shrink_800/B4DZVhceuUHYAk-/0/1741096611220?e=1751500800&v=beta&t=w-6Gsj45WQqOvq4uBWNokk9FVsBG5SEAVCaPwqM2gjI"
    ],
    "date": "2025-04-02T11:57:23.904Z"
  },
  {
    "captions": "TAURUS SHEAR BALER\nCutting force T. 500\nThanks to Ali Bagheban\n.\nfor more info:\ninfo@taurusweb.it\nwww.taurusweb.it\n\n#Taurus #shearbaler #pressacesoia #scrapequipment #Scrapmachine #scrap #Scrapyard #rottame #riciclo #recyclingequipment #recycling #cuttingmachine #cuttingforce #Ferrailleur #ferraille #pressecisaille #prensacizalla #compactadora #prensa #sucata #chatarras #chatarreros #GuillotineTAURUS SHEAR BALER\nCutting force T. 500\nThanks to Ali Bagheban\n.\nfor more info:\ninfo@taurusweb.it\nwww.taurusweb.it\n\n#Taurus #shearbaler #pressacesoia #scrapequipment #Scrapmachine #scrap #Scrapyard #rottame #riciclo #recyclingequipment #recycling #cuttingmachine #cuttingforce #Ferrailleur #ferraille #pressecisaille #prensacizalla #compactadora #prensa #sucata #chatarras #chatarreros #Guillotine",
    "likes": "14",
    "shares": "3",
    "time": {
      "raw": "2ay",
      "parsed": "02.04.2025",
      "isoString": "2025-04-02T11:57:23.902Z"
    },
    "mediaType": "image",
    "mediaContent": [
      "https://media.licdn.com/dms/image/v2/D4D22AQEdc0pNuI__iw/feedshare-shrink_800/B4DZWLJrAAH4Ak-/0/1741796324020?e=1751500800&v=beta&t=Btmp5QqXiBDiybXYx0GaT6nS3xnrrmiX4cklMiqwJgc"
    ],
    "date": "2025-04-02T11:57:23.902Z"
  },
  {
    "captions": "BIENVENUE EN FRANCE \n.\nplus d'informations:\ninfo@taurusweb.it\nwww.taurusweb.it\n#Taurus #france #Ferrailleur #ferraille #pressecisaille #presse #force #scrapequipment #machine #maquinaspesadas #chatarras #scrapyard #compactadora #sucatas #pressacesoia #shearbaler #recyclingequipment #recyclingmachine #recyclageBIENVENUE EN FRANCE \n.\nplus d'informations:\ninfo@taurusweb.it\nwww.taurusweb.it\n#Taurus #france #Ferrailleur #ferraille #pressecisaille #presse #force #scrapequipment #machine #maquinaspesadas #chatarras #scrapyard #compactadora #sucatas #pressacesoia #shearbaler #recyclingequipment #recyclingmachine #recyclage",
    "likes": "38",
    "comments": "1",
    "shares": "11",
    "time": {
      "raw": "2ay",
      "parsed": "02.04.2025",
      "isoString": "2025-04-02T11:57:23.901Z"
    },
    "mediaType": "image",
    "mediaContent": [
      "https://media.licdn.com/dms/image/v2/D4D22AQERucICEFdINQ/feedshare-shrink_800/B4DZWVnxMhHkAg-/0/1741971986140?e=1751500800&v=beta&t=ghYOBaOxV9s39He_gQSrG4KtLMrrOypUlRY1Cbw7TlQ"
    ],
    "date": "2025-04-02T11:57:23.901Z"
  },
  {
    "captions": "TAURUS SHEAR BALER CAT 1200 Tons CUTTING FORCE\n\n.\nFor more info:\ninfo@taurusweb.it\nwww.taurusweb.it\n\n#Taurus #cuttingforce #cat #tracks #trackvehicle #shearbaler #shear #scrapequipment #scrapyard #scrap #pressacesoia #CESOIA #rottame #scrapdealer #Ferrailleur #pressecisaille #Presse #prensa #prensacisalla #compactadora #sucatas #chatarras #MadeInItalyTAURUS SHEAR BALER CAT 1200 Tons CUTTING FORCE\n\n.\nFor more info:\ninfo@taurusweb.it\nwww.taurusweb.it\n\n#Taurus #cuttingforce #cat #tracks #trackvehicle #shearbaler #shear #scrapequipment #scrapyard #scrap #pressacesoia #CESOIA #rottame #scrapdealer #Ferrailleur #pressecisaille #Presse #prensa #prensacisalla #compactadora #sucatas #chatarras #MadeInItaly",
    "likes": "22",
    "shares": "5",
    "time": {
      "raw": "2ay",
      "parsed": "02.04.2025",
      "isoString": "2025-04-02T11:57:23.898Z"
    },
    "mediaType": "image",
    "mediaContent": [
      "https://media.licdn.com/dms/image/v2/D4D22AQG2GtbCJyMkxw/feedshare-shrink_800/B4DZW0X50zGcAg-/0/1742487921066?e=1751500800&v=beta&t=UDsyL5dzbJAP-RS0pDXjoALYJg6QVE-rFmIVxhCyVBY"
    ],
    "date": "2025-04-02T11:57:23.898Z"
  },
  {
    "captions": "TAURUS SHEAR BALER CAT10\n.\nFor more info:\ninfo@taurusweb.it\nwww.taurusweb.it\n\n#taurus #shearbaler #cat #track #scrapequipment #scrapyard #scrap #recyclingequipment #recyclingtechnology #circulareconomy #prensa #compactadora #chatarras #chatarreros #Ferrailleur #ferraille #pressecisaille #pressacesoia #rottame #mezzocingolato #cingoli TAURUS SHEAR BALER CAT10\n.\nFor more info:\ninfo@taurusweb.it\nwww.taurusweb.it\n\n#taurus #shearbaler #cat #track #scrapequipment #scrapyard #scrap #recyclingequipment #recyclingtechnology #circulareconomy #prensa #compactadora #chatarras #chatarreros #Ferrailleur #ferraille #pressecisaille #pressacesoia #rottame #mezzocingolato #cingoli",
    "likes": "25",
    "shares": "5",
    "time": {
      "raw": "2ay",
      "parsed": "02.04.2025",
      "isoString": "2025-04-02T11:57:23.899Z"
    },
    "mediaType": "image",
    "mediaContent": [
      "https://media.licdn.com/dms/image/v2/D4D22AQHbC5Dv5z1NFg/feedshare-shrink_800/B4DZWkw1.UHkBs-/0/1742226023103?e=1751500800&v=beta&t=3pVSSZXWOs_CpYQr_10qNK6p_5vOxk-GbCg4IB6GtPk"
    ],
    "date": "2025-04-02T11:57:23.899Z"
  },
  {
    "captions": "Nous tenons à remercier Anna et Frédéric\npour la confiance qu'ils nous ont accordée",
    "likes": "21",
    "shares": "3",
    "time": {
      "raw": "1ay",
      "parsed": "02.05.2025",
      "isoString": "2025-05-02T11:57:23.896Z"
    },
    "mediaType": "video",
    "mediaContent": {
      "src": [
        {
          "src": "https://dms.licdn.com/playlist/vid/v2/D4D05AQFzb5ysmBqNdg/mp4-640p-30fp-crf28/B4DZYgLY7qHABg-/0/1744296597306?e=1749470400&v=beta&t=GEs-lFYeKODRM-Bm8SC9rkT5vIPu4gZQrShNAJx-LhY",
          "type": "video/mp4",
          "data-bitrate": 796442
        }
      ],
      "posterUrl": "https://media.licdn.com/dms/image/v2/D4D05AQFzb5ysmBqNdg/videocover-low/B4DZYgLY7qHACU-/0/1744296591545?e=1749470400&v=beta&t=g_MBdh3pNBAPmZSP9nK9ecScOQ4lJcrQUs6XktrmIHs"
    },
    "date": "2025-05-02T11:57:23.896Z"
  },
  {
    "likes": "9",
    "shares": "1",
    "time": {
      "raw": "2ay",
      "parsed": "25.04.2025",
      "isoString": "2025-04-25T05:18:09.252Z"
    },
    "mediaType": "image",
    "mediaContent": [
      "https://media.licdn.com/dms/image/v2/D4D22AQH4RXBnn03lmg/feedshare-shrink_800/B4DZZJShj1H4Ag-/0/1744986315506?e=1753920000&v=beta&t=DY1XMbdBI8RN8G3x9MFzXPjDGVlV7TIBoSDOYPGSyvk"
    ],
    "date": "2025-04-25T05:18:09.252Z"
  },
  {
    "captions": "TAURUS SHEAR BALER\n850 TONS\n.\nFor more info:\ninfo@taurusweb.it\nwww.taurusweb.it\n\n#Taurus #shearbaler #shear #pressacesoia #cesoia #pressa #tons #scrapequipment #scrapdealer #scrap #scrapyard #scrapyardlife #recycling #recyclingequipment #recyclingunit #rottame #Ferrailleur #ferraille #pressecisaille #presse #sucatas #prensacisalla #compactadora #cisalla TAURUS SHEAR BALER\n850 TONS\n.\nFor more info:\ninfo@taurusweb.it\nwww.taurusweb.it\n\n#Taurus #shearbaler #shear #pressacesoia #cesoia #pressa #tons #scrapequipment #scrapdealer #scrap #scrapyard #scrapyardlife #recycling #recyclingequipment #recyclingunit #rottame #Ferrailleur #ferraille #pressecisaille #presse #sucatas #prensacisalla #compactadora #cisalla",
    "likes": "16",
    "shares": "3",
    "time": {
      "raw": "2ay",
      "parsed": "25.04.2025",
      "isoString": "2025-04-25T05:18:09.254Z"
    },
    "mediaType": "image",
    "mediaContent": [
      "https://media.licdn.com/dms/image/v2/D4D22AQGd3VJtO4ts5w/feedshare-shrink_800/B4DZZEERlKGwAs-/0/1744898694372?e=1753920000&v=beta&t=jvbR886dq-OEgsW8EJCu4z-VMxC-Y2s3l43Q9SzsAU0"
    ],
    "date": "2025-04-25T05:18:09.254Z"
  },
  {
    "captions": "TAURUS SHEAR BALER CAT \nhttps://lnkd.in/dHqMhpZJ\n.\nFor more info:\ninfo@taurusweb.it\nwww.taurusweb.it\n#Taurus #cuttingforce #cat #tracks #trackvehicle #shearbaler #shear #scrapequipment #scrapyard #scrap #pressacesoia #CESOIA #rottame #scrapdealer #Ferrailleur #pressecisaille #Presse #prensa #prensacisalla #compactadora #sucatas #chatarras #MadeInItalyTAURUS SHEAR BALER CAT \nhttps://lnkd.in/dHqMhpZJ\n.\nFor more info:\ninfo@taurusweb.it\nwww.taurusweb.it\n#Taurus #cuttingforce #cat #tracks #trackvehicle #shearbaler #shear #scrapequipment #scrapyard #scrap #pressacesoia #CESOIA #rottame #scrapdealer #Ferrailleur #pressecisaille #Presse #prensa #prensacisalla #compactadora #sucatas #chatarras #MadeInItaly",
    "likes": "12",
    "shares": "3",
    "time": {
      "raw": "2ay",
      "parsed": "20.04.2025",
      "isoString": "2025-04-20T05:04:34.910Z"
    },
    "mediaType": "image",
    "mediaContent": [
      "https://media.licdn.com/dms/image/v2/D4D22AQG9uhw-saE2_A/feedshare-shrink_800/B4DZY512vrHsAk-/0/1744727142059?e=1753315200&v=beta&t=xtN2jVrgbJEFFGkUoYndt7rNomUh2yBVQpiRvdCD_-g"
    ],
    "date": "2025-04-20T05:04:34.910Z"
  },
  {
    "captions": "TAURUS PRE-SHREDDER BRAVO\nprocessing bales\n.\nFor more info:\ninfo@taurusweb.it\n\n#Bravo #preshredder #shreddermachine #rotaryShear #scrapequipment #scrap #scrapyardlife #rottame #premacinatore #bales #pacco #mulino #Martelli #hammermill #hammer #proler #recycling #circulareconomy #madeinitaly",
    "likes": "21",
    "shares": "5",
    "time": {
      "raw": "2ay",
      "parsed": "25.04.2025",
      "isoString": "2025-04-25T05:18:09.251Z"
    },
    "mediaType": "video",
    "mediaContent": {
      "src": [
        {
          "src": "https://dms.licdn.com/playlist/vid/v2/D4D05AQG5gG0yRjpMkA/mp4-720p-30fp-crf28/B4DZZeBQ6YG0BY-/0/1745334170457?e=1751436000&v=beta&t=Xa2ZSg_Fo-u9SX_H5nGngfBTxbPzevq_8Dm1dFxcVBQ",
          "type": "video/mp4",
          "data-bitrate": 1214529
        },
        {
          "src": "https://dms.licdn.com/playlist/vid/v2/D4D05AQG5gG0yRjpMkA/mp4-640p-30fp-crf28/B4DZZeBQ6YG0BU-/0/1745334169420?e=1751436000&v=beta&t=TUGelNU5fUN8w8mjcxHdmydqrxHI6MhCviwplj6wTxM",
          "type": "video/mp4",
          "data-bitrate": 954791
        }
      ],
      "posterUrl": "https://media.licdn.com/dms/image/v2/D4D05AQG5gG0yRjpMkA/videocover-low/B4DZZeBQ6YG0CI-/0/1745334160336?e=1751436000&v=beta&t=cirYLW9g6GpFhHb9vF_XZDiIHU3JsjBRfgd6RJ2cgjg"
    },
    "date": "2025-04-25T05:18:09.251Z"
  },
  {
    "captions": "TAURUS BLACKLINE TR 1600\nunder assembling operations\n\n.\nFor more info:\ninfo@taurusweb.it\nwww.taurusweb.it\n\n#Taurus #tr #inclinedshear #shear #cesoia #cesoiainclinata #rottame #scrap #recycling #circulareconomy  #rottame #scrapyard #scrapequipment #scraplife #cisaille #madeinitalyTAURUS BLACKLINE TR 1600\nunder assembling operations\n\n.\nFor more info:\ninfo@taurusweb.it\nwww.taurusweb.it\n\n#Taurus #tr #inclinedshear #shear #cesoia #cesoiainclinata #rottame #scrap #recycling #circulareconomy  #rottame #scrapyard #scrapequipment #scraplife #cisaille #madeinitaly",
    "likes": "30",
    "shares": "5",
    "time": {
      "raw": "2ay",
      "parsed": "25.04.2025",
      "isoString": "2025-04-25T05:18:09.250Z"
    },
    "mediaType": "image",
    "mediaContent": [
      "https://media.licdn.com/dms/image/v2/D4D22AQGsc1PE0MVrnw/feedshare-shrink_800/B4DZZoJ3eBGsAk-/0/1745504139908?e=1753920000&v=beta&t=XG1TE-KCqL5t1aa717ICSDs2EYFpT-1ufFcfi6lcswY"
    ],
    "date": "2025-04-25T05:18:09.250Z"
  },
  {
    "captions": "The world's largest recycled materials industry event will take place in San Diego, and TAURUS will be at the event with ELV Select - Dealer in North America. \nCome to discover our product range\nat booth #827 \nfrom May 12-15, 2025.\nWe look forward to seeing you there!\nBob Vanleeuwen\n\n#REMA #Taurus #elvselect #recycling #event #recyclingevent #shearbaler #shear #scrapequipment #scraplife #scrap #rottame #riciclo #pressa #pressacesoia #ferraille #chatarra #sucata #pressecisaille #cisaille #compactadora #prensa #guillotineThe world's largest recycled materials industry event will take place in San Diego, and TAURUS will be at the event with ELV Select - Dealer in North America. \nCome to discover our product range\nat booth #827 \nfrom May 12-15, 2025.\nWe look forward to seeing you there!\nBob Vanleeuwen\n\n#REMA #Taurus #elvselect #recycling #event #recyclingevent #shearbaler #shear #scrapequipment #scraplife #scrap #rottame #riciclo #pressa #pressacesoia #ferraille #chatarra #sucata #pressecisaille #cisaille #compactadora #prensa #guillotine",
    "likes": "17",
    "comments": "1",
    "shares": "1",
    "time": {
      "raw": "1ay",
      "parsed": "25.05.2025",
      "isoString": "2025-05-25T05:18:09.248Z"
    },
    "mediaType": "image",
    "mediaContent": [
      "https://media.licdn.com/dms/image/v2/D4D22AQHZfgkPnsvONA/feedshare-shrink_800/B4DZZ71SLmG4Ag-/0/1745834288430?e=1753920000&v=beta&t=mZyEg2NpMer2t9Lde5HlP_XwDKeMpaBhLtnVAtEjpu4"
    ],
    "date": "2025-05-25T05:18:09.248Z"
  },
  {
    "captions": "TAURUS SHEAR BALER EVO\nwhile processing heavy scrap...\nhttps://lnkd.in/dqVxv-XU\n.\nFor more info:\ninfo@taurusweb.it\nwww.taurusweb.it\n#taurus #shearbaler #shear #baler #scrap #scrapyard #scrapmachine #elv #recyclingunit #recyclingmachine #chatarra #compactadora #cisaille #ferraille #presse #pressacesoia #rottame #sucata #cuchillas",
    "likes": "13",
    "shares": "3",
    "time": {
      "raw": "1ay",
      "parsed": "25.05.2025",
      "isoString": "2025-05-25T05:18:09.246Z"
    },
    "mediaType": "video",
    "mediaContent": {
      "src": [
        {
          "src": "https://dms.licdn.com/playlist/vid/v2/D4D05AQEc6W6RjCqKtA/mp4-720p-30fp-crf28/B4DZahI3LeHEBQ-/0/1746460291223?e=1751436000&v=beta&t=uzcVyCGwrOzW8_116ZSITMWKgjB5ZbW9ljKQ8i6yLZY",
          "type": "video/mp4",
          "data-bitrate": 1079418
        },
        {
          "src": "https://dms.licdn.com/playlist/vid/v2/D4D05AQEc6W6RjCqKtA/mp4-640p-30fp-crf28/B4DZahI3LeHEBM-/0/1746460288819?e=1751436000&v=beta&t=e1YvQ3lolYlnGgYDG9TE2JXX-hKP3itAJK7PQtd4J8c",
          "type": "video/mp4",
          "data-bitrate": 792103
        }
      ],
      "posterUrl": "https://media.licdn.com/dms/image/v2/D4D05AQEc6W6RjCqKtA/videocover-low/B4DZahI3LeHECA-/0/1746460274517?e=1751436000&v=beta&t=hqmxIIcRmDTRQ0ez4xU8m-Sszikw8pklSy1pqAbL3Gw"
    },
    "date": "2025-05-25T05:18:09.246Z"
  },
  {
    "captions": "TAURUS CAT SHEAR BALER\n.\nFor more info:\nInfo@taurusweb.it\nWww.taurusweb.it",
    "likes": "17",
    "shares": "3",
    "time": {
      "raw": "1ay",
      "parsed": "25.05.2025",
      "isoString": "2025-05-25T05:18:09.244Z"
    },
    "mediaType": "video",
    "mediaContent": {
      "src": [
        {
          "src": "https://dms.licdn.com/playlist/vid/v2/D4D05AQH786EPyP35wQ/mp4-640p-30fp-crf28/B4DZbFLYJRG8BQ-/0/1747064829386?e=1751436000&v=beta&t=FiWiZrR3VexMhql9c5MPt3P3joueJOuCNELU8gQjaw4",
          "type": "video/mp4",
          "data-bitrate": 902396
        }
      ],
      "posterUrl": "https://media.licdn.com/dms/image/v2/D4D05AQH786EPyP35wQ/videocover-high/B4DZbFLYJRG8Bw-/0/1747064826837?e=1751436000&v=beta&t=UHd_Y1NXwoo7nfgk6Ftam-JRQxXDewkBNAmcClp3nBE"
    },
    "date": "2025-05-25T05:18:09.244Z"
  },
  {
    "captions": "TAURUS and ELV SELECT are waiting for you at ReMa from May 12 to 15 at booth No. 827\nSee you there!!!\nBob VanleeuwenTAURUS and ELV SELECT are waiting for you at ReMa from May 12 to 15 at booth No. 827\nSee you there!!!\nBob Vanleeuwen",
    "likes": "14",
    "shares": "1",
    "time": {
      "raw": "1ay",
      "parsed": "25.05.2025",
      "isoString": "2025-05-25T05:18:09.245Z"
    },
    "mediaType": "image",
    "mediaContent": [
      "https://media.licdn.com/dms/image/v2/D4D22AQHMFGlCKU0f8A/feedshare-shrink_800/B4DZa7k4mdGYAk-/0/1746903731833?e=1753920000&v=beta&t=f6e4tKh4a-YIRkRCTu5QhjRnz1klswP2GS-OA2adknw"
    ],
    "date": "2025-05-25T05:18:09.245Z"
  },
  {
    "captions": "🔩 RAPID: Power and High Performance. ⚙\nA fusion of technology and expertise, strength and speed, robustness and structural simplicity.\n RAPID shear balers are built for those who accept no compromises:\n ✅ High productivity\n ✅ Low energy consumption\n ✅ High-density, quality scrap output\n🔧 Ideal for HEAVY DUTY applications:\n ▪ Demolition scrap\n ▪ Industrial waste\n ▪ Reinforced concrete rods\n ▪ Rails\n📍 Monolithic, compact structure – easy to install, no foundation required.\n 🔋 Available in both diesel and electric versions.\n👉 Trust in the strength of RAPID.\n Engineered to last, built to perform.🔩 RAPID: Power and High Performance. ⚙\nA fusion of technology and expertise, strength and speed, robustness and structural simplicity.\n RAPID shear balers are built for those who accept no compromises:\n ✅ High productivity\n ✅ Low energy consumption\n ✅ High-density, quality scrap output\n🔧 Ideal for HEAVY DUTY applications:\n ▪ Demolition scrap\n ▪ Industrial waste\n ▪ Reinforced concrete rods\n ▪ Rails\n📍 Monolithic, compact structure – easy to install, no foundation required.\n 🔋 Available in both diesel and electric versions.\n👉 Trust in the strength of RAPID.\n Engineered to last, built to perform.",
    "likes": "29",
    "comments": "1",
    "shares": "5",
    "time": {
      "raw": "1ay",
      "parsed": "25.05.2025",
      "isoString": "2025-05-25T05:18:09.241Z"
    },
    "mediaType": "image",
    "mediaContent": [
      "https://media.licdn.com/dms/image/v2/D4D22AQEivsLQcziIYA/feedshare-shrink_800/B4DZbzf9qAG0Ak-/0/1747841965621?e=1753920000&v=beta&t=JBKyztctqz_zssZyq1lksQE7sV6h9Mi-OX0HHb32dD0"
    ],
    "date": "2025-05-25T05:18:09.241Z"
  },
  {
    "captions": "CAT: the TAURUS shear baler on tracks\nFree to be...CAT: the TAURUS shear baler on tracks\nFree to be...",
    "likes": "19",
    "shares": "3",
    "time": {
      "raw": "1ay",
      "parsed": "25.05.2025",
      "isoString": "2025-05-25T05:18:09.242Z"
    },
    "mediaType": "image",
    "mediaContent": [
      "https://media.licdn.com/dms/image/v2/D4D22AQHOwxwF6xpkMw/feedshare-shrink_800/B4DZbKNltRHsAk-/0/1747149284382?e=1753920000&v=beta&t=UNHeVkjcVc3OR3377-eA7TNsySw3hIpVRjzE_bwZfMU"
    ],
    "date": "2025-05-25T05:18:09.242Z"
  },
  {
    "captions": "🔧 BRAVO: the pre-shredding solution that optimized hammer mill feeding\n💥 The “Redripper BRAVO”, featuring counter-rotating horizontal shafts, is the pre-shredder specifically designed to handle bulky scrap, E.L.V., and compacted scrap bales before they enter the mill.\n👉 Installed upstream of the hammer mill, it ensures homogeneous, continuous, and safe feeding.\n📌 Equipped with the patented OSD OVERSTROKE tilting feed chute, BRAVO:\n•\tIncreases productivity\n•\tFacilitates the intake of large and bulky materials\n\n⚙️ Tangible benefits for metal scrap shredding and sorting plants:\n• Eliminates explosion risks in the grinding chamber\n• Reduces energy consumption\n• Extends the lifespan of hammers, grids, and wear plates\n• Prevents power surges and overloads\n\nBRAVO boosts the performance of small and medium-sized plants, enabling them to process complex materials safely and efficiently.\n📞 Want to learn more about how BRAVO can optimize your plant? Get in touch with us!",
    "likes": "22",
    "shares": "6",
    "time": {
      "raw": "4h",
      "parsed": "28.05.2025",
      "isoString": "2025-05-28T05:18:09.236Z"
    },
    "mediaType": "video",
    "mediaContent": {
      "src": [
        {
          "src": "https://dms.licdn.com/playlist/vid/v2/D4D05AQHvipcHZbW30g/mp4-640p-30fp-crf28/B4DZcNQibAHMBQ-/0/1748274281329?e=1751436000&v=beta&t=M77lLhBhmCtlCBPCpIqEM7vvMDehOtd9sezg0jrXgJQ",
          "type": "video/mp4",
          "data-bitrate": 661170
        },
        {
          "src": "https://dms.licdn.com/playlist/vid/v2/D4D05AQHvipcHZbW30g/mp4-720p-30fp-crf28/B4DZcNQibAHMBU-/0/1748274297078?e=1751436000&v=beta&t=GCL4mh5lzItzwdg5imiG_Rmk1p6nCvQlijBYfZQPmm4",
          "type": "video/mp4",
          "data-bitrate": 902838
        }
      ],
      "posterUrl": "https://media.licdn.com/dms/image/v2/D4D05AQHvipcHZbW30g/videocover-low/B4DZcNQibAHMBs-/0/1748274268127?e=1751436000&v=beta&t=OEMwOUnq5Q4aiit-WOhsZS1FArBDc0qVkaBEVuUk9Aw"
    },
    "date": "2025-05-28T05:18:09.236Z"
  },
  {
    "captions": "📍 France | 📆 22/05/2025\n🚀 Inauguration of TAURUS RAPID SHEAR BALER\n\nA sincere thanks to M.R.D.P.S. for the invitation to participate to the inauguration of the RAPID SHEAR BALER and the trust placed in us.📍 France | 📆 22/05/2025\n🚀 Inauguration of TAURUS RAPID SHEAR BALER\n\nA sincere thanks to M.R.D.P.S. for the invitation to participate to the inauguration of the RAPID SHEAR BALER and the trust placed in us.",
    "likes": "47",
    "comments": "5",
    "shares": "7",
    "time": {
      "raw": "1ay",
      "parsed": "25.05.2025",
      "isoString": "2025-05-25T05:18:09.238Z"
    },
    "mediaType": "image",
    "mediaContent": [
      "https://media.licdn.com/dms/image/v2/D4D22AQH7pzMaAiIQ6w/feedshare-shrink_800/B4DZb9zLWXIEAg-/0/1748014774536?e=1753920000&v=beta&t=fshJ_ZUB7M_AAR09u2SfLsnPEtgMSNp7iGzJGp1KMso"
    ],
    "date": "2025-05-25T05:18:09.238Z"
  },
  {
    "captions": "TAURUS REDLINE BRAVO \nThe best friend of your hammer mill!!!\nhttps://lnkd.in/dHXJ9Cx4\n.\nFor more info:\ninfo@taurusweb.it\nwww.taurusweb.it",
    "likes": "24",
    "shares": "4",
    "time": {
      "raw": "3h",
      "parsed": "04.06.2025",
      "isoString": "2025-06-04T05:18:09.235Z"
    },
    "mediaType": "video",
    "mediaContent": {
      "src": [
        {
          "src": "https://dms.licdn.com/playlist/vid/v2/D4D05AQHfk4zRjJ-23Q/mp4-640p-30fp-crf28/B4DZcXj5kbGkBU-/0/1748446982259?e=1751436000&v=beta&t=VgebqFYD0cOrP6GTGnHydWHXzVZrIlddCmYiQygpD1E",
          "type": "video/mp4",
          "data-bitrate": 629772
        }
      ],
      "posterUrl": "https://media.licdn.com/dms/image/v2/D4D05AQHfk4zRjJ-23Q/videocover-high/B4DZcXj5kbGkBw-/0/1748446980416?e=1751436000&v=beta&t=szk-3e9uKv9RIYZJzc0KXpjI74yXD7Vexx3ruf7jURg"
    },
    "date": "2025-06-04T05:18:09.235Z"
  },
  {
    "captions": "TAURUS SHEAR BALER QUATTRO\nCYLINDERS PER WING N.4\nCUTTING FORCE UP TO Tons 1700\nTOP OF THE RANGE \nhttps://lnkd.in/dj5TVEaw\n.\nFor more info:\nInfo@taurusweb.it\nwww.taurusweb.it",
    "likes": "10",
    "shares": "2",
    "time": {
      "raw": "1h",
      "parsed": "18.06.2025",
      "isoString": "2025-06-18T05:18:09.228Z"
    },
    "mediaType": "video",
    "mediaContent": {
      "src": [
        {
          "src": "https://dms.licdn.com/playlist/vid/v2/D4D05AQG0LDygb6Dd3A/mp4-640p-30fp-crf28/B4DZdfYItSGgBg-/0/1749651903177?e=1751436000&v=beta&t=OCc2kE_2LviCQizX0KLCGuHKrcWWtl5U8t9Z7zbm3tM",
          "type": "video/mp4",
          "data-bitrate": 726816
        },
        {
          "src": "https://dms.licdn.com/playlist/vid/v2/D4D05AQG0LDygb6Dd3A/mp4-720p-30fp-crf28/B4DZdfYItSGgBk-/0/1749651903310?e=1751436000&v=beta&t=v8X6tYcQrhnqY6Jp5LeU79vBZvdt9NINzsyaTs9zZrA",
          "type": "video/mp4",
          "data-bitrate": 960612
        }
      ],
      "posterUrl": "https://media.licdn.com/dms/image/v2/D4D05AQG0LDygb6Dd3A/videocover-low/B4DZdfYItSGgCQ-/0/1749651897051?e=1751436000&v=beta&t=Bb_GfhKszdLoo11OF5-TpSiBL-8bD_2vqJnuEblcsWM"
    },
    "date": "2025-06-18T05:18:09.228Z"
  },
  {
    "captions": "💪🏻CAT 1000 & CAT 1200\nTesting Time…\n.\nFor more info:\nwww.taurusweb.it\nInfo@taurusweb.it💪🏻CAT 1000 & CAT 1200\nTesting Time…\n.\nFor more info:\nwww.taurusweb.it\nInfo@taurusweb.it",
    "likes": "33",
    "comments": "1",
    "shares": "3",
    "time": {
      "raw": "2h",
      "parsed": "11.06.2025",
      "isoString": "2025-06-11T05:18:09.229Z"
    },
    "mediaType": "image",
    "mediaContent": [
      "https://media.licdn.com/dms/image/v2/D4D22AQH9xV85HEwjWw/feedshare-shrink_800/B4DZdVSP0eGkAg-/0/1749482537162?e=1753920000&v=beta&t=85bHM1fk-_zZS29xFHD86W0XDEmpnlBmlAy0TgoeLvI"
    ],
    "date": "2025-06-11T05:18:09.229Z"
  },
  {
    "captions": "🌍 The scrap market is evolving. Today's demands call for machines that are versatile, efficient, easy to maintain and relocate, and cost-effective.\n\n🔥 QUATTRO is the answer. A shear baler designed for the future:\n✅ High performance\n✅ Low operating costs\n✅ Easy installation and maintenance\n✅ A fast return on investment\n\n📌 QUATTRO is the result of over 50 years of hands-on experience.\nIt represents our vision of the ideal machine for the scrap industry of tomorrow.\n\n📲 Contact us to Learn more about QUATTRO🌍 The scrap market is evolving. Today's demands call for machines that are versatile, efficient, easy to maintain and relocate, and cost-effective.\n\n🔥 QUATTRO is the answer. A shear baler designed for the future:\n✅ High performance\n✅ Low operating costs\n✅ Easy installation and maintenance\n✅ A fast return on investment\n\n📌 QUATTRO is the result of over 50 years of hands-on experience.\nIt represents our vision of the ideal machine for the scrap industry of tomorrow.\n\n📲 Contact us to Learn more about QUATTRO",
    "likes": "26",
    "comments": "2",
    "shares": "1",
    "time": {
      "raw": "2h",
      "parsed": "11.06.2025",
      "isoString": "2025-06-11T05:18:09.231Z"
    },
    "mediaType": "image",
    "mediaContent": [
      "https://media.licdn.com/dms/image/v2/D4D22AQG7YXYaFgrUyw/feedshare-shrink_800/B4DZdF0v8dG8Ak-/0/1749223145946?e=1753920000&v=beta&t=8X7Fx2D9bFRYqUkC-HYoMnRpNKtl04Av7kb_m5HhMfs",
      "https://media.licdn.com/dms/image/v2/D4D22AQELXOZ_qv54Fg/feedshare-shrink_800/B4DZdF0v7vGYAg-/0/1749223145821?e=1753920000&v=beta&t=RIf7uNiGHbEW9Za466QMZeRmjWYSBS0TiZPp0QSMzkE"
    ],
    "date": "2025-06-11T05:18:09.231Z"
  },
  {
    "captions": "TAURUS BRAVO PRE-SHREDDER\nin operation since 2004\nFor more than 21 years is processing bales and E.L.V.\nhttps://lnkd.in/dHXJ9Cx4\n.\nFor more info:\nInfo@taurusweb.it\nWww.taurusweb.it",
    "likes": "12",
    "shares": "3",
    "time": {
      "raw": "2h",
      "parsed": "11.06.2025",
      "isoString": "2025-06-11T05:18:09.233Z"
    },
    "mediaType": "video",
    "mediaContent": {
      "src": [
        {
          "src": "https://dms.licdn.com/playlist/vid/v2/D4D05AQGl_ZsdS6A8ag/mp4-640p-30fp-crf28/B4DZc7dfgzHkBQ-/0/1749049290789?e=1751436000&v=beta&t=MZp-3fIs1DJ7wvSGc66CURVG75i2yvBF2btvMf-pZs0",
          "type": "video/mp4",
          "data-bitrate": 634943
        }
      ],
      "posterUrl": "https://media.licdn.com/dms/image/v2/D4D05AQGl_ZsdS6A8ag/videocover-low/B4DZc7dfgzHkBo-/0/1749049282441?e=1751436000&v=beta&t=G6w1mHIKB6mjDobSG4iVccHlAIqMWXe8_8kipS8pU9g"
    },
    "date": "2025-06-11T05:18:09.233Z"
  },
  {
    "captions": "TAURUS BLACKLINE TR INCLINED SHEAR \nDuring assembling operations\nCutting force T 1200\nDiscover more: https://lnkd.in/dXtfMU-m\n.\nFor more info:\nInfo@taurusweb.it\nwww.taurusweb.itTAURUS BLACKLINE TR INCLINED SHEAR \nDuring assembling operations\nCutting force T 1200\nDiscover more: https://lnkd.in/dXtfMU-m\n.\nFor more info:\nInfo@taurusweb.it\nwww.taurusweb.it",
    "likes": "30",
    "shares": "5",
    "time": {
      "raw": "5g",
      "parsed": "20.06.2025",
      "isoString": "2025-06-20T05:18:09.225Z"
    },
    "mediaType": "image",
    "mediaContent": [
      "https://media.licdn.com/dms/image/v2/D4D22AQHKsSW_--q7RQ/feedshare-shrink_800/B4DZeIplvRGkAw-/0/1750344293997?e=1753920000&v=beta&t=swmyee9qJMIRFsGRmrq8rlEfuInIQJT0gIporAOEZL4"
    ],
    "date": "2025-06-20T05:18:09.225Z"
  },
  {
    "captions": "TAURUS SHEAR BALER CAT\nON TRACKS\nCutting force Ton 700\ndiscover our CAT range: https://lnkd.in/dHqMhpZJ\n.\nFor more info:\ninfo@taurusweb.it\nwww.taurusweb.it",
    "likes": "12",
    "shares": "3",
    "time": {
      "raw": "1h",
      "parsed": "18.06.2025",
      "isoString": "2025-06-18T05:18:09.227Z"
    },
    "mediaType": "video",
    "mediaContent": {
      "src": [
        {
          "src": "https://dms.licdn.com/playlist/vid/v2/D4D05AQFiAYhY5VkMcw/mp4-640p-30fp-crf28/B4DZd5Zk.TGUBc-/0/1750088443990?e=1751436000&v=beta&t=Px3SKYfH-1WCETcuZKRFnPq4DDuJCBIRaYdDM24MeNI",
          "type": "video/mp4",
          "data-bitrate": 558697
        },
        {
          "src": "https://dms.licdn.com/playlist/vid/v2/D4D05AQFiAYhY5VkMcw/mp4-720p-30fp-crf28/B4DZd5Zk.TGUBg-/0/1750088443525?e=1751436000&v=beta&t=jPcnWJrDUT5of4WfWMKFi_6qeNI8S6ZSq5wywKmfF18",
          "type": "video/mp4",
          "data-bitrate": 654787
        }
      ],
      "posterUrl": "https://media.licdn.com/dms/image/v2/D4D05AQFiAYhY5VkMcw/videocover-high/B4DZd5Zk.TGUB4-/0/1750088442427?e=1751436000&v=beta&t=Tu9I9rDO6g3lk2g9b4JJpa3l9_PCfPDXj94DX0FsQP8"
    },
    "date": "2025-06-18T05:18:09.227Z"
  },
  {
    "captions": "TAURUS SHEAR BALER CAT\nIf the scrap doesn’t go to the shear…\nThe shear goes to the scrap…\nhttps://lnkd.in/dHqMhpZJ\n.\nFor more info:\nInfo@taurusweb.it\nWww.taurusweb.itTAURUS SHEAR BALER CAT\nIf the scrap doesn’t go to the shear…\nThe shear goes to the scrap…\nhttps://lnkd.in/dHqMhpZJ\n.\nFor more info:\nInfo@taurusweb.it\nWww.taurusweb.it",
    "likes": "4",
    "time": {
      "raw": "13s",
      "parsed": "24.06.2025",
      "isoString": "2025-06-24T16:18:09.221Z"
    },
    "mediaType": "image",
    "mediaContent": [
      "https://media.licdn.com/dms/image/v2/D4D22AQELH2wNw9GVbA/feedshare-shrink_800/B4DZeilihdGgAk-/0/1750779439800?e=1753920000&v=beta&t=AL_xKiibmVZbkfiEjxNXMTKTLp9MgwWgKR_xbTRcvRY"
    ],
    "date": "2025-06-24T16:18:09.221Z"
  }
]