{
  "followerData": [
    [
      20250225,
      2872
    ],
    [
      20250225,
      2872
    ],
    [
      20250225,
      2872
    ],
    [
      20250228,
      2880
    ],
    [
      20250228,
      2880
    ],
    [
      20250228,
      2880
    ],
    [
      20250228,
      2880
    ],
    [
      20250303,
      2886
    ],
    [
      1741011789938,
      "2.886"
    ],
    [
      1741076735788,
      "2.885"
    ],
    [
      1741077880948,
      "2.885"
    ],
    [
      1741083862068,
      "2.884"
    ],
    [
      1741084871752,
      "2.884"
    ],
    [
      1741170626060,
      2884
    ],
    [
      1741756023734,
      2898
    ],
    [
      1741848930615,
      2898
    ],
    [
      1742188133252,
      2898
    ],
    [
      1742966718431,
      2924
    ],
    [
      1744004597389,
      2940
    ],
    [
      1744606158818,
      2952
    ],
    [
      1745214824341,
      2972
    ],
    [
      1745472353942,
      2980
    ],
    [
      1745816558618,
      2991
    ],
    [
      1746164497728,
      3004
    ]
  ],
  "data": [
    {
      "captions": "ğŸŒ Discover FOR REC's solutions to recycle photovoltaic panels! \n\nAs solar energy increases, so does the need for efficient handling of end-of-life photovoltaic panels.\nFOR REC meets this need with tailor-made plants designed to ensure optimal separation of components and reduce processing times.\n\nMain features of the FOR REC plants:\nâœ” Full panel treatment: our lines accept whole solar panels, setting up an efficient separation process;\nâœ”Material separation: we recover aluminium from frames, magnetic metals, inert fraction, ethylene vinyl acetate and non-magnetic metals from harnesses and connectors.\nâœ” High production capacity: our plants process up to 6 tonnes/hour thanks to advanced hydraulic grinders and separation systems.\n\nDiscover our cutting-edge solutions for photovoltaic panel recycling ğŸ‘‰ https://lnkd.in/d_NHvAPe \n\n#Forrec #IndustrialRecycling #CircularEconomy #SolarEnergyğŸŒ Discover FOR REC's solutions to recycle photovoltaic panels! \n\nAs solar energy increases, so does the need for efficient handling of end-of-life photovoltaic panels.\nFOR REC meets this need with tailor-made plants designed to ensure optimal separation of components and reduce processing times.\n\nMain features of the FOR REC plants:\nâœ” Full panel treatment: our lines accept whole solar panels, setting up an efficient separation process;\nâœ”Material separation: we recover aluminium from frames, magnetic metals, inert fraction, ethylene vinyl acetate and non-magnetic metals from harnesses and connectors.\nâœ” High production capacity: our plants process up to 6 tonnes/hour thanks to advanced hydraulic grinders and separation systems.\n\nDiscover our cutting-edge solutions for photovoltaic panel recycling ğŸ‘‰ https://lnkd.in/d_NHvAPe \n\n#Forrec #IndustrialRecycling #CircularEconomy #SolarEnergy",
      "likes": "49",
      "shares": "10",
      "time": {
        "raw": "1ay",
        "parsed": "28.03.2025",
        "isoString": "2025-03-28T05:02:38.345Z"
      },
      "mediaType": "image",
      "mediaContent": [
        "https://media.licdn.com/dms/image/v2/D4D22AQFtVip0yjz8Ow/feedshare-shrink_800/B4DZVLfdOhGcAg-/0/1740728293927?e=1748476800&v=beta&t=4WPPRWgCfaQBRNcazpqMfVO-ZQDjoWUKM8LP15U9IIo"
      ],
      "date": "2025-03-28T05:02:38.345Z"
    },
    {
      "captions": "â™»ï¸ Give new life to tires! Thanks to FORRECâ€™s advanced plant and the collaboration with Telford Smith, recycling becomes a real opportunity. ğŸš€ğŸ”„ Turning waste into opportunity! The FORREC Tyre Recycling Plant processes up to 6,000kg of tyres per hour, creating materials for industries while supporting Australiaâ€™s circular economy. ğŸ’¡ğŸŒ \n\nPartner with Telford Smith, the supplier of Forrec, for tailored recycling solutions that make a difference.Â ğŸš€ Click on the link to find out more: https://lnkd.in/gAVfHe2JÂ \nğŸ“Š Connect with Us for cutting-edge insights into recycling and sustainable waste management! Like Our posts, share them with your network, and follow Our page for expert advice and innovative solutions. Ready to transform your recycling and waste management strategy? Contact Telford Smith for personalised solutions today. Together, we can drive sustainable change! â™»ï¸ğŸ’¼Â \n#Innovation #Recycling #Sustainability #PlasticRecycling #WasteManagement #TelfordSmith #Legacy #Quality #BusinessGrowth #StayInformed #QualityControl #ExpertAdvice #EngineeringExcellence #Engineering #ProfessionalExcellence #EngineeringStandardsÂ #EcoSolutions #WasteManagement #CircularEconomyLeaders #ForrecğŸ”„ Turning waste into opportunity! The FORREC Tyre Recycling Plant processes up to 6,000kg of tyres per hour, creating materials for industries while supporting Australiaâ€™s circular economy. ğŸ’¡ğŸŒ \n\nPartner with Telford Smith, the supplier of Forrec, for tailored recycling solutions that make a difference.Â ğŸš€ Click on the link to find out more: https://lnkd.in/gAVfHe2JÂ \nğŸ“Š Connect with Us for cutting-edge insights into recycling and sustainable waste management! Like Our posts, share them with your network, and follow Our page for expert advice and innovative solutions. Ready to transform your recycling and waste management strategy? Contact Telford Smith for personalised solutions today. Together, we can drive sustainable change! â™»ï¸ğŸ’¼Â \n#Innovation #Recycling #Sustainability #PlasticRecycling #WasteManagement #TelfordSmith #Legacy #Quality #BusinessGrowth #StayInformed #QualityControl #ExpertAdvice #EngineeringExcellence #Engineering #ProfessionalExcellence #EngineeringStandardsÂ #EcoSolutions #WasteManagement #CircularEconomyLeaders #Forrec",
      "likes": "22",
      "comments": "1",
      "shares": "7",
      "time": {
        "raw": "1ay3ay",
        "parsed": "28.04.2025",
        "isoString": "2025-04-28T05:02:38.347Z"
      },
      "mediaType": "image",
      "mediaContent": [
        "https://media.licdn.com/dms/image/v2/D5622AQG56DNg0ISm-g/feedshare-shrink_800/B56ZSMXdhoHwAk-/0/1737521748801?e=1748476800&v=beta&t=EwyZ53qOmxaQXxPaGSGuxLydNd4wntbfs3KlhUqfz5Y"
      ],
      "date": "2025-04-28T05:02:38.347Z"
    },
    {
      "captions": "ğŸ”„ Turning waste into opportunity! The FORREC Tyre Recycling Plant processes up to 6,000kg of tyres per hour, creating materials for industries while supporting Australiaâ€™s circular economy. ğŸ’¡ğŸŒ \n\nPartner with Telford Smith, the supplier of Forrec, for tailored recycling solutions that make a difference.Â ğŸš€ Click on the link to find out more: https://lnkd.in/gAVfHe2JÂ \nğŸ“Š Connect with Us for cutting-edge insights into recycling and sustainable waste management! Like Our posts, share them with your network, and follow Our page for expert advice and innovative solutions. Ready to transform your recycling and waste management strategy? Contact Telford Smith for personalised solutions today. Together, we can drive sustainable change! â™»ï¸ğŸ’¼Â \n#Innovation #Recycling #Sustainability #PlasticRecycling #WasteManagement #TelfordSmith #Legacy #Quality #BusinessGrowth #StayInformed #QualityControl #ExpertAdvice #EngineeringExcellence #Engineering #ProfessionalExcellence #EngineeringStandardsÂ #EcoSolutions #WasteManagement #CircularEconomyLeaders #ForrecğŸ”„ Turning waste into opportunity! The FORREC Tyre Recycling Plant processes up to 6,000kg of tyres per hour, creating materials for industries while supporting Australiaâ€™s circular economy. ğŸ’¡ğŸŒ \n\nPartner with Telford Smith, the supplier of Forrec, for tailored recycling solutions that make a difference.Â ğŸš€ Click on the link to find out more: https://lnkd.in/gAVfHe2JÂ \nğŸ“Š Connect with Us for cutting-edge insights into recycling and sustainable waste management! Like Our posts, share them with your network, and follow Our page for expert advice and innovative solutions. Ready to transform your recycling and waste management strategy? Contact Telford Smith for personalised solutions today. Together, we can drive sustainable change! â™»ï¸ğŸ’¼Â \n#Innovation #Recycling #Sustainability #PlasticRecycling #WasteManagement #TelfordSmith #Legacy #Quality #BusinessGrowth #StayInformed #QualityControl #ExpertAdvice #EngineeringExcellence #Engineering #ProfessionalExcellence #EngineeringStandardsÂ #EcoSolutions #WasteManagement #CircularEconomyLeaders #Forrec",
      "likes": "22",
      "comments": "1",
      "shares": "7",
      "time": {
        "raw": "3ay",
        "parsed": "28.01.2025",
        "isoString": "2025-01-28T05:02:38.349Z"
      },
      "mediaType": "image",
      "mediaContent": [
        "https://media.licdn.com/dms/image/v2/D5622AQG56DNg0ISm-g/feedshare-shrink_800/B56ZSMXdhoHwAk-/0/1737521748801?e=1748476800&v=beta&t=EwyZ53qOmxaQXxPaGSGuxLydNd4wntbfs3KlhUqfz5Y"
      ],
      "date": "2025-01-28T05:02:38.349Z"
    },
    {
      "captions": "ğŸŒ FOR REC will be attending Residuos Expo in Mexico City, from March 25th to 27th, 2025, at the Centro Citibanamex (booth 928).\nâ™»ï¸ Come visit us to discover our innovative solutions in the recycling and waste management industry. We look forward to meeting you and discussing how we can support your needs!\n___________________________________________________________________\n\nğŸŒ FOR REC estarÃ¡ presente en Residuos Expo en Ciudad de MÃ©xico, del 25 al 27 de marzo de 2025, en el Centro Citibanamex (stand 928).\nâ™»ï¸ Â¡Ven a visitarnos! Descubre nuestras soluciones innovadoras en la industria del reciclaje y la gestiÃ³n de residuos. Â¡Esperamos verte y hablar sobre cÃ³mo podemos apoyar tus necesidades!\n\n#ResiduosExpo #FORREC #Recycling #WasteManagement #IndustrialRecycling #CircularEconomy #Sustainability #MexicoCityğŸŒ FOR REC will be attending Residuos Expo in Mexico City, from March 25th to 27th, 2025, at the Centro Citibanamex (booth 928).\nâ™»ï¸ Come visit us to discover our innovative solutions in the recycling and waste management industry. We look forward to meeting you and discussing how we can support your needs!\n___________________________________________________________________\n\nğŸŒ FOR REC estarÃ¡ presente en Residuos Expo en Ciudad de MÃ©xico, del 25 al 27 de marzo de 2025, en el Centro Citibanamex (stand 928).\nâ™»ï¸ Â¡Ven a visitarnos! Descubre nuestras soluciones innovadoras en la industria del reciclaje y la gestiÃ³n de residuos. Â¡Esperamos verte y hablar sobre cÃ³mo podemos apoyar tus necesidades!\n\n#ResiduosExpo #FORREC #Recycling #WasteManagement #IndustrialRecycling #CircularEconomy #Sustainability #MexicoCity",
      "likes": "34",
      "shares": "10",
      "time": {
        "raw": "3h",
        "parsed": "05.03.2025",
        "isoString": "2025-03-05T05:25:18.197Z"
      },
      "mediaType": "image",
      "mediaContent": [
        "https://media.licdn.com/dms/image/v2/D4D22AQHN2a15qoofig/feedshare-shrink_800/B4DZVBpmfOHwAo-/0/1740563180009?e=1746057600&v=beta&t=AcRngJA6lK8HIl-ZdvsQO0U8gH_KffQUVB0v4FCuMtE"
      ],
      "date": "2025-03-05T05:25:18.197Z"
    },
    {
      "captions": "FORREC is at WFES in Abu Dhabi! ğŸŒ\nWe are thrilled to be part of one of the leading global events focused on renewable energy and sustainable innovation. Come visit us at Hall 2, Stand 2330 to discover our advanced waste treatment solutions and learn how we can support your business with cutting-edge technology.\nWe look forward to welcoming you!\n\n#WFES #AbuDhabi #Forrec #GreenTechnology #WasteManagementFORREC is at WFES in Abu Dhabi! ğŸŒ\nWe are thrilled to be part of one of the leading global events focused on renewable energy and sustainable innovation. Come visit us at Hall 2, Stand 2330 to discover our advanced waste treatment solutions and learn how we can support your business with cutting-edge technology.\nWe look forward to welcoming you!\n\n#WFES #AbuDhabi #Forrec #GreenTechnology #WasteManagement",
      "likes": "55",
      "shares": "4",
      "time": {
        "raw": "3ay",
        "parsed": "28.01.2025",
        "isoString": "2025-01-28T05:02:38.352Z"
      },
      "mediaType": "image",
      "mediaContent": [
        "https://media.licdn.com/dms/image/v2/D4D22AQGAget5EhlVlA/feedshare-shrink_2048_1536/B4DZRkHP1FGkAs-/0/1736846409713?e=1748476800&v=beta&t=svyzSgt8NyJjd-3fmSQjUKRVAv1A93VrFxj0-w3nBrA",
        "https://media.licdn.com/dms/image/v2/D4D22AQGpPWF2_OL6Vw/feedshare-shrink_800/B4DZRkHP0tHcAk-/0/1736846409595?e=1748476800&v=beta&t=RWM8wF7ScqWW-93RcgLyFqclf0G7h0A6RLbG_b2V5IM"
      ],
      "date": "2025-01-28T05:02:38.352Z"
    },
    {
      "captions": "ğŸŒŸ Proud to Be Part of the Italian Chamber of Commerce in Colombia! ğŸ‡®ğŸ‡¹ğŸ‡¨ğŸ‡´\nWe are thrilled to announce that FOR REC SPA is officially affiliated with the Italian Chamber of Commerce in Colombia. This partnership reflects our commitment to strengthening ties between Italy and Colombia and growing within an international network of excellence.\nğŸ‘‰ Starting in 2025, we will proudly display the Chamber's Seal of Affiliation, symbolizing trust and quality.\nWe are grateful for this opportunity and look forward to continuing this fruitful collaboration! ğŸ™Œ\nğŸ”— #FORRECSPA #ItalianChamberColombia #InternationalPartnerships #BusinessExcellence\n_____________________________________________________________________________\n\nğŸŒŸ Orgullosos de ser parte de la CÃ¡mara de Comercio Italiana en Colombia! ğŸ‡®ğŸ‡¹ğŸ‡¨ğŸ‡´\nNos complace anunciar que FOR REC SPA forma parte oficialmente de la CÃ¡mara de Comercio Italiana para Colombia. Esta alianza refleja nuestro compromiso con fortalecer los lazos entre Italia y Colombia, creciendo dentro de una red internacional de excelencia.\nğŸ‘‰ A partir de 2025, luciremos con orgullo el Sello de AfiliaciÃ³n de la CÃ¡mara, sÃ­mbolo de confianza y calidad.\nEstamos agradecidos por esta oportunidad y esperamos continuar con esta colaboraciÃ³n tan fructÃ­fera. ğŸ™Œ\nğŸ”— #FORRECSPA #CÃ¡maraItalianaColombia #AlianzasInternacionales #ExcelenciaEmpresarialğŸŒŸ Proud to Be Part of the Italian Chamber of Commerce in Colombia! ğŸ‡®ğŸ‡¹ğŸ‡¨ğŸ‡´\nWe are thrilled to announce that FOR REC SPA is officially affiliated with the Italian Chamber of Commerce in Colombia. This partnership reflects our commitment to strengthening ties between Italy and Colombia and growing within an international network of excellence.\nğŸ‘‰ Starting in 2025, we will proudly display the Chamber's Seal of Affiliation, symbolizing trust and quality.\nWe are grateful for this opportunity and look forward to continuing this fruitful collaboration! ğŸ™Œ\nğŸ”— #FORRECSPA #ItalianChamberColombia #InternationalPartnerships #BusinessExcellence\n_____________________________________________________________________________\n\nğŸŒŸ Orgullosos de ser parte de la CÃ¡mara de Comercio Italiana en Colombia! ğŸ‡®ğŸ‡¹ğŸ‡¨ğŸ‡´\nNos complace anunciar que FOR REC SPA forma parte oficialmente de la CÃ¡mara de Comercio Italiana para Colombia. Esta alianza refleja nuestro compromiso con fortalecer los lazos entre Italia y Colombia, creciendo dentro de una red internacional de excelencia.\nğŸ‘‰ A partir de 2025, luciremos con orgullo el Sello de AfiliaciÃ³n de la CÃ¡mara, sÃ­mbolo de confianza y calidad.\nEstamos agradecidos por esta oportunidad y esperamos continuar con esta colaboraciÃ³n tan fructÃ­fera. ğŸ™Œ\nğŸ”— #FORRECSPA #CÃ¡maraItalianaColombia #AlianzasInternacionales #ExcelenciaEmpresarial",
      "likes": "26",
      "shares": "1",
      "time": {
        "raw": "4ay",
        "parsed": "28.12.2024",
        "isoString": "2024-12-28T05:02:38.353Z"
      },
      "mediaType": "image",
      "mediaContent": [
        "https://media.licdn.com/dms/image/v2/D4D22AQHA-NZaw_t4KA/feedshare-shrink_2048_1536/B4DZPjG76VHcAo-/0/1734682067064?e=1748476800&v=beta&t=msJ4xfGTgqs8LsjjOLng59Wtngrzl1tbnRW-e77KEDg"
      ],
      "date": "2024-12-28T05:02:38.353Z"
    },
    {
      "captions": "Indiaâ€™s recycling sector is now increasingly attracting the attention of international machinery suppliers such as FOR REC S.P.A.. \n\nWhile the Indian government is tightening recycling norms by implementing EPR for various sectors global machinery suppliers are strengthening their presence by appointing local representatives.\n\nItalian based FOR REC S.P.A., operates through a Delhi based representative Nordseewerke India Private Limited. A company promoting recycling plant machinery for the last 15 years. \n\nThe full article can be accessed via our website (Link in comments) \n\n#TyreRecycling #TyreRecyclingMachinery #Machinery #BusinessGrowth #IndiaBusiness #SustainabilityAsia #Sustainability #FORRECIndiaâ€™s recycling sector is now increasingly attracting the attention of international machinery suppliers such as FOR REC S.P.A.. \n\nWhile the Indian government is tightening recycling norms by implementing EPR for various sectors global machinery suppliers are strengthening their presence by appointing local representatives.\n\nItalian based FOR REC S.P.A., operates through a Delhi based representative Nordseewerke India Private Limited. A company promoting recycling plant machinery for the last 15 years. \n\nThe full article can be accessed via our website (Link in comments) \n\n#TyreRecycling #TyreRecyclingMachinery #Machinery #BusinessGrowth #IndiaBusiness #SustainabilityAsia #Sustainability #FORREC",
      "likes": "19",
      "comments": "1",
      "shares": "5",
      "time": {
        "raw": "4ay",
        "parsed": "28.12.2024",
        "isoString": "2024-12-28T05:02:38.355Z"
      },
      "mediaType": "image",
      "mediaContent": [
        "https://media.licdn.com/dms/image/v2/D5622AQFM2bdl9ZZusw/feedshare-shrink_800/B56ZPeIPHlHQAk-/0/1734598523308?e=1748476800&v=beta&t=lPryEXpItneyopu5kin0DiyAqwtiD_6gubVv_0YUwa8"
      ],
      "date": "2024-12-28T05:02:38.355Z"
    },
    {
      "captions": "ğŸŒ Expanding Recycling Solutions in India! ğŸ‡®ğŸ‡³\nForrec is excited to contribute to sustainable growth in India, where the emphasis on a circular economy is stronger than ever. By providing advanced systems for End-of-Life Tyre (ELT) recycling, Forrec supports the Indian market in its journey toward environmental sustainability.\nOur solutions are tailored to address the growing demand for efficient recycling technologies in a market poised for transformation under initiatives like Extended Producer Responsibility (EPR). Together, we can make recycling not just a necessity but an opportunity for innovation and growth.\nDiscover how Forrec is shaping the future of recycling globally.\n#Forrec #RecyclingSolutions #Sustainability #India #CircularEconomy",
      "likes": "22",
      "comments": "2",
      "shares": "3",
      "time": {
        "raw": "4ay",
        "parsed": "28.12.2024",
        "isoString": "2024-12-28T05:02:38.357Z"
      },
      "mediaType": "other",
      "date": "2024-12-28T05:02:38.357Z"
    },
    {
      "captions": "Grazie a Marco Zoccarato e a Macchion Luisa Ã¨ sempre un piacere incontrarvi.\nNon perdere lâ€™intervista al CEO di FOR REC S.P.A. fatta durante lâ€™ultimo ECOMONDO - ITALIAN EXHIBITION GROUP.ECOMONDO - ITALIAN EXHIBITION GROUP 2024\nrePlanet Magazine intervista Marco Zoccarato CEO di FOR REC S.P.A. \nImpianti di trattamento #rifiuti e trituratori industriali\n\nAnnalisa De Maddalena Filippo Cavalliere\n#rePlanetMagazine #rePlanet #ecomondo #reduce #reuse #recycle #plasticrecycling #recycling #textile #greeneconomy #circulareconomy #economiacircolare #ambiente #plasticsfantastic #planetapproved",
      "likes": "23",
      "comments": "1",
      "shares": "6",
      "time": {
        "raw": "5ay5ay",
        "parsed": "28.04.2025",
        "isoString": "2025-04-28T05:02:38.358Z"
      },
      "mediaType": "video",
      "mediaContent": {
        "src": [
          {
            "src": "https://dms.licdn.com/playlist/vid/v2/D4D05AQEEf6vuaVFvjA/mp4-640p-30fp-crf28/mp4-640p-30fp-crf28/0/1732641619549?e=1746424800&v=beta&t=JcRPD1t-ZARaFyZJGupN8Zqublx0pVNIk11n44EcO2k",
            "type": "video/mp4",
            "data-bitrate": 560939
          },
          {
            "src": "https://dms.licdn.com/playlist/vid/v2/D4D05AQEEf6vuaVFvjA/mp4-720p-30fp-crf28/mp4-720p-30fp-crf28/0/1732641615312?e=1746424800&v=beta&t=zyKrb-FmrRv8uZpwIeOo-eykWIvBbVtz3W6un5wtGWQ",
            "type": "video/mp4",
            "data-bitrate": 753365
          }
        ],
        "posterUrl": "https://media.licdn.com/dms/image/v2/D4D05AQEEf6vuaVFvjA/feedshare-thumbnail_720_1280/feedshare-thumbnail_720_1280/0/1732641571749?e=1746424800&v=beta&t=dDX9xz2iqmgAwacevoAZ8GN8lX2HSQSrtXH1IqJZsDk"
      },
      "date": "2025-04-28T05:02:38.358Z"
    },
    {
      "captions": "ECOMONDO - ITALIAN EXHIBITION GROUP 2024\nrePlanet Magazine intervista Marco Zoccarato CEO di FOR REC S.P.A. \nImpianti di trattamento #rifiuti e trituratori industriali\n\nAnnalisa De Maddalena Filippo Cavalliere\n#rePlanetMagazine #rePlanet #ecomondo #reduce #reuse #recycle #plasticrecycling #recycling #textile #greeneconomy #circulareconomy #economiacircolare #ambiente #plasticsfantastic #planetapproved",
      "time": {
        "raw": "5ay",
        "parsed": "28.11.2024",
        "isoString": "2024-11-28T05:02:38.359Z"
      },
      "mediaType": "video",
      "mediaContent": {
        "src": [
          {
            "src": "https://dms.licdn.com/playlist/vid/v2/D4D05AQEEf6vuaVFvjA/mp4-640p-30fp-crf28/mp4-640p-30fp-crf28/0/1732641619549?e=1746424800&v=beta&t=JcRPD1t-ZARaFyZJGupN8Zqublx0pVNIk11n44EcO2k",
            "type": "video/mp4",
            "data-bitrate": 560939
          },
          {
            "src": "https://dms.licdn.com/playlist/vid/v2/D4D05AQEEf6vuaVFvjA/mp4-720p-30fp-crf28/mp4-720p-30fp-crf28/0/1732641615312?e=1746424800&v=beta&t=zyKrb-FmrRv8uZpwIeOo-eykWIvBbVtz3W6un5wtGWQ",
            "type": "video/mp4",
            "data-bitrate": 753365
          }
        ],
        "posterUrl": "https://media.licdn.com/dms/image/v2/D4D05AQEEf6vuaVFvjA/feedshare-thumbnail_720_1280/feedshare-thumbnail_720_1280/0/1732641571749?e=1746424800&v=beta&t=dDX9xz2iqmgAwacevoAZ8GN8lX2HSQSrtXH1IqJZsDk"
      },
      "date": "2024-11-28T05:02:38.359Z"
    },
    {
      "captions": "ğŸš€ We are excited to bring you a new digital experience with the launch of our updated website!\n\nThe new website offers a comprehensive preview of our recycling lines, making it easier than ever to understand our innovative processes.\nIndeed, with this update we wanted to revolutionize the user experience by offering:\nâœ” Accurate explanation of the structure of our plants;\nâœ” Detailed renderings and complete overview of the waste treatment process;\nâœ” Full preview of the materials you will be able to process, including complex wastes such as photovoltaic panels.\n\nVisit our new website and learn howÂ FORÂ RECÂ continues to lead the way in sustainable solutionsÂ forÂ a greener futureÂ ğŸ‘‰ https://lnkd.in/d7NdxkSA\n\n#FORRECÂ #RecyclingSolutions #Sustainability #InnovationÂ ğŸš€ We are excited to bring you a new digital experience with the launch of our updated website!\n\nThe new website offers a comprehensive preview of our recycling lines, making it easier than ever to understand our innovative processes.\nIndeed, with this update we wanted to revolutionize the user experience by offering:\nâœ” Accurate explanation of the structure of our plants;\nâœ” Detailed renderings and complete overview of the waste treatment process;\nâœ” Full preview of the materials you will be able to process, including complex wastes such as photovoltaic panels.\n\nVisit our new website and learn howÂ FORÂ RECÂ continues to lead the way in sustainable solutionsÂ forÂ a greener futureÂ ğŸ‘‰ https://lnkd.in/d7NdxkSA\n\n#FORRECÂ #RecyclingSolutions #Sustainability #Innovation",
      "likes": "37",
      "comments": "1",
      "shares": "4",
      "time": {
        "raw": "5ay",
        "parsed": "28.11.2024",
        "isoString": "2024-11-28T05:02:38.360Z"
      },
      "mediaType": "image",
      "mediaContent": [
        "https://media.licdn.com/dms/image/v2/D4D22AQGg-ny4IIZNYA/feedshare-shrink_800/feedshare-shrink_800/0/1732008214979?e=1748476800&v=beta&t=zWQCPbVtfu_ujaOJNmW_m954QjrTSfnCl6xEeWpO4u0"
      ],
      "date": "2024-11-28T05:02:38.360Z"
    },
    {
      "captions": "ğŸ–¤ Un pensiero speciale al nostro caro collega Piergiorgio Acquati, recentemente scomparso. La sua presenza, la sua professionalitÃ  e il suo spirito rimarranno sempre nei nostri cuori. Giorgio sarÃ  sempre una parte importante della famiglia FORREC\n\nUn grazie di cuore a tutti coloro che sono passati a trovarci alla fiera Ecomondo di Rimini!\n\nIl vostro riconoscimento e il vostro interesse ci motivano ogni giorno a fare sempre meglio.\n\nUn ringraziamento speciale a tutto il team di FOR REC S.P.A., che ha reso possibile questo evento con il suo impegno e la sua passione.\n\n#Ecomondo2024 #FORREC #TeamFORREC #Innovazione #Riciclo #GestioneRifiuti #SostenibilitÃ  #InMemoriağŸ–¤ Un pensiero speciale al nostro caro collega Piergiorgio Acquati, recentemente scomparso. La sua presenza, la sua professionalitÃ  e il suo spirito rimarranno sempre nei nostri cuori. Giorgio sarÃ  sempre una parte importante della famiglia FORREC\n\nUn grazie di cuore a tutti coloro che sono passati a trovarci alla fiera Ecomondo di Rimini!\n\nIl vostro riconoscimento e il vostro interesse ci motivano ogni giorno a fare sempre meglio.\n\nUn ringraziamento speciale a tutto il team di FOR REC S.P.A., che ha reso possibile questo evento con il suo impegno e la sua passione.\n\n#Ecomondo2024 #FORREC #TeamFORREC #Innovazione #Riciclo #GestioneRifiuti #SostenibilitÃ  #InMemoria",
      "likes": "148",
      "comments": "10",
      "shares": "13",
      "time": {
        "raw": "5ay",
        "parsed": "28.11.2024",
        "isoString": "2024-11-28T05:02:38.363Z"
      },
      "mediaType": "image",
      "mediaContent": [
        "https://media.licdn.com/dms/image/v2/D5622AQHyZBzjqFmeSA/feedshare-shrink_800/feedshare-shrink_800/0/1731078562086?e=1748476800&v=beta&t=CwL4xtasCFsEdB5bK4XRYS620F0zpi6RpWfzLmoAO8o"
      ],
      "date": "2024-11-28T05:02:38.363Z"
    },
    {
      "captions": "ğŸŒ± FOR REC SPA Ã¨ presente alla fiera Ecomondo di Rimini!\nSiamo pronti ad accogliervi al nostro stand (Pad A1, Stand 203-102) per presentarvi le nostre ultime innovazioni nel campo del riciclaggio e dell'economia circolare.\nVi aspettiamo per discutere insieme delle soluzioni sostenibili che stanno trasformando il futuro del nostro pianeta. Non mancate! ğŸŒ\n\nğŸŒ± FOR REC SPA is attending the Ecomondo fair in Rimini!\nWe are excited to welcome you at our booth (hall A1, 203-102) to showcase our latest innovations in recycling and circular economy.\nJoin us to explore sustainable solutions that are shaping the future of our planet. Donâ€™t miss it! ğŸŒ\n\n#Ecomondo2024 #Recycling #CircularEconomy #Sustainability #Innovation #ForRecSpa #RiminiFair #GreenFutureğŸŒ± FOR REC SPA Ã¨ presente alla fiera Ecomondo di Rimini!\nSiamo pronti ad accogliervi al nostro stand (Pad A1, Stand 203-102) per presentarvi le nostre ultime innovazioni nel campo del riciclaggio e dell'economia circolare.\nVi aspettiamo per discutere insieme delle soluzioni sostenibili che stanno trasformando il futuro del nostro pianeta. Non mancate! ğŸŒ\n\nğŸŒ± FOR REC SPA is attending the Ecomondo fair in Rimini!\nWe are excited to welcome you at our booth (hall A1, 203-102) to showcase our latest innovations in recycling and circular economy.\nJoin us to explore sustainable solutions that are shaping the future of our planet. Donâ€™t miss it! ğŸŒ\n\n#Ecomondo2024 #Recycling #CircularEconomy #Sustainability #Innovation #ForRecSpa #RiminiFair #GreenFuture",
      "likes": "83",
      "shares": "6",
      "time": {
        "raw": "5ay",
        "parsed": "28.11.2024",
        "isoString": "2024-11-28T05:02:38.364Z"
      },
      "mediaType": "image",
      "mediaContent": [
        "https://media.licdn.com/dms/image/v2/D4D22AQGCFs5P50ZZ0Q/feedshare-shrink_800/feedshare-shrink_800/0/1730882325843?e=1748476800&v=beta&t=f16_qIGUqVt9vq8qMfajD0DOhhhnR4_T3pV74FAH5mg",
        "https://media.licdn.com/dms/image/v2/D4D22AQEni4vHYtLr5A/feedshare-shrink_800/feedshare-shrink_800/0/1730882325295?e=1748476800&v=beta&t=WfOt7JwKXWUNIdmUlkdKXIN-IqsCuqTZ1qTbBFlG8S8",
        "https://media.licdn.com/dms/image/v2/D4D22AQF1XruRYdBuNw/feedshare-shrink_800/feedshare-shrink_800/0/1730882326658?e=1748476800&v=beta&t=zN_0PyCbyIY7IsSINwd5dIdikKMzWJoy9NR87qquKwg"
      ],
      "date": "2024-11-28T05:02:38.364Z"
    },
    {
      "captions": "ğŸŒ Get ready for ECOMONDO 2024!\nWe are excited to announce that we will attend the international trade fair dedicated to the world of environmental innovation and the circular economy.\n\nğŸ“… SAVE THE DATE\nWe look forward to seeing you atÂ ECOMONDO - ITALIAN EXHIBITION GROUPÂ from November 5 to 8 at the Rimini Exhibition Center, Italy.\n\nâœ” Why should you visit our booth?\nOur latest news regards the new Z16 hammer mill: designed to offer more power and efficiency, this machine is perfect for processing WEEE, washing machines, aluminum scraps and motors up to 40 kg with no need for pre-shredding.\nDon't miss your chance to see it!\n\nIn the meantime, you can find out all its technical features here:Â \nhttps://lnkd.in/gCbrZh34\nWe are waiting for you at booth A1 - stand 203-102!\n\n#Ecomondo2024 #GreenEconomy #SustainableInnovation #WasteManagementÂ \nğŸŒ Get ready for ECOMONDO 2024!\nWe are excited to announce that we will attend the international trade fair dedicated to the world of environmental innovation and the circular economy.\n\nğŸ“… SAVE THE DATE\nWe look forward to seeing you atÂ ECOMONDO - ITALIAN EXHIBITION GROUPÂ from November 5 to 8 at the Rimini Exhibition Center, Italy.\n\nâœ” Why should you visit our booth?\nOur latest news regards the new Z16 hammer mill: designed to offer more power and efficiency, this machine is perfect for processing WEEE, washing machines, aluminum scraps and motors up to 40 kg with no need for pre-shredding.\nDon't miss your chance to see it!\n\nIn the meantime, you can find out all its technical features here:Â \nhttps://lnkd.in/gCbrZh34\nWe are waiting for you at booth A1 - stand 203-102!\n\n#Ecomondo2024 #GreenEconomy #SustainableInnovation #WasteManagement",
      "likes": "42",
      "comments": "1",
      "shares": "7",
      "time": {
        "raw": "6ay",
        "parsed": "28.10.2024",
        "isoString": "2024-10-28T05:02:38.366Z"
      },
      "mediaType": "image",
      "mediaContent": [
        "https://media.licdn.com/dms/image/v2/D5622AQHRb5xj1QezoA/feedshare-shrink_800/feedshare-shrink_800/0/1729676469635?e=1748476800&v=beta&t=Tm9rd19uoyzCxxtTX6y9h6_ojdHpuNfdQGwE-AlUBck"
      ],
      "date": "2024-10-28T05:02:38.366Z"
    },
    {
      "captions": "ğŸš¨ Last chance to visit us at IFAT India 2024! ğŸš¨\nFOR REC S.P.A. is excited to be in Mumbai, showcasing our latest innovations in recycling technology. If you're at the exhibition, stop by Booth A009 and discover how we can help you transform waste into valuable resources.\nBut hurry, the exhibition ends tomorrow!\nWe look forward to meeting you and discussing solutions tailored to your needs.\nSee you at IFAT India!\n#FORREC #IFATIndia2024 #Recycling #Sustainability #WasteManagement #Innovations #MumbaiğŸš¨ Last chance to visit us at IFAT India 2024! ğŸš¨\nFOR REC S.P.A. is excited to be in Mumbai, showcasing our latest innovations in recycling technology. If you're at the exhibition, stop by Booth A009 and discover how we can help you transform waste into valuable resources.\nBut hurry, the exhibition ends tomorrow!\nWe look forward to meeting you and discussing solutions tailored to your needs.\nSee you at IFAT India!\n#FORREC #IFATIndia2024 #Recycling #Sustainability #WasteManagement #Innovations #Mumbai",
      "likes": "47",
      "shares": "5",
      "time": {
        "raw": "6ay",
        "parsed": "28.10.2024",
        "isoString": "2024-10-28T05:02:38.367Z"
      },
      "mediaType": "image",
      "mediaContent": [
        "https://media.licdn.com/dms/image/v2/D4D22AQE5S-XOXPJVPQ/feedshare-shrink_800/feedshare-shrink_800/0/1729167760844?e=1748476800&v=beta&t=Zq66XeLXn7xL-RW2ZQep5UqBA2xKBGoE-HCdGGzHaSE",
        "https://media.licdn.com/dms/image/v2/D4D22AQG1JZ-AQY6jVw/feedshare-shrink_800/feedshare-shrink_800/0/1729167761249?e=1748476800&v=beta&t=t-krBLpZYCXxt25lEi9mBdBhdgA_6gQhiUrbV72EgP4",
        "https://media.licdn.com/dms/image/v2/D4D22AQFqVvWqx58MyQ/feedshare-shrink_800/feedshare-shrink_800/0/1729167760710?e=1748476800&v=beta&t=oEVFsBhanpvUfkrMP278lcedo0kAt2ciFaApnrMzKsU"
      ],
      "date": "2024-10-28T05:02:38.367Z"
    },
    {
      "captions": "ğŸš€ Exciting News! ğŸš€\nWe at FOR REC S.P.A. are thrilled to share in the satisfaction of seeing TZR Recycling Industry's brand-new headquarters come to life, fully equipped with state-of-the-art machinery and optimized production spaces.\nThis project, born from a successful collaboration between Forrec and TZR, marks an important milestone for both companies. It's not just about innovation, but also about setting new standards for efficiency and international competitiveness.\nWe look forward to the continued success of this partnership and the opportunities it will create!\n#Forrec #TZR #Innovation #Efficiency #Competitiveness #NewHeadquarters",
      "likes": "73",
      "comments": "5",
      "shares": "11",
      "time": {
        "raw": "7ay",
        "parsed": "28.09.2024",
        "isoString": "2024-09-28T05:02:38.368Z"
      },
      "mediaType": "video",
      "mediaContent": {
        "src": [
          {
            "src": "https://dms.licdn.com/playlist/vid/v2/D4D05AQFkjkf39tX6Rw/mp4-640p-30fp-crf28/mp4-640p-30fp-crf28/0/1727365683139?e=1746424800&v=beta&t=OjPfUiXIpDIi94ymVt5EbpLNrfSwGVWrz89voymR7E0",
            "type": "video/mp4",
            "data-bitrate": 708859
          },
          {
            "src": "https://dms.licdn.com/playlist/vid/v2/D4D05AQFkjkf39tX6Rw/mp4-720p-30fp-crf28/mp4-720p-30fp-crf28/0/1727365685627?e=1746424800&v=beta&t=BRViYRXgsUi5RLwT7J5AFYzThmGu9o6LPUTvasVbH1o",
            "type": "video/mp4",
            "data-bitrate": 949795
          }
        ],
        "posterUrl": "https://media.licdn.com/dms/image/v2/D4D05AQFkjkf39tX6Rw/videocover-low/videocover-low/0/1727365633632?e=1746424800&v=beta&t=DJkITcRoAdi50sS7O9wC66Q88odegIbK63RoONapYbc"
      },
      "date": "2024-09-28T05:02:38.368Z"
    },
    {
      "captions": "ğŸŒ Sustainable recycling for a greener futureÂ ğŸŒ\nFOR REC is committed to protecting the environment by developing innovative recycling solutions that maximize efficiency and reduce waste.\n\nğŸ”Œ However, as the volume of WEEE and photovoltaic panels increases, the need for advanced recycling methods is more pressing than ever.\nFor this reason, FOR REC has designed a tailor-made recycling line that effectively separates key components, ensuring optimal material recovery and environmental responsibility.\nWith our modular recycling facilities, we aim to provide high-performance solutions that promote #sustainability and reduce treatment costs.\n\nHave we intrigued you? Learn more about our WEEE and photovoltaic recycling solutionsÂ ğŸ‘‰ https://lnkd.in/e4GCTvuX\n\n#Innovation #WasteManagement #Recycling",
      "likes": "19",
      "comments": "2",
      "shares": "5",
      "time": {
        "raw": "7ay",
        "parsed": "28.09.2024",
        "isoString": "2024-09-28T05:02:38.369Z"
      },
      "mediaType": "other",
      "date": "2024-09-28T05:02:38.369Z"
    },
    {
      "captions": "Thanks JMC Recycling Systems Ltd for the post... we are very proud of this machine! ğŸ’ª  and ready to present this project and our technology at the next Environmental Services & Solutions Expo (ESS Expo) in Birmingham with your fundamental support!\n#metalscrapsrecycling #shredders #recyclingsolutions The FOR REC S.P.A. FX5000 Shredder is one good looking machine ğŸ˜ \n\nWith a cutting chamber of 1500 x 2000 mm, it's brilliant for a lot of applications including: light loose material, cars, ferrous waste and oversized waste.The FOR REC S.P.A. FX5000 Shredder is one good looking machine ğŸ˜ \n\nWith a cutting chamber of 1500 x 2000 mm, it's brilliant for a lot of applications including: light loose material, cars, ferrous waste and oversized waste.",
      "likes": "38",
      "comments": "4",
      "shares": "1",
      "time": {
        "raw": "10ay10ay",
        "parsed": "28.04.2025",
        "isoString": "2025-04-28T05:02:38.370Z"
      },
      "mediaType": "image",
      "mediaContent": [
        "https://media.licdn.com/dms/image/v2/D4E10AQGaFC8ckdtItQ/image-shrink_800/image-shrink_800/0/1718352059200?e=1746424800&v=beta&t=drsYOACA38v5uv9xlN6iVJjd4tL8rgKOE3M_FzI_Zm4"
      ],
      "date": "2025-04-28T05:02:38.370Z"
    },
    {
      "captions": "The FOR REC S.P.A. FX5000 Shredder is one good looking machine ğŸ˜ \n\nWith a cutting chamber of 1500 x 2000 mm, it's brilliant for a lot of applications including: light loose material, cars, ferrous waste and oversized waste.The FOR REC S.P.A. FX5000 Shredder is one good looking machine ğŸ˜ \n\nWith a cutting chamber of 1500 x 2000 mm, it's brilliant for a lot of applications including: light loose material, cars, ferrous waste and oversized waste.",
      "likes": "38",
      "comments": "4",
      "shares": "1",
      "time": {
        "raw": "10ay",
        "parsed": "28.06.2024",
        "isoString": "2024-06-28T05:02:38.371Z"
      },
      "mediaType": "image",
      "mediaContent": [
        "https://media.licdn.com/dms/image/v2/D4E10AQGaFC8ckdtItQ/image-shrink_800/image-shrink_800/0/1718352059200?e=1746424800&v=beta&t=drsYOACA38v5uv9xlN6iVJjd4tL8rgKOE3M_FzI_Zm4"
      ],
      "date": "2024-06-28T05:02:38.371Z"
    },
    {
      "captions": "â™» NOVACERO S.A. presented the first plant for the treatment of scrap from metal processing in steel mills that enables total recovery of materialsÂ \nFOR REC S.P.A. is proud to have designed and supplied this system and thanks all the staff at NOVACERO for their collaboration\n#recycling #steel #recovery \nEn Novacero, estamos comprometidos con construir un futuro mÃ¡s sostenible para Ecuador y el mundo.\n\nCon la reciente inauguraciÃ³n de nuestra Planta Recuperadora de Residuos, estamos dando un paso significativo en esa direcciÃ³n.\nEsta planta, que transforma residuos en materia prima Ãºtil para diversas industrias, representa nuestra firme apuesta por la transformaciÃ³n sostenible.\n\nAl evitar que mÃ¡s de 12 mil toneladas anuales de desechos se conviertan en basura, estamos contribuyendo activamente a la reducciÃ³n de la contaminaciÃ³n y al cuidado del medio ambiente.\n\nNuestro compromiso ambiental es un pilar fundamental en todas nuestras operaciones, y esta planta es un claro ejemplo de ello.\n\nJuntos, estamos construyendo un futuro mÃ¡s limpio y prÃ³spero. ğŸ’šğŸŒ\n\n#NovaceroÂ #SostenibilidadÂ #CompromisoAmbiental",
      "likes": "25",
      "comments": "2",
      "shares": "4",
      "time": {
        "raw": "11ay11ay",
        "parsed": "04.03.2025",
        "isoString": "2025-03-04T10:24:21.832Z"
      },
      "mediaType": "video",
      "mediaContent": {
        "src": [
          {
            "src": "https://dms.licdn.com/playlist/vid/v2/D4D05AQHvWkse70SPXA/mp4-640p-30fp-crf28/mp4-640p-30fp-crf28/0/1711052188960?e=1741690800&v=beta&t=dsKey6wfIAqhSp9jARSx_RkTWyMMyMt3weYWv1qDe1Y",
            "type": "video/mp4",
            "data-bitrate": 515459
          },
          {
            "src": "https://dms.licdn.com/playlist/vid/v2/D4D05AQHvWkse70SPXA/mp4-720p-30fp-crf28/mp4-720p-30fp-crf28/0/1711052189426?e=1741690800&v=beta&t=7JeY9DHtd325wnOqzDj24nQA6o3sK7vUh3MBT1pQkp4",
            "type": "video/mp4",
            "data-bitrate": 692868
          }
        ],
        "posterUrl": "https://media.licdn.com/dms/image/v2/D4D05AQHvWkse70SPXA/videocover-high/videocover-high/0/1711052185694?e=1741690800&v=beta&t=4Jf3NU0dfE7Xt1crqiwhsQfd-FITpPl96jb2Q8EaQPE"
      },
      "date": "2025-03-04T10:24:21.832Z"
    },
    {
      "captions": "En Novacero, estamos comprometidos con construir un futuro mÃ¡s sostenible para Ecuador y el mundo.\n\nCon la reciente inauguraciÃ³n de nuestra Planta Recuperadora de Residuos, estamos dando un paso significativo en esa direcciÃ³n.\nEsta planta, que transforma residuos en materia prima Ãºtil para diversas industrias, representa nuestra firme apuesta por la transformaciÃ³n sostenible.\n\nAl evitar que mÃ¡s de 12 mil toneladas anuales de desechos se conviertan en basura, estamos contribuyendo activamente a la reducciÃ³n de la contaminaciÃ³n y al cuidado del medio ambiente.\n\nNuestro compromiso ambiental es un pilar fundamental en todas nuestras operaciones, y esta planta es un claro ejemplo de ello.\n\nJuntos, estamos construyendo un futuro mÃ¡s limpio y prÃ³spero. ğŸ’šğŸŒ\n\n#NovaceroÂ #SostenibilidadÂ #CompromisoAmbiental",
      "time": {
        "raw": "11ay",
        "parsed": "04.04.2024",
        "isoString": "2024-04-04T10:24:21.832Z"
      },
      "mediaType": "video",
      "mediaContent": {
        "src": [
          {
            "src": "https://dms.licdn.com/playlist/vid/v2/D4D05AQHvWkse70SPXA/mp4-640p-30fp-crf28/mp4-640p-30fp-crf28/0/1711052188960?e=1741690800&v=beta&t=dsKey6wfIAqhSp9jARSx_RkTWyMMyMt3weYWv1qDe1Y",
            "type": "video/mp4",
            "data-bitrate": 515459
          },
          {
            "src": "https://dms.licdn.com/playlist/vid/v2/D4D05AQHvWkse70SPXA/mp4-720p-30fp-crf28/mp4-720p-30fp-crf28/0/1711052189426?e=1741690800&v=beta&t=7JeY9DHtd325wnOqzDj24nQA6o3sK7vUh3MBT1pQkp4",
            "type": "video/mp4",
            "data-bitrate": 692868
          }
        ],
        "posterUrl": "https://media.licdn.com/dms/image/v2/D4D05AQHvWkse70SPXA/videocover-high/videocover-high/0/1711052185694?e=1741690800&v=beta&t=4Jf3NU0dfE7Xt1crqiwhsQfd-FITpPl96jb2Q8EaQPE"
      },
      "date": "2024-04-04T10:24:21.832Z"
    },
    {
      "captions": "FOR REC S.P.A.is attending the next World Future Energy Summit in AbuDhabi. \nVisit our booth 3211 in Hall 3FOR REC S.P.A.is attending the next World Future Energy Summit in AbuDhabi. \nVisit our booth 3211 in Hall 3",
      "likes": "13",
      "shares": "1",
      "time": {
        "raw": "11ay",
        "parsed": "04.04.2024",
        "isoString": "2024-04-04T10:24:21.833Z"
      },
      "mediaType": "image",
      "mediaContent": [
        "https://media.licdn.com/dms/image/v2/D4D22AQGtPNgLlJB-YQ/feedshare-shrink_800/feedshare-shrink_800/0/1711530799223?e=1744243200&v=beta&t=HcEDKFSM91FuJiYXJqfZg1j8iatxrBncso_VqztYpwI"
      ],
      "date": "2024-04-04T10:24:21.833Z"
    },
    {
      "captions": "ğŸ“¢ Looking forward to hearing about upcoming events scheduled for FOR REC S.P.A.? Mark your appointments and come visit us at the fair!\n-------------------------------------------------------------------------\nğŸ“¢ Curioso di sapere quali saranno i prossimi eventi in programma per FOR REC S.P.A.? Segnati gli appuntamenti e passa a trovarci in fiera!\nğŸ“¢ Looking forward to hearing about upcoming events scheduled for FOR REC S.P.A.? Mark your appointments and come visit us at the fair!\n-------------------------------------------------------------------------\nğŸ“¢ Curioso di sapere quali saranno i prossimi eventi in programma per FOR REC S.P.A.? Segnati gli appuntamenti e passa a trovarci in fiera!",
      "likes": "10",
      "shares": "4",
      "time": {
        "raw": "11ay",
        "parsed": "04.04.2024",
        "isoString": "2024-04-04T10:24:21.834Z"
      },
      "mediaType": "image",
      "mediaContent": [
        "https://media.licdn.com/dms/image/v2/D4D22AQEHNm7TO01KaQ/feedshare-shrink_2048_1536/feedshare-shrink_2048_1536/0/1710769595541?e=1744243200&v=beta&t=sqH7pmj5nl1Iac1AtySY8JSmcgW9TjHDPXbHWHksX8c"
      ],
      "date": "2024-04-04T10:24:21.834Z"
    },
    {
      "captions": "Discover how FORREC, in partnership with Telford Smith, is turning tyre recycling into an opportunity for the circular economy! ğŸŒğŸ”„ Our innovative solutions are making a difference by processing up to 6,000kg of tyres per hour and creating materials for various industries. Find out more by clicking the link below! ğŸš€\n\n#Innovation #Recycling #Sustainability #CircularEconomy #ForrecğŸ”„ Turning waste into opportunity! The FORREC Tyre Recycling Plant processes up to 6,000kg of tyres per hour, creating materials for industries while supporting Australiaâ€™s circular economy. ğŸ’¡ğŸŒ \n\nPartner with Telford Smith, the supplier of Forrec, for tailored recycling solutions that make a difference.Â ğŸš€ Click on the link to find out more: https://lnkd.in/gAVfHe2JÂ \nğŸ“Š Connect with Us for cutting-edge insights into recycling and sustainable waste management! Like Our posts, share them with your network, and follow Our page for expert advice and innovative solutions. Ready to transform your recycling and waste management strategy? Contact Telford Smith for personalised solutions today. Together, we can drive sustainable change! â™»ï¸ğŸ’¼Â \n#Innovation #Recycling #Sustainability #PlasticRecycling #WasteManagement #TelfordSmith #Legacy #Quality #BusinessGrowth #StayInformed #QualityControl #ExpertAdvice #EngineeringExcellence #Engineering #ProfessionalExcellence #EngineeringStandardsÂ #EcoSolutions #WasteManagement #CircularEconomyLeaders  #ForrecğŸ”„ Turning waste into opportunity! The FORREC Tyre Recycling Plant processes up to 6,000kg of tyres per hour, creating materials for industries while supporting Australiaâ€™s circular economy. ğŸ’¡ğŸŒ \n\nPartner with Telford Smith, the supplier of Forrec, for tailored recycling solutions that make a difference.Â ğŸš€ Click on the link to find out more: https://lnkd.in/gAVfHe2JÂ \nğŸ“Š Connect with Us for cutting-edge insights into recycling and sustainable waste management! Like Our posts, share them with your network, and follow Our page for expert advice and innovative solutions. Ready to transform your recycling and waste management strategy? Contact Telford Smith for personalised solutions today. Together, we can drive sustainable change! â™»ï¸ğŸ’¼Â \n#Innovation #Recycling #Sustainability #PlasticRecycling #WasteManagement #TelfordSmith #Legacy #Quality #BusinessGrowth #StayInformed #QualityControl #ExpertAdvice #EngineeringExcellence #Engineering #ProfessionalExcellence #EngineeringStandardsÂ #EcoSolutions #WasteManagement #CircularEconomyLeaders  #Forrec",
      "likes": "29",
      "shares": "2",
      "time": {
        "raw": "1ay3ay",
        "parsed": "28.04.2025",
        "isoString": "2025-04-28T05:02:38.332Z"
      },
      "mediaType": "image",
      "mediaContent": [
        "https://media.licdn.com/dms/image/v2/D5622AQHFmrJVFRrLiA/feedshare-shrink_800/B56ZSMa9EgHEAg-/0/1737522664464?e=1748476800&v=beta&t=Ud--FBNJcCAjnUeCuoHsvso-3V69Wgov-BkVGYnNr68"
      ],
      "date": "2025-04-28T05:02:38.332Z"
    },
    {
      "captions": "ğŸ”„ Turning waste into opportunity! The FORREC Tyre Recycling Plant processes up to 6,000kg of tyres per hour, creating materials for industries while supporting Australiaâ€™s circular economy. ğŸ’¡ğŸŒ \n\nPartner with Telford Smith, the supplier of Forrec, for tailored recycling solutions that make a difference.Â ğŸš€ Click on the link to find out more: https://lnkd.in/gAVfHe2JÂ \nğŸ“Š Connect with Us for cutting-edge insights into recycling and sustainable waste management! Like Our posts, share them with your network, and follow Our page for expert advice and innovative solutions. Ready to transform your recycling and waste management strategy? Contact Telford Smith for personalised solutions today. Together, we can drive sustainable change! â™»ï¸ğŸ’¼Â \n#Innovation #Recycling #Sustainability #PlasticRecycling #WasteManagement #TelfordSmith #Legacy #Quality #BusinessGrowth #StayInformed #QualityControl #ExpertAdvice #EngineeringExcellence #Engineering #ProfessionalExcellence #EngineeringStandardsÂ #EcoSolutions #WasteManagement #CircularEconomyLeaders  #ForrecğŸ”„ Turning waste into opportunity! The FORREC Tyre Recycling Plant processes up to 6,000kg of tyres per hour, creating materials for industries while supporting Australiaâ€™s circular economy. ğŸ’¡ğŸŒ \n\nPartner with Telford Smith, the supplier of Forrec, for tailored recycling solutions that make a difference.Â ğŸš€ Click on the link to find out more: https://lnkd.in/gAVfHe2JÂ \nğŸ“Š Connect with Us for cutting-edge insights into recycling and sustainable waste management! Like Our posts, share them with your network, and follow Our page for expert advice and innovative solutions. Ready to transform your recycling and waste management strategy? Contact Telford Smith for personalised solutions today. Together, we can drive sustainable change! â™»ï¸ğŸ’¼Â \n#Innovation #Recycling #Sustainability #PlasticRecycling #WasteManagement #TelfordSmith #Legacy #Quality #BusinessGrowth #StayInformed #QualityControl #ExpertAdvice #EngineeringExcellence #Engineering #ProfessionalExcellence #EngineeringStandardsÂ #EcoSolutions #WasteManagement #CircularEconomyLeaders  #Forrec",
      "likes": "29",
      "shares": "2",
      "time": {
        "raw": "3ay",
        "parsed": "28.01.2025",
        "isoString": "2025-01-28T05:02:38.333Z"
      },
      "mediaType": "image",
      "mediaContent": [
        "https://media.licdn.com/dms/image/v2/D5622AQHFmrJVFRrLiA/feedshare-shrink_800/B56ZSMa9EgHEAg-/0/1737522664464?e=1748476800&v=beta&t=Ud--FBNJcCAjnUeCuoHsvso-3V69Wgov-BkVGYnNr68"
      ],
      "date": "2025-01-28T05:02:38.333Z"
    },
    {
      "captions": "Â¡No te pierdas el artÃ­culo de InduAmbiente que explora las soluciones innovadoras de FOR REC! Descubre cÃ³mo estamos transformando la industria y promoviendo la economÃ­a circular para un futuro mÃ¡s sostenible y eficiente. ğŸŒâœ¨\n\n#EconomÃ­aCircular #Sostenibilidad #InnovaciÃ³n #Forrec #Reciclaje #FuturoSostenible #SolucionesInnovadorasPara Reciclar los RAEE\nFOR REC S.P.A. provee mÃ¡quinas y servicios para el Ã³ptimo reciclaje de residuos elÃ©ctricos y electrÃ³nicos y paneles fotovoltaicos.\nConoce mÃ¡s de sus ventajas y procesos que emplea en: https://n9.cl/f4ul4\n\n#reciclaje #residuos #RAEEPara Reciclar los RAEE\nFOR REC S.P.A. provee mÃ¡quinas y servicios para el Ã³ptimo reciclaje de residuos elÃ©ctricos y electrÃ³nicos y paneles fotovoltaicos.\nConoce mÃ¡s de sus ventajas y procesos que emplea en: https://n9.cl/f4ul4\n\n#reciclaje #residuos #RAEE",
      "likes": "18",
      "shares": "3",
      "time": {
        "raw": "1ay1ay",
        "parsed": "28.04.2025",
        "isoString": "2025-04-28T05:02:38.334Z"
      },
      "mediaType": "image",
      "mediaContent": [
        "https://media.licdn.com/dms/image/v2/D4E22AQENeBRkshud1w/feedshare-shrink_800/B4EZVxUa_pG0Ak-/0/1741362934990?e=1748476800&v=beta&t=_LR8xxBP-vJ6LLFXb06Ej0TgtA4U7RO3wqzI1RwHQdo"
      ],
      "date": "2025-04-28T05:02:38.334Z"
    },
    {
      "captions": "Para Reciclar los RAEE\nFOR REC S.P.A. provee mÃ¡quinas y servicios para el Ã³ptimo reciclaje de residuos elÃ©ctricos y electrÃ³nicos y paneles fotovoltaicos.\nConoce mÃ¡s de sus ventajas y procesos que emplea en: https://n9.cl/f4ul4\n\n#reciclaje #residuos #RAEEPara Reciclar los RAEE\nFOR REC S.P.A. provee mÃ¡quinas y servicios para el Ã³ptimo reciclaje de residuos elÃ©ctricos y electrÃ³nicos y paneles fotovoltaicos.\nConoce mÃ¡s de sus ventajas y procesos que emplea en: https://n9.cl/f4ul4\n\n#reciclaje #residuos #RAEE",
      "likes": "18",
      "shares": "3",
      "time": {
        "raw": "1ay",
        "parsed": "28.03.2025",
        "isoString": "2025-03-28T05:02:38.336Z"
      },
      "mediaType": "image",
      "mediaContent": [
        "https://media.licdn.com/dms/image/v2/D4E22AQENeBRkshud1w/feedshare-shrink_800/B4EZVxUa_pG0Ak-/0/1741362934990?e=1748476800&v=beta&t=_LR8xxBP-vJ6LLFXb06Ej0TgtA4U7RO3wqzI1RwHQdo"
      ],
      "date": "2025-03-28T05:02:38.336Z"
    },
    {
      "captions": "â™»ï¸ Turning waste into assets: the value of industrial recycling!\n\nEvery day, thousands of tonnes of potentially recoverable materials become industrial waste.\nWhat if we turned this waste into new opportunities?\n\nFOR REC designs and develops innovative plants for the treatment of plastic, aluminium, photovoltaic panels, WEEE and more, converting waste into valuable raw materials.\nChoosing industrial recycling means:\nâœ… Reducing environmental impact;\nâœ… Optimise production costs;\nâœ… Making a concrete contribution to the circular economy.\n\nWith FOR REC plants you can upgrade your industrial waste, giving it a second life. Find out how to turn your waste into valuable resources â¡ï¸ https://lnkd.in/dMu_Fevj\n\n#Forrec #IndustrialRecycling #CircularEconomy #Sustainability",
      "likes": "20",
      "shares": "4",
      "time": {
        "raw": "1ay",
        "parsed": "28.03.2025",
        "isoString": "2025-03-28T05:02:38.337Z"
      },
      "mediaType": "other",
      "date": "2025-03-28T05:02:38.337Z"
    },
    {
      "captions": "â™»ï¸ MSW: from urban waste to new value with FOR REC!\n\nDid you know that it is possible to recover many valuable raw materials from Municipal Solid Waste (MSW)?\nWith the FOR REC recycling lines you can valorise waste materials into a concrete opportunity for your company! How?\nOur recycling lines are designed to recover raw materials, while the non-recyclable dry fraction can be processed to produce Residual Derived Fuel (RDF).\nğŸš€ A unique way to generate additional value from material destined for disposal!\n\nğŸ“Œ Come and discover all FOR REC solutions at the RESIDUOS EXPO! We look forward to seeing you in Mexico City from 25 to 27 March.\n\n#Forrec # Recycling #CircularEconomy #ResiduosExpoâ™»ï¸ MSW: from urban waste to new value with FOR REC!\n\nDid you know that it is possible to recover many valuable raw materials from Municipal Solid Waste (MSW)?\nWith the FOR REC recycling lines you can valorise waste materials into a concrete opportunity for your company! How?\nOur recycling lines are designed to recover raw materials, while the non-recyclable dry fraction can be processed to produce Residual Derived Fuel (RDF).\nğŸš€ A unique way to generate additional value from material destined for disposal!\n\nğŸ“Œ Come and discover all FOR REC solutions at the RESIDUOS EXPO! We look forward to seeing you in Mexico City from 25 to 27 March.\n\n#Forrec # Recycling #CircularEconomy #ResiduosExpo",
      "likes": "41",
      "shares": "5",
      "time": {
        "raw": "1ay",
        "parsed": "28.03.2025",
        "isoString": "2025-03-28T05:02:38.330Z"
      },
      "mediaType": "image",
      "mediaContent": [
        "https://media.licdn.com/dms/image/v2/D4D22AQG1KOEdJwVFfQ/feedshare-shrink_800/B4DZWEDn.VHwAg-/0/1741677298209?e=1748476800&v=beta&t=NJoC8bPvauOEoNs8wysMt5SH0oV6sgFjla_sj7n1TU0"
      ],
      "date": "2025-03-28T05:02:38.330Z"
    },
    {
      "captions": "Siamo lieti di annunciare che FOR REC sarÃ  presente alla fiera ECOMED - Green Expo del Mediterraneo pressoÂ SiciliaFiera a Misterbianco (Catania), dal 15 al 17 Aprile 2025! ğŸŒ \nCi troverete al Padiglione C1, Stand 63. \nNon perdere l'opportunitÃ  di scoprire le nostre novitÃ  e soluzioni innovative. Vieni a trovarci! ğŸ¤\n\n#Ecomed2025 #Fiera #Innovazione #SostenibilitÃ  #FORREC #CataniaSiamo lieti di annunciare che FOR REC sarÃ  presente alla fiera ECOMED - Green Expo del Mediterraneo pressoÂ SiciliaFiera a Misterbianco (Catania), dal 15 al 17 Aprile 2025! ğŸŒ \nCi troverete al Padiglione C1, Stand 63. \nNon perdere l'opportunitÃ  di scoprire le nostre novitÃ  e soluzioni innovative. Vieni a trovarci! ğŸ¤\n\n#Ecomed2025 #Fiera #Innovazione #SostenibilitÃ  #FORREC #Catania",
      "likes": "23",
      "shares": "5",
      "time": {
        "raw": "1ay",
        "parsed": "02.04.2025",
        "isoString": "2025-04-02T05:41:37.465Z"
      },
      "mediaType": "image",
      "mediaContent": [
        "https://media.licdn.com/dms/image/v2/D5622AQEVnFdlao0j4g/feedshare-shrink_800/B56ZWzN4naHsAk-/0/1742468517074?e=1749081600&v=beta&t=HOKantHQS_1XLewxupTloG3AKwZWFuasGZy1idwlEos"
      ],
      "date": "2025-04-02T05:41:37.465Z"
    },
    {
      "captions": "ğŸ”Œ Are you considering the purchase of a recycling plant, but afraid of making a blind investment?\n\nWe know that choosing industrial machinery is an important decision.Â \nThat's why FOR REC has installed a complete and working plant at its headquarter in Italy, dedicated to the recycling of electric wires and motors.\nYou will be able to directly see the performance of this machinery, test it personally and see for yourself the quality of the end result before you invest.\n\nğŸ‘‰ Choose the security of a conscious investment!\n\n#Forrec #RecyclingğŸ”Œ Are you considering the purchase of a recycling plant, but afraid of making a blind investment?\n\nWe know that choosing industrial machinery is an important decision.Â \nThat's why FOR REC has installed a complete and working plant at its headquarter in Italy, dedicated to the recycling of electric wires and motors.\nYou will be able to directly see the performance of this machinery, test it personally and see for yourself the quality of the end result before you invest.\n\nğŸ‘‰ Choose the security of a conscious investment!\n\n#Forrec #Recycling",
      "likes": "71",
      "comments": "2",
      "shares": "16",
      "time": {
        "raw": "1ay",
        "parsed": "28.03.2025",
        "isoString": "2025-03-28T05:02:38.328Z"
      },
      "mediaType": "image",
      "mediaContent": [
        "https://media.licdn.com/dms/image/v2/D4D22AQGx3AQUN6al5w/feedshare-shrink_800/B4DZXHXV7vH4Ag-/0/1742806542958?e=1748476800&v=beta&t=R9KRvq1W-PBzoy81UlAttSewvQg5nBNZjP3j_JHMkZQ"
      ],
      "date": "2025-03-28T05:02:38.328Z"
    },
    {
      "captions": "â™»ï¸ High-performance recycling for WEEE, electric motors and photovoltaic panels \n\nAt FOR REC, we donâ€™t just design recycling systems: we build high-performing solutions tailored to the real needs of your industry.\nOur latest blog article takes you inside the world of WEEE treatment, with a special focus on a recent installation in Northern Italy, where our advanced technology enabled the client to process a large volume of waste in record time.\n\nThanks to a totally custom recycling line, the company is now able to perfectly separate materials such as plastics, non-magnetic metals and ferrous fraction by processing up to 2 tons of material per hour.\nğŸ‘‰ Do you want to discover more? Read more here: https://lnkd.in/djQ6m6BR\n\n#FORREC #RecyclingTechnology #WEEE #CircularEconomy",
      "likes": "21",
      "shares": "3",
      "time": {
        "raw": "1h",
        "parsed": "07.04.2025",
        "isoString": "2025-04-07T04:49:18.567Z"
      },
      "mediaType": "other",
      "date": "2025-04-07T04:49:18.567Z"
    },
    {
      "captions": "A heartfelt thank you to everyone who visited our booth at Residuos Expo 2025! It was a pleasure meeting you, discussing innovations and solutions for waste management, and sharing our ideas for a more sustainable future.\nWe look forward to continuing to collaborate and grow together.\nSee you soon! ğŸš€\n\n________________________________________________\n\nUn sincero gracias a todos los que pasaron por nuestro stand en Residuos Expo 2025. Â¡Fue un placer conocerlos, discutir innovaciones y soluciones para la gestiÃ³n de residuos y compartir nuestras ideas para un futuro mÃ¡s sostenible!\nEsperamos continuar colaborando y creciendo juntos.\nÂ¡Hasta pronto!ğŸš€\n\n#ResiduosExpo2025 #Feria #InnovaciÃ³n #Sostenibilidad #GestiÃ³nDeResiduos #GraciasA heartfelt thank you to everyone who visited our booth at Residuos Expo 2025! It was a pleasure meeting you, discussing innovations and solutions for waste management, and sharing our ideas for a more sustainable future.\nWe look forward to continuing to collaborate and grow together.\nSee you soon! ğŸš€\n\n________________________________________________\n\nUn sincero gracias a todos los que pasaron por nuestro stand en Residuos Expo 2025. Â¡Fue un placer conocerlos, discutir innovaciones y soluciones para la gestiÃ³n de residuos y compartir nuestras ideas para un futuro mÃ¡s sostenible!\nEsperamos continuar colaborando y creciendo juntos.\nÂ¡Hasta pronto!ğŸš€\n\n#ResiduosExpo2025 #Feria #InnovaciÃ³n #Sostenibilidad #GestiÃ³nDeResiduos #Gracias",
      "likes": "30",
      "shares": "3",
      "time": {
        "raw": "4h",
        "parsed": "04.04.2025",
        "isoString": "2025-04-04T05:41:37.462Z"
      },
      "mediaType": "image",
      "mediaContent": [
        "https://media.licdn.com/dms/image/v2/D4D22AQFStfwGVbJEPQ/feedshare-shrink_800/B4DZX6veIYH4Ak-/0/1743668503734?e=1749081600&v=beta&t=JDgMn165cI841Xd0_QO9uNU4LCK5Q1FpeQ11jBicMsQ",
        "https://media.licdn.com/dms/image/v2/D4D22AQHPcPKwVQmCVg/feedshare-shrink_800/B4DZX6veIDG8Ak-/0/1743668503779?e=1749081600&v=beta&t=RchmrKm8TEB3oweD8xZI63V4Xd7dbgrQgdwn1idd1xQ"
      ],
      "date": "2025-04-04T05:41:37.462Z"
    },
    {
      "captions": "â™»ï¸ Refrigerators and boilers: complex waste, smart solutions!\n\nRecycling refrigerators and boilers is no simple task. These appliances contain insulating gases, plastics, metals, and other components that require precision and safety during treatment.\n\nAt FOR REC, weâ€™ve developed turnkey systems capable of handling the complexity of these materials. Our technologies ensure:\nâœ… Safe removal of harmful substances;\nâœ… Efficient separation of metals, plastics, and polyurethane;\nâœ… Compliance with international environmental standards.\n\nWhether youâ€™re facing the challenges of WEEE regulations or looking to improve your plantâ€™s performance, FOR REC provides customized and scalable solutions to make refrigerator and boiler recycling cleaner, safer, and more efficient.\n\nDiscover more about our specialized systems: https://lnkd.in/dF2S5DkF\n\n#FORREC #RecyclingTechnology #WEEE #CircularEconomyâ™»ï¸ Refrigerators and boilers: complex waste, smart solutions!\n\nRecycling refrigerators and boilers is no simple task. These appliances contain insulating gases, plastics, metals, and other components that require precision and safety during treatment.\n\nAt FOR REC, weâ€™ve developed turnkey systems capable of handling the complexity of these materials. Our technologies ensure:\nâœ… Safe removal of harmful substances;\nâœ… Efficient separation of metals, plastics, and polyurethane;\nâœ… Compliance with international environmental standards.\n\nWhether youâ€™re facing the challenges of WEEE regulations or looking to improve your plantâ€™s performance, FOR REC provides customized and scalable solutions to make refrigerator and boiler recycling cleaner, safer, and more efficient.\n\nDiscover more about our specialized systems: https://lnkd.in/dF2S5DkF\n\n#FORREC #RecyclingTechnology #WEEE #CircularEconomy",
      "likes": "28",
      "shares": "8",
      "time": {
        "raw": "2h",
        "parsed": "18.04.2025",
        "isoString": "2025-04-18T05:41:37.454Z"
      },
      "mediaType": "image",
      "mediaContent": [
        "https://media.licdn.com/dms/image/v2/D4D22AQG6xAGmxuxHow/feedshare-shrink_800/B4DZY92P1gGkAg-/0/1744794354653?e=1749081600&v=beta&t=6LaSTycZfxIJM2hjatKlF_Lan1YbV722BSaxaIBgDQU"
      ],
      "date": "2025-04-18T05:41:37.454Z"
    },
    {
      "captions": "ğŸ“¢ Siamo presenti sull'ultimo numero di Recover Magazine!\n ğŸ”Œ Presentiamo la nostra proposta per il riciclo di motori e cavi elettrici, capace di garantire rame puro al 99%.\nUn risultato che conferma il nostro impegno costante nellâ€™innovazione tecnologica e nella promozione di unâ€™economia sempre piÃ¹ circolare e sostenibile. â™»ï¸\n\nğŸ‘‰ Sfoglia la rivista online e scopri di piÃ¹: https://lnkd.in/dedFuaXu\n\n#FORREC #RecyclingSolutions #GreenTechnology #EconomiaCircolare #RecoverMagazine #SostenibilitÃ  #InnovazioneğŸ—ï¸  Sull'ultimo numero di Recover Magazine! ğŸ—ï¸ \nRAME PURO AL 99%\n\nğŸ”Œ La proposta di FOR REC S.P.A. nel riciclo di motori e cavi elettrici.\nSfoglia la rivista online: https://lnkd.in/dedFuaXu",
      "likes": "33",
      "shares": "5",
      "time": {
        "raw": "2h2h",
        "parsed": "02.05.2025",
        "isoString": "2025-05-02T05:41:37.457Z"
      },
      "mediaType": "document",
      "mediaContent": {
        "title": "Recover Magazine 70 marzo 2025 - For Rec",
        "subtitle": "2 sayfa",
        "totalPages": 2,
        "coverPages": [
          {
            "type": "image",
            "config": {
              "src": "https://media.licdn.com/dms/image/v2/D4E1FAQF3aW27L-QTZA/feedshare-document-cover-images_480/B4EZYz14LlHkBI-/0/1744626485921?e=1746770400&v=beta&t=YbBlFMNxN8R9FOBS9Qzu_l59mRZ9q_68l5pvU9rBs8Q"
            }
          },
          {
            "type": "image",
            "config": {
              "src": "https://media.licdn.com/dms/image/v2/D4E1FAQF3aW27L-QTZA/feedshare-document-cover-images_480/B4EZYz14LlHkBI-/1/1744626485921?e=1746770400&v=beta&t=Ah0x15WdwcW5IHgR-mABm-NTkV1-EdMWYU1lYhMk7ys"
            }
          }
        ]
      },
      "date": "2025-05-02T05:41:37.457Z"
    },
    {
      "captions": "ğŸ—ï¸  Sull'ultimo numero di Recover Magazine! ğŸ—ï¸ \nRAME PURO AL 99%\n\nğŸ”Œ La proposta di FOR REC S.P.A. nel riciclo di motori e cavi elettrici.\nSfoglia la rivista online: https://lnkd.in/dedFuaXu",
      "time": {
        "raw": "2h",
        "parsed": "18.04.2025",
        "isoString": "2025-04-18T05:41:37.458Z"
      },
      "mediaType": "document",
      "mediaContent": {
        "title": "Recover Magazine 70 marzo 2025 - For Rec",
        "subtitle": "2 sayfa",
        "totalPages": 2,
        "coverPages": [
          {
            "type": "image",
            "config": {
              "src": "https://media.licdn.com/dms/image/v2/D4E1FAQF3aW27L-QTZA/feedshare-document-cover-images_480/B4EZYz14LlHkBI-/0/1744626485921?e=1746770400&v=beta&t=YbBlFMNxN8R9FOBS9Qzu_l59mRZ9q_68l5pvU9rBs8Q"
            }
          },
          {
            "type": "image",
            "config": {
              "src": "https://media.licdn.com/dms/image/v2/D4E1FAQF3aW27L-QTZA/feedshare-document-cover-images_480/B4EZYz14LlHkBI-/1/1744626485921?e=1746770400&v=beta&t=Ah0x15WdwcW5IHgR-mABm-NTkV1-EdMWYU1lYhMk7ys"
            }
          }
        ]
      },
      "date": "2025-04-18T05:41:37.458Z"
    },
    {
      "captions": "â™»ï¸ High-performance recycling for WEEE, electric motors and photovoltaic panels!\n\nAt FOR REC, we donâ€™t just design recycling systems: we build high-performing solutions tailored to the real needs of your industry.\nOur latest blog article takes you inside the world of WEEE treatment, with a special focus on a recent installation in Northern Italy, where our advanced technology enabled the client to process a large volume of waste in record time.\n\nThanks to a totally custom recycling line, the company is now able to perfectly separate materials such as plastics, non-magnetic metals and ferrous fraction by processing up to 2 tons of material per hour.\nğŸ‘‰ Do you want to discover more? Read more here: https://lnkd.in/djQ6m6BR\n\n#FORREC #RecyclingTechnology #WEEE #CircularEconomy",
      "likes": "28",
      "shares": "4",
      "time": {
        "raw": "3h",
        "parsed": "11.04.2025",
        "isoString": "2025-04-11T05:41:37.459Z"
      },
      "mediaType": "other",
      "date": "2025-04-11T05:41:37.459Z"
    },
    {
      "captions": "ğŸŒ FOR REC is heading to California!\nWeâ€™re excited to announce our participation in the REMA Convention: the largest recycled materials industry event in the world!\n\nJoin us in San Diego to discover our most advanced solutions for the treatment of WEEE, electric motors, photovoltaic panels, refrigerators, and more.Â \nLetâ€™s connect and shape the future of circular economy together!\nğŸ“… May 12â€“15\nğŸ“Visit us at booth #814\nğŸ”— https://lnkd.in/dRBg7njW\n\n#FORREC #REMA #RecyclingTechnology",
      "likes": "8",
      "shares": "3",
      "time": {
        "raw": "1h",
        "parsed": "25.04.2025",
        "isoString": "2025-04-25T05:41:37.452Z"
      },
      "mediaType": "other",
      "date": "2025-04-25T05:41:37.452Z"
    },
    {
      "captions": "ğŸ‰ Weâ€™re excited to announce that FOR REC will be exhibiting at ReMA in San Diego, California, from May 12 to 15, 2025!\n\nYou can find us at Booth 814.\n\nDonâ€™t miss the chance to explore our latest technologies and innovative recycling solutions. Come visit us and letâ€™s talk sustainable innovation! â™»ï¸ğŸ‰ Weâ€™re excited to announce that FOR REC will be exhibiting at ReMA in San Diego, California, from May 12 to 15, 2025!\n\nYou can find us at Booth 814.\n\nDonâ€™t miss the chance to explore our latest technologies and innovative recycling solutions. Come visit us and letâ€™s talk sustainable innovation! â™»ï¸",
      "likes": "17",
      "shares": "5",
      "time": {
        "raw": "3g",
        "parsed": "25.04.2025",
        "isoString": "2025-04-25T05:02:38.312Z"
      },
      "mediaType": "image",
      "mediaContent": [
        "https://media.licdn.com/dms/image/v2/D4D22AQE_A01ni41DSw/feedshare-shrink_800/B4DZZn2XlxHwAk-/0/1745499028672?e=1748476800&v=beta&t=U0RxlHKOf3efVKejRievAwNqFG0Y83miz7yn7yEg8ME"
      ],
      "date": "2025-04-25T05:02:38.312Z"
    },
    {
      "captions": "FOR REC S.P.A. \nRecycling System\n\nğŸ‡®ğŸ‡¹ \nUna vista panoramica di una delle diverse aree produttive FOR REC, dove si puÃ² chiaramente vedere il terzo robot per i rivestimenti anti-usura dei rotori e la produzione di lame speciali per i nostri macchinari piÃ¹ performanti. \nLa nostra produzione Ã¨ sempre in costante evoluzione grazie ai tanti clienti in tutto il mondo che continuano a sposare la nostra qualitÃ  e tecnologia!\nA breve nuove immagini. \n\nâ€”â€”â€”â€”â€”â€”â€”â€”â€”\n\nğŸ´ó §ó ¢ó ¥ó ®ó §ó ¿\nA panoramic view of one of the different FOR REC production areas, where is clearly visible the third robot for rotor wear coatings and the production of special blades for our high-performance machines. \nOur production is constantly evolving thanks to the many customers around the world who continue to espouse our quality and technology!\nNew pictures coming soon.FOR REC S.P.A. \nRecycling System\n\nğŸ‡®ğŸ‡¹ \nUna vista panoramica di una delle diverse aree produttive FOR REC, dove si puÃ² chiaramente vedere il terzo robot per i rivestimenti anti-usura dei rotori e la produzione di lame speciali per i nostri macchinari piÃ¹ performanti. \nLa nostra produzione Ã¨ sempre in costante evoluzione grazie ai tanti clienti in tutto il mondo che continuano a sposare la nostra qualitÃ  e tecnologia!\nA breve nuove immagini. \n\nâ€”â€”â€”â€”â€”â€”â€”â€”â€”\n\nğŸ´ó §ó ¢ó ¥ó ®ó §ó ¿\nA panoramic view of one of the different FOR REC production areas, where is clearly visible the third robot for rotor wear coatings and the production of special blades for our high-performance machines. \nOur production is constantly evolving thanks to the many customers around the world who continue to espouse our quality and technology!\nNew pictures coming soon.",
      "likes": "62",
      "comments": "2",
      "shares": "4",
      "time": {
        "raw": "1h",
        "parsed": "25.04.2025",
        "isoString": "2025-04-25T05:41:37.450Z"
      },
      "mediaType": "image",
      "mediaContent": [
        "https://media.licdn.com/dms/image/v2/D4D22AQHMHyWQPWDJhg/feedshare-shrink_800/B4DZZnph1LGsAo-/0/1745495663873?e=1749081600&v=beta&t=sudHQbz5S-Kz7V_AnDe3_4PS6TOjT6QeZ4G8NlokMvc"
      ],
      "date": "2025-04-25T05:41:37.450Z"
    },
    {
      "captions": "ğŸŒ FOR REC will be attending Residuos Expo in Mexico City, from March 25th to 27th, 2025, at the Centro Citibanamex (booth 928).\nâ™»ï¸ Come visit us to discover our innovative solutions in the recycling and waste management industry. We look forward to meeting you and discussing how we can support your needs!\n\n________________________________________________\n\nğŸŒ FOR REC estarÃ¡ presente en Residuos Expo en Ciudad de MÃ©xico, del 25 al 27 de marzo de 2025, en el Centro Citibanamex (stand 928).\nâ™»ï¸ Â¡Ven a visitarnos! Descubre nuestras soluciones innovadoras en la industria del reciclaje y la gestiÃ³n de residuos. Â¡Esperamos verte y hablar sobre cÃ³mo podemos apoyar tus necesidades!\n\n#ResiduosExpo #FORREC #Recycling #WasteManagement #IndustrialRecycling #CircularEconomy #Sustainability #MexicoCityğŸŒ FOR REC will be attending Residuos Expo in Mexico City, from March 25th to 27th, 2025, at the Centro Citibanamex (booth 928).\nâ™»ï¸ Come visit us to discover our innovative solutions in the recycling and waste management industry. We look forward to meeting you and discussing how we can support your needs!\n\n________________________________________________\n\nğŸŒ FOR REC estarÃ¡ presente en Residuos Expo en Ciudad de MÃ©xico, del 25 al 27 de marzo de 2025, en el Centro Citibanamex (stand 928).\nâ™»ï¸ Â¡Ven a visitarnos! Descubre nuestras soluciones innovadoras en la industria del reciclaje y la gestiÃ³n de residuos. Â¡Esperamos verte y hablar sobre cÃ³mo podemos apoyar tus necesidades!\n\n#ResiduosExpo #FORREC #Recycling #WasteManagement #IndustrialRecycling #CircularEconomy #Sustainability #MexicoCity",
      "likes": "39",
      "shares": "10",
      "time": {
        "raw": "2ay",
        "parsed": "28.02.2025",
        "isoString": "2025-02-28T05:02:38.350Z"
      },
      "mediaType": "image",
      "mediaContent": [
        "https://media.licdn.com/dms/image/v2/D4D22AQHN2a15qoofig/feedshare-shrink_800/B4DZVBpmfOHwAo-/0/1740563180009?e=1748476800&v=beta&t=44VV-fStDEpcUVFsY8m2yvJxue9BYAPV3B_Z8F2PSc4"
      ],
      "date": "2025-02-28T05:02:38.350Z"
    },
    {
      "captions": "â™»ï¸ Recycling is not just a necessity: itâ€™s a responsibility.\n\nAt FOR REC, we believe that efficient waste management is key to building a sustainable future. Thatâ€™s why we design and build fully customized industrial recycling lines, tailored to each clientâ€™s specific needs.\n\nWhether youâ€™re treating WEEE, metals, plastics, wood, or end-of-life products, FOR REC delivers:\nğŸ”§ Turnkey solutions engineered for your materials and capacity;\nğŸ“ˆ Modular systems designed to grow with your business;\nğŸŒ Reliable performance that supports environmental goals and compliance.\n\nFrom first analysis to installation and after-sales, we partner with companies worldwide to turn waste into valuable resources â€” efficiently, safely, and with precision.\n\nğŸ‘‰ Learn more about our custom recycling solutions: https://lnkd.in/dhsGNM49\n\n#FORREC #Recycling #CustomSolutions #IndustrialRecycling #WasteManagement",
      "likes": "7",
      "shares": "1",
      "time": {
        "raw": "2g",
        "parsed": "30.04.2025",
        "isoString": "2025-04-30T05:41:37.443Z"
      },
      "mediaType": "other",
      "date": "2025-04-30T05:41:37.443Z"
    },
    {
      "captions": "ğŸŒ Exciting news! FOR REC will be attending IFAT Eurasia in Istanbul from May 15 to 17, 2025!\nVisit us in Hall 12, Booth 101, and discover our latest innovations in recycling technology.\nLetâ€™s meet and discuss how we can build a greener, more sustainable future together! â™»ï¸\n\n#FORREC #IFATEurasia2025 #RecyclingSolutions #Sustainability #GreenInnovation #WasteManagement #CircularEconomyğŸŒ Exciting news! FOR REC will be attending IFAT Eurasia in Istanbul from May 15 to 17, 2025!\nVisit us in Hall 12, Booth 101, and discover our latest innovations in recycling technology.\nLetâ€™s meet and discuss how we can build a greener, more sustainable future together! â™»ï¸\n\n#FORREC #IFATEurasia2025 #RecyclingSolutions #Sustainability #GreenInnovation #WasteManagement #CircularEconomy",
      "likes": "10",
      "shares": "1",
      "time": {
        "raw": "3g",
        "parsed": "29.04.2025",
        "isoString": "2025-04-29T05:41:37.445Z"
      },
      "mediaType": "image",
      "mediaContent": [
        "https://media.licdn.com/dms/image/v2/D4D22AQGia3T7TGGd_g/feedshare-shrink_800/B4DZZ8Dg.EGsAo-/0/1745838018973?e=1749081600&v=beta&t=kNHRueBX-JqAb6UzRy0_3V9Jv96Iymy2sak1CM3FjR4"
      ],
      "date": "2025-04-29T05:41:37.445Z"
    },
    {
      "captions": "ğŸ‰ Weâ€™re excited to announce that FOR REC will be exhibiting at ReMA in San Diego, California, from May 12 to 15, 2025!\n\nYou can find us at Booth 814.\n\nDonâ€™t miss the chance to explore our latest technologies and innovative recycling solutions. Come visit us and letâ€™s talk sustainable innovation! â™»ï¸\n\n#FORREC #ReMA2025 #RecyclingTechnology #SustainabilityMatters #GreenFuture #InnovationInRecycling #SanDiegoEventsğŸ‰ Weâ€™re excited to announce that FOR REC will be exhibiting at ReMA in San Diego, California, from May 12 to 15, 2025!\n\nYou can find us at Booth 814.\n\nDonâ€™t miss the chance to explore our latest technologies and innovative recycling solutions. Come visit us and letâ€™s talk sustainable innovation! â™»ï¸\n\n#FORREC #ReMA2025 #RecyclingTechnology #SustainabilityMatters #GreenFuture #InnovationInRecycling #SanDiegoEvents",
      "likes": "29",
      "shares": "8",
      "time": {
        "raw": "1h",
        "parsed": "25.04.2025",
        "isoString": "2025-04-25T05:41:37.447Z"
      },
      "mediaType": "image",
      "mediaContent": [
        "https://media.licdn.com/dms/image/v2/D4D22AQE_A01ni41DSw/feedshare-shrink_800/B4DZZn2XlxHwAk-/0/1745499028672?e=1749081600&v=beta&t=LIvLaBaxvTr7CrbYYJBv2jwCCXQcePryMb1wYWE9rNk"
      ],
      "date": "2025-04-25T05:41:37.447Z"
    }
  ]
}