[
  {
    "captions": "ğŸŒ Discover FOR REC's solutions to recycle photovoltaic panels! \n\nAs solar energy increases, so does the need for efficient handling of end-of-life photovoltaic panels.\nFOR REC meets this need with tailor-made plants designed to ensure optimal separation of components and reduce processing times.\n\nMain features of the FOR REC plants:\nâœ” Full panel treatment: our lines accept whole solar panels, setting up an efficient separation process;\nâœ”Material separation: we recover aluminium from frames, magnetic metals, inert fraction, ethylene vinyl acetate and non-magnetic metals from harnesses and connectors.\nâœ” High production capacity: our plants process up to 6 tonnes/hour thanks to advanced hydraulic grinders and separation systems.\n\nDiscover our cutting-edge solutions for photovoltaic panel recycling ğŸ‘‰ https://lnkd.in/d_NHvAPe \n\n#Forrec #IndustrialRecycling #CircularEconomy #SolarEnergyğŸŒ Discover FOR REC's solutions to recycle photovoltaic panels! \n\nAs solar energy increases, so does the need for efficient handling of end-of-life photovoltaic panels.\nFOR REC meets this need with tailor-made plants designed to ensure optimal separation of components and reduce processing times.\n\nMain features of the FOR REC plants:\nâœ” Full panel treatment: our lines accept whole solar panels, setting up an efficient separation process;\nâœ”Material separation: we recover aluminium from frames, magnetic metals, inert fraction, ethylene vinyl acetate and non-magnetic metals from harnesses and connectors.\nâœ” High production capacity: our plants process up to 6 tonnes/hour thanks to advanced hydraulic grinders and separation systems.\n\nDiscover our cutting-edge solutions for photovoltaic panel recycling ğŸ‘‰ https://lnkd.in/d_NHvAPe \n\n#Forrec #IndustrialRecycling #CircularEconomy #SolarEnergy",
    "likes": "34",
    "shares": "7",
    "time": {
      "raw": "3g",
      "parsed": "28.02.2025",
      "isoString": "2025-02-28T10:43:10.946Z"
    },
    "mediaType": "image",
    "mediaContent": [
      "https://media.licdn.com/dms/image/v2/D4D22AQFtVip0yjz8Ow/feedshare-shrink_800/B4DZVLfdOhGcAg-/0/1740728293927?e=1743638400&v=beta&t=FElIu1J2cYpxACw5F-o_GUfa1QH7cPaCOCE9QpnntMQ"
    ],
    "date": "2025-02-28T10:43:10.946Z"
  },
  {
    "captions": "â™»ï¸ Give new life to tires! Thanks to FORRECâ€™s advanced plant and the collaboration with Telford Smith, recycling becomes a real opportunity. ğŸš€ğŸ”„ Turning waste into opportunity! The FORREC Tyre Recycling Plant processes up to 6,000kg of tyres per hour, creating materials for industries while supporting Australiaâ€™s circular economy. ğŸ’¡ğŸŒ \n\nPartner with Telford Smith, the supplier of Forrec, for tailored recycling solutions that make a difference.Â ğŸš€ Click on the link to find out more: https://lnkd.in/gAVfHe2JÂ \nğŸ“Š Connect with Us for cutting-edge insights into recycling and sustainable waste management! Like Our posts, share them with your network, and follow Our page for expert advice and innovative solutions. Ready to transform your recycling and waste management strategy? Contact Telford Smith for personalised solutions today. Together, we can drive sustainable change! â™»ï¸ğŸ’¼Â \n#Innovation #Recycling #Sustainability #PlasticRecycling #WasteManagement #TelfordSmith #Legacy #Quality #BusinessGrowth #StayInformed #QualityControl #ExpertAdvice #EngineeringExcellence #Engineering #ProfessionalExcellence #EngineeringStandardsÂ #EcoSolutions #WasteManagement #CircularEconomyLeaders #ForrecğŸ”„ Turning waste into opportunity! The FORREC Tyre Recycling Plant processes up to 6,000kg of tyres per hour, creating materials for industries while supporting Australiaâ€™s circular economy. ğŸ’¡ğŸŒ \n\nPartner with Telford Smith, the supplier of Forrec, for tailored recycling solutions that make a difference.Â ğŸš€ Click on the link to find out more: https://lnkd.in/gAVfHe2JÂ \nğŸ“Š Connect with Us for cutting-edge insights into recycling and sustainable waste management! Like Our posts, share them with your network, and follow Our page for expert advice and innovative solutions. Ready to transform your recycling and waste management strategy? Contact Telford Smith for personalised solutions today. Together, we can drive sustainable change! â™»ï¸ğŸ’¼Â \n#Innovation #Recycling #Sustainability #PlasticRecycling #WasteManagement #TelfordSmith #Legacy #Quality #BusinessGrowth #StayInformed #QualityControl #ExpertAdvice #EngineeringExcellence #Engineering #ProfessionalExcellence #EngineeringStandardsÂ #EcoSolutions #WasteManagement #CircularEconomyLeaders #Forrec",
    "likes": "17",
    "comments": "1",
    "shares": "5",
    "time": {
      "raw": "4g1ay",
      "parsed": "03.03.2025",
      "isoString": "2025-03-03T10:43:10.949Z"
    },
    "mediaType": "image",
    "mediaContent": [
      "https://media.licdn.com/dms/image/v2/D5622AQG56DNg0ISm-g/feedshare-shrink_800/B56ZSMXdhoHwAk-/0/1737521748801?e=1743638400&v=beta&t=zHhFUSAAZSOJYuDUReOCx1dgWTHQ6WpA65H9mcsTrL0"
    ],
    "date": "2025-03-03T10:43:10.949Z"
  },
  {
    "captions": "ğŸ”„ Turning waste into opportunity! The FORREC Tyre Recycling Plant processes up to 6,000kg of tyres per hour, creating materials for industries while supporting Australiaâ€™s circular economy. ğŸ’¡ğŸŒ \n\nPartner with Telford Smith, the supplier of Forrec, for tailored recycling solutions that make a difference.Â ğŸš€ Click on the link to find out more: https://lnkd.in/gAVfHe2JÂ \nğŸ“Š Connect with Us for cutting-edge insights into recycling and sustainable waste management! Like Our posts, share them with your network, and follow Our page for expert advice and innovative solutions. Ready to transform your recycling and waste management strategy? Contact Telford Smith for personalised solutions today. Together, we can drive sustainable change! â™»ï¸ğŸ’¼Â \n#Innovation #Recycling #Sustainability #PlasticRecycling #WasteManagement #TelfordSmith #Legacy #Quality #BusinessGrowth #StayInformed #QualityControl #ExpertAdvice #EngineeringExcellence #Engineering #ProfessionalExcellence #EngineeringStandardsÂ #EcoSolutions #WasteManagement #CircularEconomyLeaders #ForrecğŸ”„ Turning waste into opportunity! The FORREC Tyre Recycling Plant processes up to 6,000kg of tyres per hour, creating materials for industries while supporting Australiaâ€™s circular economy. ğŸ’¡ğŸŒ \n\nPartner with Telford Smith, the supplier of Forrec, for tailored recycling solutions that make a difference.Â ğŸš€ Click on the link to find out more: https://lnkd.in/gAVfHe2JÂ \nğŸ“Š Connect with Us for cutting-edge insights into recycling and sustainable waste management! Like Our posts, share them with your network, and follow Our page for expert advice and innovative solutions. Ready to transform your recycling and waste management strategy? Contact Telford Smith for personalised solutions today. Together, we can drive sustainable change! â™»ï¸ğŸ’¼Â \n#Innovation #Recycling #Sustainability #PlasticRecycling #WasteManagement #TelfordSmith #Legacy #Quality #BusinessGrowth #StayInformed #QualityControl #ExpertAdvice #EngineeringExcellence #Engineering #ProfessionalExcellence #EngineeringStandardsÂ #EcoSolutions #WasteManagement #CircularEconomyLeaders #Forrec",
    "likes": "17",
    "comments": "1",
    "shares": "5",
    "time": {
      "raw": "1ay",
      "parsed": "03.02.2025",
      "isoString": "2025-02-03T10:43:10.957Z"
    },
    "mediaType": "image",
    "mediaContent": [
      "https://media.licdn.com/dms/image/v2/D5622AQG56DNg0ISm-g/feedshare-shrink_800/B56ZSMXdhoHwAk-/0/1737521748801?e=1743638400&v=beta&t=zHhFUSAAZSOJYuDUReOCx1dgWTHQ6WpA65H9mcsTrL0"
    ],
    "date": "2025-02-03T10:43:10.957Z"
  },
  {
    "captions": "ğŸŒ FOR REC will be attending Residuos Expo in Mexico City, from March 25th to 27th, 2025, at the Centro Citibanamex (booth 928).\nâ™»ï¸ Come visit us to discover our innovative solutions in the recycling and waste management industry. We look forward to meeting you and discussing how we can support your needs!\n___________________________________________________________________\n\nğŸŒ FOR REC estarÃ¡ presente en Residuos Expo en Ciudad de MÃ©xico, del 25 al 27 de marzo de 2025, en el Centro Citibanamex (stand 928).\nâ™»ï¸ Â¡Ven a visitarnos! Descubre nuestras soluciones innovadoras en la industria del reciclaje y la gestiÃ³n de residuos. Â¡Esperamos verte y hablar sobre cÃ³mo podemos apoyar tus necesidades!\n\n#ResiduosExpo #FORREC #Recycling #WasteManagement #IndustrialRecycling #CircularEconomy #Sustainability #MexicoCityğŸŒ FOR REC will be attending Residuos Expo in Mexico City, from March 25th to 27th, 2025, at the Centro Citibanamex (booth 928).\nâ™»ï¸ Come visit us to discover our innovative solutions in the recycling and waste management industry. We look forward to meeting you and discussing how we can support your needs!\n___________________________________________________________________\n\nğŸŒ FOR REC estarÃ¡ presente en Residuos Expo en Ciudad de MÃ©xico, del 25 al 27 de marzo de 2025, en el Centro Citibanamex (stand 928).\nâ™»ï¸ Â¡Ven a visitarnos! Descubre nuestras soluciones innovadoras en la industria del reciclaje y la gestiÃ³n de residuos. Â¡Esperamos verte y hablar sobre cÃ³mo podemos apoyar tus necesidades!\n\n#ResiduosExpo #FORREC #Recycling #WasteManagement #IndustrialRecycling #CircularEconomy #Sustainability #MexicoCity",
    "likes": "27",
    "shares": "8",
    "time": {
      "raw": "5g",
      "parsed": "26.02.2025",
      "isoString": "2025-02-26T10:43:10.958Z"
    },
    "mediaType": "image",
    "mediaContent": [
      "https://media.licdn.com/dms/image/v2/D4D22AQHN2a15qoofig/feedshare-shrink_800/B4DZVBpmfOHwAo-/0/1740563180009?e=1743638400&v=beta&t=z2BgTkUbuRkhaXBGai0v5Mab4boQAIFMfDutdpjiovc"
    ],
    "date": "2025-02-26T10:43:10.958Z"
  },
  {
    "captions": "FORREC is at WFES in Abu Dhabi! ğŸŒ\nWe are thrilled to be part of one of the leading global events focused on renewable energy and sustainable innovation. Come visit us at Hall 2, Stand 2330 to discover our advanced waste treatment solutions and learn how we can support your business with cutting-edge technology.\nWe look forward to welcoming you!\n\n#WFES #AbuDhabi #Forrec #GreenTechnology #WasteManagementFORREC is at WFES in Abu Dhabi! ğŸŒ\nWe are thrilled to be part of one of the leading global events focused on renewable energy and sustainable innovation. Come visit us at Hall 2, Stand 2330 to discover our advanced waste treatment solutions and learn how we can support your business with cutting-edge technology.\nWe look forward to welcoming you!\n\n#WFES #AbuDhabi #Forrec #GreenTechnology #WasteManagement",
    "likes": "55",
    "shares": "4",
    "time": {
      "raw": "1ay",
      "parsed": "03.02.2025",
      "isoString": "2025-02-03T10:43:10.961Z"
    },
    "mediaType": "image",
    "mediaContent": [
      "https://media.licdn.com/dms/image/v2/D4D22AQGAget5EhlVlA/feedshare-shrink_2048_1536/B4DZRkHP1FGkAs-/0/1736846409713?e=1743638400&v=beta&t=k9SvPsnPOElsFk8umWOJ0M5A5MkxYJMfLwztTxdcIjU",
      "https://media.licdn.com/dms/image/v2/D4D22AQGpPWF2_OL6Vw/feedshare-shrink_800/B4DZRkHP0tHcAk-/0/1736846409595?e=1743638400&v=beta&t=QHEZQ9jaXYGOMyrtOmiTPZDgT4v8IBql2shun1mTkao"
    ],
    "date": "2025-02-03T10:43:10.961Z"
  },
  {
    "captions": "ğŸŒŸ Proud to Be Part of the Italian Chamber of Commerce in Colombia! ğŸ‡®ğŸ‡¹ğŸ‡¨ğŸ‡´\nWe are thrilled to announce that FOR REC SPA is officially affiliated with the Italian Chamber of Commerce in Colombia. This partnership reflects our commitment to strengthening ties between Italy and Colombia and growing within an international network of excellence.\nğŸ‘‰ Starting in 2025, we will proudly display the Chamber's Seal of Affiliation, symbolizing trust and quality.\nWe are grateful for this opportunity and look forward to continuing this fruitful collaboration! ğŸ™Œ\nğŸ”— #FORRECSPA #ItalianChamberColombia #InternationalPartnerships #BusinessExcellence\n_____________________________________________________________________________\n\nğŸŒŸ Orgullosos de ser parte de la CÃ¡mara de Comercio Italiana en Colombia! ğŸ‡®ğŸ‡¹ğŸ‡¨ğŸ‡´\nNos complace anunciar que FOR REC SPA forma parte oficialmente de la CÃ¡mara de Comercio Italiana para Colombia. Esta alianza refleja nuestro compromiso con fortalecer los lazos entre Italia y Colombia, creciendo dentro de una red internacional de excelencia.\nğŸ‘‰ A partir de 2025, luciremos con orgullo el Sello de AfiliaciÃ³n de la CÃ¡mara, sÃ­mbolo de confianza y calidad.\nEstamos agradecidos por esta oportunidad y esperamos continuar con esta colaboraciÃ³n tan fructÃ­fera. ğŸ™Œ\nğŸ”— #FORRECSPA #CÃ¡maraItalianaColombia #AlianzasInternacionales #ExcelenciaEmpresarialğŸŒŸ Proud to Be Part of the Italian Chamber of Commerce in Colombia! ğŸ‡®ğŸ‡¹ğŸ‡¨ğŸ‡´\nWe are thrilled to announce that FOR REC SPA is officially affiliated with the Italian Chamber of Commerce in Colombia. This partnership reflects our commitment to strengthening ties between Italy and Colombia and growing within an international network of excellence.\nğŸ‘‰ Starting in 2025, we will proudly display the Chamber's Seal of Affiliation, symbolizing trust and quality.\nWe are grateful for this opportunity and look forward to continuing this fruitful collaboration! ğŸ™Œ\nğŸ”— #FORRECSPA #ItalianChamberColombia #InternationalPartnerships #BusinessExcellence\n_____________________________________________________________________________\n\nğŸŒŸ Orgullosos de ser parte de la CÃ¡mara de Comercio Italiana en Colombia! ğŸ‡®ğŸ‡¹ğŸ‡¨ğŸ‡´\nNos complace anunciar que FOR REC SPA forma parte oficialmente de la CÃ¡mara de Comercio Italiana para Colombia. Esta alianza refleja nuestro compromiso con fortalecer los lazos entre Italia y Colombia, creciendo dentro de una red internacional de excelencia.\nğŸ‘‰ A partir de 2025, luciremos con orgullo el Sello de AfiliaciÃ³n de la CÃ¡mara, sÃ­mbolo de confianza y calidad.\nEstamos agradecidos por esta oportunidad y esperamos continuar con esta colaboraciÃ³n tan fructÃ­fera. ğŸ™Œ\nğŸ”— #FORRECSPA #CÃ¡maraItalianaColombia #AlianzasInternacionales #ExcelenciaEmpresarial",
    "likes": "26",
    "shares": "1",
    "time": {
      "raw": "2ay",
      "parsed": "03.01.2025",
      "isoString": "2025-01-03T10:43:10.963Z"
    },
    "mediaType": "image",
    "mediaContent": [
      "https://media.licdn.com/dms/image/v2/D4D22AQHA-NZaw_t4KA/feedshare-shrink_2048_1536/B4DZPjG76VHcAo-/0/1734682067064?e=1743638400&v=beta&t=PM6ajpnA5B_35saSLwGu_DNF6xfu9cCG0nwefTi-Ick"
    ],
    "date": "2025-01-03T10:43:10.963Z"
  },
  {
    "captions": "Indiaâ€™s recycling sector is now increasingly attracting the attention of international machinery suppliers such as FOR REC S.P.A.. \n\nWhile the Indian government is tightening recycling norms by implementing EPR for various sectors global machinery suppliers are strengthening their presence by appointing local representatives.\n\nItalian based FOR REC S.P.A., operates through a Delhi based representative Nordseewerke India Private Limited. A company promoting recycling plant machinery for the last 15 years. \n\nThe full article can be accessed via our website (Link in comments) \n\n#TyreRecycling #TyreRecyclingMachinery #Machinery #BusinessGrowth #IndiaBusiness #SustainabilityAsia #Sustainability #FORRECIndiaâ€™s recycling sector is now increasingly attracting the attention of international machinery suppliers such as FOR REC S.P.A.. \n\nWhile the Indian government is tightening recycling norms by implementing EPR for various sectors global machinery suppliers are strengthening their presence by appointing local representatives.\n\nItalian based FOR REC S.P.A., operates through a Delhi based representative Nordseewerke India Private Limited. A company promoting recycling plant machinery for the last 15 years. \n\nThe full article can be accessed via our website (Link in comments) \n\n#TyreRecycling #TyreRecyclingMachinery #Machinery #BusinessGrowth #IndiaBusiness #SustainabilityAsia #Sustainability #FORREC",
    "likes": "18",
    "comments": "1",
    "shares": "5",
    "time": {
      "raw": "2ay",
      "parsed": "03.01.2025",
      "isoString": "2025-01-03T10:43:10.964Z"
    },
    "mediaType": "image",
    "mediaContent": [
      "https://media.licdn.com/dms/image/v2/D5622AQFM2bdl9ZZusw/feedshare-shrink_800/B56ZPeIPHlHQAk-/0/1734598523308?e=1743638400&v=beta&t=WXykV-Opk2QwYnqxmJY-Y67Cu22K9XAWvpxBCdSAhcc"
    ],
    "date": "2025-01-03T10:43:10.964Z"
  },
  {
    "captions": "ğŸŒ Expanding Recycling Solutions in India! ğŸ‡®ğŸ‡³\nForrec is excited to contribute to sustainable growth in India, where the emphasis on a circular economy is stronger than ever. By providing advanced systems for End-of-Life Tyre (ELT) recycling, Forrec supports the Indian market in its journey toward environmental sustainability.\nOur solutions are tailored to address the growing demand for efficient recycling technologies in a market poised for transformation under initiatives like Extended Producer Responsibility (EPR). Together, we can make recycling not just a necessity but an opportunity for innovation and growth.\nDiscover how Forrec is shaping the future of recycling globally.\n#Forrec #RecyclingSolutions #Sustainability #India #CircularEconomy",
    "likes": "22",
    "comments": "2",
    "shares": "3",
    "time": {
      "raw": "2ay",
      "parsed": "03.01.2025",
      "isoString": "2025-01-03T10:43:10.965Z"
    },
    "mediaType": "other",
    "date": "2025-01-03T10:43:10.965Z"
  },
  {
    "captions": "Grazie a Marco Zoccarato e a Macchion Luisa Ã¨ sempre un piacere incontrarvi.\nNon perdere lâ€™intervista al CEO di FOR REC S.P.A. fatta durante lâ€™ultimo ECOMONDO - ITALIAN EXHIBITION GROUP.ECOMONDO - ITALIAN EXHIBITION GROUP 2024\nrePlanet Magazine intervista Marco Zoccarato CEO di FOR REC S.P.A. \nImpianti di trattamento #rifiuti e trituratori industriali\n\nAnnalisa De Maddalena Filippo Cavalliere\n#rePlanetMagazine #rePlanet #ecomondo #reduce #reuse #recycle #plasticrecycling #recycling #textile #greeneconomy #circulareconomy #economiacircolare #ambiente #plasticsfantastic #planetapproved",
    "likes": "23",
    "comments": "1",
    "shares": "6",
    "time": {
      "raw": "3ay3ay",
      "parsed": "03.03.2025",
      "isoString": "2025-03-03T10:43:10.966Z"
    },
    "mediaType": "video",
    "mediaContent": {
      "src": [
        {
          "src": "https://dms.licdn.com/playlist/vid/v2/D4D05AQEEf6vuaVFvjA/mp4-640p-30fp-crf28/mp4-640p-30fp-crf28/0/1732641619549?e=1741604400&v=beta&t=P1rwOCh5KCR-DlMF4Wi5uAoLZqUn5xpAlotgVjLVeT4",
          "type": "video/mp4",
          "data-bitrate": 560939
        },
        {
          "src": "https://dms.licdn.com/playlist/vid/v2/D4D05AQEEf6vuaVFvjA/mp4-720p-30fp-crf28/mp4-720p-30fp-crf28/0/1732641615312?e=1741604400&v=beta&t=-haaBN0UorkarY7vwcykS0Kjsgjx67vf5Dpw-jV3ryg",
          "type": "video/mp4",
          "data-bitrate": 753365
        }
      ],
      "posterUrl": "https://media.licdn.com/dms/image/v2/D4D05AQEEf6vuaVFvjA/feedshare-thumbnail_720_1280/feedshare-thumbnail_720_1280/0/1732641571749?e=1741604400&v=beta&t=2uoW48W80JPX2rEOVpdWmqUhllWAEPsqfagyNP8FpoE"
    },
    "date": "2025-03-03T10:43:10.966Z"
  },
  {
    "captions": "ECOMONDO - ITALIAN EXHIBITION GROUP 2024\nrePlanet Magazine intervista Marco Zoccarato CEO di FOR REC S.P.A. \nImpianti di trattamento #rifiuti e trituratori industriali\n\nAnnalisa De Maddalena Filippo Cavalliere\n#rePlanetMagazine #rePlanet #ecomondo #reduce #reuse #recycle #plasticrecycling #recycling #textile #greeneconomy #circulareconomy #economiacircolare #ambiente #plasticsfantastic #planetapproved",
    "time": {
      "raw": "3ay",
      "parsed": "03.12.2024",
      "isoString": "2024-12-03T10:43:10.967Z"
    },
    "mediaType": "video",
    "mediaContent": {
      "src": [
        {
          "src": "https://dms.licdn.com/playlist/vid/v2/D4D05AQEEf6vuaVFvjA/mp4-640p-30fp-crf28/mp4-640p-30fp-crf28/0/1732641619549?e=1741604400&v=beta&t=P1rwOCh5KCR-DlMF4Wi5uAoLZqUn5xpAlotgVjLVeT4",
          "type": "video/mp4",
          "data-bitrate": 560939
        },
        {
          "src": "https://dms.licdn.com/playlist/vid/v2/D4D05AQEEf6vuaVFvjA/mp4-720p-30fp-crf28/mp4-720p-30fp-crf28/0/1732641615312?e=1741604400&v=beta&t=-haaBN0UorkarY7vwcykS0Kjsgjx67vf5Dpw-jV3ryg",
          "type": "video/mp4",
          "data-bitrate": 753365
        }
      ],
      "posterUrl": "https://media.licdn.com/dms/image/v2/D4D05AQEEf6vuaVFvjA/feedshare-thumbnail_720_1280/feedshare-thumbnail_720_1280/0/1732641571749?e=1741604400&v=beta&t=2uoW48W80JPX2rEOVpdWmqUhllWAEPsqfagyNP8FpoE"
    },
    "date": "2024-12-03T10:43:10.967Z"
  },
  {
    "captions": "ğŸš€ We are excited to bring you a new digital experience with the launch of our updated website!\n\nThe new website offers a comprehensive preview of our recycling lines, making it easier than ever to understand our innovative processes.\nIndeed, with this update we wanted to revolutionize the user experience by offering:\nâœ” Accurate explanation of the structure of our plants;\nâœ” Detailed renderings and complete overview of the waste treatment process;\nâœ” Full preview of the materials you will be able to process, including complex wastes such as photovoltaic panels.\n\nVisit our new website and learn howÂ FORÂ RECÂ continues to lead the way in sustainable solutionsÂ forÂ a greener futureÂ ğŸ‘‰ https://lnkd.in/d7NdxkSA\n\n#FORRECÂ #RecyclingSolutions #Sustainability #InnovationÂ ğŸš€ We are excited to bring you a new digital experience with the launch of our updated website!\n\nThe new website offers a comprehensive preview of our recycling lines, making it easier than ever to understand our innovative processes.\nIndeed, with this update we wanted to revolutionize the user experience by offering:\nâœ” Accurate explanation of the structure of our plants;\nâœ” Detailed renderings and complete overview of the waste treatment process;\nâœ” Full preview of the materials you will be able to process, including complex wastes such as photovoltaic panels.\n\nVisit our new website and learn howÂ FORÂ RECÂ continues to lead the way in sustainable solutionsÂ forÂ a greener futureÂ ğŸ‘‰ https://lnkd.in/d7NdxkSA\n\n#FORRECÂ #RecyclingSolutions #Sustainability #Innovation",
    "likes": "37",
    "comments": "1",
    "shares": "4",
    "time": {
      "raw": "3ay",
      "parsed": "03.12.2024",
      "isoString": "2024-12-03T10:43:10.968Z"
    },
    "mediaType": "image",
    "mediaContent": [
      "https://media.licdn.com/dms/image/v2/D4D22AQGg-ny4IIZNYA/feedshare-shrink_800/feedshare-shrink_800/0/1732008214979?e=1743638400&v=beta&t=rtv_HJ_tesVhi_uCOdaMSKwpL38y9QTRElLMYbqlqBs"
    ],
    "date": "2024-12-03T10:43:10.968Z"
  },
  {
    "captions": "ğŸ–¤ Un pensiero speciale al nostro caro collega Piergiorgio Acquati, recentemente scomparso. La sua presenza, la sua professionalitÃ  e il suo spirito rimarranno sempre nei nostri cuori. Giorgio sarÃ  sempre una parte importante della famiglia FORREC\n\nUn grazie di cuore a tutti coloro che sono passati a trovarci alla fiera Ecomondo di Rimini!\n\nIl vostro riconoscimento e il vostro interesse ci motivano ogni giorno a fare sempre meglio.\n\nUn ringraziamento speciale a tutto il team di FOR REC S.P.A., che ha reso possibile questo evento con il suo impegno e la sua passione.\n\n#Ecomondo2024 #FORREC #TeamFORREC #Innovazione #Riciclo #GestioneRifiuti #SostenibilitÃ  #InMemoriağŸ–¤ Un pensiero speciale al nostro caro collega Piergiorgio Acquati, recentemente scomparso. La sua presenza, la sua professionalitÃ  e il suo spirito rimarranno sempre nei nostri cuori. Giorgio sarÃ  sempre una parte importante della famiglia FORREC\n\nUn grazie di cuore a tutti coloro che sono passati a trovarci alla fiera Ecomondo di Rimini!\n\nIl vostro riconoscimento e il vostro interesse ci motivano ogni giorno a fare sempre meglio.\n\nUn ringraziamento speciale a tutto il team di FOR REC S.P.A., che ha reso possibile questo evento con il suo impegno e la sua passione.\n\n#Ecomondo2024 #FORREC #TeamFORREC #Innovazione #Riciclo #GestioneRifiuti #SostenibilitÃ  #InMemoria",
    "likes": "148",
    "comments": "10",
    "shares": "13",
    "time": {
      "raw": "3ay",
      "parsed": "03.12.2024",
      "isoString": "2024-12-03T10:43:10.969Z"
    },
    "mediaType": "image",
    "mediaContent": [
      "https://media.licdn.com/dms/image/v2/D5622AQHyZBzjqFmeSA/feedshare-shrink_800/feedshare-shrink_800/0/1731078562086?e=1743638400&v=beta&t=ZMbreZHLDLEjsZf9RcCB8v-DgJ4fvZRt3WV3lRwYKcU"
    ],
    "date": "2024-12-03T10:43:10.969Z"
  },
  {
    "captions": "ğŸ–¤ Un pensiero speciale al nostro caro collega Piergiorgio Acquati, recentemente scomparso. La sua presenza, la sua professionalitÃ  e il suo spirito rimarranno sempre nei nostri cuori. Giorgio sarÃ  sempre una parte importante della famiglia FORREC\n\nUn grazie di cuore a tutti coloro che sono passati a trovarci alla fiera Ecomondo di Rimini!\n\nIl vostro riconoscimento e il vostro interesse ci motivano ogni giorno a fare sempre meglio.\n\nUn ringraziamento speciale a tutto il team di FOR REC S.P.A., che ha reso possibile questo evento con il suo impegno e la sua passione.\n\n#Ecomondo2024 #FORREC #TeamFORREC #Innovazione #Riciclo #GestioneRifiuti #SostenibilitÃ  #InMemoriağŸ–¤ Un pensiero speciale al nostro caro collega Piergiorgio Acquati, recentemente scomparso. La sua presenza, la sua professionalitÃ  e il suo spirito rimarranno sempre nei nostri cuori. Giorgio sarÃ  sempre una parte importante della famiglia FORREC\n\nUn grazie di cuore a tutti coloro che sono passati a trovarci alla fiera Ecomondo di Rimini!\n\nIl vostro riconoscimento e il vostro interesse ci motivano ogni giorno a fare sempre meglio.\n\nUn ringraziamento speciale a tutto il team di FOR REC S.P.A., che ha reso possibile questo evento con il suo impegno e la sua passione.\n\n#Ecomondo2024 #FORREC #TeamFORREC #Innovazione #Riciclo #GestioneRifiuti #SostenibilitÃ  #InMemoria",
    "likes": "148",
    "comments": "10",
    "shares": "13",
    "time": {
      "raw": "3ay",
      "parsed": "03.12.2024",
      "isoString": "2024-12-03T10:43:10.970Z"
    },
    "mediaType": "image",
    "mediaContent": [
      "https://media.licdn.com/dms/image/v2/D5622AQHyZBzjqFmeSA/feedshare-shrink_800/feedshare-shrink_800/0/1731078562086?e=1743638400&v=beta&t=ZMbreZHLDLEjsZf9RcCB8v-DgJ4fvZRt3WV3lRwYKcU"
    ],
    "date": "2024-12-03T10:43:10.970Z"
  },
  {
    "captions": "ğŸŒ± FOR REC SPA Ã¨ presente alla fiera Ecomondo di Rimini!\nSiamo pronti ad accogliervi al nostro stand (Pad A1, Stand 203-102) per presentarvi le nostre ultime innovazioni nel campo del riciclaggio e dell'economia circolare.\nVi aspettiamo per discutere insieme delle soluzioni sostenibili che stanno trasformando il futuro del nostro pianeta. Non mancate! ğŸŒ\n\nğŸŒ± FOR REC SPA is attending the Ecomondo fair in Rimini!\nWe are excited to welcome you at our booth (hall A1, 203-102) to showcase our latest innovations in recycling and circular economy.\nJoin us to explore sustainable solutions that are shaping the future of our planet. Donâ€™t miss it! ğŸŒ\n\n#Ecomondo2024 #Recycling #CircularEconomy #Sustainability #Innovation #ForRecSpa #RiminiFair #GreenFutureğŸŒ± FOR REC SPA Ã¨ presente alla fiera Ecomondo di Rimini!\nSiamo pronti ad accogliervi al nostro stand (Pad A1, Stand 203-102) per presentarvi le nostre ultime innovazioni nel campo del riciclaggio e dell'economia circolare.\nVi aspettiamo per discutere insieme delle soluzioni sostenibili che stanno trasformando il futuro del nostro pianeta. Non mancate! ğŸŒ\n\nğŸŒ± FOR REC SPA is attending the Ecomondo fair in Rimini!\nWe are excited to welcome you at our booth (hall A1, 203-102) to showcase our latest innovations in recycling and circular economy.\nJoin us to explore sustainable solutions that are shaping the future of our planet. Donâ€™t miss it! ğŸŒ\n\n#Ecomondo2024 #Recycling #CircularEconomy #Sustainability #Innovation #ForRecSpa #RiminiFair #GreenFuture",
    "likes": "83",
    "shares": "6",
    "time": {
      "raw": "3ay",
      "parsed": "03.12.2024",
      "isoString": "2024-12-03T10:43:10.972Z"
    },
    "mediaType": "image",
    "mediaContent": [
      "https://media.licdn.com/dms/image/v2/D4D22AQGCFs5P50ZZ0Q/feedshare-shrink_800/feedshare-shrink_800/0/1730882325843?e=1743638400&v=beta&t=UhpA4ylx0tXoQ_cAsTFVUFi7kOM2oDP1N2g5XfoEHnI",
      "https://media.licdn.com/dms/image/v2/D4D22AQEni4vHYtLr5A/feedshare-shrink_800/feedshare-shrink_800/0/1730882325295?e=1743638400&v=beta&t=fAdHmzDCVNFQ25PyLEnCkfAgziC5Wl_Kg1oe61FSfq4",
      "https://media.licdn.com/dms/image/v2/D4D22AQF1XruRYdBuNw/feedshare-shrink_800/feedshare-shrink_800/0/1730882326658?e=1743638400&v=beta&t=Cl1GUxMBnGqRyxq6enRuWmPzdIjj6kHbPqd5g0qsdfY"
    ],
    "date": "2024-12-03T10:43:10.972Z"
  },
  {
    "captions": "ğŸŒ Get ready for ECOMONDO 2024!\nWe are excited to announce that we will attend the international trade fair dedicated to the world of environmental innovation and the circular economy.\n\nğŸ“… SAVE THE DATE\nWe look forward to seeing you atÂ ECOMONDO - ITALIAN EXHIBITION GROUPÂ from November 5 to 8 at the Rimini Exhibition Center, Italy.\n\nâœ” Why should you visit our booth?\nOur latest news regards the new Z16 hammer mill: designed to offer more power and efficiency, this machine is perfect for processing WEEE, washing machines, aluminum scraps and motors up to 40 kg with no need for pre-shredding.\nDon't miss your chance to see it!\n\nIn the meantime, you can find out all its technical features here:Â \nhttps://lnkd.in/gCbrZh34\nWe are waiting for you at booth A1 - stand 203-102!\n\n#Ecomondo2024 #GreenEconomy #SustainableInnovation #WasteManagementÂ \nğŸŒ Get ready for ECOMONDO 2024!\nWe are excited to announce that we will attend the international trade fair dedicated to the world of environmental innovation and the circular economy.\n\nğŸ“… SAVE THE DATE\nWe look forward to seeing you atÂ ECOMONDO - ITALIAN EXHIBITION GROUPÂ from November 5 to 8 at the Rimini Exhibition Center, Italy.\n\nâœ” Why should you visit our booth?\nOur latest news regards the new Z16 hammer mill: designed to offer more power and efficiency, this machine is perfect for processing WEEE, washing machines, aluminum scraps and motors up to 40 kg with no need for pre-shredding.\nDon't miss your chance to see it!\n\nIn the meantime, you can find out all its technical features here:Â \nhttps://lnkd.in/gCbrZh34\nWe are waiting for you at booth A1 - stand 203-102!\n\n#Ecomondo2024 #GreenEconomy #SustainableInnovation #WasteManagement",
    "likes": "42",
    "comments": "1",
    "shares": "7",
    "time": {
      "raw": "4ay",
      "parsed": "03.11.2024",
      "isoString": "2024-11-03T10:43:10.973Z"
    },
    "mediaType": "image",
    "mediaContent": [
      "https://media.licdn.com/dms/image/v2/D5622AQHRb5xj1QezoA/feedshare-shrink_800/feedshare-shrink_800/0/1729676469635?e=1743638400&v=beta&t=bpv3uiU6ZPHDamfo9u-TzqTrJGCO8m4tLmJ2dOY7N08"
    ],
    "date": "2024-11-03T10:43:10.973Z"
  },
  {
    "captions": "ğŸš¨ Last chance to visit us at IFAT India 2024! ğŸš¨\nFOR REC S.P.A. is excited to be in Mumbai, showcasing our latest innovations in recycling technology. If you're at the exhibition, stop by Booth A009 and discover how we can help you transform waste into valuable resources.\nBut hurry, the exhibition ends tomorrow!\nWe look forward to meeting you and discussing solutions tailored to your needs.\nSee you at IFAT India!\n#FORREC #IFATIndia2024 #Recycling #Sustainability #WasteManagement #Innovations #MumbaiğŸš¨ Last chance to visit us at IFAT India 2024! ğŸš¨\nFOR REC S.P.A. is excited to be in Mumbai, showcasing our latest innovations in recycling technology. If you're at the exhibition, stop by Booth A009 and discover how we can help you transform waste into valuable resources.\nBut hurry, the exhibition ends tomorrow!\nWe look forward to meeting you and discussing solutions tailored to your needs.\nSee you at IFAT India!\n#FORREC #IFATIndia2024 #Recycling #Sustainability #WasteManagement #Innovations #Mumbai",
    "likes": "47",
    "shares": "5",
    "time": {
      "raw": "4ay",
      "parsed": "03.11.2024",
      "isoString": "2024-11-03T10:43:10.975Z"
    },
    "mediaType": "image",
    "mediaContent": [
      "https://media.licdn.com/dms/image/v2/D4D22AQE5S-XOXPJVPQ/feedshare-shrink_800/feedshare-shrink_800/0/1729167760844?e=1743638400&v=beta&t=-pAxgAuYar5E6SN6dxfEZL-Moy7oiwbykjwbbbECprA",
      "https://media.licdn.com/dms/image/v2/D4D22AQG1JZ-AQY6jVw/feedshare-shrink_800/feedshare-shrink_800/0/1729167761249?e=1743638400&v=beta&t=vBzcrd9UGZS2zRAgAWqgjjWp6f29fPo7HfWOTYXsl5s",
      "https://media.licdn.com/dms/image/v2/D4D22AQFqVvWqx58MyQ/feedshare-shrink_800/feedshare-shrink_800/0/1729167760710?e=1743638400&v=beta&t=DDGrqZZoJDb9lgqZggUZkEeGm74JtIajsOFyP7EhahE"
    ],
    "date": "2024-11-03T10:43:10.975Z"
  },
  {
    "captions": "ğŸš€ Exciting News! ğŸš€\nWe at FOR REC S.P.A. are thrilled to share in the satisfaction of seeing TZR Recycling Industry's brand-new headquarters come to life, fully equipped with state-of-the-art machinery and optimized production spaces.\nThis project, born from a successful collaboration between Forrec and TZR, marks an important milestone for both companies. It's not just about innovation, but also about setting new standards for efficiency and international competitiveness.\nWe look forward to the continued success of this partnership and the opportunities it will create!\n#Forrec #TZR #Innovation #Efficiency #Competitiveness #NewHeadquarters",
    "likes": "71",
    "comments": "5",
    "shares": "11",
    "time": {
      "raw": "5ay",
      "parsed": "03.10.2024",
      "isoString": "2024-10-03T10:43:10.976Z"
    },
    "mediaType": "video",
    "mediaContent": {
      "src": [
        {
          "src": "https://dms.licdn.com/playlist/vid/v2/D4D05AQFkjkf39tX6Rw/mp4-640p-30fp-crf28/mp4-640p-30fp-crf28/0/1727365683139?e=1741604400&v=beta&t=lgDjXgeeLl2jGnbv2ntsZp82T3yiQpr5wg_b8uic1ys",
          "type": "video/mp4",
          "data-bitrate": 708859
        },
        {
          "src": "https://dms.licdn.com/playlist/vid/v2/D4D05AQFkjkf39tX6Rw/mp4-720p-30fp-crf28/mp4-720p-30fp-crf28/0/1727365685627?e=1741604400&v=beta&t=8U_1xO_qR61yKI9xCYjJiSSiHoAdLF3BPWszUI2lwf4",
          "type": "video/mp4",
          "data-bitrate": 949795
        }
      ],
      "posterUrl": "https://media.licdn.com/dms/image/v2/D4D05AQFkjkf39tX6Rw/videocover-low/videocover-low/0/1727365633632?e=1741604400&v=beta&t=D0qL0knCdCfRIKTgO-J78CKXaXLxNH2Y7j36vaTh2jk"
    },
    "date": "2024-10-03T10:43:10.976Z"
  },
  {
    "captions": "ğŸŒ Sustainable recycling for a greener futureÂ ğŸŒ\nFOR REC is committed to protecting the environment by developing innovative recycling solutions that maximize efficiency and reduce waste.\n\nğŸ”Œ However, as the volume of WEEE and photovoltaic panels increases, the need for advanced recycling methods is more pressing than ever.\nFor this reason, FOR REC has designed a tailor-made recycling line that effectively separates key components, ensuring optimal material recovery and environmental responsibility.\nWith our modular recycling facilities, we aim to provide high-performance solutions that promote #sustainability and reduce treatment costs.\n\nHave we intrigued you? Learn more about our WEEE and photovoltaic recycling solutionsÂ ğŸ‘‰ https://lnkd.in/e4GCTvuX\n\n#Innovation #WasteManagement #Recycling",
    "likes": "19",
    "comments": "2",
    "shares": "5",
    "time": {
      "raw": "5ay",
      "parsed": "03.10.2024",
      "isoString": "2024-10-03T10:43:10.977Z"
    },
    "mediaType": "other",
    "date": "2024-10-03T10:43:10.977Z"
  },
  {
    "captions": "Thanks JMC Recycling Systems Ltd for the post... we are very proud of this machine! ğŸ’ª  and ready to present this project and our technology at the next Environmental Services & Solutions Expo (ESS Expo) in Birmingham with your fundamental support!\n#metalscrapsrecycling #shredders #recyclingsolutions The FOR REC S.P.A. FX5000 Shredder is one good looking machine ğŸ˜ \n\nWith a cutting chamber of 1500 x 2000 mm, it's brilliant for a lot of applications including: light loose material, cars, ferrous waste and oversized waste.The FOR REC S.P.A. FX5000 Shredder is one good looking machine ğŸ˜ \n\nWith a cutting chamber of 1500 x 2000 mm, it's brilliant for a lot of applications including: light loose material, cars, ferrous waste and oversized waste.",
    "likes": "38",
    "comments": "4",
    "shares": "1",
    "time": {
      "raw": "8ay8ay",
      "parsed": "03.03.2025",
      "isoString": "2025-03-03T10:43:10.978Z"
    },
    "mediaType": "image",
    "mediaContent": [
      "https://media.licdn.com/dms/image/v2/D4E10AQGaFC8ckdtItQ/image-shrink_800/image-shrink_800/0/1718352059200?e=1741604400&v=beta&t=9lm_tgyjVog6I-eT-s8-rB8F03N-vhUfRJJE-KDLTMc"
    ],
    "date": "2025-03-03T10:43:10.978Z"
  },
  {
    "captions": "The FOR REC S.P.A. FX5000 Shredder is one good looking machine ğŸ˜ \n\nWith a cutting chamber of 1500 x 2000 mm, it's brilliant for a lot of applications including: light loose material, cars, ferrous waste and oversized waste.The FOR REC S.P.A. FX5000 Shredder is one good looking machine ğŸ˜ \n\nWith a cutting chamber of 1500 x 2000 mm, it's brilliant for a lot of applications including: light loose material, cars, ferrous waste and oversized waste.",
    "likes": "38",
    "comments": "4",
    "shares": "1",
    "time": {
      "raw": "8ay",
      "parsed": "03.07.2024",
      "isoString": "2024-07-03T10:43:10.978Z"
    },
    "mediaType": "image",
    "mediaContent": [
      "https://media.licdn.com/dms/image/v2/D4E10AQGaFC8ckdtItQ/image-shrink_800/image-shrink_800/0/1718352059200?e=1741604400&v=beta&t=9lm_tgyjVog6I-eT-s8-rB8F03N-vhUfRJJE-KDLTMc"
    ],
    "date": "2024-07-03T10:43:10.978Z"
  },
  {
    "captions": "â™» NOVACERO S.A. presented the first plant for the treatment of scrap from metal processing in steel mills that enables total recovery of materialsÂ \nFOR REC S.P.A. is proud to have designed and supplied this system and thanks all the staff at NOVACERO for their collaboration\n#recycling #steel #recovery \nEn Novacero, estamos comprometidos con construir un futuro mÃ¡s sostenible para Ecuador y el mundo.\n\nCon la reciente inauguraciÃ³n de nuestra Planta Recuperadora de Residuos, estamos dando un paso significativo en esa direcciÃ³n.\nEsta planta, que transforma residuos en materia prima Ãºtil para diversas industrias, representa nuestra firme apuesta por la transformaciÃ³n sostenible.\n\nAl evitar que mÃ¡s de 12 mil toneladas anuales de desechos se conviertan en basura, estamos contribuyendo activamente a la reducciÃ³n de la contaminaciÃ³n y al cuidado del medio ambiente.\n\nNuestro compromiso ambiental es un pilar fundamental en todas nuestras operaciones, y esta planta es un claro ejemplo de ello.\n\nJuntos, estamos construyendo un futuro mÃ¡s limpio y prÃ³spero. ğŸ’šğŸŒ\n\n#NovaceroÂ #SostenibilidadÂ #CompromisoAmbiental",
    "likes": "25",
    "comments": "2",
    "shares": "4",
    "time": {
      "raw": "11ay11ay",
      "parsed": "03.03.2025",
      "isoString": "2025-03-03T10:43:10.979Z"
    },
    "mediaType": "video",
    "mediaContent": {
      "src": [
        {
          "src": "https://dms.licdn.com/playlist/vid/v2/D4D05AQHvWkse70SPXA/mp4-640p-30fp-crf28/mp4-640p-30fp-crf28/0/1711052188960?e=1741604400&v=beta&t=DU42qCFFdagqWVt1pfv2A3zkZNMFOIrmEd7J5y3Vb34",
          "type": "video/mp4",
          "data-bitrate": 515459
        },
        {
          "src": "https://dms.licdn.com/playlist/vid/v2/D4D05AQHvWkse70SPXA/mp4-720p-30fp-crf28/mp4-720p-30fp-crf28/0/1711052189426?e=1741604400&v=beta&t=HXoEfG-Dd0Rw1LVuscF1rqQTDl3pI52ASGcg3Trh_Fs",
          "type": "video/mp4",
          "data-bitrate": 692868
        }
      ],
      "posterUrl": "https://media.licdn.com/dms/image/v2/D4D05AQHvWkse70SPXA/videocover-high/videocover-high/0/1711052185694?e=1741604400&v=beta&t=VlC0SVjNCvRn7Tc_IX-rhH-sc8ut9U3R6gM8IAO63wA"
    },
    "date": "2025-03-03T10:43:10.979Z"
  },
  {
    "captions": "En Novacero, estamos comprometidos con construir un futuro mÃ¡s sostenible para Ecuador y el mundo.\n\nCon la reciente inauguraciÃ³n de nuestra Planta Recuperadora de Residuos, estamos dando un paso significativo en esa direcciÃ³n.\nEsta planta, que transforma residuos en materia prima Ãºtil para diversas industrias, representa nuestra firme apuesta por la transformaciÃ³n sostenible.\n\nAl evitar que mÃ¡s de 12 mil toneladas anuales de desechos se conviertan en basura, estamos contribuyendo activamente a la reducciÃ³n de la contaminaciÃ³n y al cuidado del medio ambiente.\n\nNuestro compromiso ambiental es un pilar fundamental en todas nuestras operaciones, y esta planta es un claro ejemplo de ello.\n\nJuntos, estamos construyendo un futuro mÃ¡s limpio y prÃ³spero. ğŸ’šğŸŒ\n\n#NovaceroÂ #SostenibilidadÂ #CompromisoAmbiental",
    "time": {
      "raw": "11ay",
      "parsed": "03.04.2024",
      "isoString": "2024-04-03T10:43:10.980Z"
    },
    "mediaType": "video",
    "mediaContent": {
      "src": [
        {
          "src": "https://dms.licdn.com/playlist/vid/v2/D4D05AQHvWkse70SPXA/mp4-640p-30fp-crf28/mp4-640p-30fp-crf28/0/1711052188960?e=1741604400&v=beta&t=DU42qCFFdagqWVt1pfv2A3zkZNMFOIrmEd7J5y3Vb34",
          "type": "video/mp4",
          "data-bitrate": 515459
        },
        {
          "src": "https://dms.licdn.com/playlist/vid/v2/D4D05AQHvWkse70SPXA/mp4-720p-30fp-crf28/mp4-720p-30fp-crf28/0/1711052189426?e=1741604400&v=beta&t=HXoEfG-Dd0Rw1LVuscF1rqQTDl3pI52ASGcg3Trh_Fs",
          "type": "video/mp4",
          "data-bitrate": 692868
        }
      ],
      "posterUrl": "https://media.licdn.com/dms/image/v2/D4D05AQHvWkse70SPXA/videocover-high/videocover-high/0/1711052185694?e=1741604400&v=beta&t=VlC0SVjNCvRn7Tc_IX-rhH-sc8ut9U3R6gM8IAO63wA"
    },
    "date": "2024-04-03T10:43:10.980Z"
  },
  {
    "captions": "FOR REC S.P.A.is attending the next World Future Energy Summit in AbuDhabi. \nVisit our booth 3211 in Hall 3FOR REC S.P.A.is attending the next World Future Energy Summit in AbuDhabi. \nVisit our booth 3211 in Hall 3",
    "likes": "13",
    "shares": "1",
    "time": {
      "raw": "11ay",
      "parsed": "03.04.2024",
      "isoString": "2024-04-03T10:43:10.980Z"
    },
    "mediaType": "image",
    "mediaContent": [
      "https://media.licdn.com/dms/image/v2/D4D22AQGtPNgLlJB-YQ/feedshare-shrink_800/feedshare-shrink_800/0/1711530799223?e=1743638400&v=beta&t=IWKb3kuX2J9kLu7T-xbx-Pt7PT_eCoSDz87ylzwIsS0"
    ],
    "date": "2024-04-03T10:43:10.980Z"
  },
  {
    "captions": "ğŸ“¢ Looking forward to hearing about upcoming events scheduled for FOR REC S.P.A.? Mark your appointments and come visit us at the fair!\n-------------------------------------------------------------------------\nğŸ“¢ Curioso di sapere quali saranno i prossimi eventi in programma per FOR REC S.P.A.? Segnati gli appuntamenti e passa a trovarci in fiera!\nğŸ“¢ Looking forward to hearing about upcoming events scheduled for FOR REC S.P.A.? Mark your appointments and come visit us at the fair!\n-------------------------------------------------------------------------\nğŸ“¢ Curioso di sapere quali saranno i prossimi eventi in programma per FOR REC S.P.A.? Segnati gli appuntamenti e passa a trovarci in fiera!",
    "likes": "10",
    "shares": "4",
    "time": {
      "raw": "11ay",
      "parsed": "03.04.2024",
      "isoString": "2024-04-03T10:43:10.982Z"
    },
    "mediaType": "image",
    "mediaContent": [
      "https://media.licdn.com/dms/image/v2/D4D22AQEHNm7TO01KaQ/feedshare-shrink_2048_1536/feedshare-shrink_2048_1536/0/1710769595541?e=1743638400&v=beta&t=xUQdEb5LLp78PMvSvgY9hXNaXnvZx1nPMluP3QiJdKs"
    ],
    "date": "2024-04-03T10:43:10.982Z"
  }
]