[
  {
    "name": "Birim-Makina",
    "followerData": [
      [
        1742187802128,
        null
      ],
      [
        1742966411053,
        null
      ],
      [
        1744004271895,
        null
      ],
      [
        1744605838915,
        null
      ],
      [
        1745214522444,
        null
      ],
      [
        1745472069558,
        null
      ],
      [
        1745816240547,
        null
      ],
      [
        1746164193239,
        null
      ],
      [
        1746618712841,
        null
      ],
      [
        1747116520258,
        null
      ],
      [
        1747888734845,
        null
      ]
    ],
    "data": [
      {
        "captions": "BugÃ¼n nasÄ±lsÄ±nÄ±z? Bizden neler beklediÄŸinizi bizimle paylaÅŸÄ±n.\n\nGÃ¼ncellemelerimizi kaÃ§Ä±rmak istemiyorsanÄ±z SayfamÄ±zÄ± takip edin.",
        "likes": "6",
        "time": {
          "raw": "2ay",
          "parsed": "22.03.2025",
          "isoString": "2025-03-22T04:38:54.562Z"
        },
        "mediaType": "other",
        "date": "2025-03-22T04:38:54.562Z"
      },
      {
        "captions": "Happy Woman's Day",
        "likes": "10",
        "time": {
          "raw": "2ay",
          "parsed": "22.03.2025",
          "isoString": "2025-03-22T04:38:54.563Z"
        },
        "mediaType": "video",
        "mediaContent": {
          "src": [
            {
              "src": "https://dms.licdn.com/playlist/vid/v2/D4D05AQEe8tqdORQlPQ/mp4-720p-30fp-crf28/B4DZV13M79GkBo-/0/1741439197273?e=1748494800&v=beta&t=0DsNj9aeaywXmhX1P8AhH0wUhd6ueDI8zgvGNoT5z5c",
              "type": "video/mp4",
              "data-bitrate": 698190
            },
            {
              "src": "https://dms.licdn.com/playlist/vid/v2/D4D05AQEe8tqdORQlPQ/mp4-640p-30fp-crf28/B4DZV13M79GkBk-/0/1741439197322?e=1748494800&v=beta&t=Hrl-lNekdk1eH8NXdgx8S67xqZOX1B6aulcCsGxV8QA",
              "type": "video/mp4",
              "data-bitrate": 530053
            }
          ],
          "posterUrl": "https://media.licdn.com/dms/image/v2/D4D05AQEe8tqdORQlPQ/videocover-low/B4DZV13M79GkCU-/0/1741439195646?e=1748494800&v=beta&t=-1HYaVyVpoD9vSvt3_WMh-RcOxXVfgxdCHTJXBNPZpQ"
        },
        "date": "2025-03-22T04:38:54.563Z"
      },
      {
        "captions": "âš™ğŸ”§ We have commissioned two new Fanuc robot welding arms that can perform high precision welding operations on a 24 metre slider.\n\nğŸš€âš¡ We are raising the bar even higher in production capacity and quality with uninterrupted automation.\n\n---\n\nâš™ğŸ”§ 24 metrelik slider Ã¼zerinde yÃ¼ksek hassasiyetli kaynak iÅŸlemlerini yapabilen iki adet yeni Fanuc robot kaynak kolunu devreye almÄ±ÅŸ bulunmaktayÄ±z.\n\nğŸš€âš¡ Kesintisiz otomasyon ile Ã¼retim kapasitesinde ve kalitede Ã§Ä±tayÄ± daha da yukarÄ± taÅŸÄ±yoruz.",
        "likes": "145",
        "comments": "1",
        "shares": "5",
        "time": {
          "raw": "2ay",
          "parsed": "22.03.2025",
          "isoString": "2025-03-22T04:38:54.564Z"
        },
        "mediaType": "video",
        "mediaContent": {
          "src": [
            {
              "src": "https://dms.licdn.com/playlist/vid/v2/D4D05AQHduLnupccDCA/mp4-640p-30fp-crf28/B4DZVxzjdZG4AA-/0/1741371218357?e=1748494800&v=beta&t=VyLmpneCOO3cwAFrcbu_OdOOrFqbNI-NU8gJMgT2o8c",
              "type": "video/mp4",
              "data-bitrate": 638052
            },
            {
              "src": "https://dms.licdn.com/playlist/vid/v2/D4D05AQHduLnupccDCA/mp4-720p-30fp-crf28/B4DZVxzjdZG4AE-/0/1741371218846?e=1748494800&v=beta&t=_m3GPXJ2g4iB5HSBVNiBj8rkADSia5v6mgur39FfOV8",
              "type": "video/mp4",
              "data-bitrate": 878818
            }
          ],
          "posterUrl": "https://media.licdn.com/dms/image/v2/D4D05AQHduLnupccDCA/feedshare-thumbnail_720_1280/B4DZVxzjdYG4BE-/0/1741371099309?e=1748494800&v=beta&t=nN-9Ncc4P1vcAk6h_hQZ0q0wygZ-bUEjm8n5FKmDt-4"
        },
        "date": "2025-03-22T04:38:54.564Z"
      },
      {
        "captions": "Orca High-Capacity Cutting And Baling\n\nIt can compress and cut big size scrap with its big feeding box.\nIt 60th makes dense bales and shears the scrap.\nNo-contact sensors to avoid re-calibration\nCapacity is between 20 to 60 ton/hourÂ  \n\nâ¤ Detailed information about Orca: birimrecycling.com/orca-2\nâ¤ All Metal Scrap Shears: https://lnkd.in/dq423CXY\nâ¤ Web Site: birimrecycling.com/\n\n---\n\nOrca YÃ¼ksek Kapasiteli Kesme ve Balyalama\n\nBÃ¼yÃ¼k sÄ±kÄ±ÅŸtÄ±rma haznesiyle Ã§ok bÃ¼yÃ¼k ebatlÄ± hurdalarÄ± sÄ±kÄ±ÅŸtÄ±rÄ±p kesebilir.\nHem yoÄŸun balya , hem de kesim yapar\nAyarÄ± kaÃ§mayan temassÄ±z sensÃ¶rler\nKapasite 20-60 ton /saat aralÄ±ÄŸÄ±ndadÄ±r.\n\nâ¤ Orca HakkÄ±nda AyrÄ±ntÄ±lÄ± Bilgi: birimrecycling.com/orca\nâ¤ TÃ¼m Metal Hurda MakaslarÄ±: birimrecycling.com/shears\nâ¤ Web Site: birimrecycling.com/Orca High-Capacity Cutting And Baling\n\nIt can compress and cut big size scrap with its big feeding box.\nIt 60th makes dense bales and shears the scrap.\nNo-contact sensors to avoid re-calibration\nCapacity is between 20 to 60 ton/hourÂ  \n\nâ¤ Detailed information about Orca: birimrecycling.com/orca-2\nâ¤ All Metal Scrap Shears: https://lnkd.in/dq423CXY\nâ¤ Web Site: birimrecycling.com/\n\n---\n\nOrca YÃ¼ksek Kapasiteli Kesme ve Balyalama\n\nBÃ¼yÃ¼k sÄ±kÄ±ÅŸtÄ±rma haznesiyle Ã§ok bÃ¼yÃ¼k ebatlÄ± hurdalarÄ± sÄ±kÄ±ÅŸtÄ±rÄ±p kesebilir.\nHem yoÄŸun balya , hem de kesim yapar\nAyarÄ± kaÃ§mayan temassÄ±z sensÃ¶rler\nKapasite 20-60 ton /saat aralÄ±ÄŸÄ±ndadÄ±r.\n\nâ¤ Orca HakkÄ±nda AyrÄ±ntÄ±lÄ± Bilgi: birimrecycling.com/orca\nâ¤ TÃ¼m Metal Hurda MakaslarÄ±: birimrecycling.com/shears\nâ¤ Web Site: birimrecycling.com/",
        "likes": "64",
        "comments": "2",
        "time": {
          "raw": "2ay",
          "parsed": "22.03.2025",
          "isoString": "2025-03-22T04:38:54.565Z"
        },
        "mediaType": "image",
        "mediaContent": [
          "https://media.licdn.com/dms/image/v2/D4D22AQFkKz-Oe65trQ/feedshare-shrink_800/B4DZVdaYgrGcAg-/0/1741028961232?e=1750896000&v=beta&t=PWiBzPuOYWYiQErfiA47KyY2WrfzTXqc4W3lxqQeAJA"
        ],
        "date": "2025-03-22T04:38:54.565Z"
      },
      {
        "captions": "ğŸ¦¾ Tiger 3 Ram Baler\nÂ \nâš™ï¸ Operation & Structure\n\nâœ”ï¸ Strong body for Heavy Duty operation\nâœ”ï¸ Capacity is between 1,5 - 40 ton/hour (Fe)\nâœ”ï¸ No-contact sensors to avoid re-calibration\n\nTiger: https://lnkd.in/e9Gx3SZM\nAll Balers: https://lnkd.in/dq-MMRYC\nWeb Site: https://lnkd.in/dSwqCgZ8\n\n----\n\nğŸ¦¾ Tiger 3 SÄ±kÄ±ÅŸtÄ±rmalÄ± Pres\n\nâš™ï¸ Operasyon ve YapÄ±\n\nâœ”ï¸ AÄŸÄ±r hizmete uygun gÃ¶vde\nâœ”ï¸ Kapasite 1.5 - 40 ton/saat (Fe)\nâœ”ï¸ AyarÄ± kaÃ§mayan temassÄ±z sensÃ¶rler\n\nTiger: https://lnkd.in/emTMFnKj\nTÃ¼m Presler: https://lnkd.in/d3w4W9Wa\nWeb Site:https://lnkd.in/dSwqCgZ8\nğŸ¦¾ Tiger 3 Ram Baler\nÂ \nâš™ï¸ Operation & Structure\n\nâœ”ï¸ Strong body for Heavy Duty operation\nâœ”ï¸ Capacity is between 1,5 - 40 ton/hour (Fe)\nâœ”ï¸ No-contact sensors to avoid re-calibration\n\nTiger: https://lnkd.in/e9Gx3SZM\nAll Balers: https://lnkd.in/dq-MMRYC\nWeb Site: https://lnkd.in/dSwqCgZ8\n\n----\n\nğŸ¦¾ Tiger 3 SÄ±kÄ±ÅŸtÄ±rmalÄ± Pres\n\nâš™ï¸ Operasyon ve YapÄ±\n\nâœ”ï¸ AÄŸÄ±r hizmete uygun gÃ¶vde\nâœ”ï¸ Kapasite 1.5 - 40 ton/saat (Fe)\nâœ”ï¸ AyarÄ± kaÃ§mayan temassÄ±z sensÃ¶rler\n\nTiger: https://lnkd.in/emTMFnKj\nTÃ¼m Presler: https://lnkd.in/d3w4W9Wa\nWeb Site:https://lnkd.in/dSwqCgZ8",
        "likes": "18",
        "time": {
          "raw": "2ay",
          "parsed": "22.03.2025",
          "isoString": "2025-03-22T04:38:54.567Z"
        },
        "mediaType": "image",
        "mediaContent": [
          "https://media.licdn.com/dms/image/v2/D4E22AQEs6m28MPBKbQ/feedshare-shrink_800/B4EZVMqPK7H0Ao-/0/1740747897744?e=1750896000&v=beta&t=obKrADzq4n-JDT4UXCUhok5Ml3eDvzGUW-Vo5lCcXY4"
        ],
        "date": "2025-03-22T04:38:54.567Z"
      },
      {
        "captions": "See you in Valencia ğŸ‘‹ ğŸš€ https://lnkd.in/eDEXUwCk\n\nWe are thrilled to welcome back BIRIM MAKINA as exhibitors at #BIRValencia2025! They have been a valued presence at our World Recycling Conventions for many years, showcasing their innovative metal scrap processing machinery.\n\nğŸ“ Meet BIRIM MAKINA in #Valencia to discover their latest solutions and see how they can help optimise your operations. #Register here ğŸ‘‰https://lnkd.in/dGYPuHVa\n\nğŸŒ Want to showcase your company at #BIRValencia2025? Secure your stand today and connect with key industry players! ğŸ‘‰https://lnkd.in/euyzy_fc\n\n#BIRValencia2025 #recyclinginnovation #BirimMakina #metalrecyclingğŸš€ https://lnkd.in/eDEXUwCk\n\nWe are thrilled to welcome back BIRIM MAKINA as exhibitors at #BIRValencia2025! They have been a valued presence at our World Recycling Conventions for many years, showcasing their innovative metal scrap processing machinery.\n\nğŸ“ Meet BIRIM MAKINA in #Valencia to discover their latest solutions and see how they can help optimise your operations. #Register here ğŸ‘‰https://lnkd.in/dGYPuHVa\n\nğŸŒ Want to showcase your company at #BIRValencia2025? Secure your stand today and connect with key industry players! ğŸ‘‰https://lnkd.in/euyzy_fc\n\n#BIRValencia2025 #recyclinginnovation #BirimMakina #metalrecycling",
        "likes": "6",
        "time": {
          "raw": "2ay2ay",
          "parsed": "13.05.2025",
          "isoString": "2025-05-13T06:08:39.971Z"
        },
        "mediaType": "image",
        "mediaContent": [
          "https://media.licdn.com/dms/image/v2/D4E22AQF4PvuF3Y7OiQ/feedshare-shrink_800/B4EZVCJIK5H0Ag-/0/1740571444783?e=1750291200&v=beta&t=47F4feJJFW-T3GSBegn-WbhADzi39Gzq5qU6GZn8UlY"
        ],
        "date": "2025-05-13T06:08:39.971Z"
      },
      {
        "captions": "ğŸš€ https://lnkd.in/eDEXUwCk\n\nWe are thrilled to welcome back BIRIM MAKINA as exhibitors at #BIRValencia2025! They have been a valued presence at our World Recycling Conventions for many years, showcasing their innovative metal scrap processing machinery.\n\nğŸ“ Meet BIRIM MAKINA in #Valencia to discover their latest solutions and see how they can help optimise your operations. #Register here ğŸ‘‰https://lnkd.in/dGYPuHVa\n\nğŸŒ Want to showcase your company at #BIRValencia2025? Secure your stand today and connect with key industry players! ğŸ‘‰https://lnkd.in/euyzy_fc\n\n#BIRValencia2025 #recyclinginnovation #BirimMakina #metalrecyclingğŸš€ https://lnkd.in/eDEXUwCk\n\nWe are thrilled to welcome back BIRIM MAKINA as exhibitors at #BIRValencia2025! They have been a valued presence at our World Recycling Conventions for many years, showcasing their innovative metal scrap processing machinery.\n\nğŸ“ Meet BIRIM MAKINA in #Valencia to discover their latest solutions and see how they can help optimise your operations. #Register here ğŸ‘‰https://lnkd.in/dGYPuHVa\n\nğŸŒ Want to showcase your company at #BIRValencia2025? Secure your stand today and connect with key industry players! ğŸ‘‰https://lnkd.in/euyzy_fc\n\n#BIRValencia2025 #recyclinginnovation #BirimMakina #metalrecycling",
        "likes": "6",
        "time": {
          "raw": "2ay",
          "parsed": "13.03.2025",
          "isoString": "2025-03-13T06:08:39.972Z"
        },
        "mediaType": "image",
        "mediaContent": [
          "https://media.licdn.com/dms/image/v2/D4E22AQF4PvuF3Y7OiQ/feedshare-shrink_800/B4EZVCJIK5H0Ag-/0/1740571444783?e=1750291200&v=beta&t=47F4feJJFW-T3GSBegn-WbhADzi39Gzq5qU6GZn8UlY"
        ],
        "date": "2025-03-13T06:08:39.972Z"
      },
      {
        "captions": "â™»ï¸ We help you to reduce your CarbonÂ footprint.\n\nğŸ”¥ Diesel + Electric Hybrid Material Handler: \n\nâ€¢\tBooms are made of SSAB Strenx 700 material for extra durability\nâ€¢\tSolid Rubber Tire\nâ€¢\tQuick change from Diesel to Electric Power\nâ€¢\t14 m Boom Reach 3,5 tons lifting force at max reach\nâ€¢\tBosch Rexroth hydraulics\nâ€¢\t175 HP Volvo Diesel Engine\nâ€¢\t90 kW Electric Motor\nâ€¢\tEasy change from Electric Power to Diesel\nâ€¢\tWe help you to reduce your Carbon footprint.\n\nThe Diesel + Electric Hybrid Material Handler is an impressive product that boasts a number of exceptional features. Its booms are constructed of SSAB Strenx 700 material, ensuring extra durability. Equipped with solid rubber tires, this material handler allows for a quick and easy transition from diesel to electric power. With a 14-meter boom reach and a 3.5-ton lifting force at maximum reach, it offers powerful performance for a variety of applications. It comes with Bosch Rexroth hydraulics, 175 horsepower Volvo diesel engine, and 90 kW electric motor. Users can easily switch between electric power and diesel power, making it a flexible solution for different job sites. Additionally, by using this product, you can reduce your carbon footprint, as we help you to make environmentally conscious choices.\n\nâ¤ About Hybrid Material Handler: https://lnkd.in/dC4ztXBz\nâ¤ All Material Handler: https://lnkd.in/dWf-qx2D\nâ¤ Web Site: https://lnkd.in/dmZmCsMi\n\n---\n\nâ™»ï¸ Karbon Ayak izinizi dÃ¼ÅŸÃ¼rmenize yardÄ±mcÄ± oluyoruz. \n\nğŸ”¥ Dizel + Elektrikli Hibrit ElleÃ§leme Vinci Ã–zellikleri: \n\nâ€¢\tBomlar ekstra dayanÄ±klÄ±lÄ±k iÃ§in SSAB Strenx 700 malzemeden yapÄ±lmÄ±ÅŸtÄ±rÂ \nâ€¢\tDizelden Elektrik gÃ¼cÃ¼ne hÄ±zlÄ± ve kolay geÃ§iÅŸÂ Â \nâ€¢\t14 m Boom boyu, maksimum uzanmada 3,5 ton kaldÄ±rma kuvvetiÂ Â \nâ€¢\tBosch Rexroth pompa ve valfi\nâ€¢\t175 HP Volvo Dizel Motor\nâ€¢\t90 kW elektrik motorÂ \nâ€¢\tElektrik gÃ¼cÃ¼nden dizele kolay geÃ§iÅŸ\nâ€¢\tKarbon ayak izinizi dÃ¼ÅŸÃ¼rmenize yardÄ±mcÄ± oluyoruz. \n\nDizel + Elektrikli Hibrit ElleÃ§leme Vinci, Ã¼stÃ¼n dayanÄ±klÄ±lÄ±k iÃ§in SSAB Strenx 700 malzeme ile tasarlanmÄ±ÅŸ bomlara sahip bir Ã¼rÃ¼ndÃ¼r. Bu elleÃ§leme vinci, dolgu lastiklerle donatÄ±lmÄ±ÅŸtÄ±r ve hÄ±zlÄ± bir ÅŸekilde dizel gÃ¼Ã§ten elektrik gÃ¼cÃ¼ne geÃ§iÅŸ yapabilme Ã¶zelliÄŸine sahiptir. 14 metrelik bom boyu ve maksimum uzanmada 3,5 ton kaldÄ±rma kapasitesi ile gÃ¼Ã§lÃ¼ bir performans sunar. Bosch Rexroth pompa ve valf sistemleri ile donatÄ±lmÄ±ÅŸtÄ±r. 175 beygir gÃ¼cÃ¼ndeki Volvo dizel motoruyla Ã§alÄ±ÅŸÄ±rken, deÄŸiÅŸtirir 90 kilovatlÄ±k elektrik motoru da kullanÄ±labilir. Elektrik gÃ¼cÃ¼nden dizel gÃ¼ce kolayca geÃ§iÅŸ yapabilme Ã¶zelliÄŸi sayesinde kullanÄ±cÄ±larÄ±n karbon ayak izini azaltmalarÄ±na yardÄ±mcÄ± olur. Dizel + Elektrikli Hibrit ElleÃ§leme Vinci, dayanÄ±klÄ±lÄ±ÄŸÄ±, performansÄ± ve Ã§evre dostu Ã¶zellikleriyle dikkat Ã§ekmektedir.\n\nâ¤ Hibrid Hurda Vinci HakkÄ±nda AyrÄ±ntÄ±lÄ± Bilgi: https://lnkd.in/dfHAnGb4\nâ¤ TÃ¼m Metal Hurda VinÃ§leri: https://lnkd.in/dR_YjNhn\nâ¤ Web Site: https://lnkd.in/dmZmCsMi",
        "likes": "44",
        "time": {
          "raw": "2ay",
          "parsed": "13.03.2025",
          "isoString": "2025-03-13T06:08:39.974Z"
        },
        "mediaType": "video",
        "mediaContent": {
          "src": [
            {
              "src": "https://dms.licdn.com/playlist/vid/v2/D4D05AQF0rC5v8Q9Lug/mp4-720p-30fp-crf28/B4DZVCfShjHABg-/0/1740577404503?e=1747724400&v=beta&t=NapTspwOIBYHrgCUPDJ3m9E7bcBL4cxKM3m3ED127L4",
              "type": "video/mp4",
              "data-bitrate": 1045512
            },
            {
              "src": "https://dms.licdn.com/playlist/vid/v2/D4D05AQF0rC5v8Q9Lug/mp4-640p-30fp-crf28/B4DZVCfShjHABc-/0/1740577402363?e=1747724400&v=beta&t=vL4R0-JYVF6K5c6Dr8t6qfoF6rPq7pV5nvzfX0_Fi8Y",
              "type": "video/mp4",
              "data-bitrate": 742380
            }
          ],
          "posterUrl": "https://media.licdn.com/dms/image/v2/D4D05AQF0rC5v8Q9Lug/feedshare-thumbnail_720_1280/B4DZVCfShjHAA8-/0/1740577255061?e=1747724400&v=beta&t=6GaefGFWr1MjW48Q1GjRKt_UC7YGgfBBrMLioOnjRfk"
        },
        "date": "2025-03-13T06:08:39.974Z"
      },
      {
        "captions": "Piranha | The Ultimate Scrap Processing Solution\n- Superior performance for heavy and light scrap\n- With a cutting capacity of 1100 tons\n- Ideal for iron & steel plants\n\nâ¤ Detailed information about PÄ±ranha: birimrecycling.com/piranha\nâ¤ All Metal Scrap Shears: https://lnkd.in/dn-eeG2n\nâ¤ Web Site: birimrecycling.com/\n\n-----\n\nPiranha | Metal Hurda Geri DÃ¶nÃ¼ÅŸÃ¼mÃ¼nde En Ä°yi Ã‡Ã¶zÃ¼m\n- AÄŸÄ±r ve hafif hurdalar iÃ§in Ã¼stÃ¼n performans\n- Kesme kapasitesi 1100 ton olan\n- Demir Ã§elik tesisleri iÃ§in ideal\n\nâ¤ Piranha HakkÄ±nda AyrÄ±ntÄ±lÄ± Bilgi: birimrecycling.com/piranha\nâ¤ TÃ¼m Metal Hurda MakaslarÄ±: https://lnkd.in/dy9K9ues\nâ¤ Web Site: birimrecycling.com/",
        "likes": "32",
        "time": {
          "raw": "2ay",
          "parsed": "07.03.2025",
          "isoString": "2025-03-07T11:51:52.516Z"
        },
        "mediaType": "video",
        "mediaContent": {
          "src": [
            {
              "src": "https://dms.licdn.com/playlist/vid/v2/D4D05AQGVOIdf6GvRfA/mp4-720p-30fp-crf28/B4DZU4KBdkHkBg-/0/1740403930933?e=1747224000&v=beta&t=V__flVFEdjHCUSVJx5dRs7h6GHBB5BcCqZKwvQ5IpV4",
              "type": "video/mp4",
              "data-bitrate": 600482
            },
            {
              "src": "https://dms.licdn.com/playlist/vid/v2/D4D05AQGVOIdf6GvRfA/mp4-640p-30fp-crf28/B4DZU4KBdkHkBc-/0/1740403930097?e=1747224000&v=beta&t=z2wxOY_vBNyOnvuW36xSLCxjgHkZccIObJvZLVWOMpI",
              "type": "video/mp4",
              "data-bitrate": 455081
            }
          ],
          "posterUrl": "https://media.licdn.com/dms/image/v2/D4D05AQGVOIdf6GvRfA/feedshare-thumbnail_720_1280/B4DZU4KBdkHkA8-/0/1740403911627?e=1747224000&v=beta&t=e7ea4ElOwwtvKH8WRJkkLiBGINT4i69zL2I3O8gB3Tg"
        },
        "date": "2025-03-07T11:51:52.516Z"
      },
      {
        "captions": "Piranha shears are designed to efficiently process metal scrap with high cutting capacity and durability.\n\nâš™ï¸ Working Principle: \n\nPiranha increases the density of all types of scrap by compressing it and then automatically cuts it into the desired lengths. Diesel and electric power options are available. It has a production capacity range from 6 to 60 tons per hour depending on the model. Thanks to the short stroke programme, the blades only rise up to the height of the scrap, reducing cutting time and increasing capacity.\n\nâ¤ Detailed information about PÄ±ranha: https://lnkd.in/dn-eeG2n\nâ¤ All Metal Scrap Shears: https://lnkd.in/dq423CXY\nâ¤ Web Site: birimrecycling.com/\n\n---\n\nMetal geri dÃ¶nÃ¼ÅŸÃ¼mÃ¼ndeki en bÃ¼yÃ¼k yardÄ±mcÄ±nÄ±z olan Piranha makasÄ±, yÃ¼ksek kesme kapasitesi ve dayanÄ±klÄ±lÄ±ÄŸÄ± ile metal hurdalarÄ± verimli bir ÅŸekilde iÅŸlemek iÃ§in tasarlanmÄ±ÅŸtÄ±r.\n\nâš™ï¸ Ã‡alÄ±ÅŸma Prensibi: \n\nPiranha,her cins hurdayÄ± sÄ±kÄ±ÅŸtÄ±rarak yoÄŸunluÄŸunu artÄ±rÄ±r ve ardÄ±ndan istenilen uzunluklarda otomatik olarak keser. Dizel ve elektrikli gÃ¼Ã§ seÃ§enekleri mevcuttur. Modele baÄŸlÄ± olarak saatte 6 ila 60 ton arasÄ±nda deÄŸiÅŸen Ã¼retim kapasitesine sahiptir. KÄ±sa strok programÄ± sayesinde bÄ±Ã§aklar yalnÄ±zca hurda yÃ¼ksekliÄŸi kadar kalkarak kesim sÃ¼resini azaltÄ±r ve kapasiteyi artÄ±rÄ±r. \n\nâ¤ Piranha HakkÄ±nda AyrÄ±ntÄ±lÄ± Bilgi: birimrecycling.com/piranha\nâ¤ TÃ¼m Metal Hurda MakaslarÄ±: https://lnkd.in/dy9K9ues\nâ¤ Web Site: birimrecycling.com/Piranha shears are designed to efficiently process metal scrap with high cutting capacity and durability.\n\nâš™ï¸ Working Principle: \n\nPiranha increases the density of all types of scrap by compressing it and then automatically cuts it into the desired lengths. Diesel and electric power options are available. It has a production capacity range from 6 to 60 tons per hour depending on the model. Thanks to the short stroke programme, the blades only rise up to the height of the scrap, reducing cutting time and increasing capacity.\n\nâ¤ Detailed information about PÄ±ranha: https://lnkd.in/dn-eeG2n\nâ¤ All Metal Scrap Shears: https://lnkd.in/dq423CXY\nâ¤ Web Site: birimrecycling.com/\n\n---\n\nMetal geri dÃ¶nÃ¼ÅŸÃ¼mÃ¼ndeki en bÃ¼yÃ¼k yardÄ±mcÄ±nÄ±z olan Piranha makasÄ±, yÃ¼ksek kesme kapasitesi ve dayanÄ±klÄ±lÄ±ÄŸÄ± ile metal hurdalarÄ± verimli bir ÅŸekilde iÅŸlemek iÃ§in tasarlanmÄ±ÅŸtÄ±r.\n\nâš™ï¸ Ã‡alÄ±ÅŸma Prensibi: \n\nPiranha,her cins hurdayÄ± sÄ±kÄ±ÅŸtÄ±rarak yoÄŸunluÄŸunu artÄ±rÄ±r ve ardÄ±ndan istenilen uzunluklarda otomatik olarak keser. Dizel ve elektrikli gÃ¼Ã§ seÃ§enekleri mevcuttur. Modele baÄŸlÄ± olarak saatte 6 ila 60 ton arasÄ±nda deÄŸiÅŸen Ã¼retim kapasitesine sahiptir. KÄ±sa strok programÄ± sayesinde bÄ±Ã§aklar yalnÄ±zca hurda yÃ¼ksekliÄŸi kadar kalkarak kesim sÃ¼resini azaltÄ±r ve kapasiteyi artÄ±rÄ±r. \n\nâ¤ Piranha HakkÄ±nda AyrÄ±ntÄ±lÄ± Bilgi: birimrecycling.com/piranha\nâ¤ TÃ¼m Metal Hurda MakaslarÄ±: https://lnkd.in/dy9K9ues\nâ¤ Web Site: birimrecycling.com/",
        "likes": "26",
        "time": {
          "raw": "2ay",
          "parsed": "07.03.2025",
          "isoString": "2025-03-07T11:51:52.518Z"
        },
        "mediaType": "image",
        "mediaContent": [
          "https://media.licdn.com/dms/image/v2/D4D22AQEh3Q2nR6RWpA/feedshare-shrink_800/B4DZUo0jHYHwAg-/0/1740146619907?e=1749686400&v=beta&t=CR7t4MXE0TOLYbJ2VPODP6xW7sjsqCflXijY5caS64g",
          "https://static.licdn.com/aero-v1/sc/h/dur0ryw0e9uscxa9b6zqvgvfs"
        ],
        "date": "2025-03-07T11:51:52.518Z"
      },
      {
        "captions": "Our new 30 kW laser cutting machine has started operations. Now we can cut more precise, faster and increase our production.\n\nYeni 30 kW lazer kesim tezgahÄ±mÄ±z devreye girdi. ArtÄ±k daha hassas, daha hÄ±zlÄ± keserek Ã¼retim kapasitemizi arttÄ±rÄ±yoruz.\n\n#birimmakina #metalgeridÃ¶nÃ¼ÅŸÃ¼m #metalprocessing #metalrecycling #scrapmetal",
        "likes": "30",
        "comments": "1",
        "time": {
          "raw": "2ay",
          "parsed": "02.03.2025",
          "isoString": "2025-03-02T05:36:32.910Z"
        },
        "mediaType": "video",
        "mediaContent": {
          "src": [
            {
              "src": "https://dms.licdn.com/playlist/vid/v2/D4D05AQHpjeIkLNS2rw/mp4-640p-30fp-crf28/B4DZUkU9eCHABc-/0/1740071261184?e=1746770400&v=beta&t=-AV71YIlwF-ymse2OSm373OSodkS0XTWuaMEDIne29M",
              "type": "video/mp4",
              "data-bitrate": 856639
            },
            {
              "src": "https://dms.licdn.com/playlist/vid/v2/D4D05AQHpjeIkLNS2rw/mp4-720p-30fp-crf28/B4DZUkU9eCHABg-/0/1740071262034?e=1746770400&v=beta&t=Y5pwEhe1UhREZZxaDRd9hLwkXUsfNwNGvorPDb1EZlY",
              "type": "video/mp4",
              "data-bitrate": 1131400
            }
          ],
          "posterUrl": "https://media.licdn.com/dms/image/v2/D4D05AQHpjeIkLNS2rw/videocover-high/B4DZUkU9eCHABs-/0/1740071257761?e=1746770400&v=beta&t=hLUJuQerjcReAQSfkl8xuEgRLDUzDoZpx_Qy6Wa4t3k"
        },
        "date": "2025-03-02T05:36:32.910Z"
      },
      {
        "captions": "Piranha 1100S Metal Scrap Shear | Incline Shear | Birim Makina\n\nPiranha shears are designed to efficiently process metal scrap with high cutting capacity and durability.\n\nâš™ï¸ Working Principle: \n\nPiranha increases the density of all types of scrap by compressing it and then automatically cuts it into the desired lengths. Diesel and electric power options are available. It has a production capacity range from 6 to 60 tons per hour depending on the model. Thanks to the short stroke programme, the blades only rise up to the height of the scrap, reducing cutting time and increasing capacity.\n\nâ¤ Detailed information about PÄ±ranha: https://lnkd.in/d7xrtSDT\nâ¤ All Metal Scrap Shears: https://lnkd.in/dR9r2jNR\nâ¤ Web Site: https://lnkd.in/dmZmCsMi\n\n-----\n\nPiranha 1100S Metal Hurda MakasÄ± | SÃ¼rekli Kesim MakasÄ± | Incline Shears | Birim Makina\n\nMetal geri dÃ¶nÃ¼ÅŸÃ¼mÃ¼ndeki en bÃ¼yÃ¼k yardÄ±mcÄ±nÄ±z olan Piranha makasÄ±, yÃ¼ksek kesme kapasitesi ve dayanÄ±klÄ±lÄ±ÄŸÄ± ile metal hurdalarÄ± verimli bir ÅŸekilde iÅŸlemek iÃ§in tasarlanmÄ±ÅŸtÄ±r.\n\nâš™ï¸ Ã‡alÄ±ÅŸma Prensibi: \n\nPiranha,her cins hurdayÄ± sÄ±kÄ±ÅŸtÄ±rarak yoÄŸunluÄŸunu artÄ±rÄ±r ve ardÄ±ndan istenilen uzunluklarda otomatik olarak keser. Dizel ve elektrikli gÃ¼Ã§ seÃ§enekleri mevcuttur. Modele baÄŸlÄ± olarak saatte 6 ila 60 ton arasÄ±nda deÄŸiÅŸen Ã¼retim kapasitesine sahiptir. KÄ±sa strok programÄ± sayesinde bÄ±Ã§aklar yalnÄ±zca hurda yÃ¼ksekliÄŸi kadar kalkarak kesim sÃ¼resini azaltÄ±r ve kapasiteyi artÄ±rÄ±r. \n\nâ¤ Piranha HakkÄ±nda AyrÄ±ntÄ±lÄ± Bilgi: https://lnkd.in/dgpkxxh7\nâ¤ TÃ¼m Metal Hurda MakaslarÄ±: https://lnkd.in/dzQUGq_y\nâ¤ Web Site: https://lnkd.in/dmZmCsMi",
        "likes": "44",
        "comments": "1",
        "shares": "2",
        "time": {
          "raw": "2ay",
          "parsed": "28.02.2025",
          "isoString": "2025-02-28T04:57:20.255Z"
        },
        "mediaType": "video",
        "mediaContent": {
          "src": [
            {
              "src": "https://dms.licdn.com/playlist/vid/v2/D4D05AQEKkZwUGtzqSg/mp4-640p-30fp-crf28/B4DZUemjIVHIBc-/0/1739975448162?e=1746421200&v=beta&t=wL1rd5WsspznU3sqblieJ4ircOxN5YsQnscYj0WkZNY",
              "type": "video/mp4",
              "data-bitrate": 862726
            },
            {
              "src": "https://dms.licdn.com/playlist/vid/v2/D4D05AQEKkZwUGtzqSg/mp4-720p-30fp-crf28/B4DZUemjIVHIBg-/0/1739975441970?e=1746421200&v=beta&t=Ae_UIl244Or28uuviLwK_9D5A33w4NZ0U-CHWH3pnpE",
              "type": "video/mp4",
              "data-bitrate": 1144112
            }
          ],
          "posterUrl": "https://media.licdn.com/dms/image/v2/D4D05AQEKkZwUGtzqSg/videocover-high/B4DZUemjIVHIBs-/0/1739975393080?e=1746421200&v=beta&t=lLzQfTcYtN_4la3jNeHLdBjPRJ4Uarfl1FYseshqLxc"
        },
        "date": "2025-02-28T04:57:20.255Z"
      },
      {
        "captions": "Did You Meet Our Cats Our Cats ? \n\nStreamline your recycling processes with the Leopard, Tiger, Lion and Puma. \n\nğŸ’ª Power and Technology Together:\n\nFully Automatic and Long-term Use\nVarious Models and Power Options\nDurable Design for High Performance Under Heavy Duty Operation\n\nâ¤ Leopard: https://lnkd.in/dh27E9eS\nâ¤ Tiger: birimrecycling.com/tiger-2\nâ¤ Lion: birimrecycling.com/lion-2\nâ¤ Puma: birimrecycling.com/puma-2\n---Â  \n\nKedilerimiz Ä°le TanÄ±ÅŸtÄ±nÄ±z mÄ± ? \n\nLeopard, Tiger, Lion and Puma ileÂ metal iÅŸleme ve geri dÃ¶nÃ¼ÅŸÃ¼m sÃ¼reÃ§lerinizi kolaylaÅŸtÄ±rÄ±n.\n\nğŸ’ª GÃ¼Ã§ ve Teknoloji Bir Arada:\n\nTam otomatik ve kesintisiz Ã§alÄ±ÅŸma\nÃ‡eÅŸitli modeller ve gÃ¼Ã§ seÃ§enekleri\nDayanÄ±klÄ± tasarÄ±m ve uzun Ã¶mÃ¼r\n\nâ¤ Leopard: birimrecycling.com/leopard\nâ¤ Tiger: birimrecycling.com/tiger\nâ¤ Lion: birimrecycling.com/lion\nâ¤ Puma: birimrecycling.com/puma\n\n#DÃ¼nyaKedilerGÃ¼nÃ¼Â #WorldCatsDayÂ #BirimMakinaÂ #MetalGeriDÃ¶nÃ¼ÅŸÃ¼mÂ #MetalÄ°ÅŸlemeÂ #MetalHurdaPresiÂ #MetalScrapBalers",
        "likes": "14",
        "comments": "1",
        "shares": "1",
        "time": {
          "raw": "2ay",
          "parsed": "28.02.2025",
          "isoString": "2025-02-28T04:57:20.256Z"
        },
        "mediaType": "video",
        "mediaContent": {
          "src": [
            {
              "src": "https://dms.licdn.com/playlist/vid/v2/D4D05AQE6-oEXLsZ5sw/mp4-640p-30fp-crf28/B4DZUUFfnaG8Bg-/0/1739798789500?e=1746421200&v=beta&t=YrYnVBcRIrebmOVxblN-1d3tx8yGqiy-mPr-JfMx9OM",
              "type": "video/mp4",
              "data-bitrate": 472133
            },
            {
              "src": "https://dms.licdn.com/playlist/vid/v2/D4D05AQE6-oEXLsZ5sw/mp4-720p-30fp-crf28/B4DZUUFfnaG8Bk-/0/1739798789618?e=1746421200&v=beta&t=EUorrDOIW4wjmwwaDWEFDHW6gE_gyq4-vfofrQvxZ-4",
              "type": "video/mp4",
              "data-bitrate": 622630
            }
          ],
          "posterUrl": "https://media.licdn.com/dms/image/v2/D4D05AQE6-oEXLsZ5sw/feedshare-thumbnail_720_1280/B4DZUUFfnaG8BA-/0/1739798742820?e=1746421200&v=beta&t=HAdhWUqOv_NPw-btWpUWsukD77eSn_THjCRNAktG5G0"
        },
        "date": "2025-02-28T04:57:20.256Z"
      },
      {
        "captions": "Features of Murenha:\n\nâœ”ï¸ Automatic Lubrication\nâœ”ï¸ Lubricant filtering system for continuous operation\nâœ”ï¸ Non-contact sensors to avoid re-calibration\nâœ”ï¸ Optional Mobile and Semi Mobile versions\n\n-----\n\nMurenha'nÄ±n OÌˆzellikeri:\n\nâœ”ï¸ Otomatik yagÌ†lama\nâœ”ï¸ Sorunsuz operasyon icÌ§in oÌˆzel yagÌ† filtreleme sistemi\nâœ”ï¸ AyarÄ± kacÌ§mayan temassÄ±z sensoÌˆrler\nâœ”ï¸ Opsiyonel mobil veya yarÄ± mobil uygulamalarÄ±\n\n#MetalHurdaPresi #MetalScrapShears #ScrapRecyclingProcess #HurdaGeriDoÌˆnuÌˆsÌ§uÌˆm #BirimMakinaFeatures of Murenha:\n\nâœ”ï¸ Automatic Lubrication\nâœ”ï¸ Lubricant filtering system for continuous operation\nâœ”ï¸ Non-contact sensors to avoid re-calibration\nâœ”ï¸ Optional Mobile and Semi Mobile versions\n\n-----\n\nMurenha'nÄ±n OÌˆzellikeri:\n\nâœ”ï¸ Otomatik yagÌ†lama\nâœ”ï¸ Sorunsuz operasyon icÌ§in oÌˆzel yagÌ† filtreleme sistemi\nâœ”ï¸ AyarÄ± kacÌ§mayan temassÄ±z sensoÌˆrler\nâœ”ï¸ Opsiyonel mobil veya yarÄ± mobil uygulamalarÄ±\n\n#MetalHurdaPresi #MetalScrapShears #ScrapRecyclingProcess #HurdaGeriDoÌˆnuÌˆsÌ§uÌˆm #BirimMakina",
        "likes": "48",
        "comments": "3",
        "shares": "2",
        "time": {
          "raw": "2ay",
          "parsed": "28.02.2025",
          "isoString": "2025-02-28T04:57:20.257Z"
        },
        "mediaType": "image",
        "mediaContent": [
          "https://media.licdn.com/dms/image/v2/D4D22AQGOmjiUwslmtw/feedshare-shrink_800/B4DZUFb_jDHIAk-/0/1739552980713?e=1748476800&v=beta&t=8e_kq8ZF1IMizA6QxLtz-c2HITLh5SNxWM4LZj9QG2M"
        ],
        "date": "2025-02-28T04:57:20.257Z"
      },
      {
        "captions": "Berat Kandilimiz MÃ¼barek Olsun!Berat Kandilimiz MÃ¼barek Olsun!",
        "likes": "10",
        "time": {
          "raw": "2ay",
          "parsed": "24.02.2025",
          "isoString": "2025-02-24T05:21:09.265Z"
        },
        "mediaType": "image",
        "mediaContent": [
          "https://media.licdn.com/dms/image/v2/D4D22AQG2lxthqcevzw/feedshare-shrink_800/B4DZT_tcuhHAAk-/0/1739456894174?e=1748476800&v=beta&t=tTRNN00lOiQvWDfSJ6ow4gGc54X1VXllyrX9IRT6sN4"
        ],
        "date": "2025-02-24T05:21:09.265Z"
      },
      {
        "captions": "ğŸ“¢ğŸ“¢ New video available ! \n\nâ¤ Briquetting Press: https://lnkd.in/d3VakZkP\nâ¤ All Balers: https://lnkd.in/dC6zMMyk\n\nhttps://lnkd.in/daeYZP2q",
        "likes": "20",
        "shares": "1",
        "time": {
          "raw": "2ay",
          "parsed": "21.02.2025",
          "isoString": "2025-02-21T05:48:42.118Z"
        },
        "mediaType": "other",
        "date": "2025-02-21T05:48:42.118Z"
      },
      {
        "captions": "NO GUTS , NO GLORY\n\nAnother BIRIM continuous baler just started operation in Sydney -Australia.  \nHigh Density Bales, \nFast Cycle Time, \nHigh Productivity,\nRobust Design, \nHigh Quality Hydraulic & Electrical Components,\n\n& HAPPY CUSTOMERS WORLDWIDE\n..NO GUTS , NO GLORY\n\nAnother BIRIM continuous baler just started operation in Sydney -Australia.  \nHigh Density Bales, \nFast Cycle Time, \nHigh Productivity,\nRobust Design, \nHigh Quality Hydraulic & Electrical Components,\n\n& HAPPY CUSTOMERS WORLDWIDE\n..",
        "likes": "49",
        "shares": "2",
        "time": {
          "raw": "2ay",
          "parsed": "14.02.2025",
          "isoString": "2025-02-14T04:43:58.602Z"
        },
        "mediaType": "image",
        "mediaContent": [
          "https://media.licdn.com/dms/image/v2/D4D22AQGySvfNKyMxuQ/feedshare-shrink_800/B4DZTwIsuLHwAo-/0/1739195601465?e=1747267200&v=beta&t=9KuUsjH74TRWytAzVwea1SpxHqqrstS2FkClXAAF2zQ",
          "https://media.licdn.com/dms/image/v2/D4D22AQE0sPhqtMVoGg/feedshare-shrink_800/B4DZTwIsvDHkAo-/0/1739195601570?e=1747267200&v=beta&t=GlYenCEdxKBkTgaWV2fIgnFbBkrkSn9ZjdP_XzN2BWQ"
        ],
        "date": "2025-02-14T04:43:58.602Z"
      },
      {
        "captions": "Features of Leopard Baler:Â \nâœ”ï¸ Capacity up to 24 tons/hour (Fe)Â \nâœ”ï¸ Fully automated operation for ease of useÂ \nâœ”ï¸ Durable design for high performance under heavy duty operation\n\nâ¤ Detailed information about Leopard: https://lnkd.in/ddpHtraE\nâ¤ All Metal Scrap Balers: https://lnkd.in/dq-MMRYC\nâ¤ Web Site: https://lnkd.in/dmZmCsMi\n\n----\n\nLeopard SÃ¼rekli Pres Ã–zellikleri:Â \nâœ”ï¸ Maksimum 24 ton/saat (Fe) kapasiteli modelleri mevcutturÂ \nâœ”ï¸ KullanÄ±m kolaylÄ±ÄŸÄ± iÃ§in tam otomatik Ã§alÄ±ÅŸmaÂ \nâœ”ï¸ AÄŸÄ±r gÃ¶rev koÅŸullarÄ±nda yÃ¼ksek performans iÃ§in dayanÄ±klÄ± tasarÄ±m \n\nâ¤ Leopard HakkÄ±nda AyrÄ±ntÄ± bilgi: https://lnkd.in/d5pNy44X\nâ¤ TÃ¼m Metal Hurda Preslerimiz: https://lnkd.in/d3w4W9Wa\nâ¤ Web Sitemiz: https://lnkd.in/dSwqCgZ8\n\n#BirimMakina #MetalGeriDÃ¶nÃ¼ÅŸÃ¼mÂ #MetalÄ°ÅŸlemeÂ #3BamBalers #ContuniusBaler #MetalHurdaPresi #MetalScrapBalersFeatures of Leopard Baler:Â \nâœ”ï¸ Capacity up to 24 tons/hour (Fe)Â \nâœ”ï¸ Fully automated operation for ease of useÂ \nâœ”ï¸ Durable design for high performance under heavy duty operation\n\nâ¤ Detailed information about Leopard: https://lnkd.in/ddpHtraE\nâ¤ All Metal Scrap Balers: https://lnkd.in/dq-MMRYC\nâ¤ Web Site: https://lnkd.in/dmZmCsMi\n\n----\n\nLeopard SÃ¼rekli Pres Ã–zellikleri:Â \nâœ”ï¸ Maksimum 24 ton/saat (Fe) kapasiteli modelleri mevcutturÂ \nâœ”ï¸ KullanÄ±m kolaylÄ±ÄŸÄ± iÃ§in tam otomatik Ã§alÄ±ÅŸmaÂ \nâœ”ï¸ AÄŸÄ±r gÃ¶rev koÅŸullarÄ±nda yÃ¼ksek performans iÃ§in dayanÄ±klÄ± tasarÄ±m \n\nâ¤ Leopard HakkÄ±nda AyrÄ±ntÄ± bilgi: https://lnkd.in/d5pNy44X\nâ¤ TÃ¼m Metal Hurda Preslerimiz: https://lnkd.in/d3w4W9Wa\nâ¤ Web Sitemiz: https://lnkd.in/dSwqCgZ8\n\n#BirimMakina #MetalGeriDÃ¶nÃ¼ÅŸÃ¼mÂ #MetalÄ°ÅŸlemeÂ #3BamBalers #ContuniusBaler #MetalHurdaPresi #MetalScrapBalers",
        "likes": "52",
        "comments": "1",
        "shares": "1",
        "time": {
          "raw": "1ay",
          "parsed": "17.02.2025",
          "isoString": "2025-02-17T05:03:21.840Z"
        },
        "mediaType": "image",
        "mediaContent": [
          "https://media.licdn.com/dms/image/v2/D4D22AQGC0wfKDQs4KQ/feedshare-shrink_800/B4DZSyaOZKHkAk-/0/1738160008746?e=1744848000&v=beta&t=A05BUrttVhDaPk6Q7guP5rpgU3YnOlp0HaA9TTtXvi8"
        ],
        "date": "2025-02-17T05:03:21.840Z"
      },
      {
        "captions": "KahramanmaraÅŸ merkezli, 11 ilimizi etkileyen deprem felaketinde hayatÄ±nÄ± kaybeden vatandaÅŸlarÄ±mÄ±zÄ± rahmet ve Ã¶zlemle anÄ±yor, yakÄ±nlarÄ±na ve tÃ¼m Ã¼lkemize baÅŸsaÄŸlÄ±ÄŸÄ± ve sabÄ±r diliyoruz.\n\n#UnutmadÄ±k #6ÅubatKahramanmaraÅŸ merkezli, 11 ilimizi etkileyen deprem felaketinde hayatÄ±nÄ± kaybeden vatandaÅŸlarÄ±mÄ±zÄ± rahmet ve Ã¶zlemle anÄ±yor, yakÄ±nlarÄ±na ve tÃ¼m Ã¼lkemize baÅŸsaÄŸlÄ±ÄŸÄ± ve sabÄ±r diliyoruz.\n\n#UnutmadÄ±k #6Åubat",
        "likes": "4",
        "time": {
          "raw": "1ay",
          "parsed": "17.02.2025",
          "isoString": "2025-02-17T05:03:21.841Z"
        },
        "mediaType": "image",
        "mediaContent": [
          "https://media.licdn.com/dms/image/v2/D4D22AQEw6g7ZxPNwWQ/feedshare-shrink_800/B4DZTar6rkGcAk-/0/1738835734993?e=1744848000&v=beta&t=tm174GlL5l7IlHLpwe-jKYj4EnEIXUKP157DOBTTs2s"
        ],
        "date": "2025-02-17T05:03:21.841Z"
      },
      {
        "captions": "ğŸ“¢ğŸ“¢ New Video Available Now\n\nLeopard Continuous Baler | 3 Ram Baler\n\nLeopard Balers are designed to efficiently process metal scrap with high cutting capacity and durability. Leopard increases the density of all types of scrap by compressing it and makes it ready for other processes.\n\nhttps://lnkd.in/dfe_mNv8",
        "likes": "9",
        "time": {
          "raw": "1ay",
          "parsed": "17.02.2025",
          "isoString": "2025-02-17T05:03:21.842Z"
        },
        "mediaType": "other",
        "date": "2025-02-17T05:03:21.842Z"
      },
      {
        "captions": "Streamline your recycling processes with the Shark, Piranha, Orca, Mobile Shark and Murenha. Each is designed to provide high capacity, durability and maximum efficiency. â™»ï¸\n\nğŸ’ª Power and Technology Together:\n\nFully Automatic and Long-term Use\nVarious Models and Power Options\nDurable Design for High Performance Under Heavy Duty Operation\n\nMeet our scrap processing solutions and boost your productivity ğŸš€\n\nAll Shears: https://lnkd.in/dq423CXY\n\n---\n\nShark, Piranha, Orca, Mobile Shark ve Murenha ile metal iÅŸleme ve geri dÃ¶nÃ¼ÅŸÃ¼m sÃ¼reÃ§lerinizi kolaylaÅŸtÄ±rÄ±n. Her biri, yÃ¼ksek kapasite, dayanÄ±klÄ±lÄ±k ve maksimum verimlilik saÄŸlamak iÃ§in tasarlandÄ±. â™»ï¸\n\nğŸ’ª GÃ¼Ã§ ve Teknoloji Bir Arada:\n\nTam otomatik ve kesintisiz Ã§alÄ±ÅŸma\nÃ‡eÅŸitli modeller ve gÃ¼Ã§ seÃ§enekleri\nDayanÄ±klÄ± tasarÄ±m ve uzun Ã¶mÃ¼r\n\nHurda iÅŸleme Ã§Ã¶zÃ¼mlerimizle tanÄ±ÅŸÄ±n ve Ã¼retiminizi bir Ã¼st seviyeye taÅŸÄ±yÄ±n! ğŸš€\n\nTÃ¼m Hurda MakaslarÄ±: https://lnkd.in/dy9K9ues",
        "likes": "31",
        "comments": "1",
        "time": {
          "raw": "1ay",
          "parsed": "17.02.2025",
          "isoString": "2025-02-17T05:03:21.843Z"
        },
        "mediaType": "video",
        "mediaContent": {
          "src": [
            {
              "src": "https://dms.licdn.com/playlist/vid/v2/D4D05AQHwTLNBqFTk0Q/mp4-640p-30fp-crf28/B4DZStGohaG8Bc-/0/1738071000427?e=1742796000&v=beta&t=InTCCXZ2wXV72q9n3ewHkBc3KfptBLi6aOgaiOssuaE",
              "type": "video/mp4",
              "data-bitrate": 424917
            },
            {
              "src": "https://dms.licdn.com/playlist/vid/v2/D4D05AQHwTLNBqFTk0Q/mp4-720p-30fp-crf28/B4DZStGohaG8Bg-/0/1738070999863?e=1742796000&v=beta&t=pRBlfkXfdDo96vkXzh4WJcZ-PeIn2l-zUo_ZVV9cbJY",
              "type": "video/mp4",
              "data-bitrate": 560053
            }
          ],
          "posterUrl": "https://media.licdn.com/dms/image/v2/D4D05AQHwTLNBqFTk0Q/feedshare-thumbnail_720_1280/B4DZStGohaG8A8-/0/1738070987508?e=1742796000&v=beta&t=Hm4QeuXsajg9bMr_p2X_VEWIsQesVVVR2BbKmtwYzKc"
        },
        "date": "2025-02-17T05:03:21.843Z"
      },
      {
        "captions": "ORCA | Reliable Performance In Harsh Conditions\n\n- Strong body for Heavy Duty operation\n- High quality heavy duty cylinders (Hardened and chrome-coated piston rots, honed pipes)\n- The best quality brands are used in hydraulic and electronic parts: Linde, Rexroth, Siemens, Telemecanique, Phoenix Contact\n- Original Hardox anti-wear plates\n\n----\n\nORCA | Zorlu KoÅŸullarda GÃ¼venilir Performans\n\n- AÄŸÄ±r hizmete uygun gÃ¼Ã§lÃ¼ gÃ¶vdeÂ \n- YÃ¼ksek kaliteli aÄŸÄ±r hizmet silindirleri (SertleÅŸtirilmiÅŸ ve krom kaplanmÄ±ÅŸ miller ,Ã¶zel honlanmÄ±ÅŸ borular)\n- En kaliteli hidrolik ve elektrik parÃ§alarÄ± : Linde, Rexroth, Parker, Atos, Siemens, Telemecanique, Phoenix Contact\n- Orjinal Hardox aÅŸÄ±nma plakalarÄ±\n\n#SidePress #ScrapMetal #MetalRecycling #RecyclingEquipment #BirimMakinaÂ ORCA | Reliable Performance In Harsh Conditions\n\n- Strong body for Heavy Duty operation\n- High quality heavy duty cylinders (Hardened and chrome-coated piston rots, honed pipes)\n- The best quality brands are used in hydraulic and electronic parts: Linde, Rexroth, Siemens, Telemecanique, Phoenix Contact\n- Original Hardox anti-wear plates\n\n----\n\nORCA | Zorlu KoÅŸullarda GÃ¼venilir Performans\n\n- AÄŸÄ±r hizmete uygun gÃ¼Ã§lÃ¼ gÃ¶vdeÂ \n- YÃ¼ksek kaliteli aÄŸÄ±r hizmet silindirleri (SertleÅŸtirilmiÅŸ ve krom kaplanmÄ±ÅŸ miller ,Ã¶zel honlanmÄ±ÅŸ borular)\n- En kaliteli hidrolik ve elektrik parÃ§alarÄ± : Linde, Rexroth, Parker, Atos, Siemens, Telemecanique, Phoenix Contact\n- Orjinal Hardox aÅŸÄ±nma plakalarÄ±\n\n#SidePress #ScrapMetal #MetalRecycling #RecyclingEquipment #BirimMakina",
        "likes": "44",
        "time": {
          "raw": "1ay",
          "parsed": "22.04.2025",
          "isoString": "2025-04-22T04:38:54.560Z"
        },
        "mediaType": "image",
        "mediaContent": [
          "https://media.licdn.com/dms/image/v2/D4D22AQHQKvUFaXIlLQ/feedshare-shrink_800/B4DZXLzwMXHwAg-/0/1742881102131?e=1750896000&v=beta&t=zdShDJKq9osNgs1DLNT8ny7tPCysxZpsnGFeiJHzrYE"
        ],
        "date": "2025-04-22T04:38:54.560Z"
      },
      {
        "captions": "Aziz KahramanlarÄ±mÄ±zÄ± SaygÄ± ve Minnetle AnÄ±yoruz\n\n#18Mart #Ã‡anakkaleZaferiAziz KahramanlarÄ±mÄ±zÄ± SaygÄ± ve Minnetle AnÄ±yoruz\n\n#18Mart #Ã‡anakkaleZaferi",
        "likes": "11",
        "time": {
          "raw": "2ay",
          "parsed": "22.03.2025",
          "isoString": "2025-03-22T04:38:54.561Z"
        },
        "mediaType": "image",
        "mediaContent": [
          "https://media.licdn.com/dms/image/v2/D4D22AQF55vubCZYlYw/feedshare-shrink_800/B4DZWpBtB9HIA0-/0/1742297569595?e=1750896000&v=beta&t=y0rDdCE14jA4rmanYhHG-ZxeZ3EQFpqFsDIQSIdLbsM"
        ],
        "date": "2025-03-22T04:38:54.561Z"
      },
      {
        "captions": "Ä°yi bayramlar",
        "likes": "7",
        "time": {
          "raw": "1ay",
          "parsed": "22.04.2025",
          "isoString": "2025-04-22T04:38:54.557Z"
        },
        "mediaType": "video",
        "mediaContent": {
          "src": [
            {
              "src": "https://dms.licdn.com/playlist/vid/v2/D4D05AQHhG0QeQYt-uw/mp4-720p-30fp-crf28/B4DZXmNifRH4Bg-/0/1743324072077?e=1748494800&v=beta&t=cnbpQMsX4bBBUrJj0UGgS9_2yzw_9obmdP122YAjpJs",
              "type": "video/mp4",
              "data-bitrate": 291510
            },
            {
              "src": "https://dms.licdn.com/playlist/vid/v2/D4D05AQHhG0QeQYt-uw/mp4-640p-30fp-crf28/B4DZXmNifRH4Bc-/0/1743324071383?e=1748494800&v=beta&t=ubSWI4_jYMP-4BsmXXsw9bP7uNwuYDdPu7MRP5wO7BQ",
              "type": "video/mp4",
              "data-bitrate": 230543
            }
          ],
          "posterUrl": "https://media.licdn.com/dms/image/v2/D4D05AQHhG0QeQYt-uw/videocover-high/B4DZXmNifRH4Bs-/0/1743324071086?e=1748494800&v=beta&t=8TPJrIR-panPwBcBMG5UK_YvJTvXtw_jWjuC2wto7HQ"
        },
        "date": "2025-04-22T04:38:54.557Z"
      },
      {
        "captions": "Kadir Gecemiz MÃ¼barek Olsun",
        "likes": "4",
        "time": {
          "raw": "1ay",
          "parsed": "22.04.2025",
          "isoString": "2025-04-22T04:38:54.558Z"
        },
        "mediaType": "video",
        "mediaContent": {
          "src": [
            {
              "src": "https://dms.licdn.com/playlist/vid/v2/D4D05AQGNYkpL-xLs5A/mp4-720p-30fp-crf28/B4DZXSDXZZHIBg-/0/1742985860016?e=1748494800&v=beta&t=EBgt6tX86Mr3JKJ-oRyPF51on7EHJRyY9LhH0yOAYC0",
              "type": "video/mp4",
              "data-bitrate": 337865
            },
            {
              "src": "https://dms.licdn.com/playlist/vid/v2/D4D05AQGNYkpL-xLs5A/mp4-640p-30fp-crf28/B4DZXSDXZZHIBc-/0/1742985859992?e=1748494800&v=beta&t=fdj_u-hY47CmKTedwOHSoN06IgBNVDXk811P_8isjlY",
              "type": "video/mp4",
              "data-bitrate": 262101
            }
          ],
          "posterUrl": "https://media.licdn.com/dms/image/v2/D4D05AQGNYkpL-xLs5A/videocover-high/B4DZXSDXZZHIBs-/0/1742985859502?e=1748494800&v=beta&t=c_4uhud1_vGX39BlHArXgKWyLbNI1RtSpiXqsxcZFlk"
        },
        "date": "2025-04-22T04:38:54.558Z"
      },
      {
        "likes": "15",
        "time": {
          "raw": "1ay",
          "parsed": "22.04.2025",
          "isoString": "2025-04-22T04:38:54.556Z"
        },
        "mediaType": "video",
        "mediaContent": {
          "src": [
            {
              "src": "https://dms.licdn.com/playlist/vid/v2/D4D05AQHOK3Q5C_9TJA/mp4-720p-30fp-crf28/B4DZZJPE3cGwBY-/0/1744985468505?e=1748494800&v=beta&t=S0KyQIc7IwK7umKF-BP_TV8XRriK9agzjgC-dCBbJ1k",
              "type": "video/mp4",
              "data-bitrate": 1322825
            },
            {
              "src": "https://dms.licdn.com/playlist/vid/v2/D4D05AQHOK3Q5C_9TJA/mp4-640p-30fp-crf28/B4DZZJPE3cGwBU-/0/1744985468880?e=1748494800&v=beta&t=dKWP9mS-TvtFWHWxS9dlsvoJkwxOv_djfwg1L_NB_Ac",
              "type": "video/mp4",
              "data-bitrate": 1046350
            }
          ],
          "posterUrl": "https://media.licdn.com/dms/image/v2/D4D05AQHOK3Q5C_9TJA/feedshare-thumbnail_720_1280/B4DZZJPE3cGwAw-/0/1744985412494?e=1748494800&v=beta&t=wKeMbu4Gx-13IG81mFSjZBN7PMPTsJI03u6NPE8JRks"
        },
        "date": "2025-04-22T04:38:54.556Z"
      },
      {
        "captions": "Uludal Egemenlik ve Ã‡ocuk BayramÄ± Kutlu Olsun",
        "likes": "13",
        "time": {
          "raw": "4h",
          "parsed": "24.04.2025",
          "isoString": "2025-04-24T04:38:54.555Z"
        },
        "mediaType": "video",
        "mediaContent": {
          "src": [
            {
              "src": "https://dms.licdn.com/playlist/vid/v2/D4D05AQHVGRUbjojLMQ/mp4-640p-30fp-crf28/B4DZZi3qcoG8BY-/0/1745415492740?e=1748494800&v=beta&t=pkbyXC2Pu8yc7fmpKYEJw2OlDFLaP_6EJLkkt49ZS_k",
              "type": "video/mp4",
              "data-bitrate": 201739
            },
            {
              "src": "https://dms.licdn.com/playlist/vid/v2/D4D05AQHVGRUbjojLMQ/mp4-720p-30fp-crf28/B4DZZi3qcoG8Bc-/0/1745415491513?e=1748494800&v=beta&t=PEt665jl6f23FjJx0w3DHf6-11pAydzGSIHgUT0oeMc",
              "type": "video/mp4",
              "data-bitrate": 253812
            }
          ],
          "posterUrl": "https://media.licdn.com/dms/image/v2/D4D05AQHVGRUbjojLMQ/videocover-high/B4DZZi3qcoG8Bo-/0/1745415490831?e=1748494800&v=beta&t=rE7UQfw4YLuat9DXyJEDB_FjxZ4NxNY_LuHOdj9sSVk"
        },
        "date": "2025-04-24T04:38:54.555Z"
      },
      {
        "captions": "YÄ±llar sÃ¼ren birliktelik : GÃ¼ven Metal - Birim Makina \nMehmet Åahin ile neredeyse 10 yÄ±la yakÄ±n olan iÅŸbirliÄŸimizden her iki taraf da mutlu. \n\nYears of happy collabration between GÃ¼ven Metal Recycling and Birim Makina. Smiling faces for almost 10 years together\n\n#scrapmetal #scraprecycling #metalrecycling #recyclingmachinery #scrapbaler #metalbaler #ferrous #nonferrous #birimmakina #birimrecycling #hurda #hurdametal #geridonusum #pres #hurdapresiYÄ±llar sÃ¼ren birliktelik : GÃ¼ven Metal - Birim Makina \nMehmet Åahin ile neredeyse 10 yÄ±la yakÄ±n olan iÅŸbirliÄŸimizden her iki taraf da mutlu. \n\nYears of happy collabration between GÃ¼ven Metal Recycling and Birim Makina. Smiling faces for almost 10 years together\n\n#scrapmetal #scraprecycling #metalrecycling #recyclingmachinery #scrapbaler #metalbaler #ferrous #nonferrous #birimmakina #birimrecycling #hurda #hurdametal #geridonusum #pres #hurdapresi",
        "likes": "98",
        "comments": "1",
        "shares": "2",
        "time": {
          "raw": "3h",
          "parsed": "01.05.2025",
          "isoString": "2025-05-01T04:38:54.552Z"
        },
        "mediaType": "image",
        "mediaContent": [
          "https://media.licdn.com/dms/image/v2/D4D22AQFeuc-3MMf_Sg/feedshare-shrink_800/B4DZZtTP4CG4Ak-/0/1745590500676?e=1750896000&v=beta&t=IWsZBbLCv8kJDOo7B0meie-4B68wKOP294ZU9xOXbqc",
          "https://media.licdn.com/dms/image/v2/D4D22AQGDXKpYY2N0mg/feedshare-shrink_800/B4DZZtTP5DH4Bo-/0/1745590494515?e=1750896000&v=beta&t=kBK21WjfaV9Hp-muWmgUl5K3HC8H0Ss3ESgBqEV4VlI",
          "https://media.licdn.com/dms/image/v2/D4D22AQGK-sTFpod-Hw/feedshare-shrink_800/B4DZZtTP5XHIAg-/0/1745590499957?e=1750896000&v=beta&t=-Gfi0drvYzDJ5TxD_w533xG7yhI-AjyJ6O23itf5mB0"
        ],
        "date": "2025-05-01T04:38:54.552Z"
      },
      {
        "captions": "1 MayÄ±s Ä°ÅŸÃ§i BayramÄ± Kutlu Olsun â­ âœŠ 1 MayÄ±s Ä°ÅŸÃ§i BayramÄ± Kutlu Olsun â­ âœŠ",
        "likes": "9",
        "time": {
          "raw": "2h",
          "parsed": "08.05.2025",
          "isoString": "2025-05-08T04:38:54.546Z"
        },
        "mediaType": "image",
        "mediaContent": [
          "https://media.licdn.com/dms/image/v2/D4D22AQG9JZo1Rhj2wg/feedshare-shrink_800/B4DZaHC0BPHQAg-/0/1746022395936?e=1750896000&v=beta&t=1QvOIQm3pxBdKLEYTw6OtvHjgrqNb4YWYpmSKG02uC4"
        ],
        "date": "2025-05-08T04:38:54.546Z"
      },
      {
        "captions": "If you would like to read an interesting article about our company and our family, you can check out the feature published in the latest issue ofÂ Recycling InternationalÂ magazine below. In this article, we share insights about both our past and our future, as well as our views on the direction our industry is heading. Enjoy your reading!\n\n#Recycling #RecyclingInnovation #RecyclingInternational #ScrapMetal #ScrapRecycling #MetalRecycling #RecyclingMachinery #RecyclingEquipments #MaterialHandler #ScrapBaler #ScrapShear #MetalBaler #Ferrous #NonFerrous #BirimMakina #BirimRecycling #Hurda #HurdaMetal #GeriDonusum #Pres #HurdaPresi #HurdaMakasÄ±\n\nChristian Schlump , Barbara Belletti , Alan Donaldson , Haider Hirani , Andrew Vargo , Aykut Karahan , Murat AkkuÅŸ",
        "likes": "70",
        "comments": "1",
        "shares": "2",
        "time": {
          "raw": "3h",
          "parsed": "01.05.2025",
          "isoString": "2025-05-01T04:38:54.548Z"
        },
        "mediaType": "document",
        "mediaContent": {
          "title": "Recycling International May/June ",
          "subtitle": "5 sayfa",
          "totalPages": 5,
          "coverPages": [
            {
              "type": "image",
              "config": {
                "src": "https://media.licdn.com/dms/image/v2/D4D1FAQFNJ0JMf7snXw/feedshare-document-cover-images_480/B4DZaBlZgeGgBk-/0/1745930792747?e=1748494800&v=beta&t=qlU2zXGzofgXx2TAz7Tjl0KAJa8v1uLfZA4iGQMSm50"
              }
            },
            {
              "type": "image",
              "config": {
                "src": "https://media.licdn.com/dms/image/v2/D4D1FAQFNJ0JMf7snXw/feedshare-document-cover-images_480/B4DZaBlZgeGgBk-/1/1745930792747?e=1748494800&v=beta&t=Gh79W3St14Zi4AKyYBrjZLclpivEfWXCzDtAlweK5_o"
              }
            },
            {
              "type": "image",
              "config": {
                "src": "https://media.licdn.com/dms/image/v2/D4D1FAQFNJ0JMf7snXw/feedshare-document-cover-images_480/B4DZaBlZgeGgBk-/2/1745930792747?e=1748494800&v=beta&t=l5S0au87dDNAhBIbITB1NPMDgpnbdUDlXErD2Cb1Ujg"
              }
            }
          ]
        },
        "date": "2025-05-01T04:38:54.548Z"
      },
      {
        "captions": "We are closely following the insights shared at the SteelOrbis Spring 2025 Conference & 92nd IREPAS Meeting in Athens. ğŸ“ˆ\n\nDiscussions about export workflows, raw-material supply, and emerging quality standards directly influence the R&D of our high-efficiency scrap-processing equipment. We look forward to the summary from the conference and to meeting you at future events.\n\n---\n\nAtinaâ€™daki SteelOrbis Spring 2025 KonferansÄ± & 92. IREPAS ToplantÄ±sÄ±nda paylaÅŸÄ±lan Ã¶ngÃ¶rÃ¼leri yakÄ±ndan takip ediyoruz. ğŸ“ˆ\n\nÄ°hracat sÃ¼reÃ§leri, hammadde tedariÄŸi ve yeni kalite standartlarÄ±na dair tartÄ±ÅŸmalar, yÃ¼ksek verimli hurda iÅŸleme ekipmanlarÄ±mÄ±zÄ±n Ar-Geâ€™sine doÄŸrudan yÃ¶n veriyor. Konferans sonu Ã¶zetlerini sabÄ±rsÄ±zlÄ±kla bekliyor, bir sonraki etkinliklerde sizlerle buluÅŸmayÄ± diliyoruz.\n\n#92irepas #SteelOrbis #IREPAS #Athens #SteelIndustry Â  We are closely following the insights shared at the SteelOrbis Spring 2025 Conference & 92nd IREPAS Meeting in Athens. ğŸ“ˆ\n\nDiscussions about export workflows, raw-material supply, and emerging quality standards directly influence the R&D of our high-efficiency scrap-processing equipment. We look forward to the summary from the conference and to meeting you at future events.\n\n---\n\nAtinaâ€™daki SteelOrbis Spring 2025 KonferansÄ± & 92. IREPAS ToplantÄ±sÄ±nda paylaÅŸÄ±lan Ã¶ngÃ¶rÃ¼leri yakÄ±ndan takip ediyoruz. ğŸ“ˆ\n\nÄ°hracat sÃ¼reÃ§leri, hammadde tedariÄŸi ve yeni kalite standartlarÄ±na dair tartÄ±ÅŸmalar, yÃ¼ksek verimli hurda iÅŸleme ekipmanlarÄ±mÄ±zÄ±n Ar-Geâ€™sine doÄŸrudan yÃ¶n veriyor. Konferans sonu Ã¶zetlerini sabÄ±rsÄ±zlÄ±kla bekliyor, bir sonraki etkinliklerde sizlerle buluÅŸmayÄ± diliyoruz.\n\n#92irepas #SteelOrbis #IREPAS #Athens #SteelIndustry",
        "likes": "38",
        "time": {
          "raw": "3h",
          "parsed": "01.05.2025",
          "isoString": "2025-05-01T04:38:54.550Z"
        },
        "mediaType": "image",
        "mediaContent": [
          "https://media.licdn.com/dms/image/v2/D4D22AQHdCN6u34bdnA/feedshare-shrink_800/B4DZZ8LkVvHIAo-/0/1745840137208?e=1750896000&v=beta&t=UPOMTXrdCCPGKe7y7t-NP0P6wMXt_TThOeekBG21Ej0"
        ],
        "date": "2025-05-01T04:38:54.550Z"
      },
      {
        "captions": "There is a saying \"Two heads are better than one\", that is 2 Fanuc welding robots working together on a piece for us. Half welding time on the same piece.\n\nBir elin nesi var iki elin sesi var. AtalarÄ±mÄ±zÄ±n Ã¶ÄŸÃ¼dÃ¼nÃ¼ tuttuk ve 2 adet Fanuc Kaynak robotumuzla tek bir parÃ§ayÄ± yarÄ± sÃ¼rede kaynatÄ±yoruz.\n\n#Recycling #RecyclingInnovation #RecyclingInternational #ScrapMetal \n#ScrapRecycling #MetalRecycling #RecyclingMachinery #RecyclingEquipment #MaterialHandler #ScrapBaler #ScrapShear #MetalBaler #Ferrous #NonFerrous #BirimMakina #BirimRecycling \n#Hurda #HurdaMetal #GeriDonusum #Pres #HurdaPresi #HurdaMakasÄ±\n#welding #weldingrobot #Fanuc #kaynak #kaynakrobotu",
        "likes": "66",
        "comments": "2",
        "shares": "2",
        "time": {
          "raw": "2h",
          "parsed": "08.05.2025",
          "isoString": "2025-05-08T04:38:54.544Z"
        },
        "mediaType": "video",
        "mediaContent": {
          "src": [
            {
              "src": "https://dms.licdn.com/playlist/vid/v2/D4D05AQGQlzkLQLIBGw/mp4-640p-30fp-crf28/B4DZalLkhkHwBM-/0/1746528018823?e=1748494800&v=beta&t=kXoy8koL0Izh9RZFyFDhYWUvykLH3Kf6Gj1wWfta_iU",
              "type": "video/mp4",
              "data-bitrate": 797035
            },
            {
              "src": "https://dms.licdn.com/playlist/vid/v2/D4D05AQGQlzkLQLIBGw/mp4-720p-30fp-crf28/B4DZalLkhkHwBQ-/0/1746528019293?e=1748494800&v=beta&t=TYItGVMOtC3NepQUtlV2zAqVOZAnSZBxMDMI5RR_FeY",
              "type": "video/mp4",
              "data-bitrate": 1108818
            }
          ],
          "posterUrl": "https://media.licdn.com/dms/image/v2/D4D05AQGQlzkLQLIBGw/videocover-low/B4DZalLkhkHwCA-/0/1746528011772?e=1748494800&v=beta&t=sFjypk2g6AuVcFg1CgqE0Jc0gZSntqv4j7SPMCqDwZ4"
        },
        "date": "2025-05-08T04:38:54.544Z"
      },
      {
        "captions": "Weâ€™re all set for the exhibition â€” come and say hello at stand 1202!\n\n#ReMA2025 #BirimMakina #HawkRecyclingEquipment #RecyclingIndustry #SanDiego #ReMA2025Exhibitor #Recycling #RecyclingInnovation #RecyclingInternational #ScrapMetalÂ \n#ScrapRecycling #MetalRecycling #RecyclingMachinery #RecyclingEquipment #MaterialHandler #ScrapBaler #ScrapShear #MetalBaler #Ferrous #NonFerrous #BirimMakina #BirimRecyclingÂ \n#Hurda #HurdaMetal #GeriDonusum #Pres #HurdaPresi #HurdaMakasÄ±\n\nAndrew Vargo ,  Hawk Recycling Equipment , Aykut Karahan , Murat AkkuÅŸ \nWeâ€™re all set for the exhibition â€” come and say hello at stand 1202!\n\n#ReMA2025 #BirimMakina #HawkRecyclingEquipment #RecyclingIndustry #SanDiego #ReMA2025Exhibitor #Recycling #RecyclingInnovation #RecyclingInternational #ScrapMetalÂ \n#ScrapRecycling #MetalRecycling #RecyclingMachinery #RecyclingEquipment #MaterialHandler #ScrapBaler #ScrapShear #MetalBaler #Ferrous #NonFerrous #BirimMakina #BirimRecyclingÂ \n#Hurda #HurdaMetal #GeriDonusum #Pres #HurdaPresi #HurdaMakasÄ±\n\nAndrew Vargo ,  Hawk Recycling Equipment , Aykut Karahan , Murat AkkuÅŸ",
        "likes": "39",
        "comments": "1",
        "shares": "4",
        "time": {
          "raw": "1h",
          "parsed": "15.05.2025",
          "isoString": "2025-05-15T04:38:54.534Z"
        },
        "mediaType": "image",
        "mediaContent": [
          "https://media.licdn.com/dms/image/v2/D4D22AQEFT5QEeBryLQ/feedshare-shrink_800/B4DZbErfzGG4Ag-/0/1747056462174?e=1750896000&v=beta&t=stCbj0bkDYGl62JoqQIqkQDfw-2lkXVZgz6faCGs7As"
        ],
        "date": "2025-05-15T04:38:54.534Z"
      },
      {
        "captions": "DÃ¼n,  KESÄ°AD YÃ¶netim Kurulu BaÅŸkanÄ± Sn. Yesim Isikli ve beraberindeki heyet Teknik gezi kapsamÄ±nda Ã¼retim tesisimizi ziyaret etti.\n\nÃœretim hattÄ±mÄ±zÄ± birlikte gezerek yÃ¼ksek verimlilik odaklÄ± sÃ¼reÃ§lerimizi ve yeni teknolojik yatÄ±rÄ±mlarÄ±mÄ±zÄ± paylaÅŸtÄ±k. Ziyaretin ardÄ±ndan dÃ¼zenlediÄŸimiz samimi Ã¶ÄŸle yemeÄŸinde Birim Makinaâ€™yÄ± tanÄ±tan sunumumuzu sunduk; akabinde KemalpaÅŸa sanayi ekosisteminin sÃ¼rdÃ¼rÃ¼lebilir bÃ¼yÃ¼me potansiyeli Ã¼zerine keyifli bir sohbet gerÃ§ekleÅŸtirdik.\n\nNazik ziyaretleri iÃ§in Sn. Yesim Isikli â€™ya ve KESÄ°AD ailesine teÅŸekkÃ¼r eder, bÃ¶lge sanayisine deÄŸer katan iÅŸ birliklerimizin artarak devam etmesini dileriz.\n\n#kesiad #Ã¼retenkemalpaÅŸa #bÃ¼yÃ¼yenekonomi #KemalpaÅŸa #SanayiDÃ¼n,  KESÄ°AD YÃ¶netim Kurulu BaÅŸkanÄ± Sn. Yesim Isikli ve beraberindeki heyet Teknik gezi kapsamÄ±nda Ã¼retim tesisimizi ziyaret etti.\n\nÃœretim hattÄ±mÄ±zÄ± birlikte gezerek yÃ¼ksek verimlilik odaklÄ± sÃ¼reÃ§lerimizi ve yeni teknolojik yatÄ±rÄ±mlarÄ±mÄ±zÄ± paylaÅŸtÄ±k. Ziyaretin ardÄ±ndan dÃ¼zenlediÄŸimiz samimi Ã¶ÄŸle yemeÄŸinde Birim Makinaâ€™yÄ± tanÄ±tan sunumumuzu sunduk; akabinde KemalpaÅŸa sanayi ekosisteminin sÃ¼rdÃ¼rÃ¼lebilir bÃ¼yÃ¼me potansiyeli Ã¼zerine keyifli bir sohbet gerÃ§ekleÅŸtirdik.\n\nNazik ziyaretleri iÃ§in Sn. Yesim Isikli â€™ya ve KESÄ°AD ailesine teÅŸekkÃ¼r eder, bÃ¶lge sanayisine deÄŸer katan iÅŸ birliklerimizin artarak devam etmesini dileriz.\n\n#kesiad #Ã¼retenkemalpaÅŸa #bÃ¼yÃ¼yenekonomi #KemalpaÅŸa #Sanayi",
        "likes": "98",
        "comments": "2",
        "shares": "2",
        "time": {
          "raw": "1h",
          "parsed": "15.05.2025",
          "isoString": "2025-05-15T04:38:54.536Z"
        },
        "mediaType": "image",
        "mediaContent": [
          "https://media.licdn.com/dms/image/v2/D4D22AQHCCRt3Kjc8XA/feedshare-shrink_800/B4DZa04e_eGwAg-/0/1746791440485?e=1750896000&v=beta&t=MQC8mSvdpqWlNitpUcQzqlI2GoZEnfiT4zqsOzj3x3I",
          "https://media.licdn.com/dms/image/v2/D4D22AQF5gn1YQWY3pw/feedshare-shrink_800/B4DZa04e_4G4Ag-/0/1746791443932?e=1750896000&v=beta&t=mCcUM95G3k15isPZlFqE_2Hth4qOVRkes3VlsyENWeo",
          "https://media.licdn.com/dms/image/v2/D4D22AQFeYeGqAyKqAQ/feedshare-shrink_800/B4DZa04e_hGYAg-/0/1746791443576?e=1750896000&v=beta&t=gDxq2NIwEXuPKM2y9zSdBWFZnrlJ8i6-cS89bxMr1FE",
          "https://media.licdn.com/dms/image/v2/D4D22AQGlofH8pQiIjw/feedshare-shrink_800/B4DZa04e_oGwAo-/0/1746791443721?e=1750896000&v=beta&t=yvakMwfEfNdCvcV8Q1ZOiZaEkZhEhd80n1zBQGQh5Z8",
          "https://media.licdn.com/dms/image/v2/D4D22AQHdzBQVLG36AQ/feedshare-shrink_800/B4DZa04e_LG4Ag-/0/1746791443216?e=1750896000&v=beta&t=g0nZDLlHcl4GwVRRGIMqeCR3MIbe4H5bnNKMVAvE9VY"
        ],
        "date": "2025-05-15T04:38:54.536Z"
      },
      {
        "captions": "19 MayÄ±s AtatÃ¼rkâ€™Ã¼ Anma, GenÃ§lik ve Spor BayramÄ±â€™mÄ±z kutlu olsun!19 MayÄ±s AtatÃ¼rkâ€™Ã¼ Anma, GenÃ§lik ve Spor BayramÄ±â€™mÄ±z kutlu olsun!",
        "likes": "11",
        "time": {
          "raw": "2g",
          "parsed": "20.05.2025",
          "isoString": "2025-05-20T04:38:54.524Z"
        },
        "mediaType": "image",
        "mediaContent": [
          "https://media.licdn.com/dms/image/v2/D4D22AQENeP5PKReHxA/feedshare-shrink_800/B4DZboJmOcGwAk-/0/1747651557411?e=1750896000&v=beta&t=vJJ-_Q5-DaO9aXWgGcRGyDbXXNlxXN1z_pCh34YtwF4"
        ],
        "date": "2025-05-20T04:38:54.524Z"
      },
      {
        "captions": "Visit us at stand 1202!\n\n#ReMA2025 #BirimMakina #HawkRecyclingEquipment #RecyclingIndustry #SanDiego #ReMA2025Exhibitor #Recycling #RecyclingInnovation #RecyclingInternational #ScrapMetalÂ \n#ScrapRecycling #MetalRecycling #RecyclingMachinery #RecyclingEquipment #MaterialHandler #ScrapBaler #ScrapShear #MetalBaler #Ferrous #NonFerrous #BirimMakina #BirimRecyclingÂ \n#Hurda #HurdaMetal #GeriDonusum #Pres #HurdaPresi #HurdaMakasÄ±Visit us at stand 1202!\n\n#ReMA2025 #BirimMakina #HawkRecyclingEquipment #RecyclingIndustry #SanDiego #ReMA2025Exhibitor #Recycling #RecyclingInnovation #RecyclingInternational #ScrapMetalÂ \n#ScrapRecycling #MetalRecycling #RecyclingMachinery #RecyclingEquipment #MaterialHandler #ScrapBaler #ScrapShear #MetalBaler #Ferrous #NonFerrous #BirimMakina #BirimRecyclingÂ \n#Hurda #HurdaMetal #GeriDonusum #Pres #HurdaPresi #HurdaMakasÄ±",
        "likes": "17",
        "time": {
          "raw": "1h",
          "parsed": "15.05.2025",
          "isoString": "2025-05-15T04:38:54.529Z"
        },
        "mediaType": "image",
        "mediaContent": [
          "https://media.licdn.com/dms/image/v2/D4D22AQFKxJqjJQq6bg/feedshare-shrink_800/B4DZbPXzEzIAAk-/0/1747235846721?e=1750896000&v=beta&t=5UvLggsrN0A99soRXtmoNy5ywTBMCP8z3lH84JnSIiQ"
        ],
        "date": "2025-05-15T04:38:54.529Z"
      }
    ]
  },
  {
    "name": "JainHydraulics",
    "followerData": [
      [
        20250225,
        9
      ],
      [
        20250225,
        9
      ],
      [
        20250225,
        9
      ],
      [
        20250228,
        9
      ],
      [
        20250228,
        9
      ],
      [
        20250228,
        9
      ],
      [
        20250228,
        9
      ],
      [
        20250303,
        9
      ],
      [
        1741011387760,
        "9"
      ],
      [
        1741076417822,
        "9"
      ],
      [
        1741077567906,
        "9"
      ],
      [
        1741083484464,
        "9"
      ],
      [
        1741083494572,
        "9"
      ],
      [
        1741083503837,
        "9"
      ],
      [
        1741083535509,
        "9"
      ],
      [
        1741084548990,
        "9"
      ],
      [
        1741170314330,
        9
      ],
      [
        1741755723096,
        12
      ],
      [
        1741848633984,
        12
      ],
      [
        1742187810360,
        12
      ],
      [
        1742966418440,
        12
      ],
      [
        1744004281644,
        13
      ],
      [
        1744605847814,
        13
      ],
      [
        1745214529461,
        14
      ],
      [
        1745472078746,
        14
      ],
      [
        1745816250070,
        15
      ],
      [
        1746164200962,
        15
      ],
      [
        1746618721154,
        15
      ],
      [
        1747116529640,
        15
      ],
      [
        1747888743856,
        15
      ]
    ],
    "data": []
  },
  {
    "name": "DanieliGroup",
    "followerData": [
      [
        20250225,
        2807
      ],
      [
        20250225,
        2807
      ],
      [
        20250225,
        2807
      ],
      [
        20250228,
        2810
      ],
      [
        20250228,
        2810
      ],
      [
        20250228,
        2810
      ],
      [
        20250228,
        2810
      ],
      [
        20250303,
        2817
      ],
      [
        1741011402822,
        "2.821"
      ],
      [
        1741076431526,
        "2.823"
      ],
      [
        1741077580717,
        "2.823"
      ],
      [
        1741083548578,
        "2.823"
      ],
      [
        1741084561439,
        "2.823"
      ],
      [
        1741170326752,
        2825
      ],
      [
        1741755734753,
        2832
      ],
      [
        1741848647463,
        2833
      ],
      [
        1742187822808,
        2833
      ],
      [
        1742966430613,
        2836
      ],
      [
        1744004295803,
        2838
      ],
      [
        1744605862430,
        2847
      ],
      [
        1745214542663,
        2849
      ],
      [
        1745472091501,
        2849
      ],
      [
        1745816263764,
        2851
      ],
      [
        1746164215822,
        2856
      ],
      [
        1746618734720,
        2860
      ],
      [
        1747116542508,
        2860
      ],
      [
        1747888756175,
        2860
      ]
    ],
    "data": [
      {
        "captions": "MRAI Expo in Jaipur, marks our first event of 2025, and we couldnâ€™t be more excited!â˜€\n\nğŸƒ Visit our stand to explore the best #Danieli solutions to take your business to the next level in the green and circular economy sectors.\n\n \nğŸ” Find us at Booth 1309 \nğŸ“… From January 28th to 30th\nğŸ“ Novotel Jaipur Convention Center, Jaipur, India \nÂ \nğŸŒ Want to know where to find Danieli next? \nCheck out our website for updates on all future events ğŸ‘‰ https://lnkd.in/dh8zMFDM\n\nMaterial Recycling Association of India MRAI Expo in Jaipur, marks our first event of 2025, and we couldnâ€™t be more excited!â˜€\n\nğŸƒ Visit our stand to explore the best #Danieli solutions to take your business to the next level in the green and circular economy sectors.\n\n \nğŸ” Find us at Booth 1309 \nğŸ“… From January 28th to 30th\nğŸ“ Novotel Jaipur Convention Center, Jaipur, India \nÂ \nğŸŒ Want to know where to find Danieli next? \nCheck out our website for updates on all future events ğŸ‘‰ https://lnkd.in/dh8zMFDM\n\nMaterial Recycling Association of India",
        "likes": "16",
        "shares": "6",
        "time": {
          "raw": "4ay",
          "parsed": "22.01.2025",
          "isoString": "2025-01-22T04:39:15.913Z"
        },
        "mediaType": "image",
        "mediaContent": [
          "https://media.licdn.com/dms/image/v2/D4D22AQGuftsVUXhQ2A/feedshare-shrink_800/B4DZRkpAZgHEAg-/0/1736855259103?e=1750896000&v=beta&t=WFEBKXtkr0tmBiG1pKxaV5dvMYX9Lyk4OI8k1JzbblA"
        ],
        "date": "2025-01-22T04:39:15.913Z"
      },
      {
        "captions": "Dun dun duuun! The DaNews #DIM Special Issue is here and looking dapper â­Â Â \nDive into the Fifth Danieli Innovaction Meeting with an in-depth focus on:Â \nğŸ¯ Industry-expert panelsÂ \nâš™ Dedicated #green technology sessionsÂ \nâœˆ Global plant toursÂ \nğŸ§­ A journey through #Danieliâ€™s history and our beautiful region \n\nAnd more!\nÂ Â \nGrab your definitive digital #DaNews copy here â¡Â https://lnkd.in/g4D6dyc",
        "likes": "280",
        "shares": "17",
        "time": {
          "raw": "6ay",
          "parsed": "22.11.2024",
          "isoString": "2024-11-22T04:39:15.915Z"
        },
        "mediaType": "video",
        "mediaContent": {
          "src": [
            {
              "src": "https://dms.licdn.com/playlist/vid/v2/D4E05AQECihFi870umQ/mp4-640p-30fp-crf28/mp4-640p-30fp-crf28/0/1731428429183?e=1748494800&v=beta&t=TNyn5eaXQbtYxmx1UrlE8JS9uuAql_oMYpiddoXDPRo",
              "type": "video/mp4",
              "data-bitrate": 455926
            },
            {
              "src": "https://dms.licdn.com/playlist/vid/v2/D4E05AQECihFi870umQ/mp4-720p-30fp-crf28/mp4-720p-30fp-crf28/0/1731428430976?e=1748494800&v=beta&t=oEzhqQ5x10im6I-uUaoVYxXPHd5hjhytWysSP0MF7B4",
              "type": "video/mp4",
              "data-bitrate": 619108
            }
          ],
          "posterUrl": "https://media.licdn.com/dms/image/v2/D4E05AQECihFi870umQ/feedshare-thumbnail_720_1280/feedshare-thumbnail_720_1280/0/1731428409767?e=1748494800&v=beta&t=3zGBiv8VvkrYc46jnibT8cmStwz5C9o_tzt4bCOHwHI"
        },
        "date": "2024-11-22T04:39:15.915Z"
      },
      {
        "captions": "Everything is ready for Ecomondo, and we will be there too! â˜€\nğŸƒ Visit our stand to explore the best #Danieli solutions to take your business to the next level in the green and circular economy sectors.\nECOMONDO - ITALIAN EXHIBITION GROUP\n \nğŸ” Find us at Booth A3/109-111 \nğŸ“… From November 5th to 8th\nğŸ“ At Rimini Expo Centre, Rimini, Italy \nÂ \nğŸŒ Want to know where to find Danieli next? \nCheck out our website for updates on all future events ğŸ‘‰ https://lnkd.in/dh8zMFDMEverything is ready for Ecomondo, and we will be there too! â˜€\nğŸƒ Visit our stand to explore the best #Danieli solutions to take your business to the next level in the green and circular economy sectors.\nECOMONDO - ITALIAN EXHIBITION GROUP\n \nğŸ” Find us at Booth A3/109-111 \nğŸ“… From November 5th to 8th\nğŸ“ At Rimini Expo Centre, Rimini, Italy \nÂ \nğŸŒ Want to know where to find Danieli next? \nCheck out our website for updates on all future events ğŸ‘‰ https://lnkd.in/dh8zMFDM",
        "likes": "17",
        "comments": "1",
        "shares": "4",
        "time": {
          "raw": "6ay",
          "parsed": "22.11.2024",
          "isoString": "2024-11-22T04:39:15.916Z"
        },
        "mediaType": "image",
        "mediaContent": [
          "https://media.licdn.com/dms/image/v2/D4D22AQH2O1Y23a-X1g/feedshare-shrink_800/feedshare-shrink_800/0/1730360484228?e=1750896000&v=beta&t=DKoyelfokwbt8gr1K0rNvnzhDCnUepfMeXigLVp_dFM"
        ],
        "date": "2024-11-22T04:39:15.916Z"
      },
      {
        "captions": "BIR World Recycling Convention is coming, and we'll not miss the event! â˜€\nâ™» #Danieli is ready to make its mark with innovative solutions for the sustainable economic development: visit our stand to take your business to the next level.\n \nğŸ” Find us at Booth B02 \nğŸ“… From October 28th to 29th \nğŸ“ At Raffles City Convention Centre, Singapore \nÂ \nğŸŒ Want to know where to find Danieli next? \nCheck out our website for updates on all future events ğŸ‘‰ https://lnkd.in/dh8zMFDM\nBureau of International RecyclingBIR World Recycling Convention is coming, and we'll not miss the event! â˜€\nâ™» #Danieli is ready to make its mark with innovative solutions for the sustainable economic development: visit our stand to take your business to the next level.\n \nğŸ” Find us at Booth B02 \nğŸ“… From October 28th to 29th \nğŸ“ At Raffles City Convention Centre, Singapore \nÂ \nğŸŒ Want to know where to find Danieli next? \nCheck out our website for updates on all future events ğŸ‘‰ https://lnkd.in/dh8zMFDM\nBureau of International Recycling",
        "likes": "25",
        "shares": "2",
        "time": {
          "raw": "6ay",
          "parsed": "22.11.2024",
          "isoString": "2024-11-22T04:39:15.918Z"
        },
        "mediaType": "image",
        "mediaContent": [
          "https://media.licdn.com/dms/image/v2/D4D22AQHstak22oLumQ/feedshare-shrink_800/feedshare-shrink_800/0/1729860335368?e=1750896000&v=beta&t=yy5e7p5xLsPBml2ArCNPQN110zrkM1ufJ22wqWVZX7U"
        ],
        "date": "2024-11-22T04:39:15.918Z"
      },
      {
        "captions": "It's our honor to announce Danieli Group as an exhibitor at FABEX Saudi Arabia 2024 \n\nRegister Now to visit and get your free ticket at: https://lnkd.in/ds5N22zB \n\nğŸ“…Dates: 13-16 OCTOBER 2024\nğŸ“Venue: Riyadh International Convention & Exhibition Centre (Halls 1,2,3,4,5)\nğŸŒWebsite: https://www.fabxsaudi.com/\nğŸ“§Email: riyadh@arabiangerman.com\n\n#FABEX #FABEXKSA #MACH #Metal_and_Steel #FABEX_SaudiArabia #SaudiArabia #riyadh #MetalIndustry #SteelFabrication #Machinery #Steel #Machinery #Metal #CNC #Welding #Cutting #automationIt's our honor to announce Danieli Group as an exhibitor at FABEX Saudi Arabia 2024 \n\nRegister Now to visit and get your free ticket at: https://lnkd.in/ds5N22zB \n\nğŸ“…Dates: 13-16 OCTOBER 2024\nğŸ“Venue: Riyadh International Convention & Exhibition Centre (Halls 1,2,3,4,5)\nğŸŒWebsite: https://www.fabxsaudi.com/\nğŸ“§Email: riyadh@arabiangerman.com\n\n#FABEX #FABEXKSA #MACH #Metal_and_Steel #FABEX_SaudiArabia #SaudiArabia #riyadh #MetalIndustry #SteelFabrication #Machinery #Steel #Machinery #Metal #CNC #Welding #Cutting #automation",
        "likes": "12",
        "shares": "4",
        "time": {
          "raw": "9ay",
          "parsed": "22.08.2024",
          "isoString": "2024-08-22T04:39:15.919Z"
        },
        "mediaType": "image",
        "mediaContent": [
          "https://media.licdn.com/dms/image/v2/D4D22AQFwcCRJNjjIBw/feedshare-shrink_800/feedshare-shrink_800/0/1723727332470?e=1750896000&v=beta&t=mTSAMF7EShMM1_n4lUBZLMbLE20_ys3V0Xr-Zu15TkI"
        ],
        "date": "2024-08-22T04:39:15.919Z"
      },
      {
        "captions": "It's time for Scrap Expo, and we'll be there! â˜€\n\nâ­ Discover the latest trends, network with industry leaders, and explore the best #Danieli solutions to take your business to the next level. \nğŸ” Find us at Booth 420 \nğŸ“… From September 17 to 18 \nğŸ“ At Kentucky Exposition Center, Louisville, USA \nğŸŒ Want to know where to find Danieli next? \nCheck out our website for updates on all future events ğŸ‘‰ https://lnkd.in/dh8zMFDMIt's time for Scrap Expo, and we'll be there! â˜€\n\nâ­ Discover the latest trends, network with industry leaders, and explore the best #Danieli solutions to take your business to the next level. \nğŸ” Find us at Booth 420 \nğŸ“… From September 17 to 18 \nğŸ“ At Kentucky Exposition Center, Louisville, USA \nğŸŒ Want to know where to find Danieli next? \nCheck out our website for updates on all future events ğŸ‘‰ https://lnkd.in/dh8zMFDM",
        "likes": "16",
        "shares": "9",
        "time": {
          "raw": "8ay",
          "parsed": "22.09.2024",
          "isoString": "2024-09-22T04:39:15.921Z"
        },
        "mediaType": "image",
        "mediaContent": [
          "https://media.licdn.com/dms/image/v2/D4D22AQGnBxCWO-UPlw/feedshare-shrink_800/feedshare-shrink_800/0/1726568048923?e=1750896000&v=beta&t=JASSS2eBHruf6Ih8WyOs23IGhK8dkwdlHP2g7ikH_-Y"
        ],
        "date": "2024-09-22T04:39:15.921Z"
      },
      {
        "captions": "ğŸ”” Danieli Centro Recycling will be present at IFAT Munich 2024!\nÂ \nJoin us\nğŸ“… From May 13 to 17\nğŸ“ Hall B4, Booth 415 \nÂ \nğŸ’¼ Looking for global opportunities? Check out our website: https://lnkd.in/ez2Fvdt8The leading trade fair for environmental technologies is back! â™»Â Â \nğŸ’¡ IFAT worldwide starts next week and Danieli is ready to be a part of it. Are you? Â Â \nğŸ” Find us at Hall B4, Booth 415 Â \nğŸ“… From May 13 to 17Â \nğŸ“ At Messe MÃ¼nchen, GermanyÂ Â \nğŸŒ Want to know where to find Danieli next? Â \nCheck out our website for updates on all future events ğŸ‘‰ https://lnkd.in/dh8zMFDM",
        "likes": "21",
        "shares": "3",
        "time": {
          "raw": "12ay12ay",
          "parsed": "07.05.2025",
          "isoString": "2025-05-07T11:52:14.239Z"
        },
        "mediaType": "video",
        "mediaContent": {
          "src": [
            {
              "src": "https://dms.licdn.com/playlist/vid/v2/D4E05AQEmFCbkTAT7VQ/mp4-640p-30fp-crf28/mp4-640p-30fp-crf28/0/1715172375594?e=1747224000&v=beta&t=wU7upIWPWI6x3bT1Nh3bPsb8sYDWHoyT8AazhodWOro",
              "type": "video/mp4",
              "data-bitrate": 55193
            },
            {
              "src": "https://dms.licdn.com/playlist/vid/v2/D4E05AQEmFCbkTAT7VQ/mp4-720p-30fp-crf28/mp4-720p-30fp-crf28/0/1715172375508?e=1747224000&v=beta&t=J27B7vfH8etRkWvl1pQxO1bkQ64pqS79sMSjnN2ULec",
              "type": "video/mp4",
              "data-bitrate": 66819
            }
          ],
          "posterUrl": "https://media.licdn.com/dms/image/v2/D4E05AQEmFCbkTAT7VQ/feedshare-thumbnail_720_1280/feedshare-thumbnail_720_1280/0/1715172365655?e=1747224000&v=beta&t=2Q_qPDyAk3zuHIzk63ZLaYopfj2tBQz4y38Eo8Kwfvs"
        },
        "date": "2025-05-07T11:52:14.239Z"
      },
      {
        "captions": "The leading trade fair for environmental technologies is back! â™»Â Â \nğŸ’¡ IFAT worldwide starts next week and Danieli is ready to be a part of it. Are you? Â Â \nğŸ” Find us at Hall B4, Booth 415 Â \nğŸ“… From May 13 to 17Â \nğŸ“ At Messe MÃ¼nchen, GermanyÂ Â \nğŸŒ Want to know where to find Danieli next? Â \nCheck out our website for updates on all future events ğŸ‘‰ https://lnkd.in/dh8zMFDM",
        "time": {
          "raw": "12ay",
          "parsed": "07.05.2024",
          "isoString": "2024-05-07T11:52:14.240Z"
        },
        "mediaType": "video",
        "mediaContent": {
          "src": [
            {
              "src": "https://dms.licdn.com/playlist/vid/v2/D4E05AQEmFCbkTAT7VQ/mp4-640p-30fp-crf28/mp4-640p-30fp-crf28/0/1715172375594?e=1747224000&v=beta&t=wU7upIWPWI6x3bT1Nh3bPsb8sYDWHoyT8AazhodWOro",
              "type": "video/mp4",
              "data-bitrate": 55193
            },
            {
              "src": "https://dms.licdn.com/playlist/vid/v2/D4E05AQEmFCbkTAT7VQ/mp4-720p-30fp-crf28/mp4-720p-30fp-crf28/0/1715172375508?e=1747224000&v=beta&t=J27B7vfH8etRkWvl1pQxO1bkQ64pqS79sMSjnN2ULec",
              "type": "video/mp4",
              "data-bitrate": 66819
            }
          ],
          "posterUrl": "https://media.licdn.com/dms/image/v2/D4E05AQEmFCbkTAT7VQ/feedshare-thumbnail_720_1280/feedshare-thumbnail_720_1280/0/1715172365655?e=1747224000&v=beta&t=2Q_qPDyAk3zuHIzk63ZLaYopfj2tBQz4y38Eo8Kwfvs"
        },
        "date": "2024-05-07T11:52:14.240Z"
      },
      {
        "captions": "Join us in sunny San Diego for the worldâ€™s largest event in recycled materials! ğŸŒÂ Â \nâ™»ï¸ We're excited to return to #ReMA2025, where we'll be diving into #scrap, #recycling, and all things #sustainable.Â Â \nğŸ” Find us at Booth 523Â \nğŸ“… May 12â€“15Â \nğŸ“ San Diego Convention Center, USAÂ Â \nThank you for having us Recycled Materials Association (ReMA)!Â \nğŸŒ Want to know where #Danieli is headed next? Â \nVisit our website for the latest event updates ğŸ‘‰ https://lnkd.in/d3x5fjsF Â Join us in sunny San Diego for the worldâ€™s largest event in recycled materials! ğŸŒÂ Â \nâ™»ï¸ We're excited to return to #ReMA2025, where we'll be diving into #scrap, #recycling, and all things #sustainable.Â Â \nğŸ” Find us at Booth 523Â \nğŸ“… May 12â€“15Â \nğŸ“ San Diego Convention Center, USAÂ Â \nThank you for having us Recycled Materials Association (ReMA)!Â \nğŸŒ Want to know where #Danieli is headed next? Â \nVisit our website for the latest event updates ğŸ‘‰ https://lnkd.in/d3x5fjsF",
        "likes": "104",
        "shares": "8",
        "time": {
          "raw": "2h",
          "parsed": "08.05.2025",
          "isoString": "2025-05-08T04:39:15.912Z"
        },
        "mediaType": "image",
        "mediaContent": [
          "https://media.licdn.com/dms/image/v2/D4E22AQHAFZV5zu-XRQ/feedshare-shrink_800/B4EZaqQH4VHoAg-/0/1746613077082?e=1750896000&v=beta&t=FEHr8A8sZMpza3lTY7Sf7IADVNCE-oaVXhU75-_ICNU"
        ],
        "date": "2025-05-08T04:39:15.912Z"
      }
    ]
  },
  {
    "name": "LINDEMANNMetalRecycling",
    "followerData": [
      [
        20250225,
        3196
      ],
      [
        20250225,
        3196
      ],
      [
        20250225,
        3196
      ],
      [
        20250228,
        3211
      ],
      [
        20250228,
        3212
      ],
      [
        20250228,
        3212
      ],
      [
        20250228,
        3212
      ],
      [
        20250303,
        3219
      ],
      [
        1741011431485,
        "3.219"
      ],
      [
        1741076454330,
        "3.221"
      ],
      [
        1741077602778,
        "3.221"
      ],
      [
        1741083570831,
        "3.221"
      ],
      [
        1741084584137,
        "3.221"
      ],
      [
        1741170348851,
        3225
      ],
      [
        1741755756554,
        3256
      ],
      [
        1741848662962,
        3258
      ],
      [
        1742187837575,
        3271
      ],
      [
        1742966445991,
        3304
      ],
      [
        1744004313703,
        3369
      ],
      [
        1744605882386,
        3383
      ],
      [
        1745214558818,
        3393
      ],
      [
        1745472112968,
        3399
      ],
      [
        1745816279553,
        3423
      ],
      [
        1746164231421,
        3438
      ],
      [
        1746618760581,
        3452
      ],
      [
        1747116556837,
        3465
      ],
      [
        1747888774565,
        3488
      ]
    ],
    "data": [
      {
        "captions": "Customer Advisory Board \nDay 2 recap\n\nThe second and final day of LINDEMANNâ€™s Customer Advisory Board built on the momentum of an incredible first day, with deeper discussions, industry-leading insights, and an exclusive look at cutting-edge recycling technology in action. Steel industry expert Dr. Christian FrÃ¶hling from SMS took centre stage with a keynote exploring the role of electric arc furnaces, regulatory pressures, and the role recycled steel/scrap will play in the developing global demand for green steel.ğŸŒ±\n\nHis insights reinforced the industryâ€™s need for improved density and purity â€“ as well as innovation, collaboration and a strong commitment to decarbonization.\nAttendees then had the unique opportunity to tour S. Norton Groupâ€™s advanced recycling facility, featuring the worldâ€™s first LINDEMANN shredder with the revolutionary Variable Frequency Drive (VDA) technology, as well as Shredder Drive Assist (SDA). Seeing innovation in action capped off an event that was not just about discussion â€” but about real solutions and a better way forward for the industry.â™»ï¸\n\nFrom thought-provoking keynotes to hands-on experiences, LINDEMANNâ€™s Customer Advisory Board was a milestone moment for the industry. This event underscored the power of partnership in shaping a stronger, more sustainable future for metal recycling.\n\nğŸ¥ Watch the video to see the highlights from Day 2!\n\n#MetalRecycling #MetalRecyclingSolutions #RecycleForChange #RecycleResponsibly #GreenFuture #RecycleForABetterFuture #CleanerPlanet #CircularEconomy #CarbonReduction #TheCAB #Manchester #England #event #SNorton",
        "likes": "55",
        "shares": "6",
        "time": {
          "raw": "1ay",
          "parsed": "14.03.2025",
          "isoString": "2025-03-14T04:44:42.070Z"
        },
        "mediaType": "video",
        "mediaContent": {
          "src": [
            {
              "src": "https://dms.licdn.com/playlist/vid/v2/D4E05AQEd68lXDek8vQ/mp4-720p-30fp-crf28/B4EZVC2mnXHUBg-/0/1740583422686?e=1745211600&v=beta&t=eolRtzQKBdb0_0MflgZ_RPCB7FdA33KtpVnFh1ILTF4",
              "type": "video/mp4",
              "data-bitrate": 1015285
            },
            {
              "src": "https://dms.licdn.com/playlist/vid/v2/D4E05AQEd68lXDek8vQ/mp4-640p-30fp-crf28/B4EZVC2mnXHUBc-/0/1740583425014?e=1745211600&v=beta&t=ZFl2DT162cuw8evP6oNpMMB8sMGksmLsghhqoDAUOSM",
              "type": "video/mp4",
              "data-bitrate": 783529
            }
          ],
          "posterUrl": "https://media.licdn.com/dms/image/v2/D4E05AQEd68lXDek8vQ/videocover-low/B4EZVC2mnXHUCM-/0/1740583417229?e=1745211600&v=beta&t=esH9fZe2v13g0Gvzr4ar--ytyW1BUSVYvy4K6GWzeXo"
        },
        "date": "2025-03-14T04:44:42.070Z"
      },
      {
        "captions": "ğŸ”§ SPARE AND WEAR PARTS: THE LINDEMANN DIFFERENCE\n\nWhen it comes to keeping your recycling operation running smoothly, every component matters. As an OEM supplier, LINDEMANN provides spare and wear parts designed to fit your machines perfectly.\n\nFor decades, weâ€™ve paired the development of our innovative recycling plants with the creation of specifically adapted parts, ensuring durability, efficiency, and reliability from the ground up.\n\nOur original LINDEMANN parts are: \n\nâœ… Developed and tested in-house\n\nâœ… Designed with performance and cost-efficiency in mind\n\nâœ… Built to maximize machine availability and minimize maintenance\n\nWith extensive experience in design and field testing, we ensure every part contributes to seamless operations, helping you achieve optimal performance while reducing downtime.\n\nğŸ”— Ready to learn more? Explore the LINDEMANN advantage today:Â https://lnkd.in/e-t6EWwv\n\n#MetalRecycling #MetalRecyclingSolutions #RecycleForChange #RecycleResponsibly #GreenFuture #RecycleForABetterFuture #CleanerPlanet #CircularEconomy #CarbonReduction #GreenFutureÂ #OEMParts #Efficiency #Innovation",
        "likes": "35",
        "shares": "10",
        "time": {
          "raw": "1ay",
          "parsed": "14.03.2025",
          "isoString": "2025-03-14T04:44:42.071Z"
        },
        "mediaType": "document",
        "mediaContent": {
          "title": "Baler",
          "subtitle": "4 sayfa",
          "totalPages": 4,
          "coverPages": [
            {
              "type": "image",
              "config": {
                "src": "https://media.licdn.com/dms/image/v2/D561FAQFEKeBhP5VddA/feedshare-document-cover-images_480/B56ZTwhwkCGoBU-/0/1739202178952?e=1745211600&v=beta&t=zbHfUfZ95mL_CQJ2W6njjqtcRKGqzzX-rz47IfBOZdo"
              }
            },
            {
              "type": "image",
              "config": {
                "src": "https://media.licdn.com/dms/image/v2/D561FAQFEKeBhP5VddA/feedshare-document-cover-images_480/B56ZTwhwkCGoBU-/1/1739202178952?e=1745211600&v=beta&t=KuzO2705Zi19Ln7mSsklrnko8Rsj7cf1W1JGuttcNNg"
              }
            },
            {
              "type": "image",
              "config": {
                "src": "https://media.licdn.com/dms/image/v2/D561FAQFEKeBhP5VddA/feedshare-document-cover-images_480/B56ZTwhwkCGoBU-/2/1739202178952?e=1745211600&v=beta&t=ld7REnooF_O9wb-5jWfRlFrRPwAX994rM9j16Tk7zuM"
              }
            }
          ]
        },
        "date": "2025-03-14T04:44:42.071Z"
      },
      {
        "captions": "It was a pleasure to have you on board ğŸ˜I was honoured to be asked by Lindemann to be keynote speaker at their Customer Advisory Board meeting in Manchester. The meeting was attended by the CEOs and owners of leading metal recycling companies from across the globe. Attendees travelled from North America, France, Belgium, Holland, Germany, Spain, Sweden, Norway, Czech Republic and Denmark. We discussed the challenges facing the metal recycling industry and the solutions to overcome those challenges. To engage and interact with the decision makers at the top of their respective companies was extremely productive. The conclusion for our industry is that the outlook is extremely positive.\nOn a personal note the icing on the cake was winning the table tennis competition where I managed to take a point off professional German table tennis player Timo Boll former World Number 1, Olympic Silver Medalist, European and World Champion. Those years away at boarding school playing endless games of table tennis eventually paid off! \nA special thankyou to Matt Norton from #SNorton for hosting the event and organising a visit to S Nortonâ€™s outstanding metal recycling operation in Trafford Park Manchester. \n#enicor\n#metalrecycling\n#Lindemann\n#positiveoutlookI was honoured to be asked by Lindemann to be keynote speaker at their Customer Advisory Board meeting in Manchester. The meeting was attended by the CEOs and owners of leading metal recycling companies from across the globe. Attendees travelled from North America, France, Belgium, Holland, Germany, Spain, Sweden, Norway, Czech Republic and Denmark. We discussed the challenges facing the metal recycling industry and the solutions to overcome those challenges. To engage and interact with the decision makers at the top of their respective companies was extremely productive. The conclusion for our industry is that the outlook is extremely positive.\nOn a personal note the icing on the cake was winning the table tennis competition where I managed to take a point off professional German table tennis player Timo Boll former World Number 1, Olympic Silver Medalist, European and World Champion. Those years away at boarding school playing endless games of table tennis eventually paid off! \nA special thankyou to Matt Norton from #SNorton for hosting the event and organising a visit to S Nortonâ€™s outstanding metal recycling operation in Trafford Park Manchester. \n#enicor\n#metalrecycling\n#Lindemann\n#positiveoutlook",
        "likes": "17",
        "time": {
          "raw": "1ay2ay",
          "parsed": "14.04.2025",
          "isoString": "2025-04-14T04:44:42.074Z"
        },
        "mediaType": "image",
        "mediaContent": [
          "https://media.licdn.com/dms/image/v2/D4E22AQFxL8Ver3vBiQ/feedshare-shrink_800/B4EZTbIFgaGgAg-/0/1738843119945?e=1747267200&v=beta&t=3veyQ8_8t3O9w6b7_mfgC55pCRyGNTioeuxdbEXjijo",
          "https://media.licdn.com/dms/image/v2/D4E22AQGM1obtaYEbaQ/feedshare-shrink_800/B4EZTbIFe6HcAg-/0/1738843120532?e=1747267200&v=beta&t=07qZZ3AaKou67S-IFGsWzLc-IbgHH5lD9PlMqMJT_n4",
          "https://media.licdn.com/dms/image/v2/D4E22AQFqmakEvyW5_w/feedshare-shrink_800/B4EZTbIFgIGYAk-/0/1738843120198?e=1747267200&v=beta&t=AIk4Jc1botKKBeZHMGiRb_xmUr_jIAr9jvQt-oaGcBM",
          "https://media.licdn.com/dms/image/v2/D4E22AQFaQG_953T4cw/feedshare-shrink_800/B4EZTbIFgHGYAg-/0/1738843120775?e=1747267200&v=beta&t=N7Gpvhev2V59xG8cBhkWWckOXWc6vz9FgwceYdcxU_I",
          "https://media.licdn.com/dms/image/v2/D4E22AQEn9eZ2Gbb0rg/feedshare-shrink_800/B4EZTbIFfTHgAo-/0/1738843128584?e=1747267200&v=beta&t=OmGBkDowN6fGPryIRb8tV9G58J4Bd3XsZYz_kh01hnI"
        ],
        "date": "2025-04-14T04:44:42.074Z"
      },
      {
        "captions": "I was honoured to be asked by Lindemann to be keynote speaker at their Customer Advisory Board meeting in Manchester. The meeting was attended by the CEOs and owners of leading metal recycling companies from across the globe. Attendees travelled from North America, France, Belgium, Holland, Germany, Spain, Sweden, Norway, Czech Republic and Denmark. We discussed the challenges facing the metal recycling industry and the solutions to overcome those challenges. To engage and interact with the decision makers at the top of their respective companies was extremely productive. The conclusion for our industry is that the outlook is extremely positive.\nOn a personal note the icing on the cake was winning the table tennis competition where I managed to take a point off professional German table tennis player Timo Boll former World Number 1, Olympic Silver Medalist, European and World Champion. Those years away at boarding school playing endless games of table tennis eventually paid off! \nA special thankyou to Matt Norton from #SNorton for hosting the event and organising a visit to S Nortonâ€™s outstanding metal recycling operation in Trafford Park Manchester. \n#enicor\n#metalrecycling\n#Lindemann\n#positiveoutlookI was honoured to be asked by Lindemann to be keynote speaker at their Customer Advisory Board meeting in Manchester. The meeting was attended by the CEOs and owners of leading metal recycling companies from across the globe. Attendees travelled from North America, France, Belgium, Holland, Germany, Spain, Sweden, Norway, Czech Republic and Denmark. We discussed the challenges facing the metal recycling industry and the solutions to overcome those challenges. To engage and interact with the decision makers at the top of their respective companies was extremely productive. The conclusion for our industry is that the outlook is extremely positive.\nOn a personal note the icing on the cake was winning the table tennis competition where I managed to take a point off professional German table tennis player Timo Boll former World Number 1, Olympic Silver Medalist, European and World Champion. Those years away at boarding school playing endless games of table tennis eventually paid off! \nA special thankyou to Matt Norton from #SNorton for hosting the event and organising a visit to S Nortonâ€™s outstanding metal recycling operation in Trafford Park Manchester. \n#enicor\n#metalrecycling\n#Lindemann\n#positiveoutlook",
        "likes": "17",
        "time": {
          "raw": "2ay",
          "parsed": "14.02.2025",
          "isoString": "2025-02-14T04:44:42.076Z"
        },
        "mediaType": "image",
        "mediaContent": [
          "https://media.licdn.com/dms/image/v2/D4E22AQFxL8Ver3vBiQ/feedshare-shrink_800/B4EZTbIFgaGgAg-/0/1738843119945?e=1747267200&v=beta&t=3veyQ8_8t3O9w6b7_mfgC55pCRyGNTioeuxdbEXjijo",
          "https://media.licdn.com/dms/image/v2/D4E22AQGM1obtaYEbaQ/feedshare-shrink_800/B4EZTbIFe6HcAg-/0/1738843120532?e=1747267200&v=beta&t=07qZZ3AaKou67S-IFGsWzLc-IbgHH5lD9PlMqMJT_n4",
          "https://media.licdn.com/dms/image/v2/D4E22AQFqmakEvyW5_w/feedshare-shrink_800/B4EZTbIFgIGYAk-/0/1738843120198?e=1747267200&v=beta&t=AIk4Jc1botKKBeZHMGiRb_xmUr_jIAr9jvQt-oaGcBM",
          "https://media.licdn.com/dms/image/v2/D4E22AQFaQG_953T4cw/feedshare-shrink_800/B4EZTbIFgHGYAg-/0/1738843120775?e=1747267200&v=beta&t=N7Gpvhev2V59xG8cBhkWWckOXWc6vz9FgwceYdcxU_I",
          "https://media.licdn.com/dms/image/v2/D4E22AQEn9eZ2Gbb0rg/feedshare-shrink_800/B4EZTbIFfTHgAo-/0/1738843128584?e=1747267200&v=beta&t=OmGBkDowN6fGPryIRb8tV9G58J4Bd3XsZYz_kh01hnI"
        ],
        "date": "2025-02-14T04:44:42.076Z"
      },
      {
        "captions": "First Customer Advisory Board of Metal Recycling Industry successfully \nheld in Manchester\n\nDay 1 recap\n\nIndustry leaders, innovators, and decision-makers from across the global metal recycling sector gathered at the historic Midland Hotel in Manchester, England for LINDEMANNâ€™s inaugural Customer Advisory Board (CAB). Over two days, delegates from all over Europe â€“ and as far afield as Canada â€“ discussed the future of metal recycling, emerging trends, challenges, and how the industry can drive meaningful change.\n\nFollowing an opening address by LINDEMANN CEO Carl Gustaf GÃ¶ransson, Past President of the Bureau of International Recycling,Â Tom Bird, delivered a powerful keynote, emphasizing that while the industry is already green, it must do more to communicate its sustainability credentials. This set the stage for insightful presentations from LINDEMANNâ€™s leadership team, outlining the companyâ€™s strategic vision, advancements in technology and a commitment to supporting customers with new business models and closer after-sales partnerships. ğŸ“£ğŸ¤\n\nBut CAB wasnâ€™t just about presentations â€” it was a collaborative platform where industry voices were heard. Lively discussions and interactive sessions captured key challenges and opportunities, ensuring that customer perspectives are at the heart of future innovations. Participants even got to go toe-to-toe with the professional table tennis athletes from the LINDEMANN-sponsored Borussia DÃ¼sseldorf e.V. team in Germany!\n\nğŸ“½ï¸ Watch the video to relive the energy, insights, and collaboration from Day 1!\n\n#MetalRecycling #MetalRecyclingSolutions #RecycleForChange #RecycleResponsibly #GreenFuture #RecycleForABetterFuture #CleanerPlanet #CircularEconomy #CarbonReduction #TheCAB #Manchester #England #event",
        "likes": "52",
        "comments": "1",
        "shares": "12",
        "time": {
          "raw": "2h",
          "parsed": "26.02.2025",
          "isoString": "2025-02-26T05:02:36.283Z"
        },
        "mediaType": "video",
        "mediaContent": {
          "src": [
            {
              "src": "https://dms.licdn.com/playlist/vid/v2/D4E05AQHMVmoX6Sx0oA/mp4-640p-30fp-crf28/B4EZU3ucvsGYBc-/0/1740396768709?e=1742364000&v=beta&t=TMSMzSH-5F-8u2Fg7blGe46KwHCIXwwbkB7JUVsaOsk",
              "type": "video/mp4",
              "data-bitrate": 633721
            },
            {
              "src": "https://dms.licdn.com/playlist/vid/v2/D4E05AQHMVmoX6Sx0oA/mp4-720p-30fp-crf28/B4EZU3ucvsGYBg-/0/1740396770257?e=1742364000&v=beta&t=cCQO8lp7mYh2xZAV8bPz6nQJaGiuyULL5f2VAobkRMo",
              "type": "video/mp4",
              "data-bitrate": 829428
            }
          ],
          "posterUrl": "https://media.licdn.com/dms/image/v2/D4E05AQHMVmoX6Sx0oA/videocover-low/B4EZU3ucvsGYCM-/0/1740396759935?e=1742364000&v=beta&t=ax2xFhlXU3nTVvq0ogMJWSwfSB2ial_3PLkoFq0tjXU"
        },
        "date": "2025-02-26T05:02:36.283Z"
      },
      {
        "captions": "InDEx: Revolutionizing Metal Recycling Technology â™»ï¸\n\nThe circular economy demands high performance and rapid, predictive recycling technologies to meet its ambitious goals. Thatâ€™s where InDEx, LINDEMANNâ€™s digital operating and production data acquisition system, comes in.\n\nDeveloped to provide real-time insights into your machineâ€™s performance, InDEx empowers operators to:\n\nğŸ“ˆMonitor utilization and performance instantly\n\nğŸ” Track materials being processed\n\nğŸ“² Access critical data anytime, anywhereâ€”via mobile app or web portal\n\nIn a presentation at RWTH Aachen University, experts Wei Song, Fabian Diaz, and Bernd Friedrich recognized InDEx as a â€œstate-in-industryâ€ solution, highlighting its role in supporting the circular economy through digital transformation.\n\nInDEx gives our customers the tools they need to stay agile and efficient, making it easier than ever to optimize processes and maximize machine value. Together, weâ€™re setting new standards in metal recycling technology.\n\n#MetalRecycling #MetalRecyclingSolutions #RecycleForChange #RecycleResponsibly #GreenFuture #RecycleForABetterFuture #CleanerPlanet #CircularEconomy #CarbonReduction #InDEx #technologyÂ InDEx: Revolutionizing Metal Recycling Technology â™»ï¸\n\nThe circular economy demands high performance and rapid, predictive recycling technologies to meet its ambitious goals. Thatâ€™s where InDEx, LINDEMANNâ€™s digital operating and production data acquisition system, comes in.\n\nDeveloped to provide real-time insights into your machineâ€™s performance, InDEx empowers operators to:\n\nğŸ“ˆMonitor utilization and performance instantly\n\nğŸ” Track materials being processed\n\nğŸ“² Access critical data anytime, anywhereâ€”via mobile app or web portal\n\nIn a presentation at RWTH Aachen University, experts Wei Song, Fabian Diaz, and Bernd Friedrich recognized InDEx as a â€œstate-in-industryâ€ solution, highlighting its role in supporting the circular economy through digital transformation.\n\nInDEx gives our customers the tools they need to stay agile and efficient, making it easier than ever to optimize processes and maximize machine value. Together, weâ€™re setting new standards in metal recycling technology.\n\n#MetalRecycling #MetalRecyclingSolutions #RecycleForChange #RecycleResponsibly #GreenFuture #RecycleForABetterFuture #CleanerPlanet #CircularEconomy #CarbonReduction #InDEx #technology",
        "likes": "19",
        "shares": "4",
        "time": {
          "raw": "2h",
          "parsed": "26.02.2025",
          "isoString": "2025-02-26T05:02:36.285Z"
        },
        "mediaType": "image",
        "mediaContent": [
          "https://media.licdn.com/dms/image/v2/D5622AQHZr419aAdgDw/feedshare-shrink_800/B56ZTwhIAjGoAk-/0/1739202005888?e=1744848000&v=beta&t=iuG_GDqWeOmCn6WyuUHtyy5LUL85aKSJL2OlyiqiDh4"
        ],
        "date": "2025-02-26T05:02:36.285Z"
      },
      {
