[
  {
    "name": "JainHydraulics",
    "followerData": [
      [
        20250225,
        9
      ],
      [
        20250225,
        9
      ],
      [
        20250225,
        9
      ],
      [
        20250228,
        9
      ],
      [
        20250228,
        9
      ],
      [
        20250228,
        9
      ],
      [
        20250228,
        9
      ],
      [
        20250303,
        9
      ],
      [
        1741011387760,
        "9"
      ],
      [
        1741076417822,
        "9"
      ],
      [
        1741077567906,
        "9"
      ],
      [
        1741083484464,
        "9"
      ],
      [
        1741083494572,
        "9"
      ],
      [
        1741083503837,
        "9"
      ],
      [
        1741083535509,
        "9"
      ],
      [
        1741084548990,
        "9"
      ],
      [
        1741170314330,
        9
      ],
      [
        1741755723096,
        12
      ]
    ],
    "data": []
  },
  {
    "name": "DanieliGroup",
    "followerData": [
      [
        20250225,
        2807
      ],
      [
        20250225,
        2807
      ],
      [
        20250225,
        2807
      ],
      [
        20250228,
        2810
      ],
      [
        20250228,
        2810
      ],
      [
        20250228,
        2810
      ],
      [
        20250228,
        2810
      ],
      [
        20250303,
        2817
      ],
      [
        1741011402822,
        "2.821"
      ],
      [
        1741076431526,
        "2.823"
      ],
      [
        1741077580717,
        "2.823"
      ],
      [
        1741083548578,
        "2.823"
      ],
      [
        1741084561439,
        "2.823"
      ],
      [
        1741170326752,
        2825
      ],
      [
        1741755734753,
        2832
      ]
    ],
    "data": [
      {
        "captions": "MRAI Expo in Jaipur, marks our first event of 2025, and we couldn’t be more excited!☀\n\n🍃 Visit our stand to explore the best #Danieli solutions to take your business to the next level in the green and circular economy sectors.\n\n \n🔍 Find us at Booth 1309 \n📅 From January 28th to 30th\n📍 Novotel Jaipur Convention Center, Jaipur, India \n \n🌐 Want to know where to find Danieli next? \nCheck out our website for updates on all future events 👉 https://lnkd.in/dh8zMFDM\n\nMaterial Recycling Association of India MRAI Expo in Jaipur, marks our first event of 2025, and we couldn’t be more excited!☀\n\n🍃 Visit our stand to explore the best #Danieli solutions to take your business to the next level in the green and circular economy sectors.\n\n \n🔍 Find us at Booth 1309 \n📅 From January 28th to 30th\n📍 Novotel Jaipur Convention Center, Jaipur, India \n \n🌐 Want to know where to find Danieli next? \nCheck out our website for updates on all future events 👉 https://lnkd.in/dh8zMFDM\n\nMaterial Recycling Association of India",
        "likes": "14",
        "shares": "6",
        "time": {
          "raw": "1ay",
          "parsed": "12.02.2025",
          "isoString": "2025-02-12T05:02:14.502Z"
        },
        "mediaType": "image",
        "mediaContent": [
          "https://media.licdn.com/dms/image/v2/D4D22AQGuftsVUXhQ2A/feedshare-shrink_800/B4DZRkpAZgHEAg-/0/1736855259103?e=1744848000&v=beta&t=Np4NI8tGZpqHuHPnRUiVwGt0ojRZ3g5VRT0aEcRCXpY"
        ],
        "date": "2025-02-12T05:02:14.502Z"
      },
      {
        "captions": "Dun dun duuun! The DaNews #DIM Special Issue is here and looking dapper ⭐  \nDive into the Fifth Danieli Innovaction Meeting with an in-depth focus on: \n🎯 Industry-expert panels \n⚙ Dedicated #green technology sessions \n✈ Global plant tours \n🧭 A journey through #Danieli’s history and our beautiful region \n\nAnd more!\n  \nGrab your definitive digital #DaNews copy here ➡ https://lnkd.in/g4D6dyc",
        "likes": "279",
        "shares": "17",
        "time": {
          "raw": "3ay",
          "parsed": "12.12.2024",
          "isoString": "2024-12-12T05:02:14.505Z"
        },
        "mediaType": "video",
        "mediaContent": {
          "src": [
            {
              "src": "https://dms.licdn.com/playlist/vid/v2/D4E05AQECihFi870umQ/mp4-640p-30fp-crf28/mp4-640p-30fp-crf28/0/1731428429183?e=1742364000&v=beta&t=T4LKDLjYs6snsm2FPsZUezH86R2QGTnmu45PMmv6K-k",
              "type": "video/mp4",
              "data-bitrate": 455926
            },
            {
              "src": "https://dms.licdn.com/playlist/vid/v2/D4E05AQECihFi870umQ/mp4-720p-30fp-crf28/mp4-720p-30fp-crf28/0/1731428430976?e=1742364000&v=beta&t=99N7DHeDvd2Kjp6OhU00ibPTDJyV2EVP3JxknlbzBZs",
              "type": "video/mp4",
              "data-bitrate": 619108
            }
          ],
          "posterUrl": "https://media.licdn.com/dms/image/v2/D4E05AQECihFi870umQ/feedshare-thumbnail_720_1280/feedshare-thumbnail_720_1280/0/1731428409767?e=1742364000&v=beta&t=ikhPrGV7ZtzepI8ObNkIjEqOOb4UHMd6PxmTBfohM_A"
        },
        "date": "2024-12-12T05:02:14.505Z"
      },
      {
        "captions": "Everything is ready for Ecomondo, and we will be there too! ☀\n🍃 Visit our stand to explore the best #Danieli solutions to take your business to the next level in the green and circular economy sectors.\nECOMONDO - ITALIAN EXHIBITION GROUP\n \n🔍 Find us at Booth A3/109-111 \n📅 From November 5th to 8th\n📍 At Rimini Expo Centre, Rimini, Italy \n \n🌐 Want to know where to find Danieli next? \nCheck out our website for updates on all future events 👉 https://lnkd.in/dh8zMFDMEverything is ready for Ecomondo, and we will be there too! ☀\n🍃 Visit our stand to explore the best #Danieli solutions to take your business to the next level in the green and circular economy sectors.\nECOMONDO - ITALIAN EXHIBITION GROUP\n \n🔍 Find us at Booth A3/109-111 \n📅 From November 5th to 8th\n📍 At Rimini Expo Centre, Rimini, Italy \n \n🌐 Want to know where to find Danieli next? \nCheck out our website for updates on all future events 👉 https://lnkd.in/dh8zMFDM",
        "likes": "17",
        "comments": "1",
        "shares": "4",
        "time": {
          "raw": "4ay",
          "parsed": "12.11.2024",
          "isoString": "2024-11-12T05:02:14.507Z"
        },
        "mediaType": "image",
        "mediaContent": [
          "https://media.licdn.com/dms/image/v2/D4D22AQH2O1Y23a-X1g/feedshare-shrink_800/feedshare-shrink_800/0/1730360484228?e=1744848000&v=beta&t=YEc7itqHlzvJOGHPpO3B3dL4OzkAY49ijl0W_Jqp2K0"
        ],
        "date": "2024-11-12T05:02:14.507Z"
      },
      {
        "captions": "BIR World Recycling Convention is coming, and we'll not miss the event! ☀\n♻ #Danieli is ready to make its mark with innovative solutions for the sustainable economic development: visit our stand to take your business to the next level.\n \n🔍 Find us at Booth B02 \n📅 From October 28th to 29th \n📍 At Raffles City Convention Centre, Singapore \n \n🌐 Want to know where to find Danieli next? \nCheck out our website for updates on all future events 👉 https://lnkd.in/dh8zMFDM\nBureau of International RecyclingBIR World Recycling Convention is coming, and we'll not miss the event! ☀\n♻ #Danieli is ready to make its mark with innovative solutions for the sustainable economic development: visit our stand to take your business to the next level.\n \n🔍 Find us at Booth B02 \n📅 From October 28th to 29th \n📍 At Raffles City Convention Centre, Singapore \n \n🌐 Want to know where to find Danieli next? \nCheck out our website for updates on all future events 👉 https://lnkd.in/dh8zMFDM\nBureau of International Recycling",
        "likes": "25",
        "shares": "2",
        "time": {
          "raw": "4ay",
          "parsed": "12.11.2024",
          "isoString": "2024-11-12T05:02:14.509Z"
        },
        "mediaType": "image",
        "mediaContent": [
          "https://media.licdn.com/dms/image/v2/D4D22AQHstak22oLumQ/feedshare-shrink_800/feedshare-shrink_800/0/1729860335368?e=1744848000&v=beta&t=Q4apnOdoXEG0lXDOk_GP4fmNZQSKG5zqkMcRF90HRHA"
        ],
        "date": "2024-11-12T05:02:14.509Z"
      },
      {
        "captions": "It's our honor to announce Danieli Group as an exhibitor at FABEX Saudi Arabia 2024 \n\nRegister Now to visit and get your free ticket at: https://lnkd.in/ds5N22zB \n\n📅Dates: 13-16 OCTOBER 2024\n📍Venue: Riyadh International Convention & Exhibition Centre (Halls 1,2,3,4,5)\n🌐Website: https://www.fabxsaudi.com/\n📧Email: riyadh@arabiangerman.com\n\n#FABEX #FABEXKSA #MACH #Metal_and_Steel #FABEX_SaudiArabia #SaudiArabia #riyadh #MetalIndustry #SteelFabrication #Machinery #Steel #Machinery #Metal #CNC #Welding #Cutting #automationIt's our honor to announce Danieli Group as an exhibitor at FABEX Saudi Arabia 2024 \n\nRegister Now to visit and get your free ticket at: https://lnkd.in/ds5N22zB \n\n📅Dates: 13-16 OCTOBER 2024\n📍Venue: Riyadh International Convention & Exhibition Centre (Halls 1,2,3,4,5)\n🌐Website: https://www.fabxsaudi.com/\n📧Email: riyadh@arabiangerman.com\n\n#FABEX #FABEXKSA #MACH #Metal_and_Steel #FABEX_SaudiArabia #SaudiArabia #riyadh #MetalIndustry #SteelFabrication #Machinery #Steel #Machinery #Metal #CNC #Welding #Cutting #automation",
        "likes": "12",
        "shares": "4",
        "time": {
          "raw": "6ay",
          "parsed": "12.09.2024",
          "isoString": "2024-09-12T05:02:14.510Z"
        },
        "mediaType": "image",
        "mediaContent": [
          "https://media.licdn.com/dms/image/v2/D4D22AQFwcCRJNjjIBw/feedshare-shrink_800/feedshare-shrink_800/0/1723727332470?e=1744848000&v=beta&t=2onvBBBv36bRcRNxtLY31NKHjgQ2d3500-lYjWzlSaE"
        ],
        "date": "2024-09-12T05:02:14.510Z"
      },
      {
        "captions": "It's time for Scrap Expo, and we'll be there! ☀\n\n⭐ Discover the latest trends, network with industry leaders, and explore the best #Danieli solutions to take your business to the next level. \n🔍 Find us at Booth 420 \n📅 From September 17 to 18 \n📍 At Kentucky Exposition Center, Louisville, USA \n🌐 Want to know where to find Danieli next? \nCheck out our website for updates on all future events 👉 https://lnkd.in/dh8zMFDMIt's time for Scrap Expo, and we'll be there! ☀\n\n⭐ Discover the latest trends, network with industry leaders, and explore the best #Danieli solutions to take your business to the next level. \n🔍 Find us at Booth 420 \n📅 From September 17 to 18 \n📍 At Kentucky Exposition Center, Louisville, USA \n🌐 Want to know where to find Danieli next? \nCheck out our website for updates on all future events 👉 https://lnkd.in/dh8zMFDM",
        "likes": "16",
        "shares": "9",
        "time": {
          "raw": "5ay",
          "parsed": "12.10.2024",
          "isoString": "2024-10-12T05:02:14.512Z"
        },
        "mediaType": "image",
        "mediaContent": [
          "https://media.licdn.com/dms/image/v2/D4D22AQGnBxCWO-UPlw/feedshare-shrink_800/feedshare-shrink_800/0/1726568048923?e=1744848000&v=beta&t=LfUBJassOM9mKw359RG2ZSdxiP34n0kNSnC-SmUPDM0"
        ],
        "date": "2024-10-12T05:02:14.512Z"
      },
      {
        "captions": "🔔 Danieli Centro Recycling will be present at IFAT Munich 2024!\n \nJoin us\n📅 From May 13 to 17\n📍 Hall B4, Booth 415 \n \n💼 Looking for global opportunities? Check out our website: https://lnkd.in/ez2Fvdt8The leading trade fair for environmental technologies is back! ♻  \n💡 IFAT worldwide starts next week and Danieli is ready to be a part of it. Are you?   \n🔍 Find us at Hall B4, Booth 415  \n📅 From May 13 to 17 \n📍 At Messe München, Germany  \n🌐 Want to know where to find Danieli next?  \nCheck out our website for updates on all future events 👉 https://lnkd.in/dh8zMFDM",
        "likes": "21",
        "shares": "3",
        "time": {
          "raw": "10ay10ay",
          "parsed": "12.03.2025",
          "isoString": "2025-03-12T05:02:14.513Z"
        },
        "mediaType": "video",
        "mediaContent": {
          "src": [
            {
              "src": "https://dms.licdn.com/playlist/vid/v2/D4E05AQEmFCbkTAT7VQ/mp4-640p-30fp-crf28/mp4-640p-30fp-crf28/0/1715172375594?e=1742364000&v=beta&t=hHJpiV7K_CR6XAE2VJ_p4V36EHx9jTh4ElSCVhmoIYA",
              "type": "video/mp4",
              "data-bitrate": 55193
            },
            {
              "src": "https://dms.licdn.com/playlist/vid/v2/D4E05AQEmFCbkTAT7VQ/mp4-720p-30fp-crf28/mp4-720p-30fp-crf28/0/1715172375508?e=1742364000&v=beta&t=INhG_4tcATk394yVpjF39rLClyDctxsun6IDh7VwGWI",
              "type": "video/mp4",
              "data-bitrate": 66819
            }
          ],
          "posterUrl": "https://media.licdn.com/dms/image/v2/D4E05AQEmFCbkTAT7VQ/feedshare-thumbnail_720_1280/feedshare-thumbnail_720_1280/0/1715172365655?e=1742364000&v=beta&t=mnRr8iL6viRTTfoDnNOnY0UfLABNaC9uMUZQ0NzFZdc"
        },
        "date": "2025-03-12T05:02:14.513Z"
      },
      {
        "captions": "The leading trade fair for environmental technologies is back! ♻  \n💡 IFAT worldwide starts next week and Danieli is ready to be a part of it. Are you?   \n🔍 Find us at Hall B4, Booth 415  \n📅 From May 13 to 17 \n📍 At Messe München, Germany  \n🌐 Want to know where to find Danieli next?  \nCheck out our website for updates on all future events 👉 https://lnkd.in/dh8zMFDM",
        "time": {
          "raw": "10ay",
          "parsed": "12.05.2024",
          "isoString": "2024-05-12T05:02:14.513Z"
        },
        "mediaType": "video",
        "mediaContent": {
          "src": [
            {
              "src": "https://dms.licdn.com/playlist/vid/v2/D4E05AQEmFCbkTAT7VQ/mp4-640p-30fp-crf28/mp4-640p-30fp-crf28/0/1715172375594?e=1742364000&v=beta&t=hHJpiV7K_CR6XAE2VJ_p4V36EHx9jTh4ElSCVhmoIYA",
              "type": "video/mp4",
              "data-bitrate": 55193
            },
            {
              "src": "https://dms.licdn.com/playlist/vid/v2/D4E05AQEmFCbkTAT7VQ/mp4-720p-30fp-crf28/mp4-720p-30fp-crf28/0/1715172375508?e=1742364000&v=beta&t=INhG_4tcATk394yVpjF39rLClyDctxsun6IDh7VwGWI",
              "type": "video/mp4",
              "data-bitrate": 66819
            }
          ],
          "posterUrl": "https://media.licdn.com/dms/image/v2/D4E05AQEmFCbkTAT7VQ/feedshare-thumbnail_720_1280/feedshare-thumbnail_720_1280/0/1715172365655?e=1742364000&v=beta&t=mnRr8iL6viRTTfoDnNOnY0UfLABNaC9uMUZQ0NzFZdc"
        },
        "date": "2024-05-12T05:02:14.513Z"
      }
    ]
  },
  {
    "name": "LINDEMANNMetalRecycling",
    "followerData": [
      [
        20250225,
        3196
      ],
      [
        20250225,
        3196
      ],
      [
        20250225,
        3196
      ],
      [
        20250228,
        3211
      ],
      [
        20250228,
        3212
      ],
      [
        20250228,
        3212
      ],
      [
        20250228,
        3212
      ],
      [
        20250303,
        3219
      ],
      [
        1741011431485,
        "3.219"
      ],
      [
        1741076454330,
        "3.221"
      ],
      [
        1741077602778,
        "3.221"
      ],
      [
        1741083570831,
        "3.221"
      ],
      [
        1741084584137,
        "3.221"
      ],
      [
        1741170348851,
        3225
      ],
      [
        1741755756554,
        3256
      ]
    ],
    "data": [
      {
        "captions": "Customer Advisory Board \nDay 2 recap\n\nThe second and final day of LINDEMANN’s Customer Advisory Board built on the momentum of an incredible first day, with deeper discussions, industry-leading insights, and an exclusive look at cutting-edge recycling technology in action. Steel industry expert Dr. Christian Fröhling from SMS took centre stage with a keynote exploring the role of electric arc furnaces, regulatory pressures, and the role recycled steel/scrap will play in the developing global demand for green steel.🌱\n\nHis insights reinforced the industry’s need for improved density and purity – as well as innovation, collaboration and a strong commitment to decarbonization.\nAttendees then had the unique opportunity to tour S. Norton Group’s advanced recycling facility, featuring the world’s first LINDEMANN shredder with the revolutionary Variable Frequency Drive (VDA) technology, as well as Shredder Drive Assist (SDA). Seeing innovation in action capped off an event that was not just about discussion — but about real solutions and a better way forward for the industry.♻️\n\nFrom thought-provoking keynotes to hands-on experiences, LINDEMANN’s Customer Advisory Board was a milestone moment for the industry. This event underscored the power of partnership in shaping a stronger, more sustainable future for metal recycling.\n\n🎥 Watch the video to see the highlights from Day 2!\n\n#MetalRecycling #MetalRecyclingSolutions #RecycleForChange #RecycleResponsibly #GreenFuture #RecycleForABetterFuture #CleanerPlanet #CircularEconomy #CarbonReduction #TheCAB #Manchester #England #event #SNorton",
        "likes": "46",
        "shares": "5",
        "time": {
          "raw": "1h",
          "parsed": "05.03.2025",
          "isoString": "2025-03-05T05:02:36.277Z"
        },
        "mediaType": "video",
        "mediaContent": {
          "src": [
            {
              "src": "https://dms.licdn.com/playlist/vid/v2/D4E05AQEd68lXDek8vQ/mp4-720p-30fp-crf28/B4EZVC2mnXHUBg-/0/1740583422686?e=1742364000&v=beta&t=FbP3CG2ynwVecEoiO8bvxoaTze_c6lp-fvYg3UO_G1o",
              "type": "video/mp4",
              "data-bitrate": 1015285
            },
            {
              "src": "https://dms.licdn.com/playlist/vid/v2/D4E05AQEd68lXDek8vQ/mp4-640p-30fp-crf28/B4EZVC2mnXHUBc-/0/1740583425014?e=1742364000&v=beta&t=s5LyXg5G9co7_QPyFzmG809dY1OnedNqIzwTA4OM2hs",
              "type": "video/mp4",
              "data-bitrate": 783529
            }
          ],
          "posterUrl": "https://media.licdn.com/dms/image/v2/D4E05AQEd68lXDek8vQ/videocover-low/B4EZVC2mnXHUCM-/0/1740583417229?e=1742364000&v=beta&t=pze960txeIZnETL6Wb6DC_WPYybWfO5-AqahtRKMLiY"
        },
        "date": "2025-03-05T05:02:36.277Z"
      },
      {
        "captions": "🔧 SPARE AND WEAR PARTS: THE LINDEMANN DIFFERENCE\n\nWhen it comes to keeping your recycling operation running smoothly, every component matters. As an OEM supplier, LINDEMANN provides spare and wear parts designed to fit your machines perfectly.\n\nFor decades, we’ve paired the development of our innovative recycling plants with the creation of specifically adapted parts, ensuring durability, efficiency, and reliability from the ground up.\n\nOur original LINDEMANN parts are: \n\n✅ Developed and tested in-house\n\n✅ Designed with performance and cost-efficiency in mind\n\n✅ Built to maximize machine availability and minimize maintenance\n\nWith extensive experience in design and field testing, we ensure every part contributes to seamless operations, helping you achieve optimal performance while reducing downtime.\n\n🔗 Ready to learn more? Explore the LINDEMANN advantage today: https://lnkd.in/e-t6EWwv\n\n#MetalRecycling #MetalRecyclingSolutions #RecycleForChange #RecycleResponsibly #GreenFuture #RecycleForABetterFuture #CleanerPlanet #CircularEconomy #CarbonReduction #GreenFuture #OEMParts #Efficiency #Innovation",
        "likes": "26",
        "shares": "8",
        "time": {
          "raw": "1h",
          "parsed": "05.03.2025",
          "isoString": "2025-03-05T05:02:36.279Z"
        },
        "mediaType": "document",
        "mediaContent": {
          "title": "Baler",
          "subtitle": "4 sayfa",
          "totalPages": 4,
          "coverPages": [
            {
              "type": "image",
              "config": {
                "src": "https://media.licdn.com/dms/image/v2/D561FAQFEKeBhP5VddA/feedshare-document-cover-images_480/B56ZTwhwkCGoBU-/0/1739202178952?e=1742364000&v=beta&t=sZS_uL6j3gPLlumHK2sUpQt0U4cmlhhQordbD7tAKyM"
              }
            },
            {
              "type": "image",
              "config": {
                "src": "https://media.licdn.com/dms/image/v2/D561FAQFEKeBhP5VddA/feedshare-document-cover-images_480/B56ZTwhwkCGoBU-/1/1739202178952?e=1742364000&v=beta&t=mQoihPNc_PjV41Yvn6R0JZO25yoiWRvXXQNIi-IUvhk"
              }
            },
            {
              "type": "image",
              "config": {
                "src": "https://media.licdn.com/dms/image/v2/D561FAQFEKeBhP5VddA/feedshare-document-cover-images_480/B56ZTwhwkCGoBU-/2/1739202178952?e=1742364000&v=beta&t=nrTkUYUdkpcZ8zQZWFUx03O_FlSNwE23H6_btxBCCD0"
              }
            }
          ]
        },
        "date": "2025-03-05T05:02:36.279Z"
      },
      {
        "captions": "It was a pleasure to have you on board 😎I was honoured to be asked by Lindemann to be keynote speaker at their Customer Advisory Board meeting in Manchester. The meeting was attended by the CEOs and owners of leading metal recycling companies from across the globe. Attendees travelled from North America, France, Belgium, Holland, Germany, Spain, Sweden, Norway, Czech Republic and Denmark. We discussed the challenges facing the metal recycling industry and the solutions to overcome those challenges. To engage and interact with the decision makers at the top of their respective companies was extremely productive. The conclusion for our industry is that the outlook is extremely positive.\nOn a personal note the icing on the cake was winning the table tennis competition where I managed to take a point off professional German table tennis player Timo Boll former World Number 1, Olympic Silver Medalist, European and World Champion. Those years away at boarding school playing endless games of table tennis eventually paid off! \nA special thankyou to Matt Norton from #SNorton for hosting the event and organising a visit to S Norton’s outstanding metal recycling operation in Trafford Park Manchester. \n#enicor\n#metalrecycling\n#Lindemann\n#positiveoutlookI was honoured to be asked by Lindemann to be keynote speaker at their Customer Advisory Board meeting in Manchester. The meeting was attended by the CEOs and owners of leading metal recycling companies from across the globe. Attendees travelled from North America, France, Belgium, Holland, Germany, Spain, Sweden, Norway, Czech Republic and Denmark. We discussed the challenges facing the metal recycling industry and the solutions to overcome those challenges. To engage and interact with the decision makers at the top of their respective companies was extremely productive. The conclusion for our industry is that the outlook is extremely positive.\nOn a personal note the icing on the cake was winning the table tennis competition where I managed to take a point off professional German table tennis player Timo Boll former World Number 1, Olympic Silver Medalist, European and World Champion. Those years away at boarding school playing endless games of table tennis eventually paid off! \nA special thankyou to Matt Norton from #SNorton for hosting the event and organising a visit to S Norton’s outstanding metal recycling operation in Trafford Park Manchester. \n#enicor\n#metalrecycling\n#Lindemann\n#positiveoutlook",
        "likes": "15",
        "time": {
          "raw": "2h1ay",
          "parsed": "12.03.2025",
          "isoString": "2025-03-12T05:02:36.280Z"
        },
        "mediaType": "image",
        "mediaContent": [
          "https://media.licdn.com/dms/image/v2/D4E22AQFxL8Ver3vBiQ/feedshare-shrink_800/B4EZTbIFgaGgAg-/0/1738843119945?e=1744848000&v=beta&t=RmKn5SB1wp3m5pF8At5H5NCvfjaHI40Ic9gWiLPsi18",
          "https://media.licdn.com/dms/image/v2/D4E22AQGM1obtaYEbaQ/feedshare-shrink_800/B4EZTbIFe6HcAg-/0/1738843120532?e=1744848000&v=beta&t=1XrCdC6LVO7_nB3GbkeGoWsFnEVTv97xWgp_NvY_lUo",
          "https://media.licdn.com/dms/image/v2/D4E22AQFqmakEvyW5_w/feedshare-shrink_800/B4EZTbIFgIGYAk-/0/1738843120198?e=1744848000&v=beta&t=tLEdEX3LZ2rvY_PCNxhON1cfa2SkEqc46aYXLliAegg",
          "https://media.licdn.com/dms/image/v2/D4E22AQFaQG_953T4cw/feedshare-shrink_800/B4EZTbIFgHGYAg-/0/1738843120775?e=1744848000&v=beta&t=WDi-8aknT7cWDJIe3ny8Cb5e26sFES2ZnQWGKBsecak",
          "https://media.licdn.com/dms/image/v2/D4E22AQEn9eZ2Gbb0rg/feedshare-shrink_800/B4EZTbIFfTHgAo-/0/1738843128584?e=1744848000&v=beta&t=ItnS3aFxlCqUGhdxHVuWeATLot17Qhrxy7irW1JBK8M"
        ],
        "date": "2025-03-12T05:02:36.280Z"
      },
      {
        "captions": "I was honoured to be asked by Lindemann to be keynote speaker at their Customer Advisory Board meeting in Manchester. The meeting was attended by the CEOs and owners of leading metal recycling companies from across the globe. Attendees travelled from North America, France, Belgium, Holland, Germany, Spain, Sweden, Norway, Czech Republic and Denmark. We discussed the challenges facing the metal recycling industry and the solutions to overcome those challenges. To engage and interact with the decision makers at the top of their respective companies was extremely productive. The conclusion for our industry is that the outlook is extremely positive.\nOn a personal note the icing on the cake was winning the table tennis competition where I managed to take a point off professional German table tennis player Timo Boll former World Number 1, Olympic Silver Medalist, European and World Champion. Those years away at boarding school playing endless games of table tennis eventually paid off! \nA special thankyou to Matt Norton from #SNorton for hosting the event and organising a visit to S Norton’s outstanding metal recycling operation in Trafford Park Manchester. \n#enicor\n#metalrecycling\n#Lindemann\n#positiveoutlookI was honoured to be asked by Lindemann to be keynote speaker at their Customer Advisory Board meeting in Manchester. The meeting was attended by the CEOs and owners of leading metal recycling companies from across the globe. Attendees travelled from North America, France, Belgium, Holland, Germany, Spain, Sweden, Norway, Czech Republic and Denmark. We discussed the challenges facing the metal recycling industry and the solutions to overcome those challenges. To engage and interact with the decision makers at the top of their respective companies was extremely productive. The conclusion for our industry is that the outlook is extremely positive.\nOn a personal note the icing on the cake was winning the table tennis competition where I managed to take a point off professional German table tennis player Timo Boll former World Number 1, Olympic Silver Medalist, European and World Champion. Those years away at boarding school playing endless games of table tennis eventually paid off! \nA special thankyou to Matt Norton from #SNorton for hosting the event and organising a visit to S Norton’s outstanding metal recycling operation in Trafford Park Manchester. \n#enicor\n#metalrecycling\n#Lindemann\n#positiveoutlook",
        "likes": "15",
        "time": {
          "raw": "1ay",
          "parsed": "12.02.2025",
          "isoString": "2025-02-12T05:02:36.282Z"
        },
        "mediaType": "image",
        "mediaContent": [
          "https://media.licdn.com/dms/image/v2/D4E22AQFxL8Ver3vBiQ/feedshare-shrink_800/B4EZTbIFgaGgAg-/0/1738843119945?e=1744848000&v=beta&t=RmKn5SB1wp3m5pF8At5H5NCvfjaHI40Ic9gWiLPsi18",
          "https://media.licdn.com/dms/image/v2/D4E22AQGM1obtaYEbaQ/feedshare-shrink_800/B4EZTbIFe6HcAg-/0/1738843120532?e=1744848000&v=beta&t=1XrCdC6LVO7_nB3GbkeGoWsFnEVTv97xWgp_NvY_lUo",
          "https://media.licdn.com/dms/image/v2/D4E22AQFqmakEvyW5_w/feedshare-shrink_800/B4EZTbIFgIGYAk-/0/1738843120198?e=1744848000&v=beta&t=tLEdEX3LZ2rvY_PCNxhON1cfa2SkEqc46aYXLliAegg",
          "https://media.licdn.com/dms/image/v2/D4E22AQFaQG_953T4cw/feedshare-shrink_800/B4EZTbIFgHGYAg-/0/1738843120775?e=1744848000&v=beta&t=WDi-8aknT7cWDJIe3ny8Cb5e26sFES2ZnQWGKBsecak",
          "https://media.licdn.com/dms/image/v2/D4E22AQEn9eZ2Gbb0rg/feedshare-shrink_800/B4EZTbIFfTHgAo-/0/1738843128584?e=1744848000&v=beta&t=ItnS3aFxlCqUGhdxHVuWeATLot17Qhrxy7irW1JBK8M"
        ],
        "date": "2025-02-12T05:02:36.282Z"
      },
      {
        "captions": "First Customer Advisory Board of Metal Recycling Industry successfully \nheld in Manchester\n\nDay 1 recap\n\nIndustry leaders, innovators, and decision-makers from across the global metal recycling sector gathered at the historic Midland Hotel in Manchester, England for LINDEMANN’s inaugural Customer Advisory Board (CAB). Over two days, delegates from all over Europe – and as far afield as Canada – discussed the future of metal recycling, emerging trends, challenges, and how the industry can drive meaningful change.\n\nFollowing an opening address by LINDEMANN CEO Carl Gustaf Göransson, Past President of the Bureau of International Recycling, Tom Bird, delivered a powerful keynote, emphasizing that while the industry is already green, it must do more to communicate its sustainability credentials. This set the stage for insightful presentations from LINDEMANN’s leadership team, outlining the company’s strategic vision, advancements in technology and a commitment to supporting customers with new business models and closer after-sales partnerships. 📣🤝\n\nBut CAB wasn’t just about presentations — it was a collaborative platform where industry voices were heard. Lively discussions and interactive sessions captured key challenges and opportunities, ensuring that customer perspectives are at the heart of future innovations. Participants even got to go toe-to-toe with the professional table tennis athletes from the LINDEMANN-sponsored Borussia Düsseldorf e.V. team in Germany!\n\n📽️ Watch the video to relive the energy, insights, and collaboration from Day 1!\n\n#MetalRecycling #MetalRecyclingSolutions #RecycleForChange #RecycleResponsibly #GreenFuture #RecycleForABetterFuture #CleanerPlanet #CircularEconomy #CarbonReduction #TheCAB #Manchester #England #event",
        "likes": "52",
        "comments": "1",
        "shares": "12",
        "time": {
          "raw": "2h",
          "parsed": "26.02.2025",
          "isoString": "2025-02-26T05:02:36.283Z"
        },
        "mediaType": "video",
        "mediaContent": {
          "src": [
            {
              "src": "https://dms.licdn.com/playlist/vid/v2/D4E05AQHMVmoX6Sx0oA/mp4-640p-30fp-crf28/B4EZU3ucvsGYBc-/0/1740396768709?e=1742364000&v=beta&t=TMSMzSH-5F-8u2Fg7blGe46KwHCIXwwbkB7JUVsaOsk",
              "type": "video/mp4",
              "data-bitrate": 633721
            },
            {
              "src": "https://dms.licdn.com/playlist/vid/v2/D4E05AQHMVmoX6Sx0oA/mp4-720p-30fp-crf28/B4EZU3ucvsGYBg-/0/1740396770257?e=1742364000&v=beta&t=cCQO8lp7mYh2xZAV8bPz6nQJaGiuyULL5f2VAobkRMo",
              "type": "video/mp4",
              "data-bitrate": 829428
            }
          ],
          "posterUrl": "https://media.licdn.com/dms/image/v2/D4E05AQHMVmoX6Sx0oA/videocover-low/B4EZU3ucvsGYCM-/0/1740396759935?e=1742364000&v=beta&t=ax2xFhlXU3nTVvq0ogMJWSwfSB2ial_3PLkoFq0tjXU"
        },
        "date": "2025-02-26T05:02:36.283Z"
      },
      {
        "captions": "InDEx: Revolutionizing Metal Recycling Technology ♻️\n\nThe circular economy demands high performance and rapid, predictive recycling technologies to meet its ambitious goals. That’s where InDEx, LINDEMANN’s digital operating and production data acquisition system, comes in.\n\nDeveloped to provide real-time insights into your machine’s performance, InDEx empowers operators to:\n\n📈Monitor utilization and performance instantly\n\n🔍 Track materials being processed\n\n📲 Access critical data anytime, anywhere—via mobile app or web portal\n\nIn a presentation at RWTH Aachen University, experts Wei Song, Fabian Diaz, and Bernd Friedrich recognized InDEx as a “state-in-industry” solution, highlighting its role in supporting the circular economy through digital transformation.\n\nInDEx gives our customers the tools they need to stay agile and efficient, making it easier than ever to optimize processes and maximize machine value. Together, we’re setting new standards in metal recycling technology.\n\n#MetalRecycling #MetalRecyclingSolutions #RecycleForChange #RecycleResponsibly #GreenFuture #RecycleForABetterFuture #CleanerPlanet #CircularEconomy #CarbonReduction #InDEx #technology InDEx: Revolutionizing Metal Recycling Technology ♻️\n\nThe circular economy demands high performance and rapid, predictive recycling technologies to meet its ambitious goals. That’s where InDEx, LINDEMANN’s digital operating and production data acquisition system, comes in.\n\nDeveloped to provide real-time insights into your machine’s performance, InDEx empowers operators to:\n\n📈Monitor utilization and performance instantly\n\n🔍 Track materials being processed\n\n📲 Access critical data anytime, anywhere—via mobile app or web portal\n\nIn a presentation at RWTH Aachen University, experts Wei Song, Fabian Diaz, and Bernd Friedrich recognized InDEx as a “state-in-industry” solution, highlighting its role in supporting the circular economy through digital transformation.\n\nInDEx gives our customers the tools they need to stay agile and efficient, making it easier than ever to optimize processes and maximize machine value. Together, we’re setting new standards in metal recycling technology.\n\n#MetalRecycling #MetalRecyclingSolutions #RecycleForChange #RecycleResponsibly #GreenFuture #RecycleForABetterFuture #CleanerPlanet #CircularEconomy #CarbonReduction #InDEx #technology",
        "likes": "19",
        "shares": "4",
        "time": {
          "raw": "2h",
          "parsed": "26.02.2025",
          "isoString": "2025-02-26T05:02:36.285Z"
        },
        "mediaType": "image",
        "mediaContent": [
          "https://media.licdn.com/dms/image/v2/D5622AQHZr419aAdgDw/feedshare-shrink_800/B56ZTwhIAjGoAk-/0/1739202005888?e=1744848000&v=beta&t=iuG_GDqWeOmCn6WyuUHtyy5LUL85aKSJL2OlyiqiDh4"
        ],
        "date": "2025-02-26T05:02:36.285Z"
      },
      {
        "captions": "As 2025 begins to take shape, LINDEMANN is ready to seize the opportunities this year brings. The global focus on sustainability continues to grow, and we are proud to be part of the movement driving positive change through innovation in metal recycling.♻️\nCompanies everywhere must align with increasingly stringent regulations aimed at reducing emissions, conserving resources, and fostering sustainable practices. At LINDEMANN, we are committed to supporting our customers in meeting these standards through innovative metal recycling solutions that help reduce environmental impact while driving efficiency. 📈\nThis year, we will focus on strengthening partnerships and delivering solutions that enable companies to meet their environmental obligations while making meaningful progress toward sustainability goals. 🥅\n#MetalRecycling #MetalRecyclingSolutions #RecycleForChange #RecycleResponsibly #GreenFuture #RecycleForABetterFuture #CleanerPlanet #CircularEconomy #CarbonReduction #CustainabilityGoals #customers As 2025 begins to take shape, LINDEMANN is ready to seize the opportunities this year brings. The global focus on sustainability continues to grow, and we are proud to be part of the movement driving positive change through innovation in metal recycling.♻️\nCompanies everywhere must align with increasingly stringent regulations aimed at reducing emissions, conserving resources, and fostering sustainable practices. At LINDEMANN, we are committed to supporting our customers in meeting these standards through innovative metal recycling solutions that help reduce environmental impact while driving efficiency. 📈\nThis year, we will focus on strengthening partnerships and delivering solutions that enable companies to meet their environmental obligations while making meaningful progress toward sustainability goals. 🥅\n#MetalRecycling #MetalRecyclingSolutions #RecycleForChange #RecycleResponsibly #GreenFuture #RecycleForABetterFuture #CleanerPlanet #CircularEconomy #CarbonReduction #CustainabilityGoals #customers",
        "likes": "28",
        "shares": "5",
        "time": {
          "raw": "2h",
          "parsed": "26.02.2025",
          "isoString": "2025-02-26T05:02:36.286Z"
        },
        "mediaType": "image",
        "mediaContent": [
          "https://media.licdn.com/dms/image/v2/D5622AQFbS_EeCVZhxA/feedshare-shrink_800/B56ZTwgvWKGUAs-/0/1739201904099?e=1744848000&v=beta&t=9rAbFEHHnBDRfKTUfZYhG8NvRu0WS3fg2xfmbj-f-J4"
        ],
        "date": "2025-02-26T05:02:36.286Z"
      },
      {
        "captions": "Did you know: Steel production currently accounts for approximately 8% of global CO₂ emissions?! Let's make a change and drive the green steel cycle. In our vision of transforming the metal circular economy for a better tomorrow,  I am sharing my thoughts and reflections in this article why scrap metal is key to cutting CO₂.\nAt Lindemann, our goal is to play an active role in  transformation journey",
        "likes": "23",
        "shares": "6",
        "time": {
          "raw": "2h2h",
          "parsed": "12.03.2025",
          "isoString": "2025-03-12T05:02:36.287Z"
        },
        "mediaType": "other",
        "date": "2025-03-12T05:02:36.287Z"
      },
      {
        "captions": "In our vision of transforming the metal circular economy for a better tomorrow,  I am sharing my thoughts and reflections in this article why scrap metal is key to cutting CO₂.\nAt Lindemann, our goal is to play an active role in  transformation journey",
        "time": {
          "raw": "2h",
          "parsed": "26.02.2025",
          "isoString": "2025-02-26T05:02:36.288Z"
        },
        "mediaType": "other",
        "date": "2025-02-26T05:02:36.288Z"
      },
      {
        "captions": "Excellent Service for Customers Success😎💪CASE STUDY - EXCELLENT CUSTOMER-RELATIONSHIP AND CUSTOMER-SERVICE ACROSS CONTINENTS\n\nSometimes it's not the big strategies or long-term plans that make the difference - but quick, pragmatic solutions at critical moments.\n\nOne of our customers had a machine failure: A control block had unexpectedly failed after very long time of operation. Replacement? It had already been ordered before the failure, but was still in production for some time. Long story short: machine downtime and loss of production.\n\nIn this situation our service team deeply impressed me:\nInstead of waiting, they checked with another long-standing customer, who they knew had a machine of the same type and a control block in stock.\n\nThe result? We picked this one up and sent it to another customer - a temporary loan of the control block across continents!\n\nI have been working in various industries for over 15 years. But I've never experienced this kind of interaction between service and customers!\n\nWhat can we learn from this?\n✅ Excellent service - does not just mean reacting to problems, but finding solutions where others only see obstacles.\n✅ Good customer relations - a genuine partnership-based exchange is what makes such solutions conceivable. Trust and long-term cooperation pay off - for all sides.\n\nHave you ever experienced similarly situations? Even in other fields?CASE STUDY - EXCELLENT CUSTOMER-RELATIONSHIP AND CUSTOMER-SERVICE ACROSS CONTINENTS\n\nSometimes it's not the big strategies or long-term plans that make the difference - but quick, pragmatic solutions at critical moments.\n\nOne of our customers had a machine failure: A control block had unexpectedly failed after very long time of operation. Replacement? It had already been ordered before the failure, but was still in production for some time. Long story short: machine downtime and loss of production.\n\nIn this situation our service team deeply impressed me:\nInstead of waiting, they checked with another long-standing customer, who they knew had a machine of the same type and a control block in stock.\n\nThe result? We picked this one up and sent it to another customer - a temporary loan of the control block across continents!\n\nI have been working in various industries for over 15 years. But I've never experienced this kind of interaction between service and customers!\n\nWhat can we learn from this?\n✅ Excellent service - does not just mean reacting to problems, but finding solutions where others only see obstacles.\n✅ Good customer relations - a genuine partnership-based exchange is what makes such solutions conceivable. Trust and long-term cooperation pay off - for all sides.\n\nHave you ever experienced similarly situations? Even in other fields?",
        "likes": "7",
        "time": {
          "raw": "2h2h",
          "parsed": "12.03.2025",
          "isoString": "2025-03-12T05:02:36.289Z"
        },
        "mediaType": "image",
        "mediaContent": [
          "https://media.licdn.com/dms/image/v2/D4E22AQEx451gH50UvQ/feedshare-shrink_800/B4EZUahpF.G0Ag-/0/1739906781998?e=1744848000&v=beta&t=TWbzptst7R00X9WNSBqVkuM_sxdxlQEVdkz2Ft0VXic"
        ],
        "date": "2025-03-12T05:02:36.289Z"
      },
      {
        "captions": "CASE STUDY - EXCELLENT CUSTOMER-RELATIONSHIP AND CUSTOMER-SERVICE ACROSS CONTINENTS\n\nSometimes it's not the big strategies or long-term plans that make the difference - but quick, pragmatic solutions at critical moments.\n\nOne of our customers had a machine failure: A control block had unexpectedly failed after very long time of operation. Replacement? It had already been ordered before the failure, but was still in production for some time. Long story short: machine downtime and loss of production.\n\nIn this situation our service team deeply impressed me:\nInstead of waiting, they checked with another long-standing customer, who they knew had a machine of the same type and a control block in stock.\n\nThe result? We picked this one up and sent it to another customer - a temporary loan of the control block across continents!\n\nI have been working in various industries for over 15 years. But I've never experienced this kind of interaction between service and customers!\n\nWhat can we learn from this?\n✅ Excellent service - does not just mean reacting to problems, but finding solutions where others only see obstacles.\n✅ Good customer relations - a genuine partnership-based exchange is what makes such solutions conceivable. Trust and long-term cooperation pay off - for all sides.\n\nHave you ever experienced similarly situations? Even in other fields?CASE STUDY - EXCELLENT CUSTOMER-RELATIONSHIP AND CUSTOMER-SERVICE ACROSS CONTINENTS\n\nSometimes it's not the big strategies or long-term plans that make the difference - but quick, pragmatic solutions at critical moments.\n\nOne of our customers had a machine failure: A control block had unexpectedly failed after very long time of operation. Replacement? It had already been ordered before the failure, but was still in production for some time. Long story short: machine downtime and loss of production.\n\nIn this situation our service team deeply impressed me:\nInstead of waiting, they checked with another long-standing customer, who they knew had a machine of the same type and a control block in stock.\n\nThe result? We picked this one up and sent it to another customer - a temporary loan of the control block across continents!\n\nI have been working in various industries for over 15 years. But I've never experienced this kind of interaction between service and customers!\n\nWhat can we learn from this?\n✅ Excellent service - does not just mean reacting to problems, but finding solutions where others only see obstacles.\n✅ Good customer relations - a genuine partnership-based exchange is what makes such solutions conceivable. Trust and long-term cooperation pay off - for all sides.\n\nHave you ever experienced similarly situations? Even in other fields?",
        "likes": "7",
        "time": {
          "raw": "2h",
          "parsed": "26.02.2025",
          "isoString": "2025-02-26T05:02:36.290Z"
        },
        "mediaType": "image",
        "mediaContent": [
          "https://media.licdn.com/dms/image/v2/D4E22AQEx451gH50UvQ/feedshare-shrink_800/B4EZUahpF.G0Ag-/0/1739906781998?e=1744848000&v=beta&t=TWbzptst7R00X9WNSBqVkuM_sxdxlQEVdkz2Ft0VXic"
        ],
        "date": "2025-02-26T05:02:36.290Z"
      },
      {
        "captions": "☀️💪😎Transforming the metal circular economy for a better tomorrow. Together, we can build a greener and more efficient world! 🌍♻️ \n\nRuslan Pereira Jean L.  \n\n#CircularEconomy #Sustainability #Innovation #Chatarra #Sucata #WeAreLindemann #MetalRecycling #LindemannMetalRecycling #EconomiaCircular #ReciclagemTransforming the metal circular economy for a better tomorrow. Together, we can build a greener and more efficient world! 🌍♻️ \n\nRuslan Pereira Jean L.  \n\n#CircularEconomy #Sustainability #Innovation #Chatarra #Sucata #WeAreLindemann #MetalRecycling #LindemannMetalRecycling #EconomiaCircular #Reciclagem",
        "likes": "13",
        "time": {
          "raw": "2h2h",
          "parsed": "12.03.2025",
          "isoString": "2025-03-12T05:02:36.291Z"
        },
        "mediaType": "image",
        "mediaContent": [
          "https://media.licdn.com/dms/image/v2/D4D22AQGotAzvnQBaDQ/feedshare-shrink_800/B4DZUfYSCHHkAk-/0/1739988241755?e=1744848000&v=beta&t=9qJGPQd_TFD38ulNT2eAPSWnZ2t6oOvsz4XH9YJop9Q"
        ],
        "date": "2025-03-12T05:02:36.291Z"
      },
      {
        "captions": "Transforming the metal circular economy for a better tomorrow. Together, we can build a greener and more efficient world! 🌍♻️ \n\nRuslan Pereira Jean L.  \n\n#CircularEconomy #Sustainability #Innovation #Chatarra #Sucata #WeAreLindemann #MetalRecycling #LindemannMetalRecycling #EconomiaCircular #ReciclagemTransforming the metal circular economy for a better tomorrow. Together, we can build a greener and more efficient world! 🌍♻️ \n\nRuslan Pereira Jean L.  \n\n#CircularEconomy #Sustainability #Innovation #Chatarra #Sucata #WeAreLindemann #MetalRecycling #LindemannMetalRecycling #EconomiaCircular #Reciclagem",
        "likes": "13",
        "time": {
          "raw": "2h",
          "parsed": "26.02.2025",
          "isoString": "2025-02-26T05:02:36.292Z"
        },
        "mediaType": "image",
        "mediaContent": [
          "https://media.licdn.com/dms/image/v2/D4D22AQGotAzvnQBaDQ/feedshare-shrink_800/B4DZUfYSCHHkAk-/0/1739988241755?e=1744848000&v=beta&t=9qJGPQd_TFD38ulNT2eAPSWnZ2t6oOvsz4XH9YJop9Q"
        ],
        "date": "2025-02-26T05:02:36.292Z"
      },
      {
        "captions": "At the 12th International Material Recycling Convention & Exposition,\nheld by MRAI, LINDEMANN  made a significant impact, joining 2,500 delegates from around the world. 🌍✨ Keegan Vas represented the company in a high-profile panel discussion on the role of technology in scrap processing. He showcased innovative solutions, including the Index and the groundbreaking thermal camera for shredders. 🔥🤖\n\nThe panel, featuring experts from different branches, sparked lively debates on AI-driven sorting, sensor-based separation, and advanced processing techniques. These discussions set new standards for productivity, sustainability, and the future of the recycling industry. ♻️🚀\n\nLINDEMANN's booth at the exhibition was buzzing with activity, further reinforcing the company's commitment to pushing the boundaries of metal recycling. The future of the industry looks bright! 💡\n\n#MetalRecycling #MetalRecyclingSolutions #RecycleForChange #RecycleResponsibly #GreenFuture #RecycleForABetterFuture #CircularEconomy #Ecomondo #EcotecSolutions #Sustainability #Innovation#IMRC2025 #RecyclingTechnology",
        "likes": "31",
        "shares": "2",
        "time": {
          "raw": "2h",
          "parsed": "26.02.2025",
          "isoString": "2025-02-26T05:02:36.293Z"
        },
        "mediaType": "document",
        "mediaContent": {
          "title": "MRAI",
          "subtitle": "4 sayfa",
          "totalPages": 4,
          "coverPages": [
            {
              "type": "image",
              "config": {
                "src": "https://media.licdn.com/dms/image/v2/D4E1FAQHLeX5PLr-OQg/feedshare-document-cover-images_480/B4EZUdtBuwGgBM-/0/1739960105265?e=1742364000&v=beta&t=a313Xjo-cUt1z2VBuPL7X22-ZAP7nN0znJUcngkja6E"
              }
            },
            {
              "type": "image",
              "config": {
                "src": "https://media.licdn.com/dms/image/v2/D4E1FAQHLeX5PLr-OQg/feedshare-document-cover-images_480/B4EZUdtBuwGgBM-/1/1739960105265?e=1742364000&v=beta&t=68D7GCmDZLpMqhyCNX63QDAHo753xKNHhf9lwv8Dwlo"
              }
            },
            {
              "type": "image",
              "config": {
                "src": "https://media.licdn.com/dms/image/v2/D4E1FAQHLeX5PLr-OQg/feedshare-document-cover-images_480/B4EZUdtBuwGgBM-/2/1739960105265?e=1742364000&v=beta&t=xfbGtqmatBL7llzBudlhvPy4CDbRjWHE8kji-fcmvnQ"
              }
            }
          ]
        },
        "date": "2025-02-26T05:02:36.293Z"
      },
      {
        "captions": "Designed for ultimate operator comfort and precision, the LINDEMANN shredder cabin sets the standard for modern recycling equipment.\n\n✅ Climate Control: Equipped with heating and air-conditioning, the cabin provides optimal comfort in all weather conditions.\n\n✅ Enhanced Monitoring: An advanced graphic visualization system with Siemens TP series ensures seamless machine monitoring, so operators can stay in control.\n\n✅ Ergonomic Excellence: The rotating control chair, with adjustable length and height, features dampers for smoother operation. Separate replacement options for seat cushions, armrests, and headrests mean longer-lasting comfort.\n\n✅ Optimal Visibility: Angled and reinforced safety glass minimizes reflections, providing an unobstructed view of the worksite.\n\n✅ Intuitive Controls: Joysticks and push buttons are integrated into the armrests for effortless operation, while the adjustable side-wall-mounted control panel puts everything within reach.\n\nBuilt with comfort, safety, and efficiency in mind. Stay tuned for more insights into our machine features!\n\n#MetalRecycling #MetalRecyclingSolutions #RecycleForChange #RecycleResponsibly #GreenFuture #RecycleForABetterFuture #CleanerPlanet #CircularEconomy #CarbonReduction #ShredderParts #cabin Designed for ultimate operator comfort and precision, the LINDEMANN shredder cabin sets the standard for modern recycling equipment.\n\n✅ Climate Control: Equipped with heating and air-conditioning, the cabin provides optimal comfort in all weather conditions.\n\n✅ Enhanced Monitoring: An advanced graphic visualization system with Siemens TP series ensures seamless machine monitoring, so operators can stay in control.\n\n✅ Ergonomic Excellence: The rotating control chair, with adjustable length and height, features dampers for smoother operation. Separate replacement options for seat cushions, armrests, and headrests mean longer-lasting comfort.\n\n✅ Optimal Visibility: Angled and reinforced safety glass minimizes reflections, providing an unobstructed view of the worksite.\n\n✅ Intuitive Controls: Joysticks and push buttons are integrated into the armrests for effortless operation, while the adjustable side-wall-mounted control panel puts everything within reach.\n\nBuilt with comfort, safety, and efficiency in mind. Stay tuned for more insights into our machine features!\n\n#MetalRecycling #MetalRecyclingSolutions #RecycleForChange #RecycleResponsibly #GreenFuture #RecycleForABetterFuture #CleanerPlanet #CircularEconomy #CarbonReduction #ShredderParts #cabin",
        "likes": "51",
        "comments": "1",
        "shares": "6",
        "time": {
          "raw": "2h",
          "parsed": "26.02.2025",
          "isoString": "2025-02-26T05:02:36.294Z"
        },
        "mediaType": "image",
        "mediaContent": [
          "https://media.licdn.com/dms/image/v2/D5622AQGj_lZn8_Negw/feedshare-shrink_800/B56ZTwf_p5HsAk-/0/1739201709007?e=1744848000&v=beta&t=SsU_lJBjlPcks5OjTqvbIuLPKXI7Wti4CDipRquQfz8"
        ],
        "date": "2025-02-26T05:02:36.294Z"
      },
      {
        "captions": "Location Spotlight: San Antonio, Texas! 🇺🇸\n\nAt LINDEMANN Metal Recycling, we take pride in being close to our customers, no matter where they are. Today, we're highlighting our North American headquarters in the vibrant city of San Antonio, Texas! 🤠\n\nThis dynamic hub is where X incredible team members come together to drive innovation and provide exceptional service. It’s also home to our U.S. service center, which ensures top-notch support for our North American customers. \n\nBut what makes San Antonio so special?\n\n🌵 Known as the \"Alamo City\", San Antonio boasts a rich history, with landmarks like the iconic Alamo and the San Antonio Missions, a UNESCO World Heritage Site.\n\n🌉 The city is famous for the beautiful River Walk, a network of scenic walkways along the San Antonio River filled with restaurants, shops, and cultural experiences.\n\n🎉 San Antonio is also a hub for innovation and business, making it the perfect home for LINDEMANN’s commitment to advancing metal recycling technology in North America.\n\nFrom this dynamic location, we work to deliver cutting-edge recycling solutions and industry-leading support to our customers across the continent.\n\nHave you visited our San Antonio location or experienced its unique charm? Share your thoughts in the comments!\n\n#MetalRecycling #MetalRecyclingSolutions #RecycleForChange #RecycleResponsibly #GreenFuture #RecycleForABetterFuture #CleanerPlanet #CircularEconomy #CarbonReduction #SanAntonio #Spotlight #location #service Location Spotlight: San Antonio, Texas! 🇺🇸\n\nAt LINDEMANN Metal Recycling, we take pride in being close to our customers, no matter where they are. Today, we're highlighting our North American headquarters in the vibrant city of San Antonio, Texas! 🤠\n\nThis dynamic hub is where X incredible team members come together to drive innovation and provide exceptional service. It’s also home to our U.S. service center, which ensures top-notch support for our North American customers. \n\nBut what makes San Antonio so special?\n\n🌵 Known as the \"Alamo City\", San Antonio boasts a rich history, with landmarks like the iconic Alamo and the San Antonio Missions, a UNESCO World Heritage Site.\n\n🌉 The city is famous for the beautiful River Walk, a network of scenic walkways along the San Antonio River filled with restaurants, shops, and cultural experiences.\n\n🎉 San Antonio is also a hub for innovation and business, making it the perfect home for LINDEMANN’s commitment to advancing metal recycling technology in North America.\n\nFrom this dynamic location, we work to deliver cutting-edge recycling solutions and industry-leading support to our customers across the continent.\n\nHave you visited our San Antonio location or experienced its unique charm? Share your thoughts in the comments!\n\n#MetalRecycling #MetalRecyclingSolutions #RecycleForChange #RecycleResponsibly #GreenFuture #RecycleForABetterFuture #CleanerPlanet #CircularEconomy #CarbonReduction #SanAntonio #Spotlight #location #service",
        "likes": "41",
        "shares": "7",
        "time": {
          "raw": "3h",
          "parsed": "19.02.2025",
          "isoString": "2025-02-19T05:02:36.296Z"
        },
        "mediaType": "image",
        "mediaContent": [
          "https://media.licdn.com/dms/image/v2/D5622AQGyKeezGynPZg/feedshare-shrink_800/B56ZTwewfVGQAs-/0/1739201384896?e=1744848000&v=beta&t=bwLbOXZZfIEZtObk3_yMUzdAkEZbctNdGapFnU9nWNU"
        ],
        "date": "2025-02-19T05:02:36.296Z"
      },
      {
        "captions": "Keep Your Machines Running smoothly with LINDEMANN Inspections and Maintenance\n\nTime takes its toll on even the best machines. Over the years, wear and aging can lead to internal leakages and the risk of unexpected failures. That’s where LINDEMANN's inspections and maintenance planning services come in.\n\nOur expert team helps you identify potential issues before they become costly problems, ensuring your machines stay in top shape and delivering peak performance.\n\nDon’t let aging components catch you off guard. Partner with LINDEMANN for proactive care and long-term reliability.\n\n👉 Ready to avoid unpleasant surprises? Discover how we can support your operations: https://lnkd.in/eHZSfXGj\n\n#MetalRecycling #MetalRecyclingSolutions #RecycleForChange #RecycleResponsibly #GreenFuture #RecycleForABetterFuture #CleanerPlanet #CircularEconomy #CarbonReduction #GreenFuture #maintenance #reliability Keep Your Machines Running smoothly with LINDEMANN Inspections and Maintenance\n\nTime takes its toll on even the best machines. Over the years, wear and aging can lead to internal leakages and the risk of unexpected failures. That’s where LINDEMANN's inspections and maintenance planning services come in.\n\nOur expert team helps you identify potential issues before they become costly problems, ensuring your machines stay in top shape and delivering peak performance.\n\nDon’t let aging components catch you off guard. Partner with LINDEMANN for proactive care and long-term reliability.\n\n👉 Ready to avoid unpleasant surprises? Discover how we can support your operations: https://lnkd.in/eHZSfXGj\n\n#MetalRecycling #MetalRecyclingSolutions #RecycleForChange #RecycleResponsibly #GreenFuture #RecycleForABetterFuture #CleanerPlanet #CircularEconomy #CarbonReduction #GreenFuture #maintenance #reliability",
        "likes": "39",
        "shares": "8",
        "time": {
          "raw": "3h",
          "parsed": "19.02.2025",
          "isoString": "2025-02-19T05:02:36.297Z"
        },
        "mediaType": "image",
        "mediaContent": [
          "https://media.licdn.com/dms/image/v2/D4E22AQHZQImFxJfOqg/feedshare-shrink_800/B4EZTwbNTzG0Ag-/0/1739200457091?e=1744848000&v=beta&t=6maN--msrJPaLvqZM9gPsPLFOcNVtWWGsdjg5BBQ2Ps"
        ],
        "date": "2025-02-19T05:02:36.297Z"
      },
      {
        "captions": "🔩 Discover our NxtCut Midsize Scrap Shear in 360°! 🌍\n\nEver wondered what cutting-edge innovation looks like? With our interactive 360° 3D view, you can explore every detail of the NxtCut Midsize Scrap Shear from the comfort of your screen.\n\n📲 Take a closer look at the machine redefining efficiency in metal recycling by following this link: https://lnkd.in/gFxUBhbw\n\nGet a new perspective on performance. Check it out today!\n\n#MetalRecycling #MetalRecyclingSolutions #RecycleForChange #RecycleResponsibly #GreenFuture #RecycleForABetterFuture #CleanerPlanet #CircularEconomy #CarbonReduction #GreenFuture #ScrapShear #InnovationInAction #360View🔩 Discover our NxtCut Midsize Scrap Shear in 360°! 🌍\n\nEver wondered what cutting-edge innovation looks like? With our interactive 360° 3D view, you can explore every detail of the NxtCut Midsize Scrap Shear from the comfort of your screen.\n\n📲 Take a closer look at the machine redefining efficiency in metal recycling by following this link: https://lnkd.in/gFxUBhbw\n\nGet a new perspective on performance. Check it out today!\n\n#MetalRecycling #MetalRecyclingSolutions #RecycleForChange #RecycleResponsibly #GreenFuture #RecycleForABetterFuture #CleanerPlanet #CircularEconomy #CarbonReduction #GreenFuture #ScrapShear #InnovationInAction #360View",
        "likes": "52",
        "comments": "2",
        "shares": "10",
        "time": {
          "raw": "4h",
          "parsed": "12.02.2025",
          "isoString": "2025-02-12T05:02:36.298Z"
        },
        "mediaType": "image",
        "mediaContent": [
          "https://media.licdn.com/dms/image/v2/D5622AQECgkdVfaS25w/feedshare-shrink_800/B56ZTwdk64GoBo-/0/1739201076939?e=1744848000&v=beta&t=SqwXz7M5xzrTb3geSB85ETUaIuWcNUasoIVlR0hOprA"
        ],
        "date": "2025-02-12T05:02:36.298Z"
      },
      {
        "captions": "Thanks for that great opportunity: it was a pleasure to see our ZZ shredder 😎 and how your business is running. Today we were pleased to welcome a group of senior leaders from the metals recycling industry, representing companies from across Europe. The group have been attending a Lindemann industry event being held in Manchester and took the opportunity to visit S. Norton’s £20m world-class shredder installation at our Manchester site. This ambitious investment in recycling technology has increased scrap metal shredding capacity by 50% and produces higher quality ferrous and non-ferrous metals - all while delivering sustainability gains including reduced emissions to atmosphere and lower energy consumption.\n#LindemannMetalRecycling #Metals #Recycling #Sustainability #ManchesterToday we were pleased to welcome a group of senior leaders from the metals recycling industry, representing companies from across Europe. The group have been attending a Lindemann industry event being held in Manchester and took the opportunity to visit S. Norton’s £20m world-class shredder installation at our Manchester site. This ambitious investment in recycling technology has increased scrap metal shredding capacity by 50% and produces higher quality ferrous and non-ferrous metals - all while delivering sustainability gains including reduced emissions to atmosphere and lower energy consumption.\n#LindemannMetalRecycling #Metals #Recycling #Sustainability #Manchester",
        "likes": "31",
        "shares": "2",
        "time": {
          "raw": "3h3h",
          "parsed": "05.03.2025",
          "isoString": "2025-03-05T10:25:48.588Z"
        },
        "mediaType": "image",
        "mediaContent": [
          "https://media.licdn.com/dms/image/v2/D4E22AQGhQmdzvMsfkQ/feedshare-shrink_800/B4EZTWQxADHgAk-/0/1738761509024?e=1744243200&v=beta&t=xbb4hqqIX8Mp9m5XNbH6HTNJg2rchqekOGNcnVRYdTw",
          "https://media.licdn.com/dms/image/v2/D4E22AQHg8C40oPAqkw/feedshare-shrink_800/B4EZTWQxA3GYAo-/0/1738761510858?e=1744243200&v=beta&t=Jb3b-EUQ_eMSKozME7e845CaEBlWKgLXZmC6HyvV9qg",
          "https://media.licdn.com/dms/image/v2/D4E22AQEjDtUCcrQrNw/feedshare-shrink_800/B4EZTWQw_8G0Ag-/0/1738761510602?e=1744243200&v=beta&t=cWKRWimv_xQwbCj8TQg0saH4JyB1WutTL9inAvwX5Ec",
          "https://media.licdn.com/dms/image/v2/D4E22AQF8mbgoL9250w/feedshare-shrink_800/B4EZTWQxBGHUAg-/0/1738761510529?e=1744243200&v=beta&t=HvbJ2jnk0-YrCNrWlvjwMAn-2cXj4q5h527dD2v4AtM"
        ],
        "date": "2025-03-05T10:25:48.588Z"
      },
      {
        "captions": "Today we were pleased to welcome a group of senior leaders from the metals recycling industry, representing companies from across Europe. The group have been attending a Lindemann industry event being held in Manchester and took the opportunity to visit S. Norton’s £20m world-class shredder installation at our Manchester site. This ambitious investment in recycling technology has increased scrap metal shredding capacity by 50% and produces higher quality ferrous and non-ferrous metals - all while delivering sustainability gains including reduced emissions to atmosphere and lower energy consumption.\n#LindemannMetalRecycling #Metals #Recycling #Sustainability #ManchesterToday we were pleased to welcome a group of senior leaders from the metals recycling industry, representing companies from across Europe. The group have been attending a Lindemann industry event being held in Manchester and took the opportunity to visit S. Norton’s £20m world-class shredder installation at our Manchester site. This ambitious investment in recycling technology has increased scrap metal shredding capacity by 50% and produces higher quality ferrous and non-ferrous metals - all while delivering sustainability gains including reduced emissions to atmosphere and lower energy consumption.\n#LindemannMetalRecycling #Metals #Recycling #Sustainability #Manchester",
        "likes": "31",
        "shares": "2",
        "time": {
          "raw": "3h",
          "parsed": "12.02.2025",
          "isoString": "2025-02-12T10:25:48.589Z"
        },
        "mediaType": "image",
        "mediaContent": [
          "https://media.licdn.com/dms/image/v2/D4E22AQGhQmdzvMsfkQ/feedshare-shrink_800/B4EZTWQxADHgAk-/0/1738761509024?e=1744243200&v=beta&t=xbb4hqqIX8Mp9m5XNbH6HTNJg2rchqekOGNcnVRYdTw",
          "https://media.licdn.com/dms/image/v2/D4E22AQHg8C40oPAqkw/feedshare-shrink_800/B4EZTWQxA3GYAo-/0/1738761510858?e=1744243200&v=beta&t=Jb3b-EUQ_eMSKozME7e845CaEBlWKgLXZmC6HyvV9qg",
          "https://media.licdn.com/dms/image/v2/D4E22AQEjDtUCcrQrNw/feedshare-shrink_800/B4EZTWQw_8G0Ag-/0/1738761510602?e=1744243200&v=beta&t=cWKRWimv_xQwbCj8TQg0saH4JyB1WutTL9inAvwX5Ec",
          "https://media.licdn.com/dms/image/v2/D4E22AQF8mbgoL9250w/feedshare-shrink_800/B4EZTWQxBGHUAg-/0/1738761510529?e=1744243200&v=beta&t=HvbJ2jnk0-YrCNrWlvjwMAn-2cXj4q5h527dD2v4AtM"
        ],
        "date": "2025-02-12T10:25:48.589Z"
      },
      {
        "captions": "Did you know? Around 30% of steel is currently produced by recycling scrap, and this is expected to rise to 50% by 2050. ♻️\nRecycling steel not only saves resources but also reduces CO₂ emissions – a win for the planet! 🌱✨\n\nEvery step we take today helps build a greener tomorrow – let's recycle for a sustainable future! 💪🌎♻️\n\n#MetalRecycling #MetalRecyclingSolutions #RecycleForChange #RecycleResponsibly #GreenFuture #RecycleForABetterFuture #Steel",
        "likes": "29",
        "shares": "5",
        "time": {
          "raw": "1ay",
          "parsed": "05.02.2025",
          "isoString": "2025-02-05T10:25:48.590Z"
        },
        "mediaType": "document",
        "mediaContent": {
          "title": "facts",
          "subtitle": "2 sayfa",
          "totalPages": 2,
          "coverPages": [
            {
              "type": "image",
              "config": {
                "src": "https://media.licdn.com/dms/image/v2/D4E1FAQGfdBm4O_B0OQ/feedshare-document-cover-images_480/B4EZSXq8sbHMBI-/0/1737711406819?e=1741777200&v=beta&t=RzclvH1OC4XcNxVxCXZQ2hFMrqYFHqt-vwCl1H2EtJo"
              }
            },
            {
              "type": "image",
              "config": {
                "src": "https://media.licdn.com/dms/image/v2/D4E1FAQGfdBm4O_B0OQ/feedshare-document-cover-images_480/B4EZSXq8sbHMBI-/1/1737711406819?e=1741777200&v=beta&t=gjRuB_5A3kasDDrkRCminPbmXd3Nkd_iqyW9f85pEds"
              }
            }
          ]
        },
        "date": "2025-02-05T10:25:48.590Z"
      },
      {
        "captions": "🇮🇳 India’s Steel Ambitions: A Call for Action in Metal Recycling♻️\n\nBy 2030, India aims to achieve an impressive 250 million tones of steel output, a critical milestone for its industrial and economic growth. But this ambitious target comes with a significant challenge: 700 shredder plants will be required to process the necessary scrap materials, supported by 2,800-3,000 collection and dismantling centers.(Source: Euromonitor, SIAM, Business Sweden Analysis)\n\nThis is a tremendous opportunity for the recycling industry to step up and play a pivotal role in building a more efficient and sustainable supply chain.\n\nAt LINDEMANN, we are committed to driving innovation and delivering advanced solutions that empower businesses to meet these demands. With our cutting-edge shredders and expertise in metal recycling, we’re ready to support India—and the world—on its journey to a more circular economy.\n\nLet’s shape the future of recycling together. 🌟\n\n#MetalRecycling #MetalRecyclingSolutions #RecycleForChange #RecycleResponsibly #GreenFuture #RecycleForABetterFuture #CleanerPlanet #CircularEconomy #CarbonReduction #GreenFuture #India 🇮🇳 India’s Steel Ambitions: A Call for Action in Metal Recycling♻️\n\nBy 2030, India aims to achieve an impressive 250 million tones of steel output, a critical milestone for its industrial and economic growth. But this ambitious target comes with a significant challenge: 700 shredder plants will be required to process the necessary scrap materials, supported by 2,800-3,000 collection and dismantling centers.(Source: Euromonitor, SIAM, Business Sweden Analysis)\n\nThis is a tremendous opportunity for the recycling industry to step up and play a pivotal role in building a more efficient and sustainable supply chain.\n\nAt LINDEMANN, we are committed to driving innovation and delivering advanced solutions that empower businesses to meet these demands. With our cutting-edge shredders and expertise in metal recycling, we’re ready to support India—and the world—on its journey to a more circular economy.\n\nLet’s shape the future of recycling together. 🌟\n\n#MetalRecycling #MetalRecyclingSolutions #RecycleForChange #RecycleResponsibly #GreenFuture #RecycleForABetterFuture #CleanerPlanet #CircularEconomy #CarbonReduction #GreenFuture #India",
        "likes": "37",
        "comments": "2",
        "shares": "6",
        "time": {
          "raw": "1ay",
          "parsed": "05.02.2025",
          "isoString": "2025-02-05T10:25:48.591Z"
        },
        "mediaType": "image",
        "mediaContent": [
          "https://media.licdn.com/dms/image/v2/D4E22AQGoQBsivsiAIQ/feedshare-shrink_800/B4EZSdI9yIGYAg-/0/1737803163338?e=1744243200&v=beta&t=yb5WMdgXtraikTmuR5W-PN9iAvPa7AJSP0u7VnZKh-g"
        ],
        "date": "2025-02-05T10:25:48.591Z"
      },
      {
        "captions": "At LINDEMANN Metal Recycling, our commitment to excellence knows no borders. Across the globe, we deliver industry-leading service and support tailored to meet the unique needs of our customers, wherever they are. 🌍\n\nFrom installation and training to maintenance and spare parts, our expert teams work closely with you at every stage to maximize the efficiency and longevity of your metal recycling equipment. With service technicians strategically located worldwide, we ensure quick response times and minimized downtime for your operations. 📈\n\nAt LINDEMANN, we pride ourselves on delivering not just premium technology but also a partnership built on trust, reliability, and expertise. Whether you’re looking to upgrade your machinery, resolve a technical issue, or plan preventive maintenance, our global team is ready to help you succeed.\n\nWe’re here for you. To get in contact with a team near you, visit: https://lnkd.in/eCbX9HMg\n\n#MetalRecycling #MetalRecyclingSolutions #RecycleForChange #RecycleResponsibly #GreenFuture #RecycleForABetterFuture #CleanerPlanet #CircularEconomy #CarbonReduction #GlobalSupport #CustomerServiceAt LINDEMANN Metal Recycling, our commitment to excellence knows no borders. Across the globe, we deliver industry-leading service and support tailored to meet the unique needs of our customers, wherever they are. 🌍\n\nFrom installation and training to maintenance and spare parts, our expert teams work closely with you at every stage to maximize the efficiency and longevity of your metal recycling equipment. With service technicians strategically located worldwide, we ensure quick response times and minimized downtime for your operations. 📈\n\nAt LINDEMANN, we pride ourselves on delivering not just premium technology but also a partnership built on trust, reliability, and expertise. Whether you’re looking to upgrade your machinery, resolve a technical issue, or plan preventive maintenance, our global team is ready to help you succeed.\n\nWe’re here for you. To get in contact with a team near you, visit: https://lnkd.in/eCbX9HMg\n\n#MetalRecycling #MetalRecyclingSolutions #RecycleForChange #RecycleResponsibly #GreenFuture #RecycleForABetterFuture #CleanerPlanet #CircularEconomy #CarbonReduction #GlobalSupport #CustomerService",
        "likes": "63",
        "comments": "2",
        "shares": "7",
        "time": {
          "raw": "1ay",
          "parsed": "05.02.2025",
          "isoString": "2025-02-05T10:25:48.593Z"
        },
        "mediaType": "image",
        "mediaContent": [
          "https://media.licdn.com/dms/image/v2/D4E22AQGC0uKNfQIclg/feedshare-shrink_800/B4EZS76XtFG0Ag-/0/1738319430927?e=1744243200&v=beta&t=SOsH4n4xDtbS1Unvdadmjbcka3qyobE8mUoOV_SNDtA"
        ],
        "date": "2025-02-05T10:25:48.593Z"
      },
      {
        "captions": "We’re thrilled to announce that LINDEMANN will be participating in the 12th International Material Recycling Convention (IMRC), organized by MRAI, taking place January 28-30, 2025, at the Novotel Jaipur & Convention Centre in Jaipur, India. 🇮🇳 ♻️\n\n Why Attend?✅\n\nThe IMRC is a premier event that unites 3,000+ delegates and 200+ exhibitors from across the global recycling fraternity. It’s a unique platform for networking, showcasing the latest in recycling technologies, exploring business opportunities, and discovering innovative solutions shaping the industry’s future.\n\nAt LINDEMANN, we’re excited to share how our advanced recycling technologies are driving the future of sustainable metal recycling. We will be at booth ...... Don’t forget to stop by to meet our team and discuss how we can help you achieve your goals.\n\n🎟️ Don’t miss out—register now: https://imrc.mrai.org.in\n\n#MetalRecycling #MetalRecyclingSolutions #RecycleForChange #RecycleResponsibly #GreenFuture #RecycleForABetterFuture #CleanerPlanet #CircularEconomy #MRAI #IMRC2025 #RecyclingInnovation #NetworkingOpportunityWe’re thrilled to announce that LINDEMANN will be participating in the 12th International Material Recycling Convention (IMRC), organized by MRAI, taking place January 28-30, 2025, at the Novotel Jaipur & Convention Centre in Jaipur, India. 🇮🇳 ♻️\n\n Why Attend?✅\n\nThe IMRC is a premier event that unites 3,000+ delegates and 200+ exhibitors from across the global recycling fraternity. It’s a unique platform for networking, showcasing the latest in recycling technologies, exploring business opportunities, and discovering innovative solutions shaping the industry’s future.\n\nAt LINDEMANN, we’re excited to share how our advanced recycling technologies are driving the future of sustainable metal recycling. We will be at booth ...... Don’t forget to stop by to meet our team and discuss how we can help you achieve your goals.\n\n🎟️ Don’t miss out—register now: https://imrc.mrai.org.in\n\n#MetalRecycling #MetalRecyclingSolutions #RecycleForChange #RecycleResponsibly #GreenFuture #RecycleForABetterFuture #CleanerPlanet #CircularEconomy #MRAI #IMRC2025 #RecyclingInnovation #NetworkingOpportunity",
        "likes": "35",
        "shares": "5",
        "time": {
          "raw": "1ay",
          "parsed": "05.02.2025",
          "isoString": "2025-02-05T10:25:48.595Z"
        },
        "mediaType": "image",
        "mediaContent": [
          "https://media.licdn.com/dms/image/v2/D4E22AQFScq8XfsCqQQ/feedshare-shrink_800/B4EZSXoDtMGYAg-/0/1737710649488?e=1744243200&v=beta&t=YJ4w6dGb_1F24IZKuKHh3wQpA1-1nSwsumszH5J6iGo"
        ],
        "date": "2025-02-05T10:25:48.595Z"
      },
      {
        "captions": "The LINDEMANN ZZ Shredder beats them all 😎Member news: S Norton Group showcases £20m shredder for metals recycling CEOs\n\nhttps://loom.ly/0DV1b0QMember news: S Norton Group showcases £20m shredder for metals recycling CEOs\n\nhttps://loom.ly/0DV1b0Q",
        "likes": "33",
        "comments": "1",
        "shares": "1",
        "time": {
          "raw": "1g1g",
          "parsed": "12.03.2025",
          "isoString": "2025-03-12T05:02:36.266Z"
        },
        "mediaType": "image",
        "mediaContent": [
          "https://media.licdn.com/dms/image/v2/D4E10AQFPAVcMuVZDJg/image-shrink_800/B4EZWAFHtZGwAg-/0/1741610582846?e=1742364000&v=beta&t=PKZkZI8t1CjIqiBIiNbecAbMExgNedBPVYK9Purtlgg"
        ],
        "date": "2025-03-12T05:02:36.266Z"
      },
      {
        "captions": "Member news: S Norton Group showcases £20m shredder for metals recycling CEOs\n\nhttps://loom.ly/0DV1b0QMember news: S Norton Group showcases £20m shredder for metals recycling CEOs\n\nhttps://loom.ly/0DV1b0Q",
        "likes": "33",
        "comments": "1",
        "shares": "1",
        "time": {
          "raw": "1g",
          "parsed": "11.03.2025",
          "isoString": "2025-03-11T05:02:36.267Z"
        },
        "mediaType": "image",
        "mediaContent": [
          "https://media.licdn.com/dms/image/v2/D4E10AQFPAVcMuVZDJg/image-shrink_800/B4EZWAFHtZGwAg-/0/1741610582846?e=1742364000&v=beta&t=PKZkZI8t1CjIqiBIiNbecAbMExgNedBPVYK9Purtlgg"
        ],
        "date": "2025-03-11T05:02:36.267Z"
      },
      {
        "captions": "♻️ The future of steel is circular.\n \nToday, around 30% of steel is produced using recycled scrap. By 2050, this share is expected to rise to 50%—a major shift toward a more resource-efficient and lower-emission industry.\n \nAt LINDEMANN, we are proud to provide the technology that powers this transformation. Our high-performance shredders and shears help the industry recover more material, optimize processing, and meet the growing demand for recycled steel.\n \nSteel’s strength lies not just in its durability but in its infinite recyclability. Let's shape a cleaner future together.🌱\n \nSource: ING Think: Why ferrous scrap is emerging as a key strategic raw material\n \n#MetalRecycling #MetalRecyclingSolutions #RecycleForChange #RecycleResponsibly #GreenFuture #RecycleForABetterFuture #CleanerPlanet #CircularEconomy #CarbonReduction #technology #Facts♻️ The future of steel is circular.\n \nToday, around 30% of steel is produced using recycled scrap. By 2050, this share is expected to rise to 50%—a major shift toward a more resource-efficient and lower-emission industry.\n \nAt LINDEMANN, we are proud to provide the technology that powers this transformation. Our high-performance shredders and shears help the industry recover more material, optimize processing, and meet the growing demand for recycled steel.\n \nSteel’s strength lies not just in its durability but in its infinite recyclability. Let's shape a cleaner future together.🌱\n \nSource: ING Think: Why ferrous scrap is emerging as a key strategic raw material\n \n#MetalRecycling #MetalRecyclingSolutions #RecycleForChange #RecycleResponsibly #GreenFuture #RecycleForABetterFuture #CleanerPlanet #CircularEconomy #CarbonReduction #technology #Facts",
        "likes": "18",
        "shares": "2",
        "time": {
          "raw": "1g",
          "parsed": "11.03.2025",
          "isoString": "2025-03-11T05:02:36.270Z"
        },
        "mediaType": "image",
        "mediaContent": [
          "https://media.licdn.com/dms/image/v2/D4D22AQG-ZQyjlbMacA/feedshare-shrink_800/B4DZWADRT_GkAg-/0/1741610099555?e=1744848000&v=beta&t=2Iuq-sLKK5Tim0xXaToU1Tafze3n2_XzhbqUTlLrkCs"
        ],
        "date": "2025-03-11T05:02:36.270Z"
      },
      {
        "captions": "💜 Happy International Women’s Day 2025 💜 – Empowerment, Diversity, and Strength! 💪🌍\n \nToday, we celebrate not only the achievements of women worldwide but also the courage, passion, and dedication they put into their work every single day.\n \nWe are especially proud of the strong women in the metal recycling industry who contribute daily to protecting our planet and creating a more sustainable future. 🌱💚\n \nYou are the driving force of change, and we are proud to work alongside you in this fascinating industry. Here’s a glimpse of what happens when women step up and change the world. 💥\n \nWe are honored to work side by side with powerful women like you, who are shaping the future and transforming the world every day. Today, we give you a small insight into the power that emerges when women take action and transform the industry!\n \nYou are true #Changemakers, and we celebrate you today and every day. 💪\n \n#MetalRecycling #MetalRecyclingSolutions #RecycleForChange #RecycleResponsibly #GreenFuture #RecycleForABetterFuture #CleanerPlanet #CircularEconomy #CarbonReduction #technology #InternationalWomensDay #Sustainability #Female #WeAreTransformers💜 Happy International Women’s Day 2025 💜 – Empowerment, Diversity, and Strength! 💪🌍\n \nToday, we celebrate not only the achievements of women worldwide but also the courage, passion, and dedication they put into their work every single day.\n \nWe are especially proud of the strong women in the metal recycling industry who contribute daily to protecting our planet and creating a more sustainable future. 🌱💚\n \nYou are the driving force of change, and we are proud to work alongside you in this fascinating industry. Here’s a glimpse of what happens when women step up and change the world. 💥\n \nWe are honored to work side by side with powerful women like you, who are shaping the future and transforming the world every day. Today, we give you a small insight into the power that emerges when women take action and transform the industry!\n \nYou are true #Changemakers, and we celebrate you today and every day. 💪\n \n#MetalRecycling #MetalRecyclingSolutions #RecycleForChange #RecycleResponsibly #GreenFuture #RecycleForABetterFuture #CleanerPlanet #CircularEconomy #CarbonReduction #technology #InternationalWomensDay #Sustainability #Female #WeAreTransformers",
        "likes": "17",
        "time": {
          "raw": "3g",
          "parsed": "09.03.2025",
          "isoString": "2025-03-09T05:02:36.272Z"
        },
        "mediaType": "image",
        "mediaContent": [
          "https://media.licdn.com/dms/image/v2/D4D22AQHAzU8cu0Pk8w/feedshare-shrink_800/B4DZVwB5HvHIAk-/0/1741341301071?e=1744848000&v=beta&t=_Mx5IUCG7QthOH7Ypb-SFowzvQQ0LNdaVle9K8PQ4pg"
        ],
        "date": "2025-03-09T05:02:36.272Z"
      },
      {
        "captions": "💜 Countdown to International Women’s Day 2025 💜🎥\n \nTomorrow is your day! International Women’s Day 2025 is just around the corner, and we are excited to celebrate you!\n\n At LINDEMANN, we believe that true innovation and progress emerge when everyone raises their voice, shares their perspectives, and empowers one another.\nTomorrow, we will focus on the women who are shaping the future of recycling – with their tireless dedication, passion, and courage to pave new paths. They are the visionaries and trailblazers who drive the industry forward and create a more sustainable world. 🌱💚\n \nA special shoutout goes to our Brazilian team, who have created an impressive video showcasing the strength and determination of women in the industry.\n At LINDEMANN, we are TRANSFORMERS – we are reshaping the future of recycling and setting new standards every day.\n \nTo all the women in our industry – tomorrow (and every other day) we celebrate you! THANK YOU for your impact, your resilience, and your relentless contributions. Let’s continue to build a future where opportunities in metal recycling are open to all – you are the catalysts of change! 💥\n \n🌍♻️ Happy International Women’s Day!\n \n#MetalRecycling #MetalRecyclingSolutions #RecycleForChange #RecycleResponsibly #GreenFuture #RecycleForABetterFuture #CleanerPlanet #CircularEconomy #CarbonReduction #technology #InternationalWomensDay #Sustainability #Female #WeAreTransformers",
        "likes": "58",
        "comments": "2",
        "shares": "8",
        "time": {
          "raw": "4g",
          "parsed": "08.03.2025",
          "isoString": "2025-03-08T05:02:36.274Z"
        },
        "mediaType": "video",
        "mediaContent": {
          "src": [
            {
              "src": "https://dms.licdn.com/playlist/vid/v2/D4D05AQEDOkxn-eSV_Q/mp4-720p-30fp-crf28/B4DZVwAybPHkBg-/0/1741341081815?e=1742364000&v=beta&t=A81Qzm2C8ED4eFvDSzD9mNtwMc3js-Ka41_F6Pm3hYY",
              "type": "video/mp4",
              "data-bitrate": 1274171
            },
            {
              "src": "https://dms.licdn.com/playlist/vid/v2/D4D05AQEDOkxn-eSV_Q/mp4-640p-30fp-crf28/B4DZVwAybPHkBc-/0/1741341080388?e=1742364000&v=beta&t=1_H0nJXkqQBUexQOjHsBBI0La5xQiz2sgp39oyGDXWs",
              "type": "video/mp4",
              "data-bitrate": 988281
            }
          ],
          "posterUrl": "https://media.licdn.com/dms/image/v2/D4D05AQEDOkxn-eSV_Q/videocover-high/B4DZVwAybPHkBs-/0/1741341070458?e=1742364000&v=beta&t=NsZrkgIIddCo9pM70RE5auuMVjRT8JRW6MYQjbUTPJk"
        },
        "date": "2025-03-08T05:02:36.274Z"
      },
      {
        "captions": "Vergangene Woche hieß es wieder: \"Shooting time!\" 📸 📹 Gemeinsam mit Ben Ott haben wir die heiligen Hallen von LINDEMANN betreten und den Jungs aus dem Service- und Repaircenter bei ihrer Arbeit über die Schulter geblickt. \n\nBeeindruckend: die Schrottpresse, die hier im Video zu sehen ist, wiegt um die 40 Tonnen und schafft es binnen 26 Sekunden aus Stanzabfällen ein 40 x 40 cm großes \"Bale\" zum pressen, das dann ca. 300kg wiegt und wieder eingeschmolzen wird. Mehr zu dem Thema findet ihr hier:...https://lnkd.in/eNy6gBUvAre you interested in how our Service Team around Jan-Bernd Krämer is working? Check out this video!\n\nNestled in the industrial landscape of Düsseldorf,\nGermany, LINDEMANN Metal Recycling‘s 8,000 m2 servicenter is one of the best of its kind. For 15 years, this\nfacility has been at the forefront of revolutionizing the\nrepair and refurbishment of a range of rotors and other\ncomponents. Each component undergoes a rigorous\nfailure analysis process to ensure it meets or exceeds\noriginal specifications.\nBehind the scenes, a dedicated team of more than\n20 experts, service technicians, and engineers work\ntirelessly with state-of-the-art machinery to uphold\nLINDEMANN‘s reputation. Their collective expertise and\ncommitment to customer satisfaction are the driving\nforces behind the Service Center‘s success, enabling\nLINDEMANN to consistently deliver outstanding results\nto its customers.\n\n✅ And the EtaPress 44, which you can see in the video here, was fully manufactured and installed in our service center – including mechanics, electrics, and hydraulics.\n\n#teamwork #refurbishing #spareparts #menatwork #servicepower #madeingermany #scrapbaler",
        "likes": "6",
        "comments": "1",
        "shares": "2",
        "time": {
          "raw": "4g4g",
          "parsed": "12.03.2025",
          "isoString": "2025-03-12T05:02:36.275Z"
        },
        "mediaType": "video",
        "mediaContent": {
          "src": [
            {
              "src": "https://dms.licdn.com/playlist/vid/v2/D4E05AQExLVDUjdjFAQ/mp4-720p-30fp-crf28/B4EZVv8wcPGwBg-/0/1741340085913?e=1742364000&v=beta&t=f-c2h42mhn8IO0vvDLQ_DGgsvedpwrk4u_R7Q119jfU",
              "type": "video/mp4",
              "data-bitrate": 1098494
            },
            {
              "src": "https://dms.licdn.com/playlist/vid/v2/D4E05AQExLVDUjdjFAQ/mp4-640p-30fp-crf28/B4EZVv8wcPGwBc-/0/1741340085707?e=1742364000&v=beta&t=sjRxtMpiPhf1UkhcD-5CYWwhtOJdKLDpWjCNZ4HQ2yw",
              "type": "video/mp4",
              "data-bitrate": 822038
            }
          ],
          "posterUrl": "https://media.licdn.com/dms/image/v2/D4E05AQExLVDUjdjFAQ/videocover-low/B4EZVv8wcPGwCM-/0/1741340074857?e=1742364000&v=beta&t=DlS4wbbqcWnH6nvK5-j-gnzG_7g83MUscyG9FTbmmxM"
        },
        "date": "2025-03-12T05:02:36.275Z"
      },
      {
        "captions": "Are you interested in how our Service Team around Jan-Bernd Krämer is working? Check out this video!\n\nNestled in the industrial landscape of Düsseldorf,\nGermany, LINDEMANN Metal Recycling‘s 8,000 m2 servicenter is one of the best of its kind. For 15 years, this\nfacility has been at the forefront of revolutionizing the\nrepair and refurbishment of a range of rotors and other\ncomponents. Each component undergoes a rigorous\nfailure analysis process to ensure it meets or exceeds\noriginal specifications.\nBehind the scenes, a dedicated team of more than\n20 experts, service technicians, and engineers work\ntirelessly with state-of-the-art machinery to uphold\nLINDEMANN‘s reputation. Their collective expertise and\ncommitment to customer satisfaction are the driving\nforces behind the Service Center‘s success, enabling\nLINDEMANN to consistently deliver outstanding results\nto its customers.\n\n✅ And the EtaPress 44, which you can see in the video here, was fully manufactured and installed in our service center – including mechanics, electrics, and hydraulics.\n\n#teamwork #refurbishing #spareparts #menatwork #servicepower #madeingermany #scrapbaler",
        "likes": "80",
        "shares": "10",
        "time": {
          "raw": "4g",
          "parsed": "08.03.2025",
          "isoString": "2025-03-08T05:02:36.276Z"
        },
        "mediaType": "video",
        "mediaContent": {
          "src": [
            {
              "src": "https://dms.licdn.com/playlist/vid/v2/D4E05AQExLVDUjdjFAQ/mp4-720p-30fp-crf28/B4EZVv8wcPGwBg-/0/1741340085913?e=1742364000&v=beta&t=f-c2h42mhn8IO0vvDLQ_DGgsvedpwrk4u_R7Q119jfU",
              "type": "video/mp4",
              "data-bitrate": 1098494
            },
            {
              "src": "https://dms.licdn.com/playlist/vid/v2/D4E05AQExLVDUjdjFAQ/mp4-640p-30fp-crf28/B4EZVv8wcPGwBc-/0/1741340085707?e=1742364000&v=beta&t=sjRxtMpiPhf1UkhcD-5CYWwhtOJdKLDpWjCNZ4HQ2yw",
              "type": "video/mp4",
              "data-bitrate": 822038
            }
          ],
          "posterUrl": "https://media.licdn.com/dms/image/v2/D4E05AQExLVDUjdjFAQ/videocover-low/B4EZVv8wcPGwCM-/0/1741340074857?e=1742364000&v=beta&t=DlS4wbbqcWnH6nvK5-j-gnzG_7g83MUscyG9FTbmmxM"
        },
        "date": "2025-03-08T05:02:36.276Z"
      }
    ]
  },
  {
    "name": "Sierra",
    "followerData": [
      [
        20250213,
        5830
      ],
      [
        20250225,
        5862
      ],
      [
        20250225,
        5862
      ],
      [
        20250225,
        5862
      ],
      [
        20250228,
        5865
      ],
      [
        20250228,
        5865
      ],
      [
        20250228,
        5865
      ],
      [
        20250228,
        5865
      ],
      [
        20250303,
        5874
      ],
      [
        1741011455536,
        "5.874"
      ],
      [
        1741076472538,
        "5.877"
      ],
      [
        1741077615332,
        "5.877"
      ],
      [
        1741083590935,
        "5.877"
      ],
      [
        1741084601735,
        "5.877"
      ],
      [
        1741170361423,
        5880
      ],
      [
        1741755775755,
        5897
      ]
    ],
    "data": [
      {
        "captions": "New challengers in the kitchen! 🔥\n\nTeam Alter Trading —bringing bold flavors, fresh energy, and a competitive edge to Table Scraps: The Chef’s Challenge. These industry pros know their way around the job, but can they handle the heat of the kitchen?\n\nFind out when Table Scraps: The Chef’s Challenge drops March 14th! \n\n🔔 Subscribe on YouTube today! \n🔗 https://lnkd.in/gNG2dRXW\n\n#TableScraps #TheChefsChallenge #RecyclingMeetsCulinary #RecyclingCommunity Michael Goldstein🟧, Patrick Young, Mark Hadacek, Abby Goldstein, John Sacco",
        "likes": "24",
        "comments": "4",
        "shares": "3",
        "time": {
          "raw": "1h",
          "parsed": "05.03.2025",
          "isoString": "2025-03-05T05:02:55.515Z"
        },
        "mediaType": "video",
        "mediaContent": {
          "src": [
            {
              "src": "https://dms.licdn.com/playlist/vid/v2/D5605AQFE7bULTPQ4Fg/mp4-640p-30fp-crf28/B56ZVNuLu8GQBk-/0/1740765711583?e=1742364000&v=beta&t=P1rZ5qkxhK9PrNFIcb2ZYXxPX2YWxWTm8siZEu88vPs",
              "type": "video/mp4",
              "data-bitrate": 858157
            },
            {
              "src": "https://dms.licdn.com/playlist/vid/v2/D5605AQFE7bULTPQ4Fg/mp4-720p-30fp-crf28/B56ZVNuLu8GQBo-/0/1740765711535?e=1742364000&v=beta&t=4NBE6FlJJkbKUXCv75VfHyHTbL41CnE_wNNDNh4h2Xo",
              "type": "video/mp4",
              "data-bitrate": 1142498
            }
          ],
          "posterUrl": "https://media.licdn.com/dms/image/v2/D5605AQFE7bULTPQ4Fg/videocover-high/B56ZVNuLu8GQB0-/0/1740765710943?e=1742364000&v=beta&t=RHrS-KU6GoaSceUu64Q3OiXaY514Qqd-Gtw82VWRuVc"
        },
        "date": "2025-03-05T05:02:55.515Z"
      },
      {
        "captions": "Sierra® T1100 3-in-1? This powerhouse combines three machines in one, delivering unmatched versatility and efficiency. \n\nWith a 36-inch throat, it effortlessly handles bulkier materials and even logs automobiles with ease—outperforming anything else on the market. Plus, the double automatic lubrication system keeps you cutting longer!\n\n📲 Reach out to one of our sales reps today for more information!\n\n#SierraT1100 #RecyclingInnovation #BuiltToPerform Alter Trading",
        "likes": "13",
        "time": {
          "raw": "1h",
          "parsed": "05.03.2025",
          "isoString": "2025-03-05T05:02:55.516Z"
        },
        "mediaType": "video",
        "mediaContent": {
          "src": [
            {
              "src": "https://dms.licdn.com/playlist/vid/v2/D5605AQEMy8sAKSEIRQ/mp4-720p-30fp-crf28/B56ZVOLW6FHEBg-/0/1740773372512?e=1742364000&v=beta&t=pw8_ad8PZ_ibjEUvaBaYAqPO6Ha3s6lX5NdHKikC9ik",
              "type": "video/mp4",
              "data-bitrate": 1273632
            },
            {
              "src": "https://dms.licdn.com/playlist/vid/v2/D5605AQEMy8sAKSEIRQ/mp4-640p-30fp-crf28/B56ZVOLW6FHEBc-/0/1740773367640?e=1742364000&v=beta&t=a5pnZnFV3ikImFXg1PJWKjZOGHY-ha1wZqOfSlDNOjQ",
              "type": "video/mp4",
              "data-bitrate": 993407
            }
          ],
          "posterUrl": "https://media.licdn.com/dms/image/v2/D5605AQEMy8sAKSEIRQ/videocover-high/B56ZVOLW6FHEBs-/0/1740773364340?e=1742364000&v=beta&t=KYsp2vWcOR-f79DaFUNnojW4wilyddiahImi-cx7p34"
        },
        "date": "2025-03-05T05:02:55.516Z"
      },
      {
        "captions": "When we say “The Chef’s Challenge,” we mean it! ⏲️\n\nThis season of Table Scraps raises the stakes, so it’s only fitting that we brought in expert judges to take on the challenge! 🏆\n\nMeet Gino, Lanette, and Antonia—Bakersfield’s very own food and wine legends. With deep roots in the restaurant industry, they know a great dish when they taste one. And what better place to bring them in than Luigi’s (@Luigisbakersfield)—a Bakersfield institution for 115 years and a true cornerstone of the community. 🍝\n\nOh, and fun fact? They also happen to be John Sacco’s in-laws! We love our Luigi’s family!\n\nWill anyone WOW the judges? Find out March 14th! ♻️\n\n#TableScraps #TheChefsChallenge #RecyclingMeetsCulinary #RecyclingCommunity #FoodAndWine #Sustainability #BakersfieldEatsWhen we say “The Chef’s Challenge,” we mean it! ⏲️\n\nThis season of Table Scraps raises the stakes, so it’s only fitting that we brought in expert judges to take on the challenge! 🏆\n\nMeet Gino, Lanette, and Antonia—Bakersfield’s very own food and wine legends. With deep roots in the restaurant industry, they know a great dish when they taste one. And what better place to bring them in than Luigi’s (@Luigisbakersfield)—a Bakersfield institution for 115 years and a true cornerstone of the community. 🍝\n\nOh, and fun fact? They also happen to be John Sacco’s in-laws! We love our Luigi’s family!\n\nWill anyone WOW the judges? Find out March 14th! ♻️\n\n#TableScraps #TheChefsChallenge #RecyclingMeetsCulinary #RecyclingCommunity #FoodAndWine #Sustainability #BakersfieldEats",
        "likes": "23",
        "comments": "2",
        "shares": "3",
        "time": {
          "raw": "1h",
          "parsed": "05.03.2025",
          "isoString": "2025-03-05T05:02:55.517Z"
        },
        "mediaType": "image",
        "mediaContent": [
          "https://media.licdn.com/dms/image/v2/D5622AQHci18dt-Qeuw/feedshare-shrink_800/B56ZVOwRn8GUAg-/0/1740783035453?e=1744848000&v=beta&t=nSlXW9hYCTi_-lp1VpYA2IbS-qaXH6VA5CvChKQ3LYY",
          "https://media.licdn.com/dms/image/v2/D5622AQGCyjl7npFORw/feedshare-shrink_800/B56ZVOwRoOGUAg-/0/1740783034508?e=1744848000&v=beta&t=dTvedA690ZaTdR-S-1t95pi5Lc1Y32MsWQcBNlF4I2M",
          "https://media.licdn.com/dms/image/v2/D5622AQElwuU_v8kE-A/feedshare-shrink_800/B56ZVOwRoAGsAs-/0/1740783034459?e=1744848000&v=beta&t=Or7GvyMCmRZPEtmkflAmUV-OZ1Fyb8KCsMg9cvtSJvo",
          "https://media.licdn.com/dms/image/v2/D5622AQFeJCzrA8siGA/feedshare-shrink_800/B56ZVOwRoIHQAk-/0/1740783034273?e=1744848000&v=beta&t=exvXXtWcUxdvy61JW86bhh3R2Zhp3YGO0LWRI7vqze8",
          "https://media.licdn.com/dms/image/v2/D5622AQHXVkyoJsSfNw/feedshare-shrink_800/B56ZVOwRn8HQAk-/0/1740783034224?e=1744848000&v=beta&t=4M2OlIUBeZ3-G2evqUCI9A1PlfclAnqB2IGNrKP_kzA"
        ],
        "date": "2025-03-05T05:02:55.517Z"
      },
      {
        "captions": "Sierra® E9.6 Ecological Material Handler—built for efficiency and performance⚡️♻️\n\n✅Zero emissions & reduced noise\n\n✅ Energy Plus™ heavy-duty battery for lower operating costs\n\n✅ Unmatched mobility for safe, flexible operation \n\nDesigned for materials like nonferrous metals, cardboard, plastics, and more, the E9.6 is revolutionizing recycling operations! \n\n#SierraE96 #recyclinginnovation #sustainablesolutionsSierra® E9.6 Ecological Material Handler—built for efficiency and performance⚡️♻️\n\n✅Zero emissions & reduced noise\n\n✅ Energy Plus™ heavy-duty battery for lower operating costs\n\n✅ Unmatched mobility for safe, flexible operation \n\nDesigned for materials like nonferrous metals, cardboard, plastics, and more, the E9.6 is revolutionizing recycling operations! \n\n#SierraE96 #recyclinginnovation #sustainablesolutions",
        "likes": "6",
        "time": {
          "raw": "1h",
          "parsed": "05.03.2025",
          "isoString": "2025-03-05T05:02:55.518Z"
        },
        "mediaType": "image",
        "mediaContent": [
          "https://media.licdn.com/dms/image/v2/D5622AQEQt9YMiI8zBA/feedshare-shrink_800/B56ZVNpp3.HQAo-/0/1740764523455?e=1744848000&v=beta&t=NPDbMUtd7Vs1m0oCFexn-jBfzr-kQrsLIBv7IwyjFNQ",
          "https://media.licdn.com/dms/image/v2/D5622AQHRTBkQS4AWEQ/feedshare-shrink_800/B56ZVNpp3wHQAg-/0/1740764523383?e=1744848000&v=beta&t=1MZwndlBnTud8U5In2NT9jG2Uz1uMlTdbqB_sLaQDmE",
          "https://media.licdn.com/dms/image/v2/D5622AQEa09hKtNBilA/feedshare-shrink_800/B56ZVNpp3EGsAg-/0/1740764523601?e=1744848000&v=beta&t=8HD_LMwfnlT1_nEy9Pd0tNwLWSGIpISX_n2Y9Qk_98I",
          "https://media.licdn.com/dms/image/v2/D5622AQHSs9-YwZHSEA/feedshare-shrink_800/B56ZVNpp4CGsAk-/0/1740764522956?e=1744848000&v=beta&t=Tq7qaUDPIM6EOssgs1Jz3rBbfJ2f3jhGfuboyY07o8Y",
          "https://media.licdn.com/dms/image/v2/D5622AQFbM3f_EKo8TA/feedshare-shrink_800/B56ZVNpp38HEAg-/0/1740764523201?e=1744848000&v=beta&t=z2m25DNQvWFd0HyeuSA373DiQQIE2Mo4Hhw5s7trQs8"
        ],
        "date": "2025-03-05T05:02:55.518Z"
      },
      {
        "captions": "Meet Alton Schaubhut ♻️CMC 📌Dallas TX / New Orleans, LA 🎤Team O.G.s\n\n2/2 of the O.G.s! Alton was also a chef on Table Scraps Season 1! He’s bringing his New Oreleans flare to the Chef’s Challenge! Meeting Andrew through REMA & Season 1, they think they have what it takes to win the chef’s challenge…\n\nSee who takes home the Chef’s trophy→ March 14th! 📺Subscribe on Youtube – https://lnkd.in/gBt__iug",
        "likes": "34",
        "comments": "6",
        "shares": "1",
        "time": {
          "raw": "4g",
          "parsed": "01.03.2025",
          "isoString": "2025-03-01T10:26:01.188Z"
        },
        "mediaType": "video",
        "mediaContent": {
          "src": [
            {
              "src": "https://dms.licdn.com/playlist/vid/v2/D5605AQFjtzKx8eV8bw/mp4-720p-30fp-crf28/B56ZVNZ7erGsBg-/0/1740760419333?e=1741777200&v=beta&t=-shjIlMtNUzzvhAJ9YuhRBZhC30ZBZ-GUjzmCbHgxg8",
              "type": "video/mp4",
              "data-bitrate": 1183202
            },
            {
              "src": "https://dms.licdn.com/playlist/vid/v2/D5605AQFjtzKx8eV8bw/mp4-640p-30fp-crf28/B56ZVNZ7erGsBc-/0/1740760417437?e=1741777200&v=beta&t=sI88_NG7xAVVWUzDfM_fzvDg2aQIrUwVg4RiAL9s1o8",
              "type": "video/mp4",
              "data-bitrate": 898784
            }
          ],
          "posterUrl": "https://media.licdn.com/dms/image/v2/D5605AQFjtzKx8eV8bw/videocover-high/B56ZVNZ7erGsBs-/0/1740760413058?e=1741777200&v=beta&t=Ts4aZstH-apIHQN5kG9XYpGDELiS0tx4s8v3tUtBR48"
        },
        "date": "2025-03-01T10:26:01.188Z"
      },
      {
        "captions": "Season 2 of Table Scraps: The Chef's Challenge is almost here, bringing the recycling community together in a whole new way!\n\nBefore we fire up the kitchen again, have you watched Season 1? 🍴🥩\n\n📺 Catch up now: https://lnkd.in/gxcqsxJS",
        "likes": "13",
        "shares": "2",
        "time": {
          "raw": "5g",
          "parsed": "28.02.2025",
          "isoString": "2025-02-28T10:26:01.188Z"
        },
        "mediaType": "video",
        "mediaContent": {
          "src": [
            {
              "src": "https://dms.licdn.com/playlist/vid/v2/D5605AQEhwbt1g8Vu8w/mp4-720p-30fp-crf28/B56ZVIZVeoGsBg-/0/1740676366300?e=1741777200&v=beta&t=7n5WEc9-R3LCFmJSOoWkYVE4BsT2AcHmtiKfrFUMpCw",
              "type": "video/mp4",
              "data-bitrate": 1337622
            },
            {
              "src": "https://dms.licdn.com/playlist/vid/v2/D5605AQEhwbt1g8Vu8w/mp4-640p-30fp-crf28/B56ZVIZVeoGsBc-/0/1740676366368?e=1741777200&v=beta&t=BIVAGMJ6XD7lJYztiYUdVdOXsmgNuDquh-iAShUwpOo",
              "type": "video/mp4",
              "data-bitrate": 1014901
            }
          ],
          "posterUrl": "https://media.licdn.com/dms/image/v2/D5605AQEhwbt1g8Vu8w/feedshare-thumbnail_720_1280/B56ZVIZVeoGsA8-/0/1740676360868?e=1741777200&v=beta&t=kp7Yj_JtIY-v7wChxZOV2fVHfvhlshhxVjEgmXFTBr8"
        },
        "date": "2025-02-28T10:26:01.188Z"
      },
      {
        "captions": "Out in the yard! 🦾 Efficiency you can hear. 🔊♻️ Aluminum radiators baled and ready for recycling—another step in keeping valuable materials in the loop. #SustainableSolutions #RecyclingInAction",
        "likes": "2",
        "time": {
          "raw": "4g5g",
          "parsed": "04.03.2025",
          "isoString": "2025-03-04T10:36:41.483Z"
        },
        "mediaType": "video",
        "mediaContent": {
          "src": [
            {
              "src": "https://dms.licdn.com/playlist/vid/v2/D5605AQGrpZ2FI-kw9g/mp4-720p-30fp-crf28/B56ZVD.qEVGQBg-/0/1740602263147?e=1741690800&v=beta&t=Yt1GJ6XNo2OhiwII3NcBAieUCafSbVQ7AQxfh_xldSc",
              "type": "video/mp4",
              "data-bitrate": 1229157
            },
            {
              "src": "https://dms.licdn.com/playlist/vid/v2/D5605AQGrpZ2FI-kw9g/mp4-640p-30fp-crf28/B56ZVD.qEVGQBc-/0/1740602262071?e=1741690800&v=beta&t=yH0AoUrkqV6wxbD8xB7lBKumbZYMtnnm9lkQA0rSwvE",
              "type": "video/mp4",
              "data-bitrate": 925153
            }
          ],
          "posterUrl": "https://media.licdn.com/dms/image/v2/D5605AQGrpZ2FI-kw9g/videocover-high/B56ZVD.qEVGQBs-/0/1740602259719?e=1741690800&v=beta&t=YnLnQ2maRds0xzNd60t15mk6MStavZ_fLd9lQUPuWaY"
        },
        "date": "2025-03-04T10:36:41.483Z"
      },
      {
        "captions": "Efficiency you can hear. 🔊♻️ Aluminum radiators baled and ready for recycling—another step in keeping valuable materials in the loop. #SustainableSolutions #RecyclingInAction",
        "time": {
          "raw": "5g",
          "parsed": "27.02.2025",
          "isoString": "2025-02-27T10:36:41.484Z"
        },
        "mediaType": "video",
        "mediaContent": {
          "src": [
            {
              "src": "https://dms.licdn.com/playlist/vid/v2/D5605AQGrpZ2FI-kw9g/mp4-720p-30fp-crf28/B56ZVD.qEVGQBg-/0/1740602263147?e=1741690800&v=beta&t=Yt1GJ6XNo2OhiwII3NcBAieUCafSbVQ7AQxfh_xldSc",
              "type": "video/mp4",
              "data-bitrate": 1229157
            },
            {
              "src": "https://dms.licdn.com/playlist/vid/v2/D5605AQGrpZ2FI-kw9g/mp4-640p-30fp-crf28/B56ZVD.qEVGQBc-/0/1740602262071?e=1741690800&v=beta&t=yH0AoUrkqV6wxbD8xB7lBKumbZYMtnnm9lkQA0rSwvE",
              "type": "video/mp4",
              "data-bitrate": 925153
            }
          ],
          "posterUrl": "https://media.licdn.com/dms/image/v2/D5605AQGrpZ2FI-kw9g/videocover-high/B56ZVD.qEVGQBs-/0/1740602259719?e=1741690800&v=beta&t=YnLnQ2maRds0xzNd60t15mk6MStavZ_fLd9lQUPuWaY"
        },
        "date": "2025-02-27T10:36:41.484Z"
      },
      {
        "captions": "Meet Andrew Lincoln! ♻️Lincoln Recycling 📌Erie, PA 🎤Team O.G.s\n\nAndrew was a chef on Table Scraps Season 1! He’s back & bringing his experience to the Chef’s Challenge! John Sacco & Andrew bonded over their shared love of cooking & food. He’s teamed up with another familiar face: Alton Schaubhut to bring the heat to Bakersfield. (Missing their other teammate Michael Sciaba who couldn’t make it😔)\n\nWatch Andrew cook → March 14th! 📺 Subscribe on Youtube – link in bio!",
        "likes": "48",
        "comments": "8",
        "shares": "2",
        "time": {
          "raw": "5g",
          "parsed": "27.02.2025",
          "isoString": "2025-02-27T10:36:41.484Z"
        },
        "mediaType": "video",
        "mediaContent": {
          "src": [
            {
              "src": "https://dms.licdn.com/playlist/vid/v2/D5605AQFyH_PT1-4aYQ/mp4-720p-30fp-crf28/B56ZVDKeMsHEBk-/0/1740588604050?e=1741690800&v=beta&t=6W0hS-_ACr0Qz8ZDdudWLicFXsFcY8R5Hu_us1m2XQI",
              "type": "video/mp4",
              "data-bitrate": 892620
            },
            {
              "src": "https://dms.licdn.com/playlist/vid/v2/D5605AQFyH_PT1-4aYQ/mp4-640p-30fp-crf28/B56ZVDKeMsHEBg-/0/1740588609762?e=1741690800&v=beta&t=GDhM18yR4T5ymzMXSGwUEwWamT329MZ0hac1h_-mp4M",
              "type": "video/mp4",
              "data-bitrate": 678836
            }
          ],
          "posterUrl": "https://media.licdn.com/dms/image/v2/D5605AQFyH_PT1-4aYQ/feedshare-thumbnail_720_1280/B56ZVDKeMsHEBA-/0/1740588574536?e=1741690800&v=beta&t=cUTtjyCP-S7XDkrpm0yP7mFK6BidYjFnRcCfqcdayRQ"
        },
        "date": "2025-02-27T10:36:41.484Z"
      },
      {
        "captions": "Team OG’s- back for another year, bringing skills, experience, and a whole lot of flavor to the challenge. Are they the ones to beat? 👀\n\nPremiering March 14th—who’s hungry?🍴 \n\n🔔 Don’t miss out, subscribe on YouTube today!\n\n#TableScraps #TheChefsChallenge #RecyclingMeetsCulinary #RecyclingCommunity \nAndrew Lincoln, Alton Schaubhut",
        "likes": "14",
        "comments": "4",
        "shares": "1",
        "time": {
          "raw": "6g",
          "parsed": "26.02.2025",
          "isoString": "2025-02-26T10:36:41.485Z"
        },
        "mediaType": "video",
        "mediaContent": {
          "src": [
            {
              "src": "https://dms.licdn.com/playlist/vid/v2/D5605AQF62KDsDfihbA/mp4-720p-30fp-crf28/B56ZU.vISGGsBg-/0/1740514301701?e=1741690800&v=beta&t=5BF2i6F_RY54d0RA-oYW2_dsv5Br5v8KbVHga9hh14g",
              "type": "video/mp4",
              "data-bitrate": 936933
            },
            {
              "src": "https://dms.licdn.com/playlist/vid/v2/D5605AQF62KDsDfihbA/mp4-640p-30fp-crf28/B56ZU.vISGGsBc-/0/1740514301482?e=1741690800&v=beta&t=hT-7ZmfRbFRDOcpDe-t1cdjunnGsy7OsC8uJizVNbvk",
              "type": "video/mp4",
              "data-bitrate": 721512
            }
          ],
          "posterUrl": "https://media.licdn.com/dms/image/v2/D5605AQF62KDsDfihbA/videocover-high/B56ZU.vISGGsBs-/0/1740514300877?e=1741690800&v=beta&t=axniKWjFgLA_6fxz0IRVvUuR_rtdJJjfXgn6pGH4yHw"
        },
        "date": "2025-02-26T10:36:41.485Z"
      },
      {
        "captions": "The Sierra S5000 baler makes a compact stainless steel bale, there is nothing that competes with this unit !!! \n\n#sierrainternationalmachinery\n#scrapmetal #recycledmaterials\n#portablebaler #amplirollsystemThe Sierra S5000 baler makes a compact stainless steel bale, there is nothing that competes with this unit !!! \n\n#sierrainternationalmachinery\n#scrapmetal #recycledmaterials\n#portablebaler #amplirollsystem",
        "likes": "17",
        "shares": "1",
        "time": {
          "raw": "6g",
          "parsed": "26.02.2025",
          "isoString": "2025-02-26T10:36:41.486Z"
        },
        "mediaType": "image",
        "mediaContent": [
          "https://media.licdn.com/dms/image/v2/D4D22AQH-gASDuzg16g/feedshare-shrink_800/B4DZU.jA4nGcAk-/0/1740511126491?e=1744243200&v=beta&t=l-TSV53CSabZvgGyhMqC1hEpfK5BGu50zXl-p4___-4",
          "https://media.licdn.com/dms/image/v2/D4D22AQFuCtGh1Xccgg/feedshare-shrink_800/B4DZU.jA3bHkAk-/0/1740511126081?e=1744243200&v=beta&t=_TsUN5n6JI4oKWM8aZBtuuZRAfooNRyPlsqnjdjJLNo",
          "https://media.licdn.com/dms/image/v2/D4D22AQESkJrlDvSL4Q/feedshare-shrink_800/B4DZU.jA4SGcAg-/0/1740511125803?e=1744243200&v=beta&t=aHRlsviJCMrynWDD8g2ZoRnq_I6ld1z75L9_N81RekU"
        ],
        "date": "2025-02-26T10:36:41.486Z"
      },
      {
        "captions": "Reb-1 baler heading to recycling facility in the NE where it will be processing plastic and aluminum cans to then be repurposed into new products ♻️✅Sierra International MachineryReb-1 baler heading to recycling facility in the NE where it will be processing plastic and aluminum cans to then be repurposed into new products ♻️✅Sierra International Machinery",
        "likes": "18",
        "comments": "1",
        "shares": "1",
        "time": {
          "raw": "6g",
          "parsed": "26.02.2025",
          "isoString": "2025-02-26T10:36:41.488Z"
        },
        "mediaType": "image",
        "mediaContent": [
          "https://media.licdn.com/dms/image/v2/D4E22AQHMPZpIDfVW1Q/feedshare-shrink_800/B4EZU.TQa3H0Ak-/0/1740506992724?e=1744243200&v=beta&t=g10lkipEJhWaU2xuu88heM950_8Tv5WErJNMpYxhD2o",
          "https://media.licdn.com/dms/image/v2/D4E22AQGeeq9Dmbg4cw/feedshare-shrink_800/B4EZU.TQb9HMAg-/0/1740506993651?e=1744243200&v=beta&t=uQDeSvbQU0hdE81e8ypsE5KP_EUemcyn5inPHH5vCDw"
        ],
        "date": "2025-02-26T10:36:41.488Z"
      },
      {
        "captions": "The Sierra® RB6000: Unmatched Power & Performance. ♻️\n\nWhen it comes to baling and logging, the RB6000 sets the standard:\n\n✅ Most powerful in its class\n\n✅ Handles up to 32 tons per hour\n\n✅ Mill-spec bales & high-density logging\n\n✅ Built to last with Hardox® 450 liners\n\nWith a 170 HP Cummins Turbo Diesel Engine and an industry-leading crane, this machine is designed for maximum efficiency and reliability.\n\n📩 Ready to upgrade your operation? Reach out today!\n\n🔗 https://lnkd.in/gZ5HMB9P\n\n#RB6000 #RecyclingIndustry #HeavyMachinery #Efficiency #BuiltToWork",
        "likes": "3",
        "time": {
          "raw": "6g",
          "parsed": "26.02.2025",
          "isoString": "2025-02-26T10:36:41.489Z"
        },
        "mediaType": "video",
        "mediaContent": {
          "src": [
            {
              "src": "https://dms.licdn.com/playlist/vid/v2/D5605AQEQy8nN9Xm6ow/mp4-640p-30fp-crf28/B56ZU98dOkHEBc-/0/1740501020955?e=1741690800&v=beta&t=tGuzgwW_2mwN_4Euz-vS3dlmrnAurLodg2kRgzkLn-0",
              "type": "video/mp4",
              "data-bitrate": 1084675
            },
            {
              "src": "https://dms.licdn.com/playlist/vid/v2/D5605AQEQy8nN9Xm6ow/mp4-720p-30fp-crf28/B56ZU98dOkHEBg-/0/1740501022032?e=1741690800&v=beta&t=WpQ7HSIsKyHTVaamhWybh9Jm38X7_vT-LAK4Sz5W-48",
              "type": "video/mp4",
              "data-bitrate": 1411652
            }
          ],
          "posterUrl": "https://media.licdn.com/dms/image/v2/D5605AQEQy8nN9Xm6ow/videocover-high/B56ZU98dOkHEBs-/0/1740501019142?e=1741690800&v=beta&t=X31dmmfRVgGAz9mKHIMLEbMfPX1I9Cb4BTcs7QM6tIw"
        },
        "date": "2025-02-26T10:36:41.489Z"
      },
      {
        "captions": "Every great dish starts with a story—just like Table Scraps: The Chef’s Challenge did. 🍽️♻️\n\nJohn Sacco breaks down the ‘why’ behind this one-of-a-kind competition: bringing people from all over the world together through the shared bond of recycled materials & food. \n\nYear 2 kicked it up a notch! These foodies will be throwing down their best dishes – find out who has what it takes to win → March 14th 📆\n\n📺 Subscribe on Youtube – link in bio! \n\n#TableScraps #ChefsChallenge #Sustainability #Recycling #foodies",
        "likes": "30",
        "comments": "2",
        "shares": "3",
        "time": {
          "raw": "1h",
          "parsed": "25.02.2025",
          "isoString": "2025-02-25T10:36:41.490Z"
        },
        "mediaType": "video",
        "mediaContent": {
          "src": [
            {
              "src": "https://dms.licdn.com/playlist/vid/v2/D4D05AQGEdiQ_a81dzA/mp4-720p-30fp-crf28/B4DZU5E.7yG8Bg-/0/1740419382172?e=1741690800&v=beta&t=fhbdV0nHyXnmOO3CqNnF9izC8IA-YPfg7PBtM-CU_Ok",
              "type": "video/mp4",
              "data-bitrate": 1340348
            },
            {
              "src": "https://dms.licdn.com/playlist/vid/v2/D4D05AQGEdiQ_a81dzA/mp4-640p-30fp-crf28/B4DZU5E.7yG8Bc-/0/1740419381833?e=1741690800&v=beta&t=IprMs-yANltn799-h4PZRXvQwHW-vj8t4kRn-F8-j7c",
              "type": "video/mp4",
              "data-bitrate": 1012092
            }
          ],
          "posterUrl": "https://media.licdn.com/dms/image/v2/D4D05AQGEdiQ_a81dzA/videocover-high/B4DZU5E.7yG8Bs-/0/1740419377782?e=1741690800&v=beta&t=U550jxCclGenpeUA670zlRD0ALiW7IRn1TlJgjq92cQ"
        },
        "date": "2025-02-25T10:36:41.490Z"
      },
      {
        "captions": "🚨 Meet the competitors! 🚨\n\nThree teams. One kitchen. Who’s claiming the Table Scraps: The Chef’s Challenge title? 🍽️\n\n🏆 Team Alter Q\n🏆 Team International\n🏆 Team OG’s – the original Table Scraps chef’s are BACK!\n\nGet ready for the ultimate recycler showdown—March 14th on YouTube! Don’t miss it. Subscribe now: https://lnkd.in/gtP7jhBm\n\n#TableScraps #ChefsChallenge #RecyclingIndustry #Sustainability #Foodies",
        "likes": "39",
        "comments": "4",
        "shares": "2",
        "time": {
          "raw": "1h",
          "parsed": "25.02.2025",
          "isoString": "2025-02-25T10:36:41.491Z"
        },
        "mediaType": "video",
        "mediaContent": {
          "src": [
            {
              "src": "https://dms.licdn.com/playlist/vid/v2/D5605AQHXLPnMCZf3qQ/mp4-720p-30fp-crf28/B56ZUrBUUUGUBk-/0/1740183530582?e=1741690800&v=beta&t=gJiaIHpxFMi14MDTeCEoM1SCk7xpIGpQB8R4H6Sts1o",
              "type": "video/mp4",
              "data-bitrate": 1051350
            },
            {
              "src": "https://dms.licdn.com/playlist/vid/v2/D5605AQHXLPnMCZf3qQ/mp4-640p-30fp-crf28/B56ZUrBUUUGUBg-/0/1740183530645?e=1741690800&v=beta&t=VDH9_6hSgLBgF7YtnTqxocyM25jDtakFVnBIcEu5o7c",
              "type": "video/mp4",
              "data-bitrate": 666856
            }
          ],
          "posterUrl": "https://media.licdn.com/dms/image/v2/D5605AQHXLPnMCZf3qQ/feedshare-thumbnail_720_1280/B56ZUrBUUUGUBA-/0/1740183527026?e=1741690800&v=beta&t=tETwXng21ac-IfkdnM3smAEg627HrmV2eKs9eAVFzjg"
        },
        "date": "2025-02-25T10:36:41.491Z"
      },
      {
        "captions": "Good morning ☀️ \n\nSierra® T409 Matrial Handler | 📦 #wedotoo Sierra Recycling & DemolitionGood morning ☀️ \n\nSierra® T409 Matrial Handler | 📦 #wedotoo Sierra Recycling & Demolition",
        "likes": "4",
        "time": {
          "raw": "1h",
          "parsed": "25.02.2025",
          "isoString": "2025-02-25T10:36:41.492Z"
        },
        "mediaType": "image",
        "mediaContent": [
          "https://media.licdn.com/dms/image/v2/D5622AQFCcspWuOpP_w/feedshare-shrink_800/B56ZUqq0wbHoAg-/0/1740177625077?e=1744243200&v=beta&t=MhHSF6JvoqaFeRvMmOqIHncT_IE02y0YcwcmzVRSN1Q"
        ],
        "date": "2025-02-25T10:36:41.492Z"
      },
      {
        "captions": "Are you ready? 👀 Here’s a sneak peek at this year’s Table Scraps: The Chef’s Challenge! 🍽️\n\nWhich team of recyclers will come out on top? 🏆 \n\n🎥 Premieres March 14, 2025\n🔔 Don’t miss out—subscribe on YouTube today! https://lnkd.in/gtP7jhBm\n\n#TableScraps #ChefsChallenge #Foodies #RecyclingCommunity \n\nJohn Sacco Michael Goldstein🟦Alton Schaubhut Andrew Lincoln Michael Sciaba Abby Goldstein Patrick Young Mark Hadacek Stuart Kagan 🧿 Atilla W. Antonio Tammaro",
        "likes": "27",
        "comments": "7",
        "shares": "4",
        "time": {
          "raw": "1h",
          "parsed": "25.02.2025",
          "isoString": "2025-02-25T10:36:41.493Z"
        },
        "mediaType": "video",
        "mediaContent": {
          "src": [
            {
              "src": "https://dms.licdn.com/playlist/vid/v2/D5605AQFpG5WU9HJ5lQ/mp4-640p-30fp-crf28/B56ZUpxzssHsBc-/0/1740162694269?e=1741690800&v=beta&t=TsFI5y8-j1QkJ3P1zDCWwpfYwZ6rFleKob-AgoTeJ94",
              "type": "video/mp4",
              "data-bitrate": 928183
            },
            {
              "src": "https://dms.licdn.com/playlist/vid/v2/D5605AQFpG5WU9HJ5lQ/mp4-720p-30fp-crf28/B56ZUpxzssHsBg-/0/1740162691617?e=1741690800&v=beta&t=HG4Wa8AzIAJsectxKQhpn2hNPkFoLyEsiqB3cJPCyJM",
              "type": "video/mp4",
              "data-bitrate": 1230355
            }
          ],
          "posterUrl": "https://media.licdn.com/dms/image/v2/D5605AQFpG5WU9HJ5lQ/feedshare-thumbnail_720_1280/B56ZUpxzssHsA8-/0/1740162679332?e=1741690800&v=beta&t=O8sk2KiQaAWBSTBlOLDi8qeCS7pdLA65SzuxRqsdt8k"
        },
        "date": "2025-02-25T10:36:41.493Z"
      },
      {
        "captions": "Table Scraps is BACK—with an exciting twist! 🍽️\n\nTable Scraps: The Chef’s Challenge premieres March 14th, bringing together fellow recyclers for a fun kitchen showdown! Which team is coming out on top? 🍳🔥\n\nDon’t miss out—subscribe on YouTube today! 🎥 Link in the comments! ⬇️\n#TableScraps #ChefsChallenge #RecyclingIndustry #Sustainability #Foodie\n\n---\n\nAndrew Lincoln, Michael Sciaba, Michael Goldstein🟦, Abby Goldstein, Patrick Young, Mark Hadacek, Stuart Kagan, 🧿 Atilla W., Antonio Tammaro, Alton Schaubhut, John Sacco",
        "likes": "23",
        "comments": "5",
        "shares": "2",
        "time": {
          "raw": "1h",
          "parsed": "25.02.2025",
          "isoString": "2025-02-25T10:36:41.494Z"
        },
        "mediaType": "video",
        "mediaContent": {
          "src": [
            {
              "src": "https://dms.licdn.com/playlist/vid/v2/D5605AQE-ZM1HQUcLvw/mp4-720p-30fp-crf28/B56ZUlrkWPGoBg-/0/1740093943965?e=1741690800&v=beta&t=azXpxmtIvMsd6iOvNX6Rakw-J2emG3XUYP4hyi-RV1Y",
              "type": "video/mp4",
              "data-bitrate": 361000
            },
            {
              "src": "https://dms.licdn.com/playlist/vid/v2/D5605AQE-ZM1HQUcLvw/mp4-640p-30fp-crf28/B56ZUlrkWPGoBc-/0/1740093943736?e=1741690800&v=beta&t=-dl7EnQPsExIC0P1y7_1DrnB2WBoUjOVje3IwOVWa3c",
              "type": "video/mp4",
              "data-bitrate": 273412
            }
          ],
          "posterUrl": "https://media.licdn.com/dms/image/v2/D5605AQE-ZM1HQUcLvw/feedshare-thumbnail_720_1280/B56ZUlrkWPGoA8-/0/1740093934511?e=1741690800&v=beta&t=3tj04-9LLoDFK-U3GMc7BFJ0zMzAZeI9jSKCmsC5dZI"
        },
        "date": "2025-02-25T10:36:41.494Z"
      },
      {
        "captions": "Recycled copper retains its quality indefinitely—making it a critical material in today’s economy.\nThese bales—processed with our Sierra® REB-2—are on their way to becoming:\n\n⚡ Electrical wiring\n💻 Circuit boards\n🔧 Motors & transformers\n🚰 Plumbing systems\n🏠 Roofing & gutters\n🚗 Automotive components\n🔋 EV & battery tech\n✈️ Aerospace materials\n☀️ Renewable energy infrastructure\n\nWhen efficiency, durability, and throughput matter, the REB-2 delivers. More tons. More profit. Let’s talk.",
        "likes": "5",
        "time": {
          "raw": "1h",
          "parsed": "25.02.2025",
          "isoString": "2025-02-25T10:36:41.495Z"
        },
        "mediaType": "video",
        "mediaContent": {
          "src": [
            {
              "src": "https://dms.licdn.com/playlist/vid/v2/D5605AQEI_b6tUuM-8Q/mp4-720p-30fp-crf28/B56ZUkQ6iKGUBo-/0/1740070209849?e=1741690800&v=beta&t=Mpw0jYuScky7KZ1pka5YnTR_2h9vmBjanwW7JjwNawY",
              "type": "video/mp4",
              "data-bitrate": 1304986
            },
            {
              "src": "https://dms.licdn.com/playlist/vid/v2/D5605AQEI_b6tUuM-8Q/mp4-640p-30fp-crf28/B56ZUkQ6iKGUBk-/0/1740070209326?e=1741690800&v=beta&t=iUFaMfvGersNg7iH5jQDV4JsenjgQEC4ESkCelxRa-w",
              "type": "video/mp4",
              "data-bitrate": 992737
            }
          ],
          "posterUrl": "https://media.licdn.com/dms/image/v2/D5605AQEI_b6tUuM-8Q/feedshare-thumbnail_720_1280/B56ZUkQ6iKGUBE-/0/1740070178321?e=1741690800&v=beta&t=pwxLpMHGgTZd1U-BBcpa8L4aTpjle0F06mVc--w2bjk"
        },
        "date": "2025-02-25T10:36:41.495Z"
      },
      {
        "captions": "Sierra Recycling & Demolition is upgrading their operation, and this 2012 T1100CD shear/baler/logger is ready for a new home! \n\nKey features:\n✔️ New Floor for extended durability\n\n✔️ Rebuilt Pusher Cylinder (New Rod & Packing)\n\n✔️ (3) 125 HP Engines for maximum power\n\n✔️ New Brass Wear Plates to reduce friction and extend lifespan\n\n✔️ Shear & Pre-Compression for efficient processing\n\n🎥 Filmed: February 2025\n📍 Location: Bakersfield, CA\n📆 Delivery: March 2025\n\nWith a 29'6\" box and 14,577 hours (as of 10/14/2025) this machine is ready to go to work in your yard. Don’t miss out on this opportunity!\n\n📞 Interested? \nContact our sales team today ➡️ https://lnkd.in/gZ5HMB9P",
        "likes": "7",
        "shares": "2",
        "time": {
          "raw": "1h",
          "parsed": "24.02.2025",
          "isoString": "2025-02-24T14:17:35.295Z"
        },
        "mediaType": "video",
        "mediaContent": {
          "src": [
            {
              "src": "https://dms.licdn.com/playlist/vid/v2/D5605AQGHkczrOqncdQ/mp4-640p-30fp-crf28/B56ZUfF5BhGsBc-/0/1739983415024?e=1741618800&v=beta&t=RqdAKh_7rJvHzPcS6nnpAMSVTWGuaqU7wDo1ddW1pug",
              "type": "video/mp4",
              "data-bitrate": 883019
            },
            {
              "src": "https://dms.licdn.com/playlist/vid/v2/D5605AQGHkczrOqncdQ/mp4-720p-30fp-crf28/B56ZUfF5BhGsBg-/0/1739983416124?e=1741618800&v=beta&t=TOsKsF89Ss8MdfQ7HpRm6awtWVlfTt_x19U4JY_Iszo",
              "type": "video/mp4",
              "data-bitrate": 1159375
            }
          ],
          "posterUrl": "https://media.licdn.com/dms/image/v2/D5605AQGHkczrOqncdQ/videocover-low/B56ZUfF5BhGsCM-/0/1739983410653?e=1741618800&v=beta&t=SVnWGfjdUthmaF4X9ywDW7ZBX1EENtZ8ZFsIx0v3oL8"
        },
        "date": "2025-02-24T14:17:35.295Z"
      },
      {
        "captions": "Cutting I-beam like it’s nothing ✂️\n\nStrength. Speed. Efficiency. That's all the Sierra® T715SKL Shear/Baler/Logger knows! \n\nShear Force - 715 tons\nMain Compression - 170 tons\n\nProcesses: \n\nALL METAL\nSTAINLESS STEEL\nHMS #1 + #2 STEEL\nP&S\n\nFor more info reach out to one of our sales reps today! ➡️ https://lnkd.in/gZ5HMB9P",
        "likes": "5",
        "time": {
          "raw": "1h",
          "parsed": "24.02.2025",
          "isoString": "2025-02-24T14:17:35.296Z"
        },
        "mediaType": "video",
        "mediaContent": {
          "src": [
            {
              "src": "https://dms.licdn.com/playlist/vid/v2/D5605AQFoSPIYO-UoFQ/mp4-720p-30fp-crf28/B56ZUbc2DqHEBk-/0/1739922304647?e=1741618800&v=beta&t=jT-F8EpqjxhKTpkHqWAOOsh-GU5jeggZP2SYJGXwRCc",
              "type": "video/mp4",
              "data-bitrate": 1154348
            },
            {
              "src": "https://dms.licdn.com/playlist/vid/v2/D5605AQFoSPIYO-UoFQ/mp4-640p-30fp-crf28/B56ZUbc2DqHEBg-/0/1739922305437?e=1741618800&v=beta&t=w3mC0XKoYgdsT5d2Bo_kiXycruZULXigriQ_SdxHO1Q",
              "type": "video/mp4",
              "data-bitrate": 840865
            }
          ],
          "posterUrl": "https://media.licdn.com/dms/image/v2/D5605AQFoSPIYO-UoFQ/videocover-high/B56ZUbc2DqHEBw-/0/1739922303756?e=1741618800&v=beta&t=ZMwnP285ccy0fF3Bn809M5m4Ho2_43BYKsd5OfZuLaE"
        },
        "date": "2025-02-24T14:17:35.296Z"
      },
      {
        "captions": "Alter-Adjacent & Team Alter-Q’s secret weapon: Abby Goldstein (Michael Goldstein🟧's other half!) 📍St. Louis, MO\n\nAbby made the trip to Bakersfield for Table Scraps with Michael because of their shared love for food & their friends in the recycled materials industry! 🍽️Abby was keeping the kitchen going with mimosas & key tasks to get the dishes done in time! Tune in on March 14th to see how Team Alter-Q’s dishes turned out! 👀\n\n📺Don’t miss out! Subscribe to our YouTube channel link below!\nhttps://lnkd.in/gtP7jhBm\n\nAlter Trading",
        "likes": "27",
        "comments": "5",
        "shares": "1",
        "time": {
          "raw": "1h",
          "parsed": "05.03.2025",
          "isoString": "2025-03-05T05:02:55.513Z"
        },
        "mediaType": "video",
        "mediaContent": {
          "src": [
            {
              "src": "https://dms.licdn.com/playlist/vid/v2/D5605AQFEvBRK1Z3Fgg/mp4-720p-30fp-crf28/B56ZVdATLVHQB0-/0/1741022141910?e=1742364000&v=beta&t=HrYAa1j0YB63pp6NMAf_pOQSpAQ2frRkjd2C3_oLvxI",
              "type": "video/mp4",
              "data-bitrate": 1180291
            },
            {
              "src": "https://dms.licdn.com/playlist/vid/v2/D5605AQFEvBRK1Z3Fgg/mp4-640p-30fp-crf28/B56ZVdATLVHQBw-/0/1741022140606?e=1742364000&v=beta&t=YmDxTplS4ParnWNSLGpjQAEjua1RT-MLcr-wWQH86N0",
              "type": "video/mp4",
              "data-bitrate": 899038
            }
          ],
          "posterUrl": "https://media.licdn.com/dms/image/v2/D5605AQFEvBRK1Z3Fgg/feedshare-thumbnail_720_1280/B56ZVdATLVHQA8-/0/1741022115962?e=1742364000&v=beta&t=wrWnTmg3Zwh0CD92lIPArgFPObC1d1BLvKSZnijveVA"
        },
        "date": "2025-03-05T05:02:55.513Z"
      },
      {
        "captions": "Say hello to Michael Goldstein🟧! ♻️Alter Trading 🏆St. Louis, MO\n\nMichael & his other half Abby (who you’ll meet later today) came to the Table Scraps The Chef’s Challenge to rep Alter Trading & have some fun! Michael wasn’t so much focused on the food, but rather hyping his team up & making sure no one was caught cooking without a drink! Alter & Sierra go back many years, and we love continuing relationships in the recycled materials industry! 🤝 Cheers, Michael! 🍻\n\nTable Scraps drops March 14th → Subscribe to our Youtube Channel ⭐️ \nhttps://lnkd.in/gtP7jhBm",
        "likes": "38",
        "comments": "9",
        "shares": "1",
        "time": {
          "raw": "1h",
          "parsed": "05.03.2025",
          "isoString": "2025-03-05T05:02:55.514Z"
        },
        "mediaType": "video",
        "mediaContent": {
          "src": [
            {
              "src": "https://dms.licdn.com/playlist/vid/v2/D5605AQGzgBV3kH1iBg/mp4-640p-30fp-crf28/B56ZVc.mRxHsB0-/0/1741021701793?e=1742364000&v=beta&t=Hm2ZMEm9AJTiD00jXnVeHVEn8mpu4DSXxIdUzE2I40g",
              "type": "video/mp4",
              "data-bitrate": 776091
            },
            {
              "src": "https://dms.licdn.com/playlist/vid/v2/D5605AQGzgBV3kH1iBg/mp4-720p-30fp-crf28/B56ZVc.mRxHsB4-/0/1741021701234?e=1742364000&v=beta&t=AnVoPRP30F3XWfhpoIUtqTdlJ6i84NW_Uvqkczhnsr8",
              "type": "video/mp4",
              "data-bitrate": 1021574
            }
          ],
          "posterUrl": "https://media.licdn.com/dms/image/v2/D5605AQGzgBV3kH1iBg/feedshare-thumbnail_720_1280/B56ZVc.mRxHsBA-/0/1741021669679?e=1742364000&v=beta&t=Gmf-0BXDWRRTLRzG4OOYhsGnaNyN1Z346JklqFZjLT4"
        },
        "date": "2025-03-05T05:02:55.514Z"
      },
      {
        "captions": "The Sierra® T900 has been at the top of its class for 20+ years—and for good reason. \n\nWith a powerful yet efficient hydraulic system and a 36” throat for handling bulkier materials, this shear/baler/logger delivers unmatched productivity. 💪⚙️ \n\nAfter 16,000 hours in operation at Sierra Recycling & Demolition’s own yard, we can confidently say it’s built to perform.\n\n#MetalRecycling #SierraT900",
        "likes": "15",
        "time": {
          "raw": "1h",
          "parsed": "05.03.2025",
          "isoString": "2025-03-05T05:02:55.511Z"
        },
        "mediaType": "video",
        "mediaContent": {
          "src": [
            {
              "src": "https://dms.licdn.com/playlist/vid/v2/D5605AQHbF4ZE0gbpwA/mp4-640p-30fp-crf28/B56ZVi3bVtGUBc-/0/1741120456767?e=1742364000&v=beta&t=jEzGaLXLo7EDd_tItfEKm4RdNT-_cJ46Sylrl_pYWEk",
              "type": "video/mp4",
              "data-bitrate": 734765
            },
            {
              "src": "https://dms.licdn.com/playlist/vid/v2/D5605AQHbF4ZE0gbpwA/mp4-720p-30fp-crf28/B56ZVi3bVtGUBg-/0/1741120457286?e=1742364000&v=beta&t=arvrZG6MH-KL8qTN6TdSZ1VxIzqXqNG8XNrR_HmSRr8",
              "type": "video/mp4",
              "data-bitrate": 1001282
            }
          ],
          "posterUrl": "https://media.licdn.com/dms/image/v2/D5605AQHbF4ZE0gbpwA/videocover-high/B56ZVi3bVtGUBs-/0/1741120455061?e=1742364000&v=beta&t=cLZ3oNuuUWRzZZeOMJmbyu7PNWf1K0wiJYhdaavTj9A"
        },
        "date": "2025-03-05T05:02:55.511Z"
      },
      {
        "captions": "Table Scraps🍽️: The Chef’s Challenge is a celebration of the relationships that fuel the recycling community—the shared experiences, the friendly rivalries, and the moments that bring us together.\n\nAnd at the end of the day? It’s just great food and even better company. \n\nSwipe through for a glimpse behind the scenes, and don’t miss Season 2—premiering March 14th!\n\n——\n\nJohn Sacco 🧿 Atilla W. Antonio Tammaro Stuart Kagan Andrew Lincoln Alton Schaubhut Patrick Young Mark Hadacek Michael Goldstein🟧 Abby Goldstein Giovanna SaccoTable Scraps🍽️: The Chef’s Challenge is a celebration of the relationships that fuel the recycling community—the shared experiences, the friendly rivalries, and the moments that bring us together.\n\nAnd at the end of the day? It’s just great food and even better company. \n\nSwipe through for a glimpse behind the scenes, and don’t miss Season 2—premiering March 14th!\n\n——\n\nJohn Sacco 🧿 Atilla W. Antonio Tammaro Stuart Kagan Andrew Lincoln Alton Schaubhut Patrick Young Mark Hadacek Michael Goldstein🟧 Abby Goldstein Giovanna Sacco",
        "likes": "39",
        "comments": "5",
        "shares": "2",
        "time": {
          "raw": "1h",
          "parsed": "05.03.2025",
          "isoString": "2025-03-05T05:02:55.512Z"
        },
        "mediaType": "image",
        "mediaContent": [
          "https://media.licdn.com/dms/image/v2/D5622AQHOTgZHPpl_Rw/feedshare-shrink_800/B56ZVdg2FnGoAg-/0/1741030662433?e=1744848000&v=beta&t=F-rqA03gQI2nRHoxuv7IYcS43cCWQ1DrZpODth70RIY",
          "https://media.licdn.com/dms/image/v2/D5622AQEUY9wRhZc4fg/feedshare-shrink_800/B56ZVdg2FEHQAg-/0/1741030656895?e=1744848000&v=beta&t=sHbtbcu1ljrMvidmtrl3WKoO1OJKZ7z7_FGJmjN2Fts",
          "https://media.licdn.com/dms/image/v2/D5622AQFgh5qmSj9CUw/feedshare-shrink_800/B56ZVdg2FCGsAo-/0/1741030662916?e=1744848000&v=beta&t=1rFBn-oyFc6UWqjtNHSP_ilQD9vgNs_5hp0NmJWHBCw",
          "https://media.licdn.com/dms/image/v2/D5622AQFNzxMwoPT1sQ/feedshare-shrink_800/B56ZVdg2F7GQAg-/0/1741030658375?e=1744848000&v=beta&t=9P1a6pQY179mqw2iBxXtUWaVsPziCwr-jDIGcMPKekU",
          "https://media.licdn.com/dms/image/v2/D5622AQErNAxB4ZeliA/feedshare-shrink_800/B56ZVdg2GPHEAk-/0/1741030656798?e=1744848000&v=beta&t=SdX69gK0pWR59nF31rhWaW3DOJEh4gJWTjIp_BFcIfE"
        ],
        "date": "2025-03-05T05:02:55.512Z"
      },
      {
        "captions": "In the aftermath of the devastating Palisades Fire, our hearts go out to all those affected. As recovery efforts continue, one of Sierra®'s RB6000 portable baler/loggers is on the ground in the Palisades, assisting in the cleanup and recycling efforts. \n\nWhat was lost can find new life through the recycling and repurposing of materials!\n\n#lafires #palisades #rebuildpalisadesIn the aftermath of the devastating Palisades Fire, our hearts go out to all those affected. As recovery efforts continue, one of Sierra®'s RB6000 portable baler/loggers is on the ground in the Palisades, assisting in the cleanup and recycling efforts. \n\nWhat was lost can find new life through the recycling and repurposing of materials!\n\n#lafires #palisades #rebuildpalisades",
        "likes": "6",
        "shares": "1",
        "time": {
          "raw": "5s",
          "parsed": "12.03.2025",
          "isoString": "2025-03-12T00:02:55.491Z"
        },
        "mediaType": "image",
        "mediaContent": [
          "https://media.licdn.com/dms/image/v2/D5610AQHq2TRKohKQTw/image-shrink_800/B56ZWHeczYHQAg-/0/1741734662424?e=1742364000&v=beta&t=3_B1YkQ9HgCWp5V9vynS0d3M9Ahklgbii58tTBIQXSk",
          "https://media.licdn.com/dms/image/v2/D5610AQGiw-y-zOO6Mg/image-shrink_800/B56ZWHec.2HEAc-/0/1741734662523?e=1742364000&v=beta&t=09MC9DUzIgEeXfxHAKyv4pDS4TQRsC0hu8xHH1iwDPM",
          "https://media.licdn.com/dms/image/v2/D5610AQE2MSJGMctn7Q/image-shrink_800/B56ZWHedHiHEAc-/0/1741734663732?e=1742364000&v=beta&t=Or1Uh7FQywko9O1rfQ7tTxIsNWV12Flf60QErW52No0",
          "https://media.licdn.com/dms/image/v2/D5610AQEG9Y50isWlAg/image-shrink_800/B56ZWHedV.HEAc-/0/1741734666077?e=1742364000&v=beta&t=5rH4S9kAJwwXeXBoLRVCcDWT543uq8d2mUSo6zXa6QY",
          "https://media.licdn.com/dms/image/v2/D5610AQGjbbT2uszeJA/image-shrink_800/B56ZWHedl0GoAc-/0/1741734665524?e=1742364000&v=beta&t=W0r6Imjk35ERM7OJ-pzKuZgANcwchxE_k6-Yi9f1-O4"
        ],
        "date": "2025-03-12T00:02:55.491Z"
      },
      {
        "captions": "Next up on Team International:  🧿 Atilla W. 📍Singapore 🤝 Navigate Commodities \n\nAtilla met John Sacco in Copenhagen at the B.I.R. after his impactful presentation! He knows the importance of changing the narrative around the Recycled Materials Industry! AND he also loves to cook 🍽️ Team International is excited about this meal full of Italian influence. We can’t wait to watch this unfold → 3 DAYS! Table Scraps: The Chef’s Challenge coming Friday March 14 on our YouTube Channel! \n\n📺 Subscribe on YouTube: https://lnkd.in/gtP7jhBm",
        "likes": "13",
        "comments": "2",
        "time": {
          "raw": "10s",
          "parsed": "11.03.2025",
          "isoString": "2025-03-11T19:02:55.493Z"
        },
        "mediaType": "video",
        "mediaContent": {
          "src": [
            {
              "src": "https://dms.licdn.com/playlist/vid/v2/D5610AQH0lBXBqxVkRg/mp4-640p-30fp-crf28/B56ZWGkFgcGUBs-/0/1741719370654?e=1742364000&v=beta&t=xpsccUe2M_wh90cmHOOx6egM4ceBSyRQ3PFHcICuwKU",
              "type": "video/mp4",
              "data-bitrate": 914841
            },
            {
              "src": "https://dms.licdn.com/playlist/vid/v2/D5610AQH0lBXBqxVkRg/mp4-360p-30fp-crf28/B56ZWGkFgcGUBo-/0/1741719368494?e=1742364000&v=beta&t=-BxC5uEdVJJfUJ3rYij6WrsKBogc9GhQ6pZbKQ83haU",
              "type": "video/mp4",
              "data-bitrate": 402170
            },
            {
              "src": "https://dms.licdn.com/playlist/vid/v2/D5610AQH0lBXBqxVkRg/mp4-720p-30fp-crf28/B56ZWGkFgcGUBw-/0/1741719370997?e=1742364000&v=beta&t=2k3Q0CPymG8Wd-yN2v0rtSjtGginFPm7F-aULQ8zhk4",
              "type": "video/mp4",
              "data-bitrate": 1229916
            }
          ],
          "posterUrl": "https://media.licdn.com/dms/image/v2/D5610AQH0lBXBqxVkRg/ads-video-thumbnail_720_1280/B56ZWGkFgcGUAc-/0/1741719365126?e=1742364000&v=beta&t=lgkqnV8r-4oRMuZ6Iay3I5XZuMy7SZmQbR_0wiEq3u8"
        },
        "date": "2025-03-11T19:02:55.493Z"
      },
      {
        "captions": "Make sure you say hi 👋 to Cameron Keefe and Tom Jansen at C&D World Conference + Expo - Booth #7!\nSierra International Machinery is proudly exhibiting at the Construction & Demolition Recycling Association (CDRA)’s event C&D World Conference in Dallas, TX. \n\nStop by booth 7 to learn how our two-ram balers and material handlers can help your operations today! \n\n#machinery #networking #TheSierraWaySierra International Machinery is proudly exhibiting at the Construction & Demolition Recycling Association (CDRA)’s event C&D World Conference in Dallas, TX. \n\nStop by booth 7 to learn how our two-ram balers and material handlers can help your operations today! \n\n#machinery #networking #TheSierraWay",
        "time": {
          "raw": "10s10s",
          "parsed": "12.03.2025",
          "isoString": "2025-03-12T05:02:55.498Z"
        },
        "mediaType": "image",
        "mediaContent": [
          "https://media.licdn.com/dms/image/v2/D4E22AQFr4CnA9GSMRw/feedshare-shrink_800/B4EZWGgy2cGwAg-/0/1741718507530?e=1744848000&v=beta&t=f0ZqEZIihUTIJF3pWkwrMvqQcBiEYAfMiu6C6RN7J4c"
        ],
        "date": "2025-03-12T05:02:55.498Z"
      },
      {
        "captions": "Sierra International Machinery is proudly exhibiting at the Construction & Demolition Recycling Association (CDRA)’s event C&D World Conference in Dallas, TX. \n\nStop by booth 7 to learn how our two-ram balers and material handlers can help your operations today! \n\n#machinery #networking #TheSierraWaySierra International Machinery is proudly exhibiting at the Construction & Demolition Recycling Association (CDRA)’s event C&D World Conference in Dallas, TX. \n\nStop by booth 7 to learn how our two-ram balers and material handlers can help your operations today! \n\n#machinery #networking #TheSierraWay",
        "time": {
          "raw": "10s",
          "parsed": "11.03.2025",
          "isoString": "2025-03-11T19:02:55.500Z"
        },
        "mediaType": "image",
        "mediaContent": [
          "https://media.licdn.com/dms/image/v2/D4E22AQFr4CnA9GSMRw/feedshare-shrink_800/B4EZWGgy2cGwAg-/0/1741718507530?e=1744848000&v=beta&t=f0ZqEZIihUTIJF3pWkwrMvqQcBiEYAfMiu6C6RN7J4c"
        ],
        "date": "2025-03-11T19:02:55.500Z"
      },
      {
        "captions": "Sierra, Nuestra 409, perfecto complemento para tus operaciones, movimientos de materiales, carga de maquinaria, rapidez de carga y descarga de góndolas,Sierra, Nuestra 409, perfecto complemento para tus operaciones, movimientos de materiales, carga de maquinaria, rapidez de carga y descarga de góndolas,",
        "likes": "5",
        "shares": "1",
        "time": {
          "raw": "14s",
          "parsed": "11.03.2025",
          "isoString": "2025-03-11T15:02:55.502Z"
        },
        "mediaType": "image",
        "mediaContent": [
          "https://media.licdn.com/dms/image/v2/D4E22AQHBiz7d_tYzQw/feedshare-shrink_800/B4EZWFt7DPHMAo-/0/1741705166334?e=1744848000&v=beta&t=oRIO44iQJkni-B0woXaTQeOoNTXZ603iA3ynun1brIs"
        ],
        "date": "2025-03-11T15:02:55.502Z"
      },
      {
        "captions": "Our Buddy: Stuart Kagan! 📍ATX ♻️BUDDY - Born Scrappy \n\nStuart is a long time ‘buddy’ of Sierra! We have appreciated his love & support since day 1! 🌎\n\nStuart called his friends from all around the world to compete in Table Scraps! Team International is bringing their fresh & light flavors to try & win the Italian judges tastebuds over. THIS FRIDAY! MARCH 14! Don’t miss the dishes that Team INT puts together (😱) \n\n📺 Subscribe on YouTube: https://lnkd.in/dSqJ4r8m",
        "likes": "25",
        "comments": "2",
        "shares": "1",
        "time": {
          "raw": "1g",
          "parsed": "11.03.2025",
          "isoString": "2025-03-11T05:02:55.503Z"
        },
        "mediaType": "video",
        "mediaContent": {
          "src": [
            {
              "src": "https://dms.licdn.com/playlist/vid/v2/D4D05AQEXILkeqVAEuw/mp4-720p-30fp-crf28/B4DZWCAwyKHIBo-/0/1741643023900?e=1742364000&v=beta&t=ve7oMNEwB7_uwCSk2UNVTZAiiv-qaOeUyDN5HPWyLTQ",
              "type": "video/mp4",
              "data-bitrate": 1091350
            },
            {
              "src": "https://dms.licdn.com/playlist/vid/v2/D4D05AQEXILkeqVAEuw/mp4-640p-30fp-crf28/B4DZWCAwyKHIBk-/0/1741643023675?e=1742364000&v=beta&t=5TzLI9SEBSFBHJt26LeJnKng9RKUv5lx-oujs-GEK64",
              "type": "video/mp4",
              "data-bitrate": 820813
            }
          ],
          "posterUrl": "https://media.licdn.com/dms/image/v2/D4D05AQEXILkeqVAEuw/videocover-high/B4DZWCAwyKHIB0-/0/1741643017706?e=1742364000&v=beta&t=GjO8Yzkj-ApS_ZEJN8RTNElcwFvlatT0ZK8q0l4CiZY"
        },
        "date": "2025-03-11T05:02:55.503Z"
      },
      {
        "captions": "Got milk?🥛\n\nThe Sierra® REB-4 makes quick work of plastic, turning loose material into dense, high-quality bales. With its patented dual-compression doors, rollback is eliminated—meaning more efficient baling! ♻️ \n\nAvailable with either a 150 or 250 HP power unit, it's built for high production and versatility. From plastics to non-ferrous metals, tires, and fiber, the REB-4 delivers the performance recyclers need.",
        "likes": "7",
        "time": {
          "raw": "2g",
          "parsed": "10.03.2025",
          "isoString": "2025-03-10T05:02:55.504Z"
        },
        "mediaType": "video",
        "mediaContent": {
          "src": [
            {
              "src": "https://dms.licdn.com/playlist/vid/v2/D5610AQEfvSwIe0yPZg/mp4-360p-30fp-crf28/B56ZV7.0poHoBo-/0/1741541830059?e=1742364000&v=beta&t=NtTgnZan_d97ff2tqEZ-jBy3SCIRoDHWa0QKG4ZckJc",
              "type": "video/mp4",
              "data-bitrate": 311246
            },
            {
              "src": "https://dms.licdn.com/playlist/vid/v2/D5610AQEfvSwIe0yPZg/mp4-720p-30fp-crf28/B56ZV7.0poHoBw-/0/1741541829536?e=1742364000&v=beta&t=N--_mMg3d2h-BxCAhHzWUREe0_hnvBSv11c451YT5ww",
              "type": "video/mp4",
              "data-bitrate": 905533
            },
            {
              "src": "https://dms.licdn.com/playlist/vid/v2/D5610AQEfvSwIe0yPZg/mp4-640p-30fp-crf28/B56ZV7.0poHoBs-/0/1741541831126?e=1742364000&v=beta&t=K7DYHmooeq34LSMBht0gm9I80LKk_vKYSE33g0iuWVE",
              "type": "video/mp4",
              "data-bitrate": 693096
            }
          ],
          "posterUrl": "https://media.licdn.com/dms/image/v2/D5610AQEfvSwIe0yPZg/ads-video-thumbnail_720_1280/B56ZV7.0poHoAc-/0/1741541824859?e=1742364000&v=beta&t=TP0JxvmL8icqeYBPtqFZ5Wv8HNd7HG4Inyepu2zZwu8"
        },
        "date": "2025-03-10T05:02:55.504Z"
      },
      {
        "captions": "Will Team International’s 🇿🇦 🇮🇹 🇸🇬  global experience give them the upper hand, or will they get lost in translation? 👀\n\nFind out when Table Scraps returns for The Chef’s Challenge on March 14th!\n\nDrop a 🌍 if you’re backing Team International! \n\nAntonio Tammaro Stuart Kagan 🧿 Atilla W. John Sacco",
        "likes": "7",
        "comments": "1",
        "time": {
          "raw": "2g",
          "parsed": "10.03.2025",
          "isoString": "2025-03-10T05:02:55.505Z"
        },
        "mediaType": "video",
        "mediaContent": {
          "src": [
            {
              "src": "https://dms.licdn.com/playlist/vid/v2/D5610AQEf8lsH30KVzg/mp4-640p-30fp-crf28/B56ZV7.0qUHoBo-/0/1741541825734?e=1742364000&v=beta&t=UW1DHsMFOzUI75yvK7oOXzoByWvULyZ0RqwlIw5fjbI",
              "type": "video/mp4",
              "data-bitrate": 1059096
            },
            {
              "src": "https://dms.licdn.com/playlist/vid/v2/D5610AQEf8lsH30KVzg/mp4-360p-30fp-crf28/B56ZV7.0qUHoBk-/0/1741541825478?e=1742364000&v=beta&t=c68CgFqSZvKDrrgj-yq3ks7V2kPZb5Mc9BCNc3sT2pI",
              "type": "video/mp4",
              "data-bitrate": 453594
            },
            {
              "src": "https://dms.licdn.com/playlist/vid/v2/D5610AQEf8lsH30KVzg/mp4-720p-30fp-crf28/B56ZV7.0qUHoBs-/0/1741541825863?e=1742364000&v=beta&t=qqlfaul43x8YvGlmhvRS-MazQsP1EGaNbuuXEetNEnc",
              "type": "video/mp4",
              "data-bitrate": 1387393
            }
          ],
          "posterUrl": "https://media.licdn.com/dms/image/v2/D5610AQEf8lsH30KVzg/ads-video-thumbnail_720_1280/B56ZV7.0qUHoAY-/0/1741541823936?e=1742364000&v=beta&t=FMGW_-9KXOYnXE1DI3J9WyszhZfnunUD_nIWP8Nmu1w"
        },
        "date": "2025-03-10T05:02:55.505Z"
      },
      {
        "captions": "Something about that Sierra® red & yellow!🔥 | REB-8 Two-Ram BalerSomething about that Sierra® red & yellow!🔥 | REB-8 Two-Ram Baler",
        "likes": "15",
        "shares": "1",
        "time": {
          "raw": "4g",
          "parsed": "08.03.2025",
          "isoString": "2025-03-08T05:02:55.506Z"
        },
        "mediaType": "image",
        "mediaContent": [
          "https://media.licdn.com/dms/image/v2/D5610AQHzAri0Bt2X_w/image-shrink_800/B56ZVyKU1eHQAg-/0/1741377064948?e=1742364000&v=beta&t=-TmJ64vuCPkGprAcPY-Gd0xJHRE0iJE-VL4aHwwrqck",
          "https://media.licdn.com/dms/image/v2/D5610AQFNm4YGbXjm0g/image-shrink_800/B56ZVyKVADGQAc-/0/1741377065670?e=1742364000&v=beta&t=Px9jmPpmm1wwyWsaD8dpYx8xynzYxXvsbq2lxlQbJQc",
          "https://media.licdn.com/dms/image/v2/D5610AQGOJ9Ld2K2W9Q/image-shrink_800/B56ZVyKVMGHQAg-/0/1741377066156?e=1742364000&v=beta&t=w97zh9rZN81U-KmoKwThSAGvorXTSv-ulHYyXtFJacA",
          "https://media.licdn.com/dms/image/v2/D5610AQGQlsn5t_WKoA/image-shrink_800/B56ZVyKVUIHsAc-/0/1741377066602?e=1742364000&v=beta&t=xdSzud57TOHjD54Go6OPt1Lzzwa0_ZdO-NMYEFHox0g",
          "https://media.licdn.com/dms/image/v2/D5610AQF8Kl9tFLJ0tA/image-shrink_800/B56ZVyKVckGsAc-/0/1741377067942?e=1742364000&v=beta&t=jk1lvuZfB3l5rEgq9bMZVAyqp4dvJr32875I89HxV8A"
        ],
        "date": "2025-03-08T05:02:55.506Z"
      },
      {
        "captions": "Almost 20 years old and still plays a vital role. This T500 has been through hurricanes, blazing summers and even snow/ice storms. This durability is what customers have come to expect from Sierra International Machinery !Almost 20 years old and still plays a vital role. This T500 has been through hurricanes, blazing summers and even snow/ice storms. This durability is what customers have come to expect from Sierra International Machinery !",
        "likes": "23",
        "comments": "1",
        "shares": "1",
        "time": {
          "raw": "4g",
          "parsed": "08.03.2025",
          "isoString": "2025-03-08T05:02:55.507Z"
        },
        "mediaType": "image",
        "mediaContent": [
          "https://media.licdn.com/dms/image/v2/D4E22AQG78WdwLkmEbg/feedshare-shrink_800/B4EZVxn9uMH0Ak-/0/1741368062355?e=1744848000&v=beta&t=HmEa7XtLv0-6__Nc05X_EQsZwHVhzMj8Qf28e7AZcMM"
        ],
        "date": "2025-03-08T05:02:55.507Z"
      },
      {
        "captions": "The Sierra® REB-8 two-ram baler is built for maximum performance—offering greater input density in the charging chamber and minimizing material shearing by 90% when the doors are fully closed.\n\nWhat does this mean for your operation?\n\n✔ Reduced shear and hydraulic shock for smoother operation\n\n✔ Less stress on blades and structure, extending machine life\n\n✔ Lower energy costs, increasing efficiency and profitability\n\nWhen it comes to performance, the REB-8 is built to last and engineered to perform. \n\n#SierraInternationalMachinery #REB8 #RecyclingMachinery #BalingEfficiency #SustainableSolutions #IndustrialEquipment",
        "likes": "2",
        "time": {
          "raw": "5g",
          "parsed": "07.03.2025",
          "isoString": "2025-03-07T05:02:55.508Z"
        },
        "mediaType": "video",
        "mediaContent": {
          "src": [
            {
              "src": "https://dms.licdn.com/playlist/vid/v2/D5605AQEqLMytWl6G6A/mp4-640p-30fp-crf28/B56ZVtIg1kHQBc-/0/1741292707872?e=1742364000&v=beta&t=mejt0TUrPIxvg5zEHA4ifzro9u-xkDPeWlXtGQhg2eQ",
              "type": "video/mp4",
              "data-bitrate": 809318
            }
          ],
          "posterUrl": "https://media.licdn.com/dms/image/v2/D5605AQEqLMytWl6G6A/videocover-high/B56ZVtIg1kHQBs-/0/1741292706072?e=1742364000&v=beta&t=uJS_pEMruCYDCG1ScaRaBOlRRt-t0QcFQyBUx42NBqg"
        },
        "date": "2025-03-07T05:02:55.508Z"
      },
      {
        "captions": "Last but not least on Team Alter-Q: Patrick Young  📍Milwakee, WI 🤝Alter Trading \n\nPatrick is another certified foodie that brought his cooking game to CA! The dishes that Patrick makes on this season of Table Scraps will make your mouth water! From his speciality cut of meat to his incredible appetizer, you’re not going to want to miss Team Alter-Q’s meal.\n\nThanks for the sneak peak, Patrick! 🍽️\n\nSubscribe now on YouTube → almost 1 week away! 📺March 14th\n\nhttps://lnkd.in/gvnu-_id",
        "likes": "29",
        "comments": "7",
        "time": {
          "raw": "5g",
          "parsed": "07.03.2025",
          "isoString": "2025-03-07T05:02:55.509Z"
        },
        "mediaType": "video",
        "mediaContent": {
          "src": [
            {
              "src": "https://dms.licdn.com/playlist/vid/v2/D5605AQHPYW0ZGrkbDQ/mp4-720p-30fp-crf28/B56ZVsLysZGoBo-/0/1741276802910?e=1742364000&v=beta&t=vncWD1fZclzinB0tBb4cILyJiQgd61lUKduIpCSlwpk",
              "type": "video/mp4",
              "data-bitrate": 876646
            },
            {
              "src": "https://dms.licdn.com/playlist/vid/v2/D5605AQHPYW0ZGrkbDQ/mp4-640p-30fp-crf28/B56ZVsLysZGoBk-/0/1741276802208?e=1742364000&v=beta&t=g-OfXGveHsG4pnsmjEOtAOq8EQftJwmTH2F_D8VJrL0",
              "type": "video/mp4",
              "data-bitrate": 672227
            }
          ],
          "posterUrl": "https://media.licdn.com/dms/image/v2/D5605AQHPYW0ZGrkbDQ/videocover-high/B56ZVsLysZGoB0-/0/1741276797082?e=1742364000&v=beta&t=2Iw139IVhNmHMucgS1WT_4QN2nJgrnQ0k_VkzF3RViw"
        },
        "date": "2025-03-07T05:02:55.509Z"
      },
      {
        "captions": "Next Up on Team Alter-Q: Mark Hadacek  📍Milwaukee, WI\n\nMark lives to eat, not eating to live: certified foodie 🫡 Mark brought his prized black truffles for his porcini risotto… Let’s see if it gives team Alter-Q the edge with the judges!\n\nMark’s in the business of making good food – subscribe to Table Scraps on our YouTube channel → coming March 14th ♻️\nhttps://lnkd.in/g-VSPrHf \n\nAlter Trading John Sacco",
        "likes": "24",
        "comments": "3",
        "shares": "2",
        "time": {
          "raw": "6g",
          "parsed": "06.03.2025",
          "isoString": "2025-03-06T05:02:55.510Z"
        },
        "mediaType": "video",
        "mediaContent": {
          "src": [
            {
              "src": "https://dms.licdn.com/playlist/vid/v2/D5605AQENE_OSvk5dHQ/mp4-640p-30fp-crf28/B56ZVnMK6fHQBs-/0/1741193015652?e=1742364000&v=beta&t=CGoBqF0aMKCfZ4GWzTwVxxrMC-esc95SPg3RdpXMUo4",
              "type": "video/mp4",
              "data-bitrate": 812346
            },
            {
              "src": "https://dms.licdn.com/playlist/vid/v2/D5605AQENE_OSvk5dHQ/mp4-720p-30fp-crf28/B56ZVnMK6fHQBw-/0/1741193016446?e=1742364000&v=beta&t=H6-eTilX9AOUtNyE30vzjMNKWbpJSWAp8dBz9hMaAnQ",
              "type": "video/mp4",
              "data-bitrate": 1061646
            }
          ],
          "posterUrl": "https://media.licdn.com/dms/image/v2/D5605AQENE_OSvk5dHQ/videocover-high/B56ZVnMK6fHQB8-/0/1741193012033?e=1742364000&v=beta&t=PGYclnPP2Jucf7NUYki2ICibBs0fLJCPsJbkl9-zmyI"
        },
        "date": "2025-03-06T05:02:55.510Z"
      }
    ]
  },
  {
    "name": "AymasRecyclingMachinery",
    "followerData": [
      [
        20250225,
        3629
      ],
      [
        20250225,
        3629
      ],
      [
        20250225,
        3629
      ],
      [
        20250228,
        3644
      ],
      [
        20250228,
        3644
      ],
      [
        20250228,
        3644
      ],
      [
        20250228,
        3644
      ],
      [
        20250303,
        3668
      ],
      [
        1741011479064,
        "3.672"
      ],
      [
        1741076491651,
        "3.697"
      ],
      [
        1741077634518,
        "3.697"
      ],
      [
        1741083610049,
        "3.708"
      ],
      [
        1741084616644,
        "3.709"
      ],
      [
        1741170381073,
        3730
      ],
      [
        1741755789926,
        3785
      ]
    ],
    "data": [
      {
        "captions": "Wishing you a blessed and peaceful Ramadan! May this holy month bring you joy, prosperity, and spiritual growth. 🌙✨\n\nHappy Ramadan Mubarak! May this holy month bring you peace, abundance and spiritual strength. 🌙✨Wishing you a blessed and peaceful Ramadan! May this holy month bring you joy, prosperity, and spiritual growth. 🌙✨\n\nHappy Ramadan Mubarak! May this holy month bring you peace, abundance and spiritual strength. 🌙✨",
        "likes": "22",
        "shares": "5",
        "time": {
          "raw": "1h",
          "parsed": "05.03.2025",
          "isoString": "2025-03-05T05:03:09.672Z"
        },
        "mediaType": "image",
        "mediaContent": [
          "https://media.licdn.com/dms/image/v2/D4D22AQGm1_af2BS_ZA/feedshare-shrink_800/B4DZVNNZR7GkAk-/0/1740757113228?e=1744848000&v=beta&t=K9wYfJ6WAAtBIfjPZZNXYGetEgNkViH3plMQdhxRebQ"
        ],
        "date": "2025-03-05T05:03:09.672Z"
      },
      {
        "captions": "AYMAS\n\n#materialhandler #metalrecycling #hurda #scrap #scraplife #scrapyard #scrapmetal #heavyload \n#scrapshear #metalscrap\n#recyclingequipment #scrapshear \n#engineering #hurdamakası \n#geridönüşüm #recyclingmachinery #scrapmetalrecycling #briquetting #singleshaftshredder #cablestripper #inclinedshear  #copper #scrapbaler #scrapshear  #shredder #metalbaler #scraprecycling #baler #twinshaftshredder \n#aymasrecyclingmachinery",
        "likes": "36",
        "shares": "4",
        "time": {
          "raw": "1h",
          "parsed": "05.03.2025",
          "isoString": "2025-03-05T05:03:09.673Z"
        },
        "mediaType": "video",
        "mediaContent": {
          "src": [
            {
              "src": "https://dms.licdn.com/playlist/vid/v2/D5605AQGludL6PxPtIQ/mp4-640p-30fp-crf28/B56ZVGSV8HGQBk-/0/1740640978535?e=1742364000&v=beta&t=s_p6p5uQc67CX-FyZEi-Pwc1V1PeUG7nnmpe25TaP9M",
              "type": "video/mp4",
              "data-bitrate": 537310
            }
          ],
          "posterUrl": "https://media.licdn.com/dms/image/v2/D5605AQGludL6PxPtIQ/videocover-low/B56ZVGSV8HGQCU-/0/1740640974158?e=1742364000&v=beta&t=WdKOuPR7ORsgYCpDRihF97dnWB_uN2wJBr5I-BXbgeA"
        },
        "date": "2025-03-05T05:03:09.673Z"
      },
      {
        "captions": "#materialhandler #metalrecycling #hurda #scrap #scraplife #scrapyard #scrapmetal #heavyload \n#scrapshear #metalscrap\n#recyclingequipment #scrapshear \n#engineering #hurdamakası \n#geridönüşüm #recyclingmachinery #scrapmetalrecycling #briquetting #singleshaftshredder #cablestripper #inclinedshear  #copper #scrapbaler #scrapshear  #shredder #metalbaler #scraprecycling #baler #twinshaftshredder \n#aymasrecyclingmachinery#materialhandler #metalrecycling #hurda #scrap #scraplife #scrapyard #scrapmetal #heavyload \n#scrapshear #metalscrap\n#recyclingequipment #scrapshear \n#engineering #hurdamakası \n#geridönüşüm #recyclingmachinery #scrapmetalrecycling #briquetting #singleshaftshredder #cablestripper #inclinedshear  #copper #scrapbaler #scrapshear  #shredder #metalbaler #scraprecycling #baler #twinshaftshredder \n#aymasrecyclingmachinery",
        "likes": "58",
        "comments": "1",
        "shares": "5",
        "time": {
          "raw": "2h",
          "parsed": "26.02.2025",
          "isoString": "2025-02-26T05:03:09.674Z"
        },
        "mediaType": "image",
        "mediaContent": [
          "https://media.licdn.com/dms/image/v2/D4D22AQEPSlYw6VQhqg/feedshare-shrink_800/B4DZU8rwHUGkAo-/0/1740479869773?e=1744848000&v=beta&t=W3DUeysTUZmiuUw8wua2xw6hs6WmFIghy7zkPEvqKcA"
        ],
        "date": "2025-02-26T05:03:09.674Z"
      },
      {
        "captions": "Well, it only took 11 days and 33 separate #Exhibitors of #ReMA2025 https://lnkd.in/e548nxm3\nhttps://aymasmakina.com/en\n#TheShow to get through's the \"A's\" alphabetically, but that makes sense when you throw the biggest #recyclingevent in the #recycledmaterials industry. AYMAS Recycling Machinery, it's your turn in the #exhibitorspotlight. Aymas manufactures reliable #scrapprocessing equipments. #ScrapShears #Shears #ScrapBalers #Shredders #ChipBriquetting  #BaleBusters #Dewiring #DewiringEquipment\n#Briquetters #Compactors #Nonferrous #NonferrousBalers\n#AlligatorShears #GuillotineShears #MobileAttachments\n#AutoShredders #Trommels #Screens\n#CanDensifiers #CanFlatteners #ExhibitorReMA2025Well, it only took 11 days and 33 separate #Exhibitors of #ReMA2025 https://lnkd.in/e548nxm3\nhttps://aymasmakina.com/en\n#TheShow to get through's the \"A's\" alphabetically, but that makes sense when you throw the biggest #recyclingevent in the #recycledmaterials industry. AYMAS Recycling Machinery, it's your turn in the #exhibitorspotlight. Aymas manufactures reliable #scrapprocessing equipments. #ScrapShears #Shears #ScrapBalers #Shredders #ChipBriquetting  #BaleBusters #Dewiring #DewiringEquipment\n#Briquetters #Compactors #Nonferrous #NonferrousBalers\n#AlligatorShears #GuillotineShears #MobileAttachments\n#AutoShredders #Trommels #Screens\n#CanDensifiers #CanFlatteners #ExhibitorReMA2025",
        "likes": "13",
        "shares": "6",
        "time": {
          "raw": "2h",
          "parsed": "26.02.2025",
          "isoString": "2025-02-26T05:03:09.676Z"
        },
        "mediaType": "image",
        "mediaContent": [
          "https://media.licdn.com/dms/image/v2/D4E22AQFBrHa1HUhOxw/feedshare-shrink_800/B4EZUUtfvlHcAg-/0/1739809226077?e=1744848000&v=beta&t=2tFRDyWWB4KF-Wti4jqsKVc52VzBndYwZxVXTVAQZKE"
        ],
        "date": "2025-02-26T05:03:09.676Z"
      },
      {
        "captions": "Shredded aluminum baling. High compression forces for shredded scrap densifying.\n\n#materialhandler #metalrecycling #hurda #scrap #scraplife #scrapyard #scrapmetal #heavyload \n#scrapshear #metalscrap\n#recyclingequipment #scrapshear \n#engineering #hurdamakası \n#demirçelik #recyclingmachinery #scrapmetalrecycling #briquetting #singleshaftshredder #cablestripper #inclinedshear  #copper #scrapbaler #scrapshear  #shredder #metalbaler #scraprecycling #baler #twinshaftshredder \n#aymasrecyclingmachinery",
        "likes": "50",
        "comments": "1",
        "shares": "7",
        "time": {
          "raw": "1h",
          "parsed": "26.02.2025",
          "isoString": "2025-02-26T10:26:20.846Z"
        },
        "mediaType": "video",
        "mediaContent": {
          "src": [
            {
              "src": "https://dms.licdn.com/playlist/vid/v2/D4D05AQGuQtgoeGGZ-w/mp4-640p-30fp-crf28/B4DZUitvB4GcBc-/0/1740044205393?e=1741777200&v=beta&t=WUOuBLq92K98Q6u01wJ9sMGcjiDUPUodIYqN0yK63PA",
              "type": "video/mp4",
              "data-bitrate": 646331
            }
          ],
          "posterUrl": "https://media.licdn.com/dms/image/v2/D4D05AQGuQtgoeGGZ-w/videocover-high/B4DZUitvB4GcBs-/0/1740044201461?e=1741777200&v=beta&t=Zor4WLxfdKTHxTe7O20GPO7z8T5FE0oSlSp_uHhiqsU"
        },
        "date": "2025-02-26T10:26:20.846Z"
      },
      {
        "captions": "Recycling made simple with Immix! We help conserve resources and reduce environmental impact every day. \nLooking for a tailored metal recycling solution? Get in touch today!\n\n📞 1300 046 649\n🌐 www.immix.com.au\n📧 trading@immix.com.au\n\n#Immix #SustainableRecycling #MetalRecycling #EcoFriendly #ReduceReuseRecycleRecycling made simple with Immix! We help conserve resources and reduce environmental impact every day. \nLooking for a tailored metal recycling solution? Get in touch today!\n\n📞 1300 046 649\n🌐 www.immix.com.au\n📧 trading@immix.com.au\n\n#Immix #SustainableRecycling #MetalRecycling #EcoFriendly #ReduceReuseRecycle",
        "likes": "13",
        "shares": "7",
        "time": {
          "raw": "1h",
          "parsed": "26.02.2025",
          "isoString": "2025-02-26T10:26:20.847Z"
        },
        "mediaType": "image",
        "mediaContent": [
          "https://media.licdn.com/dms/image/v2/D4E22AQFojYtsUhlrfw/feedshare-shrink_800/B4EZUiSyfzGgAk-/0/1740037112701?e=1744243200&v=beta&t=CpRYI6K1Rb6Jz6ogCLiF5XTU4ROIrb475zaElCsuDjE"
        ],
        "date": "2025-02-26T10:26:20.847Z"
      },
      {
        "captions": "Up to 2000 ton cutting force\nUp to 100 tph\nUp to 300 ton densifying compression\n\n#materialhandler #metalrecycling #hurda #scrap #scraplife #scrapyard #scrapmetal #heavyload \n#scrapshear #metalscrap\n#recyclingequipment #scrapshear \n#engineering #hurdamakası \n#hurda #recyclingmachinery #scrapmetalrecycling #briquetting #singleshaftshredder #cablestripper #inclinedshear  #copper #scrapbaler #scrapshear  #shredder #metalbaler #scraprecycling #baler #twinshaftshredder \n#aymasrecyclingmachineryUp to 2000 ton cutting force\nUp to 100 tph\nUp to 300 ton densifying compression\n\n#materialhandler #metalrecycling #hurda #scrap #scraplife #scrapyard #scrapmetal #heavyload \n#scrapshear #metalscrap\n#recyclingequipment #scrapshear \n#engineering #hurdamakası \n#hurda #recyclingmachinery #scrapmetalrecycling #briquetting #singleshaftshredder #cablestripper #inclinedshear  #copper #scrapbaler #scrapshear  #shredder #metalbaler #scraprecycling #baler #twinshaftshredder \n#aymasrecyclingmachinery",
        "likes": "71",
        "shares": "12",
        "time": {
          "raw": "2h",
          "parsed": "19.02.2025",
          "isoString": "2025-02-19T10:26:20.848Z"
        },
        "mediaType": "image",
        "mediaContent": [
          "https://media.licdn.com/dms/image/v2/D4D22AQE-fmsx0usaHA/feedshare-shrink_800/B4DZUYYk0EGkAk-/0/1739870857584?e=1744243200&v=beta&t=_Ru8UfrG6HP0ZKw20D67TDMVdwKSMndcIKQd6CNQfWw"
        ],
        "date": "2025-02-19T10:26:20.848Z"
      },
      {
        "captions": "#materialhandler #metalrecycling #hurda #scrap #scraplife #scrapyard #scrapmetal #heavyload \n#scrapshear #metalscrap\n#recyclingequipment #scrapshear \n#engineering #heavymetal \n#hurda #recyclingmachinery #scrapmetalrecycling #briquetting #singleshaftshredder #cablestripper #inclinedshear  #copper #scrapbaler #scrapshear  #shredder #metalbaler #scraprecycling #baler #twinshaftshredder \n#aymasrecyclingmachinery#materialhandler #metalrecycling #hurda #scrap #scraplife #scrapyard #scrapmetal #heavyload \n#scrapshear #metalscrap\n#recyclingequipment #scrapshear \n#engineering #heavymetal \n#hurda #recyclingmachinery #scrapmetalrecycling #briquetting #singleshaftshredder #cablestripper #inclinedshear  #copper #scrapbaler #scrapshear  #shredder #metalbaler #scraprecycling #baler #twinshaftshredder \n#aymasrecyclingmachinery",
        "likes": "38",
        "comments": "1",
        "shares": "5",
        "time": {
          "raw": "2h",
          "parsed": "19.02.2025",
          "isoString": "2025-02-19T10:26:20.849Z"
        },
        "mediaType": "image",
        "mediaContent": [
          "https://media.licdn.com/dms/image/v2/D4D22AQHilifLUjWAyQ/feedshare-shrink_800/B4DZT_KkUoHAAk-/0/1739447749796?e=1744243200&v=beta&t=Lacf-JTnPcDnU_QopDpQr7wDg-ZyqWjAQdjmNI2oVIk"
        ],
        "date": "2025-02-19T10:26:20.849Z"
      },
      {
        "captions": "more scrap to chew !\n\n#materialhandler #metalrecycling #hurdacı #scrap #scraplife #scrapyard #scrapmetal #heavyload \n#scrapshear #metalscrap\n#recyclingequipment #scrapshear \n#engineering #heavymetal \n#hurda #recyclingmachinery #scrapmetalrecycling #briquetting #singleshaftshredder #cablestripper #inclinedshear  #copper #scrapbaler #scrapshear  #shredder #metalbaler #scraprecycling #baler #twinshaftshredder \n#aymasrecyclingmachinerymore scrap to chew !\n\n#materialhandler #metalrecycling #hurdacı #scrap #scraplife #scrapyard #scrapmetal #heavyload \n#scrapshear #metalscrap\n#recyclingequipment #scrapshear \n#engineering #heavymetal \n#hurda #recyclingmachinery #scrapmetalrecycling #briquetting #singleshaftshredder #cablestripper #inclinedshear  #copper #scrapbaler #scrapshear  #shredder #metalbaler #scraprecycling #baler #twinshaftshredder \n#aymasrecyclingmachinery",
        "likes": "36",
        "shares": "7",
        "time": {
          "raw": "3h",
          "parsed": "12.02.2025",
          "isoString": "2025-02-12T10:26:20.851Z"
        },
        "mediaType": "image",
        "mediaContent": [
          "https://media.licdn.com/dms/image/v2/D4D22AQHYQ-1wnYkWhA/feedshare-shrink_800/B4DZT0nQj7HYAk-/0/1739270720927?e=1744243200&v=beta&t=iGUgKlhdtcXsORxZ-3xb7_i0mAVf1gIs7vGNnD7u0nk"
        ],
        "date": "2025-02-12T10:26:20.851Z"
      },
      {
        "captions": "Bugün, 6 Şubat depreminin yıl dönümünde, hayatını kaybeden vatandaşlarımızı saygı ve rahmetle anıyor, ailelerine sabır ve dayanma gücü diliyoruz. Bu büyük felaketin acısını yüreğimizde hissederken, dayanışma ve birlik içinde olmanın önemini bir kez daha hatırlıyoruz.\n\nDeprem gerçeğiyle yüzleşmek ve gerekli önlemleri almak, gelecekte benzer acıların yaşanmaması için hayati bir sorumluluktur. Daha güvenli yarınlar için bilinçlenmeye, afetlere karşı hazırlıklı olmaya ve gerekli tedbirleri almaya devam etmeliyiz.\n\nBugün, sadece kaybettiklerimizi anma günü değil, aynı zamanda ders çıkarıp daha güvenli bir gelecek inşa etme sorumluluğunu hatırlama günüdür.\n\n——————————————————————— \n\nToday marks the anniversary of the February 6 earthquake, and we remember with respect and compassion those who lost their lives. We extend our deepest condolences to their families and wish them strength and resilience. The pain of this great disaster remains in our hearts, reminding us once again of the importance of unity and solidarity.\n\nFacing the reality of earthquakes and taking necessary precautions is crucial to preventing similar tragedies in the future. We must continue to raise awareness, be prepared for disasters, and take the necessary measures to ensure a safer tomorrow.\n\nToday is not only a day of remembrance for those we lost but also a day to reflect, learn, and commit to building a safer future.\n\n#6şubatdepremi #AymasRecyclingMachineryBugün, 6 Şubat depreminin yıl dönümünde, hayatını kaybeden vatandaşlarımızı saygı ve rahmetle anıyor, ailelerine sabır ve dayanma gücü diliyoruz. Bu büyük felaketin acısını yüreğimizde hissederken, dayanışma ve birlik içinde olmanın önemini bir kez daha hatırlıyoruz.\n\nDeprem gerçeğiyle yüzleşmek ve gerekli önlemleri almak, gelecekte benzer acıların yaşanmaması için hayati bir sorumluluktur. Daha güvenli yarınlar için bilinçlenmeye, afetlere karşı hazırlıklı olmaya ve gerekli tedbirleri almaya devam etmeliyiz.\n\nBugün, sadece kaybettiklerimizi anma günü değil, aynı zamanda ders çıkarıp daha güvenli bir gelecek inşa etme sorumluluğunu hatırlama günüdür.\n\n——————————————————————— \n\nToday marks the anniversary of the February 6 earthquake, and we remember with respect and compassion those who lost their lives. We extend our deepest condolences to their families and wish them strength and resilience. The pain of this great disaster remains in our hearts, reminding us once again of the importance of unity and solidarity.\n\nFacing the reality of earthquakes and taking necessary precautions is crucial to preventing similar tragedies in the future. We must continue to raise awareness, be prepared for disasters, and take the necessary measures to ensure a safer tomorrow.\n\nToday is not only a day of remembrance for those we lost but also a day to reflect, learn, and commit to building a safer future.\n\n#6şubatdepremi #AymasRecyclingMachinery",
        "likes": "13",
        "shares": "8",
        "time": {
          "raw": "3h",
          "parsed": "12.02.2025",
          "isoString": "2025-02-12T10:26:20.852Z"
        },
        "mediaType": "image",
        "mediaContent": [
          "https://media.licdn.com/dms/image/v2/D4D22AQGP_Cal7l5ZRA/feedshare-shrink_800/B4DZTbGIDHHAAg-/0/1738842605018?e=1744243200&v=beta&t=g4mT14X8YXkhI7HfuX6knUJi6SfNP3gLJFY7UDQZEU0"
        ],
        "date": "2025-02-12T10:26:20.852Z"
      },
      {
        "captions": "A mobile inclined shear on duty.\n\n#materialhandler #metalrecycling #hurda #scrap #scraplife #scrapyard #scrapmetal #heavyload \n#scrapshear #metalscrap\n#recyclingequipment #scrapshear \n#engineering #heavymetal \n#hurda #recyclingmachinery #scrapmetalrecycling #briquetting #singleshaftshredder #cablestripper #inclinedshear  #copper #scrapbaler #scrapshear  #shredder #metalbaler #scraprecycling #baler #twinshaftshredder \n#aymasrecyclingmachineryA mobile inclined shear on duty.\n\n#materialhandler #metalrecycling #hurda #scrap #scraplife #scrapyard #scrapmetal #heavyload \n#scrapshear #metalscrap\n#recyclingequipment #scrapshear \n#engineering #heavymetal \n#hurda #recyclingmachinery #scrapmetalrecycling #briquetting #singleshaftshredder #cablestripper #inclinedshear  #copper #scrapbaler #scrapshear  #shredder #metalbaler #scraprecycling #baler #twinshaftshredder \n#aymasrecyclingmachinery",
        "likes": "35",
        "shares": "7",
        "time": {
          "raw": "3h",
          "parsed": "12.02.2025",
          "isoString": "2025-02-12T10:26:20.854Z"
        },
        "mediaType": "image",
        "mediaContent": [
          "https://media.licdn.com/dms/image/v2/D4D22AQGYrP9vP6OqdA/feedshare-shrink_800/B4DZTakKRNGcAk-/0/1738833700987?e=1744243200&v=beta&t=6XQRJlFLAUDJH3GtrvElQ3YAhvSzGcdQflarNrUb8kE"
        ],
        "date": "2025-02-12T10:26:20.854Z"
      },
      {
        "captions": "A new installation of one of our triple compression baler for ferrous.\n\n#materialhandler #metalrecycling #hurda #scrap #scraplife #scrapyard #scrapmetal #heavyload \n#baler #metalscrap\n#recyclingequipment #scrapshear \n#engineering #heavymetal \n#hurda #recyclingmachinery #scrapmetalrecycling #briquetting #singleshaftshredder #cablestripper #inclinedshear  #copper #scrapbaler #scrapshear  #shredder #metalbaler #scraprecycling #baler #twinshaftshredder \n#aymasrecyclingmachineryA new installation of one of our triple compression baler for ferrous.\n\n#materialhandler #metalrecycling #hurda #scrap #scraplife #scrapyard #scrapmetal #heavyload \n#baler #metalscrap\n#recyclingequipment #scrapshear \n#engineering #heavymetal \n#hurda #recyclingmachinery #scrapmetalrecycling #briquetting #singleshaftshredder #cablestripper #inclinedshear  #copper #scrapbaler #scrapshear  #shredder #metalbaler #scraprecycling #baler #twinshaftshredder \n#aymasrecyclingmachinery",
        "likes": "36",
        "shares": "7",
        "time": {
          "raw": "4h",
          "parsed": "05.02.2025",
          "isoString": "2025-02-05T10:26:20.855Z"
        },
        "mediaType": "image",
        "mediaContent": [
          "https://media.licdn.com/dms/image/v2/D4D22AQGFz4Bk6P7pyQ/feedshare-shrink_800/B4DZTQwZNlGcAg-/0/1738669138298?e=1744243200&v=beta&t=rPgG8yw3FriqvBsfRy6z-Dw26LbfzLhrepPZzPgugEc"
        ],
        "date": "2025-02-05T10:26:20.855Z"
      },
      {
        "captions": "From scrap to sustainability! 🌍 At IMMIX, we're turning scrap metal into valuable resources through efficient recycling processes. Together, let's shape a greener future! \n#MetalRecycling #Sustainability #IMMIXFrom scrap to sustainability! 🌍 At IMMIX, we're turning scrap metal into valuable resources through efficient recycling processes. Together, let's shape a greener future! \n#MetalRecycling #Sustainability #IMMIX",
        "likes": "28",
        "comments": "2",
        "shares": "3",
        "time": {
          "raw": "1ay",
          "parsed": "05.02.2025",
          "isoString": "2025-02-05T10:26:20.857Z"
        },
        "mediaType": "image",
        "mediaContent": [
          "https://media.licdn.com/dms/image/v2/D4E22AQFJ-soKtiP1bA/feedshare-shrink_800/B4EZQ6MVtpHEAg-/0/1736143112593?e=1744243200&v=beta&t=7jjjCQsM50ECt8u6GB7AxM6ZZO3l-lNYbl-FhylzHC8"
        ],
        "date": "2025-02-05T10:26:20.857Z"
      },
      {
        "captions": "👇 𝗖𝗟𝗜𝗖𝗞 𝗧𝗢 𝗗𝗜𝗦𝗖𝗢𝗩𝗘𝗥 𝗠𝗢𝗥𝗘",
        "likes": "25",
        "shares": "7",
        "time": {
          "raw": "1ay",
          "parsed": "05.02.2025",
          "isoString": "2025-02-05T10:26:20.858Z"
        },
        "mediaType": "other",
        "date": "2025-02-05T10:26:20.858Z"
      },
      {
        "captions": "Dostępne i przystępne? \nTak! Takie są maszyny Aymas, które czekają na Was i swój nowy dom, a raczej hale, albo zakład, plac... \nTy wybierasz gdzie będzie dla Ciebie pracować. \nCzas produkcji paczkarki i brykieciarki to standardowo 3-4 miesiące,   po co czekać, skoro możesz zacząć już teraz?\n\nhttps://lnkd.in/eSn8rdhB",
        "likes": "14",
        "shares": "7",
        "time": {
          "raw": "1ay",
          "parsed": "05.02.2025",
          "isoString": "2025-02-05T10:26:20.859Z"
        },
        "mediaType": "other",
        "date": "2025-02-05T10:26:20.859Z"
      },
      {
        "captions": "#materialhandler #metalrecycling #Jaipur #scrap #scraplife #scrapyard #scrapmetal #heavyload \n#MRAI #metalscrap\n#recyclingequipment #scrapshear \n#engineering #heavymetal \n#hurda #recyclingmachinery #scrapmetalrecycling #briquetting #singleshaftshredder #cablestripper #inclinedshear  #copper #scrapbaler #scrapshear  #shredder #metalbaler #scraprecycling #baler #twinshaftshredder \n#aymasrecyclingmachinery#materialhandler #metalrecycling #Jaipur #scrap #scraplife #scrapyard #scrapmetal #heavyload \n#MRAI #metalscrap\n#recyclingequipment #scrapshear \n#engineering #heavymetal \n#hurda #recyclingmachinery #scrapmetalrecycling #briquetting #singleshaftshredder #cablestripper #inclinedshear  #copper #scrapbaler #scrapshear  #shredder #metalbaler #scraprecycling #baler #twinshaftshredder \n#aymasrecyclingmachinery",
        "likes": "35",
        "comments": "1",
        "shares": "6",
        "time": {
          "raw": "1ay",
          "parsed": "05.02.2025",
          "isoString": "2025-02-05T10:26:20.860Z"
        },
        "mediaType": "image",
        "mediaContent": [
          "https://media.licdn.com/dms/image/v2/D4D22AQFzNnPNch-PGA/feedshare-shrink_800/B4DZS2B51GHAAg-/0/1738220741215?e=1744243200&v=beta&t=tP4CZwbAOmMx7GPYz8c_I4g6jrdmOsb2fC6yrVikiw0"
        ],
        "date": "2025-02-05T10:26:20.860Z"
      },
      {
        "captions": "MRAI Exhibition in Jaipur. Come and visit us.\n\n#materialhandler #metalrecycling #Jaipur #scrap #scraplife #scrapyard #scrapmetal #heavyload \n#MRAI #metalscrap\n#recyclingequipment #scrapshear \n#engineering #heavymetal \n#hurda #recyclingmachinery #scrapmetalrecycling #briquetting #singleshaftshredder #cablestripper #inclinedshear  #copper #scrapbaler #scrapshear  #shredder #metalbaler #scraprecycling #baler #twinshaftshredder \n#aymasrecyclingmachineryMRAI Exhibition in Jaipur. Come and visit us.\n\n#materialhandler #metalrecycling #Jaipur #scrap #scraplife #scrapyard #scrapmetal #heavyload \n#MRAI #metalscrap\n#recyclingequipment #scrapshear \n#engineering #heavymetal \n#hurda #recyclingmachinery #scrapmetalrecycling #briquetting #singleshaftshredder #cablestripper #inclinedshear  #copper #scrapbaler #scrapshear  #shredder #metalbaler #scraprecycling #baler #twinshaftshredder \n#aymasrecyclingmachinery",
        "likes": "33",
        "shares": "5",
        "time": {
          "raw": "1ay",
          "parsed": "05.02.2025",
          "isoString": "2025-02-05T10:26:20.862Z"
        },
        "mediaType": "image",
        "mediaContent": [
          "https://media.licdn.com/dms/image/v2/D4D22AQFOBLvPkbGCZw/feedshare-shrink_800/B4DZSxfTnzHAAg-/0/1738144564771?e=1744243200&v=beta&t=3XvgKYVrEvGIq5NxCTrbjl2XBu38ilLqWigqVMIB5Cs"
        ],
        "date": "2025-02-05T10:26:20.862Z"
      },
      {
        "likes": "40",
        "comments": "1",
        "shares": "7",
        "time": {
          "raw": "1ay",
          "parsed": "05.02.2025",
          "isoString": "2025-02-05T10:26:20.863Z"
        },
        "mediaType": "image",
        "mediaContent": [
          "https://media.licdn.com/dms/image/v2/D4D22AQF_Uqk9IXFowQ/feedshare-shrink_2048_1536/B4DZSr1HSlHIAo-/0/1738049616263?e=1744243200&v=beta&t=OxN6oFzdfr7TpRaeStmGiQwPKQMG8bRe7h--2xJ9pes"
        ],
        "date": "2025-02-05T10:26:20.863Z"
      },
      {
        "captions": "Heavy beast is on the way.\n\n#materialhandler #metalrecycling #steel #scrap #scraplife #scrapyard #scrapmetal #heavyload \n#heavyduty #metalscrap\n#recyclingequipment #scrapshear \n#engineering #heavymetal \n#alligatorshear #recyclingmachinery #scrapmetalrecycling #briquetting #singleshaftshredder #cablestripper #inclinedshear  #copper #scrapbaler #scrapshear  #shredder #metalbaler #scraprecycling #baler #twinshaftshredder \n#aymasrecyclingmachineryHeavy beast is on the way.\n\n#materialhandler #metalrecycling #steel #scrap #scraplife #scrapyard #scrapmetal #heavyload \n#heavyduty #metalscrap\n#recyclingequipment #scrapshear \n#engineering #heavymetal \n#alligatorshear #recyclingmachinery #scrapmetalrecycling #briquetting #singleshaftshredder #cablestripper #inclinedshear  #copper #scrapbaler #scrapshear  #shredder #metalbaler #scraprecycling #baler #twinshaftshredder \n#aymasrecyclingmachinery",
        "likes": "69",
        "comments": "3",
        "shares": "9",
        "time": {
          "raw": "1ay",
          "parsed": "05.02.2025",
          "isoString": "2025-02-05T10:26:20.864Z"
        },
        "mediaType": "image",
        "mediaContent": [
          "https://media.licdn.com/dms/image/v2/D4D22AQHp86fYmCEyDw/feedshare-shrink_800/B4DZSXo4pEHYAg-/0/1737710866723?e=1744243200&v=beta&t=ieXD7ofPHvvYvoesZ7RUrEXD0ACae5w_X1T2-OWKK-8"
        ],
        "date": "2025-02-05T10:26:20.864Z"
      },
      {
        "captions": "Another container arrives to Machinery Specialist HQ with loads of wire strippers and alligator shears\nhalf of them already sold and ready for shipping next week, but contact our team to secure yours before they all gone.Another container arrives to Machinery Specialist HQ with loads of wire strippers and alligator shears\nhalf of them already sold and ready for shipping next week, but contact our team to secure yours before they all gone.",
        "likes": "46",
        "shares": "5",
        "time": {
          "raw": "1ay",
          "parsed": "03.02.2025",
          "isoString": "2025-02-03T14:17:58.826Z"
        },
        "mediaType": "image",
        "mediaContent": [
          "https://media.licdn.com/dms/image/v2/D5622AQEuSN1ZJJ0XUQ/feedshare-shrink_800/B56ZSWSnJ1HQAg-/0/1737688250635?e=1743638400&v=beta&t=HOvsZzTuf-4S4nyacNyfy0h74vOaiwoFOmk3v2NYlPQ"
        ],
        "date": "2025-02-03T14:17:58.826Z"
      },
      {
        "captions": "#dubai #materialhandler #metalrecycling #hurda #scrap #scraplife #scrapyard #scrapmetal #heavyload \n#scrapshear #metalscrap\n#recyclingequipment #scrapshear \n#engineering #hurdamakası \n#geridönüşüm #recyclingmachinery #scrapmetalrecycling #inclinedshear #scrapshear #eğikmakas\n#aymasrecyclingmachinery",
        "likes": "23",
        "comments": "2",
        "shares": "5",
        "time": {
          "raw": "1h",
          "parsed": "05.03.2025",
          "isoString": "2025-03-05T05:03:09.671Z"
        },
        "mediaType": "video",
        "mediaContent": {
          "src": [
            {
              "src": "https://dms.licdn.com/playlist/vid/v2/D4D05AQE73xhqRNVvSQ/mp4-640p-30fp-crf28/B4DZVf8aSOGkBc-/0/1741071446926?e=1742364000&v=beta&t=f20A2SbT9H3P2Yh2oOFFzHsMFbBVJ7aj1HBk0VhJZC4",
              "type": "video/mp4",
              "data-bitrate": 773349
            }
          ],
          "posterUrl": "https://media.licdn.com/dms/image/v2/D4D05AQE73xhqRNVvSQ/videocover-high/B4DZVf8aSOGkBs-/0/1741071446422?e=1742364000&v=beta&t=DovoXC41Fm5PLXveUUdAJcF7bxGZk-E_4NToiVGb-3I"
        },
        "date": "2025-03-05T05:03:09.671Z"
      },
      {
        "captions": "A new installation in KSA.\n\n#materialhandler #metalrecycling #hurda #scrap #scraplife #scrapyard #scrapmetal #heavyload \n#scrapshear #metalscrap\n#recyclingequipment #scrapshear \n#engineering #hurdamakası #recyclingmachinery #scrapmetalrecycling #briquetting #singleshaftshredder #cablestripper #inclinedshear  #copper #scrapbaler #scrapshear  #shredder #metalbaler #scraprecycling #geridönüşüm #twinshaftshredder \n#aymasrecyclingmachinery",
        "likes": "36",
        "shares": "6",
        "time": {
          "raw": "22s",
          "parsed": "11.03.2025",
          "isoString": "2025-03-11T07:03:09.661Z"
        },
        "mediaType": "video",
        "mediaContent": {
          "src": [
            {
              "src": "https://dms.licdn.com/playlist/vid/v2/D4D05AQFlwbOUkiK6Aw/mp4-640p-30fp-crf28/B4DZWD_I39G4Bs-/0/1741676152838?e=1742364000&v=beta&t=1Sip_b023fc8vE5zRYgcoPGYQI1mO3XypFCFuslpCZ0",
              "type": "video/mp4",
              "data-bitrate": 221289
            }
          ],
          "posterUrl": "https://media.licdn.com/dms/image/v2/D4D05AQFlwbOUkiK6Aw/videocover-low/B4DZWD_I39G4Cc-/0/1741676150459?e=1742364000&v=beta&t=07Z5lWvWT0D0eef440KB0_9QMziA6OZDV401_BNoH0s"
        },
        "date": "2025-03-11T07:03:09.661Z"
      },
      {
        "captions": "MEET THE BEAST\n\nThe Aymas Inclined Shear can process a whopping 70 tonnes of mixed and heavy-duty scrap per hour with continuous feeding.\n\n✂️ No scrap length limit!\n✂️ No operator needed!\n✂️ Electric or diesel - your choice\n✂️ Automatic lubrication & remote diagnostic for easy maintenance\n✂️ Chrome-plated shafts and anti-wear plates for long lifespan\n✂️ Stationary or semi-mobile\n✂️ Reliable cooling system for hot climates (we're looking at you, QLD & NT)\n\nDM us for more info!\n\n#scrap #scrapmetal #scrapprocessingMEET THE BEAST\n\nThe Aymas Inclined Shear can process a whopping 70 tonnes of mixed and heavy-duty scrap per hour with continuous feeding.\n\n✂️ No scrap length limit!\n✂️ No operator needed!\n✂️ Electric or diesel - your choice\n✂️ Automatic lubrication & remote diagnostic for easy maintenance\n✂️ Chrome-plated shafts and anti-wear plates for long lifespan\n✂️ Stationary or semi-mobile\n✂️ Reliable cooling system for hot climates (we're looking at you, QLD & NT)\n\nDM us for more info!\n\n#scrap #scrapmetal #scrapprocessing",
        "likes": "23",
        "shares": "5",
        "time": {
          "raw": "1g",
          "parsed": "11.03.2025",
          "isoString": "2025-03-11T05:03:09.663Z"
        },
        "mediaType": "image",
        "mediaContent": [
          "https://media.licdn.com/dms/image/v2/D4D22AQHD42G4ZC2bgA/feedshare-shrink_800/B4DZS7GrVlG4Ag-/0/1738305955150?e=1744848000&v=beta&t=12MsEdxO-NsgcJ_djM8wAfsFEesz7m-e8aINXm-B3eM"
        ],
        "date": "2025-03-11T05:03:09.663Z"
      },
      {
        "captions": "Aymas is in Mexico for Latin American clients. Visit us for the recent technologies in metal scrap recycling machinery.\n\n#materialhandler #metalrecycling #hurda #scrap #scraplife #scrapyard #scrapmetal #heavyload \n#scrapshear #metalscrap\n#recyclingequipment #scrapshear \n#engineering #hurdamakası \n#Residuosexpo  #recyclingmachinery #scrapmetalrecycling #briquetting #singleshaftshredder #cablestripper #inclinedshear  #copper #scrapbaler #scrapshear  #shredder #metalbaler #scraprecycling #baler #twinshaftshredder \n#aymasrecyclingmachineryAymas is in Mexico for Latin American clients. Visit us for the recent technologies in metal scrap recycling machinery.\n\n#materialhandler #metalrecycling #hurda #scrap #scraplife #scrapyard #scrapmetal #heavyload \n#scrapshear #metalscrap\n#recyclingequipment #scrapshear \n#engineering #hurdamakası \n#Residuosexpo  #recyclingmachinery #scrapmetalrecycling #briquetting #singleshaftshredder #cablestripper #inclinedshear  #copper #scrapbaler #scrapshear  #shredder #metalbaler #scraprecycling #baler #twinshaftshredder \n#aymasrecyclingmachinery",
        "likes": "20",
        "shares": "4",
        "time": {
          "raw": "3g",
          "parsed": "09.03.2025",
          "isoString": "2025-03-09T05:03:09.665Z"
        },
        "mediaType": "image",
        "mediaContent": [
          "https://media.licdn.com/dms/image/v2/D4D22AQEqlG-3qsTS4A/feedshare-shrink_800/B4DZV2oRmaG8Ag-/0/1741452025116?e=1744848000&v=beta&t=Ay9jf6IyvnVCUg_SdCNFS2xQMpso31cVgKwONeUzXus"
        ],
        "date": "2025-03-09T05:03:09.665Z"
      },
      {
        "captions": "🌸 Happy International Women's Day! 🌸 Today, we celebrate the strength, resilience, and extraordinary achievements of women around the world. Let's continue to uplift, support, and empower each other every day. Together, we can create a brighter and more equal future. 💪✨ \n\n#materialhandler #metalrecycling #Womendays #scrap #scraplife #scrapyard #scrapmetal #heavyload \n#scrapshear #metalscrap\n#recyclingequipment #scrapshear \n#engineering #hurdamakası \n#InternationalWomensDay #recyclingmachinery #scrapmetalrecycling #briquetting #singleshaftshredder #cablestripper #inclinedshear  #copper #scrapbaler #scrapshear  #shredder #metalbaler #scraprecycling #baler #twinshaftshredder \n#aymasrecyclingmachinery🌸 Happy International Women's Day! 🌸 Today, we celebrate the strength, resilience, and extraordinary achievements of women around the world. Let's continue to uplift, support, and empower each other every day. Together, we can create a brighter and more equal future. 💪✨ \n\n#materialhandler #metalrecycling #Womendays #scrap #scraplife #scrapyard #scrapmetal #heavyload \n#scrapshear #metalscrap\n#recyclingequipment #scrapshear \n#engineering #hurdamakası \n#InternationalWomensDay #recyclingmachinery #scrapmetalrecycling #briquetting #singleshaftshredder #cablestripper #inclinedshear  #copper #scrapbaler #scrapshear  #shredder #metalbaler #scraprecycling #baler #twinshaftshredder \n#aymasrecyclingmachinery",
        "likes": "13",
        "comments": "1",
        "shares": "4",
        "time": {
          "raw": "3g",
          "parsed": "09.03.2025",
          "isoString": "2025-03-09T05:03:09.668Z"
        },
        "mediaType": "image",
        "mediaContent": [
          "https://media.licdn.com/dms/image/v2/D4D22AQGqrtO4lVg_ng/feedshare-shrink_800/B4DZV12uRTHIAg-/0/1741439037133?e=1744848000&v=beta&t=8yt9iw7oB79zauRjH4o5Gk6NHgx2ZvTmVYs_PpR8vT4"
        ],
        "date": "2025-03-09T05:03:09.668Z"
      },
      {
        "captions": "#materialhandler #metalrecycling #hurda #scrap #scraplife #scrapyard #scrapmetal #heavyload \n#scrapshear #metalscrap\n#recyclingequipment #scrapshear \n#steel #hurdamakası \n#geridönüşüm #demirçelik #scrapmetalrecycling #briquetting #singleshaftshredder #cablestripper #inclinedshear  #copper #scrapbaler #scrapshear  #shredder #metalbaler #scraprecycling #demir #twinshaftshredder \n#aymasrecyclingmachinery",
        "likes": "17",
        "comments": "1",
        "shares": "5",
        "time": {
          "raw": "5g",
          "parsed": "07.03.2025",
          "isoString": "2025-03-07T05:03:09.670Z"
        },
        "mediaType": "video",
        "mediaContent": {
          "src": [
            {
              "src": "https://dms.licdn.com/playlist/vid/v2/D4D05AQEaEvl3HdOiFQ/mp4-640p-30fp-crf28/B4DZVqCktQHIBE-/0/1741240821798?e=1742364000&v=beta&t=SQvvAn3qPHCwbVHFQbmuitljtqHG5U0eInusbJm-FM4",
              "type": "video/mp4",
              "data-bitrate": 417174
            }
          ],
          "posterUrl": "https://media.licdn.com/dms/image/v2/D4D05AQEaEvl3HdOiFQ/videocover-high/B4DZVqCktQHIBU-/0/1741240820255?e=1742364000&v=beta&t=uVj0fLC7Qqf4PJ9L84bcf7oUp79o5KRb0M8erAkKvMo"
        },
        "date": "2025-03-07T05:03:09.670Z"
      }
    ]
  },
  {
    "name": "LEFORTMetalRecyclingEquipment",
    "followerData": [
      [
        20250225,
        7340
      ],
      [
        20250225,
        7340
      ],
      [
        20250225,
        7340
      ],
      [
        20250228,
        7364
      ],
      [
        20250228,
        7364
      ],
      [
        20250228,
        7364
      ],
      [
        20250228,
        7364
      ],
      [
        20250303,
        7380
      ],
      [
        1741011516680,
        "7.380"
      ],
      [
        1741076521358,
        "7.383"
      ],
      [
        1741077666885,
        "7.383"
      ],
      [
        1741083640360,
        "7.384"
      ],
      [
        1741084653354,
        "7.384"
      ],
      [
        1741170415957,
        7397
      ],
      [
        1741755821565,
        7430
      ]
    ],
    "data": [
      {
        "captions": "🇬🇧 Jebb Metals have now put to work their new Koloss 1000 TS. This Lefort shear/baler is proving to be a real head turner as it sits proudly at the top of their yard. \n\n💥 Delivered to site in three main pieces the machine is assembled on a foundation frame and commissioned within two weeks. The machine is very productive on all grades of ferrous and non-ferrous metals, shearing with the 1000T window crosshead or baling with the 180T baling ram. \n\n💪🏽 The power, strength and speed of its cutting is giving very pleasing results for its new owners. This machine, fitted with the 600HP Scania diesel engine, operators control cabin and tunnel pusher ram is easily capable of 25-30 Tonnes per hour of production, depending upon material and cut length. \n\nWe wish Philip & Stephen all the best for the future with their new Lefort Koloss 1000 TS 🙌\n\n#LefortUk🇬🇧 Jebb Metals have now put to work their new Koloss 1000 TS. This Lefort shear/baler is proving to be a real head turner as it sits proudly at the top of their yard. \n\n💥 Delivered to site in three main pieces the machine is assembled on a foundation frame and commissioned within two weeks. The machine is very productive on all grades of ferrous and non-ferrous metals, shearing with the 1000T window crosshead or baling with the 180T baling ram. \n\n💪🏽 The power, strength and speed of its cutting is giving very pleasing results for its new owners. This machine, fitted with the 600HP Scania diesel engine, operators control cabin and tunnel pusher ram is easily capable of 25-30 Tonnes per hour of production, depending upon material and cut length. \n\nWe wish Philip & Stephen all the best for the future with their new Lefort Koloss 1000 TS 🙌\n\n#LefortUk",
        "likes": "72",
        "comments": "4",
        "shares": "7",
        "time": {
          "raw": "1h",
          "parsed": "05.03.2025",
          "isoString": "2025-03-05T05:03:41.238Z"
        },
        "mediaType": "image",
        "mediaContent": [
          "https://media.licdn.com/dms/image/v2/D4E22AQGlu4rUV34Lxg/feedshare-shrink_800/B4EZVcNW7KGYAk-/0/1741008763842?e=1744848000&v=beta&t=QfVnCPdDGqnb_n-moawhJ1kHYJAPH4NdUVeNGYbGzyE"
        ],
        "date": "2025-03-05T05:03:41.238Z"
      },
      {
        "captions": "💥🎬 [𝐯𝐢𝐝𝐞𝐨] BORNES RECYCLAGE ramps-up with a new Lidex 1300T !\n\n« Our Lidex can go up to 70t/hr. It has a rail breaker and can handle heavy scrap when needed. In the crane, thanks to the automatic cycle, our operator can prepare the next load while the scrap previously loaded is still being processed. No time is lost ! » Charles Bornes \n\nM. Bornes also prizes the total cooperation shown throughout the project including the recommendations for the most efficient layout of the machine on site, the supply of the civil engineering guide drawings, the logistic operations, the assembly & commissioning of the machine, not forgetting the training of operators and technicians.\n\n🤝 Thanks again to the Bornes family for their trust.",
        "likes": "142",
        "comments": "4",
        "shares": "12",
        "time": {
          "raw": "1h",
          "parsed": "05.03.2025",
          "isoString": "2025-03-05T05:03:41.240Z"
        },
        "mediaType": "video",
        "mediaContent": {
          "src": [
            {
              "src": "https://dms.licdn.com/playlist/vid/v2/D4E05AQHzBjqS2q1Tgw/mp4-720p-30fp-crf28/B4EZVH73AHGYBg-/0/1740668685959?e=1742364000&v=beta&t=I_piimkD6TRto9-sXK3SOsd2pQKKuER2_kTx8EF1A-w",
              "type": "video/mp4",
              "data-bitrate": 1116984
            },
            {
              "src": "https://dms.licdn.com/playlist/vid/v2/D4E05AQHzBjqS2q1Tgw/mp4-640p-30fp-crf28/B4EZVH73AHGYBc-/0/1740668687592?e=1742364000&v=beta&t=DYOhA8QfBgP866LPyG725PF3UmjJ_nxKUaLk9RBrBf4",
              "type": "video/mp4",
              "data-bitrate": 802291
            }
          ],
          "posterUrl": "https://media.licdn.com/dms/image/v2/D4E05AQHzBjqS2q1Tgw/videocover-low/B4EZVH73AHGYCM-/0/1740668675906?e=1742364000&v=beta&t=lBFJbyoIkoRKnnJ8vEU7dbxhbhPfVuqW_EmLFDEoDJU"
        },
        "date": "2025-03-05T05:03:41.240Z"
      },
      {
        "captions": "Wich one would you choose ? 650, 700, 800 or 1000T ? 🤩Wich one would you choose ? 650, 700, 800 or 1000T ? 🤩",
        "likes": "76",
        "comments": "5",
        "shares": "7",
        "time": {
          "raw": "2h",
          "parsed": "26.02.2025",
          "isoString": "2025-02-26T05:03:41.241Z"
        },
        "mediaType": "image",
        "mediaContent": [
          "https://media.licdn.com/dms/image/v2/D4E22AQFBhuWUdXPPEw/feedshare-shrink_800/B4EZU5VpuiHUAg-/0/1740423736410?e=1744848000&v=beta&t=YxHDllT1y1Lexx-8MFjyhL9ZPKvfB5GczcRHLyDEAMA",
          "https://media.licdn.com/dms/image/v2/D4E22AQEQERvskXpWxQ/feedshare-shrink_800/B4EZU5VptzHcAg-/0/1740423736612?e=1744848000&v=beta&t=XFQUCOYCJ7K1jz6dRIT4KTZF3xke1-296qQ5OiVmOY0"
        ],
        "date": "2025-02-26T05:03:41.241Z"
      },
      {
        "captions": "Fact Friday: \"Patented Innovation\" 🧐\n\nCheck out our LEFORT® TRAX 650 cutting heavy scrap metal with ease.\nThe LEFORT® TRAX self-propelled shear/baler, a patented innovation, is designed for unrivaled on-site mobility. With just a single switch on the radio control, the operator can move the entire machine towards the scrap metal pile, eliminating the need to transport scrap to the machine—boosting efficiency and productivity.\n\nLEFORT® TRAX Specifications:\n✅ Cutting force: 600-1250T\n✅ Hold down force: 120-180T\n✅ Box closing force: 2 x 240-350T\n✅ Pusher ram force: 180T\n✅ Cutting width: 800-940 mm\n✅ Box length: 6000-7000 mm\n✅ Power: Diesel or electric options available\n📩 Contact us for more details!\n\nMETQUIP LEFORT® #TRAX #Australia #Unrivaled #Machines #Innovation #Shear #Baler #Technology #Metal #Recycling #Efficiency #Machinery #Scrapyard #HeavyDutyShear #HeavyScrapShear",
        "likes": "27",
        "comments": "2",
        "shares": "3",
        "time": {
          "raw": "2h",
          "parsed": "26.02.2025",
          "isoString": "2025-02-26T05:03:41.243Z"
        },
        "mediaType": "video",
        "mediaContent": {
          "src": [
            {
              "src": "https://dms.licdn.com/playlist/vid/v2/D5605AQF1T2_sfaYzzg/mp4-640p-30fp-crf28/B56ZUmjSwRGoBg-/0/1740108600437?e=1742364000&v=beta&t=5ABMzsAG41zTazy3DvhK30Zj8TkMhus3_BLpglxNoL8",
              "type": "video/mp4",
              "data-bitrate": 921905
            },
            {
              "src": "https://dms.licdn.com/playlist/vid/v2/D5605AQF1T2_sfaYzzg/mp4-720p-30fp-crf28/B56ZUmjSwRGoBk-/0/1740108598577?e=1742364000&v=beta&t=t9X-9PzMyqdOIS74stdc2bSc9h3HJYnOGnvHaTFz9qU",
              "type": "video/mp4",
              "data-bitrate": 1230167
            }
          ],
          "posterUrl": "https://media.licdn.com/dms/image/v2/D5605AQF1T2_sfaYzzg/videocover-high/B56ZUmjSwRGoBw-/0/1740108585903?e=1742364000&v=beta&t=_EBBigXBx-EdQ07K-tnwRYIOyMgTR0MD9ekm_VRp7vg"
        },
        "date": "2025-02-26T05:03:41.243Z"
      },
      {
        "captions": "KONKEROR 1000T ready for departure to Norway  🇳🇴KONKEROR 1000T ready for departure to Norway  🇳🇴",
        "likes": "74",
        "shares": "2",
        "time": {
          "raw": "3h",
          "parsed": "19.02.2025",
          "isoString": "2025-02-19T05:03:41.244Z"
        },
        "mediaType": "image",
        "mediaContent": [
          "https://media.licdn.com/dms/image/v2/D4E22AQHXqiCirqHVPA/feedshare-shrink_800/B4EZUUWakRGYAo-/0/1739803182232?e=1744848000&v=beta&t=nbA_OhIsim6LPzlTOGfmPWY-cMf2oXF-WcXR9rqPkB4",
          "https://media.licdn.com/dms/image/v2/D4E22AQEWTnoPBDA0kg/feedshare-shrink_800/B4EZUUWaj8GwAg-/0/1739803180114?e=1744848000&v=beta&t=YFrWhhXeQrmj3YEQwerzmlMiAT0jP1srUjumhePmbqY",
          "https://media.licdn.com/dms/image/v2/D4E22AQGZpiYfiXfKUg/feedshare-shrink_800/B4EZUUWakHGwAg-/0/1739803179251?e=1744848000&v=beta&t=H4edPJMIPELSVrbXGFdYeHMRgQLunnH-P7eKoa3JWYk"
        ],
        "date": "2025-02-19T05:03:41.244Z"
      },
      {
        "captions": "🇫🇷 New video at BORNES RECYCLAGE coming soon ! #Lidex1300🇫🇷 New video at BORNES RECYCLAGE coming soon ! #Lidex1300",
        "likes": "103",
        "comments": "1",
        "shares": "11",
        "time": {
          "raw": "3h",
          "parsed": "19.02.2025",
          "isoString": "2025-02-19T05:03:41.245Z"
        },
        "mediaType": "image",
        "mediaContent": [
          "https://media.licdn.com/dms/image/v2/D4E22AQFrYD2RFVQYcg/feedshare-shrink_800/B4EZT6d29bHgAw-/0/1739368924877?e=1744848000&v=beta&t=jKsYf-Ds2RNdkNxlel4CfWiPS4n9TTzpMcGQr9aFR_Q",
          "https://media.licdn.com/dms/image/v2/D4E22AQH-WUUm7Zrtmg/feedshare-shrink_800/B4EZT6d28KGwAg-/0/1739368921314?e=1744848000&v=beta&t=eWKcQChFQgqpi6UHkHT_Pb91AK8wEhlVAHDcECwayck",
          "https://media.licdn.com/dms/image/v2/D4E22AQHuuJoVj8fKBg/feedshare-shrink_800/B4EZT6d28rG0Ao-/0/1739368923413?e=1744848000&v=beta&t=39myct4Mn5Ayp7rF_mGG4A2560EJaMYSkAee7TVvV_Q"
        ],
        "date": "2025-02-19T05:03:41.245Z"
      },
      {
        "captions": "We hebben vandaag 11/2/25 onze nieuwe lefort 650 trax schrootschaar op onze werf in beringe binnen gekregen \nMet deze machine maken we een grote stap om de metaal recycling op deze werf te vergrotenWe hebben vandaag 11/2/25 onze nieuwe lefort 650 trax schrootschaar op onze werf in beringe binnen gekregen \nMet deze machine maken we een grote stap om de metaal recycling op deze werf te vergroten",
        "likes": "155",
        "comments": "6",
        "shares": "1",
        "time": {
          "raw": "4h",
          "parsed": "12.02.2025",
          "isoString": "2025-02-12T05:03:41.246Z"
        },
        "mediaType": "image",
        "mediaContent": [
          "https://media.licdn.com/dms/image/v2/D5622AQEaM5TnYCzAtQ/feedshare-shrink_800/B56ZT21Z08GoAo-/0/1739307983425?e=1744848000&v=beta&t=s3Yf0qvDREx4BmFTB9PayHTt0V2ohssVooAnt9fHmrk",
          "https://media.licdn.com/dms/image/v2/D5622AQEHA-0zPAVh2w/feedshare-shrink_800/B56ZT21Z2CGsAs-/0/1739307983286?e=1744848000&v=beta&t=s8ij1WBQD9Jv4bLY-vPNkwzxo1v3CzH09smqXEMR8Gs"
        ],
        "date": "2025-02-12T05:03:41.246Z"
      },
      {
        "captions": "[𝟐𝟎𝟐𝟓 𝐋𝐄𝐅𝐎𝐑𝐓 𝐑𝐀𝐍𝐆𝐄]\n\nSelecting the right hydraulic shear depends on the type, rate and volume of material being processed, but also where the machine will work. \n\nThanks to a very large range of machines, we can accommodate any operation, from the smallest to the largest scrap yard facilities, with a product that will help bring success and growth to a recycler’s business.\n\nFind out more about our scrap shears  : https://lnkd.in/ertBPuHn\n[𝟐𝟎𝟐𝟓 𝐋𝐄𝐅𝐎𝐑𝐓 𝐑𝐀𝐍𝐆𝐄]\n\nSelecting the right hydraulic shear depends on the type, rate and volume of material being processed, but also where the machine will work. \n\nThanks to a very large range of machines, we can accommodate any operation, from the smallest to the largest scrap yard facilities, with a product that will help bring success and growth to a recycler’s business.\n\nFind out more about our scrap shears  : https://lnkd.in/ertBPuHn",
        "likes": "64",
        "comments": "1",
        "shares": "4",
        "time": {
          "raw": "1ay",
          "parsed": "12.02.2025",
          "isoString": "2025-02-12T05:03:41.247Z"
        },
        "mediaType": "image",
        "mediaContent": [
          "https://media.licdn.com/dms/image/v2/D4E22AQGwlwLT9tlEfQ/feedshare-shrink_800/B4EZTg2DkUGwAg-/0/1738939069642?e=1744848000&v=beta&t=0KuhEw1QWie6CpgC0ZbeU8gEeniW_9pkbkcUMHFeVVA",
          "https://media.licdn.com/dms/image/v2/D4E22AQHVFvyCwJumeQ/feedshare-shrink_800/B4EZTg2EKKGYAg-/0/1738939070172?e=1744848000&v=beta&t=T1IYcLxbbvLpgk1oNrmUO3nOLamOPhMMnawgNy9F4Z8",
          "https://media.licdn.com/dms/image/v2/D4E22AQGCsyknQLVF-g/feedshare-shrink_800/B4EZTg2EBQHMAk-/0/1738939070699?e=1744848000&v=beta&t=P_txuYOiUx2kiaHMRAvQmT9zB-IWzXtQ3NQHsTB_rzA",
          "https://media.licdn.com/dms/image/v2/D4E22AQHm32ERupTYsQ/feedshare-shrink_800/B4EZTg2EKQHUAo-/0/1738939070116?e=1744848000&v=beta&t=jvzXREMMlRjJGiPS8BUyr8W6bienb-tBSwrw6XOVRh4"
        ],
        "date": "2025-02-12T05:03:41.247Z"
      },
      {
        "captions": "NEWLY COMMISSIONED LEFORT TRAX 650 IN SYDNEY! 🛠️\n\nCongratulations to our valued customer in Sydney, Australia, on their brand-new LEFORT TRAX 650! By choosing LEFORT®, they are elevating their operations with unmatched performance, reliability, and durability. BUILT TO LAST! 💪\n\nFor inquiries contact Metquip.\nContact us now ✉\nWebsite: metquip.com.au/contact-us\nPhone: (08) 9362 4304\nEmail: sales@metquip.com.au\nWarehouse (locations):\n📍 84 Briggs Street, Welshpool ,WA 6106\n📍15/29 Governor Macquarie Drive, Chipping Norton, NSW 2170NEWLY COMMISSIONED LEFORT TRAX 650 IN SYDNEY! 🛠️\n\nCongratulations to our valued customer in Sydney, Australia, on their brand-new LEFORT TRAX 650! By choosing LEFORT®, they are elevating their operations with unmatched performance, reliability, and durability. BUILT TO LAST! 💪\n\nFor inquiries contact Metquip.\nContact us now ✉\nWebsite: metquip.com.au/contact-us\nPhone: (08) 9362 4304\nEmail: sales@metquip.com.au\nWarehouse (locations):\n📍 84 Briggs Street, Welshpool ,WA 6106\n📍15/29 Governor Macquarie Drive, Chipping Norton, NSW 2170",
        "likes": "43",
        "shares": "3",
        "time": {
          "raw": "1ay",
          "parsed": "12.02.2025",
          "isoString": "2025-02-12T05:03:41.249Z"
        },
        "mediaType": "image",
        "mediaContent": [
          "https://media.licdn.com/dms/image/v2/D5622AQHy5PuQi2v_qA/feedshare-shrink_800/B56ZTT_zlPHoAg-/0/1738723508412?e=1744848000&v=beta&t=qLYmgPSBr87CWmgmQBpOtebBFOOk8v-LgUJdCH53kA8",
          "https://media.licdn.com/dms/image/v2/D5622AQHg0RR0oPjIsA/feedshare-shrink_800/B56ZTT_zk3GQAo-/0/1738723507948?e=1744848000&v=beta&t=aJoJbliiXmB5fdNrsiQiCVTL3oECA-hG1BxZkFxAnMY",
          "https://media.licdn.com/dms/image/v2/D5622AQH0EvYFIJAlWA/feedshare-shrink_800/B56ZTT_zlEGQAg-/0/1738723508472?e=1744848000&v=beta&t=xFPKcX3bKUAae0dw8Z02D2HjdeKRlNwUdoaW7fIMSkg",
          "https://media.licdn.com/dms/image/v2/D5622AQFE-1qcsHltsA/feedshare-shrink_800/B56ZTT_zlRHQAg-/0/1738723509338?e=1744848000&v=beta&t=5_Zbvl4PlFlzVSpW0xHO9juH2LdBTSNIo3E0UcevzVk"
        ],
        "date": "2025-02-12T05:03:41.249Z"
      },
      {
        "captions": "This week, I had the opportunity to be involved in the commissioning of the LEFORT® TRAX, a cutting-edge machine from one of the world’s leading manufacturers in heavy-duty metal recycling. ♻️ \n\nThis one-of-a-kind machine combines powerful baling and shearing capabilities, making heavy duty scrap processing effortless. What sets it apart is its self-propelled mobility—mounted on tracks and operated with a single remote, it offers unmatched flexibility and efficiency on-site.\n\nThank you Walter Leijen, our director for this amazing opportunity. Looking forward for upcoming projects!\n\nBelow is a picture of me with the Lefort Trax 650.This week, I had the opportunity to be involved in the commissioning of the LEFORT® TRAX, a cutting-edge machine from one of the world’s leading manufacturers in heavy-duty metal recycling. ♻️ \n\nThis one-of-a-kind machine combines powerful baling and shearing capabilities, making heavy duty scrap processing effortless. What sets it apart is its self-propelled mobility—mounted on tracks and operated with a single remote, it offers unmatched flexibility and efficiency on-site.\n\nThank you Walter Leijen, our director for this amazing opportunity. Looking forward for upcoming projects!\n\nBelow is a picture of me with the Lefort Trax 650.",
        "likes": "22",
        "shares": "1",
        "time": {
          "raw": "1ay",
          "parsed": "12.02.2025",
          "isoString": "2025-02-12T05:03:41.250Z"
        },
        "mediaType": "image",
        "mediaContent": [
          "https://media.licdn.com/dms/image/v2/D5622AQEVg4Fusl-4Cg/feedshare-shrink_800/B56ZTUFTpIHoAk-/0/1738724952307?e=1744848000&v=beta&t=i3-_QWVbQ4gY0qCq5BvYas6i0_fk6wB-k99Nxx3JXKA"
        ],
        "date": "2025-02-12T05:03:41.250Z"
      },
      {
        "captions": "We recently delivered a 700-ton TRAX shear to William Waugh (Edinburgh) Limited. The arrival of this new shear/baler confirms the company’s commitment for staying at the forefront of technical progress.\n\nThe decision to acquire a 700-ton TRAX shear was driven by the need to modernize equipment and meet growing production demands. Alan Waugh  expressed his admiration for the flexibility of the TRAX, movable anywhere on the scrap yard.\n\nWith a cutting force of 700 tons and 6.6 m compression box, it is capable of processing large volumes of ferrous and non-ferrous. Each 325-ton press lid, along with a 180-ton pusher, ensures optimal material compression.\n\nThis shear is equipped with a 400 HP diesel engine allowing to process up to 20 t/hr and produce over 30 bales/hr.\n\nThe acquisition of this new TRAX machine marks a turning point for the company, which combines its family tradition with technological innovations to meet the future challenges of scrap metal recycling.We recently delivered a 700-ton TRAX shear to William Waugh (Edinburgh) Limited. The arrival of this new shear/baler confirms the company’s commitment for staying at the forefront of technical progress.\n\nThe decision to acquire a 700-ton TRAX shear was driven by the need to modernize equipment and meet growing production demands. Alan Waugh  expressed his admiration for the flexibility of the TRAX, movable anywhere on the scrap yard.\n\nWith a cutting force of 700 tons and 6.6 m compression box, it is capable of processing large volumes of ferrous and non-ferrous. Each 325-ton press lid, along with a 180-ton pusher, ensures optimal material compression.\n\nThis shear is equipped with a 400 HP diesel engine allowing to process up to 20 t/hr and produce over 30 bales/hr.\n\nThe acquisition of this new TRAX machine marks a turning point for the company, which combines its family tradition with technological innovations to meet the future challenges of scrap metal recycling.",
        "likes": "81",
        "shares": "4",
        "time": {
          "raw": "1ay",
          "parsed": "12.02.2025",
          "isoString": "2025-02-12T05:03:41.251Z"
        },
        "mediaType": "image",
        "mediaContent": [
          "https://media.licdn.com/dms/image/v2/D4E22AQFshLppCfb-hQ/feedshare-shrink_800/B4EZS3YQyeGYAk-/0/1738243382206?e=1744848000&v=beta&t=FwE7HLLLVMDXYj1JOq6M6Rsmhic8oXVZpNzjU6rjdAI",
          "https://media.licdn.com/dms/image/v2/D4E22AQHcFxvcDW6SDA/feedshare-shrink_800/B4EZS3YQymHUAg-/0/1738243381343?e=1744848000&v=beta&t=T6CnVWvokYdZldGDaI1B5sa2ONoDe0zWn5BVQM6oUlQ",
          "https://media.licdn.com/dms/image/v2/D4E22AQFB0Tv66X_CGA/feedshare-shrink_800/B4EZS3YQycGwAg-/0/1738243381297?e=1744848000&v=beta&t=z-zgK6LKPGQ9W3v3UXrZ7JbQjGCRUYhMv64z5X5XvFc"
        ],
        "date": "2025-02-12T05:03:41.251Z"
      },
      {
        "captions": "[𝐍𝐞𝐰 𝐏𝐚𝐢𝐧𝐭 𝐁𝐨𝐨𝐭𝐡] 🎨\n\nOur new cutting-edge paint facility is almost finished...\nOnly a few days left before the ribbon-cutting ceremony ![𝐍𝐞𝐰 𝐏𝐚𝐢𝐧𝐭 𝐁𝐨𝐨𝐭𝐡] 🎨\n\nOur new cutting-edge paint facility is almost finished...\nOnly a few days left before the ribbon-cutting ceremony !",
        "likes": "57",
        "shares": "8",
        "time": {
          "raw": "1ay",
          "parsed": "12.02.2025",
          "isoString": "2025-02-12T05:03:41.253Z"
        },
        "mediaType": "image",
        "mediaContent": [
          "https://media.licdn.com/dms/image/v2/D4E22AQHl2rxv26phOA/feedshare-shrink_800/B4EZSNhDrQGwAg-/0/1737541043653?e=1744848000&v=beta&t=TFl1g9L4fkKk3ecN4TaNyBe-HkbkfOKKRyx4MgOf9ig"
        ],
        "date": "2025-02-12T05:03:41.253Z"
      },
      {
        "captions": "🌎⚙️📦🚀\n\nWherever you are and whatever the time, parts availability is key.",
        "likes": "42",
        "shares": "11",
        "time": {
          "raw": "1ay",
          "parsed": "12.02.2025",
          "isoString": "2025-02-12T05:03:41.254Z"
        },
        "mediaType": "video",
        "mediaContent": {
          "src": [
            {
              "src": "https://dms.licdn.com/playlist/vid/v2/D4E05AQFoh1mivl09yw/mp4-640p-30fp-crf28/B4EZSJLRtFGYBc-/0/1737468253999?e=1742364000&v=beta&t=nEBeV1lOiL6CcsYQ7W-gJrQOoFcQhGzY6jIjwIleQlg",
              "type": "video/mp4",
              "data-bitrate": 872696
            },
            {
              "src": "https://dms.licdn.com/playlist/vid/v2/D4E05AQFoh1mivl09yw/mp4-720p-30fp-crf28/B4EZSJLRtFGYBg-/0/1737468263633?e=1742364000&v=beta&t=6_gapo5y9RKssl7931eIy36wGIwZuCs7T9Y4Fw9kwns",
              "type": "video/mp4",
              "data-bitrate": 1140218
            }
          ],
          "posterUrl": "https://media.licdn.com/dms/image/v2/D4E05AQFoh1mivl09yw/feedshare-thumbnail_720_1280/B4EZSJLRtFGYA8-/0/1737468227932?e=1742364000&v=beta&t=Vx2HNMDBBLesFH-gQ2IWuLhnU3gdsPi0_ksfoC9KiUs"
        },
        "date": "2025-02-12T05:03:41.254Z"
      },
      {
        "captions": "The new 2025 LEFORT® catalog is now available. It gives a broad overview of what we manufacture and offer.\n \nIf you want technical details or additional information, do not hesitate to contact us. We are here to support you worldwide 💪🏽\n\n#BuiltToLast",
        "likes": "44",
        "shares": "4",
        "time": {
          "raw": "1ay",
          "parsed": "12.02.2025",
          "isoString": "2025-02-12T05:03:41.255Z"
        },
        "mediaType": "document",
        "mediaContent": {
          "title": "2025 LEFORT CATALOG",
          "subtitle": "15 sayfa",
          "totalPages": 15,
          "coverPages": [
            {
              "type": "image",
              "config": {
                "src": "https://media.licdn.com/dms/image/v2/D4E1FAQF0tm1LO5giUQ/feedshare-document-cover-images_480/B4EZSDRBUiHABI-/0/1737369083190?e=1742364000&v=beta&t=iz23-6mPz2WqRutzAbAKRXhVxCi168jsc6Kt64heiz4"
              }
            },
            {
              "type": "image",
              "config": {
                "src": "https://media.licdn.com/dms/image/v2/D4E1FAQF0tm1LO5giUQ/feedshare-document-cover-images_480/B4EZSDRBUiHABI-/1/1737369083190?e=1742364000&v=beta&t=-vrhkfWYXs5kSgKSgrE3WhrJo6O0xyYM7C3cB62S3ZY"
              }
            },
            {
              "type": "image",
              "config": {
                "src": "https://media.licdn.com/dms/image/v2/D4E1FAQF0tm1LO5giUQ/feedshare-document-cover-images_480/B4EZSDRBUiHABI-/2/1737369083190?e=1742364000&v=beta&t=_cIcM_iCgf0q_iNOZ3pJLNdKS5eyWrGVWQRhEzPQvdQ"
              }
            }
          ]
        },
        "date": "2025-02-12T05:03:41.255Z"
      },
      {
        "captions": "Proud to add another Lefort Trax to our fleet of shears, optimising scrap processing at our Ripon site 🤩♻️Proud to add another Lefort Trax to our fleet of shears, optimising scrap processing at our Ripon site 🤩♻️",
        "likes": "129",
        "comments": "7",
        "shares": "2",
        "time": {
          "raw": "1ay",
          "parsed": "12.02.2025",
          "isoString": "2025-02-12T05:03:41.256Z"
        },
        "mediaType": "image",
        "mediaContent": [
          "https://media.licdn.com/dms/image/v2/D4D22AQF9uz9ErOnf-g/feedshare-shrink_800/B4DZRlZahuHYAk-/0/1736867952878?e=1744848000&v=beta&t=Mskvbd5KRrb9yyrc1k2EbtaXGTcl-LIECxidy-VCHDQ"
        ],
        "date": "2025-02-12T05:03:41.256Z"
      },
      {
        "captions": "Family-owned company BORNES RECYCLAGE took delivery of a 1,300-tonne side compression shear Lidex. With this new heavy-duty machine, the scrap metal recycling expert is laying the foundations of its future development.\n\nSome key specs :\n\n▪️Up to 70 t/hour\n▪️Full automatic cycle\n▪️Cross head in cast steel for a better resistance\n▪️Ultra-rapid cutting blades replacement system \n\n🔗 Read full article in the Lefort Mag #2\n\nhttps://lnkd.in/efdfqpSSFamily-owned company BORNES RECYCLAGE took delivery of a 1,300-tonne side compression shear Lidex. With this new heavy-duty machine, the scrap metal recycling expert is laying the foundations of its future development.\n\nSome key specs :\n\n▪️Up to 70 t/hour\n▪️Full automatic cycle\n▪️Cross head in cast steel for a better resistance\n▪️Ultra-rapid cutting blades replacement system \n\n🔗 Read full article in the Lefort Mag #2\n\nhttps://lnkd.in/efdfqpSS",
        "likes": "193",
        "comments": "7",
        "shares": "9",
        "time": {
          "raw": "1ay",
          "parsed": "12.02.2025",
          "isoString": "2025-02-12T05:03:41.257Z"
        },
        "mediaType": "image",
        "mediaContent": [
          "https://media.licdn.com/dms/image/v2/D4E22AQGvD82HYg3KDg/feedshare-shrink_800/B4EZRhFzrkGgAg-/0/1736795701931?e=1744848000&v=beta&t=Qbl9UxS9lcB5LZoRuQLu0qzq4e0Bu_3Bql0QhOb7PRs"
        ],
        "date": "2025-02-12T05:03:41.257Z"
      },
      {
        "captions": "Never too big 🇺🇸 #LefortAmerica #LidexNever too big 🇺🇸 #LefortAmerica #Lidex",
        "likes": "104",
        "comments": "1",
        "shares": "9",
        "time": {
          "raw": "2ay",
          "parsed": "12.01.2025",
          "isoString": "2025-01-12T05:03:41.258Z"
        },
        "mediaType": "image",
        "mediaContent": [
          "https://media.licdn.com/dms/image/v2/D4E22AQELNxTgPm4Kmg/feedshare-shrink_800/B4EZRCqB6JHkAg-/0/1736285104092?e=1744848000&v=beta&t=fGkighKUnE_QtIzx-8NqUFiNhHg-VND17yDQ12k_9Zc"
        ],
        "date": "2025-01-12T05:03:41.258Z"
      },
      {
        "captions": "Crawling into 2025 #HappyNewYear #Trax",
        "likes": "80",
        "comments": "1",
        "shares": "6",
        "time": {
          "raw": "2ay",
          "parsed": "12.01.2025",
          "isoString": "2025-01-12T05:03:41.259Z"
        },
        "mediaType": "video",
        "mediaContent": {
          "src": [
            {
              "src": "https://dms.licdn.com/playlist/vid/v2/D4E05AQEuALTUqE9U2Q/mp4-640p-30fp-crf28/B4EZQjzNt8GYBg-/0/1735767420885?e=1742364000&v=beta&t=R7z359lKihHEM6Iii1Krz7bNaY88igzeSa1CSoM5Vw8",
              "type": "video/mp4",
              "data-bitrate": 817676
            },
            {
              "src": "https://dms.licdn.com/playlist/vid/v2/D4E05AQEuALTUqE9U2Q/mp4-720p-30fp-crf28/B4EZQjzNt8GYBk-/0/1735767421217?e=1742364000&v=beta&t=9rnSBcXMAflaBoMSE2_6AZ1czDXFdc3Vq999cPrmVZ8",
              "type": "video/mp4",
              "data-bitrate": 1156466
            }
          ],
          "posterUrl": "https://media.licdn.com/dms/image/v2/D4E05AQEuALTUqE9U2Q/videocover-low/B4EZQjzNt8GYCU-/0/1735767419013?e=1742364000&v=beta&t=fgPmHQzLR-lnZ-J52SavVS9vWx1QIdydaewyCwCKSBU"
        },
        "date": "2025-01-12T05:03:41.259Z"
      },
      {
        "captions": "Arrivée de notre nouvelle presse cisaille LEFORT®  track 650 sur notre site de colombier-saugnieu(69).\n#Lefort #recyclage #aluminium #Ari #federec #recycling #birArrivée de notre nouvelle presse cisaille LEFORT®  track 650 sur notre site de colombier-saugnieu(69).\n#Lefort #recyclage #aluminium #Ari #federec #recycling #bir",
        "likes": "199",
        "comments": "21",
        "shares": "11",
        "time": {
          "raw": "3ay",
          "parsed": "12.12.2024",
          "isoString": "2024-12-12T05:03:41.260Z"
        },
        "mediaType": "image",
        "mediaContent": [
          "https://media.licdn.com/dms/image/v2/D4D22AQHmRrjZVAW3RA/feedshare-shrink_800/B4DZO2NQq9HUAg-/0/1733928754628?e=1744848000&v=beta&t=Olo9VGI4-CUChyTHqA77lW5t9RqApmww27PY61TAwjQ"
        ],
        "date": "2024-12-12T05:03:41.260Z"
      },
      {
        "captions": "THANK YOU 2024 🧡👋🏼",
        "likes": "55",
        "comments": "1",
        "shares": "10",
        "time": {
          "raw": "2ay",
          "parsed": "05.01.2025",
          "isoString": "2025-01-05T10:26:55.698Z"
        },
        "mediaType": "video",
        "mediaContent": {
          "src": [
            {
              "src": "https://dms.licdn.com/playlist/vid/v2/D4E05AQGNCpRBI1rj3Q/mp4-720p-30fp-crf28/B4EZQb533.HkBk-/0/1735634956467?e=1741777200&v=beta&t=PHgIA3r7k3jFgHjU3A5dRDjHGuGqCy_cMJLWvoHDmXI",
              "type": "video/mp4",
              "data-bitrate": 1167429
            },
            {
              "src": "https://dms.licdn.com/playlist/vid/v2/D4E05AQGNCpRBI1rj3Q/mp4-640p-30fp-crf28/B4EZQb533.HkBg-/0/1735634956012?e=1741777200&v=beta&t=bIhBpujl8S_aFX5nxquV8NSJqkHpkJNaJQUY0WFcNFM",
              "type": "video/mp4",
              "data-bitrate": 925426
            }
          ],
          "posterUrl": "https://media.licdn.com/dms/image/v2/D4E05AQGNCpRBI1rj3Q/videocover-high/B4EZQb533.HkBw-/0/1735634952383?e=1741777200&v=beta&t=17MpBekr-yk3wX7INuNkgNEUDv6JztXz0vJWBaIc5_U"
        },
        "date": "2025-01-05T10:26:55.698Z"
      },
      {
        "captions": "Voici notre nouvelle cisailles TRAX 650 Tonnes LEFORT® 😃, un équipement performant pour mieux valoriser vos fers et métaux. Ce nouvel investissement nous permet de produire mieux,  plus vite, de limiter notre emprunte carbone en déplaçant la cisaille vers les métaux à préparer et non l’inverse. \nN’hésitez pas à nous consulter pour la valorisation de vos fers et métaux ! ♻️ \nSETEO ENVIRONNEMENT c’est aussi une solution globale pour la gestion globale de vos déchets, dangereux, non dangereux !\nRdv sur notre site seteo.fr \nSETEO#Environnement#Fers#Métaux#Bougogne#Côted’or#DijonVoici notre nouvelle cisailles TRAX 650 Tonnes LEFORT® 😃, un équipement performant pour mieux valoriser vos fers et métaux. Ce nouvel investissement nous permet de produire mieux,  plus vite, de limiter notre emprunte carbone en déplaçant la cisaille vers les métaux à préparer et non l’inverse. \nN’hésitez pas à nous consulter pour la valorisation de vos fers et métaux ! ♻️ \nSETEO ENVIRONNEMENT c’est aussi une solution globale pour la gestion globale de vos déchets, dangereux, non dangereux !\nRdv sur notre site seteo.fr \nSETEO#Environnement#Fers#Métaux#Bougogne#Côted’or#Dijon",
        "likes": "96",
        "comments": "2",
        "shares": "6",
        "time": {
          "raw": "17s",
          "parsed": "11.03.2025",
          "isoString": "2025-03-11T12:03:41.237Z"
        },
        "mediaType": "image",
        "mediaContent": [
          "https://media.licdn.com/dms/image/v2/D4D22AQFur0-zWe5hFA/feedshare-shrink_800/B4DZWFCxndG8Ag-/0/1741693872197?e=1744848000&v=beta&t=CTCRlNp012Pfnr5tWI8KSanalPobXz85UfU9kxiNxiU"
        ],
        "date": "2025-03-11T12:03:41.237Z"
      }
    ]
  },
  {
    "name": "COPEXMetalRecyclingEquipment",
    "followerData": [
      [
        20250225,
        2125
      ],
      [
        20250225,
        2125
      ],
      [
        20250225,
        2125
      ],
      [
        20250228,
        2126
      ],
      [
        20250228,
        2126
      ],
      [
        20250228,
        2126
      ],
      [
        20250228,
        2126
      ],
      [
        20250303,
        2130
      ],
      [
        1741011539486,
        "2.130"
      ],
      [
        1741076538184,
        "2.131"
      ],
      [
        1741077679605,
        "2.131"
      ],
      [
        1741083653973,
        "2.131"
      ],
      [
        1741084667432,
        "2.131"
      ],
      [
        1741170435304,
        2131
      ],
      [
        1741755836322,
        2133
      ]
    ],
    "data": [
      {
        "captions": "💥🎬 [𝐯𝐢𝐝𝐞𝐨] BORNES RECYCLAGE ramps-up with a new Lidex 1300T !\n\n« Our Lidex can go up to 70t/hr. It has a rail breaker and can handle heavy scrap when needed. In the crane, thanks to the automatic cycle, our operator can prepare the next load while the scrap previously loaded is still being processed. No time is lost ! » Charles Bornes \n\nM. Bornes also prizes the total cooperation shown throughout the project including the recommendations for the most efficient layout of the machine on site, the supply of the civil engineering guide drawings, the logistic operations, the assembly & commissioning of the machine, not forgetting the training of operators and technicians.\n\n🤝 Thanks again to the Bornes family for their trust.",
        "likes": "142",
        "comments": "4",
        "shares": "12",
        "time": {
          "raw": "1h",
          "parsed": "05.03.2025",
          "isoString": "2025-03-05T05:03:56.060Z"
        },
        "mediaType": "video",
        "mediaContent": {
          "src": [
            {
              "src": "https://dms.licdn.com/playlist/vid/v2/D4E05AQHzBjqS2q1Tgw/mp4-720p-30fp-crf28/B4EZVH73AHGYBg-/0/1740668685959?e=1742364000&v=beta&t=I_piimkD6TRto9-sXK3SOsd2pQKKuER2_kTx8EF1A-w",
              "type": "video/mp4",
              "data-bitrate": 1116984
            },
            {
              "src": "https://dms.licdn.com/playlist/vid/v2/D4E05AQHzBjqS2q1Tgw/mp4-640p-30fp-crf28/B4EZVH73AHGYBc-/0/1740668687592?e=1742364000&v=beta&t=DYOhA8QfBgP866LPyG725PF3UmjJ_nxKUaLk9RBrBf4",
              "type": "video/mp4",
              "data-bitrate": 802291
            }
          ],
          "posterUrl": "https://media.licdn.com/dms/image/v2/D4E05AQHzBjqS2q1Tgw/videocover-low/B4EZVH73AHGYCM-/0/1740668675906?e=1742364000&v=beta&t=lBFJbyoIkoRKnnJ8vEU7dbxhbhPfVuqW_EmLFDEoDJU"
        },
        "date": "2025-03-05T05:03:56.060Z"
      },
      {
        "captions": "Wich one would you choose ? 650, 700, 800 or 1000T ? 🤩Wich one would you choose ? 650, 700, 800 or 1000T ? 🤩",
        "likes": "76",
        "comments": "5",
        "shares": "7",
        "time": {
          "raw": "2h",
          "parsed": "26.02.2025",
          "isoString": "2025-02-26T05:03:56.061Z"
        },
        "mediaType": "image",
        "mediaContent": [
          "https://media.licdn.com/dms/image/v2/D4E22AQFBhuWUdXPPEw/feedshare-shrink_800/B4EZU5VpuiHUAg-/0/1740423736410?e=1744848000&v=beta&t=YxHDllT1y1Lexx-8MFjyhL9ZPKvfB5GczcRHLyDEAMA",
          "https://media.licdn.com/dms/image/v2/D4E22AQEQERvskXpWxQ/feedshare-shrink_800/B4EZU5VptzHcAg-/0/1740423736612?e=1744848000&v=beta&t=XFQUCOYCJ7K1jz6dRIT4KTZF3xke1-296qQ5OiVmOY0"
        ],
        "date": "2025-02-26T05:03:56.061Z"
      },
      {
        "captions": "🇫🇷 New video at BORNES RECYCLAGE coming soon ! #Lidex1300🇫🇷 New video at BORNES RECYCLAGE coming soon ! #Lidex1300",
        "likes": "103",
        "comments": "1",
        "shares": "11",
        "time": {
          "raw": "3h",
          "parsed": "19.02.2025",
          "isoString": "2025-02-19T05:03:56.063Z"
        },
        "mediaType": "image",
        "mediaContent": [
          "https://media.licdn.com/dms/image/v2/D4E22AQFrYD2RFVQYcg/feedshare-shrink_800/B4EZT6d29bHgAw-/0/1739368924877?e=1744848000&v=beta&t=jKsYf-Ds2RNdkNxlel4CfWiPS4n9TTzpMcGQr9aFR_Q",
          "https://media.licdn.com/dms/image/v2/D4E22AQH-WUUm7Zrtmg/feedshare-shrink_800/B4EZT6d28KGwAg-/0/1739368921314?e=1744848000&v=beta&t=eWKcQChFQgqpi6UHkHT_Pb91AK8wEhlVAHDcECwayck",
          "https://media.licdn.com/dms/image/v2/D4E22AQHuuJoVj8fKBg/feedshare-shrink_800/B4EZT6d28rG0Ao-/0/1739368923413?e=1744848000&v=beta&t=39myct4Mn5Ayp7rF_mGG4A2560EJaMYSkAee7TVvV_Q"
        ],
        "date": "2025-02-19T05:03:56.063Z"
      },
      {
        "captions": "[𝟐𝟎𝟐𝟓 𝐋𝐄𝐅𝐎𝐑𝐓 𝐑𝐀𝐍𝐆𝐄]\n\nSelecting the right hydraulic shear depends on the type, rate and volume of material being processed, but also where the machine will work. \n\nThanks to a very large range of machines, we can accommodate any operation, from the smallest to the largest scrap yard facilities, with a product that will help bring success and growth to a recycler’s business.\n\nFind out more about our scrap shears  : https://lnkd.in/ertBPuHn\n[𝟐𝟎𝟐𝟓 𝐋𝐄𝐅𝐎𝐑𝐓 𝐑𝐀𝐍𝐆𝐄]\n\nSelecting the right hydraulic shear depends on the type, rate and volume of material being processed, but also where the machine will work. \n\nThanks to a very large range of machines, we can accommodate any operation, from the smallest to the largest scrap yard facilities, with a product that will help bring success and growth to a recycler’s business.\n\nFind out more about our scrap shears  : https://lnkd.in/ertBPuHn",
        "likes": "64",
        "comments": "1",
        "shares": "4",
        "time": {
          "raw": "1ay",
          "parsed": "12.02.2025",
          "isoString": "2025-02-12T05:03:56.065Z"
        },
        "mediaType": "image",
        "mediaContent": [
          "https://media.licdn.com/dms/image/v2/D4E22AQGwlwLT9tlEfQ/feedshare-shrink_800/B4EZTg2DkUGwAg-/0/1738939069642?e=1744848000&v=beta&t=0KuhEw1QWie6CpgC0ZbeU8gEeniW_9pkbkcUMHFeVVA",
          "https://media.licdn.com/dms/image/v2/D4E22AQHVFvyCwJumeQ/feedshare-shrink_800/B4EZTg2EKKGYAg-/0/1738939070172?e=1744848000&v=beta&t=T1IYcLxbbvLpgk1oNrmUO3nOLamOPhMMnawgNy9F4Z8",
          "https://media.licdn.com/dms/image/v2/D4E22AQGCsyknQLVF-g/feedshare-shrink_800/B4EZTg2EBQHMAk-/0/1738939070699?e=1744848000&v=beta&t=P_txuYOiUx2kiaHMRAvQmT9zB-IWzXtQ3NQHsTB_rzA",
          "https://media.licdn.com/dms/image/v2/D4E22AQHm32ERupTYsQ/feedshare-shrink_800/B4EZTg2EKQHUAo-/0/1738939070116?e=1744848000&v=beta&t=jvzXREMMlRjJGiPS8BUyr8W6bienb-tBSwrw6XOVRh4"
        ],
        "date": "2025-02-12T05:03:56.065Z"
      },
      {
        "captions": "🌎⚙️📦🚀\n\nWherever you are and whatever the time, parts availability is key.",
        "likes": "42",
        "shares": "11",
        "time": {
          "raw": "1ay",
          "parsed": "12.02.2025",
          "isoString": "2025-02-12T05:03:56.066Z"
        },
        "mediaType": "video",
        "mediaContent": {
          "src": [
            {
              "src": "https://dms.licdn.com/playlist/vid/v2/D4E05AQFoh1mivl09yw/mp4-640p-30fp-crf28/B4EZSJLRtFGYBc-/0/1737468253999?e=1742364000&v=beta&t=nEBeV1lOiL6CcsYQ7W-gJrQOoFcQhGzY6jIjwIleQlg",
              "type": "video/mp4",
              "data-bitrate": 872696
            },
            {
              "src": "https://dms.licdn.com/playlist/vid/v2/D4E05AQFoh1mivl09yw/mp4-720p-30fp-crf28/B4EZSJLRtFGYBg-/0/1737468263633?e=1742364000&v=beta&t=6_gapo5y9RKssl7931eIy36wGIwZuCs7T9Y4Fw9kwns",
              "type": "video/mp4",
              "data-bitrate": 1140218
            }
          ],
          "posterUrl": "https://media.licdn.com/dms/image/v2/D4E05AQFoh1mivl09yw/feedshare-thumbnail_720_1280/B4EZSJLRtFGYA8-/0/1737468227932?e=1742364000&v=beta&t=Vx2HNMDBBLesFH-gQ2IWuLhnU3gdsPi0_ksfoC9KiUs"
        },
        "date": "2025-02-12T05:03:56.066Z"
      },
      {
        "captions": "Family-owned company BORNES RECYCLAGE took delivery of a 1,300-tonne side compression shear Lidex. With this new heavy-duty machine, the scrap metal recycling expert is laying the foundations of its future development.\n\nSome key specs :\n\n▪️Up to 70 t/hour\n▪️Full automatic cycle\n▪️Cross head in cast steel for a better resistance\n▪️Ultra-rapid cutting blades replacement system \n\n🔗 Read full article in the Lefort Mag #2\n\nhttps://lnkd.in/efdfqpSSFamily-owned company BORNES RECYCLAGE took delivery of a 1,300-tonne side compression shear Lidex. With this new heavy-duty machine, the scrap metal recycling expert is laying the foundations of its future development.\n\nSome key specs :\n\n▪️Up to 70 t/hour\n▪️Full automatic cycle\n▪️Cross head in cast steel for a better resistance\n▪️Ultra-rapid cutting blades replacement system \n\n🔗 Read full article in the Lefort Mag #2\n\nhttps://lnkd.in/efdfqpSS",
        "likes": "193",
        "comments": "7",
        "shares": "9",
        "time": {
          "raw": "1ay",
          "parsed": "12.02.2025",
          "isoString": "2025-02-12T05:03:56.068Z"
        },
        "mediaType": "image",
        "mediaContent": [
          "https://media.licdn.com/dms/image/v2/D4E22AQGvD82HYg3KDg/feedshare-shrink_800/B4EZRhFzrkGgAg-/0/1736795701931?e=1744848000&v=beta&t=Qbl9UxS9lcB5LZoRuQLu0qzq4e0Bu_3Bql0QhOb7PRs"
        ],
        "date": "2025-02-12T05:03:56.068Z"
      },
      {
        "captions": "Never too big 🇺🇸 #LefortAmerica #LidexNever too big 🇺🇸 #LefortAmerica #Lidex",
        "likes": "104",
        "comments": "1",
        "shares": "9",
        "time": {
          "raw": "2ay",
          "parsed": "12.01.2025",
          "isoString": "2025-01-12T05:03:56.069Z"
        },
        "mediaType": "image",
        "mediaContent": [
          "https://media.licdn.com/dms/image/v2/D4E22AQELNxTgPm4Kmg/feedshare-shrink_800/B4EZRCqB6JHkAg-/0/1736285104092?e=1744848000&v=beta&t=fGkighKUnE_QtIzx-8NqUFiNhHg-VND17yDQ12k_9Zc"
        ],
        "date": "2025-01-12T05:03:56.069Z"
      },
      {
        "captions": "Crawling into 2025 #HappyNewYear #Trax",
        "likes": "80",
        "comments": "1",
        "shares": "6",
        "time": {
          "raw": "2ay",
          "parsed": "12.01.2025",
          "isoString": "2025-01-12T05:03:56.070Z"
        },
        "mediaType": "video",
        "mediaContent": {
          "src": [
            {
              "src": "https://dms.licdn.com/playlist/vid/v2/D4E05AQEuALTUqE9U2Q/mp4-640p-30fp-crf28/B4EZQjzNt8GYBg-/0/1735767420885?e=1742364000&v=beta&t=R7z359lKihHEM6Iii1Krz7bNaY88igzeSa1CSoM5Vw8",
              "type": "video/mp4",
              "data-bitrate": 817676
            },
            {
              "src": "https://dms.licdn.com/playlist/vid/v2/D4E05AQEuALTUqE9U2Q/mp4-720p-30fp-crf28/B4EZQjzNt8GYBk-/0/1735767421217?e=1742364000&v=beta&t=9rnSBcXMAflaBoMSE2_6AZ1czDXFdc3Vq999cPrmVZ8",
              "type": "video/mp4",
              "data-bitrate": 1156466
            }
          ],
          "posterUrl": "https://media.licdn.com/dms/image/v2/D4E05AQEuALTUqE9U2Q/videocover-low/B4EZQjzNt8GYCU-/0/1735767419013?e=1742364000&v=beta&t=fgPmHQzLR-lnZ-J52SavVS9vWx1QIdydaewyCwCKSBU"
        },
        "date": "2025-01-12T05:03:56.070Z"
      },
      {
        "captions": "THANK YOU 2024 🧡👋🏼",
        "likes": "55",
        "comments": "1",
        "shares": "10",
        "time": {
          "raw": "2ay",
          "parsed": "12.01.2025",
          "isoString": "2025-01-12T05:03:56.071Z"
        },
        "mediaType": "video",
        "mediaContent": {
          "src": [
            {
              "src": "https://dms.licdn.com/playlist/vid/v2/D4E05AQGNCpRBI1rj3Q/mp4-720p-30fp-crf28/B4EZQb533.HkBk-/0/1735634956467?e=1742364000&v=beta&t=7W-vwz9YxpuTjczI9I9NWQudIgvrPfei_9QGdwVjFvU",
              "type": "video/mp4",
              "data-bitrate": 1167429
            },
            {
              "src": "https://dms.licdn.com/playlist/vid/v2/D4E05AQGNCpRBI1rj3Q/mp4-640p-30fp-crf28/B4EZQb533.HkBg-/0/1735634956012?e=1742364000&v=beta&t=pAXg7_izAtA8bkJmWfJhK8rS4ZSVGXJ54ZKgW10IxZA",
              "type": "video/mp4",
              "data-bitrate": 925426
            }
          ],
          "posterUrl": "https://media.licdn.com/dms/image/v2/D4E05AQGNCpRBI1rj3Q/videocover-high/B4EZQb533.HkBw-/0/1735634952383?e=1742364000&v=beta&t=gFQkyrQCp4a5WwGyZs7g3y2IhqTgV46GYw_jz9rl7v8"
        },
        "date": "2025-01-12T05:03:56.071Z"
      },
      {
        "captions": "🎅🏻🎄🎁💫\n\nAs we celebrate the holiday season, we want to take a moment to express our heartfelt gratitude to each of you.\n\nMay the spirit of Christmas bring peace, joy and warmth to you and your loved ones. \n\nWishing you all a merry Christmas and a prosperous New Year, filled with new challenges and success 🥂✨🎅🏻🎄🎁💫\n\nAs we celebrate the holiday season, we want to take a moment to express our heartfelt gratitude to each of you.\n\nMay the spirit of Christmas bring peace, joy and warmth to you and your loved ones. \n\nWishing you all a merry Christmas and a prosperous New Year, filled with new challenges and success 🥂✨",
        "likes": "59",
        "shares": "5",
        "time": {
          "raw": "2ay",
          "parsed": "05.01.2025",
          "isoString": "2025-01-05T10:27:15.006Z"
        },
        "mediaType": "image",
        "mediaContent": [
          "https://media.licdn.com/dms/image/v2/D4E22AQGJdKrDCKbYpg/feedshare-shrink_800/B4EZP39LSoHgAg-/0/1735031833519?e=1744243200&v=beta&t=BaxhPoWuwPkb3sQgnmTtCt4LO2uTAbS56mGIZO7n13g"
        ],
        "date": "2025-01-05T10:27:15.006Z"
      },
      {
        "captions": "Noel avant l'heure. Du coup le 25, nous n'aurons rien au sapin.\nFeaturing de gauche à droite:\nGuillaume (Copex-Lefort),Bernard NADAL, Philippe NADAL, Lionel LEMENTEC (Copex-Lefort),Olivier JALIBERTNoel avant l'heure. Du coup le 25, nous n'aurons rien au sapin.\nFeaturing de gauche à droite:\nGuillaume (Copex-Lefort),Bernard NADAL, Philippe NADAL, Lionel LEMENTEC (Copex-Lefort),Olivier JALIBERT",
        "likes": "172",
        "comments": "16",
        "shares": "4",
        "time": {
          "raw": "2ay",
          "parsed": "05.01.2025",
          "isoString": "2025-01-05T10:27:15.007Z"
        },
        "mediaType": "image",
        "mediaContent": [
          "https://media.licdn.com/dms/image/v2/D4E22AQG_gs8MTSSR5g/feedshare-shrink_800/B4EZPP77owHwAo-/0/1734360417353?e=1744243200&v=beta&t=f0pXkrFzIPSE2BNntDzYfX-jKT65h9Q5O5lK2KWFBPs"
        ],
        "date": "2025-01-05T10:27:15.007Z"
      },
      {
        "captions": "🎬 𝐍𝐄𝐖 𝐋𝐈𝐃𝐄𝐗 𝟐𝟎𝟎𝟎𝐓 𝐚𝐭 Galloo ♻️\n \nNo need for words, just turn on the sound and watch !",
        "likes": "102",
        "comments": "2",
        "shares": "14",
        "time": {
          "raw": "2ay",
          "parsed": "05.01.2025",
          "isoString": "2025-01-05T10:27:15.009Z"
        },
        "mediaType": "video",
        "mediaContent": {
          "src": [
            {
              "src": "https://dms.licdn.com/playlist/vid/v2/D4E05AQHzH8ZHEmRRZw/mp4-640p-30fp-crf28/mp4-640p-30fp-crf28/0/1733834058647?e=1741777200&v=beta&t=mOyQnQ4OPm2gZhMdrYnXx8lFX2vslKHVvNDkyhQn1Hk",
              "type": "video/mp4",
              "data-bitrate": 754533
            },
            {
              "src": "https://dms.licdn.com/playlist/vid/v2/D4E05AQHzH8ZHEmRRZw/mp4-720p-30fp-crf28/mp4-720p-30fp-crf28/0/1733834048591?e=1741777200&v=beta&t=-cArWuN2fzQxQGpDoWgaAyNgY8qOvKCUmPk8gzoqU_w",
              "type": "video/mp4",
              "data-bitrate": 1005798
            }
          ],
          "posterUrl": "https://media.licdn.com/dms/image/v2/D4E05AQHzH8ZHEmRRZw/feedshare-thumbnail_720_1280/feedshare-thumbnail_720_1280/0/1733833812668?e=1741777200&v=beta&t=I--y6PZN5iWbuoSb6HplkiqSSdIJAJPTrdddkjJLqK4"
        },
        "date": "2025-01-05T10:27:15.009Z"
      },
      {
        "captions": "🗞️𝗧𝗵𝗲 𝗢𝗳𝗳𝗶𝗰𝗶𝗮𝗹 𝗟𝗲𝗳𝗼𝗿𝘁 𝗠𝗮𝗴𝗮𝘇𝗶𝗻𝗲 #𝟮 𝗶𝘀 𝗼𝘂𝘁 ! \n\nClick and dive into the Lefort universe with our latest news, technical insights, recent developments, customer interviews and more ... \n\nFrom customers to employees, from suppliers to passionate fans, this mag was created to unite our entire community around the Lefort brand. \n\nThank you all and happy reading !",
        "likes": "75",
        "comments": "1",
        "shares": "12",
        "time": {
          "raw": "3ay",
          "parsed": "05.12.2024",
          "isoString": "2024-12-05T10:27:15.010Z"
        },
        "mediaType": "document",
        "mediaContent": {
          "title": "The Official Lefort Magazine #2",
          "subtitle": "8 sayfa",
          "totalPages": 8,
          "coverPages": [
            {
              "type": "image",
              "config": {
                "src": "https://media.licdn.com/dms/image/v2/D4D1FAQHXIW6JSKOD2w/feedshare-document-cover-images_480/feedshare-document-cover-images_480/0/1733306963886?e=1741777200&v=beta&t=76jzwyyvfgOqc-rqyjLzVxQmPSKKFjr3ncm_TIaTkSk"
              }
            },
            {
              "type": "image",
              "config": {
                "src": "https://media.licdn.com/dms/image/v2/D4D1FAQHXIW6JSKOD2w/feedshare-document-cover-images_480/feedshare-document-cover-images_480/1/1733306963886?e=1741777200&v=beta&t=b9n5NR4AHozRUtoyGKe2JF5d5S5KTr0xDgZt4s0g9UE"
              }
            },
            {
              "type": "image",
              "config": {
                "src": "https://media.licdn.com/dms/image/v2/D4D1FAQHXIW6JSKOD2w/feedshare-document-cover-images_480/feedshare-document-cover-images_480/2/1733306963886?e=1741777200&v=beta&t=uplgB4u4TttihIDSh1obvSnNHdOJUSfM57zyURYxSno"
              }
            }
          ]
        },
        "date": "2024-12-05T10:27:15.010Z"
      },
      {
        "captions": "𝟏𝐬𝐭 𝐋𝐞𝐟𝐨𝐫𝐭 𝐋𝐢𝐝𝐞𝐱 𝐢𝐧 𝐓𝐚𝐢𝐰𝐚𝐧 🇹🇼\n\nLefort is proud to announce the successful commissioning of a first hydraulic shear Lidex 1300T at the Taiwanese company, Feng Hsin Steel. \n\nProof of the growing interest in Lefort machines from steelmakers, this installation also demonstrates the productivity and robustness necessary for companies wishing to process all kinds of scrap metal at high efficiency. \n\nA great project smoothly conducted by our teams and our local partners. Congratulations! 👏🏼𝟏𝐬𝐭 𝐋𝐞𝐟𝐨𝐫𝐭 𝐋𝐢𝐝𝐞𝐱 𝐢𝐧 𝐓𝐚𝐢𝐰𝐚𝐧 🇹🇼\n\nLefort is proud to announce the successful commissioning of a first hydraulic shear Lidex 1300T at the Taiwanese company, Feng Hsin Steel. \n\nProof of the growing interest in Lefort machines from steelmakers, this installation also demonstrates the productivity and robustness necessary for companies wishing to process all kinds of scrap metal at high efficiency. \n\nA great project smoothly conducted by our teams and our local partners. Congratulations! 👏🏼",
        "likes": "116",
        "shares": "7",
        "time": {
          "raw": "3ay",
          "parsed": "05.12.2024",
          "isoString": "2024-12-05T10:27:15.013Z"
        },
        "mediaType": "image",
        "mediaContent": [
          "https://media.licdn.com/dms/image/v2/D4E22AQEVmW-GUIFbiw/feedshare-shrink_800/feedshare-shrink_800/0/1732648981503?e=1744243200&v=beta&t=c6RlBug0ZGrnbPoKj13rXhoa6DBiZNafIh5ToW3p2DU",
          "https://media.licdn.com/dms/image/v2/D4E22AQFblv3ksDJhyA/feedshare-shrink_800/feedshare-shrink_800/0/1732648981407?e=1744243200&v=beta&t=HsR12fij5xrLy1HmlIrwXWy2Nj61YlDEE6CVvG3bzl0",
          "https://media.licdn.com/dms/image/v2/D4E22AQGw59DsJ9w5RQ/feedshare-shrink_800/feedshare-shrink_800/0/1732648980498?e=1744243200&v=beta&t=Plg-gsQr-yRGjsVAjETgCDhIlaffYEO845yYH55qJ1o"
        ],
        "date": "2024-12-05T10:27:15.013Z"
      },
      {
        "captions": "The most advanced side compression shears on the market : The LEFORT® Lidex. \n\n✔️ Full automatic cycle\n✔️ From 1000 to 2000T of cutting force \n✔️ Control of operating parameters \n✔️ Increased productivity (up to 25%)\n✔️ Watch the video below… \n\nDownload the new brochure \n👉🏼 https://lnkd.in/eHQt3fBt",
        "likes": "96",
        "comments": "3",
        "shares": "16",
        "time": {
          "raw": "4ay",
          "parsed": "05.11.2024",
          "isoString": "2024-11-05T10:27:15.014Z"
        },
        "mediaType": "video",
        "mediaContent": {
          "src": [
            {
              "src": "https://dms.licdn.com/playlist/vid/v2/D4E05AQGob-nwfuipCg/mp4-640p-30fp-crf28/mp4-640p-30fp-crf28/0/1730380845120?e=1741777200&v=beta&t=CRFB4I7izCogZcZ4EcI650fz6Dy87Bl-Sa9LzD5nJVc",
              "type": "video/mp4",
              "data-bitrate": 708956
            },
            {
              "src": "https://dms.licdn.com/playlist/vid/v2/D4E05AQGob-nwfuipCg/mp4-720p-30fp-crf28/mp4-720p-30fp-crf28/0/1730380840500?e=1741777200&v=beta&t=b7Lq1r1v2u10FQzQKa06gwGe78b756JzG_KHOWwgOF0",
              "type": "video/mp4",
              "data-bitrate": 1013681
            }
          ],
          "posterUrl": "https://media.licdn.com/dms/image/v2/D4E05AQGob-nwfuipCg/videocover-low/videocover-low/0/1730380823350?e=1741777200&v=beta&t=W9tmVJvtgyiWBK3eHY4evNNtdCswcMASArXn8JhjU7g"
        },
        "date": "2024-11-05T10:27:15.014Z"
      },
      {
        "captions": "Depending on configuration and utilization , Lidex side compression shears can reach very high production levels, up to 115 t/h and productivity gains of 25%.\n \nTill now, the Lidex are the only scrap shears with side compression to offer a complete automatic cycle.\n \nThis unique function is made possible mainly by two major innovations :\n\n✔️innovative kinematics for the preload table which allows dumping of scrap metal directly into the pusher area, and thus reducing the number of movements\n \n✔️a high amplitude lid designed to exert exceptional compaction power and efficiency to reduce cycle times.\n\nRead more : https://lnkd.in/efX56KbM",
        "likes": "100",
        "shares": "15",
        "time": {
          "raw": "5ay",
          "parsed": "05.10.2024",
          "isoString": "2024-10-05T10:27:15.020Z"
        },
        "mediaType": "video",
        "mediaContent": {
          "src": [
            {
              "src": "https://dms.licdn.com/playlist/vid/v2/D4E05AQFq7NBUjdXP-w/mp4-640p-30fp-crf28/mp4-640p-30fp-crf28/0/1728057865565?e=1741777200&v=beta&t=pMUuWseWu34_UZn_SIkdlD5YtOw99otuejAP3N4iWLA",
              "type": "video/mp4",
              "data-bitrate": 665133
            },
            {
              "src": "https://dms.licdn.com/playlist/vid/v2/D4E05AQFq7NBUjdXP-w/mp4-720p-30fp-crf28/mp4-720p-30fp-crf28/0/1728057862727?e=1741777200&v=beta&t=vGxjUdUqOkCf2rH1VHsi8d_NJkwDutGipqbWnG952Ow",
              "type": "video/mp4",
              "data-bitrate": 947774
            }
          ],
          "posterUrl": "https://media.licdn.com/dms/image/v2/D4E05AQFq7NBUjdXP-w/videocover-low/videocover-low/0/1728057854551?e=1741777200&v=beta&t=zPLEUn9AaHZFAiD5dXaVfB43PlFUmxzW95UVR6IsF0g"
        },
        "date": "2024-10-05T10:27:15.020Z"
      },
      {
        "captions": "🎻 C’est une première, le groupe LEFORT® et l’Orchestre Français des Jeunes (OFJ) se rapprochent pour un partenariat peu courant dans l’industrie tout comme dans la musique classique. \n\nFawaz Ezzat, Group After Sales Director chez Lefort témoigne  : \n\n« Le lien ne semble a priori pas évident, mais les similitudes entre l’orchestre et l’industrie sont confondantes. J’ai eu la chance d’intégrer l’OFJ lors des sessions 2006, 2007 et 2008.\n\nAvec du recul, il est évident que l’orchestre m’a apporté énormément en termes de management et de conduite de projet. Être musicien d’orchestre, c’est savoir faire du lien entre les éléments, écouter, s’exprimer, apprendre à gérer son stress, anticiper une échéance, rebondir après un échec. Ces compétences qui deviennent naturelles dans le monde musical, sont également une nécessité dans le monde industriel. » \n\nDécouvrez-en plus sur cette annonce en cliquant le lien : https://lnkd.in/dKeTs_9W🎻 C’est une première, le groupe LEFORT® et l’Orchestre Français des Jeunes (OFJ) se rapprochent pour un partenariat peu courant dans l’industrie tout comme dans la musique classique. \n\nFawaz Ezzat, Group After Sales Director chez Lefort témoigne  : \n\n« Le lien ne semble a priori pas évident, mais les similitudes entre l’orchestre et l’industrie sont confondantes. J’ai eu la chance d’intégrer l’OFJ lors des sessions 2006, 2007 et 2008.\n\nAvec du recul, il est évident que l’orchestre m’a apporté énormément en termes de management et de conduite de projet. Être musicien d’orchestre, c’est savoir faire du lien entre les éléments, écouter, s’exprimer, apprendre à gérer son stress, anticiper une échéance, rebondir après un échec. Ces compétences qui deviennent naturelles dans le monde musical, sont également une nécessité dans le monde industriel. » \n\nDécouvrez-en plus sur cette annonce en cliquant le lien : https://lnkd.in/dKeTs_9W",
        "likes": "27",
        "shares": "5",
        "time": {
          "raw": "5ay",
          "parsed": "05.10.2024",
          "isoString": "2024-10-05T10:27:15.021Z"
        },
        "mediaType": "image",
        "mediaContent": [
          "https://media.licdn.com/dms/image/v2/D4D22AQEVD-vF-PMvBA/feedshare-shrink_800/feedshare-shrink_800/0/1727873573938?e=1744243200&v=beta&t=naWDMaGcsknwQSkC4ZonOagXilINg4i3PL2cJ11qrmM",
          "https://media.licdn.com/dms/image/v2/D4D22AQHa2YfPfbzkAg/feedshare-shrink_800/feedshare-shrink_800/0/1727873572783?e=1744243200&v=beta&t=hBiqfgakVsOw-rmyaZqngd-i-sEWES5x_z0aK2wsoMU",
          "https://media.licdn.com/dms/image/v2/D4D22AQEWKrykbSiiDA/feedshare-shrink_800/feedshare-shrink_800/0/1727873573806?e=1744243200&v=beta&t=2ij5gBmyBwBvJM0Ysg-oKa7mX-OTebZmKaCLrSwqjAs",
          "https://media.licdn.com/dms/image/v2/D4D22AQEMWIueHVEAdA/feedshare-shrink_800/feedshare-shrink_800/0/1727873573365?e=1744243200&v=beta&t=Iz-yjLx52QD0biG7RzHeeYw4Los72x7QmCzhCtQRn70"
        ],
        "date": "2024-10-05T10:27:15.021Z"
      },
      {
        "captions": "🇺🇸Scrap Expo 2024 is finally here ! \n\nCome join us and explore our exceptional range of shears & balers 💪🏽\n\n📍 Louisville, KY\n📆 September 17-18\n⭐️ Booth 421 \n\n#LefortAmerica \n\nJonathan Miller Michael Schultz George Maggiolo Trey Huntsinger Recycling Today🇺🇸Scrap Expo 2024 is finally here ! \n\nCome join us and explore our exceptional range of shears & balers 💪🏽\n\n📍 Louisville, KY\n📆 September 17-18\n⭐️ Booth 421 \n\n#LefortAmerica \n\nJonathan Miller Michael Schultz George Maggiolo Trey Huntsinger Recycling Today",
        "likes": "51",
        "comments": "1",
        "shares": "5",
        "time": {
          "raw": "5ay",
          "parsed": "05.10.2024",
          "isoString": "2024-10-05T10:27:15.023Z"
        },
        "mediaType": "image",
        "mediaContent": [
          "https://media.licdn.com/dms/image/v2/D4D22AQHqj6GhSyClsg/feedshare-shrink_800/feedshare-shrink_800/0/1726642962653?e=1744243200&v=beta&t=ljYI6lQ_Q5WOpfVHn7izmL7ftfg9mz5jWOM5FJvgJuM",
          "https://media.licdn.com/dms/image/v2/D4D22AQFao7eGBUb-nA/feedshare-shrink_800/feedshare-shrink_800/0/1726642962022?e=1744243200&v=beta&t=c3f9bKPeolTLxcNv7KtU7oQEBSzi8IeqESVAH9tEKeg",
          "https://media.licdn.com/dms/image/v2/D4D22AQGzXBDairj0kw/feedshare-shrink_2048_1536/feedshare-shrink_2048_1536/0/1726642962674?e=1744243200&v=beta&t=zW87Z4UL5rBB48XZyHrKHfyVufJvAOVr4c90B7P8E9E"
        ],
        "date": "2024-10-05T10:27:15.023Z"
      },
      {
        "captions": "LEFORT® Lidex 2000T en phase finale d'assemblage chez un acteur incontournable du recyclage !\n\n🫱🏼🫲🏻 Créée en 1983, l’entreprise familiale et indépendante GUYOT environnement collecte +400.000 tonnes de ferraille chaque année. Pour poursuivre son développement, elle a choisi une presse cisaille à compression latérale LIDEX, modèle intégré désormais à la gamme LEFORT.\n\n⚙️ Cette « belle bête » affiche une force de coupe gigantesque de 2000 tonnes, une grande largeur de coupe de 1500 mm, une caisse de 10 m x 2,60 m et une motorisation de 8 x 110 kW. \n\n📈 Avec cette machine hors-normes, l’entreprise pourra atteindre des capacités de production jusqu’à 110 tonnes/heure ! \n\n+ d'infos très prochainement...LEFORT® Lidex 2000T en phase finale d'assemblage chez un acteur incontournable du recyclage !\n\n🫱🏼🫲🏻 Créée en 1983, l’entreprise familiale et indépendante GUYOT environnement collecte +400.000 tonnes de ferraille chaque année. Pour poursuivre son développement, elle a choisi une presse cisaille à compression latérale LIDEX, modèle intégré désormais à la gamme LEFORT.\n\n⚙️ Cette « belle bête » affiche une force de coupe gigantesque de 2000 tonnes, une grande largeur de coupe de 1500 mm, une caisse de 10 m x 2,60 m et une motorisation de 8 x 110 kW. \n\n📈 Avec cette machine hors-normes, l’entreprise pourra atteindre des capacités de production jusqu’à 110 tonnes/heure ! \n\n+ d'infos très prochainement...",
        "likes": "303",
        "comments": "9",
        "shares": "17",
        "time": {
          "raw": "6ay",
          "parsed": "05.09.2024",
          "isoString": "2024-09-05T10:27:15.024Z"
        },
        "mediaType": "image",
        "mediaContent": [
          "https://media.licdn.com/dms/image/v2/D4E22AQF0viJ1PULigA/feedshare-shrink_800/feedshare-shrink_800/0/1723475504829?e=1744243200&v=beta&t=EbNMJjnu4OUp8QzjbPuiKwzVEYdUmTOIWYLJ_ve0SOU",
          "https://media.licdn.com/dms/image/v2/D4E22AQGf6Pv_ir1UKA/feedshare-shrink_800/feedshare-shrink_800/0/1723475502673?e=1744243200&v=beta&t=IuO2hgomjVaceq8tJEE3m5jb1CIQDPkM9qq3ky7BXho",
          "https://media.licdn.com/dms/image/v2/D4E22AQHXtYUEMNOg1Q/feedshare-shrink_800/feedshare-shrink_800/0/1723475501033?e=1744243200&v=beta&t=Qh0usI3Q80Y6G8hbxHfbkRQI9XMdbuvVCaCVk5S2crs"
        ],
        "date": "2024-09-05T10:27:15.024Z"
      },
      {
        "captions": "By introducing the Lidex range improved by bringing together \"the best of both Lefort/Copex worlds\", LEFORT® offers a unique and unrivaled range of side compression shears, combining + 150 years of experience …\n\nModern, fast, productive and robust, the Lidex is a real game changer !\n\n⬇️ New 2024 LIDEX Brochure ⬇️\nhttps://lnkd.in/eHQt3fBtBy introducing the Lidex range improved by bringing together \"the best of both Lefort/Copex worlds\", LEFORT® offers a unique and unrivaled range of side compression shears, combining + 150 years of experience …\n\nModern, fast, productive and robust, the Lidex is a real game changer !\n\n⬇️ New 2024 LIDEX Brochure ⬇️\nhttps://lnkd.in/eHQt3fBt",
        "likes": "90",
        "comments": "1",
        "shares": "9",
        "time": {
          "raw": "7ay",
          "parsed": "03.08.2024",
          "isoString": "2024-08-03T14:18:59.153Z"
        },
        "mediaType": "image",
        "mediaContent": [
          "https://media.licdn.com/dms/image/v2/D4E22AQFIOb7tUYiIsg/feedshare-shrink_800/feedshare-shrink_800/0/1720713066178?e=1743638400&v=beta&t=eHFGVyAWONGnJMezvXBmbDN2JYw455tdJa5b20-Xh2U",
          "https://media.licdn.com/dms/image/v2/D4E22AQGl_cu6ztb9Xw/feedshare-shrink_800/feedshare-shrink_800/0/1720713065873?e=1743638400&v=beta&t=jVUJ6h4QtIKym6ZCGHrVsQM4wWK5Fm1-dsDHue6PDCo",
          "https://media.licdn.com/dms/image/v2/D4E22AQGdz_ouaOHz0Q/feedshare-shrink_800/feedshare-shrink_800/0/1720713060502?e=1743638400&v=beta&t=v8iM_uGBQddERaYXtkjc0cpFzbqKedYpTYbF03jJwRw",
          "https://media.licdn.com/dms/image/v2/D4E22AQGiaaGieqY_Xw/feedshare-shrink_800/feedshare-shrink_800/0/1720713061176?e=1743638400&v=beta&t=UByGq_XLgoinM3VANzdvbZ-ph5IrdKb8IsLDz3sntmY",
          "https://media.licdn.com/dms/image/v2/D4E22AQHSncnL1C12Ow/feedshare-shrink_800/feedshare-shrink_800/0/1720713060322?e=1743638400&v=beta&t=MXG5I-hspQZFqGUO6RZA6HLtUeYWFt6cS8xaszYvJBY"
        ],
        "date": "2024-08-03T14:18:59.153Z"
      },
      {
        "captions": "🇬🇧 Jebb Metals have now put to work their new Koloss 1000 TS. This Lefort shear/baler is proving to be a real head turner as it sits proudly at the top of their yard. \n\n💥 Delivered to site in three main pieces the machine is assembled on a foundation frame and commissioned within two weeks. The machine is very productive on all grades of ferrous and non-ferrous metals, shearing with the 1000T window crosshead or baling with the 180T baling ram. \n\n💪🏽 The power, strength and speed of its cutting is giving very pleasing results for its new owners. This machine, fitted with the 600HP Scania diesel engine, operators control cabin and tunnel pusher ram is easily capable of 25-30 Tonnes per hour of production, depending upon material and cut length. \n\nWe wish Philip & Stephen all the best for the future with their new Lefort Koloss 1000 TS 🙌\n\n#LefortUk🇬🇧 Jebb Metals have now put to work their new Koloss 1000 TS. This Lefort shear/baler is proving to be a real head turner as it sits proudly at the top of their yard. \n\n💥 Delivered to site in three main pieces the machine is assembled on a foundation frame and commissioned within two weeks. The machine is very productive on all grades of ferrous and non-ferrous metals, shearing with the 1000T window crosshead or baling with the 180T baling ram. \n\n💪🏽 The power, strength and speed of its cutting is giving very pleasing results for its new owners. This machine, fitted with the 600HP Scania diesel engine, operators control cabin and tunnel pusher ram is easily capable of 25-30 Tonnes per hour of production, depending upon material and cut length. \n\nWe wish Philip & Stephen all the best for the future with their new Lefort Koloss 1000 TS 🙌\n\n#LefortUk",
        "likes": "72",
        "comments": "4",
        "shares": "7",
        "time": {
          "raw": "1h",
          "parsed": "05.03.2025",
          "isoString": "2025-03-05T05:03:56.058Z"
        },
        "mediaType": "image",
        "mediaContent": [
          "https://media.licdn.com/dms/image/v2/D4E22AQGlu4rUV34Lxg/feedshare-shrink_800/B4EZVcNW7KGYAk-/0/1741008763842?e=1744848000&v=beta&t=QfVnCPdDGqnb_n-moawhJ1kHYJAPH4NdUVeNGYbGzyE"
        ],
        "date": "2025-03-05T05:03:56.058Z"
      }
    ]
  },
  {
    "name": "ATMRecyclingsystems",
    "followerData": [
      [
        20250225,
        658
      ],
      [
        20250225,
        657
      ],
      [
        20250225,
        657
      ],
      [
        20250228,
        662
      ],
      [
        20250228,
        662
      ],
      [
        20250228,
        662
      ],
      [
        20250228,
        662
      ],
      [
        20250303,
        662
      ],
      [
        1741011558953,
        "662"
      ],
      [
        1741076555584,
        "663"
      ],
      [
        1741077696907,
        "663"
      ],
      [
        1741083672825,
        "664"
      ],
      [
        1741084683894,
        "664"
      ],
      [
        1741170453038,
        664
      ],
      [
        1741755848763,
        666
      ]
    ],
    "data": [
      {
        "captions": "🚀 A Bird’s Eye View of Power and Precision! 🔩🔨\n\nGet a glimpse from above! Our state-of-the-art Scrap Shear 𝘼𝙧𝙣𝙤®𝘾𝙪𝙩 in action – turning mountains of metal into valuable resources. \n\nFrom massive steel beams to tangled scrap, our shear handles it all with unmatched force and precision. Even before its first cut, it’s clear that another customer trusts in our cutting-edge technology 🤝\n\nWhat makes our scrap shears stand out?\n🔹 Stability & Robustness – Engineered for maximum durability and reliability.\n🔹 Heavyweight Performance – Built to handle the toughest materials with ease.\n🔹 Longevity – Designed for years of high-performance operation.\n\nWith state-of-the-art shearing technology, we’re setting new standards in efficiency and sustainability. Watch the video to get a glimpse of recycling from a whole new angle – even before the machine gets to work! 🎥👇\n\n#CircularEconomy #ScrapShear #CustomerTrust #MetalRecycling",
        "likes": "5",
        "comments": "2",
        "shares": "2",
        "time": {
          "raw": "3h",
          "parsed": "19.02.2025",
          "isoString": "2025-02-19T05:04:08.504Z"
        },
        "mediaType": "video",
        "mediaContent": {
          "src": [
            {
              "src": "https://dms.licdn.com/playlist/vid/v2/D4E05AQHB5Cpkh-dj8Q/mp4-720p-30fp-crf28/B4EZUVuEs0HUBk-/0/1739826599635?e=1742364000&v=beta&t=m4lLjbUE4ZANkZMPp0PD2mcq9aA6MDlEukBeqWYqN5M",
              "type": "video/mp4",
              "data-bitrate": 1206997
            },
            {
              "src": "https://dms.licdn.com/playlist/vid/v2/D4E05AQHB5Cpkh-dj8Q/mp4-640p-30fp-crf28/B4EZUVuEs0HUBg-/0/1739826600862?e=1742364000&v=beta&t=yI7NAwWge722xYORjbzaLahxWmN74wpjfpOb1V2I-pw",
              "type": "video/mp4",
              "data-bitrate": 861419
            }
          ],
          "posterUrl": "https://media.licdn.com/dms/image/v2/D4E05AQHB5Cpkh-dj8Q/videocover-low/B4EZUVuEs0HUCQ-/0/1739826596056?e=1742364000&v=beta&t=AXMmJaZdTcqdLwxlbAXzi31MWsoR09bdUGgjrxRVu14"
        },
        "date": "2025-02-19T05:04:08.504Z"
      },
      {
        "captions": "🔩  𝗔𝗿𝗻𝗼®𝗕𝗿𝗶𝗸 𝟮𝟮  – The World’s Largest Briquetting Press! 🌍♻️\n\nSize matters – especially when it comes to efficiency and sustainability in metal recycling! With the 𝗔𝗿𝗻𝗼®𝗕𝗿𝗶𝗸 𝟮𝟮, we are setting standards in briquetting technology. This powerhouse is the largest briquetting press in the world, designed for maximum performance in recycling and metal processing industries.\n\nWhy choose the 𝗔𝗿𝗻𝗼®𝗕𝗿𝗶𝗸 𝟮𝟮?\n✅ Unmatched size & capacity – Handles extreme volumes with ease.\n✅ Up to 90% volume reduction – Optimized for transport and storage.\n✅ Clean & efficient – Recovers valuable coolants and cutting fluids.\n✅ Heavy-duty engineering – Built to last, designed for demanding environments.\n\nFrom metal chips to high-density briquettes this solution delivers efficiency, sustainability, and cost savings like no other.\n\n🚀 Want to see the 𝗔𝗿𝗻𝗼®𝗕𝗿𝗶𝗸 𝟮𝟮 in action? Let’s talk!\n\n#ArnoBrik22 #BriquettingPress #MetalRecycling #HeavyDutyEngineering",
        "likes": "26",
        "shares": "4",
        "time": {
          "raw": "4h",
          "parsed": "12.02.2025",
          "isoString": "2025-02-12T05:04:08.507Z"
        },
        "mediaType": "video",
        "mediaContent": {
          "src": [
            {
              "src": "https://dms.licdn.com/playlist/vid/v2/D5605AQHB7zI37W7gnw/mp4-640p-30fp-crf28/B56ZTxhYeoHQBg-/0/1739219181040?e=1742364000&v=beta&t=OUCL8k0ep7vGcfc-nwZ54GNb7KaKOtXMbeyaOdS4vIs",
              "type": "video/mp4",
              "data-bitrate": 1006269
            },
            {
              "src": "https://dms.licdn.com/playlist/vid/v2/D5605AQHB7zI37W7gnw/mp4-720p-30fp-crf28/B56ZTxhYeoHQBk-/0/1739219181480?e=1742364000&v=beta&t=Wgb7zh1XfqqytcinVRb9LNrINy9S6p5VvgcTU0HyPbE",
              "type": "video/mp4",
              "data-bitrate": 1332482
            }
          ],
          "posterUrl": "https://media.licdn.com/dms/image/v2/D5605AQHB7zI37W7gnw/videocover-low/B56ZTxhYeoHQCM-/0/1739219177862?e=1742364000&v=beta&t=YQa4xZbGFdi-2lgGXSPBDWQkLZlPe_mf9kfIQ9TW7as"
        },
        "date": "2025-02-12T05:04:08.507Z"
      },
      {
        "captions": "🔶 Kupferrecycling: Effizient, nachhaltig, unverzichtbar! ♻️\n\nKupfer ist einer der wertvollsten Rohstoffe in der Metallindustrie – aber wussten Sie, dass recyceltes Kupfer die gleiche Qualität wie Primärkupfer besitzt? Durch effizientes Recycling sparen wir nicht nur Ressourcen, sondern auch bis zu 85 % der Energie, die für die Neugewinnung benötigt wird.\n\n🚀 Unsere Paketierpressen stehen für Nachhaltigkeit!\nUm Kupferschrott optimal für die Weiterverarbeitung vorzubereiten, ist eine homogene, kompakte Ballenform entscheidend. Unsere Paketierpressen sorgen für:\n✅ Hohe Verdichtung – weniger Volumen, geringere Transport- und Lagerkosten\n✅ Optimale Schmelzbarkeit – perfekte Vorbereitung für Hütten und Gießereien\n✅ Maximale Effizienz – robust, zuverlässig und für anspruchsvolle Recyclingprozesse ausgelegt\n\nOb für Kabelschrott, Bleche oder Kupferspäne – unsere Paketierpressen sorgen dafür, dass hochwertiges Kupfer bestmöglich wiederverwertet wird.\n\n📌 Sie wollen Ihr Kupferrecycling optimieren? Kontaktieren Sie uns!\n\n#Kupferrecycling #Metallrecycling #Paketierpressen #Nachhaltigkeit #Ressourcenschonung🔶 Kupferrecycling: Effizient, nachhaltig, unverzichtbar! ♻️\n\nKupfer ist einer der wertvollsten Rohstoffe in der Metallindustrie – aber wussten Sie, dass recyceltes Kupfer die gleiche Qualität wie Primärkupfer besitzt? Durch effizientes Recycling sparen wir nicht nur Ressourcen, sondern auch bis zu 85 % der Energie, die für die Neugewinnung benötigt wird.\n\n🚀 Unsere Paketierpressen stehen für Nachhaltigkeit!\nUm Kupferschrott optimal für die Weiterverarbeitung vorzubereiten, ist eine homogene, kompakte Ballenform entscheidend. Unsere Paketierpressen sorgen für:\n✅ Hohe Verdichtung – weniger Volumen, geringere Transport- und Lagerkosten\n✅ Optimale Schmelzbarkeit – perfekte Vorbereitung für Hütten und Gießereien\n✅ Maximale Effizienz – robust, zuverlässig und für anspruchsvolle Recyclingprozesse ausgelegt\n\nOb für Kabelschrott, Bleche oder Kupferspäne – unsere Paketierpressen sorgen dafür, dass hochwertiges Kupfer bestmöglich wiederverwertet wird.\n\n📌 Sie wollen Ihr Kupferrecycling optimieren? Kontaktieren Sie uns!\n\n#Kupferrecycling #Metallrecycling #Paketierpressen #Nachhaltigkeit #Ressourcenschonung",
        "likes": "18",
        "comments": "2",
        "shares": "4",
        "time": {
          "raw": "1ay",
          "parsed": "12.02.2025",
          "isoString": "2025-02-12T05:04:08.508Z"
        },
        "mediaType": "image",
        "mediaContent": [
          "https://media.licdn.com/dms/image/v2/D4E22AQEJOHA8F5BUqQ/feedshare-shrink_1280/B4EZTNui41GwAk-/0/1738618320651?e=1744848000&v=beta&t=098Q4VeBlJt6UOHyEtSfRW6d7h3uvpPyVXGdp7KX33s",
          "https://media.licdn.com/dms/image/v2/D4E22AQGxEhgFDp9dkg/feedshare-shrink_1280/B4EZTNui5CHUAo-/0/1738618320625?e=1744848000&v=beta&t=QQeFsMcXEi0pL33paIZYOcvFnQf-_6Xv1YItvPMZ3L8",
          "https://media.licdn.com/dms/image/v2/D4E22AQGgUsGXKEhVIw/feedshare-shrink_480/B4EZTNui48G0AY-/0/1738618320629?e=1744848000&v=beta&t=OBaDUKUQDh3mjY6cShVWO20osOUnNPEeLTOOFQuRzUA",
          "https://media.licdn.com/dms/image/v2/D4E22AQGsCKGoaqN-vg/feedshare-shrink_1280/B4EZTNui4RGwAk-/0/1738618320572?e=1744848000&v=beta&t=KLm5o-ZRjrUvkqcuyqj01UjPKq-OUPo2M5APBShdczM"
        ],
        "date": "2025-02-12T05:04:08.508Z"
      },
      {
        "captions": "🎄✨ Season’s Greetings from ATM Recyclingsystems! ✨🎄\n\nAs we say goodbye to 2024, we want to express our heartfelt gratitude to our customers, partners, and team for an outstanding year. Your trust and collaboration inspire us to push boundaries and deliver excellence every day.\n\n🌟 Wishing you and your loved ones a joyous holiday season filled with happiness, peace, and success.\n\nMay 2025 bring new opportunities, innovation, and shared achievements for us all!\n\nThank you for being part of our journey – we look forward to reaching even greater milestones together in the coming year!\n\n🎁 Happy Holidays and a Happy New Year! 🎆\n\n#SeasonsGreetings #HappyHolidays #NewYear2025 #ThankYou #Partnership",
        "likes": "11",
        "comments": "1",
        "shares": "2",
        "time": {
          "raw": "2ay",
          "parsed": "12.01.2025",
          "isoString": "2025-01-12T05:04:08.509Z"
        },
        "mediaType": "video",
        "mediaContent": {
          "src": [
            {
              "src": "https://dms.licdn.com/playlist/vid/v2/D4E05AQGbU_KTb4h6Fg/mp4-640p-30fp-crf28/B4EZPbmZTkHkBg-/0/1734556447506?e=1742364000&v=beta&t=67OupyBLgBBHxxW-eRlBu3cm2Y_w4PttDq6sJkainJk",
              "type": "video/mp4",
              "data-bitrate": 882550
            },
            {
              "src": "https://dms.licdn.com/playlist/vid/v2/D4E05AQGbU_KTb4h6Fg/mp4-720p-30fp-crf28/B4EZPbmZTkHkBk-/0/1734556447448?e=1742364000&v=beta&t=Vs7xA6CHAw8Wqm_RmDHIAPtBKZr9nzxSYEZtTHBATF0",
              "type": "video/mp4",
              "data-bitrate": 1124943
            }
          ],
          "posterUrl": "https://media.licdn.com/dms/image/v2/D4E05AQGbU_KTb4h6Fg/videocover-low/B4EZPbmZTkHkCU-/0/1734556444106?e=1742364000&v=beta&t=CCgY-Loal2yFaJXlGA1KaW_qDIt0Oo15Yst-nyzSwBA"
        },
        "date": "2025-01-12T05:04:08.509Z"
      },
      {
        "captions": "Heading to the USA: Our Arno®Brik 22! 🚛✨\n\nWe’re thrilled to announce the completion of our Arno®Brik 22 – a true powerhouse in the world of briquetting presses! This exceptional machine is now on its way to a valued customer in the USA. 🌍\n\nWhat makes the Arno®Brik 22 so special?\n\n👉 Unmatched size and capacity: We’re the only manufacturer offering a briquetting press of this scale.\n👉 Efficiency meets sustainability: Perfectly designed to compress metal chips into compact, transport-friendly briquettes while recovering valuable coolant.\n👉 Custom-built for maximum performance – tailored to the specific needs of the recycling and manufacturing industry.\n\nFrom design to production, every step was handled with precision and care. Now, it’s time for the Arno®Brik 22 to make an impact overseas!\n\n📸 Check out the pictures of this impressive machine ready for shipment.\n\nInterested in a tailored solution for your recycling needs? Contact us to learn more!\n\n#ArnoBrik22 #BriquettingPress #MetalRecycling #EngineeringExcellence #SustainabilityHeading to the USA: Our Arno®Brik 22! 🚛✨\n\nWe’re thrilled to announce the completion of our Arno®Brik 22 – a true powerhouse in the world of briquetting presses! This exceptional machine is now on its way to a valued customer in the USA. 🌍\n\nWhat makes the Arno®Brik 22 so special?\n\n👉 Unmatched size and capacity: We’re the only manufacturer offering a briquetting press of this scale.\n👉 Efficiency meets sustainability: Perfectly designed to compress metal chips into compact, transport-friendly briquettes while recovering valuable coolant.\n👉 Custom-built for maximum performance – tailored to the specific needs of the recycling and manufacturing industry.\n\nFrom design to production, every step was handled with precision and care. Now, it’s time for the Arno®Brik 22 to make an impact overseas!\n\n📸 Check out the pictures of this impressive machine ready for shipment.\n\nInterested in a tailored solution for your recycling needs? Contact us to learn more!\n\n#ArnoBrik22 #BriquettingPress #MetalRecycling #EngineeringExcellence #Sustainability",
        "likes": "28",
        "comments": "2",
        "shares": "4",
        "time": {
          "raw": "2ay",
          "parsed": "12.01.2025",
          "isoString": "2025-01-12T05:04:08.510Z"
        },
        "mediaType": "image",
        "mediaContent": [
          "https://media.licdn.com/dms/image/v2/D4E22AQGVYFRPoJBUsg/feedshare-shrink_800/B4EZPQduEsHAAk-/0/1734369310397?e=1744848000&v=beta&t=Ab0e8BV-U6ZH4L2GvVhCkNxsYKaJnXpFroMLA-MqKnI",
          "https://media.licdn.com/dms/image/v2/D4E22AQEFd7Low0j-sg/feedshare-shrink_800/B4EZPQduF7HAAg-/0/1734369314448?e=1744848000&v=beta&t=LmvltDBGsujRP_V4Bwskt4r8N0PWm9YOxGFzRZ239jI",
          "https://media.licdn.com/dms/image/v2/D4E22AQHmaijq5bVKFw/feedshare-shrink_800/B4EZPQduE6HwAo-/0/1734369314442?e=1744848000&v=beta&t=0DLXOuu8XHtK3rJdItcXdIJG1q-d3Jmr03Df6smFUPI"
        ],
        "date": "2025-01-12T05:04:08.510Z"
      },
      {
        "captions": "♻️ Recycling von Metallspänen – Nachhaltigkeit beginnt in der Produktion!\n\nWussten Sie, dass Metallspäne – oft ein Nebenprodukt in der Fertigung – wertvolle Rohstoffe enthalten? Durch effiziente Prozesse können sie nicht nur wiederverwertet, sondern auch zu einem wichtigen Beitrag für die Kreislaufwirtschaft gemacht werden. 🌍🔩\n\nWie funktioniert der Recyclingprozess?\n1️⃣ Spänebrechen: Sperrige, lange Späne werden mit unserem Spänebrecher zerkleinert, sodass sie einfacher zu handhaben sind. Dies reduziert das Volumen und verhindert Probleme wie Verstopfungen in der Weiterverarbeitung.\n2️⃣ Brikettierung: Die gebrochenen Späne werden in unseren Brikettierpressen verdichtet.\n✅ Das Volumen wird um bis zu 90 % reduziert.\n✅ Kühl- und Schmiermittel werden sauber zurückgewonnen.\n✅ Es entstehen kompakte, hochwertige Briketts, die sich ideal recyceln lassen.\n\nWarum ist das wichtig?\n🌱 Ressourcenschonung: Weniger Abfall, mehr Wiederverwertung.\n⚙️ Effizienz: Gebrochene Späne und Briketts sind leichter zu transportieren und zu schmelzen.\n💡 Nachhaltige Produktion: Unternehmen sparen Kosten und tragen aktiv zur Kreislaufwirtschaft bei.\n\nVom ersten Schritt des Spänebrechens bis zum fertigen Brikett – unsere Lösungen helfen, Produktionsabfälle in wertvolle Rohstoffe zu verwandeln.\n\n📌 Erfahren Sie mehr über unsere Technologie und wie sie Ihre Prozesse nachhaltiger gestalten kann. Kontaktieren Sie uns!\n\n#Spänebrechen #Metallrecycling #Brikettierung #Ressourcenschonung #Kreislaufwirtschaft",
        "likes": "8",
        "comments": "3",
        "time": {
          "raw": "3ay",
          "parsed": "12.12.2024",
          "isoString": "2024-12-12T05:04:08.512Z"
        },
        "mediaType": "video",
        "mediaContent": {
          "src": [
            {
              "src": "https://dms.licdn.com/playlist/vid/v2/D4E05AQFMwRLRRGnhPQ/mp4-640p-30fp-crf28/mp4-640p-30fp-crf28/0/1733750200235?e=1742364000&v=beta&t=xVIXApnN4YJt3f5AcmkJMt-mj2_HuCEKHDABEAuRZMI",
              "type": "video/mp4",
              "data-bitrate": 739590
            },
            {
              "src": "https://dms.licdn.com/playlist/vid/v2/D4E05AQFMwRLRRGnhPQ/mp4-720p-30fp-crf28/mp4-720p-30fp-crf28/0/1733750200219?e=1742364000&v=beta&t=Oc78jzZCoUjXD4Rfkw2M-nqf6rI4hxw-d7GS1TQxqrI",
              "type": "video/mp4",
              "data-bitrate": 936983
            }
          ],
          "posterUrl": "https://media.licdn.com/dms/image/v2/D4E05AQFMwRLRRGnhPQ/videocover-low/videocover-low/0/1733750196697?e=1742364000&v=beta&t=wDd4F9x1nISBHgoRYDq_foV8MuC2gkkZqPVKZ6SGPgo"
        },
        "date": "2024-12-12T05:04:08.512Z"
      },
      {
        "captions": "🚆 Robust, Reliable, Efficient – Our Rail Breaker! 💪🚄\n\nRecycling rails is no easy task – but the Arno®Break R gets the job done! With incredible power, it quickly and precisely breaks down rails, sleepers, and other bulky metal pieces. The result? Perfectly prepared material for further processing. 🛤️⚙️\n\nWhy choose the Arno®Break R?\n✅ Extremely robust design for the toughest challenges\n✅ High throughput to process large volumes efficiently\n✅ Low energy consumption with maximum performance\n\nWho benefits?\n👉 Recycling companies handling bulky materials\n👉 Steel mills and scrap yards looking for precision and efficiency\n👉 Anyone who demands uncompromising performance in metal recycling\n\n📌 Curious about the Arno®Break R? Let’s explore how it can optimize your recycling operations – contact us today! 👉https://lnkd.in/e7WcupEw\n\n#RailBreaker #MetalRecycling #ScrapProcessing #RecyclingTechnology",
        "likes": "11",
        "comments": "2",
        "shares": "1",
        "time": {
          "raw": "3ay",
          "parsed": "12.12.2024",
          "isoString": "2024-12-12T05:04:08.513Z"
        },
        "mediaType": "video",
        "mediaContent": {
          "src": [
            {
              "src": "https://dms.licdn.com/playlist/vid/v2/D4E05AQFOfGOuqh865g/mp4-640p-30fp-crf28/mp4-640p-30fp-crf28/0/1733159889115?e=1742364000&v=beta&t=bsFK_gvcMGFkc3CRthKyExtzDY5uui9akcQxU-uxioM",
              "type": "video/mp4",
              "data-bitrate": 534084
            },
            {
              "src": "https://dms.licdn.com/playlist/vid/v2/D4E05AQFOfGOuqh865g/mp4-720p-30fp-crf28/mp4-720p-30fp-crf28/0/1733159889972?e=1742364000&v=beta&t=xybnCqlocmPOvaYWEqGj8N2_POSI91AxzkVtZ4u_3nc",
              "type": "video/mp4",
              "data-bitrate": 711998
            }
          ],
          "posterUrl": "https://media.licdn.com/dms/image/v2/D4E05AQFOfGOuqh865g/videocover-low/videocover-low/0/1733159884409?e=1742364000&v=beta&t=fwyxhHA0SVkdCXhqXMlWdH_KgumodymuGQlw7j0iOw4"
        },
        "date": "2024-12-12T05:04:08.513Z"
      },
      {
        "captions": "🎥 ATM stellt sich vor – Innovation trifft Erfahrung! 🎥\n\nWer sind wir?\n\n🔧 Produktion, Engineering, Vertrieb – alles aus einer Hand\n\n🌍 Mehr als 80 Jahre Erfahrung und über 1300 Maschinen weltweit im Einsatz\n\n🏆 Teil der ASCO Gruppe und Innovationsführer in der Recyclingindustrie\n\nUnser Motto: \"Der Abschluss eines Projekts ist der Start einer langfristigen Zusammenarbeit\"\n\nUnser Ziel: Gemeinsam mit unseren Kunden nachhaltige Lösungen für die Metallverarbeitung schaffen.\n\n🔧 Von der ersten Idee bis zur Inbetriebnahme Ihrer Maschine – wir begleiten Sie auf jedem Schritt. \n\n👉 Jetzt ansehen und einen Eindruck von unserer Expertise gewinnen!\n\n#ATM #Metallverarbeitung #Recyclingtechnologie #Innovation",
        "likes": "46",
        "shares": "4",
        "time": {
          "raw": "3ay",
          "parsed": "12.12.2024",
          "isoString": "2024-12-12T05:04:08.513Z"
        },
        "mediaType": "video",
        "mediaContent": {
          "src": [
            {
              "src": "https://dms.licdn.com/playlist/vid/v2/D4E05AQE1cbDpQifaWg/mp4-640p-30fp-crf28/mp4-640p-30fp-crf28/0/1732377369731?e=1742364000&v=beta&t=bNaAV0k88qx_m-smVIroB8AI3O8siasq2YK4ZXsDDKM",
              "type": "video/mp4",
              "data-bitrate": 601235
            },
            {
              "src": "https://dms.licdn.com/playlist/vid/v2/D4E05AQE1cbDpQifaWg/mp4-720p-30fp-crf28/mp4-720p-30fp-crf28/0/1732377370020?e=1742364000&v=beta&t=Nr3x0uICKmarMTXkqTWgvADPFoARMiviqLOdWo6aDMg",
              "type": "video/mp4",
              "data-bitrate": 798160
            }
          ],
          "posterUrl": "https://media.licdn.com/dms/image/v2/D4E05AQE1cbDpQifaWg/videocover-low/videocover-low/0/1732377359816?e=1742364000&v=beta&t=_Je0nsyI3QjNru0GItrQCAXbymO7uUp75e0RhUh5pfw"
        },
        "date": "2024-12-12T05:04:08.513Z"
      },
      {
        "captions": "Rückblick auf die Recy & DepoTech 2024\n\nLetzte Woche hatte ATM Recyclingsystems das Vergnügen, an der Recy & DepoTech 2024 teilzunehmen – einem der wichtigsten Treffpunkte für Recycling- und Ressourcenmanagement. 🌍♻️\n\nBesonders beeindruckt hat uns der Beitrag \"Towards closed material cycles in lithium-ion batteries and PV systems: a sustainable resource approach\" von Eva Gerold. Diese spannenden Ansätze zur Schließung von Materialkreisläufen sind ein zentraler Baustein für die nachhaltige Zukunft, an der wir gemeinsam arbeiten.\n\nWir sind stolz auf unsere langjährige Forschungszusammenarbeit mit der Montanuniversität Leoben, Lehrstuhl für Abfallverwertungstechnik und Abfallwirtschaft, die uns ermöglicht, innovative Technologien zu entwickeln und gemeinsam die Herausforderungen der Kreislaufwirtschaft zu meistern.\n\n👉 Ein großes Dankeschön an alle Vortragenden und Teilnehmenden für die inspirierenden Gespräche und neuen Impulse!\n\n#Kreislaufwirtschaft #RecyDepoTech2024 #MontanuniversitätLeoben #BatteryRecycling Rückblick auf die Recy & DepoTech 2024\n\nLetzte Woche hatte ATM Recyclingsystems das Vergnügen, an der Recy & DepoTech 2024 teilzunehmen – einem der wichtigsten Treffpunkte für Recycling- und Ressourcenmanagement. 🌍♻️\n\nBesonders beeindruckt hat uns der Beitrag \"Towards closed material cycles in lithium-ion batteries and PV systems: a sustainable resource approach\" von Eva Gerold. Diese spannenden Ansätze zur Schließung von Materialkreisläufen sind ein zentraler Baustein für die nachhaltige Zukunft, an der wir gemeinsam arbeiten.\n\nWir sind stolz auf unsere langjährige Forschungszusammenarbeit mit der Montanuniversität Leoben, Lehrstuhl für Abfallverwertungstechnik und Abfallwirtschaft, die uns ermöglicht, innovative Technologien zu entwickeln und gemeinsam die Herausforderungen der Kreislaufwirtschaft zu meistern.\n\n👉 Ein großes Dankeschön an alle Vortragenden und Teilnehmenden für die inspirierenden Gespräche und neuen Impulse!\n\n#Kreislaufwirtschaft #RecyDepoTech2024 #MontanuniversitätLeoben #BatteryRecycling",
        "likes": "28",
        "comments": "2",
        "shares": "2",
        "time": {
          "raw": "3ay",
          "parsed": "12.12.2024",
          "isoString": "2024-12-12T05:04:08.515Z"
        },
        "mediaType": "image",
        "mediaContent": [
          "https://media.licdn.com/dms/image/v2/D4E22AQH2-8ABtODI1w/feedshare-shrink_800/feedshare-shrink_800/0/1732124210162?e=1744848000&v=beta&t=vt1ujGSdhKYHR7BC8JJlzXapQhPPaFmlAfbCld7YqgM",
          "https://media.licdn.com/dms/image/v2/D4E22AQHBdmdNiiuH2Q/feedshare-shrink_800/feedshare-shrink_800/0/1732124210108?e=1744848000&v=beta&t=45QlGOPaDQ7Zy5NaC5Gr1qIam-K2-siLUko9dpStyg8"
        ],
        "date": "2024-12-12T05:04:08.515Z"
      },
      {
        "captions": "✂️ Präzision und Power – Schrottscheren für die Metallverarbeitung! ✂️\n\nUnsere Schrottscheren sind echte Kraftpakete: Sie zerkleinern Metallreste effizient und bringen sie in die optimale Form für Recyclingprozesse und Schmelzanlagen. Ob Stahlträger, Rohre oder Mischschrott – mit unserer Technologie wird Schrottverarbeitung einfacher und wirtschaftlicher. 💪\n\nWarum unsere Schrottscheren?\n✔️ Hohe Schneidkraft: Selbst härteste Materialien sind kein Problem\n✔️ Effiziente Verarbeitung: Optimale Größe für Lagerung und Transport\n✔️ Robuste Bauweise: Zuverlässigkeit auch unter härtesten Bedingungen\n\nMit unseren Schrottscheren sorgen wir für Effizienz und Nachhaltigkeit in der Schrottwirtschaft – ein unverzichtbares Tool für moderne Metallrecycler. 🌍\n\n👉 Erfahren Sie mehr über unsere ARNO®CUT Schrottscheren:  https://lnkd.in/e7jijgU8\n\n#Schrottscheren #Metallverarbeitung #Recycling #Schrottplatz",
        "likes": "11",
        "comments": "1",
        "shares": "2",
        "time": {
          "raw": "3ay",
          "parsed": "05.12.2024",
          "isoString": "2024-12-05T10:27:32.678Z"
        },
        "mediaType": "video",
        "mediaContent": {
          "src": [
            {
              "src": "https://dms.licdn.com/playlist/vid/v2/D4E05AQHxRa-RtSGc5Q/mp4-640p-30fp-crf28/mp4-640p-30fp-crf28/0/1731836816182?e=1741777200&v=beta&t=NL4ytWlpTHTLj9VRSwD0XqQQEIuxLFNQQ8fvrPN7Ol8",
              "type": "video/mp4",
              "data-bitrate": 180845
            },
            {
              "src": "https://dms.licdn.com/playlist/vid/v2/D4E05AQHxRa-RtSGc5Q/mp4-720p-30fp-crf28/mp4-720p-30fp-crf28/0/1731836814243?e=1741777200&v=beta&t=6mMbDOp3bmSBK0Osq8eldQ2H7Bg9peR6VDn8owkb62s",
              "type": "video/mp4",
              "data-bitrate": 248828
            }
          ],
          "posterUrl": "https://media.licdn.com/dms/image/v2/D4E05AQHxRa-RtSGc5Q/videocover-low/videocover-low/0/1731836807034?e=1741777200&v=beta&t=Un8LiSx_qjHMnsHIx-KaDQxIfAwRvQY8nLlcK-h4Kac"
        },
        "date": "2024-12-05T10:27:32.678Z"
      },
      {
        "captions": "📦 Paketieren mit Mehrwert – Effizienz für die Schrottwirtschaft! 📦\n\nUnsere Paketierpressen verwandeln lose Metallschrotte in kompakte, handliche Pakete – ideal für Recyclingbetriebe und Stahlwerke, die Schrott effizient lagern und transportieren wollen. 📦\n\nWas macht unsere Paketiertechnik besonders?\n\nDank hohem Pressdruck und stabiler Bauweise entstehen feste, platzsparende Pakete, die perfekt für den Weitertransport oder die Schmelze vorbereitet sind. So sparen unsere Kunden nicht nur Platz, sondern auch Zeit und Kosten!\n\nPerfekt geeignet für:\n👉 Recyclingunternehmen, die ihre Lagerung optimieren möchten\n👉 Stahlwerke und Gießereien für sauberen, geordneten Schrotteinsatz\n👉 Alle, die in Logistik und Lagerung von Metallschrott Effizienz suchen\n\n📌 Neugierig auf unsere Technologie? Vereinbaren Sie jetzt einen Termin mit uns und erfahren Sie mehr über die Vorteile unserer Paketierpressen! 📌\n\n#Paketierung #Recycling #Schrottwirtschaft #Effizienz #Schrottplatz",
        "likes": "41",
        "comments": "3",
        "shares": "5",
        "time": {
          "raw": "3ay",
          "parsed": "05.12.2024",
          "isoString": "2024-12-05T10:27:32.680Z"
        },
        "mediaType": "video",
        "mediaContent": {
          "src": [
            {
              "src": "https://dms.licdn.com/playlist/vid/v2/D4E05AQEM6NgAkP77yg/mp4-640p-30fp-crf28/mp4-640p-30fp-crf28/0/1731445195700?e=1741777200&v=beta&t=AYmaeuxk-lR94Ev2qetEyj7B3y-YF23nZE-T4PgUDCA",
              "type": "video/mp4",
              "data-bitrate": 706686
            },
            {
              "src": "https://dms.licdn.com/playlist/vid/v2/D4E05AQEM6NgAkP77yg/mp4-720p-30fp-crf28/mp4-720p-30fp-crf28/0/1731445195897?e=1741777200&v=beta&t=lqHEPjLLrfM8uYld6qBblGk2dzQD2-sSZ_6u0VHVU9Y",
              "type": "video/mp4",
              "data-bitrate": 999884
            }
          ],
          "posterUrl": "https://media.licdn.com/dms/image/v2/D4E05AQEM6NgAkP77yg/videocover-low/videocover-low/0/1731445175638?e=1741777200&v=beta&t=EBDM0M4IzhugkzLIlI-M9MEI1aGPvFce3kntJNWA20A"
        },
        "date": "2024-12-05T10:27:32.680Z"
      },
      {
        "captions": "🌍 Effizientes Recycling beginnt bei der Brikettierung 🌍\n\nUnsere Brikettierpressen sind wahre Effizienz-Booster für Recycler, Stahlwerke und Gießereien. Doch wie genau funktioniert die Brikettierung?\n\n💥 Funktionsweise: Die Maschine presst Metallspäne unter hohem Druck zu kompakten Briketts zusammen. So wird das Volumen drastisch reduziert und eine saubere, hochwertige Form geschaffen, die einfach weiterverarbeitet werden kann.\n\n🔍 Vorteile für unsere Kunden:\n\n🔹 Kompakte Briketts: Bis zu 90 % Volumenreduktion sorgt für optimierte Lagerung und Transporteinsparungen.\n🔹 Wertvolle Rohstoffrückgewinnung: Durch die Verdichtung wird das Abtropfen von Restölen minimiert – das steigert die Qualität und den Wert des Materials.\n🔹 Nachhaltigkeit und Effizienz: Mit weniger Lagerplatz und Transportkosten leisten unsere Pressen einen aktiven Beitrag zu einem umweltfreundlicheren Recyclingprozess.\n\n👉 Mehr erfahren: https://lnkd.in/egNBmVnQ\n\n#Brikettierung #RecyclingTechnologie #Metallrecycling #Nachhaltigkeit #Maschinenbau #Technologie\n🌍 Effizientes Recycling beginnt bei der Brikettierung 🌍\n\nUnsere Brikettierpressen sind wahre Effizienz-Booster für Recycler, Stahlwerke und Gießereien. Doch wie genau funktioniert die Brikettierung?\n\n💥 Funktionsweise: Die Maschine presst Metallspäne unter hohem Druck zu kompakten Briketts zusammen. So wird das Volumen drastisch reduziert und eine saubere, hochwertige Form geschaffen, die einfach weiterverarbeitet werden kann.\n\n🔍 Vorteile für unsere Kunden:\n\n🔹 Kompakte Briketts: Bis zu 90 % Volumenreduktion sorgt für optimierte Lagerung und Transporteinsparungen.\n🔹 Wertvolle Rohstoffrückgewinnung: Durch die Verdichtung wird das Abtropfen von Restölen minimiert – das steigert die Qualität und den Wert des Materials.\n🔹 Nachhaltigkeit und Effizienz: Mit weniger Lagerplatz und Transportkosten leisten unsere Pressen einen aktiven Beitrag zu einem umweltfreundlicheren Recyclingprozess.\n\n👉 Mehr erfahren: https://lnkd.in/egNBmVnQ\n\n#Brikettierung #RecyclingTechnologie #Metallrecycling #Nachhaltigkeit #Maschinenbau #Technologie",
        "likes": "15",
        "comments": "1",
        "shares": "2",
        "time": {
          "raw": "3ay",
          "parsed": "05.12.2024",
          "isoString": "2024-12-05T10:27:32.681Z"
        },
        "mediaType": "image",
        "mediaContent": [
          "https://media.licdn.com/dms/image/v2/D4E22AQH9Xl_1343_0w/feedshare-shrink_800/feedshare-shrink_800/0/1731052580991?e=1744243200&v=beta&t=tjFxhkBo6qSjhjlQ5KZMRhAIRKP_hjVWdlJyz6r1AXQ",
          "https://media.licdn.com/dms/image/v2/D4E22AQFUHSuXMo7nig/feedshare-shrink_800/feedshare-shrink_800/0/1731052567831?e=1744243200&v=beta&t=8VjSdNebeHT6n0f7NCeVhXr9zu885FwEX2WkR2mo1uQ",
          "https://media.licdn.com/dms/image/v2/D4E22AQGTY5R82ZnvwA/feedshare-shrink_800/feedshare-shrink_800/0/1731052562429?e=1744243200&v=beta&t=Qc4mOjn5ysI-V6JkT1VyZ6Zq-lwG0PjAqdQinEWkGRw"
        ],
        "date": "2024-12-05T10:27:32.681Z"
      },
      {
        "captions": "🔧📦 Wir sind dabei! Auf dem BDSV-Branchentreff in München stellen wir unsere Lösungen für die Recycling-Industrie vor.\nAuch wenn wir vor Ort keine Maschinen zeigen, freuen wir uns darauf, mit Ihnen über unsere Brikettierpressen, Paketierpressen und Schrottscheren zu sprechen und zu zeigen, wie unsere Technologien die Effizienz und Nachhaltigkeit im Stahlrecycling steigern.\n🔍 Besuchen Sie uns im 2. OG, Stand 8 für spannende Gespräche und um mehr über unsere innovativen Lösungen zu erfahren – wir freuen uns auf den Austausch!\nBDSV Bundesvereinigung Deutscher Stahlrecycling- und Entsorgungsunternehmen e. V. \n📅 Datum: 09.10 - 10.10.2024\n#Recycling #Metallrecycling #BDSV #Nachhaltigkeit #Innovation🔧📦 Wir sind dabei! Auf dem BDSV-Branchentreff in München stellen wir unsere Lösungen für die Recycling-Industrie vor.\nAuch wenn wir vor Ort keine Maschinen zeigen, freuen wir uns darauf, mit Ihnen über unsere Brikettierpressen, Paketierpressen und Schrottscheren zu sprechen und zu zeigen, wie unsere Technologien die Effizienz und Nachhaltigkeit im Stahlrecycling steigern.\n🔍 Besuchen Sie uns im 2. OG, Stand 8 für spannende Gespräche und um mehr über unsere innovativen Lösungen zu erfahren – wir freuen uns auf den Austausch!\nBDSV Bundesvereinigung Deutscher Stahlrecycling- und Entsorgungsunternehmen e. V. \n📅 Datum: 09.10 - 10.10.2024\n#Recycling #Metallrecycling #BDSV #Nachhaltigkeit #Innovation",
        "likes": "5",
        "shares": "2",
        "time": {
          "raw": "4ay",
          "parsed": "05.11.2024",
          "isoString": "2024-11-05T10:27:32.683Z"
        },
        "mediaType": "image",
        "mediaContent": [
          "https://media.licdn.com/dms/image/v2/D4E22AQHVIV6222pr8w/feedshare-shrink_2048_1536/feedshare-shrink_2048_1536/0/1728369013876?e=1744243200&v=beta&t=EJT-cStwn5FjHvfy2QlFdUC17Kc2lmmmA2GMA8h_hkM"
        ],
        "date": "2024-11-05T10:27:32.683Z"
      },
      {
        "captions": "Die duale Berufsausbildung ist entscheidend für d...",
        "likes": "1",
        "time": {
          "raw": "5ay",
          "parsed": "05.10.2024",
          "isoString": "2024-10-05T10:27:32.688Z"
        },
        "mediaType": "other",
        "date": "2024-10-05T10:27:32.688Z"
      },
      {
        "captions": "Eine Delegation des Wirtschaftsbundes, angeführt ...",
        "likes": "4",
        "time": {
          "raw": "6ay",
          "parsed": "05.09.2024",
          "isoString": "2024-09-05T10:27:32.691Z"
        },
        "mediaType": "other",
        "date": "2024-09-05T10:27:32.691Z"
      },
      {
        "captions": "Die ATM Recyclingsystems GmbH hat die Metal Recycl...",
        "likes": "10",
        "time": {
          "raw": "8ay",
          "parsed": "05.07.2024",
          "isoString": "2024-07-05T10:27:32.693Z"
        },
        "mediaType": "other",
        "date": "2024-07-05T10:27:32.693Z"
      },
      {
        "captions": "ATM Recyclingsystems GmbH entwickelt, fertigt und ...",
        "likes": "2",
        "time": {
          "raw": "8ay",
          "parsed": "05.07.2024",
          "isoString": "2024-07-05T10:27:32.695Z"
        },
        "mediaType": "other",
        "date": "2024-07-05T10:27:32.695Z"
      },
      {
        "captions": "🚗♻️ Excited to be part of IARC 2025!\n\nATM Recyclingsystems is thrilled to join the 24th International Automotive Recycling Congress (IARC 2025) in Antwerp from March 19-21, 2025! 🔄🚀\n\nLooking forward to insightful discussions, productive meetings, and connecting with industry leaders shaping the future of circularity and automotive recycling.\n\n🔜 See you in Antwerp!\n\n#IARC #ICM #CircularEconomy #AutomotiveRecycling #SustainableRecycling",
        "likes": "8",
        "comments": "4",
        "time": {
          "raw": "1h",
          "parsed": "05.03.2025",
          "isoString": "2025-03-05T05:04:08.503Z"
        },
        "mediaType": "other",
        "date": "2025-03-05T05:04:08.503Z"
      }
    ]
  },
  {
    "name": "IngBonfiglioli",
    "followerData": [
      [
        20250225,
        1247
      ],
      [
        20250225,
        1247
      ],
      [
        20250225,
        1247
      ],
      [
        20250228,
        1249
      ],
      [
        20250228,
        1249
      ],
      [
        20250228,
        1249
      ],
      [
        20250228,
        1249
      ],
      [
        20250303,
        1251
      ],
      [
        1741011580872,
        "1.251"
      ],
      [
        1741076571083,
        "1.251"
      ],
      [
        1741077711766,
        "1.251"
      ],
      [
        1741083689671,
        "1.251"
      ],
      [
        1741084700661,
        "1.251"
      ],
      [
        1741170469444,
        1250
      ],
      [
        1741755865637,
        1252
      ]
    ],
    "data": [
      {
        "captions": "#ingbonfiglioli #squalo1000 #mobilitymatter #allovertheworld #mostpowerfulshears",
        "likes": "4",
        "time": {
          "raw": "2h",
          "parsed": "26.02.2025",
          "isoString": "2025-02-26T05:04:25.397Z"
        },
        "mediaType": "video",
        "mediaContent": {
          "src": [
            {
              "src": "https://dms.licdn.com/playlist/vid/v2/D4D05AQHIgJVRDBZkUw/mp4-720p-30fp-crf28/B4DZU7QgaRG8Bk-/0/1740456227032?e=1742364000&v=beta&t=4ppsq60rhCf20umrJUU_bNGheGEy-g0tz9rOJzFErug",
              "type": "video/mp4",
              "data-bitrate": 1063619
            },
            {
              "src": "https://dms.licdn.com/playlist/vid/v2/D4D05AQHIgJVRDBZkUw/mp4-640p-30fp-crf28/B4DZU7QgaRG8Bg-/0/1740456222968?e=1742364000&v=beta&t=nFxcnUL7gvqBsSVmvhapx0zwboSHMDkEHOL6ZtODx_8",
              "type": "video/mp4",
              "data-bitrate": 817531
            }
          ],
          "posterUrl": "https://media.licdn.com/dms/image/v2/D4D05AQHIgJVRDBZkUw/videocover-low/B4DZU7QgaRG8CQ-/0/1740456210568?e=1742364000&v=beta&t=745kdoTOPjtHyl3AUZ2A_emextdCmAV5sfKzbt3bG1c"
        },
        "date": "2025-02-26T05:04:25.397Z"
      },
      {
        "captions": "Ing,Bonfiglioli SQUALO 4000 Vertical Inclined Shear on duty in New Mexico - USA.  #nomercy #thebeast #mostpowerfulshear #hms #ingbonfiglioli #nocompromises #allovertheworldIng,Bonfiglioli SQUALO 4000 Vertical Inclined Shear on duty in New Mexico - USA.  #nomercy #thebeast #mostpowerfulshear #hms #ingbonfiglioli #nocompromises #allovertheworld",
        "likes": "5",
        "shares": "1",
        "time": {
          "raw": "2h",
          "parsed": "26.02.2025",
          "isoString": "2025-02-26T05:04:25.399Z"
        },
        "mediaType": "image",
        "mediaContent": [
          "https://media.licdn.com/dms/image/v2/D4D22AQGqJMZzvf5ngg/feedshare-shrink_800/B4DZU7P_NwG8Ag-/0/1740455802087?e=1744848000&v=beta&t=_LyLT3VvdxdEjRqv98VD4_NSXQ7p-7Mi2Nc8o5ccK-k"
        ],
        "date": "2025-02-26T05:04:25.399Z"
      },
      {
        "captions": "Ing.Bonfiglioli SQUALO 2000 High Speed Vertical Inclined Shear running in the cold winter of Colorado - USA. #wintertime #ingbonfiglioli #mostpowerfulshears #onestepahead #builtolastIng.Bonfiglioli SQUALO 2000 High Speed Vertical Inclined Shear running in the cold winter of Colorado - USA. #wintertime #ingbonfiglioli #mostpowerfulshears #onestepahead #builtolast",
        "likes": "3",
        "time": {
          "raw": "2h",
          "parsed": "26.02.2025",
          "isoString": "2025-02-26T05:04:25.400Z"
        },
        "mediaType": "image",
        "mediaContent": [
          "https://media.licdn.com/dms/image/v2/D4D22AQG4GxOFKtnHZg/feedshare-shrink_800/B4DZU7Krk3GkAg-/0/1740454413928?e=1744848000&v=beta&t=XGbzb_6PbEfC8WnCsrkDe-WmPWfF6DuTPs9bmLPuXDA"
        ],
        "date": "2025-02-26T05:04:25.400Z"
      },
      {
        "captions": "#ingbonfiglioli #scrapmetalrecycling #onestepahead #allovertheworld",
        "likes": "4",
        "time": {
          "raw": "2h",
          "parsed": "26.02.2025",
          "isoString": "2025-02-26T05:04:25.401Z"
        },
        "mediaType": "video",
        "mediaContent": {
          "src": [
            {
              "src": "https://dms.licdn.com/playlist/vid/v2/D4D05AQGkqmsqEyJuYg/mp4-640p-30fp-crf28/B4DZUrnrSaGkBg-/0/1740193578763?e=1742364000&v=beta&t=g0iyT8tKyXpOxLOLC5sWlph6CwERbVNJKcEFCqHDMzs",
              "type": "video/mp4",
              "data-bitrate": 678474
            },
            {
              "src": "https://dms.licdn.com/playlist/vid/v2/D4D05AQGkqmsqEyJuYg/mp4-720p-30fp-crf28/B4DZUrnrSaGkBk-/0/1740193578886?e=1742364000&v=beta&t=KoRMy6nZ3XuHQwfJkCEZcJljBMG326bgQcX4WUcMWCs",
              "type": "video/mp4",
              "data-bitrate": 871887
            }
          ],
          "posterUrl": "https://media.licdn.com/dms/image/v2/D4D05AQGkqmsqEyJuYg/videocover-high/B4DZUrnrSaGkBw-/0/1740193577943?e=1742364000&v=beta&t=OkgGSivJ-HDQMSiVB-iXqm2LHyNOH9oH94PK5tIcz-U"
        },
        "date": "2025-02-26T05:04:25.401Z"
      },
      {
        "captions": "It's a good winter morning for chopping up material in Colorado - USA for the Ing.Bonfiglioli SQUALO 3000 Vertical Inclined Shear. #northamericanfamily #ingbonfiglioli #allovertheworld #mostpowerfulshears #nocompromisesIt's a good winter morning for chopping up material in Colorado - USA for the Ing.Bonfiglioli SQUALO 3000 Vertical Inclined Shear. #northamericanfamily #ingbonfiglioli #allovertheworld #mostpowerfulshears #nocompromises",
        "likes": "5",
        "time": {
          "raw": "2h",
          "parsed": "26.02.2025",
          "isoString": "2025-02-26T05:04:25.406Z"
        },
        "mediaType": "image",
        "mediaContent": [
          "https://media.licdn.com/dms/image/v2/D4E22AQHPmAgv8Hm6qA/feedshare-shrink_800/B4EZUofKUmHgAk-/0/1740141013899?e=1744848000&v=beta&t=WRqFC1UTjp_pYQ1Yinddk9dyawqxEfLQS9DYXMgHruY"
        ],
        "date": "2025-02-26T05:04:25.406Z"
      },
      {
        "captions": "Ing.Bonfiglioli DRAKE 10 Hammermill Shredder on duty in New Zealand. #kiwifamily #ingbonfiglioli #allovertheworld #onestepahead #shreddingtherightway",
        "likes": "3",
        "time": {
          "raw": "2h",
          "parsed": "26.02.2025",
          "isoString": "2025-02-26T05:04:25.407Z"
        },
        "mediaType": "video",
        "mediaContent": {
          "src": [
            {
              "src": "https://dms.licdn.com/playlist/vid/v2/D4D05AQFXfiTLL_n_6Q/mp4-640p-30fp-crf28/B4DZUmZNVGGcBc-/0/1740105900696?e=1742364000&v=beta&t=JsT9TYd5aE1_--E8tSXwboVsWJ1pdD0AkpKA8g1c4Rs",
              "type": "video/mp4",
              "data-bitrate": 837841
            }
          ],
          "posterUrl": "https://media.licdn.com/dms/image/v2/D4D05AQFXfiTLL_n_6Q/videocover-high/B4DZUmZNVGGcBs-/0/1740105899495?e=1742364000&v=beta&t=Rr35Elgf9KgF4i847tb3L5F3Fqksx64plILVdw0mT2E"
        },
        "date": "2025-02-26T05:04:25.407Z"
      },
      {
        "captions": "Ing.Bonfiglioli SQUALO 2000 High Speed Vertical Inclined Shear running in Utah - USA. #northamericanfamily #aljon #ingbonfiglioli #mostpowerfulshears #nocompromisesIng.Bonfiglioli SQUALO 2000 High Speed Vertical Inclined Shear running in Utah - USA. #northamericanfamily #aljon #ingbonfiglioli #mostpowerfulshears #nocompromises",
        "likes": "1",
        "time": {
          "raw": "2h",
          "parsed": "26.02.2025",
          "isoString": "2025-02-26T05:04:25.408Z"
        },
        "mediaType": "image",
        "mediaContent": [
          "https://media.licdn.com/dms/image/v2/D4D22AQGLjnpMEvAPUA/feedshare-shrink_800/B4DZUd9QNfHkAk-/0/1739964352323?e=1744848000&v=beta&t=B2WanHzUPY5WKW7S1QpYZsu7sxI8ltXBqzSjlAwj6uY"
        ],
        "date": "2025-02-26T05:04:25.408Z"
      },
      {
        "captions": "#ingbonfiglioli #aussiefamily #drake #shreddingtherightway #squalo #mostpowerfulshears",
        "likes": "4",
        "time": {
          "raw": "2h",
          "parsed": "26.02.2025",
          "isoString": "2025-02-26T05:04:25.409Z"
        },
        "mediaType": "video",
        "mediaContent": {
          "src": [
            {
              "src": "https://dms.licdn.com/playlist/vid/v2/D4D05AQFPeTE4vC5Eog/mp4-720p-30fp-crf28/B4DZUd8nE8GkBg-/0/1739964192084?e=1742364000&v=beta&t=ve45vP4viRedO8v-QLfx_45UtU0gC_K9-cY9_JmAbao",
              "type": "video/mp4",
              "data-bitrate": 1393147
            },
            {
              "src": "https://dms.licdn.com/playlist/vid/v2/D4D05AQFPeTE4vC5Eog/mp4-640p-30fp-crf28/B4DZUd8nE8GkBc-/0/1739964192367?e=1742364000&v=beta&t=cv9uiWiZMi-U99AFCJzBvhs4O3B21kMgxQfgFKISx7Q",
              "type": "video/mp4",
              "data-bitrate": 1083446
            }
          ],
          "posterUrl": "https://media.licdn.com/dms/image/v2/D4D05AQFPeTE4vC5Eog/videocover-low/B4DZUd8nE8GkCM-/0/1739964186411?e=1742364000&v=beta&t=DvWmzEkxp-JZvLiqJRlhc-r9SwLF0nZzbnl6q1jpTlw"
        },
        "date": "2025-02-26T05:04:25.409Z"
      },
      {
        "captions": "Installation in progress in the United States for another Ing.Bonfiglioli SQUALO 4000 Vertical Inclined Shear. More units on the way soon, stay tuned.\n#ingbonfiglioli #aljon #northamericanfamily #mostpowerfulshear #thebeast #nomercyInstallation in progress in the United States for another Ing.Bonfiglioli SQUALO 4000 Vertical Inclined Shear. More units on the way soon, stay tuned.\n#ingbonfiglioli #aljon #northamericanfamily #mostpowerfulshear #thebeast #nomercy",
        "likes": "3",
        "time": {
          "raw": "3h",
          "parsed": "19.02.2025",
          "isoString": "2025-02-19T05:04:25.410Z"
        },
        "mediaType": "image",
        "mediaContent": [
          "https://media.licdn.com/dms/image/v2/D4D22AQFMW4qHg8COEQ/feedshare-shrink_800/B4DZUNsMNzGcAg-/0/1739691444520?e=1744848000&v=beta&t=y8miolDoZ9fW12d3-pDn51r7f6n6HTpC65nydkzbhBk"
        ],
        "date": "2025-02-19T05:04:25.410Z"
      },
      {
        "captions": "Full throttle production at the factory this week! The family keeps growing...stay tuned for more!\n#ingbonfiglioli #allovertheworld\n#scrapmetalrecycling #onestepaheadFull throttle production at the factory this week! The family keeps growing...stay tuned for more!\n#ingbonfiglioli #allovertheworld\n#scrapmetalrecycling #onestepahead",
        "likes": "1",
        "shares": "1",
        "time": {
          "raw": "1ay",
          "parsed": "12.02.2025",
          "isoString": "2025-02-12T05:04:25.412Z"
        },
        "mediaType": "image",
        "mediaContent": [
          "https://media.licdn.com/dms/image/v2/D4D22AQF8G16wcqLQTA/feedshare-shrink_800/B4DZTgzwwsGcAg-/0/1738938455741?e=1744848000&v=beta&t=KlQFyBIC7doLEBKF7QpWwr4-uZYzrC6Xw1y6-1Q3ruo"
        ],
        "date": "2025-02-12T05:04:25.412Z"
      },
      {
        "captions": "Next level shredding. No compromises. #ingbonfiglioli #metalrecycling #shreddingtherightway",
        "likes": "2",
        "shares": "1",
        "time": {
          "raw": "1ay",
          "parsed": "12.02.2025",
          "isoString": "2025-02-12T05:04:25.412Z"
        },
        "mediaType": "video",
        "mediaContent": {
          "src": [
            {
              "src": "https://dms.licdn.com/playlist/vid/v2/D4E05AQGDdibTlT6Kdg/mp4-640p-30fp-crf28/B4EZTUGeHfHUBc-/0/1738725267452?e=1742364000&v=beta&t=_ntOkSkbJG3VYY-RwFDU2za7mbYDs8ntrG-FoEWV0OI",
              "type": "video/mp4",
              "data-bitrate": 1103392
            },
            {
              "src": "https://dms.licdn.com/playlist/vid/v2/D4E05AQGDdibTlT6Kdg/mp4-720p-30fp-crf28/B4EZTUGeHfHUBg-/0/1738725268088?e=1742364000&v=beta&t=wvjgqMYlhB4RXCczcITGOaLxlilqYMsZOZi1IYtj2b4",
              "type": "video/mp4",
              "data-bitrate": 1417703
            }
          ],
          "posterUrl": "https://media.licdn.com/dms/image/v2/D4E05AQGDdibTlT6Kdg/videocover-high/B4EZTUGeHfHUBs-/0/1738725264487?e=1742364000&v=beta&t=7ET970CnNd3TmHYtgPGdOeVKryVlihHBnMWckVbTiYc"
        },
        "date": "2025-02-12T05:04:25.412Z"
      },
      {
        "captions": "Ing.Bonfiglioli ARIETE portable baler on duty in Europe. #Ingbonfiglioli #scrapmetalrecycling #mobilitymatter #allovertheworldIng.Bonfiglioli ARIETE portable baler on duty in Europe. #Ingbonfiglioli #scrapmetalrecycling #mobilitymatter #allovertheworld",
        "likes": "4",
        "time": {
          "raw": "1ay",
          "parsed": "12.02.2025",
          "isoString": "2025-02-12T05:04:25.415Z"
        },
        "mediaType": "image",
        "mediaContent": [
          "https://media.licdn.com/dms/image/v2/D4E22AQE_mwdGbNo2Fg/feedshare-shrink_2048_1536/B4EZTUGAMzHgAs-/0/1738725131720?e=1744848000&v=beta&t=HwafZ07GdSQpaydhmCeIk81qaK6_HKZesn6ti8XfKHE"
        ],
        "date": "2025-02-12T05:04:25.415Z"
      },
      {
        "captions": "It's a good morning for this Ing.Bonfiglioli SQUALO 2000 High Speed Inclined Shear running in South America. #thesqualo #onestepahead #ingbonfiglioli #mobilitymatter #mostpowerfulshears",
        "likes": "1",
        "shares": "1",
        "time": {
          "raw": "1ay",
          "parsed": "12.02.2025",
          "isoString": "2025-02-12T05:04:25.417Z"
        },
        "mediaType": "video",
        "mediaContent": {
          "src": [
            {
              "src": "https://dms.licdn.com/playlist/vid/v2/D4E05AQHZoEbL1oGQzQ/mp4-640p-30fp-crf28/B4EZTUFuwXGgBc-/0/1738725064507?e=1742364000&v=beta&t=FY_eS3XELu6a31HJtaS6g4kuP4AJYr9-ejMGDrjfeJo",
              "type": "video/mp4",
              "data-bitrate": 625804
            }
          ],
          "posterUrl": "https://media.licdn.com/dms/image/v2/D4E05AQHZoEbL1oGQzQ/videocover-low/B4EZTUFuwXGgCM-/0/1738725062676?e=1742364000&v=beta&t=6uwfloYszcvyTHhNpy9BdQzigTd5WXRYV_IveDGhThI"
        },
        "date": "2025-02-12T05:04:25.417Z"
      },
      {
        "captions": "Ing.Bonfiglioli DRAKE 16 HP Hammermill Shredder running in South America.\n#ingbonfiglioli #shreddingtherightway #allovertheworld #onestepahead",
        "likes": "8",
        "shares": "1",
        "time": {
          "raw": "1ay",
          "parsed": "12.02.2025",
          "isoString": "2025-02-12T05:04:25.418Z"
        },
        "mediaType": "video",
        "mediaContent": {
          "src": [
            {
              "src": "https://dms.licdn.com/playlist/vid/v2/D4D05AQHmuOOBvh7QNg/mp4-640p-30fp-crf28/B4DZS_5MvyG4Bc-/0/1738386235937?e=1742364000&v=beta&t=RoyVUJQ1jyrHEaEeWrBI8FoyhoP-wb3SOTpyzzSUXwY",
              "type": "video/mp4",
              "data-bitrate": 519468
            }
          ],
          "posterUrl": "https://media.licdn.com/dms/image/v2/D4D05AQHmuOOBvh7QNg/videocover-high/B4DZS_5MvyG4Bs-/0/1738386234505?e=1742364000&v=beta&t=_X0qT-lkwRm_VChr2q8AZXY7dKSoD2iacdseCniVh88"
        },
        "date": "2025-02-12T05:04:25.418Z"
      },
      {
        "captions": "Ing.Bonfiglioli SQUALO 3000 Vertical Inclined Shear working in Ontario - Canada. #northamericanfamily #mostpowerfulshears #nocompromises #allovertheworld #onestepaheadIng.Bonfiglioli SQUALO 3000 Vertical Inclined Shear working in Ontario - Canada. #northamericanfamily #mostpowerfulshears #nocompromises #allovertheworld #onestepahead",
        "likes": "4",
        "time": {
          "raw": "1ay",
          "parsed": "12.02.2025",
          "isoString": "2025-02-12T05:04:25.421Z"
        },
        "mediaType": "image",
        "mediaContent": [
          "https://media.licdn.com/dms/image/v2/D4D22AQHRaCMJw7kCHw/feedshare-shrink_800/B4DZSrFSdtHUAg-/0/1738037078586?e=1744848000&v=beta&t=_Rkpf1MyjPLzHkN3qIOFUykBMBvcoQM8EaovT0IqIcg"
        ],
        "date": "2025-02-12T05:04:25.421Z"
      },
      {
        "captions": "Ing.Bonfiglioli ARIETE portable baler ready for another productive day in this recycling facility in Tasmania - Australia. #aussiefamily #mobilityisthekey #scrapmetalrecycling Ing.Bonfiglioli ARIETE portable baler ready for another productive day in this recycling facility in Tasmania - Australia. #aussiefamily #mobilityisthekey #scrapmetalrecycling",
        "likes": "1",
        "time": {
          "raw": "1ay",
          "parsed": "12.02.2025",
          "isoString": "2025-02-12T05:04:25.423Z"
        },
        "mediaType": "image",
        "mediaContent": [
          "https://media.licdn.com/dms/image/v2/D4D22AQH8K-qXrwIIUA/feedshare-shrink_800/B4DZSrDk73HIAk-/0/1738036639064?e=1744848000&v=beta&t=RBR-V1Lpwr6bFvgiGepe9-gXvUrNiXPo9kbL3M5W_vE"
        ],
        "date": "2025-02-12T05:04:25.423Z"
      },
      {
        "captions": "Ing.Bonfiglioli SQUALO 1500 Vertical Inclined Shear running in Sweden. #ingbonfiglioli #nocompromises #mostpowerfulshears #allovertheworld",
        "likes": "2",
        "time": {
          "raw": "1ay",
          "parsed": "12.02.2025",
          "isoString": "2025-02-12T05:04:25.425Z"
        },
        "mediaType": "video",
        "mediaContent": {
          "src": [
            {
              "src": "https://dms.licdn.com/playlist/vid/v2/D4D05AQGlHWSS3PAHqg/mp4-640p-30fp-crf28/B4DZSrDFvfHABg-/0/1738036525529?e=1742364000&v=beta&t=Jb4VEx9mY-4Sq8X2nXzwN9c98QDmtVFRmIgJ-s1-oT4",
              "type": "video/mp4",
              "data-bitrate": 1058201
            },
            {
              "src": "https://dms.licdn.com/playlist/vid/v2/D4D05AQGlHWSS3PAHqg/mp4-720p-30fp-crf28/B4DZSrDFvfHABk-/0/1738036526001?e=1742364000&v=beta&t=UGY7bx6YZ_qyIXBKguMG8CrGCZ1bk_zUNPMgMp7gAnE",
              "type": "video/mp4",
              "data-bitrate": 1380911
            }
          ],
          "posterUrl": "https://media.licdn.com/dms/image/v2/D4D05AQGlHWSS3PAHqg/videocover-low/B4DZSrDFvfHACQ-/0/1738036521871?e=1742364000&v=beta&t=TuZdv6OURYuC6D-2HyNU0oyPrtOzS0q9Yte05MMB4Z4"
        },
        "date": "2025-02-12T05:04:25.425Z"
      },
      {
        "captions": "Ing.Bonfiglioli SQUALO 3000 Vertical Inclined Shear working in Oregon - USA this week.  #northamericanfamily #ingbonfiglioli #mostpowerfulshears #mobilityisthekeyIng.Bonfiglioli SQUALO 3000 Vertical Inclined Shear working in Oregon - USA this week.  #northamericanfamily #ingbonfiglioli #mostpowerfulshears #mobilityisthekey",
        "likes": "3",
        "time": {
          "raw": "1ay",
          "parsed": "05.02.2025",
          "isoString": "2025-02-05T10:27:49.143Z"
        },
        "mediaType": "image",
        "mediaContent": [
          "https://media.licdn.com/dms/image/v2/D4D22AQG6xNBafc20EQ/feedshare-shrink_800/B4DZShAL_cHkAo-/0/1737867971280?e=1744243200&v=beta&t=ycnwFq6sM9VKQXFMIdjG0aNhcCaXaWCaZbnyxyENkDU"
        ],
        "date": "2025-02-05T10:27:49.143Z"
      },
      {
        "captions": "Nice top view for the yard of one of our customers in Eastern Europe running the Ing.Bonfiglioli DRAKE 16 HP Hammermill Shredder. Top productivity at the lowest running cost on its category! #ingbonfiglioli #shreddingtherightway #allovertheworldNice top view for the yard of one of our customers in Eastern Europe running the Ing.Bonfiglioli DRAKE 16 HP Hammermill Shredder. Top productivity at the lowest running cost on its category! #ingbonfiglioli #shreddingtherightway #allovertheworld",
        "likes": "5",
        "shares": "1",
        "time": {
          "raw": "1ay",
          "parsed": "05.02.2025",
          "isoString": "2025-02-05T10:27:49.144Z"
        },
        "mediaType": "image",
        "mediaContent": [
          "https://media.licdn.com/dms/image/v2/D4D22AQG9vTRETd7x5Q/feedshare-shrink_800/B4DZSg.2jfHIAk-/0/1737867618937?e=1744243200&v=beta&t=IGgtFNeanWuU2DBoYyMru7nfCGK9JbI57g28TB9HzJI"
        ],
        "date": "2025-02-05T10:27:49.144Z"
      },
      {
        "captions": "Ing.Bonfiglioli SQUALO 3000 Vertical Inclined Shear in operation in a top company in Saudi Arabia. #nocompromises #mostpowerfulshears #onestepahead #heavydutyshear #ingbonfiglioli",
        "likes": "6",
        "comments": "1",
        "time": {
          "raw": "1ay",
          "parsed": "05.02.2025",
          "isoString": "2025-02-05T10:27:49.145Z"
        },
        "mediaType": "video",
        "mediaContent": {
          "src": [
            {
              "src": "https://dms.licdn.com/playlist/vid/v2/D4D05AQGM5XBhnMUgpQ/mp4-640p-30fp-crf28/B4DZSg9ZX8H0Bc-/0/1737867244558?e=1741777200&v=beta&t=uahwZ_TX-tZd6R68vA-qFbWkz_0CHjzGCaeEFlcZAHk",
              "type": "video/mp4",
              "data-bitrate": 944895
            }
          ],
          "posterUrl": "https://media.licdn.com/dms/image/v2/D4D05AQGM5XBhnMUgpQ/videocover-high/B4DZSg9ZX8H0Bs-/0/1737867240443?e=1741777200&v=beta&t=UcVCNPvvo0Q1sKkCdJfH2voC5OJ1VXFvqmw0MyFc0j0"
        },
        "date": "2025-02-05T10:27:49.145Z"
      },
      {
        "captions": "Ing.Bonfiglioli SQUALO 2000 High Speed Vertical Inclined Shear in operation in Brazil. #ingbonfiglioli #thesqualo #allovertheworld #mostpowerfulshears #onestepaheadIng.Bonfiglioli SQUALO 2000 High Speed Vertical Inclined Shear in operation in Brazil. #ingbonfiglioli #thesqualo #allovertheworld #mostpowerfulshears #onestepahead",
        "likes": "2",
        "time": {
          "raw": "1g",
          "parsed": "11.03.2025",
          "isoString": "2025-03-11T05:04:25.393Z"
        },
        "mediaType": "image",
        "mediaContent": [
          "https://media.licdn.com/dms/image/v2/D4D22AQEiMkFi37Dm9A/feedshare-shrink_2048_1536/B4DZWBJgaoHkAw-/0/1741628508578?e=1744848000&v=beta&t=MdcHfROQOrUoa9FyQzKin_veEz-l4bjMG6FBqdTD5VQ"
        ],
        "date": "2025-03-11T05:04:25.393Z"
      },
      {
        "captions": "Customer's pick up from the factory of its new Ing.Bonfiglioli ARIETE portable baler. Mobility Is the Key!! #ingbonfiglioli #mobilityisthekey #scrapmetalrecycling\n#onestepaheadCustomer's pick up from the factory of its new Ing.Bonfiglioli ARIETE portable baler. Mobility Is the Key!! #ingbonfiglioli #mobilityisthekey #scrapmetalrecycling\n#onestepahead",
        "likes": "1",
        "time": {
          "raw": "1g",
          "parsed": "11.03.2025",
          "isoString": "2025-03-11T05:04:25.395Z"
        },
        "mediaType": "image",
        "mediaContent": [
          "https://media.licdn.com/dms/image/v2/D4D22AQHf95n6wEJhJg/feedshare-shrink_800/B4DZWASqt6HYAg-/0/1741614133808?e=1744848000&v=beta&t=7b0rBijBrEk7NojG5iRGZokslJr2m1phevUgGVVfBE0"
        ],
        "date": "2025-03-11T05:04:25.395Z"
      },
      {
        "captions": "A couple of Ing.Bonfiglioli SQUALO Vertical Inclined Shears ready at the factory and on the way to the overseas market this week. #ingbonfiglioli #mostpowerfulshears  #nocompromises #allovertheworldA couple of Ing.Bonfiglioli SQUALO Vertical Inclined Shears ready at the factory and on the way to the overseas market this week. #ingbonfiglioli #mostpowerfulshears  #nocompromises #allovertheworld",
        "likes": "4",
        "time": {
          "raw": "1g",
          "parsed": "11.03.2025",
          "isoString": "2025-03-11T05:04:25.396Z"
        },
        "mediaType": "image",
        "mediaContent": [
          "https://media.licdn.com/dms/image/v2/D4D22AQFbO7hlfKJeEQ/feedshare-shrink_800/B4DZWAPG82HIAk-/0/1741613201271?e=1744848000&v=beta&t=AqP6lxLWxVn9vQWZcdJTm2DXFLZDZ96PepiQRGtpl6o"
        ],
        "date": "2025-03-11T05:04:25.396Z"
      }
    ]
  },
  {
    "name": "GPSScrapProcessingSolutions",
    "followerData": [
      [
        20250225,
        1026
      ],
      [
        20250225,
        1026
      ],
      [
        20250225,
        1026
      ],
      [
        20250228,
        1027
      ],
      [
        20250228,
        1027
      ],
      [
        20250228,
        1027
      ],
      [
        20250228,
        1027
      ],
      [
        20250303,
        1028
      ],
      [
        1741011597330,
        "1.028"
      ],
      [
        1741076589688,
        "1.028"
      ],
      [
        1741077732286,
        "1.028"
      ],
      [
        1741083709204,
        "1.028"
      ],
      [
        1741084719613,
        "1.028"
      ],
      [
        1741170488028,
        1029
      ],
      [
        1741755879633,
        1029
      ]
    ],
    "data": [
      {
        "captions": "BEFORE/AFTER - The transformation begins here.\n\n⚙️ Processing: from bulky scrap to a compact bale or log, ready for recycling.\n🔥 Zero waste, maximum gain.\n\nWith GPS Recycling machines:\n-Efficient and fast recovery.\n-Space optimization with compact bales.\n-A new life for every material, improving margins.\n\nWhat more do you want?BEFORE/AFTER - The transformation begins here.\n\n⚙️ Processing: from bulky scrap to a compact bale or log, ready for recycling.\n🔥 Zero waste, maximum gain.\n\nWith GPS Recycling machines:\n-Efficient and fast recovery.\n-Space optimization with compact bales.\n-A new life for every material, improving margins.\n\nWhat more do you want?",
        "likes": "2",
        "time": {
          "raw": "1h",
          "parsed": "05.03.2025",
          "isoString": "2025-03-05T05:04:39.357Z"
        },
        "mediaType": "image",
        "mediaContent": [
          "https://media.licdn.com/dms/image/v2/D5610AQE392NKQfUwUQ/image-shrink_800/B56ZVGa79zHEAc-/0/1740643222475?e=1742364000&v=beta&t=IQL0Kdvfh17RnCfsP4vHqpNbX3ap9Yj5pW0CCJD-UgE"
        ],
        "date": "2025-03-05T05:04:39.357Z"
      },
      {
        "captions": "💥UNRIVALED EFFICIENCY RECOVERY💥\n\nDefective cans and production waste are not a problem. The problem is managing them poorly.\nWith the the automatic balers:\n-#100% recycling directly in the production line.\n-Clean material ready for the foundry without additional steps.\n-Reduce time, increase #gains.\nIf you want speed, quality and zero #waste, this is not just a machine: it's your competitive advantage.\nDon't settle: dominate the production cycle with GPS Recycling.\n\n🔗 Find out how to revolutionize your line: https://lnkd.in/djNSDEet💥UNRIVALED EFFICIENCY RECOVERY💥\n\nDefective cans and production waste are not a problem. The problem is managing them poorly.\nWith the the automatic balers:\n-#100% recycling directly in the production line.\n-Clean material ready for the foundry without additional steps.\n-Reduce time, increase #gains.\nIf you want speed, quality and zero #waste, this is not just a machine: it's your competitive advantage.\nDon't settle: dominate the production cycle with GPS Recycling.\n\n🔗 Find out how to revolutionize your line: https://lnkd.in/djNSDEet",
        "likes": "2",
        "time": {
          "raw": "2h",
          "parsed": "26.02.2025",
          "isoString": "2025-02-26T05:04:39.358Z"
        },
        "mediaType": "image",
        "mediaContent": [
          "https://media.licdn.com/dms/image/v2/D4D10AQG0v0Yz9ypQbA/image-shrink_800/B4DZUiX429HIAc-/0/1740038443676?e=1742364000&v=beta&t=hafXC9dPNt5hFegxlLe8qrlmY14MOV6zKsnOezxINew"
        ],
        "date": "2025-02-26T05:04:39.358Z"
      },
      {
        "captions": "💖 GPS IN LOVE: POWER THAT MAKES YOU FALL IN LOVE 💖\nFor Valentine's Day, we present our new #passion: PREDATOR 9.0 HS.\n\nA machine born to make your heart beat faster:\n-High speed to handle any challenge.\n-Deadly precision, no waste.\n-Unbeatable #efficiency, like a perfect partner.\n\nIf you're looking for a machine that combines strength and #performance, look no further. This is not just #technology, it's love at first use. https://lnkd.in/g6unxs5g💖 GPS IN LOVE: POWER THAT MAKES YOU FALL IN LOVE 💖\nFor Valentine's Day, we present our new #passion: PREDATOR 9.0 HS.\n\nA machine born to make your heart beat faster:\n-High speed to handle any challenge.\n-Deadly precision, no waste.\n-Unbeatable #efficiency, like a perfect partner.\n\nIf you're looking for a machine that combines strength and #performance, look no further. This is not just #technology, it's love at first use. https://lnkd.in/g6unxs5g",
        "likes": "1",
        "time": {
          "raw": "3h",
          "parsed": "19.02.2025",
          "isoString": "2025-02-19T05:04:39.360Z"
        },
        "mediaType": "image",
        "mediaContent": [
          "https://media.licdn.com/dms/image/v2/D4D10AQGLfVDlUqHtVw/image-shrink_800/B4DZUDeQJxHIAg-/0/1739520017958?e=1742364000&v=beta&t=Wq5bJ1bJMWqHbv1v97_s84bF45StmjcRHTYB6EyqKAM"
        ],
        "date": "2025-02-19T05:04:39.360Z"
      },
      {
        "captions": "💡YOUR BUSINESS DESERVES MORE💡\n\nIn a competitive market, reducing cost per ton is the only way to improve margins and beat the competition.\n\nWith our #balers and #shearbalers:\n-Maximum efficiency, every ton is worth more.\n-Cutting-edge technology, always one step ahead.\n-Optimized costs, higher margins.\nWhy lag behind when you can dominate the market? 🚀\n\n🔗 Learn how to transform your production cycle: https://lnkd.in/dvMb29C8 \n\n#efficiencymatters #costreduction #industrialinnovation #costperton💡YOUR BUSINESS DESERVES MORE💡\n\nIn a competitive market, reducing cost per ton is the only way to improve margins and beat the competition.\n\nWith our #balers and #shearbalers:\n-Maximum efficiency, every ton is worth more.\n-Cutting-edge technology, always one step ahead.\n-Optimized costs, higher margins.\nWhy lag behind when you can dominate the market? 🚀\n\n🔗 Learn how to transform your production cycle: https://lnkd.in/dvMb29C8 \n\n#efficiencymatters #costreduction #industrialinnovation #costperton",
        "likes": "1",
        "time": {
          "raw": "1ay",
          "parsed": "12.02.2025",
          "isoString": "2025-02-12T05:04:39.361Z"
        },
        "mediaType": "image",
        "mediaContent": [
          "https://media.licdn.com/dms/image/v2/D4D10AQGHYG-S2KZFBQ/image-shrink_800/B4DZTaRlIdG4Ag-/0/1738828830752?e=1742364000&v=beta&t=N0-hb2r_Gf-ZDMMkHraQCaPmNpNYu8UVqGmhW7pa_h8"
        ],
        "date": "2025-02-12T05:04:39.361Z"
      },
      {
        "captions": "With #Predator 9.0 HS, GPS Recycling has redefined #industry standards. No one has ever built a #baler of this size, and its #power is incomparable.\n\nDesigned to handle the #bulkiest #loads, the Predator 9.0 HS delivers outstanding performance at every stage of the process.\n\n-Large loading chamber to handle large volumes quickly.\n-Unmatched compaction power, ideal for those who need high performance.\nWith this machine you can maximize your company's #productivity, contact us!\nhttps://lnkd.in/d9wYEUX5",
        "likes": "2",
        "comments": "1",
        "time": {
          "raw": "1ay",
          "parsed": "12.02.2025",
          "isoString": "2025-02-12T05:04:39.362Z"
        },
        "mediaType": "video",
        "mediaContent": {
          "src": [
            {
              "src": "https://dms.licdn.com/playlist/vid/v2/D4D10AQF7z7Hj62fFRA/mp4-640p-30fp-crf28/mp4-640p-30fp-crf28/0/1737619229761?e=1742364000&v=beta&t=bADyhKAy79NX5OB7PKe6fnp3qiYdRWjchV4ZiXdv8ao",
              "type": "video/mp4",
              "data-bitrate": 589854
            },
            {
              "src": "https://dms.licdn.com/playlist/vid/v2/D4D10AQF7z7Hj62fFRA/mp4-360p-30fp-crf28/mp4-360p-30fp-crf28/0/1737619229330?e=1742364000&v=beta&t=OKC6VITq1fA_uG0kDrQ_jnhVur_YqvB-mM6piQnsHJ8",
              "type": "video/mp4",
              "data-bitrate": 250941
            },
            {
              "src": "https://dms.licdn.com/playlist/vid/v2/D4D10AQF7z7Hj62fFRA/mp4-720p-30fp-crf28/mp4-720p-30fp-crf28/0/1737619230133?e=1742364000&v=beta&t=5dlF3plAdNU_-jXAzQNCxU1IGUj3td4vfNjlodL0MLg",
              "type": "video/mp4",
              "data-bitrate": 784332
            }
          ],
          "posterUrl": "https://media.licdn.com/dms/image/v2/D4D10AQF7z7Hj62fFRA/videocover-high/videocover-high/0/1737619228810?e=1742364000&v=beta&t=O2PEiqZgOXQ4_nKyJbGT0YxYhTnQExrxY9gaL4JQGJs"
        },
        "date": "2025-02-12T05:04:39.362Z"
      },
      {
        "captions": "🚀 The #Destroyer represents the ultimate solution for large-scale scrap processing. Designed with an extraordinary loading capacity and a #closingforce on lids greater than that of any conventional shear, this machine offers unparalleled performance.\n\n-Box over 9 meters long and an open loading area of 2.8 meters, ideal for bulky materials.\n-State-of-the-art hydraulic power plant for maximum production efficiency.\n-Increased productivity and reduced operating costs all in one.\nIf your business needs #superior performance, Destroyer is the answer.\nFind out more on our website\n🔗https://lnkd.in/gAfnKPG7🚀 The #Destroyer represents the ultimate solution for large-scale scrap processing. Designed with an extraordinary loading capacity and a #closingforce on lids greater than that of any conventional shear, this machine offers unparalleled performance.\n\n-Box over 9 meters long and an open loading area of 2.8 meters, ideal for bulky materials.\n-State-of-the-art hydraulic power plant for maximum production efficiency.\n-Increased productivity and reduced operating costs all in one.\nIf your business needs #superior performance, Destroyer is the answer.\nFind out more on our website\n🔗https://lnkd.in/gAfnKPG7",
        "likes": "5",
        "time": {
          "raw": "1ay",
          "parsed": "12.02.2025",
          "isoString": "2025-02-12T05:04:39.364Z"
        },
        "mediaType": "image",
        "mediaContent": [
          "https://media.licdn.com/dms/image/v2/D4D10AQEgQ8HdBL96AA/image-shrink_800/image-shrink_800/0/1737014415045?e=1742364000&v=beta&t=zGg3_wGCaHiT65J8HxuDelEpQTAJhj2uOhLQD0dBBJQ"
        ],
        "date": "2025-02-12T05:04:39.364Z"
      },
      {
        "captions": "🔧 #GPSRecycling is proud to continue the path of #innovation traced by Lollini International, a pioneer in the design of the first mobile scrap processing machines in Italy.\n\nIf you own a Lollini machine, you can count on us for service and genuine #spare parts to ensure that your operations remain efficient and uninterrupted.\n\nIn addition, we offer the option of picking up your Lollini model in #tradein, so you can upgrade to a more modern, efficient and technologically advanced solution. 💪\n\nDon't miss this opportunity! Contact us now: https://lnkd.in/d9wYEUX5🔧 #GPSRecycling is proud to continue the path of #innovation traced by Lollini International, a pioneer in the design of the first mobile scrap processing machines in Italy.\n\nIf you own a Lollini machine, you can count on us for service and genuine #spare parts to ensure that your operations remain efficient and uninterrupted.\n\nIn addition, we offer the option of picking up your Lollini model in #tradein, so you can upgrade to a more modern, efficient and technologically advanced solution. 💪\n\nDon't miss this opportunity! Contact us now: https://lnkd.in/d9wYEUX5",
        "likes": "1",
        "time": {
          "raw": "2ay",
          "parsed": "12.01.2025",
          "isoString": "2025-01-12T05:04:39.365Z"
        },
        "mediaType": "image",
        "mediaContent": [
          "https://media.licdn.com/dms/image/v2/D4D10AQE_jhjXvp-fUQ/image-shrink_800/image-shrink_800/0/1736409647401?e=1742364000&v=beta&t=j9WcCARQpVlPWVRMN8-6ZMUsYSWwkr415aid8CF_Zvs"
        ],
        "date": "2025-01-12T05:04:39.365Z"
      },
      {
        "captions": "Happy new year from #GPSRecycling! 🎆\nWe are ready to welcome 2025 with #newchallenges, #innovations and many #projects.\n\nWe wish everyone a year full of satisfaction and great #results! 💥\n#Happy2025! 🎉🥂Happy new year from #GPSRecycling! 🎆\nWe are ready to welcome 2025 with #newchallenges, #innovations and many #projects.\n\nWe wish everyone a year full of satisfaction and great #results! 💥\n#Happy2025! 🎉🥂",
        "likes": "6",
        "time": {
          "raw": "2ay",
          "parsed": "12.01.2025",
          "isoString": "2025-01-12T05:04:39.366Z"
        },
        "mediaType": "image",
        "mediaContent": [
          "https://media.licdn.com/dms/image/v2/D4D10AQHGH5bc5XxcYA/image-shrink_800/image-shrink_800/0/1735718413176?e=1742364000&v=beta&t=SGSylRgqfb0W1etn4okrQbxzjUa7t8LGXeXGJ_zkEzQ"
        ],
        "date": "2025-01-12T05:04:39.366Z"
      },
      {
        "captions": "🎉 2024: Despite the difficulties, we continued to innovate and make important strides in the #industry. \n\n🔩 Birth of the #Destroyer - Our new, powerful, state-of-the-art winged #shearbaler that redefined the way we process scrap.\n\n🤝 Collaboration with Harris - This year we consolidated our partnership with Harris, becoming the only dealer with exclusivity for the US, Canada and Mexico.\n\n🎪 Participation in the #ISRI in Las Vegas - We brought our #leading-edge #technology to the ultimate international #recycling event.\n\n🌍 #ExpansionGlobal - We strengthened our presence around the world.\n\n🔧 Launch of the Predator 9.0 HS - The #biggest automobile logger ever created, designed to tackle the most complex challenges in the #recycling world.\n\nThank you all for supporting and accompanying us through this year.\n#GPSRECYRLING🎉 2024: Despite the difficulties, we continued to innovate and make important strides in the #industry. \n\n🔩 Birth of the #Destroyer - Our new, powerful, state-of-the-art winged #shearbaler that redefined the way we process scrap.\n\n🤝 Collaboration with Harris - This year we consolidated our partnership with Harris, becoming the only dealer with exclusivity for the US, Canada and Mexico.\n\n🎪 Participation in the #ISRI in Las Vegas - We brought our #leading-edge #technology to the ultimate international #recycling event.\n\n🌍 #ExpansionGlobal - We strengthened our presence around the world.\n\n🔧 Launch of the Predator 9.0 HS - The #biggest automobile logger ever created, designed to tackle the most complex challenges in the #recycling world.\n\nThank you all for supporting and accompanying us through this year.\n#GPSRECYRLING",
        "likes": "8",
        "time": {
          "raw": "2ay",
          "parsed": "12.01.2025",
          "isoString": "2025-01-12T05:04:39.368Z"
        },
        "mediaType": "image",
        "mediaContent": [
          "https://media.licdn.com/dms/image/v2/D4D10AQG372fxQshNfA/image-shrink_800/image-shrink_800/0/1735545637059?e=1742364000&v=beta&t=5mCU7P_ZgCfSHa7NcQljnlUZjz8AWYM9GXGfuQallMA"
        ],
        "date": "2025-01-12T05:04:39.368Z"
      },
      {
        "captions": "🎄 #Season’s Greetings from GPS Recycling! 🎄\n\nWe would like to wish all our customers, #partners and #collaborators peaceful #Holidays. \nThank you for choosing us and supporting us in our #growth and #innovation journey. \n\nHappy holidays to everyone! 🎁❄️🎄 #Season’s Greetings from GPS Recycling! 🎄\n\nWe would like to wish all our customers, #partners and #collaborators peaceful #Holidays. \nThank you for choosing us and supporting us in our #growth and #innovation journey. \n\nHappy holidays to everyone! 🎁❄️",
        "likes": "3",
        "time": {
          "raw": "2ay",
          "parsed": "05.01.2025",
          "isoString": "2025-01-05T10:28:07.777Z"
        },
        "mediaType": "image",
        "mediaContent": [
          "https://media.licdn.com/dms/image/v2/D4D10AQHB6bs4vFfTTw/image-shrink_800/image-shrink_800/0/1735113635976?e=1741777200&v=beta&t=1KRTZszLt9-BViUgH3P3je5mUpuK6KllNsrfJIXe8Gk"
        ],
        "date": "2025-01-05T10:28:07.777Z"
      },
      {
        "captions": "We proudly present #Predator9.0, the #biggest #elvrecycling #logger #carbaler ever made. Designed to tackle the recycling industry's toughest challenges, this machine combines #power, exceptional size and unprecedented \n#operating efficiency.\n\nIf your business needs #maximum #capacity and the best #performance, Predator 9.0 HS is the solution you've been waiting for.\n\n#gpsrecycling #innovation",
        "likes": "6",
        "time": {
          "raw": "2ay",
          "parsed": "05.01.2025",
          "isoString": "2025-01-05T10:28:07.779Z"
        },
        "mediaType": "video",
        "mediaContent": {
          "src": [
            {
              "src": "https://dms.licdn.com/playlist/vid/v2/D4D10AQFseu2Ryl2qwQ/mp4-640p-30fp-crf28/mp4-640p-30fp-crf28/0/1733990499185?e=1741777200&v=beta&t=2Ze8V-xM5baxAsbhb2259FN1-3bGJuE--5JrFk9g11M",
              "type": "video/mp4",
              "data-bitrate": 881889
            },
            {
              "src": "https://dms.licdn.com/playlist/vid/v2/D4D10AQFseu2Ryl2qwQ/mp4-360p-30fp-crf28/mp4-360p-30fp-crf28/0/1733990499297?e=1741777200&v=beta&t=buDT6-sMleg_VGswltH1UotX9D7aM167WWDbfAn5Lpo",
              "type": "video/mp4",
              "data-bitrate": 368812
            },
            {
              "src": "https://dms.licdn.com/playlist/vid/v2/D4D10AQFseu2Ryl2qwQ/mp4-720p-30fp-crf28/mp4-720p-30fp-crf28/0/1733990499091?e=1741777200&v=beta&t=7GQI04bbcUpwsNZ39DAgbepMmxQfFU6vvuPF5eNiXy8",
              "type": "video/mp4",
              "data-bitrate": 1165984
            }
          ],
          "posterUrl": "https://media.licdn.com/dms/image/v2/D4D10AQFseu2Ryl2qwQ/videocover-high/videocover-high/0/1733990495577?e=1741777200&v=beta&t=yvKUR2N_COsIaJqNrdSxvWgB1gKFbec58ELK2r3yf-k"
        },
        "date": "2025-01-05T10:28:07.779Z"
      },
      {
        "captions": "Our great #production #flexibility, combined with our knowledge of the industry and the daily challenges of scrap dealers, allows us to offer fully #customized solutions that greatly improve workflow.\n\nOur machines are designed to be fast, powerful and ensure an increase in your #profit margins, but they are not all the same!\n\nContact us today for a customized #pre-sales consultation and find out how we can help you optimize your operation! 🌍\n\n#gpsrecyclingOur great #production #flexibility, combined with our knowledge of the industry and the daily challenges of scrap dealers, allows us to offer fully #customized solutions that greatly improve workflow.\n\nOur machines are designed to be fast, powerful and ensure an increase in your #profit margins, but they are not all the same!\n\nContact us today for a customized #pre-sales consultation and find out how we can help you optimize your operation! 🌍\n\n#gpsrecycling",
        "likes": "2",
        "time": {
          "raw": "3ay",
          "parsed": "05.12.2024",
          "isoString": "2024-12-05T10:28:07.785Z"
        },
        "mediaType": "image",
        "mediaContent": [
          "https://media.licdn.com/dms/image/v2/D4D10AQFvGDLNx4I1tw/image-shrink_800/image-shrink_800/0/1733385619574?e=1741777200&v=beta&t=q6A-ZBV-zOeq_a9rXEVFHu0kRi7YAhGSKbun-Wm3N8Q"
        ],
        "date": "2024-12-05T10:28:07.785Z"
      },
      {
        "captions": "📢 Our Predator baler/loggers are ready to hit the road!\n\nWe have Predator machines ready for delivery to the US and Canada through our exclusive partners, Harris and Ely Enterprises, Inc Want to speed up your recycling process? The Predator is designed for maximum performance and unbeatable speed in processing scrap. 💪\n\n⌛ Quantities are limited! Don't wait - contact us today to lock in your machine!\n\n#Predator #GPSRecycling #ImmediateDelivery #Recycling #Productivity📢 Our Predator baler/loggers are ready to hit the road!\n\nWe have Predator machines ready for delivery to the US and Canada through our exclusive partners, Harris and Ely Enterprises, Inc Want to speed up your recycling process? The Predator is designed for maximum performance and unbeatable speed in processing scrap. 💪\n\n⌛ Quantities are limited! Don't wait - contact us today to lock in your machine!\n\n#Predator #GPSRecycling #ImmediateDelivery #Recycling #Productivity",
        "likes": "3",
        "shares": "1",
        "time": {
          "raw": "3ay",
          "parsed": "05.12.2024",
          "isoString": "2024-12-05T10:28:07.787Z"
        },
        "mediaType": "image",
        "mediaContent": [
          "https://media.licdn.com/dms/image/v2/D4D10AQHb1hLePDT7BQ/image-shrink_800/image-shrink_800/0/1732780809697?e=1741777200&v=beta&t=8Q3L2Swx4tEhvyHTTdUi_-0WAC1VZJWLs0LRiurkgSc"
        ],
        "date": "2024-12-05T10:28:07.787Z"
      },
      {
        "captions": "Guess the shear:\n- Equipped with a fast and extremely powerful cutting system\n- Continuous feeding\n- Not only powerful, but also compact\nDo you know which shear we are talking about? Share your answer in the comments! ⁣\n#gpsrecycling #guesstheshearGuess the shear:\n- Equipped with a fast and extremely powerful cutting system\n- Continuous feeding\n- Not only powerful, but also compact\nDo you know which shear we are talking about? Share your answer in the comments! ⁣\n#gpsrecycling #guesstheshear",
        "likes": "2",
        "time": {
          "raw": "3ay",
          "parsed": "05.12.2024",
          "isoString": "2024-12-05T10:28:07.789Z"
        },
        "mediaType": "image",
        "mediaContent": [
          "https://media.licdn.com/dms/image/v2/D4D10AQGI-fcP7PhJaQ/image-shrink_800/image-shrink_800/0/1732608068944?e=1741777200&v=beta&t=mR831YcJpyY9NrqMcqwkINN4vlvXjT6tcsPlkvNAKiM"
        ],
        "date": "2024-12-05T10:28:07.789Z"
      },
      {
        "captions": "🔧 Maximum power, minimum wait!\n\nThe Predator balers are ready for delivery thanks to our partnership with Harris and Ely Enterprises, Inc There are no waiting times: these machines are ready to go into action and improve your business. 💥\n\nIf you are looking for power and reliability, the Predator is the right choice for you. Write to us now for more information and to book your machine!\n\n#Predator #GPSRecycling #Power #ImmediateDelivery🔧 Maximum power, minimum wait!\n\nThe Predator balers are ready for delivery thanks to our partnership with Harris and Ely Enterprises, Inc There are no waiting times: these machines are ready to go into action and improve your business. 💥\n\nIf you are looking for power and reliability, the Predator is the right choice for you. Write to us now for more information and to book your machine!\n\n#Predator #GPSRecycling #Power #ImmediateDelivery",
        "likes": "5",
        "shares": "1",
        "time": {
          "raw": "3ay",
          "parsed": "05.12.2024",
          "isoString": "2024-12-05T10:28:07.792Z"
        },
        "mediaType": "image",
        "mediaContent": [
          "https://media.licdn.com/dms/image/v2/D4D10AQHTK66N_TReEw/image-shrink_800/image-shrink_800/0/1732176012463?e=1741777200&v=beta&t=vwPBP5TMl4uIJLFX5S_LHVFHxHaf1SING1hIHvASGQM"
        ],
        "date": "2024-12-05T10:28:07.792Z"
      },
      {
        "captions": "🔧Our commitment goes beyond sales: we listen carefully to our #customers' needs to offer customized solutions. Thanks to our global presence, we are ready to step in and provide #support in every corner of the world, ensuring that our customers' #machines operate at peak #performance. 🌍\n\nFor this reason, we are always looking for new #resellers to expand our network and bring our technology and support to anyone in need around the world.\n\nIf you are interested in a partnership please contact us:https://lnkd.in/d9wYEUX5\n\n#gpsrecycling🔧Our commitment goes beyond sales: we listen carefully to our #customers' needs to offer customized solutions. Thanks to our global presence, we are ready to step in and provide #support in every corner of the world, ensuring that our customers' #machines operate at peak #performance. 🌍\n\nFor this reason, we are always looking for new #resellers to expand our network and bring our technology and support to anyone in need around the world.\n\nIf you are interested in a partnership please contact us:https://lnkd.in/d9wYEUX5\n\n#gpsrecycling",
        "likes": "3",
        "time": {
          "raw": "3ay",
          "parsed": "05.12.2024",
          "isoString": "2024-12-05T10:28:07.794Z"
        },
        "mediaType": "image",
        "mediaContent": [
          "https://media.licdn.com/dms/image/v2/D5610AQGSn6vY60X2gA/image-shrink_800/image-shrink_800/0/1732003218289?e=1741777200&v=beta&t=iVKSMqO5D6feEvu9tU0iw0I-FZq9ybUO_8X7tjqkHiI"
        ],
        "date": "2024-12-05T10:28:07.794Z"
      },
      {
        "captions": "🤔 What are G.P.S. Great Scrap Processing Solutions, Harris  and Ely Enterprises, Inc doing together? It sounds like the beginning of a joke, but it's pure reality!\n\n😄 There is an Italian (GPS), an American (Harris), and another American (Ely)... together they bring the Predator ready for delivery to the United States and Canada, ready to revolutionize the world of recycling! 💥\nThis is no joke, this is your next chance to get the Predator baler/logger in your yard right away. \n\nContact us now!\n📦 Stock is running low!\n\n#Predator #GPSRecycling #ReadyToShip #Efficiency🤔 What are G.P.S. Great Scrap Processing Solutions, Harris  and Ely Enterprises, Inc doing together? It sounds like the beginning of a joke, but it's pure reality!\n\n😄 There is an Italian (GPS), an American (Harris), and another American (Ely)... together they bring the Predator ready for delivery to the United States and Canada, ready to revolutionize the world of recycling! 💥\nThis is no joke, this is your next chance to get the Predator baler/logger in your yard right away. \n\nContact us now!\n📦 Stock is running low!\n\n#Predator #GPSRecycling #ReadyToShip #Efficiency",
        "likes": "5",
        "shares": "1",
        "time": {
          "raw": "3ay",
          "parsed": "05.12.2024",
          "isoString": "2024-12-05T10:28:07.795Z"
        },
        "mediaType": "image",
        "mediaContent": [
          "https://media.licdn.com/dms/image/v2/D5610AQGDsj8Y4Zs_7w/image-shrink_800/image-shrink_800/0/1731571222124?e=1741777200&v=beta&t=c5eJYio58OQJVN6DSViOBdVTnar-Y8iCdccBKwX8v3g"
        ],
        "date": "2024-12-05T10:28:07.795Z"
      },
      {
        "captions": "In the world of #automobileloggers, there is only one leading machine. GPS's #Predator is the most imitated machine on the market, but no copy can come close to its performance in terms of #power, #reliability and #innovation.\nThe Predator was born to make a difference, and it proves it to you every day.\nWhy choose an imitation when you can have the top technology for #scrap treatment? \n\nFind out what makes it unique: https://lnkd.in/g6unxs5gIn the world of #automobileloggers, there is only one leading machine. GPS's #Predator is the most imitated machine on the market, but no copy can come close to its performance in terms of #power, #reliability and #innovation.\nThe Predator was born to make a difference, and it proves it to you every day.\nWhy choose an imitation when you can have the top technology for #scrap treatment? \n\nFind out what makes it unique: https://lnkd.in/g6unxs5g",
        "likes": "6",
        "shares": "3",
        "time": {
          "raw": "3ay",
          "parsed": "05.12.2024",
          "isoString": "2024-12-05T10:28:07.796Z"
        },
        "mediaType": "image",
        "mediaContent": [
          "https://media.licdn.com/dms/image/v2/D4D10AQEGSq4mOnb_tA/image-shrink_800/image-shrink_800/0/1731398406811?e=1741777200&v=beta&t=G6kQNVBRsldSLtJsS8_BcY18d2PLfwbj9Me0gFQiBys"
        ],
        "date": "2024-12-05T10:28:07.796Z"
      },
      {
        "captions": "🧮 Harris + Ely Enterprises, Inc + G.P.S. Great Scrap Processing Solutions = your new Predator ready for delivery to the US and Canada!\n\nWhen the power of the Predator meets the right partners, the equation is simple: maximum efficiency and minimum delivery times.\n\nThis is the winning formula for your scrap yard.🚀\n💪 The Predator, the most powerful scrap baler on the market, is ready to go into action without waiting times!\n\nDon't wait, contact us now! 🚀\n\n#Predator #GPSRecycling #ReadyToShip #Efficiency #Recycling🧮 Harris + Ely Enterprises, Inc + G.P.S. Great Scrap Processing Solutions = your new Predator ready for delivery to the US and Canada!\n\nWhen the power of the Predator meets the right partners, the equation is simple: maximum efficiency and minimum delivery times.\n\nThis is the winning formula for your scrap yard.🚀\n💪 The Predator, the most powerful scrap baler on the market, is ready to go into action without waiting times!\n\nDon't wait, contact us now! 🚀\n\n#Predator #GPSRecycling #ReadyToShip #Efficiency #Recycling",
        "likes": "6",
        "time": {
          "raw": "3ay",
          "parsed": "05.12.2024",
          "isoString": "2024-12-05T10:28:07.798Z"
        },
        "mediaType": "image",
        "mediaContent": [
          "https://media.licdn.com/dms/image/v2/D5622AQGPOmlH7jOhqg/feedshare-shrink_800/feedshare-shrink_800/0/1730974771950?e=1744243200&v=beta&t=ssmaTDThCAdJnjV1hNUEFSch4HRQWHwTgQ1nTHU-GCc",
          "https://static.licdn.com/aero-v1/sc/h/dur0ryw0e9uscxa9b6zqvgvfs"
        ],
        "date": "2024-12-05T10:28:07.798Z"
      },
      {
        "captions": "📢 We are looking for new GPS agents and dealers in the world! 🌍\n#GPSRecycling is looking for qualified resellers to expand its global network and provide more #service to its #customers.\nWhy become a #GPS reseller?\n\n✅ Represent state-of-the-art, top-quality machines.\n✅ Dedicated sales and technical support\n✅ Be part of a successful global network\n\nIf you have a business in the #recycling industry and are interested, contact us now for more information! 🌟\n#business #partnership📢 We are looking for new GPS agents and dealers in the world! 🌍\n#GPSRecycling is looking for qualified resellers to expand its global network and provide more #service to its #customers.\nWhy become a #GPS reseller?\n\n✅ Represent state-of-the-art, top-quality machines.\n✅ Dedicated sales and technical support\n✅ Be part of a successful global network\n\nIf you have a business in the #recycling industry and are interested, contact us now for more information! 🌟\n#business #partnership",
        "likes": "3",
        "time": {
          "raw": "3ay",
          "parsed": "05.12.2024",
          "isoString": "2024-12-05T10:28:07.799Z"
        },
        "mediaType": "image",
        "mediaContent": [
          "https://media.licdn.com/dms/image/v2/D4D10AQHg34dvRdyjdg/image-shrink_800/image-shrink_800/0/1730880011591?e=1741777200&v=beta&t=1nFIS4DJialSuDHk_v0YA-GqxTbsx23cz1yl7hVDH4A"
        ],
        "date": "2024-12-05T10:28:07.799Z"
      },
      {
        "captions": "💥 DEFECTIVE CANS? NEVER A PROBLEM AGAIN! 💥\nOut-of-standard cans of tomatoes, legumes, preserved foods or beverage cans don't have to slow you down. \n\nWith the automatic balers:\n\n-You press the defective cans with the contents.\n-You separate the product from the can in one process.\n-You recover 100 percent of the material for #recycling.\n\nResult? More speed, zero #waste and optimized costs.\n🔗 Find out how to revolutionize your waste management: https://lnkd.in/dRFdd7rW💥 DEFECTIVE CANS? NEVER A PROBLEM AGAIN! 💥\nOut-of-standard cans of tomatoes, legumes, preserved foods or beverage cans don't have to slow you down. \n\nWith the automatic balers:\n\n-You press the defective cans with the contents.\n-You separate the product from the can in one process.\n-You recover 100 percent of the material for #recycling.\n\nResult? More speed, zero #waste and optimized costs.\n🔗 Find out how to revolutionize your waste management: https://lnkd.in/dRFdd7rW",
        "likes": "1",
        "time": {
          "raw": "5g",
          "parsed": "07.03.2025",
          "isoString": "2025-03-07T05:04:39.355Z"
        },
        "mediaType": "image",
        "mediaContent": [
          "https://media.licdn.com/dms/image/v2/D4D10AQEH3wNhQGtQUw/image-shrink_800/B4DZVqeEU5GkAg-/0/1741248022840?e=1742364000&v=beta&t=MxMaVxaE0u_gX1GLluZmR04Tj1OTWlnQ1gckNg9byfc"
        ],
        "date": "2025-03-07T05:04:39.355Z"
      }
    ]
  },
  {
    "name": "EcotecnicaEurope",
    "followerData": [
      [
        20250225,
        73
      ],
      [
        20250225,
        73
      ],
      [
        20250225,
        73
      ],
      [
        20250228,
        73
      ],
      [
        20250228,
        73
      ],
      [
        20250228,
        73
      ],
      [
        20250228,
        73
      ],
      [
        20250303,
        73
      ],
      [
        1741011613279,
        "73"
      ],
      [
        1741076603237,
        "73"
      ],
      [
        1741077745262,
        "73"
      ],
      [
        1741083723722,
        "73"
      ],
      [
        1741084733896,
        "73"
      ],
      [
        1741170501064,
        73
      ],
      [
        1741755892028,
        75
      ]
    ],
    "data": [
      {
        "captions": "Se stai valutando l’acquisto di una pressa cesoia, l’opzione usata potrebbe rivelarsi una scelta strategica per ridurre i costi mantenendo alte prestazioni.\n\nNel nostro ultimo articolo, ti guidiamo alla scoperta dei vantaggi di scegliere una pressa cesoia usata e diamo alcuni consigli utili per orientare al meglio la tua decisione.\n\n👉 Leggi l'articolo completo  e scopri come fare la scelta giusta per la tua azienda!\nhttps://lnkd.in/dU8aza8J\n\n#autodemolizione #riciclometalli #endoflifevehicles #rottamazione #recycling #autodesguace #scrapmetal #reutilización #economiacircolare #autorecycling #reciclajedeautosSe stai valutando l’acquisto di una pressa cesoia, l’opzione usata potrebbe rivelarsi una scelta strategica per ridurre i costi mantenendo alte prestazioni.\n\nNel nostro ultimo articolo, ti guidiamo alla scoperta dei vantaggi di scegliere una pressa cesoia usata e diamo alcuni consigli utili per orientare al meglio la tua decisione.\n\n👉 Leggi l'articolo completo  e scopri come fare la scelta giusta per la tua azienda!\nhttps://lnkd.in/dU8aza8J\n\n#autodemolizione #riciclometalli #endoflifevehicles #rottamazione #recycling #autodesguace #scrapmetal #reutilización #economiacircolare #autorecycling #reciclajedeautos",
        "likes": "3",
        "time": {
          "raw": "4ay",
          "parsed": "12.11.2024",
          "isoString": "2024-11-12T05:04:51.782Z"
        },
        "mediaType": "image",
        "mediaContent": [
          "https://media.licdn.com/dms/image/v2/D4D22AQEEhTUHUKcXig/feedshare-shrink_2048_1536/feedshare-shrink_2048_1536/0/1728897657880?e=1744848000&v=beta&t=M9pkFbN9HVIzNRXSfGcSBPYWvtW2-0lr48oQ0fQoJyA"
        ],
        "date": "2024-11-12T05:04:51.782Z"
      },
      {
        "captions": "✨Nuovo Regolamento europeo in arrivo: siglata intesa tra Italia, Spagna e Portogallo\nA preoccupare tutto il comparto è l’introduzione di standard troppo alti, come il recupero dell’85% delle componenti dei veicoli a fine vita.\n\nLeggi di più⬇️\nhttps://lnkd.in/dmEaDNGw\n\n#ecotecnicaeurope #vehiclerecycling #endoflifevehicles #sustainableautorecovery #autodemolitori✨Nuovo Regolamento europeo in arrivo: siglata intesa tra Italia, Spagna e Portogallo\nA preoccupare tutto il comparto è l’introduzione di standard troppo alti, come il recupero dell’85% delle componenti dei veicoli a fine vita.\n\nLeggi di più⬇️\nhttps://lnkd.in/dmEaDNGw\n\n#ecotecnicaeurope #vehiclerecycling #endoflifevehicles #sustainableautorecovery #autodemolitori",
        "time": {
          "raw": "7ay",
          "parsed": "12.08.2024",
          "isoString": "2024-08-12T05:04:51.783Z"
        },
        "mediaType": "image",
        "mediaContent": [
          "https://media.licdn.com/dms/image/v2/D4D22AQEVCiDFDZz3Jw/feedshare-shrink_2048_1536/feedshare-shrink_2048_1536/0/1723024319353?e=1744848000&v=beta&t=UCAMNdBTUIZSV0DM6Uy8zqojU7BpIKQrQWvMP6I7e30"
        ],
        "date": "2024-08-12T05:04:51.783Z"
      },
      {
        "captions": "❗ ❗  WE ARE COMING 🎉🥂 😎  Ora si va al caldo Katana 389 in partenza per l’Arabia Saudita Ora si va al caldo Katana 389 in partenza per l’Arabia Saudita",
        "time": {
          "raw": "8ay8ay",
          "parsed": "12.03.2025",
          "isoString": "2025-03-12T05:04:51.785Z"
        },
        "mediaType": "image",
        "mediaContent": [
          "https://media.licdn.com/dms/image/v2/D4D22AQHFBclBIrf0gw/feedshare-shrink_800/feedshare-shrink_800/0/1719595179270?e=1744848000&v=beta&t=nV1CbyISMUBTHMnk9kR0GvRrfvO5PK2IgsmluA2y5rQ",
          "https://media.licdn.com/dms/image/v2/D4D22AQFevLVQYUxJnw/feedshare-shrink_800/feedshare-shrink_800/0/1719595180247?e=1744848000&v=beta&t=SOP9wJQrt1FP5eGgRpTmHKu0i4TOHl47CgNAffmrMSQ",
          "https://media.licdn.com/dms/image/v2/D4D22AQGk9Mfxc_ZgnA/feedshare-shrink_800/feedshare-shrink_800/0/1719595180133?e=1744848000&v=beta&t=43NA5hWICclyhYdySM8x3WyFj065Eq1RApDzfPDtHX0",
          "https://media.licdn.com/dms/image/v2/D4D22AQFQc7232kzD7g/feedshare-shrink_800/feedshare-shrink_800/0/1719595170541?e=1744848000&v=beta&t=fxutAHzHzSHbWF2NvySlYvooXn8e0vmgFTJmUCfduLI"
        ],
        "date": "2025-03-12T05:04:51.785Z"
      },
      {
        "captions": "Ora si va al caldo Katana 389 in partenza per l’Arabia Saudita Ora si va al caldo Katana 389 in partenza per l’Arabia Saudita",
        "time": {
          "raw": "8ay",
          "parsed": "12.07.2024",
          "isoString": "2024-07-12T05:04:51.786Z"
        },
        "mediaType": "image",
        "mediaContent": [
          "https://media.licdn.com/dms/image/v2/D4D22AQHFBclBIrf0gw/feedshare-shrink_800/feedshare-shrink_800/0/1719595179270?e=1744848000&v=beta&t=nV1CbyISMUBTHMnk9kR0GvRrfvO5PK2IgsmluA2y5rQ",
          "https://media.licdn.com/dms/image/v2/D4D22AQFevLVQYUxJnw/feedshare-shrink_800/feedshare-shrink_800/0/1719595180247?e=1744848000&v=beta&t=SOP9wJQrt1FP5eGgRpTmHKu0i4TOHl47CgNAffmrMSQ",
          "https://media.licdn.com/dms/image/v2/D4D22AQGk9Mfxc_ZgnA/feedshare-shrink_800/feedshare-shrink_800/0/1719595180133?e=1744848000&v=beta&t=43NA5hWICclyhYdySM8x3WyFj065Eq1RApDzfPDtHX0",
          "https://media.licdn.com/dms/image/v2/D4D22AQFQc7232kzD7g/feedshare-shrink_800/feedshare-shrink_800/0/1719595170541?e=1744848000&v=beta&t=fxutAHzHzSHbWF2NvySlYvooXn8e0vmgFTJmUCfduLI"
        ],
        "date": "2024-07-12T05:04:51.786Z"
      },
      {
        "captions": "⚠️Tax credit per investimenti nella ZES Unica mezzogiorno\nDal 12 giugno al 12 luglio 2024, le imprese possono richiedere il credito d'imposta per investimenti realizzati o da realizzare nel 2024 nella Zona Economica Speciale (ZES) unica per il Mezzogiorno. \n\nPossono accedere al tax credit tutte le imprese con sede nelle regioni interessate (Abruzzo, Basilicata, Calabria, Campania, Molise, Puglia, Sicilia, Sardegna), indipendentemente dalla forma giuridica e dal regime contabile.\n\nLeggi qui 👇\nhttps://lnkd.in/dwCecRzm\n\n#zesunica #agevolazionifiscali #creditodimposta #suditalia #bandi #bandisud\n#EcoSustainability #autodemolitori #scrapcar #scraprecycling",
        "likes": "1",
        "comments": "1",
        "time": {
          "raw": "9ay",
          "parsed": "12.06.2024",
          "isoString": "2024-06-12T05:04:51.787Z"
        },
        "mediaType": "other",
        "date": "2024-06-12T05:04:51.787Z"
      },
      {
        "captions": "📢Siamo entusiasti di condividere con voi la nostra partecipazione a IFAT worldwide 2024, la fiera leader mondiale per le tecnologie ambientali e il trattamento delle acque. \n\n📍 Ci trovate allo STAND 220 – HALL B4 fino al 17 maggio\n\n------------------------------------------------------------------------------------\n#exhibition #stand #IFAT #IFATworldwide #IFATMunich #innovation #sustainability #umwelttechnologie #environmentaltechnologies #metals #recycling #circulareconomy #vehiclerecycling #scrapcar #scrap #scraprecycling\n #carrecycling #carrecycler #carwreckers\n📢Siamo entusiasti di condividere con voi la nostra partecipazione a IFAT worldwide 2024, la fiera leader mondiale per le tecnologie ambientali e il trattamento delle acque. \n\n📍 Ci trovate allo STAND 220 – HALL B4 fino al 17 maggio\n\n------------------------------------------------------------------------------------\n#exhibition #stand #IFAT #IFATworldwide #IFATMunich #innovation #sustainability #umwelttechnologie #environmentaltechnologies #metals #recycling #circulareconomy #vehiclerecycling #scrapcar #scrap #scraprecycling\n #carrecycling #carrecycler #carwreckers",
        "likes": "3",
        "shares": "1",
        "time": {
          "raw": "10ay",
          "parsed": "12.05.2024",
          "isoString": "2024-05-12T05:04:51.788Z"
        },
        "mediaType": "image",
        "mediaContent": [
          "https://media.licdn.com/dms/image/v2/D4D22AQGY7VCmPny4Ng/feedshare-shrink_800/feedshare-shrink_800/0/1715768037367?e=1744848000&v=beta&t=VwY4I0T-1jzvlGqTc2t9dA1raIWP1O9onkecfhnstZ8"
        ],
        "date": "2024-05-12T05:04:51.788Z"
      },
      {
        "captions": "📢 Ricorda di visitare lo stand di Ecotecnica Europe alla fiera IFAT worldwide di Monaco! Dal 13 al 17 maggio, scopri le nostre soluzioni innovative nel settore del riciclo e dell'ambiente. \n\nTi aspettiamo allo Stand B4/220 per conoscere le nostre ultime novità! 🌍♻️\n-------------------------------------------------------------------------------------\n\n 📢 Don't forget to visit Ecotecnica Europe's booth at IFAT Munich! From May 13th to 17th, discover our innovative solutions in recycling and environmental technology. \n\nFind us at Stand B4/220 to learn about our latest developments! 🌍♻️\n\n #IFATMunich #EcotecnicaEurope #recycling #environment #riciclo #ambiente #metalliferrosi #autodemolizioni\n\nhttps://lnkd.in/dx4HtZQD",
        "likes": "4",
        "time": {
          "raw": "10ay",
          "parsed": "12.05.2024",
          "isoString": "2024-05-12T05:04:51.789Z"
        },
        "mediaType": "other",
        "date": "2024-05-12T05:04:51.789Z"
      },
      {
        "captions": "𝗜𝗻𝗱𝘂𝘀𝘁𝗿𝗶𝗮 𝟱.𝟬: 𝗰𝗼𝗺𝗲 𝗳𝘂𝗻𝘇𝗶𝗼𝗻𝗮, 𝗰𝗵𝗶 𝗽𝘂ò 𝗳𝗮𝗿𝗻𝗲 𝗿𝗶𝗰𝗵𝗶𝗲𝘀𝘁𝗮 𝗲 𝗰𝗼𝗺𝗲 𝗰𝗮𝗹𝗰𝗼𝗹𝗮𝗿𝗲 𝗹𝗮 𝗿𝗶𝗱𝘂𝘇𝗶𝗼𝗻𝗲 𝗱𝗲𝗶 𝗰𝗼𝗻𝘀𝘂𝗺𝗶\n\nIl settore delle autodemolizioni si trova di fronte a una trasformazione radicale, guidata dall’innovazione tecnologica e dalla ♻️sostenibilità ambientale.\n\nEcotecnica Europe, leader nel settore, emerge come un fornitore all’avanguardia di presse progettate per integrarsi perfettamente con le nuove esigenze del settore autodemolizioni.\n\nI nostri macchinari, infatti, non solo migliorano l’efficienza operativa, ma contribuiscono a diminuire i consumi energetici in linea con gli obiettivi di sostenibilità propri dell’Industria 5.0.\n\nLeggi l'articolo⬇️\nhttps://lnkd.in/dyDjz97t\n\n#macchinariIndustriali #demolizioneVeicoli #maquinariaIndustrial #desguaceautomotriz #industrialMachinery #vehicledemolition #scrapmetal #scrapyard #industria50",
        "likes": "1",
        "time": {
          "raw": "11ay",
          "parsed": "12.04.2024",
          "isoString": "2024-04-12T05:04:51.790Z"
        },
        "mediaType": "other",
        "date": "2024-04-12T05:04:51.790Z"
      },
      {
        "captions": "Anche quest’anno Ecotecnica Europe rinnova la sua presenza alla fiera IFAT worldwide di Monaco, in programma dal 13 al 17 maggio 2024 presso il centro fieristico di Monaco.\n▶️STAND 220/HALL B4\n\nhttps://lnkd.in/dx4HtZQD\n\n#IFAT #riciclo #materialiferrosi #autodemolizioni #wastereduction #circulareconomy #innovation #sustainability #ferrousrecycling",
        "likes": "7",
        "comments": "1",
        "shares": "2",
        "time": {
          "raw": "11ay",
          "parsed": "12.04.2024",
          "isoString": "2024-04-12T05:04:51.791Z"
        },
        "mediaType": "other",
        "date": "2024-04-12T05:04:51.791Z"
      }
    ]
  },
  {
    "name": "Taurus",
    "followerData": [
      [
        20250213,
        1228
      ],
      [
        20250225,
        1247
      ],
      [
        20250225,
        1247
      ],
      [
        20250225,
        1247
      ],
      [
        20250228,
        1248
      ],
      [
        20250228,
        1248
      ],
      [
        20250228,
        1248
      ],
      [
        20250228,
        1248
      ],
      [
        20250303,
        1254
      ],
      [
        1741011634713,
        "1.254"
      ],
      [
        1741076616031,
        "1.255"
      ],
      [
        1741077759291,
        "1.255"
      ],
      [
        1741083737878,
        "1.255"
      ],
      [
        1741084752045,
        "1.255"
      ],
      [
        1741170518546,
        1256
      ],
      [
        1741755905834,
        1266
      ]
    ],
    "data": [
      {
        "captions": "TAURUS BLULINE SHEAR BALER\nT 1300\nAlways a step ahead!\n.\nFor more info:\ninfo@taurusweb.it\nwww.taurusweb.it\n\n#Taurus #shearbaler #pressa #pressacesoia #presse #pressecisaille #cisaille #prensa #compactadora #chatarras #chatarreria #sucata #scrap #scrapyard #Scrapmachine #scrapequipment #recycling #recyclingequipment #HeavyDuty #heavyequipment #heavymachine #rottame #madeinitaly TAURUS BLULINE SHEAR BALER\nT 1300\nAlways a step ahead!\n.\nFor more info:\ninfo@taurusweb.it\nwww.taurusweb.it\n\n#Taurus #shearbaler #pressa #pressacesoia #presse #pressecisaille #cisaille #prensa #compactadora #chatarras #chatarreria #sucata #scrap #scrapyard #Scrapmachine #scrapequipment #recycling #recyclingequipment #HeavyDuty #heavyequipment #heavymachine #rottame #madeinitaly",
        "likes": "27",
        "comments": "1",
        "shares": "2",
        "time": {
          "raw": "2h",
          "parsed": "26.02.2025",
          "isoString": "2025-02-26T05:05:05.606Z"
        },
        "mediaType": "image",
        "mediaContent": [
          "https://media.licdn.com/dms/image/v2/D4E22AQHrnGEJrjxgFA/feedshare-shrink_800/B4EZU.EsYaHMAg-/0/1740503173435?e=1744848000&v=beta&t=21ElZVEmaw8xjtAJz7W4bC22ElDkFP0YMtc1LXSAG4U"
        ],
        "date": "2025-02-26T05:05:05.606Z"
      },
      {
        "captions": "TAURUS INCLINED SHEAR TR\nThe NeverEnding Shear...\nFor more info:\ninfo@taurusweb.it\nwww.taurusweb.it\n\n#inclinedshear #Taurus #neverending #continousfeeding #shear #shearbaler #cisalleincliné #cisaille #reffaille #scrap #recycling #cesoia #rottame #cesoiainclinata #alimentazionecontinua #cizalla #cizallainclinada #cisalhamentoinclinado #sucata #chatarra #scrapyard #MadeInItaly",
        "likes": "26",
        "shares": "3",
        "time": {
          "raw": "2h",
          "parsed": "26.02.2025",
          "isoString": "2025-02-26T05:05:05.609Z"
        },
        "mediaType": "video",
        "mediaContent": {
          "src": [
            {
              "src": "https://dms.licdn.com/playlist/vid/v2/D4D05AQF4TRuSqgzU6A/mp4-640p-30fp-crf28/B4DZUitGFQHIBc-/0/1740044015092?e=1742364000&v=beta&t=hVtUr7z260_YwBgHzfmMioGKeuyA5pZj-dkkkyPZjHs",
              "type": "video/mp4",
              "data-bitrate": 586050
            }
          ],
          "posterUrl": "https://media.licdn.com/dms/image/v2/D4D05AQF4TRuSqgzU6A/videocover-high/B4DZUitGFQHIBs-/0/1740044008670?e=1742364000&v=beta&t=AuY26GkeWk8V8EUie0jfXNzIyIqqkYKopce1wfiviYo"
        },
        "date": "2025-02-26T05:05:05.609Z"
      },
      {
        "captions": "TAURUS SHEAR BALER ELLE (loading - unloading)\nShearing force t 1000\nDiscover more:\nhttps://lnkd.in/dDe3xUQA\n.\nFor more info:\ninfo@taurusweb.it\nwww.taurusweb.it\n\n#Taurus #shearbaler #Loading #unloading #liftingjacks #recycling #scrapyard #recyclingequipment #scrapunit #madeinitaly #recyclingtechnology #CircularEconomy #transportableshear #cisailletransportable #cisaille #presse #Recyclage #Ferrailleur #ferraille #compactadora #prensa #cizalla #sucata #sucateiro  TAURUS SHEAR BALER ELLE (loading - unloading)\nShearing force t 1000\nDiscover more:\nhttps://lnkd.in/dDe3xUQA\n.\nFor more info:\ninfo@taurusweb.it\nwww.taurusweb.it\n\n#Taurus #shearbaler #Loading #unloading #liftingjacks #recycling #scrapyard #recyclingequipment #scrapunit #madeinitaly #recyclingtechnology #CircularEconomy #transportableshear #cisailletransportable #cisaille #presse #Recyclage #Ferrailleur #ferraille #compactadora #prensa #cizalla #sucata #sucateiro",
        "likes": "23",
        "shares": "2",
        "time": {
          "raw": "3h",
          "parsed": "19.02.2025",
          "isoString": "2025-02-19T05:05:05.611Z"
        },
        "mediaType": "image",
        "mediaContent": [
          "https://media.licdn.com/dms/image/v2/D4D22AQGsVcevffXIIg/feedshare-shrink_800/B4DZUZyA0gGcAk-/0/1739894296515?e=1744848000&v=beta&t=KWmrFWR80HBpPV4X4XF5S0QSnmDN82I1uV8fJBxDrAw"
        ],
        "date": "2025-02-19T05:05:05.611Z"
      },
      {
        "captions": "The new TAURUS brochure is online,\nVisit our website:\nhttps://lnkd.in/dcqvQwwE\n.\nTAURUS, Always a step ahead!\n\n#Taurus #brochure2025 #production #redline #BluLine #BlackLine #shears #shearbaler #inclinedshear #hammermill #pressecisaille #preshredder #pré-broyeur #broyeur #premacinatore #mulinomartelli #pressacesoia #pressa #cesoiainclinata #cisailleincliné #scrapequipment #scrapunit #scrap #Ferrailleur #ferraille #scrapyard #chatarras #compactadora #sucata #sucateiroThe new TAURUS brochure is online,\nVisit our website:\nhttps://lnkd.in/dcqvQwwE\n.\nTAURUS, Always a step ahead!\n\n#Taurus #brochure2025 #production #redline #BluLine #BlackLine #shears #shearbaler #inclinedshear #hammermill #pressecisaille #preshredder #pré-broyeur #broyeur #premacinatore #mulinomartelli #pressacesoia #pressa #cesoiainclinata #cisailleincliné #scrapequipment #scrapunit #scrap #Ferrailleur #ferraille #scrapyard #chatarras #compactadora #sucata #sucateiro",
        "likes": "12",
        "shares": "4",
        "time": {
          "raw": "3h",
          "parsed": "19.02.2025",
          "isoString": "2025-02-19T05:05:05.614Z"
        },
        "mediaType": "image",
        "mediaContent": [
          "https://media.licdn.com/dms/image/v2/D4D22AQGCwF2hJEQtrg/feedshare-shrink_800/B4DZT_yAjPHAAk-/0/1739458088733?e=1744848000&v=beta&t=_OwFsoG2GMVIMUxwoEE-BoDQIjjd4wAzLh1YEOsvpz4"
        ],
        "date": "2025-02-19T05:05:05.614Z"
      },
      {
        "captions": "TR: THE TAURUS INCLINE SHEAR\nshearing force up to 1800 t\ninstalled power up to 950 kw\nhttps://lnkd.in/dXtfMU-m\n.\nFor more info:\ninfo@taurusweb.it\nwww.taurusweb.it\n#tr #Taurus #inclinedshear #shears #scrap #cesoiainclinata #cesoia #rottame #recycling #Ferrailleur #compactadora #cizalla #pressecisaille #presse #guillotines #Recyclage #Ferrailleur #sucata #sucateros #chatarra #prensa #scrapyard #madeinitaly #scrapunit #Scrapmachine #scrapequipment TR: THE TAURUS INCLINE SHEAR\nshearing force up to 1800 t\ninstalled power up to 950 kw\nhttps://lnkd.in/dXtfMU-m\n.\nFor more info:\ninfo@taurusweb.it\nwww.taurusweb.it\n#tr #Taurus #inclinedshear #shears #scrap #cesoiainclinata #cesoia #rottame #recycling #Ferrailleur #compactadora #cizalla #pressecisaille #presse #guillotines #Recyclage #Ferrailleur #sucata #sucateros #chatarra #prensa #scrapyard #madeinitaly #scrapunit #Scrapmachine #scrapequipment",
        "likes": "29",
        "comments": "1",
        "shares": "1",
        "time": {
          "raw": "4h",
          "parsed": "12.02.2025",
          "isoString": "2025-02-12T05:05:05.616Z"
        },
        "mediaType": "image",
        "mediaContent": [
          "https://media.licdn.com/dms/image/v2/D4D22AQEgkSnzcSYa6w/feedshare-shrink_800/B4DZT1YQSDHwAo-/0/1739283564181?e=1744848000&v=beta&t=rO1TaZExpXEMTgiixU8D5xf7SKqOLDGM1951ACFKq94"
        ],
        "date": "2025-02-12T05:05:05.616Z"
      },
      {
        "captions": "TAURUS shear baler QUATTRO\nT 1400\n.\nFor more info:\nInfo@taurusweb.it\nwww.taurusweb.it\n\n #taurus #shearbaler #4x4 #pressacesoia #prensa #compactadora #cisaille #presse\n #ferraille #sucata #chatarra #rottame #scrap #scrapmachine #recycling #scrapequipment #recyclingtechnic #madeinitalyTAURUS shear baler QUATTRO\nT 1400\n.\nFor more info:\nInfo@taurusweb.it\nwww.taurusweb.it\n\n #taurus #shearbaler #4x4 #pressacesoia #prensa #compactadora #cisaille #presse\n #ferraille #sucata #chatarra #rottame #scrap #scrapmachine #recycling #scrapequipment #recyclingtechnic #madeinitaly",
        "likes": "25",
        "shares": "2",
        "time": {
          "raw": "1ay",
          "parsed": "12.02.2025",
          "isoString": "2025-02-12T05:05:05.618Z"
        },
        "mediaType": "image",
        "mediaContent": [
          "https://media.licdn.com/dms/image/v2/D4D22AQH-62tOYBwdsw/feedshare-shrink_800/B4DZTWuhzcH0Ag-/0/1738769310326?e=1744848000&v=beta&t=DFUvQUgtgjXb3flLGRpUtSA3xieFyj9kuDT1sxpOCjA"
        ],
        "date": "2025-02-12T05:05:05.618Z"
      },
      {
        "captions": "A TAURUS SECOND HAND MACHINE\nCutting force T 700\nBox length mm 6000\nCylinder per wing n.2\nElectric motor\n.\nFor more info:\ninfo@taurusweb.it\nwww.taurusweb.it\n#Taurus #shearbaler #secondhand #used #usedmachines #diesel #RecyclingTech #recyclingequipment #recyclingmachine #Scrapmachine #scrap #scrapunit #scrapyard #pressacesoia #cesoia #pressa #rottamepesante #rottame #raccolta #chatarra #sucata #compactadora #fierrosargentinos #fierros #prensa #Ferrailleur #ferraille #Presse  #cisailleA TAURUS SECOND HAND MACHINE\nCutting force T 700\nBox length mm 6000\nCylinder per wing n.2\nElectric motor\n.\nFor more info:\ninfo@taurusweb.it\nwww.taurusweb.it\n#Taurus #shearbaler #secondhand #used #usedmachines #diesel #RecyclingTech #recyclingequipment #recyclingmachine #Scrapmachine #scrap #scrapunit #scrapyard #pressacesoia #cesoia #pressa #rottamepesante #rottame #raccolta #chatarra #sucata #compactadora #fierrosargentinos #fierros #prensa #Ferrailleur #ferraille #Presse  #cisaille",
        "likes": "29",
        "comments": "1",
        "shares": "5",
        "time": {
          "raw": "1ay",
          "parsed": "12.02.2025",
          "isoString": "2025-02-12T05:05:05.620Z"
        },
        "mediaType": "image",
        "mediaContent": [
          "https://media.licdn.com/dms/image/v2/D4D22AQGK34sS9bzb_w/feedshare-shrink_800/B4DZS9GYMpGkAg-/0/1738339354429?e=1744848000&v=beta&t=5_tDZa8JpsI12wVM7HXJieNMsAH7kPS0N0Yhl2z7mGk"
        ],
        "date": "2025-02-12T05:05:05.620Z"
      },
      {
        "captions": "Il nuovo Consiglio d'Amministrazione TAURUS 2025. \nGiovanni Colombo, Chiara Di Montegnacco Colombo e Marta Colombo. \nPresidente Onorario Peter Beyeler perché anche grazie a lui le presse cesoie TAURUS sono le migliori!\nTAURUS, Always a step ahead!\n\nThe new Board of Directors of TAURUS 2025. \nGiovanni Colombo, Chiara Di Montegnacco Colombo and Marta Colombo. \nHonorary President Peter Beyeler because also thanks to him TAURUS shear balers are the best!\nTAURUS, always a step ahead!Il nuovo Consiglio d'Amministrazione TAURUS 2025. \nGiovanni Colombo, Chiara Di Montegnacco Colombo e Marta Colombo. \nPresidente Onorario Peter Beyeler perché anche grazie a lui le presse cesoie TAURUS sono le migliori!\nTAURUS, Always a step ahead!\n\nThe new Board of Directors of TAURUS 2025. \nGiovanni Colombo, Chiara Di Montegnacco Colombo and Marta Colombo. \nHonorary President Peter Beyeler because also thanks to him TAURUS shear balers are the best!\nTAURUS, always a step ahead!",
        "likes": "36",
        "comments": "5",
        "shares": "1",
        "time": {
          "raw": "1ay",
          "parsed": "12.02.2025",
          "isoString": "2025-02-12T05:05:05.621Z"
        },
        "mediaType": "image",
        "mediaContent": [
          "https://media.licdn.com/dms/image/v2/D4D22AQEWcyqb0_FzGg/feedshare-shrink_2048_1536/B4DZSJz67yG4Aw-/0/1737478877363?e=1744848000&v=beta&t=LloKIRBOHWU8tILD3VJltWQ1kDGpFJxwea_x2bcuNEY"
        ],
        "date": "2025-02-12T05:05:05.621Z"
      },
      {
        "captions": "“CAT”, the transportable shear baler on tracked vehicle that adapts to your working needs.\nThe transportable shear baler has 2 independent remote controls, one for the shear and the other one for the traked vehicle: \"2\" is for safety, \"2\" is for ease of use; \"2\" is for not making mistakes, \"2\" is because 2 are the machines that make up the unit.\nDiscover more:\nhttps://lnkd.in/dHqMhpZJ\n.\nFor more info:\ninfo@taurusweb.it\nwww.taurusweb.it\n\n#Taurus #cat #tracks #transportable #shearbaler #pressacesoia #cingoli #mezzocingolato #trasportabile #scrapunit #scrapyard #cantiere #rottame #rottamepesante #recyclingmachines #RecyclingTech #recyclingequipment #recycling #Scrapmachine #madeinitaly “CAT”, the transportable shear baler on tracked vehicle that adapts to your working needs.\nThe transportable shear baler has 2 independent remote controls, one for the shear and the other one for the traked vehicle: \"2\" is for safety, \"2\" is for ease of use; \"2\" is for not making mistakes, \"2\" is because 2 are the machines that make up the unit.\nDiscover more:\nhttps://lnkd.in/dHqMhpZJ\n.\nFor more info:\ninfo@taurusweb.it\nwww.taurusweb.it\n\n#Taurus #cat #tracks #transportable #shearbaler #pressacesoia #cingoli #mezzocingolato #trasportabile #scrapunit #scrapyard #cantiere #rottame #rottamepesante #recyclingmachines #RecyclingTech #recyclingequipment #recycling #Scrapmachine #madeinitaly",
        "likes": "51",
        "comments": "1",
        "shares": "4",
        "time": {
          "raw": "1ay",
          "parsed": "12.02.2025",
          "isoString": "2025-02-12T05:05:05.623Z"
        },
        "mediaType": "image",
        "mediaContent": [
          "https://media.licdn.com/dms/image/v2/D4D22AQHKzKHOyak7TQ/feedshare-shrink_800/B4DZR1AofsHkAg-/0/1737129889463?e=1744848000&v=beta&t=dHn8ZoVXIMhOEod2XXV_Dl5PMSb7TDNdmSD5gF3WQgg"
        ],
        "date": "2025-02-12T05:05:05.623Z"
      },
      {
        "captions": "TAURUS shear baler QUATTRO\nAlways a step ahead!\n.\nFor more info:\ninfo@taurusweb.it\nwww.taurusweb.it\n#Taurus #shearbaler #Scrapmachine #scrapyard #scrap #rottame #pressacesoia #recyclingtechnology #RecyclingTech #Ferrailleur #ferraille #pressecisaille #Ferrailleur #presse #cylinder #4x4 #chatarras #chatarreros #sucata #circulareconomy #madeinitaly #recyclingequipment #heavyscrap #demolition #rottamepesante #heavyequipment #heavy #lightTAURUS shear baler QUATTRO\nAlways a step ahead!\n.\nFor more info:\ninfo@taurusweb.it\nwww.taurusweb.it\n#Taurus #shearbaler #Scrapmachine #scrapyard #scrap #rottame #pressacesoia #recyclingtechnology #RecyclingTech #Ferrailleur #ferraille #pressecisaille #Ferrailleur #presse #cylinder #4x4 #chatarras #chatarreros #sucata #circulareconomy #madeinitaly #recyclingequipment #heavyscrap #demolition #rottamepesante #heavyequipment #heavy #light",
        "likes": "20",
        "shares": "4",
        "time": {
          "raw": "1ay",
          "parsed": "05.02.2025",
          "isoString": "2025-02-05T10:28:38.314Z"
        },
        "mediaType": "image",
        "mediaContent": [
          "https://media.licdn.com/dms/image/v2/D4D22AQGKJZaKu4NcIg/feedshare-shrink_800/B4DZRq18ubHYAg-/0/1736959315696?e=1744243200&v=beta&t=kXgSQkiSo8TAi2MvlqoqRI95e1FCt1jeX-fqVCn9Q44"
        ],
        "date": "2025-02-05T10:28:38.314Z"
      },
      {
        "captions": "HAPPY NEW 2025 \nby CHAOS\n.\nFor more info:\ninfo@taurusweb.it\nwww.taurusweb.it\n\n#TAURUS #shearbale #pressacesoia #rottame #scrap #recycling #riciclo #circulareconomy #recyclingequipment #scrapmachine #scrapyard #rottamaio #ferraille #pressecisaille #compactadora #chatarra #sucata #cisalla #recyclingtechnology HAPPY NEW 2025 \nby CHAOS\n.\nFor more info:\ninfo@taurusweb.it\nwww.taurusweb.it\n\n#TAURUS #shearbale #pressacesoia #rottame #scrap #recycling #riciclo #circulareconomy #recyclingequipment #scrapmachine #scrapyard #rottamaio #ferraille #pressecisaille #compactadora #chatarra #sucata #cisalla #recyclingtechnology",
        "likes": "16",
        "shares": "2",
        "time": {
          "raw": "1ay",
          "parsed": "05.02.2025",
          "isoString": "2025-02-05T10:28:38.315Z"
        },
        "mediaType": "image",
        "mediaContent": [
          "https://media.licdn.com/dms/image/v2/D4D22AQEtJfFJHszh6A/feedshare-shrink_800/B4DZRgVVAAHIAs-/0/1736782992024?e=1744243200&v=beta&t=RqDaZG-HK5qNeunzeK6BJLtS7kbZNuCk6NV3BzONZBY"
        ],
        "date": "2025-02-05T10:28:38.315Z"
      },
      {
        "captions": "E762 - shearing force T 700\nA versatile machine that produces light scrap, E.L.V and collected scrap to be sent to mill. It is capable of shearing heavy scrap and demolition scrap ready for fournace  with low operating costs.\nAN INVESTMENT THAT PAYS ITSELF QUICKLY!\nhttps://lnkd.in/dqVxv-XU\n.\nFor more info:\ninfo@taurusweb.it\nwww.taurusweb.it\n\n#Taurus #shearbaler #cisalle  #prensacizalla #pressacesoia #rottame #scrap #ferraille #chatarra #sucata #sucatas #circulareconomy #Scrapmachine #Technology #scrapequipment #scraplife #scrapmetalrecycling #scrapmetal #recyclingequipment #hydraulics #HydraulicMachine #madeinitaly #metalrecycling E762 - shearing force T 700\nA versatile machine that produces light scrap, E.L.V and collected scrap to be sent to mill. It is capable of shearing heavy scrap and demolition scrap ready for fournace  with low operating costs.\nAN INVESTMENT THAT PAYS ITSELF QUICKLY!\nhttps://lnkd.in/dqVxv-XU\n.\nFor more info:\ninfo@taurusweb.it\nwww.taurusweb.it\n\n#Taurus #shearbaler #cisalle  #prensacizalla #pressacesoia #rottame #scrap #ferraille #chatarra #sucata #sucatas #circulareconomy #Scrapmachine #Technology #scrapequipment #scraplife #scrapmetalrecycling #scrapmetal #recyclingequipment #hydraulics #HydraulicMachine #madeinitaly #metalrecycling",
        "likes": "17",
        "shares": "1",
        "time": {
          "raw": "1ay",
          "parsed": "05.02.2025",
          "isoString": "2025-02-05T10:28:38.317Z"
        },
        "mediaType": "image",
        "mediaContent": [
          "https://media.licdn.com/dms/image/v2/D4D22AQEPjiL8H_i7ZA/feedshare-shrink_800/B4DZRQj6AHHkAg-/0/1736518378924?e=1744243200&v=beta&t=ih5ep7SJ3v_ZQlZBNZy8v9lK0avGmPh0yktMogqtnes"
        ],
        "date": "2025-02-05T10:28:38.317Z"
      },
      {
        "captions": "TAURUS wishes you a Happy New Year!TAURUS wishes you a Happy New Year!",
        "likes": "13",
        "comments": "1",
        "time": {
          "raw": "2ay",
          "parsed": "05.01.2025",
          "isoString": "2025-01-05T10:28:38.318Z"
        },
        "mediaType": "image",
        "mediaContent": [
          "https://media.licdn.com/dms/image/v2/D4D22AQE1R30P6qcreQ/feedshare-shrink_800/B4DZQXLyLdGkAg-/0/1735555753123?e=1744243200&v=beta&t=SjGKCX6TapTD9ytQRZTXpgcOCBink__2JI7gNBeoS1A"
        ],
        "date": "2025-01-05T10:28:38.318Z"
      },
      {
        "captions": "Merry Christmas and Happy New Year!\nby TAURUS\n\n#Taurus #shearbaler #scrap #scrapbale #Gift #christmasgifts #makeawish #christmas2024 #NewYear2025 #italy #madeinitaly #recyclingequipment #recycling #CircularEconomy #Scrapmachine #scrapprocessing #scrapsolution Merry Christmas and Happy New Year!\nby TAURUS\n\n#Taurus #shearbaler #scrap #scrapbale #Gift #christmasgifts #makeawish #christmas2024 #NewYear2025 #italy #madeinitaly #recyclingequipment #recycling #CircularEconomy #Scrapmachine #scrapprocessing #scrapsolution",
        "likes": "8",
        "shares": "1",
        "time": {
          "raw": "2ay",
          "parsed": "05.01.2025",
          "isoString": "2025-01-05T10:28:38.320Z"
        },
        "mediaType": "image",
        "mediaContent": [
          "https://media.licdn.com/dms/image/v2/D4D22AQFqlp-E-vjqVQ/feedshare-shrink_800/B4DZPjhg6MGUAg-/0/1734689035118?e=1744243200&v=beta&t=7k2fdcqkP_hU8ZttywI86rYpE3bCrks68h6BNPlDxLo"
        ],
        "date": "2025-01-05T10:28:38.320Z"
      },
      {
        "captions": "TAURUS SHEAR BALER EVO\nT 650\nIvo Nyffenegger\n.\nFor more info:\ninfo@taurusweb.it\nwww.taurusweb.it\n\n#Taurus #shearbaler #recyclingequipment #recyclingmachine\n#scrapprocessing #Scrapmachine #scrap #MadeInItaly #circulareconomy #recyclingtechniqueTAURUS SHEAR BALER EVO\nT 650\nIvo Nyffenegger\n.\nFor more info:\ninfo@taurusweb.it\nwww.taurusweb.it\n\n#Taurus #shearbaler #recyclingequipment #recyclingmachine\n#scrapprocessing #Scrapmachine #scrap #MadeInItaly #circulareconomy #recyclingtechnique",
        "likes": "20",
        "shares": "2",
        "time": {
          "raw": "2ay",
          "parsed": "05.01.2025",
          "isoString": "2025-01-05T10:28:38.321Z"
        },
        "mediaType": "image",
        "mediaContent": [
          "https://media.licdn.com/dms/image/v2/D4D22AQGE28J70eOs_Q/feedshare-shrink_800/B4DZPVZ2cKHgAg-/0/1734452144538?e=1744243200&v=beta&t=gS447kq8M2JhGoRQtyB4dvKhUyRSpyuXrPJjFfpl6-c"
        ],
        "date": "2025-01-05T10:28:38.321Z"
      },
      {
        "captions": "CHAOS SHEAR BALER\nby TAURUS\n.\nFor more info:\ninfo@taurusweb.it\nwww.taurusweb.it\n\n#Taurus #pressacesoia #shearbaler #chaos #technology #future #futuremachine #equipment #discover #madeinitaly #Recyclingtechnik #recycling #Scrapmachine #scrapprocessing #Ferrailleur #chatarra #sucataCHAOS SHEAR BALER\nby TAURUS\n.\nFor more info:\ninfo@taurusweb.it\nwww.taurusweb.it\n\n#Taurus #pressacesoia #shearbaler #chaos #technology #future #futuremachine #equipment #discover #madeinitaly #Recyclingtechnik #recycling #Scrapmachine #scrapprocessing #Ferrailleur #chatarra #sucata",
        "likes": "15",
        "shares": "2",
        "time": {
          "raw": "2ay",
          "parsed": "05.01.2025",
          "isoString": "2025-01-05T10:28:38.322Z"
        },
        "mediaType": "image",
        "mediaContent": [
          "https://media.licdn.com/dms/image/v2/D4D22AQHXOdplL3HiGw/feedshare-shrink_800/feedshare-shrink_800/0/1733849598407?e=1744243200&v=beta&t=Ilb86hrAN2_HL93Ul3K9iwgj6eBN1SpptyJHAO0A1vY"
        ],
        "date": "2025-01-05T10:28:38.322Z"
      },
      {
        "captions": "TAURUS SHEAR BALER \nT 1400\nTESTING TIME\n.\nFor more info:\ninfo@taurusweb.it\nwww.taurusweb.it\n\n#Taurus #shearbaler #HeavyDutyEquipment #heavydutymachines #heavydutyshear #shearing #TestingMachine #scrapprocessing #Scrapmachine #Recyclingtechnik #recyclingequipment #RecyclingTechnology #rottame #cesoia #pressacesoia #reciclagem #recyclage #Recycle #circulareconomy #demolizione #collaudo #cisaille #pressecisaille #ferraille #Ferrailleur #compactadora #sucata #prensa #cisalla #chatarra",
        "likes": "50",
        "comments": "3",
        "shares": "4",
        "time": {
          "raw": "3ay",
          "parsed": "05.12.2024",
          "isoString": "2024-12-05T10:28:38.323Z"
        },
        "mediaType": "video",
        "mediaContent": {
          "src": [
            {
              "src": "https://dms.licdn.com/playlist/vid/v2/D4D05AQFqyBTT3brUCA/mp4-640p-30fp-crf28/mp4-640p-30fp-crf28/0/1733324113930?e=1741777200&v=beta&t=bg3udrgKdDTzUFDKHo-lbydaVFZQZzF9P8GNFpyBaSU",
              "type": "video/mp4",
              "data-bitrate": 297858
            },
            {
              "src": "https://dms.licdn.com/playlist/vid/v2/D4D05AQFqyBTT3brUCA/mp4-720p-30fp-crf28/mp4-720p-30fp-crf28/0/1733324116342?e=1741777200&v=beta&t=TrgPUIbrlKctSQ2G05L9T7YvGwY-xCW3RPWNHGP3qNk",
              "type": "video/mp4",
              "data-bitrate": 403074
            }
          ],
          "posterUrl": "https://media.licdn.com/dms/image/v2/D4D05AQFqyBTT3brUCA/videocover-high/videocover-high/0/1733324103614?e=1741777200&v=beta&t=HsmLX9qeu71Mu4yYzvuME11KQvSjAhb6gxbGHVbofkc"
        },
        "date": "2024-12-05T10:28:38.323Z"
      },
      {
        "captions": "Dopo 40.000 ore di onorato lavoro\nil nuovo che avanza!\n.\nPer maggiori informazioni:\ninfo@taurusweb.it\nwww.taurusweb.it\n\n#taurus #4x4 #shearbaler #scrapprocessing #Scrapmachine #Recyclingtechnik #recyclingequipment #scraprecycling #recycling #madeinitaly #heavydutyequipment #heavydutymachines #rottami #rottame #pressacesoia #cisaille #pressecisaille #prensa #cisalla #compactadora #chatarreros #sucata #chatarra  Dopo 40.000 ore di onorato lavoro\nil nuovo che avanza!\n.\nPer maggiori informazioni:\ninfo@taurusweb.it\nwww.taurusweb.it\n\n#taurus #4x4 #shearbaler #scrapprocessing #Scrapmachine #Recyclingtechnik #recyclingequipment #scraprecycling #recycling #madeinitaly #heavydutyequipment #heavydutymachines #rottami #rottame #pressacesoia #cisaille #pressecisaille #prensa #cisalla #compactadora #chatarreros #sucata #chatarra",
        "likes": "23",
        "shares": "2",
        "time": {
          "raw": "3ay",
          "parsed": "05.12.2024",
          "isoString": "2024-12-05T10:28:38.325Z"
        },
        "mediaType": "image",
        "mediaContent": [
          "https://media.licdn.com/dms/image/v2/D4D22AQFh9CU52YAvSA/feedshare-shrink_800/feedshare-shrink_800/0/1732811826392?e=1744243200&v=beta&t=Pw4N8Q0aw-xlA_3RLLzgQN58fszADGmVSeXbtu5eRpY"
        ],
        "date": "2024-12-05T10:28:38.325Z"
      },
      {
        "captions": "TAURUS BLULINE shear baler \n750 T\n.\nFor more info:\ninfo@taurusweb.it\nwww.taurusweb.it\n\n#Taurus #shearbaler #shear #cuttingforce #scrapprocessing #scrap #Scrapmachine #rottame #chatarra #chatarreros #Ferrailleur #ferraille #madeinitaly #pressacesoia #pressa #Recyclingtechnik #recyclingequipment #recyclage #recycling #recyclingsolutions",
        "likes": "17",
        "shares": "4",
        "time": {
          "raw": "3ay",
          "parsed": "05.12.2024",
          "isoString": "2024-12-05T10:28:38.326Z"
        },
        "mediaType": "video",
        "mediaContent": {
          "src": [
            {
              "src": "https://dms.licdn.com/playlist/vid/v2/D4D05AQHpOtQpUtE-TQ/mp4-640p-30fp-crf28/mp4-640p-30fp-crf28/0/1732552750210?e=1741777200&v=beta&t=CbsRddg7d_iEK_CuA9hYtWVECFymZEevADHlg3Ikf9Q",
              "type": "video/mp4",
              "data-bitrate": 547984
            },
            {
              "src": "https://dms.licdn.com/playlist/vid/v2/D4D05AQHpOtQpUtE-TQ/mp4-720p-30fp-crf28/mp4-720p-30fp-crf28/0/1732552750704?e=1741777200&v=beta&t=djgvr6oYp1kompqjEIQdFvtD1MhaQRxxhGj4uQp4Mr0",
              "type": "video/mp4",
              "data-bitrate": 653600
            }
          ],
          "posterUrl": "https://media.licdn.com/dms/image/v2/D4D05AQHpOtQpUtE-TQ/videocover-high/videocover-high/0/1732552742996?e=1741777200&v=beta&t=ouVHNh9QPkLD6bXJzm5CWn-Lpu9LfzEh09x52g4I8Vc"
        },
        "date": "2024-12-05T10:28:38.326Z"
      },
      {
        "captions": "TAURUS BLULINE SHEAR BALER\nT 800\nIvo Nyffenegger\n.\nFor more info:\ninfo@taurusweb.it\nwww.taurusweb.it\n\n#Taurus #pressacesoia #pressa #cesoia #shearingforce #shears #Balers #shearbalers #scrapequiment #scrap #Scrapmachine #Recyclingtechnik #recyclingequipment #recycling #heavymachine #circulareconomy #cisalla #prensa #cisalle #compactadora #chatarra #Ferrailleur #ferraille #chatarreros #sucata #maquinasindustriales #prensadecorte TAURUS BLULINE SHEAR BALER\nT 800\nIvo Nyffenegger\n.\nFor more info:\ninfo@taurusweb.it\nwww.taurusweb.it\n\n#Taurus #pressacesoia #pressa #cesoia #shearingforce #shears #Balers #shearbalers #scrapequiment #scrap #Scrapmachine #Recyclingtechnik #recyclingequipment #recycling #heavymachine #circulareconomy #cisalla #prensa #cisalle #compactadora #chatarra #Ferrailleur #ferraille #chatarreros #sucata #maquinasindustriales #prensadecorte",
        "likes": "28",
        "shares": "2",
        "time": {
          "raw": "3ay",
          "parsed": "04.12.2024",
          "isoString": "2024-12-04T10:39:11.838Z"
        },
        "mediaType": "image",
        "mediaContent": [
          "https://media.licdn.com/dms/image/v2/D4D22AQHjHO7DIjhTig/feedshare-shrink_800/feedshare-shrink_800/0/1732285313726?e=1744243200&v=beta&t=bcH4hoZM9y2TDjCRmsUI-qfs0fPKa52xnERDgm_PgZw"
        ],
        "date": "2024-12-04T10:39:11.838Z"
      },
      {
        "captions": "TAURUS SHEAR BALER RAPID\nT 1100\n.\nFor more info:\ninfo@taurusweb.it\nwww.taurusweb.it\n#Taurus #shearbaler #shear #pressacesoia #cesoia  #rottame #scrapequipment #Scrapmachine #scrap #scrapyard #Ferrailleur #ferraille #pressecisaille #ghigliottina #recyclage #recycling #recyclingequipment #recyclingtechnology #Rapide #sucata #chatarras #prensa #compactadora #prensadecorte #cisalhamentoTAURUS SHEAR BALER RAPID\nT 1100\n.\nFor more info:\ninfo@taurusweb.it\nwww.taurusweb.it\n#Taurus #shearbaler #shear #pressacesoia #cesoia  #rottame #scrapequipment #Scrapmachine #scrap #scrapyard #Ferrailleur #ferraille #pressecisaille #ghigliottina #recyclage #recycling #recyclingequipment #recyclingtechnology #Rapide #sucata #chatarras #prensa #compactadora #prensadecorte #cisalhamento",
        "likes": "20",
        "shares": "5",
        "time": {
          "raw": "1h",
          "parsed": "05.03.2025",
          "isoString": "2025-03-05T05:05:05.603Z"
        },
        "mediaType": "image",
        "mediaContent": [
          "https://media.licdn.com/dms/image/v2/D4D22AQEooxLiroy0Lw/feedshare-shrink_800/B4DZVhceuUHYAk-/0/1741096611220?e=1744848000&v=beta&t=xbDiMknV4qVKOGhqgsc6rxueQko9urq48eRj6L1JMDk"
        ],
        "date": "2025-03-05T05:05:05.603Z"
      }
    ]
  },
  {
    "name": "JiangsuHuahongMachinery",
    "followerData": [
      [
        20250225,
        100
      ],
      [
        20250225,
        100
      ],
      [
        20250225,
        100
      ],
      [
        20250228,
        102
      ],
      [
        20250228,
        102
      ],
      [
        20250228,
        102
      ],
      [
        20250228,
        102
      ],
      [
        20250303,
        101
      ],
      [
        1741011655199,
        "101"
      ],
      [
        1741076630559,
        "101"
      ],
      [
        1741077776532,
        "101"
      ],
      [
        1741083755373,
        "101"
      ],
      [
        1741084769378,
        "101"
      ],
      [
        1741170532295,
        101
      ],
      [
        1741755924139,
        103
      ]
    ],
    "data": [
      {
        "captions": "scrap rebar Baler machine, export to Asia customer today.scrap rebar Baler machine, export to Asia customer today.",
        "shares": "1",
        "time": {
          "raw": "1h",
          "parsed": "05.03.2025",
          "isoString": "2025-03-05T05:05:23.881Z"
        },
        "mediaType": "image",
        "mediaContent": [
          "https://media.licdn.com/dms/image/v2/D4E22AQEATgr2DMNMKA/feedshare-shrink_800/B4EZVLbg0hHgAg-/0/1740727261342?e=1744848000&v=beta&t=A0HRRhs5hRqmeLDrqVj2x4dx7YOR_MB054CqKjNBpXQ"
        ],
        "date": "2025-03-05T05:05:23.881Z"
      },
      {
        "captions": "120ton scrap metal shear to Asia customer120ton scrap metal shear to Asia customer",
        "likes": "1",
        "shares": "1",
        "time": {
          "raw": "1h",
          "parsed": "05.03.2025",
          "isoString": "2025-03-05T05:05:23.882Z"
        },
        "mediaType": "image",
        "mediaContent": [
          "https://media.licdn.com/dms/image/v2/D5622AQFSFXAvV417oQ/feedshare-shrink_800/B56ZVGnXCnHEAg-/0/1740646479734?e=1744848000&v=beta&t=lXh_I-SZLaFVhuzwJZjOff56RvANutrRyYh6MbwrXwE"
        ],
        "date": "2025-03-05T05:05:23.882Z"
      },
      {
        "captions": "135ton scrap aluminum baler, export to middle east today.135ton scrap aluminum baler, export to middle east today.",
        "likes": "4",
        "shares": "1",
        "time": {
          "raw": "1h",
          "parsed": "05.03.2025",
          "isoString": "2025-03-05T05:05:23.884Z"
        },
        "mediaType": "image",
        "mediaContent": [
          "https://media.licdn.com/dms/image/v2/D5622AQFbZLG5Aoq8mg/feedshare-shrink_800/B56ZVGf7.6GUAg-/0/1740644535381?e=1744848000&v=beta&t=X8-fAl6WMR8kVg1rBYRKs9kgGuTOWEIK7YUkC3V9ZPc"
        ],
        "date": "2025-03-05T05:05:23.884Z"
      },
      {
        "captions": "315ton scrap metal Baler, export to America today.315ton scrap metal Baler, export to America today.",
        "likes": "3",
        "shares": "1",
        "time": {
          "raw": "2h",
          "parsed": "26.02.2025",
          "isoString": "2025-02-26T05:05:23.886Z"
        },
        "mediaType": "image",
        "mediaContent": [
          "https://media.licdn.com/dms/image/v2/D5622AQHeXQsx-U7Yow/feedshare-shrink_800/B56ZUrwKUvHoAg-/0/1740195808223?e=1744848000&v=beta&t=KpsZsX0SUY97Rc9lKXy-dBvgvAGS773CV1hmh6mg7wM"
        ],
        "date": "2025-02-26T05:05:23.886Z"
      },
      {
        "captions": "one more big baler, export to Africa today.one more big baler, export to Africa today.",
        "likes": "2",
        "shares": "1",
        "time": {
          "raw": "2h",
          "parsed": "26.02.2025",
          "isoString": "2025-02-26T05:05:23.887Z"
        },
        "mediaType": "image",
        "mediaContent": [
          "https://media.licdn.com/dms/image/v2/D5622AQFXL-lgwSoC0A/feedshare-shrink_800/B56ZUiGuDUHQAo-/0/1740033944148?e=1744848000&v=beta&t=LpMZV_hpcr8bcGILW-p8Kzmi-PAJ5u-L9RR-SJvxDGw"
        ],
        "date": "2025-02-26T05:05:23.887Z"
      },
      {
        "captions": "plastic baler, ship to customer today.",
        "likes": "1",
        "shares": "1",
        "time": {
          "raw": "3h",
          "parsed": "19.02.2025",
          "isoString": "2025-02-19T05:05:23.888Z"
        },
        "mediaType": "video",
        "mediaContent": {
          "src": [
            {
              "src": "https://dms.licdn.com/playlist/vid/v2/D5605AQG0MR4XDBd_Qw/mp4-720p-30fp-crf28/B56ZUH0xHMGsBg-/0/1739593036416?e=1742364000&v=beta&t=OjT3ayaLxh5TwuugZw6npUOCxVElr33ZYRwJRzGpxW8",
              "type": "video/mp4",
              "data-bitrate": 1707766
            },
            {
              "src": "https://dms.licdn.com/playlist/vid/v2/D5605AQG0MR4XDBd_Qw/mp4-640p-30fp-crf28/B56ZUH0xHMGsBc-/0/1739593036495?e=1742364000&v=beta&t=R-t53gcZqrmWKZ0oW89I0v_kOg2XN38G54bdwkdOCgc",
              "type": "video/mp4",
              "data-bitrate": 1103266
            }
          ],
          "posterUrl": "https://media.licdn.com/dms/image/v2/D5605AQG0MR4XDBd_Qw/videocover-high/B56ZUH0xHMGsBs-/0/1739593036020?e=1742364000&v=beta&t=pdAkIUm7s0iVpdc6pU9ch1gME0kdAaeEtd0oBbsxKdQ"
        },
        "date": "2025-02-19T05:05:23.888Z"
      },
      {
        "captions": "old model of 450 hammer shredder, export to Asia today.old model of 450 hammer shredder, export to Asia today.",
        "likes": "2",
        "comments": "1",
        "shares": "1",
        "time": {
          "raw": "3h",
          "parsed": "19.02.2025",
          "isoString": "2025-02-19T05:05:23.889Z"
        },
        "mediaType": "image",
        "mediaContent": [
          "https://media.licdn.com/dms/image/v2/D5622AQFi3cNVbJX3wA/feedshare-shrink_800/B56ZT.LxRvHQAg-/0/1739431290261?e=1744848000&v=beta&t=FkXShef6R-RYjXX30f2wcTdpOpbvxgibPH-12ul90o4"
        ],
        "date": "2025-02-19T05:05:23.889Z"
      },
      {
        "captions": "800hp hammer mill shredder, export to customer today. this line will include PDM magnet sorting.800hp hammer mill shredder, export to customer today. this line will include PDM magnet sorting.",
        "likes": "2",
        "shares": "1",
        "time": {
          "raw": "1ay",
          "parsed": "12.02.2025",
          "isoString": "2025-02-12T05:05:23.891Z"
        },
        "mediaType": "image",
        "mediaContent": [
          "https://media.licdn.com/dms/image/v2/D5622AQFtBK2TRXdCgw/feedshare-shrink_800/B56ZSHTofMH0As-/0/1737436861732?e=1744848000&v=beta&t=mDeU0K9JtiyW5JfrXWzP43T_I9N_nhY-uxzhesrWphU"
        ],
        "date": "2025-02-12T05:05:23.891Z"
      },
      {
        "captions": "630ton scrap metal baler, with diesel engine, export to customer today.630ton scrap metal baler, with diesel engine, export to customer today.",
        "likes": "2",
        "shares": "1",
        "time": {
          "raw": "1ay",
          "parsed": "12.02.2025",
          "isoString": "2025-02-12T05:05:23.892Z"
        },
        "mediaType": "image",
        "mediaContent": [
          "https://media.licdn.com/dms/image/v2/D5622AQEbSIxjxSTgsg/feedshare-shrink_800/B56ZSHS479H0Ag-/0/1737436667560?e=1744848000&v=beta&t=bKpnPGi770ph4Ek7lcB3--sFMRdny42SEx2wJ7ss3Nk"
        ],
        "date": "2025-02-12T05:05:23.892Z"
      },
      {
        "captions": "before Chinese new year holiday, export one Baler machine to India.before Chinese new year holiday, export one Baler machine to India.",
        "likes": "3",
        "shares": "1",
        "time": {
          "raw": "1ay",
          "parsed": "12.02.2025",
          "isoString": "2025-02-12T05:05:23.893Z"
        },
        "mediaType": "image",
        "mediaContent": [
          "https://media.licdn.com/dms/image/v2/D5622AQHMMc2cRRDpBA/feedshare-shrink_800/B56ZR9bmZXGsAg-/0/1737271176715?e=1744848000&v=beta&t=V9lmP5DaD9pm1OweFDeoX7o8IqskjxNev9jpeVhoZg8"
        ],
        "date": "2025-02-12T05:05:23.893Z"
      },
      {
        "captions": "630ton scrap metal baler, customized with Royal yellow painting, ship to Asia customer today.630ton scrap metal baler, customized with Royal yellow painting, ship to Asia customer today.",
        "likes": "4",
        "shares": "1",
        "time": {
          "raw": "1ay",
          "parsed": "12.02.2025",
          "isoString": "2025-02-12T05:05:23.894Z"
        },
        "mediaType": "image",
        "mediaContent": [
          "https://media.licdn.com/dms/image/v2/D5622AQFkY2RhrTNoew/feedshare-shrink_800/B56ZRy5b38GoAg-/0/1737094454529?e=1744848000&v=beta&t=3Hzcwyua8Wz_exopGeIHF3dcXSjflhOJgbWs1Lm8j3A"
        ],
        "date": "2025-02-12T05:05:23.894Z"
      },
      {
        "captions": "250ton Baler machine, export to America today.250ton Baler machine, export to America today.",
        "likes": "1",
        "comments": "1",
        "shares": "1",
        "time": {
          "raw": "1ay",
          "parsed": "12.02.2025",
          "isoString": "2025-02-12T05:05:23.895Z"
        },
        "mediaType": "image",
        "mediaContent": [
          "https://media.licdn.com/dms/image/v2/D5622AQEpFtb7tC7qUw/feedshare-shrink_800/B56ZRyKUxjG8Ag-/0/1737082099793?e=1744848000&v=beta&t=XAkAUDqfaTQM4s1Pgv1mom92RXGRIq5KWwfKFiYIkmI"
        ],
        "date": "2025-02-12T05:05:23.895Z"
      },
      {
        "captions": "scrap aluminum baler machine, export to Africa today.scrap aluminum baler machine, export to Africa today.",
        "likes": "1",
        "shares": "1",
        "time": {
          "raw": "1ay",
          "parsed": "12.02.2025",
          "isoString": "2025-02-12T05:05:23.896Z"
        },
        "mediaType": "image",
        "mediaContent": [
          "https://media.licdn.com/dms/image/v2/D5622AQFzZzUmmZy9mw/feedshare-shrink_800/B56ZRooi19G8Ag-/0/1736922248856?e=1744848000&v=beta&t=8ZnADgsUiyVwVakijkS7Fw2XW8zH5x4E6OhL50RKjM8"
        ],
        "date": "2025-02-12T05:05:23.896Z"
      },
      {
        "captions": "scrap bale pre shredder, export to customer today.scrap bale pre shredder, export to customer today.",
        "likes": "2",
        "shares": "1",
        "time": {
          "raw": "1ay",
          "parsed": "12.02.2025",
          "isoString": "2025-02-12T05:05:23.897Z"
        },
        "mediaType": "image",
        "mediaContent": [
          "https://media.licdn.com/dms/image/v2/D5622AQFdXtCc3LpB0Q/feedshare-shrink_800/B56ZRklWMiHQAg-/0/1736854301460?e=1744848000&v=beta&t=z6EGd2RJLBrOnH-pnrEYW5LeH5F43KyhdUGjlxCs3k0"
        ],
        "date": "2025-02-12T05:05:23.897Z"
      },
      {
        "captions": "160ton scrap metal baler, export to Indonesia today.160ton scrap metal baler, export to Indonesia today.",
        "likes": "2",
        "shares": "1",
        "time": {
          "raw": "1ay",
          "parsed": "12.02.2025",
          "isoString": "2025-02-12T05:05:23.898Z"
        },
        "mediaType": "image",
        "mediaContent": [
          "https://media.licdn.com/dms/image/v2/D5622AQEGpuNInq8Z5A/feedshare-shrink_800/B56ZRkOikcGQAo-/0/1736848322661?e=1744848000&v=beta&t=YCMIbmZ7e0AUzCMNnuTZuBJUdeAFSS-L_NRfxkXEAOo"
        ],
        "date": "2025-02-12T05:05:23.898Z"
      },
      {
        "captions": "2025year: 3rd container, one more 800ton container shear machine, ship to our customer.2025year: 3rd container, one more 800ton container shear machine, ship to our customer.",
        "likes": "1",
        "shares": "1",
        "time": {
          "raw": "2ay",
          "parsed": "12.01.2025",
          "isoString": "2025-01-12T05:05:23.899Z"
        },
        "mediaType": "image",
        "mediaContent": [
          "https://media.licdn.com/dms/image/v2/D5622AQFMhye6E5AjXg/feedshare-shrink_800/B56ZQqsXefHQAk-/0/1735883064021?e=1744848000&v=beta&t=taSS6pjp9jFIV9r7pPzXVhUS5F67FQx_esJ5fEwRfYQ"
        ],
        "date": "2025-01-12T05:05:23.899Z"
      },
      {
        "captions": "2025 year 2nd container: 200ton alligator shear shipping to rolling mill customer.2025 year 2nd container: 200ton alligator shear shipping to rolling mill customer.",
        "likes": "2",
        "shares": "1",
        "time": {
          "raw": "2ay",
          "parsed": "12.01.2025",
          "isoString": "2025-01-12T05:05:23.900Z"
        },
        "mediaType": "image",
        "mediaContent": [
          "https://media.licdn.com/dms/image/v2/D5622AQGDVlI55OecNQ/feedshare-shrink_800/B56ZQlhe2PGsAk-/0/1735796324730?e=1744848000&v=beta&t=pnEKL4O3BjVgH7kmJJBbGDCGZyjLU2yVWh3SwDfxnbU"
        ],
        "date": "2025-01-12T05:05:23.900Z"
      },
      {
        "captions": "2025 year first container: 800ton container shear shipping to my old customer.2025 year first container: 800ton container shear shipping to my old customer.",
        "likes": "1",
        "shares": "1",
        "time": {
          "raw": "2ay",
          "parsed": "04.01.2025",
          "isoString": "2025-01-04T10:39:29.148Z"
        },
        "mediaType": "image",
        "mediaContent": [
          "https://media.licdn.com/dms/image/v2/D5622AQGlFLHYZ8IPbg/feedshare-shrink_800/B56ZQlg1uEH0Ak-/0/1735796159220?e=1744243200&v=beta&t=BJj4wtMWE1Ky904FjMxFK0kiIsVb-FfBwGkRnuOzmYI"
        ],
        "date": "2025-01-04T10:39:29.148Z"
      },
      {
        "captions": "3 shear machines finished inspection, and ready for shipment to Africa.3 shear machines finished inspection, and ready for shipment to Africa.",
        "likes": "1",
        "shares": "1",
        "time": {
          "raw": "2ay",
          "parsed": "04.01.2025",
          "isoString": "2025-01-04T10:39:29.149Z"
        },
        "mediaType": "image",
        "mediaContent": [
          "https://media.licdn.com/dms/image/v2/D5622AQHTR37IFLn7wQ/feedshare-shrink_800/B56ZPhrb6lGsAk-/0/1734658082554?e=1744243200&v=beta&t=iSn7YXiS-Hz00FixODdkG3ULOrFPsHywSkdkv0cVBho"
        ],
        "date": "2025-01-04T10:39:29.149Z"
      },
      {
        "captions": "new design of 500ton gantry shear, all parts dismantled to load normal container for our Asian customer.new design of 500ton gantry shear, all parts dismantled to load normal container for our Asian customer.",
        "likes": "3",
        "shares": "1",
        "time": {
          "raw": "2ay",
          "parsed": "04.01.2025",
          "isoString": "2025-01-04T10:39:29.150Z"
        },
        "mediaType": "image",
        "mediaContent": [
          "https://media.licdn.com/dms/image/v2/D5622AQEyB5uE81hJlg/feedshare-shrink_800/feedshare-shrink_800/0/1733816582167?e=1744243200&v=beta&t=18eeziIjIT14r5TYWyTO3AOZA2scXXMHtX9yzf7ZgOc"
        ],
        "date": "2025-01-04T10:39:29.150Z"
      },
      {
        "captions": "high density bale breaking machine, export to Asia customer.high density bale breaking machine, export to Asia customer.",
        "likes": "3",
        "shares": "1",
        "time": {
          "raw": "1g",
          "parsed": "11.03.2025",
          "isoString": "2025-03-11T05:05:23.877Z"
        },
        "mediaType": "image",
        "mediaContent": [
          "https://media.licdn.com/dms/image/v2/D4E22AQG_I7aIUZFGWw/feedshare-shrink_800/B4EZV_NjBTG0Ag-/0/1741596018805?e=1744848000&v=beta&t=oi5o5uGswl2s28nafRkw8zL50nkaGVovJvplju66ykg"
        ],
        "date": "2025-03-11T05:05:23.877Z"
      },
      {
        "captions": "800HP hammer mill shredder, export to Asia customer today.800HP hammer mill shredder, export to Asia customer today.",
        "likes": "3",
        "shares": "1",
        "time": {
          "raw": "3g",
          "parsed": "09.03.2025",
          "isoString": "2025-03-09T05:05:23.878Z"
        },
        "mediaType": "image",
        "mediaContent": [
          "https://media.licdn.com/dms/image/v2/D5622AQGg3rghVY0HWQ/feedshare-shrink_800/B56ZV0tBF3GQAg-/0/1741419715288?e=1744848000&v=beta&t=2gOFtfBQlnYLcU2SqloiwI-Pm9NRxZi_rmM38IQPoLY"
        ],
        "date": "2025-03-09T05:05:23.878Z"
      },
      {
        "captions": "1600HP hammer mill shredder finished installation, with sound isolation wall and dedent system, start production in Asia customer site.1600HP hammer mill shredder finished installation, with sound isolation wall and dedent system, start production in Asia customer site.",
        "likes": "2",
        "shares": "1",
        "time": {
          "raw": "4g",
          "parsed": "08.03.2025",
          "isoString": "2025-03-08T05:05:23.880Z"
        },
        "mediaType": "image",
        "mediaContent": [
          "https://media.licdn.com/dms/image/v2/D5622AQF66hYfY2Mk2Q/feedshare-shrink_800/B56ZVveBttGoAg-/0/1741331927584?e=1744848000&v=beta&t=xWKMWhrafvKaA_RDebUOqc8ALey_XSA3_GY_jtlBtKY"
        ],
        "date": "2025-03-08T05:05:23.880Z"
      }
    ]
  },
  {
    "name": "IdromecSpa",
    "followerData": [
      [
        20250225,
        738
      ],
      [
        20250225,
        738
      ],
      [
        20250225,
        738
      ],
      [
        20250228,
        741
      ],
      [
        20250228,
        741
      ],
      [
        20250228,
        741
      ],
      [
        20250228,
        741
      ],
      [
        20250303,
        742
      ],
      [
        1741011674310,
        "742"
      ],
      [
        1741076644997,
        "743"
      ],
      [
        1741077791025,
        "743"
      ],
      [
        1741083769573,
        "743"
      ],
      [
        1741084785571,
        "743"
      ],
      [
        1741170547541,
        743
      ],
      [
        1741755938615,
        763
      ]
    ],
    "data": [
      {
        "captions": "Exciting new 1400 ton Shear for our recycling facility in Bakersfield !On Location in Mozzecane Italy!!\n\nIt was exciting to see our new 1400ton Shear being loaded out for our own facility Sierra Recycling & Demolition!!!!\n\nCan’t wait for its arrival!!!",
        "likes": "43",
        "comments": "3",
        "shares": "5",
        "time": {
          "raw": "4h4h",
          "parsed": "12.03.2025",
          "isoString": "2025-03-12T05:05:38.323Z"
        },
        "mediaType": "video",
        "mediaContent": {
          "src": [
            {
              "src": "https://dms.licdn.com/playlist/vid/v2/D5605AQFJgP7A2Of8lQ/mp4-640p-30fp-crf28/B56ZTvpPVqHEBc-/0/1739187379825?e=1742364000&v=beta&t=AkDzxSaB2J4N4DJMPAXAur9qnHwacMRNFCCe8_2FAqM",
              "type": "video/mp4",
              "data-bitrate": 610370
            },
            {
              "src": "https://dms.licdn.com/playlist/vid/v2/D5605AQFJgP7A2Of8lQ/mp4-720p-30fp-crf28/B56ZTvpPVqHEBg-/0/1739187380483?e=1742364000&v=beta&t=7aaiN0cnaH_QxMER8xPs1NFw0dqEUzCuxKr_nXNLrNo",
              "type": "video/mp4",
              "data-bitrate": 833042
            }
          ],
          "posterUrl": "https://media.licdn.com/dms/image/v2/D5605AQFJgP7A2Of8lQ/videocover-low/B56ZTvpPVqHECM-/0/1739187374832?e=1742364000&v=beta&t=FpDKAtXGoBdX4ZseuVfYvMYSWoRsRJhRWYomaGetPEA"
        },
        "date": "2025-03-12T05:05:38.323Z"
      },
      {
        "captions": "On Location in Mozzecane Italy!!\n\nIt was exciting to see our new 1400ton Shear being loaded out for our own facility Sierra Recycling & Demolition!!!!\n\nCan’t wait for its arrival!!!",
        "time": {
          "raw": "4h",
          "parsed": "12.02.2025",
          "isoString": "2025-02-12T05:05:38.323Z"
        },
        "mediaType": "video",
        "mediaContent": {
          "src": [
            {
              "src": "https://dms.licdn.com/playlist/vid/v2/D5605AQFJgP7A2Of8lQ/mp4-640p-30fp-crf28/B56ZTvpPVqHEBc-/0/1739187379825?e=1742364000&v=beta&t=AkDzxSaB2J4N4DJMPAXAur9qnHwacMRNFCCe8_2FAqM",
              "type": "video/mp4",
              "data-bitrate": 610370
            },
            {
              "src": "https://dms.licdn.com/playlist/vid/v2/D5605AQFJgP7A2Of8lQ/mp4-720p-30fp-crf28/B56ZTvpPVqHEBg-/0/1739187380483?e=1742364000&v=beta&t=7aaiN0cnaH_QxMER8xPs1NFw0dqEUzCuxKr_nXNLrNo",
              "type": "video/mp4",
              "data-bitrate": 833042
            }
          ],
          "posterUrl": "https://media.licdn.com/dms/image/v2/D5605AQFJgP7A2Of8lQ/videocover-low/B56ZTvpPVqHECM-/0/1739187374832?e=1742364000&v=beta&t=FpDKAtXGoBdX4ZseuVfYvMYSWoRsRJhRWYomaGetPEA"
        },
        "date": "2025-02-12T05:05:38.323Z"
      },
      {
        "captions": "Venerdì abbiamo avuto  l’ultimo di 3 incontri con i ragazzi delle scuole secondarie di primo grado di Mozzecane e Nogarole Rocca. I ragazzi, divisi a gruppi, hanno visitato l’officina e gli uffici della ditta dove sono state spiegate loro le varie figure professionali. Il tutto nell’ottica della scelta della corretta scuola secondaria di secondo grado. I ragazzi, accompagnati dai professori, hanno mostrato interesse e fatto domande. Speriamo di essere stati d’aiuto nella scelta del loro percorso di studi che li preparerà alla vita lavorativa. In bocca al lupo ragazzi!Venerdì abbiamo avuto  l’ultimo di 3 incontri con i ragazzi delle scuole secondarie di primo grado di Mozzecane e Nogarole Rocca. I ragazzi, divisi a gruppi, hanno visitato l’officina e gli uffici della ditta dove sono state spiegate loro le varie figure professionali. Il tutto nell’ottica della scelta della corretta scuola secondaria di secondo grado. I ragazzi, accompagnati dai professori, hanno mostrato interesse e fatto domande. Speriamo di essere stati d’aiuto nella scelta del loro percorso di studi che li preparerà alla vita lavorativa. In bocca al lupo ragazzi!",
        "likes": "27",
        "time": {
          "raw": "3ay",
          "parsed": "12.12.2024",
          "isoString": "2024-12-12T05:05:38.325Z"
        },
        "mediaType": "image",
        "mediaContent": [
          "https://media.licdn.com/dms/image/v2/D5622AQFR1Y-7lGi3Pg/feedshare-shrink_800/feedshare-shrink_800/0/1731942602714?e=1744848000&v=beta&t=6vRmU1uRHfKtpfmhHbUOzTfCarsgQJzj2vrStzLNQEc",
          "https://media.licdn.com/dms/image/v2/D5622AQGDbGjPJ8SJjA/feedshare-shrink_800/feedshare-shrink_800/0/1731942602790?e=1744848000&v=beta&t=JMRBMnCIFE7qXu-5_aezg8s8b-nhKeB_3jjr2C2N9s8",
          "https://media.licdn.com/dms/image/v2/D5622AQF4q8J_cEVbzQ/feedshare-shrink_800/feedshare-shrink_800/0/1731942602558?e=1744848000&v=beta&t=xt95qUbxQTfER79y3qG-f8J-ZT2j0qP-ttKzt66zUt4"
        ],
        "date": "2024-12-12T05:05:38.325Z"
      },
      {
        "captions": "Saremo presenti ad Ecomondo 2024, dal 5 all’8 Novembre. Ci troverete al Rimini Expo Centre, Hall C3, Stand 301. Non mancate!\n\nWe will be at Ecomondo 2024, from 5th to 8th November. You will find us at Rimini Expo Centre, Hall C3, Stand 301. Be there!\n\n#ecomondo #idromec #shearbaler #recyclingSaremo presenti ad Ecomondo 2024, dal 5 all’8 Novembre. Ci troverete al Rimini Expo Centre, Hall C3, Stand 301. Non mancate!\n\nWe will be at Ecomondo 2024, from 5th to 8th November. You will find us at Rimini Expo Centre, Hall C3, Stand 301. Be there!\n\n#ecomondo #idromec #shearbaler #recycling",
        "likes": "10",
        "shares": "1",
        "time": {
          "raw": "4ay",
          "parsed": "12.11.2024",
          "isoString": "2024-11-12T05:05:38.326Z"
        },
        "mediaType": "image",
        "mediaContent": [
          "https://media.licdn.com/dms/image/v2/D4D22AQGn9yC8IazGhA/feedshare-shrink_800/feedshare-shrink_800/0/1730667175460?e=1744848000&v=beta&t=Pz3pScgc8jljBRiloXmOb3TsJS49DuG6xziDXtadjsA"
        ],
        "date": "2024-11-12T05:05:38.326Z"
      },
      {
        "likes": "14",
        "comments": "2",
        "time": {
          "raw": "7ay",
          "parsed": "12.08.2024",
          "isoString": "2024-08-12T05:05:38.329Z"
        },
        "mediaType": "image",
        "mediaContent": [
          "https://media.licdn.com/dms/image/v2/D4D22AQFSEU_gXbc6Ag/feedshare-shrink_800/feedshare-shrink_800/0/1722880521861?e=1744848000&v=beta&t=CknKrZva_TJOPI0y0sdIWjXBKpNlxAT5KKd6o9RIc0Y"
        ],
        "date": "2024-08-12T05:05:38.329Z"
      },
      {
        "captions": "11st July 1969: exactly 55 years ago Idromec was born.\nHere’s a pic from the early 80s\n#idromec #shearbaler #recycling11st July 1969: exactly 55 years ago Idromec was born.\nHere’s a pic from the early 80s\n#idromec #shearbaler #recycling",
        "likes": "28",
        "shares": "2",
        "time": {
          "raw": "8ay",
          "parsed": "12.07.2024",
          "isoString": "2024-07-12T05:05:38.332Z"
        },
        "mediaType": "image",
        "mediaContent": [
          "https://media.licdn.com/dms/image/v2/D4D22AQEOPJl_NH_Nuw/feedshare-shrink_800/feedshare-shrink_800/0/1720711243102?e=1744848000&v=beta&t=VRZCPOUgSwgmqshPbepMwFOMuD2TPziAQ40lOBXYNO0"
        ],
        "date": "2024-07-12T05:05:38.332Z"
      },
      {
        "captions": "Last day in IFAT!!! You can find us at Hall C5 stand 328!\n#ifat #shearbaler #idromec #recycling",
        "likes": "16",
        "comments": "2",
        "shares": "1",
        "time": {
          "raw": "9ay",
          "parsed": "12.06.2024",
          "isoString": "2024-06-12T05:05:38.335Z"
        },
        "mediaType": "video",
        "mediaContent": {
          "src": [
            {
              "src": "https://dms.licdn.com/playlist/vid/v2/D4D05AQHd08j_AhLPcg/feedshare-ambry-analyzed_servable_progressive_video/feedshare-ambry-analyzed_servable_progressive_video/0/1715939640900?e=1742364000&v=beta&t=C6fhehap1Ft7jSW0LjFc1kutWadjqf40G4PHLRDdBU4",
              "type": "video/quicktime",
              "data-bitrate": 14993888
            },
            {
              "src": "https://dms.licdn.com/playlist/vid/v2/D4D05AQHd08j_AhLPcg/mp4-640p-30fp-crf28/mp4-640p-30fp-crf28/0/1715939657955?e=1742364000&v=beta&t=A5qhu5V7MN-y95ZA5x7UTlxaQn2Ag57a8cAXP168fHo",
              "type": "video/mp4",
              "data-bitrate": 812715
            },
            {
              "src": "https://dms.licdn.com/playlist/vid/v2/D4D05AQHd08j_AhLPcg/mp4-720p-30fp-crf28/mp4-720p-30fp-crf28/0/1715939657894?e=1742364000&v=beta&t=rDxTBM0sBeKS_eRx2sS9kezgn77_niFHARE-OF9aaNM",
              "type": "video/mp4",
              "data-bitrate": 1136998
            }
          ],
          "posterUrl": "https://media.licdn.com/dms/image/v2/D4D05AQHd08j_AhLPcg/videocover-high/videocover-high/0/1715939642735?e=1742364000&v=beta&t=J0YiKpjmWXniCn7PPkIuyXlaXPuCa3hFHraZe2eB2IE"
        },
        "date": "2024-06-12T05:05:38.335Z"
      },
      {
        "captions": "4th day at IFAT 2024! Visit us at Hall C5, stand 328!\n#ifat #shearbaler #idromec #recycling4th day at IFAT 2024! Visit us at Hall C5, stand 328!\n#ifat #shearbaler #idromec #recycling",
        "likes": "16",
        "shares": "2",
        "time": {
          "raw": "9ay",
          "parsed": "12.06.2024",
          "isoString": "2024-06-12T05:05:38.337Z"
        },
        "mediaType": "image",
        "mediaContent": [
          "https://media.licdn.com/dms/image/v2/D4D22AQFBVLE0qQ1u6g/feedshare-shrink_800/feedshare-shrink_800/0/1715872649696?e=1744848000&v=beta&t=wnD-x5xPWcrQbScy8nrAyYWHtNEZfzKVfx_hMOIKTu8",
          "https://media.licdn.com/dms/image/v2/D4D22AQGDN7ntpRg0aw/feedshare-shrink_800/feedshare-shrink_800/0/1715872650289?e=1744848000&v=beta&t=u8Hy3Tuv4WdFpOGkNQQiNjafMJRI9I-I9tkHB5QdSZM",
          "https://media.licdn.com/dms/image/v2/D4D22AQE4zGmaAcUpCQ/feedshare-shrink_800/feedshare-shrink_800/0/1715872650065?e=1744848000&v=beta&t=Az5ZweYJw87-4LTHBvvxKItOxVyDMD7DzFsDadoMyBg",
          "https://media.licdn.com/dms/image/v2/D4D22AQETq5NINzJ7xg/feedshare-shrink_800/feedshare-shrink_800/0/1715872650292?e=1744848000&v=beta&t=3hPHBy8WUuOK5asKQreA-WW2iJ4gXrLoRAIrqLJleKQ"
        ],
        "date": "2024-06-12T05:05:38.337Z"
      },
      {
        "captions": "IFAT day 2: visit us at Hall C5 stand 328! We will show you our balers and shearbalers!\n#ifat #shearbaler #idromec #recyclingIFAT day 2: visit us at Hall C5 stand 328! We will show you our balers and shearbalers!\n#ifat #shearbaler #idromec #recycling",
        "likes": "9",
        "comments": "1",
        "time": {
          "raw": "10ay",
          "parsed": "12.05.2024",
          "isoString": "2024-05-12T05:05:38.342Z"
        },
        "mediaType": "image",
        "mediaContent": [
          "https://media.licdn.com/dms/image/v2/D4D22AQG_SjHZQAWEzQ/feedshare-shrink_800/feedshare-shrink_800/0/1715691824133?e=1744848000&v=beta&t=dvLvmOZ_tINfKJ5UcHZ8smrlDOP9EPwKz_dwv19IHaA",
          "https://media.licdn.com/dms/image/v2/D4D22AQGHzJSNEgOKyQ/feedshare-shrink_800/feedshare-shrink_800/0/1715691826502?e=1744848000&v=beta&t=ZDSMzlVsuvbBQOci7hpCABgzYyLETsxwp3UFe7CfLvc",
          "https://media.licdn.com/dms/image/v2/D4D22AQGyaYemQvGn4g/feedshare-shrink_800/feedshare-shrink_800/0/1715691826522?e=1744848000&v=beta&t=QF-5FBj-RfRu897na36zWaSJ7Gcw0GXv6u4JStQrMEc",
          "https://media.licdn.com/dms/image/v2/D4D22AQHn0Mln-Hy26Q/feedshare-shrink_800/feedshare-shrink_800/0/1715691825438?e=1744848000&v=beta&t=rxaMKxAIYUoNpf2LgUl5Fl0FpXUFtMClRCavUBYrPJs"
        ],
        "date": "2024-05-12T05:05:38.342Z"
      },
      {
        "captions": "Are you ready? You can find us at Hall C5 stand 328!\n\n#idromec #shearbaler #ifat #recyclingAre you ready? You can find us at Hall C5 stand 328!\n\n#idromec #shearbaler #ifat #recycling",
        "likes": "16",
        "time": {
          "raw": "10ay",
          "parsed": "12.05.2024",
          "isoString": "2024-05-12T05:05:38.344Z"
        },
        "mediaType": "image",
        "mediaContent": [
          "https://media.licdn.com/dms/image/v2/D4D22AQF12pQKjwYrGg/feedshare-shrink_800/feedshare-shrink_800/0/1715588784121?e=1744848000&v=beta&t=JKCMmLLsumZqUhN91uNtRH7byC79EwSeNvMmjlRn-mc",
          "https://media.licdn.com/dms/image/v2/D4D22AQGikCnZ2jHaLw/feedshare-shrink_800/feedshare-shrink_800/0/1715588781704?e=1744848000&v=beta&t=p4a33lepOmslmU3cjfINIHAkPH-PYCyXvA00pcmocsE",
          "https://media.licdn.com/dms/image/v2/D4D22AQGS4YrZf187rg/feedshare-shrink_800/feedshare-shrink_800/0/1715588780834?e=1744848000&v=beta&t=rQnULELbioD763xzFykSAgyPDu6-n7_pmUorx7220-I"
        ],
        "date": "2024-05-12T05:05:38.344Z"
      },
      {
        "captions": "IFAT 2024 | 13-17 Maggio\nEccoci anche quest’anno alla fiera internazionale leader per la gestione dei rifiuti e delle materie prime. Venite a trovarci al Centro Fieristico di Monaco di Baviera, Hall C5 – Stand 328!\n \nIFAT 2024 | May 13-17\nHere we are once again at the world’s leading trade fair for waste and raw materials management.\nCome and visit us at the Munich Trade Fair Center, Hall C5 – Booth 328!\n\n#ifat #idromec #shearbaler #recyclingIFAT 2024 | 13-17 Maggio\nEccoci anche quest’anno alla fiera internazionale leader per la gestione dei rifiuti e delle materie prime. Venite a trovarci al Centro Fieristico di Monaco di Baviera, Hall C5 – Stand 328!\n \nIFAT 2024 | May 13-17\nHere we are once again at the world’s leading trade fair for waste and raw materials management.\nCome and visit us at the Munich Trade Fair Center, Hall C5 – Booth 328!\n\n#ifat #idromec #shearbaler #recycling",
        "likes": "18",
        "shares": "1",
        "time": {
          "raw": "10ay",
          "parsed": "12.05.2024",
          "isoString": "2024-05-12T05:05:38.345Z"
        },
        "mediaType": "image",
        "mediaContent": [
          "https://media.licdn.com/dms/image/v2/D4E22AQEm8XTOITdtyw/feedshare-shrink_800/feedshare-shrink_800/0/1715092209459?e=1744848000&v=beta&t=JxgpjMMOChLb1TzVN4HAN-XOVnqltG4CHwa_esuQraY"
        ],
        "date": "2024-05-12T05:05:38.345Z"
      },
      {
        "captions": "Visit us at Booth B6!\n#isri #idromec #shearbaler #recyclingVisit us at Booth B6!\n#isri #idromec #shearbaler #recycling",
        "likes": "12",
        "time": {
          "raw": "10ay",
          "parsed": "12.05.2024",
          "isoString": "2024-05-12T05:05:38.347Z"
        },
        "mediaType": "image",
        "mediaContent": [
          "https://media.licdn.com/dms/image/v2/D4D22AQEB2HHkHoFISQ/feedshare-shrink_800/feedshare-shrink_800/0/1713381796898?e=1744848000&v=beta&t=vLeZ7NA2eK1ImNhdsqJ11P_ZXpaHOqpw4BSuLggkRj8",
          "https://media.licdn.com/dms/image/v2/D4D22AQF4QvED2J-fHQ/feedshare-shrink_800/feedshare-shrink_800/0/1713381796347?e=1744848000&v=beta&t=KKBNt5riKLJzeWCQC14GWw0ZxZwuxSQ0ZCrdiRmIH-Y"
        ],
        "date": "2024-05-12T05:05:38.347Z"
      },
      {
        "captions": "Ready to startViva ISRI! We are ready for you!",
        "time": {
          "raw": "10ay11ay",
          "parsed": "12.03.2025",
          "isoString": "2025-03-12T05:05:38.350Z"
        },
        "mediaType": "video",
        "mediaContent": {
          "src": [
            {
              "src": "https://dms.licdn.com/playlist/vid/v2/D5605AQHjtUsPOmWqKg/feedshare-ambry-analyzed_servable_progressive_video/feedshare-ambry-analyzed_servable_progressive_video/0/1713225575593?e=1742364000&v=beta&t=8ZBcxd9gquZbETzv_TQYcDPHX_u3Ee8iMLWRH-ziDY0",
              "type": "video/quicktime",
              "data-bitrate": 12784870
            },
            {
              "src": "https://dms.licdn.com/playlist/vid/v2/D5605AQHjtUsPOmWqKg/mp4-640p-30fp-crf28/mp4-640p-30fp-crf28/0/1713225578724?e=1742364000&v=beta&t=tqAsltEtqkTgZvpCWpFG0pKrHr2BlEzhU5MdagGAkDk",
              "type": "video/mp4",
              "data-bitrate": 1176888
            },
            {
              "src": "https://dms.licdn.com/playlist/vid/v2/D5605AQHjtUsPOmWqKg/mp4-720p-30fp-crf28/mp4-720p-30fp-crf28/0/1713225579450?e=1742364000&v=beta&t=p3FDVX9d4-mvtLtMeHzscgy9-JslnYBAbf9QpjivF0w",
              "type": "video/mp4",
              "data-bitrate": 1547287
            }
          ],
          "posterUrl": "https://media.licdn.com/dms/image/v2/D5605AQHjtUsPOmWqKg/videocover-high/videocover-high/0/1713225574224?e=1742364000&v=beta&t=FSTIu_cFCm4gAk0yCuwy9wqhYndQWRQSjE7s1-pgQe0"
        },
        "date": "2025-03-12T05:05:38.350Z"
      },
      {
        "captions": "Viva ISRI! We are ready for you!",
        "time": {
          "raw": "11ay",
          "parsed": "12.04.2024",
          "isoString": "2024-04-12T05:05:38.351Z"
        },
        "mediaType": "video",
        "mediaContent": {
          "src": [
            {
              "src": "https://dms.licdn.com/playlist/vid/v2/D5605AQHjtUsPOmWqKg/feedshare-ambry-analyzed_servable_progressive_video/feedshare-ambry-analyzed_servable_progressive_video/0/1713225575593?e=1742364000&v=beta&t=8ZBcxd9gquZbETzv_TQYcDPHX_u3Ee8iMLWRH-ziDY0",
              "type": "video/quicktime",
              "data-bitrate": 12784870
            },
            {
              "src": "https://dms.licdn.com/playlist/vid/v2/D5605AQHjtUsPOmWqKg/mp4-640p-30fp-crf28/mp4-640p-30fp-crf28/0/1713225578724?e=1742364000&v=beta&t=tqAsltEtqkTgZvpCWpFG0pKrHr2BlEzhU5MdagGAkDk",
              "type": "video/mp4",
              "data-bitrate": 1176888
            },
            {
              "src": "https://dms.licdn.com/playlist/vid/v2/D5605AQHjtUsPOmWqKg/mp4-720p-30fp-crf28/mp4-720p-30fp-crf28/0/1713225579450?e=1742364000&v=beta&t=p3FDVX9d4-mvtLtMeHzscgy9-JslnYBAbf9QpjivF0w",
              "type": "video/mp4",
              "data-bitrate": 1547287
            }
          ],
          "posterUrl": "https://media.licdn.com/dms/image/v2/D5605AQHjtUsPOmWqKg/videocover-high/videocover-high/0/1713225574224?e=1742364000&v=beta&t=FSTIu_cFCm4gAk0yCuwy9wqhYndQWRQSjE7s1-pgQe0"
        },
        "date": "2024-04-12T05:05:38.351Z"
      },
      {
        "captions": "Almost ready to start at the Mandalay Bay Convention Center !!Almost ready to start at the Mandalay Bay Convention Center !!",
        "likes": "16",
        "shares": "1",
        "time": {
          "raw": "11ay",
          "parsed": "12.04.2024",
          "isoString": "2024-04-12T05:05:38.351Z"
        },
        "mediaType": "image",
        "mediaContent": [
          "https://media.licdn.com/dms/image/v2/D4D22AQE9QcfvqFL5IQ/feedshare-shrink_800/feedshare-shrink_800/0/1713180189376?e=1744848000&v=beta&t=6ZOJrHy4EzHT7uLzu_bwZcJ_wD_OszjxdiotGubTqY8",
          "https://media.licdn.com/dms/image/v2/D4D22AQHqYaV6zSdVzg/feedshare-shrink_800/feedshare-shrink_800/0/1713180185607?e=1744848000&v=beta&t=iJjJVegvGcBB2qz3HZbdNfRHUEfgrjjF7RudQA926mA",
          "https://media.licdn.com/dms/image/v2/D4D22AQEB-8nFf_Udng/feedshare-shrink_800/feedshare-shrink_800/0/1713180188767?e=1744848000&v=beta&t=EAOFi19iE4A6MlpUQfunFYe-SFnj_1fBpFuV2p0TB4M"
        ],
        "date": "2024-04-12T05:05:38.351Z"
      },
      {
        "captions": "Happy Easter!\n#idromec #shearbaler #recycling #peaceHappy Easter!\n#idromec #shearbaler #recycling #peace",
        "likes": "4",
        "time": {
          "raw": "11ay",
          "parsed": "12.04.2024",
          "isoString": "2024-04-12T05:05:38.353Z"
        },
        "mediaType": "image",
        "mediaContent": [
          "https://media.licdn.com/dms/image/v2/D4D22AQGBln2c_CLLEw/feedshare-shrink_800/feedshare-shrink_800/0/1711874287092?e=1744848000&v=beta&t=r7LEGU8BGF8xh9LaWQc3Ri5g10K8wHkeqsnPNfCvRFw"
        ],
        "date": "2024-04-12T05:05:38.353Z"
      },
      {
        "captions": "It’always a pleasure to meet you and Jose Pereyra!Spent a wonderful day with Olivo Tabarelli, the founder of IDROMEC SPA , a man who’s been my mentor and friend for 40 years!!\n\nThey just don’t make them like him anymore! \n\n#mentor #friendSpent a wonderful day with Olivo Tabarelli, the founder of IDROMEC SPA , a man who’s been my mentor and friend for 40 years!!\n\nThey just don’t make them like him anymore! \n\n#mentor #friend",
        "likes": "11",
        "time": {
          "raw": "11ay11ay",
          "parsed": "12.03.2025",
          "isoString": "2025-03-12T05:05:38.354Z"
        },
        "mediaType": "image",
        "mediaContent": [
          "https://media.licdn.com/dms/image/v2/D4D22AQHUmSrlzva4Jg/feedshare-shrink_800/feedshare-shrink_800/0/1710918869870?e=1744848000&v=beta&t=M76TQyq-S_NZ0FttVfhlnIlP3NMdRnEmJMV8lC_TrVo",
          "https://media.licdn.com/dms/image/v2/D4D22AQFoFERV18sIVw/feedshare-shrink_800/feedshare-shrink_800/0/1710918873460?e=1744848000&v=beta&t=jrKAKYM2j-WljnEnsQ3Kge5_0zA0Tnx1_LU0uhJEaHA",
          "https://media.licdn.com/dms/image/v2/D4D22AQFv-YvOSDfSeA/feedshare-shrink_800/feedshare-shrink_800/0/1710918872422?e=1744848000&v=beta&t=ChVlnz2LOvATrzu2js-g3hKNXcRVbW6XED2_RMH1l2U",
          "https://media.licdn.com/dms/image/v2/D4D22AQGlH5J_bjoE_Q/feedshare-shrink_800/feedshare-shrink_800/0/1710918873250?e=1744848000&v=beta&t=wbEKlRoVYM-bvm1_vGCFTdEXjskmcZAouY5X01HX_ls",
          "https://media.licdn.com/dms/image/v2/D4D22AQFAy6gxE3VWuA/feedshare-shrink_800/feedshare-shrink_800/0/1710918869086?e=1744848000&v=beta&t=a6NTlvVDla41XPNgb0JufeAsYiDV1yTtGXUv63gkjVc"
        ],
        "date": "2025-03-12T05:05:38.354Z"
      },
      {
        "captions": "Spent a wonderful day with Olivo Tabarelli, the founder of IDROMEC SPA , a man who’s been my mentor and friend for 40 years!!\n\nThey just don’t make them like him anymore! \n\n#mentor #friendSpent a wonderful day with Olivo Tabarelli, the founder of IDROMEC SPA , a man who’s been my mentor and friend for 40 years!!\n\nThey just don’t make them like him anymore! \n\n#mentor #friend",
        "likes": "11",
        "time": {
          "raw": "11ay",
          "parsed": "12.04.2024",
          "isoString": "2024-04-12T05:05:38.356Z"
        },
        "mediaType": "image",
        "mediaContent": [
          "https://media.licdn.com/dms/image/v2/D4D22AQHUmSrlzva4Jg/feedshare-shrink_800/feedshare-shrink_800/0/1710918869870?e=1744848000&v=beta&t=M76TQyq-S_NZ0FttVfhlnIlP3NMdRnEmJMV8lC_TrVo",
          "https://media.licdn.com/dms/image/v2/D4D22AQFoFERV18sIVw/feedshare-shrink_800/feedshare-shrink_800/0/1710918873460?e=1744848000&v=beta&t=jrKAKYM2j-WljnEnsQ3Kge5_0zA0Tnx1_LU0uhJEaHA",
          "https://media.licdn.com/dms/image/v2/D4D22AQFv-YvOSDfSeA/feedshare-shrink_800/feedshare-shrink_800/0/1710918872422?e=1744848000&v=beta&t=ChVlnz2LOvATrzu2js-g3hKNXcRVbW6XED2_RMH1l2U",
          "https://media.licdn.com/dms/image/v2/D4D22AQGlH5J_bjoE_Q/feedshare-shrink_800/feedshare-shrink_800/0/1710918873250?e=1744848000&v=beta&t=wbEKlRoVYM-bvm1_vGCFTdEXjskmcZAouY5X01HX_ls",
          "https://media.licdn.com/dms/image/v2/D4D22AQFAy6gxE3VWuA/feedshare-shrink_800/feedshare-shrink_800/0/1710918869086?e=1744848000&v=beta&t=a6NTlvVDla41XPNgb0JufeAsYiDV1yTtGXUv63gkjVc"
        ],
        "date": "2024-04-12T05:05:38.356Z"
      },
      {
        "captions": "Olivo Tabarelli, 93 years old, with over 70 years dedicated to the companies he built alongside his brother Luigi (Tabarelli spa in 1949 and Idromec spa in 1969). Every day. A lifetime where work was not just a duty, but a testament to responsibility and passion.Olivo Tabarelli, 93 years old, with over 70 years dedicated to the companies he built alongside his brother Luigi (Tabarelli spa in 1949 and Idromec spa in 1969). Every day. A lifetime where work was not just a duty, but a testament to responsibility and passion.",
        "likes": "54",
        "comments": "2",
        "time": {
          "raw": "1g",
          "parsed": "11.03.2025",
          "isoString": "2025-03-11T05:05:38.321Z"
        },
        "mediaType": "image",
        "mediaContent": [
          "https://media.licdn.com/dms/image/v2/D4D22AQHEPRCWdFqgAw/feedshare-shrink_800/B4DZWAeHLjHkAs-/0/1741617140215?e=1744848000&v=beta&t=NbAzCD04pT3Tie7wCA-xPElKVkzAT2FVBfaKirhcZnE"
        ],
        "date": "2025-03-11T05:05:38.321Z"
      }
    ]
  },
  {
    "name": "ZatoRecyclingSolutions",
    "followerData": [
      [
        20250225,
        null
      ],
      [
        20250225,
        null
      ],
      [
        20250225,
        null
      ],
      [
        20250228,
        null
      ],
      [
        20250228,
        null
      ],
      [
        20250228,
        null
      ],
      [
        20250228,
        null
      ],
      [
        20250303,
        null
      ],
      [
        1741011688717,
        "N/A"
      ],
      [
        1741076663727,
        "N/A"
      ],
      [
        1741077808102,
        "N/A"
      ],
      [
        1741083788631,
        "N/A"
      ],
      [
        1741084802887,
        "N/A"
      ],
      [
        1741170563944,
        null
      ],
      [
        1741755950587,
        null
      ]
    ],
    "data": [
      {
        "captions": "High volume density doesn’t mean higher value—especially in scrap logistics.\n\nIn Munich, one of our customers faced this exact issue: hot forming automotive scrap was too thin yet too bulky for efficient handling. Then came Zato Blue Devil—the twin-shaft shredder that downsizes and densifies light steel scrap, optimizes container loads, and reduces logistics costs.\n\nThe result? Greater efficiency, lower costs, less waste. Watch the shredder in action and see the difference!\n\n#ZATO #ZatoShredder #RecyclingEquipment #MetalRecycling #BlueDevil",
        "likes": "30",
        "comments": "1",
        "time": {
          "raw": "1h",
          "parsed": "05.03.2025",
          "isoString": "2025-03-05T05:05:50.368Z"
        },
        "mediaType": "video",
        "mediaContent": {
          "src": [
            {
              "src": "https://dms.licdn.com/playlist/vid/v2/D4D05AQHzL3tcvN7Ncg/mp4-640p-30fp-crf28/B4DZVNSdOcHYBg-/0/1740758454680?e=1742364000&v=beta&t=BzRFpIQlsrqBOZSf7Qd4pA9vYCglCsK21_dCawW8QvM",
              "type": "video/mp4",
              "data-bitrate": 1060634
            },
            {
              "src": "https://dms.licdn.com/playlist/vid/v2/D4D05AQHzL3tcvN7Ncg/mp4-720p-30fp-crf28/B4DZVNSdOcHYBk-/0/1740758456265?e=1742364000&v=beta&t=DzB33EsaZVkO1KqOTSE1KNpMXV-QFgQgTPPFzUZNBAA",
              "type": "video/mp4",
              "data-bitrate": 1349818
            }
          ],
          "posterUrl": "https://media.licdn.com/dms/image/v2/D4D05AQHzL3tcvN7Ncg/videocover-low/B4DZVNSdOcHYCQ-/0/1740758450800?e=1742364000&v=beta&t=hJ5ziUil9wxUYBGo41hwoKRWIXrs8dD2CkEKJIYgnXY"
        },
        "date": "2025-03-05T05:05:50.368Z"
      },
      {
        "captions": "Busheling nearing closer to $500/ton riding the wave as most metals are pushing higher on demand hopes. \n\nMaybe it’s time to think about how your yard is processing busheling. \n\nThis is Zato most popular application in the US and for good reason. \n\nSkeleton plates, production clips, coils, tubes, racking, fencing bundles, and lots of other clean iron products fly through our Blue Devil twin shaft. \n\nWith a production cost of only $11/ton and throughput up to 30 tons per hour, this machine is the answer to your question. \n\n“How can we grow this year?”\n\nPut down a concrete pad and we can install in two weeks. \n\n#scrap #zato #shredder #busheling #recycling #metals",
        "likes": "61",
        "comments": "3",
        "shares": "2",
        "time": {
          "raw": "2h",
          "parsed": "26.02.2025",
          "isoString": "2025-02-26T05:05:50.373Z"
        },
        "mediaType": "video",
        "mediaContent": {
          "src": [
            {
              "src": "https://dms.licdn.com/playlist/vid/v2/D5605AQHmIdzSeevx2w/mp4-640p-30fp-crf28/B56ZUpkOIYHoBc-/0/1740159500789?e=1742364000&v=beta&t=8tGx_hc2flcDxzXftTALiMOhZlToKpQ52ss9Wy30G6I",
              "type": "video/mp4",
              "data-bitrate": 744948
            },
            {
              "src": "https://dms.licdn.com/playlist/vid/v2/D5605AQHmIdzSeevx2w/mp4-720p-30fp-crf28/B56ZUpkOIYHoBg-/0/1740159499817?e=1742364000&v=beta&t=wkQh_Y9WOtOaHICW1xHEd18r_V1EmGwAld6Aq_gq2Nw",
              "type": "video/mp4",
              "data-bitrate": 992472
            }
          ],
          "posterUrl": "https://media.licdn.com/dms/image/v2/D5605AQHmIdzSeevx2w/videocover-high/B56ZUpkOIYHoBs-/0/1740159490902?e=1742364000&v=beta&t=nSrp0TT5Yyng3jeykubj8UJg5HDtPgwapwP8-TRXE3Q"
        },
        "date": "2025-02-26T05:05:50.373Z"
      },
      {
        "captions": "This is one of the nightmares of hammer mill operators: in Spanish it is called \"maraña\": tangled wire rod that jams the rotor, blocking the hammers and clogging the grids;\n\nOne of the ways of processing such material is to let it be devoured by the Zato Blue Devil: the final size is so beautiful that it is no longer necessary to pass it through the hammer mill: maximising the yield by simply \"thinking differently\"...",
        "likes": "74",
        "comments": "2",
        "shares": "1",
        "time": {
          "raw": "2h",
          "parsed": "26.02.2025",
          "isoString": "2025-02-26T05:05:50.374Z"
        },
        "mediaType": "video",
        "mediaContent": {
          "src": [
            {
              "src": "https://dms.licdn.com/playlist/vid/v2/D5605AQHT-P6KeYv0bQ/mp4-720p-30fp-crf28/B56ZUj70.WHsBs-/0/1740064659720?e=1742364000&v=beta&t=mKCfQbFUpY_9VL5PS1f8Stch2Czxc2b6J93VG2GpT0w",
              "type": "video/mp4",
              "data-bitrate": 1455367
            },
            {
              "src": "https://dms.licdn.com/playlist/vid/v2/D5605AQHT-P6KeYv0bQ/mp4-640p-30fp-crf28/B56ZUj70.WHsBo-/0/1740064660864?e=1742364000&v=beta&t=emy_0Dy_87kN6W4bIguQhSAmxc04wrE8AYUm8JE2hjk",
              "type": "video/mp4",
              "data-bitrate": 1135619
            }
          ],
          "posterUrl": "https://media.licdn.com/dms/image/v2/D5605AQHT-P6KeYv0bQ/videocover-low/B56ZUj70.WHsCY-/0/1740064657717?e=1742364000&v=beta&t=wJezg16cwxRfYWtaV0PFlluJe-xC0MtAbkaditrp270"
        },
        "date": "2025-02-26T05:05:50.374Z"
      },
      {
        "captions": "More and more companies are embracing circular economy principles, transforming scrap into valuable resources. Latin America’s metal recycling industry is following this path, driving demand for efficient, high-performance solutions.\n\nFor businesses seeking reliable partners in waste management, Zato brings over 25 years of expertise in designing and manufacturing hammermills, pre-shredders, scrap shears and scrap cleaning plants for ferrous and non-ferrous metals.\n\nMeet our experts at stand 1718 to explore smarter, more efficient metal recycling solutions.\n\n#ZATO #ZatoShredder #RecyclingEquipment #MetalRecycling #ResiduosExpo2025More and more companies are embracing circular economy principles, transforming scrap into valuable resources. Latin America’s metal recycling industry is following this path, driving demand for efficient, high-performance solutions.\n\nFor businesses seeking reliable partners in waste management, Zato brings over 25 years of expertise in designing and manufacturing hammermills, pre-shredders, scrap shears and scrap cleaning plants for ferrous and non-ferrous metals.\n\nMeet our experts at stand 1718 to explore smarter, more efficient metal recycling solutions.\n\n#ZATO #ZatoShredder #RecyclingEquipment #MetalRecycling #ResiduosExpo2025",
        "likes": "20",
        "comments": "1",
        "shares": "3",
        "time": {
          "raw": "2h",
          "parsed": "26.02.2025",
          "isoString": "2025-02-26T05:05:50.375Z"
        },
        "mediaType": "image",
        "mediaContent": [
          "https://media.licdn.com/dms/image/v2/D4D22AQGXcll2iVh5yg/feedshare-shrink_800/B4DZT.6aZMHYAg-/0/1739443516817?e=1744848000&v=beta&t=Tweahc8_IL9w7yPXNYhH0Tj2VDZ9DhIJnUfc2Sl27ec"
        ],
        "date": "2025-02-26T05:05:50.375Z"
      },
      {
        "captions": "Orders delivered on time, communication and zero stress—that's what Michela, Letizia, and Elisa ensure every day with their work.\n\nAs Zato's back office team, they keep everything on - managing orders, liaising with production and logistics, and making sure customers receive exactly what they need, when they need it. \n\nBecause great solutions deserve an even greater team behind them.\n\n#ZATO #ZatoShredder #RecyclingSolutions #ZatoTeam #BackOfficeOrders delivered on time, communication and zero stress—that's what Michela, Letizia, and Elisa ensure every day with their work.\n\nAs Zato's back office team, they keep everything on - managing orders, liaising with production and logistics, and making sure customers receive exactly what they need, when they need it. \n\nBecause great solutions deserve an even greater team behind them.\n\n#ZATO #ZatoShredder #RecyclingSolutions #ZatoTeam #BackOffice",
        "likes": "9",
        "time": {
          "raw": "3h",
          "parsed": "19.02.2025",
          "isoString": "2025-02-19T05:05:50.377Z"
        },
        "mediaType": "image",
        "mediaContent": [
          "https://media.licdn.com/dms/image/v2/D4D22AQHR-eOHaVaGoA/feedshare-shrink_800/B4DZT.4wJLG8Ak-/0/1739443080121?e=1744848000&v=beta&t=fcA6wtWGlp2Y1MWozpGRB0E6NR5aqLEVbfC5TArN0eg"
        ],
        "date": "2025-02-19T05:05:50.377Z"
      },
      {
        "captions": "It's been a busy start to the year for us at Zato and recycling as a whole. \n\nTwo weeks ago, the S&P Global Aluminum Symposium was held in Florida where manufacturers and recyclers alike took part in a massive industry update. \n\nThe most widely held sentiment: the US needs more secondary aluminum smelting.\n\nArconic expects AI infrastructure for water, energy, and grid maintenance to be a bolstering point for recycled aluminum. Military AND space exploration to be another demand sector.\n\nAlcoa says that with Alumina prices at all time highs, aluminum actually has more demand and is going to benefit.\n\nBank of America charts show aluminum supply growth has waned the last 4 years while demand for aluminum products has grown significantly. \n\nWhy does this matter to recyclers?\n\nSimilar to ferrous markets recently, as melt shops expand into more local US markets, they will need clean, sized, sorted material. Mixed aluminum and non-ferrous goods may keep you alive, but refined, specific grades keeps you growing.\n\nOur job at Zato is easy, keep supplying customers with equipment to create liberated, sized material for sorting. Low quality in, high quality out, under one roof.\n\nBlue Devil Twin Shaft Shredder: debales and pre-shreds full size aluminum scrap.\n\nBlue Marlin Single Shaft Shredder: downsizes extrusions and profiles to screen and sort.\n\nBlue Shark Compact Hammermill: shreds any aluminum material to a uniform size, liberate contaminants, and allow the best sorted product to be made.",
        "likes": "75",
        "comments": "6",
        "shares": "2",
        "time": {
          "raw": "4h",
          "parsed": "12.02.2025",
          "isoString": "2025-02-12T05:05:50.378Z"
        },
        "mediaType": "video",
        "mediaContent": {
          "src": [
            {
              "src": "https://dms.licdn.com/playlist/vid/v2/D5605AQFQjUHLybRAyg/mp4-640p-30fp-crf28/B56ZTxIQKsHQBc-/0/1739212271372?e=1742364000&v=beta&t=uWqKccOmD0GSPlm7RK1zX-3W2_DFOR2fu6BI0EhkiUU",
              "type": "video/mp4",
              "data-bitrate": 962349
            },
            {
              "src": "https://dms.licdn.com/playlist/vid/v2/D5605AQFQjUHLybRAyg/mp4-720p-30fp-crf28/B56ZTxIQKsHQBg-/0/1739212270992?e=1742364000&v=beta&t=lhbXT_ryDxWv0EaseuRa1xGcAEtylG8pT1D2L0x3HP4",
              "type": "video/mp4",
              "data-bitrate": 1258216
            }
          ],
          "posterUrl": "https://media.licdn.com/dms/image/v2/D5605AQFQjUHLybRAyg/videocover-high/B56ZTxIQKsHQBs-/0/1739212266224?e=1742364000&v=beta&t=FCeL_3sCTN0uhiFFVvz3lQcNG0YQEnyt3dwS6xxtx98"
        },
        "date": "2025-02-12T05:05:50.378Z"
      },
      {
        "captions": "Small in size, powerful in performance!\n\nThe Blue Shark 12.10 FP combines compactness, reliability, and exceptional efficiency to revolutionise metal recycling. Designed for shredding ferrous and nonferrous materials, it delivers high-purity outputs while ensuring ease of use, low maintenance, and superior durability.\n\nLooking for a smarter, more efficient recycling solution? Discover more about our hammer mill at https://lnkd.in/eyd-ysfE \n\n#ZATO #ZatoShredder #RecyclingSolutions #BlueShark #Hammermill Small in size, powerful in performance!\n\nThe Blue Shark 12.10 FP combines compactness, reliability, and exceptional efficiency to revolutionise metal recycling. Designed for shredding ferrous and nonferrous materials, it delivers high-purity outputs while ensuring ease of use, low maintenance, and superior durability.\n\nLooking for a smarter, more efficient recycling solution? Discover more about our hammer mill at https://lnkd.in/eyd-ysfE \n\n#ZATO #ZatoShredder #RecyclingSolutions #BlueShark #Hammermill",
        "likes": "24",
        "shares": "4",
        "time": {
          "raw": "1ay",
          "parsed": "12.02.2025",
          "isoString": "2025-02-12T05:05:50.379Z"
        },
        "mediaType": "image",
        "mediaContent": [
          "https://media.licdn.com/dms/image/v2/D4E22AQF_irlUGp5mUw/feedshare-shrink_800/B4EZTb4aT1HcAk-/0/1738855786591?e=1744848000&v=beta&t=GlmR4eSKJgJoEL8JxFEXNrKIAK_bLVSslm7oekMJbjU"
        ],
        "date": "2025-02-12T05:05:50.379Z"
      },
      {
        "captions": "Shredding hazardous materials such as fire extinguishers and previously bonified gas tanks is no easy task. The risks of explosions and equipment damage can disrupt operations and inflate costs.\n\nAll these problems can be solved by switching to the Blue Devil shredder. The result? Enhanced safety, reliable hammer mill protection, and improved operational efficiency.\n\nLearn more by watching the full video!\n\n#ZATO #ZatoShredder #RecyclingSolutions #TwinShaftShredder #BlueDevil",
        "likes": "47",
        "shares": "4",
        "time": {
          "raw": "1ay",
          "parsed": "12.02.2025",
          "isoString": "2025-02-12T05:05:50.380Z"
        },
        "mediaType": "video",
        "mediaContent": {
          "src": [
            {
              "src": "https://dms.licdn.com/playlist/vid/v2/D4D05AQE66Ol8QIcTwg/mp4-640p-30fp-crf28/B4DZStIJPQG8Bc-/0/1738071408246?e=1742364000&v=beta&t=UtqP64TuEK9fuGNDRLL0Pv5bWzvziNf3L4yD1X17tSg",
              "type": "video/mp4",
              "data-bitrate": 904424
            },
            {
              "src": "https://dms.licdn.com/playlist/vid/v2/D4D05AQE66Ol8QIcTwg/mp4-720p-30fp-crf28/B4DZStIJPQG8Bg-/0/1738071408741?e=1742364000&v=beta&t=7J8E6DoDr0sStQMpbQi3mkFAJH7Gllg8nMQImEjacz8",
              "type": "video/mp4",
              "data-bitrate": 1199877
            }
          ],
          "posterUrl": "https://media.licdn.com/dms/image/v2/D4D05AQE66Ol8QIcTwg/videocover-low/B4DZStIJPQG8CI-/0/1738071403279?e=1742364000&v=beta&t=cZj6kQEtPouKkQm9VVD1bcWv9khEX0vl6aWBpcwKCNI"
        },
        "date": "2025-02-12T05:05:50.380Z"
      },
      {
        "captions": "Safety and efficiency go hand in hand with Zato’s Blue Devil pre-shredder.\n\nDesigned to act as a ‘Guardian Angel’, the Blue Devil reduces explosion risks caused by, previously bonified, gas tanks ensuring a safe working environment. Its open design handles dangerous items without damage, minimising downtime and protecting your team and profits.\n\nInvest in safety and performance—discover more about Zato’s Blue Devil.\n\n#ZATO #ZatoShredder #RecyclingSolutions #TwinShaftShredder #BlueDevil",
        "likes": "13",
        "comments": "3",
        "shares": "2",
        "time": {
          "raw": "1ay",
          "parsed": "12.02.2025",
          "isoString": "2025-02-12T05:05:50.381Z"
        },
        "mediaType": "document",
        "mediaContent": {
          "title": "Can a pre-shredder protect you from gas tank explosions?",
          "subtitle": "4 sayfa",
          "totalPages": 4,
          "coverPages": [
            {
              "type": "image",
              "config": {
                "src": "https://media.licdn.com/dms/image/v2/D4D1FAQGH4EkSB_OCCg/feedshare-document-cover-images_480/B4DZSNX88DG4BM-/0/1737538660666?e=1742364000&v=beta&t=pVWfX_lO2O4fx1yGuXKqIzcHmzjON8f04oyUWvYH64M"
              }
            },
            {
              "type": "image",
              "config": {
                "src": "https://media.licdn.com/dms/image/v2/D4D1FAQGH4EkSB_OCCg/feedshare-document-cover-images_480/B4DZSNX88DG4BM-/1/1737538660666?e=1742364000&v=beta&t=NXR5UQgOPVMZwK9OA__hBN80TyQ8SHo1RWmJXKYVSk0"
              }
            },
            {
              "type": "image",
              "config": {
                "src": "https://media.licdn.com/dms/image/v2/D4D1FAQGH4EkSB_OCCg/feedshare-document-cover-images_480/B4DZSNX88DG4BM-/2/1737538660666?e=1742364000&v=beta&t=tbPvnk9a3hWg3Ruqj-gfQjRXW5mMRIX8PUZsUtOtTdE"
              }
            }
          ]
        },
        "date": "2025-02-12T05:05:50.381Z"
      },
      {
        "captions": "At a French customer’s facility, the Zato Blue Devil twin-shaft shredder turned challenges into solutions.\n\n- Cleaner separation\n- Reduced material volume\n- Optimised processes\n\nThe result? Increased efficiency and a satisfied client\n\nWatch the full video to see the Blue Devil in action and discover how it’s revolutionizing recycling processes!\n\n#ZATO #ZatoShredder #RecyclingSolutions #TwinShaftShredder #BlueDevil",
        "likes": "52",
        "comments": "1",
        "shares": "5",
        "time": {
          "raw": "1ay",
          "parsed": "05.02.2025",
          "isoString": "2025-02-05T10:29:23.683Z"
        },
        "mediaType": "video",
        "mediaContent": {
          "src": [
            {
              "src": "https://dms.licdn.com/playlist/vid/v2/D4D05AQGouUSlJ5ciEg/mp4-720p-30fp-crf28/B4DZSEYkJAG8Bg-/0/1737387870896?e=1741777200&v=beta&t=oeV8AwB3q03kVC2Il5dAAli6Xaz_AJNKBRGFh8i4jtM",
              "type": "video/mp4",
              "data-bitrate": 1143537
            },
            {
              "src": "https://dms.licdn.com/playlist/vid/v2/D4D05AQGouUSlJ5ciEg/mp4-640p-30fp-crf28/B4DZSEYkJAG8Bc-/0/1737387868796?e=1741777200&v=beta&t=CSpbuKi6ZASDt2rh4yE3mukE7P3Gccju1IoTO93ubmw",
              "type": "video/mp4",
              "data-bitrate": 882342
            }
          ],
          "posterUrl": "https://media.licdn.com/dms/image/v2/D4D05AQGouUSlJ5ciEg/videocover-low/B4DZSEYkJAG8CI-/0/1737387862519?e=1741777200&v=beta&t=oGijAjZYACVFjr1L_sKRIWU4sSlCjJ8qpBU6yolHP64"
        },
        "date": "2025-02-05T10:29:23.683Z"
      },
      {
        "captions": "Recycling teaches us that every ending is also a new beginning. ♻️✨\n\nAt Zato, we hope this festive season and the close of 2024 bring the same joy and success we’ve shared together this year, with a renewed promise to make the future even more sustainable.\n\nWishing you happy holidays from all of us at Zato!\n\n#ZATO #ZatoShredder #RecyclingEquipment Recycling teaches us that every ending is also a new beginning. ♻️✨\n\nAt Zato, we hope this festive season and the close of 2024 bring the same joy and success we’ve shared together this year, with a renewed promise to make the future even more sustainable.\n\nWishing you happy holidays from all of us at Zato!\n\n#ZATO #ZatoShredder #RecyclingEquipment",
        "likes": "7",
        "time": {
          "raw": "2ay",
          "parsed": "05.01.2025",
          "isoString": "2025-01-05T10:29:23.684Z"
        },
        "mediaType": "image",
        "mediaContent": [
          "https://media.licdn.com/dms/image/v2/D4D22AQEJFUUJcbvVsA/feedshare-shrink_800/B4DZPAYRqdHQAg-/0/1734099410386?e=1744243200&v=beta&t=AXPJXoG4sm9bwJDnU5_HKs1g8ERTpV9__C4b-uSkTXY"
        ],
        "date": "2025-01-05T10:29:23.684Z"
      },
      {
        "captions": "Driving innovation also means building connections—meet Wilma, Hanan, and Jenny, the Marketing Team behind Zato’s global presence.\n\nFrom developing creative strategies to organising industry events, their work ensures Zato’s cutting-edge solutions reach the right audience. Their experience ensures that our brand remains an industry leader and connects with customers around the world who trust our expertise.\n\nStay connected to learn more about the people powering Zato’s success!\n\n#ZATO #ZatoShredder #RecyclingSolutions #ZatoTeam #Marketing Driving innovation also means building connections—meet Wilma, Hanan, and Jenny, the Marketing Team behind Zato’s global presence.\n\nFrom developing creative strategies to organising industry events, their work ensures Zato’s cutting-edge solutions reach the right audience. Their experience ensures that our brand remains an industry leader and connects with customers around the world who trust our expertise.\n\nStay connected to learn more about the people powering Zato’s success!\n\n#ZATO #ZatoShredder #RecyclingSolutions #ZatoTeam #Marketing",
        "likes": "20",
        "shares": "3",
        "time": {
          "raw": "2ay",
          "parsed": "05.01.2025",
          "isoString": "2025-01-05T10:29:23.685Z"
        },
        "mediaType": "image",
        "mediaContent": [
          "https://media.licdn.com/dms/image/v2/D4D22AQET0XhCI1JfOw/feedshare-shrink_800/B4DZPaShOEGUAk-/0/1734534110225?e=1744243200&v=beta&t=yYrOXW2srXcFr_YPtwYoKm4RKSWVKqQOt3Gd8FEP3l4"
        ],
        "date": "2025-01-05T10:29:23.685Z"
      },
      {
        "captions": "Your biggest investment is likely not living up to it’s full potential. \n\nHammermills are revolutionary to metal recyclers, transforming you from a collection point to a recycling site. \n\nBut is there more you can get out of your hammermill? \n- YES!\n\n4 of our newest customers allowed us to gather data before and after the installation of a Zato Blue Devil. \n\nNot only was production nearly doubled at every site, but downtime decreased dramatically. \n\nWhy?\n\nIt’s pretty simple - bulky material into a shredder is like eating a full head of lettuce, sure you could do it. \n\nBut if you chopped it up into smaller pieces, you could do it a lot faster and without hurting yourself. \n\nIts the same idea with shred feed. Not only are the pieces smaller, you also remove pressurized containers, or unshreddables.  \n\nRecycle safer. Recycle better. \n\nRecycled Materials Association (ReMA) Recycling Today #scrap #shredder #zato #steelYour biggest investment is likely not living up to it’s full potential. \n\nHammermills are revolutionary to metal recyclers, transforming you from a collection point to a recycling site. \n\nBut is there more you can get out of your hammermill? \n- YES!\n\n4 of our newest customers allowed us to gather data before and after the installation of a Zato Blue Devil. \n\nNot only was production nearly doubled at every site, but downtime decreased dramatically. \n\nWhy?\n\nIt’s pretty simple - bulky material into a shredder is like eating a full head of lettuce, sure you could do it. \n\nBut if you chopped it up into smaller pieces, you could do it a lot faster and without hurting yourself. \n\nIts the same idea with shred feed. Not only are the pieces smaller, you also remove pressurized containers, or unshreddables.  \n\nRecycle safer. Recycle better. \n\nRecycled Materials Association (ReMA) Recycling Today #scrap #shredder #zato #steel",
        "likes": "33",
        "shares": "3",
        "time": {
          "raw": "2ay",
          "parsed": "05.01.2025",
          "isoString": "2025-01-05T10:29:23.686Z"
        },
        "mediaType": "image",
        "mediaContent": [
          "https://media.licdn.com/dms/image/v2/D5622AQEdcinRjpYjpw/feedshare-shrink_2048_1536/B56ZPQyU4lGsAs-/0/1734374674844?e=1744243200&v=beta&t=y_ncIelBvbZppEd1RB4b0iZrpVvQ2wcIRmjYI73daPw"
        ],
        "date": "2025-01-05T10:29:23.686Z"
      },
      {
        "captions": "Big moves don’t happen without blood, sweat, and years of hustle. Standing here in front of our new Zato BlueDevil shredder, I can’t help but think about all the people who made this happen.\n\nThis isn’t just a machine—it’s a symbol of countless late nights, tough decisions, and relentless hard work by every single person on our team. It’s proof that when you grind together, you grow together.\n\nBut don’t get it twisted—we’re far from done. This is just the next step in our journey, and we’re coming for more. Let’s keep building, keep hustling, and keep proving that nothing’s out of reach. 🔥🔧⚙️\n\n#BuiltByHardWork #TeamGrit #NextLevel #ScrapLife #StillGrindingBig moves don’t happen without blood, sweat, and years of hustle. Standing here in front of our new Zato BlueDevil shredder, I can’t help but think about all the people who made this happen.\n\nThis isn’t just a machine—it’s a symbol of countless late nights, tough decisions, and relentless hard work by every single person on our team. It’s proof that when you grind together, you grow together.\n\nBut don’t get it twisted—we’re far from done. This is just the next step in our journey, and we’re coming for more. Let’s keep building, keep hustling, and keep proving that nothing’s out of reach. 🔥🔧⚙️\n\n#BuiltByHardWork #TeamGrit #NextLevel #ScrapLife #StillGrinding",
        "likes": "98",
        "comments": "9",
        "shares": "1",
        "time": {
          "raw": "2ay",
          "parsed": "05.01.2025",
          "isoString": "2025-01-05T10:29:23.688Z"
        },
        "mediaType": "image",
        "mediaContent": [
          "https://media.licdn.com/dms/image/v2/D5622AQHtL2D69yQSVA/feedshare-shrink_800/feedshare-shrink_800/0/1733505013979?e=1744243200&v=beta&t=jhDSNH2pkBzX9sl2Wa-izzqeBr_ibo8vf_cvuQ-RHtk"
        ],
        "date": "2025-01-05T10:29:23.688Z"
      },
      {
        "captions": "Blue Devil available for install as soon as next week! \n\nOur latest installation of a Zato slow speed rotary shear is testing out some different applications. \n\nWith tires, the main draw is increasing density to lower shipping costs. A truck packed full of shredded tires is beating the weight on a truck of full size tires everyday. \n\nSame business case for stainless steel, shredded iron, aluminum, and many other materials. \n#scrap #tires #shredder #zato",
        "likes": "58",
        "comments": "6",
        "shares": "5",
        "time": {
          "raw": "3ay",
          "parsed": "05.12.2024",
          "isoString": "2024-12-05T10:29:23.689Z"
        },
        "mediaType": "video",
        "mediaContent": {
          "src": [
            {
              "src": "https://dms.licdn.com/playlist/vid/v2/D5605AQGP1kxrwdqTYg/mp4-640p-30fp-crf28/mp4-640p-30fp-crf28/0/1733340964892?e=1741777200&v=beta&t=6gTc5OC0AHfpeO1lijZJuvmasgrfI18gArnO4SmC-bs",
              "type": "video/mp4",
              "data-bitrate": 1109375
            },
            {
              "src": "https://dms.licdn.com/playlist/vid/v2/D5605AQGP1kxrwdqTYg/mp4-720p-30fp-crf28/mp4-720p-30fp-crf28/0/1733340966551?e=1741777200&v=beta&t=u_i1EUjf0nrhP0V9hkhKJM5q1nnIXtb7cysfDEtePz0",
              "type": "video/mp4",
              "data-bitrate": 1420914
            }
          ],
          "posterUrl": "https://media.licdn.com/dms/image/v2/D5605AQGP1kxrwdqTYg/videocover-low/videocover-low/0/1733340954078?e=1741777200&v=beta&t=OhKpor38MvrBpw8LLYwzGZOd0cPdb42vFgRWAtcN-yw"
        },
        "date": "2024-12-05T10:29:23.689Z"
      },
      {
        "captions": "Meet the team behind the reliability and quality of every Zato product.\n\nOur Production Team, based in Prevalle, carefully assembles each component in-house, overseeing every step of the process to ensure robust, durable, and high-performing solutions. With meticulous quality checks and a streamlined production process, they’re dedicated to delivering our equipment on time and to the highest standards. A commitment to quality you can trust.\n\n#ZATO #ZatoShredder #Recyclingsolutions #ZatoTeam #ProductionTeamMeet the team behind the reliability and quality of every Zato product.\n\nOur Production Team, based in Prevalle, carefully assembles each component in-house, overseeing every step of the process to ensure robust, durable, and high-performing solutions. With meticulous quality checks and a streamlined production process, they’re dedicated to delivering our equipment on time and to the highest standards. A commitment to quality you can trust.\n\n#ZATO #ZatoShredder #Recyclingsolutions #ZatoTeam #ProductionTeam",
        "likes": "24",
        "shares": "1",
        "time": {
          "raw": "3ay",
          "parsed": "05.12.2024",
          "isoString": "2024-12-05T10:29:23.690Z"
        },
        "mediaType": "image",
        "mediaContent": [
          "https://media.licdn.com/dms/image/v2/D4E22AQF9LpR1TUOk2Q/feedshare-shrink_800/feedshare-shrink_800/0/1732032548625?e=1744243200&v=beta&t=_M8g6TQxADYDYprAYJLVFUzwOf-XSSRMzH9MV2szLkQ"
        ],
        "date": "2024-12-05T10:29:23.690Z"
      },
      {
        "captions": "Discover the advanced shredding system that’s transforming Access Recycling Services!\n\nFeaturing a seamless integration of the Blue Devil pre-shredder, the fully automated 1,200 HP Blue Shark hammer mill, and the Blue Sorter separation line, this solution is engineered for precision, safety, and efficiency. It minimizes downtime while boosting processing speed and output.\n\nWatch the video to see how this Australian company has optimized its scrap processing!\n\n#ZATO #ZatoShredder #RecyclingEquipment #TwinShaftShredder",
        "likes": "85",
        "comments": "2",
        "shares": "2",
        "time": {
          "raw": "3ay",
          "parsed": "05.12.2024",
          "isoString": "2024-12-05T10:29:23.691Z"
        },
        "mediaType": "video",
        "mediaContent": {
          "src": [
            {
              "src": "https://dms.licdn.com/playlist/vid/v2/D5605AQGTvfQLZGYUvA/mp4-640p-30fp-crf28/mp4-640p-30fp-crf28/0/1731948359092?e=1741777200&v=beta&t=9fYUJyNVNSKpvBTT_JqTLfchzhTjlUK2z7nrpSijD5M",
              "type": "video/mp4",
              "data-bitrate": 911373
            },
            {
              "src": "https://dms.licdn.com/playlist/vid/v2/D5605AQGTvfQLZGYUvA/mp4-720p-30fp-crf28/mp4-720p-30fp-crf28/0/1731948357127?e=1741777200&v=beta&t=5EzUzRX7FxKR7wMPyjxXAmPMXjh1ZSj0-zhV-q2dd2g",
              "type": "video/mp4",
              "data-bitrate": 1228857
            }
          ],
          "posterUrl": "https://media.licdn.com/dms/image/v2/D5605AQGTvfQLZGYUvA/videocover-low/videocover-low/0/1731948330141?e=1741777200&v=beta&t=7kRrxXrM-6_OnbVQYc6ha06woLDG2llIQO_dYpDwPkc"
        },
        "date": "2024-12-05T10:29:23.691Z"
      },
      {
        "captions": "A key event addressing the impact of climate disruption, ZATO will showcase its innovative solutions at the Pollutec Paris 2024 trade fair.\n\nFrom November 26th to 27th, explore our comprehensive range of technologies for shredding and processing both ferrous and non-ferrous scrap materials.\n\nConnect with us at stand E041. Don't miss this opportunity!\n\n#ZATO #ZatoShredder #RecyclingEquipment #PollutecParisA key event addressing the impact of climate disruption, ZATO will showcase its innovative solutions at the Pollutec Paris 2024 trade fair.\n\nFrom November 26th to 27th, explore our comprehensive range of technologies for shredding and processing both ferrous and non-ferrous scrap materials.\n\nConnect with us at stand E041. Don't miss this opportunity!\n\n#ZATO #ZatoShredder #RecyclingEquipment #PollutecParis",
        "likes": "14",
        "time": {
          "raw": "3ay",
          "parsed": "05.12.2024",
          "isoString": "2024-12-05T10:29:23.692Z"
        },
        "mediaType": "image",
        "mediaContent": [
          "https://media.licdn.com/dms/image/v2/D4D22AQEqsjksjm73xg/feedshare-shrink_800/feedshare-shrink_800/0/1731339480831?e=1744243200&v=beta&t=HeQFmoUj2s4j3WuCuIImfi29B8aJ1ULU1jDsYAnxcT4"
        ],
        "date": "2024-12-05T10:29:23.692Z"
      },
      {
        "captions": "Busheling. Light iron. White goods. Breakage. Car bodies. Pre-shredding. Cast and Sheet Aluminum. Heavy melt.\n\nThrough one machine, our Blue Devil. \n\nWe’ve added lots of new customers in the US🇺🇸 this year. \n\nWe are learning new applications and outlets every month as the market changes. \n\nAnd as our product count grows here, so do we. \n\nWhich is why we’ve invested in a new office in Northern Kentucky and grown our employee headcount by 100% this year. \n\nZato North America stocks all of our parts and blades here now. 🔩⚙️\n\nService and support technicians are here year round now. \n\nI’m looking forward to an exciting end of the year and strong growth going into 2025! \n\nSee you next week at the Shredder Ops Forum in San Antonio! ✌🏼\n\n#zato #metal #recycling #recycledmaterials Recycled Materials Association (ReMA)",
        "likes": "75",
        "shares": "3",
        "time": {
          "raw": "3ay",
          "parsed": "05.12.2024",
          "isoString": "2024-12-05T10:29:23.693Z"
        },
        "mediaType": "video",
        "mediaContent": {
          "src": [
            {
              "src": "https://dms.licdn.com/playlist/vid/v2/D5605AQHL6ZxmQ_KhUQ/mp4-640p-30fp-crf28/mp4-640p-30fp-crf28/0/1730834092791?e=1741777200&v=beta&t=m0bH6menr5hf9T39K2Dd3vt03zZEMIOJAu-fdmAXyy8",
              "type": "video/mp4",
              "data-bitrate": 851946
            },
            {
              "src": "https://dms.licdn.com/playlist/vid/v2/D5605AQHL6ZxmQ_KhUQ/mp4-720p-30fp-crf28/mp4-720p-30fp-crf28/0/1730834089330?e=1741777200&v=beta&t=vCNcYXMkr3nKoi683T8cgQ2lNCg9suggRGBm_tlxKuw",
              "type": "video/mp4",
              "data-bitrate": 1171792
            }
          ],
          "posterUrl": "https://media.licdn.com/dms/image/v2/D5605AQHL6ZxmQ_KhUQ/videocover-high/videocover-high/0/1730834081697?e=1741777200&v=beta&t=RsDT_ik_pEM97bSGV7NKp6UEz8JtDC0KM1f0lZ0eonQ"
        },
        "date": "2024-12-05T10:29:23.693Z"
      },
      {
        "captions": "The ultimate system for precision, durability and efficiency in one shear: Cayman RB!\n\nWith its robust frame and high-bore cylinder, it delivers powerful cutting forces, effortlessly processing railway and tramway rails up to 70 kg/m. Equipped with four-profile interchangeable blades and simplified hydraulic rotation, it ensures smooth operation and reduced maintenance.\n\n#ZATO #ZatoShredder #RecyclingEquipmentThe ultimate system for precision, durability and efficiency in one shear: Cayman RB!\n\nWith its robust frame and high-bore cylinder, it delivers powerful cutting forces, effortlessly processing railway and tramway rails up to 70 kg/m. Equipped with four-profile interchangeable blades and simplified hydraulic rotation, it ensures smooth operation and reduced maintenance.\n\n#ZATO #ZatoShredder #RecyclingEquipment",
        "likes": "16",
        "time": {
          "raw": "3ay",
          "parsed": "05.12.2024",
          "isoString": "2024-12-05T10:29:23.694Z"
        },
        "mediaType": "image",
        "mediaContent": [
          "https://media.licdn.com/dms/image/v2/D4D22AQFHukb0ADdYVQ/feedshare-shrink_800/feedshare-shrink_800/0/1730822756416?e=1744243200&v=beta&t=YhCsXatFQN-Z40knlr9ZZW5KHyFy2wHMVu6r3eoz0bM"
        ],
        "date": "2024-12-05T10:29:23.694Z"
      },
      {
        "captions": "4.5m³ loading mouth. 315 kW power. 78 blades working in sync.\n\nThe Blue Storm twin-shaft shredder is engineered for maximum efficiency and precision. With differentiated rotor speeds (3.5–4.5 rpm), it downsizes, densifies, and maximizes material value. Light scrap, WEEE, cables, aluminum—nothing goes to waste.\n\nLooking for a smarter, more powerful shredding solution? Learn more at https://lnkd.in/dvz4bbsi \n\n#ZATO #ZatoShredder #RecyclingSolutions #BlueStorm #TwinShaftShredder4.5m³ loading mouth. 315 kW power. 78 blades working in sync.\n\nThe Blue Storm twin-shaft shredder is engineered for maximum efficiency and precision. With differentiated rotor speeds (3.5–4.5 rpm), it downsizes, densifies, and maximizes material value. Light scrap, WEEE, cables, aluminum—nothing goes to waste.\n\nLooking for a smarter, more powerful shredding solution? Learn more at https://lnkd.in/dvz4bbsi \n\n#ZATO #ZatoShredder #RecyclingSolutions #BlueStorm #TwinShaftShredder",
        "likes": "14",
        "time": {
          "raw": "4g",
          "parsed": "08.03.2025",
          "isoString": "2025-03-08T05:05:50.366Z"
        },
        "mediaType": "image",
        "mediaContent": [
          "https://media.licdn.com/dms/image/v2/D4D22AQHiZXTSxgwfAQ/feedshare-shrink_800/B4DZVwMyMBHAAg-/0/1741344155626?e=1744848000&v=beta&t=pG_b86jDXG5MOvLZSuj3QBi8ehObzaXqXczuKvIK_58"
        ],
        "date": "2025-03-08T05:05:50.366Z"
      }
    ]
  },
  {
    "name": "Sennebogen",
    "followerData": [
      [
        20250225,
        26192
      ],
      [
        20250225,
        26194
      ],
      [
        20250228,
        26230
      ],
      [
        20250228,
        26230
      ],
      [
        20250228,
        26230
      ],
      [
        20250228,
        26230
      ],
      [
        20250303,
        26264
      ],
      [
        1741011719166,
        "26.267"
      ],
      [
        1741076686937,
        "26.273"
      ],
      [
        1741077832428,
        "26.273"
      ],
      [
        1741083805810,
        "26.275"
      ],
      [
        1741084819580,
        "26.274"
      ],
      [
        1741170582891,
        26291
      ],
      [
        1741755973677,
        26438
      ]
    ],
    "data": [
      {
        "captions": "𝟲𝟲 𝗝𝗮𝗵𝗿𝗲 𝗭𝘂𝘀𝗮𝗺𝗺𝗲𝗻𝗮𝗿𝗯𝗲𝗶𝘁: 𝗦𝗘𝗡𝗡𝗘𝗕𝗢𝗚𝗘𝗡 𝘂𝗻𝗱 𝗥𝗼𝘁𝗵𝗲 𝗘𝗿𝗱𝗲 𝗳𝗲𝗶𝗲𝗿𝗻 𝗝𝘂𝗯𝗶𝗹ä𝘂𝗺 🤝\n\nSENNEBOGEN und Rothe Erde feiern 66 Jahre erfolgreiche Partnerschaft! Seit 1959 liefert Rothe Erde, einer der führenden Hersteller von Großwälzlagern, hochwertige Wälzlager für die Maschinen von SENNEBOGEN – vom Umschlagbagger bis zum Hafenkran. ⚙️\n\n🗨️ „Die Qualität und Zuverlässigkeit der Komponenten von Rothe Erde bilden seit Jahrzehnten eine verlässliche Basis für unsere innovativen und zuverlässigen Premiumprodukte“, so Erich Sennebogen, Geschäftsführer von SENNEBOGEN.\n\nZur Jubiläumsfeier wurde ein doppelreihiges Kugellager, das baugleich mit dem ersten gelieferten Modell aus 1959 ist, an das Erich Sennebogen-Museum überreicht. 👏\n\n💡Zum Artikel: https://lnkd.in/endMfxQJ\n\n_____\n\n𝟲𝟲 𝗬𝗲𝗮𝗿𝘀 𝗼𝗳 𝗣𝗮𝗿𝘁𝗻𝗲𝗿𝘀𝗵𝗶𝗽: 𝗦𝗘𝗡𝗡𝗘𝗕𝗢𝗚𝗘𝗡 𝗮𝗻𝗱 𝗥𝗼𝘁𝗵𝗲 𝗘𝗿𝗱𝗲 𝗖𝗲𝗹𝗲𝗯𝗿𝗮𝘁𝗲 𝗔𝗻𝗻𝗶𝘃𝗲𝗿𝘀𝗮𝗿𝘆 🤝\n\nSENNEBOGEN and Rothe Erde celebrate 66 years of successful collaboration! Since 1959, Rothe Erde, a leading manufacturer of large bearings, has supplied high-quality bearings for SENNEBOGEN machines – from material handlers to harbor cranes. ⚙️\n\n🗨️ \"The quality and reliability of Rothe Erde components have formed the foundation of our innovative and reliable premium products for decades,\" says Erich Sennebogen, CEO of SENNEBOGEN.\n\nTo mark the anniversary, a double-row ball bearing, identical to the first one delivered in 1959, was handed over to the Erich Sennebogen Museum. 👏\n\n💡Read more here: https://lnkd.in/e3s4uYDc\n\n#SENNEBOGEN #RotheErde #thyssenkrupp #Partnership #Maschinenbau #MOVEBIGTHINGS𝟲𝟲 𝗝𝗮𝗵𝗿𝗲 𝗭𝘂𝘀𝗮𝗺𝗺𝗲𝗻𝗮𝗿𝗯𝗲𝗶𝘁: 𝗦𝗘𝗡𝗡𝗘𝗕𝗢𝗚𝗘𝗡 𝘂𝗻𝗱 𝗥𝗼𝘁𝗵𝗲 𝗘𝗿𝗱𝗲 𝗳𝗲𝗶𝗲𝗿𝗻 𝗝𝘂𝗯𝗶𝗹ä𝘂𝗺 🤝\n\nSENNEBOGEN und Rothe Erde feiern 66 Jahre erfolgreiche Partnerschaft! Seit 1959 liefert Rothe Erde, einer der führenden Hersteller von Großwälzlagern, hochwertige Wälzlager für die Maschinen von SENNEBOGEN – vom Umschlagbagger bis zum Hafenkran. ⚙️\n\n🗨️ „Die Qualität und Zuverlässigkeit der Komponenten von Rothe Erde bilden seit Jahrzehnten eine verlässliche Basis für unsere innovativen und zuverlässigen Premiumprodukte“, so Erich Sennebogen, Geschäftsführer von SENNEBOGEN.\n\nZur Jubiläumsfeier wurde ein doppelreihiges Kugellager, das baugleich mit dem ersten gelieferten Modell aus 1959 ist, an das Erich Sennebogen-Museum überreicht. 👏\n\n💡Zum Artikel: https://lnkd.in/endMfxQJ\n\n_____\n\n𝟲𝟲 𝗬𝗲𝗮𝗿𝘀 𝗼𝗳 𝗣𝗮𝗿𝘁𝗻𝗲𝗿𝘀𝗵𝗶𝗽: 𝗦𝗘𝗡𝗡𝗘𝗕𝗢𝗚𝗘𝗡 𝗮𝗻𝗱 𝗥𝗼𝘁𝗵𝗲 𝗘𝗿𝗱𝗲 𝗖𝗲𝗹𝗲𝗯𝗿𝗮𝘁𝗲 𝗔𝗻𝗻𝗶𝘃𝗲𝗿𝘀𝗮𝗿𝘆 🤝\n\nSENNEBOGEN and Rothe Erde celebrate 66 years of successful collaboration! Since 1959, Rothe Erde, a leading manufacturer of large bearings, has supplied high-quality bearings for SENNEBOGEN machines – from material handlers to harbor cranes. ⚙️\n\n🗨️ \"The quality and reliability of Rothe Erde components have formed the foundation of our innovative and reliable premium products for decades,\" says Erich Sennebogen, CEO of SENNEBOGEN.\n\nTo mark the anniversary, a double-row ball bearing, identical to the first one delivered in 1959, was handed over to the Erich Sennebogen Museum. 👏\n\n💡Read more here: https://lnkd.in/e3s4uYDc\n\n#SENNEBOGEN #RotheErde #thyssenkrupp #Partnership #Maschinenbau #MOVEBIGTHINGS",
        "likes": "150",
        "comments": "4",
        "shares": "3",
        "time": {
          "raw": "1h",
          "parsed": "05.03.2025",
          "isoString": "2025-03-05T05:06:13.340Z"
        },
        "mediaType": "image",
        "mediaContent": [
          "https://media.licdn.com/dms/image/v2/D4E10AQEWHP1mbiGITQ/image-shrink_800/B4EZVLkrHgG0AI-/0/1740729661788?e=1742364000&v=beta&t=_z17cT7ZLABAC8XkMYOhqKtPYoBRsTglW3X3f0gJy6A"
        ],
        "date": "2025-03-05T05:06:13.340Z"
      },
      {
        "captions": "𝗡𝗲𝘄 𝟮𝟬𝟬 𝘁 𝗧𝗲𝗹𝗲𝘀𝗰𝗼𝗽𝗶𝗰 𝗖𝗿𝗮𝘄𝗹𝗲𝗿 𝗖𝗿𝗮𝗻𝗲: 𝗦𝗘𝗡𝗡𝗘𝗕𝗢𝗚𝗘𝗡 𝟲𝟮𝟬𝟯 𝗘 🆕\n\nWe are launching our new largest telecrane on crawlers yet, designed for demanding construction projects with 200 t load capacity. 💪\n\nInfrastructure, bridge, and wind turbine construction – the robust SENNEBOGEN 6203 E handles even the heaviest precast elements and components.  It's suitable for pick-and-carry operation and tasks on uneven construction sites, enabling working at angles of up to 4°. 🚧\n\n🏗️ Pin Boom can be telescoped up to 56.4 m and configured with various jib options, extendable up to 78 m boom length.\n🔧 Easy transport in just 7 transport units & capable of fast self-assembly\n📊 New SENcon Load Control for operator assistance: intuitive control system and valuable lifting data on a large, clearly organised display\n\n📰 Read more in the press release: 👉 https://bit.ly/3D6jm34\n\n🔥 See it live at bauma 2025 at the SENNEBOGEN booth!\nMore details: https://lnkd.in/eh7YATsp\n\n#TelescopicCrane #CrawlerCrane #HeavyLifting #ConstructionMachinery #Bauma2025 #MOVEBIGTHINGS #SENNEBOGEN #GreenHeartofbauma𝗡𝗲𝘄 𝟮𝟬𝟬 𝘁 𝗧𝗲𝗹𝗲𝘀𝗰𝗼𝗽𝗶𝗰 𝗖𝗿𝗮𝘄𝗹𝗲𝗿 𝗖𝗿𝗮𝗻𝗲: 𝗦𝗘𝗡𝗡𝗘𝗕𝗢𝗚𝗘𝗡 𝟲𝟮𝟬𝟯 𝗘 🆕\n\nWe are launching our new largest telecrane on crawlers yet, designed for demanding construction projects with 200 t load capacity. 💪\n\nInfrastructure, bridge, and wind turbine construction – the robust SENNEBOGEN 6203 E handles even the heaviest precast elements and components.  It's suitable for pick-and-carry operation and tasks on uneven construction sites, enabling working at angles of up to 4°. 🚧\n\n🏗️ Pin Boom can be telescoped up to 56.4 m and configured with various jib options, extendable up to 78 m boom length.\n🔧 Easy transport in just 7 transport units & capable of fast self-assembly\n📊 New SENcon Load Control for operator assistance: intuitive control system and valuable lifting data on a large, clearly organised display\n\n📰 Read more in the press release: 👉 https://bit.ly/3D6jm34\n\n🔥 See it live at bauma 2025 at the SENNEBOGEN booth!\nMore details: https://lnkd.in/eh7YATsp\n\n#TelescopicCrane #CrawlerCrane #HeavyLifting #ConstructionMachinery #Bauma2025 #MOVEBIGTHINGS #SENNEBOGEN #GreenHeartofbauma",
        "likes": "126",
        "comments": "1",
        "shares": "9",
        "time": {
          "raw": "1h",
          "parsed": "05.03.2025",
          "isoString": "2025-03-05T05:06:13.342Z"
        },
        "mediaType": "image",
        "mediaContent": [
          "https://media.licdn.com/dms/image/v2/D4E10AQF6UwHWS_F48A/image-shrink_800/B4EZVHfuU2GgAc-/0/1740661256314?e=1742364000&v=beta&t=OJ3N9c5EjouTLngBhqKjSb_Ibu9lprAD5e4rWWPPaiU",
          "https://media.licdn.com/dms/image/v2/D4E10AQFBYNQggClJfA/image-shrink_800/B4EZVHfuU_GgAc-/0/1740661254309?e=1742364000&v=beta&t=UDy0BrmloBTPKC0akGlZqnsqUngeNNpYFcE_ty9oy0o",
          "https://media.licdn.com/dms/image/v2/D4E10AQH4BPIffpatdQ/image-shrink_800/B4EZVHfuU9GgAc-/0/1740661254211?e=1742364000&v=beta&t=ZsAyLPCMg1GYANuUluUujjpVJufol01TR4aZT_6Cy84",
          "https://media.licdn.com/dms/image/v2/D4E10AQFnvIONpzoDnQ/image-shrink_800/B4EZVHfuUvH0Ac-/0/1740661254331?e=1742364000&v=beta&t=rwlQpJsm7ZHneY13UBQ20_Tb3sBxy08pKOETtG_AhIg",
          "https://media.licdn.com/dms/image/v2/D4E10AQH6dAB-nB8rkg/image-shrink_800/B4EZVHfuVBHcAk-/0/1740661254346?e=1742364000&v=beta&t=FlZkVTFTd2lBo2cs8MMwZN473rZNjOZ6bgmQgdqlErQ"
        ],
        "date": "2025-03-05T05:06:13.342Z"
      },
      {
        "captions": "𝗡𝗲𝘄: 𝗦𝗘𝗡𝗡𝗘𝗕𝗢𝗚𝗘𝗡 𝟴𝟯𝟬 𝗘 𝗗𝗲𝗺𝗼𝗹𝗶𝘁𝗶𝗼𝗻 𝗩𝗮𝗿𝗶𝗼 𝗧𝗼𝗼𝗹 𝘄𝗶𝘁𝗵 𝗗𝗶𝗴𝗴𝗶𝗻𝗴 𝗕𝗼𝗼𝗺 & 𝗕𝘂𝗰𝗸𝗲𝘁 🔥\n\nThe proven SENNEBOGEN 830 E Demolition machine is now becoming even more versatile with the new Vario Tool variant with two new equipment options:\n🆕 Robust 12 m digging boom\n🆕 1.7m³ digging bucket \n\n💡 Why is this important? Urban demolition projects are getting more complex, and debris recycling plus site preparation are now key tasks for modern demolition contractors.\n🚧 SENNEBOGEN now goes beyond demolition and sorting: offering solutions for earthmoving and foundation work as well.\n🔄 The quick-change system allows seamless switching between boom variants and attachments. One machine for multiple jobs saves you time and costs!\n\n📰 Read more in the press release: 👉 https://bit.ly/4kcVVFU\n\n💚 See this exhibit live at bauma 2025 trade fair in Munich!\nLearn more here: https://lnkd.in/eh7YATsp\n\n#Demolition #Excavator #Abbruchbagger #Abbruch #ConstructionMachinery #HeavyEquipment #Bauma2025 #MOVEBIGTHINGS #SENNEBOGEN, the #GreenHeartofbauma𝗡𝗲𝘄: 𝗦𝗘𝗡𝗡𝗘𝗕𝗢𝗚𝗘𝗡 𝟴𝟯𝟬 𝗘 𝗗𝗲𝗺𝗼𝗹𝗶𝘁𝗶𝗼𝗻 𝗩𝗮𝗿𝗶𝗼 𝗧𝗼𝗼𝗹 𝘄𝗶𝘁𝗵 𝗗𝗶𝗴𝗴𝗶𝗻𝗴 𝗕𝗼𝗼𝗺 & 𝗕𝘂𝗰𝗸𝗲𝘁 🔥\n\nThe proven SENNEBOGEN 830 E Demolition machine is now becoming even more versatile with the new Vario Tool variant with two new equipment options:\n🆕 Robust 12 m digging boom\n🆕 1.7m³ digging bucket \n\n💡 Why is this important? Urban demolition projects are getting more complex, and debris recycling plus site preparation are now key tasks for modern demolition contractors.\n🚧 SENNEBOGEN now goes beyond demolition and sorting: offering solutions for earthmoving and foundation work as well.\n🔄 The quick-change system allows seamless switching between boom variants and attachments. One machine for multiple jobs saves you time and costs!\n\n📰 Read more in the press release: 👉 https://bit.ly/4kcVVFU\n\n💚 See this exhibit live at bauma 2025 trade fair in Munich!\nLearn more here: https://lnkd.in/eh7YATsp\n\n#Demolition #Excavator #Abbruchbagger #Abbruch #ConstructionMachinery #HeavyEquipment #Bauma2025 #MOVEBIGTHINGS #SENNEBOGEN, the #GreenHeartofbauma",
        "likes": "94",
        "comments": "2",
        "shares": "9",
        "time": {
          "raw": "2h",
          "parsed": "26.02.2025",
          "isoString": "2025-02-26T05:06:13.344Z"
        },
        "mediaType": "image",
        "mediaContent": [
          "https://media.licdn.com/dms/image/v2/D5610AQFxxzmW3eiEPA/image-shrink_800/B56ZU9MsZpGsAc-/0/1740488494331?e=1742364000&v=beta&t=nNNYM8BBnLw1YLuu0DXXBosH2BLG4_YNIA7RWPnpvNg",
          "https://media.licdn.com/dms/image/v2/D5610AQGew4LUogli_g/image-shrink_800/B56ZU9MsaGGUAs-/0/1740488496045?e=1742364000&v=beta&t=YhH5unVgwgaNj58XddNO2-GHcGluDHuUA8PpQ3Wt9Dg",
          "https://media.licdn.com/dms/image/v2/D5610AQHGTQqTpCxR0A/image-shrink_800/B56ZU9MsX4HoAo-/0/1740488493891?e=1742364000&v=beta&t=i8K_vTwKb7vVjWv1YMuF0UXyEHS0_NoNXK9Riy0yQMI",
          "https://media.licdn.com/dms/image/v2/D5610AQHQ2ogoCmcrOw/image-shrink_800/B56ZU9MsZnGsAg-/0/1740488497515?e=1742364000&v=beta&t=xPlp1B2BjcTVaN9LTCzH5BdP5Ap5mrncQmuoL4k3Los"
        ],
        "date": "2025-02-26T05:06:13.344Z"
      },
      {
        "captions": "𝗡𝗲𝘄 𝗦𝗘𝗡𝗡𝗘𝗕𝗢𝗚𝗘𝗡 𝟯𝟲𝟬 𝗚 – 𝗧𝗵𝗲 𝗜𝗻𝗱𝘂𝘀𝘁𝗿𝗶𝗮𝗹 𝟲 𝘁 𝗧𝗲𝗹𝗲𝗵𝗮𝗻𝗱𝗹𝗲𝗿 🆕\n\nThe SENNEBOGEN 360 G takes telehandler performance to a whole new level: With its robust steel construction it is built for demanding multi-shift operations in industrial applications and more. 🏭\n\n💪 The best of both worlds: combining the power and Z-kinematics of a wheel loader with the agility of a telehandler. The new addition to our portfolio boosts with even faster work cycles and higher efficiency.  \n🔝 Heavy lifter with a 6 t load capacity and an 8.5 m stacking height.\n👷 Newly redesigned Multicab for maximum operator benefits: The cab can be raised to 4.25 m view height, providing an optimal view of trucks, containers, and the entire jobsite. \n🔇Noise & vibration protection, ergonomic controls, and an intuitive touch display ensure a fatigue-free and highly efficient workspace.\n🔄 Versatile & customizable: Choose from a wide range of attachments, equipment options, and tire variants to tailor the 360 G to your needs.\n\n📢 Learn more in the press release:\n➡️ https://bit.ly/4h2hNBn\n\n📍 Join us at bauma Munich in April 2025 to see the 360 G at our booth!\n➡️ https://lnkd.in/eh7YATsp\n\n#Sennebogen360G #Telehandler #Teleskoplader #Industrielader #Wheelloader #MaterialHandling #Bauma2025 #MOVEBIGTHINGS with #SENNEBOGEN, the #GreenHeartofBauma 💚𝗡𝗲𝘄 𝗦𝗘𝗡𝗡𝗘𝗕𝗢𝗚𝗘𝗡 𝟯𝟲𝟬 𝗚 – 𝗧𝗵𝗲 𝗜𝗻𝗱𝘂𝘀𝘁𝗿𝗶𝗮𝗹 𝟲 𝘁 𝗧𝗲𝗹𝗲𝗵𝗮𝗻𝗱𝗹𝗲𝗿 🆕\n\nThe SENNEBOGEN 360 G takes telehandler performance to a whole new level: With its robust steel construction it is built for demanding multi-shift operations in industrial applications and more. 🏭\n\n💪 The best of both worlds: combining the power and Z-kinematics of a wheel loader with the agility of a telehandler. The new addition to our portfolio boosts with even faster work cycles and higher efficiency.  \n🔝 Heavy lifter with a 6 t load capacity and an 8.5 m stacking height.\n👷 Newly redesigned Multicab for maximum operator benefits: The cab can be raised to 4.25 m view height, providing an optimal view of trucks, containers, and the entire jobsite. \n🔇Noise & vibration protection, ergonomic controls, and an intuitive touch display ensure a fatigue-free and highly efficient workspace.\n🔄 Versatile & customizable: Choose from a wide range of attachments, equipment options, and tire variants to tailor the 360 G to your needs.\n\n📢 Learn more in the press release:\n➡️ https://bit.ly/4h2hNBn\n\n📍 Join us at bauma Munich in April 2025 to see the 360 G at our booth!\n➡️ https://lnkd.in/eh7YATsp\n\n#Sennebogen360G #Telehandler #Teleskoplader #Industrielader #Wheelloader #MaterialHandling #Bauma2025 #MOVEBIGTHINGS with #SENNEBOGEN, the #GreenHeartofBauma 💚",
        "likes": "134",
        "shares": "33",
        "time": {
          "raw": "2h",
          "parsed": "26.02.2025",
          "isoString": "2025-02-26T05:06:13.346Z"
        },
        "mediaType": "image",
        "mediaContent": [
          "https://media.licdn.com/dms/image/v2/D4E10AQEMang9rNsVwA/image-shrink_800/B4EZUizafDGgAU-/0/1740045660184?e=1742364000&v=beta&t=WUhAbyj7w7OGQ-MSkImpQ_Q034EGy4PGZSNyEi0Oc3I",
          "https://media.licdn.com/dms/image/v2/D4E10AQFm-kQMEuCMIA/image-shrink_800/B4EZUizafCGgAg-/0/1740045658945?e=1742364000&v=beta&t=je7R_26issd7NCEABVG6L6oo9OcYEWeIOXxROA8h4AM",
          "https://media.licdn.com/dms/image/v2/D4E10AQEwM-1pdZK-Yw/image-shrink_800/B4EZUizafCHcAc-/0/1740045659775?e=1742364000&v=beta&t=re1e9qRMDhNEPv24zgwpXSF-krD2lmCOJol5m88BLfY",
          "https://media.licdn.com/dms/image/v2/D4E10AQEDs4y_VW63mw/image-shrink_800/B4EZUizae2HgAc-/0/1740045659239?e=1742364000&v=beta&t=3nodt1O_KokwJ0kNE22uhUVFgVga02HBBKwNeQ8G-Mc",
          "https://media.licdn.com/dms/image/v2/D4E10AQGJyG5vOlJqrQ/image-shrink_800/B4EZUizae1GgAg-/0/1740045659868?e=1742364000&v=beta&t=RrgUjIzignDLwQV_QS-KYW1CHASwmSyA8l9BwXbzBL4"
        ],
        "date": "2025-02-26T05:06:13.346Z"
      },
      {
        "captions": "𝗜𝗻𝘁𝗿𝗼𝗱𝘂𝗰𝗶𝗻𝗴 𝘁𝗵𝗲 𝗡𝗲𝘄 𝗦𝗘𝗡𝗡𝗘𝗕𝗢𝗚𝗘𝗡 𝟴𝟯𝟬 𝗚 – 𝗧𝗵𝗲 𝗡𝗲𝘅𝘁 𝗘𝘃𝗼𝗹𝘂𝘁𝗶𝗼𝗻 𝗶𝗻 𝗠𝗮𝘁𝗲𝗿𝗶𝗮𝗹 𝗛𝗮𝗻𝗱𝗹𝗶𝗻𝗴! 🆕\n\nThe SENNEBOGEN 830 has been upgraded to the newest G-Series machine generation! The powerful 830 G material handler delivers enhanced efficiency, performance, and operator comfort. \n\n💪 Up to 17 m reach and a 38 t operating weight make the 830 G ideal for demanding scrap handling, recycling, timber, and port applications.\n✅ With its modular design, and various undercarriage and attachment options, SENNEBOGEN can provide you with the ideal solution for your jobsite.\n🍃 Optimized for low fuel consumption, reduced emissions, and HVO capability.\n👷 New Maxcab Comfort Cab: Designed for operator comfort, featuring the best view, a vibration-resistant workspace, ergonomic climate-controlled seating, and active noise cancellation.\n🕹️ With SENcon Control System: The revolutionary new SENcon provides intuitive operation, individual driver profiles, real-time machine insights, remote diagnostics, and over-the-air updates.\n\nLearn more about the 830 G in the press release: \n➡️ https://bit.ly/4b42mac\n\n📍 Join us at Bauma 2025 in Munich in April to see the 830 G at our booth! \n➡️ https://www.sennebogen.com\n\n#MaterialHandling #MaterialHandler #Umschlagbagger #830G #SENcon #Bauma2025 #MOVEBIGTHINGS #SENNEBOGEN the #GreenHeartofBauma 💚𝗜𝗻𝘁𝗿𝗼𝗱𝘂𝗰𝗶𝗻𝗴 𝘁𝗵𝗲 𝗡𝗲𝘄 𝗦𝗘𝗡𝗡𝗘𝗕𝗢𝗚𝗘𝗡 𝟴𝟯𝟬 𝗚 – 𝗧𝗵𝗲 𝗡𝗲𝘅𝘁 𝗘𝘃𝗼𝗹𝘂𝘁𝗶𝗼𝗻 𝗶𝗻 𝗠𝗮𝘁𝗲𝗿𝗶𝗮𝗹 𝗛𝗮𝗻𝗱𝗹𝗶𝗻𝗴! 🆕\n\nThe SENNEBOGEN 830 has been upgraded to the newest G-Series machine generation! The powerful 830 G material handler delivers enhanced efficiency, performance, and operator comfort. \n\n💪 Up to 17 m reach and a 38 t operating weight make the 830 G ideal for demanding scrap handling, recycling, timber, and port applications.\n✅ With its modular design, and various undercarriage and attachment options, SENNEBOGEN can provide you with the ideal solution for your jobsite.\n🍃 Optimized for low fuel consumption, reduced emissions, and HVO capability.\n👷 New Maxcab Comfort Cab: Designed for operator comfort, featuring the best view, a vibration-resistant workspace, ergonomic climate-controlled seating, and active noise cancellation.\n🕹️ With SENcon Control System: The revolutionary new SENcon provides intuitive operation, individual driver profiles, real-time machine insights, remote diagnostics, and over-the-air updates.\n\nLearn more about the 830 G in the press release: \n➡️ https://bit.ly/4b42mac\n\n📍 Join us at Bauma 2025 in Munich in April to see the 830 G at our booth! \n➡️ https://www.sennebogen.com\n\n#MaterialHandling #MaterialHandler #Umschlagbagger #830G #SENcon #Bauma2025 #MOVEBIGTHINGS #SENNEBOGEN the #GreenHeartofBauma 💚",
        "likes": "193",
        "comments": "2",
        "shares": "31",
        "time": {
          "raw": "3h",
          "parsed": "19.02.2025",
          "isoString": "2025-02-19T05:06:13.348Z"
        },
        "mediaType": "image",
        "mediaContent": [
          "https://media.licdn.com/dms/image/v2/D4E10AQGbZ8WxvU5SNg/image-shrink_800/B4EZUZXmyzGYAc-/0/1739887374473?e=1742364000&v=beta&t=Bfl7hprRS4WVfAR-jdFg1eHHnMKowJM722MWjtPlz0c",
          "https://media.licdn.com/dms/image/v2/D4E10AQGmhyqMPVKFYw/image-shrink_800/B4EZUZXmy1HMAg-/0/1739887374924?e=1742364000&v=beta&t=4Nrl035wno2FeLJGJ_WYP6Q9b-5HQnYh_IDOi0E7R34",
          "https://media.licdn.com/dms/image/v2/D4E10AQHkn49nGzbgQg/image-shrink_800/B4EZUZXmz3G0Ac-/0/1739887374721?e=1742364000&v=beta&t=Ns9BWhtvS5LSNgQmn4SmWgM3lTzCT2fQrLAw6j4AQmk",
          "https://media.licdn.com/dms/image/v2/D4E10AQHol_2AdEFonA/image-shrink_800/B4EZUZXmzhHUAc-/0/1739887374472?e=1742364000&v=beta&t=cOYWrQDR38sckRl7WJGma8YK_1X_jmE7xwUjko2aYHM",
          "https://media.licdn.com/dms/image/v2/D4E10AQEX41trpZCHrA/image-shrink_800/B4EZUZXmyxHcAc-/0/1739887375362?e=1742364000&v=beta&t=CYL3cMmVB9j3bqwgqHgll4OIn2UPcP_pv1-ZbXFIAxw"
        ],
        "date": "2025-02-19T05:06:13.348Z"
      },
      {
        "captions": "𝗡𝗲𝘄 𝗦𝗘𝗡𝗰𝗼𝗻 𝗦𝗘𝗡𝗡𝗘𝗕𝗢𝗚𝗘𝗡 𝗠𝗮𝗰𝗵𝗶𝗻𝗲 𝗖𝗼𝗻𝘁𝗿𝗼𝗹 𝗦𝘆𝘀𝘁𝗲𝗺 📱🆕\n\nIntroducing our new SENcon control system: Smart, more intuitive, future-ready! Designed for operators, fleet managers, and service technicians, SENcon ensures maximum efficiency, safety, and ease of use with a range of powerful features:\n\n🕹️ Customizable Driver Profiles: Adjust joystick settings and machine parameters for personalized comfort and precision.\n💡 Intelligent Assistance Systems: Features like the Virtual Wall and load weighing increase accuracy and safety.\n📊 Real-time Machine Monitoring: Get instant insights into machine performance and live diagnostics for optimal efficiency.\n🔧 Remote Service Support: Diagnose issues remotely, minimize downtime, and ensure fast, targeted maintenance.\n🔄 Wireless Over-the-air Software Updates: Always up to date, no on-site visits needed.\n✅ Seamless Fleet Integration: Connect with SENtrack telematics system to optimize performance, maintenance, and energy efficiency.\n\nLearn more in the press release: ➡️ https://bit.ly/3CQFGh9\n\n🔜 Stay tuned for the first SENNEBOGEN machines featuring the new SENcon! We will soon introduce the new machines for bauma 2025!\n\n#SENcon #SmartControl #MaterialHandling #FleetManagement #Automation #bauma2025 #GreenHeartofbauma #MOVEBIGTHINGS #SENNEBOGEN𝗡𝗲𝘄 𝗦𝗘𝗡𝗰𝗼𝗻 𝗦𝗘𝗡𝗡𝗘𝗕𝗢𝗚𝗘𝗡 𝗠𝗮𝗰𝗵𝗶𝗻𝗲 𝗖𝗼𝗻𝘁𝗿𝗼𝗹 𝗦𝘆𝘀𝘁𝗲𝗺 📱🆕\n\nIntroducing our new SENcon control system: Smart, more intuitive, future-ready! Designed for operators, fleet managers, and service technicians, SENcon ensures maximum efficiency, safety, and ease of use with a range of powerful features:\n\n🕹️ Customizable Driver Profiles: Adjust joystick settings and machine parameters for personalized comfort and precision.\n💡 Intelligent Assistance Systems: Features like the Virtual Wall and load weighing increase accuracy and safety.\n📊 Real-time Machine Monitoring: Get instant insights into machine performance and live diagnostics for optimal efficiency.\n🔧 Remote Service Support: Diagnose issues remotely, minimize downtime, and ensure fast, targeted maintenance.\n🔄 Wireless Over-the-air Software Updates: Always up to date, no on-site visits needed.\n✅ Seamless Fleet Integration: Connect with SENtrack telematics system to optimize performance, maintenance, and energy efficiency.\n\nLearn more in the press release: ➡️ https://bit.ly/3CQFGh9\n\n🔜 Stay tuned for the first SENNEBOGEN machines featuring the new SENcon! We will soon introduce the new machines for bauma 2025!\n\n#SENcon #SmartControl #MaterialHandling #FleetManagement #Automation #bauma2025 #GreenHeartofbauma #MOVEBIGTHINGS #SENNEBOGEN",
        "likes": "144",
        "comments": "2",
        "shares": "25",
        "time": {
          "raw": "3h",
          "parsed": "19.02.2025",
          "isoString": "2025-02-19T05:06:13.350Z"
        },
        "mediaType": "image",
        "mediaContent": [
          "https://media.licdn.com/dms/image/v2/D4E10AQElnUv2wdccZA/image-shrink_800/B4EZUU0UV_HcAk-/0/1739811015163?e=1742364000&v=beta&t=o1swl0a1IjKOqbYYLZhtrG1DxHTWWkYF9_Qq0dRhhPU",
          "https://media.licdn.com/dms/image/v2/D4E10AQGfXwbt8SdYow/image-shrink_800/B4EZUU0UXEG0Ac-/0/1739811015140?e=1742364000&v=beta&t=ydipL5jvAjxHHdB6RJg9szOmWAw6Un1Q_Z7CEnaZ0zE",
          "https://media.licdn.com/dms/image/v2/D4E10AQFqDpKZiEu7zg/image-shrink_800/B4EZUU0UV5H0Ac-/0/1739811016770?e=1742364000&v=beta&t=dmNn0jXEXeO_wCfsut5hk5QYyqpCGbUpcXc86ifTXPY",
          "https://media.licdn.com/dms/image/v2/D4E10AQECEbH3LAkW7Q/image-shrink_800/B4EZUU0UW3HgAc-/0/1739811015489?e=1742364000&v=beta&t=uOoH5rlVKCpr-Dia3efBJ8JbZve_p37t6dQd3pxa60s",
          "https://media.licdn.com/dms/image/v2/D4E10AQH735ffGOfRJA/image-shrink_800/B4EZUU0UV7HgAc-/0/1739811015267?e=1742364000&v=beta&t=tvD3JeLJPVHb-Nyzfl1oV-8a6B3DfoCNXYXzCnWseCk"
        ],
        "date": "2025-02-19T05:06:13.350Z"
      },
      {
        "captions": "A special Valentine’s Day card just arrived! ✉️💚\nFeel free to share it with someone who moves big things in your life! 💐\n\nRoses are red, \nviolets are blue, \nlet's move big things - \njust me and you!\n\nSpeaking of sweethearts... have you heard about the Green Heart of bauma? SENNEBOGEN will be at the bauma 2025 trade fair in Munich with a large booth and many exciting machines. 🙌 \nStay tuned for more coming very soon:  https://lnkd.in/eh7YATsp\n\n#valentinesday #valentinstag #valentinescard #materialhandling #HeavyEquipment #GreenHeartofbauma #bauma2025 #MOVEBIGTHINGS #SENNEBOGENA special Valentine’s Day card just arrived! ✉️💚\nFeel free to share it with someone who moves big things in your life! 💐\n\nRoses are red, \nviolets are blue, \nlet's move big things - \njust me and you!\n\nSpeaking of sweethearts... have you heard about the Green Heart of bauma? SENNEBOGEN will be at the bauma 2025 trade fair in Munich with a large booth and many exciting machines. 🙌 \nStay tuned for more coming very soon:  https://lnkd.in/eh7YATsp\n\n#valentinesday #valentinstag #valentinescard #materialhandling #HeavyEquipment #GreenHeartofbauma #bauma2025 #MOVEBIGTHINGS #SENNEBOGEN",
        "likes": "93",
        "comments": "1",
        "shares": "7",
        "time": {
          "raw": "3h",
          "parsed": "19.02.2025",
          "isoString": "2025-02-19T05:06:13.352Z"
        },
        "mediaType": "image",
        "mediaContent": [
          "https://media.licdn.com/dms/image/v2/D4E10AQG1KHA7GLHKhQ/image-shrink_800/B4EZUDec_wGwAc-/0/1739520070609?e=1742364000&v=beta&t=X96NZ3HY1TjwisAP0xzybesC5e3E0vL9yeCbLgVTbdQ"
        ],
        "date": "2025-02-19T05:06:13.352Z"
      },
      {
        "captions": "𝗦𝗘𝗡𝗡𝗘𝗕𝗢𝗚𝗘𝗡 & 𝗗𝗘𝗨𝗧𝗭: 𝗦𝘁𝗿𝗼𝗻𝗴 𝗽𝗮𝗿𝘁𝗻𝗲𝗿𝘀𝗵𝗶𝗽 𝗰𝗼𝗻𝘁𝗶𝗻𝘂𝗲𝘀 𝘁𝗼 𝗴𝗿𝗼𝘄💪🚜\nBavarian machines and Cologne engines – a success story for over 70 years! 🤝\nSince the 1950s, SENNEBOGEN has relied on the reliable engines from DEUTZ AG. Over the years, this partnership has grown steadily, and today DEUTZ engines power numerous SENNEBOGEN machines around the world. 🌍\n🌱 This long-standing partnership is now being further strengthened: In addition to the integration of DEUTZ diesel engines in selected SENNEBOGEN models, the focus of the collaboration will also be on alternative drive concepts. Battery-electric and hydrogen-based drives offer a sustainable option for the future. 🔋\n💬 \"We see many positive synergies in an intensified collaboration. Especially in the off-highway application, we can jointly develop new, forward-looking solutions\", says managing director Erich Sennebogen.\n💡 Learn more in our press release: ➡️ https://bit.ly/4jStDAA\n\n𝗦𝗘𝗡𝗡𝗘𝗕𝗢𝗚𝗘𝗡 & 𝗗𝗘𝗨𝗧𝗭: 𝗦𝘁𝗮𝗿𝗸𝗲 𝗣𝗮𝗿𝘁𝗻𝗲𝗿𝘀𝗰𝗵𝗮𝗳𝘁 𝘄𝗶𝗿𝗱 𝘄𝗲𝗶𝘁𝗲𝗿 𝗮𝘂𝘀𝗴𝗲𝗯𝗮𝘂𝘁💪🚜\nBayerische Maschinen und Kölner Motoren – eine Erfolgsgeschichte seit über 70 Jahren! 🤝 \nSchon in den 1950er Jahren vertraute SENNEBOGEN auf die zuverlässigen Motoren von DEUTZ AG. Seither wurde die Zusammenarbeit stetig ausgebaut, sodass heute DEUTZ-Motoren in zahlreichen SENNEBOGEN Maschinen rund um die Welt im Einsatz sind. 🌍\n🌱Diese langjährige Partnerschaft wird nun weiter vertieft: Neben dem Einbau von DEUTZ Dieselmotoren in ausgewählten SENNEBOGEN Modellen wird ein Fokus der Zusammenarbeit auch auf alternativen Antriebkonzepten liegen. Batterieelektrische und wasserstoffbasierte Antriebe bieten eine nachhaltige Option für die Zukunft. 🔋 \n💬 „Wir sehen viele positive Synergien in einer intensiveren Zusammenarbeit. Gerade in der Off-Highway-Anwendung können wir zusammen neue, zukunftsweisende Lösungen realisieren,“ so Geschäftsführer Erich Sennebogen.\n💡Mehr in der Pressemeldung: ➡️ https://bit.ly/3Xi0Zzh\n\n#Innovation #Nachhaltigkeit #AlternativeAntriebe #Sustainability #AlternativeDrives #OffHighway #DEUTZ #SENNEBOGEN #MOVEBIGTHINGS𝗦𝗘𝗡𝗡𝗘𝗕𝗢𝗚𝗘𝗡 & 𝗗𝗘𝗨𝗧𝗭: 𝗦𝘁𝗿𝗼𝗻𝗴 𝗽𝗮𝗿𝘁𝗻𝗲𝗿𝘀𝗵𝗶𝗽 𝗰𝗼𝗻𝘁𝗶𝗻𝘂𝗲𝘀 𝘁𝗼 𝗴𝗿𝗼𝘄💪🚜\nBavarian machines and Cologne engines – a success story for over 70 years! 🤝\nSince the 1950s, SENNEBOGEN has relied on the reliable engines from DEUTZ AG. Over the years, this partnership has grown steadily, and today DEUTZ engines power numerous SENNEBOGEN machines around the world. 🌍\n🌱 This long-standing partnership is now being further strengthened: In addition to the integration of DEUTZ diesel engines in selected SENNEBOGEN models, the focus of the collaboration will also be on alternative drive concepts. Battery-electric and hydrogen-based drives offer a sustainable option for the future. 🔋\n💬 \"We see many positive synergies in an intensified collaboration. Especially in the off-highway application, we can jointly develop new, forward-looking solutions\", says managing director Erich Sennebogen.\n💡 Learn more in our press release: ➡️ https://bit.ly/4jStDAA\n\n𝗦𝗘𝗡𝗡𝗘𝗕𝗢𝗚𝗘𝗡 & 𝗗𝗘𝗨𝗧𝗭: 𝗦𝘁𝗮𝗿𝗸𝗲 𝗣𝗮𝗿𝘁𝗻𝗲𝗿𝘀𝗰𝗵𝗮𝗳𝘁 𝘄𝗶𝗿𝗱 𝘄𝗲𝗶𝘁𝗲𝗿 𝗮𝘂𝘀𝗴𝗲𝗯𝗮𝘂𝘁💪🚜\nBayerische Maschinen und Kölner Motoren – eine Erfolgsgeschichte seit über 70 Jahren! 🤝 \nSchon in den 1950er Jahren vertraute SENNEBOGEN auf die zuverlässigen Motoren von DEUTZ AG. Seither wurde die Zusammenarbeit stetig ausgebaut, sodass heute DEUTZ-Motoren in zahlreichen SENNEBOGEN Maschinen rund um die Welt im Einsatz sind. 🌍\n🌱Diese langjährige Partnerschaft wird nun weiter vertieft: Neben dem Einbau von DEUTZ Dieselmotoren in ausgewählten SENNEBOGEN Modellen wird ein Fokus der Zusammenarbeit auch auf alternativen Antriebkonzepten liegen. Batterieelektrische und wasserstoffbasierte Antriebe bieten eine nachhaltige Option für die Zukunft. 🔋 \n💬 „Wir sehen viele positive Synergien in einer intensiveren Zusammenarbeit. Gerade in der Off-Highway-Anwendung können wir zusammen neue, zukunftsweisende Lösungen realisieren,“ so Geschäftsführer Erich Sennebogen.\n💡Mehr in der Pressemeldung: ➡️ https://bit.ly/3Xi0Zzh\n\n#Innovation #Nachhaltigkeit #AlternativeAntriebe #Sustainability #AlternativeDrives #OffHighway #DEUTZ #SENNEBOGEN #MOVEBIGTHINGS",
        "likes": "184",
        "comments": "7",
        "shares": "5",
        "time": {
          "raw": "4h",
          "parsed": "12.02.2025",
          "isoString": "2025-02-12T05:06:13.355Z"
        },
        "mediaType": "image",
        "mediaContent": [
          "https://media.licdn.com/dms/image/v2/D4E10AQEOpEOQEVy4_w/image-shrink_800/B4EZT1GU2KG0Ac-/0/1739278864703?e=1742364000&v=beta&t=27l8U3eihLVxxLZxpk2TwnRlptsw7yLhM4xJq5m5YJE",
          "https://media.licdn.com/dms/image/v2/D4E10AQFbnMbPVlCdeQ/image-shrink_800/B4EZT1GU1MHUBM-/0/1739278864493?e=1742364000&v=beta&t=M_wx11vCQUWf1qAdFvB0spWnGuSjfkeYRq-TvWHD9E4",
          "https://media.licdn.com/dms/image/v2/D4E10AQH4bd5KaLNwrg/image-shrink_800/B4EZT1GU1XHcAc-/0/1739278865269?e=1742364000&v=beta&t=QAPvlRWZ92jYSZTDvF3o_CMobsiuRYejbEPnJLAy0rw"
        ],
        "date": "2025-02-12T05:06:13.355Z"
      },
      {
        "captions": "𝗚𝗲𝘁 𝗿𝗲𝗮𝗱𝘆 𝗳𝗼𝗿 𝗯𝗮𝘂𝗺𝗮 𝟮𝟬𝟮𝟱 - 𝘄𝗶𝘁𝗵 𝗦𝗘𝗡𝗡𝗘𝗕𝗢𝗚𝗘𝗡! 🙌\n\nFrom 𝗔𝗽𝗿𝗶𝗹 𝟳–𝟭𝟯, 𝟮𝟬𝟮𝟱, Messe Munich will once again host the world's leading trade fair for construction machinery, attracting thousands of visitors. 🚜\n\n💚 For decades, SENNEBOGEN has been a central part of bauma, and we’ll be there again this year! As a family-owned company with Bavarian hospitality and heartfelt values, our booth with its green machines has become an integral part of the fair, known as the \"𝗚𝗿𝗲𝗲𝗻 𝗛𝗲𝗮𝗿𝘁 𝗼𝗳 𝗯𝗮𝘂𝗺𝗮\".\n\n🚀 We will be showcasing our customer-specific material handling and crane solutions at our booth. Cutting-edge technology that combines maximum performance, efficiency, unmatched operator comfort and safety features: 𝗗𝗿𝗶𝘃𝗲𝗻 𝗯𝘆 𝗧𝗲𝗰𝗵𝗻𝗼𝗹𝗼𝗴𝘆, 𝗘𝗻𝗴𝗶𝗻𝗲𝗲𝗿𝗲𝗱 𝘄𝗶𝘁𝗵 𝗣𝗮𝘀𝘀𝗶𝗼𝗻.\n🔥 Our new highlights and exhibits will be announced soon – 𝘀𝘁𝗮𝘆 𝘁𝘂𝗻𝗲𝗱!\n 👉 https://lnkd.in/eh7YATsp\n\n💬 For inquiries or to schedule an appointment during the trade fair week, use our contact form on the website.\n👉 https://lnkd.in/erSeAWzT\n\n#GreenHeartofbauma #bauma #baumamunich #bauma2025 #materialhandling #cranes at bauma with #SENNEBOGEN #MOVEBIGTHINGS",
        "likes": "194",
        "comments": "1",
        "shares": "35",
        "time": {
          "raw": "1ay",
          "parsed": "12.02.2025",
          "isoString": "2025-02-12T05:06:13.356Z"
        },
        "mediaType": "video",
        "mediaContent": {
          "src": [
            {
              "src": "https://dms.licdn.com/playlist/vid/v2/D4E10AQHtW0mEjU9fDA/mp4-720p-30fp-crf28/B4EZTqMEFhHgBs-/0/1739095838315?e=1742364000&v=beta&t=V7qF_vZ_U4oT8Ri72TUpjN9bMOS43MN3F7fdqPZBQj4",
              "type": "video/mp4",
              "data-bitrate": 754645
            },
            {
              "src": "https://dms.licdn.com/playlist/vid/v2/D4E10AQHtW0mEjU9fDA/mp4-640p-30fp-crf28/B4EZTqMEFhHgBo-/0/1739095838025?e=1742364000&v=beta&t=NmVa0cEW9JDdl5ia-l_ZZjlZF37OaWqVf4CnWYnwCxw",
              "type": "video/mp4",
              "data-bitrate": 570187
            },
            {
              "src": "https://dms.licdn.com/playlist/vid/v2/D4E10AQHtW0mEjU9fDA/mp4-360p-30fp-crf28/B4EZTqMEFhHgBk-/0/1739095836071?e=1742364000&v=beta&t=0ru_t08BJCYJYnJUfX7vdl6s5_A-3E4a0t4klFvrH5s",
              "type": "video/mp4",
              "data-bitrate": 272804
            }
          ],
          "posterUrl": "https://media.licdn.com/dms/image/v2/D4E10AQHtW0mEjU9fDA/videocover-high/B4EZTqMEFhHgBA-/0/1739095832481?e=1742364000&v=beta&t=ZtlngYCFzvAoYyRj4-Nvfjk0UNrKrIMq9uWvRdfl1ss"
        },
        "date": "2025-02-12T05:06:13.356Z"
      },
      {
        "captions": "𝗦𝗲𝗿𝘃𝗶𝗰𝗲𝗯𝗲𝗿𝗮𝘁𝗲𝗿 𝗳ü𝗿 𝗦𝗘𝗡𝗡𝗘𝗕𝗢𝗚𝗘𝗡 𝗠𝗮𝘀𝗰𝗵𝗶𝗻𝗲𝗻 – 𝗱𝗶𝗿𝗲𝗸𝘁 𝗯𝗲𝗶𝗺 𝗞𝘂𝗻𝗱𝗲𝗻 𝗶𝗺 𝗘𝗶𝗻𝘀𝗮𝘁𝘇 🛠️\nStillstandszeiten kosten Zeit und Geld – wir sorgen dafür, dass es erst gar nicht dazu kommt! Deshalb setzen wir auf starke Serviceberatung und den direkten Draht zum Kunden. Denn enge Zusammenarbeit schafft Vertrauen und macht den Unterschied. 🤝\n👷 Begleite im Video die SENNEBOGEN Serviceberater von Schlüter Baumaschinen GmbH bei ihrem Einsatz:\nSie sind beim Kunden vor Ort, prüfen Maschinen, analysieren Daten und stehen mit Rat und Tat zur Seite, damit SENNEBOGEN Maschinen zuverlässig laufen! ✅\nErfahre mehr über den SENNEBOGEN Service: \n➡️ https://lnkd.in/eKRCMCh6 \n\n𝗦𝗲𝗿𝘃𝗶𝗰𝗲 𝗖𝗼𝗻𝘀𝘂𝗹𝘁𝗮𝗻𝘁𝘀 𝗳𝗼𝗿 𝗦𝗘𝗡𝗡𝗘𝗕𝗢𝗚𝗘𝗡 𝗠𝗮𝗰𝗵𝗶𝗻𝗲𝘀 – 𝗼𝗻-𝘀𝗶𝘁𝗲 𝘄𝗶𝘁𝗵 𝘁𝗵𝗲 𝗰𝘂𝘀𝘁𝗼𝗺𝗲𝗿 🛠️\nDowntime costs time and money – we make sure it doesn’t happen in the first place! That’s why we focus on strong service consulting and direct customer communication. Close collaboration builds trust and makes the difference. 🤝\n👷 Join the SENNEBOGEN service consultants from Schlüter on their mission:\nThey are on-site with customers, inspecting machines, analyzing data, and providing hands-on support to keep SENNEBOGEN machines running reliably! ✅\nLearn more about SENNEBOGEN service here: \n➡️ https://lnkd.in/eKRCMCh6 \n \n#Service #Kundennähe #CustomerFocus #Baumaschinen #ConstructionMachinery #SchlüterBaumaschinen #SENNEBOGEN #MOVEBIGTHINGS",
        "likes": "156",
        "shares": "14",
        "time": {
          "raw": "1ay",
          "parsed": "12.02.2025",
          "isoString": "2025-02-12T05:06:13.358Z"
        },
        "mediaType": "video",
        "mediaContent": {
          "src": [
            {
              "src": "https://dms.licdn.com/playlist/vid/v2/D4E05AQEaGlyqPRD7zg/mp4-720p-30fp-crf28/B4EZSy3Lg0HUBo-/0/1738167757178?e=1742364000&v=beta&t=untB0XI5WY2z3zChIan27mE0LJMvA0eRVQJcv8R7k-Q",
              "type": "video/mp4",
              "data-bitrate": 1110693
            },
            {
              "src": "https://dms.licdn.com/playlist/vid/v2/D4E05AQEaGlyqPRD7zg/mp4-640p-30fp-crf28/B4EZSy3Lg0HUBk-/0/1738167753652?e=1742364000&v=beta&t=z0si-_-7JEX6BI7zMJ0LrapDX-sq6fqa66fAmPMTwRY",
              "type": "video/mp4",
              "data-bitrate": 852917
            }
          ],
          "posterUrl": "https://media.licdn.com/dms/image/v2/D4E05AQEaGlyqPRD7zg/videocover-high/B4EZSy3Lg0HUB0-/0/1738167730696?e=1742364000&v=beta&t=rswy6b8rk-5pKqoqIyFljz5WrRIegBHyV7nqKpfG1X4"
        },
        "date": "2025-02-12T05:06:13.358Z"
      },
      {
        "captions": "🌿 𝗦𝗘𝗡𝗡𝗘𝗕𝗢𝗚𝗘𝗡 𝟴𝟮𝟱 𝗘 𝗘𝗹𝗲𝗰𝘁𝗿𝗶𝗰: 𝗘𝗳𝗳𝗶𝗰𝗶𝗲𝗻𝗰𝘆 𝗠𝗲𝗲𝘁𝘀 𝗦𝘂𝘀𝘁𝗮𝗶𝗻𝗮𝗯𝗶𝗹𝗶𝘁𝘆 𝗶𝗻 𝗧𝗶𝗺𝗯𝗲𝗿 𝗟𝗼𝗴𝗶𝘀𝘁𝗶𝗰𝘀 ⚡\n\nAt VMG Group’s state-of-the-art veneer plant in Lithuania, sustainability is a top priority. That’s why they chose the SENNEBOGEN 825 E electric material handler: With its low emissions its is a perfect match for their eco-friendly production strategy. 🌍\n\nThe 825 E, supported by SENNEBOGEN’s sales and service partner ScanBalt Crane OÜ, has proven to be an indispensable part of the production processes, loading logs efficiently from the conditioning line.\n\n✅ High performance with tailored grab technology.\n✅ Elevating cab: Maximum visibility for precision and safety\n✅ Reduced energy costs\n\n💡 Read more in the jobsite report: ➡️ https://bit.ly/4hef0pj\n\n#TimberHandling #Holzumschlag #Sustainability #Nachhaltigkeit #ElectricMaterialHandler #Elektrobagger #MOVEBIGTHINGS #SENNEBOGEN🌿 𝗦𝗘𝗡𝗡𝗘𝗕𝗢𝗚𝗘𝗡 𝟴𝟮𝟱 𝗘 𝗘𝗹𝗲𝗰𝘁𝗿𝗶𝗰: 𝗘𝗳𝗳𝗶𝗰𝗶𝗲𝗻𝗰𝘆 𝗠𝗲𝗲𝘁𝘀 𝗦𝘂𝘀𝘁𝗮𝗶𝗻𝗮𝗯𝗶𝗹𝗶𝘁𝘆 𝗶𝗻 𝗧𝗶𝗺𝗯𝗲𝗿 𝗟𝗼𝗴𝗶𝘀𝘁𝗶𝗰𝘀 ⚡\n\nAt VMG Group’s state-of-the-art veneer plant in Lithuania, sustainability is a top priority. That’s why they chose the SENNEBOGEN 825 E electric material handler: With its low emissions its is a perfect match for their eco-friendly production strategy. 🌍\n\nThe 825 E, supported by SENNEBOGEN’s sales and service partner ScanBalt Crane OÜ, has proven to be an indispensable part of the production processes, loading logs efficiently from the conditioning line.\n\n✅ High performance with tailored grab technology.\n✅ Elevating cab: Maximum visibility for precision and safety\n✅ Reduced energy costs\n\n💡 Read more in the jobsite report: ➡️ https://bit.ly/4hef0pj\n\n#TimberHandling #Holzumschlag #Sustainability #Nachhaltigkeit #ElectricMaterialHandler #Elektrobagger #MOVEBIGTHINGS #SENNEBOGEN",
        "likes": "118",
        "comments": "1",
        "shares": "10",
        "time": {
          "raw": "1ay",
          "parsed": "12.02.2025",
          "isoString": "2025-02-12T05:06:13.359Z"
        },
        "mediaType": "image",
        "mediaContent": [
          "https://media.licdn.com/dms/image/v2/D4E10AQGJYVuohPQUFA/image-shrink_800/B4EZS36BnEHoAg-/0/1738252231637?e=1742364000&v=beta&t=AmWfkM6_NCE1jI98Vu_RiFREqx9v6ksvTxXg5aJU3BU",
          "https://media.licdn.com/dms/image/v2/D4E10AQEzLaCQwPLDVg/image-shrink_800/B4EZS36BnyGgAg-/0/1738252230153?e=1742364000&v=beta&t=WN1MMLyl37F7dyPAwCdVuu6LVnqffYQLce7Ee3zFFic",
          "https://media.licdn.com/dms/image/v2/D4E10AQExs8BzpOQFyg/image-shrink_800/B4EZS36BmzHgAc-/0/1738252230638?e=1742364000&v=beta&t=nH0qgsn10aCTLYLmBUCR4G9zl-8pg4UnMTJ6IVRnTbc"
        ],
        "date": "2025-02-12T05:06:13.359Z"
      },
      {
