[
  {
    "name": "JainHydraulics",
    "followerData": [
      [
        20250225,
        9
      ],
      [
        20250225,
        9
      ],
      [
        20250225,
        9
      ],
      [
        20250228,
        9
      ],
      [
        20250228,
        9
      ],
      [
        20250228,
        9
      ],
      [
        20250228,
        9
      ],
      [
        20250303,
        9
      ],
      [
        1741011387760,
        "9"
      ],
      [
        1741076417822,
        "9"
      ]
    ],
    "data": []
  },
  {
    "name": "DanieliGroup",
    "followerData": [
      [
        20250225,
        2807
      ],
      [
        20250225,
        2807
      ],
      [
        20250225,
        2807
      ],
      [
        20250228,
        2810
      ],
      [
        20250228,
        2810
      ],
      [
        20250228,
        2810
      ],
      [
        20250228,
        2810
      ],
      [
        20250303,
        2817
      ],
      [
        1741011402822,
        "2.821"
      ],
      [
        1741076431526,
        "2.823"
      ]
    ],
    "data": [
      {
        "captions": "MRAI Expo in Jaipur, marks our first event of 2025, and we couldn’t be more excited!☀\n\n🍃 Visit our stand to explore the best #Danieli solutions to take your business to the next level in the green and circular economy sectors.\n\n \n🔍 Find us at Booth 1309 \n📅 From January 28th to 30th\n📍 Novotel Jaipur Convention Center, Jaipur, India \n \n🌐 Want to know where to find Danieli next? \nCheck out our website for updates on all future events 👉 https://lnkd.in/dh8zMFDM\n\nMaterial Recycling Association of India MRAI Expo in Jaipur, marks our first event of 2025, and we couldn’t be more excited!☀\n\n🍃 Visit our stand to explore the best #Danieli solutions to take your business to the next level in the green and circular economy sectors.\n\n \n🔍 Find us at Booth 1309 \n📅 From January 28th to 30th\n📍 Novotel Jaipur Convention Center, Jaipur, India \n \n🌐 Want to know where to find Danieli next? \nCheck out our website for updates on all future events 👉 https://lnkd.in/dh8zMFDM\n\nMaterial Recycling Association of India",
        "likes": "14",
        "shares": "6",
        "time": {
          "raw": "1ay",
          "parsed": "04.02.2025",
          "isoString": "2025-02-04T08:20:31.298Z"
        },
        "mediaType": "image",
        "mediaContent": [
          "https://media.licdn.com/dms/image/v2/D4D22AQGuftsVUXhQ2A/feedshare-shrink_800/B4DZRkpAZgHEAg-/0/1736855259103?e=1744243200&v=beta&t=8_U09hjPflmugFmRkLP4-GAFRyt3flLO5ABcqANZstU"
        ],
        "date": "2025-02-04T08:20:31.298Z"
      },
      {
        "captions": "Dun dun duuun! The DaNews #DIM Special Issue is here and looking dapper ⭐  \nDive into the Fifth Danieli Innovaction Meeting with an in-depth focus on: \n🎯 Industry-expert panels \n⚙ Dedicated #green technology sessions \n✈ Global plant tours \n🧭 A journey through #Danieli’s history and our beautiful region \n\nAnd more!\n  \nGrab your definitive digital #DaNews copy here ➡ https://lnkd.in/g4D6dyc",
        "likes": "279",
        "shares": "17",
        "time": {
          "raw": "3ay",
          "parsed": "04.12.2024",
          "isoString": "2024-12-04T08:20:31.301Z"
        },
        "mediaType": "video",
        "mediaContent": {
          "src": [
            {
              "src": "https://dms.licdn.com/playlist/vid/v2/D4E05AQECihFi870umQ/mp4-640p-30fp-crf28/mp4-640p-30fp-crf28/0/1731428429183?e=1741683600&v=beta&t=hc7hUdn7Br0RqLpqyHFQ9rikCihYImSlCNnIWrNO8dc",
              "type": "video/mp4",
              "data-bitrate": 455926
            },
            {
              "src": "https://dms.licdn.com/playlist/vid/v2/D4E05AQECihFi870umQ/mp4-720p-30fp-crf28/mp4-720p-30fp-crf28/0/1731428430976?e=1741683600&v=beta&t=N4jaOam4wWtNnEYnL5HJ7XT9WihHlV9GR0lDaQRUttY",
              "type": "video/mp4",
              "data-bitrate": 619108
            }
          ],
          "posterUrl": "https://media.licdn.com/dms/image/v2/D4E05AQECihFi870umQ/feedshare-thumbnail_720_1280/feedshare-thumbnail_720_1280/0/1731428409767?e=1741683600&v=beta&t=4wv1FOEMx5uPVP947TD7o_YLHjPYpi-Q6_k47NpDFvU"
        },
        "date": "2024-12-04T08:20:31.301Z"
      },
      {
        "captions": "Everything is ready for Ecomondo, and we will be there too! ☀\n🍃 Visit our stand to explore the best #Danieli solutions to take your business to the next level in the green and circular economy sectors.\nECOMONDO - ITALIAN EXHIBITION GROUP\n \n🔍 Find us at Booth A3/109-111 \n📅 From November 5th to 8th\n📍 At Rimini Expo Centre, Rimini, Italy \n \n🌐 Want to know where to find Danieli next? \nCheck out our website for updates on all future events 👉 https://lnkd.in/dh8zMFDMEverything is ready for Ecomondo, and we will be there too! ☀\n🍃 Visit our stand to explore the best #Danieli solutions to take your business to the next level in the green and circular economy sectors.\nECOMONDO - ITALIAN EXHIBITION GROUP\n \n🔍 Find us at Booth A3/109-111 \n📅 From November 5th to 8th\n📍 At Rimini Expo Centre, Rimini, Italy \n \n🌐 Want to know where to find Danieli next? \nCheck out our website for updates on all future events 👉 https://lnkd.in/dh8zMFDM",
        "likes": "17",
        "comments": "1",
        "shares": "4",
        "time": {
          "raw": "4ay",
          "parsed": "04.11.2024",
          "isoString": "2024-11-04T08:20:31.302Z"
        },
        "mediaType": "image",
        "mediaContent": [
          "https://media.licdn.com/dms/image/v2/D4D22AQH2O1Y23a-X1g/feedshare-shrink_800/feedshare-shrink_800/0/1730360484228?e=1744243200&v=beta&t=Aa7Eima6kGouopj6GFGJO3TXLKsiyxAP7k2MVYAGYqE"
        ],
        "date": "2024-11-04T08:20:31.302Z"
      },
      {
        "captions": "BIR World Recycling Convention is coming, and we'll not miss the event! ☀\n♻ #Danieli is ready to make its mark with innovative solutions for the sustainable economic development: visit our stand to take your business to the next level.\n \n🔍 Find us at Booth B02 \n📅 From October 28th to 29th \n📍 At Raffles City Convention Centre, Singapore \n \n🌐 Want to know where to find Danieli next? \nCheck out our website for updates on all future events 👉 https://lnkd.in/dh8zMFDM\nBureau of International RecyclingBIR World Recycling Convention is coming, and we'll not miss the event! ☀\n♻ #Danieli is ready to make its mark with innovative solutions for the sustainable economic development: visit our stand to take your business to the next level.\n \n🔍 Find us at Booth B02 \n📅 From October 28th to 29th \n📍 At Raffles City Convention Centre, Singapore \n \n🌐 Want to know where to find Danieli next? \nCheck out our website for updates on all future events 👉 https://lnkd.in/dh8zMFDM\nBureau of International Recycling",
        "likes": "25",
        "shares": "2",
        "time": {
          "raw": "4ay",
          "parsed": "04.11.2024",
          "isoString": "2024-11-04T08:20:31.304Z"
        },
        "mediaType": "image",
        "mediaContent": [
          "https://media.licdn.com/dms/image/v2/D4D22AQHstak22oLumQ/feedshare-shrink_800/feedshare-shrink_800/0/1729860335368?e=1744243200&v=beta&t=u8OfGw5t8ruuBJLQb9DHVXpqXkqyCnGwbGOmOg6L4DA"
        ],
        "date": "2024-11-04T08:20:31.304Z"
      },
      {
        "captions": "It's our honor to announce Danieli Group as an exhibitor at FABEX Saudi Arabia 2024 \n\nRegister Now to visit and get your free ticket at: https://lnkd.in/ds5N22zB \n\n📅Dates: 13-16 OCTOBER 2024\n📍Venue: Riyadh International Convention & Exhibition Centre (Halls 1,2,3,4,5)\n🌐Website: https://www.fabxsaudi.com/\n📧Email: riyadh@arabiangerman.com\n\n#FABEX #FABEXKSA #MACH #Metal_and_Steel #FABEX_SaudiArabia #SaudiArabia #riyadh #MetalIndustry #SteelFabrication #Machinery #Steel #Machinery #Metal #CNC #Welding #Cutting #automationIt's our honor to announce Danieli Group as an exhibitor at FABEX Saudi Arabia 2024 \n\nRegister Now to visit and get your free ticket at: https://lnkd.in/ds5N22zB \n\n📅Dates: 13-16 OCTOBER 2024\n📍Venue: Riyadh International Convention & Exhibition Centre (Halls 1,2,3,4,5)\n🌐Website: https://www.fabxsaudi.com/\n📧Email: riyadh@arabiangerman.com\n\n#FABEX #FABEXKSA #MACH #Metal_and_Steel #FABEX_SaudiArabia #SaudiArabia #riyadh #MetalIndustry #SteelFabrication #Machinery #Steel #Machinery #Metal #CNC #Welding #Cutting #automation",
        "likes": "12",
        "shares": "4",
        "time": {
          "raw": "6ay",
          "parsed": "04.09.2024",
          "isoString": "2024-09-04T08:20:31.305Z"
        },
        "mediaType": "image",
        "mediaContent": [
          "https://media.licdn.com/dms/image/v2/D4D22AQFwcCRJNjjIBw/feedshare-shrink_800/feedshare-shrink_800/0/1723727332470?e=1744243200&v=beta&t=5CfeBxZbLwnUYvexPeOmzY19tGNi5A1BL6_5jp1SSIY"
        ],
        "date": "2024-09-04T08:20:31.305Z"
      },
      {
        "captions": "It's time for Scrap Expo, and we'll be there! ☀\n\n⭐ Discover the latest trends, network with industry leaders, and explore the best #Danieli solutions to take your business to the next level. \n🔍 Find us at Booth 420 \n📅 From September 17 to 18 \n📍 At Kentucky Exposition Center, Louisville, USA \n🌐 Want to know where to find Danieli next? \nCheck out our website for updates on all future events 👉 https://lnkd.in/dh8zMFDMIt's time for Scrap Expo, and we'll be there! ☀\n\n⭐ Discover the latest trends, network with industry leaders, and explore the best #Danieli solutions to take your business to the next level. \n🔍 Find us at Booth 420 \n📅 From September 17 to 18 \n📍 At Kentucky Exposition Center, Louisville, USA \n🌐 Want to know where to find Danieli next? \nCheck out our website for updates on all future events 👉 https://lnkd.in/dh8zMFDM",
        "likes": "16",
        "shares": "9",
        "time": {
          "raw": "5ay",
          "parsed": "04.10.2024",
          "isoString": "2024-10-04T08:20:31.307Z"
        },
        "mediaType": "image",
        "mediaContent": [
          "https://media.licdn.com/dms/image/v2/D4D22AQGnBxCWO-UPlw/feedshare-shrink_800/feedshare-shrink_800/0/1726568048923?e=1744243200&v=beta&t=riZcm5nMMVPJGpfSimROaW5vjInSR0H4T7l6raCHjz8"
        ],
        "date": "2024-10-04T08:20:31.307Z"
      },
      {
        "captions": "🔔 Danieli Centro Recycling will be present at IFAT Munich 2024!\n \nJoin us\n📅 From May 13 to 17\n📍 Hall B4, Booth 415 \n \n💼 Looking for global opportunities? Check out our website: https://lnkd.in/ez2Fvdt8The leading trade fair for environmental technologies is back! ♻  \n💡 IFAT worldwide starts next week and Danieli is ready to be a part of it. Are you?   \n🔍 Find us at Hall B4, Booth 415  \n📅 From May 13 to 17 \n📍 At Messe München, Germany  \n🌐 Want to know where to find Danieli next?  \nCheck out our website for updates on all future events 👉 https://lnkd.in/dh8zMFDM",
        "likes": "21",
        "shares": "3",
        "time": {
          "raw": "9ay9ay",
          "parsed": "04.03.2025",
          "isoString": "2025-03-04T08:20:31.308Z"
        },
        "mediaType": "video",
        "mediaContent": {
          "src": [
            {
              "src": "https://dms.licdn.com/playlist/vid/v2/D4E05AQEmFCbkTAT7VQ/mp4-640p-30fp-crf28/mp4-640p-30fp-crf28/0/1715172375594?e=1741683600&v=beta&t=cvViIF2XX7Qt5-HotDtEHu8lmq7KYOjVxAljoQZGTUU",
              "type": "video/mp4",
              "data-bitrate": 55193
            },
            {
              "src": "https://dms.licdn.com/playlist/vid/v2/D4E05AQEmFCbkTAT7VQ/mp4-720p-30fp-crf28/mp4-720p-30fp-crf28/0/1715172375508?e=1741683600&v=beta&t=ax6lar9qI2I-o2Fu61LNJKLPOxiq0rh2mW4VlF3z6O0",
              "type": "video/mp4",
              "data-bitrate": 66819
            }
          ],
          "posterUrl": "https://media.licdn.com/dms/image/v2/D4E05AQEmFCbkTAT7VQ/feedshare-thumbnail_720_1280/feedshare-thumbnail_720_1280/0/1715172365655?e=1741683600&v=beta&t=_35iUIoARhX5ZGm2fZ2fI293UUJrBF7Q1vyyb2vbAPY"
        },
        "date": "2025-03-04T08:20:31.308Z"
      },
      {
        "captions": "The leading trade fair for environmental technologies is back! ♻  \n💡 IFAT worldwide starts next week and Danieli is ready to be a part of it. Are you?   \n🔍 Find us at Hall B4, Booth 415  \n📅 From May 13 to 17 \n📍 At Messe München, Germany  \n🌐 Want to know where to find Danieli next?  \nCheck out our website for updates on all future events 👉 https://lnkd.in/dh8zMFDM",
        "time": {
          "raw": "9ay",
          "parsed": "04.06.2024",
          "isoString": "2024-06-04T08:20:31.309Z"
        },
        "mediaType": "video",
        "mediaContent": {
          "src": [
            {
              "src": "https://dms.licdn.com/playlist/vid/v2/D4E05AQEmFCbkTAT7VQ/mp4-640p-30fp-crf28/mp4-640p-30fp-crf28/0/1715172375594?e=1741683600&v=beta&t=cvViIF2XX7Qt5-HotDtEHu8lmq7KYOjVxAljoQZGTUU",
              "type": "video/mp4",
              "data-bitrate": 55193
            },
            {
              "src": "https://dms.licdn.com/playlist/vid/v2/D4E05AQEmFCbkTAT7VQ/mp4-720p-30fp-crf28/mp4-720p-30fp-crf28/0/1715172375508?e=1741683600&v=beta&t=ax6lar9qI2I-o2Fu61LNJKLPOxiq0rh2mW4VlF3z6O0",
              "type": "video/mp4",
              "data-bitrate": 66819
            }
          ],
          "posterUrl": "https://media.licdn.com/dms/image/v2/D4E05AQEmFCbkTAT7VQ/feedshare-thumbnail_720_1280/feedshare-thumbnail_720_1280/0/1715172365655?e=1741683600&v=beta&t=_35iUIoARhX5ZGm2fZ2fI293UUJrBF7Q1vyyb2vbAPY"
        },
        "date": "2024-06-04T08:20:31.309Z"
      }
    ]
  },
  {
    "name": "LINDEMANNMetalRecycling",
    "followerData": [
      [
        20250225,
        3196
      ],
      [
        20250225,
        3196
      ],
      [
        20250225,
        3196
      ],
      [
        20250228,
        3211
      ],
      [
        20250228,
        3212
      ],
      [
        20250228,
        3212
      ],
      [
        20250228,
        3212
      ],
      [
        20250303,
        3219
      ],
      [
        1741011431485,
        "3.219"
      ],
      [
        1741076454330,
        "3.221"
      ]
    ],
    "data": [
      {
        "captions": "Customer Advisory Board \nDay 2 recap\n\nThe second and final day of LINDEMANN’s Customer Advisory Board built on the momentum of an incredible first day, with deeper discussions, industry-leading insights, and an exclusive look at cutting-edge recycling technology in action. Steel industry expert Dr. Christian Fröhling from SMS took centre stage with a keynote exploring the role of electric arc furnaces, regulatory pressures, and the role recycled steel/scrap will play in the developing global demand for green steel.🌱\n\nHis insights reinforced the industry’s need for improved density and purity – as well as innovation, collaboration and a strong commitment to decarbonization.\nAttendees then had the unique opportunity to tour S. Norton Group’s advanced recycling facility, featuring the world’s first LINDEMANN shredder with the revolutionary Variable Frequency Drive (VDA) technology, as well as Shredder Drive Assist (SDA). Seeing innovation in action capped off an event that was not just about discussion — but about real solutions and a better way forward for the industry.♻️\n\nFrom thought-provoking keynotes to hands-on experiences, LINDEMANN’s Customer Advisory Board was a milestone moment for the industry. This event underscored the power of partnership in shaping a stronger, more sustainable future for metal recycling.\n\n🎥 Watch the video to see the highlights from Day 2!\n\n#MetalRecycling #MetalRecyclingSolutions #RecycleForChange #RecycleResponsibly #GreenFuture #RecycleForABetterFuture #CleanerPlanet #CircularEconomy #CarbonReduction #TheCAB #Manchester #England #event #SNorton",
        "likes": "43",
        "shares": "5",
        "time": {
          "raw": "4g",
          "parsed": "28.02.2025",
          "isoString": "2025-02-28T08:20:54.067Z"
        },
        "mediaType": "video",
        "mediaContent": {
          "src": [
            {
              "src": "https://dms.licdn.com/playlist/vid/v2/D4E05AQEd68lXDek8vQ/mp4-720p-30fp-crf28/B4EZVC2mnXHUBg-/0/1740583422686?e=1741683600&v=beta&t=SKPHuuBmjW63hKG5LUeGRJpBGYXQKQTTi6pEYSKHuiY",
              "type": "video/mp4",
              "data-bitrate": 1015285
            },
            {
              "src": "https://dms.licdn.com/playlist/vid/v2/D4E05AQEd68lXDek8vQ/mp4-640p-30fp-crf28/B4EZVC2mnXHUBc-/0/1740583425014?e=1741683600&v=beta&t=CV_tWK0M9reFnDvdMTI0J_OiHk3Y15NgdNIP08gOur8",
              "type": "video/mp4",
              "data-bitrate": 783529
            }
          ],
          "posterUrl": "https://media.licdn.com/dms/image/v2/D4E05AQEd68lXDek8vQ/videocover-low/B4EZVC2mnXHUCM-/0/1740583417229?e=1741683600&v=beta&t=hWjCuDP-bio_kfsEukLpXqxJlhN9rkS041MGX0kjVjI"
        },
        "date": "2025-02-28T08:20:54.067Z"
      },
      {
        "captions": "🔧 SPARE AND WEAR PARTS: THE LINDEMANN DIFFERENCE\n\nWhen it comes to keeping your recycling operation running smoothly, every component matters. As an OEM supplier, LINDEMANN provides spare and wear parts designed to fit your machines perfectly.\n\nFor decades, we’ve paired the development of our innovative recycling plants with the creation of specifically adapted parts, ensuring durability, efficiency, and reliability from the ground up.\n\nOur original LINDEMANN parts are: \n\n✅ Developed and tested in-house\n\n✅ Designed with performance and cost-efficiency in mind\n\n✅ Built to maximize machine availability and minimize maintenance\n\nWith extensive experience in design and field testing, we ensure every part contributes to seamless operations, helping you achieve optimal performance while reducing downtime.\n\n🔗 Ready to learn more? Explore the LINDEMANN advantage today: https://lnkd.in/e-t6EWwv\n\n#MetalRecycling #MetalRecyclingSolutions #RecycleForChange #RecycleResponsibly #GreenFuture #RecycleForABetterFuture #CleanerPlanet #CircularEconomy #CarbonReduction #GreenFuture #OEMParts #Efficiency #Innovation",
        "likes": "47",
        "shares": "7",
        "time": {
          "raw": "1ay",
          "parsed": "04.02.2025",
          "isoString": "2025-02-04T08:20:54.098Z"
        },
        "mediaType": "document",
        "mediaContent": {
          "title": "shear parts",
          "subtitle": "5 sayfa",
          "totalPages": 5,
          "coverPages": [
            {
              "type": "image",
              "config": {
                "src": "https://media.licdn.com/dms/image/v2/D4E1FAQEIOVAJe2Q7Tg/feedshare-document-cover-images_480/B4EZSc6WMrGgBM-/0/1737799336683?e=1741683600&v=beta&t=Ru0rdocS_U8Du2kFu1_ZggitorPy0kPEzAghXVsIXAg"
              }
            },
            {
              "type": "image",
              "config": {
                "src": "https://media.licdn.com/dms/image/v2/D4E1FAQEIOVAJe2Q7Tg/feedshare-document-cover-images_480/B4EZSc6WMrGgBM-/1/1737799336683?e=1741683600&v=beta&t=2T9UXqYbRBRc2V7n7iiJA4rTkxYc1jjSpoPCW0eRjW4"
              }
            },
            {
              "type": "image",
              "config": {
                "src": "https://media.licdn.com/dms/image/v2/D4E1FAQEIOVAJe2Q7Tg/feedshare-document-cover-images_480/B4EZSc6WMrGgBM-/2/1737799336683?e=1741683600&v=beta&t=ZLHc8gjATr7cS_g7n600oUGiWrorUYSXiWiTadTt47U"
              }
            }
          ]
        },
        "date": "2025-02-04T08:20:54.098Z"
      },
      {
        "captions": "It was a pleasure to have you on board 😎I was honoured to be asked by Lindemann to be keynote speaker at their Customer Advisory Board meeting in Manchester. The meeting was attended by the CEOs and owners of leading metal recycling companies from across the globe. Attendees travelled from North America, France, Belgium, Holland, Germany, Spain, Sweden, Norway, Czech Republic and Denmark. We discussed the challenges facing the metal recycling industry and the solutions to overcome those challenges. To engage and interact with the decision makers at the top of their respective companies was extremely productive. The conclusion for our industry is that the outlook is extremely positive.\nOn a personal note the icing on the cake was winning the table tennis competition where I managed to take a point off professional German table tennis player Timo Boll former World Number 1, Olympic Silver Medalist, European and World Champion. Those years away at boarding school playing endless games of table tennis eventually paid off! \nA special thankyou to Matt Norton from #SNorton for hosting the event and organising a visit to S Norton’s outstanding metal recycling operation in Trafford Park Manchester. \n#enicor\n#metalrecycling\n#Lindemann\n#positiveoutlookI was honoured to be asked by Lindemann to be keynote speaker at their Customer Advisory Board meeting in Manchester. The meeting was attended by the CEOs and owners of leading metal recycling companies from across the globe. Attendees travelled from North America, France, Belgium, Holland, Germany, Spain, Sweden, Norway, Czech Republic and Denmark. We discussed the challenges facing the metal recycling industry and the solutions to overcome those challenges. To engage and interact with the decision makers at the top of their respective companies was extremely productive. The conclusion for our industry is that the outlook is extremely positive.\nOn a personal note the icing on the cake was winning the table tennis competition where I managed to take a point off professional German table tennis player Timo Boll former World Number 1, Olympic Silver Medalist, European and World Champion. Those years away at boarding school playing endless games of table tennis eventually paid off! \nA special thankyou to Matt Norton from #SNorton for hosting the event and organising a visit to S Norton’s outstanding metal recycling operation in Trafford Park Manchester. \n#enicor\n#metalrecycling\n#Lindemann\n#positiveoutlook",
        "likes": "13",
        "time": {
          "raw": "1h3h",
          "parsed": "04.03.2025",
          "isoString": "2025-03-04T08:20:54.070Z"
        },
        "mediaType": "image",
        "mediaContent": [
          "https://media.licdn.com/dms/image/v2/D4E22AQFxL8Ver3vBiQ/feedshare-shrink_800/B4EZTbIFgaGgAg-/0/1738843119945?e=1744243200&v=beta&t=wDSnqoz_ui5aKTXLE073Vdrp1wak1PBpz1WBXJiniFs",
          "https://media.licdn.com/dms/image/v2/D4E22AQGM1obtaYEbaQ/feedshare-shrink_800/B4EZTbIFe6HcAg-/0/1738843120532?e=1744243200&v=beta&t=Ov_owiOwKnuYLFHOTKjknXcfFJfOvMpmrOVtYAZMYX8",
          "https://media.licdn.com/dms/image/v2/D4E22AQFqmakEvyW5_w/feedshare-shrink_800/B4EZTbIFgIGYAk-/0/1738843120198?e=1744243200&v=beta&t=CIN884mmmrOoMGWotE3t0XDUU5WXwarJjj8RqnENFss",
          "https://media.licdn.com/dms/image/v2/D4E22AQFaQG_953T4cw/feedshare-shrink_800/B4EZTbIFgHGYAg-/0/1738843120775?e=1744243200&v=beta&t=C9g9S3ao-NDLA9Sll_wugcgxr--pQXJx3fP9xY7EtVw",
          "https://media.licdn.com/dms/image/v2/D4E22AQEn9eZ2Gbb0rg/feedshare-shrink_800/B4EZTbIFfTHgAo-/0/1738843128584?e=1744243200&v=beta&t=n10EHtPoDPkzoMTYzbXrNZ6G9HxHbkDMEJ1uriGDpNk"
        ],
        "date": "2025-03-04T08:20:54.070Z"
      },
      {
        "captions": "I was honoured to be asked by Lindemann to be keynote speaker at their Customer Advisory Board meeting in Manchester. The meeting was attended by the CEOs and owners of leading metal recycling companies from across the globe. Attendees travelled from North America, France, Belgium, Holland, Germany, Spain, Sweden, Norway, Czech Republic and Denmark. We discussed the challenges facing the metal recycling industry and the solutions to overcome those challenges. To engage and interact with the decision makers at the top of their respective companies was extremely productive. The conclusion for our industry is that the outlook is extremely positive.\nOn a personal note the icing on the cake was winning the table tennis competition where I managed to take a point off professional German table tennis player Timo Boll former World Number 1, Olympic Silver Medalist, European and World Champion. Those years away at boarding school playing endless games of table tennis eventually paid off! \nA special thankyou to Matt Norton from #SNorton for hosting the event and organising a visit to S Norton’s outstanding metal recycling operation in Trafford Park Manchester. \n#enicor\n#metalrecycling\n#Lindemann\n#positiveoutlookI was honoured to be asked by Lindemann to be keynote speaker at their Customer Advisory Board meeting in Manchester. The meeting was attended by the CEOs and owners of leading metal recycling companies from across the globe. Attendees travelled from North America, France, Belgium, Holland, Germany, Spain, Sweden, Norway, Czech Republic and Denmark. We discussed the challenges facing the metal recycling industry and the solutions to overcome those challenges. To engage and interact with the decision makers at the top of their respective companies was extremely productive. The conclusion for our industry is that the outlook is extremely positive.\nOn a personal note the icing on the cake was winning the table tennis competition where I managed to take a point off professional German table tennis player Timo Boll former World Number 1, Olympic Silver Medalist, European and World Champion. Those years away at boarding school playing endless games of table tennis eventually paid off! \nA special thankyou to Matt Norton from #SNorton for hosting the event and organising a visit to S Norton’s outstanding metal recycling operation in Trafford Park Manchester. \n#enicor\n#metalrecycling\n#Lindemann\n#positiveoutlook",
        "likes": "13",
        "time": {
          "raw": "3h",
          "parsed": "11.02.2025",
          "isoString": "2025-02-11T08:20:54.072Z"
        },
        "mediaType": "image",
        "mediaContent": [
          "https://media.licdn.com/dms/image/v2/D4E22AQFxL8Ver3vBiQ/feedshare-shrink_800/B4EZTbIFgaGgAg-/0/1738843119945?e=1744243200&v=beta&t=wDSnqoz_ui5aKTXLE073Vdrp1wak1PBpz1WBXJiniFs",
          "https://media.licdn.com/dms/image/v2/D4E22AQGM1obtaYEbaQ/feedshare-shrink_800/B4EZTbIFe6HcAg-/0/1738843120532?e=1744243200&v=beta&t=Ov_owiOwKnuYLFHOTKjknXcfFJfOvMpmrOVtYAZMYX8",
          "https://media.licdn.com/dms/image/v2/D4E22AQFqmakEvyW5_w/feedshare-shrink_800/B4EZTbIFgIGYAk-/0/1738843120198?e=1744243200&v=beta&t=CIN884mmmrOoMGWotE3t0XDUU5WXwarJjj8RqnENFss",
          "https://media.licdn.com/dms/image/v2/D4E22AQFaQG_953T4cw/feedshare-shrink_800/B4EZTbIFgHGYAg-/0/1738843120775?e=1744243200&v=beta&t=C9g9S3ao-NDLA9Sll_wugcgxr--pQXJx3fP9xY7EtVw",
          "https://media.licdn.com/dms/image/v2/D4E22AQEn9eZ2Gbb0rg/feedshare-shrink_800/B4EZTbIFfTHgAo-/0/1738843128584?e=1744243200&v=beta&t=n10EHtPoDPkzoMTYzbXrNZ6G9HxHbkDMEJ1uriGDpNk"
        ],
        "date": "2025-02-11T08:20:54.072Z"
      },
      {
        "captions": "First Customer Advisory Board of Metal Recycling Industry successfully \nheld in Manchester\n\nDay 1 recap\n\nIndustry leaders, innovators, and decision-makers from across the global metal recycling sector gathered at the historic Midland Hotel in Manchester, England for LINDEMANN’s inaugural Customer Advisory Board (CAB). Over two days, delegates from all over Europe – and as far afield as Canada – discussed the future of metal recycling, emerging trends, challenges, and how the industry can drive meaningful change.\n\nFollowing an opening address by LINDEMANN CEO Carl Gustaf Göransson, Past President of the Bureau of International Recycling, Tom Bird, delivered a powerful keynote, emphasizing that while the industry is already green, it must do more to communicate its sustainability credentials. This set the stage for insightful presentations from LINDEMANN’s leadership team, outlining the company’s strategic vision, advancements in technology and a commitment to supporting customers with new business models and closer after-sales partnerships. 📣🤝\n\nBut CAB wasn’t just about presentations — it was a collaborative platform where industry voices were heard. Lively discussions and interactive sessions captured key challenges and opportunities, ensuring that customer perspectives are at the heart of future innovations. Participants even got to go toe-to-toe with the professional table tennis athletes from the LINDEMANN-sponsored Borussia Düsseldorf e.V. team in Germany!\n\n📽️ Watch the video to relive the energy, insights, and collaboration from Day 1!\n\n#MetalRecycling #MetalRecyclingSolutions #RecycleForChange #RecycleResponsibly #GreenFuture #RecycleForABetterFuture #CleanerPlanet #CircularEconomy #CarbonReduction #TheCAB #Manchester #England #event",
        "likes": "50",
        "comments": "1",
        "shares": "12",
        "time": {
          "raw": "1h",
          "parsed": "25.02.2025",
          "isoString": "2025-02-25T08:20:54.073Z"
        },
        "mediaType": "video",
        "mediaContent": {
          "src": [
            {
              "src": "https://dms.licdn.com/playlist/vid/v2/D4E05AQHMVmoX6Sx0oA/mp4-640p-30fp-crf28/B4EZU3ucvsGYBc-/0/1740396768709?e=1741683600&v=beta&t=A03lF5mKyQK4O117-flrHIdQjryJxmdOrpiJdcDNOU4",
              "type": "video/mp4",
              "data-bitrate": 633721
            },
            {
              "src": "https://dms.licdn.com/playlist/vid/v2/D4E05AQHMVmoX6Sx0oA/mp4-720p-30fp-crf28/B4EZU3ucvsGYBg-/0/1740396770257?e=1741683600&v=beta&t=5IgD1cZPysWdlvtyIfw979B1u7jvIEbap4vvULRl0kM",
              "type": "video/mp4",
              "data-bitrate": 829428
            }
          ],
          "posterUrl": "https://media.licdn.com/dms/image/v2/D4E05AQHMVmoX6Sx0oA/videocover-low/B4EZU3ucvsGYCM-/0/1740396759935?e=1741683600&v=beta&t=nt7_IuvxOghLMP3ZAruqbi10vYCaEdsZ7VecqF8iOr4"
        },
        "date": "2025-02-25T08:20:54.073Z"
      },
      {
        "captions": "InDEx: Revolutionizing Metal Recycling Technology ♻️\n\nThe circular economy demands high performance and rapid, predictive recycling technologies to meet its ambitious goals. That’s where InDEx, LINDEMANN’s digital operating and production data acquisition system, comes in.\n\nDeveloped to provide real-time insights into your machine’s performance, InDEx empowers operators to:\n\n📈Monitor utilization and performance instantly\n\n🔍 Track materials being processed\n\n📲 Access critical data anytime, anywhere—via mobile app or web portal\n\nIn a presentation at RWTH Aachen University, experts Wei Song, Fabian Diaz, and Bernd Friedrich recognized InDEx as a “state-in-industry” solution, highlighting its role in supporting the circular economy through digital transformation.\n\nInDEx gives our customers the tools they need to stay agile and efficient, making it easier than ever to optimize processes and maximize machine value. Together, we’re setting new standards in metal recycling technology.\n\n#MetalRecycling #MetalRecyclingSolutions #RecycleForChange #RecycleResponsibly #GreenFuture #RecycleForABetterFuture #CleanerPlanet #CircularEconomy #CarbonReduction #InDEx #technology InDEx: Revolutionizing Metal Recycling Technology ♻️\n\nThe circular economy demands high performance and rapid, predictive recycling technologies to meet its ambitious goals. That’s where InDEx, LINDEMANN’s digital operating and production data acquisition system, comes in.\n\nDeveloped to provide real-time insights into your machine’s performance, InDEx empowers operators to:\n\n📈Monitor utilization and performance instantly\n\n🔍 Track materials being processed\n\n📲 Access critical data anytime, anywhere—via mobile app or web portal\n\nIn a presentation at RWTH Aachen University, experts Wei Song, Fabian Diaz, and Bernd Friedrich recognized InDEx as a “state-in-industry” solution, highlighting its role in supporting the circular economy through digital transformation.\n\nInDEx gives our customers the tools they need to stay agile and efficient, making it easier than ever to optimize processes and maximize machine value. Together, we’re setting new standards in metal recycling technology.\n\n#MetalRecycling #MetalRecyclingSolutions #RecycleForChange #RecycleResponsibly #GreenFuture #RecycleForABetterFuture #CleanerPlanet #CircularEconomy #CarbonReduction #InDEx #technology",
        "likes": "17",
        "shares": "3",
        "time": {
          "raw": "1h",
          "parsed": "25.02.2025",
          "isoString": "2025-02-25T08:20:54.074Z"
        },
        "mediaType": "image",
        "mediaContent": [
          "https://media.licdn.com/dms/image/v2/D5622AQHZr419aAdgDw/feedshare-shrink_800/B56ZTwhIAjGoAk-/0/1739202005888?e=1744243200&v=beta&t=033OvXnBWtXomEMP7OyUdMAFQmbCxgJPMPRi7mSDTlw"
        ],
        "date": "2025-02-25T08:20:54.074Z"
      },
      {
        "captions": "As 2025 begins to take shape, LINDEMANN is ready to seize the opportunities this year brings. The global focus on sustainability continues to grow, and we are proud to be part of the movement driving positive change through innovation in metal recycling.♻️\nCompanies everywhere must align with increasingly stringent regulations aimed at reducing emissions, conserving resources, and fostering sustainable practices. At LINDEMANN, we are committed to supporting our customers in meeting these standards through innovative metal recycling solutions that help reduce environmental impact while driving efficiency. 📈\nThis year, we will focus on strengthening partnerships and delivering solutions that enable companies to meet their environmental obligations while making meaningful progress toward sustainability goals. 🥅\n#MetalRecycling #MetalRecyclingSolutions #RecycleForChange #RecycleResponsibly #GreenFuture #RecycleForABetterFuture #CleanerPlanet #CircularEconomy #CarbonReduction #CustainabilityGoals #customers As 2025 begins to take shape, LINDEMANN is ready to seize the opportunities this year brings. The global focus on sustainability continues to grow, and we are proud to be part of the movement driving positive change through innovation in metal recycling.♻️\nCompanies everywhere must align with increasingly stringent regulations aimed at reducing emissions, conserving resources, and fostering sustainable practices. At LINDEMANN, we are committed to supporting our customers in meeting these standards through innovative metal recycling solutions that help reduce environmental impact while driving efficiency. 📈\nThis year, we will focus on strengthening partnerships and delivering solutions that enable companies to meet their environmental obligations while making meaningful progress toward sustainability goals. 🥅\n#MetalRecycling #MetalRecyclingSolutions #RecycleForChange #RecycleResponsibly #GreenFuture #RecycleForABetterFuture #CleanerPlanet #CircularEconomy #CarbonReduction #CustainabilityGoals #customers",
        "likes": "28",
        "shares": "5",
        "time": {
          "raw": "1h",
          "parsed": "25.02.2025",
          "isoString": "2025-02-25T08:20:54.076Z"
        },
        "mediaType": "image",
        "mediaContent": [
          "https://media.licdn.com/dms/image/v2/D5622AQFbS_EeCVZhxA/feedshare-shrink_800/B56ZTwgvWKGUAs-/0/1739201904099?e=1744243200&v=beta&t=_ydti7M_cDlWiH5WXW7iYR-LlO9zc-mxWTo0CNyz94U"
        ],
        "date": "2025-02-25T08:20:54.076Z"
      },
      {
        "captions": "Did you know: Steel production currently accounts for approximately 8% of global CO₂ emissions?! Let's make a change and drive the green steel cycle. In our vision of transforming the metal circular economy for a better tomorrow,  I am sharing my thoughts and reflections in this article why scrap metal is key to cutting CO₂.\nAt Lindemann, our goal is to play an active role in  transformation journey",
        "likes": "21",
        "shares": "5",
        "time": {
          "raw": "1h1h",
          "parsed": "04.03.2025",
          "isoString": "2025-03-04T08:20:54.077Z"
        },
        "mediaType": "other",
        "date": "2025-03-04T08:20:54.077Z"
      },
      {
        "captions": "In our vision of transforming the metal circular economy for a better tomorrow,  I am sharing my thoughts and reflections in this article why scrap metal is key to cutting CO₂.\nAt Lindemann, our goal is to play an active role in  transformation journey",
        "time": {
          "raw": "1h",
          "parsed": "25.02.2025",
          "isoString": "2025-02-25T08:20:54.078Z"
        },
        "mediaType": "other",
        "date": "2025-02-25T08:20:54.078Z"
      },
      {
        "captions": "Excellent Service for Customers Success😎💪CASE STUDY - EXCELLENT CUSTOMER-RELATIONSHIP AND CUSTOMER-SERVICE ACROSS CONTINENTS\n\nSometimes it's not the big strategies or long-term plans that make the difference - but quick, pragmatic solutions at critical moments.\n\nOne of our customers had a machine failure: A control block had unexpectedly failed after very long time of operation. Replacement? It had already been ordered before the failure, but was still in production for some time. Long story short: machine downtime and loss of production.\n\nIn this situation our service team deeply impressed me:\nInstead of waiting, they checked with another long-standing customer, who they knew had a machine of the same type and a control block in stock.\n\nThe result? We picked this one up and sent it to another customer - a temporary loan of the control block across continents!\n\nI have been working in various industries for over 15 years. But I've never experienced this kind of interaction between service and customers!\n\nWhat can we learn from this?\n✅ Excellent service - does not just mean reacting to problems, but finding solutions where others only see obstacles.\n✅ Good customer relations - a genuine partnership-based exchange is what makes such solutions conceivable. Trust and long-term cooperation pay off - for all sides.\n\nHave you ever experienced similarly situations? Even in other fields?CASE STUDY - EXCELLENT CUSTOMER-RELATIONSHIP AND CUSTOMER-SERVICE ACROSS CONTINENTS\n\nSometimes it's not the big strategies or long-term plans that make the difference - but quick, pragmatic solutions at critical moments.\n\nOne of our customers had a machine failure: A control block had unexpectedly failed after very long time of operation. Replacement? It had already been ordered before the failure, but was still in production for some time. Long story short: machine downtime and loss of production.\n\nIn this situation our service team deeply impressed me:\nInstead of waiting, they checked with another long-standing customer, who they knew had a machine of the same type and a control block in stock.\n\nThe result? We picked this one up and sent it to another customer - a temporary loan of the control block across continents!\n\nI have been working in various industries for over 15 years. But I've never experienced this kind of interaction between service and customers!\n\nWhat can we learn from this?\n✅ Excellent service - does not just mean reacting to problems, but finding solutions where others only see obstacles.\n✅ Good customer relations - a genuine partnership-based exchange is what makes such solutions conceivable. Trust and long-term cooperation pay off - for all sides.\n\nHave you ever experienced similarly situations? Even in other fields?",
        "likes": "5",
        "time": {
          "raw": "1h1h",
          "parsed": "04.03.2025",
          "isoString": "2025-03-04T08:20:54.079Z"
        },
        "mediaType": "image",
        "mediaContent": [
          "https://media.licdn.com/dms/image/v2/D4E22AQEx451gH50UvQ/feedshare-shrink_800/B4EZUahpF.G0Ag-/0/1739906781998?e=1744243200&v=beta&t=vZpjgXlweFinky-2Su2ct6HKVZCWDxF6gyl4duZvNok"
        ],
        "date": "2025-03-04T08:20:54.079Z"
      },
      {
        "captions": "CASE STUDY - EXCELLENT CUSTOMER-RELATIONSHIP AND CUSTOMER-SERVICE ACROSS CONTINENTS\n\nSometimes it's not the big strategies or long-term plans that make the difference - but quick, pragmatic solutions at critical moments.\n\nOne of our customers had a machine failure: A control block had unexpectedly failed after very long time of operation. Replacement? It had already been ordered before the failure, but was still in production for some time. Long story short: machine downtime and loss of production.\n\nIn this situation our service team deeply impressed me:\nInstead of waiting, they checked with another long-standing customer, who they knew had a machine of the same type and a control block in stock.\n\nThe result? We picked this one up and sent it to another customer - a temporary loan of the control block across continents!\n\nI have been working in various industries for over 15 years. But I've never experienced this kind of interaction between service and customers!\n\nWhat can we learn from this?\n✅ Excellent service - does not just mean reacting to problems, but finding solutions where others only see obstacles.\n✅ Good customer relations - a genuine partnership-based exchange is what makes such solutions conceivable. Trust and long-term cooperation pay off - for all sides.\n\nHave you ever experienced similarly situations? Even in other fields?CASE STUDY - EXCELLENT CUSTOMER-RELATIONSHIP AND CUSTOMER-SERVICE ACROSS CONTINENTS\n\nSometimes it's not the big strategies or long-term plans that make the difference - but quick, pragmatic solutions at critical moments.\n\nOne of our customers had a machine failure: A control block had unexpectedly failed after very long time of operation. Replacement? It had already been ordered before the failure, but was still in production for some time. Long story short: machine downtime and loss of production.\n\nIn this situation our service team deeply impressed me:\nInstead of waiting, they checked with another long-standing customer, who they knew had a machine of the same type and a control block in stock.\n\nThe result? We picked this one up and sent it to another customer - a temporary loan of the control block across continents!\n\nI have been working in various industries for over 15 years. But I've never experienced this kind of interaction between service and customers!\n\nWhat can we learn from this?\n✅ Excellent service - does not just mean reacting to problems, but finding solutions where others only see obstacles.\n✅ Good customer relations - a genuine partnership-based exchange is what makes such solutions conceivable. Trust and long-term cooperation pay off - for all sides.\n\nHave you ever experienced similarly situations? Even in other fields?",
        "likes": "5",
        "time": {
          "raw": "1h",
          "parsed": "25.02.2025",
          "isoString": "2025-02-25T08:20:54.080Z"
        },
        "mediaType": "image",
        "mediaContent": [
          "https://media.licdn.com/dms/image/v2/D4E22AQEx451gH50UvQ/feedshare-shrink_800/B4EZUahpF.G0Ag-/0/1739906781998?e=1744243200&v=beta&t=vZpjgXlweFinky-2Su2ct6HKVZCWDxF6gyl4duZvNok"
        ],
        "date": "2025-02-25T08:20:54.080Z"
      },
      {
        "captions": "☀️💪😎Transforming the metal circular economy for a better tomorrow. Together, we can build a greener and more efficient world! 🌍♻️ \n\nRuslan Pereira Jean L.  \n\n#CircularEconomy #Sustainability #Innovation #Chatarra #Sucata #WeAreLindemann #MetalRecycling #LindemannMetalRecycling #EconomiaCircular #ReciclagemTransforming the metal circular economy for a better tomorrow. Together, we can build a greener and more efficient world! 🌍♻️ \n\nRuslan Pereira Jean L.  \n\n#CircularEconomy #Sustainability #Innovation #Chatarra #Sucata #WeAreLindemann #MetalRecycling #LindemannMetalRecycling #EconomiaCircular #Reciclagem",
        "likes": "10",
        "time": {
          "raw": "1h1h",
          "parsed": "04.03.2025",
          "isoString": "2025-03-04T08:20:54.081Z"
        },
        "mediaType": "image",
        "mediaContent": [
          "https://media.licdn.com/dms/image/v2/D4D22AQGotAzvnQBaDQ/feedshare-shrink_800/B4DZUfYSCHHkAk-/0/1739988241755?e=1744243200&v=beta&t=h7P0y4LGhSVZzkRKCxz354vqypnY2XCHICblbgnj_AY"
        ],
        "date": "2025-03-04T08:20:54.081Z"
      },
      {
        "captions": "Transforming the metal circular economy for a better tomorrow. Together, we can build a greener and more efficient world! 🌍♻️ \n\nRuslan Pereira Jean L.  \n\n#CircularEconomy #Sustainability #Innovation #Chatarra #Sucata #WeAreLindemann #MetalRecycling #LindemannMetalRecycling #EconomiaCircular #ReciclagemTransforming the metal circular economy for a better tomorrow. Together, we can build a greener and more efficient world! 🌍♻️ \n\nRuslan Pereira Jean L.  \n\n#CircularEconomy #Sustainability #Innovation #Chatarra #Sucata #WeAreLindemann #MetalRecycling #LindemannMetalRecycling #EconomiaCircular #Reciclagem",
        "likes": "10",
        "time": {
          "raw": "1h",
          "parsed": "25.02.2025",
          "isoString": "2025-02-25T08:20:54.082Z"
        },
        "mediaType": "image",
        "mediaContent": [
          "https://media.licdn.com/dms/image/v2/D4D22AQGotAzvnQBaDQ/feedshare-shrink_800/B4DZUfYSCHHkAk-/0/1739988241755?e=1744243200&v=beta&t=h7P0y4LGhSVZzkRKCxz354vqypnY2XCHICblbgnj_AY"
        ],
        "date": "2025-02-25T08:20:54.082Z"
      },
      {
        "captions": "At the 12th International Material Recycling Convention & Exposition,\nheld by MRAI, LINDEMANN  made a significant impact, joining 2,500 delegates from around the world. 🌍✨ Keegan Vas represented the company in a high-profile panel discussion on the role of technology in scrap processing. He showcased innovative solutions, including the Index and the groundbreaking thermal camera for shredders. 🔥🤖\n\nThe panel, featuring experts from different branches, sparked lively debates on AI-driven sorting, sensor-based separation, and advanced processing techniques. These discussions set new standards for productivity, sustainability, and the future of the recycling industry. ♻️🚀\n\nLINDEMANN's booth at the exhibition was buzzing with activity, further reinforcing the company's commitment to pushing the boundaries of metal recycling. The future of the industry looks bright! 💡\n\n#MetalRecycling #MetalRecyclingSolutions #RecycleForChange #RecycleResponsibly #GreenFuture #RecycleForABetterFuture #CircularEconomy #Ecomondo #EcotecSolutions #Sustainability #Innovation#IMRC2025 #RecyclingTechnology",
        "likes": "29",
        "shares": "2",
        "time": {
          "raw": "1h",
          "parsed": "25.02.2025",
          "isoString": "2025-02-25T08:20:54.083Z"
        },
        "mediaType": "document",
        "mediaContent": {
          "title": "MRAI",
          "subtitle": "4 sayfa",
          "totalPages": 4,
          "coverPages": [
            {
              "type": "image",
              "config": {
                "src": "https://media.licdn.com/dms/image/v2/D4E1FAQHLeX5PLr-OQg/feedshare-document-cover-images_480/B4EZUdtBuwGgBM-/0/1739960105265?e=1741683600&v=beta&t=w-Sii_xhPy5oSX06kybYO7NQOmkKJC8CoKUnu2wXLT8"
              }
            },
            {
              "type": "image",
              "config": {
                "src": "https://media.licdn.com/dms/image/v2/D4E1FAQHLeX5PLr-OQg/feedshare-document-cover-images_480/B4EZUdtBuwGgBM-/1/1739960105265?e=1741683600&v=beta&t=IQKhmUBq6l50KFZfRSXbHV3NxfVsn3RoULr1gpWNCkc"
              }
            },
            {
              "type": "image",
              "config": {
                "src": "https://media.licdn.com/dms/image/v2/D4E1FAQHLeX5PLr-OQg/feedshare-document-cover-images_480/B4EZUdtBuwGgBM-/2/1739960105265?e=1741683600&v=beta&t=07JPpKBaoXfokrp7c_mNQ5W1844UZz59w9aDgIys5fU"
              }
            }
          ]
        },
        "date": "2025-02-25T08:20:54.083Z"
      },
      {
        "captions": "Designed for ultimate operator comfort and precision, the LINDEMANN shredder cabin sets the standard for modern recycling equipment.\n\n✅ Climate Control: Equipped with heating and air-conditioning, the cabin provides optimal comfort in all weather conditions.\n\n✅ Enhanced Monitoring: An advanced graphic visualization system with Siemens TP series ensures seamless machine monitoring, so operators can stay in control.\n\n✅ Ergonomic Excellence: The rotating control chair, with adjustable length and height, features dampers for smoother operation. Separate replacement options for seat cushions, armrests, and headrests mean longer-lasting comfort.\n\n✅ Optimal Visibility: Angled and reinforced safety glass minimizes reflections, providing an unobstructed view of the worksite.\n\n✅ Intuitive Controls: Joysticks and push buttons are integrated into the armrests for effortless operation, while the adjustable side-wall-mounted control panel puts everything within reach.\n\nBuilt with comfort, safety, and efficiency in mind. Stay tuned for more insights into our machine features!\n\n#MetalRecycling #MetalRecyclingSolutions #RecycleForChange #RecycleResponsibly #GreenFuture #RecycleForABetterFuture #CleanerPlanet #CircularEconomy #CarbonReduction #ShredderParts #cabin Designed for ultimate operator comfort and precision, the LINDEMANN shredder cabin sets the standard for modern recycling equipment.\n\n✅ Climate Control: Equipped with heating and air-conditioning, the cabin provides optimal comfort in all weather conditions.\n\n✅ Enhanced Monitoring: An advanced graphic visualization system with Siemens TP series ensures seamless machine monitoring, so operators can stay in control.\n\n✅ Ergonomic Excellence: The rotating control chair, with adjustable length and height, features dampers for smoother operation. Separate replacement options for seat cushions, armrests, and headrests mean longer-lasting comfort.\n\n✅ Optimal Visibility: Angled and reinforced safety glass minimizes reflections, providing an unobstructed view of the worksite.\n\n✅ Intuitive Controls: Joysticks and push buttons are integrated into the armrests for effortless operation, while the adjustable side-wall-mounted control panel puts everything within reach.\n\nBuilt with comfort, safety, and efficiency in mind. Stay tuned for more insights into our machine features!\n\n#MetalRecycling #MetalRecyclingSolutions #RecycleForChange #RecycleResponsibly #GreenFuture #RecycleForABetterFuture #CleanerPlanet #CircularEconomy #CarbonReduction #ShredderParts #cabin",
        "likes": "49",
        "comments": "1",
        "shares": "5",
        "time": {
          "raw": "1h",
          "parsed": "25.02.2025",
          "isoString": "2025-02-25T08:20:54.084Z"
        },
        "mediaType": "image",
        "mediaContent": [
          "https://media.licdn.com/dms/image/v2/D5622AQGj_lZn8_Negw/feedshare-shrink_800/B56ZTwf_p5HsAk-/0/1739201709007?e=1744243200&v=beta&t=-tJ1Qk34IwJG2GdS2DuMRW1ESJP3Y9G0gYA5WdUj0Ac"
        ],
        "date": "2025-02-25T08:20:54.084Z"
      },
      {
        "captions": "Location Spotlight: San Antonio, Texas! 🇺🇸\n\nAt LINDEMANN Metal Recycling, we take pride in being close to our customers, no matter where they are. Today, we're highlighting our North American headquarters in the vibrant city of San Antonio, Texas! 🤠\n\nThis dynamic hub is where X incredible team members come together to drive innovation and provide exceptional service. It’s also home to our U.S. service center, which ensures top-notch support for our North American customers. \n\nBut what makes San Antonio so special?\n\n🌵 Known as the \"Alamo City\", San Antonio boasts a rich history, with landmarks like the iconic Alamo and the San Antonio Missions, a UNESCO World Heritage Site.\n\n🌉 The city is famous for the beautiful River Walk, a network of scenic walkways along the San Antonio River filled with restaurants, shops, and cultural experiences.\n\n🎉 San Antonio is also a hub for innovation and business, making it the perfect home for LINDEMANN’s commitment to advancing metal recycling technology in North America.\n\nFrom this dynamic location, we work to deliver cutting-edge recycling solutions and industry-leading support to our customers across the continent.\n\nHave you visited our San Antonio location or experienced its unique charm? Share your thoughts in the comments!\n\n#MetalRecycling #MetalRecyclingSolutions #RecycleForChange #RecycleResponsibly #GreenFuture #RecycleForABetterFuture #CleanerPlanet #CircularEconomy #CarbonReduction #SanAntonio #Spotlight #location #service Location Spotlight: San Antonio, Texas! 🇺🇸\n\nAt LINDEMANN Metal Recycling, we take pride in being close to our customers, no matter where they are. Today, we're highlighting our North American headquarters in the vibrant city of San Antonio, Texas! 🤠\n\nThis dynamic hub is where X incredible team members come together to drive innovation and provide exceptional service. It’s also home to our U.S. service center, which ensures top-notch support for our North American customers. \n\nBut what makes San Antonio so special?\n\n🌵 Known as the \"Alamo City\", San Antonio boasts a rich history, with landmarks like the iconic Alamo and the San Antonio Missions, a UNESCO World Heritage Site.\n\n🌉 The city is famous for the beautiful River Walk, a network of scenic walkways along the San Antonio River filled with restaurants, shops, and cultural experiences.\n\n🎉 San Antonio is also a hub for innovation and business, making it the perfect home for LINDEMANN’s commitment to advancing metal recycling technology in North America.\n\nFrom this dynamic location, we work to deliver cutting-edge recycling solutions and industry-leading support to our customers across the continent.\n\nHave you visited our San Antonio location or experienced its unique charm? Share your thoughts in the comments!\n\n#MetalRecycling #MetalRecyclingSolutions #RecycleForChange #RecycleResponsibly #GreenFuture #RecycleForABetterFuture #CleanerPlanet #CircularEconomy #CarbonReduction #SanAntonio #Spotlight #location #service",
        "likes": "34",
        "shares": "5",
        "time": {
          "raw": "2h",
          "parsed": "18.02.2025",
          "isoString": "2025-02-18T08:20:54.086Z"
        },
        "mediaType": "image",
        "mediaContent": [
          "https://media.licdn.com/dms/image/v2/D5622AQGyKeezGynPZg/feedshare-shrink_800/B56ZTwewfVGQAs-/0/1739201384896?e=1744243200&v=beta&t=7w3SG5AoNIfvfhp1b9VRgEhD6A14Y8s8XUSw-JHKobU"
        ],
        "date": "2025-02-18T08:20:54.086Z"
      },
      {
        "captions": "Keep Your Machines Running smoothly with LINDEMANN Inspections and Maintenance\n\nTime takes its toll on even the best machines. Over the years, wear and aging can lead to internal leakages and the risk of unexpected failures. That’s where LINDEMANN's inspections and maintenance planning services come in.\n\nOur expert team helps you identify potential issues before they become costly problems, ensuring your machines stay in top shape and delivering peak performance.\n\nDon’t let aging components catch you off guard. Partner with LINDEMANN for proactive care and long-term reliability.\n\n👉 Ready to avoid unpleasant surprises? Discover how we can support your operations: https://lnkd.in/eHZSfXGj\n\n#MetalRecycling #MetalRecyclingSolutions #RecycleForChange #RecycleResponsibly #GreenFuture #RecycleForABetterFuture #CleanerPlanet #CircularEconomy #CarbonReduction #GreenFuture #maintenance #reliability Keep Your Machines Running smoothly with LINDEMANN Inspections and Maintenance\n\nTime takes its toll on even the best machines. Over the years, wear and aging can lead to internal leakages and the risk of unexpected failures. That’s where LINDEMANN's inspections and maintenance planning services come in.\n\nOur expert team helps you identify potential issues before they become costly problems, ensuring your machines stay in top shape and delivering peak performance.\n\nDon’t let aging components catch you off guard. Partner with LINDEMANN for proactive care and long-term reliability.\n\n👉 Ready to avoid unpleasant surprises? Discover how we can support your operations: https://lnkd.in/eHZSfXGj\n\n#MetalRecycling #MetalRecyclingSolutions #RecycleForChange #RecycleResponsibly #GreenFuture #RecycleForABetterFuture #CleanerPlanet #CircularEconomy #CarbonReduction #GreenFuture #maintenance #reliability",
        "likes": "37",
        "shares": "8",
        "time": {
          "raw": "2h",
          "parsed": "18.02.2025",
          "isoString": "2025-02-18T08:20:54.087Z"
        },
        "mediaType": "image",
        "mediaContent": [
          "https://media.licdn.com/dms/image/v2/D4E22AQHZQImFxJfOqg/feedshare-shrink_800/B4EZTwbNTzG0Ag-/0/1739200457091?e=1744243200&v=beta&t=u5B_4t25GUuxRIx0eKPdCCoB-lZIQ-hNQOMpr4dxv0A"
        ],
        "date": "2025-02-18T08:20:54.087Z"
      },
      {
        "captions": "🔩 Discover our NxtCut Midsize Scrap Shear in 360°! 🌍\n\nEver wondered what cutting-edge innovation looks like? With our interactive 360° 3D view, you can explore every detail of the NxtCut Midsize Scrap Shear from the comfort of your screen.\n\n📲 Take a closer look at the machine redefining efficiency in metal recycling by following this link: https://lnkd.in/gFxUBhbw\n\nGet a new perspective on performance. Check it out today!\n\n#MetalRecycling #MetalRecyclingSolutions #RecycleForChange #RecycleResponsibly #GreenFuture #RecycleForABetterFuture #CleanerPlanet #CircularEconomy #CarbonReduction #GreenFuture #ScrapShear #InnovationInAction #360View🔩 Discover our NxtCut Midsize Scrap Shear in 360°! 🌍\n\nEver wondered what cutting-edge innovation looks like? With our interactive 360° 3D view, you can explore every detail of the NxtCut Midsize Scrap Shear from the comfort of your screen.\n\n📲 Take a closer look at the machine redefining efficiency in metal recycling by following this link: https://lnkd.in/gFxUBhbw\n\nGet a new perspective on performance. Check it out today!\n\n#MetalRecycling #MetalRecyclingSolutions #RecycleForChange #RecycleResponsibly #GreenFuture #RecycleForABetterFuture #CleanerPlanet #CircularEconomy #CarbonReduction #GreenFuture #ScrapShear #InnovationInAction #360View",
        "likes": "51",
        "comments": "2",
        "shares": "10",
        "time": {
          "raw": "3h",
          "parsed": "11.02.2025",
          "isoString": "2025-02-11T08:20:54.088Z"
        },
        "mediaType": "image",
        "mediaContent": [
          "https://media.licdn.com/dms/image/v2/D5622AQECgkdVfaS25w/feedshare-shrink_800/B56ZTwdk64GoBo-/0/1739201076939?e=1744243200&v=beta&t=XqdFDvBDXaludtkL0Bv_sspqpnGJJ-UQIbxU94SR1qk"
        ],
        "date": "2025-02-11T08:20:54.088Z"
      },
      {
        "captions": "Thanks for that great opportunity: it was a pleasure to see our ZZ shredder 😎 and how your business is running. Today we were pleased to welcome a group of senior leaders from the metals recycling industry, representing companies from across Europe. The group have been attending a Lindemann industry event being held in Manchester and took the opportunity to visit S. Norton’s £20m world-class shredder installation at our Manchester site. This ambitious investment in recycling technology has increased scrap metal shredding capacity by 50% and produces higher quality ferrous and non-ferrous metals - all while delivering sustainability gains including reduced emissions to atmosphere and lower energy consumption.\n#LindemannMetalRecycling #Metals #Recycling #Sustainability #ManchesterToday we were pleased to welcome a group of senior leaders from the metals recycling industry, representing companies from across Europe. The group have been attending a Lindemann industry event being held in Manchester and took the opportunity to visit S. Norton’s £20m world-class shredder installation at our Manchester site. This ambitious investment in recycling technology has increased scrap metal shredding capacity by 50% and produces higher quality ferrous and non-ferrous metals - all while delivering sustainability gains including reduced emissions to atmosphere and lower energy consumption.\n#LindemannMetalRecycling #Metals #Recycling #Sustainability #Manchester",
        "likes": "31",
        "shares": "2",
        "time": {
          "raw": "3h3h",
          "parsed": "04.03.2025",
          "isoString": "2025-03-04T08:20:54.090Z"
        },
        "mediaType": "image",
        "mediaContent": [
          "https://media.licdn.com/dms/image/v2/D4E22AQGhQmdzvMsfkQ/feedshare-shrink_800/B4EZTWQxADHgAk-/0/1738761509024?e=1744243200&v=beta&t=xbb4hqqIX8Mp9m5XNbH6HTNJg2rchqekOGNcnVRYdTw",
          "https://media.licdn.com/dms/image/v2/D4E22AQHg8C40oPAqkw/feedshare-shrink_800/B4EZTWQxA3GYAo-/0/1738761510858?e=1744243200&v=beta&t=Jb3b-EUQ_eMSKozME7e845CaEBlWKgLXZmC6HyvV9qg",
          "https://media.licdn.com/dms/image/v2/D4E22AQEjDtUCcrQrNw/feedshare-shrink_800/B4EZTWQw_8G0Ag-/0/1738761510602?e=1744243200&v=beta&t=cWKRWimv_xQwbCj8TQg0saH4JyB1WutTL9inAvwX5Ec",
          "https://media.licdn.com/dms/image/v2/D4E22AQF8mbgoL9250w/feedshare-shrink_800/B4EZTWQxBGHUAg-/0/1738761510529?e=1744243200&v=beta&t=HvbJ2jnk0-YrCNrWlvjwMAn-2cXj4q5h527dD2v4AtM"
        ],
        "date": "2025-03-04T08:20:54.090Z"
      },
      {
        "captions": "Today we were pleased to welcome a group of senior leaders from the metals recycling industry, representing companies from across Europe. The group have been attending a Lindemann industry event being held in Manchester and took the opportunity to visit S. Norton’s £20m world-class shredder installation at our Manchester site. This ambitious investment in recycling technology has increased scrap metal shredding capacity by 50% and produces higher quality ferrous and non-ferrous metals - all while delivering sustainability gains including reduced emissions to atmosphere and lower energy consumption.\n#LindemannMetalRecycling #Metals #Recycling #Sustainability #ManchesterToday we were pleased to welcome a group of senior leaders from the metals recycling industry, representing companies from across Europe. The group have been attending a Lindemann industry event being held in Manchester and took the opportunity to visit S. Norton’s £20m world-class shredder installation at our Manchester site. This ambitious investment in recycling technology has increased scrap metal shredding capacity by 50% and produces higher quality ferrous and non-ferrous metals - all while delivering sustainability gains including reduced emissions to atmosphere and lower energy consumption.\n#LindemannMetalRecycling #Metals #Recycling #Sustainability #Manchester",
        "likes": "31",
        "shares": "2",
        "time": {
          "raw": "3h",
          "parsed": "11.02.2025",
          "isoString": "2025-02-11T08:20:54.091Z"
        },
        "mediaType": "image",
        "mediaContent": [
          "https://media.licdn.com/dms/image/v2/D4E22AQGhQmdzvMsfkQ/feedshare-shrink_800/B4EZTWQxADHgAk-/0/1738761509024?e=1744243200&v=beta&t=xbb4hqqIX8Mp9m5XNbH6HTNJg2rchqekOGNcnVRYdTw",
          "https://media.licdn.com/dms/image/v2/D4E22AQHg8C40oPAqkw/feedshare-shrink_800/B4EZTWQxA3GYAo-/0/1738761510858?e=1744243200&v=beta&t=Jb3b-EUQ_eMSKozME7e845CaEBlWKgLXZmC6HyvV9qg",
          "https://media.licdn.com/dms/image/v2/D4E22AQEjDtUCcrQrNw/feedshare-shrink_800/B4EZTWQw_8G0Ag-/0/1738761510602?e=1744243200&v=beta&t=cWKRWimv_xQwbCj8TQg0saH4JyB1WutTL9inAvwX5Ec",
          "https://media.licdn.com/dms/image/v2/D4E22AQF8mbgoL9250w/feedshare-shrink_800/B4EZTWQxBGHUAg-/0/1738761510529?e=1744243200&v=beta&t=HvbJ2jnk0-YrCNrWlvjwMAn-2cXj4q5h527dD2v4AtM"
        ],
        "date": "2025-02-11T08:20:54.091Z"
      },
      {
        "captions": "Did you know? Around 30% of steel is currently produced by recycling scrap, and this is expected to rise to 50% by 2050. ♻️\nRecycling steel not only saves resources but also reduces CO₂ emissions – a win for the planet! 🌱✨\n\nEvery step we take today helps build a greener tomorrow – let's recycle for a sustainable future! 💪🌎♻️\n\n#MetalRecycling #MetalRecyclingSolutions #RecycleForChange #RecycleResponsibly #GreenFuture #RecycleForABetterFuture #Steel",
        "likes": "29",
        "shares": "5",
        "time": {
          "raw": "4h",
          "parsed": "04.02.2025",
          "isoString": "2025-02-04T08:20:54.092Z"
        },
        "mediaType": "document",
        "mediaContent": {
          "title": "facts",
          "subtitle": "2 sayfa",
          "totalPages": 2,
          "coverPages": [
            {
              "type": "image",
              "config": {
                "src": "https://media.licdn.com/dms/image/v2/D4E1FAQGfdBm4O_B0OQ/feedshare-document-cover-images_480/B4EZSXq8sbHMBI-/0/1737711406819?e=1741683600&v=beta&t=vCyBQ5lGs5Ss0AYDfMSI6rzTyu7pwMU_xaL49nFu4NE"
              }
            },
            {
              "type": "image",
              "config": {
                "src": "https://media.licdn.com/dms/image/v2/D4E1FAQGfdBm4O_B0OQ/feedshare-document-cover-images_480/B4EZSXq8sbHMBI-/1/1737711406819?e=1741683600&v=beta&t=G9SLwZBs97VstbRJ8NNkxLudwcePTjfxE3YN992-Zfg"
              }
            }
          ]
        },
        "date": "2025-02-04T08:20:54.092Z"
      },
      {
        "captions": "🇮🇳 India’s Steel Ambitions: A Call for Action in Metal Recycling♻️\n\nBy 2030, India aims to achieve an impressive 250 million tones of steel output, a critical milestone for its industrial and economic growth. But this ambitious target comes with a significant challenge: 700 shredder plants will be required to process the necessary scrap materials, supported by 2,800-3,000 collection and dismantling centers.(Source: Euromonitor, SIAM, Business Sweden Analysis)\n\nThis is a tremendous opportunity for the recycling industry to step up and play a pivotal role in building a more efficient and sustainable supply chain.\n\nAt LINDEMANN, we are committed to driving innovation and delivering advanced solutions that empower businesses to meet these demands. With our cutting-edge shredders and expertise in metal recycling, we’re ready to support India—and the world—on its journey to a more circular economy.\n\nLet’s shape the future of recycling together. 🌟\n\n#MetalRecycling #MetalRecyclingSolutions #RecycleForChange #RecycleResponsibly #GreenFuture #RecycleForABetterFuture #CleanerPlanet #CircularEconomy #CarbonReduction #GreenFuture #India 🇮🇳 India’s Steel Ambitions: A Call for Action in Metal Recycling♻️\n\nBy 2030, India aims to achieve an impressive 250 million tones of steel output, a critical milestone for its industrial and economic growth. But this ambitious target comes with a significant challenge: 700 shredder plants will be required to process the necessary scrap materials, supported by 2,800-3,000 collection and dismantling centers.(Source: Euromonitor, SIAM, Business Sweden Analysis)\n\nThis is a tremendous opportunity for the recycling industry to step up and play a pivotal role in building a more efficient and sustainable supply chain.\n\nAt LINDEMANN, we are committed to driving innovation and delivering advanced solutions that empower businesses to meet these demands. With our cutting-edge shredders and expertise in metal recycling, we’re ready to support India—and the world—on its journey to a more circular economy.\n\nLet’s shape the future of recycling together. 🌟\n\n#MetalRecycling #MetalRecyclingSolutions #RecycleForChange #RecycleResponsibly #GreenFuture #RecycleForABetterFuture #CleanerPlanet #CircularEconomy #CarbonReduction #GreenFuture #India",
        "likes": "37",
        "comments": "2",
        "shares": "6",
        "time": {
          "raw": "1ay",
          "parsed": "04.02.2025",
          "isoString": "2025-02-04T08:20:54.094Z"
        },
        "mediaType": "image",
        "mediaContent": [
          "https://media.licdn.com/dms/image/v2/D4E22AQGoQBsivsiAIQ/feedshare-shrink_800/B4EZSdI9yIGYAg-/0/1737803163338?e=1744243200&v=beta&t=yb5WMdgXtraikTmuR5W-PN9iAvPa7AJSP0u7VnZKh-g"
        ],
        "date": "2025-02-04T08:20:54.094Z"
      },
      {
        "captions": "At LINDEMANN Metal Recycling, our commitment to excellence knows no borders. Across the globe, we deliver industry-leading service and support tailored to meet the unique needs of our customers, wherever they are. 🌍\n\nFrom installation and training to maintenance and spare parts, our expert teams work closely with you at every stage to maximize the efficiency and longevity of your metal recycling equipment. With service technicians strategically located worldwide, we ensure quick response times and minimized downtime for your operations. 📈\n\nAt LINDEMANN, we pride ourselves on delivering not just premium technology but also a partnership built on trust, reliability, and expertise. Whether you’re looking to upgrade your machinery, resolve a technical issue, or plan preventive maintenance, our global team is ready to help you succeed.\n\nWe’re here for you. To get in contact with a team near you, visit: https://lnkd.in/eCbX9HMg\n\n#MetalRecycling #MetalRecyclingSolutions #RecycleForChange #RecycleResponsibly #GreenFuture #RecycleForABetterFuture #CleanerPlanet #CircularEconomy #CarbonReduction #GlobalSupport #CustomerServiceAt LINDEMANN Metal Recycling, our commitment to excellence knows no borders. Across the globe, we deliver industry-leading service and support tailored to meet the unique needs of our customers, wherever they are. 🌍\n\nFrom installation and training to maintenance and spare parts, our expert teams work closely with you at every stage to maximize the efficiency and longevity of your metal recycling equipment. With service technicians strategically located worldwide, we ensure quick response times and minimized downtime for your operations. 📈\n\nAt LINDEMANN, we pride ourselves on delivering not just premium technology but also a partnership built on trust, reliability, and expertise. Whether you’re looking to upgrade your machinery, resolve a technical issue, or plan preventive maintenance, our global team is ready to help you succeed.\n\nWe’re here for you. To get in contact with a team near you, visit: https://lnkd.in/eCbX9HMg\n\n#MetalRecycling #MetalRecyclingSolutions #RecycleForChange #RecycleResponsibly #GreenFuture #RecycleForABetterFuture #CleanerPlanet #CircularEconomy #CarbonReduction #GlobalSupport #CustomerService",
        "likes": "63",
        "comments": "2",
        "shares": "7",
        "time": {
          "raw": "1ay",
          "parsed": "04.02.2025",
          "isoString": "2025-02-04T08:20:54.095Z"
        },
        "mediaType": "image",
        "mediaContent": [
          "https://media.licdn.com/dms/image/v2/D4E22AQGC0uKNfQIclg/feedshare-shrink_800/B4EZS76XtFG0Ag-/0/1738319430927?e=1744243200&v=beta&t=SOsH4n4xDtbS1Unvdadmjbcka3qyobE8mUoOV_SNDtA"
        ],
        "date": "2025-02-04T08:20:54.095Z"
      },
      {
        "captions": "We’re thrilled to announce that LINDEMANN will be participating in the 12th International Material Recycling Convention (IMRC), organized by MRAI, taking place January 28-30, 2025, at the Novotel Jaipur & Convention Centre in Jaipur, India. 🇮🇳 ♻️\n\n Why Attend?✅\n\nThe IMRC is a premier event that unites 3,000+ delegates and 200+ exhibitors from across the global recycling fraternity. It’s a unique platform for networking, showcasing the latest in recycling technologies, exploring business opportunities, and discovering innovative solutions shaping the industry’s future.\n\nAt LINDEMANN, we’re excited to share how our advanced recycling technologies are driving the future of sustainable metal recycling. We will be at booth ...... Don’t forget to stop by to meet our team and discuss how we can help you achieve your goals.\n\n🎟️ Don’t miss out—register now: https://imrc.mrai.org.in\n\n#MetalRecycling #MetalRecyclingSolutions #RecycleForChange #RecycleResponsibly #GreenFuture #RecycleForABetterFuture #CleanerPlanet #CircularEconomy #MRAI #IMRC2025 #RecyclingInnovation #NetworkingOpportunityWe’re thrilled to announce that LINDEMANN will be participating in the 12th International Material Recycling Convention (IMRC), organized by MRAI, taking place January 28-30, 2025, at the Novotel Jaipur & Convention Centre in Jaipur, India. 🇮🇳 ♻️\n\n Why Attend?✅\n\nThe IMRC is a premier event that unites 3,000+ delegates and 200+ exhibitors from across the global recycling fraternity. It’s a unique platform for networking, showcasing the latest in recycling technologies, exploring business opportunities, and discovering innovative solutions shaping the industry’s future.\n\nAt LINDEMANN, we’re excited to share how our advanced recycling technologies are driving the future of sustainable metal recycling. We will be at booth ...... Don’t forget to stop by to meet our team and discuss how we can help you achieve your goals.\n\n🎟️ Don’t miss out—register now: https://imrc.mrai.org.in\n\n#MetalRecycling #MetalRecyclingSolutions #RecycleForChange #RecycleResponsibly #GreenFuture #RecycleForABetterFuture #CleanerPlanet #CircularEconomy #MRAI #IMRC2025 #RecyclingInnovation #NetworkingOpportunity",
        "likes": "35",
        "shares": "5",
        "time": {
          "raw": "1ay",
          "parsed": "04.02.2025",
          "isoString": "2025-02-04T08:20:54.097Z"
        },
        "mediaType": "image",
        "mediaContent": [
          "https://media.licdn.com/dms/image/v2/D4E22AQFScq8XfsCqQQ/feedshare-shrink_800/B4EZSXoDtMGYAg-/0/1737710649488?e=1744243200&v=beta&t=YJ4w6dGb_1F24IZKuKHh3wQpA1-1nSwsumszH5J6iGo"
        ],
        "date": "2025-02-04T08:20:54.097Z"
      }
    ]
  },
  {
    "name": "Sierra",
    "followerData": [
      [
        20250213,
        5830
      ],
      [
        20250225,
        5862
      ],
      [
        20250225,
        5862
      ],
      [
        20250225,
        5862
      ],
      [
        20250228,
        5865
      ],
      [
        20250228,
        5865
      ],
      [
        20250228,
        5865
      ],
      [
        20250228,
        5865
      ],
      [
        20250303,
        5874
      ],
      [
        1741011455536,
        "5.874"
      ],
      [
        1741076472538,
        "5.877"
      ]
    ],
    "data": [
      {
        "captions": "New challengers in the kitchen! 🔥\n\nTeam Alter Trading —bringing bold flavors, fresh energy, and a competitive edge to Table Scraps: The Chef’s Challenge. These industry pros know their way around the job, but can they handle the heat of the kitchen?\n\nFind out when Table Scraps: The Chef’s Challenge drops March 14th! \n\n🔔 Subscribe on YouTube today! \n🔗 https://lnkd.in/gNG2dRXW\n\n#TableScraps #TheChefsChallenge #RecyclingMeetsCulinary #RecyclingCommunity Michael Goldstein🟧, Patrick Young, Mark Hadacek, Abby Goldstein, John Sacco",
        "likes": "22",
        "comments": "4",
        "shares": "3",
        "time": {
          "raw": "1g",
          "parsed": "03.03.2025",
          "isoString": "2025-03-03T08:21:12.278Z"
        },
        "mediaType": "video",
        "mediaContent": {
          "src": [
            {
              "src": "https://dms.licdn.com/playlist/vid/v2/D5605AQFE7bULTPQ4Fg/mp4-640p-30fp-crf28/B56ZVNuLu8GQBk-/0/1740765711583?e=1741683600&v=beta&t=S77zWjrKjDCZI_ZN2_O6t3yAbibK8POBa6AS3aPdJKc",
              "type": "video/mp4",
              "data-bitrate": 858157
            },
            {
              "src": "https://dms.licdn.com/playlist/vid/v2/D5605AQFE7bULTPQ4Fg/mp4-720p-30fp-crf28/B56ZVNuLu8GQBo-/0/1740765711535?e=1741683600&v=beta&t=pVmHohFm0Lj6hLA6j1imn0ACyjkGr847knBMyZV3A38",
              "type": "video/mp4",
              "data-bitrate": 1142498
            }
          ],
          "posterUrl": "https://media.licdn.com/dms/image/v2/D5605AQFE7bULTPQ4Fg/videocover-high/B56ZVNuLu8GQB0-/0/1740765710943?e=1741683600&v=beta&t=0upxvNR2whjeN54qRnPPYhsJEz1aLr81X8qmktVkZwE"
        },
        "date": "2025-03-03T08:21:12.278Z"
      },
      {
        "captions": "Sierra® T1100 3-in-1? This powerhouse combines three machines in one, delivering unmatched versatility and efficiency. \n\nWith a 36-inch throat, it effortlessly handles bulkier materials and even logs automobiles with ease—outperforming anything else on the market. Plus, the double automatic lubrication system keeps you cutting longer!\n\n📲 Reach out to one of our sales reps today for more information!\n\n#SierraT1100 #RecyclingInnovation #BuiltToPerform Alter Trading",
        "likes": "9",
        "time": {
          "raw": "1g",
          "parsed": "03.03.2025",
          "isoString": "2025-03-03T08:21:12.279Z"
        },
        "mediaType": "video",
        "mediaContent": {
          "src": [
            {
              "src": "https://dms.licdn.com/playlist/vid/v2/D5605AQEMy8sAKSEIRQ/mp4-720p-30fp-crf28/B56ZVOLW6FHEBg-/0/1740773372512?e=1741683600&v=beta&t=j5C447G0Yxgtix4wukKOeDh0T8InzTh_f5t9lRWubpU",
              "type": "video/mp4",
              "data-bitrate": 1273632
            },
            {
              "src": "https://dms.licdn.com/playlist/vid/v2/D5605AQEMy8sAKSEIRQ/mp4-640p-30fp-crf28/B56ZVOLW6FHEBc-/0/1740773367640?e=1741683600&v=beta&t=sO9L7bv_rKa3G3OqcUaOySLRoEBr4Gk3T3MsWFmtaQI",
              "type": "video/mp4",
              "data-bitrate": 993407
            }
          ],
          "posterUrl": "https://media.licdn.com/dms/image/v2/D5605AQEMy8sAKSEIRQ/videocover-high/B56ZVOLW6FHEBs-/0/1740773364340?e=1741683600&v=beta&t=FBKMj4v7EWUJUFTK_xXal2oou52KX85y1fJAqyyFhcs"
        },
        "date": "2025-03-03T08:21:12.279Z"
      },
      {
        "captions": "When we say “The Chef’s Challenge,” we mean it! ⏲️\n\nThis season of Table Scraps raises the stakes, so it’s only fitting that we brought in expert judges to take on the challenge! 🏆\n\nMeet Gino, Lanette, and Antonia—Bakersfield’s very own food and wine legends. With deep roots in the restaurant industry, they know a great dish when they taste one. And what better place to bring them in than Luigi’s (@Luigisbakersfield)—a Bakersfield institution for 115 years and a true cornerstone of the community. 🍝\n\nOh, and fun fact? They also happen to be John Sacco’s in-laws! We love our Luigi’s family!\n\nWill anyone WOW the judges? Find out March 14th! ♻️\n\n#TableScraps #TheChefsChallenge #RecyclingMeetsCulinary #RecyclingCommunity #FoodAndWine #Sustainability #BakersfieldEatsWhen we say “The Chef’s Challenge,” we mean it! ⏲️\n\nThis season of Table Scraps raises the stakes, so it’s only fitting that we brought in expert judges to take on the challenge! 🏆\n\nMeet Gino, Lanette, and Antonia—Bakersfield’s very own food and wine legends. With deep roots in the restaurant industry, they know a great dish when they taste one. And what better place to bring them in than Luigi’s (@Luigisbakersfield)—a Bakersfield institution for 115 years and a true cornerstone of the community. 🍝\n\nOh, and fun fact? They also happen to be John Sacco’s in-laws! We love our Luigi’s family!\n\nWill anyone WOW the judges? Find out March 14th! ♻️\n\n#TableScraps #TheChefsChallenge #RecyclingMeetsCulinary #RecyclingCommunity #FoodAndWine #Sustainability #BakersfieldEats",
        "likes": "21",
        "comments": "2",
        "shares": "3",
        "time": {
          "raw": "2g",
          "parsed": "02.03.2025",
          "isoString": "2025-03-02T08:21:12.280Z"
        },
        "mediaType": "image",
        "mediaContent": [
          "https://media.licdn.com/dms/image/v2/D5622AQHci18dt-Qeuw/feedshare-shrink_800/B56ZVOwRn8GUAg-/0/1740783035453?e=1744243200&v=beta&t=S-kLBcuvIwsUqjPdQOlqfQl4t73qJTKmyOMhyKO3jS0",
          "https://media.licdn.com/dms/image/v2/D5622AQGCyjl7npFORw/feedshare-shrink_800/B56ZVOwRoOGUAg-/0/1740783034508?e=1744243200&v=beta&t=Yp7UeK-LNOzTWDRqQj6nAE2_w9E3kfwhNWQUGgO0aU8",
          "https://media.licdn.com/dms/image/v2/D5622AQElwuU_v8kE-A/feedshare-shrink_800/B56ZVOwRoAGsAs-/0/1740783034459?e=1744243200&v=beta&t=Lk11_LRTSlRI-8SQAr4FvVEinqzBzoO1nBHrNd0A0j8",
          "https://media.licdn.com/dms/image/v2/D5622AQFeJCzrA8siGA/feedshare-shrink_800/B56ZVOwRoIHQAk-/0/1740783034273?e=1744243200&v=beta&t=oZj9nHUK-jkuwP_-N7FUibDcXsu6g95ezw6TLte_vhM",
          "https://media.licdn.com/dms/image/v2/D5622AQHXVkyoJsSfNw/feedshare-shrink_800/B56ZVOwRn8HQAk-/0/1740783034224?e=1744243200&v=beta&t=P8gDvAfeDVQN92_Cs-oiVjmUkGcpahze22aucCjdvy0"
        ],
        "date": "2025-03-02T08:21:12.280Z"
      },
      {
        "captions": "Sierra® E9.6 Ecological Material Handler—built for efficiency and performance⚡️♻️\n\n✅Zero emissions & reduced noise\n\n✅ Energy Plus™ heavy-duty battery for lower operating costs\n\n✅ Unmatched mobility for safe, flexible operation \n\nDesigned for materials like nonferrous metals, cardboard, plastics, and more, the E9.6 is revolutionizing recycling operations! \n\n#SierraE96 #recyclinginnovation #sustainablesolutionsSierra® E9.6 Ecological Material Handler—built for efficiency and performance⚡️♻️\n\n✅Zero emissions & reduced noise\n\n✅ Energy Plus™ heavy-duty battery for lower operating costs\n\n✅ Unmatched mobility for safe, flexible operation \n\nDesigned for materials like nonferrous metals, cardboard, plastics, and more, the E9.6 is revolutionizing recycling operations! \n\n#SierraE96 #recyclinginnovation #sustainablesolutions",
        "likes": "2",
        "time": {
          "raw": "3g",
          "parsed": "01.03.2025",
          "isoString": "2025-03-01T08:21:12.282Z"
        },
        "mediaType": "image",
        "mediaContent": [
          "https://media.licdn.com/dms/image/v2/D5622AQEQt9YMiI8zBA/feedshare-shrink_800/B56ZVNpp3.HQAo-/0/1740764523455?e=1744243200&v=beta&t=NTnIrFxSYU0VhSdY7xrhVBuel2G7JE8uZKV22heCyWY",
          "https://media.licdn.com/dms/image/v2/D5622AQHRTBkQS4AWEQ/feedshare-shrink_800/B56ZVNpp3wHQAg-/0/1740764523383?e=1744243200&v=beta&t=ADbuV97v6_5Xb7UVnxM-ENasY1TOJJIUhDNmCZorhVE",
          "https://media.licdn.com/dms/image/v2/D5622AQEa09hKtNBilA/feedshare-shrink_800/B56ZVNpp3EGsAg-/0/1740764523601?e=1744243200&v=beta&t=Zx7RJE8G3qfV0rKo0Mj45Thsv9aQqm6OMWglBUSLr9M",
          "https://media.licdn.com/dms/image/v2/D5622AQHSs9-YwZHSEA/feedshare-shrink_800/B56ZVNpp4CGsAk-/0/1740764522956?e=1744243200&v=beta&t=B4KWTsrELZvmI61fYVzumJFj5rwRtD8wVpZ2tcMvoNw",
          "https://media.licdn.com/dms/image/v2/D5622AQFbM3f_EKo8TA/feedshare-shrink_800/B56ZVNpp38HEAg-/0/1740764523201?e=1744243200&v=beta&t=TfLHHbpQ1bioZuL0fGiT8a7-3Gu3Z41HdILfNcx7Tjc"
        ],
        "date": "2025-03-01T08:21:12.282Z"
      },
      {
        "captions": "Meet Alton Schaubhut ♻️CMC 📌Dallas TX / New Orleans, LA 🎤Team O.G.s\n\n2/2 of the O.G.s! Alton was also a chef on Table Scraps Season 1! He’s bringing his New Oreleans flare to the Chef’s Challenge! Meeting Andrew through REMA & Season 1, they think they have what it takes to win the chef’s challenge…\n\nSee who takes home the Chef’s trophy→ March 14th! 📺Subscribe on Youtube – https://lnkd.in/gBt__iug",
        "likes": "31",
        "comments": "6",
        "shares": "1",
        "time": {
          "raw": "3g",
          "parsed": "01.03.2025",
          "isoString": "2025-03-01T08:21:12.283Z"
        },
        "mediaType": "video",
        "mediaContent": {
          "src": [
            {
              "src": "https://dms.licdn.com/playlist/vid/v2/D5605AQFjtzKx8eV8bw/mp4-720p-30fp-crf28/B56ZVNZ7erGsBg-/0/1740760419333?e=1741683600&v=beta&t=hZ-O0HCXXKxK0WXHB9b3UP52hr31KLTBCbNyxLVtPEA",
              "type": "video/mp4",
              "data-bitrate": 1183202
            },
            {
              "src": "https://dms.licdn.com/playlist/vid/v2/D5605AQFjtzKx8eV8bw/mp4-640p-30fp-crf28/B56ZVNZ7erGsBc-/0/1740760417437?e=1741683600&v=beta&t=PRFaHCB4Nq3TQ4h4gFgUWux_H7QiS71rIgOowOzzN6g",
              "type": "video/mp4",
              "data-bitrate": 898784
            }
          ],
          "posterUrl": "https://media.licdn.com/dms/image/v2/D5605AQFjtzKx8eV8bw/videocover-high/B56ZVNZ7erGsBs-/0/1740760413058?e=1741683600&v=beta&t=fzz4q3ydMRWX4Isxi6xzCXnNS1adN5dbJwDvp-5sCOU"
        },
        "date": "2025-03-01T08:21:12.283Z"
      },
      {
        "captions": "Season 2 of Table Scraps: The Chef's Challenge is almost here, bringing the recycling community together in a whole new way!\n\nBefore we fire up the kitchen again, have you watched Season 1? 🍴🥩\n\n📺 Catch up now: https://lnkd.in/gxcqsxJS",
        "likes": "13",
        "shares": "2",
        "time": {
          "raw": "4g",
          "parsed": "28.02.2025",
          "isoString": "2025-02-28T08:21:12.284Z"
        },
        "mediaType": "video",
        "mediaContent": {
          "src": [
            {
              "src": "https://dms.licdn.com/playlist/vid/v2/D5605AQEhwbt1g8Vu8w/mp4-720p-30fp-crf28/B56ZVIZVeoGsBg-/0/1740676366300?e=1741683600&v=beta&t=xt3wVlRPAGFux7W-azFGqUU1MuQAUuf3IMdcQJHtkzQ",
              "type": "video/mp4",
              "data-bitrate": 1337622
            },
            {
              "src": "https://dms.licdn.com/playlist/vid/v2/D5605AQEhwbt1g8Vu8w/mp4-640p-30fp-crf28/B56ZVIZVeoGsBc-/0/1740676366368?e=1741683600&v=beta&t=uzOjwiQiQ0Lyij85Jjo7YbviMLPdrUbYeB2sB7XRAAw",
              "type": "video/mp4",
              "data-bitrate": 1014901
            }
          ],
          "posterUrl": "https://media.licdn.com/dms/image/v2/D5605AQEhwbt1g8Vu8w/feedshare-thumbnail_720_1280/B56ZVIZVeoGsA8-/0/1740676360868?e=1741683600&v=beta&t=lP_15eNOFb0SXQqn_Lvr0xBY2xdspzPxplReRpz6LvY"
        },
        "date": "2025-02-28T08:21:12.284Z"
      },
      {
        "captions": "Out in the yard! 🦾 Efficiency you can hear. 🔊♻️ Aluminum radiators baled and ready for recycling—another step in keeping valuable materials in the loop. #SustainableSolutions #RecyclingInAction",
        "likes": "2",
        "time": {
          "raw": "4g5g",
          "parsed": "04.03.2025",
          "isoString": "2025-03-04T08:21:12.284Z"
        },
        "mediaType": "video",
        "mediaContent": {
          "src": [
            {
              "src": "https://dms.licdn.com/playlist/vid/v2/D5605AQGrpZ2FI-kw9g/mp4-720p-30fp-crf28/B56ZVD.qEVGQBg-/0/1740602263147?e=1741683600&v=beta&t=qF3nwRP1ohr32NZ6NH0qf7-nv7DzsojnYYgBT0DD-3k",
              "type": "video/mp4",
              "data-bitrate": 1229157
            },
            {
              "src": "https://dms.licdn.com/playlist/vid/v2/D5605AQGrpZ2FI-kw9g/mp4-640p-30fp-crf28/B56ZVD.qEVGQBc-/0/1740602262071?e=1741683600&v=beta&t=PrgsKhvE8y8BEnnRQNwl1PD04ajyUc6IogOPowsjKew",
              "type": "video/mp4",
              "data-bitrate": 925153
            }
          ],
          "posterUrl": "https://media.licdn.com/dms/image/v2/D5605AQGrpZ2FI-kw9g/videocover-high/B56ZVD.qEVGQBs-/0/1740602259719?e=1741683600&v=beta&t=61MszFYT3z9wQk1nnIuynNSHffrqnuZbtezh_67iqfo"
        },
        "date": "2025-03-04T08:21:12.284Z"
      },
      {
        "captions": "Efficiency you can hear. 🔊♻️ Aluminum radiators baled and ready for recycling—another step in keeping valuable materials in the loop. #SustainableSolutions #RecyclingInAction",
        "time": {
          "raw": "5g",
          "parsed": "27.02.2025",
          "isoString": "2025-02-27T08:21:12.285Z"
        },
        "mediaType": "video",
        "mediaContent": {
          "src": [
            {
              "src": "https://dms.licdn.com/playlist/vid/v2/D5605AQGrpZ2FI-kw9g/mp4-720p-30fp-crf28/B56ZVD.qEVGQBg-/0/1740602263147?e=1741683600&v=beta&t=qF3nwRP1ohr32NZ6NH0qf7-nv7DzsojnYYgBT0DD-3k",
              "type": "video/mp4",
              "data-bitrate": 1229157
            },
            {
              "src": "https://dms.licdn.com/playlist/vid/v2/D5605AQGrpZ2FI-kw9g/mp4-640p-30fp-crf28/B56ZVD.qEVGQBc-/0/1740602262071?e=1741683600&v=beta&t=PrgsKhvE8y8BEnnRQNwl1PD04ajyUc6IogOPowsjKew",
              "type": "video/mp4",
              "data-bitrate": 925153
            }
          ],
          "posterUrl": "https://media.licdn.com/dms/image/v2/D5605AQGrpZ2FI-kw9g/videocover-high/B56ZVD.qEVGQBs-/0/1740602259719?e=1741683600&v=beta&t=61MszFYT3z9wQk1nnIuynNSHffrqnuZbtezh_67iqfo"
        },
        "date": "2025-02-27T08:21:12.285Z"
      },
      {
        "captions": "Meet Andrew Lincoln! ♻️Lincoln Recycling 📌Erie, PA 🎤Team O.G.s\n\nAndrew was a chef on Table Scraps Season 1! He’s back & bringing his experience to the Chef’s Challenge! John Sacco & Andrew bonded over their shared love of cooking & food. He’s teamed up with another familiar face: Alton Schaubhut to bring the heat to Bakersfield. (Missing their other teammate Michael Sciaba who couldn’t make it😔)\n\nWatch Andrew cook → March 14th! 📺 Subscribe on Youtube – link in bio!",
        "likes": "48",
        "comments": "8",
        "shares": "2",
        "time": {
          "raw": "5g",
          "parsed": "27.02.2025",
          "isoString": "2025-02-27T08:21:12.286Z"
        },
        "mediaType": "video",
        "mediaContent": {
          "src": [
            {
              "src": "https://dms.licdn.com/playlist/vid/v2/D5605AQFyH_PT1-4aYQ/mp4-720p-30fp-crf28/B56ZVDKeMsHEBk-/0/1740588604050?e=1741683600&v=beta&t=nlhjQMurd2HDP3PsDcNIiakyBgbL_gcS6-XIUokjy64",
              "type": "video/mp4",
              "data-bitrate": 892620
            },
            {
              "src": "https://dms.licdn.com/playlist/vid/v2/D5605AQFyH_PT1-4aYQ/mp4-640p-30fp-crf28/B56ZVDKeMsHEBg-/0/1740588609762?e=1741683600&v=beta&t=O1SP0Mf3CXTr0KFFwXYnsjoq5XuJXoJ7qLPB5aVZkc0",
              "type": "video/mp4",
              "data-bitrate": 678836
            }
          ],
          "posterUrl": "https://media.licdn.com/dms/image/v2/D5605AQFyH_PT1-4aYQ/feedshare-thumbnail_720_1280/B56ZVDKeMsHEBA-/0/1740588574536?e=1741683600&v=beta&t=ArhRhaUUtudYY7o1D9RLnRelVU-XHwwkod11SbXCk0c"
        },
        "date": "2025-02-27T08:21:12.286Z"
      },
      {
        "captions": "Team OG’s- back for another year, bringing skills, experience, and a whole lot of flavor to the challenge. Are they the ones to beat? 👀\n\nPremiering March 14th—who’s hungry?🍴 \n\n🔔 Don’t miss out, subscribe on YouTube today!\n\n#TableScraps #TheChefsChallenge #RecyclingMeetsCulinary #RecyclingCommunity \nAndrew Lincoln, Alton Schaubhut",
        "likes": "14",
        "comments": "4",
        "shares": "1",
        "time": {
          "raw": "6g",
          "parsed": "26.02.2025",
          "isoString": "2025-02-26T08:21:12.287Z"
        },
        "mediaType": "video",
        "mediaContent": {
          "src": [
            {
              "src": "https://dms.licdn.com/playlist/vid/v2/D5605AQF62KDsDfihbA/mp4-720p-30fp-crf28/B56ZU.vISGGsBg-/0/1740514301701?e=1741683600&v=beta&t=e3SE8N8lD30l6s37jlqd05RTVW1Ql4rvoQZmyqiswE0",
              "type": "video/mp4",
              "data-bitrate": 936933
            },
            {
              "src": "https://dms.licdn.com/playlist/vid/v2/D5605AQF62KDsDfihbA/mp4-640p-30fp-crf28/B56ZU.vISGGsBc-/0/1740514301482?e=1741683600&v=beta&t=cllSN7qvB2jHicAns2Xnv-u6Ga3dHY_Cj_zOUxqFevE",
              "type": "video/mp4",
              "data-bitrate": 721512
            }
          ],
          "posterUrl": "https://media.licdn.com/dms/image/v2/D5605AQF62KDsDfihbA/videocover-high/B56ZU.vISGGsBs-/0/1740514300877?e=1741683600&v=beta&t=TwCNjSZ1CPDVIkGiO6pGvYFg5OaKb1GUKWz69FuiLLg"
        },
        "date": "2025-02-26T08:21:12.287Z"
      },
      {
        "captions": "The Sierra S5000 baler makes a compact stainless steel bale, there is nothing that competes with this unit !!! \n\n#sierrainternationalmachinery\n#scrapmetal #recycledmaterials\n#portablebaler #amplirollsystemThe Sierra S5000 baler makes a compact stainless steel bale, there is nothing that competes with this unit !!! \n\n#sierrainternationalmachinery\n#scrapmetal #recycledmaterials\n#portablebaler #amplirollsystem",
        "likes": "17",
        "shares": "1",
        "time": {
          "raw": "6g",
          "parsed": "26.02.2025",
          "isoString": "2025-02-26T08:21:12.288Z"
        },
        "mediaType": "image",
        "mediaContent": [
          "https://media.licdn.com/dms/image/v2/D4D22AQH-gASDuzg16g/feedshare-shrink_800/B4DZU.jA4nGcAk-/0/1740511126491?e=1744243200&v=beta&t=l-TSV53CSabZvgGyhMqC1hEpfK5BGu50zXl-p4___-4",
          "https://media.licdn.com/dms/image/v2/D4D22AQFuCtGh1Xccgg/feedshare-shrink_800/B4DZU.jA3bHkAk-/0/1740511126081?e=1744243200&v=beta&t=_TsUN5n6JI4oKWM8aZBtuuZRAfooNRyPlsqnjdjJLNo",
          "https://media.licdn.com/dms/image/v2/D4D22AQESkJrlDvSL4Q/feedshare-shrink_800/B4DZU.jA4SGcAg-/0/1740511125803?e=1744243200&v=beta&t=aHRlsviJCMrynWDD8g2ZoRnq_I6ld1z75L9_N81RekU"
        ],
        "date": "2025-02-26T08:21:12.288Z"
      },
      {
        "captions": "Reb-1 baler heading to recycling facility in the NE where it will be processing plastic and aluminum cans to then be repurposed into new products ♻️✅Sierra International MachineryReb-1 baler heading to recycling facility in the NE where it will be processing plastic and aluminum cans to then be repurposed into new products ♻️✅Sierra International Machinery",
        "likes": "18",
        "comments": "1",
        "shares": "1",
        "time": {
          "raw": "6g",
          "parsed": "26.02.2025",
          "isoString": "2025-02-26T08:21:12.289Z"
        },
        "mediaType": "image",
        "mediaContent": [
          "https://media.licdn.com/dms/image/v2/D4E22AQHMPZpIDfVW1Q/feedshare-shrink_800/B4EZU.TQa3H0Ak-/0/1740506992724?e=1744243200&v=beta&t=g10lkipEJhWaU2xuu88heM950_8Tv5WErJNMpYxhD2o",
          "https://media.licdn.com/dms/image/v2/D4E22AQGeeq9Dmbg4cw/feedshare-shrink_800/B4EZU.TQb9HMAg-/0/1740506993651?e=1744243200&v=beta&t=uQDeSvbQU0hdE81e8ypsE5KP_EUemcyn5inPHH5vCDw"
        ],
        "date": "2025-02-26T08:21:12.289Z"
      },
      {
        "captions": "The Sierra® RB6000: Unmatched Power & Performance. ♻️\n\nWhen it comes to baling and logging, the RB6000 sets the standard:\n\n✅ Most powerful in its class\n\n✅ Handles up to 32 tons per hour\n\n✅ Mill-spec bales & high-density logging\n\n✅ Built to last with Hardox® 450 liners\n\nWith a 170 HP Cummins Turbo Diesel Engine and an industry-leading crane, this machine is designed for maximum efficiency and reliability.\n\n📩 Ready to upgrade your operation? Reach out today!\n\n🔗 https://lnkd.in/gZ5HMB9P\n\n#RB6000 #RecyclingIndustry #HeavyMachinery #Efficiency #BuiltToWork",
        "likes": "3",
        "time": {
          "raw": "6g",
          "parsed": "26.02.2025",
          "isoString": "2025-02-26T08:21:12.290Z"
        },
        "mediaType": "video",
        "mediaContent": {
          "src": [
            {
              "src": "https://dms.licdn.com/playlist/vid/v2/D5605AQEQy8nN9Xm6ow/mp4-640p-30fp-crf28/B56ZU98dOkHEBc-/0/1740501020955?e=1741683600&v=beta&t=dawbSHXjLT6X3LF6sIyMbmAuUqc5_Qanig9JMp75pj4",
              "type": "video/mp4",
              "data-bitrate": 1084675
            },
            {
              "src": "https://dms.licdn.com/playlist/vid/v2/D5605AQEQy8nN9Xm6ow/mp4-720p-30fp-crf28/B56ZU98dOkHEBg-/0/1740501022032?e=1741683600&v=beta&t=TVWquTMGx1cW1JoGRofWqkk_7cG7yX8gGrJ4sKDJGMs",
              "type": "video/mp4",
              "data-bitrate": 1411652
            }
          ],
          "posterUrl": "https://media.licdn.com/dms/image/v2/D5605AQEQy8nN9Xm6ow/videocover-high/B56ZU98dOkHEBs-/0/1740501019142?e=1741683600&v=beta&t=mQ4cQ4sN5A-36yQJU2Z0hHMunXBvDhpbvuRUMgJaJEI"
        },
        "date": "2025-02-26T08:21:12.290Z"
      },
      {
        "captions": "Every great dish starts with a story—just like Table Scraps: The Chef’s Challenge did. 🍽️♻️\n\nJohn Sacco breaks down the ‘why’ behind this one-of-a-kind competition: bringing people from all over the world together through the shared bond of recycled materials & food. \n\nYear 2 kicked it up a notch! These foodies will be throwing down their best dishes – find out who has what it takes to win → March 14th 📆\n\n📺 Subscribe on Youtube – link in bio! \n\n#TableScraps #ChefsChallenge #Sustainability #Recycling #foodies",
        "likes": "30",
        "comments": "2",
        "shares": "3",
        "time": {
          "raw": "1h",
          "parsed": "25.02.2025",
          "isoString": "2025-02-25T08:21:12.292Z"
        },
        "mediaType": "video",
        "mediaContent": {
          "src": [
            {
              "src": "https://dms.licdn.com/playlist/vid/v2/D4D05AQGEdiQ_a81dzA/mp4-720p-30fp-crf28/B4DZU5E.7yG8Bg-/0/1740419382172?e=1741683600&v=beta&t=13ULQrCjHX1_y3tyHPUECmlospZCGGL2xMmUeaH67wI",
              "type": "video/mp4",
              "data-bitrate": 1340348
            },
            {
              "src": "https://dms.licdn.com/playlist/vid/v2/D4D05AQGEdiQ_a81dzA/mp4-640p-30fp-crf28/B4DZU5E.7yG8Bc-/0/1740419381833?e=1741683600&v=beta&t=TsdNil_vnkz68Ui_M2SpZUVQHvhgO34GOwYuS-gmwo8",
              "type": "video/mp4",
              "data-bitrate": 1012092
            }
          ],
          "posterUrl": "https://media.licdn.com/dms/image/v2/D4D05AQGEdiQ_a81dzA/videocover-high/B4DZU5E.7yG8Bs-/0/1740419377782?e=1741683600&v=beta&t=kd7kvoZaBSpUXuN3ZiEGdyw8hUsM13DD9Pi3HeFQjd0"
        },
        "date": "2025-02-25T08:21:12.292Z"
      },
      {
        "captions": "🚨 Meet the competitors! 🚨\n\nThree teams. One kitchen. Who’s claiming the Table Scraps: The Chef’s Challenge title? 🍽️\n\n🏆 Team Alter Q\n🏆 Team International\n🏆 Team OG’s – the original Table Scraps chef’s are BACK!\n\nGet ready for the ultimate recycler showdown—March 14th on YouTube! Don’t miss it. Subscribe now: https://lnkd.in/gtP7jhBm\n\n#TableScraps #ChefsChallenge #RecyclingIndustry #Sustainability #Foodies",
        "likes": "39",
        "comments": "4",
        "shares": "2",
        "time": {
          "raw": "1h",
          "parsed": "25.02.2025",
          "isoString": "2025-02-25T08:21:12.293Z"
        },
        "mediaType": "video",
        "mediaContent": {
          "src": [
            {
              "src": "https://dms.licdn.com/playlist/vid/v2/D5605AQHXLPnMCZf3qQ/mp4-720p-30fp-crf28/B56ZUrBUUUGUBk-/0/1740183530582?e=1741683600&v=beta&t=ERpiwzZnaollNTTKHt5WxIueOiErYPOE4tZJd0qXhCg",
              "type": "video/mp4",
              "data-bitrate": 1051350
            },
            {
              "src": "https://dms.licdn.com/playlist/vid/v2/D5605AQHXLPnMCZf3qQ/mp4-640p-30fp-crf28/B56ZUrBUUUGUBg-/0/1740183530645?e=1741683600&v=beta&t=gf0Qx3cD4JsLcmAmV6M5KyvYx5NneCc26pQkQjBMWvo",
              "type": "video/mp4",
              "data-bitrate": 666856
            }
          ],
          "posterUrl": "https://media.licdn.com/dms/image/v2/D5605AQHXLPnMCZf3qQ/feedshare-thumbnail_720_1280/B56ZUrBUUUGUBA-/0/1740183527026?e=1741683600&v=beta&t=gx88ZkwcNIMHn2TylDON5g3mxZgsb6t58j3iFF35eLE"
        },
        "date": "2025-02-25T08:21:12.293Z"
      },
      {
        "captions": "Good morning ☀️ \n\nSierra® T409 Matrial Handler | 📦 #wedotoo Sierra Recycling & DemolitionGood morning ☀️ \n\nSierra® T409 Matrial Handler | 📦 #wedotoo Sierra Recycling & Demolition",
        "likes": "4",
        "time": {
          "raw": "1h",
          "parsed": "25.02.2025",
          "isoString": "2025-02-25T08:21:12.294Z"
        },
        "mediaType": "image",
        "mediaContent": [
          "https://media.licdn.com/dms/image/v2/D5622AQFCcspWuOpP_w/feedshare-shrink_800/B56ZUqq0wbHoAg-/0/1740177625077?e=1744243200&v=beta&t=MhHSF6JvoqaFeRvMmOqIHncT_IE02y0YcwcmzVRSN1Q"
        ],
        "date": "2025-02-25T08:21:12.294Z"
      },
      {
        "captions": "Are you ready? 👀 Here’s a sneak peek at this year’s Table Scraps: The Chef’s Challenge! 🍽️\n\nWhich team of recyclers will come out on top? 🏆 \n\n🎥 Premieres March 14, 2025\n🔔 Don’t miss out—subscribe on YouTube today! https://lnkd.in/gtP7jhBm\n\n#TableScraps #ChefsChallenge #Foodies #RecyclingCommunity \n\nJohn Sacco Michael Goldstein🟦Alton Schaubhut Andrew Lincoln Michael Sciaba Abby Goldstein Patrick Young Mark Hadacek Stuart Kagan 🧿 Atilla W. Antonio Tammaro",
        "likes": "27",
        "comments": "7",
        "shares": "4",
        "time": {
          "raw": "1h",
          "parsed": "25.02.2025",
          "isoString": "2025-02-25T08:21:12.295Z"
        },
        "mediaType": "video",
        "mediaContent": {
          "src": [
            {
              "src": "https://dms.licdn.com/playlist/vid/v2/D5605AQFpG5WU9HJ5lQ/mp4-640p-30fp-crf28/B56ZUpxzssHsBc-/0/1740162694269?e=1741683600&v=beta&t=jJ5aISzVGK8M1lIQ46Foq6ny4IN9M2FnTkmwOJirXz8",
              "type": "video/mp4",
              "data-bitrate": 928183
            },
            {
              "src": "https://dms.licdn.com/playlist/vid/v2/D5605AQFpG5WU9HJ5lQ/mp4-720p-30fp-crf28/B56ZUpxzssHsBg-/0/1740162691617?e=1741683600&v=beta&t=r9lEYm9hYxlBaOcf-5ZX-27BVDQMy9evGlk6hkwi928",
              "type": "video/mp4",
              "data-bitrate": 1230355
            }
          ],
          "posterUrl": "https://media.licdn.com/dms/image/v2/D5605AQFpG5WU9HJ5lQ/feedshare-thumbnail_720_1280/B56ZUpxzssHsA8-/0/1740162679332?e=1741683600&v=beta&t=SlPi_DztUYWqY-c_De2OHNVLkA9myo_YSFlNdXBQJJ8"
        },
        "date": "2025-02-25T08:21:12.295Z"
      },
      {
        "captions": "Table Scraps is BACK—with an exciting twist! 🍽️\n\nTable Scraps: The Chef’s Challenge premieres March 14th, bringing together fellow recyclers for a fun kitchen showdown! Which team is coming out on top? 🍳🔥\n\nDon’t miss out—subscribe on YouTube today! 🎥 Link in the comments! ⬇️\n#TableScraps #ChefsChallenge #RecyclingIndustry #Sustainability #Foodie\n\n---\n\nAndrew Lincoln, Michael Sciaba, Michael Goldstein🟦, Abby Goldstein, Patrick Young, Mark Hadacek, Stuart Kagan, 🧿 Atilla W., Antonio Tammaro, Alton Schaubhut, John Sacco",
        "likes": "23",
        "comments": "5",
        "shares": "2",
        "time": {
          "raw": "1h",
          "parsed": "25.02.2025",
          "isoString": "2025-02-25T08:21:12.295Z"
        },
        "mediaType": "video",
        "mediaContent": {
          "src": [
            {
              "src": "https://dms.licdn.com/playlist/vid/v2/D5605AQE-ZM1HQUcLvw/mp4-720p-30fp-crf28/B56ZUlrkWPGoBg-/0/1740093943965?e=1741683600&v=beta&t=nsjzY8Qw6rHJ3rJLeMu1cD7zjR0JcvJxpTlJJUmL-jA",
              "type": "video/mp4",
              "data-bitrate": 361000
            },
            {
              "src": "https://dms.licdn.com/playlist/vid/v2/D5605AQE-ZM1HQUcLvw/mp4-640p-30fp-crf28/B56ZUlrkWPGoBc-/0/1740093943736?e=1741683600&v=beta&t=GH0smhKthC0J6pgRqkbRTubx3zyQWlnVEaL04fGpovM",
              "type": "video/mp4",
              "data-bitrate": 273412
            }
          ],
          "posterUrl": "https://media.licdn.com/dms/image/v2/D5605AQE-ZM1HQUcLvw/feedshare-thumbnail_720_1280/B56ZUlrkWPGoA8-/0/1740093934511?e=1741683600&v=beta&t=LETMz23A56lrBwejTMjg11yDPTSD4rPqIQaVPRMMhZQ"
        },
        "date": "2025-02-25T08:21:12.295Z"
      },
      {
        "captions": "Recycled copper retains its quality indefinitely—making it a critical material in today’s economy.\nThese bales—processed with our Sierra® REB-2—are on their way to becoming:\n\n⚡ Electrical wiring\n💻 Circuit boards\n🔧 Motors & transformers\n🚰 Plumbing systems\n🏠 Roofing & gutters\n🚗 Automotive components\n🔋 EV & battery tech\n✈️ Aerospace materials\n☀️ Renewable energy infrastructure\n\nWhen efficiency, durability, and throughput matter, the REB-2 delivers. More tons. More profit. Let’s talk.",
        "likes": "5",
        "time": {
          "raw": "1h",
          "parsed": "25.02.2025",
          "isoString": "2025-02-25T08:21:12.296Z"
        },
        "mediaType": "video",
        "mediaContent": {
          "src": [
            {
              "src": "https://dms.licdn.com/playlist/vid/v2/D5605AQEI_b6tUuM-8Q/mp4-720p-30fp-crf28/B56ZUkQ6iKGUBo-/0/1740070209849?e=1741683600&v=beta&t=mCXKnTaSEPULR_qAdRv8UnZtLbM8VvBKqDqS3-JpDuc",
              "type": "video/mp4",
              "data-bitrate": 1304986
            },
            {
              "src": "https://dms.licdn.com/playlist/vid/v2/D5605AQEI_b6tUuM-8Q/mp4-640p-30fp-crf28/B56ZUkQ6iKGUBk-/0/1740070209326?e=1741683600&v=beta&t=0Kt6pZtXQyG7NRmZ2D45HfnRmBuSntelVJemRGz6LpA",
              "type": "video/mp4",
              "data-bitrate": 992737
            }
          ],
          "posterUrl": "https://media.licdn.com/dms/image/v2/D5605AQEI_b6tUuM-8Q/feedshare-thumbnail_720_1280/B56ZUkQ6iKGUBE-/0/1740070178321?e=1741683600&v=beta&t=5n054kZUHvrMf2H3ZW7Twp9EUkerC66-C9ET1T39isE"
        },
        "date": "2025-02-25T08:21:12.296Z"
      },
      {
        "captions": "Sierra Recycling & Demolition is upgrading their operation, and this 2012 T1100CD shear/baler/logger is ready for a new home! \n\nKey features:\n✔️ New Floor for extended durability\n\n✔️ Rebuilt Pusher Cylinder (New Rod & Packing)\n\n✔️ (3) 125 HP Engines for maximum power\n\n✔️ New Brass Wear Plates to reduce friction and extend lifespan\n\n✔️ Shear & Pre-Compression for efficient processing\n\n🎥 Filmed: February 2025\n📍 Location: Bakersfield, CA\n📆 Delivery: March 2025\n\nWith a 29'6\" box and 14,577 hours (as of 10/14/2025) this machine is ready to go to work in your yard. Don’t miss out on this opportunity!\n\n📞 Interested? \nContact our sales team today ➡️ https://lnkd.in/gZ5HMB9P",
        "likes": "7",
        "shares": "2",
        "time": {
          "raw": "1h",
          "parsed": "24.02.2025",
          "isoString": "2025-02-24T14:17:35.295Z"
        },
        "mediaType": "video",
        "mediaContent": {
          "src": [
            {
              "src": "https://dms.licdn.com/playlist/vid/v2/D5605AQGHkczrOqncdQ/mp4-640p-30fp-crf28/B56ZUfF5BhGsBc-/0/1739983415024?e=1741618800&v=beta&t=RqdAKh_7rJvHzPcS6nnpAMSVTWGuaqU7wDo1ddW1pug",
              "type": "video/mp4",
              "data-bitrate": 883019
            },
            {
              "src": "https://dms.licdn.com/playlist/vid/v2/D5605AQGHkczrOqncdQ/mp4-720p-30fp-crf28/B56ZUfF5BhGsBg-/0/1739983416124?e=1741618800&v=beta&t=TOsKsF89Ss8MdfQ7HpRm6awtWVlfTt_x19U4JY_Iszo",
              "type": "video/mp4",
              "data-bitrate": 1159375
            }
          ],
          "posterUrl": "https://media.licdn.com/dms/image/v2/D5605AQGHkczrOqncdQ/videocover-low/B56ZUfF5BhGsCM-/0/1739983410653?e=1741618800&v=beta&t=SVnWGfjdUthmaF4X9ywDW7ZBX1EENtZ8ZFsIx0v3oL8"
        },
        "date": "2025-02-24T14:17:35.295Z"
      },
      {
        "captions": "Cutting I-beam like it’s nothing ✂️\n\nStrength. Speed. Efficiency. That's all the Sierra® T715SKL Shear/Baler/Logger knows! \n\nShear Force - 715 tons\nMain Compression - 170 tons\n\nProcesses: \n\nALL METAL\nSTAINLESS STEEL\nHMS #1 + #2 STEEL\nP&S\n\nFor more info reach out to one of our sales reps today! ➡️ https://lnkd.in/gZ5HMB9P",
        "likes": "5",
        "time": {
          "raw": "1h",
          "parsed": "24.02.2025",
          "isoString": "2025-02-24T14:17:35.296Z"
        },
        "mediaType": "video",
        "mediaContent": {
          "src": [
            {
              "src": "https://dms.licdn.com/playlist/vid/v2/D5605AQFoSPIYO-UoFQ/mp4-720p-30fp-crf28/B56ZUbc2DqHEBk-/0/1739922304647?e=1741618800&v=beta&t=jT-F8EpqjxhKTpkHqWAOOsh-GU5jeggZP2SYJGXwRCc",
              "type": "video/mp4",
              "data-bitrate": 1154348
            },
            {
              "src": "https://dms.licdn.com/playlist/vid/v2/D5605AQFoSPIYO-UoFQ/mp4-640p-30fp-crf28/B56ZUbc2DqHEBg-/0/1739922305437?e=1741618800&v=beta&t=w3mC0XKoYgdsT5d2Bo_kiXycruZULXigriQ_SdxHO1Q",
              "type": "video/mp4",
              "data-bitrate": 840865
            }
          ],
          "posterUrl": "https://media.licdn.com/dms/image/v2/D5605AQFoSPIYO-UoFQ/videocover-high/B56ZUbc2DqHEBw-/0/1739922303756?e=1741618800&v=beta&t=ZMwnP285ccy0fF3Bn809M5m4Ho2_43BYKsd5OfZuLaE"
        },
        "date": "2025-02-24T14:17:35.296Z"
      },
      {
        "captions": "Alter-Adjacent & Team Alter-Q’s secret weapon: Abby Goldstein (Michael Goldstein🟧's other half!) 📍St. Louis, MO\n\nAbby made the trip to Bakersfield for Table Scraps with Michael because of their shared love for food & their friends in the recycled materials industry! 🍽️Abby was keeping the kitchen going with mimosas & key tasks to get the dishes done in time! Tune in on March 14th to see how Team Alter-Q’s dishes turned out! 👀\n\n📺Don’t miss out! Subscribe to our YouTube channel link below!\nhttps://lnkd.in/gtP7jhBm\n\nAlter Trading",
        "likes": "9",
        "comments": "3",
        "shares": "1",
        "time": {
          "raw": "11s",
          "parsed": "04.03.2025",
          "isoString": "2025-03-03T21:21:12.275Z"
        },
        "mediaType": "video",
        "mediaContent": {
          "src": [
            {
              "src": "https://dms.licdn.com/playlist/vid/v2/D5605AQFEvBRK1Z3Fgg/mp4-720p-30fp-crf28/B56ZVdATLVHQB0-/0/1741022141910?e=1741683600&v=beta&t=4o6DkD3m3DFGisiQE_X1hXP6g9t0_q0JeIjI57uS_lg",
              "type": "video/mp4",
              "data-bitrate": 1180291
            },
            {
              "src": "https://dms.licdn.com/playlist/vid/v2/D5605AQFEvBRK1Z3Fgg/mp4-640p-30fp-crf28/B56ZVdATLVHQBw-/0/1741022140606?e=1741683600&v=beta&t=vxa61Dz9fWZ_DomR3YeDOaV4BN6MOUuQSf3ForpikII",
              "type": "video/mp4",
              "data-bitrate": 899038
            }
          ],
          "posterUrl": "https://media.licdn.com/dms/image/v2/D5605AQFEvBRK1Z3Fgg/feedshare-thumbnail_720_1280/B56ZVdATLVHQA8-/0/1741022115962?e=1741683600&v=beta&t=sfCVM6zdVplq1BW42e4nmBWKbYjd_wnxsg_Z_AWGYak"
        },
        "date": "2025-03-03T21:21:12.275Z"
      },
      {
        "captions": "Say hello to Michael Goldstein🟧! ♻️Alter Trading 🏆St. Louis, MO\n\nMichael & his other half Abby (who you’ll meet later today) came to the Table Scraps The Chef’s Challenge to rep Alter Trading & have some fun! Michael wasn’t so much focused on the food, but rather hyping his team up & making sure no one was caught cooking without a drink! Alter & Sierra go back many years, and we love continuing relationships in the recycled materials industry! 🤝 Cheers, Michael! 🍻\n\nTable Scraps drops March 14th → Subscribe to our Youtube Channel ⭐️ \nhttps://lnkd.in/gtP7jhBm",
        "likes": "18",
        "comments": "7",
        "shares": "1",
        "time": {
          "raw": "15s",
          "parsed": "03.03.2025",
          "isoString": "2025-03-03T17:21:12.277Z"
        },
        "mediaType": "video",
        "mediaContent": {
          "src": [
            {
              "src": "https://dms.licdn.com/playlist/vid/v2/D5605AQGzgBV3kH1iBg/mp4-640p-30fp-crf28/B56ZVc.mRxHsB0-/0/1741021701793?e=1741683600&v=beta&t=wmhHM-yQSUUL_I4_VtFruna6tTHYILSasdepaq1Kefs",
              "type": "video/mp4",
              "data-bitrate": 776091
            },
            {
              "src": "https://dms.licdn.com/playlist/vid/v2/D5605AQGzgBV3kH1iBg/mp4-720p-30fp-crf28/B56ZVc.mRxHsB4-/0/1741021701234?e=1741683600&v=beta&t=-ZCjKrs1BduT3oYXpC2QjFDhpDRAKGDWqobowF2aNfg",
              "type": "video/mp4",
              "data-bitrate": 1021574
            }
          ],
          "posterUrl": "https://media.licdn.com/dms/image/v2/D5605AQGzgBV3kH1iBg/feedshare-thumbnail_720_1280/B56ZVc.mRxHsBA-/0/1741021669679?e=1741683600&v=beta&t=QHfYTx8k0oVy4nv-gvdvjJYLtbjPP7PYl73KVC8uyGo"
        },
        "date": "2025-03-03T17:21:12.277Z"
      }
    ]
  },
  {
    "name": "AymasRecyclingMachinery",
    "followerData": [
      [
        20250225,
        3629
      ],
      [
        20250225,
        3629
      ],
      [
        20250225,
        3629
      ],
      [
        20250228,
        3644
      ],
      [
        20250228,
        3644
      ],
      [
        20250228,
        3644
      ],
      [
        20250228,
        3644
      ],
      [
        20250303,
        3668
      ],
      [
        1741011479064,
        "3.672"
      ],
      [
        1741076491651,
        "3.697"
      ]
    ],
    "data": [
      {
        "captions": "Wishing you a blessed and peaceful Ramadan! May this holy month bring you joy, prosperity, and spiritual growth. 🌙✨\n\nHappy Ramadan Mubarak! May this holy month bring you peace, abundance and spiritual strength. 🌙✨Wishing you a blessed and peaceful Ramadan! May this holy month bring you joy, prosperity, and spiritual growth. 🌙✨\n\nHappy Ramadan Mubarak! May this holy month bring you peace, abundance and spiritual strength. 🌙✨",
        "likes": "22",
        "shares": "5",
        "time": {
          "raw": "3g",
          "parsed": "01.03.2025",
          "isoString": "2025-03-01T08:21:31.427Z"
        },
        "mediaType": "image",
        "mediaContent": [
          "https://media.licdn.com/dms/image/v2/D4D22AQGm1_af2BS_ZA/feedshare-shrink_800/B4DZVNNZR7GkAk-/0/1740757113228?e=1744243200&v=beta&t=wNMV6M8twBj1aGCh9PPZZe1icYE7mjt_CX10yFwewSE"
        ],
        "date": "2025-03-01T08:21:31.427Z"
      },
      {
        "captions": "AYMAS\n\n#materialhandler #metalrecycling #hurda #scrap #scraplife #scrapyard #scrapmetal #heavyload \n#scrapshear #metalscrap\n#recyclingequipment #scrapshear \n#engineering #hurdamakası \n#geridönüşüm #recyclingmachinery #scrapmetalrecycling #briquetting #singleshaftshredder #cablestripper #inclinedshear  #copper #scrapbaler #scrapshear  #shredder #metalbaler #scraprecycling #baler #twinshaftshredder \n#aymasrecyclingmachinery",
        "likes": "35",
        "shares": "4",
        "time": {
          "raw": "5g",
          "parsed": "27.02.2025",
          "isoString": "2025-02-27T08:21:31.428Z"
        },
        "mediaType": "video",
        "mediaContent": {
          "src": [
            {
              "src": "https://dms.licdn.com/playlist/vid/v2/D5605AQGludL6PxPtIQ/mp4-640p-30fp-crf28/B56ZVGSV8HGQBk-/0/1740640978535?e=1741683600&v=beta&t=JjYsgaFIJE8bguCk1ON29qRxrj3IUgkWeEErYihqJiI",
              "type": "video/mp4",
              "data-bitrate": 537310
            }
          ],
          "posterUrl": "https://media.licdn.com/dms/image/v2/D5605AQGludL6PxPtIQ/videocover-low/B56ZVGSV8HGQCU-/0/1740640974158?e=1741683600&v=beta&t=8etXhqNK8TChY3SgmEhFl4-vv4o9rUIERLf56pBSkK0"
        },
        "date": "2025-02-27T08:21:31.428Z"
      },
      {
        "captions": "#materialhandler #metalrecycling #hurda #scrap #scraplife #scrapyard #scrapmetal #heavyload \n#scrapshear #metalscrap\n#recyclingequipment #scrapshear \n#engineering #hurdamakası \n#geridönüşüm #recyclingmachinery #scrapmetalrecycling #briquetting #singleshaftshredder #cablestripper #inclinedshear  #copper #scrapbaler #scrapshear  #shredder #metalbaler #scraprecycling #baler #twinshaftshredder \n#aymasrecyclingmachinery#materialhandler #metalrecycling #hurda #scrap #scraplife #scrapyard #scrapmetal #heavyload \n#scrapshear #metalscrap\n#recyclingequipment #scrapshear \n#engineering #hurdamakası \n#geridönüşüm #recyclingmachinery #scrapmetalrecycling #briquetting #singleshaftshredder #cablestripper #inclinedshear  #copper #scrapbaler #scrapshear  #shredder #metalbaler #scraprecycling #baler #twinshaftshredder \n#aymasrecyclingmachinery",
        "likes": "54",
        "comments": "1",
        "shares": "5",
        "time": {
          "raw": "6g",
          "parsed": "26.02.2025",
          "isoString": "2025-02-26T08:21:31.429Z"
        },
        "mediaType": "image",
        "mediaContent": [
          "https://media.licdn.com/dms/image/v2/D4D22AQEPSlYw6VQhqg/feedshare-shrink_800/B4DZU8rwHUGkAo-/0/1740479869773?e=1744243200&v=beta&t=OLf3TL9ro8FWbhGj27ZdaGoINUH4q6mAndpJpPAFmWU"
        ],
        "date": "2025-02-26T08:21:31.429Z"
      },
      {
        "captions": "Well, it only took 11 days and 33 separate #Exhibitors of #ReMA2025 https://lnkd.in/e548nxm3\nhttps://aymasmakina.com/en\n#TheShow to get through's the \"A's\" alphabetically, but that makes sense when you throw the biggest #recyclingevent in the #recycledmaterials industry. AYMAS Recycling Machinery, it's your turn in the #exhibitorspotlight. Aymas manufactures reliable #scrapprocessing equipments. #ScrapShears #Shears #ScrapBalers #Shredders #ChipBriquetting  #BaleBusters #Dewiring #DewiringEquipment\n#Briquetters #Compactors #Nonferrous #NonferrousBalers\n#AlligatorShears #GuillotineShears #MobileAttachments\n#AutoShredders #Trommels #Screens\n#CanDensifiers #CanFlatteners #ExhibitorReMA2025Well, it only took 11 days and 33 separate #Exhibitors of #ReMA2025 https://lnkd.in/e548nxm3\nhttps://aymasmakina.com/en\n#TheShow to get through's the \"A's\" alphabetically, but that makes sense when you throw the biggest #recyclingevent in the #recycledmaterials industry. AYMAS Recycling Machinery, it's your turn in the #exhibitorspotlight. Aymas manufactures reliable #scrapprocessing equipments. #ScrapShears #Shears #ScrapBalers #Shredders #ChipBriquetting  #BaleBusters #Dewiring #DewiringEquipment\n#Briquetters #Compactors #Nonferrous #NonferrousBalers\n#AlligatorShears #GuillotineShears #MobileAttachments\n#AutoShredders #Trommels #Screens\n#CanDensifiers #CanFlatteners #ExhibitorReMA2025",
        "likes": "13",
        "shares": "6",
        "time": {
          "raw": "1h",
          "parsed": "25.02.2025",
          "isoString": "2025-02-25T08:21:31.431Z"
        },
        "mediaType": "image",
        "mediaContent": [
          "https://media.licdn.com/dms/image/v2/D4E22AQFBrHa1HUhOxw/feedshare-shrink_800/B4EZUUtfvlHcAg-/0/1739809226077?e=1744243200&v=beta&t=PPJmbuK3jUNMMwGXvDd8oLp183IPHMz2aGJsYO5lEsE"
        ],
        "date": "2025-02-25T08:21:31.431Z"
      },
      {
        "captions": "Shredded aluminum baling. High compression forces for shredded scrap densifying.\n\n#materialhandler #metalrecycling #hurda #scrap #scraplife #scrapyard #scrapmetal #heavyload \n#scrapshear #metalscrap\n#recyclingequipment #scrapshear \n#engineering #hurdamakası \n#demirçelik #recyclingmachinery #scrapmetalrecycling #briquetting #singleshaftshredder #cablestripper #inclinedshear  #copper #scrapbaler #scrapshear  #shredder #metalbaler #scraprecycling #baler #twinshaftshredder \n#aymasrecyclingmachinery",
        "likes": "50",
        "comments": "1",
        "shares": "7",
        "time": {
          "raw": "1h",
          "parsed": "25.02.2025",
          "isoString": "2025-02-25T08:21:31.432Z"
        },
        "mediaType": "video",
        "mediaContent": {
          "src": [
            {
              "src": "https://dms.licdn.com/playlist/vid/v2/D4D05AQGuQtgoeGGZ-w/mp4-640p-30fp-crf28/B4DZUitvB4GcBc-/0/1740044205393?e=1741683600&v=beta&t=aCgKvERtb6Dobj0bU4kpt6F3W6EkbUzWNaxder46Ruc",
              "type": "video/mp4",
              "data-bitrate": 646331
            }
          ],
          "posterUrl": "https://media.licdn.com/dms/image/v2/D4D05AQGuQtgoeGGZ-w/videocover-high/B4DZUitvB4GcBs-/0/1740044201461?e=1741683600&v=beta&t=9d3OS52j9swfIRahOcAG6XLQc71TQfUkVhX9fTESpBY"
        },
        "date": "2025-02-25T08:21:31.432Z"
      },
      {
        "captions": "Recycling made simple with Immix! We help conserve resources and reduce environmental impact every day. \nLooking for a tailored metal recycling solution? Get in touch today!\n\n📞 1300 046 649\n🌐 www.immix.com.au\n📧 trading@immix.com.au\n\n#Immix #SustainableRecycling #MetalRecycling #EcoFriendly #ReduceReuseRecycleRecycling made simple with Immix! We help conserve resources and reduce environmental impact every day. \nLooking for a tailored metal recycling solution? Get in touch today!\n\n📞 1300 046 649\n🌐 www.immix.com.au\n📧 trading@immix.com.au\n\n#Immix #SustainableRecycling #MetalRecycling #EcoFriendly #ReduceReuseRecycle",
        "likes": "13",
        "shares": "7",
        "time": {
          "raw": "1h",
          "parsed": "25.02.2025",
          "isoString": "2025-02-25T08:21:31.433Z"
        },
        "mediaType": "image",
        "mediaContent": [
          "https://media.licdn.com/dms/image/v2/D4E22AQFojYtsUhlrfw/feedshare-shrink_800/B4EZUiSyfzGgAk-/0/1740037112701?e=1744243200&v=beta&t=CpRYI6K1Rb6Jz6ogCLiF5XTU4ROIrb475zaElCsuDjE"
        ],
        "date": "2025-02-25T08:21:31.433Z"
      },
      {
        "captions": "Up to 2000 ton cutting force\nUp to 100 tph\nUp to 300 ton densifying compression\n\n#materialhandler #metalrecycling #hurda #scrap #scraplife #scrapyard #scrapmetal #heavyload \n#scrapshear #metalscrap\n#recyclingequipment #scrapshear \n#engineering #hurdamakası \n#hurda #recyclingmachinery #scrapmetalrecycling #briquetting #singleshaftshredder #cablestripper #inclinedshear  #copper #scrapbaler #scrapshear  #shredder #metalbaler #scraprecycling #baler #twinshaftshredder \n#aymasrecyclingmachineryUp to 2000 ton cutting force\nUp to 100 tph\nUp to 300 ton densifying compression\n\n#materialhandler #metalrecycling #hurda #scrap #scraplife #scrapyard #scrapmetal #heavyload \n#scrapshear #metalscrap\n#recyclingequipment #scrapshear \n#engineering #hurdamakası \n#hurda #recyclingmachinery #scrapmetalrecycling #briquetting #singleshaftshredder #cablestripper #inclinedshear  #copper #scrapbaler #scrapshear  #shredder #metalbaler #scraprecycling #baler #twinshaftshredder \n#aymasrecyclingmachinery",
        "likes": "71",
        "shares": "12",
        "time": {
          "raw": "1h",
          "parsed": "25.02.2025",
          "isoString": "2025-02-25T08:21:31.434Z"
        },
        "mediaType": "image",
        "mediaContent": [
          "https://media.licdn.com/dms/image/v2/D4D22AQE-fmsx0usaHA/feedshare-shrink_800/B4DZUYYk0EGkAk-/0/1739870857584?e=1744243200&v=beta&t=_Ru8UfrG6HP0ZKw20D67TDMVdwKSMndcIKQd6CNQfWw"
        ],
        "date": "2025-02-25T08:21:31.434Z"
      },
      {
        "captions": "#materialhandler #metalrecycling #hurda #scrap #scraplife #scrapyard #scrapmetal #heavyload \n#scrapshear #metalscrap\n#recyclingequipment #scrapshear \n#engineering #heavymetal \n#hurda #recyclingmachinery #scrapmetalrecycling #briquetting #singleshaftshredder #cablestripper #inclinedshear  #copper #scrapbaler #scrapshear  #shredder #metalbaler #scraprecycling #baler #twinshaftshredder \n#aymasrecyclingmachinery#materialhandler #metalrecycling #hurda #scrap #scraplife #scrapyard #scrapmetal #heavyload \n#scrapshear #metalscrap\n#recyclingequipment #scrapshear \n#engineering #heavymetal \n#hurda #recyclingmachinery #scrapmetalrecycling #briquetting #singleshaftshredder #cablestripper #inclinedshear  #copper #scrapbaler #scrapshear  #shredder #metalbaler #scraprecycling #baler #twinshaftshredder \n#aymasrecyclingmachinery",
        "likes": "37",
        "comments": "1",
        "shares": "5",
        "time": {
          "raw": "2h",
          "parsed": "18.02.2025",
          "isoString": "2025-02-18T08:21:31.436Z"
        },
        "mediaType": "image",
        "mediaContent": [
          "https://media.licdn.com/dms/image/v2/D4D22AQHilifLUjWAyQ/feedshare-shrink_800/B4DZT_KkUoHAAk-/0/1739447749796?e=1744243200&v=beta&t=Lacf-JTnPcDnU_QopDpQr7wDg-ZyqWjAQdjmNI2oVIk"
        ],
        "date": "2025-02-18T08:21:31.436Z"
      },
      {
        "captions": "more scrap to chew !\n\n#materialhandler #metalrecycling #hurdacı #scrap #scraplife #scrapyard #scrapmetal #heavyload \n#scrapshear #metalscrap\n#recyclingequipment #scrapshear \n#engineering #heavymetal \n#hurda #recyclingmachinery #scrapmetalrecycling #briquetting #singleshaftshredder #cablestripper #inclinedshear  #copper #scrapbaler #scrapshear  #shredder #metalbaler #scraprecycling #baler #twinshaftshredder \n#aymasrecyclingmachinerymore scrap to chew !\n\n#materialhandler #metalrecycling #hurdacı #scrap #scraplife #scrapyard #scrapmetal #heavyload \n#scrapshear #metalscrap\n#recyclingequipment #scrapshear \n#engineering #heavymetal \n#hurda #recyclingmachinery #scrapmetalrecycling #briquetting #singleshaftshredder #cablestripper #inclinedshear  #copper #scrapbaler #scrapshear  #shredder #metalbaler #scraprecycling #baler #twinshaftshredder \n#aymasrecyclingmachinery",
        "likes": "36",
        "shares": "7",
        "time": {
          "raw": "2h",
          "parsed": "18.02.2025",
          "isoString": "2025-02-18T08:21:31.437Z"
        },
        "mediaType": "image",
        "mediaContent": [
          "https://media.licdn.com/dms/image/v2/D4D22AQHYQ-1wnYkWhA/feedshare-shrink_800/B4DZT0nQj7HYAk-/0/1739270720927?e=1744243200&v=beta&t=iGUgKlhdtcXsORxZ-3xb7_i0mAVf1gIs7vGNnD7u0nk"
        ],
        "date": "2025-02-18T08:21:31.437Z"
      },
      {
        "captions": "Bugün, 6 Şubat depreminin yıl dönümünde, hayatını kaybeden vatandaşlarımızı saygı ve rahmetle anıyor, ailelerine sabır ve dayanma gücü diliyoruz. Bu büyük felaketin acısını yüreğimizde hissederken, dayanışma ve birlik içinde olmanın önemini bir kez daha hatırlıyoruz.\n\nDeprem gerçeğiyle yüzleşmek ve gerekli önlemleri almak, gelecekte benzer acıların yaşanmaması için hayati bir sorumluluktur. Daha güvenli yarınlar için bilinçlenmeye, afetlere karşı hazırlıklı olmaya ve gerekli tedbirleri almaya devam etmeliyiz.\n\nBugün, sadece kaybettiklerimizi anma günü değil, aynı zamanda ders çıkarıp daha güvenli bir gelecek inşa etme sorumluluğunu hatırlama günüdür.\n\n——————————————————————— \n\nToday marks the anniversary of the February 6 earthquake, and we remember with respect and compassion those who lost their lives. We extend our deepest condolences to their families and wish them strength and resilience. The pain of this great disaster remains in our hearts, reminding us once again of the importance of unity and solidarity.\n\nFacing the reality of earthquakes and taking necessary precautions is crucial to preventing similar tragedies in the future. We must continue to raise awareness, be prepared for disasters, and take the necessary measures to ensure a safer tomorrow.\n\nToday is not only a day of remembrance for those we lost but also a day to reflect, learn, and commit to building a safer future.\n\n#6şubatdepremi #AymasRecyclingMachineryBugün, 6 Şubat depreminin yıl dönümünde, hayatını kaybeden vatandaşlarımızı saygı ve rahmetle anıyor, ailelerine sabır ve dayanma gücü diliyoruz. Bu büyük felaketin acısını yüreğimizde hissederken, dayanışma ve birlik içinde olmanın önemini bir kez daha hatırlıyoruz.\n\nDeprem gerçeğiyle yüzleşmek ve gerekli önlemleri almak, gelecekte benzer acıların yaşanmaması için hayati bir sorumluluktur. Daha güvenli yarınlar için bilinçlenmeye, afetlere karşı hazırlıklı olmaya ve gerekli tedbirleri almaya devam etmeliyiz.\n\nBugün, sadece kaybettiklerimizi anma günü değil, aynı zamanda ders çıkarıp daha güvenli bir gelecek inşa etme sorumluluğunu hatırlama günüdür.\n\n——————————————————————— \n\nToday marks the anniversary of the February 6 earthquake, and we remember with respect and compassion those who lost their lives. We extend our deepest condolences to their families and wish them strength and resilience. The pain of this great disaster remains in our hearts, reminding us once again of the importance of unity and solidarity.\n\nFacing the reality of earthquakes and taking necessary precautions is crucial to preventing similar tragedies in the future. We must continue to raise awareness, be prepared for disasters, and take the necessary measures to ensure a safer tomorrow.\n\nToday is not only a day of remembrance for those we lost but also a day to reflect, learn, and commit to building a safer future.\n\n#6şubatdepremi #AymasRecyclingMachinery",
        "likes": "13",
        "shares": "8",
        "time": {
          "raw": "3h",
          "parsed": "11.02.2025",
          "isoString": "2025-02-11T08:21:31.439Z"
        },
        "mediaType": "image",
        "mediaContent": [
          "https://media.licdn.com/dms/image/v2/D4D22AQGP_Cal7l5ZRA/feedshare-shrink_800/B4DZTbGIDHHAAg-/0/1738842605018?e=1744243200&v=beta&t=g4mT14X8YXkhI7HfuX6knUJi6SfNP3gLJFY7UDQZEU0"
        ],
        "date": "2025-02-11T08:21:31.439Z"
      },
      {
        "captions": "A mobile inclined shear on duty.\n\n#materialhandler #metalrecycling #hurda #scrap #scraplife #scrapyard #scrapmetal #heavyload \n#scrapshear #metalscrap\n#recyclingequipment #scrapshear \n#engineering #heavymetal \n#hurda #recyclingmachinery #scrapmetalrecycling #briquetting #singleshaftshredder #cablestripper #inclinedshear  #copper #scrapbaler #scrapshear  #shredder #metalbaler #scraprecycling #baler #twinshaftshredder \n#aymasrecyclingmachineryA mobile inclined shear on duty.\n\n#materialhandler #metalrecycling #hurda #scrap #scraplife #scrapyard #scrapmetal #heavyload \n#scrapshear #metalscrap\n#recyclingequipment #scrapshear \n#engineering #heavymetal \n#hurda #recyclingmachinery #scrapmetalrecycling #briquetting #singleshaftshredder #cablestripper #inclinedshear  #copper #scrapbaler #scrapshear  #shredder #metalbaler #scraprecycling #baler #twinshaftshredder \n#aymasrecyclingmachinery",
        "likes": "34",
        "shares": "7",
        "time": {
          "raw": "3h",
          "parsed": "11.02.2025",
          "isoString": "2025-02-11T08:21:31.440Z"
        },
        "mediaType": "image",
        "mediaContent": [
          "https://media.licdn.com/dms/image/v2/D4D22AQGYrP9vP6OqdA/feedshare-shrink_800/B4DZTakKRNGcAk-/0/1738833700987?e=1744243200&v=beta&t=6XQRJlFLAUDJH3GtrvElQ3YAhvSzGcdQflarNrUb8kE"
        ],
        "date": "2025-02-11T08:21:31.440Z"
      },
      {
        "captions": "A new installation of one of our triple compression baler for ferrous.\n\n#materialhandler #metalrecycling #hurda #scrap #scraplife #scrapyard #scrapmetal #heavyload \n#baler #metalscrap\n#recyclingequipment #scrapshear \n#engineering #heavymetal \n#hurda #recyclingmachinery #scrapmetalrecycling #briquetting #singleshaftshredder #cablestripper #inclinedshear  #copper #scrapbaler #scrapshear  #shredder #metalbaler #scraprecycling #baler #twinshaftshredder \n#aymasrecyclingmachineryA new installation of one of our triple compression baler for ferrous.\n\n#materialhandler #metalrecycling #hurda #scrap #scraplife #scrapyard #scrapmetal #heavyload \n#baler #metalscrap\n#recyclingequipment #scrapshear \n#engineering #heavymetal \n#hurda #recyclingmachinery #scrapmetalrecycling #briquetting #singleshaftshredder #cablestripper #inclinedshear  #copper #scrapbaler #scrapshear  #shredder #metalbaler #scraprecycling #baler #twinshaftshredder \n#aymasrecyclingmachinery",
        "likes": "36",
        "shares": "7",
        "time": {
          "raw": "3h",
          "parsed": "11.02.2025",
          "isoString": "2025-02-11T08:21:31.442Z"
        },
        "mediaType": "image",
        "mediaContent": [
          "https://media.licdn.com/dms/image/v2/D4D22AQGFz4Bk6P7pyQ/feedshare-shrink_800/B4DZTQwZNlGcAg-/0/1738669138298?e=1744243200&v=beta&t=rPgG8yw3FriqvBsfRy6z-Dw26LbfzLhrepPZzPgugEc"
        ],
        "date": "2025-02-11T08:21:31.442Z"
      },
      {
        "captions": "From scrap to sustainability! 🌍 At IMMIX, we're turning scrap metal into valuable resources through efficient recycling processes. Together, let's shape a greener future! \n#MetalRecycling #Sustainability #IMMIXFrom scrap to sustainability! 🌍 At IMMIX, we're turning scrap metal into valuable resources through efficient recycling processes. Together, let's shape a greener future! \n#MetalRecycling #Sustainability #IMMIX",
        "likes": "28",
        "comments": "2",
        "shares": "3",
        "time": {
          "raw": "1ay",
          "parsed": "04.02.2025",
          "isoString": "2025-02-04T08:21:31.443Z"
        },
        "mediaType": "image",
        "mediaContent": [
          "https://media.licdn.com/dms/image/v2/D4E22AQFJ-soKtiP1bA/feedshare-shrink_800/B4EZQ6MVtpHEAg-/0/1736143112593?e=1744243200&v=beta&t=7jjjCQsM50ECt8u6GB7AxM6ZZO3l-lNYbl-FhylzHC8"
        ],
        "date": "2025-02-04T08:21:31.443Z"
      },
      {
        "captions": "👇 𝗖𝗟𝗜𝗖𝗞 𝗧𝗢 𝗗𝗜𝗦𝗖𝗢𝗩𝗘𝗥 𝗠𝗢𝗥𝗘",
        "likes": "25",
        "shares": "7",
        "time": {
          "raw": "1ay",
          "parsed": "04.02.2025",
          "isoString": "2025-02-04T08:21:31.444Z"
        },
        "mediaType": "other",
        "date": "2025-02-04T08:21:31.444Z"
      },
      {
        "captions": "Dostępne i przystępne? \nTak! Takie są maszyny Aymas, które czekają na Was i swój nowy dom, a raczej hale, albo zakład, plac... \nTy wybierasz gdzie będzie dla Ciebie pracować. \nCzas produkcji paczkarki i brykieciarki to standardowo 3-4 miesiące,   po co czekać, skoro możesz zacząć już teraz?\n\nhttps://lnkd.in/eSn8rdhB",
        "likes": "14",
        "shares": "7",
        "time": {
          "raw": "1ay",
          "parsed": "04.02.2025",
          "isoString": "2025-02-04T08:21:31.445Z"
        },
        "mediaType": "other",
        "date": "2025-02-04T08:21:31.445Z"
      },
      {
        "captions": "#materialhandler #metalrecycling #Jaipur #scrap #scraplife #scrapyard #scrapmetal #heavyload \n#MRAI #metalscrap\n#recyclingequipment #scrapshear \n#engineering #heavymetal \n#hurda #recyclingmachinery #scrapmetalrecycling #briquetting #singleshaftshredder #cablestripper #inclinedshear  #copper #scrapbaler #scrapshear  #shredder #metalbaler #scraprecycling #baler #twinshaftshredder \n#aymasrecyclingmachinery#materialhandler #metalrecycling #Jaipur #scrap #scraplife #scrapyard #scrapmetal #heavyload \n#MRAI #metalscrap\n#recyclingequipment #scrapshear \n#engineering #heavymetal \n#hurda #recyclingmachinery #scrapmetalrecycling #briquetting #singleshaftshredder #cablestripper #inclinedshear  #copper #scrapbaler #scrapshear  #shredder #metalbaler #scraprecycling #baler #twinshaftshredder \n#aymasrecyclingmachinery",
        "likes": "34",
        "comments": "1",
        "shares": "6",
        "time": {
          "raw": "1ay",
          "parsed": "04.02.2025",
          "isoString": "2025-02-04T08:21:31.446Z"
        },
        "mediaType": "image",
        "mediaContent": [
          "https://media.licdn.com/dms/image/v2/D4D22AQFzNnPNch-PGA/feedshare-shrink_800/B4DZS2B51GHAAg-/0/1738220741215?e=1744243200&v=beta&t=tP4CZwbAOmMx7GPYz8c_I4g6jrdmOsb2fC6yrVikiw0"
        ],
        "date": "2025-02-04T08:21:31.446Z"
      },
      {
        "captions": "MRAI Exhibition in Jaipur. Come and visit us.\n\n#materialhandler #metalrecycling #Jaipur #scrap #scraplife #scrapyard #scrapmetal #heavyload \n#MRAI #metalscrap\n#recyclingequipment #scrapshear \n#engineering #heavymetal \n#hurda #recyclingmachinery #scrapmetalrecycling #briquetting #singleshaftshredder #cablestripper #inclinedshear  #copper #scrapbaler #scrapshear  #shredder #metalbaler #scraprecycling #baler #twinshaftshredder \n#aymasrecyclingmachineryMRAI Exhibition in Jaipur. Come and visit us.\n\n#materialhandler #metalrecycling #Jaipur #scrap #scraplife #scrapyard #scrapmetal #heavyload \n#MRAI #metalscrap\n#recyclingequipment #scrapshear \n#engineering #heavymetal \n#hurda #recyclingmachinery #scrapmetalrecycling #briquetting #singleshaftshredder #cablestripper #inclinedshear  #copper #scrapbaler #scrapshear  #shredder #metalbaler #scraprecycling #baler #twinshaftshredder \n#aymasrecyclingmachinery",
        "likes": "33",
        "shares": "5",
        "time": {
          "raw": "1ay",
          "parsed": "04.02.2025",
          "isoString": "2025-02-04T08:21:31.447Z"
        },
        "mediaType": "image",
        "mediaContent": [
          "https://media.licdn.com/dms/image/v2/D4D22AQFOBLvPkbGCZw/feedshare-shrink_800/B4DZSxfTnzHAAg-/0/1738144564771?e=1744243200&v=beta&t=3XvgKYVrEvGIq5NxCTrbjl2XBu38ilLqWigqVMIB5Cs"
        ],
        "date": "2025-02-04T08:21:31.447Z"
      },
      {
        "likes": "40",
        "comments": "1",
        "shares": "7",
        "time": {
          "raw": "1ay",
          "parsed": "04.02.2025",
          "isoString": "2025-02-04T08:21:31.449Z"
        },
        "mediaType": "image",
        "mediaContent": [
          "https://media.licdn.com/dms/image/v2/D4D22AQF_Uqk9IXFowQ/feedshare-shrink_2048_1536/B4DZSr1HSlHIAo-/0/1738049616263?e=1744243200&v=beta&t=OxN6oFzdfr7TpRaeStmGiQwPKQMG8bRe7h--2xJ9pes"
        ],
        "date": "2025-02-04T08:21:31.449Z"
      },
      {
        "captions": "Heavy beast is on the way.\n\n#materialhandler #metalrecycling #steel #scrap #scraplife #scrapyard #scrapmetal #heavyload \n#heavyduty #metalscrap\n#recyclingequipment #scrapshear \n#engineering #heavymetal \n#alligatorshear #recyclingmachinery #scrapmetalrecycling #briquetting #singleshaftshredder #cablestripper #inclinedshear  #copper #scrapbaler #scrapshear  #shredder #metalbaler #scraprecycling #baler #twinshaftshredder \n#aymasrecyclingmachineryHeavy beast is on the way.\n\n#materialhandler #metalrecycling #steel #scrap #scraplife #scrapyard #scrapmetal #heavyload \n#heavyduty #metalscrap\n#recyclingequipment #scrapshear \n#engineering #heavymetal \n#alligatorshear #recyclingmachinery #scrapmetalrecycling #briquetting #singleshaftshredder #cablestripper #inclinedshear  #copper #scrapbaler #scrapshear  #shredder #metalbaler #scraprecycling #baler #twinshaftshredder \n#aymasrecyclingmachinery",
        "likes": "69",
        "comments": "3",
        "shares": "9",
        "time": {
          "raw": "1ay",
          "parsed": "04.02.2025",
          "isoString": "2025-02-04T08:21:31.450Z"
        },
        "mediaType": "image",
        "mediaContent": [
          "https://media.licdn.com/dms/image/v2/D4D22AQHp86fYmCEyDw/feedshare-shrink_800/B4DZSXo4pEHYAg-/0/1737710866723?e=1744243200&v=beta&t=ieXD7ofPHvvYvoesZ7RUrEXD0ACae5w_X1T2-OWKK-8"
        ],
        "date": "2025-02-04T08:21:31.450Z"
      },
      {
        "captions": "Another container arrives to Machinery Specialist HQ with loads of wire strippers and alligator shears\nhalf of them already sold and ready for shipping next week, but contact our team to secure yours before they all gone.Another container arrives to Machinery Specialist HQ with loads of wire strippers and alligator shears\nhalf of them already sold and ready for shipping next week, but contact our team to secure yours before they all gone.",
        "likes": "46",
        "shares": "5",
        "time": {
          "raw": "1ay",
          "parsed": "03.02.2025",
          "isoString": "2025-02-03T14:17:58.826Z"
        },
        "mediaType": "image",
        "mediaContent": [
          "https://media.licdn.com/dms/image/v2/D5622AQEuSN1ZJJ0XUQ/feedshare-shrink_800/B56ZSWSnJ1HQAg-/0/1737688250635?e=1743638400&v=beta&t=HOvsZzTuf-4S4nyacNyfy0h74vOaiwoFOmk3v2NYlPQ"
        ],
        "date": "2025-02-03T14:17:58.826Z"
      },
      {
        "captions": "#dubai #materialhandler #metalrecycling #hurda #scrap #scraplife #scrapyard #scrapmetal #heavyload \n#scrapshear #metalscrap\n#recyclingequipment #scrapshear \n#engineering #hurdamakası \n#geridönüşüm #recyclingmachinery #scrapmetalrecycling #inclinedshear #scrapshear #eğikmakas\n#aymasrecyclingmachinery",
        "likes": "9",
        "comments": "2",
        "shares": "5",
        "time": {
          "raw": "1s",
          "parsed": "04.03.2025",
          "isoString": "2025-03-04T07:21:31.425Z"
        },
        "mediaType": "video",
        "mediaContent": {
          "src": [
            {
              "src": "https://dms.licdn.com/playlist/vid/v2/D4D05AQE73xhqRNVvSQ/mp4-640p-30fp-crf28/B4DZVf8aSOGkBc-/0/1741071446926?e=1741683600&v=beta&t=VOrB8Uy6756MhEkOUyI0XJ46S8Wtu8ZLbXrNfEH9n5k",
              "type": "video/mp4",
              "data-bitrate": 773349
            }
          ],
          "posterUrl": "https://media.licdn.com/dms/image/v2/D4D05AQE73xhqRNVvSQ/videocover-high/B4DZVf8aSOGkBs-/0/1741071446422?e=1741683600&v=beta&t=c5QhwFPiM24L3wlFPGWC3aDyQF6aWIW42gy3qYL3_Sw"
        },
        "date": "2025-03-04T07:21:31.425Z"
      }
    ]
  },
  {
    "name": "LEFORTMetalRecyclingEquipment",
    "followerData": [
      [
        20250225,
        7340
      ],
      [
        20250225,
        7340
      ],
      [
        20250225,
        7340
      ],
      [
        20250228,
        7364
      ],
      [
        20250228,
        7364
      ],
      [
        20250228,
        7364
      ],
      [
        20250228,
        7364
      ],
      [
        20250303,
        7380
      ],
      [
        1741011516680,
        "7.380"
      ],
      [
        1741076521358,
        "7.383"
      ]
    ],
    "data": [
      {
        "captions": "🇬🇧 Jebb Metals have now put to work their new Koloss 1000 TS. This Lefort shear/baler is proving to be a real head turner as it sits proudly at the top of their yard. \n\n💥 Delivered to site in three main pieces the machine is assembled on a foundation frame and commissioned within two weeks. The machine is very productive on all grades of ferrous and non-ferrous metals, shearing with the 1000T window crosshead or baling with the 180T baling ram. \n\n💪🏽 The power, strength and speed of its cutting is giving very pleasing results for its new owners. This machine, fitted with the 600HP Scania diesel engine, operators control cabin and tunnel pusher ram is easily capable of 25-30 Tonnes per hour of production, depending upon material and cut length. \n\nWe wish Philip & Stephen all the best for the future with their new Lefort Koloss 1000 TS 🙌\n\n#LefortUk🇬🇧 Jebb Metals have now put to work their new Koloss 1000 TS. This Lefort shear/baler is proving to be a real head turner as it sits proudly at the top of their yard. \n\n💥 Delivered to site in three main pieces the machine is assembled on a foundation frame and commissioned within two weeks. The machine is very productive on all grades of ferrous and non-ferrous metals, shearing with the 1000T window crosshead or baling with the 180T baling ram. \n\n💪🏽 The power, strength and speed of its cutting is giving very pleasing results for its new owners. This machine, fitted with the 600HP Scania diesel engine, operators control cabin and tunnel pusher ram is easily capable of 25-30 Tonnes per hour of production, depending upon material and cut length. \n\nWe wish Philip & Stephen all the best for the future with their new Lefort Koloss 1000 TS 🙌\n\n#LefortUk",
        "likes": "46",
        "comments": "2",
        "shares": "6",
        "time": {
          "raw": "18s",
          "parsed": "03.03.2025",
          "isoString": "2025-03-03T14:22:01.077Z"
        },
        "mediaType": "image",
        "mediaContent": [
          "https://media.licdn.com/dms/image/v2/D4E22AQGlu4rUV34Lxg/feedshare-shrink_800/B4EZVcNW7KGYAk-/0/1741008763842?e=1744243200&v=beta&t=noxprdUfocMe8NdUnCHke0-YD2y0T71UUiOuYREKaWc"
        ],
        "date": "2025-03-03T14:22:01.077Z"
      },
      {
        "captions": "💥🎬 [𝐯𝐢𝐝𝐞𝐨] BORNES RECYCLAGE ramps-up with a new Lidex 1300T !\n\n« Our Lidex can go up to 70t/hr. It has a rail breaker and can handle heavy scrap when needed. In the crane, thanks to the automatic cycle, our operator can prepare the next load while the scrap previously loaded is still being processed. No time is lost ! » Charles Bornes \n\nM. Bornes also prizes the total cooperation shown throughout the project including the recommendations for the most efficient layout of the machine on site, the supply of the civil engineering guide drawings, the logistic operations, the assembly & commissioning of the machine, not forgetting the training of operators and technicians.\n\n🤝 Thanks again to the Bornes family for their trust.",
        "likes": "127",
        "comments": "4",
        "shares": "10",
        "time": {
          "raw": "4g",
          "parsed": "28.02.2025",
          "isoString": "2025-02-28T08:22:01.078Z"
        },
        "mediaType": "video",
        "mediaContent": {
          "src": [
            {
              "src": "https://dms.licdn.com/playlist/vid/v2/D4E05AQHzBjqS2q1Tgw/mp4-720p-30fp-crf28/B4EZVH73AHGYBg-/0/1740668685959?e=1741683600&v=beta&t=0f-b7WH8mJTb3YdDK-R28sK1uVCk_ZvYemIjaQtPM-o",
              "type": "video/mp4",
              "data-bitrate": 1116984
            },
            {
              "src": "https://dms.licdn.com/playlist/vid/v2/D4E05AQHzBjqS2q1Tgw/mp4-640p-30fp-crf28/B4EZVH73AHGYBc-/0/1740668687592?e=1741683600&v=beta&t=yq5pqv7SyJWbWUB0I7Khvdm3pB7hVuhEKyPGwsA7W5Q",
              "type": "video/mp4",
              "data-bitrate": 802291
            }
          ],
          "posterUrl": "https://media.licdn.com/dms/image/v2/D4E05AQHzBjqS2q1Tgw/videocover-low/B4EZVH73AHGYCM-/0/1740668675906?e=1741683600&v=beta&t=l_eknnpy1GeptTpiasP-546b_zONhttE_kcWrhqP-Ic"
        },
        "date": "2025-02-28T08:22:01.078Z"
      },
      {
        "captions": "Wich one would you choose ? 650, 700, 800 or 1000T ? 🤩Wich one would you choose ? 650, 700, 800 or 1000T ? 🤩",
        "likes": "74",
        "comments": "5",
        "shares": "7",
        "time": {
          "raw": "1h",
          "parsed": "25.02.2025",
          "isoString": "2025-02-25T08:22:01.079Z"
        },
        "mediaType": "image",
        "mediaContent": [
          "https://media.licdn.com/dms/image/v2/D4E22AQFBhuWUdXPPEw/feedshare-shrink_800/B4EZU5VpuiHUAg-/0/1740423736410?e=1744243200&v=beta&t=QiCSjk-X0zJBWTncMXSOZZ6OHJvTHnD7YHC8U1Gt-w8",
          "https://media.licdn.com/dms/image/v2/D4E22AQEQERvskXpWxQ/feedshare-shrink_800/B4EZU5VptzHcAg-/0/1740423736612?e=1744243200&v=beta&t=jg3WfkK7-3fo6zOtQF5ekyPaAILYrp1CUeYS7_oyUqU"
        ],
        "date": "2025-02-25T08:22:01.079Z"
      },
      {
        "captions": "Fact Friday: \"Patented Innovation\" 🧐\n\nCheck out our LEFORT® TRAX 650 cutting heavy scrap metal with ease.\nThe LEFORT® TRAX self-propelled shear/baler, a patented innovation, is designed for unrivaled on-site mobility. With just a single switch on the radio control, the operator can move the entire machine towards the scrap metal pile, eliminating the need to transport scrap to the machine—boosting efficiency and productivity.\n\nLEFORT® TRAX Specifications:\n✅ Cutting force: 600-1250T\n✅ Hold down force: 120-180T\n✅ Box closing force: 2 x 240-350T\n✅ Pusher ram force: 180T\n✅ Cutting width: 800-940 mm\n✅ Box length: 6000-7000 mm\n✅ Power: Diesel or electric options available\n📩 Contact us for more details!\n\nMETQUIP LEFORT® #TRAX #Australia #Unrivaled #Machines #Innovation #Shear #Baler #Technology #Metal #Recycling #Efficiency #Machinery #Scrapyard #HeavyDutyShear #HeavyScrapShear",
        "likes": "25",
        "comments": "2",
        "shares": "3",
        "time": {
          "raw": "1h",
          "parsed": "25.02.2025",
          "isoString": "2025-02-25T08:22:01.081Z"
        },
        "mediaType": "video",
        "mediaContent": {
          "src": [
            {
              "src": "https://dms.licdn.com/playlist/vid/v2/D5605AQF1T2_sfaYzzg/mp4-640p-30fp-crf28/B56ZUmjSwRGoBg-/0/1740108600437?e=1741683600&v=beta&t=aWh0mkI-gYAu34QR0c8tWMK8pm4DBGxeTI9ZLW8wkSo",
              "type": "video/mp4",
              "data-bitrate": 921905
            },
            {
              "src": "https://dms.licdn.com/playlist/vid/v2/D5605AQF1T2_sfaYzzg/mp4-720p-30fp-crf28/B56ZUmjSwRGoBk-/0/1740108598577?e=1741683600&v=beta&t=qhNivO4GEn9ihb-8S-mliM6E6KESPHiQIHWJQwkEq-8",
              "type": "video/mp4",
              "data-bitrate": 1230167
            }
          ],
          "posterUrl": "https://media.licdn.com/dms/image/v2/D5605AQF1T2_sfaYzzg/videocover-high/B56ZUmjSwRGoBw-/0/1740108585903?e=1741683600&v=beta&t=6P2HqPo8bsYZuJ85-54brP77SJDqIAi5SINw_3Oxy6o"
        },
        "date": "2025-02-25T08:22:01.081Z"
      },
      {
        "captions": "KONKEROR 1000T ready for departure to Norway  🇳🇴KONKEROR 1000T ready for departure to Norway  🇳🇴",
        "likes": "65",
        "shares": "2",
        "time": {
          "raw": "2h",
          "parsed": "18.02.2025",
          "isoString": "2025-02-18T08:22:01.082Z"
        },
        "mediaType": "image",
        "mediaContent": [
          "https://media.licdn.com/dms/image/v2/D4E22AQHXqiCirqHVPA/feedshare-shrink_800/B4EZUUWakRGYAo-/0/1739803182232?e=1744243200&v=beta&t=--Tev80uxMWHZeVkrnEfg2_FudK6ttllJ-r3Zrjis3U",
          "https://media.licdn.com/dms/image/v2/D4E22AQEWTnoPBDA0kg/feedshare-shrink_800/B4EZUUWaj8GwAg-/0/1739803180114?e=1744243200&v=beta&t=dSKy9pYi_br1NrWHW0NMu8W5LSYnRbnIFrW_2dY5PDc",
          "https://media.licdn.com/dms/image/v2/D4E22AQGZpiYfiXfKUg/feedshare-shrink_800/B4EZUUWakHGwAg-/0/1739803179251?e=1744243200&v=beta&t=BbhR0cpVBpkFeuO86gv7XIWQEQ1820fTCbCu1WPjR5Y"
        ],
        "date": "2025-02-18T08:22:01.082Z"
      },
      {
        "captions": "🇫🇷 New video at BORNES RECYCLAGE coming soon ! #Lidex1300🇫🇷 New video at BORNES RECYCLAGE coming soon ! #Lidex1300",
        "likes": "98",
        "comments": "1",
        "shares": "11",
        "time": {
          "raw": "2h",
          "parsed": "18.02.2025",
          "isoString": "2025-02-18T08:22:01.083Z"
        },
        "mediaType": "image",
        "mediaContent": [
          "https://media.licdn.com/dms/image/v2/D4E22AQFrYD2RFVQYcg/feedshare-shrink_800/B4EZT6d29bHgAw-/0/1739368924877?e=1744243200&v=beta&t=VxKkSKF5GlAmcZF57ORXGPMeifuHQKmkt7sMEk-swcI",
          "https://media.licdn.com/dms/image/v2/D4E22AQH-WUUm7Zrtmg/feedshare-shrink_800/B4EZT6d28KGwAg-/0/1739368921314?e=1744243200&v=beta&t=N-jr1zLzLtIwC4pAtv-i6NRPMg9kgz6Bo8X1MMo3RAs",
          "https://media.licdn.com/dms/image/v2/D4E22AQHuuJoVj8fKBg/feedshare-shrink_800/B4EZT6d28rG0Ao-/0/1739368923413?e=1744243200&v=beta&t=oHG_iFAR_jwVMFNmwfEtdJGGc6eEbDBzCN6YxMoRNxc"
        ],
        "date": "2025-02-18T08:22:01.083Z"
      },
      {
        "captions": "We hebben vandaag 11/2/25 onze nieuwe lefort 650 trax schrootschaar op onze werf in beringe binnen gekregen \nMet deze machine maken we een grote stap om de metaal recycling op deze werf te vergrotenWe hebben vandaag 11/2/25 onze nieuwe lefort 650 trax schrootschaar op onze werf in beringe binnen gekregen \nMet deze machine maken we een grote stap om de metaal recycling op deze werf te vergroten",
        "likes": "151",
        "comments": "6",
        "shares": "1",
        "time": {
          "raw": "2h",
          "parsed": "18.02.2025",
          "isoString": "2025-02-18T08:22:01.084Z"
        },
        "mediaType": "image",
        "mediaContent": [
          "https://media.licdn.com/dms/image/v2/D5622AQEaM5TnYCzAtQ/feedshare-shrink_800/B56ZT21Z08GoAo-/0/1739307983425?e=1744243200&v=beta&t=YBAgsZTQxAtCmtf_UceFPN6tNDAipx2p7yMJwpnCPmo",
          "https://media.licdn.com/dms/image/v2/D5622AQEHA-0zPAVh2w/feedshare-shrink_800/B56ZT21Z2CGsAs-/0/1739307983286?e=1744243200&v=beta&t=OvUlfHrT1rwkLmNJyZkz6Nijei6Ymfb0VqWPCpU59SQ"
        ],
        "date": "2025-02-18T08:22:01.084Z"
      },
      {
        "captions": "[𝟐𝟎𝟐𝟓 𝐋𝐄𝐅𝐎𝐑𝐓 𝐑𝐀𝐍𝐆𝐄]\n\nSelecting the right hydraulic shear depends on the type, rate and volume of material being processed, but also where the machine will work. \n\nThanks to a very large range of machines, we can accommodate any operation, from the smallest to the largest scrap yard facilities, with a product that will help bring success and growth to a recycler’s business.\n\nFind out more about our scrap shears  : https://lnkd.in/ertBPuHn\n[𝟐𝟎𝟐𝟓 𝐋𝐄𝐅𝐎𝐑𝐓 𝐑𝐀𝐍𝐆𝐄]\n\nSelecting the right hydraulic shear depends on the type, rate and volume of material being processed, but also where the machine will work. \n\nThanks to a very large range of machines, we can accommodate any operation, from the smallest to the largest scrap yard facilities, with a product that will help bring success and growth to a recycler’s business.\n\nFind out more about our scrap shears  : https://lnkd.in/ertBPuHn",
        "likes": "62",
        "comments": "1",
        "shares": "4",
        "time": {
          "raw": "3h",
          "parsed": "11.02.2025",
          "isoString": "2025-02-11T08:22:01.085Z"
        },
        "mediaType": "image",
        "mediaContent": [
          "https://media.licdn.com/dms/image/v2/D4E22AQGwlwLT9tlEfQ/feedshare-shrink_800/B4EZTg2DkUGwAg-/0/1738939069642?e=1744243200&v=beta&t=q-tu-cxH74x1hxVP-BgtHXjBVEV1TRrpau79L8YNJ5M",
          "https://media.licdn.com/dms/image/v2/D4E22AQHVFvyCwJumeQ/feedshare-shrink_800/B4EZTg2EKKGYAg-/0/1738939070172?e=1744243200&v=beta&t=DqqOtvYR-xaugbOIwhVzBnlAFtXbQXek4ir90Grb5Oo",
          "https://media.licdn.com/dms/image/v2/D4E22AQGCsyknQLVF-g/feedshare-shrink_800/B4EZTg2EBQHMAk-/0/1738939070699?e=1744243200&v=beta&t=6s3oKwh5BUOICz-tQmZw3s-qkGGc-BKvsXqX_7CmO6E",
          "https://media.licdn.com/dms/image/v2/D4E22AQHm32ERupTYsQ/feedshare-shrink_800/B4EZTg2EKQHUAo-/0/1738939070116?e=1744243200&v=beta&t=yICqv4omyTKrPOKuF0GA67etmplAKJRQx8cKyCyxnSM"
        ],
        "date": "2025-02-11T08:22:01.085Z"
      },
      {
        "captions": "NEWLY COMMISSIONED LEFORT TRAX 650 IN SYDNEY! 🛠️\n\nCongratulations to our valued customer in Sydney, Australia, on their brand-new LEFORT TRAX 650! By choosing LEFORT®, they are elevating their operations with unmatched performance, reliability, and durability. BUILT TO LAST! 💪\n\nFor inquiries contact Metquip.\nContact us now ✉\nWebsite: metquip.com.au/contact-us\nPhone: (08) 9362 4304\nEmail: sales@metquip.com.au\nWarehouse (locations):\n📍 84 Briggs Street, Welshpool ,WA 6106\n📍15/29 Governor Macquarie Drive, Chipping Norton, NSW 2170NEWLY COMMISSIONED LEFORT TRAX 650 IN SYDNEY! 🛠️\n\nCongratulations to our valued customer in Sydney, Australia, on their brand-new LEFORT TRAX 650! By choosing LEFORT®, they are elevating their operations with unmatched performance, reliability, and durability. BUILT TO LAST! 💪\n\nFor inquiries contact Metquip.\nContact us now ✉\nWebsite: metquip.com.au/contact-us\nPhone: (08) 9362 4304\nEmail: sales@metquip.com.au\nWarehouse (locations):\n📍 84 Briggs Street, Welshpool ,WA 6106\n📍15/29 Governor Macquarie Drive, Chipping Norton, NSW 2170",
        "likes": "43",
        "shares": "3",
        "time": {
          "raw": "3h",
          "parsed": "11.02.2025",
          "isoString": "2025-02-11T08:22:01.087Z"
        },
        "mediaType": "image",
        "mediaContent": [
          "https://media.licdn.com/dms/image/v2/D5622AQHy5PuQi2v_qA/feedshare-shrink_800/B56ZTT_zlPHoAg-/0/1738723508412?e=1744243200&v=beta&t=xW_ZxYqgjOWxFeE3FV7YWAfnv5aIl1NRZ30LzdNthHw",
          "https://media.licdn.com/dms/image/v2/D5622AQHg0RR0oPjIsA/feedshare-shrink_800/B56ZTT_zk3GQAo-/0/1738723507948?e=1744243200&v=beta&t=TcS2w8GwbnUMso1uo2p1qpTKJUhfu2vHqjuSfAtU-TM",
          "https://media.licdn.com/dms/image/v2/D5622AQH0EvYFIJAlWA/feedshare-shrink_800/B56ZTT_zlEGQAg-/0/1738723508472?e=1744243200&v=beta&t=hs5121OAuBfm-2KxHKjuJRtm1g2XYYT6CGDwJSMULqw",
          "https://media.licdn.com/dms/image/v2/D5622AQFE-1qcsHltsA/feedshare-shrink_800/B56ZTT_zlRHQAg-/0/1738723509338?e=1744243200&v=beta&t=fGRM8nz-W7zkCJM4mEuYJaYKWffZBaabOMfbaLMQEd0"
        ],
        "date": "2025-02-11T08:22:01.087Z"
      },
      {
        "captions": "This week, I had the opportunity to be involved in the commissioning of the LEFORT® TRAX, a cutting-edge machine from one of the world’s leading manufacturers in heavy-duty metal recycling. ♻️ \n\nThis one-of-a-kind machine combines powerful baling and shearing capabilities, making heavy duty scrap processing effortless. What sets it apart is its self-propelled mobility—mounted on tracks and operated with a single remote, it offers unmatched flexibility and efficiency on-site.\n\nThank you Walter Leijen, our director for this amazing opportunity. Looking forward for upcoming projects!\n\nBelow is a picture of me with the Lefort Trax 650.This week, I had the opportunity to be involved in the commissioning of the LEFORT® TRAX, a cutting-edge machine from one of the world’s leading manufacturers in heavy-duty metal recycling. ♻️ \n\nThis one-of-a-kind machine combines powerful baling and shearing capabilities, making heavy duty scrap processing effortless. What sets it apart is its self-propelled mobility—mounted on tracks and operated with a single remote, it offers unmatched flexibility and efficiency on-site.\n\nThank you Walter Leijen, our director for this amazing opportunity. Looking forward for upcoming projects!\n\nBelow is a picture of me with the Lefort Trax 650.",
        "likes": "22",
        "shares": "1",
        "time": {
          "raw": "3h",
          "parsed": "11.02.2025",
          "isoString": "2025-02-11T08:22:01.089Z"
        },
        "mediaType": "image",
        "mediaContent": [
          "https://media.licdn.com/dms/image/v2/D5622AQEVg4Fusl-4Cg/feedshare-shrink_800/B56ZTUFTpIHoAk-/0/1738724952307?e=1744243200&v=beta&t=D5ZPno88L8p9rX2S6GpYrI_Np6s_xEBrqcTLPRP0vQE"
        ],
        "date": "2025-02-11T08:22:01.089Z"
      },
      {
        "captions": "We recently delivered a 700-ton TRAX shear to William Waugh (Edinburgh) Limited. The arrival of this new shear/baler confirms the company’s commitment for staying at the forefront of technical progress.\n\nThe decision to acquire a 700-ton TRAX shear was driven by the need to modernize equipment and meet growing production demands. Alan Waugh  expressed his admiration for the flexibility of the TRAX, movable anywhere on the scrap yard.\n\nWith a cutting force of 700 tons and 6.6 m compression box, it is capable of processing large volumes of ferrous and non-ferrous. Each 325-ton press lid, along with a 180-ton pusher, ensures optimal material compression.\n\nThis shear is equipped with a 400 HP diesel engine allowing to process up to 20 t/hr and produce over 30 bales/hr.\n\nThe acquisition of this new TRAX machine marks a turning point for the company, which combines its family tradition with technological innovations to meet the future challenges of scrap metal recycling.We recently delivered a 700-ton TRAX shear to William Waugh (Edinburgh) Limited. The arrival of this new shear/baler confirms the company’s commitment for staying at the forefront of technical progress.\n\nThe decision to acquire a 700-ton TRAX shear was driven by the need to modernize equipment and meet growing production demands. Alan Waugh  expressed his admiration for the flexibility of the TRAX, movable anywhere on the scrap yard.\n\nWith a cutting force of 700 tons and 6.6 m compression box, it is capable of processing large volumes of ferrous and non-ferrous. Each 325-ton press lid, along with a 180-ton pusher, ensures optimal material compression.\n\nThis shear is equipped with a 400 HP diesel engine allowing to process up to 20 t/hr and produce over 30 bales/hr.\n\nThe acquisition of this new TRAX machine marks a turning point for the company, which combines its family tradition with technological innovations to meet the future challenges of scrap metal recycling.",
        "likes": "81",
        "shares": "4",
        "time": {
          "raw": "1ay",
          "parsed": "04.02.2025",
          "isoString": "2025-02-04T08:22:01.091Z"
        },
        "mediaType": "image",
        "mediaContent": [
          "https://media.licdn.com/dms/image/v2/D4E22AQFshLppCfb-hQ/feedshare-shrink_800/B4EZS3YQyeGYAk-/0/1738243382206?e=1744243200&v=beta&t=-jcKGeHmfSj5QEb0XYUmQnegPS_jmivXS5M2T9f11jM",
          "https://media.licdn.com/dms/image/v2/D4E22AQHcFxvcDW6SDA/feedshare-shrink_800/B4EZS3YQymHUAg-/0/1738243381343?e=1744243200&v=beta&t=KbMEZfv-YHz6VCWsb9l1_ZKrBTLnucPPBWgzVIiTG4o",
          "https://media.licdn.com/dms/image/v2/D4E22AQFB0Tv66X_CGA/feedshare-shrink_800/B4EZS3YQycGwAg-/0/1738243381297?e=1744243200&v=beta&t=0PDucwqkGOXaKom1dQUK1lBPDGqlwJ8k-RBW3lsAsRo"
        ],
        "date": "2025-02-04T08:22:01.091Z"
      },
      {
        "captions": "[𝐍𝐞𝐰 𝐏𝐚𝐢𝐧𝐭 𝐁𝐨𝐨𝐭𝐡] 🎨\n\nOur new cutting-edge paint facility is almost finished...\nOnly a few days left before the ribbon-cutting ceremony ![𝐍𝐞𝐰 𝐏𝐚𝐢𝐧𝐭 𝐁𝐨𝐨𝐭𝐡] 🎨\n\nOur new cutting-edge paint facility is almost finished...\nOnly a few days left before the ribbon-cutting ceremony !",
        "likes": "57",
        "shares": "8",
        "time": {
          "raw": "1ay",
          "parsed": "04.02.2025",
          "isoString": "2025-02-04T08:22:01.092Z"
        },
        "mediaType": "image",
        "mediaContent": [
          "https://media.licdn.com/dms/image/v2/D4E22AQHl2rxv26phOA/feedshare-shrink_800/B4EZSNhDrQGwAg-/0/1737541043653?e=1744243200&v=beta&t=RuuCBythFAtkrGUmkB0soMOtWQpJSbvkBwulSqHoO7I"
        ],
        "date": "2025-02-04T08:22:01.092Z"
      },
      {
        "captions": "🌎⚙️📦🚀\n\nWherever you are and whatever the time, parts availability is key.",
        "likes": "39",
        "shares": "9",
        "time": {
          "raw": "1ay",
          "parsed": "04.02.2025",
          "isoString": "2025-02-04T08:22:01.093Z"
        },
        "mediaType": "video",
        "mediaContent": {
          "src": [
            {
              "src": "https://dms.licdn.com/playlist/vid/v2/D4E05AQFoh1mivl09yw/mp4-640p-30fp-crf28/B4EZSJLRtFGYBc-/0/1737468253999?e=1741683600&v=beta&t=w3P8C2_6L1mNohN0Wt9L-tP2ApgmWPfJ-M8lCPl2CRY",
              "type": "video/mp4",
              "data-bitrate": 872696
            },
            {
              "src": "https://dms.licdn.com/playlist/vid/v2/D4E05AQFoh1mivl09yw/mp4-720p-30fp-crf28/B4EZSJLRtFGYBg-/0/1737468263633?e=1741683600&v=beta&t=1qbNLVGgEDmGFT8uQdwi72CFBsK_WqoBxWvFjgLehWk",
              "type": "video/mp4",
              "data-bitrate": 1140218
            }
          ],
          "posterUrl": "https://media.licdn.com/dms/image/v2/D4E05AQFoh1mivl09yw/feedshare-thumbnail_720_1280/B4EZSJLRtFGYA8-/0/1737468227932?e=1741683600&v=beta&t=4WTU2iIIYrL_7gmvWIXqaTxtSFRkb-gdE6-TnDGlTHg"
        },
        "date": "2025-02-04T08:22:01.093Z"
      },
      {
        "captions": "The new 2025 LEFORT® catalog is now available. It gives a broad overview of what we manufacture and offer.\n \nIf you want technical details or additional information, do not hesitate to contact us. We are here to support you worldwide 💪🏽\n\n#BuiltToLast",
        "likes": "44",
        "shares": "4",
        "time": {
          "raw": "1ay",
          "parsed": "04.02.2025",
          "isoString": "2025-02-04T08:22:01.094Z"
        },
        "mediaType": "document",
        "mediaContent": {
          "title": "2025 LEFORT CATALOG",
          "subtitle": "15 sayfa",
          "totalPages": 15,
          "coverPages": [
            {
              "type": "image",
              "config": {
                "src": "https://media.licdn.com/dms/image/v2/D4E1FAQF0tm1LO5giUQ/feedshare-document-cover-images_480/B4EZSDRBUiHABI-/0/1737369083190?e=1741683600&v=beta&t=IyQ5mn_gn3wJ9grf3sBYaaKpjEX9uS07ym7hl69zs3s"
              }
            },
            {
              "type": "image",
              "config": {
                "src": "https://media.licdn.com/dms/image/v2/D4E1FAQF0tm1LO5giUQ/feedshare-document-cover-images_480/B4EZSDRBUiHABI-/1/1737369083190?e=1741683600&v=beta&t=SGtnYIpQCKCaq4yzly0o2KCFA8kxqr7xoegw18QUCqU"
              }
            },
            {
              "type": "image",
              "config": {
                "src": "https://media.licdn.com/dms/image/v2/D4E1FAQF0tm1LO5giUQ/feedshare-document-cover-images_480/B4EZSDRBUiHABI-/2/1737369083190?e=1741683600&v=beta&t=SoE7T_iSebFdlmsNQRMqvxlo4hz0SAnc8CEFvBQHbJc"
              }
            }
          ]
        },
        "date": "2025-02-04T08:22:01.094Z"
      },
      {
        "captions": "Proud to add another Lefort Trax to our fleet of shears, optimising scrap processing at our Ripon site 🤩♻️Proud to add another Lefort Trax to our fleet of shears, optimising scrap processing at our Ripon site 🤩♻️",
        "likes": "129",
        "comments": "7",
        "shares": "2",
        "time": {
          "raw": "1ay",
          "parsed": "04.02.2025",
          "isoString": "2025-02-04T08:22:01.095Z"
        },
        "mediaType": "image",
        "mediaContent": [
          "https://media.licdn.com/dms/image/v2/D4D22AQF9uz9ErOnf-g/feedshare-shrink_800/B4DZRlZahuHYAk-/0/1736867952878?e=1744243200&v=beta&t=HzQq7Lbyp2p_A3aI0h0_sLNNu2WcBSJEBRlckfLQQhs"
        ],
        "date": "2025-02-04T08:22:01.095Z"
      },
      {
        "captions": "Family-owned company BORNES RECYCLAGE took delivery of a 1,300-tonne side compression shear Lidex. With this new heavy-duty machine, the scrap metal recycling expert is laying the foundations of its future development.\n\nSome key specs :\n\n▪️Up to 70 t/hour\n▪️Full automatic cycle\n▪️Cross head in cast steel for a better resistance\n▪️Ultra-rapid cutting blades replacement system \n\n🔗 Read full article in the Lefort Mag #2\n\nhttps://lnkd.in/efdfqpSSFamily-owned company BORNES RECYCLAGE took delivery of a 1,300-tonne side compression shear Lidex. With this new heavy-duty machine, the scrap metal recycling expert is laying the foundations of its future development.\n\nSome key specs :\n\n▪️Up to 70 t/hour\n▪️Full automatic cycle\n▪️Cross head in cast steel for a better resistance\n▪️Ultra-rapid cutting blades replacement system \n\n🔗 Read full article in the Lefort Mag #2\n\nhttps://lnkd.in/efdfqpSS",
        "likes": "191",
        "comments": "7",
        "shares": "9",
        "time": {
          "raw": "1ay",
          "parsed": "04.02.2025",
          "isoString": "2025-02-04T08:22:01.096Z"
        },
        "mediaType": "image",
        "mediaContent": [
          "https://media.licdn.com/dms/image/v2/D4E22AQGvD82HYg3KDg/feedshare-shrink_800/B4EZRhFzrkGgAg-/0/1736795701931?e=1744243200&v=beta&t=S0cIJwesmvEJBWoHGycMcrzySWGIDywghJgNk0QN41k"
        ],
        "date": "2025-02-04T08:22:01.096Z"
      },
      {
        "captions": "Never too big 🇺🇸 #LefortAmerica #LidexNever too big 🇺🇸 #LefortAmerica #Lidex",
        "likes": "104",
        "comments": "1",
        "shares": "9",
        "time": {
          "raw": "1ay",
          "parsed": "04.02.2025",
          "isoString": "2025-02-04T08:22:01.097Z"
        },
        "mediaType": "image",
        "mediaContent": [
          "https://media.licdn.com/dms/image/v2/D4E22AQELNxTgPm4Kmg/feedshare-shrink_800/B4EZRCqB6JHkAg-/0/1736285104092?e=1744243200&v=beta&t=vnBLiIK3ND2jEtU9v6XjEB7PucHtmgfAx1VfDFJPyiM"
        ],
        "date": "2025-02-04T08:22:01.097Z"
      },
      {
        "captions": "Crawling into 2025 #HappyNewYear #Trax",
        "likes": "80",
        "comments": "1",
        "shares": "6",
        "time": {
          "raw": "2ay",
          "parsed": "04.01.2025",
          "isoString": "2025-01-04T08:22:01.098Z"
        },
        "mediaType": "video",
        "mediaContent": {
          "src": [
            {
              "src": "https://dms.licdn.com/playlist/vid/v2/D4E05AQEuALTUqE9U2Q/mp4-640p-30fp-crf28/B4EZQjzNt8GYBg-/0/1735767420885?e=1741683600&v=beta&t=bT-nMFsxPxGeHKgicVegXPVaQYLcvF0xRVMlkLLKQ8U",
              "type": "video/mp4",
              "data-bitrate": 817676
            },
            {
              "src": "https://dms.licdn.com/playlist/vid/v2/D4E05AQEuALTUqE9U2Q/mp4-720p-30fp-crf28/B4EZQjzNt8GYBk-/0/1735767421217?e=1741683600&v=beta&t=gup6o9dft9soqff0A-mgOlB1gvpZzqIIP5cVMTOFII4",
              "type": "video/mp4",
              "data-bitrate": 1156466
            }
          ],
          "posterUrl": "https://media.licdn.com/dms/image/v2/D4E05AQEuALTUqE9U2Q/videocover-low/B4EZQjzNt8GYCU-/0/1735767419013?e=1741683600&v=beta&t=Kl93cuLWvGt7TKVu5yg-A8zQqlpwCMhRlpk13kZh8SM"
        },
        "date": "2025-01-04T08:22:01.098Z"
      },
      {
        "captions": "Arrivée de notre nouvelle presse cisaille LEFORT®  track 650 sur notre site de colombier-saugnieu(69).\n#Lefort #recyclage #aluminium #Ari #federec #recycling #birArrivée de notre nouvelle presse cisaille LEFORT®  track 650 sur notre site de colombier-saugnieu(69).\n#Lefort #recyclage #aluminium #Ari #federec #recycling #bir",
        "likes": "199",
        "comments": "21",
        "shares": "11",
        "time": {
          "raw": "2ay",
          "parsed": "04.01.2025",
          "isoString": "2025-01-04T08:22:01.099Z"
        },
        "mediaType": "image",
        "mediaContent": [
          "https://media.licdn.com/dms/image/v2/D4D22AQHmRrjZVAW3RA/feedshare-shrink_800/B4DZO2NQq9HUAg-/0/1733928754628?e=1744243200&v=beta&t=vc2wIWihfnFgrfGakAKAYuW877bdRwXpHm6m4pJ0RtM"
        ],
        "date": "2025-01-04T08:22:01.099Z"
      },
      {
        "captions": "THANK YOU 2024 🧡👋🏼",
        "likes": "55",
        "comments": "1",
        "shares": "10",
        "time": {
          "raw": "2ay",
          "parsed": "04.01.2025",
          "isoString": "2025-01-04T08:22:01.099Z"
        },
        "mediaType": "video",
        "mediaContent": {
          "src": [
            {
              "src": "https://dms.licdn.com/playlist/vid/v2/D4E05AQGNCpRBI1rj3Q/mp4-720p-30fp-crf28/B4EZQb533.HkBk-/0/1735634956467?e=1741683600&v=beta&t=pzcnh_CcgW6RRAKKlkBAUmCTfjXOSIW0-_sRCjeifRA",
              "type": "video/mp4",
              "data-bitrate": 1167429
            },
            {
              "src": "https://dms.licdn.com/playlist/vid/v2/D4E05AQGNCpRBI1rj3Q/mp4-640p-30fp-crf28/B4EZQb533.HkBg-/0/1735634956012?e=1741683600&v=beta&t=gdsQHBzgghGkMU63cwuiLDJ1HSm3vgezb0MRIV9wtt8",
              "type": "video/mp4",
              "data-bitrate": 925426
            }
          ],
          "posterUrl": "https://media.licdn.com/dms/image/v2/D4E05AQGNCpRBI1rj3Q/videocover-high/B4EZQb533.HkBw-/0/1735634952383?e=1741683600&v=beta&t=CFWbAx4paHifRLhL-XMCaCXQsShjO2miAzamhXkzljU"
        },
        "date": "2025-01-04T08:22:01.099Z"
      }
    ]
  },
  {
    "name": "COPEXMetalRecyclingEquipment",
    "followerData": [
      [
        20250225,
        2125
      ],
      [
        20250225,
        2125
      ],
      [
        20250225,
        2125
      ],
      [
        20250228,
        2126
      ],
      [
        20250228,
        2126
      ],
      [
        20250228,
        2126
      ],
      [
        20250228,
        2126
      ],
      [
        20250303,
        2130
      ],
      [
        1741011539486,
        "2.130"
      ],
      [
        1741076538184,
        "2.131"
      ]
    ],
    "data": [
      {
        "captions": "💥🎬 [𝐯𝐢𝐝𝐞𝐨] BORNES RECYCLAGE ramps-up with a new Lidex 1300T !\n\n« Our Lidex can go up to 70t/hr. It has a rail breaker and can handle heavy scrap when needed. In the crane, thanks to the automatic cycle, our operator can prepare the next load while the scrap previously loaded is still being processed. No time is lost ! » Charles Bornes \n\nM. Bornes also prizes the total cooperation shown throughout the project including the recommendations for the most efficient layout of the machine on site, the supply of the civil engineering guide drawings, the logistic operations, the assembly & commissioning of the machine, not forgetting the training of operators and technicians.\n\n🤝 Thanks again to the Bornes family for their trust.",
        "likes": "127",
        "comments": "4",
        "shares": "10",
        "time": {
          "raw": "4g",
          "parsed": "28.02.2025",
          "isoString": "2025-02-28T08:22:17.912Z"
        },
        "mediaType": "video",
        "mediaContent": {
          "src": [
            {
              "src": "https://dms.licdn.com/playlist/vid/v2/D4E05AQHzBjqS2q1Tgw/mp4-720p-30fp-crf28/B4EZVH73AHGYBg-/0/1740668685959?e=1741683600&v=beta&t=0f-b7WH8mJTb3YdDK-R28sK1uVCk_ZvYemIjaQtPM-o",
              "type": "video/mp4",
              "data-bitrate": 1116984
            },
            {
              "src": "https://dms.licdn.com/playlist/vid/v2/D4E05AQHzBjqS2q1Tgw/mp4-640p-30fp-crf28/B4EZVH73AHGYBc-/0/1740668687592?e=1741683600&v=beta&t=yq5pqv7SyJWbWUB0I7Khvdm3pB7hVuhEKyPGwsA7W5Q",
              "type": "video/mp4",
              "data-bitrate": 802291
            }
          ],
          "posterUrl": "https://media.licdn.com/dms/image/v2/D4E05AQHzBjqS2q1Tgw/videocover-low/B4EZVH73AHGYCM-/0/1740668675906?e=1741683600&v=beta&t=l_eknnpy1GeptTpiasP-546b_zONhttE_kcWrhqP-Ic"
        },
        "date": "2025-02-28T08:22:17.912Z"
      },
      {
        "captions": "Wich one would you choose ? 650, 700, 800 or 1000T ? 🤩Wich one would you choose ? 650, 700, 800 or 1000T ? 🤩",
        "likes": "74",
        "comments": "5",
        "shares": "7",
        "time": {
          "raw": "1h",
          "parsed": "25.02.2025",
          "isoString": "2025-02-25T08:22:17.913Z"
        },
        "mediaType": "image",
        "mediaContent": [
          "https://media.licdn.com/dms/image/v2/D4E22AQFBhuWUdXPPEw/feedshare-shrink_800/B4EZU5VpuiHUAg-/0/1740423736410?e=1744243200&v=beta&t=QiCSjk-X0zJBWTncMXSOZZ6OHJvTHnD7YHC8U1Gt-w8",
          "https://media.licdn.com/dms/image/v2/D4E22AQEQERvskXpWxQ/feedshare-shrink_800/B4EZU5VptzHcAg-/0/1740423736612?e=1744243200&v=beta&t=jg3WfkK7-3fo6zOtQF5ekyPaAILYrp1CUeYS7_oyUqU"
        ],
        "date": "2025-02-25T08:22:17.913Z"
      },
      {
        "captions": "🇫🇷 New video at BORNES RECYCLAGE coming soon ! #Lidex1300🇫🇷 New video at BORNES RECYCLAGE coming soon ! #Lidex1300",
        "likes": "98",
        "comments": "1",
        "shares": "11",
        "time": {
          "raw": "2h",
          "parsed": "18.02.2025",
          "isoString": "2025-02-18T08:22:17.915Z"
        },
        "mediaType": "image",
        "mediaContent": [
          "https://media.licdn.com/dms/image/v2/D4E22AQFrYD2RFVQYcg/feedshare-shrink_800/B4EZT6d29bHgAw-/0/1739368924877?e=1744243200&v=beta&t=VxKkSKF5GlAmcZF57ORXGPMeifuHQKmkt7sMEk-swcI",
          "https://media.licdn.com/dms/image/v2/D4E22AQH-WUUm7Zrtmg/feedshare-shrink_800/B4EZT6d28KGwAg-/0/1739368921314?e=1744243200&v=beta&t=N-jr1zLzLtIwC4pAtv-i6NRPMg9kgz6Bo8X1MMo3RAs",
          "https://media.licdn.com/dms/image/v2/D4E22AQHuuJoVj8fKBg/feedshare-shrink_800/B4EZT6d28rG0Ao-/0/1739368923413?e=1744243200&v=beta&t=oHG_iFAR_jwVMFNmwfEtdJGGc6eEbDBzCN6YxMoRNxc"
        ],
        "date": "2025-02-18T08:22:17.915Z"
      },
      {
        "captions": "[𝟐𝟎𝟐𝟓 𝐋𝐄𝐅𝐎𝐑𝐓 𝐑𝐀𝐍𝐆𝐄]\n\nSelecting the right hydraulic shear depends on the type, rate and volume of material being processed, but also where the machine will work. \n\nThanks to a very large range of machines, we can accommodate any operation, from the smallest to the largest scrap yard facilities, with a product that will help bring success and growth to a recycler’s business.\n\nFind out more about our scrap shears  : https://lnkd.in/ertBPuHn\n[𝟐𝟎𝟐𝟓 𝐋𝐄𝐅𝐎𝐑𝐓 𝐑𝐀𝐍𝐆𝐄]\n\nSelecting the right hydraulic shear depends on the type, rate and volume of material being processed, but also where the machine will work. \n\nThanks to a very large range of machines, we can accommodate any operation, from the smallest to the largest scrap yard facilities, with a product that will help bring success and growth to a recycler’s business.\n\nFind out more about our scrap shears  : https://lnkd.in/ertBPuHn",
        "likes": "62",
        "comments": "1",
        "shares": "4",
        "time": {
          "raw": "3h",
          "parsed": "11.02.2025",
          "isoString": "2025-02-11T08:22:17.916Z"
        },
        "mediaType": "image",
        "mediaContent": [
          "https://media.licdn.com/dms/image/v2/D4E22AQGwlwLT9tlEfQ/feedshare-shrink_800/B4EZTg2DkUGwAg-/0/1738939069642?e=1744243200&v=beta&t=q-tu-cxH74x1hxVP-BgtHXjBVEV1TRrpau79L8YNJ5M",
          "https://media.licdn.com/dms/image/v2/D4E22AQHVFvyCwJumeQ/feedshare-shrink_800/B4EZTg2EKKGYAg-/0/1738939070172?e=1744243200&v=beta&t=DqqOtvYR-xaugbOIwhVzBnlAFtXbQXek4ir90Grb5Oo",
          "https://media.licdn.com/dms/image/v2/D4E22AQGCsyknQLVF-g/feedshare-shrink_800/B4EZTg2EBQHMAk-/0/1738939070699?e=1744243200&v=beta&t=6s3oKwh5BUOICz-tQmZw3s-qkGGc-BKvsXqX_7CmO6E",
          "https://media.licdn.com/dms/image/v2/D4E22AQHm32ERupTYsQ/feedshare-shrink_800/B4EZTg2EKQHUAo-/0/1738939070116?e=1744243200&v=beta&t=yICqv4omyTKrPOKuF0GA67etmplAKJRQx8cKyCyxnSM"
        ],
        "date": "2025-02-11T08:22:17.916Z"
      },
      {
        "captions": "🌎⚙️📦🚀\n\nWherever you are and whatever the time, parts availability is key.",
        "likes": "39",
        "shares": "9",
        "time": {
          "raw": "1ay",
          "parsed": "04.02.2025",
          "isoString": "2025-02-04T08:22:17.917Z"
        },
        "mediaType": "video",
        "mediaContent": {
          "src": [
            {
              "src": "https://dms.licdn.com/playlist/vid/v2/D4E05AQFoh1mivl09yw/mp4-640p-30fp-crf28/B4EZSJLRtFGYBc-/0/1737468253999?e=1741683600&v=beta&t=w3P8C2_6L1mNohN0Wt9L-tP2ApgmWPfJ-M8lCPl2CRY",
              "type": "video/mp4",
              "data-bitrate": 872696
            },
            {
              "src": "https://dms.licdn.com/playlist/vid/v2/D4E05AQFoh1mivl09yw/mp4-720p-30fp-crf28/B4EZSJLRtFGYBg-/0/1737468263633?e=1741683600&v=beta&t=1qbNLVGgEDmGFT8uQdwi72CFBsK_WqoBxWvFjgLehWk",
              "type": "video/mp4",
              "data-bitrate": 1140218
            }
          ],
          "posterUrl": "https://media.licdn.com/dms/image/v2/D4E05AQFoh1mivl09yw/feedshare-thumbnail_720_1280/B4EZSJLRtFGYA8-/0/1737468227932?e=1741683600&v=beta&t=4WTU2iIIYrL_7gmvWIXqaTxtSFRkb-gdE6-TnDGlTHg"
        },
        "date": "2025-02-04T08:22:17.917Z"
      },
      {
        "captions": "Family-owned company BORNES RECYCLAGE took delivery of a 1,300-tonne side compression shear Lidex. With this new heavy-duty machine, the scrap metal recycling expert is laying the foundations of its future development.\n\nSome key specs :\n\n▪️Up to 70 t/hour\n▪️Full automatic cycle\n▪️Cross head in cast steel for a better resistance\n▪️Ultra-rapid cutting blades replacement system \n\n🔗 Read full article in the Lefort Mag #2\n\nhttps://lnkd.in/efdfqpSSFamily-owned company BORNES RECYCLAGE took delivery of a 1,300-tonne side compression shear Lidex. With this new heavy-duty machine, the scrap metal recycling expert is laying the foundations of its future development.\n\nSome key specs :\n\n▪️Up to 70 t/hour\n▪️Full automatic cycle\n▪️Cross head in cast steel for a better resistance\n▪️Ultra-rapid cutting blades replacement system \n\n🔗 Read full article in the Lefort Mag #2\n\nhttps://lnkd.in/efdfqpSS",
        "likes": "191",
        "comments": "7",
        "shares": "9",
        "time": {
          "raw": "1ay",
          "parsed": "04.02.2025",
          "isoString": "2025-02-04T08:22:17.918Z"
        },
        "mediaType": "image",
        "mediaContent": [
          "https://media.licdn.com/dms/image/v2/D4E22AQGvD82HYg3KDg/feedshare-shrink_800/B4EZRhFzrkGgAg-/0/1736795701931?e=1744243200&v=beta&t=S0cIJwesmvEJBWoHGycMcrzySWGIDywghJgNk0QN41k"
        ],
        "date": "2025-02-04T08:22:17.918Z"
      },
      {
        "captions": "Never too big 🇺🇸 #LefortAmerica #LidexNever too big 🇺🇸 #LefortAmerica #Lidex",
        "likes": "104",
        "comments": "1",
        "shares": "9",
        "time": {
          "raw": "1ay",
          "parsed": "04.02.2025",
          "isoString": "2025-02-04T08:22:17.920Z"
        },
        "mediaType": "image",
        "mediaContent": [
          "https://media.licdn.com/dms/image/v2/D4E22AQELNxTgPm4Kmg/feedshare-shrink_800/B4EZRCqB6JHkAg-/0/1736285104092?e=1744243200&v=beta&t=vnBLiIK3ND2jEtU9v6XjEB7PucHtmgfAx1VfDFJPyiM"
        ],
        "date": "2025-02-04T08:22:17.920Z"
      },
      {
        "captions": "Crawling into 2025 #HappyNewYear #Trax",
        "likes": "80",
        "comments": "1",
        "shares": "6",
        "time": {
          "raw": "2ay",
          "parsed": "04.01.2025",
          "isoString": "2025-01-04T08:22:17.921Z"
        },
        "mediaType": "video",
        "mediaContent": {
          "src": [
            {
              "src": "https://dms.licdn.com/playlist/vid/v2/D4E05AQEuALTUqE9U2Q/mp4-640p-30fp-crf28/B4EZQjzNt8GYBg-/0/1735767420885?e=1741683600&v=beta&t=bT-nMFsxPxGeHKgicVegXPVaQYLcvF0xRVMlkLLKQ8U",
              "type": "video/mp4",
              "data-bitrate": 817676
            },
            {
              "src": "https://dms.licdn.com/playlist/vid/v2/D4E05AQEuALTUqE9U2Q/mp4-720p-30fp-crf28/B4EZQjzNt8GYBk-/0/1735767421217?e=1741683600&v=beta&t=gup6o9dft9soqff0A-mgOlB1gvpZzqIIP5cVMTOFII4",
              "type": "video/mp4",
              "data-bitrate": 1156466
            }
          ],
          "posterUrl": "https://media.licdn.com/dms/image/v2/D4E05AQEuALTUqE9U2Q/videocover-low/B4EZQjzNt8GYCU-/0/1735767419013?e=1741683600&v=beta&t=Kl93cuLWvGt7TKVu5yg-A8zQqlpwCMhRlpk13kZh8SM"
        },
        "date": "2025-01-04T08:22:17.921Z"
      },
      {
        "captions": "THANK YOU 2024 🧡👋🏼",
        "likes": "55",
        "comments": "1",
        "shares": "10",
        "time": {
          "raw": "2ay",
          "parsed": "04.01.2025",
          "isoString": "2025-01-04T08:22:17.921Z"
        },
        "mediaType": "video",
        "mediaContent": {
          "src": [
            {
              "src": "https://dms.licdn.com/playlist/vid/v2/D4E05AQGNCpRBI1rj3Q/mp4-720p-30fp-crf28/B4EZQb533.HkBk-/0/1735634956467?e=1741683600&v=beta&t=pzcnh_CcgW6RRAKKlkBAUmCTfjXOSIW0-_sRCjeifRA",
              "type": "video/mp4",
              "data-bitrate": 1167429
            },
            {
              "src": "https://dms.licdn.com/playlist/vid/v2/D4E05AQGNCpRBI1rj3Q/mp4-640p-30fp-crf28/B4EZQb533.HkBg-/0/1735634956012?e=1741683600&v=beta&t=gdsQHBzgghGkMU63cwuiLDJ1HSm3vgezb0MRIV9wtt8",
              "type": "video/mp4",
              "data-bitrate": 925426
            }
          ],
          "posterUrl": "https://media.licdn.com/dms/image/v2/D4E05AQGNCpRBI1rj3Q/videocover-high/B4EZQb533.HkBw-/0/1735634952383?e=1741683600&v=beta&t=CFWbAx4paHifRLhL-XMCaCXQsShjO2miAzamhXkzljU"
        },
        "date": "2025-01-04T08:22:17.921Z"
      },
      {
        "captions": "🎅🏻🎄🎁💫\n\nAs we celebrate the holiday season, we want to take a moment to express our heartfelt gratitude to each of you.\n\nMay the spirit of Christmas bring peace, joy and warmth to you and your loved ones. \n\nWishing you all a merry Christmas and a prosperous New Year, filled with new challenges and success 🥂✨🎅🏻🎄🎁💫\n\nAs we celebrate the holiday season, we want to take a moment to express our heartfelt gratitude to each of you.\n\nMay the spirit of Christmas bring peace, joy and warmth to you and your loved ones. \n\nWishing you all a merry Christmas and a prosperous New Year, filled with new challenges and success 🥂✨",
        "likes": "59",
        "shares": "5",
        "time": {
          "raw": "2ay",
          "parsed": "04.01.2025",
          "isoString": "2025-01-04T08:22:17.923Z"
        },
        "mediaType": "image",
        "mediaContent": [
          "https://media.licdn.com/dms/image/v2/D4E22AQGJdKrDCKbYpg/feedshare-shrink_800/B4EZP39LSoHgAg-/0/1735031833519?e=1744243200&v=beta&t=BaxhPoWuwPkb3sQgnmTtCt4LO2uTAbS56mGIZO7n13g"
        ],
        "date": "2025-01-04T08:22:17.923Z"
      },
      {
        "captions": "Noel avant l'heure. Du coup le 25, nous n'aurons rien au sapin.\nFeaturing de gauche à droite:\nGuillaume (Copex-Lefort),Bernard NADAL, Philippe NADAL, Lionel LEMENTEC (Copex-Lefort),Olivier JALIBERTNoel avant l'heure. Du coup le 25, nous n'aurons rien au sapin.\nFeaturing de gauche à droite:\nGuillaume (Copex-Lefort),Bernard NADAL, Philippe NADAL, Lionel LEMENTEC (Copex-Lefort),Olivier JALIBERT",
        "likes": "172",
        "comments": "16",
        "shares": "4",
        "time": {
          "raw": "2ay",
          "parsed": "04.01.2025",
          "isoString": "2025-01-04T08:22:17.924Z"
        },
        "mediaType": "image",
        "mediaContent": [
          "https://media.licdn.com/dms/image/v2/D4E22AQG_gs8MTSSR5g/feedshare-shrink_800/B4EZPP77owHwAo-/0/1734360417353?e=1744243200&v=beta&t=f0pXkrFzIPSE2BNntDzYfX-jKT65h9Q5O5lK2KWFBPs"
        ],
        "date": "2025-01-04T08:22:17.924Z"
      },
      {
        "captions": "🎬 𝐍𝐄𝐖 𝐋𝐈𝐃𝐄𝐗 𝟐𝟎𝟎𝟎𝐓 𝐚𝐭 Galloo ♻️\n \nNo need for words, just turn on the sound and watch !",
        "likes": "102",
        "comments": "2",
        "shares": "14",
        "time": {
          "raw": "2ay",
          "parsed": "04.01.2025",
          "isoString": "2025-01-04T08:22:17.925Z"
        },
        "mediaType": "video",
        "mediaContent": {
          "src": [
            {
              "src": "https://dms.licdn.com/playlist/vid/v2/D4E05AQHzH8ZHEmRRZw/mp4-640p-30fp-crf28/mp4-640p-30fp-crf28/0/1733834058647?e=1741683600&v=beta&t=67lBUbbS_c3hspThm1kurx5Q9ZXzphROPd9_SEDFkXk",
              "type": "video/mp4",
              "data-bitrate": 754533
            },
            {
              "src": "https://dms.licdn.com/playlist/vid/v2/D4E05AQHzH8ZHEmRRZw/mp4-720p-30fp-crf28/mp4-720p-30fp-crf28/0/1733834048591?e=1741683600&v=beta&t=EnHBHM11oKvx1W2DKdYqGoNct_Bjzsohv2Z86h4vRdw",
              "type": "video/mp4",
              "data-bitrate": 1005798
            }
          ],
          "posterUrl": "https://media.licdn.com/dms/image/v2/D4E05AQHzH8ZHEmRRZw/feedshare-thumbnail_720_1280/feedshare-thumbnail_720_1280/0/1733833812668?e=1741683600&v=beta&t=TaBiivfYxxFkaAGSnhXA3vuA-_4SxVxN2j_5Z5A3A8k"
        },
        "date": "2025-01-04T08:22:17.925Z"
      },
      {
        "captions": "🗞️𝗧𝗵𝗲 𝗢𝗳𝗳𝗶𝗰𝗶𝗮𝗹 𝗟𝗲𝗳𝗼𝗿𝘁 𝗠𝗮𝗴𝗮𝘇𝗶𝗻𝗲 #𝟮 𝗶𝘀 𝗼𝘂𝘁 ! \n\nClick and dive into the Lefort universe with our latest news, technical insights, recent developments, customer interviews and more ... \n\nFrom customers to employees, from suppliers to passionate fans, this mag was created to unite our entire community around the Lefort brand. \n\nThank you all and happy reading !",
        "likes": "75",
        "comments": "1",
        "shares": "12",
        "time": {
          "raw": "2ay",
          "parsed": "04.01.2025",
          "isoString": "2025-01-04T08:22:17.926Z"
        },
        "mediaType": "document",
        "mediaContent": {
          "title": "The Official Lefort Magazine #2",
          "subtitle": "8 sayfa",
          "totalPages": 8,
          "coverPages": [
            {
              "type": "image",
              "config": {
                "src": "https://media.licdn.com/dms/image/v2/D4D1FAQHXIW6JSKOD2w/feedshare-document-cover-images_480/feedshare-document-cover-images_480/0/1733306963886?e=1741683600&v=beta&t=yCc9DEurf6pNVAizM2X5xNHhKSoEoFg7RkDlSdkkAqE"
              }
            },
            {
              "type": "image",
              "config": {
                "src": "https://media.licdn.com/dms/image/v2/D4D1FAQHXIW6JSKOD2w/feedshare-document-cover-images_480/feedshare-document-cover-images_480/1/1733306963886?e=1741683600&v=beta&t=PHRqU4a_dAXfHVb439CBs7TbV5qzevf_5Hzwzbzbt38"
              }
            },
            {
              "type": "image",
              "config": {
                "src": "https://media.licdn.com/dms/image/v2/D4D1FAQHXIW6JSKOD2w/feedshare-document-cover-images_480/feedshare-document-cover-images_480/2/1733306963886?e=1741683600&v=beta&t=rdZzFXTfZAyFCelE-7q8oDcTX7w1G9yTi7gAu6k5pYo"
              }
            }
          ]
        },
        "date": "2025-01-04T08:22:17.926Z"
      },
      {
        "captions": "𝟏𝐬𝐭 𝐋𝐞𝐟𝐨𝐫𝐭 𝐋𝐢𝐝𝐞𝐱 𝐢𝐧 𝐓𝐚𝐢𝐰𝐚𝐧 🇹🇼\n\nLefort is proud to announce the successful commissioning of a first hydraulic shear Lidex 1300T at the Taiwanese company, Feng Hsin Steel. \n\nProof of the growing interest in Lefort machines from steelmakers, this installation also demonstrates the productivity and robustness necessary for companies wishing to process all kinds of scrap metal at high efficiency. \n\nA great project smoothly conducted by our teams and our local partners. Congratulations! 👏🏼𝟏𝐬𝐭 𝐋𝐞𝐟𝐨𝐫𝐭 𝐋𝐢𝐝𝐞𝐱 𝐢𝐧 𝐓𝐚𝐢𝐰𝐚𝐧 🇹🇼\n\nLefort is proud to announce the successful commissioning of a first hydraulic shear Lidex 1300T at the Taiwanese company, Feng Hsin Steel. \n\nProof of the growing interest in Lefort machines from steelmakers, this installation also demonstrates the productivity and robustness necessary for companies wishing to process all kinds of scrap metal at high efficiency. \n\nA great project smoothly conducted by our teams and our local partners. Congratulations! 👏🏼",
        "likes": "116",
        "shares": "7",
        "time": {
          "raw": "3ay",
          "parsed": "04.12.2024",
          "isoString": "2024-12-04T08:22:17.927Z"
        },
        "mediaType": "image",
        "mediaContent": [
          "https://media.licdn.com/dms/image/v2/D4E22AQEVmW-GUIFbiw/feedshare-shrink_800/feedshare-shrink_800/0/1732648981503?e=1744243200&v=beta&t=c6RlBug0ZGrnbPoKj13rXhoa6DBiZNafIh5ToW3p2DU",
          "https://media.licdn.com/dms/image/v2/D4E22AQFblv3ksDJhyA/feedshare-shrink_800/feedshare-shrink_800/0/1732648981407?e=1744243200&v=beta&t=HsR12fij5xrLy1HmlIrwXWy2Nj61YlDEE6CVvG3bzl0",
          "https://media.licdn.com/dms/image/v2/D4E22AQGw59DsJ9w5RQ/feedshare-shrink_800/feedshare-shrink_800/0/1732648980498?e=1744243200&v=beta&t=Plg-gsQr-yRGjsVAjETgCDhIlaffYEO845yYH55qJ1o"
        ],
        "date": "2024-12-04T08:22:17.927Z"
      },
      {
        "captions": "The most advanced side compression shears on the market : The LEFORT® Lidex. \n\n✔️ Full automatic cycle\n✔️ From 1000 to 2000T of cutting force \n✔️ Control of operating parameters \n✔️ Increased productivity (up to 25%)\n✔️ Watch the video below… \n\nDownload the new brochure \n👉🏼 https://lnkd.in/eHQt3fBt",
        "likes": "96",
        "comments": "3",
        "shares": "16",
        "time": {
          "raw": "4ay",
          "parsed": "04.11.2024",
          "isoString": "2024-11-04T08:22:17.928Z"
        },
        "mediaType": "video",
        "mediaContent": {
          "src": [
            {
              "src": "https://dms.licdn.com/playlist/vid/v2/D4E05AQGob-nwfuipCg/mp4-640p-30fp-crf28/mp4-640p-30fp-crf28/0/1730380845120?e=1741683600&v=beta&t=1fa8nXLOGjWAxr5iDI9FqqhYL0aNetWwMicOo6yCYFc",
              "type": "video/mp4",
              "data-bitrate": 708956
            },
            {
              "src": "https://dms.licdn.com/playlist/vid/v2/D4E05AQGob-nwfuipCg/mp4-720p-30fp-crf28/mp4-720p-30fp-crf28/0/1730380840500?e=1741683600&v=beta&t=vybELxIKWMF18A28RyeRQ_JVtkYuP0i_SmpT3NTACSE",
              "type": "video/mp4",
              "data-bitrate": 1013681
            }
          ],
          "posterUrl": "https://media.licdn.com/dms/image/v2/D4E05AQGob-nwfuipCg/videocover-low/videocover-low/0/1730380823350?e=1741683600&v=beta&t=mdDB1UEeS_UW-m6wiEd4KnKZbv6gTireR4K25aXpitA"
        },
        "date": "2024-11-04T08:22:17.928Z"
      },
      {
        "captions": "Depending on configuration and utilization , Lidex side compression shears can reach very high production levels, up to 115 t/h and productivity gains of 25%.\n \nTill now, the Lidex are the only scrap shears with side compression to offer a complete automatic cycle.\n \nThis unique function is made possible mainly by two major innovations :\n\n✔️innovative kinematics for the preload table which allows dumping of scrap metal directly into the pusher area, and thus reducing the number of movements\n \n✔️a high amplitude lid designed to exert exceptional compaction power and efficiency to reduce cycle times.\n\nRead more : https://lnkd.in/efX56KbM",
        "likes": "100",
        "shares": "15",
        "time": {
          "raw": "5ay",
          "parsed": "04.10.2024",
          "isoString": "2024-10-04T08:22:17.929Z"
        },
        "mediaType": "video",
        "mediaContent": {
          "src": [
            {
              "src": "https://dms.licdn.com/playlist/vid/v2/D4E05AQFq7NBUjdXP-w/mp4-640p-30fp-crf28/mp4-640p-30fp-crf28/0/1728057865565?e=1741683600&v=beta&t=whVvx6IrWUdO-lpKw1pNOhWO6kUHoEHept9lKAe7W8Y",
              "type": "video/mp4",
              "data-bitrate": 665133
            },
            {
              "src": "https://dms.licdn.com/playlist/vid/v2/D4E05AQFq7NBUjdXP-w/mp4-720p-30fp-crf28/mp4-720p-30fp-crf28/0/1728057862727?e=1741683600&v=beta&t=9nismLjmjCNLuBGxig7ZlLLNJtCMgigiYBaS05g7Cgg",
              "type": "video/mp4",
              "data-bitrate": 947774
            }
          ],
          "posterUrl": "https://media.licdn.com/dms/image/v2/D4E05AQFq7NBUjdXP-w/videocover-low/videocover-low/0/1728057854551?e=1741683600&v=beta&t=x9WjGbrCumXudq71TemgKmYNFGOCs4HFlY05ldEruSg"
        },
        "date": "2024-10-04T08:22:17.929Z"
      },
      {
        "captions": "🎻 C’est une première, le groupe LEFORT® et l’Orchestre Français des Jeunes (OFJ) se rapprochent pour un partenariat peu courant dans l’industrie tout comme dans la musique classique. \n\nFawaz Ezzat, Group After Sales Director chez Lefort témoigne  : \n\n« Le lien ne semble a priori pas évident, mais les similitudes entre l’orchestre et l’industrie sont confondantes. J’ai eu la chance d’intégrer l’OFJ lors des sessions 2006, 2007 et 2008.\n\nAvec du recul, il est évident que l’orchestre m’a apporté énormément en termes de management et de conduite de projet. Être musicien d’orchestre, c’est savoir faire du lien entre les éléments, écouter, s’exprimer, apprendre à gérer son stress, anticiper une échéance, rebondir après un échec. Ces compétences qui deviennent naturelles dans le monde musical, sont également une nécessité dans le monde industriel. » \n\nDécouvrez-en plus sur cette annonce en cliquant le lien : https://lnkd.in/dKeTs_9W🎻 C’est une première, le groupe LEFORT® et l’Orchestre Français des Jeunes (OFJ) se rapprochent pour un partenariat peu courant dans l’industrie tout comme dans la musique classique. \n\nFawaz Ezzat, Group After Sales Director chez Lefort témoigne  : \n\n« Le lien ne semble a priori pas évident, mais les similitudes entre l’orchestre et l’industrie sont confondantes. J’ai eu la chance d’intégrer l’OFJ lors des sessions 2006, 2007 et 2008.\n\nAvec du recul, il est évident que l’orchestre m’a apporté énormément en termes de management et de conduite de projet. Être musicien d’orchestre, c’est savoir faire du lien entre les éléments, écouter, s’exprimer, apprendre à gérer son stress, anticiper une échéance, rebondir après un échec. Ces compétences qui deviennent naturelles dans le monde musical, sont également une nécessité dans le monde industriel. » \n\nDécouvrez-en plus sur cette annonce en cliquant le lien : https://lnkd.in/dKeTs_9W",
        "likes": "27",
        "shares": "5",
        "time": {
          "raw": "5ay",
          "parsed": "04.10.2024",
          "isoString": "2024-10-04T08:22:17.934Z"
        },
        "mediaType": "image",
        "mediaContent": [
          "https://media.licdn.com/dms/image/v2/D4D22AQEVD-vF-PMvBA/feedshare-shrink_800/feedshare-shrink_800/0/1727873573938?e=1744243200&v=beta&t=naWDMaGcsknwQSkC4ZonOagXilINg4i3PL2cJ11qrmM",
          "https://media.licdn.com/dms/image/v2/D4D22AQHa2YfPfbzkAg/feedshare-shrink_800/feedshare-shrink_800/0/1727873572783?e=1744243200&v=beta&t=hBiqfgakVsOw-rmyaZqngd-i-sEWES5x_z0aK2wsoMU",
          "https://media.licdn.com/dms/image/v2/D4D22AQEWKrykbSiiDA/feedshare-shrink_800/feedshare-shrink_800/0/1727873573806?e=1744243200&v=beta&t=2ij5gBmyBwBvJM0Ysg-oKa7mX-OTebZmKaCLrSwqjAs",
          "https://media.licdn.com/dms/image/v2/D4D22AQEMWIueHVEAdA/feedshare-shrink_800/feedshare-shrink_800/0/1727873573365?e=1744243200&v=beta&t=Iz-yjLx52QD0biG7RzHeeYw4Los72x7QmCzhCtQRn70"
        ],
        "date": "2024-10-04T08:22:17.934Z"
      },
      {
        "captions": "🇺🇸Scrap Expo 2024 is finally here ! \n\nCome join us and explore our exceptional range of shears & balers 💪🏽\n\n📍 Louisville, KY\n📆 September 17-18\n⭐️ Booth 421 \n\n#LefortAmerica \n\nJonathan Miller Michael Schultz George Maggiolo Trey Huntsinger Recycling Today🇺🇸Scrap Expo 2024 is finally here ! \n\nCome join us and explore our exceptional range of shears & balers 💪🏽\n\n📍 Louisville, KY\n📆 September 17-18\n⭐️ Booth 421 \n\n#LefortAmerica \n\nJonathan Miller Michael Schultz George Maggiolo Trey Huntsinger Recycling Today",
        "likes": "51",
        "comments": "1",
        "shares": "5",
        "time": {
          "raw": "5ay",
          "parsed": "04.10.2024",
          "isoString": "2024-10-04T08:22:17.935Z"
        },
        "mediaType": "image",
        "mediaContent": [
          "https://media.licdn.com/dms/image/v2/D4D22AQHqj6GhSyClsg/feedshare-shrink_800/feedshare-shrink_800/0/1726642962653?e=1744243200&v=beta&t=ljYI6lQ_Q5WOpfVHn7izmL7ftfg9mz5jWOM5FJvgJuM",
          "https://media.licdn.com/dms/image/v2/D4D22AQFao7eGBUb-nA/feedshare-shrink_800/feedshare-shrink_800/0/1726642962022?e=1744243200&v=beta&t=c3f9bKPeolTLxcNv7KtU7oQEBSzi8IeqESVAH9tEKeg",
          "https://media.licdn.com/dms/image/v2/D4D22AQGzXBDairj0kw/feedshare-shrink_2048_1536/feedshare-shrink_2048_1536/0/1726642962674?e=1744243200&v=beta&t=zW87Z4UL5rBB48XZyHrKHfyVufJvAOVr4c90B7P8E9E"
        ],
        "date": "2024-10-04T08:22:17.935Z"
      },
      {
        "captions": "LEFORT® Lidex 2000T en phase finale d'assemblage chez un acteur incontournable du recyclage !\n\n🫱🏼🫲🏻 Créée en 1983, l’entreprise familiale et indépendante GUYOT environnement collecte +400.000 tonnes de ferraille chaque année. Pour poursuivre son développement, elle a choisi une presse cisaille à compression latérale LIDEX, modèle intégré désormais à la gamme LEFORT.\n\n⚙️ Cette « belle bête » affiche une force de coupe gigantesque de 2000 tonnes, une grande largeur de coupe de 1500 mm, une caisse de 10 m x 2,60 m et une motorisation de 8 x 110 kW. \n\n📈 Avec cette machine hors-normes, l’entreprise pourra atteindre des capacités de production jusqu’à 110 tonnes/heure ! \n\n+ d'infos très prochainement...LEFORT® Lidex 2000T en phase finale d'assemblage chez un acteur incontournable du recyclage !\n\n🫱🏼🫲🏻 Créée en 1983, l’entreprise familiale et indépendante GUYOT environnement collecte +400.000 tonnes de ferraille chaque année. Pour poursuivre son développement, elle a choisi une presse cisaille à compression latérale LIDEX, modèle intégré désormais à la gamme LEFORT.\n\n⚙️ Cette « belle bête » affiche une force de coupe gigantesque de 2000 tonnes, une grande largeur de coupe de 1500 mm, une caisse de 10 m x 2,60 m et une motorisation de 8 x 110 kW. \n\n📈 Avec cette machine hors-normes, l’entreprise pourra atteindre des capacités de production jusqu’à 110 tonnes/heure ! \n\n+ d'infos très prochainement...",
        "likes": "303",
        "comments": "9",
        "shares": "17",
        "time": {
          "raw": "6ay",
          "parsed": "04.09.2024",
          "isoString": "2024-09-04T08:22:17.936Z"
        },
        "mediaType": "image",
        "mediaContent": [
          "https://media.licdn.com/dms/image/v2/D4E22AQF0viJ1PULigA/feedshare-shrink_800/feedshare-shrink_800/0/1723475504829?e=1744243200&v=beta&t=EbNMJjnu4OUp8QzjbPuiKwzVEYdUmTOIWYLJ_ve0SOU",
          "https://media.licdn.com/dms/image/v2/D4E22AQGf6Pv_ir1UKA/feedshare-shrink_800/feedshare-shrink_800/0/1723475502673?e=1744243200&v=beta&t=IuO2hgomjVaceq8tJEE3m5jb1CIQDPkM9qq3ky7BXho",
          "https://media.licdn.com/dms/image/v2/D4E22AQHXtYUEMNOg1Q/feedshare-shrink_800/feedshare-shrink_800/0/1723475501033?e=1744243200&v=beta&t=Qh0usI3Q80Y6G8hbxHfbkRQI9XMdbuvVCaCVk5S2crs"
        ],
        "date": "2024-09-04T08:22:17.936Z"
      },
      {
        "captions": "By introducing the Lidex range improved by bringing together \"the best of both Lefort/Copex worlds\", LEFORT® offers a unique and unrivaled range of side compression shears, combining + 150 years of experience …\n\nModern, fast, productive and robust, the Lidex is a real game changer !\n\n⬇️ New 2024 LIDEX Brochure ⬇️\nhttps://lnkd.in/eHQt3fBtBy introducing the Lidex range improved by bringing together \"the best of both Lefort/Copex worlds\", LEFORT® offers a unique and unrivaled range of side compression shears, combining + 150 years of experience …\n\nModern, fast, productive and robust, the Lidex is a real game changer !\n\n⬇️ New 2024 LIDEX Brochure ⬇️\nhttps://lnkd.in/eHQt3fBt",
        "likes": "90",
        "comments": "1",
        "shares": "9",
        "time": {
          "raw": "7ay",
          "parsed": "03.08.2024",
          "isoString": "2024-08-03T14:18:59.153Z"
        },
        "mediaType": "image",
        "mediaContent": [
          "https://media.licdn.com/dms/image/v2/D4E22AQFIOb7tUYiIsg/feedshare-shrink_800/feedshare-shrink_800/0/1720713066178?e=1743638400&v=beta&t=eHFGVyAWONGnJMezvXBmbDN2JYw455tdJa5b20-Xh2U",
          "https://media.licdn.com/dms/image/v2/D4E22AQGl_cu6ztb9Xw/feedshare-shrink_800/feedshare-shrink_800/0/1720713065873?e=1743638400&v=beta&t=jVUJ6h4QtIKym6ZCGHrVsQM4wWK5Fm1-dsDHue6PDCo",
          "https://media.licdn.com/dms/image/v2/D4E22AQGdz_ouaOHz0Q/feedshare-shrink_800/feedshare-shrink_800/0/1720713060502?e=1743638400&v=beta&t=v8iM_uGBQddERaYXtkjc0cpFzbqKedYpTYbF03jJwRw",
          "https://media.licdn.com/dms/image/v2/D4E22AQGiaaGieqY_Xw/feedshare-shrink_800/feedshare-shrink_800/0/1720713061176?e=1743638400&v=beta&t=UByGq_XLgoinM3VANzdvbZ-ph5IrdKb8IsLDz3sntmY",
          "https://media.licdn.com/dms/image/v2/D4E22AQHSncnL1C12Ow/feedshare-shrink_800/feedshare-shrink_800/0/1720713060322?e=1743638400&v=beta&t=MXG5I-hspQZFqGUO6RZA6HLtUeYWFt6cS8xaszYvJBY"
        ],
        "date": "2024-08-03T14:18:59.153Z"
      },
      {
        "captions": "🇬🇧 Jebb Metals have now put to work their new Koloss 1000 TS. This Lefort shear/baler is proving to be a real head turner as it sits proudly at the top of their yard. \n\n💥 Delivered to site in three main pieces the machine is assembled on a foundation frame and commissioned within two weeks. The machine is very productive on all grades of ferrous and non-ferrous metals, shearing with the 1000T window crosshead or baling with the 180T baling ram. \n\n💪🏽 The power, strength and speed of its cutting is giving very pleasing results for its new owners. This machine, fitted with the 600HP Scania diesel engine, operators control cabin and tunnel pusher ram is easily capable of 25-30 Tonnes per hour of production, depending upon material and cut length. \n\nWe wish Philip & Stephen all the best for the future with their new Lefort Koloss 1000 TS 🙌\n\n#LefortUk🇬🇧 Jebb Metals have now put to work their new Koloss 1000 TS. This Lefort shear/baler is proving to be a real head turner as it sits proudly at the top of their yard. \n\n💥 Delivered to site in three main pieces the machine is assembled on a foundation frame and commissioned within two weeks. The machine is very productive on all grades of ferrous and non-ferrous metals, shearing with the 1000T window crosshead or baling with the 180T baling ram. \n\n💪🏽 The power, strength and speed of its cutting is giving very pleasing results for its new owners. This machine, fitted with the 600HP Scania diesel engine, operators control cabin and tunnel pusher ram is easily capable of 25-30 Tonnes per hour of production, depending upon material and cut length. \n\nWe wish Philip & Stephen all the best for the future with their new Lefort Koloss 1000 TS 🙌\n\n#LefortUk",
        "likes": "46",
        "comments": "2",
        "shares": "6",
        "time": {
          "raw": "18s",
          "parsed": "03.03.2025",
          "isoString": "2025-03-03T14:22:17.911Z"
        },
        "mediaType": "image",
        "mediaContent": [
          "https://media.licdn.com/dms/image/v2/D4E22AQGlu4rUV34Lxg/feedshare-shrink_800/B4EZVcNW7KGYAk-/0/1741008763842?e=1744243200&v=beta&t=noxprdUfocMe8NdUnCHke0-YD2y0T71UUiOuYREKaWc"
        ],
        "date": "2025-03-03T14:22:17.911Z"
      }
    ]
  },
  {
    "name": "ATMRecyclingsystems",
    "followerData": [
      [
        20250225,
        658
      ],
      [
        20250225,
        657
      ],
      [
        20250225,
        657
      ],
      [
        20250228,
        662
      ],
      [
        20250228,
        662
      ],
      [
        20250228,
        662
      ],
      [
        20250228,
        662
      ],
      [
        20250303,
        662
      ],
      [
        1741011558953,
        "662"
      ],
      [
        1741076555584,
        "663"
      ]
    ],
    "data": [
      {
        "captions": "🚀 A Bird’s Eye View of Power and Precision! 🔩🔨\n\nGet a glimpse from above! Our state-of-the-art Scrap Shear 𝘼𝙧𝙣𝙤®𝘾𝙪𝙩 in action – turning mountains of metal into valuable resources. \n\nFrom massive steel beams to tangled scrap, our shear handles it all with unmatched force and precision. Even before its first cut, it’s clear that another customer trusts in our cutting-edge technology 🤝\n\nWhat makes our scrap shears stand out?\n🔹 Stability & Robustness – Engineered for maximum durability and reliability.\n🔹 Heavyweight Performance – Built to handle the toughest materials with ease.\n🔹 Longevity – Designed for years of high-performance operation.\n\nWith state-of-the-art shearing technology, we’re setting new standards in efficiency and sustainability. Watch the video to get a glimpse of recycling from a whole new angle – even before the machine gets to work! 🎥👇\n\n#CircularEconomy #ScrapShear #CustomerTrust #MetalRecycling",
        "likes": "5",
        "comments": "2",
        "shares": "2",
        "time": {
          "raw": "2h",
          "parsed": "18.02.2025",
          "isoString": "2025-02-18T08:22:35.318Z"
        },
        "mediaType": "video",
        "mediaContent": {
          "src": [
            {
              "src": "https://dms.licdn.com/playlist/vid/v2/D4E05AQHB5Cpkh-dj8Q/mp4-720p-30fp-crf28/B4EZUVuEs0HUBk-/0/1739826599635?e=1741683600&v=beta&t=PFGiSBmy7z78iCU4i6oeCxOe9Iy0W7zXPxy7xMadk74",
              "type": "video/mp4",
              "data-bitrate": 1206997
            },
            {
              "src": "https://dms.licdn.com/playlist/vid/v2/D4E05AQHB5Cpkh-dj8Q/mp4-640p-30fp-crf28/B4EZUVuEs0HUBg-/0/1739826600862?e=1741683600&v=beta&t=BLsfT1xcSeZ3HsVZL2kyhzuk5nK_hL5_NYWj5PwSQFU",
              "type": "video/mp4",
              "data-bitrate": 861419
            }
          ],
          "posterUrl": "https://media.licdn.com/dms/image/v2/D4E05AQHB5Cpkh-dj8Q/videocover-low/B4EZUVuEs0HUCQ-/0/1739826596056?e=1741683600&v=beta&t=I8eM6MX5wj-NhcsJph07rLqOwrCr73fQbsTN_ksqLRM"
        },
        "date": "2025-02-18T08:22:35.318Z"
      },
      {
        "captions": "🔩  𝗔𝗿𝗻𝗼®𝗕𝗿𝗶𝗸 𝟮𝟮  – The World’s Largest Briquetting Press! 🌍♻️\n\nSize matters – especially when it comes to efficiency and sustainability in metal recycling! With the 𝗔𝗿𝗻𝗼®𝗕𝗿𝗶𝗸 𝟮𝟮, we are setting standards in briquetting technology. This powerhouse is the largest briquetting press in the world, designed for maximum performance in recycling and metal processing industries.\n\nWhy choose the 𝗔𝗿𝗻𝗼®𝗕𝗿𝗶𝗸 𝟮𝟮?\n✅ Unmatched size & capacity – Handles extreme volumes with ease.\n✅ Up to 90% volume reduction – Optimized for transport and storage.\n✅ Clean & efficient – Recovers valuable coolants and cutting fluids.\n✅ Heavy-duty engineering – Built to last, designed for demanding environments.\n\nFrom metal chips to high-density briquettes this solution delivers efficiency, sustainability, and cost savings like no other.\n\n🚀 Want to see the 𝗔𝗿𝗻𝗼®𝗕𝗿𝗶𝗸 𝟮𝟮 in action? Let’s talk!\n\n#ArnoBrik22 #BriquettingPress #MetalRecycling #HeavyDutyEngineering",
        "likes": "25",
        "shares": "4",
        "time": {
          "raw": "3h",
          "parsed": "11.02.2025",
          "isoString": "2025-02-11T08:22:35.319Z"
        },
        "mediaType": "video",
        "mediaContent": {
          "src": [
            {
              "src": "https://dms.licdn.com/playlist/vid/v2/D5605AQHB7zI37W7gnw/mp4-640p-30fp-crf28/B56ZTxhYeoHQBg-/0/1739219181040?e=1741683600&v=beta&t=qRnh0OrRSg5x5g7fQV0dnqsgVAdVRXdSBF45khKCCU8",
              "type": "video/mp4",
              "data-bitrate": 1006269
            },
            {
              "src": "https://dms.licdn.com/playlist/vid/v2/D5605AQHB7zI37W7gnw/mp4-720p-30fp-crf28/B56ZTxhYeoHQBk-/0/1739219181480?e=1741683600&v=beta&t=Cg-cG4atGDGnlryDl5OuQCq5-MaX1NaLx-fwhxoGDdI",
              "type": "video/mp4",
              "data-bitrate": 1332482
            }
          ],
          "posterUrl": "https://media.licdn.com/dms/image/v2/D5605AQHB7zI37W7gnw/videocover-low/B56ZTxhYeoHQCM-/0/1739219177862?e=1741683600&v=beta&t=Id10-xTFkxJcfyY8e2pf3uHtZir2h1UBlzOdRh-N7h0"
        },
        "date": "2025-02-11T08:22:35.319Z"
      },
      {
        "captions": "🔶 Kupferrecycling: Effizient, nachhaltig, unverzichtbar! ♻️\n\nKupfer ist einer der wertvollsten Rohstoffe in der Metallindustrie – aber wussten Sie, dass recyceltes Kupfer die gleiche Qualität wie Primärkupfer besitzt? Durch effizientes Recycling sparen wir nicht nur Ressourcen, sondern auch bis zu 85 % der Energie, die für die Neugewinnung benötigt wird.\n\n🚀 Unsere Paketierpressen stehen für Nachhaltigkeit!\nUm Kupferschrott optimal für die Weiterverarbeitung vorzubereiten, ist eine homogene, kompakte Ballenform entscheidend. Unsere Paketierpressen sorgen für:\n✅ Hohe Verdichtung – weniger Volumen, geringere Transport- und Lagerkosten\n✅ Optimale Schmelzbarkeit – perfekte Vorbereitung für Hütten und Gießereien\n✅ Maximale Effizienz – robust, zuverlässig und für anspruchsvolle Recyclingprozesse ausgelegt\n\nOb für Kabelschrott, Bleche oder Kupferspäne – unsere Paketierpressen sorgen dafür, dass hochwertiges Kupfer bestmöglich wiederverwertet wird.\n\n📌 Sie wollen Ihr Kupferrecycling optimieren? Kontaktieren Sie uns!\n\n#Kupferrecycling #Metallrecycling #Paketierpressen #Nachhaltigkeit #Ressourcenschonung🔶 Kupferrecycling: Effizient, nachhaltig, unverzichtbar! ♻️\n\nKupfer ist einer der wertvollsten Rohstoffe in der Metallindustrie – aber wussten Sie, dass recyceltes Kupfer die gleiche Qualität wie Primärkupfer besitzt? Durch effizientes Recycling sparen wir nicht nur Ressourcen, sondern auch bis zu 85 % der Energie, die für die Neugewinnung benötigt wird.\n\n🚀 Unsere Paketierpressen stehen für Nachhaltigkeit!\nUm Kupferschrott optimal für die Weiterverarbeitung vorzubereiten, ist eine homogene, kompakte Ballenform entscheidend. Unsere Paketierpressen sorgen für:\n✅ Hohe Verdichtung – weniger Volumen, geringere Transport- und Lagerkosten\n✅ Optimale Schmelzbarkeit – perfekte Vorbereitung für Hütten und Gießereien\n✅ Maximale Effizienz – robust, zuverlässig und für anspruchsvolle Recyclingprozesse ausgelegt\n\nOb für Kabelschrott, Bleche oder Kupferspäne – unsere Paketierpressen sorgen dafür, dass hochwertiges Kupfer bestmöglich wiederverwertet wird.\n\n📌 Sie wollen Ihr Kupferrecycling optimieren? Kontaktieren Sie uns!\n\n#Kupferrecycling #Metallrecycling #Paketierpressen #Nachhaltigkeit #Ressourcenschonung",
        "likes": "18",
        "comments": "2",
        "shares": "4",
        "time": {
          "raw": "4h",
          "parsed": "04.02.2025",
          "isoString": "2025-02-04T08:22:35.320Z"
        },
        "mediaType": "image",
        "mediaContent": [
          "https://media.licdn.com/dms/image/v2/D4E22AQEJOHA8F5BUqQ/feedshare-shrink_1280/B4EZTNui41GwAk-/0/1738618320651?e=1744243200&v=beta&t=P0i2WgDza7KYkDYA8c7_4-FzPbVveaQnm3Ntw-D7ips",
          "https://media.licdn.com/dms/image/v2/D4E22AQGxEhgFDp9dkg/feedshare-shrink_1280/B4EZTNui5CHUAo-/0/1738618320625?e=1744243200&v=beta&t=i47_ZwDjToFEZuSNKZXlyMBrxWVmUGfS-gqthEsDQQw",
          "https://media.licdn.com/dms/image/v2/D4E22AQGgUsGXKEhVIw/feedshare-shrink_480/B4EZTNui48G0AY-/0/1738618320629?e=1744243200&v=beta&t=E6Hm7d3m266fWrY85KlETthpEfHLfTMdTF74ot5Ci3A",
          "https://media.licdn.com/dms/image/v2/D4E22AQGsCKGoaqN-vg/feedshare-shrink_1280/B4EZTNui4RGwAk-/0/1738618320572?e=1744243200&v=beta&t=Zz-sw4JSd1LX54LKaSs7QCfQuHqsUhBLDwflCg8fo7Q"
        ],
        "date": "2025-02-04T08:22:35.320Z"
      },
      {
        "captions": "🎄✨ Season’s Greetings from ATM Recyclingsystems! ✨🎄\n\nAs we say goodbye to 2024, we want to express our heartfelt gratitude to our customers, partners, and team for an outstanding year. Your trust and collaboration inspire us to push boundaries and deliver excellence every day.\n\n🌟 Wishing you and your loved ones a joyous holiday season filled with happiness, peace, and success.\n\nMay 2025 bring new opportunities, innovation, and shared achievements for us all!\n\nThank you for being part of our journey – we look forward to reaching even greater milestones together in the coming year!\n\n🎁 Happy Holidays and a Happy New Year! 🎆\n\n#SeasonsGreetings #HappyHolidays #NewYear2025 #ThankYou #Partnership",
        "likes": "11",
        "comments": "1",
        "shares": "2",
        "time": {
          "raw": "2ay",
          "parsed": "04.01.2025",
          "isoString": "2025-01-04T08:22:35.322Z"
        },
        "mediaType": "video",
        "mediaContent": {
          "src": [
            {
              "src": "https://dms.licdn.com/playlist/vid/v2/D4E05AQGbU_KTb4h6Fg/mp4-640p-30fp-crf28/B4EZPbmZTkHkBg-/0/1734556447506?e=1741683600&v=beta&t=OH_a7Akfx88be8PcqH0uSLXoPriF4PmFr5e7SED7iKo",
              "type": "video/mp4",
              "data-bitrate": 882550
            },
            {
              "src": "https://dms.licdn.com/playlist/vid/v2/D4E05AQGbU_KTb4h6Fg/mp4-720p-30fp-crf28/B4EZPbmZTkHkBk-/0/1734556447448?e=1741683600&v=beta&t=MDoNYPNQY7rHCyLEl9TBkq_e3_1jvL7TNQO_AoJBj8s",
              "type": "video/mp4",
              "data-bitrate": 1124943
            }
          ],
          "posterUrl": "https://media.licdn.com/dms/image/v2/D4E05AQGbU_KTb4h6Fg/videocover-low/B4EZPbmZTkHkCU-/0/1734556444106?e=1741683600&v=beta&t=jtkpa95NNs7sBfK-SWSYoocBEqWK30Nj8trz4IFQNpQ"
        },
        "date": "2025-01-04T08:22:35.322Z"
      },
      {
        "captions": "Heading to the USA: Our Arno®Brik 22! 🚛✨\n\nWe’re thrilled to announce the completion of our Arno®Brik 22 – a true powerhouse in the world of briquetting presses! This exceptional machine is now on its way to a valued customer in the USA. 🌍\n\nWhat makes the Arno®Brik 22 so special?\n\n👉 Unmatched size and capacity: We’re the only manufacturer offering a briquetting press of this scale.\n👉 Efficiency meets sustainability: Perfectly designed to compress metal chips into compact, transport-friendly briquettes while recovering valuable coolant.\n👉 Custom-built for maximum performance – tailored to the specific needs of the recycling and manufacturing industry.\n\nFrom design to production, every step was handled with precision and care. Now, it’s time for the Arno®Brik 22 to make an impact overseas!\n\n📸 Check out the pictures of this impressive machine ready for shipment.\n\nInterested in a tailored solution for your recycling needs? Contact us to learn more!\n\n#ArnoBrik22 #BriquettingPress #MetalRecycling #EngineeringExcellence #SustainabilityHeading to the USA: Our Arno®Brik 22! 🚛✨\n\nWe’re thrilled to announce the completion of our Arno®Brik 22 – a true powerhouse in the world of briquetting presses! This exceptional machine is now on its way to a valued customer in the USA. 🌍\n\nWhat makes the Arno®Brik 22 so special?\n\n👉 Unmatched size and capacity: We’re the only manufacturer offering a briquetting press of this scale.\n👉 Efficiency meets sustainability: Perfectly designed to compress metal chips into compact, transport-friendly briquettes while recovering valuable coolant.\n👉 Custom-built for maximum performance – tailored to the specific needs of the recycling and manufacturing industry.\n\nFrom design to production, every step was handled with precision and care. Now, it’s time for the Arno®Brik 22 to make an impact overseas!\n\n📸 Check out the pictures of this impressive machine ready for shipment.\n\nInterested in a tailored solution for your recycling needs? Contact us to learn more!\n\n#ArnoBrik22 #BriquettingPress #MetalRecycling #EngineeringExcellence #Sustainability",
        "likes": "28",
        "comments": "2",
        "shares": "4",
        "time": {
          "raw": "2ay",
          "parsed": "04.01.2025",
          "isoString": "2025-01-04T08:22:35.324Z"
        },
        "mediaType": "image",
        "mediaContent": [
          "https://media.licdn.com/dms/image/v2/D4E22AQGVYFRPoJBUsg/feedshare-shrink_800/B4EZPQduEsHAAk-/0/1734369310397?e=1744243200&v=beta&t=7UgB9PtGFvIw1CW2kJ9gYAx4NGnmFpQlQ6bD_eAn7P4",
          "https://media.licdn.com/dms/image/v2/D4E22AQEFd7Low0j-sg/feedshare-shrink_800/B4EZPQduF7HAAg-/0/1734369314448?e=1744243200&v=beta&t=bcWOjUUWKhUuoGqI0vxAUYK-QgmWFoi1tEsnlBtTc2U",
          "https://media.licdn.com/dms/image/v2/D4E22AQHmaijq5bVKFw/feedshare-shrink_800/B4EZPQduE6HwAo-/0/1734369314442?e=1744243200&v=beta&t=JPILrYI2TtDL4DLpslN3kpRTcMw4-J_sIAu32zGkEpc"
        ],
        "date": "2025-01-04T08:22:35.324Z"
      },
      {
        "captions": "♻️ Recycling von Metallspänen – Nachhaltigkeit beginnt in der Produktion!\n\nWussten Sie, dass Metallspäne – oft ein Nebenprodukt in der Fertigung – wertvolle Rohstoffe enthalten? Durch effiziente Prozesse können sie nicht nur wiederverwertet, sondern auch zu einem wichtigen Beitrag für die Kreislaufwirtschaft gemacht werden. 🌍🔩\n\nWie funktioniert der Recyclingprozess?\n1️⃣ Spänebrechen: Sperrige, lange Späne werden mit unserem Spänebrecher zerkleinert, sodass sie einfacher zu handhaben sind. Dies reduziert das Volumen und verhindert Probleme wie Verstopfungen in der Weiterverarbeitung.\n2️⃣ Brikettierung: Die gebrochenen Späne werden in unseren Brikettierpressen verdichtet.\n✅ Das Volumen wird um bis zu 90 % reduziert.\n✅ Kühl- und Schmiermittel werden sauber zurückgewonnen.\n✅ Es entstehen kompakte, hochwertige Briketts, die sich ideal recyceln lassen.\n\nWarum ist das wichtig?\n🌱 Ressourcenschonung: Weniger Abfall, mehr Wiederverwertung.\n⚙️ Effizienz: Gebrochene Späne und Briketts sind leichter zu transportieren und zu schmelzen.\n💡 Nachhaltige Produktion: Unternehmen sparen Kosten und tragen aktiv zur Kreislaufwirtschaft bei.\n\nVom ersten Schritt des Spänebrechens bis zum fertigen Brikett – unsere Lösungen helfen, Produktionsabfälle in wertvolle Rohstoffe zu verwandeln.\n\n📌 Erfahren Sie mehr über unsere Technologie und wie sie Ihre Prozesse nachhaltiger gestalten kann. Kontaktieren Sie uns!\n\n#Spänebrechen #Metallrecycling #Brikettierung #Ressourcenschonung #Kreislaufwirtschaft",
        "likes": "8",
        "comments": "3",
        "time": {
          "raw": "2ay",
          "parsed": "04.01.2025",
          "isoString": "2025-01-04T08:22:35.325Z"
        },
        "mediaType": "video",
        "mediaContent": {
          "src": [
            {
              "src": "https://dms.licdn.com/playlist/vid/v2/D4E05AQFMwRLRRGnhPQ/mp4-640p-30fp-crf28/mp4-640p-30fp-crf28/0/1733750200235?e=1741683600&v=beta&t=YaCK6VWaZax8KelOJ1oddSjkmuVD3czAon7hcm13cXc",
              "type": "video/mp4",
              "data-bitrate": 739590
            },
            {
              "src": "https://dms.licdn.com/playlist/vid/v2/D4E05AQFMwRLRRGnhPQ/mp4-720p-30fp-crf28/mp4-720p-30fp-crf28/0/1733750200219?e=1741683600&v=beta&t=aHWBYoz8CAZIxhEue6dC8ELQY-TgNWlMyL5QcDWlvRk",
              "type": "video/mp4",
              "data-bitrate": 936983
            }
          ],
          "posterUrl": "https://media.licdn.com/dms/image/v2/D4E05AQFMwRLRRGnhPQ/videocover-low/videocover-low/0/1733750196697?e=1741683600&v=beta&t=RV_lQh7rsjt7-pP7IVakwQVRqnfH_XG5fs9o-6Gum28"
        },
        "date": "2025-01-04T08:22:35.325Z"
      },
      {
        "captions": "🚆 Robust, Reliable, Efficient – Our Rail Breaker! 💪🚄\n\nRecycling rails is no easy task – but the Arno®Break R gets the job done! With incredible power, it quickly and precisely breaks down rails, sleepers, and other bulky metal pieces. The result? Perfectly prepared material for further processing. 🛤️⚙️\n\nWhy choose the Arno®Break R?\n✅ Extremely robust design for the toughest challenges\n✅ High throughput to process large volumes efficiently\n✅ Low energy consumption with maximum performance\n\nWho benefits?\n👉 Recycling companies handling bulky materials\n👉 Steel mills and scrap yards looking for precision and efficiency\n👉 Anyone who demands uncompromising performance in metal recycling\n\n📌 Curious about the Arno®Break R? Let’s explore how it can optimize your recycling operations – contact us today! 👉https://lnkd.in/e7WcupEw\n\n#RailBreaker #MetalRecycling #ScrapProcessing #RecyclingTechnology",
        "likes": "11",
        "comments": "2",
        "shares": "1",
        "time": {
          "raw": "3ay",
          "parsed": "04.12.2024",
          "isoString": "2024-12-04T08:22:35.326Z"
        },
        "mediaType": "video",
        "mediaContent": {
          "src": [
            {
              "src": "https://dms.licdn.com/playlist/vid/v2/D4E05AQFOfGOuqh865g/mp4-640p-30fp-crf28/mp4-640p-30fp-crf28/0/1733159889115?e=1741683600&v=beta&t=EAgjetEzxH5XvpglJ96UTNy1G3Z4YAdzXyHucz26x14",
              "type": "video/mp4",
              "data-bitrate": 534084
            },
            {
              "src": "https://dms.licdn.com/playlist/vid/v2/D4E05AQFOfGOuqh865g/mp4-720p-30fp-crf28/mp4-720p-30fp-crf28/0/1733159889972?e=1741683600&v=beta&t=kq59ussn5NqZFxz_oHXJtQLlAhwNUhB727yGwrvYreE",
              "type": "video/mp4",
              "data-bitrate": 711998
            }
          ],
          "posterUrl": "https://media.licdn.com/dms/image/v2/D4E05AQFOfGOuqh865g/videocover-low/videocover-low/0/1733159884409?e=1741683600&v=beta&t=ggI6ocSGfyf-q7CJVYq3Beut4FyKO20g9ktby8k8AXw"
        },
        "date": "2024-12-04T08:22:35.326Z"
      },
      {
        "captions": "🎥 ATM stellt sich vor – Innovation trifft Erfahrung! 🎥\n\nWer sind wir?\n\n🔧 Produktion, Engineering, Vertrieb – alles aus einer Hand\n\n🌍 Mehr als 80 Jahre Erfahrung und über 1300 Maschinen weltweit im Einsatz\n\n🏆 Teil der ASCO Gruppe und Innovationsführer in der Recyclingindustrie\n\nUnser Motto: \"Der Abschluss eines Projekts ist der Start einer langfristigen Zusammenarbeit\"\n\nUnser Ziel: Gemeinsam mit unseren Kunden nachhaltige Lösungen für die Metallverarbeitung schaffen.\n\n🔧 Von der ersten Idee bis zur Inbetriebnahme Ihrer Maschine – wir begleiten Sie auf jedem Schritt. \n\n👉 Jetzt ansehen und einen Eindruck von unserer Expertise gewinnen!\n\n#ATM #Metallverarbeitung #Recyclingtechnologie #Innovation",
        "likes": "46",
        "shares": "4",
        "time": {
          "raw": "3ay",
          "parsed": "04.12.2024",
          "isoString": "2024-12-04T08:22:35.327Z"
        },
        "mediaType": "video",
        "mediaContent": {
          "src": [
            {
              "src": "https://dms.licdn.com/playlist/vid/v2/D4E05AQE1cbDpQifaWg/mp4-640p-30fp-crf28/mp4-640p-30fp-crf28/0/1732377369731?e=1741683600&v=beta&t=OF4X5gU0Fmtg2EFTfFRTTSRgVgbKh5W5vCRjHpudQa0",
              "type": "video/mp4",
              "data-bitrate": 601235
            },
            {
              "src": "https://dms.licdn.com/playlist/vid/v2/D4E05AQE1cbDpQifaWg/mp4-720p-30fp-crf28/mp4-720p-30fp-crf28/0/1732377370020?e=1741683600&v=beta&t=Tg3vsB774vPw0GyJxEpIJibqiR8I_JBz909qQX4Z_wI",
              "type": "video/mp4",
              "data-bitrate": 798160
            }
          ],
          "posterUrl": "https://media.licdn.com/dms/image/v2/D4E05AQE1cbDpQifaWg/videocover-low/videocover-low/0/1732377359816?e=1741683600&v=beta&t=BKjxWfXBejGnea3FX_T4foPhPbKbeDNO7mxL3Ww0SW0"
        },
        "date": "2024-12-04T08:22:35.327Z"
      },
      {
        "captions": "Rückblick auf die Recy & DepoTech 2024\n\nLetzte Woche hatte ATM Recyclingsystems das Vergnügen, an der Recy & DepoTech 2024 teilzunehmen – einem der wichtigsten Treffpunkte für Recycling- und Ressourcenmanagement. 🌍♻️\n\nBesonders beeindruckt hat uns der Beitrag \"Towards closed material cycles in lithium-ion batteries and PV systems: a sustainable resource approach\" von Eva Gerold. Diese spannenden Ansätze zur Schließung von Materialkreisläufen sind ein zentraler Baustein für die nachhaltige Zukunft, an der wir gemeinsam arbeiten.\n\nWir sind stolz auf unsere langjährige Forschungszusammenarbeit mit der Montanuniversität Leoben, Lehrstuhl für Abfallverwertungstechnik und Abfallwirtschaft, die uns ermöglicht, innovative Technologien zu entwickeln und gemeinsam die Herausforderungen der Kreislaufwirtschaft zu meistern.\n\n👉 Ein großes Dankeschön an alle Vortragenden und Teilnehmenden für die inspirierenden Gespräche und neuen Impulse!\n\n#Kreislaufwirtschaft #RecyDepoTech2024 #MontanuniversitätLeoben #BatteryRecycling Rückblick auf die Recy & DepoTech 2024\n\nLetzte Woche hatte ATM Recyclingsystems das Vergnügen, an der Recy & DepoTech 2024 teilzunehmen – einem der wichtigsten Treffpunkte für Recycling- und Ressourcenmanagement. 🌍♻️\n\nBesonders beeindruckt hat uns der Beitrag \"Towards closed material cycles in lithium-ion batteries and PV systems: a sustainable resource approach\" von Eva Gerold. Diese spannenden Ansätze zur Schließung von Materialkreisläufen sind ein zentraler Baustein für die nachhaltige Zukunft, an der wir gemeinsam arbeiten.\n\nWir sind stolz auf unsere langjährige Forschungszusammenarbeit mit der Montanuniversität Leoben, Lehrstuhl für Abfallverwertungstechnik und Abfallwirtschaft, die uns ermöglicht, innovative Technologien zu entwickeln und gemeinsam die Herausforderungen der Kreislaufwirtschaft zu meistern.\n\n👉 Ein großes Dankeschön an alle Vortragenden und Teilnehmenden für die inspirierenden Gespräche und neuen Impulse!\n\n#Kreislaufwirtschaft #RecyDepoTech2024 #MontanuniversitätLeoben #BatteryRecycling",
        "likes": "28",
        "comments": "2",
        "shares": "2",
        "time": {
          "raw": "3ay",
          "parsed": "04.12.2024",
          "isoString": "2024-12-04T08:22:35.328Z"
        },
        "mediaType": "image",
        "mediaContent": [
          "https://media.licdn.com/dms/image/v2/D4E22AQH2-8ABtODI1w/feedshare-shrink_800/feedshare-shrink_800/0/1732124210162?e=1744243200&v=beta&t=9ZUKphWBy2JauUJVbN8DW00M7QNWPdDOCKCquqVdb7I",
          "https://media.licdn.com/dms/image/v2/D4E22AQHBdmdNiiuH2Q/feedshare-shrink_800/feedshare-shrink_800/0/1732124210108?e=1744243200&v=beta&t=yCTXe4facTz8dxVRMuz_zMBiuZc-Vg1wqM9InZfboFo"
        ],
        "date": "2024-12-04T08:22:35.328Z"
      },
      {
        "captions": "✂️ Präzision und Power – Schrottscheren für die Metallverarbeitung! ✂️\n\nUnsere Schrottscheren sind echte Kraftpakete: Sie zerkleinern Metallreste effizient und bringen sie in die optimale Form für Recyclingprozesse und Schmelzanlagen. Ob Stahlträger, Rohre oder Mischschrott – mit unserer Technologie wird Schrottverarbeitung einfacher und wirtschaftlicher. 💪\n\nWarum unsere Schrottscheren?\n✔️ Hohe Schneidkraft: Selbst härteste Materialien sind kein Problem\n✔️ Effiziente Verarbeitung: Optimale Größe für Lagerung und Transport\n✔️ Robuste Bauweise: Zuverlässigkeit auch unter härtesten Bedingungen\n\nMit unseren Schrottscheren sorgen wir für Effizienz und Nachhaltigkeit in der Schrottwirtschaft – ein unverzichtbares Tool für moderne Metallrecycler. 🌍\n\n👉 Erfahren Sie mehr über unsere ARNO®CUT Schrottscheren:  https://lnkd.in/e7jijgU8\n\n#Schrottscheren #Metallverarbeitung #Recycling #Schrottplatz",
        "likes": "11",
        "comments": "1",
        "shares": "2",
        "time": {
          "raw": "3ay",
          "parsed": "04.12.2024",
          "isoString": "2024-12-04T08:22:35.329Z"
        },
        "mediaType": "video",
        "mediaContent": {
          "src": [
            {
              "src": "https://dms.licdn.com/playlist/vid/v2/D4E05AQHxRa-RtSGc5Q/mp4-640p-30fp-crf28/mp4-640p-30fp-crf28/0/1731836816182?e=1741683600&v=beta&t=JCjw40qg-wQKGCy_bwp7iw_q2ApP1JygIYqATYWuUiI",
              "type": "video/mp4",
              "data-bitrate": 180845
            },
            {
              "src": "https://dms.licdn.com/playlist/vid/v2/D4E05AQHxRa-RtSGc5Q/mp4-720p-30fp-crf28/mp4-720p-30fp-crf28/0/1731836814243?e=1741683600&v=beta&t=XUAAFe1syrKWP8oXmOiLHUklA22JDH1-tZ4dgINGEwA",
              "type": "video/mp4",
              "data-bitrate": 248828
            }
          ],
          "posterUrl": "https://media.licdn.com/dms/image/v2/D4E05AQHxRa-RtSGc5Q/videocover-low/videocover-low/0/1731836807034?e=1741683600&v=beta&t=zH6x7XWOskQmLWs-H-TuPwov2Drqober9Ko3t5u4wRY"
        },
        "date": "2024-12-04T08:22:35.329Z"
      },
      {
        "captions": "📦 Paketieren mit Mehrwert – Effizienz für die Schrottwirtschaft! 📦\n\nUnsere Paketierpressen verwandeln lose Metallschrotte in kompakte, handliche Pakete – ideal für Recyclingbetriebe und Stahlwerke, die Schrott effizient lagern und transportieren wollen. 📦\n\nWas macht unsere Paketiertechnik besonders?\n\nDank hohem Pressdruck und stabiler Bauweise entstehen feste, platzsparende Pakete, die perfekt für den Weitertransport oder die Schmelze vorbereitet sind. So sparen unsere Kunden nicht nur Platz, sondern auch Zeit und Kosten!\n\nPerfekt geeignet für:\n👉 Recyclingunternehmen, die ihre Lagerung optimieren möchten\n👉 Stahlwerke und Gießereien für sauberen, geordneten Schrotteinsatz\n👉 Alle, die in Logistik und Lagerung von Metallschrott Effizienz suchen\n\n📌 Neugierig auf unsere Technologie? Vereinbaren Sie jetzt einen Termin mit uns und erfahren Sie mehr über die Vorteile unserer Paketierpressen! 📌\n\n#Paketierung #Recycling #Schrottwirtschaft #Effizienz #Schrottplatz",
        "likes": "41",
        "comments": "3",
        "shares": "5",
        "time": {
          "raw": "3ay",
          "parsed": "04.12.2024",
          "isoString": "2024-12-04T08:22:35.330Z"
        },
        "mediaType": "video",
        "mediaContent": {
          "src": [
            {
              "src": "https://dms.licdn.com/playlist/vid/v2/D4E05AQEM6NgAkP77yg/mp4-640p-30fp-crf28/mp4-640p-30fp-crf28/0/1731445195700?e=1741683600&v=beta&t=YIJXtwldu75KbWCPH9sJpyQtGElZCxjpQyH-KpTV278",
              "type": "video/mp4",
              "data-bitrate": 706686
            },
            {
              "src": "https://dms.licdn.com/playlist/vid/v2/D4E05AQEM6NgAkP77yg/mp4-720p-30fp-crf28/mp4-720p-30fp-crf28/0/1731445195897?e=1741683600&v=beta&t=BpPe4GcpV_nP6smbblGDKIMz4yAArEpc_5q3k5p6J6Q",
              "type": "video/mp4",
              "data-bitrate": 999884
            }
          ],
          "posterUrl": "https://media.licdn.com/dms/image/v2/D4E05AQEM6NgAkP77yg/videocover-low/videocover-low/0/1731445175638?e=1741683600&v=beta&t=JXT3gX06an83btj-B8L8g5b_VHBUuCQSUyyX1d2xZYU"
        },
        "date": "2024-12-04T08:22:35.330Z"
      },
      {
        "captions": "🌍 Effizientes Recycling beginnt bei der Brikettierung 🌍\n\nUnsere Brikettierpressen sind wahre Effizienz-Booster für Recycler, Stahlwerke und Gießereien. Doch wie genau funktioniert die Brikettierung?\n\n💥 Funktionsweise: Die Maschine presst Metallspäne unter hohem Druck zu kompakten Briketts zusammen. So wird das Volumen drastisch reduziert und eine saubere, hochwertige Form geschaffen, die einfach weiterverarbeitet werden kann.\n\n🔍 Vorteile für unsere Kunden:\n\n🔹 Kompakte Briketts: Bis zu 90 % Volumenreduktion sorgt für optimierte Lagerung und Transporteinsparungen.\n🔹 Wertvolle Rohstoffrückgewinnung: Durch die Verdichtung wird das Abtropfen von Restölen minimiert – das steigert die Qualität und den Wert des Materials.\n🔹 Nachhaltigkeit und Effizienz: Mit weniger Lagerplatz und Transportkosten leisten unsere Pressen einen aktiven Beitrag zu einem umweltfreundlicheren Recyclingprozess.\n\n👉 Mehr erfahren: https://lnkd.in/egNBmVnQ\n\n#Brikettierung #RecyclingTechnologie #Metallrecycling #Nachhaltigkeit #Maschinenbau #Technologie\n🌍 Effizientes Recycling beginnt bei der Brikettierung 🌍\n\nUnsere Brikettierpressen sind wahre Effizienz-Booster für Recycler, Stahlwerke und Gießereien. Doch wie genau funktioniert die Brikettierung?\n\n💥 Funktionsweise: Die Maschine presst Metallspäne unter hohem Druck zu kompakten Briketts zusammen. So wird das Volumen drastisch reduziert und eine saubere, hochwertige Form geschaffen, die einfach weiterverarbeitet werden kann.\n\n🔍 Vorteile für unsere Kunden:\n\n🔹 Kompakte Briketts: Bis zu 90 % Volumenreduktion sorgt für optimierte Lagerung und Transporteinsparungen.\n🔹 Wertvolle Rohstoffrückgewinnung: Durch die Verdichtung wird das Abtropfen von Restölen minimiert – das steigert die Qualität und den Wert des Materials.\n🔹 Nachhaltigkeit und Effizienz: Mit weniger Lagerplatz und Transportkosten leisten unsere Pressen einen aktiven Beitrag zu einem umweltfreundlicheren Recyclingprozess.\n\n👉 Mehr erfahren: https://lnkd.in/egNBmVnQ\n\n#Brikettierung #RecyclingTechnologie #Metallrecycling #Nachhaltigkeit #Maschinenbau #Technologie",
        "likes": "15",
        "comments": "1",
        "shares": "2",
        "time": {
          "raw": "3ay",
          "parsed": "04.12.2024",
          "isoString": "2024-12-04T08:22:35.332Z"
        },
        "mediaType": "image",
        "mediaContent": [
          "https://media.licdn.com/dms/image/v2/D4E22AQH9Xl_1343_0w/feedshare-shrink_800/feedshare-shrink_800/0/1731052580991?e=1744243200&v=beta&t=tjFxhkBo6qSjhjlQ5KZMRhAIRKP_hjVWdlJyz6r1AXQ",
          "https://media.licdn.com/dms/image/v2/D4E22AQFUHSuXMo7nig/feedshare-shrink_800/feedshare-shrink_800/0/1731052567831?e=1744243200&v=beta&t=8VjSdNebeHT6n0f7NCeVhXr9zu885FwEX2WkR2mo1uQ",
          "https://media.licdn.com/dms/image/v2/D4E22AQGTY5R82ZnvwA/feedshare-shrink_800/feedshare-shrink_800/0/1731052562429?e=1744243200&v=beta&t=Qc4mOjn5ysI-V6JkT1VyZ6Zq-lwG0PjAqdQinEWkGRw"
        ],
        "date": "2024-12-04T08:22:35.332Z"
      },
      {
        "captions": "🔧📦 Wir sind dabei! Auf dem BDSV-Branchentreff in München stellen wir unsere Lösungen für die Recycling-Industrie vor.\nAuch wenn wir vor Ort keine Maschinen zeigen, freuen wir uns darauf, mit Ihnen über unsere Brikettierpressen, Paketierpressen und Schrottscheren zu sprechen und zu zeigen, wie unsere Technologien die Effizienz und Nachhaltigkeit im Stahlrecycling steigern.\n🔍 Besuchen Sie uns im 2. OG, Stand 8 für spannende Gespräche und um mehr über unsere innovativen Lösungen zu erfahren – wir freuen uns auf den Austausch!\nBDSV Bundesvereinigung Deutscher Stahlrecycling- und Entsorgungsunternehmen e. V. \n📅 Datum: 09.10 - 10.10.2024\n#Recycling #Metallrecycling #BDSV #Nachhaltigkeit #Innovation🔧📦 Wir sind dabei! Auf dem BDSV-Branchentreff in München stellen wir unsere Lösungen für die Recycling-Industrie vor.\nAuch wenn wir vor Ort keine Maschinen zeigen, freuen wir uns darauf, mit Ihnen über unsere Brikettierpressen, Paketierpressen und Schrottscheren zu sprechen und zu zeigen, wie unsere Technologien die Effizienz und Nachhaltigkeit im Stahlrecycling steigern.\n🔍 Besuchen Sie uns im 2. OG, Stand 8 für spannende Gespräche und um mehr über unsere innovativen Lösungen zu erfahren – wir freuen uns auf den Austausch!\nBDSV Bundesvereinigung Deutscher Stahlrecycling- und Entsorgungsunternehmen e. V. \n📅 Datum: 09.10 - 10.10.2024\n#Recycling #Metallrecycling #BDSV #Nachhaltigkeit #Innovation",
        "likes": "5",
        "shares": "2",
        "time": {
          "raw": "4ay",
          "parsed": "04.11.2024",
          "isoString": "2024-11-04T08:22:35.346Z"
        },
        "mediaType": "image",
        "mediaContent": [
          "https://media.licdn.com/dms/image/v2/D4E22AQHVIV6222pr8w/feedshare-shrink_2048_1536/feedshare-shrink_2048_1536/0/1728369013876?e=1744243200&v=beta&t=EJT-cStwn5FjHvfy2QlFdUC17Kc2lmmmA2GMA8h_hkM"
        ],
        "date": "2024-11-04T08:22:35.346Z"
      },
      {
        "captions": "Die duale Berufsausbildung ist entscheidend für d...",
        "likes": "1",
        "time": {
          "raw": "5ay",
          "parsed": "04.10.2024",
          "isoString": "2024-10-04T08:22:35.349Z"
        },
        "mediaType": "other",
        "date": "2024-10-04T08:22:35.349Z"
      },
      {
        "captions": "Eine Delegation des Wirtschaftsbundes, angeführt ...",
        "likes": "4",
        "time": {
          "raw": "6ay",
          "parsed": "04.09.2024",
          "isoString": "2024-09-04T08:22:35.351Z"
        },
        "mediaType": "other",
        "date": "2024-09-04T08:22:35.351Z"
      },
      {
        "captions": "Die ATM Recyclingsystems GmbH hat die Metal Recycl...",
        "likes": "10",
        "time": {
          "raw": "8ay",
          "parsed": "04.07.2024",
          "isoString": "2024-07-04T08:22:35.351Z"
        },
        "mediaType": "other",
        "date": "2024-07-04T08:22:35.351Z"
      },
      {
        "captions": "ATM Recyclingsystems GmbH entwickelt, fertigt und ...",
        "likes": "2",
        "time": {
          "raw": "8ay",
          "parsed": "04.07.2024",
          "isoString": "2024-07-04T08:22:35.352Z"
        },
        "mediaType": "other",
        "date": "2024-07-04T08:22:35.352Z"
      },
      {
        "captions": "🚗♻️ Excited to be part of IARC 2025!\n\nATM Recyclingsystems is thrilled to join the 24th International Automotive Recycling Congress (IARC 2025) in Antwerp from March 19-21, 2025! 🔄🚀\n\nLooking forward to insightful discussions, productive meetings, and connecting with industry leaders shaping the future of circularity and automotive recycling.\n\n🔜 See you in Antwerp!\n\n#IARC #ICM #CircularEconomy #AutomotiveRecycling #SustainableRecycling",
        "likes": "1",
        "time": {
          "raw": "1s",
          "parsed": "04.03.2025",
          "isoString": "2025-03-04T07:22:35.315Z"
        },
        "mediaType": "other",
        "date": "2025-03-04T07:22:35.315Z"
      }
    ]
  },
  {
    "name": "IngBonfiglioli",
    "followerData": [
      [
        20250225,
        1247
      ],
      [
        20250225,
        1247
      ],
      [
        20250225,
        1247
      ],
      [
        20250228,
        1249
      ],
      [
        20250228,
        1249
      ],
      [
        20250228,
        1249
      ],
      [
        20250228,
        1249
      ],
      [
        20250303,
        1251
      ],
      [
        1741011580872,
        "1.251"
      ],
      [
        1741076571083,
        "1.251"
      ]
    ],
    "data": [
      {
        "captions": "#ingbonfiglioli #squalo1000 #mobilitymatter #allovertheworld #mostpowerfulshears",
        "likes": "4",
        "time": {
          "raw": "1h",
          "parsed": "25.02.2025",
          "isoString": "2025-02-25T08:22:50.852Z"
        },
        "mediaType": "video",
        "mediaContent": {
          "src": [
            {
              "src": "https://dms.licdn.com/playlist/vid/v2/D4D05AQHIgJVRDBZkUw/mp4-720p-30fp-crf28/B4DZU7QgaRG8Bk-/0/1740456227032?e=1741683600&v=beta&t=v3DEhiOEfdrnfaBO9U4v6ezlwEVW8vAbU8tx40Znp9k",
              "type": "video/mp4",
              "data-bitrate": 1063619
            },
            {
              "src": "https://dms.licdn.com/playlist/vid/v2/D4D05AQHIgJVRDBZkUw/mp4-640p-30fp-crf28/B4DZU7QgaRG8Bg-/0/1740456222968?e=1741683600&v=beta&t=fIZyVK-l3g5Vwj5YSwOW-Sk_qfGFTiWjgjj4oxOe6hU",
              "type": "video/mp4",
              "data-bitrate": 817531
            }
          ],
          "posterUrl": "https://media.licdn.com/dms/image/v2/D4D05AQHIgJVRDBZkUw/videocover-low/B4DZU7QgaRG8CQ-/0/1740456210568?e=1741683600&v=beta&t=cuXSYrpluQs8Cild4AWEORqXARpRijBsNJxSVLsyBNs"
        },
        "date": "2025-02-25T08:22:50.852Z"
      },
      {
        "captions": "Ing,Bonfiglioli SQUALO 4000 Vertical Inclined Shear on duty in New Mexico - USA.  #nomercy #thebeast #mostpowerfulshear #hms #ingbonfiglioli #nocompromises #allovertheworldIng,Bonfiglioli SQUALO 4000 Vertical Inclined Shear on duty in New Mexico - USA.  #nomercy #thebeast #mostpowerfulshear #hms #ingbonfiglioli #nocompromises #allovertheworld",
        "likes": "2",
        "shares": "1",
        "time": {
          "raw": "1h",
          "parsed": "25.02.2025",
          "isoString": "2025-02-25T08:22:50.853Z"
        },
        "mediaType": "image",
        "mediaContent": [
          "https://media.licdn.com/dms/image/v2/D4D22AQGqJMZzvf5ngg/feedshare-shrink_800/B4DZU7P_NwG8Ag-/0/1740455802087?e=1744243200&v=beta&t=sxsIEAGQtSVq8B5M2d5fUlRti0JTa0XW1qCtpeTOJGI"
        ],
        "date": "2025-02-25T08:22:50.853Z"
      },
      {
        "captions": "Ing.Bonfiglioli SQUALO 2000 High Speed Vertical Inclined Shear running in the cold winter of Colorado - USA. #wintertime #ingbonfiglioli #mostpowerfulshears #onestepahead #builtolastIng.Bonfiglioli SQUALO 2000 High Speed Vertical Inclined Shear running in the cold winter of Colorado - USA. #wintertime #ingbonfiglioli #mostpowerfulshears #onestepahead #builtolast",
        "likes": "3",
        "time": {
          "raw": "1h",
          "parsed": "25.02.2025",
          "isoString": "2025-02-25T08:22:50.855Z"
        },
        "mediaType": "image",
        "mediaContent": [
          "https://media.licdn.com/dms/image/v2/D4D22AQG4GxOFKtnHZg/feedshare-shrink_800/B4DZU7Krk3GkAg-/0/1740454413928?e=1744243200&v=beta&t=_sxcm4_aexIu9l7AuuIOCVdZbZa2esTKc4u4iNo_PUY"
        ],
        "date": "2025-02-25T08:22:50.855Z"
      },
      {
        "captions": "#ingbonfiglioli #scrapmetalrecycling #onestepahead #allovertheworld",
        "likes": "3",
        "time": {
          "raw": "1h",
          "parsed": "25.02.2025",
          "isoString": "2025-02-25T08:22:50.856Z"
        },
        "mediaType": "video",
        "mediaContent": {
          "src": [
            {
              "src": "https://dms.licdn.com/playlist/vid/v2/D4D05AQGkqmsqEyJuYg/mp4-640p-30fp-crf28/B4DZUrnrSaGkBg-/0/1740193578763?e=1741683600&v=beta&t=S8mm2lQqUDXUa19Ilbh3zhkRjd7mp6HaqlCJSx0y-wg",
              "type": "video/mp4",
              "data-bitrate": 678474
            },
            {
              "src": "https://dms.licdn.com/playlist/vid/v2/D4D05AQGkqmsqEyJuYg/mp4-720p-30fp-crf28/B4DZUrnrSaGkBk-/0/1740193578886?e=1741683600&v=beta&t=wrtS7vSIydXQF35lbLSg-gsqi4-nkemUSr_gtSX6Nnw",
              "type": "video/mp4",
              "data-bitrate": 871887
            }
          ],
          "posterUrl": "https://media.licdn.com/dms/image/v2/D4D05AQGkqmsqEyJuYg/videocover-high/B4DZUrnrSaGkBw-/0/1740193577943?e=1741683600&v=beta&t=ButAQmZW1GiPTIT4RLUF7KqPJIPaXsJoKh_8oI_nlpo"
        },
        "date": "2025-02-25T08:22:50.856Z"
      },
      {
        "captions": "It's a good winter morning for chopping up material in Colorado - USA for the Ing.Bonfiglioli SQUALO 3000 Vertical Inclined Shear. #northamericanfamily #ingbonfiglioli #allovertheworld #mostpowerfulshears #nocompromisesIt's a good winter morning for chopping up material in Colorado - USA for the Ing.Bonfiglioli SQUALO 3000 Vertical Inclined Shear. #northamericanfamily #ingbonfiglioli #allovertheworld #mostpowerfulshears #nocompromises",
        "likes": "5",
        "time": {
          "raw": "1h",
          "parsed": "25.02.2025",
          "isoString": "2025-02-25T08:22:50.857Z"
        },
        "mediaType": "image",
        "mediaContent": [
          "https://media.licdn.com/dms/image/v2/D4E22AQHPmAgv8Hm6qA/feedshare-shrink_800/B4EZUofKUmHgAk-/0/1740141013899?e=1744243200&v=beta&t=ppHx_kaFptyknd6QP2eXMHPUopF-pESAG4SKaMHPwbY"
        ],
        "date": "2025-02-25T08:22:50.857Z"
      },
      {
        "captions": "Ing.Bonfiglioli DRAKE 10 Hammermill Shredder on duty in New Zealand. #kiwifamily #ingbonfiglioli #allovertheworld #onestepahead #shreddingtherightway",
        "likes": "2",
        "time": {
          "raw": "1h",
          "parsed": "25.02.2025",
          "isoString": "2025-02-25T08:22:50.858Z"
        },
        "mediaType": "video",
        "mediaContent": {
          "src": [
            {
              "src": "https://dms.licdn.com/playlist/vid/v2/D4D05AQFXfiTLL_n_6Q/mp4-640p-30fp-crf28/B4DZUmZNVGGcBc-/0/1740105900696?e=1741683600&v=beta&t=f3tkt2ZJ1odPDSASIW8j4qDeahv50WiZcJhP0Kxzwq8",
              "type": "video/mp4",
              "data-bitrate": 837841
            }
          ],
          "posterUrl": "https://media.licdn.com/dms/image/v2/D4D05AQFXfiTLL_n_6Q/videocover-high/B4DZUmZNVGGcBs-/0/1740105899495?e=1741683600&v=beta&t=4D6Gx0GcChmocvJQNlzg4Wn8_Ed82h358dYHL4pup10"
        },
        "date": "2025-02-25T08:22:50.858Z"
      },
      {
        "captions": "Ing.Bonfiglioli SQUALO 2000 High Speed Vertical Inclined Shear running in Utah - USA. #northamericanfamily #aljon #ingbonfiglioli #mostpowerfulshears #nocompromisesIng.Bonfiglioli SQUALO 2000 High Speed Vertical Inclined Shear running in Utah - USA. #northamericanfamily #aljon #ingbonfiglioli #mostpowerfulshears #nocompromises",
        "likes": "1",
        "time": {
          "raw": "1h",
          "parsed": "25.02.2025",
          "isoString": "2025-02-25T08:22:50.859Z"
        },
        "mediaType": "image",
        "mediaContent": [
          "https://media.licdn.com/dms/image/v2/D4D22AQGLjnpMEvAPUA/feedshare-shrink_800/B4DZUd9QNfHkAk-/0/1739964352323?e=1744243200&v=beta&t=j9JSyTgUY3SmYyK_bBMs3PHPZEPB4ftM8qeGX8lHnJw"
        ],
        "date": "2025-02-25T08:22:50.859Z"
      },
      {
        "captions": "#ingbonfiglioli #aussiefamily #drake #shreddingtherightway #squalo #mostpowerfulshears",
        "likes": "4",
        "time": {
          "raw": "1h",
          "parsed": "25.02.2025",
          "isoString": "2025-02-25T08:22:50.860Z"
        },
        "mediaType": "video",
        "mediaContent": {
          "src": [
            {
              "src": "https://dms.licdn.com/playlist/vid/v2/D4D05AQFPeTE4vC5Eog/mp4-720p-30fp-crf28/B4DZUd8nE8GkBg-/0/1739964192084?e=1741683600&v=beta&t=PJG_YuVhEA4c9xUHF3wUUPBv-Z1vChZ1GP-LLpXr84Y",
              "type": "video/mp4",
              "data-bitrate": 1393147
            },
            {
              "src": "https://dms.licdn.com/playlist/vid/v2/D4D05AQFPeTE4vC5Eog/mp4-640p-30fp-crf28/B4DZUd8nE8GkBc-/0/1739964192367?e=1741683600&v=beta&t=nERs7V-EtEbfkgtT20QM1aN38coUc_sHaTzeyQQYIwQ",
              "type": "video/mp4",
              "data-bitrate": 1083446
            }
          ],
          "posterUrl": "https://media.licdn.com/dms/image/v2/D4D05AQFPeTE4vC5Eog/videocover-low/B4DZUd8nE8GkCM-/0/1739964186411?e=1741683600&v=beta&t=4x7baGZyvjWygmLW6jKJhojbKpR6zwJFi4U0-HXOhuk"
        },
        "date": "2025-02-25T08:22:50.860Z"
      },
      {
        "captions": "Installation in progress in the United States for another Ing.Bonfiglioli SQUALO 4000 Vertical Inclined Shear. More units on the way soon, stay tuned.\n#ingbonfiglioli #aljon #northamericanfamily #mostpowerfulshear #thebeast #nomercyInstallation in progress in the United States for another Ing.Bonfiglioli SQUALO 4000 Vertical Inclined Shear. More units on the way soon, stay tuned.\n#ingbonfiglioli #aljon #northamericanfamily #mostpowerfulshear #thebeast #nomercy",
        "likes": "2",
        "time": {
          "raw": "2h",
          "parsed": "18.02.2025",
          "isoString": "2025-02-18T08:22:50.861Z"
        },
        "mediaType": "image",
        "mediaContent": [
          "https://media.licdn.com/dms/image/v2/D4D22AQFMW4qHg8COEQ/feedshare-shrink_800/B4DZUNsMNzGcAg-/0/1739691444520?e=1744243200&v=beta&t=QI3vcSHvTR2dE-iPJH3D608VFOcrZ8IvrcvRAEOOJ5s"
        ],
        "date": "2025-02-18T08:22:50.861Z"
      },
      {
        "captions": "Full throttle production at the factory this week! The family keeps growing...stay tuned for more!\n#ingbonfiglioli #allovertheworld\n#scrapmetalrecycling #onestepaheadFull throttle production at the factory this week! The family keeps growing...stay tuned for more!\n#ingbonfiglioli #allovertheworld\n#scrapmetalrecycling #onestepahead",
        "likes": "1",
        "shares": "1",
        "time": {
          "raw": "3h",
          "parsed": "11.02.2025",
          "isoString": "2025-02-11T08:22:50.862Z"
        },
        "mediaType": "image",
        "mediaContent": [
          "https://media.licdn.com/dms/image/v2/D4D22AQF8G16wcqLQTA/feedshare-shrink_800/B4DZTgzwwsGcAg-/0/1738938455741?e=1744243200&v=beta&t=5w4fdw1z_W0A1orV1vOi6fbUvi99HVnWRICVX3zxV2U"
        ],
        "date": "2025-02-11T08:22:50.862Z"
      },
      {
        "captions": "Next level shredding. No compromises. #ingbonfiglioli #metalrecycling #shreddingtherightway",
        "likes": "2",
        "shares": "1",
        "time": {
          "raw": "3h",
          "parsed": "11.02.2025",
          "isoString": "2025-02-11T08:22:50.863Z"
        },
        "mediaType": "video",
        "mediaContent": {
          "src": [
            {
              "src": "https://dms.licdn.com/playlist/vid/v2/D4E05AQGDdibTlT6Kdg/mp4-640p-30fp-crf28/B4EZTUGeHfHUBc-/0/1738725267452?e=1741683600&v=beta&t=ZSKNcx9_aGwWdKz8NnlrH5yUd-9QhkInx8EbTGasau8",
              "type": "video/mp4",
              "data-bitrate": 1103392
            },
            {
              "src": "https://dms.licdn.com/playlist/vid/v2/D4E05AQGDdibTlT6Kdg/mp4-720p-30fp-crf28/B4EZTUGeHfHUBg-/0/1738725268088?e=1741683600&v=beta&t=uycHElamWQgGgoT-5Bl0aMZm0D0Smb5szKczz-ILAII",
              "type": "video/mp4",
              "data-bitrate": 1417703
            }
          ],
          "posterUrl": "https://media.licdn.com/dms/image/v2/D4E05AQGDdibTlT6Kdg/videocover-high/B4EZTUGeHfHUBs-/0/1738725264487?e=1741683600&v=beta&t=Xp0TpHdmVkOI8uU1ZtGekLC-KQwGTC6bg7AfKzOA7HM"
        },
        "date": "2025-02-11T08:22:50.863Z"
      },
      {
        "captions": "Ing.Bonfiglioli ARIETE portable baler on duty in Europe. #Ingbonfiglioli #scrapmetalrecycling #mobilitymatter #allovertheworldIng.Bonfiglioli ARIETE portable baler on duty in Europe. #Ingbonfiglioli #scrapmetalrecycling #mobilitymatter #allovertheworld",
        "likes": "4",
        "time": {
          "raw": "3h",
          "parsed": "11.02.2025",
          "isoString": "2025-02-11T08:22:50.864Z"
        },
        "mediaType": "image",
        "mediaContent": [
          "https://media.licdn.com/dms/image/v2/D4E22AQE_mwdGbNo2Fg/feedshare-shrink_2048_1536/B4EZTUGAMzHgAs-/0/1738725131720?e=1744243200&v=beta&t=JA9Du8Zc6BFm_9K9-Sveczge3xTzP9UYtS1V0EEzFO0"
        ],
        "date": "2025-02-11T08:22:50.864Z"
      },
      {
        "captions": "It's a good morning for this Ing.Bonfiglioli SQUALO 2000 High Speed Inclined Shear running in South America. #thesqualo #onestepahead #ingbonfiglioli #mobilitymatter #mostpowerfulshears",
        "likes": "1",
        "shares": "1",
        "time": {
          "raw": "3h",
          "parsed": "11.02.2025",
          "isoString": "2025-02-11T08:22:50.865Z"
        },
        "mediaType": "video",
        "mediaContent": {
          "src": [
            {
              "src": "https://dms.licdn.com/playlist/vid/v2/D4E05AQHZoEbL1oGQzQ/mp4-640p-30fp-crf28/B4EZTUFuwXGgBc-/0/1738725064507?e=1741683600&v=beta&t=B6aXkkvhSsPEsTaQIBA1-JgVF2Soqe7nR2qtQ51VXQE",
              "type": "video/mp4",
              "data-bitrate": 625804
            }
          ],
          "posterUrl": "https://media.licdn.com/dms/image/v2/D4E05AQHZoEbL1oGQzQ/videocover-low/B4EZTUFuwXGgCM-/0/1738725062676?e=1741683600&v=beta&t=7WyY_F669TEc71LmUqfQT3yY4s2j8gvV6fXXu1ie-c4"
        },
        "date": "2025-02-11T08:22:50.865Z"
      },
      {
        "captions": "Ing.Bonfiglioli DRAKE 16 HP Hammermill Shredder running in South America.\n#ingbonfiglioli #shreddingtherightway #allovertheworld #onestepahead",
        "likes": "8",
        "shares": "1",
        "time": {
          "raw": "1ay",
          "parsed": "04.02.2025",
          "isoString": "2025-02-04T08:22:50.866Z"
        },
        "mediaType": "video",
        "mediaContent": {
          "src": [
            {
              "src": "https://dms.licdn.com/playlist/vid/v2/D4D05AQHmuOOBvh7QNg/mp4-640p-30fp-crf28/B4DZS_5MvyG4Bc-/0/1738386235937?e=1741683600&v=beta&t=n8Iuwdh7mVEJamv1FRB5UclainWM6mpaWrEtXhURJOw",
              "type": "video/mp4",
              "data-bitrate": 519468
            }
          ],
          "posterUrl": "https://media.licdn.com/dms/image/v2/D4D05AQHmuOOBvh7QNg/videocover-high/B4DZS_5MvyG4Bs-/0/1738386234505?e=1741683600&v=beta&t=n8RkmYt13rFSOsXM36JyZKNZJKOb2OjMrRLYXab_52o"
        },
        "date": "2025-02-04T08:22:50.866Z"
      },
      {
        "captions": "Ing.Bonfiglioli SQUALO 3000 Vertical Inclined Shear working in Ontario - Canada. #northamericanfamily #mostpowerfulshears #nocompromises #allovertheworld #onestepaheadIng.Bonfiglioli SQUALO 3000 Vertical Inclined Shear working in Ontario - Canada. #northamericanfamily #mostpowerfulshears #nocompromises #allovertheworld #onestepahead",
        "likes": "4",
        "time": {
          "raw": "1ay",
          "parsed": "04.02.2025",
          "isoString": "2025-02-04T08:22:50.867Z"
        },
        "mediaType": "image",
        "mediaContent": [
          "https://media.licdn.com/dms/image/v2/D4D22AQHRaCMJw7kCHw/feedshare-shrink_800/B4DZSrFSdtHUAg-/0/1738037078586?e=1744243200&v=beta&t=NAJ9kq9Z0a2ehCmUu-RQmYa-KuBF1xBwBOliPxRYD1s"
        ],
        "date": "2025-02-04T08:22:50.867Z"
      },
      {
        "captions": "Ing.Bonfiglioli ARIETE portable baler ready for another productive day in this recycling facility in Tasmania - Australia. #aussiefamily #mobilityisthekey #scrapmetalrecycling Ing.Bonfiglioli ARIETE portable baler ready for another productive day in this recycling facility in Tasmania - Australia. #aussiefamily #mobilityisthekey #scrapmetalrecycling",
        "likes": "1",
        "time": {
          "raw": "1ay",
          "parsed": "04.02.2025",
          "isoString": "2025-02-04T08:22:50.868Z"
        },
        "mediaType": "image",
        "mediaContent": [
          "https://media.licdn.com/dms/image/v2/D4D22AQH8K-qXrwIIUA/feedshare-shrink_800/B4DZSrDk73HIAk-/0/1738036639064?e=1744243200&v=beta&t=TX3p58HT9TN-RNoJ-6GZ-8hu0rkprD3jG0_PfxW62cE"
        ],
        "date": "2025-02-04T08:22:50.868Z"
      },
      {
        "captions": "Ing.Bonfiglioli SQUALO 1500 Vertical Inclined Shear running in Sweden. #ingbonfiglioli #nocompromises #mostpowerfulshears #allovertheworld",
        "likes": "2",
        "time": {
          "raw": "1ay",
          "parsed": "04.02.2025",
          "isoString": "2025-02-04T08:22:50.869Z"
        },
        "mediaType": "video",
        "mediaContent": {
          "src": [
            {
              "src": "https://dms.licdn.com/playlist/vid/v2/D4D05AQGlHWSS3PAHqg/mp4-640p-30fp-crf28/B4DZSrDFvfHABg-/0/1738036525529?e=1741683600&v=beta&t=WyB2rfUbQ6a3She6hQpA7xydhc2QykHyKU8WJ6eOHBg",
              "type": "video/mp4",
              "data-bitrate": 1058201
            },
            {
              "src": "https://dms.licdn.com/playlist/vid/v2/D4D05AQGlHWSS3PAHqg/mp4-720p-30fp-crf28/B4DZSrDFvfHABk-/0/1738036526001?e=1741683600&v=beta&t=t_m3UsLKjBG9oXHAgJ9UiiPRYlvp7YidnLUgxpa5OQs",
              "type": "video/mp4",
              "data-bitrate": 1380911
            }
          ],
          "posterUrl": "https://media.licdn.com/dms/image/v2/D4D05AQGlHWSS3PAHqg/videocover-low/B4DZSrDFvfHACQ-/0/1738036521871?e=1741683600&v=beta&t=GzROr5KCrmmcjBT_kAsouUFPUXjdngUGItM-yQ-MKQ4"
        },
        "date": "2025-02-04T08:22:50.869Z"
      },
      {
        "captions": "Ing.Bonfiglioli SQUALO 3000 Vertical Inclined Shear working in Oregon - USA this week.  #northamericanfamily #ingbonfiglioli #mostpowerfulshears #mobilityisthekeyIng.Bonfiglioli SQUALO 3000 Vertical Inclined Shear working in Oregon - USA this week.  #northamericanfamily #ingbonfiglioli #mostpowerfulshears #mobilityisthekey",
        "likes": "3",
        "time": {
          "raw": "1ay",
          "parsed": "04.02.2025",
          "isoString": "2025-02-04T08:22:50.870Z"
        },
        "mediaType": "image",
        "mediaContent": [
          "https://media.licdn.com/dms/image/v2/D4D22AQG6xNBafc20EQ/feedshare-shrink_800/B4DZShAL_cHkAo-/0/1737867971280?e=1744243200&v=beta&t=ycnwFq6sM9VKQXFMIdjG0aNhcCaXaWCaZbnyxyENkDU"
        ],
        "date": "2025-02-04T08:22:50.870Z"
      },
      {
        "captions": "Nice top view for the yard of one of our customers in Eastern Europe running the Ing.Bonfiglioli DRAKE 16 HP Hammermill Shredder. Top productivity at the lowest running cost on its category! #ingbonfiglioli #shreddingtherightway #allovertheworldNice top view for the yard of one of our customers in Eastern Europe running the Ing.Bonfiglioli DRAKE 16 HP Hammermill Shredder. Top productivity at the lowest running cost on its category! #ingbonfiglioli #shreddingtherightway #allovertheworld",
        "likes": "5",
        "shares": "1",
        "time": {
          "raw": "1ay",
          "parsed": "04.02.2025",
          "isoString": "2025-02-04T08:22:50.872Z"
        },
        "mediaType": "image",
        "mediaContent": [
          "https://media.licdn.com/dms/image/v2/D4D22AQG9vTRETd7x5Q/feedshare-shrink_800/B4DZSg.2jfHIAk-/0/1737867618937?e=1744243200&v=beta&t=IGgtFNeanWuU2DBoYyMru7nfCGK9JbI57g28TB9HzJI"
        ],
        "date": "2025-02-04T08:22:50.872Z"
      },
      {
        "captions": "Ing.Bonfiglioli SQUALO 3000 Vertical Inclined Shear in operation in a top company in Saudi Arabia. #nocompromises #mostpowerfulshears #onestepahead #heavydutyshear #ingbonfiglioli",
        "likes": "6",
        "comments": "1",
        "time": {
          "raw": "1ay",
          "parsed": "04.02.2025",
          "isoString": "2025-02-04T08:22:50.873Z"
        },
        "mediaType": "video",
        "mediaContent": {
          "src": [
            {
              "src": "https://dms.licdn.com/playlist/vid/v2/D4D05AQGM5XBhnMUgpQ/mp4-640p-30fp-crf28/B4DZSg9ZX8H0Bc-/0/1737867244558?e=1741683600&v=beta&t=7q3akETkJ0cr9Df2GneXCll14Y7djXaUtT7W7gZgwXE",
              "type": "video/mp4",
              "data-bitrate": 944895
            }
          ],
          "posterUrl": "https://media.licdn.com/dms/image/v2/D4D05AQGM5XBhnMUgpQ/videocover-high/B4DZSg9ZX8H0Bs-/0/1737867240443?e=1741683600&v=beta&t=x4238l_607KfS_Apqxu6VdcoI70qH3Z1TbTXnyIp9BI"
        },
        "date": "2025-02-04T08:22:50.873Z"
      }
    ]
  },
  {
    "name": "GPSScrapProcessingSolutions",
    "followerData": [
      [
        20250225,
        1026
      ],
      [
        20250225,
        1026
      ],
      [
        20250225,
        1026
      ],
      [
        20250228,
        1027
      ],
      [
        20250228,
        1027
      ],
      [
        20250228,
        1027
      ],
      [
        20250228,
        1027
      ],
      [
        20250303,
        1028
      ],
      [
        1741011597330,
        "1.028"
      ],
      [
        1741076589688,
        "1.028"
      ]
    ],
    "data": [
      {
        "captions": "BEFORE/AFTER - The transformation begins here.\n\n⚙️ Processing: from bulky scrap to a compact bale or log, ready for recycling.\n🔥 Zero waste, maximum gain.\n\nWith GPS Recycling machines:\n-Efficient and fast recovery.\n-Space optimization with compact bales.\n-A new life for every material, improving margins.\n\nWhat more do you want?BEFORE/AFTER - The transformation begins here.\n\n⚙️ Processing: from bulky scrap to a compact bale or log, ready for recycling.\n🔥 Zero waste, maximum gain.\n\nWith GPS Recycling machines:\n-Efficient and fast recovery.\n-Space optimization with compact bales.\n-A new life for every material, improving margins.\n\nWhat more do you want?",
        "likes": "2",
        "time": {
          "raw": "5g",
          "parsed": "27.02.2025",
          "isoString": "2025-02-27T08:23:09.421Z"
        },
        "mediaType": "image",
        "mediaContent": [
          "https://media.licdn.com/dms/image/v2/D5610AQE392NKQfUwUQ/image-shrink_800/B56ZVGa79zHEAc-/0/1740643222475?e=1741683600&v=beta&t=4ZbCv_VdObSJK0IC8o0PEY30Sl9ICGBNf7wf55ItdNk"
        ],
        "date": "2025-02-27T08:23:09.421Z"
      },
      {
        "captions": "💥UNRIVALED EFFICIENCY RECOVERY💥\n\nDefective cans and production waste are not a problem. The problem is managing them poorly.\nWith the the automatic balers:\n-#100% recycling directly in the production line.\n-Clean material ready for the foundry without additional steps.\n-Reduce time, increase #gains.\nIf you want speed, quality and zero #waste, this is not just a machine: it's your competitive advantage.\nDon't settle: dominate the production cycle with GPS Recycling.\n\n🔗 Find out how to revolutionize your line: https://lnkd.in/djNSDEet💥UNRIVALED EFFICIENCY RECOVERY💥\n\nDefective cans and production waste are not a problem. The problem is managing them poorly.\nWith the the automatic balers:\n-#100% recycling directly in the production line.\n-Clean material ready for the foundry without additional steps.\n-Reduce time, increase #gains.\nIf you want speed, quality and zero #waste, this is not just a machine: it's your competitive advantage.\nDon't settle: dominate the production cycle with GPS Recycling.\n\n🔗 Find out how to revolutionize your line: https://lnkd.in/djNSDEet",
        "likes": "2",
        "time": {
          "raw": "1h",
          "parsed": "25.02.2025",
          "isoString": "2025-02-25T08:23:09.426Z"
        },
        "mediaType": "image",
        "mediaContent": [
          "https://media.licdn.com/dms/image/v2/D4D10AQG0v0Yz9ypQbA/image-shrink_800/B4DZUiX429HIAc-/0/1740038443676?e=1741683600&v=beta&t=KVhkLMD1OC9SaPamCp9JtiHd2xxtW51DBeNKRu39_JU"
        ],
        "date": "2025-02-25T08:23:09.426Z"
      },
      {
        "captions": "💖 GPS IN LOVE: POWER THAT MAKES YOU FALL IN LOVE 💖\nFor Valentine's Day, we present our new #passion: PREDATOR 9.0 HS.\n\nA machine born to make your heart beat faster:\n-High speed to handle any challenge.\n-Deadly precision, no waste.\n-Unbeatable #efficiency, like a perfect partner.\n\nIf you're looking for a machine that combines strength and #performance, look no further. This is not just #technology, it's love at first use. https://lnkd.in/g6unxs5g💖 GPS IN LOVE: POWER THAT MAKES YOU FALL IN LOVE 💖\nFor Valentine's Day, we present our new #passion: PREDATOR 9.0 HS.\n\nA machine born to make your heart beat faster:\n-High speed to handle any challenge.\n-Deadly precision, no waste.\n-Unbeatable #efficiency, like a perfect partner.\n\nIf you're looking for a machine that combines strength and #performance, look no further. This is not just #technology, it's love at first use. https://lnkd.in/g6unxs5g",
        "likes": "1",
        "time": {
          "raw": "2h",
          "parsed": "18.02.2025",
          "isoString": "2025-02-18T08:23:09.431Z"
        },
        "mediaType": "image",
        "mediaContent": [
          "https://media.licdn.com/dms/image/v2/D4D10AQGLfVDlUqHtVw/image-shrink_800/B4DZUDeQJxHIAg-/0/1739520017958?e=1741683600&v=beta&t=JYbilKjXUZKAcLNpfk5Ftr1C19H9jHK8HsUbWBfP_u8"
        ],
        "date": "2025-02-18T08:23:09.431Z"
      },
      {
        "captions": "💡YOUR BUSINESS DESERVES MORE💡\n\nIn a competitive market, reducing cost per ton is the only way to improve margins and beat the competition.\n\nWith our #balers and #shearbalers:\n-Maximum efficiency, every ton is worth more.\n-Cutting-edge technology, always one step ahead.\n-Optimized costs, higher margins.\nWhy lag behind when you can dominate the market? 🚀\n\n🔗 Learn how to transform your production cycle: https://lnkd.in/dvMb29C8 \n\n#efficiencymatters #costreduction #industrialinnovation #costperton💡YOUR BUSINESS DESERVES MORE💡\n\nIn a competitive market, reducing cost per ton is the only way to improve margins and beat the competition.\n\nWith our #balers and #shearbalers:\n-Maximum efficiency, every ton is worth more.\n-Cutting-edge technology, always one step ahead.\n-Optimized costs, higher margins.\nWhy lag behind when you can dominate the market? 🚀\n\n🔗 Learn how to transform your production cycle: https://lnkd.in/dvMb29C8 \n\n#efficiencymatters #costreduction #industrialinnovation #costperton",
        "likes": "1",
        "time": {
          "raw": "3h",
          "parsed": "11.02.2025",
          "isoString": "2025-02-11T08:23:09.434Z"
        },
        "mediaType": "image",
        "mediaContent": [
          "https://media.licdn.com/dms/image/v2/D4D10AQGHYG-S2KZFBQ/image-shrink_800/B4DZTaRlIdG4Ag-/0/1738828830752?e=1741683600&v=beta&t=ri-1WdJ7Lt5lEeOGwki7TFFZgi8qFGXsyDD5eVUr9nY"
        ],
        "date": "2025-02-11T08:23:09.434Z"
      },
      {
        "captions": "With #Predator 9.0 HS, GPS Recycling has redefined #industry standards. No one has ever built a #baler of this size, and its #power is incomparable.\n\nDesigned to handle the #bulkiest #loads, the Predator 9.0 HS delivers outstanding performance at every stage of the process.\n\n-Large loading chamber to handle large volumes quickly.\n-Unmatched compaction power, ideal for those who need high performance.\nWith this machine you can maximize your company's #productivity, contact us!\nhttps://lnkd.in/d9wYEUX5",
        "likes": "2",
        "comments": "1",
        "time": {
          "raw": "1ay",
          "parsed": "04.02.2025",
          "isoString": "2025-02-04T08:23:09.436Z"
        },
        "mediaType": "video",
        "mediaContent": {
          "src": [
            {
              "src": "https://dms.licdn.com/playlist/vid/v2/D4D10AQF7z7Hj62fFRA/mp4-640p-30fp-crf28/mp4-640p-30fp-crf28/0/1737619229761?e=1741683600&v=beta&t=lrk2anj4G2MI69A1086_3_Q1gz_S78JuyieMsQYfShY",
              "type": "video/mp4",
              "data-bitrate": 589854
            },
            {
              "src": "https://dms.licdn.com/playlist/vid/v2/D4D10AQF7z7Hj62fFRA/mp4-360p-30fp-crf28/mp4-360p-30fp-crf28/0/1737619229330?e=1741683600&v=beta&t=OuoNA4w8943DE1qEQiLdPrAE_KQdvLMiD7Du5C2FLBk",
              "type": "video/mp4",
              "data-bitrate": 250941
            },
            {
              "src": "https://dms.licdn.com/playlist/vid/v2/D4D10AQF7z7Hj62fFRA/mp4-720p-30fp-crf28/mp4-720p-30fp-crf28/0/1737619230133?e=1741683600&v=beta&t=dhL3v8b9ROWnimQwWSSNOKdYfz4j_FYcV57m3c0k0-c",
              "type": "video/mp4",
              "data-bitrate": 784332
            }
          ],
          "posterUrl": "https://media.licdn.com/dms/image/v2/D4D10AQF7z7Hj62fFRA/videocover-high/videocover-high/0/1737619228810?e=1741683600&v=beta&t=NEI6tPXclmWRp6Lc-QB8DZM7DwNj1RODylpJngk9_Xw"
        },
        "date": "2025-02-04T08:23:09.436Z"
      },
      {
        "captions": "🚀 The #Destroyer represents the ultimate solution for large-scale scrap processing. Designed with an extraordinary loading capacity and a #closingforce on lids greater than that of any conventional shear, this machine offers unparalleled performance.\n\n-Box over 9 meters long and an open loading area of 2.8 meters, ideal for bulky materials.\n-State-of-the-art hydraulic power plant for maximum production efficiency.\n-Increased productivity and reduced operating costs all in one.\nIf your business needs #superior performance, Destroyer is the answer.\nFind out more on our website\n🔗https://lnkd.in/gAfnKPG7🚀 The #Destroyer represents the ultimate solution for large-scale scrap processing. Designed with an extraordinary loading capacity and a #closingforce on lids greater than that of any conventional shear, this machine offers unparalleled performance.\n\n-Box over 9 meters long and an open loading area of 2.8 meters, ideal for bulky materials.\n-State-of-the-art hydraulic power plant for maximum production efficiency.\n-Increased productivity and reduced operating costs all in one.\nIf your business needs #superior performance, Destroyer is the answer.\nFind out more on our website\n🔗https://lnkd.in/gAfnKPG7",
        "likes": "5",
        "time": {
          "raw": "1ay",
          "parsed": "04.02.2025",
          "isoString": "2025-02-04T08:23:09.437Z"
        },
        "mediaType": "image",
        "mediaContent": [
          "https://media.licdn.com/dms/image/v2/D4D10AQEgQ8HdBL96AA/image-shrink_800/image-shrink_800/0/1737014415045?e=1741683600&v=beta&t=qvI9DnuwZKCdPLbpnNFSRY349ZSGjAkQ9hHASc_cZDo"
        ],
        "date": "2025-02-04T08:23:09.437Z"
      },
      {
        "captions": "🔧 #GPSRecycling is proud to continue the path of #innovation traced by Lollini International, a pioneer in the design of the first mobile scrap processing machines in Italy.\n\nIf you own a Lollini machine, you can count on us for service and genuine #spare parts to ensure that your operations remain efficient and uninterrupted.\n\nIn addition, we offer the option of picking up your Lollini model in #tradein, so you can upgrade to a more modern, efficient and technologically advanced solution. 💪\n\nDon't miss this opportunity! Contact us now: https://lnkd.in/d9wYEUX5🔧 #GPSRecycling is proud to continue the path of #innovation traced by Lollini International, a pioneer in the design of the first mobile scrap processing machines in Italy.\n\nIf you own a Lollini machine, you can count on us for service and genuine #spare parts to ensure that your operations remain efficient and uninterrupted.\n\nIn addition, we offer the option of picking up your Lollini model in #tradein, so you can upgrade to a more modern, efficient and technologically advanced solution. 💪\n\nDon't miss this opportunity! Contact us now: https://lnkd.in/d9wYEUX5",
        "likes": "1",
        "time": {
          "raw": "1ay",
          "parsed": "04.02.2025",
          "isoString": "2025-02-04T08:23:09.439Z"
        },
        "mediaType": "image",
        "mediaContent": [
          "https://media.licdn.com/dms/image/v2/D4D10AQE_jhjXvp-fUQ/image-shrink_800/image-shrink_800/0/1736409647401?e=1741683600&v=beta&t=a8sVdrsFiDNfb5CzY4dKAVaGpjlSoFmH3UIjxxm_Sf4"
        ],
        "date": "2025-02-04T08:23:09.439Z"
      },
      {
        "captions": "Happy new year from #GPSRecycling! 🎆\nWe are ready to welcome 2025 with #newchallenges, #innovations and many #projects.\n\nWe wish everyone a year full of satisfaction and great #results! 💥\n#Happy2025! 🎉🥂Happy new year from #GPSRecycling! 🎆\nWe are ready to welcome 2025 with #newchallenges, #innovations and many #projects.\n\nWe wish everyone a year full of satisfaction and great #results! 💥\n#Happy2025! 🎉🥂",
        "likes": "6",
        "time": {
          "raw": "2ay",
          "parsed": "04.01.2025",
          "isoString": "2025-01-04T08:23:09.441Z"
        },
        "mediaType": "image",
        "mediaContent": [
          "https://media.licdn.com/dms/image/v2/D4D10AQHGH5bc5XxcYA/image-shrink_800/image-shrink_800/0/1735718413176?e=1741683600&v=beta&t=XKtNtcbcTig4-5RfoIdZjUKPnxdJqYar4yQ0G4JouUU"
        ],
        "date": "2025-01-04T08:23:09.441Z"
      },
      {
        "captions": "🎉 2024: Despite the difficulties, we continued to innovate and make important strides in the #industry. \n\n🔩 Birth of the #Destroyer - Our new, powerful, state-of-the-art winged #shearbaler that redefined the way we process scrap.\n\n🤝 Collaboration with Harris - This year we consolidated our partnership with Harris, becoming the only dealer with exclusivity for the US, Canada and Mexico.\n\n🎪 Participation in the #ISRI in Las Vegas - We brought our #leading-edge #technology to the ultimate international #recycling event.\n\n🌍 #ExpansionGlobal - We strengthened our presence around the world.\n\n🔧 Launch of the Predator 9.0 HS - The #biggest automobile logger ever created, designed to tackle the most complex challenges in the #recycling world.\n\nThank you all for supporting and accompanying us through this year.\n#GPSRECYRLING🎉 2024: Despite the difficulties, we continued to innovate and make important strides in the #industry. \n\n🔩 Birth of the #Destroyer - Our new, powerful, state-of-the-art winged #shearbaler that redefined the way we process scrap.\n\n🤝 Collaboration with Harris - This year we consolidated our partnership with Harris, becoming the only dealer with exclusivity for the US, Canada and Mexico.\n\n🎪 Participation in the #ISRI in Las Vegas - We brought our #leading-edge #technology to the ultimate international #recycling event.\n\n🌍 #ExpansionGlobal - We strengthened our presence around the world.\n\n🔧 Launch of the Predator 9.0 HS - The #biggest automobile logger ever created, designed to tackle the most complex challenges in the #recycling world.\n\nThank you all for supporting and accompanying us through this year.\n#GPSRECYRLING",
        "likes": "8",
        "time": {
          "raw": "2ay",
          "parsed": "04.01.2025",
          "isoString": "2025-01-04T08:23:09.445Z"
        },
        "mediaType": "image",
        "mediaContent": [
          "https://media.licdn.com/dms/image/v2/D4D10AQG372fxQshNfA/image-shrink_800/image-shrink_800/0/1735545637059?e=1741683600&v=beta&t=xdNXT1-V6GFS9LtAqf9RF-nbMhTAhHj0coc4nCxOz_8"
        ],
        "date": "2025-01-04T08:23:09.445Z"
      },
      {
        "captions": "🎄 #Season’s Greetings from GPS Recycling! 🎄\n\nWe would like to wish all our customers, #partners and #collaborators peaceful #Holidays. \nThank you for choosing us and supporting us in our #growth and #innovation journey. \n\nHappy holidays to everyone! 🎁❄️🎄 #Season’s Greetings from GPS Recycling! 🎄\n\nWe would like to wish all our customers, #partners and #collaborators peaceful #Holidays. \nThank you for choosing us and supporting us in our #growth and #innovation journey. \n\nHappy holidays to everyone! 🎁❄️",
        "likes": "3",
        "time": {
          "raw": "2ay",
          "parsed": "04.01.2025",
          "isoString": "2025-01-04T08:23:09.447Z"
        },
        "mediaType": "image",
        "mediaContent": [
          "https://media.licdn.com/dms/image/v2/D4D10AQHB6bs4vFfTTw/image-shrink_800/image-shrink_800/0/1735113635976?e=1741683600&v=beta&t=DqrCVWcvi26PgvToBjO2yNQOTjpYPKLi6SzabQe_1o8"
        ],
        "date": "2025-01-04T08:23:09.447Z"
      },
      {
        "captions": "We proudly present #Predator9.0, the #biggest #elvrecycling #logger #carbaler ever made. Designed to tackle the recycling industry's toughest challenges, this machine combines #power, exceptional size and unprecedented \n#operating efficiency.\n\nIf your business needs #maximum #capacity and the best #performance, Predator 9.0 HS is the solution you've been waiting for.\n\n#gpsrecycling #innovation",
        "likes": "6",
        "time": {
          "raw": "2ay",
          "parsed": "04.01.2025",
          "isoString": "2025-01-04T08:23:09.448Z"
        },
        "mediaType": "video",
        "mediaContent": {
          "src": [
            {
              "src": "https://dms.licdn.com/playlist/vid/v2/D4D10AQFseu2Ryl2qwQ/mp4-640p-30fp-crf28/mp4-640p-30fp-crf28/0/1733990499185?e=1741683600&v=beta&t=wvtu9n_VYKiJzYO0O88AtSRCzwyP5Eb6zWr3Wdoa4Ck",
              "type": "video/mp4",
              "data-bitrate": 881889
            },
            {
              "src": "https://dms.licdn.com/playlist/vid/v2/D4D10AQFseu2Ryl2qwQ/mp4-360p-30fp-crf28/mp4-360p-30fp-crf28/0/1733990499297?e=1741683600&v=beta&t=sMH3XPXxXOLBejNm0teU_zukgAtMOYs4_E8MybK0gTo",
              "type": "video/mp4",
              "data-bitrate": 368812
            },
            {
              "src": "https://dms.licdn.com/playlist/vid/v2/D4D10AQFseu2Ryl2qwQ/mp4-720p-30fp-crf28/mp4-720p-30fp-crf28/0/1733990499091?e=1741683600&v=beta&t=mrEEr3Dn8hNjTjjcHea4bR_ut_8iOeTvcfrwuuPd63I",
              "type": "video/mp4",
              "data-bitrate": 1165984
            }
          ],
          "posterUrl": "https://media.licdn.com/dms/image/v2/D4D10AQFseu2Ryl2qwQ/videocover-high/videocover-high/0/1733990495577?e=1741683600&v=beta&t=QexJbCo_dUz9KQRtfG9dByE4y4N25V3N14Y3ofMKHU4"
        },
        "date": "2025-01-04T08:23:09.448Z"
      },
      {
        "captions": "Our great #production #flexibility, combined with our knowledge of the industry and the daily challenges of scrap dealers, allows us to offer fully #customized solutions that greatly improve workflow.\n\nOur machines are designed to be fast, powerful and ensure an increase in your #profit margins, but they are not all the same!\n\nContact us today for a customized #pre-sales consultation and find out how we can help you optimize your operation! 🌍\n\n#gpsrecyclingOur great #production #flexibility, combined with our knowledge of the industry and the daily challenges of scrap dealers, allows us to offer fully #customized solutions that greatly improve workflow.\n\nOur machines are designed to be fast, powerful and ensure an increase in your #profit margins, but they are not all the same!\n\nContact us today for a customized #pre-sales consultation and find out how we can help you optimize your operation! 🌍\n\n#gpsrecycling",
        "likes": "2",
        "time": {
          "raw": "2ay",
          "parsed": "04.01.2025",
          "isoString": "2025-01-04T08:23:09.449Z"
        },
        "mediaType": "image",
        "mediaContent": [
          "https://media.licdn.com/dms/image/v2/D4D10AQFvGDLNx4I1tw/image-shrink_800/image-shrink_800/0/1733385619574?e=1741683600&v=beta&t=Abs3MW90FWvf7c-lk2qRcwx6B4fnXz7IszkKdOC2Jus"
        ],
        "date": "2025-01-04T08:23:09.449Z"
      },
      {
        "captions": "📢 Our Predator baler/loggers are ready to hit the road!\n\nWe have Predator machines ready for delivery to the US and Canada through our exclusive partners, Harris and Ely Enterprises, Inc Want to speed up your recycling process? The Predator is designed for maximum performance and unbeatable speed in processing scrap. 💪\n\n⌛ Quantities are limited! Don't wait - contact us today to lock in your machine!\n\n#Predator #GPSRecycling #ImmediateDelivery #Recycling #Productivity📢 Our Predator baler/loggers are ready to hit the road!\n\nWe have Predator machines ready for delivery to the US and Canada through our exclusive partners, Harris and Ely Enterprises, Inc Want to speed up your recycling process? The Predator is designed for maximum performance and unbeatable speed in processing scrap. 💪\n\n⌛ Quantities are limited! Don't wait - contact us today to lock in your machine!\n\n#Predator #GPSRecycling #ImmediateDelivery #Recycling #Productivity",
        "likes": "3",
        "shares": "1",
        "time": {
          "raw": "3ay",
          "parsed": "04.12.2024",
          "isoString": "2024-12-04T08:23:09.450Z"
        },
        "mediaType": "image",
        "mediaContent": [
          "https://media.licdn.com/dms/image/v2/D4D10AQHb1hLePDT7BQ/image-shrink_800/image-shrink_800/0/1732780809697?e=1741683600&v=beta&t=eUs7yfPDp7-0SBM8iZspvtEVrzlmhXpv7SlibOJbDJA"
        ],
        "date": "2024-12-04T08:23:09.450Z"
      },
      {
        "captions": "Guess the shear:\n- Equipped with a fast and extremely powerful cutting system\n- Continuous feeding\n- Not only powerful, but also compact\nDo you know which shear we are talking about? Share your answer in the comments! ⁣\n#gpsrecycling #guesstheshearGuess the shear:\n- Equipped with a fast and extremely powerful cutting system\n- Continuous feeding\n- Not only powerful, but also compact\nDo you know which shear we are talking about? Share your answer in the comments! ⁣\n#gpsrecycling #guesstheshear",
        "likes": "2",
        "time": {
          "raw": "3ay",
          "parsed": "04.12.2024",
          "isoString": "2024-12-04T08:23:09.451Z"
        },
        "mediaType": "image",
        "mediaContent": [
          "https://media.licdn.com/dms/image/v2/D4D10AQGI-fcP7PhJaQ/image-shrink_800/image-shrink_800/0/1732608068944?e=1741683600&v=beta&t=sS5s0gUHb7hSAuwbNr261IzPo2ITWl2pgx7JcCEko6w"
        ],
        "date": "2024-12-04T08:23:09.451Z"
      },
      {
        "captions": "🔧 Maximum power, minimum wait!\n\nThe Predator balers are ready for delivery thanks to our partnership with Harris and Ely Enterprises, Inc There are no waiting times: these machines are ready to go into action and improve your business. 💥\n\nIf you are looking for power and reliability, the Predator is the right choice for you. Write to us now for more information and to book your machine!\n\n#Predator #GPSRecycling #Power #ImmediateDelivery🔧 Maximum power, minimum wait!\n\nThe Predator balers are ready for delivery thanks to our partnership with Harris and Ely Enterprises, Inc There are no waiting times: these machines are ready to go into action and improve your business. 💥\n\nIf you are looking for power and reliability, the Predator is the right choice for you. Write to us now for more information and to book your machine!\n\n#Predator #GPSRecycling #Power #ImmediateDelivery",
        "likes": "5",
        "shares": "1",
        "time": {
          "raw": "3ay",
          "parsed": "04.12.2024",
          "isoString": "2024-12-04T08:23:09.453Z"
        },
        "mediaType": "image",
        "mediaContent": [
          "https://media.licdn.com/dms/image/v2/D4D10AQHTK66N_TReEw/image-shrink_800/image-shrink_800/0/1732176012463?e=1741683600&v=beta&t=7cA0hHk1LNfQBTu1J4r0DXhtixDaeq9YCMQADM-53Ds"
        ],
        "date": "2024-12-04T08:23:09.453Z"
      },
      {
        "captions": "🔧Our commitment goes beyond sales: we listen carefully to our #customers' needs to offer customized solutions. Thanks to our global presence, we are ready to step in and provide #support in every corner of the world, ensuring that our customers' #machines operate at peak #performance. 🌍\n\nFor this reason, we are always looking for new #resellers to expand our network and bring our technology and support to anyone in need around the world.\n\nIf you are interested in a partnership please contact us:https://lnkd.in/d9wYEUX5\n\n#gpsrecycling🔧Our commitment goes beyond sales: we listen carefully to our #customers' needs to offer customized solutions. Thanks to our global presence, we are ready to step in and provide #support in every corner of the world, ensuring that our customers' #machines operate at peak #performance. 🌍\n\nFor this reason, we are always looking for new #resellers to expand our network and bring our technology and support to anyone in need around the world.\n\nIf you are interested in a partnership please contact us:https://lnkd.in/d9wYEUX5\n\n#gpsrecycling",
        "likes": "3",
        "time": {
          "raw": "3ay",
          "parsed": "04.12.2024",
          "isoString": "2024-12-04T08:23:09.455Z"
        },
        "mediaType": "image",
        "mediaContent": [
          "https://media.licdn.com/dms/image/v2/D5610AQGSn6vY60X2gA/image-shrink_800/image-shrink_800/0/1732003218289?e=1741683600&v=beta&t=sK1AmyEkBCmtAcY-LVI0A4xdxMsaHE-6URMNu2SFAXM"
        ],
        "date": "2024-12-04T08:23:09.455Z"
      },
      {
        "captions": "🤔 What are G.P.S. Great Scrap Processing Solutions, Harris  and Ely Enterprises, Inc doing together? It sounds like the beginning of a joke, but it's pure reality!\n\n😄 There is an Italian (GPS), an American (Harris), and another American (Ely)... together they bring the Predator ready for delivery to the United States and Canada, ready to revolutionize the world of recycling! 💥\nThis is no joke, this is your next chance to get the Predator baler/logger in your yard right away. \n\nContact us now!\n📦 Stock is running low!\n\n#Predator #GPSRecycling #ReadyToShip #Efficiency🤔 What are G.P.S. Great Scrap Processing Solutions, Harris  and Ely Enterprises, Inc doing together? It sounds like the beginning of a joke, but it's pure reality!\n\n😄 There is an Italian (GPS), an American (Harris), and another American (Ely)... together they bring the Predator ready for delivery to the United States and Canada, ready to revolutionize the world of recycling! 💥\nThis is no joke, this is your next chance to get the Predator baler/logger in your yard right away. \n\nContact us now!\n📦 Stock is running low!\n\n#Predator #GPSRecycling #ReadyToShip #Efficiency",
        "likes": "5",
        "shares": "1",
        "time": {
          "raw": "3ay",
          "parsed": "04.12.2024",
          "isoString": "2024-12-04T08:23:09.456Z"
        },
        "mediaType": "image",
        "mediaContent": [
          "https://media.licdn.com/dms/image/v2/D5610AQGDsj8Y4Zs_7w/image-shrink_800/image-shrink_800/0/1731571222124?e=1741683600&v=beta&t=1jrvAbODFskvdiva28ax3I6YT1ngSSxBsdbLGUGA1U4"
        ],
        "date": "2024-12-04T08:23:09.456Z"
      },
      {
        "captions": "In the world of #automobileloggers, there is only one leading machine. GPS's #Predator is the most imitated machine on the market, but no copy can come close to its performance in terms of #power, #reliability and #innovation.\nThe Predator was born to make a difference, and it proves it to you every day.\nWhy choose an imitation when you can have the top technology for #scrap treatment? \n\nFind out what makes it unique: https://lnkd.in/g6unxs5gIn the world of #automobileloggers, there is only one leading machine. GPS's #Predator is the most imitated machine on the market, but no copy can come close to its performance in terms of #power, #reliability and #innovation.\nThe Predator was born to make a difference, and it proves it to you every day.\nWhy choose an imitation when you can have the top technology for #scrap treatment? \n\nFind out what makes it unique: https://lnkd.in/g6unxs5g",
        "likes": "6",
        "shares": "3",
        "time": {
          "raw": "3ay",
          "parsed": "04.12.2024",
          "isoString": "2024-12-04T08:23:09.457Z"
        },
        "mediaType": "image",
        "mediaContent": [
          "https://media.licdn.com/dms/image/v2/D4D10AQEGSq4mOnb_tA/image-shrink_800/image-shrink_800/0/1731398406811?e=1741683600&v=beta&t=OjfGOkjhtsrQMTLFE1d5X7lQcSGNkwAkeOMMGiquBi4"
        ],
        "date": "2024-12-04T08:23:09.457Z"
      },
      {
        "captions": "🧮 Harris + Ely Enterprises, Inc + G.P.S. Great Scrap Processing Solutions = your new Predator ready for delivery to the US and Canada!\n\nWhen the power of the Predator meets the right partners, the equation is simple: maximum efficiency and minimum delivery times.\n\nThis is the winning formula for your scrap yard.🚀\n💪 The Predator, the most powerful scrap baler on the market, is ready to go into action without waiting times!\n\nDon't wait, contact us now! 🚀\n\n#Predator #GPSRecycling #ReadyToShip #Efficiency #Recycling🧮 Harris + Ely Enterprises, Inc + G.P.S. Great Scrap Processing Solutions = your new Predator ready for delivery to the US and Canada!\n\nWhen the power of the Predator meets the right partners, the equation is simple: maximum efficiency and minimum delivery times.\n\nThis is the winning formula for your scrap yard.🚀\n💪 The Predator, the most powerful scrap baler on the market, is ready to go into action without waiting times!\n\nDon't wait, contact us now! 🚀\n\n#Predator #GPSRecycling #ReadyToShip #Efficiency #Recycling",
        "likes": "6",
        "time": {
          "raw": "3ay",
          "parsed": "04.12.2024",
          "isoString": "2024-12-04T08:23:09.459Z"
        },
        "mediaType": "image",
        "mediaContent": [
          "https://media.licdn.com/dms/image/v2/D5622AQGPOmlH7jOhqg/feedshare-shrink_800/feedshare-shrink_800/0/1730974771950?e=1744243200&v=beta&t=ssmaTDThCAdJnjV1hNUEFSch4HRQWHwTgQ1nTHU-GCc",
          "https://static.licdn.com/aero-v1/sc/h/dur0ryw0e9uscxa9b6zqvgvfs"
        ],
        "date": "2024-12-04T08:23:09.459Z"
      },
      {
        "captions": "📢 We are looking for new GPS agents and dealers in the world! 🌍\n#GPSRecycling is looking for qualified resellers to expand its global network and provide more #service to its #customers.\nWhy become a #GPS reseller?\n\n✅ Represent state-of-the-art, top-quality machines.\n✅ Dedicated sales and technical support\n✅ Be part of a successful global network\n\nIf you have a business in the #recycling industry and are interested, contact us now for more information! 🌟\n#business #partnership📢 We are looking for new GPS agents and dealers in the world! 🌍\n#GPSRecycling is looking for qualified resellers to expand its global network and provide more #service to its #customers.\nWhy become a #GPS reseller?\n\n✅ Represent state-of-the-art, top-quality machines.\n✅ Dedicated sales and technical support\n✅ Be part of a successful global network\n\nIf you have a business in the #recycling industry and are interested, contact us now for more information! 🌟\n#business #partnership",
        "likes": "3",
        "time": {
          "raw": "3ay",
          "parsed": "04.12.2024",
          "isoString": "2024-12-04T08:23:09.460Z"
        },
        "mediaType": "image",
        "mediaContent": [
          "https://media.licdn.com/dms/image/v2/D4D10AQHg34dvRdyjdg/image-shrink_800/image-shrink_800/0/1730880011591?e=1741683600&v=beta&t=ZCiLX9bIut-ybc9WrjX3dy0ILlYStn6GAa2zQOtKw7U"
        ],
        "date": "2024-12-04T08:23:09.460Z"
      }
    ]
  },
  {
    "name": "EcotecnicaEurope",
    "followerData": [
      [
        20250225,
        73
      ],
      [
        20250225,
        73
      ],
      [
        20250225,
        73
      ],
      [
        20250228,
        73
      ],
      [
        20250228,
        73
      ],
      [
        20250228,
        73
      ],
      [
        20250228,
        73
      ],
      [
        20250303,
        73
      ],
      [
        1741011613279,
        "73"
      ],
      [
        1741076603237,
        "73"
      ]
    ],
    "data": [
      {
        "captions": "Se stai valutando l’acquisto di una pressa cesoia, l’opzione usata potrebbe rivelarsi una scelta strategica per ridurre i costi mantenendo alte prestazioni.\n\nNel nostro ultimo articolo, ti guidiamo alla scoperta dei vantaggi di scegliere una pressa cesoia usata e diamo alcuni consigli utili per orientare al meglio la tua decisione.\n\n👉 Leggi l'articolo completo  e scopri come fare la scelta giusta per la tua azienda!\nhttps://lnkd.in/dU8aza8J\n\n#autodemolizione #riciclometalli #endoflifevehicles #rottamazione #recycling #autodesguace #scrapmetal #reutilización #economiacircolare #autorecycling #reciclajedeautosSe stai valutando l’acquisto di una pressa cesoia, l’opzione usata potrebbe rivelarsi una scelta strategica per ridurre i costi mantenendo alte prestazioni.\n\nNel nostro ultimo articolo, ti guidiamo alla scoperta dei vantaggi di scegliere una pressa cesoia usata e diamo alcuni consigli utili per orientare al meglio la tua decisione.\n\n👉 Leggi l'articolo completo  e scopri come fare la scelta giusta per la tua azienda!\nhttps://lnkd.in/dU8aza8J\n\n#autodemolizione #riciclometalli #endoflifevehicles #rottamazione #recycling #autodesguace #scrapmetal #reutilización #economiacircolare #autorecycling #reciclajedeautos",
        "likes": "3",
        "time": {
          "raw": "4ay",
          "parsed": "04.11.2024",
          "isoString": "2024-11-04T08:23:23.009Z"
        },
        "mediaType": "image",
        "mediaContent": [
          "https://media.licdn.com/dms/image/v2/D4D22AQEEhTUHUKcXig/feedshare-shrink_2048_1536/feedshare-shrink_2048_1536/0/1728897657880?e=1744243200&v=beta&t=dPnwa_RWBRZBDr5BcATf2g8AuWiRbG_zMyHiTNv50sY"
        ],
        "date": "2024-11-04T08:23:23.009Z"
      },
      {
        "captions": "✨Nuovo Regolamento europeo in arrivo: siglata intesa tra Italia, Spagna e Portogallo\nA preoccupare tutto il comparto è l’introduzione di standard troppo alti, come il recupero dell’85% delle componenti dei veicoli a fine vita.\n\nLeggi di più⬇️\nhttps://lnkd.in/dmEaDNGw\n\n#ecotecnicaeurope #vehiclerecycling #endoflifevehicles #sustainableautorecovery #autodemolitori✨Nuovo Regolamento europeo in arrivo: siglata intesa tra Italia, Spagna e Portogallo\nA preoccupare tutto il comparto è l’introduzione di standard troppo alti, come il recupero dell’85% delle componenti dei veicoli a fine vita.\n\nLeggi di più⬇️\nhttps://lnkd.in/dmEaDNGw\n\n#ecotecnicaeurope #vehiclerecycling #endoflifevehicles #sustainableautorecovery #autodemolitori",
        "time": {
          "raw": "6ay",
          "parsed": "04.09.2024",
          "isoString": "2024-09-04T08:23:23.011Z"
        },
        "mediaType": "image",
        "mediaContent": [
          "https://media.licdn.com/dms/image/v2/D4D22AQEVCiDFDZz3Jw/feedshare-shrink_2048_1536/feedshare-shrink_2048_1536/0/1723024319353?e=1744243200&v=beta&t=Rr1-ULtkSf2YlNRLPZ0Z3uOa0qGkZY4dbQ1aZmBIocs"
        ],
        "date": "2024-09-04T08:23:23.011Z"
      },
      {
        "captions": "❗ ❗  WE ARE COMING 🎉🥂 😎  Ora si va al caldo Katana 389 in partenza per l’Arabia Saudita Ora si va al caldo Katana 389 in partenza per l’Arabia Saudita",
        "time": {
          "raw": "8ay8ay",
          "parsed": "04.03.2025",
          "isoString": "2025-03-04T08:23:23.013Z"
        },
        "mediaType": "image",
        "mediaContent": [
          "https://media.licdn.com/dms/image/v2/D4D22AQHFBclBIrf0gw/feedshare-shrink_800/feedshare-shrink_800/0/1719595179270?e=1744243200&v=beta&t=sMbBFcnHN5v57FCLnIusXRgf5hDAmieJIynNZqHYPww",
          "https://media.licdn.com/dms/image/v2/D4D22AQFevLVQYUxJnw/feedshare-shrink_800/feedshare-shrink_800/0/1719595180247?e=1744243200&v=beta&t=l3YMmbSNp6krKZkzEYdGEh-uaXDQ75yfyVqAUP7-lP4",
          "https://media.licdn.com/dms/image/v2/D4D22AQGk9Mfxc_ZgnA/feedshare-shrink_800/feedshare-shrink_800/0/1719595180133?e=1744243200&v=beta&t=87O0kfiOUsMShrrtKYOpKjBqRpxkdgShjhuhujqY7lQ",
          "https://media.licdn.com/dms/image/v2/D4D22AQFQc7232kzD7g/feedshare-shrink_800/feedshare-shrink_800/0/1719595170541?e=1744243200&v=beta&t=BDKad3fNO3MQRjBUb3OJLiPBN9Hzo6ylmOtBQLn392Q"
        ],
        "date": "2025-03-04T08:23:23.013Z"
      },
      {
        "captions": "Ora si va al caldo Katana 389 in partenza per l’Arabia Saudita Ora si va al caldo Katana 389 in partenza per l’Arabia Saudita",
        "time": {
          "raw": "8ay",
          "parsed": "04.07.2024",
          "isoString": "2024-07-04T08:23:23.014Z"
        },
        "mediaType": "image",
        "mediaContent": [
          "https://media.licdn.com/dms/image/v2/D4D22AQHFBclBIrf0gw/feedshare-shrink_800/feedshare-shrink_800/0/1719595179270?e=1744243200&v=beta&t=sMbBFcnHN5v57FCLnIusXRgf5hDAmieJIynNZqHYPww",
          "https://media.licdn.com/dms/image/v2/D4D22AQFevLVQYUxJnw/feedshare-shrink_800/feedshare-shrink_800/0/1719595180247?e=1744243200&v=beta&t=l3YMmbSNp6krKZkzEYdGEh-uaXDQ75yfyVqAUP7-lP4",
          "https://media.licdn.com/dms/image/v2/D4D22AQGk9Mfxc_ZgnA/feedshare-shrink_800/feedshare-shrink_800/0/1719595180133?e=1744243200&v=beta&t=87O0kfiOUsMShrrtKYOpKjBqRpxkdgShjhuhujqY7lQ",
          "https://media.licdn.com/dms/image/v2/D4D22AQFQc7232kzD7g/feedshare-shrink_800/feedshare-shrink_800/0/1719595170541?e=1744243200&v=beta&t=BDKad3fNO3MQRjBUb3OJLiPBN9Hzo6ylmOtBQLn392Q"
        ],
        "date": "2024-07-04T08:23:23.014Z"
      },
      {
        "captions": "⚠️Tax credit per investimenti nella ZES Unica mezzogiorno\nDal 12 giugno al 12 luglio 2024, le imprese possono richiedere il credito d'imposta per investimenti realizzati o da realizzare nel 2024 nella Zona Economica Speciale (ZES) unica per il Mezzogiorno. \n\nPossono accedere al tax credit tutte le imprese con sede nelle regioni interessate (Abruzzo, Basilicata, Calabria, Campania, Molise, Puglia, Sicilia, Sardegna), indipendentemente dalla forma giuridica e dal regime contabile.\n\nLeggi qui 👇\nhttps://lnkd.in/dwCecRzm\n\n#zesunica #agevolazionifiscali #creditodimposta #suditalia #bandi #bandisud\n#EcoSustainability #autodemolitori #scrapcar #scraprecycling",
        "likes": "1",
        "comments": "1",
        "time": {
          "raw": "9ay",
          "parsed": "04.06.2024",
          "isoString": "2024-06-04T08:23:23.015Z"
        },
        "mediaType": "other",
        "date": "2024-06-04T08:23:23.015Z"
      },
      {
        "captions": "📢Siamo entusiasti di condividere con voi la nostra partecipazione a IFAT worldwide 2024, la fiera leader mondiale per le tecnologie ambientali e il trattamento delle acque. \n\n📍 Ci trovate allo STAND 220 – HALL B4 fino al 17 maggio\n\n------------------------------------------------------------------------------------\n#exhibition #stand #IFAT #IFATworldwide #IFATMunich #innovation #sustainability #umwelttechnologie #environmentaltechnologies #metals #recycling #circulareconomy #vehiclerecycling #scrapcar #scrap #scraprecycling\n #carrecycling #carrecycler #carwreckers\n📢Siamo entusiasti di condividere con voi la nostra partecipazione a IFAT worldwide 2024, la fiera leader mondiale per le tecnologie ambientali e il trattamento delle acque. \n\n📍 Ci trovate allo STAND 220 – HALL B4 fino al 17 maggio\n\n------------------------------------------------------------------------------------\n#exhibition #stand #IFAT #IFATworldwide #IFATMunich #innovation #sustainability #umwelttechnologie #environmentaltechnologies #metals #recycling #circulareconomy #vehiclerecycling #scrapcar #scrap #scraprecycling\n #carrecycling #carrecycler #carwreckers",
        "likes": "3",
        "shares": "1",
        "time": {
          "raw": "9ay",
          "parsed": "04.06.2024",
          "isoString": "2024-06-04T08:23:23.016Z"
        },
        "mediaType": "image",
        "mediaContent": [
          "https://media.licdn.com/dms/image/v2/D4D22AQGY7VCmPny4Ng/feedshare-shrink_800/feedshare-shrink_800/0/1715768037367?e=1744243200&v=beta&t=jAEq0JUpTW6NHTqcUMNmq4csQ2HjjbNpLrpZpFEAKzg"
        ],
        "date": "2024-06-04T08:23:23.016Z"
      },
      {
        "captions": "📢 Ricorda di visitare lo stand di Ecotecnica Europe alla fiera IFAT worldwide di Monaco! Dal 13 al 17 maggio, scopri le nostre soluzioni innovative nel settore del riciclo e dell'ambiente. \n\nTi aspettiamo allo Stand B4/220 per conoscere le nostre ultime novità! 🌍♻️\n-------------------------------------------------------------------------------------\n\n 📢 Don't forget to visit Ecotecnica Europe's booth at IFAT Munich! From May 13th to 17th, discover our innovative solutions in recycling and environmental technology. \n\nFind us at Stand B4/220 to learn about our latest developments! 🌍♻️\n\n #IFATMunich #EcotecnicaEurope #recycling #environment #riciclo #ambiente #metalliferrosi #autodemolizioni\n\nhttps://lnkd.in/dx4HtZQD",
        "likes": "4",
        "time": {
          "raw": "10ay",
          "parsed": "04.05.2024",
          "isoString": "2024-05-04T08:23:23.018Z"
        },
        "mediaType": "other",
        "date": "2024-05-04T08:23:23.018Z"
      },
      {
        "captions": "𝗜𝗻𝗱𝘂𝘀𝘁𝗿𝗶𝗮 𝟱.𝟬: 𝗰𝗼𝗺𝗲 𝗳𝘂𝗻𝘇𝗶𝗼𝗻𝗮, 𝗰𝗵𝗶 𝗽𝘂ò 𝗳𝗮𝗿𝗻𝗲 𝗿𝗶𝗰𝗵𝗶𝗲𝘀𝘁𝗮 𝗲 𝗰𝗼𝗺𝗲 𝗰𝗮𝗹𝗰𝗼𝗹𝗮𝗿𝗲 𝗹𝗮 𝗿𝗶𝗱𝘂𝘇𝗶𝗼𝗻𝗲 𝗱𝗲𝗶 𝗰𝗼𝗻𝘀𝘂𝗺𝗶\n\nIl settore delle autodemolizioni si trova di fronte a una trasformazione radicale, guidata dall’innovazione tecnologica e dalla ♻️sostenibilità ambientale.\n\nEcotecnica Europe, leader nel settore, emerge come un fornitore all’avanguardia di presse progettate per integrarsi perfettamente con le nuove esigenze del settore autodemolizioni.\n\nI nostri macchinari, infatti, non solo migliorano l’efficienza operativa, ma contribuiscono a diminuire i consumi energetici in linea con gli obiettivi di sostenibilità propri dell’Industria 5.0.\n\nLeggi l'articolo⬇️\nhttps://lnkd.in/dyDjz97t\n\n#macchinariIndustriali #demolizioneVeicoli #maquinariaIndustrial #desguaceautomotriz #industrialMachinery #vehicledemolition #scrapmetal #scrapyard #industria50",
        "likes": "1",
        "time": {
          "raw": "11ay",
          "parsed": "04.04.2024",
          "isoString": "2024-04-04T08:23:23.019Z"
        },
        "mediaType": "other",
        "date": "2024-04-04T08:23:23.019Z"
      },
      {
        "captions": "Anche quest’anno Ecotecnica Europe rinnova la sua presenza alla fiera IFAT worldwide di Monaco, in programma dal 13 al 17 maggio 2024 presso il centro fieristico di Monaco.\n▶️STAND 220/HALL B4\n\nhttps://lnkd.in/dx4HtZQD\n\n#IFAT #riciclo #materialiferrosi #autodemolizioni #wastereduction #circulareconomy #innovation #sustainability #ferrousrecycling",
        "likes": "7",
        "comments": "1",
        "shares": "2",
        "time": {
          "raw": "11ay",
          "parsed": "04.04.2024",
          "isoString": "2024-04-04T08:23:23.020Z"
        },
        "mediaType": "other",
        "date": "2024-04-04T08:23:23.020Z"
      }
    ]
  },
  {
    "name": "Taurus",
    "followerData": [
      [
        20250213,
        1228
      ],
      [
        20250225,
        1247
      ],
      [
        20250225,
        1247
      ],
      [
        20250225,
        1247
      ],
      [
        20250228,
        1248
      ],
      [
        20250228,
        1248
      ],
      [
        20250228,
        1248
      ],
      [
        20250228,
        1248
      ],
      [
        20250303,
        1254
      ],
      [
        1741011634713,
        "1.254"
      ],
      [
        1741076616031,
        "1.255"
      ]
    ],
    "data": [
      {
        "captions": "TAURUS BLULINE SHEAR BALER\nT 1300\nAlways a step ahead!\n.\nFor more info:\ninfo@taurusweb.it\nwww.taurusweb.it\n\n#Taurus #shearbaler #pressa #pressacesoia #presse #pressecisaille #cisaille #prensa #compactadora #chatarras #chatarreria #sucata #scrap #scrapyard #Scrapmachine #scrapequipment #recycling #recyclingequipment #HeavyDuty #heavyequipment #heavymachine #rottame #madeinitaly TAURUS BLULINE SHEAR BALER\nT 1300\nAlways a step ahead!\n.\nFor more info:\ninfo@taurusweb.it\nwww.taurusweb.it\n\n#Taurus #shearbaler #pressa #pressacesoia #presse #pressecisaille #cisaille #prensa #compactadora #chatarras #chatarreria #sucata #scrap #scrapyard #Scrapmachine #scrapequipment #recycling #recyclingequipment #HeavyDuty #heavyequipment #heavymachine #rottame #madeinitaly",
        "likes": "27",
        "comments": "1",
        "shares": "2",
        "time": {
          "raw": "6g",
          "parsed": "26.02.2025",
          "isoString": "2025-02-26T08:23:35.822Z"
        },
        "mediaType": "image",
        "mediaContent": [
          "https://media.licdn.com/dms/image/v2/D4E22AQHrnGEJrjxgFA/feedshare-shrink_800/B4EZU.EsYaHMAg-/0/1740503173435?e=1744243200&v=beta&t=L417e9UMleSiVDWuBBo3NHkXCOcti2ONM4NAUWmWAPI"
        ],
        "date": "2025-02-26T08:23:35.822Z"
      },
      {
        "captions": "TAURUS INCLINED SHEAR TR\nThe NeverEnding Shear...\nFor more info:\ninfo@taurusweb.it\nwww.taurusweb.it\n\n#inclinedshear #Taurus #neverending #continousfeeding #shear #shearbaler #cisalleincliné #cisaille #reffaille #scrap #recycling #cesoia #rottame #cesoiainclinata #alimentazionecontinua #cizalla #cizallainclinada #cisalhamentoinclinado #sucata #chatarra #scrapyard #MadeInItaly",
        "likes": "25",
        "shares": "3",
        "time": {
          "raw": "1h",
          "parsed": "25.02.2025",
          "isoString": "2025-02-25T08:23:35.824Z"
        },
        "mediaType": "video",
        "mediaContent": {
          "src": [
            {
              "src": "https://dms.licdn.com/playlist/vid/v2/D4D05AQF4TRuSqgzU6A/mp4-640p-30fp-crf28/B4DZUitGFQHIBc-/0/1740044015092?e=1741683600&v=beta&t=Ooav5Oqn-RqHBXwXecxuriWm9RCTJaOzQE1Pw3yjufM",
              "type": "video/mp4",
              "data-bitrate": 586050
            }
          ],
          "posterUrl": "https://media.licdn.com/dms/image/v2/D4D05AQF4TRuSqgzU6A/videocover-high/B4DZUitGFQHIBs-/0/1740044008670?e=1741683600&v=beta&t=l5WBQSjtE3HLjSqbaoV7b4FZxC0pGvUiUaTsr-8_KoA"
        },
        "date": "2025-02-25T08:23:35.824Z"
      },
      {
        "captions": "TAURUS SHEAR BALER ELLE (loading - unloading)\nShearing force t 1000\nDiscover more:\nhttps://lnkd.in/dDe3xUQA\n.\nFor more info:\ninfo@taurusweb.it\nwww.taurusweb.it\n\n#Taurus #shearbaler #Loading #unloading #liftingjacks #recycling #scrapyard #recyclingequipment #scrapunit #madeinitaly #recyclingtechnology #CircularEconomy #transportableshear #cisailletransportable #cisaille #presse #Recyclage #Ferrailleur #ferraille #compactadora #prensa #cizalla #sucata #sucateiro  TAURUS SHEAR BALER ELLE (loading - unloading)\nShearing force t 1000\nDiscover more:\nhttps://lnkd.in/dDe3xUQA\n.\nFor more info:\ninfo@taurusweb.it\nwww.taurusweb.it\n\n#Taurus #shearbaler #Loading #unloading #liftingjacks #recycling #scrapyard #recyclingequipment #scrapunit #madeinitaly #recyclingtechnology #CircularEconomy #transportableshear #cisailletransportable #cisaille #presse #Recyclage #Ferrailleur #ferraille #compactadora #prensa #cizalla #sucata #sucateiro",
        "likes": "21",
        "shares": "2",
        "time": {
          "raw": "1h",
          "parsed": "25.02.2025",
          "isoString": "2025-02-25T08:23:35.825Z"
        },
        "mediaType": "image",
        "mediaContent": [
          "https://media.licdn.com/dms/image/v2/D4D22AQGsVcevffXIIg/feedshare-shrink_800/B4DZUZyA0gGcAk-/0/1739894296515?e=1744243200&v=beta&t=t_T8_4YKDLGlseoH0BLKhlZyv0-GHRvLCxIIdydNVik"
        ],
        "date": "2025-02-25T08:23:35.825Z"
      },
      {
        "captions": "The new TAURUS brochure is online,\nVisit our website:\nhttps://lnkd.in/dcqvQwwE\n.\nTAURUS, Always a step ahead!\n\n#Taurus #brochure2025 #production #redline #BluLine #BlackLine #shears #shearbaler #inclinedshear #hammermill #pressecisaille #preshredder #pré-broyeur #broyeur #premacinatore #mulinomartelli #pressacesoia #pressa #cesoiainclinata #cisailleincliné #scrapequipment #scrapunit #scrap #Ferrailleur #ferraille #scrapyard #chatarras #compactadora #sucata #sucateiroThe new TAURUS brochure is online,\nVisit our website:\nhttps://lnkd.in/dcqvQwwE\n.\nTAURUS, Always a step ahead!\n\n#Taurus #brochure2025 #production #redline #BluLine #BlackLine #shears #shearbaler #inclinedshear #hammermill #pressecisaille #preshredder #pré-broyeur #broyeur #premacinatore #mulinomartelli #pressacesoia #pressa #cesoiainclinata #cisailleincliné #scrapequipment #scrapunit #scrap #Ferrailleur #ferraille #scrapyard #chatarras #compactadora #sucata #sucateiro",
        "likes": "12",
        "shares": "4",
        "time": {
          "raw": "2h",
          "parsed": "18.02.2025",
          "isoString": "2025-02-18T08:23:35.826Z"
        },
        "mediaType": "image",
        "mediaContent": [
          "https://media.licdn.com/dms/image/v2/D4D22AQGCwF2hJEQtrg/feedshare-shrink_800/B4DZT_yAjPHAAk-/0/1739458088733?e=1744243200&v=beta&t=lIGuUoHivex3wDb9Be0Qp70EO4978FB4AFHpaycKwDQ"
        ],
        "date": "2025-02-18T08:23:35.826Z"
      },
      {
        "captions": "TR: THE TAURUS INCLINE SHEAR\nshearing force up to 1800 t\ninstalled power up to 950 kw\nhttps://lnkd.in/dXtfMU-m\n.\nFor more info:\ninfo@taurusweb.it\nwww.taurusweb.it\n#tr #Taurus #inclinedshear #shears #scrap #cesoiainclinata #cesoia #rottame #recycling #Ferrailleur #compactadora #cizalla #pressecisaille #presse #guillotines #Recyclage #Ferrailleur #sucata #sucateros #chatarra #prensa #scrapyard #madeinitaly #scrapunit #Scrapmachine #scrapequipment TR: THE TAURUS INCLINE SHEAR\nshearing force up to 1800 t\ninstalled power up to 950 kw\nhttps://lnkd.in/dXtfMU-m\n.\nFor more info:\ninfo@taurusweb.it\nwww.taurusweb.it\n#tr #Taurus #inclinedshear #shears #scrap #cesoiainclinata #cesoia #rottame #recycling #Ferrailleur #compactadora #cizalla #pressecisaille #presse #guillotines #Recyclage #Ferrailleur #sucata #sucateros #chatarra #prensa #scrapyard #madeinitaly #scrapunit #Scrapmachine #scrapequipment",
        "likes": "29",
        "comments": "1",
        "shares": "1",
        "time": {
          "raw": "2h",
          "parsed": "18.02.2025",
          "isoString": "2025-02-18T08:23:35.828Z"
        },
        "mediaType": "image",
        "mediaContent": [
          "https://media.licdn.com/dms/image/v2/D4D22AQEgkSnzcSYa6w/feedshare-shrink_800/B4DZT1YQSDHwAo-/0/1739283564181?e=1744243200&v=beta&t=42SlPn3iQ7HQ4gdwCDETotecRHXo1FXhcvnvI8EgAGo"
        ],
        "date": "2025-02-18T08:23:35.828Z"
      },
      {
        "captions": "TAURUS shear baler QUATTRO\nT 1400\n.\nFor more info:\nInfo@taurusweb.it\nwww.taurusweb.it\n\n #taurus #shearbaler #4x4 #pressacesoia #prensa #compactadora #cisaille #presse\n #ferraille #sucata #chatarra #rottame #scrap #scrapmachine #recycling #scrapequipment #recyclingtechnic #madeinitalyTAURUS shear baler QUATTRO\nT 1400\n.\nFor more info:\nInfo@taurusweb.it\nwww.taurusweb.it\n\n #taurus #shearbaler #4x4 #pressacesoia #prensa #compactadora #cisaille #presse\n #ferraille #sucata #chatarra #rottame #scrap #scrapmachine #recycling #scrapequipment #recyclingtechnic #madeinitaly",
        "likes": "25",
        "shares": "2",
        "time": {
          "raw": "3h",
          "parsed": "11.02.2025",
          "isoString": "2025-02-11T08:23:35.829Z"
        },
        "mediaType": "image",
        "mediaContent": [
          "https://media.licdn.com/dms/image/v2/D4D22AQH-62tOYBwdsw/feedshare-shrink_800/B4DZTWuhzcH0Ag-/0/1738769310326?e=1744243200&v=beta&t=xJ0FhPxNLNpTvXQxtHhzxDbWWSGLFcaU4GHqqIpapWo"
        ],
        "date": "2025-02-11T08:23:35.829Z"
      },
      {
        "captions": "A TAURUS SECOND HAND MACHINE\nCutting force T 700\nBox length mm 6000\nCylinder per wing n.2\nElectric motor\n.\nFor more info:\ninfo@taurusweb.it\nwww.taurusweb.it\n#Taurus #shearbaler #secondhand #used #usedmachines #diesel #RecyclingTech #recyclingequipment #recyclingmachine #Scrapmachine #scrap #scrapunit #scrapyard #pressacesoia #cesoia #pressa #rottamepesante #rottame #raccolta #chatarra #sucata #compactadora #fierrosargentinos #fierros #prensa #Ferrailleur #ferraille #Presse  #cisailleA TAURUS SECOND HAND MACHINE\nCutting force T 700\nBox length mm 6000\nCylinder per wing n.2\nElectric motor\n.\nFor more info:\ninfo@taurusweb.it\nwww.taurusweb.it\n#Taurus #shearbaler #secondhand #used #usedmachines #diesel #RecyclingTech #recyclingequipment #recyclingmachine #Scrapmachine #scrap #scrapunit #scrapyard #pressacesoia #cesoia #pressa #rottamepesante #rottame #raccolta #chatarra #sucata #compactadora #fierrosargentinos #fierros #prensa #Ferrailleur #ferraille #Presse  #cisaille",
        "likes": "29",
        "comments": "1",
        "shares": "5",
        "time": {
          "raw": "1ay",
          "parsed": "04.02.2025",
          "isoString": "2025-02-04T08:23:35.831Z"
        },
        "mediaType": "image",
        "mediaContent": [
          "https://media.licdn.com/dms/image/v2/D4D22AQGK34sS9bzb_w/feedshare-shrink_800/B4DZS9GYMpGkAg-/0/1738339354429?e=1744243200&v=beta&t=JaUTjLmAfAvTJ-wXrFJgEvU19TvaSSuEpXri7ow4Djs"
        ],
        "date": "2025-02-04T08:23:35.831Z"
      },
      {
        "captions": "Il nuovo Consiglio d'Amministrazione TAURUS 2025. \nGiovanni Colombo, Chiara Di Montegnacco Colombo e Marta Colombo. \nPresidente Onorario Peter Beyeler perché anche grazie a lui le presse cesoie TAURUS sono le migliori!\nTAURUS, Always a step ahead!\n\nThe new Board of Directors of TAURUS 2025. \nGiovanni Colombo, Chiara Di Montegnacco Colombo and Marta Colombo. \nHonorary President Peter Beyeler because also thanks to him TAURUS shear balers are the best!\nTAURUS, always a step ahead!Il nuovo Consiglio d'Amministrazione TAURUS 2025. \nGiovanni Colombo, Chiara Di Montegnacco Colombo e Marta Colombo. \nPresidente Onorario Peter Beyeler perché anche grazie a lui le presse cesoie TAURUS sono le migliori!\nTAURUS, Always a step ahead!\n\nThe new Board of Directors of TAURUS 2025. \nGiovanni Colombo, Chiara Di Montegnacco Colombo and Marta Colombo. \nHonorary President Peter Beyeler because also thanks to him TAURUS shear balers are the best!\nTAURUS, always a step ahead!",
        "likes": "36",
        "comments": "5",
        "shares": "1",
        "time": {
          "raw": "1ay",
          "parsed": "04.02.2025",
          "isoString": "2025-02-04T08:23:35.832Z"
        },
        "mediaType": "image",
        "mediaContent": [
          "https://media.licdn.com/dms/image/v2/D4D22AQEWcyqb0_FzGg/feedshare-shrink_2048_1536/B4DZSJz67yG4Aw-/0/1737478877363?e=1744243200&v=beta&t=vUyYdDzY735k2Ve2oPagprpWbY4XYnp1CoZAc_wMZFQ"
        ],
        "date": "2025-02-04T08:23:35.832Z"
      },
      {
        "captions": "“CAT”, the transportable shear baler on tracked vehicle that adapts to your working needs.\nThe transportable shear baler has 2 independent remote controls, one for the shear and the other one for the traked vehicle: \"2\" is for safety, \"2\" is for ease of use; \"2\" is for not making mistakes, \"2\" is because 2 are the machines that make up the unit.\nDiscover more:\nhttps://lnkd.in/dHqMhpZJ\n.\nFor more info:\ninfo@taurusweb.it\nwww.taurusweb.it\n\n#Taurus #cat #tracks #transportable #shearbaler #pressacesoia #cingoli #mezzocingolato #trasportabile #scrapunit #scrapyard #cantiere #rottame #rottamepesante #recyclingmachines #RecyclingTech #recyclingequipment #recycling #Scrapmachine #madeinitaly “CAT”, the transportable shear baler on tracked vehicle that adapts to your working needs.\nThe transportable shear baler has 2 independent remote controls, one for the shear and the other one for the traked vehicle: \"2\" is for safety, \"2\" is for ease of use; \"2\" is for not making mistakes, \"2\" is because 2 are the machines that make up the unit.\nDiscover more:\nhttps://lnkd.in/dHqMhpZJ\n.\nFor more info:\ninfo@taurusweb.it\nwww.taurusweb.it\n\n#Taurus #cat #tracks #transportable #shearbaler #pressacesoia #cingoli #mezzocingolato #trasportabile #scrapunit #scrapyard #cantiere #rottame #rottamepesante #recyclingmachines #RecyclingTech #recyclingequipment #recycling #Scrapmachine #madeinitaly",
        "likes": "49",
        "comments": "1",
        "shares": "4",
        "time": {
          "raw": "1ay",
          "parsed": "04.02.2025",
          "isoString": "2025-02-04T08:23:35.835Z"
        },
        "mediaType": "image",
        "mediaContent": [
          "https://media.licdn.com/dms/image/v2/D4D22AQHKzKHOyak7TQ/feedshare-shrink_800/B4DZR1AofsHkAg-/0/1737129889463?e=1744243200&v=beta&t=_RnIagIAKdZmtfOhKRJUtul_bEc9A7ve1tX8Hkz96P0"
        ],
        "date": "2025-02-04T08:23:35.835Z"
      },
      {
        "captions": "TAURUS shear baler QUATTRO\nAlways a step ahead!\n.\nFor more info:\ninfo@taurusweb.it\nwww.taurusweb.it\n#Taurus #shearbaler #Scrapmachine #scrapyard #scrap #rottame #pressacesoia #recyclingtechnology #RecyclingTech #Ferrailleur #ferraille #pressecisaille #Ferrailleur #presse #cylinder #4x4 #chatarras #chatarreros #sucata #circulareconomy #madeinitaly #recyclingequipment #heavyscrap #demolition #rottamepesante #heavyequipment #heavy #lightTAURUS shear baler QUATTRO\nAlways a step ahead!\n.\nFor more info:\ninfo@taurusweb.it\nwww.taurusweb.it\n#Taurus #shearbaler #Scrapmachine #scrapyard #scrap #rottame #pressacesoia #recyclingtechnology #RecyclingTech #Ferrailleur #ferraille #pressecisaille #Ferrailleur #presse #cylinder #4x4 #chatarras #chatarreros #sucata #circulareconomy #madeinitaly #recyclingequipment #heavyscrap #demolition #rottamepesante #heavyequipment #heavy #light",
        "likes": "20",
        "shares": "4",
        "time": {
          "raw": "1ay",
          "parsed": "04.02.2025",
          "isoString": "2025-02-04T08:23:35.839Z"
        },
        "mediaType": "image",
        "mediaContent": [
          "https://media.licdn.com/dms/image/v2/D4D22AQGKJZaKu4NcIg/feedshare-shrink_800/B4DZRq18ubHYAg-/0/1736959315696?e=1744243200&v=beta&t=kXgSQkiSo8TAi2MvlqoqRI95e1FCt1jeX-fqVCn9Q44"
        ],
        "date": "2025-02-04T08:23:35.839Z"
      },
      {
        "captions": "HAPPY NEW 2025 \nby CHAOS\n.\nFor more info:\ninfo@taurusweb.it\nwww.taurusweb.it\n\n#TAURUS #shearbale #pressacesoia #rottame #scrap #recycling #riciclo #circulareconomy #recyclingequipment #scrapmachine #scrapyard #rottamaio #ferraille #pressecisaille #compactadora #chatarra #sucata #cisalla #recyclingtechnology HAPPY NEW 2025 \nby CHAOS\n.\nFor more info:\ninfo@taurusweb.it\nwww.taurusweb.it\n\n#TAURUS #shearbale #pressacesoia #rottame #scrap #recycling #riciclo #circulareconomy #recyclingequipment #scrapmachine #scrapyard #rottamaio #ferraille #pressecisaille #compactadora #chatarra #sucata #cisalla #recyclingtechnology",
        "likes": "16",
        "shares": "2",
        "time": {
          "raw": "1ay",
          "parsed": "03.02.2025",
          "isoString": "2025-02-03T14:20:34.451Z"
        },
        "mediaType": "image",
        "mediaContent": [
          "https://media.licdn.com/dms/image/v2/D4D22AQEtJfFJHszh6A/feedshare-shrink_800/B4DZRgVVAAHIAs-/0/1736782992024?e=1743638400&v=beta&t=mj59dA3OleOKIZWSNGHBlJ2SASue_m3YnL-V7nYcBhM"
        ],
        "date": "2025-02-03T14:20:34.451Z"
      },
      {
        "captions": "E762 - shearing force T 700\nA versatile machine that produces light scrap, E.L.V and collected scrap to be sent to mill. It is capable of shearing heavy scrap and demolition scrap ready for fournace  with low operating costs.\nAN INVESTMENT THAT PAYS ITSELF QUICKLY!\nhttps://lnkd.in/dqVxv-XU\n.\nFor more info:\ninfo@taurusweb.it\nwww.taurusweb.it\n\n#Taurus #shearbaler #cisalle  #prensacizalla #pressacesoia #rottame #scrap #ferraille #chatarra #sucata #sucatas #circulareconomy #Scrapmachine #Technology #scrapequipment #scraplife #scrapmetalrecycling #scrapmetal #recyclingequipment #hydraulics #HydraulicMachine #madeinitaly #metalrecycling E762 - shearing force T 700\nA versatile machine that produces light scrap, E.L.V and collected scrap to be sent to mill. It is capable of shearing heavy scrap and demolition scrap ready for fournace  with low operating costs.\nAN INVESTMENT THAT PAYS ITSELF QUICKLY!\nhttps://lnkd.in/dqVxv-XU\n.\nFor more info:\ninfo@taurusweb.it\nwww.taurusweb.it\n\n#Taurus #shearbaler #cisalle  #prensacizalla #pressacesoia #rottame #scrap #ferraille #chatarra #sucata #sucatas #circulareconomy #Scrapmachine #Technology #scrapequipment #scraplife #scrapmetalrecycling #scrapmetal #recyclingequipment #hydraulics #HydraulicMachine #madeinitaly #metalrecycling",
        "likes": "17",
        "shares": "1",
        "time": {
          "raw": "1ay",
          "parsed": "03.02.2025",
          "isoString": "2025-02-03T14:20:34.453Z"
        },
        "mediaType": "image",
        "mediaContent": [
          "https://media.licdn.com/dms/image/v2/D4D22AQEPjiL8H_i7ZA/feedshare-shrink_800/B4DZRQj6AHHkAg-/0/1736518378924?e=1743638400&v=beta&t=PYKq-0Jl2mlPx1tECjQBMi8DXlv0TLrCmd8KWFevNPw"
        ],
        "date": "2025-02-03T14:20:34.453Z"
      },
      {
        "captions": "TAURUS wishes you a Happy New Year!TAURUS wishes you a Happy New Year!",
        "likes": "13",
        "comments": "1",
        "time": {
          "raw": "2ay",
          "parsed": "03.01.2025",
          "isoString": "2025-01-03T14:20:34.454Z"
        },
        "mediaType": "image",
        "mediaContent": [
          "https://media.licdn.com/dms/image/v2/D4D22AQE1R30P6qcreQ/feedshare-shrink_800/B4DZQXLyLdGkAg-/0/1735555753123?e=1743638400&v=beta&t=YkAQmyhyFB47CzHrvMk0lVJZiDmFStx56Zdx7_vgxX4"
        ],
        "date": "2025-01-03T14:20:34.454Z"
      },
      {
        "captions": "Merry Christmas and Happy New Year!\nby TAURUS\n\n#Taurus #shearbaler #scrap #scrapbale #Gift #christmasgifts #makeawish #christmas2024 #NewYear2025 #italy #madeinitaly #recyclingequipment #recycling #CircularEconomy #Scrapmachine #scrapprocessing #scrapsolution Merry Christmas and Happy New Year!\nby TAURUS\n\n#Taurus #shearbaler #scrap #scrapbale #Gift #christmasgifts #makeawish #christmas2024 #NewYear2025 #italy #madeinitaly #recyclingequipment #recycling #CircularEconomy #Scrapmachine #scrapprocessing #scrapsolution",
        "likes": "8",
        "shares": "1",
        "time": {
          "raw": "2ay",
          "parsed": "03.01.2025",
          "isoString": "2025-01-03T14:20:34.456Z"
        },
        "mediaType": "image",
        "mediaContent": [
          "https://media.licdn.com/dms/image/v2/D4D22AQFqlp-E-vjqVQ/feedshare-shrink_800/B4DZPjhg6MGUAg-/0/1734689035118?e=1743638400&v=beta&t=w9WHhD_fb1kfGX64bANaZhUlbrANHoDkdrb06WOd0_4"
        ],
        "date": "2025-01-03T14:20:34.456Z"
      },
      {
        "captions": "TAURUS SHEAR BALER EVO\nT 650\nIvo Nyffenegger\n.\nFor more info:\ninfo@taurusweb.it\nwww.taurusweb.it\n\n#Taurus #shearbaler #recyclingequipment #recyclingmachine\n#scrapprocessing #Scrapmachine #scrap #MadeInItaly #circulareconomy #recyclingtechniqueTAURUS SHEAR BALER EVO\nT 650\nIvo Nyffenegger\n.\nFor more info:\ninfo@taurusweb.it\nwww.taurusweb.it\n\n#Taurus #shearbaler #recyclingequipment #recyclingmachine\n#scrapprocessing #Scrapmachine #scrap #MadeInItaly #circulareconomy #recyclingtechnique",
        "likes": "20",
        "shares": "2",
        "time": {
          "raw": "2ay",
          "parsed": "03.01.2025",
          "isoString": "2025-01-03T14:20:34.457Z"
        },
        "mediaType": "image",
        "mediaContent": [
          "https://media.licdn.com/dms/image/v2/D4D22AQGE28J70eOs_Q/feedshare-shrink_800/B4DZPVZ2cKHgAg-/0/1734452144538?e=1743638400&v=beta&t=KwyjqVu2ZVfOgHMGZtTSFwfl_93t_sMhh5AY3S4j02o"
        ],
        "date": "2025-01-03T14:20:34.457Z"
      },
      {
        "captions": "CHAOS SHEAR BALER\nby TAURUS\n.\nFor more info:\ninfo@taurusweb.it\nwww.taurusweb.it\n\n#Taurus #pressacesoia #shearbaler #chaos #technology #future #futuremachine #equipment #discover #madeinitaly #Recyclingtechnik #recycling #Scrapmachine #scrapprocessing #Ferrailleur #chatarra #sucataCHAOS SHEAR BALER\nby TAURUS\n.\nFor more info:\ninfo@taurusweb.it\nwww.taurusweb.it\n\n#Taurus #pressacesoia #shearbaler #chaos #technology #future #futuremachine #equipment #discover #madeinitaly #Recyclingtechnik #recycling #Scrapmachine #scrapprocessing #Ferrailleur #chatarra #sucata",
        "likes": "15",
        "shares": "2",
        "time": {
          "raw": "2ay",
          "parsed": "03.01.2025",
          "isoString": "2025-01-03T14:20:34.459Z"
        },
        "mediaType": "image",
        "mediaContent": [
          "https://media.licdn.com/dms/image/v2/D4D22AQHXOdplL3HiGw/feedshare-shrink_800/feedshare-shrink_800/0/1733849598407?e=1743638400&v=beta&t=6LfZrsRmrrHdzDcnh32wS-OGm2Alq6fAco_My3PY7xM"
        ],
        "date": "2025-01-03T14:20:34.459Z"
      },
      {
        "captions": "TAURUS SHEAR BALER \nT 1400\nTESTING TIME\n.\nFor more info:\ninfo@taurusweb.it\nwww.taurusweb.it\n\n#Taurus #shearbaler #HeavyDutyEquipment #heavydutymachines #heavydutyshear #shearing #TestingMachine #scrapprocessing #Scrapmachine #Recyclingtechnik #recyclingequipment #RecyclingTechnology #rottame #cesoia #pressacesoia #reciclagem #recyclage #Recycle #circulareconomy #demolizione #collaudo #cisaille #pressecisaille #ferraille #Ferrailleur #compactadora #sucata #prensa #cisalla #chatarra",
        "likes": "50",
        "comments": "3",
        "shares": "4",
        "time": {
          "raw": "2ay",
          "parsed": "03.01.2025",
          "isoString": "2025-01-03T14:20:34.460Z"
        },
        "mediaType": "video",
        "mediaContent": {
          "src": [
            {
              "src": "https://dms.licdn.com/playlist/vid/v2/D4D05AQFqyBTT3brUCA/mp4-640p-30fp-crf28/mp4-640p-30fp-crf28/0/1733324113930?e=1741618800&v=beta&t=kwpXeYaSeM-uHrZMVKbKjYsYMmK8wzesh9IygevjYjs",
              "type": "video/mp4",
              "data-bitrate": 297858
            },
            {
              "src": "https://dms.licdn.com/playlist/vid/v2/D4D05AQFqyBTT3brUCA/mp4-720p-30fp-crf28/mp4-720p-30fp-crf28/0/1733324116342?e=1741618800&v=beta&t=RtM5KcyKNz3OvxipoKvlPp5m_3fiVW44EZAM4WDOJT4",
              "type": "video/mp4",
              "data-bitrate": 403074
            }
          ],
          "posterUrl": "https://media.licdn.com/dms/image/v2/D4D05AQFqyBTT3brUCA/videocover-high/videocover-high/0/1733324103614?e=1741618800&v=beta&t=8pFF6Jd-ZbLlo-xhFTRSaRWdW3UzcI3J95je_6XZWnY"
        },
        "date": "2025-01-03T14:20:34.460Z"
      },
      {
        "captions": "Dopo 40.000 ore di onorato lavoro\nil nuovo che avanza!\n.\nPer maggiori informazioni:\ninfo@taurusweb.it\nwww.taurusweb.it\n\n#taurus #4x4 #shearbaler #scrapprocessing #Scrapmachine #Recyclingtechnik #recyclingequipment #scraprecycling #recycling #madeinitaly #heavydutyequipment #heavydutymachines #rottami #rottame #pressacesoia #cisaille #pressecisaille #prensa #cisalla #compactadora #chatarreros #sucata #chatarra  Dopo 40.000 ore di onorato lavoro\nil nuovo che avanza!\n.\nPer maggiori informazioni:\ninfo@taurusweb.it\nwww.taurusweb.it\n\n#taurus #4x4 #shearbaler #scrapprocessing #Scrapmachine #Recyclingtechnik #recyclingequipment #scraprecycling #recycling #madeinitaly #heavydutyequipment #heavydutymachines #rottami #rottame #pressacesoia #cisaille #pressecisaille #prensa #cisalla #compactadora #chatarreros #sucata #chatarra",
        "likes": "23",
        "shares": "2",
        "time": {
          "raw": "3ay",
          "parsed": "03.12.2024",
          "isoString": "2024-12-03T14:20:34.462Z"
        },
        "mediaType": "image",
        "mediaContent": [
          "https://media.licdn.com/dms/image/v2/D4D22AQFh9CU52YAvSA/feedshare-shrink_800/feedshare-shrink_800/0/1732811826392?e=1743638400&v=beta&t=y2v75jjOtNbMgXpuUXUzY-JMONw5lJJ1Pz_45jrnEyM"
        ],
        "date": "2024-12-03T14:20:34.462Z"
      },
      {
        "captions": "TAURUS BLULINE shear baler \n750 T\n.\nFor more info:\ninfo@taurusweb.it\nwww.taurusweb.it\n\n#Taurus #shearbaler #shear #cuttingforce #scrapprocessing #scrap #Scrapmachine #rottame #chatarra #chatarreros #Ferrailleur #ferraille #madeinitaly #pressacesoia #pressa #Recyclingtechnik #recyclingequipment #recyclage #recycling #recyclingsolutions",
        "likes": "17",
        "shares": "4",
        "time": {
          "raw": "3ay",
          "parsed": "03.12.2024",
          "isoString": "2024-12-03T14:20:34.463Z"
        },
        "mediaType": "video",
        "mediaContent": {
          "src": [
            {
              "src": "https://dms.licdn.com/playlist/vid/v2/D4D05AQHpOtQpUtE-TQ/mp4-640p-30fp-crf28/mp4-640p-30fp-crf28/0/1732552750210?e=1741618800&v=beta&t=bq1MSD3fgJqhfTjvzhK5O6XL_H2g-gQD8zXH3VpaJYM",
              "type": "video/mp4",
              "data-bitrate": 547984
            },
            {
              "src": "https://dms.licdn.com/playlist/vid/v2/D4D05AQHpOtQpUtE-TQ/mp4-720p-30fp-crf28/mp4-720p-30fp-crf28/0/1732552750704?e=1741618800&v=beta&t=jKkOZGPzYQH5_a2BX3-IsSzes1n5S1C_CNiAgDpX3yE",
              "type": "video/mp4",
              "data-bitrate": 653600
            }
          ],
          "posterUrl": "https://media.licdn.com/dms/image/v2/D4D05AQHpOtQpUtE-TQ/videocover-high/videocover-high/0/1732552742996?e=1741618800&v=beta&t=1zEcG8VhcezshoCGecJs8jFQzQ7wUJUHS9nZDIdJr-c"
        },
        "date": "2024-12-03T14:20:34.463Z"
      },
      {
        "captions": "TAURUS BLULINE SHEAR BALER\nT 800\nIvo Nyffenegger\n.\nFor more info:\ninfo@taurusweb.it\nwww.taurusweb.it\n\n#Taurus #pressacesoia #pressa #cesoia #shearingforce #shears #Balers #shearbalers #scrapequiment #scrap #Scrapmachine #Recyclingtechnik #recyclingequipment #recycling #heavymachine #circulareconomy #cisalla #prensa #cisalle #compactadora #chatarra #Ferrailleur #ferraille #chatarreros #sucata #maquinasindustriales #prensadecorte TAURUS BLULINE SHEAR BALER\nT 800\nIvo Nyffenegger\n.\nFor more info:\ninfo@taurusweb.it\nwww.taurusweb.it\n\n#Taurus #pressacesoia #pressa #cesoia #shearingforce #shears #Balers #shearbalers #scrapequiment #scrap #Scrapmachine #Recyclingtechnik #recyclingequipment #recycling #heavymachine #circulareconomy #cisalla #prensa #cisalle #compactadora #chatarra #Ferrailleur #ferraille #chatarreros #sucata #maquinasindustriales #prensadecorte",
        "likes": "28",
        "shares": "2",
        "time": {
          "raw": "3ay",
          "parsed": "03.12.2024",
          "isoString": "2024-12-03T14:20:34.464Z"
        },
        "mediaType": "image",
        "mediaContent": [
          "https://media.licdn.com/dms/image/v2/D4D22AQHjHO7DIjhTig/feedshare-shrink_800/feedshare-shrink_800/0/1732285313726?e=1743638400&v=beta&t=9KucYyvbaKh9kUqzlQbdEFZKTLodHM1ieYN-n1wI4Dc"
        ],
        "date": "2024-12-03T14:20:34.464Z"
      }
    ]
  },
  {
    "name": "JiangsuHuahongMachinery",
    "followerData": [
      [
        20250225,
        100
      ],
      [
        20250225,
        100
      ],
      [
        20250225,
        100
      ],
      [
        20250228,
        102
      ],
      [
        20250228,
        102
      ],
      [
        20250228,
        102
      ],
      [
        20250228,
        102
      ],
      [
        20250303,
        101
      ],
      [
        1741011655199,
        "101"
      ],
      [
        1741076630559,
        "101"
      ]
    ],
    "data": [
      {
        "captions": "scrap rebar Baler machine, export to Asia customer today.scrap rebar Baler machine, export to Asia customer today.",
        "shares": "1",
        "time": {
          "raw": "4g",
          "parsed": "28.02.2025",
          "isoString": "2025-02-28T08:23:50.298Z"
        },
        "mediaType": "image",
        "mediaContent": [
          "https://media.licdn.com/dms/image/v2/D4E22AQEATgr2DMNMKA/feedshare-shrink_800/B4EZVLbg0hHgAg-/0/1740727261342?e=1744243200&v=beta&t=UnjsQeJcLlTUX5rkQOzKmSHRx5kCUYrwYk2sCozRU6s"
        ],
        "date": "2025-02-28T08:23:50.298Z"
      },
      {
        "captions": "120ton scrap metal shear to Asia customer120ton scrap metal shear to Asia customer",
        "likes": "1",
        "shares": "1",
        "time": {
          "raw": "4g",
          "parsed": "28.02.2025",
          "isoString": "2025-02-28T08:23:50.299Z"
        },
        "mediaType": "image",
        "mediaContent": [
          "https://media.licdn.com/dms/image/v2/D5622AQFSFXAvV417oQ/feedshare-shrink_800/B56ZVGnXCnHEAg-/0/1740646479734?e=1744243200&v=beta&t=iiA-Fcb2sqlA3N9Bs4niz-8gdG4omFykG70n6oA5_fY"
        ],
        "date": "2025-02-28T08:23:50.299Z"
      },
      {
        "captions": "135ton scrap aluminum baler, export to middle east today.135ton scrap aluminum baler, export to middle east today.",
        "likes": "4",
        "shares": "1",
        "time": {
          "raw": "5g",
          "parsed": "27.02.2025",
          "isoString": "2025-02-27T08:23:50.300Z"
        },
        "mediaType": "image",
        "mediaContent": [
          "https://media.licdn.com/dms/image/v2/D5622AQFbZLG5Aoq8mg/feedshare-shrink_800/B56ZVGf7.6GUAg-/0/1740644535381?e=1744243200&v=beta&t=M25LMi7qQELoY0HzAvThR1ggL2Q7HbYKPy3yy8Lb1wU"
        ],
        "date": "2025-02-27T08:23:50.300Z"
      },
      {
        "captions": "315ton scrap metal Baler, export to America today.315ton scrap metal Baler, export to America today.",
        "likes": "1",
        "shares": "1",
        "time": {
          "raw": "1h",
          "parsed": "25.02.2025",
          "isoString": "2025-02-25T08:23:50.303Z"
        },
        "mediaType": "image",
        "mediaContent": [
          "https://media.licdn.com/dms/image/v2/D5622AQHeXQsx-U7Yow/feedshare-shrink_800/B56ZUrwKUvHoAg-/0/1740195808223?e=1744243200&v=beta&t=ozPEJ2kbAkO4I29f6SqpcFuvT7NwBe8yhXsWRDzL2zk"
        ],
        "date": "2025-02-25T08:23:50.303Z"
      },
      {
        "captions": "one more big baler, export to Africa today.one more big baler, export to Africa today.",
        "likes": "2",
        "shares": "1",
        "time": {
          "raw": "1h",
          "parsed": "25.02.2025",
          "isoString": "2025-02-25T08:23:50.310Z"
        },
        "mediaType": "image",
        "mediaContent": [
          "https://media.licdn.com/dms/image/v2/D5622AQFXL-lgwSoC0A/feedshare-shrink_800/B56ZUiGuDUHQAo-/0/1740033944148?e=1744243200&v=beta&t=7mXhyJiW428OPOD6WsOlrWU22rZ4Zw9EdDuITqdveUQ"
        ],
        "date": "2025-02-25T08:23:50.310Z"
      },
      {
        "captions": "plastic baler, ship to customer today.",
        "likes": "1",
        "shares": "1",
        "time": {
          "raw": "2h",
          "parsed": "18.02.2025",
          "isoString": "2025-02-18T08:23:50.311Z"
        },
        "mediaType": "video",
        "mediaContent": {
          "src": [
            {
              "src": "https://dms.licdn.com/playlist/vid/v2/D5605AQG0MR4XDBd_Qw/mp4-720p-30fp-crf28/B56ZUH0xHMGsBg-/0/1739593036416?e=1741683600&v=beta&t=BtNt9Yerifica7dq0A1jf_qPj6af1haUEwCfveuK4wk",
              "type": "video/mp4",
              "data-bitrate": 1707766
            },
            {
              "src": "https://dms.licdn.com/playlist/vid/v2/D5605AQG0MR4XDBd_Qw/mp4-640p-30fp-crf28/B56ZUH0xHMGsBc-/0/1739593036495?e=1741683600&v=beta&t=YHplqjKJ8rXs-6gjoZuhMRC5FJowFzTSWDHMeNYzGPM",
              "type": "video/mp4",
              "data-bitrate": 1103266
            }
          ],
          "posterUrl": "https://media.licdn.com/dms/image/v2/D5605AQG0MR4XDBd_Qw/videocover-high/B56ZUH0xHMGsBs-/0/1739593036020?e=1741683600&v=beta&t=RJWAB2YurkqFqLuCGHEi9Y6YOkrn61Jj4rb_PpaqqOk"
        },
        "date": "2025-02-18T08:23:50.311Z"
      },
      {
        "captions": "old model of 450 hammer shredder, export to Asia today.old model of 450 hammer shredder, export to Asia today.",
        "likes": "2",
        "comments": "1",
        "shares": "1",
        "time": {
          "raw": "2h",
          "parsed": "18.02.2025",
          "isoString": "2025-02-18T08:23:50.312Z"
        },
        "mediaType": "image",
        "mediaContent": [
          "https://media.licdn.com/dms/image/v2/D5622AQFi3cNVbJX3wA/feedshare-shrink_800/B56ZT.LxRvHQAg-/0/1739431290261?e=1744243200&v=beta&t=uxaRzfWwN-UEd73POdPtDF8QA8AlItL8j6Qz9zpIHQk"
        ],
        "date": "2025-02-18T08:23:50.312Z"
      },
      {
        "captions": "800hp hammer mill shredder, export to customer today. this line will include PDM magnet sorting.800hp hammer mill shredder, export to customer today. this line will include PDM magnet sorting.",
        "likes": "2",
        "shares": "1",
        "time": {
          "raw": "1ay",
          "parsed": "04.02.2025",
          "isoString": "2025-02-04T08:23:50.313Z"
        },
        "mediaType": "image",
        "mediaContent": [
          "https://media.licdn.com/dms/image/v2/D5622AQFtBK2TRXdCgw/feedshare-shrink_800/B56ZSHTofMH0As-/0/1737436861732?e=1744243200&v=beta&t=DOFs-FOJ4LS-tS85FzrrwXLZwa_YRDDb4Iir404_7fo"
        ],
        "date": "2025-02-04T08:23:50.313Z"
      },
      {
        "captions": "630ton scrap metal baler, with diesel engine, export to customer today.630ton scrap metal baler, with diesel engine, export to customer today.",
        "likes": "2",
        "shares": "1",
        "time": {
          "raw": "1ay",
          "parsed": "04.02.2025",
          "isoString": "2025-02-04T08:23:50.314Z"
        },
        "mediaType": "image",
        "mediaContent": [
          "https://media.licdn.com/dms/image/v2/D5622AQEbSIxjxSTgsg/feedshare-shrink_800/B56ZSHS479H0Ag-/0/1737436667560?e=1744243200&v=beta&t=MHeUjwuWLYLBkYfHQFJ-ex0ibawziCaBQ8cw-uoVVXA"
        ],
        "date": "2025-02-04T08:23:50.314Z"
      },
      {
        "captions": "before Chinese new year holiday, export one Baler machine to India.before Chinese new year holiday, export one Baler machine to India.",
        "likes": "3",
        "shares": "1",
        "time": {
          "raw": "1ay",
          "parsed": "04.02.2025",
          "isoString": "2025-02-04T08:23:50.316Z"
        },
        "mediaType": "image",
        "mediaContent": [
          "https://media.licdn.com/dms/image/v2/D5622AQHMMc2cRRDpBA/feedshare-shrink_800/B56ZR9bmZXGsAg-/0/1737271176715?e=1744243200&v=beta&t=JRAuBUQPTqmYxisPIt_Gf6P0koJI4fXVe_dDng1RpoQ"
        ],
        "date": "2025-02-04T08:23:50.316Z"
      },
      {
        "captions": "630ton scrap metal baler, customized with Royal yellow painting, ship to Asia customer today.630ton scrap metal baler, customized with Royal yellow painting, ship to Asia customer today.",
        "likes": "4",
        "shares": "1",
        "time": {
          "raw": "1ay",
          "parsed": "04.02.2025",
          "isoString": "2025-02-04T08:23:50.318Z"
        },
        "mediaType": "image",
        "mediaContent": [
          "https://media.licdn.com/dms/image/v2/D5622AQFkY2RhrTNoew/feedshare-shrink_800/B56ZRy5b38GoAg-/0/1737094454529?e=1744243200&v=beta&t=9XPjCBg06MDLRN5uRY_mj0-f4VJ71dyaBEwFUq9JAtU"
        ],
        "date": "2025-02-04T08:23:50.318Z"
      },
      {
        "captions": "250ton Baler machine, export to America today.250ton Baler machine, export to America today.",
        "likes": "1",
        "comments": "1",
        "shares": "1",
        "time": {
          "raw": "1ay",
          "parsed": "04.02.2025",
          "isoString": "2025-02-04T08:23:50.319Z"
        },
        "mediaType": "image",
        "mediaContent": [
          "https://media.licdn.com/dms/image/v2/D5622AQEpFtb7tC7qUw/feedshare-shrink_800/B56ZRyKUxjG8Ag-/0/1737082099793?e=1744243200&v=beta&t=J8FkghSZU14YBAhIqOzVyS6IeHkHZiQfqCdjTq4xebk"
        ],
        "date": "2025-02-04T08:23:50.319Z"
      },
      {
        "captions": "scrap aluminum baler machine, export to Africa today.scrap aluminum baler machine, export to Africa today.",
        "likes": "1",
        "shares": "1",
        "time": {
          "raw": "1ay",
          "parsed": "04.02.2025",
          "isoString": "2025-02-04T08:23:50.320Z"
        },
        "mediaType": "image",
        "mediaContent": [
          "https://media.licdn.com/dms/image/v2/D5622AQFzZzUmmZy9mw/feedshare-shrink_800/B56ZRooi19G8Ag-/0/1736922248856?e=1744243200&v=beta&t=6c6dxWvxAPr7R7XGS_jROpuv_vJUCP15JDbs5ta42No"
        ],
        "date": "2025-02-04T08:23:50.320Z"
      },
      {
        "captions": "scrap bale pre shredder, export to customer today.scrap bale pre shredder, export to customer today.",
        "likes": "2",
        "shares": "1",
        "time": {
          "raw": "1ay",
          "parsed": "04.02.2025",
          "isoString": "2025-02-04T08:23:50.321Z"
        },
        "mediaType": "image",
        "mediaContent": [
          "https://media.licdn.com/dms/image/v2/D5622AQFdXtCc3LpB0Q/feedshare-shrink_800/B56ZRklWMiHQAg-/0/1736854301460?e=1744243200&v=beta&t=8o9R5TumxXEtR703lDXyjFVJXl_ugkBu2tnPSpy5T-E"
        ],
        "date": "2025-02-04T08:23:50.321Z"
      },
      {
        "captions": "160ton scrap metal baler, export to Indonesia today.160ton scrap metal baler, export to Indonesia today.",
        "likes": "2",
        "shares": "1",
        "time": {
          "raw": "1ay",
          "parsed": "04.02.2025",
          "isoString": "2025-02-04T08:23:50.323Z"
        },
        "mediaType": "image",
        "mediaContent": [
          "https://media.licdn.com/dms/image/v2/D5622AQEGpuNInq8Z5A/feedshare-shrink_800/B56ZRkOikcGQAo-/0/1736848322661?e=1744243200&v=beta&t=Xs41pmNA_Hwl5tO2TpdLyHVo7muQYT_vHoabSB6xoyE"
        ],
        "date": "2025-02-04T08:23:50.323Z"
      },
      {
        "captions": "2025year: 3rd container, one more 800ton container shear machine, ship to our customer.2025year: 3rd container, one more 800ton container shear machine, ship to our customer.",
        "likes": "1",
        "shares": "1",
        "time": {
          "raw": "2ay",
          "parsed": "04.01.2025",
          "isoString": "2025-01-04T08:23:50.324Z"
        },
        "mediaType": "image",
        "mediaContent": [
          "https://media.licdn.com/dms/image/v2/D5622AQFMhye6E5AjXg/feedshare-shrink_800/B56ZQqsXefHQAk-/0/1735883064021?e=1744243200&v=beta&t=-vXxlDAzh45HoVVl4t4XCWs38_ATWb1x_LX3w63pweg"
        ],
        "date": "2025-01-04T08:23:50.324Z"
      },
      {
        "captions": "2025 year 2nd container: 200ton alligator shear shipping to rolling mill customer.2025 year 2nd container: 200ton alligator shear shipping to rolling mill customer.",
        "likes": "2",
        "shares": "1",
        "time": {
          "raw": "2ay",
          "parsed": "04.01.2025",
          "isoString": "2025-01-04T08:23:50.325Z"
        },
        "mediaType": "image",
        "mediaContent": [
          "https://media.licdn.com/dms/image/v2/D5622AQGDVlI55OecNQ/feedshare-shrink_800/B56ZQlhe2PGsAk-/0/1735796324730?e=1744243200&v=beta&t=LB_1GjbEynTTx__ysCK9ZQSvTaSuMAcvON29ZGMqjew"
        ],
        "date": "2025-01-04T08:23:50.325Z"
      },
      {
        "captions": "2025 year first container: 800ton container shear shipping to my old customer.2025 year first container: 800ton container shear shipping to my old customer.",
        "likes": "1",
        "shares": "1",
        "time": {
          "raw": "2ay",
          "parsed": "04.01.2025",
          "isoString": "2025-01-04T08:23:50.326Z"
        },
        "mediaType": "image",
        "mediaContent": [
          "https://media.licdn.com/dms/image/v2/D5622AQGlFLHYZ8IPbg/feedshare-shrink_800/B56ZQlg1uEH0Ak-/0/1735796159220?e=1744243200&v=beta&t=BJj4wtMWE1Ky904FjMxFK0kiIsVb-FfBwGkRnuOzmYI"
        ],
        "date": "2025-01-04T08:23:50.326Z"
      },
      {
        "captions": "3 shear machines finished inspection, and ready for shipment to Africa.3 shear machines finished inspection, and ready for shipment to Africa.",
        "likes": "1",
        "shares": "1",
        "time": {
          "raw": "2ay",
          "parsed": "04.01.2025",
          "isoString": "2025-01-04T08:23:50.327Z"
        },
        "mediaType": "image",
        "mediaContent": [
          "https://media.licdn.com/dms/image/v2/D5622AQHTR37IFLn7wQ/feedshare-shrink_800/B56ZPhrb6lGsAk-/0/1734658082554?e=1744243200&v=beta&t=iSn7YXiS-Hz00FixODdkG3ULOrFPsHywSkdkv0cVBho"
        ],
        "date": "2025-01-04T08:23:50.327Z"
      },
      {
        "captions": "new design of 500ton gantry shear, all parts dismantled to load normal container for our Asian customer.new design of 500ton gantry shear, all parts dismantled to load normal container for our Asian customer.",
        "likes": "3",
        "shares": "1",
        "time": {
          "raw": "2ay",
          "parsed": "04.01.2025",
          "isoString": "2025-01-04T08:23:50.328Z"
        },
        "mediaType": "image",
        "mediaContent": [
          "https://media.licdn.com/dms/image/v2/D5622AQEyB5uE81hJlg/feedshare-shrink_800/feedshare-shrink_800/0/1733816582167?e=1744243200&v=beta&t=18eeziIjIT14r5TYWyTO3AOZA2scXXMHtX9yzf7ZgOc"
        ],
        "date": "2025-01-04T08:23:50.328Z"
      }
    ]
  },
  {
    "name": "IdromecSpa",
    "followerData": [
      [
        20250225,
        738
      ],
      [
        20250225,
        738
      ],
      [
        20250225,
        738
      ],
      [
        20250228,
        741
      ],
      [
        20250228,
        741
      ],
      [
        20250228,
        741
      ],
      [
        20250228,
        741
      ],
      [
        20250303,
        742
      ],
      [
        1741011674310,
        "742"
      ],
      [
        1741076644997,
        "743"
      ]
    ],
    "data": [
      {
        "captions": "Exciting new 1400 ton Shear for our recycling facility in Bakersfield !On Location in Mozzecane Italy!!\n\nIt was exciting to see our new 1400ton Shear being loaded out for our own facility Sierra Recycling & Demolition!!!!\n\nCan’t wait for its arrival!!!",
        "likes": "40",
        "comments": "3",
        "shares": "5",
        "time": {
          "raw": "3h3h",
          "parsed": "04.03.2025",
          "isoString": "2025-03-04T08:24:04.722Z"
        },
        "mediaType": "video",
        "mediaContent": {
          "src": [
            {
              "src": "https://dms.licdn.com/playlist/vid/v2/D5605AQFJgP7A2Of8lQ/mp4-640p-30fp-crf28/B56ZTvpPVqHEBc-/0/1739187379825?e=1741683600&v=beta&t=RhKaAQCe03S4VXKLLLHc-NX8gpATX2nGzm8IBwMdpd8",
              "type": "video/mp4",
              "data-bitrate": 610370
            },
            {
              "src": "https://dms.licdn.com/playlist/vid/v2/D5605AQFJgP7A2Of8lQ/mp4-720p-30fp-crf28/B56ZTvpPVqHEBg-/0/1739187380483?e=1741683600&v=beta&t=oaGSraKd5cD2WNAo1GOEAK0CgTCgVxcmB14nooI35uc",
              "type": "video/mp4",
              "data-bitrate": 833042
            }
          ],
          "posterUrl": "https://media.licdn.com/dms/image/v2/D5605AQFJgP7A2Of8lQ/videocover-low/B56ZTvpPVqHECM-/0/1739187374832?e=1741683600&v=beta&t=WvzGiJefq4u0uiDoEQggHvr_ChKFV6_HDdBzjaEkHM4"
        },
        "date": "2025-03-04T08:24:04.722Z"
      },
      {
        "captions": "On Location in Mozzecane Italy!!\n\nIt was exciting to see our new 1400ton Shear being loaded out for our own facility Sierra Recycling & Demolition!!!!\n\nCan’t wait for its arrival!!!",
        "time": {
          "raw": "3h",
          "parsed": "11.02.2025",
          "isoString": "2025-02-11T08:24:04.722Z"
        },
        "mediaType": "video",
        "mediaContent": {
          "src": [
            {
              "src": "https://dms.licdn.com/playlist/vid/v2/D5605AQFJgP7A2Of8lQ/mp4-640p-30fp-crf28/B56ZTvpPVqHEBc-/0/1739187379825?e=1741683600&v=beta&t=RhKaAQCe03S4VXKLLLHc-NX8gpATX2nGzm8IBwMdpd8",
              "type": "video/mp4",
              "data-bitrate": 610370
            },
            {
              "src": "https://dms.licdn.com/playlist/vid/v2/D5605AQFJgP7A2Of8lQ/mp4-720p-30fp-crf28/B56ZTvpPVqHEBg-/0/1739187380483?e=1741683600&v=beta&t=oaGSraKd5cD2WNAo1GOEAK0CgTCgVxcmB14nooI35uc",
              "type": "video/mp4",
              "data-bitrate": 833042
            }
          ],
          "posterUrl": "https://media.licdn.com/dms/image/v2/D5605AQFJgP7A2Of8lQ/videocover-low/B56ZTvpPVqHECM-/0/1739187374832?e=1741683600&v=beta&t=WvzGiJefq4u0uiDoEQggHvr_ChKFV6_HDdBzjaEkHM4"
        },
        "date": "2025-02-11T08:24:04.722Z"
      },
      {
        "captions": "Venerdì abbiamo avuto  l’ultimo di 3 incontri con i ragazzi delle scuole secondarie di primo grado di Mozzecane e Nogarole Rocca. I ragazzi, divisi a gruppi, hanno visitato l’officina e gli uffici della ditta dove sono state spiegate loro le varie figure professionali. Il tutto nell’ottica della scelta della corretta scuola secondaria di secondo grado. I ragazzi, accompagnati dai professori, hanno mostrato interesse e fatto domande. Speriamo di essere stati d’aiuto nella scelta del loro percorso di studi che li preparerà alla vita lavorativa. In bocca al lupo ragazzi!Venerdì abbiamo avuto  l’ultimo di 3 incontri con i ragazzi delle scuole secondarie di primo grado di Mozzecane e Nogarole Rocca. I ragazzi, divisi a gruppi, hanno visitato l’officina e gli uffici della ditta dove sono state spiegate loro le varie figure professionali. Il tutto nell’ottica della scelta della corretta scuola secondaria di secondo grado. I ragazzi, accompagnati dai professori, hanno mostrato interesse e fatto domande. Speriamo di essere stati d’aiuto nella scelta del loro percorso di studi che li preparerà alla vita lavorativa. In bocca al lupo ragazzi!",
        "likes": "27",
        "time": {
          "raw": "3ay",
          "parsed": "04.12.2024",
          "isoString": "2024-12-04T08:24:04.724Z"
        },
        "mediaType": "image",
        "mediaContent": [
          "https://media.licdn.com/dms/image/v2/D5622AQFR1Y-7lGi3Pg/feedshare-shrink_800/feedshare-shrink_800/0/1731942602714?e=1744243200&v=beta&t=BkO4T8_PiN0SxJSEjxhZZv9scVVfxZDGhuNFgJwOwqQ",
          "https://media.licdn.com/dms/image/v2/D5622AQGDbGjPJ8SJjA/feedshare-shrink_800/feedshare-shrink_800/0/1731942602790?e=1744243200&v=beta&t=WHGWgqFhxfOlshbEhUg4bq5ZBbfHYhrW7ooiMyaUYuI",
          "https://media.licdn.com/dms/image/v2/D5622AQF4q8J_cEVbzQ/feedshare-shrink_800/feedshare-shrink_800/0/1731942602558?e=1744243200&v=beta&t=Dfyb83PfGUHAwaWuSRZF-bb4JvFaKX4FjP4GG9a0xCk"
        ],
        "date": "2024-12-04T08:24:04.724Z"
      },
      {
        "captions": "Saremo presenti ad Ecomondo 2024, dal 5 all’8 Novembre. Ci troverete al Rimini Expo Centre, Hall C3, Stand 301. Non mancate!\n\nWe will be at Ecomondo 2024, from 5th to 8th November. You will find us at Rimini Expo Centre, Hall C3, Stand 301. Be there!\n\n#ecomondo #idromec #shearbaler #recyclingSaremo presenti ad Ecomondo 2024, dal 5 all’8 Novembre. Ci troverete al Rimini Expo Centre, Hall C3, Stand 301. Non mancate!\n\nWe will be at Ecomondo 2024, from 5th to 8th November. You will find us at Rimini Expo Centre, Hall C3, Stand 301. Be there!\n\n#ecomondo #idromec #shearbaler #recycling",
        "likes": "10",
        "shares": "1",
        "time": {
          "raw": "4ay",
          "parsed": "04.11.2024",
          "isoString": "2024-11-04T08:24:04.725Z"
        },
        "mediaType": "image",
        "mediaContent": [
          "https://media.licdn.com/dms/image/v2/D4D22AQGn9yC8IazGhA/feedshare-shrink_800/feedshare-shrink_800/0/1730667175460?e=1744243200&v=beta&t=zEjo2h_A_8HANsHV64d9sXGDVQ6rrSkPpZNBbJHQE5s"
        ],
        "date": "2024-11-04T08:24:04.725Z"
      },
      {
        "likes": "14",
        "comments": "2",
        "time": {
          "raw": "7ay",
          "parsed": "04.08.2024",
          "isoString": "2024-08-04T08:24:04.728Z"
        },
        "mediaType": "image",
        "mediaContent": [
          "https://media.licdn.com/dms/image/v2/D4D22AQFSEU_gXbc6Ag/feedshare-shrink_800/feedshare-shrink_800/0/1722880521861?e=1744243200&v=beta&t=YL_JJK5vdXYNykH_Jd-zn39XXdlEm_sWkFqrDJzUPvY"
        ],
        "date": "2024-08-04T08:24:04.728Z"
      },
      {
        "captions": "11st July 1969: exactly 55 years ago Idromec was born.\nHere’s a pic from the early 80s\n#idromec #shearbaler #recycling11st July 1969: exactly 55 years ago Idromec was born.\nHere’s a pic from the early 80s\n#idromec #shearbaler #recycling",
        "likes": "28",
        "shares": "2",
        "time": {
          "raw": "7ay",
          "parsed": "04.08.2024",
          "isoString": "2024-08-04T08:24:04.729Z"
        },
        "mediaType": "image",
        "mediaContent": [
          "https://media.licdn.com/dms/image/v2/D4D22AQEOPJl_NH_Nuw/feedshare-shrink_800/feedshare-shrink_800/0/1720711243102?e=1744243200&v=beta&t=Rx4CGVDFyfSk1rpn-6ojIvASY2DjHaUzJ8R7qdhooAM"
        ],
        "date": "2024-08-04T08:24:04.729Z"
      },
      {
        "captions": "Last day in IFAT!!! You can find us at Hall C5 stand 328!\n#ifat #shearbaler #idromec #recycling",
        "likes": "16",
        "comments": "2",
        "shares": "1",
        "time": {
          "raw": "9ay",
          "parsed": "04.06.2024",
          "isoString": "2024-06-04T08:24:04.730Z"
        },
        "mediaType": "video",
        "mediaContent": {
          "src": [
            {
              "src": "https://dms.licdn.com/playlist/vid/v2/D4D05AQHd08j_AhLPcg/feedshare-ambry-analyzed_servable_progressive_video/feedshare-ambry-analyzed_servable_progressive_video/0/1715939640900?e=1741683600&v=beta&t=283C-ghNL6HnZEFHc5aeWDv8r4mPliQDEOspdVtnQms",
              "type": "video/quicktime",
              "data-bitrate": 14993888
            },
            {
              "src": "https://dms.licdn.com/playlist/vid/v2/D4D05AQHd08j_AhLPcg/mp4-640p-30fp-crf28/mp4-640p-30fp-crf28/0/1715939657955?e=1741683600&v=beta&t=YaH4PYN7BBlJYKK110K1pX041_evkrcbCzwgcd1eYpQ",
              "type": "video/mp4",
              "data-bitrate": 812715
            },
            {
              "src": "https://dms.licdn.com/playlist/vid/v2/D4D05AQHd08j_AhLPcg/mp4-720p-30fp-crf28/mp4-720p-30fp-crf28/0/1715939657894?e=1741683600&v=beta&t=vsJUONkoGkSpzLmq21SqLqNv_O9iL4OTp25Nj58eCfc",
              "type": "video/mp4",
              "data-bitrate": 1136998
            }
          ],
          "posterUrl": "https://media.licdn.com/dms/image/v2/D4D05AQHd08j_AhLPcg/videocover-high/videocover-high/0/1715939642735?e=1741683600&v=beta&t=fdg3nvaSPWaJfbTuT0wlfzWGtJqMYGWftTtzh1Y__gA"
        },
        "date": "2024-06-04T08:24:04.730Z"
      },
      {
        "captions": "4th day at IFAT 2024! Visit us at Hall C5, stand 328!\n#ifat #shearbaler #idromec #recycling4th day at IFAT 2024! Visit us at Hall C5, stand 328!\n#ifat #shearbaler #idromec #recycling",
        "likes": "16",
        "shares": "2",
        "time": {
          "raw": "9ay",
          "parsed": "04.06.2024",
          "isoString": "2024-06-04T08:24:04.731Z"
        },
        "mediaType": "image",
        "mediaContent": [
          "https://media.licdn.com/dms/image/v2/D4D22AQFBVLE0qQ1u6g/feedshare-shrink_800/feedshare-shrink_800/0/1715872649696?e=1744243200&v=beta&t=7zhZ3hn6nuWx-Dr2eCS-7YoKCbb7awmxN8qbyBJFTTw",
          "https://media.licdn.com/dms/image/v2/D4D22AQGDN7ntpRg0aw/feedshare-shrink_800/feedshare-shrink_800/0/1715872650289?e=1744243200&v=beta&t=klFeND_SJxFdgJEHA_ghdmoipmohN416RKai34iitSs",
          "https://media.licdn.com/dms/image/v2/D4D22AQE4zGmaAcUpCQ/feedshare-shrink_800/feedshare-shrink_800/0/1715872650065?e=1744243200&v=beta&t=dCaxGAYJ2ejMGQmoUTUmLlKQ3Ku4CubtMQY0bdpNbF8",
          "https://media.licdn.com/dms/image/v2/D4D22AQETq5NINzJ7xg/feedshare-shrink_800/feedshare-shrink_800/0/1715872650292?e=1744243200&v=beta&t=2xxFCr3qKD7rW1AGy3BshIJTSTE57HEy0PlZx47UNBg"
        ],
        "date": "2024-06-04T08:24:04.731Z"
      },
      {
        "captions": "IFAT day 2: visit us at Hall C5 stand 328! We will show you our balers and shearbalers!\n#ifat #shearbaler #idromec #recyclingIFAT day 2: visit us at Hall C5 stand 328! We will show you our balers and shearbalers!\n#ifat #shearbaler #idromec #recycling",
        "likes": "9",
        "comments": "1",
        "time": {
          "raw": "9ay",
          "parsed": "04.06.2024",
          "isoString": "2024-06-04T08:24:04.733Z"
        },
        "mediaType": "image",
        "mediaContent": [
          "https://media.licdn.com/dms/image/v2/D4D22AQG_SjHZQAWEzQ/feedshare-shrink_800/feedshare-shrink_800/0/1715691824133?e=1744243200&v=beta&t=fHKynTSoH5LzygbOgRVz1YusW1hIzksKZH93naeBocg",
          "https://media.licdn.com/dms/image/v2/D4D22AQGHzJSNEgOKyQ/feedshare-shrink_800/feedshare-shrink_800/0/1715691826502?e=1744243200&v=beta&t=_LEfBe9CFG1gTgNqRrmq3RORxOhRMBKtqtNtlHpVjfA",
          "https://media.licdn.com/dms/image/v2/D4D22AQGyaYemQvGn4g/feedshare-shrink_800/feedshare-shrink_800/0/1715691826522?e=1744243200&v=beta&t=7i3YCeCj9jwbF4pdP46R_X42SKafZz8EdHWXaBTZV5g",
          "https://media.licdn.com/dms/image/v2/D4D22AQHn0Mln-Hy26Q/feedshare-shrink_800/feedshare-shrink_800/0/1715691825438?e=1744243200&v=beta&t=J5i5tYooVyHTF-TgdMMUg6pt8KoMSo6QOdl_tw_07Kk"
        ],
        "date": "2024-06-04T08:24:04.733Z"
      },
      {
        "captions": "Are you ready? You can find us at Hall C5 stand 328!\n\n#idromec #shearbaler #ifat #recyclingAre you ready? You can find us at Hall C5 stand 328!\n\n#idromec #shearbaler #ifat #recycling",
        "likes": "16",
        "time": {
          "raw": "9ay",
          "parsed": "04.06.2024",
          "isoString": "2024-06-04T08:24:04.734Z"
        },
        "mediaType": "image",
        "mediaContent": [
          "https://media.licdn.com/dms/image/v2/D4D22AQF12pQKjwYrGg/feedshare-shrink_800/feedshare-shrink_800/0/1715588784121?e=1744243200&v=beta&t=IMlHQuw_KeD5ItCoqiIYNFI59fxGSC_kN5o4vzBpWTk",
          "https://media.licdn.com/dms/image/v2/D4D22AQGikCnZ2jHaLw/feedshare-shrink_800/feedshare-shrink_800/0/1715588781704?e=1744243200&v=beta&t=bKwmDnMr1s-P56ex6AiJprdXeNhAW3OlHFh4XuzCKXc",
          "https://media.licdn.com/dms/image/v2/D4D22AQGS4YrZf187rg/feedshare-shrink_800/feedshare-shrink_800/0/1715588780834?e=1744243200&v=beta&t=mhMGNCm6C2VEEt704jfVMd-RABEXA2uDwM5t8QG-Gg4"
        ],
        "date": "2024-06-04T08:24:04.734Z"
      },
      {
        "captions": "IFAT 2024 | 13-17 Maggio\nEccoci anche quest’anno alla fiera internazionale leader per la gestione dei rifiuti e delle materie prime. Venite a trovarci al Centro Fieristico di Monaco di Baviera, Hall C5 – Stand 328!\n \nIFAT 2024 | May 13-17\nHere we are once again at the world’s leading trade fair for waste and raw materials management.\nCome and visit us at the Munich Trade Fair Center, Hall C5 – Booth 328!\n\n#ifat #idromec #shearbaler #recyclingIFAT 2024 | 13-17 Maggio\nEccoci anche quest’anno alla fiera internazionale leader per la gestione dei rifiuti e delle materie prime. Venite a trovarci al Centro Fieristico di Monaco di Baviera, Hall C5 – Stand 328!\n \nIFAT 2024 | May 13-17\nHere we are once again at the world’s leading trade fair for waste and raw materials management.\nCome and visit us at the Munich Trade Fair Center, Hall C5 – Booth 328!\n\n#ifat #idromec #shearbaler #recycling",
        "likes": "18",
        "shares": "1",
        "time": {
          "raw": "10ay",
          "parsed": "04.05.2024",
          "isoString": "2024-05-04T08:24:04.735Z"
        },
        "mediaType": "image",
        "mediaContent": [
          "https://media.licdn.com/dms/image/v2/D4E22AQEm8XTOITdtyw/feedshare-shrink_800/feedshare-shrink_800/0/1715092209459?e=1744243200&v=beta&t=Ec4zanYfEsHaFCM4BYvDz_SNtTwqaJlTnQL20LG6eME"
        ],
        "date": "2024-05-04T08:24:04.735Z"
      },
      {
        "captions": "Visit us at Booth B6!\n#isri #idromec #shearbaler #recyclingVisit us at Booth B6!\n#isri #idromec #shearbaler #recycling",
        "likes": "12",
        "time": {
          "raw": "10ay",
          "parsed": "04.05.2024",
          "isoString": "2024-05-04T08:24:04.737Z"
        },
        "mediaType": "image",
        "mediaContent": [
          "https://media.licdn.com/dms/image/v2/D4D22AQEB2HHkHoFISQ/feedshare-shrink_800/feedshare-shrink_800/0/1713381796898?e=1744243200&v=beta&t=Az60GKqLlOSwoKm27hDFVMfyBud9A_PXE5bAgYVVI0A",
          "https://media.licdn.com/dms/image/v2/D4D22AQF4QvED2J-fHQ/feedshare-shrink_800/feedshare-shrink_800/0/1713381796347?e=1744243200&v=beta&t=ZU6bZdNJIhMjt9tXqju6q4RCMl4KOjGzxdMBdZlHNCE"
        ],
        "date": "2024-05-04T08:24:04.737Z"
      },
      {
        "captions": "Ready to startViva ISRI! We are ready for you!",
        "time": {
          "raw": "10ay10ay",
          "parsed": "04.03.2025",
          "isoString": "2025-03-04T08:24:04.738Z"
        },
        "mediaType": "video",
        "mediaContent": {
          "src": [
            {
              "src": "https://dms.licdn.com/playlist/vid/v2/D5605AQHjtUsPOmWqKg/feedshare-ambry-analyzed_servable_progressive_video/feedshare-ambry-analyzed_servable_progressive_video/0/1713225575593?e=1741683600&v=beta&t=S3y5EPURRw3m4uoy3OPsCwHgI_k57qkN-Wx-WYI8LH8",
              "type": "video/quicktime",
              "data-bitrate": 12784870
            },
            {
              "src": "https://dms.licdn.com/playlist/vid/v2/D5605AQHjtUsPOmWqKg/mp4-640p-30fp-crf28/mp4-640p-30fp-crf28/0/1713225578724?e=1741683600&v=beta&t=7JFSeGL4WHAIbchjPNbiGx9ZIzyqk47VbqADP0YQLP4",
              "type": "video/mp4",
              "data-bitrate": 1176888
            },
            {
              "src": "https://dms.licdn.com/playlist/vid/v2/D5605AQHjtUsPOmWqKg/mp4-720p-30fp-crf28/mp4-720p-30fp-crf28/0/1713225579450?e=1741683600&v=beta&t=11fdobgCyh6a37xuWaErRh2HfG_43dOA_tOtn06lbG4",
              "type": "video/mp4",
              "data-bitrate": 1547287
            }
          ],
          "posterUrl": "https://media.licdn.com/dms/image/v2/D5605AQHjtUsPOmWqKg/videocover-high/videocover-high/0/1713225574224?e=1741683600&v=beta&t=m-Y1f9Lwno2ykhlQhUka3rpc_27yZv1xshiCd3XQDF8"
        },
        "date": "2025-03-04T08:24:04.738Z"
      },
      {
        "captions": "Viva ISRI! We are ready for you!",
        "time": {
          "raw": "10ay",
          "parsed": "04.05.2024",
          "isoString": "2024-05-04T08:24:04.738Z"
        },
        "mediaType": "video",
        "mediaContent": {
          "src": [
            {
              "src": "https://dms.licdn.com/playlist/vid/v2/D5605AQHjtUsPOmWqKg/feedshare-ambry-analyzed_servable_progressive_video/feedshare-ambry-analyzed_servable_progressive_video/0/1713225575593?e=1741683600&v=beta&t=S3y5EPURRw3m4uoy3OPsCwHgI_k57qkN-Wx-WYI8LH8",
              "type": "video/quicktime",
              "data-bitrate": 12784870
            },
            {
              "src": "https://dms.licdn.com/playlist/vid/v2/D5605AQHjtUsPOmWqKg/mp4-640p-30fp-crf28/mp4-640p-30fp-crf28/0/1713225578724?e=1741683600&v=beta&t=7JFSeGL4WHAIbchjPNbiGx9ZIzyqk47VbqADP0YQLP4",
              "type": "video/mp4",
              "data-bitrate": 1176888
            },
            {
              "src": "https://dms.licdn.com/playlist/vid/v2/D5605AQHjtUsPOmWqKg/mp4-720p-30fp-crf28/mp4-720p-30fp-crf28/0/1713225579450?e=1741683600&v=beta&t=11fdobgCyh6a37xuWaErRh2HfG_43dOA_tOtn06lbG4",
              "type": "video/mp4",
              "data-bitrate": 1547287
            }
          ],
          "posterUrl": "https://media.licdn.com/dms/image/v2/D5605AQHjtUsPOmWqKg/videocover-high/videocover-high/0/1713225574224?e=1741683600&v=beta&t=m-Y1f9Lwno2ykhlQhUka3rpc_27yZv1xshiCd3XQDF8"
        },
        "date": "2024-05-04T08:24:04.738Z"
      },
      {
        "captions": "Almost ready to start at the Mandalay Bay Convention Center !!Almost ready to start at the Mandalay Bay Convention Center !!",
        "likes": "16",
        "shares": "1",
        "time": {
          "raw": "10ay",
          "parsed": "04.05.2024",
          "isoString": "2024-05-04T08:24:04.739Z"
        },
        "mediaType": "image",
        "mediaContent": [
          "https://media.licdn.com/dms/image/v2/D4D22AQE9QcfvqFL5IQ/feedshare-shrink_800/feedshare-shrink_800/0/1713180189376?e=1744243200&v=beta&t=Ir3AgFBeWzD-cuyz643bosVWKDt-GoHEut_FYBDw9zA",
          "https://media.licdn.com/dms/image/v2/D4D22AQHqYaV6zSdVzg/feedshare-shrink_800/feedshare-shrink_800/0/1713180185607?e=1744243200&v=beta&t=-NP_Ir9Si-x5JN2gu1z5WojossfSVAIXxgKEIcr7isM",
          "https://media.licdn.com/dms/image/v2/D4D22AQEB-8nFf_Udng/feedshare-shrink_800/feedshare-shrink_800/0/1713180188767?e=1744243200&v=beta&t=Ck5Q1QwWkRrE30QS0Hff-s7-f7ETmXG5r7md474YBLE"
        ],
        "date": "2024-05-04T08:24:04.739Z"
      },
      {
        "captions": "Happy Easter!\n#idromec #shearbaler #recycling #peaceHappy Easter!\n#idromec #shearbaler #recycling #peace",
        "likes": "4",
        "time": {
          "raw": "11ay",
          "parsed": "04.04.2024",
          "isoString": "2024-04-04T08:24:04.740Z"
        },
        "mediaType": "image",
        "mediaContent": [
          "https://media.licdn.com/dms/image/v2/D4D22AQGBln2c_CLLEw/feedshare-shrink_800/feedshare-shrink_800/0/1711874287092?e=1744243200&v=beta&t=a8iaBPYABCR84Yqjn8OO24hNEHNk6sHas5Df57SWWLc"
        ],
        "date": "2024-04-04T08:24:04.740Z"
      },
      {
        "captions": "It’always a pleasure to meet you and Jose Pereyra!Spent a wonderful day with Olivo Tabarelli, the founder of IDROMEC SPA , a man who’s been my mentor and friend for 40 years!!\n\nThey just don’t make them like him anymore! \n\n#mentor #friendSpent a wonderful day with Olivo Tabarelli, the founder of IDROMEC SPA , a man who’s been my mentor and friend for 40 years!!\n\nThey just don’t make them like him anymore! \n\n#mentor #friend",
        "likes": "11",
        "time": {
          "raw": "11ay11ay",
          "parsed": "04.03.2025",
          "isoString": "2025-03-04T08:24:04.741Z"
        },
        "mediaType": "image",
        "mediaContent": [
          "https://media.licdn.com/dms/image/v2/D4D22AQHUmSrlzva4Jg/feedshare-shrink_800/feedshare-shrink_800/0/1710918869870?e=1744243200&v=beta&t=hfBWYN8ckwGlwNeOtFWkxVdiDtBWOeIhPF8XEWExR2U",
          "https://media.licdn.com/dms/image/v2/D4D22AQFoFERV18sIVw/feedshare-shrink_800/feedshare-shrink_800/0/1710918873460?e=1744243200&v=beta&t=mE_mqLLg7hbWR4v_Pzugqb2ZRT-a-tby0NJf7bJ2q6I",
          "https://media.licdn.com/dms/image/v2/D4D22AQFv-YvOSDfSeA/feedshare-shrink_800/feedshare-shrink_800/0/1710918872422?e=1744243200&v=beta&t=OXxzAoRS4vWKvgykYKE62kKutYSzalsf_8G3Zvvw3R4",
          "https://media.licdn.com/dms/image/v2/D4D22AQGlH5J_bjoE_Q/feedshare-shrink_800/feedshare-shrink_800/0/1710918873250?e=1744243200&v=beta&t=LjYbeX22py-5ikxmo2r9DgegfkkSNtosPaq-FMAbfFo",
          "https://media.licdn.com/dms/image/v2/D4D22AQFAy6gxE3VWuA/feedshare-shrink_800/feedshare-shrink_800/0/1710918869086?e=1744243200&v=beta&t=ws6bX3S4BfjfbT7z4gKRzagPv_4-BDKlnPuyjyisPzY"
        ],
        "date": "2025-03-04T08:24:04.741Z"
      },
      {
        "captions": "Spent a wonderful day with Olivo Tabarelli, the founder of IDROMEC SPA , a man who’s been my mentor and friend for 40 years!!\n\nThey just don’t make them like him anymore! \n\n#mentor #friendSpent a wonderful day with Olivo Tabarelli, the founder of IDROMEC SPA , a man who’s been my mentor and friend for 40 years!!\n\nThey just don’t make them like him anymore! \n\n#mentor #friend",
        "likes": "11",
        "time": {
          "raw": "11ay",
          "parsed": "04.04.2024",
          "isoString": "2024-04-04T08:24:04.742Z"
        },
        "mediaType": "image",
        "mediaContent": [
          "https://media.licdn.com/dms/image/v2/D4D22AQHUmSrlzva4Jg/feedshare-shrink_800/feedshare-shrink_800/0/1710918869870?e=1744243200&v=beta&t=hfBWYN8ckwGlwNeOtFWkxVdiDtBWOeIhPF8XEWExR2U",
          "https://media.licdn.com/dms/image/v2/D4D22AQFoFERV18sIVw/feedshare-shrink_800/feedshare-shrink_800/0/1710918873460?e=1744243200&v=beta&t=mE_mqLLg7hbWR4v_Pzugqb2ZRT-a-tby0NJf7bJ2q6I",
          "https://media.licdn.com/dms/image/v2/D4D22AQFv-YvOSDfSeA/feedshare-shrink_800/feedshare-shrink_800/0/1710918872422?e=1744243200&v=beta&t=OXxzAoRS4vWKvgykYKE62kKutYSzalsf_8G3Zvvw3R4",
          "https://media.licdn.com/dms/image/v2/D4D22AQGlH5J_bjoE_Q/feedshare-shrink_800/feedshare-shrink_800/0/1710918873250?e=1744243200&v=beta&t=LjYbeX22py-5ikxmo2r9DgegfkkSNtosPaq-FMAbfFo",
          "https://media.licdn.com/dms/image/v2/D4D22AQFAy6gxE3VWuA/feedshare-shrink_800/feedshare-shrink_800/0/1710918869086?e=1744243200&v=beta&t=ws6bX3S4BfjfbT7z4gKRzagPv_4-BDKlnPuyjyisPzY"
        ],
        "date": "2024-04-04T08:24:04.742Z"
      }
    ]
  },
  {
    "name": "ZatoRecyclingSolutions",
    "followerData": [
      [
        20250225,
        null
      ],
      [
        20250225,
        null
      ],
      [
        20250225,
        null
      ],
      [
        20250228,
        null
      ],
      [
        20250228,
        null
      ],
      [
        20250228,
        null
      ],
      [
        20250228,
        null
      ],
      [
        20250303,
        null
      ],
      [
        1741011688717,
        "N/A"
      ],
      [
        1741076663727,
        "N/A"
      ]
    ],
    "data": [
      {
        "captions": "High volume density doesn’t mean higher value—especially in scrap logistics.\n\nIn Munich, one of our customers faced this exact issue: hot forming automotive scrap was too thin yet too bulky for efficient handling. Then came Zato Blue Devil—the twin-shaft shredder that downsizes and densifies light steel scrap, optimizes container loads, and reduces logistics costs.\n\nThe result? Greater efficiency, lower costs, less waste. Watch the shredder in action and see the difference!\n\n#ZATO #ZatoShredder #RecyclingEquipment #MetalRecycling #BlueDevil",
        "likes": "22",
        "comments": "1",
        "time": {
          "raw": "3g",
          "parsed": "01.03.2025",
          "isoString": "2025-03-01T08:24:23.467Z"
        },
        "mediaType": "video",
        "mediaContent": {
          "src": [
            {
              "src": "https://dms.licdn.com/playlist/vid/v2/D4D05AQHzL3tcvN7Ncg/mp4-640p-30fp-crf28/B4DZVNSdOcHYBg-/0/1740758454680?e=1741683600&v=beta&t=hKN8JWtJJeubHYjd8Ea5y6-YPl6ulr1tCPMuTJyUeOQ",
              "type": "video/mp4",
              "data-bitrate": 1060634
            },
            {
              "src": "https://dms.licdn.com/playlist/vid/v2/D4D05AQHzL3tcvN7Ncg/mp4-720p-30fp-crf28/B4DZVNSdOcHYBk-/0/1740758456265?e=1741683600&v=beta&t=en1rz1veHBeMOeSA2zddfP0Y_rWK34UYQoEAyFDVtBk",
              "type": "video/mp4",
              "data-bitrate": 1349818
            }
          ],
          "posterUrl": "https://media.licdn.com/dms/image/v2/D4D05AQHzL3tcvN7Ncg/videocover-low/B4DZVNSdOcHYCQ-/0/1740758450800?e=1741683600&v=beta&t=lEnyTUDId8XBLgV6frNQd3sy0F30wbMdvq12HIX7j4c"
        },
        "date": "2025-03-01T08:24:23.467Z"
      },
      {
        "captions": "Busheling nearing closer to $500/ton riding the wave as most metals are pushing higher on demand hopes. \n\nMaybe it’s time to think about how your yard is processing busheling. \n\nThis is Zato most popular application in the US and for good reason. \n\nSkeleton plates, production clips, coils, tubes, racking, fencing bundles, and lots of other clean iron products fly through our Blue Devil twin shaft. \n\nWith a production cost of only $11/ton and throughput up to 30 tons per hour, this machine is the answer to your question. \n\n“How can we grow this year?”\n\nPut down a concrete pad and we can install in two weeks. \n\n#scrap #zato #shredder #busheling #recycling #metals",
        "likes": "53",
        "comments": "3",
        "shares": "2",
        "time": {
          "raw": "1h",
          "parsed": "25.02.2025",
          "isoString": "2025-02-25T08:24:23.468Z"
        },
        "mediaType": "video",
        "mediaContent": {
          "src": [
            {
              "src": "https://dms.licdn.com/playlist/vid/v2/D5605AQHmIdzSeevx2w/mp4-640p-30fp-crf28/B56ZUpkOIYHoBc-/0/1740159500789?e=1741683600&v=beta&t=kH6UY-VUtxtIdBZP-IkT-cXu1HNBLjxjc0UHRHsl7W0",
              "type": "video/mp4",
              "data-bitrate": 744948
            },
            {
              "src": "https://dms.licdn.com/playlist/vid/v2/D5605AQHmIdzSeevx2w/mp4-720p-30fp-crf28/B56ZUpkOIYHoBg-/0/1740159499817?e=1741683600&v=beta&t=mWx7-pjxmeI5Id_iJdxclQJMvjVhxcus0pzHWCUiKGg",
              "type": "video/mp4",
              "data-bitrate": 992472
            }
          ],
          "posterUrl": "https://media.licdn.com/dms/image/v2/D5605AQHmIdzSeevx2w/videocover-high/B56ZUpkOIYHoBs-/0/1740159490902?e=1741683600&v=beta&t=nwBsjZEVFnSRFbU52mgghUXd9RQGuyQDEA6oKWkz2r8"
        },
        "date": "2025-02-25T08:24:23.468Z"
      },
      {
        "captions": "This is one of the nightmares of hammer mill operators: in Spanish it is called \"maraña\": tangled wire rod that jams the rotor, blocking the hammers and clogging the grids;\n\nOne of the ways of processing such material is to let it be devoured by the Zato Blue Devil: the final size is so beautiful that it is no longer necessary to pass it through the hammer mill: maximising the yield by simply \"thinking differently\"...",
        "likes": "59",
        "comments": "2",
        "shares": "1",
        "time": {
          "raw": "1h",
          "parsed": "25.02.2025",
          "isoString": "2025-02-25T08:24:23.469Z"
        },
        "mediaType": "video",
        "mediaContent": {
          "src": [
            {
              "src": "https://dms.licdn.com/playlist/vid/v2/D5605AQHT-P6KeYv0bQ/mp4-720p-30fp-crf28/B56ZUj70.WHsBs-/0/1740064659720?e=1741683600&v=beta&t=g2fxEGcvtIsEUMhwO9D5Kc961r4wnbOInN4Zar0Um8s",
              "type": "video/mp4",
              "data-bitrate": 1455367
            },
            {
              "src": "https://dms.licdn.com/playlist/vid/v2/D5605AQHT-P6KeYv0bQ/mp4-640p-30fp-crf28/B56ZUj70.WHsBo-/0/1740064660864?e=1741683600&v=beta&t=frZgIwXz1jYhdLZHi-0QIJStNs5XnAw4_9h88yhy_CQ",
              "type": "video/mp4",
              "data-bitrate": 1135619
            }
          ],
          "posterUrl": "https://media.licdn.com/dms/image/v2/D5605AQHT-P6KeYv0bQ/videocover-low/B56ZUj70.WHsCY-/0/1740064657717?e=1741683600&v=beta&t=STveKeKudLYQPmrey119YCd4HQKSeBHAolR_K2KTGYM"
        },
        "date": "2025-02-25T08:24:23.469Z"
      },
      {
        "captions": "More and more companies are embracing circular economy principles, transforming scrap into valuable resources. Latin America’s metal recycling industry is following this path, driving demand for efficient, high-performance solutions.\n\nFor businesses seeking reliable partners in waste management, Zato brings over 25 years of expertise in designing and manufacturing hammermills, pre-shredders, scrap shears and scrap cleaning plants for ferrous and non-ferrous metals.\n\nMeet our experts at stand 1718 to explore smarter, more efficient metal recycling solutions.\n\n#ZATO #ZatoShredder #RecyclingEquipment #MetalRecycling #ResiduosExpo2025More and more companies are embracing circular economy principles, transforming scrap into valuable resources. Latin America’s metal recycling industry is following this path, driving demand for efficient, high-performance solutions.\n\nFor businesses seeking reliable partners in waste management, Zato brings over 25 years of expertise in designing and manufacturing hammermills, pre-shredders, scrap shears and scrap cleaning plants for ferrous and non-ferrous metals.\n\nMeet our experts at stand 1718 to explore smarter, more efficient metal recycling solutions.\n\n#ZATO #ZatoShredder #RecyclingEquipment #MetalRecycling #ResiduosExpo2025",
        "likes": "14",
        "comments": "1",
        "shares": "1",
        "time": {
          "raw": "1h",
          "parsed": "25.02.2025",
          "isoString": "2025-02-25T08:24:23.471Z"
        },
        "mediaType": "image",
        "mediaContent": [
          "https://media.licdn.com/dms/image/v2/D4D22AQGXcll2iVh5yg/feedshare-shrink_800/B4DZT.6aZMHYAg-/0/1739443516817?e=1744243200&v=beta&t=nrL0c3z3d0XT_KkHvQEFW9zX948g_mf0Si-k9cubV3A"
        ],
        "date": "2025-02-25T08:24:23.471Z"
      },
      {
        "captions": "Orders delivered on time, communication and zero stress—that's what Michela, Letizia, and Elisa ensure every day with their work.\n\nAs Zato's back office team, they keep everything on - managing orders, liaising with production and logistics, and making sure customers receive exactly what they need, when they need it. \n\nBecause great solutions deserve an even greater team behind them.\n\n#ZATO #ZatoShredder #RecyclingSolutions #ZatoTeam #BackOfficeOrders delivered on time, communication and zero stress—that's what Michela, Letizia, and Elisa ensure every day with their work.\n\nAs Zato's back office team, they keep everything on - managing orders, liaising with production and logistics, and making sure customers receive exactly what they need, when they need it. \n\nBecause great solutions deserve an even greater team behind them.\n\n#ZATO #ZatoShredder #RecyclingSolutions #ZatoTeam #BackOffice",
        "likes": "8",
        "time": {
          "raw": "2h",
          "parsed": "18.02.2025",
          "isoString": "2025-02-18T08:24:23.477Z"
        },
        "mediaType": "image",
        "mediaContent": [
          "https://media.licdn.com/dms/image/v2/D4D22AQHR-eOHaVaGoA/feedshare-shrink_800/B4DZT.4wJLG8Ak-/0/1739443080121?e=1744243200&v=beta&t=V4J2rWX-c3NS6gRCGZDk_DAkbClig0OXe9CWiQUUJh0"
        ],
        "date": "2025-02-18T08:24:23.477Z"
      },
      {
        "captions": "It's been a busy start to the year for us at Zato and recycling as a whole. \n\nTwo weeks ago, the S&P Global Aluminum Symposium was held in Florida where manufacturers and recyclers alike took part in a massive industry update. \n\nThe most widely held sentiment: the US needs more secondary aluminum smelting.\n\nArconic expects AI infrastructure for water, energy, and grid maintenance to be a bolstering point for recycled aluminum. Military AND space exploration to be another demand sector.\n\nAlcoa says that with Alumina prices at all time highs, aluminum actually has more demand and is going to benefit.\n\nBank of America charts show aluminum supply growth has waned the last 4 years while demand for aluminum products has grown significantly. \n\nWhy does this matter to recyclers?\n\nSimilar to ferrous markets recently, as melt shops expand into more local US markets, they will need clean, sized, sorted material. Mixed aluminum and non-ferrous goods may keep you alive, but refined, specific grades keeps you growing.\n\nOur job at Zato is easy, keep supplying customers with equipment to create liberated, sized material for sorting. Low quality in, high quality out, under one roof.\n\nBlue Devil Twin Shaft Shredder: debales and pre-shreds full size aluminum scrap.\n\nBlue Marlin Single Shaft Shredder: downsizes extrusions and profiles to screen and sort.\n\nBlue Shark Compact Hammermill: shreds any aluminum material to a uniform size, liberate contaminants, and allow the best sorted product to be made.",
        "likes": "74",
        "comments": "6",
        "shares": "2",
        "time": {
          "raw": "3h",
          "parsed": "11.02.2025",
          "isoString": "2025-02-11T08:24:23.480Z"
        },
        "mediaType": "video",
        "mediaContent": {
          "src": [
            {
              "src": "https://dms.licdn.com/playlist/vid/v2/D5605AQFQjUHLybRAyg/mp4-640p-30fp-crf28/B56ZTxIQKsHQBc-/0/1739212271372?e=1741683600&v=beta&t=qxCScxomg2Sm1LgrPIvozQr4wrVqxLYXgUiaS5D8WuE",
              "type": "video/mp4",
              "data-bitrate": 962349
            },
            {
              "src": "https://dms.licdn.com/playlist/vid/v2/D5605AQFQjUHLybRAyg/mp4-720p-30fp-crf28/B56ZTxIQKsHQBg-/0/1739212270992?e=1741683600&v=beta&t=i3J7hy01frZeX2nSyfSpieJrsq0Uk8a6LxhuzQ8EAvA",
              "type": "video/mp4",
              "data-bitrate": 1258216
            }
          ],
          "posterUrl": "https://media.licdn.com/dms/image/v2/D5605AQFQjUHLybRAyg/videocover-high/B56ZTxIQKsHQBs-/0/1739212266224?e=1741683600&v=beta&t=epgtuvxzfm_7m-7fRLKbu01qlOPmz7gONZxWtYkn6iE"
        },
        "date": "2025-02-11T08:24:23.480Z"
      },
      {
        "captions": "Small in size, powerful in performance!\n\nThe Blue Shark 12.10 FP combines compactness, reliability, and exceptional efficiency to revolutionise metal recycling. Designed for shredding ferrous and nonferrous materials, it delivers high-purity outputs while ensuring ease of use, low maintenance, and superior durability.\n\nLooking for a smarter, more efficient recycling solution? Discover more about our hammer mill at https://lnkd.in/eyd-ysfE \n\n#ZATO #ZatoShredder #RecyclingSolutions #BlueShark #Hammermill Small in size, powerful in performance!\n\nThe Blue Shark 12.10 FP combines compactness, reliability, and exceptional efficiency to revolutionise metal recycling. Designed for shredding ferrous and nonferrous materials, it delivers high-purity outputs while ensuring ease of use, low maintenance, and superior durability.\n\nLooking for a smarter, more efficient recycling solution? Discover more about our hammer mill at https://lnkd.in/eyd-ysfE \n\n#ZATO #ZatoShredder #RecyclingSolutions #BlueShark #Hammermill",
        "likes": "23",
        "shares": "3",
        "time": {
          "raw": "3h",
          "parsed": "11.02.2025",
          "isoString": "2025-02-11T08:24:23.481Z"
        },
        "mediaType": "image",
        "mediaContent": [
          "https://media.licdn.com/dms/image/v2/D4E22AQF_irlUGp5mUw/feedshare-shrink_800/B4EZTb4aT1HcAk-/0/1738855786591?e=1744243200&v=beta&t=lWmZ11M_vCXHOTAL_lD7BU5dfeOaVXv6tQgZ2eSSfdM"
        ],
        "date": "2025-02-11T08:24:23.481Z"
      },
      {
        "captions": "Shredding hazardous materials such as fire extinguishers and previously bonified gas tanks is no easy task. The risks of explosions and equipment damage can disrupt operations and inflate costs.\n\nAll these problems can be solved by switching to the Blue Devil shredder. The result? Enhanced safety, reliable hammer mill protection, and improved operational efficiency.\n\nLearn more by watching the full video!\n\n#ZATO #ZatoShredder #RecyclingSolutions #TwinShaftShredder #BlueDevil",
        "likes": "47",
        "shares": "4",
        "time": {
          "raw": "1ay",
          "parsed": "04.02.2025",
          "isoString": "2025-02-04T08:24:23.483Z"
        },
        "mediaType": "video",
        "mediaContent": {
          "src": [
            {
              "src": "https://dms.licdn.com/playlist/vid/v2/D4D05AQE66Ol8QIcTwg/mp4-640p-30fp-crf28/B4DZStIJPQG8Bc-/0/1738071408246?e=1741683600&v=beta&t=X_I9QZ6lZAaHvYreOeA9EzBEUY17kKFjPKBippJcZZ8",
              "type": "video/mp4",
              "data-bitrate": 904424
            },
            {
              "src": "https://dms.licdn.com/playlist/vid/v2/D4D05AQE66Ol8QIcTwg/mp4-720p-30fp-crf28/B4DZStIJPQG8Bg-/0/1738071408741?e=1741683600&v=beta&t=UduXSqkF4b3rzKmUiTxcjmLBBeD8BcT4uNcGZIdnzO8",
              "type": "video/mp4",
              "data-bitrate": 1199877
            }
          ],
          "posterUrl": "https://media.licdn.com/dms/image/v2/D4D05AQE66Ol8QIcTwg/videocover-low/B4DZStIJPQG8CI-/0/1738071403279?e=1741683600&v=beta&t=OVF8uKpqnnGE-SCN_Y5OzxzlS7dVhyicxIXw8r0Bd1o"
        },
        "date": "2025-02-04T08:24:23.483Z"
      },
      {
        "captions": "Safety and efficiency go hand in hand with Zato’s Blue Devil pre-shredder.\n\nDesigned to act as a ‘Guardian Angel’, the Blue Devil reduces explosion risks caused by, previously bonified, gas tanks ensuring a safe working environment. Its open design handles dangerous items without damage, minimising downtime and protecting your team and profits.\n\nInvest in safety and performance—discover more about Zato’s Blue Devil.\n\n#ZATO #ZatoShredder #RecyclingSolutions #TwinShaftShredder #BlueDevil",
        "likes": "13",
        "comments": "3",
        "shares": "2",
        "time": {
          "raw": "1ay",
          "parsed": "04.02.2025",
          "isoString": "2025-02-04T08:24:23.485Z"
        },
        "mediaType": "document",
        "mediaContent": {
          "title": "Can a pre-shredder protect you from gas tank explosions?",
          "subtitle": "4 sayfa",
          "totalPages": 4,
          "coverPages": [
            {
              "type": "image",
              "config": {
                "src": "https://media.licdn.com/dms/image/v2/D4D1FAQGH4EkSB_OCCg/feedshare-document-cover-images_480/B4DZSNX88DG4BM-/0/1737538660666?e=1741683600&v=beta&t=QdgsMIRruh-rlmMl2h7TLTyqjJD0SbO6Pby5ZE5ZzyU"
              }
            },
            {
              "type": "image",
              "config": {
                "src": "https://media.licdn.com/dms/image/v2/D4D1FAQGH4EkSB_OCCg/feedshare-document-cover-images_480/B4DZSNX88DG4BM-/1/1737538660666?e=1741683600&v=beta&t=MdPgrYdHWZk3RqlNrByBCcifCQGlXtMEaJcVgCuWoQs"
              }
            },
            {
              "type": "image",
              "config": {
                "src": "https://media.licdn.com/dms/image/v2/D4D1FAQGH4EkSB_OCCg/feedshare-document-cover-images_480/B4DZSNX88DG4BM-/2/1737538660666?e=1741683600&v=beta&t=tsIEFKlfxUZ928Q3dvCB8wQLlsE7bLTtpWNhtBk8OlA"
              }
            }
          ]
        },
        "date": "2025-02-04T08:24:23.485Z"
      },
      {
        "captions": "At a French customer’s facility, the Zato Blue Devil twin-shaft shredder turned challenges into solutions.\n\n- Cleaner separation\n- Reduced material volume\n- Optimised processes\n\nThe result? Increased efficiency and a satisfied client\n\nWatch the full video to see the Blue Devil in action and discover how it’s revolutionizing recycling processes!\n\n#ZATO #ZatoShredder #RecyclingSolutions #TwinShaftShredder #BlueDevil",
        "likes": "52",
        "comments": "1",
        "shares": "5",
        "time": {
          "raw": "1ay",
          "parsed": "04.02.2025",
          "isoString": "2025-02-04T08:24:23.486Z"
        },
        "mediaType": "video",
        "mediaContent": {
          "src": [
            {
              "src": "https://dms.licdn.com/playlist/vid/v2/D4D05AQGouUSlJ5ciEg/mp4-720p-30fp-crf28/B4DZSEYkJAG8Bg-/0/1737387870896?e=1741683600&v=beta&t=_w1lXNnhuSwGQ-SFvoc3MnTO3iQUmLA-SdkP0E4Nx3U",
              "type": "video/mp4",
              "data-bitrate": 1143537
            },
            {
              "src": "https://dms.licdn.com/playlist/vid/v2/D4D05AQGouUSlJ5ciEg/mp4-640p-30fp-crf28/B4DZSEYkJAG8Bc-/0/1737387868796?e=1741683600&v=beta&t=zYld2Rt32G6rr2xslPcBPraSABUSStSMv_oqAJ0vSec",
              "type": "video/mp4",
              "data-bitrate": 882342
            }
          ],
          "posterUrl": "https://media.licdn.com/dms/image/v2/D4D05AQGouUSlJ5ciEg/videocover-low/B4DZSEYkJAG8CI-/0/1737387862519?e=1741683600&v=beta&t=4P_a0-h1QOWmOOG91XA4oE2hfPgdHJamEEiiuMsjwOs"
        },
        "date": "2025-02-04T08:24:23.486Z"
      },
      {
        "captions": "Recycling teaches us that every ending is also a new beginning. ♻️✨\n\nAt Zato, we hope this festive season and the close of 2024 bring the same joy and success we’ve shared together this year, with a renewed promise to make the future even more sustainable.\n\nWishing you happy holidays from all of us at Zato!\n\n#ZATO #ZatoShredder #RecyclingEquipment Recycling teaches us that every ending is also a new beginning. ♻️✨\n\nAt Zato, we hope this festive season and the close of 2024 bring the same joy and success we’ve shared together this year, with a renewed promise to make the future even more sustainable.\n\nWishing you happy holidays from all of us at Zato!\n\n#ZATO #ZatoShredder #RecyclingEquipment",
        "likes": "7",
        "time": {
          "raw": "2ay",
          "parsed": "04.01.2025",
          "isoString": "2025-01-04T08:24:23.488Z"
        },
        "mediaType": "image",
        "mediaContent": [
          "https://media.licdn.com/dms/image/v2/D4D22AQEJFUUJcbvVsA/feedshare-shrink_800/B4DZPAYRqdHQAg-/0/1734099410386?e=1744243200&v=beta&t=AXPJXoG4sm9bwJDnU5_HKs1g8ERTpV9__C4b-uSkTXY"
        ],
        "date": "2025-01-04T08:24:23.488Z"
      },
      {
        "captions": "Driving innovation also means building connections—meet Wilma, Hanan, and Jenny, the Marketing Team behind Zato’s global presence.\n\nFrom developing creative strategies to organising industry events, their work ensures Zato’s cutting-edge solutions reach the right audience. Their experience ensures that our brand remains an industry leader and connects with customers around the world who trust our expertise.\n\nStay connected to learn more about the people powering Zato’s success!\n\n#ZATO #ZatoShredder #RecyclingSolutions #ZatoTeam #Marketing Driving innovation also means building connections—meet Wilma, Hanan, and Jenny, the Marketing Team behind Zato’s global presence.\n\nFrom developing creative strategies to organising industry events, their work ensures Zato’s cutting-edge solutions reach the right audience. Their experience ensures that our brand remains an industry leader and connects with customers around the world who trust our expertise.\n\nStay connected to learn more about the people powering Zato’s success!\n\n#ZATO #ZatoShredder #RecyclingSolutions #ZatoTeam #Marketing",
        "likes": "20",
        "shares": "3",
        "time": {
          "raw": "2ay",
          "parsed": "04.01.2025",
          "isoString": "2025-01-04T08:24:23.490Z"
        },
        "mediaType": "image",
        "mediaContent": [
          "https://media.licdn.com/dms/image/v2/D4D22AQET0XhCI1JfOw/feedshare-shrink_800/B4DZPaShOEGUAk-/0/1734534110225?e=1744243200&v=beta&t=yYrOXW2srXcFr_YPtwYoKm4RKSWVKqQOt3Gd8FEP3l4"
        ],
        "date": "2025-01-04T08:24:23.490Z"
      },
      {
        "captions": "Your biggest investment is likely not living up to it’s full potential. \n\nHammermills are revolutionary to metal recyclers, transforming you from a collection point to a recycling site. \n\nBut is there more you can get out of your hammermill? \n- YES!\n\n4 of our newest customers allowed us to gather data before and after the installation of a Zato Blue Devil. \n\nNot only was production nearly doubled at every site, but downtime decreased dramatically. \n\nWhy?\n\nIt’s pretty simple - bulky material into a shredder is like eating a full head of lettuce, sure you could do it. \n\nBut if you chopped it up into smaller pieces, you could do it a lot faster and without hurting yourself. \n\nIts the same idea with shred feed. Not only are the pieces smaller, you also remove pressurized containers, or unshreddables.  \n\nRecycle safer. Recycle better. \n\nRecycled Materials Association (ReMA) Recycling Today #scrap #shredder #zato #steelYour biggest investment is likely not living up to it’s full potential. \n\nHammermills are revolutionary to metal recyclers, transforming you from a collection point to a recycling site. \n\nBut is there more you can get out of your hammermill? \n- YES!\n\n4 of our newest customers allowed us to gather data before and after the installation of a Zato Blue Devil. \n\nNot only was production nearly doubled at every site, but downtime decreased dramatically. \n\nWhy?\n\nIt’s pretty simple - bulky material into a shredder is like eating a full head of lettuce, sure you could do it. \n\nBut if you chopped it up into smaller pieces, you could do it a lot faster and without hurting yourself. \n\nIts the same idea with shred feed. Not only are the pieces smaller, you also remove pressurized containers, or unshreddables.  \n\nRecycle safer. Recycle better. \n\nRecycled Materials Association (ReMA) Recycling Today #scrap #shredder #zato #steel",
        "likes": "33",
        "shares": "3",
        "time": {
          "raw": "2ay",
          "parsed": "04.01.2025",
          "isoString": "2025-01-04T08:24:23.493Z"
        },
        "mediaType": "image",
        "mediaContent": [
          "https://media.licdn.com/dms/image/v2/D5622AQEdcinRjpYjpw/feedshare-shrink_2048_1536/B56ZPQyU4lGsAs-/0/1734374674844?e=1744243200&v=beta&t=y_ncIelBvbZppEd1RB4b0iZrpVvQ2wcIRmjYI73daPw"
        ],
        "date": "2025-01-04T08:24:23.493Z"
      },
      {
        "captions": "Big moves don’t happen without blood, sweat, and years of hustle. Standing here in front of our new Zato BlueDevil shredder, I can’t help but think about all the people who made this happen.\n\nThis isn’t just a machine—it’s a symbol of countless late nights, tough decisions, and relentless hard work by every single person on our team. It’s proof that when you grind together, you grow together.\n\nBut don’t get it twisted—we’re far from done. This is just the next step in our journey, and we’re coming for more. Let’s keep building, keep hustling, and keep proving that nothing’s out of reach. 🔥🔧⚙️\n\n#BuiltByHardWork #TeamGrit #NextLevel #ScrapLife #StillGrindingBig moves don’t happen without blood, sweat, and years of hustle. Standing here in front of our new Zato BlueDevil shredder, I can’t help but think about all the people who made this happen.\n\nThis isn’t just a machine—it’s a symbol of countless late nights, tough decisions, and relentless hard work by every single person on our team. It’s proof that when you grind together, you grow together.\n\nBut don’t get it twisted—we’re far from done. This is just the next step in our journey, and we’re coming for more. Let’s keep building, keep hustling, and keep proving that nothing’s out of reach. 🔥🔧⚙️\n\n#BuiltByHardWork #TeamGrit #NextLevel #ScrapLife #StillGrinding",
        "likes": "98",
        "comments": "9",
        "shares": "1",
        "time": {
          "raw": "2ay",
          "parsed": "04.01.2025",
          "isoString": "2025-01-04T08:24:23.496Z"
        },
        "mediaType": "image",
        "mediaContent": [
          "https://media.licdn.com/dms/image/v2/D5622AQHtL2D69yQSVA/feedshare-shrink_800/feedshare-shrink_800/0/1733505013979?e=1744243200&v=beta&t=jhDSNH2pkBzX9sl2Wa-izzqeBr_ibo8vf_cvuQ-RHtk"
        ],
        "date": "2025-01-04T08:24:23.496Z"
      },
      {
        "captions": "Blue Devil available for install as soon as next week! \n\nOur latest installation of a Zato slow speed rotary shear is testing out some different applications. \n\nWith tires, the main draw is increasing density to lower shipping costs. A truck packed full of shredded tires is beating the weight on a truck of full size tires everyday. \n\nSame business case for stainless steel, shredded iron, aluminum, and many other materials. \n#scrap #tires #shredder #zato",
        "likes": "58",
        "comments": "6",
        "shares": "5",
        "time": {
          "raw": "2ay",
          "parsed": "04.01.2025",
          "isoString": "2025-01-04T08:24:23.502Z"
        },
        "mediaType": "video",
        "mediaContent": {
          "src": [
            {
              "src": "https://dms.licdn.com/playlist/vid/v2/D5605AQGP1kxrwdqTYg/mp4-640p-30fp-crf28/mp4-640p-30fp-crf28/0/1733340964892?e=1741683600&v=beta&t=-WfZPoMWM1k5UamQ5ghc2GBvro_uIuvGIXZN-aOgtJY",
              "type": "video/mp4",
              "data-bitrate": 1109375
            },
            {
              "src": "https://dms.licdn.com/playlist/vid/v2/D5605AQGP1kxrwdqTYg/mp4-720p-30fp-crf28/mp4-720p-30fp-crf28/0/1733340966551?e=1741683600&v=beta&t=mhHxlqhW5drWVdE5DVBW_Ypjdv64KO1qSQSHXhE1eCY",
              "type": "video/mp4",
              "data-bitrate": 1420914
            }
          ],
          "posterUrl": "https://media.licdn.com/dms/image/v2/D5605AQGP1kxrwdqTYg/videocover-low/videocover-low/0/1733340954078?e=1741683600&v=beta&t=P23lpAc9aZM_yfVTP9UWF-hQB2Ce_DPJSPxkzVqZZXI"
        },
        "date": "2025-01-04T08:24:23.502Z"
      },
      {
        "captions": "Meet the team behind the reliability and quality of every Zato product.\n\nOur Production Team, based in Prevalle, carefully assembles each component in-house, overseeing every step of the process to ensure robust, durable, and high-performing solutions. With meticulous quality checks and a streamlined production process, they’re dedicated to delivering our equipment on time and to the highest standards. A commitment to quality you can trust.\n\n#ZATO #ZatoShredder #Recyclingsolutions #ZatoTeam #ProductionTeamMeet the team behind the reliability and quality of every Zato product.\n\nOur Production Team, based in Prevalle, carefully assembles each component in-house, overseeing every step of the process to ensure robust, durable, and high-performing solutions. With meticulous quality checks and a streamlined production process, they’re dedicated to delivering our equipment on time and to the highest standards. A commitment to quality you can trust.\n\n#ZATO #ZatoShredder #Recyclingsolutions #ZatoTeam #ProductionTeam",
        "likes": "24",
        "shares": "1",
        "time": {
          "raw": "3ay",
          "parsed": "04.12.2024",
          "isoString": "2024-12-04T08:24:23.503Z"
        },
        "mediaType": "image",
        "mediaContent": [
          "https://media.licdn.com/dms/image/v2/D4E22AQF9LpR1TUOk2Q/feedshare-shrink_800/feedshare-shrink_800/0/1732032548625?e=1744243200&v=beta&t=_M8g6TQxADYDYprAYJLVFUzwOf-XSSRMzH9MV2szLkQ"
        ],
        "date": "2024-12-04T08:24:23.503Z"
      },
      {
        "captions": "Discover the advanced shredding system that’s transforming Access Recycling Services!\n\nFeaturing a seamless integration of the Blue Devil pre-shredder, the fully automated 1,200 HP Blue Shark hammer mill, and the Blue Sorter separation line, this solution is engineered for precision, safety, and efficiency. It minimizes downtime while boosting processing speed and output.\n\nWatch the video to see how this Australian company has optimized its scrap processing!\n\n#ZATO #ZatoShredder #RecyclingEquipment #TwinShaftShredder",
        "likes": "85",
        "comments": "2",
        "shares": "2",
        "time": {
          "raw": "3ay",
          "parsed": "04.12.2024",
          "isoString": "2024-12-04T08:24:23.504Z"
        },
        "mediaType": "video",
        "mediaContent": {
          "src": [
            {
              "src": "https://dms.licdn.com/playlist/vid/v2/D5605AQGTvfQLZGYUvA/mp4-640p-30fp-crf28/mp4-640p-30fp-crf28/0/1731948359092?e=1741683600&v=beta&t=hfV8QDo50OfBPRJzqWWcSqmSnTfJX0Q3dY3sxsfK_B8",
              "type": "video/mp4",
              "data-bitrate": 911373
            },
            {
              "src": "https://dms.licdn.com/playlist/vid/v2/D5605AQGTvfQLZGYUvA/mp4-720p-30fp-crf28/mp4-720p-30fp-crf28/0/1731948357127?e=1741683600&v=beta&t=MZ8HJEGAYfxzy7Pyj6WgPo1tw1VwY7iPijrkAUCQpZo",
              "type": "video/mp4",
              "data-bitrate": 1228857
            }
          ],
          "posterUrl": "https://media.licdn.com/dms/image/v2/D5605AQGTvfQLZGYUvA/videocover-low/videocover-low/0/1731948330141?e=1741683600&v=beta&t=vPEhJHSYuBKX2l5rlA1U5YfzBB9EgNFWpIwpuXg5jMU"
        },
        "date": "2024-12-04T08:24:23.504Z"
      },
      {
        "captions": "A key event addressing the impact of climate disruption, ZATO will showcase its innovative solutions at the Pollutec Paris 2024 trade fair.\n\nFrom November 26th to 27th, explore our comprehensive range of technologies for shredding and processing both ferrous and non-ferrous scrap materials.\n\nConnect with us at stand E041. Don't miss this opportunity!\n\n#ZATO #ZatoShredder #RecyclingEquipment #PollutecParisA key event addressing the impact of climate disruption, ZATO will showcase its innovative solutions at the Pollutec Paris 2024 trade fair.\n\nFrom November 26th to 27th, explore our comprehensive range of technologies for shredding and processing both ferrous and non-ferrous scrap materials.\n\nConnect with us at stand E041. Don't miss this opportunity!\n\n#ZATO #ZatoShredder #RecyclingEquipment #PollutecParis",
        "likes": "14",
        "time": {
          "raw": "3ay",
          "parsed": "04.12.2024",
          "isoString": "2024-12-04T08:24:23.506Z"
        },
        "mediaType": "image",
        "mediaContent": [
          "https://media.licdn.com/dms/image/v2/D4D22AQEqsjksjm73xg/feedshare-shrink_800/feedshare-shrink_800/0/1731339480831?e=1744243200&v=beta&t=HeQFmoUj2s4j3WuCuIImfi29B8aJ1ULU1jDsYAnxcT4"
        ],
        "date": "2024-12-04T08:24:23.506Z"
      },
      {
        "captions": "Busheling. Light iron. White goods. Breakage. Car bodies. Pre-shredding. Cast and Sheet Aluminum. Heavy melt.\n\nThrough one machine, our Blue Devil. \n\nWe’ve added lots of new customers in the US🇺🇸 this year. \n\nWe are learning new applications and outlets every month as the market changes. \n\nAnd as our product count grows here, so do we. \n\nWhich is why we’ve invested in a new office in Northern Kentucky and grown our employee headcount by 100% this year. \n\nZato North America stocks all of our parts and blades here now. 🔩⚙️\n\nService and support technicians are here year round now. \n\nI’m looking forward to an exciting end of the year and strong growth going into 2025! \n\nSee you next week at the Shredder Ops Forum in San Antonio! ✌🏼\n\n#zato #metal #recycling #recycledmaterials Recycled Materials Association (ReMA)",
        "likes": "75",
        "shares": "3",
        "time": {
          "raw": "3ay",
          "parsed": "04.12.2024",
          "isoString": "2024-12-04T08:24:23.507Z"
        },
        "mediaType": "video",
        "mediaContent": {
          "src": [
            {
              "src": "https://dms.licdn.com/playlist/vid/v2/D5605AQHL6ZxmQ_KhUQ/mp4-640p-30fp-crf28/mp4-640p-30fp-crf28/0/1730834092791?e=1741683600&v=beta&t=br_FVEQYeSoZuPOC5gOOz7xH8i5X81hEkLLd8iIwQVQ",
              "type": "video/mp4",
              "data-bitrate": 851946
            },
            {
              "src": "https://dms.licdn.com/playlist/vid/v2/D5605AQHL6ZxmQ_KhUQ/mp4-720p-30fp-crf28/mp4-720p-30fp-crf28/0/1730834089330?e=1741683600&v=beta&t=hgarKqKLritQcvZO5sQTYeifaIq7HT88Bd-ee9X6Af4",
              "type": "video/mp4",
              "data-bitrate": 1171792
            }
          ],
          "posterUrl": "https://media.licdn.com/dms/image/v2/D5605AQHL6ZxmQ_KhUQ/videocover-high/videocover-high/0/1730834081697?e=1741683600&v=beta&t=59mGO1OIKNITr6KWwXrBFGRkpcAdW9VC0-x-SV032jY"
        },
        "date": "2024-12-04T08:24:23.507Z"
      },
      {
        "captions": "The ultimate system for precision, durability and efficiency in one shear: Cayman RB!\n\nWith its robust frame and high-bore cylinder, it delivers powerful cutting forces, effortlessly processing railway and tramway rails up to 70 kg/m. Equipped with four-profile interchangeable blades and simplified hydraulic rotation, it ensures smooth operation and reduced maintenance.\n\n#ZATO #ZatoShredder #RecyclingEquipmentThe ultimate system for precision, durability and efficiency in one shear: Cayman RB!\n\nWith its robust frame and high-bore cylinder, it delivers powerful cutting forces, effortlessly processing railway and tramway rails up to 70 kg/m. Equipped with four-profile interchangeable blades and simplified hydraulic rotation, it ensures smooth operation and reduced maintenance.\n\n#ZATO #ZatoShredder #RecyclingEquipment",
        "likes": "16",
        "time": {
          "raw": "3ay",
          "parsed": "04.12.2024",
          "isoString": "2024-12-04T08:24:23.508Z"
        },
        "mediaType": "image",
        "mediaContent": [
          "https://media.licdn.com/dms/image/v2/D4D22AQFHukb0ADdYVQ/feedshare-shrink_800/feedshare-shrink_800/0/1730822756416?e=1744243200&v=beta&t=YhCsXatFQN-Z40knlr9ZZW5KHyFy2wHMVu6r3eoz0bM"
        ],
        "date": "2024-12-04T08:24:23.508Z"
      }
    ]
  },
  {
    "name": "Sennebogen",
    "followerData": [
      [
        20250225,
        26192
      ],
      [
        20250225,
        26194
      ],
      [
        20250228,
        26230
      ],
      [
        20250228,
        26230
      ],
      [
        20250228,
        26230
      ],
      [
        20250228,
        26230
      ],
      [
        20250303,
        26264
      ],
      [
        1741011719166,
        "26.267"
      ],
      [
        1741076686937,
        "26.273"
      ]
    ],
    "data": [
      {
        "captions": "𝟲𝟲 𝗝𝗮𝗵𝗿𝗲 𝗭𝘂𝘀𝗮𝗺𝗺𝗲𝗻𝗮𝗿𝗯𝗲𝗶𝘁: 𝗦𝗘𝗡𝗡𝗘𝗕𝗢𝗚𝗘𝗡 𝘂𝗻𝗱 𝗥𝗼𝘁𝗵𝗲 𝗘𝗿𝗱𝗲 𝗳𝗲𝗶𝗲𝗿𝗻 𝗝𝘂𝗯𝗶𝗹ä𝘂𝗺 🤝\n\nSENNEBOGEN und Rothe Erde feiern 66 Jahre erfolgreiche Partnerschaft! Seit 1959 liefert Rothe Erde, einer der führenden Hersteller von Großwälzlagern, hochwertige Wälzlager für die Maschinen von SENNEBOGEN – vom Umschlagbagger bis zum Hafenkran. ⚙️\n\n🗨️ „Die Qualität und Zuverlässigkeit der Komponenten von Rothe Erde bilden seit Jahrzehnten eine verlässliche Basis für unsere innovativen und zuverlässigen Premiumprodukte“, so Erich Sennebogen, Geschäftsführer von SENNEBOGEN.\n\nZur Jubiläumsfeier wurde ein doppelreihiges Kugellager, das baugleich mit dem ersten gelieferten Modell aus 1959 ist, an das Erich Sennebogen-Museum überreicht. 👏\n\n💡Zum Artikel: https://lnkd.in/endMfxQJ\n\n_____\n\n𝟲𝟲 𝗬𝗲𝗮𝗿𝘀 𝗼𝗳 𝗣𝗮𝗿𝘁𝗻𝗲𝗿𝘀𝗵𝗶𝗽: 𝗦𝗘𝗡𝗡𝗘𝗕𝗢𝗚𝗘𝗡 𝗮𝗻𝗱 𝗥𝗼𝘁𝗵𝗲 𝗘𝗿𝗱𝗲 𝗖𝗲𝗹𝗲𝗯𝗿𝗮𝘁𝗲 𝗔𝗻𝗻𝗶𝘃𝗲𝗿𝘀𝗮𝗿𝘆 🤝\n\nSENNEBOGEN and Rothe Erde celebrate 66 years of successful collaboration! Since 1959, Rothe Erde, a leading manufacturer of large bearings, has supplied high-quality bearings for SENNEBOGEN machines – from material handlers to harbor cranes. ⚙️\n\n🗨️ \"The quality and reliability of Rothe Erde components have formed the foundation of our innovative and reliable premium products for decades,\" says Erich Sennebogen, CEO of SENNEBOGEN.\n\nTo mark the anniversary, a double-row ball bearing, identical to the first one delivered in 1959, was handed over to the Erich Sennebogen Museum. 👏\n\n💡Read more here: https://lnkd.in/e3s4uYDc\n\n#SENNEBOGEN #RotheErde #thyssenkrupp #Partnership #Maschinenbau #MOVEBIGTHINGS𝟲𝟲 𝗝𝗮𝗵𝗿𝗲 𝗭𝘂𝘀𝗮𝗺𝗺𝗲𝗻𝗮𝗿𝗯𝗲𝗶𝘁: 𝗦𝗘𝗡𝗡𝗘𝗕𝗢𝗚𝗘𝗡 𝘂𝗻𝗱 𝗥𝗼𝘁𝗵𝗲 𝗘𝗿𝗱𝗲 𝗳𝗲𝗶𝗲𝗿𝗻 𝗝𝘂𝗯𝗶𝗹ä𝘂𝗺 🤝\n\nSENNEBOGEN und Rothe Erde feiern 66 Jahre erfolgreiche Partnerschaft! Seit 1959 liefert Rothe Erde, einer der führenden Hersteller von Großwälzlagern, hochwertige Wälzlager für die Maschinen von SENNEBOGEN – vom Umschlagbagger bis zum Hafenkran. ⚙️\n\n🗨️ „Die Qualität und Zuverlässigkeit der Komponenten von Rothe Erde bilden seit Jahrzehnten eine verlässliche Basis für unsere innovativen und zuverlässigen Premiumprodukte“, so Erich Sennebogen, Geschäftsführer von SENNEBOGEN.\n\nZur Jubiläumsfeier wurde ein doppelreihiges Kugellager, das baugleich mit dem ersten gelieferten Modell aus 1959 ist, an das Erich Sennebogen-Museum überreicht. 👏\n\n💡Zum Artikel: https://lnkd.in/endMfxQJ\n\n_____\n\n𝟲𝟲 𝗬𝗲𝗮𝗿𝘀 𝗼𝗳 𝗣𝗮𝗿𝘁𝗻𝗲𝗿𝘀𝗵𝗶𝗽: 𝗦𝗘𝗡𝗡𝗘𝗕𝗢𝗚𝗘𝗡 𝗮𝗻𝗱 𝗥𝗼𝘁𝗵𝗲 𝗘𝗿𝗱𝗲 𝗖𝗲𝗹𝗲𝗯𝗿𝗮𝘁𝗲 𝗔𝗻𝗻𝗶𝘃𝗲𝗿𝘀𝗮𝗿𝘆 🤝\n\nSENNEBOGEN and Rothe Erde celebrate 66 years of successful collaboration! Since 1959, Rothe Erde, a leading manufacturer of large bearings, has supplied high-quality bearings for SENNEBOGEN machines – from material handlers to harbor cranes. ⚙️\n\n🗨️ \"The quality and reliability of Rothe Erde components have formed the foundation of our innovative and reliable premium products for decades,\" says Erich Sennebogen, CEO of SENNEBOGEN.\n\nTo mark the anniversary, a double-row ball bearing, identical to the first one delivered in 1959, was handed over to the Erich Sennebogen Museum. 👏\n\n💡Read more here: https://lnkd.in/e3s4uYDc\n\n#SENNEBOGEN #RotheErde #thyssenkrupp #Partnership #Maschinenbau #MOVEBIGTHINGS",
        "likes": "101",
        "comments": "3",
        "shares": "3",
        "time": {
          "raw": "4g",
          "parsed": "28.02.2025",
          "isoString": "2025-02-28T08:24:46.654Z"
        },
        "mediaType": "image",
        "mediaContent": [
          "https://media.licdn.com/dms/image/v2/D4E10AQEWHP1mbiGITQ/image-shrink_800/B4EZVLkrHgG0AI-/0/1740729661788?e=1741683600&v=beta&t=pwtL4kt3-_AHOXL6XKWfhAufErP2wIdpguJgBzi-l3Y"
        ],
        "date": "2025-02-28T08:24:46.654Z"
      },
      {
        "captions": "𝗡𝗲𝘄 𝟮𝟬𝟬 𝘁 𝗧𝗲𝗹𝗲𝘀𝗰𝗼𝗽𝗶𝗰 𝗖𝗿𝗮𝘄𝗹𝗲𝗿 𝗖𝗿𝗮𝗻𝗲: 𝗦𝗘𝗡𝗡𝗘𝗕𝗢𝗚𝗘𝗡 𝟲𝟮𝟬𝟯 𝗘 🆕\n\nWe are launching our new largest telecrane on crawlers yet, designed for demanding construction projects with 200 t load capacity. 💪\n\nInfrastructure, bridge, and wind turbine construction – the robust SENNEBOGEN 6203 E handles even the heaviest precast elements and components.  It's suitable for pick-and-carry operation and tasks on uneven construction sites, enabling working at angles of up to 4°. 🚧\n\n🏗️ Pin Boom can be telescoped up to 56.4 m and configured with various jib options, extendable up to 78 m boom length.\n🔧 Easy transport in just 7 transport units & capable of fast self-assembly\n📊 New SENcon Load Control for operator assistance: intuitive control system and valuable lifting data on a large, clearly organised display\n\n📰 Read more in the press release: 👉 https://bit.ly/3D6jm34\n\n🔥 See it live at bauma 2025 at the SENNEBOGEN booth!\nMore details: https://lnkd.in/eh7YATsp\n\n#TelescopicCrane #CrawlerCrane #HeavyLifting #ConstructionMachinery #Bauma2025 #MOVEBIGTHINGS #SENNEBOGEN #GreenHeartofbauma𝗡𝗲𝘄 𝟮𝟬𝟬 𝘁 𝗧𝗲𝗹𝗲𝘀𝗰𝗼𝗽𝗶𝗰 𝗖𝗿𝗮𝘄𝗹𝗲𝗿 𝗖𝗿𝗮𝗻𝗲: 𝗦𝗘𝗡𝗡𝗘𝗕𝗢𝗚𝗘𝗡 𝟲𝟮𝟬𝟯 𝗘 🆕\n\nWe are launching our new largest telecrane on crawlers yet, designed for demanding construction projects with 200 t load capacity. 💪\n\nInfrastructure, bridge, and wind turbine construction – the robust SENNEBOGEN 6203 E handles even the heaviest precast elements and components.  It's suitable for pick-and-carry operation and tasks on uneven construction sites, enabling working at angles of up to 4°. 🚧\n\n🏗️ Pin Boom can be telescoped up to 56.4 m and configured with various jib options, extendable up to 78 m boom length.\n🔧 Easy transport in just 7 transport units & capable of fast self-assembly\n📊 New SENcon Load Control for operator assistance: intuitive control system and valuable lifting data on a large, clearly organised display\n\n📰 Read more in the press release: 👉 https://bit.ly/3D6jm34\n\n🔥 See it live at bauma 2025 at the SENNEBOGEN booth!\nMore details: https://lnkd.in/eh7YATsp\n\n#TelescopicCrane #CrawlerCrane #HeavyLifting #ConstructionMachinery #Bauma2025 #MOVEBIGTHINGS #SENNEBOGEN #GreenHeartofbauma",
        "likes": "104",
        "comments": "1",
        "shares": "7",
        "time": {
          "raw": "4g",
          "parsed": "28.02.2025",
          "isoString": "2025-02-28T08:24:46.657Z"
        },
        "mediaType": "image",
        "mediaContent": [
          "https://media.licdn.com/dms/image/v2/D4E10AQF6UwHWS_F48A/image-shrink_800/B4EZVHfuU2GgAc-/0/1740661256314?e=1741683600&v=beta&t=r6p-N0vZyTOn2OQJiRehUfe_gIX-pOW0Jvgz49sKy4s",
          "https://media.licdn.com/dms/image/v2/D4E10AQFBYNQggClJfA/image-shrink_800/B4EZVHfuU_GgAc-/0/1740661254309?e=1741683600&v=beta&t=PFqthMf1VCBkcM27BOfyfDPEnN9lwiCnWrXSVvo_Twc",
          "https://media.licdn.com/dms/image/v2/D4E10AQH4BPIffpatdQ/image-shrink_800/B4EZVHfuU9GgAc-/0/1740661254211?e=1741683600&v=beta&t=1Tq6FixSRbTqLfxgxKp2svoPVFQfsA23S1pUjg_DcKE",
          "https://media.licdn.com/dms/image/v2/D4E10AQFnvIONpzoDnQ/image-shrink_800/B4EZVHfuUvH0Ac-/0/1740661254331?e=1741683600&v=beta&t=KWvskaE3pGtpUyprEKOTPLDm65YAGHsPDe6Bc0bmuKs",
          "https://media.licdn.com/dms/image/v2/D4E10AQH6dAB-nB8rkg/image-shrink_800/B4EZVHfuVBHcAk-/0/1740661254346?e=1741683600&v=beta&t=VWT9muBhf8-Ii4ixX201Ql8ldAOL4Wi7fyA6-8BQ4zY"
        ],
        "date": "2025-02-28T08:24:46.657Z"
      },
      {
        "captions": "𝗡𝗲𝘄: 𝗦𝗘𝗡𝗡𝗘𝗕𝗢𝗚𝗘𝗡 𝟴𝟯𝟬 𝗘 𝗗𝗲𝗺𝗼𝗹𝗶𝘁𝗶𝗼𝗻 𝗩𝗮𝗿𝗶𝗼 𝗧𝗼𝗼𝗹 𝘄𝗶𝘁𝗵 𝗗𝗶𝗴𝗴𝗶𝗻𝗴 𝗕𝗼𝗼𝗺 & 𝗕𝘂𝗰𝗸𝗲𝘁 🔥\n\nThe proven SENNEBOGEN 830 E Demolition machine is now becoming even more versatile with the new Vario Tool variant with two new equipment options:\n🆕 Robust 12 m digging boom\n🆕 1.7m³ digging bucket \n\n💡 Why is this important? Urban demolition projects are getting more complex, and debris recycling plus site preparation are now key tasks for modern demolition contractors.\n🚧 SENNEBOGEN now goes beyond demolition and sorting: offering solutions for earthmoving and foundation work as well.\n🔄 The quick-change system allows seamless switching between boom variants and attachments. One machine for multiple jobs saves you time and costs!\n\n📰 Read more in the press release: 👉 https://bit.ly/4kcVVFU\n\n💚 See this exhibit live at bauma 2025 trade fair in Munich!\nLearn more here: https://lnkd.in/eh7YATsp\n\n#Demolition #Excavator #Abbruchbagger #Abbruch #ConstructionMachinery #HeavyEquipment #Bauma2025 #MOVEBIGTHINGS #SENNEBOGEN, the #GreenHeartofbauma𝗡𝗲𝘄: 𝗦𝗘𝗡𝗡𝗘𝗕𝗢𝗚𝗘𝗡 𝟴𝟯𝟬 𝗘 𝗗𝗲𝗺𝗼𝗹𝗶𝘁𝗶𝗼𝗻 𝗩𝗮𝗿𝗶𝗼 𝗧𝗼𝗼𝗹 𝘄𝗶𝘁𝗵 𝗗𝗶𝗴𝗴𝗶𝗻𝗴 𝗕𝗼𝗼𝗺 & 𝗕𝘂𝗰𝗸𝗲𝘁 🔥\n\nThe proven SENNEBOGEN 830 E Demolition machine is now becoming even more versatile with the new Vario Tool variant with two new equipment options:\n🆕 Robust 12 m digging boom\n🆕 1.7m³ digging bucket \n\n💡 Why is this important? Urban demolition projects are getting more complex, and debris recycling plus site preparation are now key tasks for modern demolition contractors.\n🚧 SENNEBOGEN now goes beyond demolition and sorting: offering solutions for earthmoving and foundation work as well.\n🔄 The quick-change system allows seamless switching between boom variants and attachments. One machine for multiple jobs saves you time and costs!\n\n📰 Read more in the press release: 👉 https://bit.ly/4kcVVFU\n\n💚 See this exhibit live at bauma 2025 trade fair in Munich!\nLearn more here: https://lnkd.in/eh7YATsp\n\n#Demolition #Excavator #Abbruchbagger #Abbruch #ConstructionMachinery #HeavyEquipment #Bauma2025 #MOVEBIGTHINGS #SENNEBOGEN, the #GreenHeartofbauma",
        "likes": "71",
        "comments": "1",
        "shares": "8",
        "time": {
          "raw": "6g",
          "parsed": "26.02.2025",
          "isoString": "2025-02-26T08:24:46.658Z"
        },
        "mediaType": "image",
        "mediaContent": [
          "https://media.licdn.com/dms/image/v2/D5610AQFxxzmW3eiEPA/image-shrink_800/B56ZU9MsZpGsAc-/0/1740488494331?e=1741683600&v=beta&t=L2sMEpndJru8xJNR26NR_uK7tUXjvR2dfazPADArM9I",
          "https://media.licdn.com/dms/image/v2/D5610AQGew4LUogli_g/image-shrink_800/B56ZU9MsaGGUAs-/0/1740488496045?e=1741683600&v=beta&t=yXV9mCMgWe19UcX0F1eSywa-2-47RIxOqXupeA4XxgY",
          "https://media.licdn.com/dms/image/v2/D5610AQHGTQqTpCxR0A/image-shrink_800/B56ZU9MsX4HoAo-/0/1740488493891?e=1741683600&v=beta&t=vRjLA7iIj8lF0CGXqZiS8k3gowK0vfBKXDd7p3i7Oko",
          "https://media.licdn.com/dms/image/v2/D5610AQHQ2ogoCmcrOw/image-shrink_800/B56ZU9MsZnGsAg-/0/1740488497515?e=1741683600&v=beta&t=c2xxrh9oEUC0ppWCDsRIpqPdLbAuXZjlkycudQty8OA"
        ],
        "date": "2025-02-26T08:24:46.658Z"
      },
      {
        "captions": "𝗡𝗲𝘄 𝗦𝗘𝗡𝗡𝗘𝗕𝗢𝗚𝗘𝗡 𝟯𝟲𝟬 𝗚 – 𝗧𝗵𝗲 𝗜𝗻𝗱𝘂𝘀𝘁𝗿𝗶𝗮𝗹 𝟲 𝘁 𝗧𝗲𝗹𝗲𝗵𝗮𝗻𝗱𝗹𝗲𝗿 🆕\n\nThe SENNEBOGEN 360 G takes telehandler performance to a whole new level: With its robust steel construction it is built for demanding multi-shift operations in industrial applications and more. 🏭\n\n💪 The best of both worlds: combining the power and Z-kinematics of a wheel loader with the agility of a telehandler. The new addition to our portfolio boosts with even faster work cycles and higher efficiency.  \n🔝 Heavy lifter with a 6 t load capacity and an 8.5 m stacking height.\n👷 Newly redesigned Multicab for maximum operator benefits: The cab can be raised to 4.25 m view height, providing an optimal view of trucks, containers, and the entire jobsite. \n🔇Noise & vibration protection, ergonomic controls, and an intuitive touch display ensure a fatigue-free and highly efficient workspace.\n🔄 Versatile & customizable: Choose from a wide range of attachments, equipment options, and tire variants to tailor the 360 G to your needs.\n\n📢 Learn more in the press release:\n➡️ https://bit.ly/4h2hNBn\n\n📍 Join us at bauma Munich in April 2025 to see the 360 G at our booth!\n➡️ https://lnkd.in/eh7YATsp\n\n#Sennebogen360G #Telehandler #Teleskoplader #Industrielader #Wheelloader #MaterialHandling #Bauma2025 #MOVEBIGTHINGS with #SENNEBOGEN, the #GreenHeartofBauma 💚𝗡𝗲𝘄 𝗦𝗘𝗡𝗡𝗘𝗕𝗢𝗚𝗘𝗡 𝟯𝟲𝟬 𝗚 – 𝗧𝗵𝗲 𝗜𝗻𝗱𝘂𝘀𝘁𝗿𝗶𝗮𝗹 𝟲 𝘁 𝗧𝗲𝗹𝗲𝗵𝗮𝗻𝗱𝗹𝗲𝗿 🆕\n\nThe SENNEBOGEN 360 G takes telehandler performance to a whole new level: With its robust steel construction it is built for demanding multi-shift operations in industrial applications and more. 🏭\n\n💪 The best of both worlds: combining the power and Z-kinematics of a wheel loader with the agility of a telehandler. The new addition to our portfolio boosts with even faster work cycles and higher efficiency.  \n🔝 Heavy lifter with a 6 t load capacity and an 8.5 m stacking height.\n👷 Newly redesigned Multicab for maximum operator benefits: The cab can be raised to 4.25 m view height, providing an optimal view of trucks, containers, and the entire jobsite. \n🔇Noise & vibration protection, ergonomic controls, and an intuitive touch display ensure a fatigue-free and highly efficient workspace.\n🔄 Versatile & customizable: Choose from a wide range of attachments, equipment options, and tire variants to tailor the 360 G to your needs.\n\n📢 Learn more in the press release:\n➡️ https://bit.ly/4h2hNBn\n\n📍 Join us at bauma Munich in April 2025 to see the 360 G at our booth!\n➡️ https://lnkd.in/eh7YATsp\n\n#Sennebogen360G #Telehandler #Teleskoplader #Industrielader #Wheelloader #MaterialHandling #Bauma2025 #MOVEBIGTHINGS with #SENNEBOGEN, the #GreenHeartofBauma 💚",
        "likes": "115",
        "shares": "32",
        "time": {
          "raw": "1h",
          "parsed": "25.02.2025",
          "isoString": "2025-02-25T08:24:46.660Z"
        },
        "mediaType": "image",
        "mediaContent": [
          "https://media.licdn.com/dms/image/v2/D4E10AQEMang9rNsVwA/image-shrink_800/B4EZUizafDGgAU-/0/1740045660184?e=1741683600&v=beta&t=ovglhz6QA2R43uoE7LrRTYmueUc9ImJYW73zpyCE44M",
          "https://media.licdn.com/dms/image/v2/D4E10AQFm-kQMEuCMIA/image-shrink_800/B4EZUizafCGgAg-/0/1740045658945?e=1741683600&v=beta&t=QbZHF8Mlvz2LDggE_de6zmKQv7KQnyY80IXNA2mzwLI",
          "https://media.licdn.com/dms/image/v2/D4E10AQEwM-1pdZK-Yw/image-shrink_800/B4EZUizafCHcAc-/0/1740045659775?e=1741683600&v=beta&t=0YTpLP1gz0-sbv_IU9D-51UkAuQuOn0M75xHdwMqyX8",
          "https://media.licdn.com/dms/image/v2/D4E10AQEDs4y_VW63mw/image-shrink_800/B4EZUizae2HgAc-/0/1740045659239?e=1741683600&v=beta&t=OlsJJt0CQudJKqHZhoKSGK1zK4KMZmnh5EQ8DLEiVmY",
          "https://media.licdn.com/dms/image/v2/D4E10AQGJyG5vOlJqrQ/image-shrink_800/B4EZUizae1GgAg-/0/1740045659868?e=1741683600&v=beta&t=9zE8-hBVpX0jg8EBWo3OYtLUYhz49zaDELkZFXfIgvQ"
        ],
        "date": "2025-02-25T08:24:46.660Z"
      },
      {
        "captions": "𝗜𝗻𝘁𝗿𝗼𝗱𝘂𝗰𝗶𝗻𝗴 𝘁𝗵𝗲 𝗡𝗲𝘄 𝗦𝗘𝗡𝗡𝗘𝗕𝗢𝗚𝗘𝗡 𝟴𝟯𝟬 𝗚 – 𝗧𝗵𝗲 𝗡𝗲𝘅𝘁 𝗘𝘃𝗼𝗹𝘂𝘁𝗶𝗼𝗻 𝗶𝗻 𝗠𝗮𝘁𝗲𝗿𝗶𝗮𝗹 𝗛𝗮𝗻𝗱𝗹𝗶𝗻𝗴! 🆕\n\nThe SENNEBOGEN 830 has been upgraded to the newest G-Series machine generation! The powerful 830 G material handler delivers enhanced efficiency, performance, and operator comfort. \n\n💪 Up to 17 m reach and a 38 t operating weight make the 830 G ideal for demanding scrap handling, recycling, timber, and port applications.\n✅ With its modular design, and various undercarriage and attachment options, SENNEBOGEN can provide you with the ideal solution for your jobsite.\n🍃 Optimized for low fuel consumption, reduced emissions, and HVO capability.\n👷 New Maxcab Comfort Cab: Designed for operator comfort, featuring the best view, a vibration-resistant workspace, ergonomic climate-controlled seating, and active noise cancellation.\n🕹️ With SENcon Control System: The revolutionary new SENcon provides intuitive operation, individual driver profiles, real-time machine insights, remote diagnostics, and over-the-air updates.\n\nLearn more about the 830 G in the press release: \n➡️ https://bit.ly/4b42mac\n\n📍 Join us at Bauma 2025 in Munich in April to see the 830 G at our booth! \n➡️ https://www.sennebogen.com\n\n#MaterialHandling #MaterialHandler #Umschlagbagger #830G #SENcon #Bauma2025 #MOVEBIGTHINGS #SENNEBOGEN the #GreenHeartofBauma 💚𝗜𝗻𝘁𝗿𝗼𝗱𝘂𝗰𝗶𝗻𝗴 𝘁𝗵𝗲 𝗡𝗲𝘄 𝗦𝗘𝗡𝗡𝗘𝗕𝗢𝗚𝗘𝗡 𝟴𝟯𝟬 𝗚 – 𝗧𝗵𝗲 𝗡𝗲𝘅𝘁 𝗘𝘃𝗼𝗹𝘂𝘁𝗶𝗼𝗻 𝗶𝗻 𝗠𝗮𝘁𝗲𝗿𝗶𝗮𝗹 𝗛𝗮𝗻𝗱𝗹𝗶𝗻𝗴! 🆕\n\nThe SENNEBOGEN 830 has been upgraded to the newest G-Series machine generation! The powerful 830 G material handler delivers enhanced efficiency, performance, and operator comfort. \n\n💪 Up to 17 m reach and a 38 t operating weight make the 830 G ideal for demanding scrap handling, recycling, timber, and port applications.\n✅ With its modular design, and various undercarriage and attachment options, SENNEBOGEN can provide you with the ideal solution for your jobsite.\n🍃 Optimized for low fuel consumption, reduced emissions, and HVO capability.\n👷 New Maxcab Comfort Cab: Designed for operator comfort, featuring the best view, a vibration-resistant workspace, ergonomic climate-controlled seating, and active noise cancellation.\n🕹️ With SENcon Control System: The revolutionary new SENcon provides intuitive operation, individual driver profiles, real-time machine insights, remote diagnostics, and over-the-air updates.\n\nLearn more about the 830 G in the press release: \n➡️ https://bit.ly/4b42mac\n\n📍 Join us at Bauma 2025 in Munich in April to see the 830 G at our booth! \n➡️ https://www.sennebogen.com\n\n#MaterialHandling #MaterialHandler #Umschlagbagger #830G #SENcon #Bauma2025 #MOVEBIGTHINGS #SENNEBOGEN the #GreenHeartofBauma 💚",
        "likes": "176",
        "comments": "1",
        "shares": "31",
        "time": {
          "raw": "1h",
          "parsed": "25.02.2025",
          "isoString": "2025-02-25T08:24:46.662Z"
        },
        "mediaType": "image",
        "mediaContent": [
          "https://media.licdn.com/dms/image/v2/D4E10AQGbZ8WxvU5SNg/image-shrink_800/B4EZUZXmyzGYAc-/0/1739887374473?e=1741683600&v=beta&t=BPqPqLAcNaLJhiuuQrn2T1NcF4-lMnsJyQUf342Ug40",
          "https://media.licdn.com/dms/image/v2/D4E10AQGmhyqMPVKFYw/image-shrink_800/B4EZUZXmy1HMAg-/0/1739887374924?e=1741683600&v=beta&t=d0X_9Aac4poDGmHvJebu7Js3mhk-KjnuIUeunSqAbgA",
          "https://media.licdn.com/dms/image/v2/D4E10AQHkn49nGzbgQg/image-shrink_800/B4EZUZXmz3G0Ac-/0/1739887374721?e=1741683600&v=beta&t=sSKkYgSZvi_ctoODhNhwBviOIEY7Y2DmcG0qvNNoDSE",
          "https://media.licdn.com/dms/image/v2/D4E10AQHol_2AdEFonA/image-shrink_800/B4EZUZXmzhHUAc-/0/1739887374472?e=1741683600&v=beta&t=D7Hdzk4zjtL-BzbnvkJAo19Sizm1yqD6wvhCY2DOudw",
          "https://media.licdn.com/dms/image/v2/D4E10AQEX41trpZCHrA/image-shrink_800/B4EZUZXmyxHcAc-/0/1739887375362?e=1741683600&v=beta&t=YQlKIr9JxoNit5bMHzAfcFTCK4HugFSJ45cnMSJZ6JE"
        ],
        "date": "2025-02-25T08:24:46.662Z"
      },
      {
        "captions": "𝗡𝗲𝘄 𝗦𝗘𝗡𝗰𝗼𝗻 𝗦𝗘𝗡𝗡𝗘𝗕𝗢𝗚𝗘𝗡 𝗠𝗮𝗰𝗵𝗶𝗻𝗲 𝗖𝗼𝗻𝘁𝗿𝗼𝗹 𝗦𝘆𝘀𝘁𝗲𝗺 📱🆕\n\nIntroducing our new SENcon control system: Smart, more intuitive, future-ready! Designed for operators, fleet managers, and service technicians, SENcon ensures maximum efficiency, safety, and ease of use with a range of powerful features:\n\n🕹️ Customizable Driver Profiles: Adjust joystick settings and machine parameters for personalized comfort and precision.\n💡 Intelligent Assistance Systems: Features like the Virtual Wall and load weighing increase accuracy and safety.\n📊 Real-time Machine Monitoring: Get instant insights into machine performance and live diagnostics for optimal efficiency.\n🔧 Remote Service Support: Diagnose issues remotely, minimize downtime, and ensure fast, targeted maintenance.\n🔄 Wireless Over-the-air Software Updates: Always up to date, no on-site visits needed.\n✅ Seamless Fleet Integration: Connect with SENtrack telematics system to optimize performance, maintenance, and energy efficiency.\n\nLearn more in the press release: ➡️ https://bit.ly/3CQFGh9\n\n🔜 Stay tuned for the first SENNEBOGEN machines featuring the new SENcon! We will soon introduce the new machines for bauma 2025!\n\n#SENcon #SmartControl #MaterialHandling #FleetManagement #Automation #bauma2025 #GreenHeartofbauma #MOVEBIGTHINGS #SENNEBOGEN𝗡𝗲𝘄 𝗦𝗘𝗡𝗰𝗼𝗻 𝗦𝗘𝗡𝗡𝗘𝗕𝗢𝗚𝗘𝗡 𝗠𝗮𝗰𝗵𝗶𝗻𝗲 𝗖𝗼𝗻𝘁𝗿𝗼𝗹 𝗦𝘆𝘀𝘁𝗲𝗺 📱🆕\n\nIntroducing our new SENcon control system: Smart, more intuitive, future-ready! Designed for operators, fleet managers, and service technicians, SENcon ensures maximum efficiency, safety, and ease of use with a range of powerful features:\n\n🕹️ Customizable Driver Profiles: Adjust joystick settings and machine parameters for personalized comfort and precision.\n💡 Intelligent Assistance Systems: Features like the Virtual Wall and load weighing increase accuracy and safety.\n📊 Real-time Machine Monitoring: Get instant insights into machine performance and live diagnostics for optimal efficiency.\n🔧 Remote Service Support: Diagnose issues remotely, minimize downtime, and ensure fast, targeted maintenance.\n🔄 Wireless Over-the-air Software Updates: Always up to date, no on-site visits needed.\n✅ Seamless Fleet Integration: Connect with SENtrack telematics system to optimize performance, maintenance, and energy efficiency.\n\nLearn more in the press release: ➡️ https://bit.ly/3CQFGh9\n\n🔜 Stay tuned for the first SENNEBOGEN machines featuring the new SENcon! We will soon introduce the new machines for bauma 2025!\n\n#SENcon #SmartControl #MaterialHandling #FleetManagement #Automation #bauma2025 #GreenHeartofbauma #MOVEBIGTHINGS #SENNEBOGEN",
        "likes": "136",
        "comments": "1",
        "shares": "24",
        "time": {
          "raw": "2h",
          "parsed": "18.02.2025",
          "isoString": "2025-02-18T08:24:46.663Z"
        },
        "mediaType": "image",
        "mediaContent": [
          "https://media.licdn.com/dms/image/v2/D4E10AQElnUv2wdccZA/image-shrink_800/B4EZUU0UV_HcAk-/0/1739811015163?e=1741683600&v=beta&t=GFpPpGgxOJQAIbFH2JlkwNjViDzwxYp7dA6K_itE2t8",
          "https://media.licdn.com/dms/image/v2/D4E10AQGfXwbt8SdYow/image-shrink_800/B4EZUU0UXEG0Ac-/0/1739811015140?e=1741683600&v=beta&t=UxRsirYRjOHqnJ4rqk8gfLFYxWz5IBZ-iiumb7BoMJQ",
          "https://media.licdn.com/dms/image/v2/D4E10AQFqDpKZiEu7zg/image-shrink_800/B4EZUU0UV5H0Ac-/0/1739811016770?e=1741683600&v=beta&t=yuag0t3rfpetpvRddTNwIHZUWgKvrbQwJnbtMeaThlg",
          "https://media.licdn.com/dms/image/v2/D4E10AQECEbH3LAkW7Q/image-shrink_800/B4EZUU0UW3HgAc-/0/1739811015489?e=1741683600&v=beta&t=78P2419GA4afL2cpmxd72rHrXJ-_E3BYfmq6RAgxiKU",
          "https://media.licdn.com/dms/image/v2/D4E10AQH735ffGOfRJA/image-shrink_800/B4EZUU0UV7HgAc-/0/1739811015267?e=1741683600&v=beta&t=Z6bY-9Vdw6sk8cUh7EoRdcnh0B1lbfNN8aR1qPNbeP4"
        ],
        "date": "2025-02-18T08:24:46.663Z"
      },
      {
        "captions": "A special Valentine’s Day card just arrived! ✉️💚\nFeel free to share it with someone who moves big things in your life! 💐\n\nRoses are red, \nviolets are blue, \nlet's move big things - \njust me and you!\n\nSpeaking of sweethearts... have you heard about the Green Heart of bauma? SENNEBOGEN will be at the bauma 2025 trade fair in Munich with a large booth and many exciting machines. 🙌 \nStay tuned for more coming very soon:  https://lnkd.in/eh7YATsp\n\n#valentinesday #valentinstag #valentinescard #materialhandling #HeavyEquipment #GreenHeartofbauma #bauma2025 #MOVEBIGTHINGS #SENNEBOGENA special Valentine’s Day card just arrived! ✉️💚\nFeel free to share it with someone who moves big things in your life! 💐\n\nRoses are red, \nviolets are blue, \nlet's move big things - \njust me and you!\n\nSpeaking of sweethearts... have you heard about the Green Heart of bauma? SENNEBOGEN will be at the bauma 2025 trade fair in Munich with a large booth and many exciting machines. 🙌 \nStay tuned for more coming very soon:  https://lnkd.in/eh7YATsp\n\n#valentinesday #valentinstag #valentinescard #materialhandling #HeavyEquipment #GreenHeartofbauma #bauma2025 #MOVEBIGTHINGS #SENNEBOGEN",
        "likes": "89",
        "comments": "1",
        "shares": "7",
        "time": {
          "raw": "2h",
          "parsed": "18.02.2025",
          "isoString": "2025-02-18T08:24:46.665Z"
        },
        "mediaType": "image",
        "mediaContent": [
          "https://media.licdn.com/dms/image/v2/D4E10AQG1KHA7GLHKhQ/image-shrink_800/B4EZUDec_wGwAc-/0/1739520070609?e=1741683600&v=beta&t=iX23U5IM-EZoKhXFSMMmbEdlZSK-d0MYuxwsT8E8gLk"
        ],
        "date": "2025-02-18T08:24:46.665Z"
      },
      {
        "captions": "𝗦𝗘𝗡𝗡𝗘𝗕𝗢𝗚𝗘𝗡 & 𝗗𝗘𝗨𝗧𝗭: 𝗦𝘁𝗿𝗼𝗻𝗴 𝗽𝗮𝗿𝘁𝗻𝗲𝗿𝘀𝗵𝗶𝗽 𝗰𝗼𝗻𝘁𝗶𝗻𝘂𝗲𝘀 𝘁𝗼 𝗴𝗿𝗼𝘄💪🚜\nBavarian machines and Cologne engines – a success story for over 70 years! 🤝\nSince the 1950s, SENNEBOGEN has relied on the reliable engines from DEUTZ AG. Over the years, this partnership has grown steadily, and today DEUTZ engines power numerous SENNEBOGEN machines around the world. 🌍\n🌱 This long-standing partnership is now being further strengthened: In addition to the integration of DEUTZ diesel engines in selected SENNEBOGEN models, the focus of the collaboration will also be on alternative drive concepts. Battery-electric and hydrogen-based drives offer a sustainable option for the future. 🔋\n💬 \"We see many positive synergies in an intensified collaboration. Especially in the off-highway application, we can jointly develop new, forward-looking solutions\", says managing director Erich Sennebogen.\n💡 Learn more in our press release: ➡️ https://bit.ly/4jStDAA\n\n𝗦𝗘𝗡𝗡𝗘𝗕𝗢𝗚𝗘𝗡 & 𝗗𝗘𝗨𝗧𝗭: 𝗦𝘁𝗮𝗿𝗸𝗲 𝗣𝗮𝗿𝘁𝗻𝗲𝗿𝘀𝗰𝗵𝗮𝗳𝘁 𝘄𝗶𝗿𝗱 𝘄𝗲𝗶𝘁𝗲𝗿 𝗮𝘂𝘀𝗴𝗲𝗯𝗮𝘂𝘁💪🚜\nBayerische Maschinen und Kölner Motoren – eine Erfolgsgeschichte seit über 70 Jahren! 🤝 \nSchon in den 1950er Jahren vertraute SENNEBOGEN auf die zuverlässigen Motoren von DEUTZ AG. Seither wurde die Zusammenarbeit stetig ausgebaut, sodass heute DEUTZ-Motoren in zahlreichen SENNEBOGEN Maschinen rund um die Welt im Einsatz sind. 🌍\n🌱Diese langjährige Partnerschaft wird nun weiter vertieft: Neben dem Einbau von DEUTZ Dieselmotoren in ausgewählten SENNEBOGEN Modellen wird ein Fokus der Zusammenarbeit auch auf alternativen Antriebkonzepten liegen. Batterieelektrische und wasserstoffbasierte Antriebe bieten eine nachhaltige Option für die Zukunft. 🔋 \n💬 „Wir sehen viele positive Synergien in einer intensiveren Zusammenarbeit. Gerade in der Off-Highway-Anwendung können wir zusammen neue, zukunftsweisende Lösungen realisieren,“ so Geschäftsführer Erich Sennebogen.\n💡Mehr in der Pressemeldung: ➡️ https://bit.ly/3Xi0Zzh\n\n#Innovation #Nachhaltigkeit #AlternativeAntriebe #Sustainability #AlternativeDrives #OffHighway #DEUTZ #SENNEBOGEN #MOVEBIGTHINGS𝗦𝗘𝗡𝗡𝗘𝗕𝗢𝗚𝗘𝗡 & 𝗗𝗘𝗨𝗧𝗭: 𝗦𝘁𝗿𝗼𝗻𝗴 𝗽𝗮𝗿𝘁𝗻𝗲𝗿𝘀𝗵𝗶𝗽 𝗰𝗼𝗻𝘁𝗶𝗻𝘂𝗲𝘀 𝘁𝗼 𝗴𝗿𝗼𝘄💪🚜\nBavarian machines and Cologne engines – a success story for over 70 years! 🤝\nSince the 1950s, SENNEBOGEN has relied on the reliable engines from DEUTZ AG. Over the years, this partnership has grown steadily, and today DEUTZ engines power numerous SENNEBOGEN machines around the world. 🌍\n🌱 This long-standing partnership is now being further strengthened: In addition to the integration of DEUTZ diesel engines in selected SENNEBOGEN models, the focus of the collaboration will also be on alternative drive concepts. Battery-electric and hydrogen-based drives offer a sustainable option for the future. 🔋\n💬 \"We see many positive synergies in an intensified collaboration. Especially in the off-highway application, we can jointly develop new, forward-looking solutions\", says managing director Erich Sennebogen.\n💡 Learn more in our press release: ➡️ https://bit.ly/4jStDAA\n\n𝗦𝗘𝗡𝗡𝗘𝗕𝗢𝗚𝗘𝗡 & 𝗗𝗘𝗨𝗧𝗭: 𝗦𝘁𝗮𝗿𝗸𝗲 𝗣𝗮𝗿𝘁𝗻𝗲𝗿𝘀𝗰𝗵𝗮𝗳𝘁 𝘄𝗶𝗿𝗱 𝘄𝗲𝗶𝘁𝗲𝗿 𝗮𝘂𝘀𝗴𝗲𝗯𝗮𝘂𝘁💪🚜\nBayerische Maschinen und Kölner Motoren – eine Erfolgsgeschichte seit über 70 Jahren! 🤝 \nSchon in den 1950er Jahren vertraute SENNEBOGEN auf die zuverlässigen Motoren von DEUTZ AG. Seither wurde die Zusammenarbeit stetig ausgebaut, sodass heute DEUTZ-Motoren in zahlreichen SENNEBOGEN Maschinen rund um die Welt im Einsatz sind. 🌍\n🌱Diese langjährige Partnerschaft wird nun weiter vertieft: Neben dem Einbau von DEUTZ Dieselmotoren in ausgewählten SENNEBOGEN Modellen wird ein Fokus der Zusammenarbeit auch auf alternativen Antriebkonzepten liegen. Batterieelektrische und wasserstoffbasierte Antriebe bieten eine nachhaltige Option für die Zukunft. 🔋 \n💬 „Wir sehen viele positive Synergien in einer intensiveren Zusammenarbeit. Gerade in der Off-Highway-Anwendung können wir zusammen neue, zukunftsweisende Lösungen realisieren,“ so Geschäftsführer Erich Sennebogen.\n💡Mehr in der Pressemeldung: ➡️ https://bit.ly/3Xi0Zzh\n\n#Innovation #Nachhaltigkeit #AlternativeAntriebe #Sustainability #AlternativeDrives #OffHighway #DEUTZ #SENNEBOGEN #MOVEBIGTHINGS",
        "likes": "178",
        "comments": "7",
        "shares": "5",
        "time": {
          "raw": "2h",
          "parsed": "18.02.2025",
          "isoString": "2025-02-18T08:24:46.668Z"
        },
        "mediaType": "image",
        "mediaContent": [
          "https://media.licdn.com/dms/image/v2/D4E10AQEOpEOQEVy4_w/image-shrink_800/B4EZT1GU2KG0Ac-/0/1739278864703?e=1741683600&v=beta&t=phU2rUt8oZ02Rfk3p1m0UzZ6X9xD6Bs0MIL9xAZD3Fw",
          "https://media.licdn.com/dms/image/v2/D4E10AQFbnMbPVlCdeQ/image-shrink_800/B4EZT1GU1MHUBM-/0/1739278864493?e=1741683600&v=beta&t=35DkmnOk9nLvRhl2Q4_yXdkHBfrrO0cmdsZnVy--IqU",
          "https://media.licdn.com/dms/image/v2/D4E10AQH4bd5KaLNwrg/image-shrink_800/B4EZT1GU1XHcAc-/0/1739278865269?e=1741683600&v=beta&t=Sco264Hs7BMb0AV6xxI4vVYzAphSXKRmbvUP6MGqIus"
        ],
        "date": "2025-02-18T08:24:46.668Z"
      },
      {
        "captions": "𝗚𝗲𝘁 𝗿𝗲𝗮𝗱𝘆 𝗳𝗼𝗿 𝗯𝗮𝘂𝗺𝗮 𝟮𝟬𝟮𝟱 - 𝘄𝗶𝘁𝗵 𝗦𝗘𝗡𝗡𝗘𝗕𝗢𝗚𝗘𝗡! 🙌\n\nFrom 𝗔𝗽𝗿𝗶𝗹 𝟳–𝟭𝟯, 𝟮𝟬𝟮𝟱, Messe Munich will once again host the world's leading trade fair for construction machinery, attracting thousands of visitors. 🚜\n\n💚 For decades, SENNEBOGEN has been a central part of bauma, and we’ll be there again this year! As a family-owned company with Bavarian hospitality and heartfelt values, our booth with its green machines has become an integral part of the fair, known as the \"𝗚𝗿𝗲𝗲𝗻 𝗛𝗲𝗮𝗿𝘁 𝗼𝗳 𝗯𝗮𝘂𝗺𝗮\".\n\n🚀 We will be showcasing our customer-specific material handling and crane solutions at our booth. Cutting-edge technology that combines maximum performance, efficiency, unmatched operator comfort and safety features: 𝗗𝗿𝗶𝘃𝗲𝗻 𝗯𝘆 𝗧𝗲𝗰𝗵𝗻𝗼𝗹𝗼𝗴𝘆, 𝗘𝗻𝗴𝗶𝗻𝗲𝗲𝗿𝗲𝗱 𝘄𝗶𝘁𝗵 𝗣𝗮𝘀𝘀𝗶𝗼𝗻.\n🔥 Our new highlights and exhibits will be announced soon – 𝘀𝘁𝗮𝘆 𝘁𝘂𝗻𝗲𝗱!\n 👉 https://lnkd.in/eh7YATsp\n\n💬 For inquiries or to schedule an appointment during the trade fair week, use our contact form on the website.\n👉 https://lnkd.in/erSeAWzT\n\n#GreenHeartofbauma #bauma #baumamunich #bauma2025 #materialhandling #cranes at bauma with #SENNEBOGEN #MOVEBIGTHINGS",
        "likes": "187",
        "comments": "1",
        "shares": "34",
        "time": {
          "raw": "3h",
          "parsed": "11.02.2025",
          "isoString": "2025-02-11T08:24:46.669Z"
        },
        "mediaType": "video",
        "mediaContent": {
          "src": [
            {
              "src": "https://dms.licdn.com/playlist/vid/v2/D4E10AQHtW0mEjU9fDA/mp4-720p-30fp-crf28/B4EZTqMEFhHgBs-/0/1739095838315?e=1741683600&v=beta&t=Ub7y3Tbd1XX61GT6cSRUbJk-KJVhXXvxqBWbzn4FHj8",
              "type": "video/mp4",
              "data-bitrate": 754645
            },
            {
              "src": "https://dms.licdn.com/playlist/vid/v2/D4E10AQHtW0mEjU9fDA/mp4-640p-30fp-crf28/B4EZTqMEFhHgBo-/0/1739095838025?e=1741683600&v=beta&t=ICjDer2BzHl_yFl3mxnjxDpKtCrIO07zv6YR9h6_xLk",
              "type": "video/mp4",
              "data-bitrate": 570187
            },
            {
              "src": "https://dms.licdn.com/playlist/vid/v2/D4E10AQHtW0mEjU9fDA/mp4-360p-30fp-crf28/B4EZTqMEFhHgBk-/0/1739095836071?e=1741683600&v=beta&t=bCRk36aNYmB1rUSrxey-VzBLqPGVKdpkGkcL75Ych98",
              "type": "video/mp4",
              "data-bitrate": 272804
            }
          ],
          "posterUrl": "https://media.licdn.com/dms/image/v2/D4E10AQHtW0mEjU9fDA/videocover-high/B4EZTqMEFhHgBA-/0/1739095832481?e=1741683600&v=beta&t=VyVks7LfRn0DVv9fliUULUihWRh9J-FO5Xg_lHMriNM"
        },
        "date": "2025-02-11T08:24:46.669Z"
      },
      {
        "captions": "𝗦𝗲𝗿𝘃𝗶𝗰𝗲𝗯𝗲𝗿𝗮𝘁𝗲𝗿 𝗳ü𝗿 𝗦𝗘𝗡𝗡𝗘𝗕𝗢𝗚𝗘𝗡 𝗠𝗮𝘀𝗰𝗵𝗶𝗻𝗲𝗻 – 𝗱𝗶𝗿𝗲𝗸𝘁 𝗯𝗲𝗶𝗺 𝗞𝘂𝗻𝗱𝗲𝗻 𝗶𝗺 𝗘𝗶𝗻𝘀𝗮𝘁𝘇 🛠️\nStillstandszeiten kosten Zeit und Geld – wir sorgen dafür, dass es erst gar nicht dazu kommt! Deshalb setzen wir auf starke Serviceberatung und den direkten Draht zum Kunden. Denn enge Zusammenarbeit schafft Vertrauen und macht den Unterschied. 🤝\n👷 Begleite im Video die SENNEBOGEN Serviceberater von Schlüter Baumaschinen GmbH bei ihrem Einsatz:\nSie sind beim Kunden vor Ort, prüfen Maschinen, analysieren Daten und stehen mit Rat und Tat zur Seite, damit SENNEBOGEN Maschinen zuverlässig laufen! ✅\nErfahre mehr über den SENNEBOGEN Service: \n➡️ https://lnkd.in/eKRCMCh6 \n\n𝗦𝗲𝗿𝘃𝗶𝗰𝗲 𝗖𝗼𝗻𝘀𝘂𝗹𝘁𝗮𝗻𝘁𝘀 𝗳𝗼𝗿 𝗦𝗘𝗡𝗡𝗘𝗕𝗢𝗚𝗘𝗡 𝗠𝗮𝗰𝗵𝗶𝗻𝗲𝘀 – 𝗼𝗻-𝘀𝗶𝘁𝗲 𝘄𝗶𝘁𝗵 𝘁𝗵𝗲 𝗰𝘂𝘀𝘁𝗼𝗺𝗲𝗿 🛠️\nDowntime costs time and money – we make sure it doesn’t happen in the first place! That’s why we focus on strong service consulting and direct customer communication. Close collaboration builds trust and makes the difference. 🤝\n👷 Join the SENNEBOGEN service consultants from Schlüter on their mission:\nThey are on-site with customers, inspecting machines, analyzing data, and providing hands-on support to keep SENNEBOGEN machines running reliably! ✅\nLearn more about SENNEBOGEN service here: \n➡️ https://lnkd.in/eKRCMCh6 \n \n#Service #Kundennähe #CustomerFocus #Baumaschinen #ConstructionMachinery #SchlüterBaumaschinen #SENNEBOGEN #MOVEBIGTHINGS",
        "likes": "151",
        "shares": "14",
        "time": {
          "raw": "3h",
          "parsed": "11.02.2025",
          "isoString": "2025-02-11T08:24:46.671Z"
        },
        "mediaType": "video",
        "mediaContent": {
          "src": [
            {
              "src": "https://dms.licdn.com/playlist/vid/v2/D4E05AQEaGlyqPRD7zg/mp4-720p-30fp-crf28/B4EZSy3Lg0HUBo-/0/1738167757178?e=1741683600&v=beta&t=RmQqi3OEwk9w64Xfrp0F9QDwWXBkyvQ7XzaYAOFggQ8",
              "type": "video/mp4",
              "data-bitrate": 1110693
            },
            {
              "src": "https://dms.licdn.com/playlist/vid/v2/D4E05AQEaGlyqPRD7zg/mp4-640p-30fp-crf28/B4EZSy3Lg0HUBk-/0/1738167753652?e=1741683600&v=beta&t=HNk5SVEk-BhqNKqB-ZSnaBiBjDLHbIy62sWSduxgT44",
              "type": "video/mp4",
              "data-bitrate": 852917
            }
          ],
          "posterUrl": "https://media.licdn.com/dms/image/v2/D4E05AQEaGlyqPRD7zg/videocover-high/B4EZSy3Lg0HUB0-/0/1738167730696?e=1741683600&v=beta&t=NE5kDbUosO3J73wBYRNyh-O1cgUxpMFzT48B8UpFUis"
        },
        "date": "2025-02-11T08:24:46.671Z"
      },
      {
        "captions": "🌿 𝗦𝗘𝗡𝗡𝗘𝗕𝗢𝗚𝗘𝗡 𝟴𝟮𝟱 𝗘 𝗘𝗹𝗲𝗰𝘁𝗿𝗶𝗰: 𝗘𝗳𝗳𝗶𝗰𝗶𝗲𝗻𝗰𝘆 𝗠𝗲𝗲𝘁𝘀 𝗦𝘂𝘀𝘁𝗮𝗶𝗻𝗮𝗯𝗶𝗹𝗶𝘁𝘆 𝗶𝗻 𝗧𝗶𝗺𝗯𝗲𝗿 𝗟𝗼𝗴𝗶𝘀𝘁𝗶𝗰𝘀 ⚡\n\nAt VMG Group’s state-of-the-art veneer plant in Lithuania, sustainability is a top priority. That’s why they chose the SENNEBOGEN 825 E electric material handler: With its low emissions its is a perfect match for their eco-friendly production strategy. 🌍\n\nThe 825 E, supported by SENNEBOGEN’s sales and service partner ScanBalt Crane OÜ, has proven to be an indispensable part of the production processes, loading logs efficiently from the conditioning line.\n\n✅ High performance with tailored grab technology.\n✅ Elevating cab: Maximum visibility for precision and safety\n✅ Reduced energy costs\n\n💡 Read more in the jobsite report: ➡️ https://bit.ly/4hef0pj\n\n#TimberHandling #Holzumschlag #Sustainability #Nachhaltigkeit #ElectricMaterialHandler #Elektrobagger #MOVEBIGTHINGS #SENNEBOGEN🌿 𝗦𝗘𝗡𝗡𝗘𝗕𝗢𝗚𝗘𝗡 𝟴𝟮𝟱 𝗘 𝗘𝗹𝗲𝗰𝘁𝗿𝗶𝗰: 𝗘𝗳𝗳𝗶𝗰𝗶𝗲𝗻𝗰𝘆 𝗠𝗲𝗲𝘁𝘀 𝗦𝘂𝘀𝘁𝗮𝗶𝗻𝗮𝗯𝗶𝗹𝗶𝘁𝘆 𝗶𝗻 𝗧𝗶𝗺𝗯𝗲𝗿 𝗟𝗼𝗴𝗶𝘀𝘁𝗶𝗰𝘀 ⚡\n\nAt VMG Group’s state-of-the-art veneer plant in Lithuania, sustainability is a top priority. That’s why they chose the SENNEBOGEN 825 E electric material handler: With its low emissions its is a perfect match for their eco-friendly production strategy. 🌍\n\nThe 825 E, supported by SENNEBOGEN’s sales and service partner ScanBalt Crane OÜ, has proven to be an indispensable part of the production processes, loading logs efficiently from the conditioning line.\n\n✅ High performance with tailored grab technology.\n✅ Elevating cab: Maximum visibility for precision and safety\n✅ Reduced energy costs\n\n💡 Read more in the jobsite report: ➡️ https://bit.ly/4hef0pj\n\n#TimberHandling #Holzumschlag #Sustainability #Nachhaltigkeit #ElectricMaterialHandler #Elektrobagger #MOVEBIGTHINGS #SENNEBOGEN",
        "likes": "116",
        "comments": "1",
        "shares": "10",
        "time": {
          "raw": "1ay",
          "parsed": "04.02.2025",
          "isoString": "2025-02-04T08:24:46.672Z"
        },
        "mediaType": "image",
        "mediaContent": [
          "https://media.licdn.com/dms/image/v2/D4E10AQGJYVuohPQUFA/image-shrink_800/B4EZS36BnEHoAg-/0/1738252231637?e=1741683600&v=beta&t=F76lo-vjfTtMFZtUlKbjDEmyRNNuaK3KoNtaxE66GL4",
          "https://media.licdn.com/dms/image/v2/D4E10AQEzLaCQwPLDVg/image-shrink_800/B4EZS36BnyGgAg-/0/1738252230153?e=1741683600&v=beta&t=nQ-kcpDWRXPEqwleJ_p06ozeqrDqaq80Ntxd1x0hfm8",
          "https://media.licdn.com/dms/image/v2/D4E10AQExs8BzpOQFyg/image-shrink_800/B4EZS36BmzHgAc-/0/1738252230638?e=1741683600&v=beta&t=I7m6MyzCobQFsGR-qrYU18I0V9wDupXek5dzRCtOnY8"
        ],
        "date": "2025-02-04T08:24:46.672Z"
      },
      {
        "captions": "𝗘𝗳𝗳𝗶𝗰𝗶𝗲𝗻𝘁 𝗪𝗮𝘀𝘁𝗲 𝗠𝗮𝗻𝗮𝗴𝗲𝗺𝗲𝗻𝘁 𝘄𝗶𝘁𝗵 𝗦𝗘𝗡𝗡𝗘𝗕𝗢𝗚𝗘𝗡 𝟯𝟱𝟱 𝗘 𝗧𝗲𝗹𝗲𝗵𝗮𝗻𝗱𝗹𝗲𝗿 ♻️\n\nThe SENNEBOGEN 355 E Telehandler of the Donau-Wald waste management association delivers exceptional performance at the Passau-Hellersberg disposal center! ✅ Under tight schedules, working 4–5 hours a day, it handles paper and bulky household waste and loads it into trucks.\n👷Werner Reh operates the 355 E on a daily basis and reports: \"We are very happy with the vehicle!\"\n\nWhy it stands out:\n🚛 Elevating cab: Operators benefit from an optimal view over the work environment and can look into the loading trucks.\n💪 High-capacity hold-down bucket: The attachment is ideal for efficiently handling loose waste material with its high filling volume of up to 1,400 kg/m³.\n🛠️ Reliable SENNEBOGEN service: 💬 \"There was always someone available or even on-site if there was a problem.\"\n\nRead more in the jobsite report: \n👉 https://bit.ly/4h4j9MC\n\n#Telehandler #Teleskoplader #WasteManagement #Recycling #MaterialHandling #Passau #MOVEBIGTHINGS #SENNEBOGEN with SENNEBOGEN Vertriebsgesellschaft𝗘𝗳𝗳𝗶𝗰𝗶𝗲𝗻𝘁 𝗪𝗮𝘀𝘁𝗲 𝗠𝗮𝗻𝗮𝗴𝗲𝗺𝗲𝗻𝘁 𝘄𝗶𝘁𝗵 𝗦𝗘𝗡𝗡𝗘𝗕𝗢𝗚𝗘𝗡 𝟯𝟱𝟱 𝗘 𝗧𝗲𝗹𝗲𝗵𝗮𝗻𝗱𝗹𝗲𝗿 ♻️\n\nThe SENNEBOGEN 355 E Telehandler of the Donau-Wald waste management association delivers exceptional performance at the Passau-Hellersberg disposal center! ✅ Under tight schedules, working 4–5 hours a day, it handles paper and bulky household waste and loads it into trucks.\n👷Werner Reh operates the 355 E on a daily basis and reports: \"We are very happy with the vehicle!\"\n\nWhy it stands out:\n🚛 Elevating cab: Operators benefit from an optimal view over the work environment and can look into the loading trucks.\n💪 High-capacity hold-down bucket: The attachment is ideal for efficiently handling loose waste material with its high filling volume of up to 1,400 kg/m³.\n🛠️ Reliable SENNEBOGEN service: 💬 \"There was always someone available or even on-site if there was a problem.\"\n\nRead more in the jobsite report: \n👉 https://bit.ly/4h4j9MC\n\n#Telehandler #Teleskoplader #WasteManagement #Recycling #MaterialHandling #Passau #MOVEBIGTHINGS #SENNEBOGEN with SENNEBOGEN Vertriebsgesellschaft",
        "likes": "82",
        "shares": "13",
        "time": {
          "raw": "1ay",
          "parsed": "04.02.2025",
          "isoString": "2025-02-04T08:24:46.673Z"
        },
        "mediaType": "image",
        "mediaContent": [
          "https://media.licdn.com/dms/image/v2/D4E10AQFh24xShsbtVg/image-shrink_800/B4EZStSLe_GgAU-/0/1738074012924?e=1741683600&v=beta&t=ucPBub6221vakWCIwdS9m313RLCCkNoiq1jhRbrhZKk",
          "https://media.licdn.com/dms/image/v2/D4E10AQFBri7A2uXWTA/image-shrink_800/B4EZStSLifHoAQ-/0/1738074013461?e=1741683600&v=beta&t=RejJ8mWrQ7EkF5J3_YSFLORXTvuJkf6rW4-2WSablpk",
          "https://media.licdn.com/dms/image/v2/D4E10AQH686SBIT6cog/image-shrink_800/B4EZStSLfQHcAQ-/0/1738074012388?e=1741683600&v=beta&t=VmahC6jADoX3MQj1wcaV6pAdYKbkEzQG0pxKkrNi8r0"
        ],
        "date": "2025-02-04T08:24:46.673Z"
      },
      {
        "captions": "𝗦𝗽𝗲𝗰𝗶𝗮𝗹 𝗖𝗶𝘃𝗶𝗹 𝗘𝗻𝗴𝗶𝗻𝗲𝗲𝗿𝗶𝗻𝗴: 𝟰𝟬 𝗬𝗲𝗮𝗿𝘀 𝗼𝗳 𝗣𝗮𝗿𝘁𝗻𝗲𝗿𝘀𝗵𝗶𝗽 𝗯𝗲𝘁𝘄𝗲𝗲𝗻 𝗔𝗕𝗜 𝗚𝗿𝗼𝘂𝗽 & 𝗦𝗘𝗡𝗡𝗘𝗕𝗢𝗚𝗘𝗡 👏\nIn 1984, a success story began when SENNEBOGEN and ABI Gruppe joined forces to create innovative solutions for special civil engineering applications. 🏗️ \nOver the past 40 years, this collaboration has shaped the market, delivering customized, efficient machinery that sets global standards in the special civil engineering sector. \n💬 \"The number of solutions we have implemented together speaks for the great success of this partnership. We have extensive expertise in building base machines, while ABI is an expert in special civil engineering applications. Together, we provide customers with market-leading solutions in the special civil engineering sector,\" emphasized managing director Erich Sennebogen during the anniversary celebration. \n🤝 Both companies are looking to the future with confidence, ready to tackle new challenges and opportunities together. \nRead more here: ➡️ https://bit.ly/4h4OC15\n\n𝗦𝗽𝗲𝘇𝗶𝗮𝗹𝘁𝗶𝗲𝗳𝗯𝗮𝘂: 𝟰𝟬 𝗝𝗮𝗵𝗿𝗲 𝗣𝗮𝗿𝘁𝗻𝗲𝗿𝘀𝗰𝗵𝗮𝗳𝘁 𝘇𝘄𝗶𝘀𝗰𝗵𝗲𝗻 𝗔𝗕𝗜 𝗚𝗿𝗼𝘂𝗽 𝘂𝗻𝗱 𝗦𝗘𝗡𝗡𝗘𝗕𝗢𝗚𝗘𝗡 👏\nIm Jahr 1984 begann eine Erfolgsgeschichte, als SENNEBOGEN und die ABI Gruppe ihre Kräfte bündelten, um innovative Lösungen für Anwendungen im Spezialtiefbau zu schaffen. 🏗️ \nIn den vergangenen 40 Jahren hat diese Zusammenarbeit den Markt geprägt und kundenorientierte, effiziente Maschinen geliefert, die weltweit Maßstäbe im Spezialtiefbau setzen.\n💬 „Die Anzahl der Lösungen, die wir gemeinsam realisiert haben, zeugt vom großen Erfolg dieser Konstellation. Wir verstehen viel vom Bau von Trägergeräten, ABI ist ein Experte für die Spezialtiefbauanwendung. Zusammen bieten wir den Kunden heute marktführende Lösungen im Spezialtiefbau an“, betonte Geschäftsführer Erich Sennebogen anlässlich der Jubiläumsfeier.\n🤝 Beide Unternehmen blicken zuversichtlich in die Zukunft und sind bereit, neue Herausforderungen und Chancen gemeinsam anzugehen.\nMehr dazu hier: ➡️ https://bit.ly/4h4OC15\n\n#Engineering #CivilEngineering #Tiefbau #Spezialtiefbau #MOVEBIGTHINGS #SENNEBOGEN𝗦𝗽𝗲𝗰𝗶𝗮𝗹 𝗖𝗶𝘃𝗶𝗹 𝗘𝗻𝗴𝗶𝗻𝗲𝗲𝗿𝗶𝗻𝗴: 𝟰𝟬 𝗬𝗲𝗮𝗿𝘀 𝗼𝗳 𝗣𝗮𝗿𝘁𝗻𝗲𝗿𝘀𝗵𝗶𝗽 𝗯𝗲𝘁𝘄𝗲𝗲𝗻 𝗔𝗕𝗜 𝗚𝗿𝗼𝘂𝗽 & 𝗦𝗘𝗡𝗡𝗘𝗕𝗢𝗚𝗘𝗡 👏\nIn 1984, a success story began when SENNEBOGEN and ABI Gruppe joined forces to create innovative solutions for special civil engineering applications. 🏗️ \nOver the past 40 years, this collaboration has shaped the market, delivering customized, efficient machinery that sets global standards in the special civil engineering sector. \n💬 \"The number of solutions we have implemented together speaks for the great success of this partnership. We have extensive expertise in building base machines, while ABI is an expert in special civil engineering applications. Together, we provide customers with market-leading solutions in the special civil engineering sector,\" emphasized managing director Erich Sennebogen during the anniversary celebration. \n🤝 Both companies are looking to the future with confidence, ready to tackle new challenges and opportunities together. \nRead more here: ➡️ https://bit.ly/4h4OC15\n\n𝗦𝗽𝗲𝘇𝗶𝗮𝗹𝘁𝗶𝗲𝗳𝗯𝗮𝘂: 𝟰𝟬 𝗝𝗮𝗵𝗿𝗲 𝗣𝗮𝗿𝘁𝗻𝗲𝗿𝘀𝗰𝗵𝗮𝗳𝘁 𝘇𝘄𝗶𝘀𝗰𝗵𝗲𝗻 𝗔𝗕𝗜 𝗚𝗿𝗼𝘂𝗽 𝘂𝗻𝗱 𝗦𝗘𝗡𝗡𝗘𝗕𝗢𝗚𝗘𝗡 👏\nIm Jahr 1984 begann eine Erfolgsgeschichte, als SENNEBOGEN und die ABI Gruppe ihre Kräfte bündelten, um innovative Lösungen für Anwendungen im Spezialtiefbau zu schaffen. 🏗️ \nIn den vergangenen 40 Jahren hat diese Zusammenarbeit den Markt geprägt und kundenorientierte, effiziente Maschinen geliefert, die weltweit Maßstäbe im Spezialtiefbau setzen.\n💬 „Die Anzahl der Lösungen, die wir gemeinsam realisiert haben, zeugt vom großen Erfolg dieser Konstellation. Wir verstehen viel vom Bau von Trägergeräten, ABI ist ein Experte für die Spezialtiefbauanwendung. Zusammen bieten wir den Kunden heute marktführende Lösungen im Spezialtiefbau an“, betonte Geschäftsführer Erich Sennebogen anlässlich der Jubiläumsfeier.\n🤝 Beide Unternehmen blicken zuversichtlich in die Zukunft und sind bereit, neue Herausforderungen und Chancen gemeinsam anzugehen.\nMehr dazu hier: ➡️ https://bit.ly/4h4OC15\n\n#Engineering #CivilEngineering #Tiefbau #Spezialtiefbau #MOVEBIGTHINGS #SENNEBOGEN",
        "likes": "180",
        "comments": "1",
        "shares": "6",
        "time": {
          "raw": "1ay",
          "parsed": "04.02.2025",
          "isoString": "2025-02-04T08:24:46.675Z"
        },
        "mediaType": "image",
        "mediaContent": [
          "https://media.licdn.com/dms/image/v2/D4E10AQF0dfxczbYh8g/image-shrink_800/B4EZSXiqjWHgAU-/0/1737709235957?e=1741683600&v=beta&t=09EGi0e6vsI0J3huzRr1egmnMgEKO3--Ehb5EMTLb8A",
          "https://media.licdn.com/dms/image/v2/D4E10AQGiJ_3QSOUcTg/image-shrink_800/B4EZSXiqh.GYAU-/0/1737709236533?e=1741683600&v=beta&t=JWcMv-Wv42Q7sTc9ZkwpbEQBkI7LFt3MCfGjZ1WMpdE",
          "https://media.licdn.com/dms/image/v2/D4E10AQGPmeKvP-Zvdg/image-shrink_800/B4EZSXiqiAGYAQ-/0/1737709234856?e=1741683600&v=beta&t=z1JZ5XAkT33oDAE9Kr76dlINSO5D3wjSdMJGoU5h__8"
        ],
        "date": "2025-02-04T08:24:46.675Z"
      },
      {
        "captions": "𝗦𝘂𝘀𝘁𝗮𝗶𝗻𝗮𝗯𝗹𝗲 𝗮𝗻𝗱 𝗖𝗼𝘀𝘁-𝗘𝗳𝗳𝗶𝗰𝗶𝗲𝗻𝘁 𝗦𝗘𝗡𝗡𝗘𝗕𝗢𝗚𝗘𝗡 𝗠𝗮𝗰𝗵𝗶𝗻𝗲 𝗧𝗿𝗮𝗻𝘀𝗽𝗼𝗿𝘁 𝘃𝗶𝗮 𝗪𝗮𝘁𝗲𝗿 𝗥𝗼𝘂𝘁𝗲 🌍⚓\n\nOur recent shipment of eight large SENNEBOGEN machines from Straubing to South Carolina via eco-friendly waterway marks another step toward sustainable logistics at SENNEBOGEN. 🍃\n\nA total of 700 tons of machinery was loaded onto barges at the port of Straubing. 🚢 Among them were the powerful SENNEBOGEN 855 and 870 material handlers, weighing between 70 and 105 tons. The complex loading process involved precise tandem lifts, performed with a SENNEBOGEN 5500 E Crawler Crane, working in tandem with another crane.\n\nThe machines are now traveling via inland and ocean vessels to their final destination in Charleston, South Carolina. 🇺🇸 This water route cuts CO₂ emissions by 75%, saving 49 tons compared to road transport. ✅\n\nRead more here: ➡️ https://bit.ly/3WvwUeZ\n\n#HeavyLifting #GreenLogistics #Sustainable #Sustainability #Nachhaltigkeit #CrawlerCrane #Raupenkran #MOVEBIGTHINGS #SENNEBOGEN with SENNEBOGEN LLC & Hafen Straubing-Sand𝗦𝘂𝘀𝘁𝗮𝗶𝗻𝗮𝗯𝗹𝗲 𝗮𝗻𝗱 𝗖𝗼𝘀𝘁-𝗘𝗳𝗳𝗶𝗰𝗶𝗲𝗻𝘁 𝗦𝗘𝗡𝗡𝗘𝗕𝗢𝗚𝗘𝗡 𝗠𝗮𝗰𝗵𝗶𝗻𝗲 𝗧𝗿𝗮𝗻𝘀𝗽𝗼𝗿𝘁 𝘃𝗶𝗮 𝗪𝗮𝘁𝗲𝗿 𝗥𝗼𝘂𝘁𝗲 🌍⚓\n\nOur recent shipment of eight large SENNEBOGEN machines from Straubing to South Carolina via eco-friendly waterway marks another step toward sustainable logistics at SENNEBOGEN. 🍃\n\nA total of 700 tons of machinery was loaded onto barges at the port of Straubing. 🚢 Among them were the powerful SENNEBOGEN 855 and 870 material handlers, weighing between 70 and 105 tons. The complex loading process involved precise tandem lifts, performed with a SENNEBOGEN 5500 E Crawler Crane, working in tandem with another crane.\n\nThe machines are now traveling via inland and ocean vessels to their final destination in Charleston, South Carolina. 🇺🇸 This water route cuts CO₂ emissions by 75%, saving 49 tons compared to road transport. ✅\n\nRead more here: ➡️ https://bit.ly/3WvwUeZ\n\n#HeavyLifting #GreenLogistics #Sustainable #Sustainability #Nachhaltigkeit #CrawlerCrane #Raupenkran #MOVEBIGTHINGS #SENNEBOGEN with SENNEBOGEN LLC & Hafen Straubing-Sand",
        "likes": "59",
        "shares": "2",
        "time": {
          "raw": "1ay",
          "parsed": "04.02.2025",
          "isoString": "2025-02-04T08:24:46.677Z"
        },
        "mediaType": "image",
        "mediaContent": [
          "https://media.licdn.com/dms/image/v2/D4E10AQF_A5Kt8AgcdA/image-shrink_800/B4EZSOUtPyHAAg-/0/1737554581499?e=1741683600&v=beta&t=RnGRv-kOzfHm9x4ES6jrPID3M5ylQ-X3oaVCkr8kVAY",
          "https://media.licdn.com/dms/image/v2/D4E10AQH2t-jRRJPPQw/image-shrink_800/B4EZSOUtPoHMAQ-/0/1737554581710?e=1741683600&v=beta&t=vAvp1MHejoHZY1WvMS76npsStDLDlmvOtQMfM-KVgz8",
          "https://media.licdn.com/dms/image/v2/D4E10AQEP9R6FB3xfyg/image-shrink_800/B4EZSOUtP5GgAQ-/0/1737554581551?e=1741683600&v=beta&t=9H_xnuPzC8kyasyhE3wZBczlQZVTSojFINNOiyB8Dgs"
        ],
        "date": "2025-02-04T08:24:46.677Z"
      },
      {
        "captions": "𝗢𝘃𝗲𝗿 𝟭𝟬,𝟬𝟬𝟬 𝗣𝗼𝘀𝘀𝗶𝗯𝗹𝗲 𝗖𝗼𝗻𝗳𝗶𝗴𝘂𝗿𝗮𝘁𝗶𝗼𝗻𝘀: 𝗕𝗜𝗚 𝗦𝗘𝗡𝗡𝗘𝗕𝗢𝗚𝗘𝗡 𝗠𝗮𝘁𝗲𝗿𝗶𝗮𝗹 𝗛𝗮𝗻𝗱𝗹𝗲𝗿𝘀 💪\n\nThis SENNEBOGEN 885 G port material handler is a good example for our strength in customization: equipped with rail gantry, electric drive, quick coupler, and spreader, it handles containers in a Norwegian port with highest efficiency. 🚢\n\n✅ Thanks to SENNEBOGEN's modular system, we offer over 𝟭𝟬,𝟬𝟬𝟬 configuration possibilities: From different drive solutions and undercarriage designs to boom and attachments. We help our customers find the perfect setup for their specific needs.\n\n💬 “If you configure these things correctly together, you can achieve permanently lower operating costs and also a higher handling capacity,” explains managing director Erich Sennebogen. \n\nRead his interview here: \n➡️ https://bit.ly/4geBWVf\n\n885 G product page:\n➡️ https://sennebogen.com/885\n\n#Hafenumschlag #Umschlagbagger #materialhandler #porthandling #customization #norway #SENNEBOGEN #MOVEBIGTHINGS𝗢𝘃𝗲𝗿 𝟭𝟬,𝟬𝟬𝟬 𝗣𝗼𝘀𝘀𝗶𝗯𝗹𝗲 𝗖𝗼𝗻𝗳𝗶𝗴𝘂𝗿𝗮𝘁𝗶𝗼𝗻𝘀: 𝗕𝗜𝗚 𝗦𝗘𝗡𝗡𝗘𝗕𝗢𝗚𝗘𝗡 𝗠𝗮𝘁𝗲𝗿𝗶𝗮𝗹 𝗛𝗮𝗻𝗱𝗹𝗲𝗿𝘀 💪\n\nThis SENNEBOGEN 885 G port material handler is a good example for our strength in customization: equipped with rail gantry, electric drive, quick coupler, and spreader, it handles containers in a Norwegian port with highest efficiency. 🚢\n\n✅ Thanks to SENNEBOGEN's modular system, we offer over 𝟭𝟬,𝟬𝟬𝟬 configuration possibilities: From different drive solutions and undercarriage designs to boom and attachments. We help our customers find the perfect setup for their specific needs.\n\n💬 “If you configure these things correctly together, you can achieve permanently lower operating costs and also a higher handling capacity,” explains managing director Erich Sennebogen. \n\nRead his interview here: \n➡️ https://bit.ly/4geBWVf\n\n885 G product page:\n➡️ https://sennebogen.com/885\n\n#Hafenumschlag #Umschlagbagger #materialhandler #porthandling #customization #norway #SENNEBOGEN #MOVEBIGTHINGS",
        "likes": "130",
        "comments": "1",
        "shares": "10",
        "time": {
          "raw": "1ay",
          "parsed": "04.02.2025",
          "isoString": "2025-02-04T08:24:46.678Z"
        },
        "mediaType": "image",
        "mediaContent": [
          "https://media.licdn.com/dms/image/v2/D4E10AQEMI7P8WYbw-Q/image-shrink_800/B4EZRzy6MiG0AQ-/0/1737109514004?e=1741683600&v=beta&t=lT0MAx7poOFd4R_hfc1NDAiw6ZoRamWeWJRFxq_rWmQ",
          "https://media.licdn.com/dms/image/v2/D4E10AQE3TSRaeeGZTQ/image-shrink_800/B4EZRzy6McGcAQ-/0/1737109513717?e=1741683600&v=beta&t=4dcVYLVz65vjdmvoQGQdjaCRbFHq4meQiiM-81SojYI",
          "https://media.licdn.com/dms/image/v2/D4E10AQGaUyEPZr0oJA/image-shrink_800/B4EZRzy6McHAAQ-/0/1737109514610?e=1741683600&v=beta&t=JCHkhQAl2feiZZ04VfHyNmeLAMOTgZi1ObZXmhU7qv8"
        ],
        "date": "2025-02-04T08:24:46.678Z"
      },
      {
        "captions": "𝗢𝗻 𝗧𝗿𝗮𝗰𝗸 𝗳𝗼𝗿 𝗘𝗳𝗳𝗶𝗰𝗶𝗲𝗻𝗰𝘆: 𝗘𝗹𝗲𝗰𝘁𝗿𝗶𝗰 𝗦𝗘𝗡𝗡𝗘𝗕𝗢𝗚𝗘𝗡 𝟴𝟯𝟬 𝗘 𝗠𝗮𝘁𝗲𝗿𝗶𝗮𝗹 𝗛𝗮𝗻𝗱𝗹𝗲𝗿 𝗼𝗻 𝗥𝗮𝗶𝗹 𝗨𝗻𝗱𝗲𝗿𝗰𝗮𝗿𝗿𝗶𝗮𝗴𝗲⚡\n\nRESAG Recycling und Sortierwerk Bern AG has elevated their operations with a new electric SENNEBOGEN 830 E. ♻️ Powered by an efficient 132 kW electric engine, the machine ensures a quiet, low-vibration, and emission-free environment – ideal for indoor operations. 🔇\n\n💬 \"In the closed hall, this is particularly important for a pleasant and healthy working environment for our employees,\" explains René Schneider, Managing Director.\n\nDelivered by Kuhn Schweiz AG, the material handler is mounted on a customized rail undercarriage. 🛤️ Its curved \"banana\" attachment provides an extended reach for waste sorting and loading tasks.\n\nIn addition to the 830 E, the sorting plant uses a mobile SENNEBOGEN 825 E, which mainly supports the company in wood processing - the purchase of a second model is already being planned.\n\n💡Read the full jobsite report: ➡️ https://bit.ly/3C0g2WS\n\n#Recycling #MaterialHandling #Sustainable #Electric #Materialhandler #Umschlagbagger #Elektrobagger #MOVEBIGTHINGS #SENNEBOGEN𝗢𝗻 𝗧𝗿𝗮𝗰𝗸 𝗳𝗼𝗿 𝗘𝗳𝗳𝗶𝗰𝗶𝗲𝗻𝗰𝘆: 𝗘𝗹𝗲𝗰𝘁𝗿𝗶𝗰 𝗦𝗘𝗡𝗡𝗘𝗕𝗢𝗚𝗘𝗡 𝟴𝟯𝟬 𝗘 𝗠𝗮𝘁𝗲𝗿𝗶𝗮𝗹 𝗛𝗮𝗻𝗱𝗹𝗲𝗿 𝗼𝗻 𝗥𝗮𝗶𝗹 𝗨𝗻𝗱𝗲𝗿𝗰𝗮𝗿𝗿𝗶𝗮𝗴𝗲⚡\n\nRESAG Recycling und Sortierwerk Bern AG has elevated their operations with a new electric SENNEBOGEN 830 E. ♻️ Powered by an efficient 132 kW electric engine, the machine ensures a quiet, low-vibration, and emission-free environment – ideal for indoor operations. 🔇\n\n💬 \"In the closed hall, this is particularly important for a pleasant and healthy working environment for our employees,\" explains René Schneider, Managing Director.\n\nDelivered by Kuhn Schweiz AG, the material handler is mounted on a customized rail undercarriage. 🛤️ Its curved \"banana\" attachment provides an extended reach for waste sorting and loading tasks.\n\nIn addition to the 830 E, the sorting plant uses a mobile SENNEBOGEN 825 E, which mainly supports the company in wood processing - the purchase of a second model is already being planned.\n\n💡Read the full jobsite report: ➡️ https://bit.ly/3C0g2WS\n\n#Recycling #MaterialHandling #Sustainable #Electric #Materialhandler #Umschlagbagger #Elektrobagger #MOVEBIGTHINGS #SENNEBOGEN",
        "likes": "95",
        "comments": "1",
        "shares": "2",
        "time": {
          "raw": "1ay",
          "parsed": "04.02.2025",
          "isoString": "2025-02-04T08:24:46.680Z"
        },
        "mediaType": "image",
        "mediaContent": [
          "https://media.licdn.com/dms/image/v2/D4E10AQHbXnv6pHJMIw/image-shrink_800/image-shrink_800/0/1736957424679?e=1741683600&v=beta&t=PvPvOkWo81OWG9n7frWOnIgRV22PYCelrqaRL5Waylo",
          "https://media.licdn.com/dms/image/v2/D4E10AQHx5xxGug4SOA/image-shrink_800/image-shrink_800/0/1736957424282?e=1741683600&v=beta&t=yF3ZgjhtVsD6Q9a8ARRVSKYK7h9QR5BSXsNlAhTPdBk",
          "https://media.licdn.com/dms/image/v2/D4E10AQG_CAl7QML4Jw/image-shrink_800/image-shrink_800/0/1736957424279?e=1741683600&v=beta&t=YWlLEbsqbfNHUelGPReDYxgyeiG9rhydJbtQ_kGPzFA",
          "https://media.licdn.com/dms/image/v2/D4E10AQHSrbh5bmKQdw/image-shrink_800/image-shrink_800/0/1736957424051?e=1741683600&v=beta&t=jtD_OQUVyev0HFjmb0DYhNO1_rf1Ai6qlCgfpIBLGRQ"
        ],
        "date": "2025-02-04T08:24:46.680Z"
      },
      {
        "captions": "❄️🌲 Winter Ready with the SENNEBOGEN Tree Care Handlers! 🌲❄️\n\nWhen the snow falls and tree care gets tricky, the SENNEBOGEN 718 E steps up! Whether you’re clearing icy roadsides, maintaining trees on slopes or between buildings, or even harvesting energy wood, this machine delivers precision and efficiency in even the toughest conditions. And safety is our BIGGEST concern ⚠️\n\n✨ Why Choose the 718 E?\n\n💚 Compact Power: Ideal for narrow spaces and urban areas.\n💚 13-Meter Reach: Perfect for focused, controlled operations.\n💚 Winter Comfort: Heated, ergonomic cab keeps operators warm and productive.\n\n👉 Learn more: www.sennebogen.com/718\n\nBIGGEST thanks to our team in North America for the video materials! SENNEBOGEN LLC \n\n#WinterWorkforce #TreeCare #CompactEfficiency #Arborist #FellingExcavator #Fällbagger #TreeFelling #TreeCareHandler #HeavyMachinery #MOVEBIGTHINGS #SENNEBOGEN",
        "likes": "196",
        "comments": "5",
        "shares": "11",
        "time": {
          "raw": "1ay",
          "parsed": "04.02.2025",
          "isoString": "2025-02-04T08:24:46.681Z"
        },
        "mediaType": "video",
        "mediaContent": {
          "src": [
            {
              "src": "https://dms.licdn.com/playlist/vid/v2/D4D05AQGGA0DA5lfKcg/mp4-720p-30fp-crf28/B4DZRP0QGNGUBg-/0/1736505903817?e=1741683600&v=beta&t=NdA3ewPusG6IWzxI7KpUsiAMs59rw9vS3w-xw0XoTQc",
              "type": "video/mp4",
              "data-bitrate": 1308665
            },
            {
              "src": "https://dms.licdn.com/playlist/vid/v2/D4D05AQGGA0DA5lfKcg/mp4-640p-30fp-crf28/B4DZRP0QGNGUBc-/0/1736505904084?e=1741683600&v=beta&t=iXW2ftrQR1WmYTPq2xhNxFFtzx-HWPgfCTtSTwHhxas",
              "type": "video/mp4",
              "data-bitrate": 1026527
            }
          ],
          "posterUrl": "https://media.licdn.com/dms/image/v2/D4D05AQGGA0DA5lfKcg/videocover-high/B4DZRP0QGNGUBs-/0/1736505900451?e=1741683600&v=beta&t=iz4tsB0RlRUgv4va8VxVyHtex9Owqn5EtRsfzwuUybw"
        },
        "date": "2025-02-04T08:24:46.681Z"
      },
      {
        "captions": "Last year brought again many exciting SENNEBOGEN machine projects from jobsites around the world. 🌍\nAnd we won't slow down in 2025!💥Here’s to another year of innovation and partnerships as we keep moving big things together. 🤝\n\n📆 You can connect with us at many major trade fairs in 2025. Save the dates!\n➡️ Bauma Munich: April 07 - 13\n➡️ Breakbulk Rotterdam: May 13 - 15\n➡️ Ligna Hanover: May 26 - 30\n\n💡Here you can find all SENNEBOGEN jobsite reports: What was your favorite one?\n➡️ https://bit.ly/4hgfJXB\n\n#crane #craneoperator #grue #materialhandler #umschlagbagger #heavyequipment #heavymachinery #demolition #telehandler #porthandling #MOVEBIGTHINGS #SENNEBOGENLast year brought again many exciting SENNEBOGEN machine projects from jobsites around the world. 🌍\nAnd we won't slow down in 2025!💥Here’s to another year of innovation and partnerships as we keep moving big things together. 🤝\n\n📆 You can connect with us at many major trade fairs in 2025. Save the dates!\n➡️ Bauma Munich: April 07 - 13\n➡️ Breakbulk Rotterdam: May 13 - 15\n➡️ Ligna Hanover: May 26 - 30\n\n💡Here you can find all SENNEBOGEN jobsite reports: What was your favorite one?\n➡️ https://bit.ly/4hgfJXB\n\n#crane #craneoperator #grue #materialhandler #umschlagbagger #heavyequipment #heavymachinery #demolition #telehandler #porthandling #MOVEBIGTHINGS #SENNEBOGEN",
        "likes": "84",
        "shares": "6",
        "time": {
          "raw": "1ay",
          "parsed": "04.02.2025",
          "isoString": "2025-02-04T08:24:46.683Z"
        },
        "mediaType": "image",
        "mediaContent": [
          "https://media.licdn.com/dms/image/v2/D4E10AQHscLNnOK--rw/image-shrink_800/image-shrink_800/0/1735898436922?e=1741683600&v=beta&t=K532CpgPVPV6fecpZQ3xTYxG6piqz6ja_4OzDnOiUJ0",
          "https://media.licdn.com/dms/image/v2/D4E10AQE9bis9A1y0Mw/image-shrink_800/image-shrink_800/0/1735898436732?e=1741683600&v=beta&t=6pIVN9hP3oTRBSGexxVMfjR_dq2QXG3Nq2tXrvbAARQ",
          "https://media.licdn.com/dms/image/v2/D4E10AQGMUNI25tfVGA/image-shrink_800/image-shrink_800/0/1735898436945?e=1741683600&v=beta&t=BBoOE4kRyqX0Jy8VCiN1kL0MlKVv9Wa48P27kAkH2aw"
        ],
        "date": "2025-02-04T08:24:46.683Z"
      },
      {
        "captions": "Happy New Year 2025 from SENNEBOGEN! 🎆🎉🍀\n\nFrohes neues Jahr! Bonne année ! Felice Anno Nuovo! ¡Feliz Año Nuevo! Mutlu Yıllar! Szczęśliwego Nowego Roku! سنة جديدة سعيدة! 新年おめでとうございます！ 새해 복 많이 받으세요!\n\n#materialhandler #Umschlagbagger #materialhandling #materialumschlag #newyear #newyearseve #happynewyear #2025 #SENNEBOGEN #MOVEBIGTHINGSHappy New Year 2025 from SENNEBOGEN! 🎆🎉🍀\n\nFrohes neues Jahr! Bonne année ! Felice Anno Nuovo! ¡Feliz Año Nuevo! Mutlu Yıllar! Szczęśliwego Nowego Roku! سنة جديدة سعيدة! 新年おめでとうございます！ 새해 복 많이 받으세요!\n\n#materialhandler #Umschlagbagger #materialhandling #materialumschlag #newyear #newyearseve #happynewyear #2025 #SENNEBOGEN #MOVEBIGTHINGS",
        "likes": "380",
        "comments": "3",
        "shares": "14",
        "time": {
          "raw": "2ay",
          "parsed": "04.01.2025",
          "isoString": "2025-01-04T08:24:46.685Z"
        },
        "mediaType": "image",
        "mediaContent": [
          "https://media.licdn.com/dms/image/v2/D4E10AQFhDpLOWF-uww/image-shrink_800/image-shrink_800/0/1735689639342?e=1741683600&v=beta&t=CYo_c0HkXwZD3W_Fwen_gz1mJzMa4vgZwBPNuxjcpKo"
        ],
        "date": "2025-01-04T08:24:46.685Z"
      },
      {
        "captions": "Restoration of historic SENNEBOGEN machines - former apprentice project with a success story 🔧\nOur employees Andreas and Alois started their career at SENNEBOGEN with an extraordinary project: the restoration of historical machines for the opening of the Erich Sennebogen Museum in 2014. ✨ \nOne of these machines was a SENNEBOGEN S 802 rope excavator, in production between 1958 and 1960. After so many decades, the wear and tear of time had taken a heavy toll on the machine, which had to be dismantled and painstakingly restored. Alongside other historical models, all restored to their former glory, it is a witness to the development of mechanical engineering in our company's history. 👏\nTen years after the museum opened, Andreas and Alois are still part of our team and have made impressive careers since then. 🚀\n💡Read more here: ➡️ https://bit.ly/3Assyxo\n\nRestaurierung historischer SENNEBOGEN Maschinen - ehemaliges Azubiprojekt mit Erfolgsgeschichte 🔧\nUnsere Mitarbeiter Andreas und Alois starteten ihre Karriere bei SENNEBOGEN mit einem außergewöhnlichen Projekt: der Restaurierung historischer Maschinen zur Eröffnung des Erich Sennebogen Museums um 2014. ✨ \nEine dieser Maschinen war ein SENNEBOGEN S 802 Seilbagger, in Produktion zwischen 1958 und 1960. Nach so vielen Jahrzehnten hatte der Zahn der Zeit stark an der Maschine genagt, welche  zerlegt und in mühevoller Detailarbeit restauriert werden musste. Im Museum in Straubing zeugt sie seit der Aufbereitung in neuer Pracht neben anderen historischen Modellen von der Entwicklung des Maschinenbaus in der Unternehmensgeschichte. 👏\nAuch Andreas und Alois sind zehn Jahre nach Museumseröffnung immer noch Teil unseres Teams und haben seitdem beeindruckende Karrieren gemacht. 🚀\n💡Lies hier mehr: ➡️ https://bit.ly/3Assyxo\n\n#Karriere #Straubing #Maschinenbau #Seilbagger #MOVEBIGTHINGS #SENNEBOGENRestoration of historic SENNEBOGEN machines - former apprentice project with a success story 🔧\nOur employees Andreas and Alois started their career at SENNEBOGEN with an extraordinary project: the restoration of historical machines for the opening of the Erich Sennebogen Museum in 2014. ✨ \nOne of these machines was a SENNEBOGEN S 802 rope excavator, in production between 1958 and 1960. After so many decades, the wear and tear of time had taken a heavy toll on the machine, which had to be dismantled and painstakingly restored. Alongside other historical models, all restored to their former glory, it is a witness to the development of mechanical engineering in our company's history. 👏\nTen years after the museum opened, Andreas and Alois are still part of our team and have made impressive careers since then. 🚀\n💡Read more here: ➡️ https://bit.ly/3Assyxo\n\nRestaurierung historischer SENNEBOGEN Maschinen - ehemaliges Azubiprojekt mit Erfolgsgeschichte 🔧\nUnsere Mitarbeiter Andreas und Alois starteten ihre Karriere bei SENNEBOGEN mit einem außergewöhnlichen Projekt: der Restaurierung historischer Maschinen zur Eröffnung des Erich Sennebogen Museums um 2014. ✨ \nEine dieser Maschinen war ein SENNEBOGEN S 802 Seilbagger, in Produktion zwischen 1958 und 1960. Nach so vielen Jahrzehnten hatte der Zahn der Zeit stark an der Maschine genagt, welche  zerlegt und in mühevoller Detailarbeit restauriert werden musste. Im Museum in Straubing zeugt sie seit der Aufbereitung in neuer Pracht neben anderen historischen Modellen von der Entwicklung des Maschinenbaus in der Unternehmensgeschichte. 👏\nAuch Andreas und Alois sind zehn Jahre nach Museumseröffnung immer noch Teil unseres Teams und haben seitdem beeindruckende Karrieren gemacht. 🚀\n💡Lies hier mehr: ➡️ https://bit.ly/3Assyxo\n\n#Karriere #Straubing #Maschinenbau #Seilbagger #MOVEBIGTHINGS #SENNEBOGEN",
        "likes": "138",
        "comments": "1",
        "shares": "7",
        "time": {
          "raw": "2ay",
          "parsed": "04.01.2025",
          "isoString": "2025-01-04T08:24:46.686Z"
        },
        "mediaType": "image",
        "mediaContent": [
          "https://media.licdn.com/dms/image/v2/D4E10AQF_w8ojzfjKMA/image-shrink_800/image-shrink_800/0/1735304445221?e=1741683600&v=beta&t=jouZ-AMOvoQS5jPcbuJ3JOvZypmYDVflSEJeDHbDNoA",
          "https://media.licdn.com/dms/image/v2/D4E10AQHdSSSg8hjg2Q/image-shrink_800/image-shrink_800/0/1735304445499?e=1741683600&v=beta&t=Y4xus8tXH_MfV8Dz7F5AAB5OZ9NlpSt3DSYkCl2zQOM",
          "https://media.licdn.com/dms/image/v2/D4E10AQEFX4NQ12GTbQ/image-shrink_800/image-shrink_800/0/1735304445321?e=1741683600&v=beta&t=PtX5jjScVwMNete65fyCMXIQbmQBuU4R4djB8sbSh78"
        ],
        "date": "2025-01-04T08:24:46.686Z"
      }
    ]
  },
  {
    "name": "TabarelliSpa",
    "followerData": [
      [
        20250225,
        926
      ],
      [
        20250225,
        926
      ],
      [
        20250225,
        926
      ],
      [
        20250228,
        927
      ],
      [
        20250228,
        927
      ],
      [
        20250228,
        927
      ],
      [
        20250228,
        927
      ],
      [
        20250303,
        928
      ],
      [
        1741011738663,
        "928"
      ],
      [
        1741076701818,
        "929"
      ]
    ],
    "data": [
      {
        "captions": "Saremo presenti ad ECOMONDO - ITALIAN EXHIBITION GROUP  2024, dal 5 all’8 Novembre. Ci troverete al Rimini Expo Centre, Hall C3, Stand 301. Venite a scoprire il nuovo T815 e la nuova cabina!Non mancate!\n\nWe will be at Ecomondo 2024, from 5th to 8th November. You will find us at Rimini Expo Centre, Hall C3, Stand 301. Come and discover the new T815 and the new cab there!\n\n#ecomondo #tabarelli #materialhandler #recycling",
        "likes": "27",
        "shares": "3",
        "time": {
          "raw": "3ay",
          "parsed": "04.12.2024",
          "isoString": "2024-12-04T08:25:01.566Z"
        },
        "mediaType": "video",
        "mediaContent": {
          "src": [
            {
              "src": "https://dms.licdn.com/playlist/vid/v2/D4D05AQF3IwOSh1uWhQ/mp4-640p-30fp-crf28/mp4-640p-30fp-crf28/0/1730814532848?e=1741683600&v=beta&t=iCtLsObSTSNiJAPVsZmqx_5k26T9jMCgUArUBVhiez0",
              "type": "video/mp4",
              "data-bitrate": 699053
            },
            {
              "src": "https://dms.licdn.com/playlist/vid/v2/D4D05AQF3IwOSh1uWhQ/mp4-720p-30fp-crf28/mp4-720p-30fp-crf28/0/1730814532477?e=1741683600&v=beta&t=gzTIroJfwDi7NP5XgrjuxbCMJh1NxSOXbJXiYF8OVZI",
              "type": "video/mp4",
              "data-bitrate": 994330
            }
          ],
          "posterUrl": "https://media.licdn.com/dms/image/v2/D4D05AQF3IwOSh1uWhQ/videocover-high/videocover-high/0/1730814528608?e=1741683600&v=beta&t=HTesVU-i5YvDDQ2vOctgIPNhlrNTe5RrvwAA96LhJxU"
        },
        "date": "2024-12-04T08:25:01.566Z"
      },
      {
        "captions": "Saremo presenti ad Ecomondo 2024, dal 5 all’8 Novembre. Ci troverete al Rimini Expo Centre, Hall C3, Stand 301. Non mancate!\n\nWe will be at Ecomondo 2024, from 5th to 8th November. You will find us at Rimini Expo Centre, Hall C3, Stand 301. Be there!\n\n#ecomondo #tabarelli #materialhandler #recyclingSaremo presenti ad Ecomondo 2024, dal 5 all’8 Novembre. Ci troverete al Rimini Expo Centre, Hall C3, Stand 301. Non mancate!\n\nWe will be at Ecomondo 2024, from 5th to 8th November. You will find us at Rimini Expo Centre, Hall C3, Stand 301. Be there!\n\n#ecomondo #tabarelli #materialhandler #recycling",
        "likes": "15",
        "shares": "2",
        "time": {
          "raw": "4ay",
          "parsed": "04.11.2024",
          "isoString": "2024-11-04T08:25:01.568Z"
        },
        "mediaType": "image",
        "mediaContent": [
          "https://media.licdn.com/dms/image/v2/D4D22AQHeMPL6gYAoEA/feedshare-shrink_800/feedshare-shrink_800/0/1730667100300?e=1744243200&v=beta&t=IfsunVKSjo2Y19mVGeg-fKlWI2vNjA7Ol_cV1ePdeUM"
        ],
        "date": "2024-11-04T08:25:01.568Z"
      },
      {
        "captions": "Nuova cabina 2024:\n-   Design moderno\n- Maggior sicurezza (questa cabina è molto più solida e le griglie protettive superiori e frontali sono più robuste rispetto alla precedente)\n- Comfort (cabina più grande come abitacolo, visibilità lato destro aumentata, climatizzatore con potenza doppia rispetto alla precedente)\n- Sistema di filtraggio aria ottimizzato (doppio filtro)\n- Display touch screen 7”\n- Estintore in cabina\n- Nuovo cruscotto con porta telefono, porta bottiglie e vasca porta oggetti dietro al sedile che permette di mettere un piccolo frigo\n- Cambio filtro aria esterna e rabbocco liquido tergi cristalli molto agevole aprendo la portellina in ABS\n- Griglia anteriore e superiore sono apribili per consentire la pulizia dei vetri\n- Assistenza remota\n \nNew Cab 2024: \n- Modern design:\n- Better security: the front and upper protective grilles have been reinforced, providing additional protection for the operator\n- Enhanced comfort: the cockpit is more spacious; side visibility, particularly on the right side, has been improved; air conditioning system has doubled its power.\n- Optimised air filter system: improved by adding a double filter.\n- 7-inch touch screen display:\n- Cab fire extinguisher\n- New multifunctional dashboard with a telephone holder, a bottle holder and a storage tub located behind the seat, that can also be used to store a refrigerator\n- Ease of maintenance:** easily allows access to components without having to remove parts of the cab.\n- Accessibility for window cleaning:** Both the front and top grille are designed to be openable.\n- Remote assistance\n #tabarelli #materialhandler #recycling #newcab",
        "likes": "37",
        "comments": "1",
        "shares": "9",
        "time": {
          "raw": "4ay",
          "parsed": "04.11.2024",
          "isoString": "2024-11-04T08:25:01.569Z"
        },
        "mediaType": "video",
        "mediaContent": {
          "src": [
            {
              "src": "https://dms.licdn.com/playlist/vid/v2/D4D05AQFX9R2-yJIHyw/mp4-640p-30fp-crf28/mp4-640p-30fp-crf28/0/1729772915824?e=1741683600&v=beta&t=rO27sCWev1qutyySm_r1TIzOwHjWksV_FzYf2AnoZSA",
              "type": "video/mp4",
              "data-bitrate": 917714
            },
            {
              "src": "https://dms.licdn.com/playlist/vid/v2/D4D05AQFX9R2-yJIHyw/mp4-720p-30fp-crf28/mp4-720p-30fp-crf28/0/1729772915250?e=1741683600&v=beta&t=-55CIor3eYlkFIVRfDoO3q06Rw7ndb8QLoogB5m2GBc",
              "type": "video/mp4",
              "data-bitrate": 1210063
            }
          ],
          "posterUrl": "https://media.licdn.com/dms/image/v2/D4D05AQFX9R2-yJIHyw/videocover-high/videocover-high/0/1729772911754?e=1741683600&v=beta&t=dWQEUkFbB70Fg27lyDHNTcSDr-8J8LoEd2MFqGM6udo"
        },
        "date": "2024-11-04T08:25:01.569Z"
      },
      {
        "likes": "8",
        "comments": "1",
        "time": {
          "raw": "7ay",
          "parsed": "04.08.2024",
          "isoString": "2024-08-04T08:25:01.571Z"
        },
        "mediaType": "image",
        "mediaContent": [
          "https://media.licdn.com/dms/image/v2/D4D22AQGw9jFEIJWWdw/feedshare-shrink_800/feedshare-shrink_800/0/1722880496475?e=1744243200&v=beta&t=8nSLJDElhl0e2FvAWSrXDWHtFd6ciBFGvTSS7m5tiqM"
        ],
        "date": "2024-08-04T08:25:01.571Z"
      },
      {
        "captions": "T510 material handler for Sierra International Machinery  :\n- Stage V Cummins engine (129 kw/175 hp)\n- 13 m boom\n- 4 outriggers\n#recycling #tabarelli #materialhandler",
        "likes": "26",
        "shares": "4",
        "time": {
          "raw": "7ay",
          "parsed": "04.08.2024",
          "isoString": "2024-08-04T08:25:01.573Z"
        },
        "mediaType": "video",
        "mediaContent": {
          "src": [
            {
              "src": "https://dms.licdn.com/playlist/vid/v2/D4E05AQGo4UPJaIchuA/feedshare-ambry-analyzed_servable_progressive_video/feedshare-ambry-analyzed_servable_progressive_video/0/1722504270783?e=1741683600&v=beta&t=KJ5NBXOauy4FQPkAVSx63O3v9JcPrVm99TtZOXiedsc",
              "type": "video/mp4",
              "data-bitrate": 3138128
            },
            {
              "src": "https://dms.licdn.com/playlist/vid/v2/D4E05AQGo4UPJaIchuA/mp4-640p-30fp-crf28/mp4-640p-30fp-crf28/0/1722504275976?e=1741683600&v=beta&t=5vun9dvhYf1vEhH0g8IkYdCqNhYhKwOFZVSbOHyfLBE",
              "type": "video/mp4",
              "data-bitrate": 1013523
            },
            {
              "src": "https://dms.licdn.com/playlist/vid/v2/D4E05AQGo4UPJaIchuA/mp4-720p-30fp-crf28/mp4-720p-30fp-crf28/0/1722504274618?e=1741683600&v=beta&t=1NQI5fzTq-TU3Ml-oYIphC2nIRebVgI7UXHwbAoFf2I",
              "type": "video/mp4",
              "data-bitrate": 1306626
            }
          ],
          "posterUrl": "https://media.licdn.com/dms/image/v2/D4E05AQGo4UPJaIchuA/videocover-high/videocover-high/0/1722504271387?e=1741683600&v=beta&t=hCrjlvNc-_UV3o6p3QiWaxNpw33yneXWGwGqXChsGnA"
        },
        "date": "2024-08-04T08:25:01.573Z"
      },
      {
        "captions": "On  Recycling Magazine this month…\n#tabarelli #materialhandler #recycling",
        "likes": "8",
        "shares": "1",
        "time": {
          "raw": "7ay",
          "parsed": "04.08.2024",
          "isoString": "2024-08-04T08:25:01.573Z"
        },
        "mediaType": "video",
        "mediaContent": {
          "src": [
            {
              "src": "https://dms.licdn.com/playlist/vid/v2/D4D05AQGELldvToELdQ/feedshare-ambry-analyzed_servable_progressive_video/feedshare-ambry-analyzed_servable_progressive_video/0/1721067218079?e=1741683600&v=beta&t=Q9Xp9S21PzIK3pYNOuB3sPoTKF_4VFg6aQja6Jovj18",
              "type": "video/quicktime",
              "data-bitrate": 15076204
            },
            {
              "src": "https://dms.licdn.com/playlist/vid/v2/D4D05AQGELldvToELdQ/mp4-640p-30fp-crf28/mp4-640p-30fp-crf28/0/1721067233850?e=1741683600&v=beta&t=faufglkvFbjEqJVgXN1CIVfas-4CkYx07UG33_i2fTg",
              "type": "video/mp4",
              "data-bitrate": 1071767
            },
            {
              "src": "https://dms.licdn.com/playlist/vid/v2/D4D05AQGELldvToELdQ/mp4-720p-30fp-crf28/mp4-720p-30fp-crf28/0/1721067233365?e=1741683600&v=beta&t=BseMApSymB_lOUSZyxYvIQgK0W32zoGQuVsEIlbnZQc",
              "type": "video/mp4",
              "data-bitrate": 1417740
            }
          ],
          "posterUrl": "https://media.licdn.com/dms/image/v2/D4D05AQGELldvToELdQ/videocover-high/videocover-high/0/1721067219607?e=1741683600&v=beta&t=gUOuzdtPNdawGlDtV-bXLH3xdjKBILPR4khP9Bmo1ck"
        },
        "date": "2024-08-04T08:25:01.573Z"
      },
      {
        "captions": "4th day at IFAT 2024! Visit us at Hall C5, stand 328!\n#ifat #materialhandler #tabarelli #recycling4th day at IFAT 2024! Visit us at Hall C5, stand 328!\n#ifat #materialhandler #tabarelli #recycling",
        "likes": "17",
        "shares": "2",
        "time": {
          "raw": "9ay",
          "parsed": "04.06.2024",
          "isoString": "2024-06-04T08:25:01.574Z"
        },
        "mediaType": "image",
        "mediaContent": [
          "https://media.licdn.com/dms/image/v2/D4D22AQGIasDUzNltqg/feedshare-shrink_800/feedshare-shrink_800/0/1715872379360?e=1744243200&v=beta&t=6iC6y2Rcwgq_DyDLQANp8nV4tdQsDw6K4ha9RqBtyYU",
          "https://media.licdn.com/dms/image/v2/D4D22AQFvW5WPGWwfUQ/feedshare-shrink_800/feedshare-shrink_800/0/1715872379801?e=1744243200&v=beta&t=ULmMrigsWdW2pggToUdYGzhoiYEjdk5wEJATDlMWqIE",
          "https://media.licdn.com/dms/image/v2/D4D22AQFa9Y3OzH_F6Q/feedshare-shrink_800/feedshare-shrink_800/0/1715872379322?e=1744243200&v=beta&t=ckdL2aUe1ZPZP5f1OtG4yWDrPhhDm6eYfQAG-COOANY"
        ],
        "date": "2024-06-04T08:25:01.574Z"
      },
      {
        "captions": "Huge support for our Material Handler\nBusiness from our US Colleague Thomas Hickson  from Sierra International Machinery  and DE colleague Ingo Niksic  from BMA Maschinenvertrieb  \n#ifat #materialhandler #tabarelli #recyclingHuge support for our Material Handler\nBusiness from our US Colleague Thomas Hickson  from Sierra International Machinery  and DE colleague Ingo Niksic  from BMA Maschinenvertrieb  \n#ifat #materialhandler #tabarelli #recycling",
        "likes": "36",
        "comments": "1",
        "shares": "4",
        "time": {
          "raw": "9ay",
          "parsed": "04.06.2024",
          "isoString": "2024-06-04T08:25:01.576Z"
        },
        "mediaType": "image",
        "mediaContent": [
          "https://media.licdn.com/dms/image/v2/D4D22AQFUUljVhTnczQ/feedshare-shrink_800/feedshare-shrink_800/0/1715768063809?e=1744243200&v=beta&t=IpCRHFe9bCkePCzJNYWx-P51rA9EygQNww-YiVDIPlw",
          "https://media.licdn.com/dms/image/v2/D4D22AQFlouhnVhbzAA/feedshare-shrink_800/feedshare-shrink_800/0/1715768063849?e=1744243200&v=beta&t=LKGQGiSyVD2W7_u0k91YPsjnf9WkmkQUF8C33rFSSmY",
          "https://media.licdn.com/dms/image/v2/D4D22AQFYZZ_QA-vI6Q/feedshare-shrink_800/feedshare-shrink_800/0/1715768063644?e=1744243200&v=beta&t=gisonz3-N5_6udvGCnaEpj2tkbb_w45yZrr6B8V-HsA"
        ],
        "date": "2024-06-04T08:25:01.576Z"
      },
      {
        "captions": "IFAT day 2: visit us at Hall C5 stand 328! We will show you our electric and diesel material handlers!\n#ifat #materialhandler #tabarelli #recyclingIFAT day 2: visit us at Hall C5 stand 328! We will show you our electric and diesel material handlers!\n#ifat #materialhandler #tabarelli #recycling",
        "likes": "8",
        "time": {
          "raw": "9ay",
          "parsed": "04.06.2024",
          "isoString": "2024-06-04T08:25:01.577Z"
        },
        "mediaType": "image",
        "mediaContent": [
          "https://media.licdn.com/dms/image/v2/D4D22AQGqUOtPmORFDA/feedshare-shrink_800/feedshare-shrink_800/0/1715691490262?e=1744243200&v=beta&t=0LWJYvNIMR7W8jOgY7gk_bl06jDKmK0Y-5XgOn_mUqI",
          "https://media.licdn.com/dms/image/v2/D4D22AQGYx5AkXt9FUA/feedshare-shrink_800/feedshare-shrink_800/0/1715691490265?e=1744243200&v=beta&t=8P-UzJirMbOd7ckgxE88xponxFDWPQifJo0bz1YGBJw",
          "https://media.licdn.com/dms/image/v2/D4D22AQHMfs7bhpFWCA/feedshare-shrink_800/feedshare-shrink_800/0/1715691490284?e=1744243200&v=beta&t=9KtcePVfiQMa1ItvQO6oJn3Tc3nD0YyRidtp7vk613c",
          "https://media.licdn.com/dms/image/v2/D4D22AQHUZwYN0jd6ow/feedshare-shrink_800/feedshare-shrink_800/0/1715691489092?e=1744243200&v=beta&t=EHW7TaUX5C48cuDOajTi6oIRSSdXj6mC47MxRrkiC4Y"
        ],
        "date": "2024-06-04T08:25:01.577Z"
      },
      {
        "captions": "Are you ready? You can find us at Hall C5 stand 328!\n\n#tabarelli #materialhandler #ifat #recyclingAre you ready? You can find us at Hall C5 stand 328!\n\n#tabarelli #materialhandler #ifat #recycling",
        "likes": "16",
        "shares": "1",
        "time": {
          "raw": "9ay",
          "parsed": "04.06.2024",
          "isoString": "2024-06-04T08:25:01.578Z"
        },
        "mediaType": "image",
        "mediaContent": [
          "https://media.licdn.com/dms/image/v2/D4D22AQET0VfNDho3qQ/feedshare-shrink_800/feedshare-shrink_800/0/1715588552932?e=1744243200&v=beta&t=AarCtt00UzhwfYMhPqMpvSS6vFDQZTO8x7QeY8KG2uQ",
          "https://media.licdn.com/dms/image/v2/D4D22AQH3e-_BNajS1A/feedshare-shrink_800/feedshare-shrink_800/0/1715588553350?e=1744243200&v=beta&t=ozPebZDskc8_7AwTEv9mHNZ0FksNVyN77Rnv17lAi3I"
        ],
        "date": "2024-06-04T08:25:01.578Z"
      },
      {
        "captions": "IFAT 2024 | 13-17 Maggio\nEccoci anche quest’anno alla fiera internazionale leader per la gestione dei rifiuti e delle materie prime. Venite a trovarci al Centro Fieristico di Monaco di Baviera, Hall C5 – Stand 328!\n \nIFAT 2024 | May 13-17\nHere we are once again at the world’s leading trade fair for waste and raw materials management.\nCome and visit us at the Munich Trade Fair Center, Hall C5 – Booth 328!\n\n#ifat #tabarelli #materialhandler #recyclingIFAT 2024 | 13-17 Maggio\nEccoci anche quest’anno alla fiera internazionale leader per la gestione dei rifiuti e delle materie prime. Venite a trovarci al Centro Fieristico di Monaco di Baviera, Hall C5 – Stand 328!\n \nIFAT 2024 | May 13-17\nHere we are once again at the world’s leading trade fair for waste and raw materials management.\nCome and visit us at the Munich Trade Fair Center, Hall C5 – Booth 328!\n\n#ifat #tabarelli #materialhandler #recycling",
        "likes": "14",
        "comments": "1",
        "shares": "2",
        "time": {
          "raw": "10ay",
          "parsed": "04.05.2024",
          "isoString": "2024-05-04T08:25:01.580Z"
        },
        "mediaType": "image",
        "mediaContent": [
          "https://media.licdn.com/dms/image/v2/D4E22AQGoBtUYlH5ljQ/feedshare-shrink_800/feedshare-shrink_800/0/1715092147985?e=1744243200&v=beta&t=tBNZbWaUQRFsSl6qRVOaahxo0Vc1rvrwuX0549zlL0U"
        ],
        "date": "2024-05-04T08:25:01.580Z"
      },
      {
        "captions": "Visit us at Booth B6!\n#isri #tabarelli #materialhandler #recyclingVisit us at Booth B6!\n#isri #tabarelli #materialhandler #recycling",
        "likes": "15",
        "shares": "1",
        "time": {
          "raw": "10ay",
          "parsed": "04.05.2024",
          "isoString": "2024-05-04T08:25:01.581Z"
        },
        "mediaType": "image",
        "mediaContent": [
          "https://media.licdn.com/dms/image/v2/D4D22AQFA2Qw3hCv5Ww/feedshare-shrink_800/feedshare-shrink_800/0/1713381857573?e=1744243200&v=beta&t=i8XqgzQYQiJ_vg9UEftigdqZnikyzEqjm_CAdtdbtv0",
          "https://media.licdn.com/dms/image/v2/D4D22AQHs27QyZSqwlA/feedshare-shrink_800/feedshare-shrink_800/0/1713381857399?e=1744243200&v=beta&t=8BfP-6JxAlQPSxreebXU8pwpo3fXmuD7C6520f-oAKc"
        ],
        "date": "2024-05-04T08:25:01.581Z"
      },
      {
        "captions": "Ready to startViva ISRI! We are ready for you!",
        "likes": "2",
        "time": {
          "raw": "10ay10ay",
          "parsed": "04.03.2025",
          "isoString": "2025-03-04T08:25:01.582Z"
        },
        "mediaType": "video",
        "mediaContent": {
          "src": [
            {
              "src": "https://dms.licdn.com/playlist/vid/v2/D5605AQHjtUsPOmWqKg/feedshare-ambry-analyzed_servable_progressive_video/feedshare-ambry-analyzed_servable_progressive_video/0/1713225575593?e=1741683600&v=beta&t=S3y5EPURRw3m4uoy3OPsCwHgI_k57qkN-Wx-WYI8LH8",
              "type": "video/quicktime",
              "data-bitrate": 12784870
            },
            {
              "src": "https://dms.licdn.com/playlist/vid/v2/D5605AQHjtUsPOmWqKg/mp4-640p-30fp-crf28/mp4-640p-30fp-crf28/0/1713225578724?e=1741683600&v=beta&t=7JFSeGL4WHAIbchjPNbiGx9ZIzyqk47VbqADP0YQLP4",
              "type": "video/mp4",
              "data-bitrate": 1176888
            },
            {
              "src": "https://dms.licdn.com/playlist/vid/v2/D5605AQHjtUsPOmWqKg/mp4-720p-30fp-crf28/mp4-720p-30fp-crf28/0/1713225579450?e=1741683600&v=beta&t=11fdobgCyh6a37xuWaErRh2HfG_43dOA_tOtn06lbG4",
              "type": "video/mp4",
              "data-bitrate": 1547287
            }
          ],
          "posterUrl": "https://media.licdn.com/dms/image/v2/D5605AQHjtUsPOmWqKg/videocover-high/videocover-high/0/1713225574224?e=1741683600&v=beta&t=m-Y1f9Lwno2ykhlQhUka3rpc_27yZv1xshiCd3XQDF8"
        },
        "date": "2025-03-04T08:25:01.582Z"
      },
      {
        "captions": "Viva ISRI! We are ready for you!",
        "time": {
          "raw": "10ay",
          "parsed": "04.05.2024",
          "isoString": "2024-05-04T08:25:01.583Z"
        },
        "mediaType": "video",
        "mediaContent": {
          "src": [
            {
              "src": "https://dms.licdn.com/playlist/vid/v2/D5605AQHjtUsPOmWqKg/feedshare-ambry-analyzed_servable_progressive_video/feedshare-ambry-analyzed_servable_progressive_video/0/1713225575593?e=1741683600&v=beta&t=S3y5EPURRw3m4uoy3OPsCwHgI_k57qkN-Wx-WYI8LH8",
              "type": "video/quicktime",
              "data-bitrate": 12784870
            },
            {
              "src": "https://dms.licdn.com/playlist/vid/v2/D5605AQHjtUsPOmWqKg/mp4-640p-30fp-crf28/mp4-640p-30fp-crf28/0/1713225578724?e=1741683600&v=beta&t=7JFSeGL4WHAIbchjPNbiGx9ZIzyqk47VbqADP0YQLP4",
              "type": "video/mp4",
              "data-bitrate": 1176888
            },
            {
              "src": "https://dms.licdn.com/playlist/vid/v2/D5605AQHjtUsPOmWqKg/mp4-720p-30fp-crf28/mp4-720p-30fp-crf28/0/1713225579450?e=1741683600&v=beta&t=11fdobgCyh6a37xuWaErRh2HfG_43dOA_tOtn06lbG4",
              "type": "video/mp4",
              "data-bitrate": 1547287
            }
          ],
          "posterUrl": "https://media.licdn.com/dms/image/v2/D5605AQHjtUsPOmWqKg/videocover-high/videocover-high/0/1713225574224?e=1741683600&v=beta&t=m-Y1f9Lwno2ykhlQhUka3rpc_27yZv1xshiCd3XQDF8"
        },
        "date": "2024-05-04T08:25:01.583Z"
      },
      {
        "captions": "Almost ready to start at the Mandalay Bay Convention Center !!Almost ready to start at the Mandalay Bay Convention Center !!",
        "likes": "27",
        "shares": "4",
        "time": {
          "raw": "10ay",
          "parsed": "04.05.2024",
          "isoString": "2024-05-04T08:25:01.583Z"
        },
        "mediaType": "image",
        "mediaContent": [
          "https://media.licdn.com/dms/image/v2/D4D22AQGAIuSZCRAquw/feedshare-shrink_800/feedshare-shrink_800/0/1713180144563?e=1744243200&v=beta&t=HSfjjSSc2-TsxSkQC53-KLPM4DLdIpRTo4uDGhEVBRs",
          "https://media.licdn.com/dms/image/v2/D4D22AQEKy9GQxGUiXA/feedshare-shrink_800/feedshare-shrink_800/0/1713180144374?e=1744243200&v=beta&t=vDOY_c99asnVk5GKXAitXbbG7COytgH9LFQmOEERark",
          "https://media.licdn.com/dms/image/v2/D4D22AQG4OWNine0dfA/feedshare-shrink_800/feedshare-shrink_800/0/1713180143605?e=1744243200&v=beta&t=PKzTbm0T7z1lma-23P3U8ey9saTZBUpv-m8o6aIDrOU"
        ],
        "date": "2024-05-04T08:25:01.583Z"
      },
      {
        "captions": "Happy Easter!\n#tabarelli #materialhandler #recycling #peaceHappy Easter!\n#tabarelli #materialhandler #recycling #peace",
        "likes": "5",
        "time": {
          "raw": "11ay",
          "parsed": "04.04.2024",
          "isoString": "2024-04-04T08:25:01.584Z"
        },
        "mediaType": "image",
        "mediaContent": [
          "https://media.licdn.com/dms/image/v2/D4D22AQHXMafl8TgEnQ/feedshare-shrink_800/feedshare-shrink_800/0/1711874212678?e=1744243200&v=beta&t=f8wKFctf2zNNn-Zjmkfni5EpbnuN8pbPZC44Cus5TCg"
        ],
        "date": "2024-04-04T08:25:01.584Z"
      },
      {
        "captions": "Der BMA Maschinenvertrieb Tabarelli Material Handler bewirbt sich mit einem Beitrag zum Erreichen der Klimaziele für den Innovationspreis der Region Göttingen Northeim. Mit rein für den Batteriebetrieb entwickelten Materialumschlagmaschinen helfen die Hannoveraner der kommunalen und privaten Recyclingbranche bei der Transformation hin zur Elektrifizierung des Maschinenparks.\n\n#innovationspreis #gemeinsamzukunftgestalten #wirtschaftsförderung #göttingen #landkreisgöttingen #northeim #regiongöttingennortheim #wrg #klimainnovationspreis #niedersachsenDer BMA Maschinenvertrieb Tabarelli Material Handler bewirbt sich mit einem Beitrag zum Erreichen der Klimaziele für den Innovationspreis der Region Göttingen Northeim. Mit rein für den Batteriebetrieb entwickelten Materialumschlagmaschinen helfen die Hannoveraner der kommunalen und privaten Recyclingbranche bei der Transformation hin zur Elektrifizierung des Maschinenparks.\n\n#innovationspreis #gemeinsamzukunftgestalten #wirtschaftsförderung #göttingen #landkreisgöttingen #northeim #regiongöttingennortheim #wrg #klimainnovationspreis #niedersachsen",
        "likes": "11",
        "shares": "4",
        "time": {
          "raw": "11ay",
          "parsed": "04.04.2024",
          "isoString": "2024-04-04T08:25:01.586Z"
        },
        "mediaType": "image",
        "mediaContent": [
          "https://media.licdn.com/dms/image/v2/D4E10AQEWKq3RNrmMNg/image-shrink_800/image-shrink_800/0/1711354042915?e=1741683600&v=beta&t=_PY0aiu964DFzNLwez8UtS696DZErtR-linU8jfo9-U"
        ],
        "date": "2024-04-04T08:25:01.586Z"
      }
    ]
  },
  {
    "name": "BronnebergRecyclingMachines",
    "followerData": [
      [
        20250225,
        751
      ],
      [
        20250225,
        751
      ],
      [
        20250225,
        751
      ],
      [
        20250228,
        751
      ],
      [
        20250228,
        751
      ],
      [
        20250228,
        751
      ],
      [
        20250228,
        751
      ],
      [
        20250303,
        752
      ],
      [
        1741011763372,
        "752"
      ],
      [
        1741076717102,
        "752"
      ]
    ],
    "data": [
      {
        "captions": "Looking for fast, mobile, accurate, and reliable metal analysis? At Bronneberg, we offer state-of-the-art SciAps Inc. Metall Analyzers that bring precision and portability together for superior performance in metal identification and sorting.\nExplore our two leading models:\n\n🔹 XRF Analyzer X-200: The perfect solution for scrap metal sorting and positive material identification (PMI). With advanced X-ray fluorescence technology, it delivers rapid and precise results even on the most challenging materials.\n🔹 Laser Analyzer Z-70: Experience the power of laser-induced breakdown spectroscopy (LIBS) for fast alloy analysis. Ideal for high-speed sorting and accurate analysis of magnesium, aluminum, and other light elements.\n\nWith SciAps Analyzers, you’ll save time, improve productivity, and boost profitability in your metal recycling operations.\n📩 Contact us today for a demonstration or to find the right solution for your needs!\n\n👉 Discover more: https://lnkd.in/eUJtWMmq\n\n#Bronneberg #SciAps #MetallAnalyzers #MetalRecycling #XRF #LIBS #InnovationLooking for fast, mobile, accurate, and reliable metal analysis? At Bronneberg, we offer state-of-the-art SciAps Inc. Metall Analyzers that bring precision and portability together for superior performance in metal identification and sorting.\nExplore our two leading models:\n\n🔹 XRF Analyzer X-200: The perfect solution for scrap metal sorting and positive material identification (PMI). With advanced X-ray fluorescence technology, it delivers rapid and precise results even on the most challenging materials.\n🔹 Laser Analyzer Z-70: Experience the power of laser-induced breakdown spectroscopy (LIBS) for fast alloy analysis. Ideal for high-speed sorting and accurate analysis of magnesium, aluminum, and other light elements.\n\nWith SciAps Analyzers, you’ll save time, improve productivity, and boost profitability in your metal recycling operations.\n📩 Contact us today for a demonstration or to find the right solution for your needs!\n\n👉 Discover more: https://lnkd.in/eUJtWMmq\n\n#Bronneberg #SciAps #MetallAnalyzers #MetalRecycling #XRF #LIBS #Innovation",
        "likes": "24",
        "comments": "1",
        "shares": "7",
        "time": {
          "raw": "1ay",
          "parsed": "04.02.2025",
          "isoString": "2025-02-04T08:25:16.871Z"
        },
        "mediaType": "image",
        "mediaContent": [
          "https://media.licdn.com/dms/image/v2/D4E22AQEw-Q2PWTy3NA/feedshare-shrink_800/B4EZR0p2ZlGcAk-/0/1737123916000?e=1744243200&v=beta&t=q30L6YK5pCaZeY1VX1H0SlSlcBAeBjn6ANPgVea4YT8",
          "https://media.licdn.com/dms/image/v2/D4E22AQH4Lv8AiDWIJw/feedshare-shrink_800/B4EZR0p2ZdHAAg-/0/1737123916285?e=1744243200&v=beta&t=iAV3t8IqPmRo1_jBZkCe_nuqk2_Xc07JpzA27JUa9N8",
          "https://media.licdn.com/dms/image/v2/D4E22AQG7i7v9bpXkvg/feedshare-shrink_800/B4EZR0p2ZbHAAo-/0/1737123915886?e=1744243200&v=beta&t=dki--sqC-z6BxVq154n3hF1L2beyT-DCUe891e55Igk"
        ],
        "date": "2025-02-04T08:25:16.871Z"
      },
      {
        "captions": "Bronneberg B.V. is een begrip in de markt. Schrootverwerkers spreken vaak met liefde over hun eerste Bronneberg schaar dan wel pers. Ze veroorzaakten decennia geleden al een kleine revolutie in de branche, en doen dat nog steeds. Achter iedere Bronneberg machine zit namelijk een gedachte, want die is altijd nét wat efficiënter, sneller of slimmer dan een machine van een ‘vreemd’ merk. \n\n“We investeren in de persoonlijke ontwikkeling van onze medewerkers en zorgen ervoor dat iedereen zich onderdeel voelt van de Bronneberg familie”, vertelt Michiel J..\n\nOntdek het volledige gesprek via https://lnkd.in/e-rDM6wq\n \n📷 Henri Jegerings , Robbert-Jan Jegerings, Alexander Jegerings, Michiel J.\n\n📖 Wenst u het ✨ Jubileumboek ✨ gratis als hardcopy ontvangen inclusief dit artikel? Aarzel dan zeker niet om dit even te laten weten in de opmerkingen hieronder en dan brengen wij dit in orde.\n\n#recycling #afval #schroot #metalsBronneberg B.V. is een begrip in de markt. Schrootverwerkers spreken vaak met liefde over hun eerste Bronneberg schaar dan wel pers. Ze veroorzaakten decennia geleden al een kleine revolutie in de branche, en doen dat nog steeds. Achter iedere Bronneberg machine zit namelijk een gedachte, want die is altijd nét wat efficiënter, sneller of slimmer dan een machine van een ‘vreemd’ merk. \n\n“We investeren in de persoonlijke ontwikkeling van onze medewerkers en zorgen ervoor dat iedereen zich onderdeel voelt van de Bronneberg familie”, vertelt Michiel J..\n\nOntdek het volledige gesprek via https://lnkd.in/e-rDM6wq\n \n📷 Henri Jegerings , Robbert-Jan Jegerings, Alexander Jegerings, Michiel J.\n\n📖 Wenst u het ✨ Jubileumboek ✨ gratis als hardcopy ontvangen inclusief dit artikel? Aarzel dan zeker niet om dit even te laten weten in de opmerkingen hieronder en dan brengen wij dit in orde.\n\n#recycling #afval #schroot #metals",
        "likes": "261",
        "comments": "17",
        "shares": "5",
        "time": {
          "raw": "1ay",
          "parsed": "04.02.2025",
          "isoString": "2025-02-04T08:25:16.876Z"
        },
        "mediaType": "image",
        "mediaContent": [
          "https://media.licdn.com/dms/image/v2/D4E22AQEfzVMCiWyKcQ/feedshare-shrink_1280/B4EZQ7PeNHGcAk-/0/1736160699690?e=1744243200&v=beta&t=b5vJsHqwFyihwI_QoARlGo7nz0UIj7wOHvRE_C3V3iI"
        ],
        "date": "2025-02-04T08:25:16.876Z"
      },
      {
        "captions": "📢 Last week, the #REEPRODUCE consortium met at Bronneberg B.V. 👏 \n\nThe consortium engaged in productive discussions around key objectives, strategies and next steps to ensure the success of our collaborative efforts🤝\n\nDuring the first half of the project, significant progress has been made in advancing recycling technologies for devices containing Neodymium (Nd) magnets. The #REEPRODUCE consortium initiated demonstration phases, focusing on validating innovative recycling processes across multiple facilities in Europe. At this stage the consortium has successfully constructed five pilots (TRL7) and carried out demonstration trials in two of them, marking a significant step forward in achieving the project’s objective.\n\nThe partners had the opportunity to visit Bronneberg B.V.'s facilities to explore the innovative pilots that FAU Erlangen-Nürnberg (Institute FAPS) and Bronneberg have developed to extract Nd-based magnets blocks from different components of selected end-of-life products, with validation planned for early 2025.\n\nExciting times ahead as we work together to drive innovation and deliver impactful results❗ ♻️🌍\n\nDon’t miss out—give us a follow and help spread the word 📢 \n\n💻Visit our website: https://www.reeproduce.eu/\n📰Subscribe to our newsletter: https://lnkd.in/eUn93-xd\n\nMeet the consortium 🤝 https://lnkd.in/exXnDuvy\n\n#rareearths #rareearthelements #recycling #circulareconomy #permanentmagnets #Europe📢 Last week, the #REEPRODUCE consortium met at Bronneberg B.V. 👏 \n\nThe consortium engaged in productive discussions around key objectives, strategies and next steps to ensure the success of our collaborative efforts🤝\n\nDuring the first half of the project, significant progress has been made in advancing recycling technologies for devices containing Neodymium (Nd) magnets. The #REEPRODUCE consortium initiated demonstration phases, focusing on validating innovative recycling processes across multiple facilities in Europe. At this stage the consortium has successfully constructed five pilots (TRL7) and carried out demonstration trials in two of them, marking a significant step forward in achieving the project’s objective.\n\nThe partners had the opportunity to visit Bronneberg B.V.'s facilities to explore the innovative pilots that FAU Erlangen-Nürnberg (Institute FAPS) and Bronneberg have developed to extract Nd-based magnets blocks from different components of selected end-of-life products, with validation planned for early 2025.\n\nExciting times ahead as we work together to drive innovation and deliver impactful results❗ ♻️🌍\n\nDon’t miss out—give us a follow and help spread the word 📢 \n\n💻Visit our website: https://www.reeproduce.eu/\n📰Subscribe to our newsletter: https://lnkd.in/eUn93-xd\n\nMeet the consortium 🤝 https://lnkd.in/exXnDuvy\n\n#rareearths #rareearthelements #recycling #circulareconomy #permanentmagnets #Europe",
        "likes": "69",
        "comments": "1",
        "shares": "14",
        "time": {
          "raw": "2ay",
          "parsed": "04.01.2025",
          "isoString": "2025-01-04T08:25:16.882Z"
        },
        "mediaType": "image",
        "mediaContent": [
          "https://media.licdn.com/dms/image/v2/D4E22AQGWZMTBx6vUEg/feedshare-shrink_800/feedshare-shrink_800/0/1733754869525?e=1744243200&v=beta&t=olQjB8-Si53uQZWx3EnVb1M-RWSgdJP7jt7ditorPTA",
          "https://media.licdn.com/dms/image/v2/D4E22AQFUChe0WRTwww/feedshare-shrink_800/feedshare-shrink_800/0/1733754866956?e=1744243200&v=beta&t=0eSWc4duhRDo7cB1WNWRB0VViCMtFZnHv8L3BnrLgNo",
          "https://media.licdn.com/dms/image/v2/D4E22AQEF5L2PLbtGpA/feedshare-shrink_800/feedshare-shrink_800/0/1733754869069?e=1744243200&v=beta&t=9XN2ch4B3Bi9CXblUZMwuuuMNmXf-WjQCXdiFC7fNFE"
        ],
        "date": "2025-01-04T08:25:16.882Z"
      },
      {
        "captions": "🔧✨ 𝗦𝘁𝗿𝗲𝗻𝗴𝘁𝗵𝗲𝗻𝗶𝗻𝗴 𝘁𝗵𝗲 𝗳𝘂𝘁𝘂𝗿𝗲 𝗼𝗳 𝗿𝗲𝗰𝘆𝗰𝗹𝗶𝗻𝗴 𝘁𝗼𝗴𝗲𝘁𝗵𝗲𝗿!\n\nAt Bronneberg, we’re thrilled to announce our partnership with Dutch Magnetics B.V., bringing magnetic solutions to the recycling industry. Together, we’re making it easier for businesses to achieve cleaner, more efficient recycling processes.\n\nHere’s how Dutch Magnetics' state-of-the-art technology is elevating recycling:\n🔹 𝗘𝗱𝗱𝘆 𝗖𝘂𝗿𝗿𝗲𝗻𝘁𝘀 for separating non-ferrous metals with precision.\n🔹 𝗠𝗮𝗴𝗻𝗲𝘁𝗶𝗰 𝗗𝗿𝘂𝗺 𝗥𝗼𝗹𝗹𝘀 to simplify material handling and sorting.\n🔹 𝗢𝘃𝗲𝗿𝗯𝗲𝗹𝘁 𝗠𝗮𝗴𝗻𝗲𝘁𝘀 to separate ferrous from non-ferrous metals.\n🔹 And more\n\nHave a look at their website for more information: https://lnkd.in/endzY-D7\n\n#RecyclingInnovation #MagneticSolutions #CircularEconomy #Bronneberg #DutchMagnetics #RecyclingTechnology #Sustainability #GreenSolutions #WasteManagement #RecyclingEfficiency",
        "likes": "25",
        "comments": "1",
        "shares": "4",
        "time": {
          "raw": "2ay",
          "parsed": "04.01.2025",
          "isoString": "2025-01-04T08:25:16.885Z"
        },
        "mediaType": "other",
        "date": "2025-01-04T08:25:16.885Z"
      },
      {
